A1: Matthew Carter
A2: Club | B2: Merrist Wood
A3: Par/SS | B3: 72/70 | D3: Num. Of Fairways | I3: =IF(B2="","",18-(COUNTIF(B9:B26,3))) -> 14
A4: Date | B4: 39172 | D4: Playing Handicap | I4: 21.1
A5: Event Place | B5: 4 | C5: M | D5: Prize Money | G5: 30000
A6: Game Stats | B6: DB+ | C6: DB | D6: Bi | E6: P | F6: B | G6: E | H6: A | I6: H1
B7: 5 | C7: 2 | D7: 8 | E7: 3 | F7: 0 | G7: 0 | H7: 0 | I7: 0
A8: Hole No | B8: Par | C8: Stroke Index | D8: Gross Score | E8: Points | F8: Putts | G8: Fairways | H8: Ferrets | I8: Green Regulation
A9: 1 | B9: 4 | C9: 10 | D9: 4 | E9: 3 | F9: 1 | G9: 1 | I9: Yes
A10: 2 | B10: 3 | C10: 18 | D10: 3 | E10: 3 | F10: 1 | I10: Yes
A11: 3 | B11: 4 | C11: 6 | D11: 6 | E11: 1 | F11: 2
A12: 4 | B12: 5 | C12: 14 | D12: 6 | E12: 2 | F12: 2 | G12: 1 | I12: Yes
A13: 5 | B13: 4 | C13: 4 | D13: 5 | E13: 2 | F13: 1 | G13: 1
A14: 6 | B14: 5 | C14: 12 | D14: 6 | E14: 2 | F14: 2 | G14: 1 | I14: Yes
A15: 7 | B15: 4 | C15: 8 | D15: 7 | E15: 0 | F15: 3 | G15: 1
A16: 8 | B16: 3 | C16: 16 | D16: 4 | E16: 2 | F16: 3 | I16: Yes
A17: 9 | B17: 4 | C17: 2 | D17: 7 | E17: 1 | F17: 2
A18: 10 | B18: 5 | C18: 9 | D18: 5 | E18: 3 | F18: 1 | G18: 1 | I18: Yes
A19: 11 | B19: 3 | C19: 15 | D19: 4 | E19: 2 | F19: 1
A20: 12 | B20: 4 | C20: 7 | D20: 5 | E20: 2 | F20: 2 | G20: 1 | I20: Yes
A21: 13 | B21: 4 | C21: 1 | D21: 7 | E21: 1 | F21: 2 | H21: 1
A22: 14 | B22: 4 | C22: 13 | D22: 5 | E22: 2 | F22: 2 | I22: Yes
A23: 15 | B23: 4 | C23: 3 | D23: 7 | E23: 1 | F23: 1
A24: 16 | B24: 3 | C24: 17 | D24: 4 | E24: 2 | F24: 2 | I24: Yes
A25: 17 | B25: 4 | C25: 5 | D25: 6 | E25: 1 | F25: 1 | G25: 1
A26: 18 | B26: 5 | C26: 11 | D26: 10 | E26: 0 | F26: 3 | G26: 1
A27: Totals | B27: =IF(B2="","",SUM(B9:B26)) -> 72 | D27: =IF(B2="","",SUM(D9:D26)) -> 101 | E27: =IF(B2="","",SUM(E9:E26)) -> 30 | F27: =IF(B2="","",SUM(F9:F26)) -> 32 | G27: =IF(B2="","",SUM(G9:G26)) -> 9 | H27: =IF(B2="","",SUM(H9:H26)) -> 1 | I27: =IF(COUNTIF(I9:I26,"=Yes")=0,"",COUNTIF(I9:I26,"=Yes")) -> 9