A1: Roy Dickens
A2: Club | B2: Broke Hill
A3: Par/SS | B3: 72/72 | D3: Num. Of Fairways | I3: =IF(B2="","",18-(COUNTIF(B9:B26,3))) -> 14
A4: Date | B4: 39166 | D4: Playing Handicap | I4: 29.300000000001003
A5: Event Place | B5: 2 | D5: Prize Money | G5: 2500
A6: Game Stats | B6: DB+ | C6: DB | D6: Bi | E6: P | F6: B | G6: E | H6: A | I6: H1
B7: 8 | C7: 7 | D7: 2 | E7: 1 | F7: 0 | G7: 0 | H7: 0 | I7: 0
A8: Hole No | B8: Par | C8: Stroke Index | D8: Gross Score | E8: Points | F8: Putts | G8: Fairways | H8: Ferrets | I8: Green Regulation
A9: 1 | B9: 4 | C9: 13 | D9: 5 | E9: 2 | F9: 2 | I9: Yes
A10: 2 | B10: 4 | C10: 9 | D10: 7 | E10: 1 | F10: 2
A11: 3 | B11: 5 | C11: 3 | D11: 10 | E11: 0 | F11: 3 | H11: 1
A12: 4 | B12: 3 | C12: 15 | D12: 6 | E12: 0 | F12: 2 | H12: 1
A13: 5 | B13: 4 | C13: 11 | D13: 6 | E13: 2 | F13: 2 | G13: 1 | I13: Yes
A14: 6 | B14: 4 | C14: 1 | D14: 6 | E14: 2 | F14: 2 | G14: 1 | I14: Yes
A15: 7 | B15: 4 | C15: 7 | D15: 5 | E15: 3 | F15: 2 | I15: Yes
A16: 8 | B16: 3 | C16: 17 | D16: 5 | E16: 1 | F16: 2
A17: 9 | B17: 5 | C17: 5 | D17: 7 | E17: 2 | F17: 2 | I17: Yes
A18: 10 | B18: 4 | C18: 12 | D18: 10 | E18: 0 | F18: 3
A19: 11 | B19: 3 | C19: 18 | D19: 3 | E19: 3 | F19: 2 | I19: Yes
A20: 12 | B20: 5 | C20: 4 | D20: 7 | E20: 2 | F20: 1
A21: 13 | B21: 4 | C21: 8 | D21: 8 | E21: 0 | F21: 2 | H21: 1
A22: 14 | B22: 4 | C22: 14 | D22: 8 | E22: 0 | F22: 1
A23: 15 | B23: 5 | C23: 2 | D23: 7 | E23: 2 | F23: 1
A24: 16 | B24: 4 | C24: 16 | D24: 6 | E24: 1 | F24: 3 | I24: Yes
A25: 17 | B25: 3 | C25: 6 | D25: 6 | E25: 1 | F25: 2
A26: 18 | B26: 4 | C26: 10 | D26: 10 | E26: 0 | F26: 3 | H26: 2
A27: Totals | B27: =IF(B2="","",SUM(B9:B26)) -> 72 | D27: =IF(B2="","",SUM(D9:D26)) -> 122 | E27: =IF(B2="","",SUM(E9:E26)) -> 22 | F27: =IF(B2="","",SUM(F9:F26)) -> 37 | G27: =IF(B2="","",SUM(G9:G26)) -> 2 | H27: =IF(B2="","",SUM(H9:H26)) -> 5 | I27: =IF(COUNTIF(I9:I26,"=Yes")=0,"",COUNTIF(I9:I26,"=Yes")) -> 7