A1: Alan Hopkins
A2: Club | B2: The Grove
A3: Par/SS | B3: 72/72 | D3: Num. Of Fairways | I3: =IF(B2="","",18-(COUNTIF(B9:B26,3))) -> 14
A4: Date | B4: 38625 | D4: Playing Handicap | I4: 7
A5: Event Place | B5: 2 | D5: Prize Money | G5: 5000
A6: Game Stats | B6: DB+ | C6: DB | D6: BI | E6: P | F6: B | G6: E | H6: A | I6: H1
B7: 2 | C7: 3 | D7: 5 | E7: 7 | F7: 1 | G7: 0 | H7: 0 | I7: 0
A8: Hole No | B8: Par | C8: Stroke Index | D8: Gross Score | E8: Points | F8: Putts | G8: Fairways | H8: Ferrets | I8: Green Regulation
A9: 1 | B9: 4 | C9: 17 | D9: 5 | E9: 1 | F9: 2 | G9: 1
A10: 2 | B10: 4 | C10: 11 | D10: 6 | E10: 0 | F10: 2
A11: 3 | B11: 4 | C11: 1 | D11: 7 | E11: 0 | F11: 2
A12: 4 | B12: 3 | C12: 9 | D12: 3 | E12: 2 | F12: 1
A13: 5 | B13: 4 | C13: 3 | D13: 6 | E13: 1 | F13: 2
A14: 6 | B14: 5 | C14: 7 | D14: 7 | E14: 1 | F14: 3 | G14: 1 | I14: Yes
A15: 7 | B15: 3 | C15: 15 | D15: 3 | E15: 2 | F15: 2 | I15: Yes
A16: 8 | B16: 4 | C16: 13 | D16: 4 | E16: 2 | F16: 2 | G16: 1 | I16: Yes
A17: 9 | B17: 5 | C17: 5 | D17: 5 | E17: 3 | F17: 1 | G17: 1 | I17: Yes
A18: 10 | B18: 4 | C18: 10 | D18: 10 | E18: 0 | F18: 3 | H18: 1
A19: 11 | B19: 5 | C19: 12 | D19: 4 | E19: 3 | F19: 1 | G19: 1 | I19: Yes
A20: 12 | B20: 4 | C20: 2 | D20: 4 | E20: 3 | F20: 2 | G20: 1 | I20: Yes
A21: 13 | B21: 3 | C21: 6 | D21: 4 | E21: 2 | F21: 2 | I21: Yes
A22: 14 | B22: 4 | C22: 16 | D22: 5 | E22: 1 | F22: 2
A23: 15 | B23: 4 | C23: 8 | D23: 5 | E23: 1 | F23: 3 | G23: 1 | I23: Yes
A24: 16 | B24: 3 | C24: 18 | D24: 3 | E24: 2 | F24: 2 | I24: Yes
A25: 17 | B25: 5 | C25: 14 | D25: 5 | E25: 2 | F25: 2 | G25: 1 | I25: Yes
A26: 18 | B26: 4 | C26: 4 | D26: 5 | E26: 2 | F26: 2 | G26: 1 | I26: Yes
A27: Totals | B27: =IF(B2="","",SUM(B9:B26)) -> 72 | D27: =IF(B2="","",SUM(D9:D26)) -> 91 | E27: =IF(B2="","",SUM(E9:E26)) -> 28 | F27: =IF(B2="","",SUM(F9:F26)) -> 36 | G27: =IF(B2="","",SUM(G9:G26)) -> 9 | H27: =IF(B2="","",SUM(H9:H26)) -> 1 | I27: =IF(COUNTIF(I9:I26,"=Yes")=0,"",COUNTIF(I9:I26,"=Yes")) -> 11