A1: Roy Dickens
A2: Club | B2: Hoebridge
A3: Par/SS | B3: 71/70 | D3: Num. Of Fairways | I3: =IF(B2="","",18-(COUNTIF(B9:B26,3))) -> 13
A4: Date | B4: 38605 | D4: Playing Handicap | I4: 31.9
A5: Event Place | B5: 1 | D5: Prize Money | G5: 7500
A6: Game Stats | B6: DB+ | C6: DB | D6: Bi | E6: P | F6: B | G6: E | H6: A | I6: H1
B7: 5 | C7: 4 | D7: 7 | E7: 2 | F7: 0 | G7: 0 | H7: 0 | I7: 0
A8: Hole No | B8: Par | C8: Stroke Index | D8: Gross Score | E8: Points | F8: Putts | G8: Fairways | H8: Ferrets | I8: Green Regulation
A9: 1 | B9: 5 | C9: 11 | D9: 6 | E9: 3 | F9: 2 | I9: Yes
A10: 2 | B10: 3 | C10: 17 | D10: 4 | E10: 2 | F10: 2 | I10: Yes
A11: 3 | B11: 4 | C11: 7 | D11: 7 | E11: 1 | F11: 2
A12: 4 | B12: 4 | C12: 1 | D12: 4 | E12: 4 | F12: 1 | G12: 1 | I12: Yes
A13: 5 | B13: 4 | C13: 5 | D13: 6 | E13: 2 | F13: 2 | G13: 1 | I13: Yes
A14: 6 | B14: 3 | C14: 15 | D14: 7 | E14: 0 | F14: 3 | H14: 1
A15: 7 | B15: 4 | C15: 3 | D15: 5 | E15: 3 | F15: 2 | I15: Yes
A16: 8 | B16: 4 | C16: 9 | D16: 7 | E16: 1 | F16: 2
A17: 9 | B17: 5 | C17: 13 | D17: 6 | E17: 3 | F17: 1 | G17: 1 | I17: Yes
A18: 10 | B18: 4 | C18: 12 | D18: 6 | E18: 2 | F18: 2 | I18: Yes
A19: 11 | B19: 4 | C19: 4 | D19: 8 | E19: 0 | F19: 2 | H19: 1
A20: 12 | B20: 3 | C20: 18 | D20: 3 | E20: 3 | F20: 2 | I20: Yes
A21: 13 | B21: 5 | C21: 8 | D21: 7 | E21: 2 | F21: 2 | G21: 1 | I21: Yes
A22: 14 | B22: 4 | C22: 14 | D22: 5 | E22: 3 | F22: 2 | I22: Yes
A23: 15 | B23: 4 | C23: 2 | D23: 5 | E23: 3 | F23: 2 | G23: 1 | I23: Yes
A24: 16 | B24: 3 | C24: 10 | D24: 4 | E24: 3 | F24: 2 | I24: Yes
A25: 17 | B25: 5 | C25: 6 | D25: 9 | E25: 0 | F25: 3 | G25: 1
A26: 18 | B26: 3 | C26: 16 | D26: 5 | E26: 1 | F26: 2
A27: Totals | B27: =IF(B2="","",SUM(B9:B26)) -> 71 | D27: =IF(B2="","",SUM(D9:D26)) -> 104 | E27: =IF(B2="","",SUM(E9:E26)) -> 36 | F27: =IF(B2="","",SUM(F9:F26)) -> 36 | G27: =IF(B2="","",SUM(G9:G26)) -> 6 | H27: =IF(B2="","",SUM(H9:H26)) -> 2 | I27: =IF(COUNTIF(I9:I26,"=Yes")=0,"",COUNTIF(I9:I26,"=Yes")) -> 12