A1: Robert Thompson
A2: Club | B2: Royal Blackheath
A3: Par/SS | B3: 70/71 | D3: Num. Of Fairways | I3: =IF(B2="","",18-(COUNTIF(B9:B26,3))) -> 14
A4: Date | B4: 38620 | D4: Playing Handicap | I4: 8.7999999999999918
A5: Event Place | B5: 3 | D5: Prize Money | G5: 2500
A6: Game Stats | B6: DB+ | C6: DB | D6: BI | E6: P | F6: B | G6: E | H6: A | I6: H1
B7: 3 | C7: 5 | D7: 6 | E7: 3 | F7: 1 | G7: 0 | H7: 0 | I7: 0
A8: Hole No | B8: Par | C8: Stroke Index | D8: Gross Score | E8: Points | F8: Putts | G8: Fairways | H8: Ferrets | I8: Green Regulation
A9: 1 | B9: 4 | C9: 7 | D9: 5 | E9: 2 | F9: 1
A10: 2 | B10: 4 | C10: 11 | D10: 6 | E10: 0 | F10: 2
A11: 3 | B11: 4 | C11: 3 | D11: 6 | E11: 1 | F11: 2
A12: 4 | B12: 3 | C12: 15 | D12: 4 | E12: 1 | F12: 2
A13: 5 | B13: 4 | C13: 13 | D13: 10 | E13: 0 | F13: 3 | H13: 1
A14: 6 | B14: 5 | C14: 1 | D14: 5 | E14: 3 | F14: 1 | I14: Yes
A15: 7 | B15: 4 | C15: 9 | D15: 4 | E15: 3 | F15: 1 | I15: Yes
A16: 8 | B16: 3 | C16: 17 | D16: 4 | E16: 1 | F16: 3 | I16: Yes
A17: 9 | B17: 4 | C17: 5 | D17: 5 | E17: 2 | F17: 2 | I17: Yes
A18: 10 | B18: 4 | C18: 12 | D18: 6 | E18: 0 | F18: 2
A19: 11 | B19: 4 | C19: 6 | D19: 4 | E19: 3 | F19: 2 | I19: Yes
A20: 12 | B20: 3 | C20: 16 | D20: 5 | E20: 0 | F20: 2
A21: 13 | B21: 5 | C21: 2 | D21: 4 | E21: 4 | F21: 1 | G21: 1 | I21: Yes
A22: 14 | B22: 4 | C22: 10 | D22: 5 | E22: 1 | F22: 1
A23: 15 | B23: 4 | C23: 8 | D23: 7 | E23: 0 | F23: 2 | H23: 1
A24: 16 | B24: 3 | C24: 18 | D24: 5 | E24: 0 | F24: 2
A25: 17 | B25: 4 | C25: 4 | D25: 5 | E25: 2 | F25: 2 | G25: 1 | I25: Yes
A26: 18 | B26: 4 | C26: 14 | D26: 7 | E26: 0 | F26: 2 | H26: 1
A27: Totals | B27: =IF(B2="","",SUM(B9:B26)) -> 70 | D27: =IF(B2="","",SUM(D9:D26)) -> 97 | E27: =IF(B2="","",SUM(E9:E26)) -> 23 | F27: =IF(B2="","",SUM(F9:F26)) -> 33 | G27: =IF(B2="","",SUM(G9:G26)) -> 2 | H27: =IF(B2="","",SUM(H9:H26)) -> 3 | I27: =IF(COUNTIF(I9:I26,"=Yes")=0,"",COUNTIF(I9:I26,"=Yes")) -> 7