A1: Jon Press
A2: Club | B2: Hamptworth
A3: Par/SS | B3: 71/69 | D3: Num. Of Fairways | I3: =IF(B2="","",18-(COUNTIF(B9:B26,3))) -> 14
A4: Date | B4: 41765 | D4: Playing Handicap | I4: 13.8
A5: Event Place | B5: 5 | C5: M | D5: Prize Money | G5: 30000
A6: Game Stats | B6: DB+ | C6: DB | D6: Bi | E6: P | F6: B | G6: E | H6: A | I6: H1
B7: 2 | C7: 4 | D7: 9 | E7: 3 | F7: 0 | G7: 0 | H7: 0 | I7: 0
A8: Hole No | B8: Par | C8: Stroke Index | D8: Gross Score | E8: Points | F8: Putts | G8: Fairways | H8: Ferrets | I8: Green Regulation
A9: 1 | B9: 4 | C9: 13 | D9: 7 | E9: 0 | F9: 3 | G9: 1
A10: 2 | B10: 5 | C10: 5 | D10: 7 | E10: 1 | F10: 2
A11: 3 | B11: 4 | C11: 14 | D11: 6 | E11: 1 | F11: 2
A12: 4 | B12: 3 | C12: 15 | D12: 4 | E12: 1 | F12: 2
A13: 5 | B13: 4 | C13: 6 | D13: 5 | E13: 2 | F13: 2 | G13: 1 | I13: Yes
A14: 6 | B14: 4 | C14: 12 | D14: 6 | E14: 1 | F14: 3 | I14: Yes
A15: 7 | B15: 5 | C15: 2 | D15: 6 | E15: 2 | F15: 3 | G15: 1 | I15: Yes
A16: 8 | B16: 3 | C16: 16 | D16: 4 | E16: 1 | F16: 2
A17: 9 | B17: 4 | C17: 3 | D17: 7 | E17: 0 | F17: 2
A18: 10 | B18: 3 | C18: 11 | D18: 3 | E18: 3 | F18: 1 | I18: Yes
A19: 11 | B19: 4 | C19: 1 | D19: 4 | E19: 3 | F19: 1 | I19: Yes
A20: 12 | B20: 4 | C20: 18 | D20: 5 | E20: 1 | F20: 2
A21: 13 | B21: 3 | C21: 7 | D21: 4 | E21: 2 | F21: 2 | I21: Yes
A22: 14 | B22: 4 | C22: 4 | D22: 5 | E22: 2 | F22: 1 | G22: 1
A23: 15 | B23: 4 | C23: 10 | D23: 5 | E23: 2 | F23: 1
A24: 16 | B24: 5 | C24: 9 | D24: 5 | E24: 3 | F24: 1 | G24: 1 | I24: Yes
A25: 17 | B25: 4 | C25: 17 | D25: 5 | E25: 1 | F25: 2 | G25: 1
A26: 18 | B26: 4 | C26: 8 | D26: 6 | E26: 1 | F26: 2
A27: Totals | B27: =IF(B2="","",SUM(B9:B26)) -> 71 | D27: =IF(B2="","",SUM(D9:D26)) -> 94 | E27: =IF(B2="","",SUM(E9:E26)) -> 27 | F27: =IF(B2="","",SUM(F9:F26)) -> 34 | G27: =IF(B2="","",SUM(G9:G26)) -> 6 | H27: =IF(B2="","",SUM(H9:H26)) -> 0 | I27: =IF(COUNTIF(I9:I26,"=Yes")=0,"",COUNTIF(I9:I26,"=Yes")) -> 7