A1: Andrew Baldwin
A2: Club | B2: Crowborough Beacon
A3: Par/SS | B3: 71/69 | D3: Num. Of Fairways | I3: =IF(B2="","",18-(COUNTIF(B9:B26,3))) -> 14
A4: Date | B4: 42129 | D4: Playing Handicap | I4: 20.4
A5: Event Place | B5: 15 | C5: M | D5: Prize Money | G5: 2500
A6: Game Stats | B6: DB+ | C6: DB | D6: Bi | E6: P | F6: B | G6: E | H6: A | I6: H1
B7: 6 | C7: 7 | D7: 4 | E7: 1 | F7: 0 | G7: 0 | H7: 0 | I7: 0
A8: Hole No | B8: Par | C8: Stroke Index | D8: Gross Score | E8: Points | F8: Putts | G8: Fairways | H8: Ferrets | I8: Green Regulation
A9: 1 | B9: 4 | C9: 9 | D9: 7 | E9: 0 | F9: 2
A10: 2 | B10: 4 | C10: 1 | D10: 10 | E10: 0 | F10: 3 | H10: 1
A11: 3 | B11: 3 | C11: 15 | D11: 5 | E11: 1 | F11: 2
A12: 4 | B12: 4 | C12: 17 | D12: 6 | E12: 1 | F12: 2
A13: 5 | B13: 4 | C13: 3 | D13: 6 | E13: 1 | F13: 2 | H13: 1
A14: 6 | B14: 3 | C14: 11 | D14: 7 | E14: 0 | F14: 3
A15: 7 | B15: 5 | C15: 7 | D15: 7 | E15: 1 | F15: 3 | I15: Yes
A16: 8 | B16: 4 | C16: 13 | D16: 6 | E16: 1 | F16: 3 | I16: Yes
A17: 9 | B17: 4 | C17: 5 | D17: 6 | E17: 1 | F17: 2
A18: 10 | B18: 5 | C18: 8 | D18: 8 | E18: 0 | F18: 2
A19: 11 | B19: 4 | C19: 14 | D19: 5 | E19: 2 | F19: 1
A20: 12 | B20: 4 | C20: 2 | D20: 6 | E20: 2 | F20: 3 | I20: Yes
A21: 13 | B21: 3 | C21: 18 | D21: 4 | E21: 2 | F21: 3 | I21: Yes
A22: 14 | B22: 5 | C22: 10 | D22: 8 | E22: 0 | F22: 2
A23: 15 | B23: 4 | C23: 6 | D23: 5 | E23: 2 | F23: 2 | G23: 1 | I23: Yes
A24: 16 | B24: 4 | C24: 12 | D24: 5 | E24: 2 | F24: 1 | G24: 1
A25: 17 | B25: 3 | C25: 16 | D25: 3 | E25: 3 | F25: 2 | I25: Yes
A26: 18 | B26: 4 | C26: 4 | D26: 7 | E26: 0 | F26: 3
A27: Totals | B27: =IF(B2="","",SUM(B9:B26)) -> 71 | D27: =IF(B2="","",SUM(D9:D26)) -> 111 | E27: =IF(B2="","",SUM(E9:E26)) -> 19 | F27: =IF(B2="","",SUM(F9:F26)) -> 41 | G27: =IF(B2="","",SUM(G9:G26)) -> 2 | H27: =IF(B2="","",SUM(H9:H26)) -> 2 | I27: =IF(COUNTIF(I9:I26,"=Yes")=0,"",COUNTIF(I9:I26,"=Yes")) -> 6