A1: Danny Marsh
A2: Club | B2: Hatfield London
A3: Par/SS | B3: 72/70 | D3: Num. Of Fairways | I3: =IF(B2="","",18-(COUNTIF(B9:B26,3))) -> 13
A4: Date | B4: 37913 | D4: Playing Handicap | I4: 11.9
A5: Event Place | B5: 1 | D5: Prize Money | G5: 7500
A6: Game Stats | B6: DB+ | C6: DB | D6: Bi | E6: P | F6: B | G6: E | H6: A | I6: H1
B7: 0 | C7: 0 | D7: 4 | E7: 11 | F7: 3 | G7: 0 | H7: 0 | I7: 0
A8: Hole No | B8: Par | C8: Stroke Index | D8: Gross Score | E8: Points | F8: Putts | G8: Fairways | H8: Ferrets | I8: Green Regulation
A9: 1 | B9: 4 | C9: 3 | D9: 5 | E9: 2 | F9: 2 | G9: 1 | I9: Yes
A10: 2 | B10: 3 | C10: 7 | D10: 3 | E10: 3 | F10: 2 | I10: Yes
A11: 3 | B11: 5 | C11: 9 | D11: 5 | E11: 3 | F11: 2 | G11: 1 | I11: Yes
A12: 4 | B12: 4 | C12: 15 | D12: 4 | E12: 2 | F12: 2 | G12: 1 | I12: Yes
A13: 5 | B13: 3 | C13: 11 | D13: 2 | E13: 4 | F13: 1 | I13: Yes
A14: 6 | B14: 5 | C14: 13 | D14: 4 | E14: 3 | F14: 2 | G14: 1 | I14: Yes
A15: 7 | B15: 4 | C15: 5 | D15: 4 | E15: 3 | F15: 2 | I15: Yes
A16: 8 | B16: 4 | C16: 1 | D16: 4 | E16: 3 | F16: 2 | G16: 1 | I16: Yes
A17: 9 | B17: 3 | C17: 17 | D17: 3 | E17: 2 | F17: 1
A18: 10 | B18: 5 | C18: 10 | D18: 5 | E18: 3 | F18: 2 | I18: Yes
A19: 11 | B19: 4 | C19: 8 | D19: 4 | E19: 3 | F19: 2 | I19: Yes
A20: 12 | B20: 5 | C20: 4 | D20: 4 | E20: 4 | F20: 1 | I20: Yes
A21: 13 | B21: 5 | C21: 18 | D21: 5 | E21: 2 | F21: 2 | G21: 1 | I21: Yes
A22: 14 | B22: 4 | C22: 14 | D22: 4 | E22: 2 | F22: 2 | G22: 1 | I22: Yes
A23: 15 | B23: 3 | C23: 12 | D23: 3 | E23: 3 | F23: 2 | I23: Yes
A24: 16 | B24: 4 | C24: 2 | D24: 5 | E24: 2 | F24: 2 | I24: Yes
A25: 17 | B25: 4 | C25: 16 | D25: 5 | E25: 1 | F25: 1
A26: 18 | B26: 3 | C26: 6 | D26: 4 | E26: 2 | F26: 1
A27: Totals | B27: =IF(B2="","",SUM(B9:B26)) -> 72 | D27: =IF(B2="","",SUM(D9:D26)) -> 73 | E27: =IF(B2="","",SUM(E9:E26)) -> 47 | F27: =IF(B2="","",SUM(F9:F26)) -> 31 | G27: =IF(B2="","",SUM(G9:G26)) -> 7 | H27: =IF(B2="","",SUM(H9:H26)) -> 0 | I27: =IF(COUNTIF(I9:I26,"=Yes")=0,"",COUNTIF(I9:I26,"=Yes")) -> 15