A1: Ian Edwards
A2: Club | B2: Santa Maria, Marbella
A3: Par/SS | B3: 70/70 | D3: Num. Of Fairways | I3: =IF(B2="","",18-(COUNTIF(B9:B26,3))) -> 13
A4: Date | B4: 37904 | D4: Playing Handicap | I4: 13.9
A5: Event Place | B5: 2 | D5: Prize Money | G5: 2500
A6: Game Stats | B6: DB+ | C6: DB | D6: Bi | E6: P | F6: B | G6: E | H6: A | I6: H1
B7: 2 | C7: 4 | D7: 5 | E7: 7 | F7: 0 | G7: 0 | H7: 0 | I7: 0
A8: Hole No | B8: Par | C8: Stroke Index | D8: Gross Score | E8: Points | F8: Putts | G8: Fairways | H8: Ferrets | I8: Green Regulation
A9: 1 | B9: 4 | C9: 17 | D9: 6 | E9: 0 | F9: 2
A10: 2 | B10: 5 | C10: 11 | D10: 8 | E10: 0 | F10: 2
A11: 3 | B11: 4 | C11: 1 | D11: 5 | E11: 2 | F11: 2 | I11: Yes
A12: 4 | B12: 4 | C12: 15 | D12: 4 | E12: 2 | F12: 2 | G12: 1 | I12: Yes
A13: 5 | B13: 4 | C13: 13 | D13: 6 | E13: 1 | F13: 2
A14: 6 | B14: 4 | C14: 5 | D14: 4 | E14: 3 | F14: 2 | G14: 1 | I14: Yes
A15: 7 | B15: 3 | C15: 9 | D15: 5 | E15: 1 | F15: 2
A16: 8 | B16: 5 | C16: 3 | D16: 5 | E16: 3 | F16: 2 | G16: 1 | I16: Yes
A17: 9 | B17: 4 | C17: 7 | D17: 4 | E17: 3 | F17: 1 | G17: 1 | I17: Yes
A18: 10 | B18: 3 | C18: 18 | D18: 4 | E18: 1 | F18: 2
A19: 11 | B19: 4 | C19: 8 | D19: 4 | E19: 3 | F19: 0 | H19: 2
A20: 12 | B20: 3 | C20: 10 | D20: 6 | E20: 0 | F20: 2 | H20: 1
A21: 13 | B21: 5 | C21: 2 | D21: 6 | E21: 2 | F21: 2 | G21: 1 | I21: Yes
A22: 14 | B22: 4 | C22: 12 | D22: 5 | E22: 2 | F22: 2 | G22: 1 | I22: Yes
A23: 15 | B23: 3 | C23: 16 | D23: 4 | E23: 1 | F23: 3 | I23: Yes
A24: 16 | B24: 4 | C24: 4 | D24: 4 | E24: 3 | F24: 1 | G24: 1 | I24: Yes
A25: 17 | B25: 3 | C25: 14 | D25: 5 | E25: 1 | F25: 3 | I25: Yes
A26: 18 | B26: 4 | C26: 6 | D26: 4 | E26: 3 | F26: 1 | I26: Yes
A27: Totals | B27: =IF(B2="","",SUM(B9:B26)) -> 70 | D27: =IF(B2="","",SUM(D9:D26)) -> 89 | E27: =IF(B2="","",SUM(E9:E26)) -> 31 | F27: =IF(B2="","",SUM(F9:F26)) -> 33 | G27: =IF(B2="","",SUM(G9:G26)) -> 7 | H27: =IF(B2="","",SUM(H9:H26)) -> 3 | I27: =IF(COUNTIF(I9:I26,"=Yes")=0,"",COUNTIF(I9:I26,"=Yes")) -> 11