A1: Ian Edwards
A2: Club | B2: Hatfield London
A3: Par/SS | B3: 72/70 | D3: Num. Of Fairways | I3: =IF(B2="","",18-(COUNTIF(B9:B26,3))) -> 13
A4: Date | B4: 37913 | D4: Playing Handicap | I4: 13.9
A5: Event Place | B5: 3 | D5: Prize Money | G5: 2500
A6: Game Stats | B6: DB+ | C6: DB | D6: BI | E6: P | F6: B | G6: E | H6: A | I6: H1
B7: 3 | C7: 2 | D7: 6 | E7: 5 | F7: 2 | G7: 0 | H7: 0 | I7: 0
A8: Hole No | B8: Par | C8: Stroke Index | D8: Gross Score | E8: Points | F8: Putts | G8: Fairways | H8: Ferrets | I8: Green Regulation
A9: 1 | B9: 4 | C9: 3 | D9: 8 | E9: 0 | F9: 2
A10: 2 | B10: 3 | C10: 7 | D10: 4 | E10: 2 | F10: 1
A11: 3 | B11: 5 | C11: 9 | D11: 5 | E11: 3 | F11: 1 | G11: 1 | I11: Yes
A12: 4 | B12: 4 | C12: 15 | D12: 4 | E12: 2 | F12: 2 | I12: Yes
A13: 5 | B13: 3 | C13: 11 | D13: 3 | E13: 3 | F13: 2 | I13: Yes
A14: 6 | B14: 5 | C14: 13 | D14: 7 | E14: 1 | F14: 3 | I14: Yes
A15: 7 | B15: 4 | C15: 5 | D15: 5 | E15: 2 | F15: 2 | G15: 1 | I15: Yes
A16: 8 | B16: 4 | C16: 1 | D16: 7 | E16: 0 | F16: 3 | H16: 1
A17: 9 | B17: 3 | C17: 17 | D17: 4 | E17: 1 | F17: 2
A18: 10 | B18: 5 | C18: 10 | D18: 7 | E18: 1 | F18: 3 | I18: Yes
A19: 11 | B19: 4 | C19: 8 | D19: 5 | E19: 2 | F19: 2 | I19: Yes
A20: 12 | B20: 5 | C20: 4 | D20: 4 | E20: 4 | F20: 1 | G20: 1 | I20: Yes
A21: 13 | B21: 5 | C21: 18 | D21: 8 | E21: 0 | F21: 3 | H21: 1
A22: 14 | B22: 4 | C22: 14 | D22: 5 | E22: 2 | F22: 3 | I22: Yes
A23: 15 | B23: 3 | C23: 12 | D23: 3 | E23: 3 | F23: 2 | I23: Yes
A24: 16 | B24: 4 | C24: 2 | D24: 4 | E24: 3 | F24: 1 | G24: 1 | I24: Yes
A25: 17 | B25: 4 | C25: 16 | D25: 3 | E25: 3 | F25: 1 | G25: 1 | I25: Yes
A26: 18 | B26: 3 | C26: 6 | D26: 4 | E26: 2 | F26: 3 | I26: Yes
A27: Totals | B27: =IF(B2="","",SUM(B9:B26)) -> 72 | D27: =IF(B2="","",SUM(D9:D26)) -> 90 | E27: =IF(B2="","",SUM(E9:E26)) -> 34 | F27: =IF(B2="","",SUM(F9:F26)) -> 37 | G27: =IF(B2="","",SUM(G9:G26)) -> 5 | H27: =IF(B2="","",SUM(H9:H26)) -> 2 | I27: =IF(COUNTIF(I9:I26,"=Yes")=0,"",COUNTIF(I9:I26,"=Yes")) -> 13