A1: Keith Mendelson
A2: Club | B2: Chelsfield Lakes
A3: Par/SS | B3: 71/68 | D3: Num. Of Fairways | I3: =IF(B2="","",18-(COUNTIF(B9:B26,3))) -> 14
A4: Date | B4: 37857 | D4: Playing Handicap | I4: 11
A5: Event Place | B5: 1 | D5: Prize Money | G5: 5000
A6: Game Stats | B6: DB+ | C6: DB | D6: Bi | E6: P | F6: B | G6: E | H6: A | I6: H1
B7: 2 | C7: 3 | D7: 8 | E7: 3 | F7: 1 | G7: 1 | H7: 0 | I7: 0
A8: Hole No | B8: Par | C8: Stroke Index | D8: Gross Score | E8: Points | F8: Putts | G8: Fairways | H8: Ferrets | I8: Green Regulation
A9: 1 | B9: 4 | C9: 12 | D9: 5 | E9: 1 | F9: 2 | G9: 1
A10: 2 | B10: 3 | C10: 7 | D10: 4 | E10: 2 | F10: 2 | I10: Yes
A11: 3 | B11: 4 | C11: 11 | D11: 3 | E11: 4 | F11: 1 | G11: 1 | I11: Yes
A12: 4 | B12: 4 | C12: 2 | D12: 6 | E12: 1 | F12: 1
A13: 5 | B13: 3 | C13: 9 | D13: 4 | E13: 2 | F13: 2 | I13: Yes
A14: 6 | B14: 5 | C14: 14 | D14: 7 | E14: 0 | F14: 2
A15: 7 | B15: 5 | C15: 6 | D15: 3 | E15: 5 | F15: 0 | G15: 1 | I15: Yes
A16: 8 | B16: 4 | C16: 18 | D16: 7 | E16: 0 | F16: 1
A17: 9 | B17: 4 | C17: 5 | D17: 5 | E17: 2 | F17: 1
A18: 10 | B18: 4 | C18: 10 | D18: 4 | E18: 3 | F18: 2 | G18: 1 | I18: Yes
A19: 11 | B19: 4 | C19: 13 | D19: 4 | E19: 2 | F19: 1
A20: 12 | B20: 4 | C20: 8 | D20: 5 | E20: 2 | F20: 2 | I20: Yes
A21: 13 | B21: 5 | C21: 1 | D21: 6 | E21: 2 | F21: 2 | G21: 1 | I21: Yes
A22: 14 | B22: 4 | C22: 16 | D22: 6 | E22: 0 | F22: 2 | G22: 1
A23: 15 | B23: 3 | C23: 17 | D23: 6 | E23: 0 | F23: 3
A24: 16 | B24: 4 | C24: 3 | D24: 4 | E24: 3 | F24: 1 | I24: Yes
A25: 17 | B25: 3 | C25: 15 | D25: 4 | E25: 1 | F25: 2
A26: 18 | B26: 4 | C26: 4 | D26: 5 | E26: 2 | F26: 1
A27: Totals | B27: =IF(B2="","",SUM(B9:B26)) -> 71 | D27: =IF(B2="","",SUM(D9:D26)) -> 88 | E27: =IF(B2="","",SUM(E9:E26)) -> 32 | F27: =IF(B2="","",SUM(F9:F26)) -> 28 | G27: =IF(B2="","",SUM(G9:G26)) -> 6 | H27: =IF(B2="","",SUM(H9:H26)) -> 0 | I27: =IF(COUNTIF(I9:I26,"=Yes")=0,"",COUNTIF(I9:I26,"=Yes")) -> 8