A1: Paul Baldwin
A2: Club | B2: Chelsfield Lakes
A3: Par/SS | B3: 71/68 | D3: Num. Of Fairways | I3: =IF(B2="","",18-(COUNTIF(B9:B26,3))) -> 14
A4: Date | B4: 37843 | D4: Playing Handicap | I4: 17.5
A5: Event Place | B5: 2 | D5: Prize Money | G5: 5000
A6: Game Stats | B6: DB+ | C6: DB | D6: Bi | E6: P | F6: B | G6: E | H6: A | I6: H1
B7: 2 | C7: 1 | D7: 10 | E7: 4 | F7: 1 | G7: 0 | H7: 0 | I7: 0
A8: Hole No | B8: Par | C8: Stroke Index | D8: Gross Score | E8: Points | F8: Putts | G8: Fairways | H8: Ferrets | I8: Green Regulation
A9: 1 | B9: 4 | C9: 12 | D9: 5 | E9: 2 | F9: 2 | I9: Yes
A10: 2 | B10: 3 | C10: 7 | D10: 4 | E10: 2 | F10: 1
A11: 3 | B11: 4 | C11: 11 | D11: 4 | E11: 3 | F11: 2 | G11: 1 | I11: Yes
A12: 4 | B12: 4 | C12: 2 | D12: 4 | E12: 3 | F12: 1 | I12: Yes
A13: 5 | B13: 3 | C13: 9 | D13: 4 | E13: 2 | F13: 1
A14: 6 | B14: 5 | C14: 14 | D14: 8 | E14: 0 | F14: 3
A15: 7 | B15: 5 | C15: 6 | D15: 6 | E15: 2 | F15: 2 | G15: 1 | I15: Yes
A16: 8 | B16: 4 | C16: 18 | D16: 5 | E16: 2 | F16: 1
A17: 9 | B17: 4 | C17: 5 | D17: 5 | E17: 2 | F17: 2 | I17: Yes
A18: 10 | B18: 4 | C18: 10 | D18: 5 | E18: 2 | F18: 2 | I18: Yes
A19: 11 | B19: 4 | C19: 13 | D19: 7 | E19: 0 | F19: 2
A20: 12 | B20: 4 | C20: 8 | D20: 5 | E20: 2 | F20: 2 | I20: Yes
A21: 13 | B21: 5 | C21: 1 | D21: 5 | E21: 3 | F21: 0
A22: 14 | B22: 4 | C22: 16 | D22: 6 | E22: 1 | F22: 2
A23: 15 | B23: 3 | C23: 17 | D23: 3 | E23: 3 | F23: 2 | I23: Yes
A24: 16 | B24: 4 | C24: 3 | D24: 5 | E24: 2 | F24: 2 | I24: Yes
A25: 17 | B25: 3 | C25: 15 | D25: 4 | E25: 2 | F25: 2 | I25: Yes
A26: 18 | B26: 4 | C26: 4 | D26: 3 | E26: 4 | F26: 1 | G26: 1 | I26: Yes
A27: Totals | B27: =IF(B2="","",SUM(B9:B26)) -> 71 | D27: =IF(B2="","",SUM(D9:D26)) -> 88 | E27: =IF(B2="","",SUM(E9:E26)) -> 37 | F27: =IF(B2="","",SUM(F9:F26)) -> 30 | G27: =IF(B2="","",SUM(G9:G26)) -> 3 | H27: =IF(B2="","",SUM(H9:H26)) -> 0 | I27: =IF(COUNTIF(I9:I26,"=Yes")=0,"",COUNTIF(I9:I26,"=Yes")) -> 11