A1: Dave Bingham
A2: Club | B2: Selsdon Park
A3: Par/SS | B3: 73/70 | D3: Num. Of Fairways | I3: =IF(B2="","",18-(COUNTIF(B9:B26,3))) -> 14
A4: Date | B4: 42252 | D4: Playing Handicap | I4: 11.6
A5: Event Place | B5: 17 | C5: M | D5: Prize Money | G5: 10000
A6: Game Stats | B6: DB+ | C6: DB | D6: Bi | E6: P | F6: B | G6: E | H6: A | I6: H1
B7: 4 | C7: 3 | D7: 9 | E7: 2 | F7: 0 | G7: 0 | H7: 0 | I7: 0
A8: Hole No | B8: Par | C8: Stroke Index | D8: Gross Score | E8: Points | F8: Putts | G8: Fairways | H8: Ferrets | I8: Green Regulation
A9: 1 | B9: 5 | C9: 9 | D9: 6 | E9: 2 | F9: 2 | G9: 1 | I9: Yes
A10: 2 | B10: 4 | C10: 3 | D10: 7 | E10: 0 | F10: 2
A11: 3 | B11: 3 | C11: 17 | D11: 4 | E11: 1 | F11: 1
A12: 4 | B12: 4 | C12: 7 | D12: 5 | E12: 2 | F12: 2 | G12: 1 | I12: Yes
A13: 5 | B13: 5 | C13: 15 | D13: 6 | E13: 1 | F13: 2
A14: 6 | B14: 3 | C14: 5 | D14: 3 | E14: 3 | F14: 2 | I14: Yes
A15: 7 | B15: 4 | C15: 13 | D15: 5 | E15: 1 | F15: 2
A16: 8 | B16: 4 | C16: 1 | D16: 9 | E16: 0 | F16: 2
A17: 9 | B17: 4 | C17: 11 | D17: 5 | E17: 2 | F17: 2 | G17: 1 | I17: Yes
A18: 10 | B18: 5 | C18: 10 | D18: 7 | E18: 1 | F18: 2 | G18: 1
A19: 11 | B19: 3 | C19: 16 | D19: 6 | E19: 0 | F19: 2
A20: 12 | B20: 5 | C20: 2 | D20: 6 | E20: 2 | F20: 1
A21: 13 | B21: 4 | C21: 8 | D21: 4 | E21: 3 | F21: 2 | I21: Yes
A22: 14 | B22: 4 | C22: 6 | D22: 6 | E22: 1 | F22: 3 | G22: 1 | I22: Yes
A23: 15 | B23: 5 | C23: 18 | D23: 6 | E23: 1 | F23: 2
A24: 16 | B24: 4 | C24: 4 | D24: 5 | E24: 2 | F24: 2 | G24: 1 | I24: Yes
A25: 17 | B25: 3 | C25: 14 | D25: 6 | E25: 0 | F25: 3
A26: 18 | B26: 4 | C26: 12 | D26: 6 | E26: 1 | F26: 2
A27: Totals | B27: =IF(B2="","",SUM(B9:B26)) -> 73 | D27: =IF(B2="","",SUM(D9:D26)) -> 102 | E27: =IF(B2="","",SUM(E9:E26)) -> 23 | F27: =IF(B2="","",SUM(F9:F26)) -> 36 | G27: =IF(B2="","",SUM(G9:G26)) -> 6 | H27: =IF(B2="","",SUM(H9:H26)) -> 0 | I27: =IF(COUNTIF(I9:I26,"=Yes")=0,"",COUNTIF(I9:I26,"=Yes")) -> 7