A1: Robert Thompson
A2: Club | B2: Berkshire
A3: Par/SS | B3: 72/70 | D3: Num. Of Fairways | I3: =IF(B2="","",18-(COUNTIF(B9:B26,3))) -> 12
A4: Date | B4: 42271 | D4: Playing Handicap | I4: 9.6
A5: Event Place | B5: 1 | D5: Prize Money | G5: 5000
A6: Game Stats | B6: DB+ | C6: DB | D6: BI | E6: P | F6: B | G6: E | H6: A | I6: H1
B7: 4 | C7: 5 | D7: 5 | E7: 4 | F7: 0 | G7: 0 | H7: 0 | I7: 0
A8: Hole No | B8: Par | C8: Stroke Index | D8: Gross Score | E8: Points | F8: Putts | G8: Fairways | H8: Ferrets | I8: Green Regulation
A9: 1 | B9: 5 | C9: 5 | D9: 5 | E9: 3 | F9: 2 | G9: 1 | I9: Yes
A10: 2 | B10: 3 | C10: 18 | D10: 4 | E10: 1 | F10: 3 | I10: Yes
A11: 3 | B11: 5 | C11: 13 | D11: 7 | E11: 0 | F11: 2
A12: 4 | B12: 4 | C12: 1 | D12: 5 | E12: 2 | F12: 2 | I12: Yes
A13: 5 | B13: 3 | C13: 9 | D13: 3 | E13: 3 | F13: 1 | I13: Yes
A14: 6 | B14: 4 | C14: 14 | D14: 10 | E14: 0 | F14: 3 | H14: 1
A15: 7 | B15: 3 | C15: 7 | D15: 5 | E15: 1 | F15: 1
A16: 8 | B16: 4 | C16: 3 | D16: 6 | E16: 1 | F16: 2 | G16: 1
A17: 9 | B17: 5 | C17: 11 | D17: 5 | E17: 2 | F17: 2 | I17: Yes
A18: 10 | B18: 3 | C18: 12 | D18: 5 | E18: 0 | F18: 2
A19: 11 | B19: 4 | C19: 4 | D19: 7 | E19: 0 | F19: 3
A20: 12 | B20: 4 | C20: 15 | D20: 5 | E20: 1 | F20: 2
A21: 13 | B21: 5 | C21: 10 | D21: 5 | E21: 3 | F21: 2 | I21: Yes
A22: 14 | B22: 4 | C22: 2 | D22: 6 | E22: 1 | F22: 1
A23: 15 | B23: 5 | C23: 16 | D23: 10 | E23: 0 | F23: 3
A24: 16 | B24: 3 | C24: 6 | D24: 4 | E24: 2 | F24: 2 | I24: Yes
A25: 17 | B25: 5 | C25: 8 | D25: 9 | E25: 0 | F25: 2
A26: 18 | B26: 3 | C26: 17 | D26: 4 | E26: 1 | F26: 2
A27: Totals | B27: =IF(B2="","",SUM(B9:B26)) -> 72 | D27: =IF(B2="","",SUM(D9:D26)) -> 105 | E27: =IF(B2="","",SUM(E9:E26)) -> 21 | F27: =IF(B2="","",SUM(F9:F26)) -> 37 | G27: =IF(B2="","",SUM(G9:G26)) -> 2 | H27: =IF(B2="","",SUM(H9:H26)) -> 1 | I27: =IF(COUNTIF(I9:I26,"=Yes")=0,"",COUNTIF(I9:I26,"=Yes")) -> 7