A1: Season 14 - April 1st 2012 to 13th April 2013
A2: MGA World Tour Money List
B3: Statistics updated | C3: =TODAY() -> 41379
A4: Pos | B4: Player | C4: Original Handicap | D4: Current Handicap | E4: Playing Handicap | F4: Events Played | G4: Tour Victories | H4: Winnings
A5: 1 | B5: Robert Thompson | C5: 11.6 | D5: 10.1 | E5: =D5 -> 10.1 | F5: 13 | G5: 5 | H5: 146250
A6: =A5+1 -> 2 | B6: Kevin Gallagher | C6: 15.7 | D6: 15.8 | E6: =D6 -> 15.8 | F6: 11 | G6: 5 | H6: 145000
A7: =A6+1 -> 3 | B7: Jon Dey | C7: 31.1 | D7: 26.6 | E7: =D7 -> 26.6 | F7: 6 | G7: 3 | H7: 126250
A8: =A7+1 -> 4 | B8: Dave Rouse | C8: 27.0 | D8: 25.8 | E8: =D8 -> 25.8 | F8: 6 | G8: 0 | H8: 116250
A9: =A8+1 -> 5 | B9: Keith Mendelson | C9: 16.4 | D9: 15.2 | E9: =D9 -> 15.2 | F9: 5 | G9: 0 | H9: 100000
A10: =A9+1 -> 6 | B10: Matthew Carter | C10: 17.5 | D10: 16.7 | E10: =D10 -> 16.7 | F10: 6 | G10: 1 | H10: 86250
A11: =A10+1 -> 7 | B11: Dave Andrews | C11: 16.3 | D11: 15.8 | E11: =D11 -> 15.8 | F11: 4 | G11: 1 | H11: 81250
A12: =A11+1 -> 8 | B12: Michael Trimmings | C12: 25.0 | D12: 24.5 | E12: =D12 -> 24.5 | F12: 4 | G12: 0 | H12: 80000
A13: =A12+1 -> 9 | B13: Paul Carter | C13: 14.3 | D13: 14.0 | E13: =D13 -> 14 | F13: 5 | G13: 1 | H13: 63750
A14: =A13+1 -> 10 | B14: Simon Thompson | C14: 9.3 | D14: 9.2 | E14: =D14 -> 9.2 | F14: 4 | G14: 0 | H14: 52250
A15: =A14+1 -> 11 | B15: Paul Baldwin | C15: 20.8 | D15: 21.100000000001003 | E15: =D15 -> 21.100000000001003 | F15: 3 | G15: 0 | H15: 48750
A16: =A15+1 -> 12 | B16: Dave Bingham | C16: 10.6 | D16: 10.9 | E16: =D16 -> 10.9 | F16: 3 | G16: 0 | H16: 48750
A17: =A16+1 -> 13 | B17: David Archer | C17: 24.0 | D17: 24.1 | E17: =D17 -> 24.1 | F17: 2 | G17: 0 | H17: 46250
A18: =A17+1 -> 14 | B18: Martin Bould | C18: 18.8 | D18: 14.8 | E18: =D18 -> 14.8 | F18: 1 | G18: 1 | H18: 42500
A19: =A18+1 -> 15 | B19: Andrew Baldwin | C19: 19.8 | D19: 20.1 | E19: =D19 -> 20.1 | F19: 2 | G19: 0 | H19: 41250
A20: =A19+1 -> 16 | B20: David Braithwaite | C20: 11.7 | D20: 12.1 | E20: =D20 -> 12.1 | F20: 3 | G20: 0 | H20: 37500
A21: =A20+1 -> 17 | B21: Jeff Colbrook | C21: 15.2 | D21: 15.500000000000998 | E21: =D21 -> 15.500000000000998 | F21: 3 | G21: 0 | H21: 25000
A22: =A21+1 -> 18 | B22: Chris Manning | C22: 22.7 | D22: 22.8 | E22: =D22 -> 22.8 | F22: 1 | G22: 0 | H22: 25000
A23: =A22+1 -> 19 | B23: Jon Press | C23: 14.2 | D23: 14.5 | E23: =D23 -> 14.5 | F23: 2 | G23: 1 | H23: 20000
A24: =A23+1 -> 20 | B24: Ian Edwards | C24: 12.6 | D24: 14.5 | E24: =D24 -> 14.5 | F24: 4 | G24: 0 | H24: 17500
A25: =A24+1 -> 21 | B25: Roy Dickens | C25: 30.4 | D25: 30.8 | E25: =D25 -> 30.8 | F25: 2 | G25: 0 | H25: 16250
A26: =A25+1 -> 22 | B26: Simon Owens | C26: 14.1 | D26: 14.5 | E26: =D26 -> 14.5 | F26: 2 | G26: 0 | H26: 8750
A27: =A26+1 -> 23 | B27: Alan Baldwin | C27: 21.2 | D27: 20.900000000001 | E27: =D27 -> 20.900000000001 | F27: 2 | G27: 0 | H27: 6250
A28: =A27+1 -> 24 | B28: Martin Cox | C28: 13.5 | D28: 13.7 | E28: =D28 -> 13.7 | F28: 1 | G28: 0 | H28: 2500
A29: =A28+1 -> 25 | B29: Steve Tilling | C29: 16.5 | D29: 16.5 | E29: =D29 -> 16.5 | F29: 0 | G29: 0 | H29: 0
A30: =A29+1 -> 26 | B30: Malcolm Rouse | C30: 44.9 | D30: 44.9 | E30: =D30 -> 44.9 | F30: 0 | G30: 0 | H30: 0
A31: =A30+1 -> 27 | B31: Keith Johns | C31: 24.3 | D31: 24.3 | E31: =D31 -> 24.3 | F31: 0 | G31: 0 | H31: 0
A32: =A31+1 -> 28 | B32: Jeff Gibbons | C32: 21.0 | D32: 21.0 | E32: =D32 -> 21 | F32: 0 | G32: 0 | H32: 0
A33: =A32+1 -> 29 | B33: Dave White | C33: 21.5 | D33: 21.5 | E33: =D33 -> 21.5 | F33: 0 | G33: 0 | H33: 0
A34: =A33+1 -> 30 | B34: Clive Ferris | C34: 26.0 | D34: 26.0 | E34: =D34 -> 26 | F34: 0 | G34: 0 | H34: 0
A35: =A34+1 -> 31 | B35: Andy Benson | C35: 6.3 | D35: 6.3 | E35: =D35 -> 6.3 | F35: 0 | G35: 0 | H35: 0
A36: =A35+1 -> 32 | B36: Alan Hopkins | C36: 7.7 | D36: 7.7 | E36: =D36 -> 7.7 | F36: 0 | G36: 0 | H36: 0