A1: Danny Marsh
A2: Club | B2: San Roque, Spain
A3: Par/SS | B3: 72/72 | D3: Num. Of Fairways | I3: =IF(B2="","",18-(COUNTIF(B9:B26,3))) -> 14
A4: Date | B4: 37906 | D4: Playing Handicap | I4: 11.4
A5: Event Place | B5: 2 | D5: Prize Money | G5: 2500
A6: Game Stats | B6: DB+ | C6: DB | D6: BI | E6: P | F6: B | G6: E | H6: A | I6: H1
B7: 3 | C7: 3 | D7: 8 | E7: 4 | F7: 0 | G7: 0 | H7: 0 | I7: 0
A8: Hole No | B8: Par | C8: Stroke Index | D8: Gross Score | E8: Points | F8: Putts | G8: Fairways | H8: Ferrets | I8: Green Regulation
A9: 1 | B9: 4 | C9: 11 | D9: 5 | E9: 2 | F9: 2 | G9: 1 | I9: Yes
A10: 2 | B10: 4 | C10: 7 | D10: 5 | E10: 2 | F10: 2 | G10: 1 | I10: Yes
A11: 3 | B11: 3 | C11: 17 | D11: 3 | E11: 2 | F11: 1
A12: 4 | B12: 4 | C12: 9 | D12: 4 | E12: 3 | F12: 1 | I12: Yes
A13: 5 | B13: 5 | C13: 5 | D13: 8 | E13: 0 | F13: 3 | H13: 1
A14: 6 | B14: 4 | C14: 1 | D14: 8 | E14: 0 | F14: 2 | H14: 2
A15: 7 | B15: 3 | C15: 15 | D15: 5 | E15: 0 | F15: 2
A16: 8 | B16: 4 | C16: 3 | D16: 5 | E16: 2 | F16: 2 | I16: Yes
A17: 9 | B17: 5 | C17: 13 | D17: 6 | E17: 1 | F17: 3 | I17: Yes
A18: 10 | B18: 5 | C18: 14 | D18: 7 | E18: 0 | F18: 2
A19: 11 | B19: 4 | C19: 2 | D19: 4 | E19: 3 | F19: 1 | G19: 1 | I19: Yes
A20: 12 | B20: 4 | C20: 4 | D20: 10 | E20: 0 | F20: 3 | G20: 1 | H20: 2
A21: 13 | B21: 4 | C21: 6 | D21: 4 | E21: 3 | F21: 1 | G21: 1 | I21: Yes
A22: 14 | B22: 3 | C22: 18 | D22: 4 | E22: 1 | F22: 2 | H22: 1
A23: 15 | B23: 4 | C23: 12 | D23: 5 | E23: 1 | F23: 2 | G23: 1
A24: 16 | B24: 3 | C24: 16 | D24: 4 | E24: 1 | F24: 2
A25: 17 | B25: 5 | C25: 10 | D25: 6 | E25: 2 | F25: 1
A26: 18 | B26: 4 | C26: 8 | D26: 6 | E26: 1 | F26: 2 | G26: 1 | H26: 1
A27: Totals | B27: =IF(B2="","",SUM(B9:B26)) -> 72 | D27: =IF(B2="","",SUM(D9:D26)) -> 99 | E27: =IF(B2="","",SUM(E9:E26)) -> 24 | F27: =IF(B2="","",SUM(F9:F26)) -> 34 | G27: =IF(B2="","",SUM(G9:G26)) -> 7 | H27: =IF(B2="","",SUM(H9:H26)) -> 7 | I27: =IF(COUNTIF(I9:I26,"=Yes")=0,"",COUNTIF(I9:I26,"=Yes")) -> 7