A1: Ian Edwards
A2: Club | B2: Santa Clara, Spain
A3: Par/SS | B3: 71/70 | D3: Num. Of Fairways | I3: =IF(B2="","",18-(COUNTIF(B9:B26,3))) -> 14
A4: Date | B4: 37904 | D4: Playing Handicap | I4: 13.9
A5: Event Place | B5: 1 | D5: Prize Money | G5: 5000
A6: Game Stats | B6: DB+ | C6: DB | D6: Bi | E6: P | F6: B | G6: E | H6: A | I6: H1
B7: 1 | C7: 2 | D7: 10 | E7: 3 | F7: 2 | G7: 0 | H7: 0 | I7: 0
A8: Hole No | B8: Par | C8: Stroke Index | D8: Gross Score | E8: Points | F8: Putts | G8: Fairways | H8: Ferrets | I8: Green Regulation
A9: 1 | B9: 4 | C9: 14 | D9: 3 | E9: 4 | F9: 1 | I9: Yes
A10: 2 | B10: 3 | C10: 12 | D10: 4 | E10: 2 | F10: 1
A11: 3 | B11: 4 | C11: 18 | D11: 5 | E11: 1 | F11: 3 | I11: Yes
A12: 4 | B12: 4 | C12: 8 | D12: 5 | E12: 2 | F12: 2 | G12: 1 | I12: Yes
A13: 5 | B13: 4 | C13: 10 | D13: 7 | E13: 0 | F13: 3 | G13: 1
A14: 6 | B14: 3 | C14: 6 | D14: 3 | E14: 3 | F14: 1 | I14: Yes
A15: 7 | B15: 4 | C15: 4 | D15: 6 | E15: 1 | F15: 2 | G15: 1
A16: 8 | B16: 5 | C16: 2 | D16: 6 | E16: 2 | F16: 1
A17: 9 | B17: 4 | C17: 16 | D17: 6 | E17: 0 | F17: 2 | G17: 1
A18: 10 | B18: 5 | C18: 3 | D18: 6 | E18: 2 | F18: 3 | G18: 1 | I18: Yes
A19: 11 | B19: 4 | C19: 11 | D19: 4 | E19: 3 | F19: 2 | G19: 1 | I19: Yes
A20: 12 | B20: 4 | C20: 5 | D20: 5 | E20: 2 | F20: 1
A21: 13 | B21: 3 | C21: 9 | D21: 2 | E21: 4 | F21: 1 | I21: Yes
A22: 14 | B22: 5 | C22: 1 | D22: 5 | E22: 3 | F22: 2 | I22: Yes
A23: 15 | B23: 3 | C23: 15 | D23: 4 | E23: 1 | F23: 2
A24: 16 | B24: 4 | C24: 17 | D24: 5 | E24: 1 | F24: 2
A25: 17 | B25: 4 | C25: 7 | D25: 5 | E25: 2 | F25: 2 | I25: Yes
A26: 18 | B26: 4 | C26: 13 | D26: 5 | E26: 2 | F26: 1 | H26: 1
A27: Totals | B27: =IF(B2="","",SUM(B9:B26)) -> 71 | D27: =IF(B2="","",SUM(D9:D26)) -> 86 | E27: =IF(B2="","",SUM(E9:E26)) -> 35 | F27: =IF(B2="","",SUM(F9:F26)) -> 32 | G27: =IF(B2="","",SUM(G9:G26)) -> 6 | H27: =IF(B2="","",SUM(H9:H26)) -> 1 | I27: =IF(COUNTIF(I9:I26,"=Yes")=0,"",COUNTIF(I9:I26,"=Yes")) -> 9