A1: Robert Thompson
A2: Club | B2: Moor Park West Course
A3: Par/SS | B3: 69/69 | D3: Num. Of Fairways | I3: =IF(B2="","",18-(COUNTIF(B9:B26,3))) -> 13
A4: Date | B4: 37925 | D4: Playing Handicap | I4: 7
A5: Event Place | B5: 2 | D5: Prize Money | G5: 2500
A6: Game Stats | B6: DB+ | C6: DB | D6: Bi | E6: P | F6: B | G6: E | H6: A | I6: H1
B7: 1 | C7: 3 | D7: 6 | E7: 6 | F7: 2 | G7: 0 | H7: 0 | I7: 0
A8: Hole No | B8: Par | C8: Stroke Index | D8: Gross Score | E8: Points | F8: Putts | G8: Fairways | H8: Ferrets | I8: Green Regulation
A9: 1 | B9: 4 | C9: 11 | D9: 5 | E9: 1 | F9: 2 | G9: 1
A10: 2 | B10: 3 | C10: 9 | D10: 6 | E10: 0 | F10: 2
A11: 3 | B11: 4 | C11: 5 | D11: 6 | E11: 1 | F11: 3 | I11: Yes
A12: 4 | B12: 3 | C12: 15 | D12: 3 | E12: 2 | F12: 1
A13: 5 | B13: 4 | C13: 3 | D13: 6 | E13: 1 | F13: 3 | G13: 1 | I13: Yes
A14: 6 | B14: 3 | C14: 17 | D14: 4 | E14: 1 | F14: 2
A15: 7 | B15: 4 | C15: 1 | D15: 4 | E15: 3 | F15: 2 | I15: Yes
A16: 8 | B16: 4 | C16: 7 | D16: 4 | E16: 3 | F16: 2 | G16: 1 | I16: Yes
A17: 9 | B17: 3 | C17: 13 | D17: 4 | E17: 1 | F17: 1
A18: 10 | B18: 4 | C18: 14 | D18: 4 | E18: 2 | F18: 2 | I18: Yes
A19: 11 | B19: 4 | C19: 6 | D19: 6 | E19: 1 | F19: 1
A20: 12 | B20: 5 | C20: 4 | D20: 4 | E20: 4 | F20: 1 | G20: 1 | I20: Yes
A21: 13 | B21: 3 | C21: 16 | D21: 3 | E21: 2 | F21: 2 | I21: Yes
A22: 14 | B22: 5 | C22: 12 | D22: 5 | E22: 2 | F22: 2 | I22: Yes
A23: 15 | B23: 4 | C23: 2 | D23: 5 | E23: 2 | F23: 2 | I23: Yes
A24: 16 | B24: 4 | C24: 8 | D24: 5 | E24: 1 | F24: 2
A25: 17 | B25: 4 | C25: 10 | D25: 3 | E25: 3 | F25: 2 | G25: 1 | I25: Yes
A26: 18 | B26: 4 | C26: 18 | D26: 5 | E26: 1 | F26: 2 | G26: 1
A27: Totals | B27: =IF(B2="","",SUM(B9:B26)) -> 69 | D27: =IF(B2="","",SUM(D9:D26)) -> 82 | E27: =IF(B2="","",SUM(E9:E26)) -> 31 | F27: =IF(B2="","",SUM(F9:F26)) -> 34 | G27: =IF(B2="","",SUM(G9:G26)) -> 6 | H27: =IF(B2="","",SUM(H9:H26)) -> 0 | I27: =IF(COUNTIF(I9:I26,"=Yes")=0,"",COUNTIF(I9:I26,"=Yes")) -> 10