A1: Alan Baldwin
A2: Club | B2: The Old Course
A3: Par/SS | B3: 73/72 | D3: Num. Of Fairways | I3: =IF(B2="","",18-(COUNTIF(B9:B26,3))) -> 14
A4: Date | B4: 37953 | D4: Playing Handicap | I4: 14.7
A5: Event Place | B5: 7 | D5: Prize Money | G5: 2500
A6: Game Stats | B6: DB+ | C6: DB | D6: Bi | E6: P | F6: B | G6: E | H6: A | I6: H1
B7: 6 | C7: 7 | D7: 4 | E7: 1 | F7: 0 | G7: 0 | H7: 0 | I7: 0
A8: Hole No | B8: Par | C8: Stroke Index | D8: Gross Score | E8: Points | F8: Putts | G8: Fairways | H8: Ferrets | I8: Green Regulation
A9: 1 | B9: 4 | C9: 17 | D9: 7 | E9: 0 | F9: 3 | G9: 1
A10: 2 | B10: 5 | C10: 5 | D10: 6 | E10: 2 | F10: 1
A11: 3 | B11: 4 | C11: 9 | D11: 5 | E11: 2 | F11: 1
A12: 4 | B12: 3 | C12: 15 | D12: 4 | E12: 2 | F12: 2 | I12: Yes
A13: 5 | B13: 5 | C13: 10 | D13: 7 | E13: 1 | F13: 2 | G13: 1
A14: 6 | B14: 3 | C14: 11 | D14: 5 | E14: 1 | F14: 1
A15: 7 | B15: 4 | C15: 7 | D15: 5 | E15: 2 | F15: 2 | G15: 1 | I15: Yes
A16: 8 | B16: 4 | C16: 1 | D16: 10 | E16: 0 | F16: 2
A17: 9 | B17: 4 | C17: 13 | D17: 6 | E17: 1 | F17: 2 | G17: 1
A18: 10 | B18: 3 | C18: 18 | D18: 10 | E18: 0 | F18: 3
A19: 11 | B19: 4 | C19: 4 | D19: 4 | E19: 3 | F19: 1 | G19: 1 | I19: Yes
A20: 12 | B20: 5 | C20: 6 | D20: 7 | E20: 1 | F20: 2
A21: 13 | B21: 4 | C21: 16 | D21: 6 | E21: 0 | F21: 3
A22: 14 | B22: 5 | C22: 8 | D22: 10 | E22: 0 | F22: 2
A23: 15 | B23: 3 | C23: 14 | D23: 10 | E23: 0 | F23: 3
A24: 16 | B24: 5 | C24: 2 | D24: 7 | E24: 1 | F24: 1
A25: 17 | B25: 4 | C25: 12 | D25: 10 | E25: 0 | F25: 2 | G25: 1
A26: 18 | B26: 4 | C26: 3 | D26: 6 | E26: 1 | F26: 2
A27: Totals | B27: =IF(B2="","",SUM(B9:B26)) -> 73 | D27: =IF(B2="","",SUM(D9:D26)) -> 125 | E27: =IF(B2="","",SUM(E9:E26)) -> 17 | F27: =IF(B2="","",SUM(F9:F26)) -> 35 | G27: =IF(B2="","",SUM(G9:G26)) -> 6 | H27: =IF(B2="","",SUM(H9:H26)) -> 0 | I27: =IF(COUNTIF(I9:I26,"=Yes")=0,"",COUNTIF(I9:I26,"=Yes")) -> 3