A1: Alan Baldwin
A2: Club | B2: Vila Sol 1-18
A3: Par/SS | B3: 72/72 | D3: Num. Of Fairways | I3: =IF(B2="","",18-(COUNTIF(B9:B26,3))) -> 14
A4: Date | B4: 37955 | D4: Playing Handicap | I4: 17.7
A5: Event Place | B5: 6 | D5: Prize Money | G5: 5000
A6: Game Stats | B6: DB+ | C6: DB | D6: BI | E6: P | F6: B | G6: E | H6: A | I6: H1
B7: 4 | C7: 7 | D7: 7 | E7: 0 | F7: 0 | G7: 0 | H7: 0 | I7: 0
A8: Hole No | B8: Par | C8: Stroke Index | D8: Gross Score | E8: Points | F8: Putts | G8: Fairways | H8: Ferrets | I8: Green Regulation
A9: 1 | B9: 4 | C9: 3 | D9: 5 | E9: 2 | F9: 2 | G9: 1 | I9: Yes
A10: 2 | B10: 4 | C10: 7 | D10: 6 | E10: 1 | F10: 3 | I10: Yes
A11: 3 | B11: 4 | C11: 1 | D11: 7 | E11: 0 | F11: 2
A12: 4 | B12: 3 | C12: 15 | D12: 4 | E12: 2 | F12: 2 | I12: Yes
A13: 5 | B13: 4 | C13: 11 | D13: 7 | E13: 0 | F13: 2
A14: 6 | B14: 5 | C14: 9 | D14: 7 | E14: 1 | F14: 2
A15: 7 | B15: 3 | C15: 13 | D15: 6 | E15: 0 | F15: 2 | H15: 1
A16: 8 | B16: 5 | C16: 5 | D16: 7 | E16: 1 | F16: 2
A17: 9 | B17: 4 | C17: 17 | D17: 6 | E17: 1 | F17: 2 | G17: 1
A18: 10 | B18: 4 | C18: 10 | D18: 6 | E18: 1 | F18: 2 | G18: 1
A19: 11 | B19: 5 | C19: 16 | D19: 7 | E19: 1 | F19: 1
A20: 12 | B20: 4 | C20: 6 | D20: 5 | E20: 2 | F20: 2 | G20: 1 | I20: Yes
A21: 13 | B21: 3 | C21: 18 | D21: 4 | E21: 2 | F21: 2 | I21: Yes
A22: 14 | B22: 5 | C22: 2 | D22: 6 | E22: 2 | F22: 2 | G22: 1 | I22: Yes
A23: 15 | B23: 3 | C23: 14 | D23: 5 | E23: 1 | F23: 2
A24: 16 | B24: 4 | C24: 8 | D24: 5 | E24: 2 | F24: 2 | I24: Yes
A25: 17 | B25: 4 | C25: 12 | D25: 7 | E25: 0 | F25: 2 | H25: 1
A26: 18 | B26: 4 | C26: 4 | D26: 5 | E26: 2 | F26: 2 | I26: Yes
A27: Totals | B27: =IF(B2="","",SUM(B9:B26)) -> 72 | D27: =IF(B2="","",SUM(D9:D26)) -> 105 | E27: =IF(B2="","",SUM(E9:E26)) -> 21 | F27: =IF(B2="","",SUM(F9:F26)) -> 36 | G27: =IF(B2="","",SUM(G9:G26)) -> 5 | H27: =IF(B2="","",SUM(H9:H26)) -> 2 | I27: =IF(COUNTIF(I9:I26,"=Yes")=0,"",COUNTIF(I9:I26,"=Yes")) -> 8