A1: Ian Edwards
A2: Club | B2: Porters Park
A3: Par/SS | B3: 70/70 | D3: Num. Of Fairways | I3: =IF(B2="","",18-(COUNTIF(B9:B26,3))) -> 14
A4: Date | B4: 37933 | D4: Playing Handicap | I4: 14.5
A5: Event Place | B5: 2 | D5: Prize Money | G5: 2500
A6: Game Stats | B6: DB+ | C6: DB | D6: Bi | E6: P | F6: B | G6: E | H6: A | I6: H1
B7: 5 | C7: 4 | D7: 5 | E7: 4 | F7: 0 | G7: 0 | H7: 0 | I7: 0
A8: Hole No | B8: Par | C8: Stroke Index | D8: Gross Score | E8: Points | F8: Putts | G8: Fairways | H8: Ferrets | I8: Green Regulation
A9: 1 | B9: 4 | C9: 17 | D9: 7 | E9: 0 | F9: 1
A10: 2 | B10: 4 | C10: 11 | D10: 5 | E10: 2 | F10: 2 | I10: Yes
A11: 3 | B11: 4 | C11: 3 | D11: 7 | E11: 0 | F11: 2
A12: 4 | B12: 4 | C12: 1 | D12: 6 | E12: 1 | F12: 3 | I12: Yes
A13: 5 | B13: 4 | C13: 9 | D13: 5 | E13: 2 | F13: 3 | G13: 1 | I13: Yes
A14: 6 | B14: 3 | C14: 13 | D14: 6 | E14: 0 | F14: 2
A15: 7 | B15: 4 | C15: 7 | D15: 7 | E15: 0 | F15: 3 | H15: 1
A16: 8 | B16: 4 | C16: 5 | D16: 6 | E16: 1 | F16: 2
A17: 9 | B17: 3 | C17: 15 | D17: 4 | E17: 2 | F17: 2 | I17: Yes
A18: 10 | B18: 5 | C18: 12 | D18: 7 | E18: 1 | F18: 2
A19: 11 | B19: 4 | C19: 2 | D19: 6 | E19: 1 | F19: 2 | G19: 1
A20: 12 | B20: 3 | C20: 8 | D20: 4 | E20: 2 | F20: 1
A21: 13 | B21: 5 | C21: 4 | D21: 5 | E21: 3 | F21: 2 | G21: 1 | I21: Yes
A22: 14 | B22: 3 | C22: 16 | D22: 3 | E22: 2 | F22: 2 | I22: Yes
A23: 15 | B23: 4 | C23: 18 | D23: 4 | E23: 2 | F23: 2 | I23: Yes
A24: 16 | B24: 4 | C24: 6 | D24: 7 | E24: 0 | F24: 3
A25: 17 | B25: 4 | C25: 14 | D25: 4 | E25: 3 | F25: 2 | I25: Yes
A26: 18 | B26: 4 | C26: 10 | D26: 5 | E26: 2 | F26: 3 | I26: Yes
A27: Totals | B27: =IF(B2="","",SUM(B9:B26)) -> 70 | D27: =IF(B2="","",SUM(D9:D26)) -> 98 | E27: =IF(B2="","",SUM(E9:E26)) -> 24 | F27: =IF(B2="","",SUM(F9:F26)) -> 39 | G27: =IF(B2="","",SUM(G9:G26)) -> 3 | H27: =IF(B2="","",SUM(H9:H26)) -> 1 | I27: =IF(COUNTIF(I9:I26,"=Yes")=0,"",COUNTIF(I9:I26,"=Yes")) -> 9