A1: Jeff Colbrook
A2: Club | B2: Vila Sol, 10-27
A3: Par/SS | B3: 72/70 | D3: Num. Of Fairways | I3: =IF(B2="","",18-(COUNTIF(B9:B26,3))) -> 14
A4: Date | B4: 37955 | D4: Playing Handicap | I4: 16.9
A5: Event Place | B5: 2 | D5: Prize Money | G5: 15000
A6: Game Stats | B6: DB+ | C6: DB | D6: Bi | E6: P | F6: B | G6: E | H6: A | I6: H1
B7: 3 | C7: 3 | D7: 9 | E7: 3 | F7: 0 | G7: 0 | H7: 0 | I7: 0
A8: Hole No | B8: Par | C8: Stroke Index | D8: Gross Score | E8: Points | F8: Putts | G8: Fairways | H8: Ferrets | I8: Green Regulation
A9: 19 | B9: 5 | C9: 6 | D9: 6 | E9: 2 | F9: 2 | G9: 1 | I9: Yes
A10: 20 | B10: 3 | C10: 16 | D10: 3 | E10: 3 | F10: 2 | I10: Yes
A11: 21 | B11: 4 | C11: 8 | D11: 5 | E11: 2 | F11: 2 | G11: 1 | I11: Yes
A12: 22 | B12: 4 | C12: 12 | D12: 6 | E12: 1 | F12: 2 | H12: 1
A13: 23 | B13: 5 | C13: 2 | D13: 6 | E13: 2 | F13: 2 | I13: Yes
A14: 24 | B14: 4 | C14: 14 | D14: 5 | E14: 2 | F14: 2 | G14: 1 | I14: Yes
A15: 25 | B15: 3 | C15: 18 | D15: 4 | E15: 1 | F15: 3 | I15: Yes
A16: 26 | B16: 4 | C16: 4 | D16: 10 | E16: 0 | F16: 3
A17: 27 | B17: 4 | C17: 10 | D17: 6 | E17: 1 | F17: 2 | G17: 1
A18: 10 | B18: 4 | C18: 9 | D18: 10 | E18: 0 | F18: 3 | H18: 1
A19: 11 | B19: 5 | C19: 15 | D19: 7 | E19: 1 | F19: 2
A20: 12 | B20: 4 | C20: 5 | D20: 4 | E20: 3 | F20: 2 | G20: 1 | I20: Yes
A21: 13 | B21: 3 | C21: 17 | D21: 4 | E21: 2 | F21: 2 | I21: Yes
A22: 14 | B22: 5 | C22: 1 | D22: 6 | E22: 2 | F22: 2 | G22: 1 | I22: Yes
A23: 15 | B23: 3 | C23: 13 | D23: 3 | E23: 3 | F23: 1 | I23: Yes
A24: 16 | B24: 4 | C24: 7 | D24: 5 | E24: 2 | F24: 2 | I24: Yes
A25: 17 | B25: 4 | C25: 11 | D25: 7 | E25: 0 | F25: 3 | G25: 1
A26: 18 | B26: 4 | C26: 3 | D26: 5 | E26: 2 | F26: 1 | G26: 1
A27: Totals | B27: =IF(B2="","",SUM(B9:B26)) -> 72 | D27: =IF(B2="","",SUM(D9:D26)) -> 102 | E27: =IF(B2="","",SUM(E9:E26)) -> 29 | F27: =IF(B2="","",SUM(F9:F26)) -> 38 | G27: =IF(B2="","",SUM(G9:G26)) -> 8 | H27: =IF(B2="","",SUM(H9:H26)) -> 2 | I27: =IF(COUNTIF(I9:I26,"=Yes")=0,"",COUNTIF(I9:I26,"=Yes")) -> 11