A1: Martin Bould
A2: Club | B2: Vila Sol, 10-27
A3: Par/SS | B3: 72/70 | D3: Num. Of Fairways | I3: =IF(B2="","",18-(COUNTIF(B9:B26,3))) -> 14
A4: Date | B4: 37955 | D4: Playing Handicap | I4: 17.3
A5: Event Place | B5: 4 | D5: Prize Money | G5: 8750
A6: Game Stats | B6: DB+ | C6: DB | D6: Bi | E6: P | F6: B | G6: E | H6: A | I6: H1
B7: 4 | C7: 4 | D7: 7 | E7: 3 | F7: 0 | G7: 0 | H7: 0 | I7: 0
A8: Hole No | B8: Par | C8: Stroke Index | D8: Gross Score | E8: Points | F8: Putts | G8: Fairways | H8: Ferrets | I8: Green Regulation
A9: 19 | B9: 5 | C9: 6 | D9: 7 | E9: 1 | F9: 3 | G9: 1 | I9: Yes
A10: 20 | B10: 3 | C10: 16 | D10: 4 | E10: 2 | F10: 2 | I10: Yes
A11: 21 | B11: 4 | C11: 8 | D11: 10 | E11: 0 | F11: 3
A12: 22 | B12: 4 | C12: 12 | D12: 5 | E12: 2 | F12: 2 | G12: 1 | I12: Yes
A13: 23 | B13: 5 | C13: 2 | D13: 7 | E13: 1 | F13: 2
A14: 24 | B14: 4 | C14: 14 | D14: 4 | E14: 3 | F14: 1 | G14: 1 | I14: Yes
A15: 25 | B15: 3 | C15: 18 | D15: 3 | E15: 2 | F15: 2 | I15: Yes
A16: 26 | B16: 4 | C16: 4 | D16: 8 | E16: 0 | F16: 3 | H16: 1
A17: 27 | B17: 4 | C17: 10 | D17: 5 | E17: 2 | F17: 2 | G17: 1 | I17: Yes
A18: 10 | B18: 4 | C18: 9 | D18: 5 | E18: 2 | F18: 2 | I18: Yes
A19: 11 | B19: 5 | C19: 15 | D19: 6 | E19: 2 | F19: 2 | I19: Yes
A20: 12 | B20: 4 | C20: 5 | D20: 10 | E20: 0 | F20: 2
A21: 13 | B21: 3 | C21: 17 | D21: 3 | E21: 3 | F21: 1 | I21: Yes
A22: 14 | B22: 5 | C22: 1 | D22: 6 | E22: 2 | F22: 2 | G22: 1 | I22: Yes
A23: 15 | B23: 3 | C23: 13 | D23: 10 | E23: 0 | F23: 3
A24: 16 | B24: 4 | C24: 7 | D24: 6 | E24: 1 | F24: 2 | G24: 1
A25: 17 | B25: 4 | C25: 11 | D25: 6 | E25: 1 | F25: 2
A26: 18 | B26: 4 | C26: 3 | D26: 5 | E26: 2 | F26: 2 | G26: 1 | I26: Yes
A27: Totals | B27: =IF(B2="","",SUM(B9:B26)) -> 72 | D27: =IF(B2="","",SUM(D9:D26)) -> 110 | E27: =IF(B2="","",SUM(E9:E26)) -> 26 | F27: =IF(B2="","",SUM(F9:F26)) -> 38 | G27: =IF(B2="","",SUM(G9:G26)) -> 7 | H27: =IF(B2="","",SUM(H9:H26)) -> 1 | I27: =IF(COUNTIF(I9:I26,"=Yes")=0,"",COUNTIF(I9:I26,"=Yes")) -> 11