A1: Martin Cox
A2: Club | B2: Vila Sol, 10-27
A3: Par/SS | B3: 72/70 | D3: Num. Of Fairways | I3: =IF(B2="","",18-(COUNTIF(B9:B26,3))) -> 14
A4: Date | B4: 37955 | D4: Playing Handicap | I4: 10.4
A5: Event Place | B5: 6 | D5: Prize Money | G5: 5000
A6: Game Stats | B6: DB+ | C6: DB | D6: BI | E6: P | F6: B | G6: E | H6: A | I6: H1
B7: 4 | C7: 2 | D7: 7 | E7: 5 | F7: 0 | G7: 0 | H7: 0 | I7: 0
A8: Hole No | B8: Par | C8: Stroke Index | D8: Gross Score | E8: Points | F8: Putts | G8: Fairways | H8: Ferrets | I8: Green Regulation
A9: 19 | B9: 5 | C9: 6 | D9: 9 | E9: 0 | F9: 3
A10: 20 | B10: 3 | C10: 16 | D10: 4 | E10: 1 | F10: 2
A11: 21 | B11: 4 | C11: 8 | D11: 5 | E11: 2 | F11: 2 | G11: 1 | I11: Yes
A12: 22 | B12: 4 | C12: 12 | D12: 5 | E12: 1 | F12: 2
A13: 23 | B13: 5 | C13: 2 | D13: 6 | E13: 2 | F13: 1
A14: 24 | B14: 4 | C14: 14 | D14: 7 | E14: 0 | F14: 3
A15: 25 | B15: 3 | C15: 18 | D15: 4 | E15: 1 | F15: 2
A16: 26 | B16: 4 | C16: 4 | D16: 7 | E16: 0 | F16: 2 | H16: 1
A17: 27 | B17: 4 | C17: 10 | D17: 6 | E17: 1 | F17: 2 | G17: 1
A18: 10 | B18: 4 | C18: 9 | D18: 7 | E18: 0 | F18: 3 | G18: 1
A19: 11 | B19: 5 | C19: 15 | D19: 6 | E19: 1 | F19: 1 | G19: 1
A20: 12 | B20: 4 | C20: 5 | D20: 5 | E20: 2 | F20: 2 | I20: Yes
A21: 13 | B21: 3 | C21: 17 | D21: 3 | E21: 2 | F21: 2 | I21: Yes
A22: 14 | B22: 5 | C22: 1 | D22: 5 | E22: 3 | F22: 2 | G22: 1 | I22: Yes
A23: 15 | B23: 3 | C23: 13 | D23: 3 | E23: 2 | F23: 1
A24: 16 | B24: 4 | C24: 7 | D24: 4 | E24: 3 | F24: 2 | G24: 1 | I24: Yes
A25: 17 | B25: 4 | C25: 11 | D25: 4 | E25: 2 | F25: 1
A26: 18 | B26: 4 | C26: 3 | D26: 6 | E26: 1 | F26: 2
A27: Totals | B27: =IF(B2="","",SUM(B9:B26)) -> 72 | D27: =IF(B2="","",SUM(D9:D26)) -> 96 | E27: =IF(B2="","",SUM(E9:E26)) -> 24 | F27: =IF(B2="","",SUM(F9:F26)) -> 35 | G27: =IF(B2="","",SUM(G9:G26)) -> 6 | H27: =IF(B2="","",SUM(H9:H26)) -> 1 | I27: =IF(COUNTIF(I9:I26,"=Yes")=0,"",COUNTIF(I9:I26,"=Yes")) -> 5