A1: Martin Cox
A2: Club | B2: Vila Sol 1-18
A3: Par/SS | B3: 72/72 | D3: Num. Of Fairways | I3: =IF(B2="","",18-(COUNTIF(B9:B26,3))) -> 14
A4: Date | B4: 37955 | D4: Playing Handicap | I4: 10.2
A5: Event Place | B5: 1 | D5: Prize Money | G5: 17500
A6: Game Stats | B6: DB+ | C6: DB | D6: Bi | E6: P | F6: B | G6: E | H6: A | I6: H1
B7: 1 | C7: 7 | D7: 3 | E7: 7 | F7: 0 | G7: 0 | H7: 0 | I7: 0
A8: Hole No | B8: Par | C8: Stroke Index | D8: Gross Score | E8: Points | F8: Putts | G8: Fairways | H8: Ferrets | I8: Green Regulation
A9: 1 | B9: 4 | C9: 3 | D9: 4 | E9: 3 | F9: 1 | I9: Yes
A10: 2 | B10: 4 | C10: 7 | D10: 5 | E10: 2 | F10: 2 | I10: Yes
A11: 3 | B11: 4 | C11: 1 | D11: 4 | E11: 3 | F11: 2 | G11: 1 | I11: Yes
A12: 4 | B12: 3 | C12: 15 | D12: 5 | E12: 0 | F12: 2
A13: 5 | B13: 4 | C13: 11 | D13: 4 | E13: 2 | F13: 2 | I13: Yes
A14: 6 | B14: 5 | C14: 9 | D14: 5 | E14: 3 | F14: 1 | I14: Yes
A15: 7 | B15: 3 | C15: 13 | D15: 6 | E15: 0 | F15: 3
A16: 8 | B16: 5 | C16: 5 | D16: 6 | E16: 2 | F16: 2 | G16: 1 | I16: Yes
A17: 9 | B17: 4 | C17: 17 | D17: 4 | E17: 2 | F17: 2 | G17: 1 | I17: Yes
A18: 10 | B18: 4 | C18: 10 | D18: 4 | E18: 3 | F18: 1 | G18: 1 | I18: Yes
A19: 11 | B19: 5 | C19: 16 | D19: 7 | E19: 0 | F19: 2
A20: 12 | B20: 4 | C20: 6 | D20: 5 | E20: 2 | F20: 2 | G20: 1 | I20: Yes
A21: 13 | B21: 3 | C21: 18 | D21: 5 | E21: 0 | F21: 2
A22: 14 | B22: 5 | C22: 2 | D22: 7 | E22: 1 | F22: 3 | G22: 1 | I22: Yes
A23: 15 | B23: 3 | C23: 14 | D23: 5 | E23: 0 | F23: 2
A24: 16 | B24: 4 | C24: 8 | D24: 6 | E24: 1 | F24: 2
A25: 17 | B25: 4 | C25: 12 | D25: 6 | E25: 0 | F25: 2 | G25: 1
A26: 18 | B26: 4 | C26: 4 | D26: 4 | E26: 3 | F26: 2 | G26: 1 | I26: Yes
A27: Totals | B27: =IF(B2="","",SUM(B9:B26)) -> 72 | D27: =IF(B2="","",SUM(D9:D26)) -> 92 | E27: =IF(B2="","",SUM(E9:E26)) -> 27 | F27: =IF(B2="","",SUM(F9:F26)) -> 35 | G27: =IF(B2="","",SUM(G9:G26)) -> 8 | H27: =IF(B2="","",SUM(H9:H26)) -> 0 | I27: =IF(COUNTIF(I9:I26,"=Yes")=0,"",COUNTIF(I9:I26,"=Yes")) -> 11