A1: Paul Baldwin
A2: Club | B2: Vila Sol, 10-27
A3: Par/SS | B3: 72/70 | D3: Num. Of Fairways | I3: =IF(B2="","",18-(COUNTIF(B9:B26,3))) -> 14
A4: Date | B4: 37955 | D4: Playing Handicap | I4: 17.500000000001005
A5: Event Place | B5: 3 | D5: Prize Money | G5: 12500
A6: Game Stats | B6: DB+ | C6: DB | D6: BI | E6: P | F6: B | G6: E | H6: A | I6: H1
B7: 3 | C7: 5 | D7: 7 | E7: 3 | F7: 0 | G7: 0 | H7: 0 | I7: 0
A8: Hole No | B8: Par | C8: Stroke Index | D8: Gross Score | E8: Points | F8: Putts | G8: Fairways | H8: Ferrets | I8: Green Regulation
A9: 19 | B9: 5 | C9: 6 | D9: 7 | E9: 1 | F9: 2
A10: 20 | B10: 3 | C10: 16 | D10: 5 | E10: 1 | F10: 2
A11: 21 | B11: 4 | C11: 8 | D11: 4 | E11: 3 | F11: 1 | I11: Yes
A12: 22 | B12: 4 | C12: 12 | D12: 7 | E12: 0 | F12: 2 | H12: 1
A13: 23 | B13: 5 | C13: 2 | D13: 6 | E13: 2 | F13: 2 | G13: 1 | I13: Yes
A14: 24 | B14: 4 | C14: 14 | D14: 7 | E14: 0 | F14: 2
A15: 25 | B15: 3 | C15: 18 | D15: 4 | E15: 2 | F15: 3 | I15: Yes
A16: 26 | B16: 4 | C16: 4 | D16: 5 | E16: 2 | F16: 2 | G16: 1 | I16: Yes
A17: 27 | B17: 4 | C17: 10 | D17: 5 | E17: 2 | F17: 3 | G17: 1 | I17: Yes
A18: 10 | B18: 4 | C18: 9 | D18: 4 | E18: 3 | F18: 1 | I18: Yes
A19: 11 | B19: 5 | C19: 15 | D19: 6 | E19: 2 | F19: 2 | G19: 1 | I19: Yes
A20: 12 | B20: 4 | C20: 5 | D20: 4 | E20: 3 | F20: 2 | G20: 1 | I20: Yes
A21: 13 | B21: 3 | C21: 17 | D21: 4 | E21: 2 | F21: 2 | I21: Yes
A22: 14 | B22: 5 | C22: 1 | D22: 10 | E22: 0 | F22: 3 | G22: 1 | H22: 2
A23: 15 | B23: 3 | C23: 13 | D23: 5 | E23: 1 | F23: 2
A24: 16 | B24: 4 | C24: 7 | D24: 6 | E24: 1 | F24: 2 | G24: 1
A25: 17 | B25: 4 | C25: 11 | D25: 5 | E25: 2 | F25: 2 | I25: Yes
A26: 18 | B26: 4 | C26: 3 | D26: 6 | E26: 1 | F26: 2
A27: Totals | B27: =IF(B2="","",SUM(B9:B26)) -> 72 | D27: =IF(B2="","",SUM(D9:D26)) -> 100 | E27: =IF(B2="","",SUM(E9:E26)) -> 28 | F27: =IF(B2="","",SUM(F9:F26)) -> 37 | G27: =IF(B2="","",SUM(G9:G26)) -> 7 | H27: =IF(B2="","",SUM(H9:H26)) -> 3 | I27: =IF(COUNTIF(I9:I26,"=Yes")=0,"",COUNTIF(I9:I26,"=Yes")) -> 10