A1: Alan Hopkins
A2: Club | B2: Hoebridge
A3: Par/SS | B3: 71/70 | D3: Num. Of Fairways | I3: =IF(B2="","",18-(COUNTIF(B9:B26,3))) -> 13
A4: Date | B4: 39095 | D4: Playing Handicap | I4: 7.1
A5: Event Place | B5: 2 | D5: Prize Money | G5: 8750
A6: Game Stats | B6: DB+ | C6: DB | D6: BI | E6: P | F6: B | G6: E | H6: A | I6: H1
B7: 0 | C7: 1 | D7: 8 | E7: 8 | F7: 1 | G7: 0 | H7: 0 | I7: 0
A8: Hole No | B8: Par | C8: Stroke Index | D8: Gross Score | E8: Points | F8: Putts | G8: Fairways | H8: Ferrets | I8: Green Regulation
A9: 1 | B9: 5 | C9: 11 | D9: 6 | E9: 1 | F9: 2
A10: 2 | B10: 3 | C10: 17 | D10: 4 | E10: 1 | F10: 2
A11: 3 | B11: 4 | C11: 7 | D11: 5 | E11: 2 | F11: 2 | I11: Yes
A12: 4 | B12: 4 | C12: 1 | D12: 5 | E12: 2 | F12: 2 | I12: Yes
A13: 5 | B13: 4 | C13: 5 | D13: 4 | E13: 3 | F13: 2 | G13: 1 | I13: Yes
A14: 6 | B14: 3 | C14: 15 | D14: 4 | E14: 1 | F14: 2
A15: 7 | B15: 4 | C15: 3 | D15: 6 | E15: 1 | F15: 3 | I15: Yes
A16: 8 | B16: 4 | C16: 9 | D16: 5 | E16: 1 | F16: 2
A17: 9 | B17: 5 | C17: 13 | D17: 5 | E17: 2 | F17: 1 | G17: 1
A18: 10 | B18: 4 | C18: 12 | D18: 4 | E18: 2 | F18: 2 | I18: Yes
A19: 11 | B19: 4 | C19: 4 | D19: 3 | E19: 4 | F19: 1 | G19: 1 | I19: Yes
A20: 12 | B20: 3 | C20: 18 | D20: 3 | E20: 2 | F20: 2 | I20: Yes
A21: 13 | B21: 5 | C21: 8 | D21: 5 | E21: 2 | F21: 2 | G21: 1 | I21: Yes
A22: 14 | B22: 4 | C22: 14 | D22: 4 | E22: 2 | F22: 2 | G22: 1 | I22: Yes
A23: 15 | B23: 4 | C23: 2 | D23: 5 | E23: 2 | F23: 2 | G23: 1 | I23: Yes
A24: 16 | B24: 3 | C24: 10 | D24: 4 | E24: 1 | F24: 2
A25: 17 | B25: 5 | C25: 6 | D25: 5 | E25: 3 | F25: 2 | G25: 1 | I25: Yes
A26: 18 | B26: 3 | C26: 16 | D26: 3 | E26: 2 | F26: 2 | I26: Yes
A27: Totals | B27: =IF(B2="","",SUM(B9:B26)) -> 71 | D27: =IF(B2="","",SUM(D9:D26)) -> 80 | E27: =IF(B2="","",SUM(E9:E26)) -> 34 | F27: =IF(B2="","",SUM(F9:F26)) -> 35 | G27: =IF(B2="","",SUM(G9:G26)) -> 7 | H27: =IF(B2="","",SUM(H9:H26)) -> 0 | I27: =IF(COUNTIF(I9:I26,"=Yes")=0,"",COUNTIF(I9:I26,"=Yes")) -> 12