A1: Season 2 - April 1st 2000 to 31st March 2001
A2: MGA World Tour Driving Accuracy (Fairways Hit)
B3: Statistics updated | C3: =TODAY() -> 36962
A4: Pos | B4: Player | C4: Original Handicap | D4: Current Handicap | E4: Playing Handicap | F4: Played | G4: Total Number of Fairways | H4: Total Fairways Hit | I4: Fairway %
A5: 1 | B5: Kevin Gallagher | C5: 11.6 | D5: 9.4 | E5: =D5 -> 9.4 | F5: 40 | G5: 528 | H5: 303 | I5: =IF(F5=0,0,ROUND((H5/G5)*100,2) &" %") -> 57.39 %
A6: =A5+1 -> 2 | B6: Martin Cox | C6: 14.1 | D6: 10.2 | E6: =D6 -> 10.2 | F6: 35 | G6: 479 | H6: 264 | I6: =IF(F6=0,0,ROUND((H6/G6)*100,2) &" %") -> 55.11 %
A7: =A6+1 -> 3 | B7: Robert Thompson | C7: 10.6 | D7: 7.6 | E7: =D7 -> 7.6 | F7: 54 | G7: 726 | H7: 393 | I7: =IF(F7=0,0,ROUND((H7/G7)*100,2) &" %") -> 54.13 %
A8: =A7+1 -> 4 | B8: Jeff Gibbons | C8: 25.1 | D8: 15.7 | E8: =D8 -> 15.7 | F8: 39 | G8: 545 | H8: 285 | I8: =IF(F8=0,0,ROUND((H8/G8)*100,2) &" %") -> 52.29 %
A9: =A8+1 -> 5 | B9: Paul Baldwin | C9: 20.0 | D9: 20.0 | E9: =D9 -> 20 | F9: 9 | G9: 126 | H9: 59 | I9: =IF(F9=0,0,ROUND((H9/G9)*100,2) &" %") -> 46.83 %
A10: =A9+1 -> 6 | B10: Keith Mendelson | C10: 14.5 | D10: 11.1 | E10: =D10 -> 11.1 | F10: 43 | G10: 600 | H10: 280 | I10: =IF(F10=0,0,ROUND((H10/G10)*100,2) &" %") -> 46.67 %
A11: =A10+1 -> 7 | B11: John Press | C11: 18.6 | D11: 12.9 | E11: =D11 -> 12.9 | F11: 16 | G11: 219 | H11: 96 | I11: =IF(F11=0,0,ROUND((H11/G11)*100,2) &" %") -> 43.84 %
A12: =A11+1 -> 8 | B12: Chris Manning | C12: 22.1 | D12: 22.4 | E12: =D12 -> 22.4 | F12: 11 | G12: 154 | H12: 66 | I12: =IF(F12=0,0,ROUND((H12/G12)*100,2) &" %") -> 42.86 %
A13: =A12+1 -> 9 | B13: Steve Tilling | C13: 20.2 | D13: 20.3 | E13: =D13 -> 20.3 | F13: 10 | G13: 141 | H13: 60 | I13: =IF(F13=0,0,ROUND((H13/G13)*100,2) &" %") -> 42.55 %
A14: =A13+1 -> 10 | B14: Paul Carter | C14: 16.9 | D14: 14.5 | E14: =D14 -> 14.5 | F14: 20 | G14: 274 | H14: 116 | I14: =IF(F14=0,0,ROUND((H14/G14)*100,2) &" %") -> 42.34 %
A15: =A14+1 -> 11 | B15: Malcolm Rouse | C15: 36.0 | D15: 38.1 | E15: =D15 -> 38.1 | F15: 5 | G15: 70 | H15: 29 | I15: =IF(F15=0,0,ROUND((H15/G15)*100,2) &" %") -> 41.43 %
A16: =A15+1 -> 12 | B16: Alan Baldwin | C16: 25.3 | D16: 22.8 | E16: =D16 -> 22.8 | F16: 6 | G16: 75 | H16: 31 | I16: =IF(F16=0,0,ROUND((H16/G16)*100,2) &" %") -> 41.33 %
A17: =A16+1 -> 13 | B17: Simon Thompson | C17: 16.9 | D17: 16.3 | E17: =D17 -> 16.3 | F17: 24 | G17: 320 | H17: 132 | I17: =IF(F17=0,0,ROUND((H17/G17)*100,2) &" %") -> 41.25 %
A18: =A17+1 -> 14 | B18: Andrew Baldwin | C18: 17.4 | D18: 16.4 | E18: =D18 -> 16.4 | F18: 42 | G18: 579 | H18: 210 | I18: =IF(F18=0,"0 %",ROUND((H18/G18)*100,2) &" %") -> 36.27 %
A19: =A18+1 -> 15 | B19: Ian Edwards | C19: 15.0 | D19: 14.6 | E19: =D19 -> 14.6 | F19: 6 | G19: 84 | H19: 30 | I19: =IF(F19=0,0,ROUND((H19/G19)*100,2) &" %") -> 35.71 %
A20: =A19+1 -> 16 | B20: Alan Hopkins | C20: 7.0 | D20: 7.4 | E20: =D20 -> 7.4 | F20: 5 | G20: 70 | H20: 25 | I20: =IF(F20=0,0,ROUND((H20/G20)*100,2) &" %") -> 35.71 %
A21: =A20+1 -> 17 | B21: Jon Dey | C21: 36.0 | D21: 35.4 | E21: =D21 -> 35.4 | F21: 5 | G21: 70 | H21: 23 | I21: =IF(F21=0,0,ROUND((H21/G21)*100,2) &" %") -> 32.86 %
A22: =A21+1 -> 18 | B22: Roy Dickens | C22: 30.3 | D22: 29.9 | E22: =D22 -> 29.9 | F22: 14 | G22: 192 | H22: 58 | I22: =IF(F22=0,0,ROUND((H22/G22)*100,2) &" %") -> 30.21 %
A23: =A22+1 -> 19 | B23: Dave Andrews | C23: 32.9 | D23: 31.9 | E23: =D23 -> 31.9 | F23: 13 | G23: 173 | H23: 49 | I23: =IF(F23=0,0,ROUND((H23/G23)*100,2) &" %") -> 28.32 %
A24: =A23+1 -> 20 | B24: Dave Rouse | C24: 22.0 | D24: 23.5 | E24: =D24 -> 23.5 | F24: 39 | G24: 542 | H24: 153 | I24: =IF(F24=0,0,ROUND((H24/G24)*100,2) &" %") -> 28.23 %
A25: =A24+1 -> 21 | B25: Dave White | C25: 20.1 | D25: 20.2 | E25: =D25 -> 20.2 | F25: 1 | G25: 14 | H25: 9 | I25: =IF(F25=0,0,ROUND((H25/G25)*100,2) &" %") -> 64.29 %
A26: =A25+1 -> 22 | B26: Andy Benson | C26: 8.9 | D26: 9.2 | E26: =D26 -> 9.2 | F26: 4 | G26: 56 | H26: 27 | I26: =IF(F26=0,0,ROUND((H26/G26)*100,2) &" %") -> 48.21 %
A27: =A26+1 -> 23 | B27: Neil Leah | C27: 17.0 | D27: 17.3 | E27: =D27 -> 17.3 | F27: 3 | G27: 42 | H27: 16 | I27: =IF(F27=0,0,ROUND((H27/G27)*100,2) &" %") -> 38.1 %
A28: =A27+1 -> 24 | B28: Mike Edmond | C28: 36.0 | D28: 36.5 | E28: =D28 -> 36.5 | F28: 1 | G28: 14 | H28: 4 | I28: =IF(F28=0,0,ROUND((H28/G28)*100,2) &" %") -> 28.57 %
A29: =A28+1 -> 25 | B29: Dave Archer | C29: 25.0 | E29: =D29 ->  | F29: 0 | G29: 0 | H29: 0 | I29: =IF(F29=0,"0 %",ROUND((H29/G29)*100,2) &" %") -> 0 %
A30: =A29+1 -> 26 | B30: Clive Ferris | C30: 25.0 | E30: =D30 ->  | F30: 0 | G30: 0 | H30: 0 | I30: =IF(F30=0,"0 %",ROUND((H30/G30)*100,2) &" %") -> 0 %