A1: Season 2 - April 1st 2000 to 31st March 2001
A2: MGA World Tour Order of Ferret
B3: Statistics updated | C3: =TODAY() -> 36962
A4: Pos | B4: Player | C4: Original Handicap | D4: Current Handicap | E4: Playing Handicap | F4: Played | G4: Total Ferrets | H4: Average per Round | I4: Ferret ratio
A5: 1 | B5: Malcolm Rouse | C5: 36.0 | D5: 38.1 | E5: =D5 -> 38.1 | F5: 5 | G5: 20 | H5: 4.00 | I5: =IF(G5="","",IF(G5=0,"0 : "&F5*18,"1 : "&ROUND(((F5*18)/G5),0))) -> 1 : 5
A6: 2 | B6: Roy Dickens | C6: 30.3 | D6: 29.9 | E6: =D6 -> 29.9 | F6: 14 | G6: 52 | H6: 3.7142857142857144 | I6: =IF(G6="","",IF(G6=0,"0 : "&F6*18,"1 : "&ROUND(((F6*18)/G6),0))) -> 1 : 5
A7: 3 | B7: Ian Edwards | C7: 15.0 | D7: 14.6 | E7: =D7 -> 14.6 | F7: 6 | G7: 15 | H7: 2.50 | I7: =IF(G7="","",IF(G7=0,"0 : "&F7*18,"1 : "&ROUND(((F7*18)/G7),0))) -> 1 : 7
A8: 4 | B8: Chris Manning | C8: 22.1 | D8: 22.4 | E8: =D8 -> 22.4 | F8: 11 | G8: 23 | H8: 2.0909090909090908 | I8: =IF(G8="","",IF(G8=0,"0 : "&F8*18,"1 : "&ROUND(((F8*18)/G8),0))) -> 1 : 9
A9: 5 | B9: Dave Rouse | C9: 22.0 | D9: 23.5 | E9: =D9 -> 23.5 | F9: 39 | G9: 78 | H9: 2.00 | I9: =IF(G9="","",IF(G9=0,"0 : "&F9*18,"1 : "&ROUND(((F9*18)/G9),0))) -> 1 : 9
A10: 6 | B10: Paul Baldwin | C10: 20.0 | D10: 20.0 | E10: =D10 -> 20 | F10: 9 | G10: 17 | H10: 1.8888888888888888 | I10: =IF(G10="","",IF(G10=0,"0 : "&F10*18,"1 : "&ROUND(((F10*18)/G10),0))) -> 1 : 10
A11: 7 | B11: Jon Dey | C11: 36.0 | D11: 35.4 | E11: =D11 -> 35.4 | F11: 5 | G11: 9 | H11: 1.80 | I11: =IF(G11="","",IF(G11=0,"0 : "&F11*18,"1 : "&ROUND(((F11*18)/G11),0))) -> 1 : 10
A12: 8 | B12: Dave Andrews | C12: 32.9 | D12: 31.9 | E12: =D12 -> 31.9 | F12: 13 | G12: 23 | H12: 1.7692307692307692 | I12: =IF(G12="","",IF(G12=0,"0 : "&F12*18,"1 : "&ROUND(((F12*18)/G12),0))) -> 1 : 10
A13: 9 | B13: Andrew Baldwin | C13: 17.4 | D13: 16.4 | E13: =D13 -> 16.4 | F13: 42 | G13: 70 | H13: 1.6666666666666667 | I13: =IF(G13="","",IF(G13=0,"0 : "&F13*18,"1 : "&ROUND(((F13*18)/G13),0))) -> 1 : 11
A14: 10 | B14: Steve Tilling | C14: 20.2 | D14: 20.3 | E14: =D14 -> 20.3 | F14: 10 | G14: 15 | H14: 1.50 | I14: =IF(G14="","",IF(G14=0,"0 : "&F14*18,"1 : "&ROUND(((F14*18)/G14),0))) -> 1 : 12
A15: 11 | B15: Paul Carter | C15: 16.9 | D15: 14.5 | E15: =D15 -> 14.5 | F15: 20 | G15: 27 | H15: 1.35 | I15: =IF(G15="","",IF(G15=0,"0 : "&F15*18,"1 : "&ROUND(((F15*18)/G15),0))) -> 1 : 13
A16: 12 | B16: Simon Thompson | C16: 16.9 | D16: 16.3 | E16: =D16 -> 16.3 | F16: 24 | G16: 32 | H16: 1.3333333333333333 | I16: =IF(G16="","",IF(G16=0,"0 : "&F16*18,"1 : "&ROUND(((F16*18)/G16),0))) -> 1 : 14
A17: 13 | B17: Alan Baldwin | C17: 25.3 | D17: 22.8 | E17: =D17 -> 22.8 | F17: 6 | G17: 7 | H17: 1.1666666666666667 | I17: =IF(G17="","",IF(G17=0,"0 : "&F17*18,"1 : "&ROUND(((F17*18)/G17),0))) -> 1 : 15
A18: 14 | B18: John Press | C18: 18.6 | D18: 12.9 | E18: =D18 -> 12.9 | F18: 16 | G18: 17 | H18: 1.0625 | I18: =IF(G18="","",IF(G18=0,"0 : "&F18*18,"1 : "&ROUND(((F18*18)/G18),0))) -> 1 : 17
A19: 15 | B19: Martin Cox | C19: 14.1 | D19: 10.2 | E19: =D19 -> 10.2 | F19: 35 | G19: 32 | H19: 0.91428571428571426 | I19: =IF(G19="","",IF(G19=0,"0 : "&F19*18,"1 : "&ROUND(((F19*18)/G19),0))) -> 1 : 20
A20: 16 | B20: Keith Mendelson | C20: 14.5 | D20: 11.1 | E20: =D20 -> 11.1 | F20: 43 | G20: 39 | H20: 0.90697674418604646 | I20: =IF(G20="","",IF(G20=0,"0 : "&F20*18,"1 : "&ROUND(((F20*18)/G20),0))) -> 1 : 20
A21: 17 | B21: Jeff Gibbons | C21: 25.1 | D21: 15.7 | E21: =D21 -> 15.7 | F21: 39 | G21: 33 | H21: 0.84615384615384615 | I21: =IF(G21="","",IF(G21=0,"0 : "&F21*18,"1 : "&ROUND(((F21*18)/G21),0))) -> 1 : 21
A22: 18 | B22: Robert Thompson | C22: 10.6 | D22: 7.6 | E22: =D22 -> 7.6 | F22: 54 | G22: 42 | H22: 0.77777777777777779 | I22: =IF(G22="","",IF(G22=0,"0 : "&F22*18,"1 : "&ROUND(((F22*18)/G22),0))) -> 1 : 23
A23: 19 | B23: Alan Hopkins | C23: 7.0 | D23: 7.4 | E23: =D23 -> 7.4 | F23: 5 | G23: 3 | H23: 00.6 | I23: =IF(G23="","",IF(G23=0,"0 : "&F23*18,"1 : "&ROUND(((F23*18)/G23),0))) -> 1 : 30
A24: 20 | B24: Kevin Gallagher | C24: 11.6 | D24: 9.4 | E24: =D24 -> 9.4 | F24: 40 | G24: 23 | H24: 0.57499999999999996 | I24: =IF(G24="","",IF(G24=0,"0 : "&F24*18,"1 : "&ROUND(((F24*18)/G24),0))) -> 1 : 31
A25: 21 | B25: Mike Edmond | C25: 36.0 | D25: 36.5 | E25: =D25 -> 36.5 | F25: 1 | G25: 5 | H25: 5.00 | I25: =IF(G25="","",IF(G25=0,"0 : "&F25*18,"1 : "&ROUND(((F25*18)/G25),0))) -> 1 : 4
A26: 22 | B26: Andy Benson | C26: 8.9 | D26: 9.2 | E26: =D26 -> 9.2 | F26: 4 | G26: 9 | H26: 2.25 | I26: =IF(G26="","",IF(G26=0,"0 : "&F26*18,"1 : "&ROUND(((F26*18)/G26),0))) -> 1 : 8
A27: 23 | B27: Dave White | C27: 20.1 | D27: 20.2 | E27: =D27 -> 20.2 | F27: 1 | G27: 2 | H27: 2.00 | I27: =IF(G27="","",IF(G27=0,"0 : "&F27*18,"1 : "&ROUND(((F27*18)/G27),0))) -> 1 : 9
A28: 24 | B28: Neil Leah | C28: 17.0 | D28: 17.3 | E28: =D28 -> 17.3 | F28: 3 | G28: 4 | H28: 1.3333333333333333 | I28: =IF(G28="","",IF(G28=0,"0 : "&F28*18,"1 : "&ROUND(((F28*18)/G28),0))) -> 1 : 14
A29: 25 | B29: Clive Ferris | C29: 25.0 | E29: =D29 ->  | F29: 0 | G29: 0 | H29: 0.00 | I29: =IF(G29=0,0,IF(G29=0,"0 : "&F29*18,"1 : "&ROUND(((F29*18)/G29),0))) -> 0
A30: 26 | B30: Dave Archer | C30: 25.0 | E30: =D30 ->  | F30: 0 | G30: 0 | H30: 0.00 | I30: =IF(G30=0,0,IF(G30=0,"0 : "&F30*18,"1 : "&ROUND(((F30*18)/G30),0))) -> 0
B31: Total Ferrets | G31: =SUM(G5:G30) -> 597