A1: Michael Trimmings
A2: Club | B2: Wimbledon Common
A3: Par/SS | B3: 68/66 | D3: Num. Of Fairways | I3: =IF(B2="","",18-(COUNTIF(B9:B26,3))) -> 13
A4: Date | B4: 38617 | D4: Playing Handicap | I4: 21.800000000001003
A5: Event Place | B5: 3 | D5: Prize Money | G5: 2500
A6: Game Stats | B6: DB+ | C6: DB | D6: Bi | E6: P | F6: B | G6: E | H6: A | I6: H1
B7: 11 | C7: 2 | D7: 5 | E7: 0 | F7: 0 | G7: 0 | H7: 0 | I7: 0
A8: Hole No | B8: Par | C8: Stroke Index | D8: Gross Score | E8: Points | F8: Putts | G8: Fairways | H8: Ferrets | I8: Green Regulation
A9: 1 | B9: 3 | C9: 7 | D9: 6 | E9: 0 | F9: 2 | H9: 1
A10: 2 | B10: 4 | C10: 1 | D10: 7 | E10: 1 | F10: 2 | H10: 1
A11: 3 | B11: 4 | C11: 14 | D11: 5 | E11: 2 | F11: 2 | I11: Yes
A12: 4 | B12: 3 | C12: 11 | D12: 6 | E12: 0 | F12: 2 | H12: 1
A13: 5 | B13: 4 | C13: 18 | D13: 6 | E13: 1 | F13: 2
A14: 6 | B14: 4 | C14: 5 | D14: 5 | E14: 2 | F14: 1 | G14: 1
A15: 7 | B15: 4 | C15: 10 | D15: 10 | E15: 0 | F15: 3 | H15: 2
A16: 8 | B16: 3 | C16: 8 | D16: 6 | E16: 0 | F16: 2
A17: 9 | B17: 4 | C17: 16 | D17: 6 | E17: 1 | F17: 1 | H17: 1
A18: 10 | B18: 4 | C18: 15 | D18: 5 | E18: 2 | F18: 2 | G18: 1 | I18: Yes
A19: 11 | B19: 4 | C19: 4 | D19: 10 | E19: 0 | F19: 3 | H19: 1
A20: 12 | B20: 3 | C20: 6 | D20: 6 | E20: 0 | F20: 3
A21: 13 | B21: 4 | C21: 13 | D21: 5 | E21: 2 | F21: 1
A22: 14 | B22: 4 | C22: 2 | D22: 8 | E22: 0 | F22: 2 | H22: 1
A23: 15 | B23: 4 | C23: 12 | D23: 10 | E23: 0 | F23: 3
A24: 16 | B24: 3 | C24: 17 | D24: 4 | E24: 2 | F24: 2 | I24: Yes
A25: 17 | B25: 4 | C25: 9 | D25: 10 | E25: 0 | F25: 3 | H25: 1
A26: 18 | B26: 5 | C26: 3 | D26: 10 | E26: 0 | F26: 3 | H26: 1
A27: Totals | B27: =IF(B2="","",SUM(B9:B26)) -> 68 | D27: =IF(B2="","",SUM(D9:D26)) -> 125 | E27: =IF(B2="","",SUM(E9:E26)) -> 13 | F27: =IF(B2="","",SUM(F9:F26)) -> 39 | G27: =IF(B2="","",SUM(G9:G26)) -> 2 | H27: =IF(B2="","",SUM(H9:H26)) -> 10 | I27: =IF(COUNTIF(I9:I26,"=Yes")=0,"",COUNTIF(I9:I26,"=Yes")) -> 3