A1: Robert Thompson
A2: Club | B2: Wimbledon Common
A3: Par/SS | B3: 68/66 | D3: Num. Of Fairways | I3: =IF(B2="","",18-(COUNTIF(B9:B26,3))) -> 13
A4: Date | B4: 38619 | D4: Playing Handicap | I4: 8.5999999999999925
A5: Event Place | B5: 3 | D5: Prize Money | G5: 2500
A6: Game Stats | B6: DB+ | C6: DB | D6: Bi | E6: P | F6: B | G6: E | H6: A | I6: H1
B7: 4 | C7: 2 | D7: 8 | E7: 4 | F7: 0 | G7: 0 | H7: 0 | I7: 0
A8: Hole No | B8: Par | C8: Stroke Index | D8: Gross Score | E8: Points | F8: Putts | G8: Fairways | H8: Ferrets | I8: Green Regulation
A9: 1 | B9: 3 | C9: 7 | D9: 5 | E9: 1 | F9: 2
A10: 2 | B10: 4 | C10: 1 | D10: 5 | E10: 2 | F10: 2 | G10: 1 | I10: Yes
A11: 3 | B11: 4 | C11: 14 | D11: 5 | E11: 1 | F11: 3 | I11: Yes
A12: 4 | B12: 3 | C12: 11 | D12: 4 | E12: 1 | F12: 2
A13: 5 | B13: 4 | C13: 18 | D13: 5 | E13: 1 | F13: 2 | G13: 1
A14: 6 | B14: 4 | C14: 5 | D14: 4 | E14: 3 | F14: 1 | I14: Yes
A15: 7 | B15: 4 | C15: 10 | D15: 4 | E15: 2 | F15: 1
A16: 8 | B16: 3 | C16: 8 | D16: 4 | E16: 2 | F16: 1
A17: 9 | B17: 4 | C17: 16 | D17: 10 | E17: 0 | F17: 3 | H17: 1
A18: 10 | B18: 4 | C18: 15 | D18: 6 | E18: 0 | F18: 2
A19: 11 | B19: 4 | C19: 4 | D19: 4 | E19: 3 | F19: 1 | G19: 1 | I19: Yes
A20: 12 | B20: 3 | C20: 6 | D20: 4 | E20: 2 | F20: 1
A21: 13 | B21: 4 | C21: 13 | D21: 5 | E21: 1 | F21: 3 | I21: Yes
A22: 14 | B22: 4 | C22: 2 | D22: 5 | E22: 2 | F22: 2 | I22: Yes
A23: 15 | B23: 4 | C23: 12 | D23: 8 | E23: 0 | F23: 1
A24: 16 | B24: 3 | C24: 17 | D24: 7 | E24: 0 | F24: 3
A25: 17 | B25: 4 | C25: 9 | D25: 8 | E25: 0 | F25: 1
A26: 18 | B26: 5 | C26: 3 | D26: 5 | E26: 3 | F26: 2 | I26: Yes
A27: Totals | B27: =IF(B2="","",SUM(B9:B26)) -> 68 | D27: =IF(B2="","",SUM(D9:D26)) -> 98 | E27: =IF(B2="","",SUM(E9:E26)) -> 24 | F27: =IF(B2="","",SUM(F9:F26)) -> 33 | G27: =IF(B2="","",SUM(G9:G26)) -> 3 | H27: =IF(B2="","",SUM(H9:H26)) -> 1 | I27: =IF(COUNTIF(I9:I26,"=Yes")=0,"",COUNTIF(I9:I26,"=Yes")) -> 7