A1: Season 8 - April 2nd 2006 to 31st March 2007
A2: MGA World Tour Driving Accuracy (Fairways Hit)
B3: Statistics updated | C3: =TODAY() -> 39174
B4: Player | C4: Original Handicap | D4: Current Handicap | E4: Playing Handicap | F4: Played | G4: Total Number of Fairways | H4: Total Fairways Hit | I4: Fairway %
A5: 1 | B5: Kevin Gallagher | C5: 11.8 | D5: 11.300000000000997 | E5: =D5 -> 11.300000000000997 | F5: 25 | G5: 329 | H5: 186 | I5: =IF(F5=0,"0 %",ROUND((H5/G5)*100,2) &" %") -> 56.53 %
A6: =A5+1 -> 2 | B6: Jeff Gibbons | C6: 20.0 | D6: 20.900000000003015 | E6: =D6 -> 20.900000000003015 | F6: 29 | G6: 407 | H6: 206 | I6: =IF(F6=0,"0 %",ROUND((H6/G6)*100,2) &" %") -> 50.61 %
A7: =A6+1 -> 3 | B7: Robert Thompson | C7: 8.1 | D7: 8.7 | E7: =D7 -> 8.7 | F7: 33 | G7: 443 | H7: 210 | I7: =IF(F7=0,"0 %",ROUND((H7/G7)*100,2) &" %") -> 47.4 %
A8: =A7+1 -> 4 | B8: Keith Mendelson | C8: 15.7 | D8: 14.2 | E8: =D8 -> 14.2 | F8: 34 | G8: 473 | H8: 224 | I8: =IF(F8=0,"0 %",ROUND((H8/G8)*100,2) &" %") -> 47.36 %
A9: =A8+1 -> 5 | B9: Dave Andrews | C9: 17.5 | D9: 17.9 | E9: =D9 -> 17.9 | F9: 17 | G9: 218 | H9: 88 | I9: =IF(F9=0,"0 %",ROUND((H9/G9)*100,2) &" %") -> 40.37 %
A10: =A9+1 -> 6 | B10: Simon Thompson | C10: 11.6 | D10: 13.7 | E10: =D10 -> 13.7 | F10: 11 | G10: 146 | H10: 51 | I10: =IF(F10=0,"0 %",ROUND((H10/G10)*100,2) &" %") -> 34.93 %
A11: =A10+1 -> 7 | B11: Jeff Colbrook | C11: 13.1 | D11: 14.200000000000996 | E11: =D11 -> 14.200000000000996 | F11: 14 | G11: 187 | H11: 61 | I11: =IF(F11=0,"0 %",ROUND((H11/G11)*100,2) &" %") -> 32.62 %
A12: =A11+1 -> 8 | B12: Martin Cox | C12: 12.3 | D12: 12.8 | E12: =D12 -> 12.8 | F12: 4 | G12: 56 | H12: 30 | I12: =IF(F12=0,"0 %",ROUND((H12/G12)*100,2) &" %") -> 53.57 %
A13: =A12+1 -> 9 | B13: Matthew Carter | C13: 20.9 | D13: 21.2 | E13: =D13 -> 21.2 | F13: 8 | G13: 109 | H13: 56 | I13: =IF(F13=0,"0 %",ROUND((H13/G13)*100,2) &" %") -> 51.38 %
A14: =A13+1 -> 10 | B14: Alan Hopkins | C14: 8.4 | D14: 7.1 | E14: =D14 -> 7.1 | F14: 7 | G14: 96 | H14: 43 | I14: =IF(F14=0,"0 %",ROUND((H14/G14)*100,2) &" %") -> 44.79 %
A15: =A14+1 -> 11 | B15: John Press | C15: 14.9 | D15: 13.5 | E15: =D15 -> 13.5 | F15: 3 | G15: 43 | H15: 19 | I15: =IF(F15=0,"0 %",ROUND((H15/G15)*100,2) &" %") -> 44.19 %
A16: =A15+1 -> 12 | B16: Danny Marsh | C16: 8.2 | D16: 8.1 | E16: =D16 -> 8.1 | F16: 3 | G16: 42 | H16: 17 | I16: =IF(F16=0,"0 %",ROUND((H16/G16)*100,2) &" %") -> 40.48 %
A17: =A16+1 -> 13 | B17: Ian Edwards | C17: 15.2 | D17: 15.7 | E17: =D17 -> 15.7 | F17: 2 | G17: 28 | H17: 11 | I17: =IF(F17=0,"0 %",ROUND((H17/G17)*100,2) &" %") -> 39.29 %
A18: =A17+1 -> 14 | B18: Alan Baldwin | C18: 22.6 | D18: 20.300000000001003 | E18: =D18 -> 20.300000000001003 | F18: 3 | G18: 39 | H18: 15 | I18: =IF(F18=0,"0 %",ROUND((H18/G18)*100,2) &" %") -> 38.46 %
A19: =A18+1 -> 15 | B19: Andy Benson | C19: 6.7 | D19: 6.9000000000009996 | E19: =D19 -> 6.9000000000009996 | F19: 3 | G19: 42 | H19: 16 | I19: =IF(F19=0,"0 %",ROUND((H19/G19)*100,2) &" %") -> 38.1 %
A20: =A19+1 -> 16 | B20: Paul Baldwin | C20: 16.9 | D20: 17.4 | E20: =D20 -> 17.4 | F20: 3 | G20: 43 | H20: 16 | I20: =IF(F20=0,"0 %",ROUND((H20/G20)*100,2) &" %") -> 37.21 %
A21: =A20+1 -> 17 | B21: Andrew Baldwin | C21: 17.4 | D21: 17.5 | E21: =D21 -> 17.5 | F21: 6 | G21: 81 | H21: 28 | I21: =IF(F21=0,"0 %",ROUND((H21/G21)*100,2) &" %") -> 34.57 %
A22: =A21+1 -> 18 | B22: Michael Trimmings | C22: 22.6 | D22: 22.2 | E22: =D22 -> 22.2 | F22: 4 | G22: 53 | H22: 18 | I22: =IF(F22=0,"0 %",ROUND((H22/G22)*100,2) &" %") -> 33.96 %
A23: =A22+1 -> 19 | B23: Martin Bould | C23: 20.4 | D23: 19.4 | E23: =D23 -> 19.4 | F23: 7 | G23: 94 | H23: 31 | I23: =IF(F23=0,"0 %",ROUND((H23/G23)*100,2) &" %") -> 32.98 %
A24: =A23+1 -> 20 | B24: Paul Carter | C24: 12.8 | D24: 12.3 | E24: =D24 -> 12.3 | F24: 6 | G24: 83 | H24: 23 | I24: =IF(F24=0,"0 %",ROUND((H24/G24)*100,2) &" %") -> 27.71 %
A25: =A24+1 -> 21 | B25: Dave Rouse | C25: 24.6 | D25: 25.1 | E25: =D25 -> 25.1 | F25: 5 | G25: 70 | H25: 17 | I25: =IF(F25=0,"0 %",ROUND((H25/G25)*100,2) &" %") -> 24.29 %
A26: =A25+1 -> 22 | B26: Simon Owens | C26: 13.0 | D26: 13.2 | E26: =D26 -> 13.2 | F26: 1 | G26: 14 | H26: 3 | I26: =IF(F26=0,"0 %",ROUND((H26/G26)*100,2) &" %") -> 21.43 %
A27: =A26+1 -> 23 | B27: Roy Dickens | C27: 29.6 | D27: 30.000000000001002 | E27: =D27 -> 30.000000000001002 | F27: 6 | G27: 85 | H27: 17 | I27: =IF(F27=0,"0 %",ROUND((H27/G27)*100,2) &" %") -> 20 %
A28: =A27+1 -> 24 | B28: Steve Tilling | C28: 16.5 | D28: 16.5 | E28: =D28 -> 16.5 | F28: 0 | G28: 0 | H28: 0 | I28: =IF(F28=0,"0 %",ROUND((H28/G28)*100,2) &" %") -> 0 %
A29: =A28+1 -> 25 | B29: Neil Leah | C29: 15.0 | D29: 15.0 | E29: =D29 -> 15 | F29: 0 | G29: 0 | H29: 0 | I29: =IF(F29=0,"0 %",ROUND((H29/G29)*100,2) &" %") -> 0 %
A30: =A29+1 -> 26 | B30: Malcolm Rouse | C30: 42.9 | D30: 42.9 | E30: =D30 -> 42.9 | F30: 0 | G30: 0 | H30: 0 | I30: =IF(F30=0,"0 %",ROUND((H30/G30)*100,2) &" %") -> 0 %
A31: =A30+1 -> 27 | B31: Keith Johns | C31: 24.3 | D31: 24.3 | E31: =D31 -> 24.3 | F31: 0 | G31: 0 | H31: 0 | I31: =IF(F31=0,"0 %",ROUND((H31/G31)*100,2) &" %") -> 0 %
A32: =A31+1 -> 28 | B32: Jon Dey | C32: 36.8 | D32: 37.0 | E32: =D32 -> 37 | F32: 1 | G32: 14 | H32: 0 | I32: =IF(F32=0,"0 %",ROUND((H32/G32)*100,2) &" %") -> 0 %
A33: =A32+1 -> 29 | B33: Dave White | C33: 22.1 | D33: 22.1 | E33: =D33 -> 22.1 | F33: 0 | G33: 0 | H33: 0 | I33: =IF(F33=0,"0 %",ROUND((H33/G33)*100,2) &" %") -> 0 %
A34: =A33+1 -> 30 | B34: Clive Ferris | C34: 26.0 | D34: 26.0 | E34: =D34 -> 26 | F34: 0 | G34: 0 | H34: 0 | I34: =IF(F34=0,"0 %",ROUND((H34/G34)*100,2) &" %") -> 0 %
A35: =A34+1 -> 31 | B35: Chris Manning | C35: 22.7 | D35: 22.7 | E35: =D35 -> 22.7 | F35: 0 | G35: 0 | H35: 0 | I35: =IF(F35=0,"0 %",ROUND((H35/G35)*100,2) &" %") -> 0 %
A36: =A35+1 -> 32 | B36: Andrew Knight | C36: 21.4 | D36: 21.4 | E36: =D36 -> 21.4 | F36: 0 | G36: 0 | H36: 0 | I36: =IF(F36=0,"0 %",ROUND((H36/G36)*100,2) &" %") -> 0 %