A1: Season 8 - April 2nd 2006 to 31st March 2007
A2: MGA World Tour Money List
B3: Statistics updated | C3: =TODAY() -> 39174
A4: Pos | B4: Player | C4: Original Handicap | D4: Current Handicap | E4: Playing Handicap | F4: Events Played | G4: Tour Victories | H4: Winnings
A5: 1 | B5: Keith Mendelson | C5: 15.7 | D5: 14.2 | E5: =D5 -> 14.2 | F5: 34 | G5: 20 | H5: 222500
A6: =A5+1 -> 2 | B6: Robert Thompson | C6: 8.1 | D6: 8.7 | E6: =D6 -> 8.7 | F6: 33 | G6: 15 | H6: 212500
A7: =A6+1 -> 3 | B7: Jeff Gibbons | C7: 20.0 | D7: 20.900000000003015 | E7: =D7 -> 20.900000000003015 | F7: 29 | G7: 10 | H7: 160000
A8: =A7+1 -> 4 | B8: Kevin Gallagher | C8: 11.8 | D8: 11.300000000000997 | E8: =D8 -> 11.300000000000997 | F8: 25 | G8: 13 | H8: 151250
A9: =A8+1 -> 5 | B9: Alan Hopkins | C9: 8.4 | D9: 7.1 | E9: =D9 -> 7.1 | F9: 7 | G9: 1 | H9: 111250
A10: =A9+1 -> 6 | B10: Martin Bould | C10: 20.4 | D10: 19.4 | E10: =D10 -> 19.4 | F10: 7 | G10: 1 | H10: 97500
A11: =A10+1 -> 7 | B11: Matthew Carter | C11: 20.9 | D11: 21.2 | E11: =D11 -> 21.2 | F11: 8 | G11: 3 | H11: 96125
A12: =A11+1 -> 8 | B12: Dave Rouse | C12: 24.6 | D12: 25.1 | E12: =D12 -> 25.1 | F12: 5 | G12: 1 | H12: 77500
A13: =A12+1 -> 9 | B13: Paul Carter | C13: 12.8 | D13: 12.3 | E13: =D13 -> 12.3 | F13: 6 | G13: 0 | H13: 77500
A14: =A13+1 -> 10 | B14: Dave Andrews | C14: 17.5 | D14: 17.9 | E14: =D14 -> 17.9 | F14: 17 | G14: 7 | H14: 75000
A15: =A14+1 -> 11 | B15: Andrew Baldwin | C15: 17.4 | D15: 17.5 | E15: =D15 -> 17.5 | F15: 6 | G15: 0 | H15: 66250
A16: =A15+1 -> 12 | B16: Jeff Colbrook | C16: 13.1 | D16: 14.200000000000996 | E16: =D16 -> 14.200000000000996 | F16: 14 | G16: 2 | H16: 65000
A17: =A16+1 -> 13 | B17: Roy Dickens | C17: 29.6 | D17: 30.000000000001002 | E17: =D17 -> 30.000000000001002 | F17: 6 | G17: 0 | H17: 61250
A18: =A17+1 -> 14 | B18: John Press | C18: 14.9 | D18: 13.5 | E18: =D18 -> 13.5 | F18: 3 | G18: 2 | H18: 57500
A19: =A18+1 -> 15 | B19: Simon Thompson | C19: 11.6 | D19: 13.7 | E19: =D19 -> 13.7 | F19: 11 | G19: 1 | H19: 57500
A20: =A19+1 -> 16 | B20: Michael Trimmings | C20: 22.6 | D20: 22.2 | E20: =D20 -> 22.2 | F20: 4 | G20: 1 | H20: 47500
A21: =A20+1 -> 17 | B21: Martin Cox | C21: 12.3 | D21: 12.8 | E21: =D21 -> 12.8 | F21: 4 | G21: 1 | H21: 41250
A22: =A21+1 -> 18 | B22: Paul Baldwin | C22: 16.9 | D22: 17.4 | E22: =D22 -> 17.4 | F22: 3 | G22: 0 | H22: 33750
A23: =A22+1 -> 19 | B23: Danny Marsh | C23: 8.2 | D23: 8.1 | E23: =D23 -> 8.1 | F23: 3 | G23: 1 | H23: 31250
A24: =A23+1 -> 20 | B24: Alan Baldwin | C24: 22.6 | D24: 20.300000000001003 | E24: =D24 -> 20.300000000001003 | F24: 3 | G24: 1 | H24: 28750
A25: =A24+1 -> 21 | B25: Andy Benson | C25: 6.7 | D25: 6.9000000000009996 | E25: =D25 -> 6.9000000000009996 | F25: 3 | G25: 1 | H25: 18750
A26: =A25+1 -> 22 | B26: Ian Edwards | C26: 15.2 | D26: 15.7 | E26: =D26 -> 15.7 | F26: 2 | G26: 0 | H26: 5000
A27: =A26+1 -> 23 | B27: Jon Dey | C27: 36.8 | D27: 37.0 | E27: =D27 -> 37 | F27: 1 | G27: 0 | H27: 5000
A28: =A27+1 -> 24 | B28: Simon Owens | C28: 13.0 | D28: 13.2 | E28: =D28 -> 13.2 | F28: 1 | G28: 1 | H28: 3750
A29: =A28+1 -> 25 | B29: Steve Tilling | C29: 16.5 | D29: 16.5 | E29: =D29 -> 16.5 | F29: 0 | G29: 0 | H29: 0
A30: =A29+1 -> 26 | B30: Neil Leah | C30: 15.0 | D30: 15.0 | E30: =D30 -> 15 | F30: 0 | G30: 0 | H30: 0
A31: =A30+1 -> 27 | B31: Malcolm Rouse | C31: 42.9 | D31: 42.9 | E31: =D31 -> 42.9 | F31: 0 | G31: 0 | H31: 0
A32: =A31+1 -> 28 | B32: Keith Johns | C32: 24.3 | D32: 24.3 | E32: =D32 -> 24.3 | F32: 0 | G32: 0 | H32: 0
A33: =A32+1 -> 29 | B33: Dave White | C33: 22.1 | D33: 22.1 | E33: =D33 -> 22.1 | F33: 0 | G33: 0 | H33: 0
A34: =A33+1 -> 30 | B34: Clive Ferris | C34: 26.0 | D34: 26.0 | E34: =D34 -> 26 | F34: 0 | G34: 0 | H34: 0
A35: =A34+1 -> 31 | B35: Chris Manning | C35: 22.7 | D35: 22.7 | E35: =D35 -> 22.7 | F35: 0 | G35: 0 | H35: 0
A36: =A35+1 -> 32 | B36: Andrew Knight | C36: 21.4 | D36: 21.4 | E36: =D36 -> 21.4 | F36: 0 | G36: 0 | H36: 0