A1: Season 8 - April 2nd 2006 to 31st March 2007
A2: MGA World Tour Order of Merit
B3: Statistics updated | C3: =TODAY() -> 39174
A4: Pos | B4: Player | C4: Original Handicap | D4: Current Handicap | E4: Playing Handicap | F4: Played | G4: Points | H4: Average | I4: HI / LOW Score | J4: Qualified (10 games)
A5: 1 | B5: Kevin Gallagher | C5: 11.8 | D5: 11.300000000000997 | E5: =D5 -> 11.300000000000997 | F5: 25 | G5: 808 | H5: =IF(ISERROR(G5/F5),0,G5/F5) -> 32.32 | I5: 41 / 24 | J5: =IF(F5>=10,"Yes","") -> Yes
A6: =IF(J6="","",A5+1) -> 2 | B6: Keith Mendelson | C6: 15.7 | D6: 14.2 | E6: =D6 -> 14.2 | F6: 34 | G6: 1074 | H6: =IF(ISERROR(G6/F6),0,G6/F6) -> 31.588235294117649 | I6: 41 / 17 | J6: =IF(F6>=10,"Yes","") -> Yes
A7: =IF(J7="","",A6+1) -> 3 | B7: Jeff Gibbons | C7: 20.0 | D7: 20.900000000003015 | E7: =D7 -> 20.900000000003015 | F7: 29 | G7: 894 | H7: =IF(ISERROR(G7/F7),0,G7/F7) -> 30.827586206896552 | I7: 39 / 20 | J7: =IF(F7>=10,"Yes","") -> Yes
A8: =IF(J8="","",A7+1) -> 4 | B8: Dave Andrews | C8: 17.5 | D8: 17.9 | E8: =D8 -> 17.9 | F8: 17 | G8: 522 | H8: =IF(ISERROR(G8/F8),0,G8/F8) -> 30.705882352941178 | I8: 39 / 19 | J8: =IF(F8>=10,"Yes","") -> Yes
A9: =IF(J9="","",A8+1) -> 5 | B9: Robert Thompson | C9: 8.1 | D9: 8.7 | E9: =D9 -> 8.7 | F9: 33 | G9: 1010 | H9: =IF(ISERROR(G9/F9),0,G9/F9) -> 30.606060606060606 | I9: 41 / 23 | J9: =IF(F9>=10,"Yes","") -> Yes
A10: =IF(J10="","",A9+1) -> 6 | B10: Jeff Colbrook | C10: 13.1 | D10: 14.200000000000996 | E10: =D10 -> 14.200000000000996 | F10: 14 | G10: 414 | H10: =IF(ISERROR(G10/F10),0,G10/F10) -> 29.571428571428573 | I10: 37 / 22 | J10: =IF(F10>=10,"Yes","") -> Yes
A11: =IF(J11="","",A10+1) -> 7 | B11: Simon Thompson | C11: 11.6 | D11: 13.7 | E11: =D11 -> 13.7 | F11: 11 | G11: 308 | H11: =IF(ISERROR(G11/F11),0,G11/F11) -> 28.00 | I11: 34 / 17 | J11: =IF(F11>=10,"Yes","") -> Yes
A12: =IF(J12="","",A11+1) ->  | B12: Alan Baldwin | C12: 22.6 | D12: 20.300000000001003 | E12: =D12 -> 20.300000000001003 | F12: 3 | G12: 101 | H12: =IF(ISERROR(G12/F12),0,G12/F12) -> 33.666666666666664 | I12: 43 / 28 | J12: =IF(F12>=10,"Yes","") -> 
A13: =IF(J13="","",A12+1) ->  | B13: Alan Hopkins | C13: 8.4 | D13: 7.1 | E13: =D13 -> 7.1 | F13: 7 | G13: 234 | H13: =IF(ISERROR(G13/F13),0,G13/F13) -> 33.428571428571431 | I13: 37 / 30 | J13: =IF(F13>=10,"Yes","") -> 
A14: =IF(J14="","",A13+1) ->  | B14: Martin Bould | C14: 20.4 | D14: 19.4 | E14: =D14 -> 19.4 | F14: 7 | G14: 227 | H14: =IF(ISERROR(G14/F14),0,G14/F14) -> 32.428571428571431 | I14: 36 / 25 | J14: =IF(F14>=10,"Yes","") -> 
A15: =IF(J15="","",A14+1) ->  | B15: John Press | C15: 14.9 | D15: 13.5 | E15: =D15 -> 13.5 | F15: 3 | G15: 96 | H15: =IF(ISERROR(G15/F15),0,G15/F15) -> 32.00 | I15: 39 / 25 | J15: =IF(F15>=10,"Yes","") -> 
A16: =IF(J16="","",A15+1) ->  | B16: Matthew Carter | C16: 20.9 | D16: 21.2 | E16: =D16 -> 21.2 | F16: 8 | G16: 250 | H16: =IF(ISERROR(G16/F16),0,G16/F16) -> 31.25 | I16: 37 / 25 | J16: =IF(F16>=10,"Yes","") -> 
A17: =IF(J17="","",A16+1) ->  | B17: Andy Benson | C17: 6.7 | D17: 6.9000000000009996 | E17: =D17 -> 6.9000000000009996 | F17: 3 | G17: 93 | H17: =IF(ISERROR(G17/F17),0,G17/F17) -> 31.00 | I17: 33 / 28 | J17: =IF(F17>=10,"Yes","") -> 
A18: =IF(J18="","",A17+1) ->  | B18: Danny Marsh | C18: 8.2 | D18: 8.1 | E18: =D18 -> 8.1 | F18: 3 | G18: 93 | H18: =IF(ISERROR(G18/F18),0,G18/F18) -> 31.00 | I18: 38 / 25 | J18: =IF(F18>=10,"Yes","") -> 
A19: =IF(J19="","",A18+1) ->  | B19: Paul Carter | C19: 12.8 | D19: 12.3 | E19: =D19 -> 12.3 | F19: 6 | G19: 178 | H19: =IF(ISERROR(G19/F19),0,G19/F19) -> 29.666666666666668 | I19: 36 / 22 | J19: =IF(F19>=10,"Yes","") -> 
A20: =IF(J20="","",A19+1) ->  | B20: Martin Cox | C20: 12.3 | D20: 12.8 | E20: =D20 -> 12.8 | F20: 4 | G20: 115 | H20: =IF(ISERROR(G20/F20),0,G20/F20) -> 28.75 | I20: 33 / 26 | J20: =IF(F20>=10,"Yes","") -> 
A21: =IF(J21="","",A20+1) ->  | B21: Andrew Baldwin | C21: 17.4 | D21: 17.5 | E21: =D21 -> 17.5 | F21: 6 | G21: 171 | H21: =IF(ISERROR(G21/F21),0,G21/F21) -> 28.50 | I21: 34 / 25 | J21: =IF(F21>=10,"Yes","") -> 
A22: =IF(J22="","",A21+1) ->  | B22: Michael Trimmings | C22: 22.6 | D22: 22.2 | E22: =D22 -> 22.2 | F22: 4 | G22: 111 | H22: =IF(ISERROR(G22/F22),0,G22/F22) -> 27.75 | I22: 35 / 21 | J22: =IF(F22>=10,"Yes","") -> 
A23: =IF(J23="","",A22+1) ->  | B23: Roy Dickens | C23: 29.6 | D23: 30.000000000001002 | E23: =D23 -> 30.000000000001002 | F23: 6 | G23: 162 | H23: =IF(ISERROR(G23/F23),0,G23/F23) -> 27.00 | I23: 34 / 21 | J23: =IF(F23>=10,"Yes","") -> 
A24: =IF(J24="","",A23+1) ->  | B24: Simon Owens | C24: 13.0 | D24: 13.2 | E24: =D24 -> 13.2 | F24: 1 | G24: 27 | H24: =IF(ISERROR(G24/F24),0,G24/F24) -> 27.00 | I24: 27 / 27 | J24: =IF(F24>=10,"Yes","") -> 
A25: =IF(J25="","",A24+1) ->  | B25: Dave Rouse | C25: 24.6 | D25: 25.1 | E25: =D25 -> 25.1 | F25: 5 | G25: 134 | H25: =IF(ISERROR(G25/F25),0,G25/F25) -> 26.80 | I25: 33 / 18 | J25: =IF(F25>=10,"Yes","") -> 
A26: =IF(J26="","",A25+1) ->  | B26: Ian Edwards | C26: 15.2 | D26: 15.7 | E26: =D26 -> 15.7 | F26: 2 | G26: 53 | H26: =IF(ISERROR(G26/F26),0,G26/F26) -> 26.50 | I26: 33 / 20 | J26: =IF(F26>=10,"Yes","") -> 
A27: =IF(J27="","",A26+1) ->  | B27: Paul Baldwin | C27: 16.9 | D27: 17.4 | E27: =D27 -> 17.4 | F27: 3 | G27: 77 | H27: =IF(ISERROR(G27/F27),0,G27/F27) -> 25.666666666666668 | I27: 30 / 22 | J27: =IF(F27>=10,"Yes","") -> 
A28: =IF(J28="","",A27+1) ->  | B28: Jon Dey | C28: 36.8 | D28: 37.0 | E28: =D28 -> 37 | F28: 1 | G28: 25 | H28: =IF(ISERROR(G28/F28),0,G28/F28) -> 25.00 | I28: 25 / 25 | J28: =IF(F28>=10,"Yes","") -> 
A29: =IF(J29="","",A28+1) ->  | B29: Steve Tilling | C29: 16.5 | D29: 16.5 | E29: =D29 -> 16.5 | F29: 0 | G29: 0 | H29: =IF(ISERROR(G29/F29),0,G29/F29) -> 0.00 | I29: / | J29: =IF(F29>=10,"Yes","") -> 
A30: =IF(J30="","",A29+1) ->  | B30: Neil Leah | C30: 15.0 | D30: 15.0 | E30: =D30 -> 15 | F30: 0 | G30: 0 | H30: =IF(ISERROR(G30/F30),0,G30/F30) -> 0.00 | I30: / | J30: =IF(F30>=10,"Yes","") -> 
A31: =IF(J31="","",A30+1) ->  | B31: Malcolm Rouse | C31: 42.9 | D31: 42.9 | E31: =D31 -> 42.9 | F31: 0 | G31: 0 | H31: =IF(ISERROR(G31/F31),0,G31/F31) -> 0.00 | I31: / | J31: =IF(F31>=10,"Yes","") -> 
A32: =IF(J32="","",A31+1) ->  | B32: Keith Johns | C32: 24.3 | D32: 24.3 | E32: =D32 -> 24.3 | F32: 0 | G32: 0 | H32: =IF(ISERROR(G32/F32),0,G32/F32) -> 0.00 | I32: / | J32: =IF(F32>=10,"Yes","") -> 
A33: =IF(J33="","",A32+1) ->  | B33: Dave White | C33: 22.1 | D33: 22.1 | E33: =D33 -> 22.1 | F33: 0 | G33: 0 | H33: =IF(ISERROR(G33/F33),0,G33/F33) -> 0.00 | I33: / | J33: =IF(F33>=10,"Yes","") -> 
A34: =IF(J34="","",A33+1) ->  | B34: Clive Ferris | C34: 26.0 | D34: 26.0 | E34: =D34 -> 26 | F34: 0 | G34: 0 | H34: =IF(ISERROR(G34/F34),0,G34/F34) -> 0.00 | I34: / | J34: =IF(F34>=10,"Yes","") -> 
A35: =IF(J35="","",A34+1) ->  | B35: Chris Manning | C35: 22.7 | D35: 22.7 | E35: =D35 -> 22.7 | F35: 0 | G35: 0 | H35: =IF(ISERROR(G35/F35),0,G35/F35) -> 0.00 | I35: / | J35: =IF(F35>=10,"Yes","") -> 
A36: =IF(J36="","",A35+1) ->  | B36: Andrew Knight | C36: 21.4 | D36: 21.4 | E36: =D36 -> 21.4 | F36: 0 | G36: 0 | H36: =IF(ISERROR(G36/F36),0,G36/F36) -> 0.00 | I36: / | J36: =IF(F36>=10,"Yes","") -> 