A1: Season 8 - April 2nd 2006 to 31st March 2007
A2: MGA World Tour Putting Statistics
B3: Statistics updated | C3: =TODAY() -> 39174
A4: Pos | B4: Player | C4: Original Handicap | D4: Current Handicap | E4: Playing Handicap | F4: Played | G4: Total Putts | H4: Ave per Round | I4: Ave Per Hole | J4: Best Round | K4: Worst Round
A5: 1 | B5: Dave Andrews | C5: 17.5 | D5: 17.9 | E5: =D5 -> 17.9 | F5: 17 | G5: 538 | H5: 31.647058823529413 | I5: =IF(G5=0,"",G5/(F5*18)) -> 1.7581699346405228 | J5: 26 | K5: 37
A6: =A5+1 -> 2 | B6: Kevin Gallagher | C6: 11.8 | D6: 11.300000000000997 | E6: =D6 -> 11.300000000000997 | F6: 25 | G6: 796 | H6: 31.84 | I6: =IF(G6=0,"",G6/(F6*18)) -> 1.768888888888889 | J6: 28 | K6: 40
A7: =A6+1 -> 3 | B7: Robert Thompson | C7: 8.1 | D7: 8.7 | E7: =D7 -> 8.7 | F7: 33 | G7: 1070 | H7: 32.424242424242422 | I7: =IF(G7=0,"",G7/(F7*18)) -> 1.8013468013468013 | J7: 28 | K7: 38
A8: =A7+1 -> 4 | B8: Jeff Gibbons | C8: 20.0 | D8: 20.900000000003015 | E8: =D8 -> 20.900000000003015 | F8: 29 | G8: 954 | H8: 32.896551724137929 | I8: =IF(G8=0,"",G8/(F8*18)) -> 1.8275862068965518 | J8: 30 | K8: 39
A9: =A8+1 -> 5 | B9: Jeff Colbrook | C9: 13.1 | D9: 14.200000000000996 | E9: =D9 -> 14.200000000000996 | F9: 14 | G9: 474 | H9: 33.857142857142854 | I9: =IF(G9=0,"",G9/(F9*18)) -> 1.8809523809523809 | J9: 27 | K9: 38
A10: =A9+1 -> 6 | B10: Keith Mendelson | C10: 15.7 | D10: 14.2 | E10: =D10 -> 14.2 | F10: 34 | G10: 1155 | H10: 33.970588235294116 | I10: =IF(G10=0,"",G10/(F10*18)) -> 1.8872549019607843 | J10: 28 | K10: 43
A11: =A10+1 -> 7 | B11: Simon Thompson | C11: 11.6 | D11: 13.7 | E11: =D11 -> 13.7 | F11: 11 | G11: 377 | H11: 34.272727272727273 | I11: =IF(G11=0,"",G11/(F11*18)) -> 1.904040404040404 | J11: 28 | K11: 38
A12: =A11+1 -> 8 | B12: Jon Dey | C12: 36.8 | D12: 37.0 | E12: =D12 -> 37 | F12: 1 | G12: 30 | H12: 30.00 | I12: =IF(G12=0,"",G12/(F12*18)) -> 1.6666666666666667 | J12: 30 | K12: 30
A13: =A12+1 -> 9 | B13: Alan Baldwin | C13: 22.6 | D13: 20.300000000001003 | E13: =D13 -> 20.300000000001003 | F13: 3 | G13: 95 | H13: 31.666666666666668 | I13: =IF(G13=0,"",G13/(F13*18)) -> 1.7592592592592593 | J13: 31 | K13: 33
A14: =A13+1 -> 10 | B14: Martin Cox | C14: 12.3 | D14: 12.8 | E14: =D14 -> 12.8 | F14: 4 | G14: 127 | H14: 31.75 | I14: =IF(G14=0,"",G14/(F14*18)) -> 1.7638888888888888 | J14: 28 | K14: 35
A15: =A14+1 -> 11 | B15: Andy Benson | C15: 6.7 | D15: 6.9000000000009996 | E15: =D15 -> 6.9000000000009996 | F15: 3 | G15: 96 | H15: 32.00 | I15: =IF(G15=0,"",G15/(F15*18)) -> 1.7777777777777777 | J15: 29 | K15: 34
A16: =A15+1 -> 12 | B16: Danny Marsh | C16: 8.2 | D16: 8.1 | E16: =D16 -> 8.1 | F16: 3 | G16: 96 | H16: 32.00 | I16: =IF(G16=0,"",G16/(F16*18)) -> 1.7777777777777777 | J16: 29 | K16: 34
A17: =A16+1 -> 13 | B17: Alan Hopkins | C17: 8.4 | D17: 7.1 | E17: =D17 -> 7.1 | F17: 7 | G17: 229 | H17: 32.714285714285715 | I17: =IF(G17=0,"",G17/(F17*18)) -> 1.8174603174603174 | J17: 29 | K17: 36
A18: =A17+1 -> 14 | B18: John Press | C18: 14.9 | D18: 13.5 | E18: =D18 -> 13.5 | F18: 3 | G18: 100 | H18: 33.333333333333336 | I18: =IF(G18=0,"",G18/(F18*18)) -> 1.8518518518518519 | J18: 32 | K18: 34
A19: =A18+1 -> 15 | B19: Matthew Carter | C19: 20.9 | D19: 21.2 | E19: =D19 -> 21.2 | F19: 8 | G19: 269 | H19: 33.625 | I19: =IF(G19=0,"",G19/(F19*18)) -> 1.8680555555555556 | J19: 30 | K19: 39
A20: =A19+1 -> 16 | B20: Paul Carter | C20: 12.8 | D20: 12.3 | E20: =D20 -> 12.3 | F20: 6 | G20: 206 | H20: 34.333333333333336 | I20: =IF(G20=0,"",G20/(F20*18)) -> 1.9074074074074074 | J20: 31 | K20: 37
A21: =A20+1 -> 17 | B21: Martin Bould | C21: 20.4 | D21: 19.4 | E21: =D21 -> 19.4 | F21: 7 | G21: 244 | H21: 34.857142857142854 | I21: =IF(G21=0,"",G21/(F21*18)) -> 1.9365079365079365 | J21: 32 | K21: 38
A22: =A21+1 -> 18 | B22: Andrew Baldwin | C22: 17.4 | D22: 17.5 | E22: =D22 -> 17.5 | F22: 6 | G22: 210 | H22: 35.00 | I22: =IF(G22=0,"",G22/(F22*18)) -> 1.9444444444444444 | J22: 28 | K22: 38
A23: =A22+1 -> 19 | B23: Paul Baldwin | C23: 16.9 | D23: 17.4 | E23: =D23 -> 17.4 | F23: 3 | G23: 106 | H23: 35.333333333333336 | I23: =IF(G23=0,"",G23/(F23*18)) -> 1.962962962962963 | J23: 32 | K23: 38
A24: =A23+1 -> 20 | B24: Dave Rouse | C24: 24.6 | D24: 25.1 | E24: =D24 -> 25.1 | F24: 5 | G24: 180 | H24: 36.00 | I24: =IF(G24=0,"",G24/(F24*18)) -> 2.00 | J24: 32 | K24: 38
A25: =A24+1 -> 21 | B25: Roy Dickens | C25: 29.6 | D25: 30.000000000001002 | E25: =D25 -> 30.000000000001002 | F25: 6 | G25: 217 | H25: 36.166666666666664 | I25: =IF(G25=0,"",G25/(F25*18)) -> 2.0092592592592591 | J25: 33 | K25: 39
A26: =A25+1 -> 22 | B26: Ian Edwards | C26: 15.2 | D26: 15.7 | E26: =D26 -> 15.7 | F26: 2 | G26: 73 | H26: 36.50 | I26: =IF(G26=0,"",G26/(F26*18)) -> 2.0277777777777777 | J26: 34 | K26: 39
A27: =A26+1 -> 23 | B27: Michael Trimmings | C27: 22.6 | D27: 22.2 | E27: =D27 -> 22.2 | F27: 4 | G27: 153 | H27: 38.25 | I27: =IF(G27=0,"",G27/(F27*18)) -> 2.125 | J27: 31 | K27: 42
A28: =A27+1 -> 24 | B28: Simon Owens | C28: 13.0 | D28: 13.2 | E28: =D28 -> 13.2 | F28: 1 | G28: 42 | H28: 42.00 | I28: =IF(G28=0,"",G28/(F28*18)) -> 2.3333333333333335 | J28: 42 | K28: 42
A29: =A28+1 -> 25 | B29: Andrew Knight | C29: 21.4 | D29: 21.4 | E29: =D29 -> 21.4 | F29: 0 | G29: 0 | H29: 0.00 | I29: =IF(G29=0,"",G29/(F29*18)) ->  | J29: 0 | K29: 0
A30: =A29+1 -> 26 | B30: Steve Tilling | C30: 16.5 | D30: 16.5 | E30: =D30 -> 16.5 | F30: 0 | G30: 0 | H30: 0.00 | I30: =IF(G30=0,"",G30/(F30*18)) ->  | J30: 0 | K30: 0
A31: =A30+1 -> 27 | B31: Neil Leah | C31: 15.0 | D31: 15.0 | E31: =D31 -> 15 | F31: 0 | G31: 0 | H31: 0.00 | I31: =IF(G31=0,"",G31/(F31*18)) ->  | J31: 0 | K31: 0
A32: =A31+1 -> 28 | B32: Malcolm Rouse | C32: 42.9 | D32: 42.9 | E32: =D32 -> 42.9 | F32: 0 | G32: 0 | H32: 0.00 | I32: =IF(G32=0,"",G32/(F32*18)) ->  | J32: 0 | K32: 0
A33: =A32+1 -> 29 | B33: Keith Johns | C33: 22.1 | D33: 22.1 | E33: =D33 -> 22.1 | F33: 0 | G33: 0 | H33: 0.00 | I33: =IF(G33=0,"",G33/(F33*18)) ->  | J33: 0 | K33: 0
A34: =A33+1 -> 30 | B34: Dave White | C34: 22.1 | D34: 22.1 | E34: =D34 -> 22.1 | F34: 0 | G34: 0 | H34: 0.00 | I34: =IF(G34=0,"",G34/(F34*18)) ->  | J34: 0 | K34: 0
A35: =A34+1 -> 31 | B35: Clive Ferris | C35: 26.0 | D35: 26.0 | E35: =D35 -> 26 | F35: 0 | G35: 0 | H35: 0.00 | I35: =IF(G35=0,"",G35/(F35*18)) ->  | J35: 0 | K35: 0
A36: =A35+1 -> 32 | B36: Chris Manning | C36: 22.7 | D36: 22.7 | E36: =D36 -> 22.7 | F36: 0 | G36: 0 | H36: 0.00 | I36: =IF(G36=0,"",G36/(F36*18)) ->  | J36: 0 | K36: 0