A1: Robert Thompson
A2: Club | B2: Merrist Wood
A3: Par/SS | B3: 72/70 | D3: Num. Of Fairways | I3: =IF(B2="","",18-(COUNTIF(B9:B26,3))) -> 14
A4: Date | B4: 38185 | D4: Playing Handicap | I4: 7.4
A5: Event Place | B5: 10 | C5: M | D5: Prize Money | G5: 7500
A6: Game Stats | B6: DB+ | C6: DB | D6: Bi | E6: P | F6: B | G6: E | H6: A | I6: H1
B7: 2 | C7: 3 | D7: 8 | E7: 4 | F7: 1 | G7: 0 | H7: 0 | I7: 0
A8: Hole No | B8: Par | C8: Stroke Index | D8: Gross Score | E8: Points | F8: Putts | G8: Fairways | H8: Ferrets | I8: Green Regulation
A9: 1 | B9: 4 | C9: 10 | D9: 6 | E9: 0 | F9: 3
A10: 2 | B10: 3 | C10: 18 | D10: 2 | E10: 3 | F10: 1 | I10: Yes
A11: 3 | B11: 4 | C11: 6 | D11: 5 | E11: 2 | F11: 2 | I11: Yes
A12: 4 | B12: 5 | C12: 14 | D12: 8 | E12: 0 | F12: 2 | H12: 1
A13: 5 | B13: 4 | C13: 4 | D13: 4 | E13: 3 | F13: 2 | G13: 1 | I13: Yes
A14: 6 | B14: 5 | C14: 12 | D14: 6 | E14: 1 | F14: 2 | H14: 1
A15: 7 | B15: 4 | C15: 8 | D15: 10 | E15: 0 | F15: 3 | H15: 2
A16: 8 | B16: 3 | C16: 16 | D16: 3 | E16: 2 | F16: 1
A17: 9 | B17: 4 | C17: 2 | D17: 5 | E17: 2 | F17: 1 | G17: 1
A18: 10 | B18: 5 | C18: 9 | D18: 6 | E18: 1 | F18: 2 | G18: 1
A19: 11 | B19: 3 | C19: 15 | D19: 4 | E19: 1 | F19: 3 | I19: Yes
A20: 12 | B20: 4 | C20: 7 | D20: 4 | E20: 3 | F20: 1 | G20: 1 | I20: Yes
A21: 13 | B21: 4 | C21: 1 | D21: 5 | E21: 2 | F21: 2 | G21: 1 | I21: Yes
A22: 14 | B22: 4 | C22: 13 | D22: 6 | E22: 0 | F22: 2
A23: 15 | B23: 4 | C23: 3 | D23: 6 | E23: 1 | F23: 2 | H23: 1
A24: 16 | B24: 3 | C24: 17 | D24: 4 | E24: 1 | F24: 2
A25: 17 | B25: 4 | C25: 5 | D25: 5 | E25: 2 | F25: 2 | I25: Yes
A26: 18 | B26: 5 | C26: 11 | D26: 5 | E26: 2 | F26: 1 | G26: 1
A27: Totals | B27: =IF(B2="","",SUM(B9:B26)) -> 72 | D27: =IF(B2="","",SUM(D9:D26)) -> 94 | E27: =IF(B2="","",SUM(E9:E26)) -> 26 | F27: =IF(B2="","",SUM(F9:F26)) -> 34 | G27: =IF(B2="","",SUM(G9:G26)) -> 6 | H27: =IF(B2="","",SUM(H9:H26)) -> 5 | I27: =IF(COUNTIF(I9:I26,"=Yes")=0,"",COUNTIF(I9:I26,"=Yes")) -> 7