A1: MELBAGE CUP 2001 ORDER OF MERIT
A3: Pos | B3: Name | C3: Team | D3: Played | E3: W | F3: D | G3: L | H3: Points | I3: Average | J3: 00 pos
A4: 1 | B4: C Manning | C4: 5 for USA | D4: 6 | E4: 5 | F4: 1 | G4: =D4-(E4+F4) -> 0 | H4: =E4+(F4*0.5) -> 5.5 | I4: =H4/D4 -> 0.91666666666666663 | J4: 1
A5: 2 | B5: A Benson | C5: USA | D5: 34 | E5: 21 | F5: 6 | G5: =D5-(E5+F5) -> 7 | H5: =E5+(F5*0.5) -> 24 | I5: =H5/D5 -> 0.70588235294117652 | J5: 2
A6: 3 | B6: P Carter | C6: USA | D6: 38 | E6: 23 | F6: 5 | G6: =D6-(E6+F6) -> 10 | H6: =E6+(F6*0.5) -> 25.5 | I6: =H6/D6 -> 0.67105263157894735 | J6: 4
A7: 4 | B7: S Thompson | C7: USA | D7: 32 | E7: 19 | F7: 4 | G7: =D7-(E7+F7) -> 9 | H7: =E7+(F7*0.5) -> 21 | I7: =H7/D7 -> 0.65625 | J7: 5
A8: 5 | B8: K Mendelson | C8: Europe | D8: 38 | E8: 22 | F8: 5 | G8: =D8-(E8+F8) -> 11 | H8: =E8+(F8*0.5) -> 24.5 | I8: =H8/D8 -> 0.64473684210526316 | J8: 3
A9: 6 | B9: A Hopkins | C9: USA | D9: 37 | E9: 22 | F9: 2 | G9: =D9-(E9+F9) -> 13 | H9: =E9+(F9*0.5) -> 23 | I9: =H9/D9 -> 0.6216216216216216 | J9: 8
A10: 7 | B10: M Cox | C10: Europe | D10: 38 | E10: 19 | F10: 9 | G10: =D10-(E10+F10) -> 10 | H10: =E10+(F10*0.5) -> 23.5 | I10: =H10/D10 -> 0.61842105263157898 | J10: 6
A11: 8 | B11: R Thompson | C11: Europe | D11: 38 | E11: 22 | F11: 2 | G11: =D11-(E11+F11) -> 14 | H11: =E11+(F11*0.5) -> 23 | I11: =H11/D11 -> 0.60526315789473684 | J11: 7
A12: 9 | B12: A Baldwin (Jnr) | C12: USA | D12: 38 | E12: 19 | F12: 4 | G12: =D12-(E12+F12) -> 15 | H12: =E12+(F12*0.5) -> 21 | I12: =H12/D12 -> 0.55263157894736847 | J12: 9
A13: 10 | B13: J Press | C13: 8 for USA | D13: 13 | E13: 6 | F13: 2 | G13: =D13-(E13+F13) -> 5 | H13: =E13+(F13*0.5) -> 7 | I13: =H13/D13 -> 0.53846153846153844 | J13: 16
A14: 11 | B14: A Baldwin (Snr) | C14: Europe | D14: 34 | E14: 17 | F14: 2 | G14: =D14-(E14+F14) -> 15 | H14: =E14+(F14*0.5) -> 18 | I14: =H14/D14 -> 0.52941176470588236 | J14: 18
A15: 12 | B15: J Gibbons | C15: Europe | D15: 32 | E15: 14 | F15: 5 | G15: =D15-(E15+F15) -> 13 | H15: =E15+(F15*0.5) -> 16.5 | I15: =H15/D15 -> 0.515625 | J15: 12
A16: 13 | B16: D Rouse | C16: USA | D16: 38 | E16: 18 | F16: 3 | G16: =D16-(E16+F16) -> 17 | H16: =E16+(F16*0.5) -> 19.5 | I16: =H16/D16 -> 0.51315789473684215 | J16: 13
A17: 14 | B17: I Edwards | C17: Europe | D17: 37 | E17: 17 | F17: 3 | G17: =D17-(E17+F17) -> 17 | H17: =E17+(F17*0.5) -> 18.5 | I17: =H17/D17 -> 0.500 | J17: 11
A18: 15 | B18: S Tilling | C18: USA | D18: 21 | E18: 10 | F18: 1 | G18: =D18-(E18+F18) -> 10 | H18: =E18+(F18*0.5) -> 10.5 | I18: =H18/D18 -> 0.500 | J18: 15
A19: 17 | B19: D White | C19: Europe | D19: 34 | E19: 15 | F19: 3 | G19: =D19-(E19+F19) -> 16 | H19: =E19+(F19*0.5) -> 16.5 | I19: =H19/D19 -> 0.48529411764705882 | J19: 17
A20: 16 | B20: D Archer | C20: Europe | D20: 34 | E20: 14 | F20: 5 | G20: =D20-(E20+F20) -> 15 | H20: =E20+(F20*0.5) -> 16.5 | I20: =H20/D20 -> 0.48529411764705882 | J20: 10
A21: 18 | B21: J Dey | C21: Europe | D21: 35 | E21: 16 | F21: 1 | G21: =D21-(E21+F21) -> 18 | H21: =E21+(F21*0.5) -> 16.5 | I21: =H21/D21 -> 0.47142857142857142 | J21: 14
A22: 19 | B22: N Leah | C22: USA | D22: 33 | E22: 12 | F22: 6 | G22: =D22-(E22+F22) -> 15 | H22: =E22+(F22*0.5) -> 15 | I22: =H22/D22 -> 0.45454545454545453 | J22: 19
A23: 20 | B23: P Baldwin | C23: USA | D23: 28 | E23: 11 | F23: 3 | G23: =D23-(E23+F23) -> 14 | H23: =E23+(F23*0.5) -> 12.5 | I23: =H23/D23 -> 0.44642857142857145 | J23: 22
A24: 21 | B24: D Andrews | C24: Europe | D24: 36 | E24: 15 | F24: 1 | G24: =D24-(E24+F24) -> 20 | H24: =E24+(F24*0.5) -> 15.5 | I24: =H24/D24 -> 0.43055555555555558 | J24: 21
A25: 22 | B25: R Dickens | C25: Europe | D25: 33 | E25: 10 | F25: 6 | G25: =D25-(E25+F25) -> 17 | H25: =E25+(F25*0.5) -> 13 | I25: =H25/D25 -> 0.39393939393939392 | J25: 20
A26: 23 | B26: K Gallagher | C26: USA | D26: 37 | E26: 13 | F26: 2 | G26: =D26-(E26+F26) -> 22 | H26: =E26+(F26*0.5) -> 14 | I26: =H26/D26 -> 0.3783783783783784 | J26: 23
A27: 24 | B27: M Edmond | C27: USA | D27: 31 | E27: 7 | F27: 0 | G27: =D27-(E27+F27) -> 24 | H27: =E27+(F27*0.5) -> 7 | I27: =H27/D27 -> 0.22580645161290322 | J27: 24
A28: 25 | B28: M Rouse | C28: USA | D28: 22 | E28: 4 | F28: 1 | G28: =D28-(E28+F28) -> 17 | H28: =E28+(F28*0.5) -> 4.5 | I28: =H28/D28 -> 0.20454545454545456 | J28: 25
A29: 26 | B29: C Ferris | C29: USA | D29: 20 | E29: 2 | F29: 3 | G29: =D29-(E29+F29) -> 15 | H29: =E29+(F29*0.5) -> 3.5 | I29: =H29/D29 -> 0.17499999999999999 | J29: 26