A1: Danny Marsh
A2: Club | B2: La Cala North, Spain
A3: Par/SS | B3: 73/72 | D3: Num. Of Fairways | I3: =IF(B2="","",18-(COUNTIF(B9:B26,3))) -> 14
A4: Date | B4: 38268 | D4: Playing Handicap | I4: 9.0000000000009983
A5: Event Place | B5: 1 | D5: Prize Money | G5: 5000
A6: Game Stats | B6: DB+ | C6: DB | D6: Bi | E6: P | F6: B | G6: E | H6: A | I6: H1
B7: 2 | C7: 0 | D7: 5 | E7: 11 | F7: 0 | G7: 0 | H7: 0 | I7: 0
A8: Hole No | B8: Par | C8: Stroke Index | D8: Gross Score | E8: Points | F8: Putts | G8: Fairways | H8: Ferrets | I8: Green Regulation
A9: 1 | B9: 5 | C9: 9 | D9: 5 | E9: 3 | F9: 2 | G9: 1 | I9: Yes
A10: 2 | B10: 4 | C10: 13 | D10: 5 | E10: 1 | F10: 2 | G10: 1
A11: 3 | B11: 4 | C11: 15 | D11: 4 | E11: 2 | F11: 2 | G11: 1 | I11: Yes
A12: 4 | B12: 3 | C12: 11 | D12: 3 | E12: 2 | F12: 2 | I12: Yes
A13: 5 | B13: 4 | C13: 7 | D13: 4 | E13: 3 | F13: 2 | G13: 1 | I13: Yes
A14: 6 | B14: 5 | C14: 1 | D14: 5 | E14: 3 | F14: 1 | G14: 1 | I14: Yes
A15: 7 | B15: 4 | C15: 5 | D15: 7 | E15: 0 | F15: 2
A16: 8 | B16: 3 | C16: 17 | D16: 3 | E16: 2 | F16: 1
A17: 9 | B17: 5 | C17: 3 | D17: 5 | E17: 3 | F17: 2 | G17: 1 | I17: Yes
A18: 10 | B18: 4 | C18: 14 | D18: 4 | E18: 2 | F18: 1
A19: 11 | B19: 3 | C19: 16 | D19: 4 | E19: 1 | F19: 2
A20: 12 | B20: 4 | C20: 8 | D20: 5 | E20: 2 | F20: 2 | I20: Yes
A21: 13 | B21: 4 | C21: 4 | D21: 8 | E21: 0 | F21: 3
A22: 14 | B22: 4 | C22: 12 | D22: 4 | E22: 2 | F22: 1
A23: 15 | B23: 5 | C23: 2 | D23: 6 | E23: 2 | F23: 2 | I23: Yes
A24: 16 | B24: 3 | C24: 18 | D24: 3 | E24: 2 | F24: 1
A25: 17 | B25: 4 | C25: 10 | D25: 5 | E25: 1 | F25: 2
A26: 18 | B26: 5 | C26: 6 | D26: 5 | E26: 3 | F26: 2 | I26: Yes
A27: Totals | B27: =IF(B2="","",SUM(B9:B26)) -> 73 | D27: =IF(B2="","",SUM(D9:D26)) -> 85 | E27: =IF(B2="","",SUM(E9:E26)) -> 34 | F27: =IF(B2="","",SUM(F9:F26)) -> 32 | G27: =IF(B2="","",SUM(G9:G26)) -> 6 | H27: =IF(B2="","",SUM(H9:H26)) -> 0 | I27: =IF(COUNTIF(I9:I26,"=Yes")=0,"",COUNTIF(I9:I26,"=Yes")) -> 9