A1: Danny Marsh
A2: Club | B2: La Quinta, Spain
A3: Par/SS | B3: 71/71 | D3: Num. Of Fairways | I3: =IF(B2="","",18-(COUNTIF(B9:B26,3))) -> 13
A4: Date | B4: 38269 | D4: Playing Handicap | I4: 9.0000000000009983
A5: Event Place | B5: 2 | D5: Prize Money | G5: 2500
A6: Game Stats | B6: DB+ | C6: DB | D6: Bi | E6: P | F6: B | G6: E | H6: A | I6: H1
B7: 4 | C7: 1 | D7: 7 | E7: 6 | F7: 0 | G7: 0 | H7: 0 | I7: 0
A8: Hole No | B8: Par | C8: Stroke Index | D8: Gross Score | E8: Points | F8: Putts | G8: Fairways | H8: Ferrets | I8: Green Regulation
A9: 1 | B9: 5 | C9: 9 | D9: 10 | E9: 0 | F9: 3 | H9: 2
A10: 2 | B10: 4 | C10: 11 | D10: 5 | E10: 1 | F10: 2 | G10: 1
A11: 3 | B11: 4 | C11: 5 | D11: 5 | E11: 2 | F11: 1
A12: 4 | B12: 3 | C12: 13 | D12: 3 | E12: 2 | F12: 1
A13: 5 | B13: 4 | C13: 1 | D13: 7 | E13: 0 | F13: 2
A14: 6 | B14: 3 | C14: 3 | D14: 4 | E14: 2 | F14: 2 | I14: Yes
A15: 7 | B15: 4 | C15: 17 | D15: 5 | E15: 1 | F15: 2
A16: 8 | B16: 3 | C16: 15 | D16: 3 | E16: 2 | F16: 2 | I16: Yes
A17: 9 | B17: 5 | C17: 7 | D17: 8 | E17: 0 | F17: 2 | H17: 1
A18: 10 | B18: 4 | C18: 16 | D18: 5 | E18: 1 | F18: 1
A19: 11 | B19: 3 | C19: 14 | D19: 3 | E19: 2 | F19: 1
A20: 12 | B20: 4 | C20: 8 | D20: 5 | E20: 2 | F20: 2 | I20: Yes
A21: 13 | B21: 4 | C21: 6 | D21: 7 | E21: 0 | F21: 3 | G21: 1
A22: 14 | B22: 5 | C22: 12 | D22: 5 | E22: 2 | F22: 2 | I22: Yes
A23: 15 | B23: 4 | C23: 4 | D23: 4 | E23: 3 | F23: 2 | G23: 1 | I23: Yes
A24: 16 | B24: 5 | C24: 2 | D24: 7 | E24: 1 | F24: 1
A25: 17 | B25: 3 | C25: 18 | D25: 4 | E25: 1 | F25: 2
A26: 18 | B26: 4 | C26: 10 | D26: 4 | E26: 2 | F26: 1 | G26: 1
A27: Totals | B27: =IF(B2="","",SUM(B9:B26)) -> 71 | D27: =IF(B2="","",SUM(D9:D26)) -> 94 | E27: =IF(B2="","",SUM(E9:E26)) -> 24 | F27: =IF(B2="","",SUM(F9:F26)) -> 32 | G27: =IF(B2="","",SUM(G9:G26)) -> 4 | H27: =IF(B2="","",SUM(H9:H26)) -> 3 | I27: =IF(COUNTIF(I9:I26,"=Yes")=0,"",COUNTIF(I9:I26,"=Yes")) -> 5