A1: Danny Marsh
A2: Club | B2: Santana, Spain
A3: Par/SS | B3: 72/72 | D3: Num. Of Fairways | I3: =IF(B2="","",18-(COUNTIF(B9:B26,3))) -> 14
A4: Date | B4: 38270 | D4: Playing Handicap | I4: 9.2000000000009976
A5: Event Place | B5: 2 | D5: Prize Money | G5: 2500
A6: Game Stats | B6: DB+ | C6: DB | D6: Bi | E6: P | F6: B | G6: E | H6: A | I6: H1
B7: 2 | C7: 2 | D7: 7 | E7: 5 | F7: 2 | G7: 0 | H7: 0 | I7: 0
A8: Hole No | B8: Par | C8: Stroke Index | D8: Gross Score | E8: Points | F8: Putts | G8: Fairways | H8: Ferrets | I8: Green Regulation
A9: 1 | B9: 4 | C9: 13 | D9: 3 | E9: 3 | F9: 1 | G9: 1 | I9: Yes
A10: 2 | B10: 3 | C10: 9 | D10: 10 | E10: 0 | F10: 3 | H10: 2
A11: 3 | B11: 4 | C11: 7 | D11: 4 | E11: 3 | F11: 1 | G11: 1 | I11: Yes
A12: 4 | B12: 5 | C12: 3 | D12: 5 | E12: 3 | F12: 2 | I12: Yes
A13: 5 | B13: 4 | C13: 11 | D13: 5 | E13: 1 | F13: 2
A14: 6 | B14: 4 | C14: 17 | D14: 5 | E14: 1 | F14: 2 | G14: 1
A15: 7 | B15: 3 | C15: 5 | D15: 4 | E15: 2 | F15: 2 | I15: Yes
A16: 8 | B16: 5 | C16: 1 | D16: 8 | E16: 0 | F16: 2 | H16: 1
A17: 9 | B17: 4 | C17: 15 | D17: 4 | E17: 2 | F17: 2 | G17: 1 | I17: Yes
A18: 10 | B18: 5 | C18: 4 | D18: 6 | E18: 2 | F18: 2 | I18: Yes
A19: 11 | B19: 4 | C19: 8 | D19: 4 | E19: 3 | F19: 1 | G19: 1 | I19: Yes
A20: 12 | B20: 3 | C20: 10 | D20: 4 | E20: 1 | F20: 3 | I20: Yes
A21: 13 | B21: 4 | C21: 14 | D21: 5 | E21: 1 | F21: 2 | G21: 1
A22: 14 | B22: 4 | C22: 18 | D22: 4 | E22: 2 | F22: 1 | G22: 1
A23: 15 | B23: 5 | C23: 6 | D23: 4 | E23: 4 | F23: 2 | G23: 1 | I23: Yes
A24: 16 | B24: 3 | C24: 16 | D24: 5 | E24: 0 | F24: 1 | H24: 1
A25: 17 | B25: 4 | C25: 12 | D25: 5 | E25: 1 | F25: 2
A26: 18 | B26: 4 | C26: 2 | D26: 6 | E26: 1 | F26: 2 | G26: 1
A27: Totals | B27: =IF(B2="","",SUM(B9:B26)) -> 72 | D27: =IF(B2="","",SUM(D9:D26)) -> 91 | E27: =IF(B2="","",SUM(E9:E26)) -> 30 | F27: =IF(B2="","",SUM(F9:F26)) -> 33 | G27: =IF(B2="","",SUM(G9:G26)) -> 9 | H27: =IF(B2="","",SUM(H9:H26)) -> 4 | I27: =IF(COUNTIF(I9:I26,"=Yes")=0,"",COUNTIF(I9:I26,"=Yes")) -> 9