A1: Ian Edwards
A2: Club | B2: La Cala North, Spain
A3: Par/SS | B3: 73/72 | D3: Num. Of Fairways | I3: =IF(B2="","",18-(COUNTIF(B9:B26,3))) -> 14
A4: Date | B4: 38268 | D4: Playing Handicap | I4: 15.2
A5: Event Place | B5: 2 | D5: Prize Money | G5: 2500
A6: Game Stats | B6: DB+ | C6: DB | D6: Bi | E6: P | F6: B | G6: E | H6: A | I6: H1
B7: 4 | C7: 3 | D7: 5 | E7: 4 | F7: 2 | G7: 0 | H7: 0 | I7: 0
A8: Hole No | B8: Par | C8: Stroke Index | D8: Gross Score | E8: Points | F8: Putts | G8: Fairways | H8: Ferrets | I8: Green Regulation
A9: 1 | B9: 5 | C9: 9 | D9: 4 | E9: 4 | F9: 1 | G9: 1 | I9: Yes
A10: 2 | B10: 4 | C10: 13 | D10: 7 | E10: 0 | F10: 2 | G10: 1
A11: 3 | B11: 4 | C11: 15 | D11: 4 | E11: 3 | F11: 2 | G11: 1 | I11: Yes
A12: 4 | B12: 3 | C12: 11 | D12: 3 | E12: 3 | F12: 2 | I12: Yes
A13: 5 | B13: 4 | C13: 7 | D13: 7 | E13: 0 | F13: 3 | H13: 1
A14: 6 | B14: 5 | C14: 1 | D14: 7 | E14: 1 | F14: 2 | G14: 1 | H14: 1
A15: 7 | B15: 4 | C15: 5 | D15: 6 | E15: 1 | F15: 1 | H15: 1
A16: 8 | B16: 3 | C16: 17 | D16: 2 | E16: 3 | F16: 0
A17: 9 | B17: 5 | C17: 3 | D17: 6 | E17: 2 | F17: 2 | G17: 1 | I17: Yes
A18: 10 | B18: 4 | C18: 14 | D18: 6 | E18: 1 | F18: 1
A19: 11 | B19: 3 | C19: 16 | D19: 4 | E19: 1 | F19: 0
A20: 12 | B20: 4 | C20: 8 | D20: 5 | E20: 2 | F20: 1 | G20: 1
A21: 13 | B21: 4 | C21: 4 | D21: 10 | E21: 0 | F21: 3 | H21: 1
A22: 14 | B22: 4 | C22: 12 | D22: 5 | E22: 2 | F22: 2 | G22: 1 | I22: Yes
A23: 15 | B23: 5 | C23: 2 | D23: 5 | E23: 3 | F23: 2 | G23: 1 | I23: Yes
A24: 16 | B24: 3 | C24: 18 | D24: 4 | E24: 1 | F24: 2
A25: 17 | B25: 4 | C25: 10 | D25: 7 | E25: 0 | F25: 2 | G25: 1
A26: 18 | B26: 5 | C26: 6 | D26: 5 | E26: 3 | F26: 2 | I26: Yes
A27: Totals | B27: =IF(B2="","",SUM(B9:B26)) -> 73 | D27: =IF(B2="","",SUM(D9:D26)) -> 97 | E27: =IF(B2="","",SUM(E9:E26)) -> 30 | F27: =IF(B2="","",SUM(F9:F26)) -> 30 | G27: =IF(B2="","",SUM(G9:G26)) -> 9 | H27: =IF(B2="","",SUM(H9:H26)) -> 4 | I27: =IF(COUNTIF(I9:I26,"=Yes")=0,"",COUNTIF(I9:I26,"=Yes")) -> 7