A1: Ian Edwards
A2: Club | B2: Santana, Spain
A3: Par/SS | B3: 72/72 | D3: Num. Of Fairways | I3: =IF(B2="","",18-(COUNTIF(B9:B26,3))) -> 14
A4: Date | B4: 38270 | D4: Playing Handicap | I4: 15.5
A5: Event Place | B5: 1 | D5: Prize Money | G5: 5000
A6: Game Stats | B6: DB+ | C6: DB | D6: Bi | E6: P | F6: B | G6: E | H6: A | I6: H1
B7: 4 | C7: 3 | D7: 4 | E7: 6 | F7: 0 | G7: 1 | H7: 0 | I7: 0
A8: Hole No | B8: Par | C8: Stroke Index | D8: Gross Score | E8: Points | F8: Putts | G8: Fairways | H8: Ferrets | I8: Green Regulation
A9: 1 | B9: 4 | C9: 13 | D9: 7 | E9: 0 | F9: 1 | H9: 1
A10: 2 | B10: 3 | C10: 9 | D10: 4 | E10: 2 | F10: 2 | I10: Yes
A11: 3 | B11: 4 | C11: 7 | D11: 4 | E11: 3 | F11: 2 | G11: 1 | I11: Yes
A12: 4 | B12: 5 | C12: 3 | D12: 7 | E12: 1 | F12: 1 | H12: 1
A13: 5 | B13: 4 | C13: 11 | D13: 4 | E13: 3 | F13: 2 | I13: Yes
A14: 6 | B14: 4 | C14: 17 | D14: 7 | E14: 0 | F14: 3 | G14: 1
A15: 7 | B15: 3 | C15: 5 | D15: 4 | E15: 2 | F15: 3 | I15: Yes
A16: 8 | B16: 5 | C16: 1 | D16: 6 | E16: 2 | F16: 2 | I16: Yes
A17: 9 | B17: 4 | C17: 15 | D17: 4 | E17: 3 | F17: 2 | G17: 1 | I17: Yes
A18: 10 | B18: 5 | C18: 4 | D18: 5 | E18: 3 | F18: 1 | I18: Yes
A19: 11 | B19: 4 | C19: 8 | D19: 4 | E19: 3 | F19: 2 | G19: 1 | I19: Yes
A20: 12 | B20: 3 | C20: 10 | D20: 5 | E20: 1 | F20: 2
A21: 13 | B21: 4 | C21: 14 | D21: 4 | E21: 3 | F21: 1 | G21: 1 | I21: Yes
A22: 14 | B22: 4 | C22: 18 | D22: 6 | E22: 0 | F22: 1 | G22: 1
A23: 15 | B23: 5 | C23: 6 | D23: 3 | E23: 5 | F23: 0 | G23: 1 | I23: Yes
A24: 16 | B24: 3 | C24: 16 | D24: 4 | E24: 2 | F24: 2 | I24: Yes
A25: 17 | B25: 4 | C25: 12 | D25: 7 | E25: 0 | F25: 2 | H25: 1
A26: 18 | B26: 4 | C26: 2 | D26: 7 | E26: 0 | F26: 2
A27: Totals | B27: =IF(B2="","",SUM(B9:B26)) -> 72 | D27: =IF(B2="","",SUM(D9:D26)) -> 92 | E27: =IF(B2="","",SUM(E9:E26)) -> 33 | F27: =IF(B2="","",SUM(F9:F26)) -> 31 | G27: =IF(B2="","",SUM(G9:G26)) -> 7 | H27: =IF(B2="","",SUM(H9:H26)) -> 3 | I27: =IF(COUNTIF(I9:I26,"=Yes")=0,"",COUNTIF(I9:I26,"=Yes")) -> 11