B1: 2008 Fantasy Results
B3: Owner | C3: Fantasy Team Name | D3: Total | E3: A Benson | F3: P Carter | G3: A Hopkins | H3: K Mendelson | I3: R Thompson | J3: M Cox | K3: S Thompson | L3: A Baldwin (Jnr) | M3: D Andrews | N3: J Colbrook | O3: D Bingham | P3: K Gallagher | Q3: A Baldwin (Sr) | R3: D Rouse | S3: I Edwards | T3: J Press | U3: M Carter | V3: P Baldwin | W3: J Dey | X3: R Dickens | Y3: M Trimmings | Z3: M Rouse (Double) | AA3: Ferret/Bould combo | AB3: S Owens
A4: 1= | B4: I Edwards | C4: Harem of Hookers | D4: =SUM(E4:AB4) -> 16.0 | E4: 4.0 | H4: 0.0 | I4: 2.0 | K4: 3.0 | S4: 3.0 | V4: 4.0
A5: 1= | B5: D Andrews | C5: Flying High | D5: =SUM(E5:AB5) -> 16.0 | E5: 4.0 | G5: 2.0 | I5: 2.0 | M5: 3.0 | O5: 3.0 | U5: 2.0
A6: 3= | B6: M Rouse | C6: Balls Deep In A Bit Of Rough | D6: =SUM(E6:AB6) -> 15.0 | E6: 4.0 | K6: 3.0 | O6: 3.0 | X6: 1.0 | Z6: 2.0 | AB6: 2.0
A7: 3= | B7: D Rouse | C7: Eyes Down for a Full Rouse | D7: =SUM(E7:AB7) -> 15.0 | E7: 4.0 | F7: 1.0 | K7: 3.0 | O7: 3.0 | R7: 2.0 | U7: 2.0
A8: 3= | B8: A Baldwin (Jnr) | C8: Dodgy Half Dozen | D8: =SUM(E8:AB8) -> 15.0 | E8: 4.0 | I8: 2.0 | K8: 3.0 | L8: 1.0 | S8: 3.0 | T8: 2.0
A9: 3= | B9: M Cox | C9: The Marauding Meringues | D9: =SUM(E9:AB9) -> 15.0 | E9: 4.0 | G9: 2.0 | I9: 2.0 | J9: 4.0 | L9: 1.0 | R9: 2.0
A10: 7= | B10: D Bingham | C10: Romans | D10: =SUM(E10:AB10) -> 14.0 | I10: 2.0 | K10: 3.0 | M10: 3.0 | O10: 3.0 | S10: 3.0 | Y10: 0.0
A11: 7= | B11: S Owens | C11: The Flatulent Foreigners | D11: =SUM(E11:AB11) -> 14.0 | G11: 2.0 | I11: 2.0 | K11: 3.0 | S11: 3.0 | Z11: 2.0 | AB11: 2.0
A12: 7= | B12: P Baldwin | C12: We Come In All Shapes And Sizes | D12: =SUM(E12:AB12) -> 14.0 | H12: 0.0 | I12: 2.0 | J12: 4.0 | K12: 3.0 | V12: 4.0 | X12: 1.0
A13: 7= | B13: M Carter | C13: Matts Maulers | D13: =SUM(E13:AB13) -> 14.0 | E13: 4.0 | O13: 3.0 | T13: 2.0 | U13: 2.0 | X13: 1.0 | AB13: 2.0
A14: 7= | B14: A Benson | C14: The Cranleigh Chokers | D14: =SUM(E14:AB14) -> 14.0 | E14: 4.0 | G14: 2.0 | I14: 2.0 | R14: 2.0 | U14: 2.0 | AB14: 2.0
A15: 7= | B15: A Hopkins | C15: Hoppinder's Hobbits | D15: =SUM(E15:AB15) -> 14.0 | E15: 4.0 | G15: 2.0 | I15: 2.0 | K15: 3.0 | U15: 2.0 | X15: 1.0
A16: 13= | B16: R Dickens | C16: The Stiff Shafts and Shankers | D16: =SUM(E16:AB16) -> 13.0 | G16: 2.0 | I16: 2.0 | K16: 3.0 | O16: 3.0 | R16: 2.0 | X16: 1.0
A17: 13= | B17: S Thompson | C17: The Brotherhood Of Chip Masters | D17: =SUM(E17:AB17) -> 13.0 | I17: 2.0 | K17: 3.0 | T17: 2.0 | V17: 4.0 | W17: 1.0 | X17: 1.0
A18: 13= | B18: J Press | C18: Scuffmasters | D18: =SUM(E18:AB18) -> 13.0 | G18: 2.0 | I18: 2.0 | T18: 2.0 | V18: 4.0 | X18: 1.0 | AB18: 2.0
A19: 16= | B19: M Bould | C19: The Big Fellas-ish | D19: =SUM(E19:AB19) -> 12.0 | E19: 4.0 | H19: 0.0 | I19: 2.0 | P19: 2.0 | U19: 2.0 | AA19: 2.0
A20: 16= | B20: A Baldwin (Snr) | C20: Nepotism Rules OK? | D20: =SUM(E20:AB20) -> 12.0 | H20: 0.0 | L20: 1.0 | Q20: 2.0 | S20: 3.0 | V20: 4.0 | AB20: 2.0
A21: 16= | B21: J Colbrook | C21: Colbrook Shiny Heads | D21: =SUM(E21:AB21) -> 12.0 | G21: 2.0 | L21: 1.0 | M21: 3.0 | N21: 0.0 | U21: 2.0 | V21: 4.0
A22: 19= | B22: R Thompson | C22: There's Only One Way To Find Out - FIGHT! | D22: =SUM(E22:AB22) -> 11.0 | E22: 4.0 | G22: 2.0 | H22: 0.0 | I22: 2.0 | W22: 1.0 | Z22: 2.0
A23: 19= | B23: K Gallagher | C23: Bubbs Not Tubbs | D23: =SUM(E23:AB23) -> 11.0 | K23: 3.0 | P23: 2.0 | U23: 2.0 | W23: 1.0 | X23: 1.0 | AB23: 2.0
A24: 21= | B24: J Dey | C24: A Ladyboy At Last | D24: =SUM(E24:AB24) -> 10.0 | N24: 0.0 | P24: 2.0 | R24: 2.0 | S24: 3.0 | W24: 1.0 | AB24: 2.0
A25: 21= | B25: K Mendelson | C25: Bournemouth Beach Babes | D25: =SUM(E25:AB25) -> 10.0 | E25: 4.0 | G25: 2.0 | H25: 0.0 | I25: 2.0 | N25: 0.0 | AB25: 2.0
A26: 23 | B26: P Carter | C26: Why All The O's? | D26: =SUM(E26:AB26) -> 9.0 | F26: 1.0 | G26: 2.0 | I26: 2.0 | O26: 3.0 | X26: 1.0 | Y26: 0.0