B2: Ferrets 2011
B4: Player | C4: Day 1 | D4: Day 2 | E4: Day 3 | F4: Day 4
B5: M Rouse | C5: 6 | D5: 7 | E5: 7 | F5: 8 | G5: =SUM(C5:F5) -> 28
B6: I Edwards | C6: 5 | D6: 7 | E6: 6 | F6: 8 | G6: =SUM(C6:F6) -> 26
B7: P Baldwin | C7: 4 | D7: 9 | E7: 4 | F7: 9 | G7: =SUM(C7:F7) -> 26
B8: R Dickens | C8: 5 | D8: 4 | E8: 3 | F8: 11 | G8: =SUM(C8:F8) -> 23
B9: A Hopkins | C9: 5 | D9: 5 | E9: 3 | F9: 9 | G9: =SUM(C9:F9) -> 22
B10: J Dey | C10: 5 | D10: 6 | E10: 6 | F10: 4 | G10: =SUM(C10:F10) -> 21
B11: D Andrews | C11: 5 | D11: 5 | E11: 5 | F11: 5 | G11: =SUM(C11:F11) -> 20
B12: D Rouse | C12: 2 | D12: 4 | E12: 9 | F12: 5 | G12: =SUM(C12:F12) -> 20
B13: M Bould | C13: 4 | D13: 6 | E13: 4 | F13: 6 | G13: =SUM(C13:F13) -> 20
B14: J Press | C14: 3 | D14: 5 | E14: 5 | F14: 7 | G14: =SUM(C14:F14) -> 20
B15: A Baldwin (Jnr) | C15: 5 | D15: 5 | E15: 1 | F15: 9 | G15: =SUM(C15:F15) -> 20
B16: M Trimmings | C16: 5 | D16: 6 | E16: 3 | F16: 4 | G16: =SUM(C16:F16) -> 18
B17: P Carter | C17: 2 | D17: 6 | E17: 9 | F17: 0 | G17: =SUM(C17:F17) -> 17
B18: D Bingham | C18: 4 | D18: 7 | E18: 3 | F18: 3 | G18: =SUM(C18:F18) -> 17
B19: R Thompson | C19: 6 | D19: 2 | E19: 4 | F19: 5 | G19: =SUM(C19:F19) -> 17
B20: K Gallagher | C20: 5 | D20: 4 | E20: 2 | F20: 6 | G20: =SUM(C20:F20) -> 17
B21: K Mendelson | C21: 3 | D21: 5 | E21: 2 | F21: 7 | G21: =SUM(C21:F21) -> 17
B22: S Owens | C22: 6 | D22: 2 | E22: 4 | F22: 4 | G22: =SUM(C22:F22) -> 16
B23: J Colbrook | C23: 5 | D23: 3 | E23: 3 | F23: 3 | G23: =SUM(C23:F23) -> 14
B24: S Thompson | C24: 4 | D24: 4 | E24: 1 | F24: 5 | G24: =SUM(C24:F24) -> 14
B25: M Carter | C25: 5 | D25: 1 | E25: 3 | F25: 5 | G25: =SUM(C25:F25) -> 14
B26: A Benson | C26: 2 | D26: 4 | E26: 2 | F26: 6 | G26: =SUM(C26:F26) -> 14
B27: A Baldwin (Snr) | C27: 3 | D27: 3 | E27: 2 | F27: 4 | G27: =SUM(C27:F27) -> 12
B28: D Braithwaite | C28: 5 | D28: 3 | E28: 0 | F28: 3 | G28: =SUM(C28:F28) -> 11
B29: M Edmond | C29: 0 | D29: 0 | E29: 0 | F29: 4 | G29: =SUM(C29:F29) -> 4
C30: =SUM(C5:C29) -> 104 | D30: =SUM(D5:D29) -> 113 | E30: =SUM(E5:E29) -> 91 | F30: =SUM(F5:F29) -> 140 | G30: =SUM(G5:G29) -> 448