A1: Melbage 2012 Fantasy Teams Final Placings
B2: Owner | C2: Fantasy Team Name | E2: M Rouse | F2: P Carter | G2: A Hopkins | H2: S Thompson | I2: K Gallagher | J2: D Rouse | K2: J Press | L2: M Carter | M2: P Baldwin | N2: M Trimmings | O2: D Braithwaite | P2: K Mendelson | Q2: R Thompson | R2: A Baldwin (Jnr) | S2: D Andrews | T2: J Colbrook | U2: M Bould | V2: I Edwards | W2: J Dey | X2: R Dickens | Y2: D Archer | Z2: D Bingham
A3: 1 | B3: J Dey | C3: My Fantasy to be as good as Hoppo | D3: =SUM(E3:Z3) -> 16.0 | G3: 2.5 | K3: 3.0 | P3: 2.5 | R3: 2.0 | S3: 4.0 | W3: 2.0
A4: 2 | B4: R Thompson | C4: It'll Be Wet & Windy This Fall | D4: =SUM(E4:Z4) -> 16.0 | F4: 2.0 | G4: 2.5 | K4: 3.0 | P4: 2.5 | Q4: 3.0 | Z4: 3.0
A5: 3 | B5: K Gallagher | C5: Where Is Lucan? | D5: =SUM(E5:Z5) -> 15.5 | H5: 2.0 | I5: 0.5 | K5: 3.0 | N5: 3.0 | U5: 4.0 | Z5: 3.0
A6: 4 | B6: M Bould | C6: The Salad Dodgers | D6: =SUM(E6:Z6) -> 15.0 | I6: 0.5 | L6: 2.0 | P6: 2.5 | Q6: 3.0 | U6: 4.0 | Z6: 3.0
A7: 5 | B7: J Press | C7: Buttons Birdy'ing Buffooning Baboons | D7: =SUM(E7:Z7) -> 15.0 | H7: 2.0 | K7: 3.0 | N7: 3.0 | O7: 1.0 | Q7: 3.0 | Z7: 3.0
A8: 6 | B8: J Colbrook | C8: Out of Work Bums | D8: =SUM(E8:Z8) -> 14.5 | F8: 2.0 | G8: 2.5 | H8: 2.0 | P8: 2.5 | S8: 4.0 | T8: 1.5
A9: 8 | B9: K Mendelson | C9: Mendy's Melbage Men | D9: =SUM(E9:Z9) -> 14.0 | G9: 2.5 | H9: 2.0 | O9: 1.0 | P9: 2.5 | Q9: 3.0 | Z9: 3.0
A10: 9 | B10: A Baldwin (Jnr) | C10: Hopeless Shankers | D10: =SUM(E10:Z10) -> 14.0 | H10: 2.0 | K10: 3.0 | O10: 1.0 | Q10: 3.0 | W10: 2.0 | Z10: 3.0
A11: 7 | B11: D Braithwaite | C11: B is for…. | D11: =SUM(E11:Z11) -> 13.5 | I11: 0.5 | K11: 3.0 | O11: 1.0 | R11: 2.0 | U11: 4.0 | Z11: 3.0
A12: 10 | B12: R Dickens | C12: Big Buttocked Boom Boys | D12: =SUM(E12:Z12) -> 13.5 | F12: 2.0 | I12: 0.5 | L12: 2.0 | Q12: 3.0 | U12: 4.0 | W12: 2.0
A13: 11 | B13: D Bingham | C13: The Lip Pickers | D13: =SUM(E13:Z13) -> 13.5 | I13: 0.5 | K13: 3.0 | N13: 3.0 | Q13: 3.0 | V13: 1.0 | Z13: 3.0
A14: 12 | B14: D Andrews | C14: Flying High | D14: =SUM(E14:Z14) -> 13.5 | F14: 2.0 | I14: 0.5 | O14: 1.0 | Q14: 3.0 | S14: 4.0 | Z14: 3.0
A15: 13 | B15: I Edwards | C15: The B Team | D15: =SUM(E15:Z15) -> 13.5 | I15: 0.5 | K15: 3.0 | O15: 1.0 | R15: 2.0 | U15: 4.0 | Z15: 3.0
A16: 14 | B16: D Rouse | C16: The Flange | D16: =SUM(E16:Z16) -> 12.5 | G16: 2.5 | H16: 2.0 | J16: 1.0 | L16: 2.0 | Q16: 3.0 | W16: 2.0
A17: 15 | B17: A Hopkins | C17: I'm Too Busy | D17: =SUM(E17:Z17) -> 12.5 | H17: 2.0 | I17: 0.5 | L17: 2.0 | U17: 4.0 | Y17: 1.0 | Z17: 3.0
A18: 16 | B18: M Trimmings | C18: Big Flappers | D18: =SUM(E18:Z18) -> 12.5 | H18: 2.0 | I18: 0.5 | J18: 1.0 | N18: 3.0 | Q18: 3.0 | Z18: 3.0
A19: 17 | B19: M Carter | C19: Y's Not | D19: =SUM(E19:Z19) -> 11.5 | F19: 2.0 | H19: 2.0 | L19: 2.0 | P19: 2.5 | V19: 1.0 | W19: 2.0
A20: 18 | B20: S Thompson | C20: Wicksy's Waterproof Wenches | D20: =SUM(E20:Z20) -> 11.5 | H20: 2.0 | I20: 0.5 | L20: 2.0 | O20: 1.0 | Q20: 3.0 | Z20: 3.0
A21: 19 | B21: P Carter | C21: A Gril called Ruth | D21: =SUM(E21:Z21) -> 9.5 | F21: 2.0 | K21: 3.0 | M21: 0.0 | T21: 1.5 | W21: 2.0 | Y21: 1.0
A22: 20 | B22: D Archer | C22: Where is Leech and Vitey? | D22: =SUM(E22:Z22) -> 9.5 | F22: 2.0 | H22: 2.0 | I22: 0.5 | P22: 2.5 | T22: 1.5 | Y22: 1.0
A23: 21 | B23: M Rouse | C23: Arch Smarch | D23: =SUM(E23:Z23) -> 8.0 | E23: 0.0 | I23: 0.5 | O23: 1.0 | P23: 2.5 | W23: 2.0 | X23: 2.0
A24: 22 | B24: P Baldwin | C24: Bournemouth Buffoons | D24: =SUM(E24:Z24) -> 8.0 | I24: 0.5 | L24: 2.0 | M24: 0.0 | O24: 1.0 | T24: 1.5 | Z24: 3.0