B1: MELBAGE CUP 2013 ORDER OF MERIT
B3: Up to and including Melbage 22
B4: Pos | D4: Name *elite* | E4: Team | F4: Played | G4: W | H4: D | I4: L | J4: Points | K4: Average | L4: 11 Pos
B5: 1 | C5: ▲ | D5: A Benson | E5: USA | F5: 68 | G5: 41 | H5: 12 | I5: 15 | J5: =G5+(H5*0.5) -> 47 | K5: =J5/F5 -> 0.69117647058823528 | L5: 2
B6: 2 | C6: ▼ | D6: D Bingham | E6: Europe | F6: 21 | G6: 14 | H6: 1 | I6: 6 | J6: =G6+(H6*0.5) -> 14.5 | K6: =J6/F6 -> 0.69047619047619047 | L6: 1
B7: 3 | C7: = | D7: M Carter | E7: 24 for USA | F7: 36 | G7: 20 | H7: 5 | I7: 11 | J7: =G7+(H7*0.5) -> 22.5 | K7: =J7/F7 -> 0.625 | L7: 3
B8: 4 | C8: ▲ | D8: M Bould | E8: Europe | F8: 44 | G8: 23 | H8: 6 | I8: 15 | J8: =G8+(H8*0.5) -> 26 | K8: =J8/F8 -> 0.59090909090909094 | L8: 5
B9: 5 | C9: ▼ | D9: J Dey | E9: Europe | F9: 83 | G9: 45 | H9: 5 | I9: 33 | J9: =G9+(H9*0.5) -> 47.5 | K9: =J9/F9 -> 0.57228915662650603 | L9: 6
B10: 6 | C10: ▲ | D10: R Thompson * | E10: Europe | F10: 86 | G10: 45 | H10: 8 | I10: 33 | J10: =G10+(H10*0.5) -> 49 | K10: =J10/F10 -> 0.56976744186046513 | L10: 7
B11: 7 | C11: ▲ | D11: A Hopkins | E11: USA | F11: 82 | G11: 43 | H11: 7 | I11: 32 | J11: =G11+(H11*0.5) -> 46.5 | K11: =J11/F11 -> 0.56707317073170727 | L11: 8
B12: 8 | C12: ▼ | D12: S Owens | E12: USA | F12: 39 | G12: 21 | H12: 2 | I12: 16 | J12: =G12+(H12*0.5) -> 22 | K12: =J12/F12 -> 0.5641025641025641 | L12: 4
B13: 9 | C13: = | D13: S Thompson | E13: USA | F13: 80 | G13: 39 | H13: 11 | I13: 30 | J13: =G13+(H13*0.5) -> 44.5 | K13: =J13/F13 -> 0.55625000000000002 | L13: 11
B14: 10 | C14: = | D14: J Press | E14: 39 for USA | F14: 60 | G14: 30 | H14: 6 | I14: 24 | J14: =G14+(H14*0.5) -> 33 | K14: =J14/F14 -> 0.5500 | L14: 10
B15: 11 | C15: ▲ | D15: D Braithwaite | E15: USA | F15: 20 | G15: 11 | H15: 0 | I15: 9 | J15: =G15+(H15*0.5) -> 11 | K15: =J15/F15 -> 0.5500 | L15: 20
B16: 12 | C16: = | D16: J Gibbons | E16: Europe | F16: 57 | G16: 27 | H16: 8 | I16: 22 | J16: =G16+(H16*0.5) -> 31 | K16: =J16/F16 -> 0.54385964912280704 | L16: 12
B17: 13 | C17: ▲ | D17: D Marsh | E17: 12 for USA | F17: 16 | G17: 8 | H17: 1 | I17: 7 | J17: =G17+(H17*0.5) -> 8.5 | K17: =J17/F17 -> 0.53125 | L17: 14
B18: 14 | C18: ▲ | D18: P Carter | E18: USA | F18: 85 | G18: 41 | H18: 8 | I18: 36 | J18: =G18+(H18*0.5) -> 45 | K18: =J18/F18 -> 0.52941176470588236 | L18: 16
B19: 15 | C19: ▼ | D19: R Dickens | E19: Europe | F19: 75 | G19: 35 | H19: 9 | I19: 31 | J19: =G19+(H19*0.5) -> 39.5 | K19: =J19/F19 -> 0.52666666666666662 | L19: 19
B20: 16 | C20: ▼ | D20: M Cox | E20: Europe | F20: 78 | G20: 34 | H20: 14 | I20: 30 | J20: =G20+(H20*0.5) -> 41 | K20: =J20/F20 -> 0.52564102564102566 | L20: 9
B21: 17 | C21: ▼ | D21: K Mendelson * | E21: 2 for USA | F21: 86 | G21: 39 | H21: 11 | I21: 32 | J21: =G21+(H21*0.5) -> 44.5 | K21: =J21/F21 -> 0.51744186046511631 | L21: 15
B22: 18 | C22: ▼ | D22: S Tilling | E22: USA | F22: 31 | G22: 15 | H22: 2 | I22: 14 | J22: =G22+(H22*0.5) -> 16 | K22: =J22/F22 -> 0.5161290322580645 | L22: 17
B23: 19 | C23: ▼ | D23: I Edwards | E23: Europe | F23: 63 | G23: 30 | H23: 5 | I23: 28 | J23: =G23+(H23*0.5) -> 32.5 | K23: =J23/F23 -> 0.51587301587301593 | L23: 18
B24: 20 | C24: ▼ | D24: M Trimmings | E24: USA | F24: 32 | G24: 15 | H24: 2 | I24: 15 | J24: =G24+(H24*0.5) -> 16 | K24: =J24/F24 -> 0.5000 | L24: 13
B25: 21 | C25: = | D25: C Manning | E25: 13 for USA | F25: 14 | G25: 6 | H25: 2 | I25: 6 | J25: =G25+(H25*0.5) -> 7 | K25: =J25/F25 -> 0.5000 | L25: 21
B26: 22 | C26: = | D26: A Baldwin (Jnr) | E26: Europe | F26: 86 | G26: 40 | H26: 6 | I26: 40 | J26: =G26+(H26*0.5) -> 43 | K26: =J26/F26 -> 0.5000 | L26: 22
B27: 23 | C27: ▲ | D27: D Andrews | E27: Europe | F27: 84 | G27: 38 | H27: 2 | I27: 44 | J27: =G27+(H27*0.5) -> 39 | K27: =J27/F27 -> 0.4642857142857143 | L27: 24
B28: 24 | C28: ▼ | D28: A Baldwin (Snr) | E28: Europe | F28: 78 | G28: 33 | H28: 6 | I28: 39 | J28: =G28+(H28*0.5) -> 36 | K28: =J28/F28 -> 0.46153846153846156 | L28: 23
B29: 25 | C29: ▲ | D29: K Gallagher | E29: USA | F29: 85 | G29: 35 | H29: 7 | I29: 43 | J29: =G29+(H29*0.5) -> 38.5 | K29: =J29/F29 -> 0.45294117647058824 | L29: 27
B30: 26 | C30: ▼ | D30: D Rouse * | E30: USA | F30: 86 | G30: 34 | H30: 8 | I30: 43 | J30: =G30+(H30*0.5) -> 38 | K30: =J30/F30 -> 0.44186046511627908 | L30: 25
B31: 27 | C31: ▼ | D31: P Baldwin | E31: USA | F31: 76 | G31: 30 | H31: 6 | I31: 40 | J31: =G31+(H31*0.5) -> 33 | K31: =J31/F31 -> 0.43421052631578949 | L31: 26
B32: 28 | C32: = | D32: A Knight | E32: 5 for USA | F32: 11 | G32: 4 | H32: 1 | I32: 6 | J32: =G32+(H32*0.5) -> 4.5 | K32: =J32/F32 -> 0.40909090909090912 | L32: 28
B33: 29 | C33: = | D33: K Johns | E33: 6 for USA | F33: 10 | G33: 3 | H33: 1 | I33: 6 | J33: =G33+(H33*0.5) -> 3.5 | K33: =J33/F33 -> 0.3500 | L33: 29
B34: 30 | C34: = | D34: J Colbrook | E34: Europe | F34: 59 | G34: 18 | H34: 5 | I34: 36 | J34: =G34+(H34*0.5) -> 20.5 | K34: =J34/F34 -> 0.34745762711864409 | L34: 30
B35: 31 | C35: = | D35: M Rouse | E35: 45 for USA | F35: 49 | G35: 14 | H35: 1 | I35: 34 | J35: =G35+(H35*0.5) -> 14.5 | K35: =J35/F35 -> 0.29591836734693877 | L35: 31
B36: 32 | C36: = | D36: C Ferris | E36: USA | F36: 28 | G36: 5 | H36: 3 | I36: 20 | J36: =G36+(H36*0.5) -> 6.5 | K36: =J36/F36 -> 0.23214285714285715 | L36: 32