A1: Alan Hopkins
A2: Club | B2: Oak Park
A3: Par/SS | B3: 70/69 | D3: Num. Of Fairways | I3: =IF(B2="","",18-(COUNTIF(B9:B26,3))) -> 14
A4: Date | B4: 39396 | D4: Playing Handicap | I4: 7.2
A5: Event Place | B5: 9 | C5: M | D5: Prize Money | G5: 3750
A6: Game Stats | B6: DB+ | C6: DB | D6: Bi | E6: P | F6: B | G6: E | H6: A | I6: H1
B7: 7 | C7: 2 | D7: 5 | E7: 4 | F7: 0 | G7: 0 | H7: 0 | I7: 0
A8: Hole No | B8: Par | C8: Stroke Index | D8: Gross Score | E8: Points | F8: Putts | G8: Fairways | H8: Ferrets | I8: Green Regulation
A9: 1 | B9: 4 | C9: 4 | D9: 5 | E9: 2 | F9: 2 | I9: Yes
A10: 2 | B10: 4 | C10: 6 | D10: 10 | E10: 0 | F10: 3
A11: 3 | B11: 3 | C11: 12 | D11: 3 | E11: 2 | F11: 1
A12: 4 | B12: 4 | C12: 2 | D12: 5 | E12: 2 | F12: 2 | G12: 1 | I12: Yes
A13: 5 | B13: 4 | C13: 10 | D13: 5 | E13: 1 | F13: 2 | H13: 1
A14: 6 | B14: 4 | C14: 8 | D14: 4 | E14: 2 | F14: 2 | I14: Yes
A15: 7 | B15: 4 | C15: 18 | D15: 6 | E15: 0 | F15: 2
A16: 8 | B16: 3 | C16: 14 | D16: 3 | E16: 2 | F16: 2 | I16: Yes
A17: 9 | B17: 4 | C17: 16 | D17: 5 | E17: 1 | F17: 1 | H17: 1
A18: 10 | B18: 5 | C18: 5 | D18: 5 | E18: 3 | F18: 2 | I18: Yes
A19: 11 | B19: 4 | C19: 9 | D19: 10 | E19: 0 | F19: 3
A20: 12 | B20: 4 | C20: 1 | D20: 10 | E20: 0 | F20: 3 | H20: 1
A21: 13 | B21: 3 | C21: 3 | D21: 10 | E21: 0 | F21: 3 | H21: 1
A22: 14 | B22: 4 | C22: 13 | D22: 10 | E22: 0 | F22: 3
A23: 15 | B23: 3 | C23: 7 | D23: 4 | E23: 2 | F23: 3 | I23: Yes
A24: 16 | B24: 4 | C24: 17 | D24: 10 | E24: 0 | F24: 3 | H24: 2
A25: 17 | B25: 5 | C25: 11 | D25: 7 | E25: 0 | F25: 2 | H25: 1
A26: 18 | B26: 4 | C26: 15 | D26: 10 | E26: 0 | F26: 3
A27: Totals | B27: =IF(B2="","",SUM(B9:B26)) -> 70 | D27: =IF(B2="","",SUM(D9:D26)) -> 122 | E27: =IF(B2="","",SUM(E9:E26)) -> 17 | F27: =IF(B2="","",SUM(F9:F26)) -> 42 | G27: =IF(B2="","",SUM(G9:G26)) -> 1 | H27: =IF(B2="","",SUM(H9:H26)) -> 7 | I27: =IF(COUNTIF(I9:I26,"=Yes")=0,"",COUNTIF(I9:I26,"=Yes")) -> 6