A1: Keith Mendelson
A2: Club | B2: Foxhills
A3: Par/SS | B3: 72/72 | D3: Num. Of Fairways | I3: =IF(B2="","",18-(COUNTIF(B9:B26,3))) -> 14
A4: Date | B4: 39393 | D4: Playing Handicap | I4: 14.9
A5: Event Place | B5: 2 | D5: Prize Money | G5: 8750
A6: Game Stats | B6: DB+ | C6: DB | D6: Bi | E6: P | F6: B | G6: E | H6: A | I6: H1
B7: 2 | C7: 2 | D7: 8 | E7: 6 | F7: 0 | G7: 0 | H7: 0 | I7: 0
A8: Hole No | B8: Par | C8: Stroke Index | D8: Gross Score | E8: Points | F8: Putts | G8: Fairways | H8: Ferrets | I8: Green Regulation
A9: 1 | B9: 4 | C9: 9 | D9: 4 | E9: 3 | F9: 1 | I9: Yes
A10: 2 | B10: 4 | C10: 13 | D10: 4 | E10: 3 | F10: 2 | G10: 1 | I10: Yes
A11: 3 | B11: 4 | C11: 3 | D11: 5 | E11: 2 | F11: 1 | G11: 1
A12: 4 | B12: 3 | C12: 17 | D12: 5 | E12: 0 | F12: 4 | I12: Yes
A13: 5 | B13: 5 | C13: 5 | D13: 5 | E13: 3 | F13: 2 | I13: Yes
A14: 6 | B14: 3 | C14: 15 | D14: 4 | E14: 2 | F14: 2 | I14: Yes
A15: 7 | B15: 5 | C15: 11 | D15: 6 | E15: 2 | F15: 2 | G15: 1 | I15: Yes
A16: 8 | B16: 4 | C16: 7 | D16: 5 | E16: 2 | F16: 2 | I16: Yes
A17: 9 | B17: 4 | C17: 1 | D17: 5 | E17: 2 | F17: 0 | G17: 1
A18: 10 | B18: 4 | C18: 14 | D18: 10 | E18: 0 | F18: 3 | H18: 2
A19: 11 | B19: 3 | C19: 12 | D19: 4 | E19: 2 | F19: 2 | I19: Yes
A20: 12 | B20: 4 | C20: 18 | D20: 4 | E20: 2 | F20: 1 | G20: 1
A21: 13 | B21: 4 | C21: 6 | D21: 5 | E21: 2 | F21: 2 | I21: Yes
A22: 14 | B22: 5 | C22: 2 | D22: 5 | E22: 3 | F22: 2 | I22: Yes
A23: 15 | B23: 4 | C23: 16 | D23: 5 | E23: 1 | F23: 2
A24: 16 | B24: 3 | C24: 8 | D24: 6 | E24: 0 | F24: 0
A25: 17 | B25: 4 | C25: 4 | D25: 6 | E25: 1 | F25: 1
A26: 18 | B26: 5 | C26: 10 | D26: 5 | E26: 3 | F26: 2 | G26: 1 | I26: Yes
A27: Totals | B27: =IF(B2="","",SUM(B9:B26)) -> 72 | D27: =IF(B2="","",SUM(D9:D26)) -> 93 | E27: =IF(B2="","",SUM(E9:E26)) -> 33 | F27: =IF(B2="","",SUM(F9:F26)) -> 31 | G27: =IF(B2="","",SUM(G9:G26)) -> 6 | H27: =IF(B2="","",SUM(H9:H26)) -> 2 | I27: =IF(COUNTIF(I9:I26,"=Yes")=0,"",COUNTIF(I9:I26,"=Yes")) -> 11