A1: Alan Hopkins
A2: Club | B2: Maidenhead
A3: Par/SS | B3: 70/69 | D3: Num. Of Fairways | I3: =IF(B2="","",18-(COUNTIF(B9:B26,3))) -> 14
A4: Date | B4: 38626 | D4: Playing Handicap | I4: 7.4000000000009987
A5: Event Place | B5: 1 | D5: Prize Money | G5: 5000
A6: Game Stats | B6: DB+ | C6: DB | D6: Bi | E6: P | F6: B | G6: E | H6: A | I6: H1
B7: 0 | C7: 5 | D7: 6 | E7: 6 | F7: 1 | G7: 0 | H7: 0 | I7: 0
A8: Hole No | B8: Par | C8: Stroke Index | D8: Gross Score | E8: Points | F8: Putts | G8: Fairways | H8: Ferrets | I8: Green Regulation
A9: 1 | B9: 4 | C9: 9 | D9: 5 | E9: 1 | F9: 2 | G9: 1
A10: 2 | B10: 4 | C10: 7 | D10: 4 | E10: 3 | F10: 1 | G10: 1 | I10: Yes
A11: 3 | B11: 4 | C11: 13 | D11: 4 | E11: 2 | F11: 2 | G11: 1 | I11: Yes
A12: 4 | B12: 4 | C12: 1 | D12: 5 | E12: 2 | F12: 1
A13: 5 | B13: 4 | C13: 17 | D13: 4 | E13: 2 | F13: 2 | G13: 1 | I13: Yes
A14: 6 | B14: 3 | C14: 11 | D14: 4 | E14: 1 | F14: 2
A15: 7 | B15: 4 | C15: 5 | D15: 6 | E15: 1 | F15: 3 | I15: Yes
A16: 8 | B16: 4 | C16: 3 | D16: 5 | E16: 2 | F16: 2 | I16: Yes
A17: 9 | B17: 5 | C17: 15 | D17: 7 | E17: 0 | F17: 2 | G17: 1
A18: 10 | B18: 3 | C18: 16 | D18: 3 | E18: 2 | F18: 0
A19: 11 | B19: 4 | C19: 2 | D19: 6 | E19: 1 | F19: 1 | G19: 1
A20: 12 | B20: 4 | C20: 18 | D20: 5 | E20: 1 | F20: 2
A21: 13 | B21: 3 | C21: 12 | D21: 3 | E21: 2 | F21: 2 | I21: Yes
A22: 14 | B22: 4 | C22: 4 | D22: 5 | E22: 2 | F22: 2 | I22: Yes
A23: 15 | B23: 4 | C23: 8 | D23: 6 | E23: 0 | F23: 2 | H23: 1
A24: 16 | B24: 3 | C24: 10 | D24: 2 | E24: 3 | F24: 1 | I24: Yes
A25: 17 | B25: 5 | C25: 14 | D25: 7 | E25: 0 | F25: 2
A26: 18 | B26: 4 | C26: 6 | D26: 4 | E26: 3 | F26: 1 | I26: Yes
A27: Totals | B27: =IF(B2="","",SUM(B9:B26)) -> 70 | D27: =IF(B2="","",SUM(D9:D26)) -> 85 | E27: =IF(B2="","",SUM(E9:E26)) -> 28 | F27: =IF(B2="","",SUM(F9:F26)) -> 30 | G27: =IF(B2="","",SUM(G9:G26)) -> 6 | H27: =IF(B2="","",SUM(H9:H26)) -> 1 | I27: =IF(COUNTIF(I9:I26,"=Yes")=0,"",COUNTIF(I9:I26,"=Yes")) -> 9