A1: Alan Hopkins
A2: Club | B2: Sunningdale New Course
A3: Par/SS | B3: 70/70 | D3: Num. Of Fairways | I3: =IF(B2="","",18-(COUNTIF(B9:B26,3))) -> 13
A4: Date | B4: 38633 | D4: Playing Handicap | I4: 7.1000000000009988
A5: Event Place | B5: 1 | D5: Prize Money | G5: 5000
A6: Game Stats | B6: DB+ | C6: DB | D6: Bi | E6: P | F6: B | G6: E | H6: A | I6: H1
B7: 2 | C7: 2 | D7: 6 | E7: 7 | F7: 1 | G7: 0 | H7: 0 | I7: 0
A8: Hole No | B8: Par | C8: Stroke Index | D8: Gross Score | E8: Points | F8: Putts | G8: Fairways | H8: Ferrets | I8: Green Regulation
A9: 1 | B9: 5 | C9: 8 | D9: 4 | E9: 3 | F9: 2 | G9: 1 | I9: Yes
A10: 2 | B10: 3 | C10: 16 | D10: 5 | E10: 0 | F10: 2
A11: 3 | B11: 4 | C11: 4 | D11: 4 | E11: 3 | F11: 2 | G11: 1 | I11: Yes
A12: 4 | B12: 4 | C12: 10 | D12: 6 | E12: 0 | F12: 3
A13: 5 | B13: 3 | C13: 12 | D13: 3 | E13: 2 | F13: 2 | I13: Yes
A14: 6 | B14: 5 | C14: 2 | D14: 6 | E14: 2 | F14: 2 | G14: 1 | I14: Yes
A15: 7 | B15: 4 | C15: 18 | D15: 4 | E15: 2 | F15: 1
A16: 8 | B16: 4 | C16: 14 | D16: 5 | E16: 1 | F16: 2 | G16: 1
A17: 9 | B17: 4 | C17: 6 | D17: 5 | E17: 2 | F17: 3 | G17: 1 | I17: Yes
A18: 10 | B18: 3 | C18: 9 | D18: 3 | E18: 2 | F18: 2 | I18: Yes
A19: 11 | B19: 4 | C19: 1 | D19: 5 | E19: 2 | F19: 3 | G19: 1 | I19: Yes
A20: 12 | B20: 4 | C20: 15 | D20: 4 | E20: 2 | F20: 2 | G20: 1 | I20: Yes
A21: 13 | B21: 5 | C21: 5 | D21: 9 | E21: 0 | F21: 3
A22: 14 | B22: 3 | C22: 11 | D22: 4 | E22: 1 | F22: 2
A23: 15 | B23: 4 | C23: 3 | D23: 4 | E23: 3 | F23: 2 | G23: 1 | I23: Yes
A24: 16 | B24: 4 | C24: 13 | D24: 5 | E24: 1 | F24: 2
A25: 17 | B25: 3 | C25: 17 | D25: 6 | E25: 0 | F25: 3 | H25: 1
A26: 18 | B26: 5 | C26: 7 | D26: 5 | E26: 3 | F26: 2 | G26: 1 | I26: Yes
A27: Totals | B27: =IF(B2="","",SUM(B9:B26)) -> 71 | D27: =IF(B2="","",SUM(D9:D26)) -> 87 | E27: =IF(B2="","",SUM(E9:E26)) -> 29 | F27: =IF(B2="","",SUM(F9:F26)) -> 40 | G27: =IF(B2="","",SUM(G9:G26)) -> 9 | H27: =IF(B2="","",SUM(H9:H26)) -> 1 | I27: =IF(COUNTIF(I9:I26,"=Yes")=0,"",COUNTIF(I9:I26,"=Yes")) -> 10