A1: Alan Hopkins
A2: Club | B2: Sunningdale Old Course
A3: Par/SS | B3: 70/70 | D3: Num. Of Fairways | I3: =IF(B2="","",18-(COUNTIF(B9:B26,3))) -> 14
A4: Date | B4: 38648 | D4: Playing Handicap | I4: 7.5000000000019984
A5: Event Place | B5: 2 | D5: Prize Money | G5: 2500
A6: Game Stats | B6: DB+ | C6: DB | D6: BI | E6: P | F6: B | G6: E | H6: A | I6: H1
B7: 2 | C7: 4 | D7: 6 | E7: 6 | F7: 0 | G7: 0 | H7: 0 | I7: 0
A8: Hole No | B8: Par | C8: Stroke Index | D8: Gross Score | E8: Points | F8: Putts | G8: Fairways | H8: Ferrets | I8: Green Regulation
A9: 1 | B9: 5 | C9: 8 | D9: 5 | E9: 3 | F9: 2 | I9: Yes
A10: 2 | B10: 4 | C10: 4 | D10: 7 | E10: 0 | F10: 2
A11: 3 | B11: 4 | C11: 12 | D11: 4 | E11: 2 | F11: 2 | G11: 1 | I11: Yes
A12: 4 | B12: 3 | C12: 16 | D12: 5 | E12: 0 | F12: 2
A13: 5 | B13: 4 | C13: 2 | D13: 4 | E13: 3 | F13: 2 | I13: Yes
A14: 6 | B14: 4 | C14: 10 | D14: 4 | E14: 2 | F14: 2 | G14: 1 | I14: Yes
A15: 7 | B15: 4 | C15: 6 | D15: 4 | E15: 3 | F15: 2 | G15: 1 | I15: Yes
A16: 8 | B16: 3 | C16: 18 | D16: 3 | E16: 2 | F16: 2 | I16: Yes
A17: 9 | B17: 4 | C17: 14 | D17: 5 | E17: 1 | F17: 2
A18: 10 | B18: 4 | C18: 7 | D18: 6 | E18: 1 | F18: 2
A19: 11 | B19: 4 | C19: 15 | D19: 6 | E19: 0 | F19: 2 | G19: 1 | H19: 1
A20: 12 | B20: 4 | C20: 1 | D20: 6 | E20: 1 | F20: 2
A21: 13 | B21: 3 | C21: 17 | D21: 4 | E21: 1 | F21: 2
A22: 14 | B22: 5 | C22: 5 | D22: 6 | E22: 2 | F22: 2 | I22: Yes
A23: 15 | B23: 3 | C23: 11 | D23: 8 | E23: 0 | F23: 3
A24: 16 | B24: 4 | C24: 3 | D24: 5 | E24: 2 | F24: 2 | I24: Yes
A25: 17 | B25: 4 | C25: 13 | D25: 5 | E25: 1 | F25: 3 | G25: 1 | I25: Yes
A26: 18 | B26: 4 | C26: 9 | D26: 5 | E26: 1 | F26: 2 | G26: 1
A27: Totals | B27: =IF(B2="","",SUM(B9:B26)) -> 70 | D27: =IF(B2="","",SUM(D9:D26)) -> 92 | E27: =IF(B2="","",SUM(E9:E26)) -> 25 | F27: =IF(B2="","",SUM(F9:F26)) -> 38 | G27: =IF(B2="","",SUM(G9:G26)) -> 6 | H27: =IF(B2="","",SUM(H9:H26)) -> 1 | I27: =IF(COUNTIF(I9:I26,"=Yes")=0,"",COUNTIF(I9:I26,"=Yes")) -> 9