A1: Dave Rouse
A2: Club | B2: Hoebridge
A3: Par/SS | B3: 71/70 | D3: Num. Of Fairways | I3: =IF(B2="","",18-(COUNTIF(B9:B26,3))) -> 13
A4: Date | B4: 38647 | D4: Playing Handicap | I4: 23.1
A5: Event Place | B5: 4 | D5: Prize Money | G5: 2500
A6: Game Stats | B6: DB+ | C6: DB | D6: BI | E6: P | F6: B | G6: E | H6: A | I6: H1
B7: 5 | C7: 6 | D7: 5 | E7: 2 | F7: 0 | G7: 0 | H7: 0 | I7: 0
A8: Hole No | B8: Par | C8: Stroke Index | D8: Gross Score | E8: Points | F8: Putts | G8: Fairways | H8: Ferrets | I8: Green Regulation
A9: 1 | B9: 5 | C9: 11 | D9: 6 | E9: 2 | F9: 2 | I9: Yes
A10: 2 | B10: 3 | C10: 17 | D10: 5 | E10: 1 | F10: 2
A11: 3 | B11: 4 | C11: 7 | D11: 6 | E11: 1 | F11: 1
A12: 4 | B12: 4 | C12: 1 | D12: 6 | E12: 2 | F12: 2 | G12: 1 | I12: Yes
A13: 5 | B13: 4 | C13: 5 | D13: 6 | E13: 2 | F13: 2 | G13: 1 | I13: Yes
A14: 6 | B14: 3 | C14: 15 | D14: 3 | E14: 3 | F14: 1 | I14: Yes
A15: 7 | B15: 4 | C15: 3 | D15: 7 | E15: 1 | F15: 2
A16: 8 | B16: 4 | C16: 9 | D16: 7 | E16: 0 | F16: 3
A17: 9 | B17: 5 | C17: 13 | D17: 6 | E17: 2 | F17: 2 | I17: Yes
A18: 10 | B18: 4 | C18: 12 | D18: 5 | E18: 2 | F18: 2 | I18: Yes
A19: 11 | B19: 4 | C19: 4 | D19: 5 | E19: 3 | F19: 2 | I19: Yes
A20: 12 | B20: 3 | C20: 18 | D20: 3 | E20: 3 | F20: 1 | I20: Yes
A21: 13 | B21: 5 | C21: 8 | D21: 7 | E21: 1 | F21: 3 | G21: 1 | I21: Yes
A22: 14 | B22: 4 | C22: 14 | D22: 7 | E22: 0 | F22: 2
A23: 15 | B23: 4 | C23: 2 | D23: 7 | E23: 1 | F23: 3 | I23: Yes
A24: 16 | B24: 3 | C24: 10 | D24: 4 | E24: 2 | F24: 2 | I24: Yes
A25: 17 | B25: 5 | C25: 6 | D25: 9 | E25: 0 | F25: 3
A26: 18 | B26: 3 | C26: 16 | D26: 5 | E26: 1 | F26: 2
A27: Totals | B27: =IF(B2="","",SUM(B9:B26)) -> 71 | D27: =IF(B2="","",SUM(D9:D26)) -> 104 | E27: =IF(B2="","",SUM(E9:E26)) -> 27 | F27: =IF(B2="","",SUM(F9:F26)) -> 37 | G27: =IF(B2="","",SUM(G9:G26)) -> 3 | H27: =IF(B2="","",SUM(H9:H26)) -> 0 | I27: =IF(COUNTIF(I9:I26,"=Yes")=0,"",COUNTIF(I9:I26,"=Yes")) -> 11