A1: Martin Bould
A2: Club | B2: Sunningdale New Course
A3: Par/SS | B3: 70/70 | D3: Num. Of Fairways | I3: =IF(B2="","",18-(COUNTIF(B9:B26,3))) -> 13
A4: Date | B4: 38633 | D4: Playing Handicap | I4: 19.600000000001
A5: Event Place | B5: 2 | D5: Prize Money | G5: 2500
A6: Game Stats | B6: DB+ | C6: DB | D6: BI | E6: P | F6: B | G6: E | H6: A | I6: H1
B7: 6 | C7: 5 | D7: 6 | E7: 1 | F7: 0 | G7: 0 | H7: 0 | I7: 0
A8: Hole No | B8: Par | C8: Stroke Index | D8: Gross Score | E8: Points | F8: Putts | G8: Fairways | H8: Ferrets | I8: Green Regulation
A9: 1 | B9: 5 | C9: 8 | D9: 7 | E9: 1 | F9: 2 | G9: 1
A10: 2 | B10: 3 | C10: 16 | D10: 6 | E10: 0 | F10: 1
A11: 3 | B11: 4 | C11: 4 | D11: 7 | E11: 0 | F11: 3
A12: 4 | B12: 4 | C12: 10 | D12: 8 | E12: 0 | F12: 3
A13: 5 | B13: 3 | C13: 12 | D13: 4 | E13: 2 | F13: 2 | I13: Yes
A14: 6 | B14: 5 | C14: 2 | D14: 7 | E14: 2 | F14: 2 | I14: Yes
A15: 7 | B15: 4 | C15: 18 | D15: 6 | E15: 1 | F15: 2
A16: 8 | B16: 4 | C16: 14 | D16: 4 | E16: 3 | F16: 1 | I16: Yes
A17: 9 | B17: 4 | C17: 6 | D17: 7 | E17: 0 | F17: 3
A18: 10 | B18: 3 | C18: 9 | D18: 5 | E18: 1 | F18: 3 | I18: Yes
A19: 11 | B19: 4 | C19: 1 | D19: 5 | E19: 3 | F19: 2 | G19: 1 | I19: Yes
A20: 12 | B20: 4 | C20: 15 | D20: 5 | E20: 2 | F20: 2 | G20: 1 | I20: Yes
A21: 13 | B21: 5 | C21: 5 | D21: 6 | E21: 2 | F21: 2 | I21: Yes
A22: 14 | B22: 3 | C22: 11 | D22: 4 | E22: 2 | F22: 1
A23: 15 | B23: 4 | C23: 3 | D23: 7 | E23: 0 | F23: 2
A24: 16 | B24: 4 | C24: 13 | D24: 6 | E24: 1 | F24: 3 | I24: Yes
A25: 17 | B25: 3 | C25: 17 | D25: 6 | E25: 0 | F25: 3
A26: 18 | B26: 5 | C26: 7 | D26: 6 | E26: 2 | F26: 2 | G26: 1 | I26: Yes
A27: Totals | B27: =IF(B2="","",SUM(B9:B26)) -> 71 | D27: =IF(B2="","",SUM(D9:D26)) -> 106 | E27: =IF(B2="","",SUM(E9:E26)) -> 22 | F27: =IF(B2="","",SUM(F9:F26)) -> 39 | G27: =IF(B2="","",SUM(G9:G26)) -> 4 | H27: =IF(B2="","",SUM(H9:H26)) -> 0 | I27: =IF(COUNTIF(I9:I26,"=Yes")=0,"",COUNTIF(I9:I26,"=Yes")) -> 9