A1: Roy Dickens
A2: Club | B2: Hoebridge
A3: Par/SS | B3: 71/70 | D3: Num. Of Fairways | I3: =IF(B2="","",18-(COUNTIF(B9:B26,3))) -> 13
A4: Date | B4: 38647 | D4: Playing Handicap | I4: 31.9
A5: Event Place | B5: 1 | D5: Prize Money | G5: 10000
A6: Game Stats | B6: DB+ | C6: DB | D6: Bi | E6: P | F6: B | G6: E | H6: A | I6: H1
B7: 3 | C7: 5 | D7: 7 | E7: 2 | F7: 1 | G7: 0 | H7: 0 | I7: 0
A8: Hole No | B8: Par | C8: Stroke Index | D8: Gross Score | E8: Points | F8: Putts | G8: Fairways | H8: Ferrets | I8: Green Regulation
A9: 1 | B9: 5 | C9: 11 | D9: 4 | E9: 5 | F9: 1 | I9: Yes
A10: 2 | B10: 3 | C10: 17 | D10: 4 | E10: 2 | F10: 2 | I10: Yes
A11: 3 | B11: 4 | C11: 7 | D11: 8 | E11: 0 | F11: 2 | G11: 1
A12: 4 | B12: 4 | C12: 1 | D12: 5 | E12: 3 | F12: 1 | I12: Yes
A13: 5 | B13: 4 | C13: 5 | D13: 7 | E13: 1 | F13: 2
A14: 6 | B14: 3 | C14: 15 | D14: 4 | E14: 2 | F14: 2 | I14: Yes
A15: 7 | B15: 4 | C15: 3 | D15: 5 | E15: 3 | F15: 2 | I15: Yes
A16: 8 | B16: 4 | C16: 9 | D16: 4 | E16: 4 | F16: 1 | I16: Yes
A17: 9 | B17: 5 | C17: 13 | D17: 7 | E17: 2 | F17: 2 | I17: Yes
A18: 19 | B18: 4 | C18: 12 | D18: 5 | E18: 3 | F18: 2 | I18: Yes
A19: 20 | B19: 4 | C19: 4 | D19: 5 | E19: 3 | F19: 1 | I19: Yes
A20: 21 | B20: 3 | C20: 18 | D20: 6 | E20: 0 | F20: 3
A21: 22 | B21: 5 | C21: 8 | D21: 7 | E21: 2 | F21: 2 | I21: Yes
A22: 23 | B22: 4 | C22: 14 | D22: 6 | E22: 2 | F22: 2 | G22: 1 | I22: Yes
A23: 24 | B23: 4 | C23: 2 | D23: 6 | E23: 2 | F23: 2 | I23: Yes
A24: 25 | B24: 3 | C24: 10 | D24: 4 | E24: 3 | F24: 2 | I24: Yes
A25: 26 | B25: 5 | C25: 6 | D25: 7 | E25: 2 | F25: 1 | G25: 1
A26: 27 | B26: 3 | C26: 16 | D26: 3 | E26: 3 | F26: 2 | I26: Yes
A27: Totals | B27: =IF(B2="","",SUM(B9:B26)) -> 71 | D27: =IF(B2="","",SUM(D9:D26)) -> 97 | E27: =IF(B2="","",SUM(E9:E26)) -> 42 | F27: =IF(B2="","",SUM(F9:F26)) -> 32 | G27: =IF(B2="","",SUM(G9:G26)) -> 3 | H27: =IF(B2="","",SUM(H9:H26)) -> 0 | I27: =IF(COUNTIF(I9:I26,"=Yes")=0,"",COUNTIF(I9:I26,"=Yes")) -> 14