B1: Season 16 - April 1st 2014 to 31st March 2015
A2: MGA World Tour Order of Ferret by Average
B3: Statistics updated | C3: =TODAY() -> 42089 | G3: See Ferrets by Quantity
A4: Pos | B4: Player | C4: Original Handicap | D4: Current Handicap | E4: Playing Handicap | F4: Played | G4: Total Ferrets | H4: Average per Round | I4: Ferret ratio
A5: 1 | B5: Ian Edwards | C5: 15.6 | D5: 17.000000000002 | E5: =D5 -> 17.000000000002 | F5: 4 | G5: 23 | H5: 5.75 | I5: =IF(G5="","",IF(G5=0,"0 : "&F5*18,"1 : "&ROUND(((F5*18)/G5),0))) -> 1 : 3
A6: 2 | B6: Martin Bould | C6: 16.0 | D6: 16.2 | E6: =D6 -> 16.2 | F6: 1 | G6: 4 | H6: 4.00 | I6: =IF(G6="","",IF(G6=0,"0 : "&F6*18,"1 : "&ROUND(((F6*18)/G6),0))) -> 1 : 5
A7: 3 | B7: Andrew Baldwin | C7: 20.0 | D7: 20.4 | E7: =D7 -> 20.4 | F7: 3 | G7: 11 | H7: 3.6666666666666665 | I7: =IF(G7="","",IF(G7=0,"0 : "&F7*18,"1 : "&ROUND(((F7*18)/G7),0))) -> 1 : 5
A8: 4 | B8: Roy Dickens | C8: 30.4 | D8: 28.800000000001003 | E8: =D8 -> 28.800000000001003 | F8: 5 | G8: 15 | H8: 3.00 | I8: =IF(G8="","",IF(G8=0,"0 : "&F8*18,"1 : "&ROUND(((F8*18)/G8),0))) -> 1 : 6
A9: 5 | B9: Alan Baldwin | C9: 21.1 | D9: 22.2 | E9: =D9 -> 22.2 | F9: 2 | G9: 6 | H9: 3.00 | I9: =IF(G9="","",IF(G9=0,"0 : "&F9*18,"1 : "&ROUND(((F9*18)/G9),0))) -> 1 : 6
A10: 6 | B10: Alan Hopkins | C10: 7.9 | D10: 7.9 | E10: =D10 -> 7.9 | F10: 2 | G10: 6 | H10: 3.00 | I10: =IF(G10="","",IF(G10=0,"0 : "&F10*18,"1 : "&ROUND(((F10*18)/G10),0))) -> 1 : 6
A11: 7 | B11: Jeff Colbrook | C11: 17.2 | D11: 18.4 | E11: =D11 -> 18.4 | F11: 5 | G11: 13 | H11: 2.60 | I11: =IF(G11="","",IF(G11=0,"0 : "&F11*18,"1 : "&ROUND(((F11*18)/G11),0))) -> 1 : 7
A12: 8 | B12: David Rouse | C12: 25.8 | D12: 27.0 | E12: =D12 -> 27 | F12: 8 | G12: 20 | H12: 2.50 | I12: =IF(G12="","",IF(G12=0,"0 : "&F12*18,"1 : "&ROUND(((F12*18)/G12),0))) -> 1 : 7
A13: 9 | B13: Paul Baldwin | C13: 20.4 | D13: 19.000000000000998 | E13: =D13 -> 19.000000000000998 | F13: 4 | G13: 10 | H13: 2.50 | I13: =IF(G13="","",IF(G13=0,"0 : "&F13*18,"1 : "&ROUND(((F13*18)/G13),0))) -> 1 : 7
A14: 10 | B14: Simon Owens | C14: 14.8 | D14: 15.1 | E14: =D14 -> 15.1 | F14: 4 | G14: 9 | H14: 2.25 | I14: =IF(G14="","",IF(G14=0,"0 : "&F14*18,"1 : "&ROUND(((F14*18)/G14),0))) -> 1 : 8
A15: 11 | B15: Michael Trimmings | C15: 20.3 | D15: 19.8 | E15: =D15 -> 19.8 | F15: 5 | G15: 11 | H15: 2.20 | I15: =IF(G15="","",IF(G15=0,"0 : "&F15*18,"1 : "&ROUND(((F15*18)/G15),0))) -> 1 : 8
A16: 12 | B16: Robert Thompson | C16: 9.2 | D16: 11.9 | E16: =D16 -> 11.9 | F16: 9 | G16: 18 | H16: 2.00 | I16: =IF(G16="","",IF(G16=0,"0 : "&F16*18,"1 : "&ROUND(((F16*18)/G16),0))) -> 1 : 9
A17: 13 | B17: Simon Thompson | C17: 11.2 | D17: 10.3 | E17: =D17 -> 10.3 | F17: 5 | G17: 9 | H17: 1.80 | I17: =IF(G17="","",IF(G17=0,"0 : "&F17*18,"1 : "&ROUND(((F17*18)/G17),0))) -> 1 : 10
A18: 14 | B18: David Braithwaite | C18: 12.6 | D18: 11.100000000000998 | E18: =D18 -> 11.100000000000998 | F18: 8 | G18: 14 | H18: 1.75 | I18: =IF(G18="","",IF(G18=0,"0 : "&F18*18,"1 : "&ROUND(((F18*18)/G18),0))) -> 1 : 10
A19: 15 | B19: Paul Carter | C19: 13.8 | D19: 12.0 | E19: =D19 -> 12 | F19: 7 | G19: 12 | H19: 1.7142857142857142 | I19: =IF(G19="","",IF(G19=0,"0 : "&F19*18,"1 : "&ROUND(((F19*18)/G19),0))) -> 1 : 11
A20: 16 | B20: Martin Cox | C20: 12.8 | D20: 13.8 | E20: =D20 -> 13.8 | F20: 5 | G20: 7 | H20: 1.40 | I20: =IF(G20="","",IF(G20=0,"0 : "&F20*18,"1 : "&ROUND(((F20*18)/G20),0))) -> 1 : 13
A21: 17 | B21: Kevin Gallagher | C21: 13.0 | D21: 13.4 | E21: =D21 -> 13.4 | F21: 6 | G21: 8 | H21: 1.3333333333333333 | I21: =IF(G21="","",IF(G21=0,"0 : "&F21*18,"1 : "&ROUND(((F21*18)/G21),0))) -> 1 : 14
A22: 18 | B22: David Kewley | C22: 17.1 | D22: 14.900000000001 | E22: =D22 -> 14.900000000001 | F22: 7 | G22: 9 | H22: 1.2857142857142858 | I22: =IF(G22="","",IF(G22=0,"0 : "&F22*18,"1 : "&ROUND(((F22*18)/G22),0))) -> 1 : 14
A23: 19 | B23: Keith Mendelson | C23: 11.8 | D23: 12.8 | E23: =D23 -> 12.8 | F23: 5 | G23: 6 | H23: 1.20 | I23: =IF(G23="","",IF(G23=0,"0 : "&F23*18,"1 : "&ROUND(((F23*18)/G23),0))) -> 1 : 15
A24: 20 | B24: Matthew Carter | C24: 16.2 | D24: 15.400000000000999 | E24: =D24 -> 15.400000000000999 | F24: 5 | G24: 6 | H24: 1.20 | I24: =IF(G24="","",IF(G24=0,"0 : "&F24*18,"1 : "&ROUND(((F24*18)/G24),0))) -> 1 : 15
A25: 21 | B25: David Bingham | C25: 11.3 | D25: 11.000000000001998 | E25: =D25 -> 11.000000000001998 | F25: 6 | G25: 7 | H25: 1.1666666666666667 | I25: =IF(G25="","",IF(G25=0,"0 : "&F25*18,"1 : "&ROUND(((F25*18)/G25),0))) -> 1 : 15
A26: 22 | B26: Jon Press | C26: 13.8 | D26: 13.5 | E26: =D26 -> 13.5 | F26: 6 | G26: 6 | H26: 1.00 | I26: =IF(G26="","",IF(G26=0,"0 : "&F26*18,"1 : "&ROUND(((F26*18)/G26),0))) -> 1 : 18
A27: 23 | B27: Andy Benson | C27: 6.3 | D27: 6.1 | E27: =D27 -> 6.1 | F27: 1 | G27: 1 | H27: 1.00 | I27: =IF(G27="","",IF(G27=0,"0 : "&F27*18,"1 : "&ROUND(((F27*18)/G27),0))) -> 1 : 18
A28: 24 | B28: Jon Dey | C28: 23.8 | D28: 22.8 | E28: =D28 -> 22.8 | F28: 7 | G28: 6 | H28: 0.8571428571428571 | I28: =IF(G28="","",IF(G28=0,"0 : "&F28*18,"1 : "&ROUND(((F28*18)/G28),0))) -> 1 : 21
A29: 25 | B29: David Andrews | C29: 15.6 | D29: 14.3 | E29: =D29 -> 14.3 | F29: 5 | G29: 4 | H29: 0.80 | I29: =IF(G29="","",IF(G29=0,"0 : "&F29*18,"1 : "&ROUND(((F29*18)/G29),0))) -> 1 : 23
A30: 26 | B30: Chris Manning | C30: 22.9 | D30: 23.3 | E30: =D30 -> 23.3 | F30: 2 | G30: 1 | H30: 0.50 | I30: =IF(G30="","",IF(G30=0,"0 : "&F30*18,"1 : "&ROUND(((F30*18)/G30),0))) -> 1 : 36
A31: 27 | B31: David Archer | C31: 21.2 | D31: 21.700000000000998 | E31: =D31 -> 21.700000000000998 | F31: 4 | G31: 1 | H31: 0.25 | I31: =IF(G31="","",IF(G31=0,"0 : "&F31*18,"1 : "&ROUND(((F31*18)/G31),0))) -> 1 : 72
B32: Clive Ferris | C32: 26.0 | D32: 26.0 | E32: =D32 -> 26 | F32: 0 | G32: 0 | H32: 0.00 | I32: =IF(G32="","",IF(G32=0,"0 : "&F32*18,"1 : "&ROUND(((F32*18)/G32),0))) -> 0 : 0
B33: Malcolm Rouse | C33: 44.9 | D33: 44.9 | E33: =D33 -> 44.9 | F33: 0 | G33: 0 | H33: 0.00 | I33: =IF(G33="","",IF(G33=0,"0 : "&F33*18,"1 : "&ROUND(((F33*18)/G33),0))) -> 0 : 0
B34: Steve Tilling | C34: 16.3 | D34: 16.3 | E34: =D34 -> 16.3 | F34: 0 | G34: 0 | H34: 0.00 | I34: =IF(G34="","",IF(G34=0,"0 : "&F34*18,"1 : "&ROUND(((F34*18)/G34),0))) -> 0 : 0
F35: TOTAL | G35: =SUM(G5:G34) -> 243