B1: MAJORS TROPHY - 2014/2015
B3: Awarded to the player with most accumulated points in Majors in a season
C4: Tubby Trophy 6/5/14 | D4: Mendy's Masters 6/9/14 | E4: Bubble Open 14/6/14 | F4: Rousey Invitation 4/10/14 | G4: Skips Memorial 19/7/14 | H4: Player's Championship 22/11/14 | I4: Thommo Classic 21/3/15 | J4: Total
B5: P Carter | C5: 27 | D5: 26 | E5: 27 | F5: 26 | G5: 41 | H5: 27 | I5: 29 | J5: =SUM(C5:I5) -> 203
B6: D Braithwaite | C6: 28 | D6: 0 | E6: 33 | F6: 27 | G6: 41 | H6: 32 | I6: 0 | J6: =SUM(C6:I6) -> 161
B7: R Thompson | C7: 25 | D7: 27 | E7: 27 | F7: 25 | G7: 30 | H7: 24 | I7: 16 | J7: =SUM(C7:I7) -> 174
B8: D Kewley | C8: 20 | D8: 0 | E8: 36 | F8: 27 | G8: 43 | H8: 25 | I8: 0 | J8: =SUM(C8:I8) -> 151
B9: D Bingham | C9: 25 | D9: 31 | E9: 28 | F9: 0 | G9: 39 | H9: 28 | I9: 22 | J9: =SUM(C9:I9) -> 173
B10: M Carter | C10: 25 | D10: 0 | E10: 29 | F10: 30 | G10: 39 | H10: 28 | I10: 0 | J10: =SUM(C10:I10) -> 151
B11: D Rouse | C11: 24 | D11: 22 | E11: 22 | F11: 26 | G11: 29 | H11: 27 | I11: 0 | J11: =SUM(C11:I11) -> 150
B12: K Gallagher | C12: 24 | D12: 25 | E12: 26 | F12: 35 | G12: 36 | H12: 0 | I12: 20 | J12: =SUM(C12:I12) -> 166
B13: R Dickens | C13: 31 | D13: 28 | E13: 0 | F13: 37 | G13: 38 | H13: 0 | I13: 0 | J13: =SUM(C13:I13) -> 134
B14: P Baldwin | C14: 25 | D14: 39 | E14: 28 | F14: 0 | G14: 36 | H14: 0 | I14: 0 | J14: =SUM(C14:I14) -> 128
B15: J Dey | C15: 0 | D15: 29 | E15: 36 | F15: 30 | G15: 33 | H15: 0 | I15: 0 | J15: =SUM(C15:I15) -> 128
B16: J Colbrook | C16: 0 | D16: 25 | E16: 36 | F16: 15 | G16: 21 | H16: 25 | I16: 0 | J16: =SUM(C16:I16) -> 122
B17: M Cox | C17: 27 | D17: 27 | E17: 30 | F17: 0 | G17: 35 | H17: 0 | I17: 19 | J17: =SUM(C17:I17) -> 138
B18: M Trimmings | C18: 33 | D18: 24 | E18: 27 | F18: 0 | G18: 34 | H18: 0 | I18: 0 | J18: =SUM(C18:I18) -> 118
B19: S Thompson | C19: 32 | D19: 0 | E19: 27 | F19: 26 | G19: 27 | H19: 0 | I19: 31 | J19: =SUM(C19:I19) -> 143
B20: D Archer | C20: 0 | D20: 24 | E20: 33 | F20: 26 | G20: 28 | H20: 0 | I20: 0 | J20: =SUM(C20:I20) -> 111
B21: J Press | C21: 27 | D21: 0 | E21: 0 | F21: 30 | G21: 0 | H21: 29 | I21: 0 | J21: =SUM(C21:I21) -> 86
B22: K Mendelson | C22: 22 | D22: 28 | E22: 0 | F22: 0 | G22: 28 | H22: 0 | I22: 20 | J22: =SUM(C22:I22) -> 98
B23: D Andrews | C23: 0 | D23: 32 | E23: 0 | F23: 0 | G23: 36 | H23: 0 | I23: 26 | J23: =SUM(C23:I23) -> 94
B24: A Hopkins | C24: 0 | D24: 0 | E24: 22 | F24: 0 | G24: 37 | H24: 0 | I24: 0 | J24: =SUM(C24:I24) -> 59
B25: A Baldwin (Jnr) | C25: 26 | D25: 0 | E25: 31 | F25: 0 | G25: 0 | H25: 0 | I25: 0 | J25: =SUM(C25:I25) -> 57
B26: S Owens | C26: 0 | D26: 32 | E26: 22 | F26: 0 | G26: 0 | H26: 0 | I26: 20 | J26: =SUM(C26:I26) -> 74
B27: I Edwards | C27: 0 | D27: 28 | E27: 22 | F27: 0 | G27: 0 | H27: 0 | I27: 0 | J27: =SUM(C27:I27) -> 50
B28: A Baldwin (Snr) | C28: 15 | D28: 0 | E28: 0 | F28: 0 | G28: 32 | H28: 0 | I28: 0 | J28: =SUM(C28:I28) -> 47
B29: C Manning | C29: 0 | D29: 0 | E29: 0 | F29: 30 | G29: 0 | H29: 0 | I29: 0 | J29: =SUM(C29:I29) -> 30
B30: M Bould | C30: 0 | D30: 0 | E30: 0 | F30: 0 | G30: 25 | H30: 0 | I30: 0 | J30: =SUM(C30:I30) -> 25
B31: S Tilling | C31: 0 | D31: 0 | E31: 0 | F31: 0 | G31: 0 | H31: 0 | I31: 0 | J31: =SUM(C31:I31) -> 0