A1: Matthew Carter
A2: Club | B2: Sutton Green
A3: Par/SS | B3: 71/71 | D3: Num. Of Fairways | I3: =IF(B2="","",18-(COUNTIF(B9:B26,3))) -> 13
A4: Date | B4: 39045 | D4: Playing Handicap | I4: 21.4
A5: Event Place | B5: 2 | D5: Prize Money | G5: 5000
A6: Game Stats | B6: DB+ | C6: DB | D6: Bi | E6: P | F6: B | G6: E | H6: A | I6: H1
B7: 3 | C7: 5 | D7: 5 | E7: 5 | F7: 0 | G7: 0 | H7: 0 | I7: 0
A8: Hole No | B8: Par | C8: Stroke Index | D8: Gross Score | E8: Points | F8: Putts | G8: Fairways | H8: Ferrets | I8: Green Regulation
A9: 1 | B9: 5 | C9: 5 | D9: 6 | E9: 2 | F9: 1
A10: 2 | B10: 4 | C10: 10 | D10: 5 | E10: 2 | F10: 2 | G10: 1 | I10: Yes
A11: 3 | B11: 3 | C11: 14 | D11: 3 | E11: 3 | F11: 2 | I11: Yes
A12: 4 | B12: 4 | C12: 7 | D12: 6 | E12: 1 | F12: 4 | G12: 1 | I12: Yes
A13: 5 | B13: 3 | C13: 18 | D13: 4 | E13: 2 | F13: 2 | I13: Yes
A14: 6 | B14: 4 | C14: 13 | D14: 6 | E14: 1 | F14: 2
A15: 7 | B15: 5 | C15: 2 | D15: 10 | E15: 0 | F15: 1 | H15: 1
A16: 8 | B16: 4 | C16: 8 | D16: 6 | E16: 1 | F16: 2 | G16: 1
A17: 9 | B17: 4 | C17: 4 | D17: 4 | E17: 3 | F17: 2 | G17: 1 | I17: Yes
A18: 10 | B18: 5 | C18: 15 | D18: 7 | E18: 1 | F18: 1
A19: 11 | B19: 3 | C19: 6 | D19: 7 | E19: 0 | F19: 2
A20: 12 | B20: 4 | C20: 17 | D20: 4 | E20: 3 | F20: 1 | I20: Yes
A21: 13 | B21: 3 | C21: 9 | D21: 5 | E21: 1 | F21: 1
A22: 14 | B22: 4 | C22: 3 | D22: 8 | E22: 0 | F22: 2 | H22: 1
A23: 15 | B23: 4 | C23: 1 | D23: 5 | E23: 3 | F23: 2 | G23: 1 | I23: Yes
A24: 16 | B24: 3 | C24: 16 | D24: 3 | E24: 3 | F24: 1 | I24: Yes
A25: 17 | B25: 4 | C25: 11 | D25: 5 | E25: 2 | F25: 2 | G25: 1 | I25: Yes
A26: 18 | B26: 5 | C26: 12 | D26: 5 | E26: 3 | F26: 2 | G26: 1 | I26: Yes
A27: Totals | B27: =IF(B2="","",SUM(B9:B26)) -> 71 | D27: =IF(B2="","",SUM(D9:D26)) -> 99 | E27: =IF(B2="","",SUM(E9:E26)) -> 31 | F27: =IF(B2="","",SUM(F9:F26)) -> 32 | G27: =IF(B2="","",SUM(G9:G26)) -> 7 | H27: =IF(B2="","",SUM(H9:H26)) -> 2 | I27: =IF(COUNTIF(I9:I26,"=Yes")=0,"",COUNTIF(I9:I26,"=Yes")) -> 10