A1: Martin Cox
A2: Club | B2: Beauport Park
A3: Par/SS | B3: 71/69 | D3: Num. Of Fairways | I3: =IF(B2="","",18-(COUNTIF(B9:B26,3))) -> 14
A4: Date | B4: 39196 | D4: Playing Handicap | I4: 12.8
A5: Event Place | B5: 13 | C5: M | D5: Prize Money | G5: 2500
A6: Game Stats | B6: DB+ | C6: DB | D6: Bi | E6: P | F6: B | G6: E | H6: A | I6: H1
B7: 10 | C7: 3 | D7: 4 | E7: 1 | F7: 0 | G7: 0 | H7: 0 | I7: 0
A8: Hole No | B8: Par | C8: Stroke Index | D8: Gross Score | E8: Points | F8: Putts | G8: Fairways | H8: Ferrets | I8: Green Regulation
A9: 1 | B9: 4 | C9: 14 | D9: 6 | E9: 0 | F9: 2
A10: 2 | B10: 5 | C10: 12 | D10: 10 | E10: 0 | F10: 2 | G10: 1 | H10: 1
A11: 3 | B11: 4 | C11: 10 | D11: 10 | E11: 0 | F11: 3 | H11: 1
A12: 4 | B12: 3 | C12: 18 | D12: 4 | E12: 1 | F12: 1
A13: 5 | B13: 4 | C13: 4 | D13: 7 | E13: 0 | F13: 2
A14: 6 | B14: 3 | C14: 8 | D14: 6 | E14: 0 | F14: 1
A15: 7 | B15: 4 | C15: 16 | D15: 4 | E15: 2 | F15: 2 | G15: 1 | I15: Yes
A16: 8 | B16: 4 | C16: 2 | D16: 10 | E16: 0 | F16: 3 | H16: 1
A17: 9 | B17: 4 | C17: 6 | D17: 7 | E17: 0 | F17: 3 | H17: 1
A18: 10 | B18: 4 | C18: 15 | D18: 6 | E18: 0 | F18: 2
A19: 11 | B19: 3 | C19: 9 | D19: 5 | E19: 1 | F19: 2
A20: 12 | B20: 4 | C20: 11 | D20: 5 | E20: 2 | F20: 1
A21: 13 | B21: 4 | C21: 3 | D21: 8 | E21: 0 | F21: 2 | H21: 1
A22: 14 | B22: 4 | C22: 1 | D22: 7 | E22: 0 | F22: 2
A23: 15 | B23: 5 | C23: 7 | D23: 10 | E23: 0 | F23: 3 | H23: 2
A24: 16 | B24: 3 | C24: 17 | D24: 10 | E24: 0 | F24: 3 | H24: 1
A25: 17 | B25: 5 | C25: 5 | D25: 6 | E25: 2 | F25: 2 | G25: 1 | I25: Yes
A26: 18 | B26: 4 | C26: 13 | D26: 5 | E26: 2 | F26: 2 | G26: 1 | I26: Yes
A27: Totals | B27: =IF(B2="","",SUM(B9:B26)) -> 71 | D27: =IF(B2="","",SUM(D9:D26)) -> 126 | E27: =IF(B2="","",SUM(E9:E26)) -> 10 | F27: =IF(B2="","",SUM(F9:F26)) -> 38 | G27: =IF(B2="","",SUM(G9:G26)) -> 4 | H27: =IF(B2="","",SUM(H9:H26)) -> 8 | I27: =IF(COUNTIF(I9:I26,"=Yes")=0,"",COUNTIF(I9:I26,"=Yes")) -> 3