A1: Andy Benson
A2: Club | B2: Chelsfield Lakes
A3: Par/SS | B3: 71/68 | D3: Num. Of Fairways | I3: =IF(B2="","",18-(COUNTIF(B9:B26,3))) -> 14
A4: Date | B4: 38675 | D4: Playing Handicap | I4: 6.5
A5: Event Place | B5: 7 | C5: M | D5: Prize Money | G5: 21250
A6: Game Stats | B6: DB+ | C6: DB | D6: Bi | E6: P | F6: B | G6: E | H6: A | I6: H1
B7: 0 | C7: 3 | D7: 3 | E7: 12 | F7: 0 | G7: 0 | H7: 0 | I7: 0
A8: Hole No | B8: Par | C8: Stroke Index | D8: Gross Score | E8: Points | F8: Putts | G8: Fairways | H8: Ferrets | I8: Green Regulation
A9: 1 | B9: 4 | C9: 11 | D9: 5 | E9: 1 | F9: 2 | G9: 1
A10: 2 | B10: 3 | C10: 3 | D10: 4 | E10: 2 | F10: 1
A11: 3 | B11: 4 | C11: 13 | D11: 6 | E11: 0 | F11: 2
A12: 4 | B12: 4 | C12: 1 | D12: 4 | E12: 3 | F12: 1 | G12: 1 | I12: Yes
A13: 5 | B13: 3 | C13: 7 | D13: 3 | E13: 3 | F13: 2 | I13: Yes
A14: 6 | B14: 5 | C14: 15 | D14: 7 | E14: 0 | F14: 3 | H14: 1
A15: 7 | B15: 5 | C15: 5 | D15: 5 | E15: 3 | F15: 2 | I15: Yes
A16: 8 | B16: 4 | C16: 17 | D16: 4 | E16: 2 | F16: 2 | I16: Yes
A17: 9 | B17: 4 | C17: 9 | D17: 4 | E17: 2 | F17: 2 | I17: Yes
A18: 10 | B18: 4 | C18: 6 | D18: 4 | E18: 3 | F18: 2 | G18: 1 | I18: Yes
A19: 11 | B19: 4 | C19: 18 | D19: 4 | E19: 2 | F19: 1
A20: 12 | B20: 4 | C20: 8 | D20: 6 | E20: 0 | F20: 1
A21: 13 | B21: 5 | C21: 2 | D21: 5 | E21: 3 | F21: 1 | I21: Yes
A22: 14 | B22: 4 | C22: 16 | D22: 4 | E22: 2 | F22: 2 | I22: Yes
A23: 15 | B23: 3 | C23: 12 | D23: 3 | E23: 2 | F23: 2 | I23: Yes
A24: 16 | B24: 4 | C24: 4 | D24: 4 | E24: 3 | F24: 2 | I24: Yes
A25: 17 | B25: 3 | C25: 14 | D25: 4 | E25: 1 | F25: 2
A26: 18 | B26: 4 | C26: 10 | D26: 4 | E26: 2 | F26: 2 | G26: 1 | I26: Yes
A27: Totals | B27: =IF(B2="","",SUM(B9:B26)) -> 71 | D27: =IF(B2="","",SUM(D9:D26)) -> 80 | E27: =IF(B2="","",SUM(E9:E26)) -> 34 | F27: =IF(B2="","",SUM(F9:F26)) -> 32 | G27: =IF(B2="","",SUM(G9:G26)) -> 4 | H27: =IF(B2="","",SUM(H9:H26)) -> 1 | I27: =IF(COUNTIF(I9:I26,"=Yes")=0,"",COUNTIF(I9:I26,"=Yes")) -> 11