A1: Roy Dickens
A2: Club | B2: Broke Hill
A3: Par/SS | B3: 72/72 | D3: Num. Of Fairways | I3: =IF(B2="","",18-(COUNTIF(B9:B26,3))) -> 14
A4: Date | B4: 38662 | D4: Playing Handicap | I4: 29.9
A5: Event Place | B5: 2 | D5: Prize Money | G5: 2500
A6: Game Stats | B6: DB+ | C6: DB | D6: Bi | E6: P | F6: B | G6: E | H6: A | I6: H1
B7: 6 | C7: 5 | D7: 6 | E7: 1 | F7: 0 | G7: 0 | H7: 0 | I7: 0
A8: Hole No | B8: Par | C8: Stroke Index | D8: Gross Score | E8: Points | F8: Putts | G8: Fairways | H8: Ferrets | I8: Green Regulation
A9: 1 | B9: 4 | C9: 13 | D9: 8 | E9: 0 | F9: 3
A10: 2 | B10: 4 | C10: 9 | D10: 6 | E10: 2 | F10: 3 | I10: Yes
A11: 3 | B11: 5 | C11: 3 | D11: 5 | E11: 4 | F11: 1 | I11: Yes
A12: 4 | B12: 3 | C12: 15 | D12: 4 | E12: 2 | F12: 3 | I12: Yes
A13: 5 | B13: 4 | C13: 11 | D13: 5 | E13: 3 | F13: 2 | G13: 1 | I13: Yes
A14: 6 | B14: 4 | C14: 1 | D14: 6 | E14: 2 | F14: 3 | I14: Yes
A15: 7 | B15: 4 | C15: 7 | D15: 5 | E15: 3 | F15: 2 | I15: Yes
A16: 8 | B16: 3 | C16: 17 | D16: 5 | E16: 1 | F16: 2
A17: 9 | B17: 5 | C17: 5 | D17: 8 | E17: 1 | F17: 2
A18: 10 | B18: 4 | C18: 12 | D18: 10 | E18: 0 | F18: 3
A19: 11 | B19: 3 | C19: 18 | D19: 6 | E19: 0 | F19: 2
A20: 12 | B20: 5 | C20: 4 | D20: 7 | E20: 2 | F20: 2 | I20: Yes
A21: 13 | B21: 4 | C21: 8 | D21: 10 | E21: 0 | F21: 3 | H21: 2
A22: 14 | B22: 4 | C22: 14 | D22: 5 | E22: 2 | F22: 2 | G22: 1 | I22: Yes
A23: 15 | B23: 5 | C23: 2 | D23: 7 | E23: 2 | F23: 2 | I23: Yes
A24: 16 | B24: 4 | C24: 16 | D24: 5 | E24: 2 | F24: 2 | G24: 1 | I24: Yes
A25: 17 | B25: 3 | C25: 6 | D25: 4 | E25: 3 | F25: 2 | I25: Yes
A26: 18 | B26: 4 | C26: 10 | D26: 8 | E26: 0 | F26: 2
A27: Totals | B27: =IF(B2="","",SUM(B9:B26)) -> 72 | D27: =IF(B2="","",SUM(D9:D26)) -> 114 | E27: =IF(B2="","",SUM(E9:E26)) -> 29 | F27: =IF(B2="","",SUM(F9:F26)) -> 41 | G27: =IF(B2="","",SUM(G9:G26)) -> 3 | H27: =IF(B2="","",SUM(H9:H26)) -> 2 | I27: =IF(COUNTIF(I9:I26,"=Yes")=0,"",COUNTIF(I9:I26,"=Yes")) -> 11