A1: Simon Thompson
A2: Club | B2: Wimbledon Common
A3: Par/SS | B3: 68/66 | D3: Num. Of Fairways | I3: =IF(B2="","",18-(COUNTIF(B9:B26,3))) -> 13
A4: Date | B4: 38682 | D4: Playing Handicap | I4: 10.7
A5: Event Place | B5: 2 | D5: Prize Money | G5: 5000
A6: Game Stats | B6: DB+ | C6: DB | D6: BI | E6: P | F6: B | G6: E | H6: A | I6: H1
B7: 4 | C7: 0 | D7: 9 | E7: 5 | F7: 0 | G7: 0 | H7: 0 | I7: 0
A8: Hole No | B8: Par | C8: Stroke Index | D8: Gross Score | E8: Points | F8: Putts | G8: Fairways | H8: Ferrets | I8: Green Regulation
A9: 1 | B9: 3 | C9: 7 | D9: 3 | E9: 3 | F9: 1 | I9: Yes
A10: 2 | B10: 4 | C10: 1 | D10: 5 | E10: 2 | F10: 1
A11: 3 | B11: 4 | C11: 14 | D11: 7 | E11: 0 | F11: 1
A12: 4 | B12: 3 | C12: 11 | D12: 4 | E12: 2 | F12: 2 | I12: Yes
A13: 5 | B13: 4 | C13: 18 | D13: 4 | E13: 2 | F13: 2 | G13: 1 | I13: Yes
A14: 6 | B14: 4 | C14: 5 | D14: 5 | E14: 2 | F14: 2 | G14: 1 | I14: Yes
A15: 7 | B15: 4 | C15: 10 | D15: 5 | E15: 2 | F15: 3 | G15: 1 | I15: Yes
A16: 8 | B16: 3 | C16: 8 | D16: 4 | E16: 2 | F16: 3 | I16: Yes
A17: 9 | B17: 4 | C17: 16 | D17: 5 | E17: 1 | F17: 2
A18: 10 | B18: 4 | C18: 15 | D18: 5 | E18: 1 | F18: 2
A19: 11 | B19: 4 | C19: 4 | D19: 7 | E19: 0 | F19: 3
A20: 12 | B20: 3 | C20: 6 | D20: 7 | E20: 0 | F20: 1
A21: 13 | B21: 4 | C21: 13 | D21: 4 | E21: 2 | F21: 1
A22: 14 | B22: 4 | C22: 2 | D22: 5 | E22: 2 | F22: 2 | I22: Yes
A23: 15 | B23: 4 | C23: 12 | D23: 4 | E23: 2 | F23: 2 | I23: Yes
A24: 16 | B24: 3 | C24: 17 | D24: 4 | E24: 1 | F24: 3 | I24: Yes
A25: 17 | B25: 4 | C25: 9 | D25: 8 | E25: 0 | F25: 3
A26: 18 | B26: 5 | C26: 3 | D26: 5 | E26: 3 | F26: 1 | I26: Yes
A27: Totals | B27: =IF(B2="","",SUM(B9:B26)) -> 68 | D27: =IF(B2="","",SUM(D9:D26)) -> 91 | E27: =IF(B2="","",SUM(E9:E26)) -> 27 | F27: =IF(B2="","",SUM(F9:F26)) -> 35 | G27: =IF(B2="","",SUM(G9:G26)) -> 3 | H27: =IF(B2="","",SUM(H9:H26)) -> 0 | I27: =IF(COUNTIF(I9:I26,"=Yes")=0,"",COUNTIF(I9:I26,"=Yes")) -> 10