A1: Danny Marsh
A2: Club | B2: Chichester Cathedral
A3: Par/SS | B3: 71/69 | D3: Num. Of Fairways | I3: =IF(B2="","",18-(COUNTIF(B9:B26,3))) -> 14
A4: Date | B4: 38849 | D4: Playing Handicap | I4: 8.2
A5: Event Place | B5: 5 | D5: Prize Money | G5: 6250
A6: Game Stats | B6: DB+ | C6: DB | D6: Bi | E6: P | F6: B | G6: E | H6: A | I6: H1
B7: 3 | C7: 4 | D7: 4 | E7: 6 | F7: 1 | G7: 0 | H7: 0 | I7: 0
A8: Hole No | B8: Par | C8: Stroke Index | D8: Gross Score | E8: Points | F8: Putts | G8: Fairways | H8: Ferrets | I8: Green Regulation
A9: 1 | B9: 4 | C9: 9 | D9: 5 | E9: 1 | F9: 1 | G9: 1
A10: 2 | B10: 4 | C10: 15 | D10: 5 | E10: 1 | F10: 2 | G10: 1
A11: 3 | B11: 4 | C11: 5 | D11: 10 | E11: 0 | F11: 2
A12: 4 | B12: 3 | C12: 13 | D12: 3 | E12: 2 | F12: 2 | I12: Yes
A13: 5 | B13: 5 | C13: 1 | D13: 7 | E13: 1 | F13: 1 | H13: 1
A14: 6 | B14: 3 | C14: 17 | D14: 5 | E14: 0 | F14: 2 | H14: 1
A15: 7 | B15: 4 | C15: 3 | D15: 4 | E15: 3 | F15: 1 | G15: 1 | I15: Yes
A16: 8 | B16: 5 | C16: 7 | D16: 7 | E16: 1 | F16: 2
A17: 9 | B17: 4 | C17: 11 | D17: 5 | E17: 1 | F17: 1
A18: 10 | B18: 4 | C18: 12 | D18: 4 | E18: 2 | F18: 2 | G18: 1 | I18: Yes
A19: 11 | B19: 4 | C19: 4 | D19: 4 | E19: 3 | F19: 2 | I19: Yes
A20: 12 | B20: 5 | C20: 14 | D20: 5 | E20: 2 | F20: 1 | G20: 1
A21: 13 | B21: 3 | C21: 2 | D21: 5 | E21: 1 | F21: 2
A22: 14 | B22: 4 | C22: 8 | D22: 5 | E22: 2 | F22: 2 | I22: Yes
A23: 15 | B23: 3 | C23: 18 | D23: 3 | E23: 2 | F23: 2 | I23: Yes
A24: 16 | B24: 4 | C24: 16 | D24: 3 | E24: 3 | F24: 2 | G24: 1 | I24: Yes
A25: 17 | B25: 4 | C25: 6 | D25: 10 | E25: 0 | F25: 3 | H25: 2
A26: 18 | B26: 4 | C26: 10 | D26: 10 | E26: 0 | F26: 3 | H26: 1
A27: Totals | B27: =IF(B2="","",SUM(B9:B26)) -> 71 | D27: =IF(B2="","",SUM(D9:D26)) -> 100 | E27: =IF(B2="","",SUM(E9:E26)) -> 25 | F27: =IF(B2="","",SUM(F9:F26)) -> 33 | G27: =IF(B2="","",SUM(G9:G26)) -> 6 | H27: =IF(B2="","",SUM(H9:H26)) -> 5 | I27: =IF(COUNTIF(I9:I26,"=Yes")=0,"",COUNTIF(I9:I26,"=Yes")) -> 7