A1: Robert Thompson
A2: Club | B2: St George's Hill
A3: Par/SS | B3: 70/71 | D3: Num. Of Fairways | I3: =IF(B2="","",18-(COUNTIF(B9:B26,3))) -> 14
A4: Date | B4: 42454 | D4: Playing Handicap | I4: 10.3
A5: Event Place | B5: 2 | D5: Prize Money | G5: 2500
A6: Game Stats | B6: DB+ | C6: DB | D6: Bi | E6: P | F6: B | G6: E | H6: A | I6: H1
B7: 0 | C7: 5 | D7: 10 | E7: 3 | F7: 0 | G7: 0 | H7: 0 | I7: 0
A8: Hole No | B8: Par | C8: Stroke Index | D8: Gross Score | E8: Points | F8: Putts | G8: Fairways | H8: Ferrets | I8: Green Regulation
A9: 1 | B9: 4 | C9: 13 | D9: 6 | E9: 0 | F9: 3 | G9: 1
A10: 2 | B10: 4 | C10: 3 | D10: 5 | E10: 2 | F10: 1 | G10: 1
A11: 3 | B11: 3 | C11: 9 | D11: 4 | E11: 2 | F11: 2 | I11: Yes
A12: 4 | B12: 4 | C12: 17 | D12: 5 | E12: 1 | F12: 2
A13: 5 | B13: 4 | C13: 5 | D13: 4 | E13: 3 | F13: 1 | I13: Yes
A14: 6 | B14: 4 | C14: 1 | D14: 5 | E14: 2 | F14: 2 | I14: Yes
A15: 7 | B15: 5 | C15: 11 | D15: 7 | E15: 0 | F15: 1
A16: 8 | B16: 3 | C16: 15 | D16: 5 | E16: 0 | F16: 2 | H16: 1
A17: 9 | B17: 4 | C17: 7 | D17: 5 | E17: 2 | F17: 2 | G17: 1 | I17: Yes
A18: 10 | B18: 4 | C18: 6 | D18: 5 | E18: 2 | F18: 2 | G18: 1 | I18: Yes
A19: 11 | B19: 3 | C19: 18 | D19: 3 | E19: 2 | F19: 2 | I19: Yes
A20: 12 | B20: 4 | C20: 16 | D20: 6 | E20: 0 | F20: 2
A21: 13 | B21: 4 | C21: 2 | D21: 5 | E21: 2 | F21: 1
A22: 14 | B22: 3 | C22: 10 | D22: 4 | E22: 2 | F22: 3 | I22: Yes
A23: 15 | B23: 5 | C23: 12 | D23: 6 | E23: 1 | F23: 2 | G23: 1
A24: 16 | B24: 4 | C24: 4 | D24: 6 | E24: 1 | F24: 1
A25: 17 | B25: 4 | C25: 8 | D25: 5 | E25: 2 | F25: 1 | G25: 1
A26: 18 | B26: 4 | C26: 14 | D26: 4 | E26: 2 | F26: 2 | G26: 1 | I26: Yes
A27: Totals | B27: =IF(B2="","",SUM(B9:B26)) -> 70 | D27: =IF(B2="","",SUM(D9:D26)) -> 90 | E27: =IF(B2="","",SUM(E9:E26)) -> 26 | F27: =IF(B2="","",SUM(F9:F26)) -> 32 | G27: =IF(B2="","",SUM(G9:G26)) -> 7 | H27: =IF(B2="","",SUM(H9:H26)) -> 1 | I27: =IF(COUNTIF(I9:I26,"=Yes")=0,"",COUNTIF(I9:I26,"=Yes")) -> 8