A1: Ian Edwards
A2: Club | B2: Porters Park
A3: Par/SS | B3: 70/70 | D3: Num. Of Fairways | I3: =IF(B2="","",18-(COUNTIF(B9:B26,3))) -> 14
A4: Date | B4: 37878 | D4: Playing Handicap | I4: 13.6
A5: Event Place | B5: 2 | D5: Prize Money | G5: 2500
A6: Game Stats | B6: DB+ | C6: DB | D6: Bi | E6: P | F6: B | G6: E | H6: A | I6: H1
B7: 2 | C7: 5 | D7: 8 | E7: 3 | F7: 0 | G7: 0 | H7: 0 | I7: 0
A8: Hole No | B8: Par | C8: Stroke Index | D8: Gross Score | E8: Points | F8: Putts | G8: Fairways | H8: Ferrets | I8: Green Regulation
A9: 1 | B9: 4 | C9: 17 | D9: 5 | E9: 1 | F9: 1
A10: 2 | B10: 4 | C10: 11 | D10: 5 | E10: 2 | F10: 2 | G10: 1 | I10: Yes
A11: 3 | B11: 4 | C11: 3 | D11: 5 | E11: 2 | F11: 2 | I11: Yes
A12: 4 | B12: 4 | C12: 1 | D12: 4 | E12: 3 | F12: 1 | I12: Yes
A13: 5 | B13: 4 | C13: 9 | D13: 6 | E13: 1 | F13: 2
A14: 6 | B14: 3 | C14: 13 | D14: 5 | E14: 1 | F14: 3 | I14: Yes
A15: 7 | B15: 4 | C15: 7 | D15: 5 | E15: 2 | F15: 3 | I15: Yes
A16: 8 | B16: 4 | C16: 5 | D16: 9 | E16: 0 | F16: 1 | H16: 1
A17: 9 | B17: 3 | C17: 15 | D17: 3 | E17: 2 | F17: 1
A18: 10 | B18: 5 | C18: 12 | D18: 6 | E18: 2 | F18: 2 | I18: Yes
A19: 11 | B19: 4 | C19: 2 | D19: 8 | E19: 0 | F19: 2 | H19: 1
A20: 12 | B20: 3 | C20: 8 | D20: 4 | E20: 2 | F20: 2 | I20: Yes
A21: 13 | B21: 5 | C21: 4 | D21: 7 | E21: 1 | F21: 1
A22: 14 | B22: 3 | C22: 16 | D22: 4 | E22: 1 | F22: 2
A23: 15 | B23: 4 | C23: 18 | D23: 4 | E23: 2 | F23: 2 | I23: Yes
A24: 16 | B24: 4 | C24: 6 | D24: 6 | E24: 1 | F24: 2
A25: 17 | B25: 4 | C25: 14 | D25: 5 | E25: 2 | F25: 2 | I25: Yes
A26: 18 | B26: 4 | C26: 10 | D26: 6 | E26: 1 | F26: 2
A27: Totals | B27: =IF(B2="","",SUM(B9:B26)) -> 70 | D27: =IF(B2="","",SUM(D9:D26)) -> 97 | E27: =IF(B2="","",SUM(E9:E26)) -> 26 | F27: =IF(B2="","",SUM(F9:F26)) -> 33 | G27: =IF(B2="","",SUM(G9:G26)) -> 1 | H27: =IF(B2="","",SUM(H9:H26)) -> 2 | I27: =IF(COUNTIF(I9:I26,"=Yes")=0,"",COUNTIF(I9:I26,"=Yes")) -> 9