A1: Martin Cox
A2: Club | B2: Weymouth
A3: Par/SS | B3: 70/67 | D3: Num. Of Fairways | I3: =IF(B2="","",18-(COUNTIF(B9:B26,3))) -> 14
A4: Date | B4: 37883 | D4: Playing Handicap | I4: 10.2
A5: Event Place | B5: 2 | D5: Prize Money | G5: 12500
A6: Game Stats | B6: DB+ | C6: DB | D6: Bi | E6: P | F6: B | G6: E | H6: A | I6: H1
B7: 3 | C7: 1 | D7: 6 | E7: 8 | F7: 0 | G7: 0 | H7: 0 | I7: 0
A8: Hole No | B8: Par | C8: Stroke Index | D8: Gross Score | E8: Points | F8: Putts | G8: Fairways | H8: Ferrets | I8: Green Regulation
A9: 1 | B9: 4 | C9: 11 | D9: 6 | E9: 0 | F9: 2
A10: 2 | B10: 4 | C10: 5 | D10: 5 | E10: 2 | F10: 2 | I10: Yes
A11: 3 | B11: 4 | C11: 7 | D11: 5 | E11: 2 | F11: 1
A12: 4 | B12: 4 | C12: 15 | D12: 4 | E12: 2 | F12: 2 | G12: 1 | I12: Yes
A13: 5 | B13: 3 | C13: 13 | D13: 4 | E13: 1 | F13: 2
A14: 6 | B14: 4 | C14: 1 | D14: 8 | E14: 0 | F14: 1 | H14: 1
A15: 7 | B15: 4 | C15: 17 | D15: 4 | E15: 2 | F15: 1 | G15: 1
A16: 8 | B16: 3 | C16: 9 | D16: 4 | E16: 2 | F16: 2 | I16: Yes
A17: 9 | B17: 5 | C17: 3 | D17: 5 | E17: 3 | F17: 1 | G17: 1 | I17: Yes
A18: 10 | B18: 3 | C18: 18 | D18: 3 | E18: 2 | F18: 1
A19: 11 | B19: 4 | C19: 12 | D19: 5 | E19: 1 | F19: 2 | G19: 1
A20: 12 | B20: 4 | C20: 2 | D20: 10 | E20: 0 | F20: 3 | H20: 1
A21: 13 | B21: 4 | C21: 6 | D21: 4 | E21: 3 | F21: 1 | G21: 1 | I21: Yes
A22: 14 | B22: 4 | C22: 16 | D22: 4 | E22: 2 | F22: 1
A23: 15 | B23: 3 | C23: 14 | D23: 3 | E23: 2 | F23: 1
A24: 16 | B24: 5 | C24: 4 | D24: 5 | E24: 3 | F24: 1 | G24: 1 | I24: Yes
A25: 17 | B25: 4 | C25: 10 | D25: 5 | E25: 2 | F25: 2 | G25: 1 | I25: Yes
A26: 18 | B26: 4 | C26: 8 | D26: 10 | E26: 0 | F26: 3 | H26: 1
A27: Totals | B27: =IF(B2="","",SUM(B9:B26)) -> 70 | D27: =IF(B2="","",SUM(D9:D26)) -> 94 | E27: =IF(B2="","",SUM(E9:E26)) -> 29 | F27: =IF(B2="","",SUM(F9:F26)) -> 29 | G27: =IF(B2="","",SUM(G9:G26)) -> 7 | H27: =IF(B2="","",SUM(H9:H26)) -> 3 | I27: =IF(COUNTIF(I9:I26,"=Yes")=0,"",COUNTIF(I9:I26,"=Yes")) -> 7