A1: Simon Thompson
A2: Club | B2: Wildwood
A3: Par/SS | B3: 72/71 | D3: Num. Of Fairways | I3: =IF(B2="","",18-(COUNTIF(B9:B26,3))) -> 14
A4: Date | B4: 37883 | D4: Playing Handicap | I4: 15.1
A5: Event Place | B5: 18 | C5: M | D5: Prize Money | G5: 2500
A6: Game Stats | B6: DB+ | C6: DB | D6: Bi | E6: P | F6: B | G6: E | H6: A | I6: H1
B7: 9 | C7: 4 | D7: 3 | E7: 2 | F7: 0 | G7: 0 | H7: 0 | I7: 0
A8: Hole No | B8: Par | C8: Stroke Index | D8: Gross Score | E8: Points | F8: Putts | G8: Fairways | H8: Ferrets | I8: Green Regulation
A9: 1 | B9: 4 | C9: 5 | D9: 7 | E9: 0 | F9: 2
A10: 2 | B10: 3 | C10: 17 | D10: 5 | E10: 0 | F10: 3
A11: 3 | B11: 4 | C11: 9 | D11: 8 | E11: 0 | F11: 1 | H11: 1
A12: 4 | B12: 5 | C12: 15 | D12: 7 | E12: 1 | F12: 2
A13: 5 | B13: 4 | C13: 3 | D13: 10 | E13: 0 | F13: 3 | H13: 1
A14: 6 | B14: 4 | C14: 11 | D14: 10 | E14: 0 | F14: 3 | H14: 1
A15: 7 | B15: 5 | C15: 7 | D15: 7 | E15: 1 | F15: 1
A16: 8 | B16: 3 | C16: 13 | D16: 6 | E16: 0 | F16: 3
A17: 9 | B17: 4 | C17: 1 | D17: 4 | E17: 3 | F17: 1 | I17: Yes
A18: 10 | B18: 5 | C18: 12 | D18: 10 | E18: 0 | F18: 3 | G18: 1 | H18: 1
A19: 11 | B19: 5 | C19: 8 | D19: 5 | E19: 3 | F19: 2 | G19: 1 | I19: Yes
A20: 12 | B20: 4 | C20: 10 | D20: 5 | E20: 2 | F20: 1
A21: 13 | B21: 3 | C21: 18 | D21: 4 | E21: 1 | F21: 2
A22: 14 | B22: 4 | C22: 4 | D22: 6 | E22: 1 | F22: 2
A23: 15 | B23: 4 | C23: 14 | D23: 5 | E23: 2 | F23: 2 | I23: Yes
A24: 16 | B24: 4 | C24: 2 | D24: 7 | E24: 0 | F24: 2 | H24: 1
A25: 17 | B25: 3 | C25: 16 | D25: 10 | E25: 0 | F25: 3 | H25: 1
A26: 18 | B26: 4 | C26: 6 | D26: 10 | E26: 0 | F26: 2 | H26: 1
A27: Totals | B27: =IF(B2="","",SUM(B9:B26)) -> 72 | D27: =IF(B2="","",SUM(D9:D26)) -> 126 | E27: =IF(B2="","",SUM(E9:E26)) -> 14 | F27: =IF(B2="","",SUM(F9:F26)) -> 38 | G27: =IF(B2="","",SUM(G9:G26)) -> 2 | H27: =IF(B2="","",SUM(H9:H26)) -> 7 | I27: =IF(COUNTIF(I9:I26,"=Yes")=0,"",COUNTIF(I9:I26,"=Yes")) -> 3