A1: Danny Marsh
A2: Club | B2: Porters Park
A3: Par/SS | B3: 70/70 | D3: Num. Of Fairways | I3: =IF(B2="","",18-(COUNTIF(B9:B26,3))) -> 14
A4: Date | B4: 38067 | D4: Playing Handicap | I4: 7.1000000000009962
A5: Event Place | B5: 1 | D5: Prize Money | G5: 5000
A6: Game Stats | B6: DB+ | C6: DB | D6: BI | E6: P | F6: B | G6: E | H6: A | I6: H1
B7: 0 | C7: 2 | D7: 7 | E7: 8 | F7: 1 | G7: 0 | H7: 0 | I7: 0
A8: Hole No | B8: Par | C8: Stroke Index | D8: Gross Score | E8: Points | F8: Putts | G8: Fairways | H8: Ferrets | I8: Green Regulation
A9: 1 | B9: 4 | C9: 17 | D9: 3 | E9: 3 | F9: 1 | I9: Yes
A10: 2 | B10: 4 | C10: 11 | D10: 4 | E10: 2 | F10: 2 | G10: 1 | I10: Yes
A11: 3 | B11: 4 | C11: 3 | D11: 5 | E11: 2 | F11: 2 | G11: 1 | I11: Yes
A12: 4 | B12: 4 | C12: 1 | D12: 4 | E12: 3 | F12: 1 | G12: 1 | I12: Yes
A13: 5 | B13: 4 | C13: 9 | D13: 4 | E13: 2 | F13: 1
A14: 6 | B14: 3 | C14: 13 | D14: 4 | E14: 1 | F14: 3 | I14: Yes
A15: 7 | B15: 4 | C15: 7 | D15: 4 | E15: 3 | F15: 2 | I15: Yes
A16: 8 | B16: 4 | C16: 5 | D16: 5 | E16: 2 | F16: 2 | I16: Yes
A17: 9 | B17: 3 | C17: 15 | D17: 4 | E17: 1 | F17: 3 | I17: Yes
A18: 10 | B18: 5 | C18: 12 | D18: 5 | E18: 2 | F18: 1
A19: 11 | B19: 4 | C19: 2 | D19: 5 | E19: 2 | F19: 2 | I19: Yes
A20: 12 | B20: 3 | C20: 8 | D20: 3 | E20: 2 | F20: 2 | I20: Yes
A21: 13 | B21: 5 | C21: 4 | D21: 6 | E21: 2 | F21: 2 | I21: Yes
A22: 14 | B22: 3 | C22: 16 | D22: 3 | E22: 2 | F22: 1
A23: 15 | B23: 4 | C23: 18 | D23: 6 | E23: 0 | F23: 1
A24: 16 | B24: 4 | C24: 6 | D24: 4 | E24: 3 | F24: 1 | I24: Yes
A25: 17 | B25: 4 | C25: 14 | D25: 5 | E25: 1 | F25: 2 | G25: 1
A26: 18 | B26: 4 | C26: 10 | D26: 6 | E26: 0 | F26: 2 | H26: 1
A27: Totals | B27: =IF(B2="","",SUM(B9:B26)) -> 70 | D27: =IF(B2="","",SUM(D9:D26)) -> 80 | E27: =IF(B2="","",SUM(E9:E26)) -> 33 | F27: =IF(B2="","",SUM(F9:F26)) -> 31 | G27: =IF(B2="","",SUM(G9:G26)) -> 4 | H27: =IF(B2="","",SUM(H9:H26)) -> 1 | I27: =IF(COUNTIF(I9:I26,"=Yes")=0,"",COUNTIF(I9:I26,"=Yes")) -> 12