A1: Keith Mendelson
A2: Club | B2: Chelsfield Lakes
A3: Par/SS | B3: 71/68 | D3: Num. Of Fairways | I3: =IF(B2="","",18-(COUNTIF(B9:B26,3))) -> 14
A4: Date | B4: 38067 | D4: Playing Handicap | I4: 11.1
A5: Event Place | B5: 2 | D5: Prize Money | G5: 7500
A6: Game Stats | B6: DB+ | C6: DB | D6: BI | E6: P | F6: B | G6: E | H6: A | I6: H1
B7: 0 | C7: 5 | D7: 6 | E7: 6 | F7: 1 | G7: 0 | H7: 0 | I7: 0
A8: Hole No | B8: Par | C8: Stroke Index | D8: Gross Score | E8: Points | F8: Putts | G8: Fairways | H8: Ferrets | I8: Green Regulation
A9: 1 | B9: 4 | C9: 12 | D9: 6 | E9: 0 | F9: 2
A10: 2 | B10: 3 | C10: 7 | D10: 4 | E10: 2 | F10: 2 | I10: Yes
A11: 3 | B11: 4 | C11: 11 | D11: 6 | E11: 1 | F11: 3 | G11: 1 | I11: Yes
A12: 4 | B12: 4 | C12: 2 | D12: 6 | E12: 1 | F12: 2
A13: 5 | B13: 3 | C13: 9 | D13: 5 | E13: 1 | F13: 2
A14: 6 | B14: 5 | C14: 14 | D14: 4 | E14: 3 | F14: 2 | G14: 1 | I14: Yes
A15: 7 | B15: 5 | C15: 6 | D15: 6 | E15: 2 | F15: 2 | I15: Yes
A16: 8 | B16: 4 | C16: 18 | D16: 4 | E16: 2 | F16: 2 | G16: 1 | I16: Yes
A17: 9 | B17: 4 | C17: 5 | D17: 5 | E17: 2 | F17: 1 | G17: 1
A18: 10 | B18: 4 | C18: 10 | D18: 4 | E18: 3 | F18: 2 | G18: 1 | I18: Yes
A19: 11 | B19: 4 | C19: 13 | D19: 4 | E19: 2 | F19: 1
A20: 12 | B20: 4 | C20: 8 | D20: 4 | E20: 3 | F20: 1 | G20: 1 | I20: Yes
A21: 13 | B21: 5 | C21: 1 | D21: 5 | E21: 3 | F21: 2 | I21: Yes
A22: 14 | B22: 4 | C22: 16 | D22: 4 | E22: 2 | F22: 2 | I22: Yes
A23: 15 | B23: 3 | C23: 17 | D23: 4 | E23: 1 | F23: 2
A24: 16 | B24: 4 | C24: 3 | D24: 6 | E24: 1 | F24: 3 | G24: 1 | I24: Yes
A25: 17 | B25: 3 | C25: 15 | D25: 4 | E25: 1 | F25: 2
A26: 18 | B26: 4 | C26: 4 | D26: 5 | E26: 2 | F26: 2 | G26: 1 | I26: Yes
A27: Totals | B27: =IF(B2="","",SUM(B9:B26)) -> 71 | D27: =IF(B2="","",SUM(D9:D26)) -> 86 | E27: =IF(B2="","",SUM(E9:E26)) -> 32 | F27: =IF(B2="","",SUM(F9:F26)) -> 35 | G27: =IF(B2="","",SUM(G9:G26)) -> 8 | H27: =IF(B2="","",SUM(H9:H26)) -> 0 | I27: =IF(COUNTIF(I9:I26,"=Yes")=0,"",COUNTIF(I9:I26,"=Yes")) -> 11