A1: Keith Mendelson
A2: Club | B2: Chelsfield Lakes
A3: Par/SS | B3: 71/68 | D3: Num. Of Fairways | I3: =IF(B2="","",18-(COUNTIF(B9:B26,3))) -> 14
A4: Date | B4: 38074 | D4: Playing Handicap | I4: 11.2
A5: Event Place | B5: 2 | D5: Prize Money | G5: 2500
A6: Game Stats | B6: DB+ | C6: DB | D6: Bi | E6: P | F6: B | G6: E | H6: A | I6: H1
B7: 4 | C7: 4 | D7: 6 | E7: 4 | F7: 0 | G7: 0 | H7: 0 | I7: 0
A8: Hole No | B8: Par | C8: Stroke Index | D8: Gross Score | E8: Points | F8: Putts | G8: Fairways | H8: Ferrets | I8: Green Regulation
A9: 1 | B9: 4 | C9: 12 | D9: 9 | E9: 0 | F9: 3 | G9: 1
A10: 2 | B10: 3 | C10: 7 | D10: 4 | E10: 2 | F10: 2 | I10: Yes
A11: 3 | B11: 4 | C11: 11 | D11: 6 | E11: 1 | F11: 2
A12: 4 | B12: 4 | C12: 2 | D12: 4 | E12: 3 | F12: 2 | I12: Yes
A13: 5 | B13: 3 | C13: 9 | D13: 6 | E13: 0 | F13: 3
A14: 6 | B14: 5 | C14: 14 | D14: 6 | E14: 1 | F14: 2
A15: 7 | B15: 5 | C15: 6 | D15: 6 | E15: 2 | F15: 1
A16: 8 | B16: 4 | C16: 18 | D16: 6 | E16: 0 | F16: 4 | G16: 1 | I16: Yes
A17: 9 | B17: 4 | C17: 5 | D17: 5 | E17: 2 | F17: 2 | I17: Yes
A18: 10 | B18: 4 | C18: 10 | D18: 4 | E18: 3 | F18: 2 | G18: 1 | I18: Yes
A19: 11 | B19: 4 | C19: 13 | D19: 4 | E19: 2 | F19: 2 | G19: 1 | I19: Yes
A20: 12 | B20: 4 | C20: 8 | D20: 5 | E20: 2 | F20: 3 | G20: 1 | I20: Yes
A21: 13 | B21: 5 | C21: 1 | D21: 7 | E21: 1 | F21: 2 | G21: 1
A22: 14 | B22: 4 | C22: 16 | D22: 4 | E22: 2 | F22: 1 | G22: 1
A23: 15 | B23: 3 | C23: 17 | D23: 4 | E23: 1 | F23: 1
A24: 16 | B24: 4 | C24: 3 | D24: 6 | E24: 1 | F24: 2 | G24: 1
A25: 17 | B25: 3 | C25: 15 | D25: 6 | E25: 0 | F25: 2
A26: 18 | B26: 4 | C26: 4 | D26: 11 | E26: 0 | F26: 3
A27: Totals | B27: =IF(B2="","",SUM(B9:B26)) -> 71 | D27: =IF(B2="","",SUM(D9:D26)) -> 103 | E27: =IF(B2="","",SUM(E9:E26)) -> 23 | F27: =IF(B2="","",SUM(F9:F26)) -> 39 | G27: =IF(B2="","",SUM(G9:G26)) -> 8 | H27: =IF(B2="","",SUM(H9:H26)) -> 0 | I27: =IF(COUNTIF(I9:I26,"=Yes")=0,"",COUNTIF(I9:I26,"=Yes")) -> 7