A1: Paul Baldwin
A2: Club | B2: East Sussex National (West)
A3: Par/SS | B3: 72/74 | D3: Num. Of Fairways | I3: =IF(B2="","",18-(COUNTIF(B9:B26,3))) -> 14
A4: Date | B4: 38076 | D4: Playing Handicap | I4: 16.900000000002006
A5: Event Place | B5: 6 | C5: M | D5: Prize Money | G5: 16250
A6: Game Stats | B6: DB+ | C6: DB | D6: Bi | E6: P | F6: B | G6: E | H6: A | I6: H1
B7: 4 | C7: 2 | D7: 8 | E7: 4 | F7: 0 | G7: 0 | H7: 0 | I7: 0
A8: Hole No | B8: Par | C8: Stroke Index | D8: Gross Score | E8: Points | F8: Putts | G8: Fairways | H8: Ferrets | I8: Green Regulation
A9: 1 | B9: 4 | C9: 10 | D9: 5 | E9: 2 | F9: 2 | G9: 1 | I9: Yes
A10: 2 | B10: 5 | C10: 4 | D10: 7 | E10: 1 | F10: 2
A11: 3 | B11: 3 | C11: 14 | D11: 4 | E11: 2 | F11: 2 | I11: Yes
A12: 4 | B12: 4 | C12: 18 | D12: 5 | E12: 1 | F12: 2
A13: 5 | B13: 5 | C13: 16 | D13: 5 | E13: 3 | F13: 2 | G13: 1 | I13: Yes
A14: 6 | B14: 4 | C14: 8 | D14: 8 | E14: 0 | F14: 1
A15: 7 | B15: 3 | C15: 6 | D15: 4 | E15: 2 | F15: 2 | I15: Yes
A16: 8 | B16: 4 | C16: 12 | D16: 6 | E16: 1 | F16: 2
A17: 9 | B17: 4 | C17: 2 | D17: 10 | E17: 0 | F17: 3 | H17: 1
A18: 10 | B18: 4 | C18: 7 | D18: 5 | E18: 2 | F18: 2 | I18: Yes
A19: 11 | B19: 4 | C19: 5 | D19: 4 | E19: 3 | F19: 2 | G19: 1 | I19: Yes
A20: 12 | B20: 5 | C20: 3 | D20: 9 | E20: 0 | F20: 3
A21: 13 | B21: 3 | C21: 15 | D21: 4 | E21: 2 | F21: 3 | I21: Yes
A22: 14 | B22: 4 | C22: 1 | D22: 9 | E22: 0 | F22: 3
A23: 15 | B23: 4 | C23: 17 | D23: 4 | E23: 3 | F23: 1 | I23: Yes
A24: 16 | B24: 3 | C24: 13 | D24: 3 | E24: 3 | F24: 2 | I24: Yes
A25: 17 | B25: 5 | C25: 9 | D25: 6 | E25: 2 | F25: 2 | I25: Yes
A26: 18 | B26: 4 | C26: 11 | D26: 5 | E26: 2 | F26: 2 | I26: Yes
A27: Totals | B27: =IF(B2="","",SUM(B9:B26)) -> 72 | D27: =IF(B2="","",SUM(D9:D26)) -> 103 | E27: =IF(B2="","",SUM(E9:E26)) -> 29 | F27: =IF(B2="","",SUM(F9:F26)) -> 38 | G27: =IF(B2="","",SUM(G9:G26)) -> 3 | H27: =IF(B2="","",SUM(H9:H26)) -> 1 | I27: =IF(COUNTIF(I9:I26,"=Yes")=0,"",COUNTIF(I9:I26,"=Yes")) -> 11