A1: Robert Thompson
A2: Club | B2: Wimbledon Common
A3: Par/SS | B3: 68/66 | D3: Num. Of Fairways | I3: =IF(B2="","",18-(COUNTIF(B9:B26,3))) -> 13
A4: Date | B4: 38360 | D4: Playing Handicap | I4: 9.3
A5: Event Place | B5: 1 | D5: Prize Money | G5: 7500
A6: Game Stats | B6: DB+ | C6: DB | D6: Bi | E6: P | F6: B | G6: E | H6: A | I6: H1
B7: 2 | C7: 2 | D7: 5 | E7: 8 | F7: 1 | G7: 0 | H7: 0 | I7: 0
A8: Hole No | B8: Par | C8: Stroke Index | D8: Gross Score | E8: Points | F8: Putts | G8: Fairways | H8: Ferrets | I8: Green Regulation
A9: 1 | B9: 3 | C9: 7 | D9: 4 | E9: 2 | F9: 2 | I9: Yes
A10: 2 | B10: 4 | C10: 1 | D10: 7 | E10: 0 | F10: 2
A11: 3 | B11: 4 | C11: 14 | D11: 4 | E11: 2 | F11: 1 | G11: 1
A12: 4 | B12: 3 | C12: 11 | D12: 6 | E12: 0 | F12: 3
A13: 5 | B13: 4 | C13: 18 | D13: 4 | E13: 2 | F13: 2 | G13: 1 | I13: Yes
A14: 6 | B14: 4 | C14: 5 | D14: 4 | E14: 3 | F14: 1 | G14: 1 | I14: Yes
A15: 7 | B15: 4 | C15: 10 | D15: 4 | E15: 2 | F15: 2 | G15: 1 | I15: Yes
A16: 8 | B16: 3 | C16: 8 | D16: 4 | E16: 2 | F16: 2 | I16: Yes
A17: 9 | B17: 4 | C17: 16 | D17: 6 | E17: 0 | F17: 2 | G17: 1
A18: 10 | B18: 4 | C18: 15 | D18: 4 | E18: 2 | F18: 1 | G18: 1
A19: 11 | B19: 4 | C19: 4 | D19: 4 | E19: 3 | F19: 1 | G19: 1 | I19: Yes
A20: 12 | B20: 3 | C20: 6 | D20: 4 | E20: 2 | F20: 2 | I20: Yes
A21: 13 | B21: 4 | C21: 13 | D21: 4 | E21: 2 | F21: 1
A22: 14 | B22: 4 | C22: 2 | D22: 5 | E22: 2 | F22: 2 | G22: 1 | I22: Yes
A23: 15 | B23: 4 | C23: 12 | D23: 5 | E23: 1 | F23: 2
A24: 16 | B24: 3 | C24: 17 | D24: 5 | E24: 0 | F24: 2
A25: 17 | B25: 4 | C25: 9 | D25: 4 | E25: 3 | F25: 1 | I25: Yes
A26: 18 | B26: 5 | C26: 3 | D26: 4 | E26: 4 | F26: 1 | G26: 1 | I26: Yes
A27: Totals | B27: =IF(B2="","",SUM(B9:B26)) -> 68 | D27: =IF(B2="","",SUM(D9:D26)) -> 82 | E27: =IF(B2="","",SUM(E9:E26)) -> 32 | F27: =IF(B2="","",SUM(F9:F26)) -> 30 | G27: =IF(B2="","",SUM(G9:G26)) -> 9 | H27: =IF(B2="","",SUM(H9:H26)) -> 0 | I27: =IF(COUNTIF(I9:I26,"=Yes")=0,"",COUNTIF(I9:I26,"=Yes")) -> 10