A1: Jeff Colbrook
A2: Club | B2: Pine Ridge
A3: Par/SS | B3: 71/72 | D3: Num. Of Fairways | I3: =IF(B2="","",18-(COUNTIF(B9:B26,3))) -> 14
A4: Date | B4: 39347 | D4: Playing Handicap | I4: 15.6
A5: Event Place | B5: 3 | C5: M | D5: Prize Money | G5: 18750
A6: Game Stats | B6: DB+ | C6: DB | D6: Bi | E6: P | F6: B | G6: E | H6: A | I6: H1
B7: 1 | C7: 2 | D7: 10 | E7: 3 | F7: 2 | G7: 0 | H7: 0 | I7: 0
A8: Hole No | B8: Par | C8: Stroke Index | D8: Gross Score | E8: Points | F8: Putts | G8: Fairways | H8: Ferrets | I8: Green Regulation
A9: 1 | B9: 4 | C9: 16 | D9: 5 | E9: 2 | F9: 2 | I9: Yes
A10: 2 | B10: 4 | C10: 6 | D10: 5 | E10: 2 | F10: 1
A11: 3 | B11: 3 | C11: 14 | D11: 4 | E11: 2 | F11: 2 | I11: Yes
A12: 4 | B12: 4 | C12: 2 | D12: 5 | E12: 2 | F12: 3 | G12: 1 | I12: Yes
A13: 5 | B13: 5 | C13: 8 | D13: 5 | E13: 3 | F13: 1 | I13: Yes
A14: 6 | B14: 3 | C14: 18 | D14: 4 | E14: 1 | F14: 1
A15: 7 | B15: 4 | C15: 10 | D15: 4 | E15: 3 | F15: 2 | I15: Yes
A16: 8 | B16: 4 | C16: 4 | D16: 5 | E16: 2 | F16: 2 | I16: Yes
A17: 9 | B17: 5 | C17: 12 | D17: 6 | E17: 2 | F17: 2 | I17: Yes
A18: 10 | B18: 4 | C18: 1 | D18: 5 | E18: 2 | F18: 2 | G18: 1 | I18: Yes
A19: 11 | B19: 4 | C19: 15 | D19: 7 | E19: 0 | F19: 2
A20: 12 | B20: 3 | C20: 9 | D20: 4 | E20: 2 | F20: 2 | I20: Yes
A21: 13 | B21: 4 | C21: 5 | D21: 5 | E21: 2 | F21: 2 | I21: Yes
A22: 14 | B22: 5 | C22: 11 | D22: 7 | E22: 1 | F22: 2
A23: 15 | B23: 4 | C23: 3 | D23: 6 | E23: 1 | F23: 4 | G23: 1 | I23: Yes
A24: 16 | B24: 4 | C24: 13 | D24: 3 | E24: 4 | F24: 1 | I24: Yes
A25: 17 | B25: 3 | C25: 17 | D25: 2 | E25: 3 | F25: 1 | I25: Yes
A26: 18 | B26: 5 | C26: 7 | D26: 5 | E26: 3 | F26: 2 | G26: 1 | I26: Yes
A27: Totals | B27: =IF(B2="","",SUM(B9:B26)) -> 72 | D27: =IF(B2="","",SUM(D9:D26)) -> 87 | E27: =IF(B2="","",SUM(E9:E26)) -> 37 | F27: =IF(B2="","",SUM(F9:F26)) -> 34 | G27: =IF(B2="","",SUM(G9:G26)) -> 4 | H27: =IF(B2="","",SUM(H9:H26)) -> 0 | I27: =IF(COUNTIF(I9:I26,"=Yes")=0,"",COUNTIF(I9:I26,"=Yes")) -> 14