A1: Matthew Carter
A2: Club | B2: Pine Ridge
A3: Par/SS | B3: 71/72 | D3: Num. Of Fairways | I3: =IF(B2="","",18-(COUNTIF(B9:B26,3))) -> 14
A4: Date | B4: 39347 | D4: Playing Handicap | I4: 21.1
A5: Event Place | B5: 7 | C5: M | D5: Prize Money | G5: 8750
A6: Game Stats | B6: DB+ | C6: DB | D6: BI | E6: P | F6: B | G6: E | H6: A | I6: H1
B7: 2 | C7: 4 | D7: 9 | E7: 3 | F7: 0 | G7: 0 | H7: 0 | I7: 0
A8: Hole No | B8: Par | C8: Stroke Index | D8: Gross Score | E8: Points | F8: Putts | G8: Fairways | H8: Ferrets | I8: Green Regulation
A9: 1 | B9: 4 | C9: 16 | D9: 5 | E9: 2 | F9: 2 | G9: 1 | I9: Yes
A10: 2 | B10: 4 | C10: 6 | D10: 7 | E10: 0 | F10: 2 | H10: 1
A11: 3 | B11: 3 | C11: 14 | D11: 4 | E11: 2 | F11: 1
A12: 4 | B12: 4 | C12: 2 | D12: 6 | E12: 2 | F12: 3 | G12: 1 | I12: Yes
A13: 5 | B13: 5 | C13: 8 | D13: 7 | E13: 1 | F13: 3 | I13: Yes
A14: 6 | B14: 3 | C14: 18 | D14: 3 | E14: 3 | F14: 1 | I14: Yes
A15: 7 | B15: 4 | C15: 10 | D15: 5 | E15: 2 | F15: 3 | I15: Yes
A16: 8 | B16: 4 | C16: 4 | D16: 6 | E16: 1 | F16: 2 | G16: 1
A17: 9 | B17: 5 | C17: 12 | D17: 6 | E17: 2 | F17: 3 | I17: Yes
A18: 10 | B18: 4 | C18: 1 | D18: 7 | E18: 1 | F18: 2
A19: 11 | B19: 4 | C19: 15 | D19: 5 | E19: 2 | F19: 2 | I19: Yes
A20: 12 | B20: 3 | C20: 9 | D20: 4 | E20: 2 | F20: 2 | I20: Yes
A21: 13 | B21: 4 | C21: 5 | D21: 5 | E21: 2 | F21: 2 | G21: 1 | I21: Yes
A22: 14 | B22: 5 | C22: 11 | D22: 5 | E22: 3 | F22: 2 | G22: 1 | I22: Yes
A23: 15 | B23: 4 | C23: 3 | D23: 4 | E23: 4 | F23: 0 | I23: Yes
A24: 16 | B24: 4 | C24: 13 | D24: 5 | E24: 2 | F24: 3 | G24: 1 | I24: Yes
A25: 17 | B25: 3 | C25: 17 | D25: 4 | E25: 2 | F25: 1
A26: 18 | B26: 5 | C26: 7 | D26: 7 | E26: 1 | F26: 4 | G26: 1 | I26: Yes
A27: Totals | B27: =IF(B2="","",SUM(B9:B26)) -> 72 | D27: =IF(B2="","",SUM(D9:D26)) -> 95 | E27: =IF(B2="","",SUM(E9:E26)) -> 34 | F27: =IF(B2="","",SUM(F9:F26)) -> 38 | G27: =IF(B2="","",SUM(G9:G26)) -> 7 | H27: =IF(B2="","",SUM(H9:H26)) -> 1 | I27: =IF(COUNTIF(I9:I26,"=Yes")=0,"",COUNTIF(I9:I26,"=Yes")) -> 13