A1: Ian Edwards
A2: Club | B2: Wildwood
A3: Par/SS | B3: 72/71 | D3: Num. Of Fairways | I3: =IF(B2="","",18-(COUNTIF(B9:B26,3))) -> 14
A4: Date | B4: 37883 | D4: Playing Handicap | I4: 13.8
A5: Event Place | B5: 6 | C5: M | D5: Prize Money | G5: 31250
A6: Game Stats | B6: DB+ | C6: DB | D6: Bi | E6: P | F6: B | G6: E | H6: A | I6: H1
B7: 2 | C7: 4 | D7: 6 | E7: 6 | F7: 0 | G7: 0 | H7: 0 | I7: 0
A8: Hole No | B8: Par | C8: Stroke Index | D8: Gross Score | E8: Points | F8: Putts | G8: Fairways | H8: Ferrets | I8: Green Regulation
A9: 1 | B9: 4 | C9: 5 | D9: 7 | E9: 0 | F9: 2 | G9: 1 | H9: 1
A10: 2 | B10: 3 | C10: 17 | D10: 5 | E10: 0 | F10: 2
A11: 3 | B11: 4 | C11: 9 | D11: 5 | E11: 2 | F11: 2 | G11: 1 | I11: Yes
A12: 4 | B12: 5 | C12: 15 | D12: 5 | E12: 2 | F12: 2 | G12: 1 | I12: Yes
A13: 5 | B13: 4 | C13: 3 | D13: 7 | E13: 0 | F13: 2 | G13: 1
A14: 6 | B14: 4 | C14: 11 | D14: 5 | E14: 2 | F14: 2 | I14: Yes
A15: 7 | B15: 5 | C15: 7 | D15: 7 | E15: 1 | F15: 1 | H15: 1
A16: 8 | B16: 3 | C16: 13 | D16: 3 | E16: 3 | F16: 1 | I16: Yes
A17: 9 | B17: 4 | C17: 1 | D17: 5 | E17: 2 | F17: 2 | G17: 1 | I17: Yes
A18: 10 | B18: 5 | C18: 12 | D18: 5 | E18: 3 | F18: 2 | G18: 1 | I18: Yes
A19: 11 | B19: 5 | C19: 8 | D19: 5 | E19: 3 | F19: 1 | I19: Yes
A20: 12 | B20: 4 | C20: 10 | D20: 5 | E20: 2 | F20: 2 | I20: Yes
A21: 13 | B21: 3 | C21: 18 | D21: 3 | E21: 2 | F21: 1
A22: 14 | B22: 4 | C22: 4 | D22: 6 | E22: 1 | F22: 2 | H22: 1
A23: 15 | B23: 4 | C23: 14 | D23: 5 | E23: 2 | F23: 1 | H23: 1
A24: 16 | B24: 4 | C24: 2 | D24: 6 | E24: 1 | F24: 2
A25: 17 | B25: 3 | C25: 16 | D25: 3 | E25: 2 | F25: 1
A26: 18 | B26: 4 | C26: 6 | D26: 5 | E26: 2 | F26: 3 | G26: 1 | I26: Yes
A27: Totals | B27: =IF(B2="","",SUM(B9:B26)) -> 72 | D27: =IF(B2="","",SUM(D9:D26)) -> 92 | E27: =IF(B2="","",SUM(E9:E26)) -> 30 | F27: =IF(B2="","",SUM(F9:F26)) -> 31 | G27: =IF(B2="","",SUM(G9:G26)) -> 7 | H27: =IF(B2="","",SUM(H9:H26)) -> 4 | I27: =IF(COUNTIF(I9:I26,"=Yes")=0,"",COUNTIF(I9:I26,"=Yes")) -> 9