A1: Keith Johns
A2: Club | B2: Wildwood
A3: Par/SS | B3: 72/71 | D3: Num. Of Fairways | I3: =IF(B2="","",18-(COUNTIF(B9:B26,3))) -> 14
A4: Date | B4: 37883 | D4: Playing Handicap | I4: 25.3
A5: Event Place | B5: 1 | C5: M | D5: Prize Money | G5: 50000
A6: Game Stats | B6: DB+ | C6: DB | D6: BI | E6: P | F6: B | G6: E | H6: A | I6: H1
B7: 3 | C7: 5 | D7: 6 | E7: 4 | F7: 0 | G7: 0 | H7: 0 | I7: 0
A8: Hole No | B8: Par | C8: Stroke Index | D8: Gross Score | E8: Points | F8: Putts | G8: Fairways | H8: Ferrets | I8: Green Regulation
A9: 1 | B9: 4 | C9: 5 | D9: 6 | E9: 2 | F9: 2 | I9: Yes
A10: 2 | B10: 3 | C10: 17 | D10: 3 | E10: 3 | F10: 2 | I10: Yes
A11: 3 | B11: 4 | C11: 9 | D11: 6 | E11: 1 | F11: 2 | G11: 1
A12: 4 | B12: 5 | C12: 15 | D12: 7 | E12: 1 | F12: 1 | H12: 1
A13: 5 | B13: 4 | C13: 3 | D13: 6 | E13: 2 | F13: 2 | I13: Yes
A14: 6 | B14: 4 | C14: 11 | D14: 10 | E14: 0 | F14: 3
A15: 7 | B15: 5 | C15: 7 | D15: 6 | E15: 3 | F15: 2 | I15: Yes
A16: 8 | B16: 3 | C16: 13 | D16: 4 | E16: 2 | F16: 2 | I16: Yes
A17: 9 | B17: 4 | C17: 1 | D17: 5 | E17: 3 | F17: 3 | I17: Yes
A18: 10 | B18: 5 | C18: 12 | D18: 8 | E18: 0 | F18: 2
A19: 11 | B19: 5 | C19: 8 | D19: 6 | E19: 2 | F19: 2 | I19: Yes
A20: 12 | B20: 4 | C20: 10 | D20: 4 | E20: 3 | F20: 2 | G20: 1 | I20: Yes
A21: 13 | B21: 3 | C21: 18 | D21: 3 | E21: 3 | F21: 2 | I21: Yes
A22: 14 | B22: 4 | C22: 4 | D22: 5 | E22: 3 | F22: 2 | G22: 1 | I22: Yes
A23: 15 | B23: 4 | C23: 14 | D23: 5 | E23: 2 | F23: 1
A24: 16 | B24: 4 | C24: 2 | D24: 7 | E24: 1 | F24: 1 | G24: 1
A25: 17 | B25: 3 | C25: 16 | D25: 3 | E25: 3 | F25: 2 | I25: Yes
A26: 18 | B26: 4 | C26: 6 | D26: 6 | E26: 2 | F26: 1 | H26: 1
A27: Totals | B27: =IF(B2="","",SUM(B9:B26)) -> 72 | D27: =IF(B2="","",SUM(D9:D26)) -> 100 | E27: =IF(B2="","",SUM(E9:E26)) -> 36 | F27: =IF(B2="","",SUM(F9:F26)) -> 34 | G27: =IF(B2="","",SUM(G9:G26)) -> 4 | H27: =IF(B2="","",SUM(H9:H26)) -> 2 | I27: =IF(COUNTIF(I9:I26,"=Yes")=0,"",COUNTIF(I9:I26,"=Yes")) -> 11