A1: Paul Baldwin
A2: Club | B2: Weymouth
A3: Par/SS | B3: 70/67 | D3: Num. Of Fairways | I3: =IF(B2="","",18-(COUNTIF(B9:B26,3))) -> 14
A4: Date | B4: 37884 | D4: Playing Handicap | I4: 16.7
A5: Event Place | B5: 5 | D5: Prize Money | G5: 7500
A6: Game Stats | B6: DB+ | C6: DB | D6: Bi | E6: P | F6: B | G6: E | H6: A | I6: H1
B7: 4 | C7: 5 | D7: 6 | E7: 2 | F7: 1 | G7: 0 | H7: 0 | I7: 0
A8: Hole No | B8: Par | C8: Stroke Index | D8: Gross Score | E8: Points | F8: Putts | G8: Fairways | H8: Ferrets | I8: Green Regulation
A9: 1 | B9: 4 | C9: 11 | D9: 5 | E9: 2 | F9: 2 | I9: Yes
A10: 2 | B10: 4 | C10: 5 | D10: 4 | E10: 3 | F10: 2 | I10: Yes
A11: 3 | B11: 4 | C11: 7 | D11: 6 | E11: 1 | F11: 2
A12: 4 | B12: 4 | C12: 15 | D12: 5 | E12: 2 | F12: 2 | I12: Yes
A13: 5 | B13: 3 | C13: 13 | D13: 5 | E13: 1 | F13: 2 | H13: 1
A14: 6 | B14: 4 | C14: 1 | D14: 10 | E14: 0 | F14: 3 | H14: 1
A15: 7 | B15: 4 | C15: 17 | D15: 5 | E15: 2 | F15: 2 | G15: 1 | I15: Yes
A16: 8 | B16: 3 | C16: 9 | D16: 5 | E16: 1 | F16: 2 | H16: 1
A17: 9 | B17: 5 | C17: 3 | D17: 10 | E17: 0 | F17: 2 | H17: 1
A18: 10 | B18: 3 | C18: 18 | D18: 3 | E18: 2 | F18: 1
A19: 11 | B19: 4 | C19: 12 | D19: 3 | E19: 4 | F19: 1 | G19: 1 | I19: Yes
A20: 12 | B20: 4 | C20: 2 | D20: 6 | E20: 1 | F20: 2
A21: 13 | B21: 4 | C21: 6 | D21: 5 | E21: 2 | F21: 2 | G21: 1 | I21: Yes
A22: 14 | B22: 4 | C22: 16 | D22: 5 | E22: 2 | F22: 2 | I22: Yes
A23: 15 | B23: 3 | C23: 14 | D23: 5 | E23: 1 | F23: 3 | I23: Yes
A24: 16 | B24: 5 | C24: 4 | D24: 10 | E24: 0 | F24: 3 | H24: 1
A25: 17 | B25: 4 | C25: 10 | D25: 5 | E25: 2 | F25: 1 | G25: 1
A26: 18 | B26: 4 | C26: 8 | D26: 9 | E26: 0 | F26: 2
A27: Totals | B27: =IF(B2="","",SUM(B9:B26)) -> 70 | D27: =SUM(D9:D26) -> 106 | E27: =IF(B2="","",SUM(E9:E26)) -> 26 | F27: =IF(B2="","",SUM(F9:F26)) -> 36 | G27: =IF(B2="","",SUM(G9:G26)) -> 4 | H27: =IF(B2="","",SUM(H9:H26)) -> 5 | I27: =IF(COUNTIF(I9:I26,"=Yes")=0,"",COUNTIF(I9:I26,"=Yes")) -> 8