A1: Simon Thompson
A2: Club | B2: Weymouth
A3: Par/SS | B3: 70/67 | D3: Num. Of Fairways | I3: =IF(B2="","",18-(COUNTIF(B9:B26,3))) -> 14
A4: Date | B4: 37884 | D4: Playing Handicap | I4: 16.1
A5: Event Place | B5: 1 | D5: Prize Money | G5: 17500
A6: Game Stats | B6: DB+ | C6: DB | D6: Bi | E6: P | F6: B | G6: E | H6: A | I6: H1
B7: 2 | C7: 2 | D7: 7 | E7: 7 | F7: 0 | G7: 0 | H7: 0 | I7: 0
A8: Hole No | B8: Par | C8: Stroke Index | D8: Gross Score | E8: Points | F8: Putts | G8: Fairways | H8: Ferrets | I8: Green Regulation
A9: 1 | B9: 4 | C9: 11 | D9: 5 | E9: 2 | F9: 2 | G9: 1 | I9: Yes
A10: 2 | B10: 4 | C10: 5 | D10: 4 | E10: 3 | F10: 1 | I10: Yes
A11: 3 | B11: 4 | C11: 7 | D11: 5 | E11: 2 | F11: 2 | I11: Yes
A12: 4 | B12: 4 | C12: 15 | D12: 6 | E12: 1 | F12: 2 | G12: 1
A13: 5 | B13: 3 | C13: 13 | D13: 4 | E13: 2 | F13: 2 | I13: Yes
A14: 6 | B14: 4 | C14: 1 | D14: 6 | E14: 1 | F14: 3 | I14: Yes
A15: 7 | B15: 4 | C15: 17 | D15: 4 | E15: 2 | F15: 1
A16: 8 | B16: 3 | C16: 9 | D16: 4 | E16: 2 | F16: 2 | I16: Yes
A17: 9 | B17: 5 | C17: 3 | D17: 5 | E17: 3 | F17: 2 | G17: 1 | I17: Yes
A18: 10 | B18: 3 | C18: 18 | D18: 3 | E18: 2 | F18: 2 | I18: Yes
A19: 11 | B19: 4 | C19: 12 | D19: 5 | E19: 2 | F19: 1
A20: 12 | B20: 4 | C20: 2 | D20: 5 | E20: 2 | F20: 2 | G20: 1 | I20: Yes
A21: 13 | B21: 4 | C21: 6 | D21: 10 | E21: 0 | F21: 3
A22: 14 | B22: 4 | C22: 16 | D22: 4 | E22: 3 | F22: 1 | I22: Yes
A23: 15 | B23: 3 | C23: 14 | D23: 3 | E23: 3 | F23: 2 | I23: Yes
A24: 16 | B24: 5 | C24: 4 | D24: 6 | E24: 2 | F24: 2 | I24: Yes
A25: 17 | B25: 4 | C25: 10 | D25: 10 | E25: 0 | F25: 3 | H25: 1
A26: 18 | B26: 4 | C26: 8 | D26: 4 | E26: 3 | F26: 2 | G26: 1 | I26: Yes
A27: Totals | B27: =IF(B2="","",SUM(B9:B26)) -> 70 | D27: =IF(B2="","",SUM(D9:D26)) -> 93 | E27: =IF(B2="","",SUM(E9:E26)) -> 35 | F27: =IF(B2="","",SUM(F9:F26)) -> 35 | G27: =IF(B2="","",SUM(G9:G26)) -> 5 | H27: =IF(B2="","",SUM(H9:H26)) -> 1 | I27: =IF(COUNTIF(I9:I26,"=Yes")=0,"",COUNTIF(I9:I26,"=Yes")) -> 13