A1: Keith Mendelson
A2: Club | B2: Broke Hill
A3: Par/SS | B3: 72/72 | D3: Num. Of Fairways | I3: =IF(B2="","",18-(COUNTIF(B9:B26,3))) -> 14
A4: Date | B4: 38445 | D4: Playing Handicap | I4: 14.4
A5: Event Place | B5: 2 | D5: Prize Money | G5: 2500
A6: Game Stats | B6: DB+ | C6: DB | D6: Bi | E6: P | F6: B | G6: E | H6: A | I6: H1
B7: 1 | C7: 4 | D7: 5 | E7: 8 | F7: 0 | G7: 0 | H7: 0 | I7: 0
A8: Hole No | B8: Par | C8: Stroke Index | D8: Gross Score | E8: Points | F8: Putts | G8: Fairways | H8: Ferrets | I8: Green Regulation
A9: 1 | B9: 4 | C9: 13 | D9: 4 | E9: 3 | F9: 1 | I9: Yes
A10: 2 | B10: 4 | C10: 9 | D10: 5 | E10: 2 | F10: 2 | I10: Yes
A11: 3 | B11: 5 | C11: 3 | D11: 7 | E11: 1 | F11: 2 | G11: 1
A12: 4 | B12: 3 | C12: 15 | D12: 3 | E12: 2 | F12: 2 | I12: Yes
A13: 5 | B13: 4 | C13: 11 | D13: 4 | E13: 3 | F13: 1 | G13: 1 | I13: Yes
A14: 6 | B14: 4 | C14: 1 | D14: 6 | E14: 1 | F14: 2
A15: 7 | B15: 4 | C15: 7 | D15: 4 | E15: 3 | F15: 2 | I15: Yes
A16: 8 | B16: 3 | C16: 17 | D16: 3 | E16: 2 | F16: 1
A17: 9 | B17: 5 | C17: 5 | D17: 7 | E17: 1 | F17: 1
A18: 10 | B18: 4 | C18: 12 | D18: 5 | E18: 2 | F18: 2 | G18: 1 | I18: Yes
A19: 11 | B19: 3 | C19: 18 | D19: 5 | E19: 0 | F19: 2
A20: 12 | B20: 5 | C20: 4 | D20: 6 | E20: 2 | F20: 2 | G20: 1 | I20: Yes
A21: 13 | B21: 4 | C21: 8 | D21: 5 | E21: 2 | F21: 2 | I21: Yes
A22: 14 | B22: 4 | C22: 14 | D22: 4 | E22: 3 | F22: 2 | G22: 1 | I22: Yes
A23: 15 | B23: 5 | C23: 2 | D23: 6 | E23: 2 | F23: 1
A24: 16 | B24: 4 | C24: 16 | D24: 4 | E24: 2 | F24: 2 | I24: Yes
A25: 17 | B25: 3 | C25: 6 | D25: 7 | E25: 0 | F25: 3
A26: 18 | B26: 4 | C26: 10 | D26: 4 | E26: 3 | F26: 1 | I26: Yes
A27: Totals | B27: =IF(B2="","",SUM(B9:B26)) -> 72 | D27: =IF(B2="","",SUM(D9:D26)) -> 89 | E27: =IF(B2="","",SUM(E9:E26)) -> 34 | F27: =IF(B2="","",SUM(F9:F26)) -> 31 | G27: =IF(B2="","",SUM(G9:G26)) -> 5 | H27: =IF(B2="","",SUM(H9:H26)) -> 0 | I27: =IF(COUNTIF(I9:I26,"=Yes")=0,"",COUNTIF(I9:I26,"=Yes")) -> 11