A1: Season 12 - April 1st 2010 to 31st March 2011
A2: MGA World Tour Driving Accuracy (Fairways Hit)
B3: Statistics updated | C3: =TODAY() -> 40639
A4: Pos | B4: Player | C4: Original Handicap | D4: Current Handicap | E4: Playing Handicap | F4: Played | G4: Total Number of Fairways | H4: Total Fairways Hit | I4: Fairway %
A5: 1 | B5: Kevin Gallagher | C5: 13.5 | D5: 15.300000000000995 | E5: =D5 -> 15.300000000000995 | F5: 12 | G5: 163 | H5: 70 | I5: =IF(F5=0,"0 %",ROUND((H5/G5)*100,2) &" %") -> 42.94 % | J5: Qualified
A6: 2 | B6: Robert Thompson | C6: 10.0 | D6: 10.6 | E6: =D6 -> 10.6 | F6: 12 | G6: 161 | H6: 67 | I6: =IF(F6=0,"0 %",ROUND((H6/G6)*100,2) &" %") -> 41.61 % | J6: Qualified
A7: 3 | B7: Michael Trimmings | C7: 24.5 | D7: 25.0 | E7: =D7 -> 25 | F7: 5 | G7: 71 | H7: 22 | I7: =IF(F7=0,"0 %",ROUND((H7/G7)*100,2) &" %") -> 30.99 % | J7: Qualified
A8: 4 | B8: Matthew Carter | C8: 19.5 | D8: 17.0 | E8: =D8 -> 17 | F8: 5 | G8: 69 | H8: 25 | I8: =IF(F8=0,"0 %",ROUND((H8/G8)*100,2) &" %") -> 36.23 % | J8: Qualified
A9: 5 | B9: Dave Rouse | C9: 25.6 | D9: 25.1 | E9: =D9 -> 25.1 | F9: 5 | G9: 69 | H9: 19 | I9: =IF(F9=0,"0 %",ROUND((H9/G9)*100,2) &" %") -> 27.54 % | J9: Qualified
A10: 6 | B10: Jon Dey | C10: 30.2 | D10: 30.0 | E10: =D10 -> 30 | F10: 5 | G10: 70 | H10: 19 | I10: =IF(F10=0,"0 %",ROUND((H10/G10)*100,2) &" %") -> 27.14 % | J10: Qualified
A11: 7 | B11: Martin Cox | C11: 13.7 | D11: 13.5 | E11: =D11 -> 13.5 | F11: 2 | G11: 28 | H11: 18 | I11: =IF(F11=0,"0 %",ROUND((H11/G11)*100,2) &" %") -> 64.29 %
A12: 8 | B12: Dave Andrews | C12: 16.7 | D12: 15.8 | E12: =D12 -> 15.8 | F12: 4 | G12: 58 | H12: 28 | I12: =IF(F12=0,"0 %",ROUND((H12/G12)*100,2) &" %") -> 48.28 %
A13: 9 | B13: Dave Bingham | C13: 13.5 | D13: 11.5 | E13: =D13 -> 11.5 | F13: 3 | G13: 41 | H13: 19 | I13: =IF(F13=0,"0 %",ROUND((H13/G13)*100,2) &" %") -> 46.34 %
A14: 10 | B14: David Braithwaite | C14: 12.0 | D14: 11.7 | E14: =D14 -> 11.7 | F14: 3 | G14: 41 | H14: 15 | I14: =IF(F14=0,"0 %",ROUND((H14/G14)*100,2) &" %") -> 36.59 %
A15: 11 | B15: Jon Press | C15: 13.3 | D15: 14.0 | E15: =D15 -> 14 | F15: 2 | G15: 28 | H15: 10 | I15: =IF(F15=0,"0 %",ROUND((H15/G15)*100,2) &" %") -> 35.71 %
A16: 12 | B16: Roy Dickens | C16: 29.8 | D16: 29.6 | E16: =D16 -> 29.6 | F16: 4 | G16: 41 | H16: 14 | I16: =IF(F16=0,"0 %",ROUND((H16/G16)*100,2) &" %") -> 34.15 %
A17: 13 | B17: Andy Benson | C17: 7.4 | D17: 7.5 | E17: =D17 -> 7.5 | F17: 1 | G17: 15 | H17: 5 | I17: =IF(F17=0,"0 %",ROUND((H17/G17)*100,2) &" %") -> 33.33 %
A18: 14 | B18: Paul Carter | C18: 13.3 | D18: 13.9 | E18: =D18 -> 13.9 | F18: 4 | G18: 55 | H18: 18 | I18: =IF(F18=0,"0 %",ROUND((H18/G18)*100,2) &" %") -> 32.73 %
A19: 15 | B19: Martin Bould | C19: 19.7 | D19: 17.8 | E19: =D19 -> 17.8 | F19: 2 | G19: 28 | H19: 9 | I19: =IF(F19=0,"0 %",ROUND((H19/G19)*100,2) &" %") -> 32.14 %
A20: 16 | B20: Ian Edwards | C20: 13.6 | D20: 12.600000000001 | E20: =D20 -> 12.600000000001 | F20: 4 | G20: 56 | H20: 17 | I20: =IF(F20=0,"0 %",ROUND((H20/G20)*100,2) &" %") -> 30.36 %
A21: 17 | B21: Keith Mendelson | C21: 14.6 | D21: 15.0 | E21: =D21 -> 15 | F21: 2 | G21: 28 | H21: 8 | I21: =IF(F21=0,"0 %",ROUND((H21/G21)*100,2) &" %") -> 28.57 %
A22: 18 | B22: Andrew Baldwin | C22: 19.2 | D22: 19.7 | E22: =D22 -> 19.7 | F22: 2 | G22: 28 | H22: 7 | I22: =IF(F22=0,"0 %",ROUND((H22/G22)*100,2) &" %") -> 25 %
A23: 19 | B23: Simon Thompson | C23: 9.6 | D23: 9.3 | E23: =D23 -> 9.3 | F23: 4 | G23: 55 | H23: 13 | I23: =IF(F23=0,"0 %",ROUND((H23/G23)*100,2) &" %") -> 23.64 %
A24: 20 | B24: Alan Hopkins | C24: 7.9 | D24: 7.2 | E24: =D24 -> 7.2 | F24: 1 | G24: 13 | H24: 3 | I24: =IF(F24=0,"0 %",ROUND((H24/G24)*100,2) &" %") -> 23.08 %
A25: 21 | B25: Alan Baldwin | C25: 20.5 | D25: 21.0 | E25: =D25 -> 21 | F25: 1 | G25: 14 | H25: 3 | I25: =IF(F25=0,"0 %",ROUND((H25/G25)*100,2) &" %") -> 21.43 %
A26: 22 | B26: Paul Baldwin | C26: 19.3 | D26: 19.500000000001002 | E26: =D26 -> 19.500000000001002 | F26: 2 | G26: 28 | H26: 3 | I26: =IF(F26=0,"0 %",ROUND((H26/G26)*100,2) &" %") -> 10.71 %
A27: 23 | B27: Jeff Colbrook | C27: 15.2 | D27: 14.7 | E27: =D27 -> 14.7 | F27: 2 | G27: 28 | H27: 3 | I27: =IF(F27=0,"0 %",ROUND((H27/G27)*100,2) &" %") -> 10.71 %
A28: 24 | B28: Andrew Knight | C28: 21.4 | D28: 21.4 | E28: =D28 -> 21.4 | F28: 0 | G28: 0 | H28: 0 | I28: =IF(F28=0,"0 %",ROUND((H28/G28)*100,2) &" %") -> 0 %
A29: 25 | B29: Chris Manning | C29: 22.7 | D29: 22.7 | E29: =D29 -> 22.7 | F29: 0 | G29: 0 | H29: 0 | I29: =IF(F29=0,"0 %",ROUND((H29/G29)*100,2) &" %") -> 0 %
A30: 26 | B30: Clive Ferris | C30: 26.0 | D30: 26.0 | E30: =D30 -> 26 | F30: 0 | G30: 0 | H30: 0 | I30: =IF(F30=0,"0 %",ROUND((H30/G30)*100,2) &" %") -> 0 %
A31: 27 | B31: Dave White | C31: 21.5 | D31: 21.5 | E31: =D31 -> 21.5 | F31: 0 | G31: 0 | H31: 0 | I31: =IF(F31=0,"0 %",ROUND((H31/G31)*100,2) &" %") -> 0 %
A32: 28 | B32: Jeff Gibbons | C32: 21.0 | D32: 21.0 | E32: =D32 -> 21 | F32: 0 | G32: 0 | H32: 0 | I32: =IF(F32=0,"0 %",ROUND((H32/G32)*100,2) &" %") -> 0 %
A33: 29 | B33: Keith Johns | C33: 24.3 | D33: 24.3 | E33: =D33 -> 24.3 | F33: 0 | G33: 0 | H33: 0 | I33: =IF(F33=0,"0 %",ROUND((H33/G33)*100,2) &" %") -> 0 %
A34: 30 | B34: Malcolm Rouse | C34: 43.9 | D34: 43.9 | E34: =D34 -> 43.9 | F34: 0 | G34: 0 | H34: 0 | I34: =IF(F34=0,"0 %",ROUND((H34/G34)*100,2) &" %") -> 0 %
A35: 31 | B35: Simon Owens | C35: 13.7 | D35: 13.7 | E35: =D35 -> 13.7 | F35: 0 | G35: 0 | H35: 0 | I35: =IF(F35=0,"0 %",ROUND((H35/G35)*100,2) &" %") -> 0 %
A36: 32 | B36: Steve Tilling | C36: 16.5 | D36: 16.5 | E36: =D36 -> 16.5 | F36: 0 | G36: 0 | H36: 0 | I36: =IF(F36=0,"0 %",ROUND((H36/G36)*100,2) &" %") -> 0 %