A1: Season 12 - April 1st 2010 to 31st March 2011
A2: MGA World Tour Net Greens in Regulation
B3: Statistics updated | C3: =TODAY() -> 40631
A4: Pos | B4: Player | C4: Original Handicap | D4: Current Handicap | E4: Playing Handicap | F4: Played | G4: Total Greens Hit | H4: Green in Regulation | I4: Greens in Regulation Ratio
A5: 1 | B5: Matthew Carter | C5: 19.5 | D5: 17.0 | E5: =D5 -> 17 | F5: 5 | G5: 55 | H5: 61.11 % | I5: =IF(G5="","",IF(G5=0,"0 : "&F5*18,"1 : "&ROUND((F5*18)/G5,1))) -> 1 : 1.6 | J5: Qualified
A6: 2 | B6: Jon Dey | C6: 30.2 | D6: 30.0 | E6: =D6 -> 30 | F6: 5 | G6: 53 | H6: 58.89 % | I6: =IF(G6="","",IF(G6=0,"0 : "&F6*18,"1 : "&ROUND((F6*18)/G6,1))) -> 1 : 1.7 | J6: Qualified
A7: 3 | B7: Dave Rouse | C7: 25.6 | D7: 25.1 | E7: =D7 -> 25.1 | F7: 5 | G7: 49 | H7: 54.44 % | I7: =IF(G7="","",IF(G7=0,"0 : "&F7*18,"1 : "&ROUND((F7*18)/G7,1))) -> 1 : 1.8 | J7: Qualified
A8: 4 | B8: Michael Trimmings | C8: 24.5 | D8: 25.0 | E8: =D8 -> 25 | F8: 5 | G8: 49 | H8: 54.44 % | I8: =IF(G8="","",IF(G8=0,"0 : "&F8*18,"1 : "&ROUND((F8*18)/G8,1))) -> 1 : 1.8 | J8: Qualified
A9: 5 | B9: Robert Thompson | C9: 10.0 | D9: 10.6 | E9: =D9 -> 10.6 | F9: 12 | G9: 117 | H9: 54.17 % | I9: =IF(G9="","",IF(G9=0,"0 : "&F9*18,"1 : "&ROUND((F9*18)/G9,1))) -> 1 : 1.8 | J9: Qualified
A10: 6 | B10: Kevin Gallagher | C10: 13.5 | D10: 15.300000000000995 | E10: =D10 -> 15.300000000000995 | F10: 12 | G10: 104 | H10: 48.15 % | I10: =IF(G10="","",IF(G10=0,"0 : "&F10*18,"1 : "&ROUND((F10*18)/G10,1))) -> 1 : 2.1 | J10: Qualified
A11: 7 | B11: Martin Bould | C11: 19.7 | D11: 17.8 | E11: =D11 -> 17.8 | F11: 2 | G11: 25 | H11: 69.44 % | I11: =IF(G11="","",IF(G11=0,"0 : "&F11*18,"1 : "&ROUND((F11*18)/G11,1))) -> 1 : 1.4
A12: 8 | B12: Jeff Colbrook | C12: 15.2 | D12: 14.7 | E12: =D12 -> 14.7 | F12: 2 | G12: 23 | H12: 63.89 % | I12: =IF(G12="","",IF(G12=0,"0 : "&F12*18,"1 : "&ROUND((F12*18)/G12,1))) -> 1 : 1.6
A13: 9 | B13: Dave Bingham | C13: 13.5 | D13: 11.5 | E13: =D13 -> 11.5 | F13: 3 | G13: 34 | H13: 62.96 % | I13: =IF(G13="","",IF(G13=0,"0 : "&F13*18,"1 : "&ROUND((F13*18)/G13,1))) -> 1 : 1.6
A14: 10 | B14: Alan Hopkins | C14: 7.9 | D14: 7.2 | E14: =D14 -> 7.2 | F14: 1 | G14: 11 | H14: 61.11 % | I14: =IF(G14="","",IF(G14=0,"0 : "&F14*18,"1 : "&ROUND((F14*18)/G14,1))) -> 1 : 1.6
A15: 11 | B15: Ian Edwards | C15: 13.6 | D15: 12.600000000001 | E15: =D15 -> 12.600000000001 | F15: 4 | G15: 42 | H15: 58.33 % | I15: =IF(G15="","",IF(G15=0,"0 : "&F15*18,"1 : "&ROUND((F15*18)/G15,1))) -> 1 : 1.7
A16: 12 | B16: Dave Andrews | C16: 16.7 | D16: 15.8 | E16: =D16 -> 15.8 | F16: 4 | G16: 39 | H16: 54.17 % | I16: =IF(G16="","",IF(G16=0,"0 : "&F16*18,"1 : "&ROUND((F16*18)/G16,1))) -> 1 : 1.8
A17: 13 | B17: David Braithwaite | C17: 12.0 | D17: 11.7 | E17: =D17 -> 11.7 | F17: 3 | G17: 28 | H17: 51.85 % | I17: =IF(G17="","",IF(G17=0,"0 : "&F17*18,"1 : "&ROUND((F17*18)/G17,1))) -> 1 : 1.9
A18: 14 | B18: Paul Carter | C18: 13.3 | D18: 13.9 | E18: =D18 -> 13.9 | F18: 4 | G18: 37 | H18: 51.39 % | I18: =IF(G18="","",IF(G18=0,"0 : "&F18*18,"1 : "&ROUND((F18*18)/G18,1))) -> 1 : 1.9
A19: 15 | B19: Simon Thompson | C19: 9.6 | D19: 9.3 | E19: =D19 -> 9.3 | F19: 4 | G19: 36 | H19: 50 % | I19: =IF(G19="","",IF(G19=0,"0 : "&F19*18,"1 : "&ROUND((F19*18)/G19,1))) -> 1 : 2
A20: 16 | B20: Roy Dickens | C20: 29.8 | D20: 29.6 | E20: =D20 -> 29.6 | F20: 4 | G20: 36 | H20: 50 % | I20: =IF(G20="","",IF(G20=0,"0 : "&F20*18,"1 : "&ROUND((F20*18)/G20,1))) -> 1 : 2
A21: 17 | B21: Paul Baldwin | C21: 19.3 | D21: 19.500000000001002 | E21: =D21 -> 19.500000000001002 | F21: 2 | G21: 18 | H21: 50 % | I21: =IF(G21="","",IF(G21=0,"0 : "&F21*18,"1 : "&ROUND((F21*18)/G21,1))) -> 1 : 2
A22: 18 | B22: Martin Cox | C22: 13.7 | D22: 13.5 | E22: =D22 -> 13.5 | F22: 2 | G22: 18 | H22: 50 % | I22: =IF(G22="","",IF(G22=0,"0 : "&F22*18,"1 : "&ROUND((F22*18)/G22,1))) -> 1 : 2
A23: 19 | B23: Andy Benson | C23: 7.4 | D23: 7.5 | E23: =D23 -> 7.5 | F23: 1 | G23: 9 | H23: 50 % | I23: =IF(G23="","",IF(G23=0,"0 : "&F23*18,"1 : "&ROUND((F23*18)/G23,1))) -> 1 : 2
A24: 20 | B24: Keith Mendelson | C24: 14.6 | D24: 15.0 | E24: =D24 -> 15 | F24: 2 | G24: 15 | H24: 41.67 % | I24: =IF(G24="","",IF(G24=0,"0 : "&F24*18,"1 : "&ROUND((F24*18)/G24,1))) -> 1 : 2.4
A25: 21 | B25: Andrew Baldwin | C25: 19.2 | D25: 19.7 | E25: =D25 -> 19.7 | F25: 2 | G25: 14 | H25: 38.89 % | I25: =IF(G25="","",IF(G25=0,"0 : "&F25*18,"1 : "&ROUND((F25*18)/G25,1))) -> 1 : 2.6
A26: 22 | B26: Jon Press | C26: 13.3 | D26: 14.0 | E26: =D26 -> 14 | F26: 2 | G26: 14 | H26: 38.89 % | I26: =IF(G26="","",IF(G26=0,"0 : "&F26*18,"1 : "&ROUND((F26*18)/G26,1))) -> 1 : 2.6
A27: 23 | B27: Alan Baldwin | C27: 20.5 | D27: 21.0 | E27: =D27 -> 21 | F27: 1 | G27: 6 | H27: 33.33 % | I27: =IF(G27="","",IF(G27=0,"0 : "&F27*18,"1 : "&ROUND((F27*18)/G27,1))) -> 1 : 3
A28: 24 | B28: Andrew Knight | C28: 21.4 | D28: 21.4 | E28: =D28 -> 21.4 | F28: 0 | G28: 0 | H28: 0.00 | I28: =IF(G28="","",IF(G28=0,"0 : "&F28*18,"1 : "&ROUND((F28*18)/G28,1))) -> 0 : 0
A29: 25 | B29: Chris Manning | C29: 22.7 | D29: 22.7 | E29: =D29 -> 22.7 | F29: 0 | G29: 0 | H29: 0.00 | I29: =IF(G29="","",IF(G29=0,"0 : "&F29*18,"1 : "&ROUND((F29*18)/G29,1))) -> 0 : 0
A30: 26 | B30: Clive Ferris | C30: 26.0 | D30: 26.0 | E30: =D30 -> 26 | F30: 0 | G30: 0 | H30: 0.00 | I30: =IF(G30="","",IF(G30=0,"0 : "&F30*18,"1 : "&ROUND((F30*18)/G30,1))) -> 0 : 0
A31: 27 | B31: Dave White | C31: 21.5 | D31: 21.5 | E31: =D31 -> 21.5 | F31: 0 | G31: 0 | H31: 0.00 | I31: =IF(G31="","",IF(G31=0,"0 : "&F31*18,"1 : "&ROUND((F31*18)/G31,1))) -> 0 : 0
A32: 28 | B32: Jeff Gibbons | C32: 21.0 | D32: 21.0 | E32: =D32 -> 21 | F32: 0 | G32: 0 | H32: 0.00 | I32: =IF(G32="","",IF(G32=0,"0 : "&F32*18,"1 : "&ROUND((F32*18)/G32,1))) -> 0 : 0
A33: 29 | B33: Keith Johns | C33: 24.3 | D33: 24.3 | E33: =D33 -> 24.3 | F33: 0 | G33: 0 | H33: 0.00 | I33: =IF(G33="","",IF(G33=0,"0 : "&F33*18,"1 : "&ROUND((F33*18)/G33,1))) -> 0 : 0
A34: 30 | B34: Malcolm Rouse | C34: 43.9 | D34: 43.9 | E34: =D34 -> 43.9 | F34: 0 | G34: 0 | H34: 0.00 | I34: =IF(G34="","",IF(G34=0,"0 : "&F34*18,"1 : "&ROUND((F34*18)/G34,1))) -> 0 : 0
A35: 31 | B35: Simon Owens | C35: 13.7 | D35: 13.7 | E35: =D35 -> 13.7 | F35: 0 | G35: 0 | H35: 0.00 | I35: =IF(G35="","",IF(G35=0,"0 : "&F35*18,"1 : "&ROUND((F35*18)/G35,1))) -> 0 : 0
A36: 32 | B36: Steve Tilling | C36: 16.5 | D36: 16.5 | E36: =D36 -> 16.5 | F36: 0 | G36: 0 | H36: 0.00 | I36: =IF(G36="","",IF(G36=0,"0 : "&F36*18,"1 : "&ROUND((F36*18)/G36,1))) -> 0 : 0