A1: Season 12 - April 1st 2010 to 31st March 2011
A2: MGA World Tour Money List
B3: Statistics updated | C3: =TODAY() -> 40631
A4: Pos | B4: Player | C4: Original Handicap | D4: Current Handicap | E4: Playing Handicap | F4: Events Played | G4: Tour Victories | H4: Winnings
A5: 1 | B5: Matthew Carter | C5: 19.5 | D5: 17.0 | E5: =D5 -> 17 | F5: 5 | G5: 2 | H5: 125000
A6: =A5+1 -> 2 | B6: Robert Thompson | C6: 10.0 | D6: 10.6 | E6: =D6 -> 10.6 | F6: 12 | G6: 3 | H6: 113750
A7: =A6+1 -> 3 | B7: Dave Rouse | C7: 25.6 | D7: 25.1 | E7: =D7 -> 25.1 | F7: 5 | G7: 1 | H7: 90000
A8: =A7+1 -> 4 | B8: Dave Bingham | C8: 13.5 | D8: 11.5 | E8: =D8 -> 11.5 | F8: 3 | G8: 0 | H8: 76250
A9: =A8+1 -> 5 | B9: Kevin Gallagher | C9: 13.5 | D9: 15.300000000000995 | E9: =D9 -> 15.300000000000995 | F9: 12 | G9: 3 | H9: 73750
A10: =A9+1 -> 6 | B10: Simon Thompson | C10: 9.6 | D10: 9.3 | E10: =D10 -> 9.3 | F10: 4 | G10: 0 | H10: 71250
A11: =A10+1 -> 7 | B11: Paul Carter | C11: 13.3 | D11: 13.9 | E11: =D11 -> 13.9 | F11: 4 | G11: 0 | H11: 67500
A12: =A11+1 -> 8 | B12: Dave Andrews | C12: 16.7 | D12: 15.8 | E12: =D12 -> 15.8 | F12: 4 | G12: 2 | H12: 65000
A13: =A12+1 -> 9 | B13: Michael Trimmings | C13: 24.5 | D13: 25.0 | E13: =D13 -> 25 | F13: 5 | G13: 1 | H13: 57500
A14: =A13+1 -> 10 | B14: Martin Bould | C14: 19.7 | D14: 17.8 | E14: =D14 -> 17.8 | F14: 2 | G14: 1 | H14: 57500
A15: =A14+1 -> 11 | B15: Roy Dickens | C15: 29.8 | D15: 29.6 | E15: =D15 -> 29.6 | F15: 4 | G15: 0 | H15: 57500
A16: =A15+1 -> 12 | B16: Ian Edwards | C16: 13.6 | D16: 12.600000000001 | E16: =D16 -> 12.600000000001 | F16: 4 | G16: 0 | H16: 48750
A17: =A16+1 -> 13 | B17: Jon Dey | C17: 30.2 | D17: 30.0 | E17: =D17 -> 30 | F17: 5 | G17: 2 | H17: 43750
A18: =A17+1 -> 14 | B18: Martin Cox | C18: 13.7 | D18: 13.5 | E18: =D18 -> 13.5 | F18: 2 | G18: 0 | H18: 43750
A19: =A18+1 -> 15 | B19: David Braithwaite | C19: 12.0 | D19: 11.7 | E19: =D19 -> 11.7 | F19: 3 | G19: 1 | H19: 42500
A20: =A19+1 -> 16 | B20: Jeff Colbrook | C20: 15.2 | D20: 14.7 | E20: =D20 -> 14.7 | F20: 2 | G20: 0 | H20: 32500
A21: =A20+1 -> 17 | B21: Paul Baldwin | C21: 19.3 | D21: 19.500000000001002 | E21: =D21 -> 19.500000000001002 | F21: 2 | G21: 0 | H21: 30000
A22: =A21+1 -> 18 | B22: Andrew Baldwin | C22: 19.2 | D22: 19.7 | E22: =D22 -> 19.7 | F22: 2 | G22: 0 | H22: 25000
A23: =A22+1 -> 19 | B23: Alan Hopkins | C23: 7.9 | D23: 7.2 | E23: =D23 -> 7.2 | F23: 1 | G23: 0 | H23: 22500
A24: =A23+1 -> 20 | B24: Keith Mendelson | C24: 14.6 | D24: 15.0 | E24: =D24 -> 15 | F24: 2 | G24: 0 | H24: 17500
A25: =A24+1 -> 21 | B25: Jon Press | C25: 13.3 | D25: 14.0 | E25: =D25 -> 14 | F25: 2 | G25: 0 | H25: 15000
A26: =A25+1 -> 22 | B26: Andy Benson | C26: 7.4 | D26: 7.5 | E26: =D26 -> 7.5 | F26: 1 | G26: 0 | H26: 7500
A27: =A26+1 -> 23 | B27: Alan Baldwin | C27: 20.5 | D27: 21.0 | E27: =D27 -> 21 | F27: 1 | G27: 0 | H27: 6250
A28: =A27+1 -> 24 | B28: Andrew Knight | C28: 21.4 | D28: 21.4 | E28: =D28 -> 21.4 | F28: 0 | G28: 0 | H28: 0
A29: =A28+1 -> 25 | B29: Chris Manning | C29: 22.7 | D29: 22.7 | E29: =D29 -> 22.7 | F29: 0 | G29: 0 | H29: 0
A30: =A29+1 -> 26 | B30: Clive Ferris | C30: 26.0 | D30: 26.0 | E30: =D30 -> 26 | F30: 0 | G30: 0 | H30: 0
A31: =A30+1 -> 27 | B31: Dave White | C31: 21.5 | D31: 21.5 | E31: =D31 -> 21.5 | F31: 0 | G31: 0 | H31: 0
A32: =A31+1 -> 28 | B32: Jeff Gibbons | C32: 21.0 | D32: 21.0 | E32: =D32 -> 21 | F32: 0 | G32: 0 | H32: 0
A33: =A32+1 -> 29 | B33: Keith Johns | C33: 24.3 | D33: 24.3 | E33: =D33 -> 24.3 | F33: 0 | G33: 0 | H33: 0
A34: =A33+1 -> 30 | B34: Malcolm Rouse | C34: 43.9 | D34: 43.9 | E34: =D34 -> 43.9 | F34: 0 | G34: 0 | H34: 0
A35: =A34+1 -> 31 | B35: Simon Owens | C35: 13.7 | D35: 13.7 | E35: =D35 -> 13.7 | F35: 0 | G35: 0 | H35: 0
A36: =A35+1 -> 32 | B36: Steve Tilling | C36: 16.5 | D36: 16.5 | E36: =D36 -> 16.5 | F36: 0 | G36: 0 | H36: 0