A1: Season 12 - April 1st 2010 to 31st March 2011
A2: MGA World Tour Putting Statistics
B3: Statistics updated | C3: =TODAY() -> 40631
A4: Pos | B4: Player | C4: Original Handicap | D4: Current Handicap | E4: Playing Handicap | F4: Played | G4: Total Putts | H4: Ave per Round | I4: Ave Per Hole | J4: Best Round | K4: Worst Round
A5: 1 | B5: Robert Thompson | C5: 10.0 | D5: 10.6 | E5: =D5 -> 10.6 | F5: 12 | G5: 393 | H5: 32.75 | I5: =IF(G5=0,"",G5/(F5*18)) -> 1.8194444444444444 | J5: 28 | K5: 37 | L5: Qualified
A6: 2 | B6: Matthew Carter | C6: 19.5 | D6: 17.0 | E6: =D6 -> 17 | F6: 5 | G6: 170 | H6: 34.00 | I6: =IF(G6=0,"",G6/(F6*18)) -> 1.8888888888888888 | J6: 30 | K6: 37 | L6: Qualified
A7: 3 | B7: Michael Trimmings | C7: 24.5 | D7: 25.0 | E7: =D7 -> 25 | F7: 5 | G7: 174 | H7: 34.80 | I7: =IF(G7=0,"",G7/(F7*18)) -> 1.9333333333333333 | J7: 30 | K7: 39 | L7: Qualified
A8: 4 | B8: Kevin Gallagher | C8: 13.5 | D8: 15.300000000000995 | E8: =D8 -> 15.300000000000995 | F8: 12 | G8: 421 | H8: 35.083333333333336 | I8: =IF(G8=0,"",G8/(F8*18)) -> 1.9490740740740742 | J8: 27 | K8: 40 | L8: Qualified
A9: 5 | B9: Jon Dey | C9: 30.2 | D9: 30.0 | E9: =D9 -> 30 | F9: 5 | G9: 178 | H9: 35.60 | I9: =IF(G9=0,"",G9/(F9*18)) -> 1.9777777777777779 | J9: 32 | K9: 39 | L9: Qualified
A10: 6 | B10: Dave Rouse | C10: 25.6 | D10: 25.1 | E10: =D10 -> 25.1 | F10: 5 | G10: 185 | H10: 37.00 | I10: =IF(G10=0,"",G10/(F10*18)) -> 2.0555555555555554 | J10: 35 | K10: 40 | L10: Qualified
A11: 7 | B11: Dave Andrews | C11: 16.7 | D11: 15.8 | E11: =D11 -> 15.8 | F11: 4 | G11: 114 | H11: 28.50 | I11: =IF(G11=0,"",G11/(F11*18)) -> 1.5833333333333333 | J11: 26 | K11: 33
A12: 8 | B12: Alan Hopkins | C12: 7.9 | D12: 7.2 | E12: =D12 -> 7.2 | F12: 1 | G12: 30 | H12: 30.00 | I12: =IF(G12=0,"",G12/(F12*18)) -> 1.6666666666666667 | J12: 30 | K12: 30
A13: 9 | B13: Keith Mendelson | C13: 14.6 | D13: 15.0 | E13: =D13 -> 15 | F13: 2 | G13: 64 | H13: 32.00 | I13: =IF(G13=0,"",G13/(F13*18)) -> 1.7777777777777777 | J13: 29 | K13: 35
A14: 10 | B14: Andy Benson | C14: 7.4 | D14: 7.5 | E14: =D14 -> 7.5 | F14: 1 | G14: 32 | H14: 32.00 | I14: =IF(G14=0,"",G14/(F14*18)) -> 1.7777777777777777 | J14: 32 | K14: 32
A15: 11 | B15: Martin Cox | C15: 13.7 | D15: 13.5 | E15: =D15 -> 13.5 | F15: 2 | G15: 67 | H15: 33.50 | I15: =IF(G15=0,"",G15/(F15*18)) -> 1.8611111111111112 | J15: 29 | K15: 38
A16: 12 | B16: Dave Bingham | C16: 13.5 | D16: 11.5 | E16: =D16 -> 11.5 | F16: 3 | G16: 101 | H16: 33.666666666666664 | I16: =IF(G16=0,"",G16/(F16*18)) -> 1.8703703703703705 | J16: 31 | K16: 36
A17: 13 | B17: Martin Bould | C17: 19.7 | D17: 17.8 | E17: =D17 -> 17.8 | F17: 2 | G17: 68 | H17: 34.00 | I17: =IF(G17=0,"",G17/(F17*18)) -> 1.8888888888888888 | J17: 32 | K17: 36
A18: 14 | B18: Ian Edwards | C18: 13.6 | D18: 12.600000000001 | E18: =D18 -> 12.600000000001 | F18: 4 | G18: 137 | H18: 34.25 | I18: =IF(G18=0,"",G18/(F18*18)) -> 1.9027777777777777 | J18: 32 | K18: 37
A19: 15 | B19: Simon Thompson | C19: 9.6 | D19: 9.3 | E19: =D19 -> 9.3 | F19: 4 | G19: 137 | H19: 34.25 | I19: =IF(G19=0,"",G19/(F19*18)) -> 1.9027777777777777 | J19: 33 | K19: 37
A20: 16 | B20: Paul Baldwin | C20: 19.3 | D20: 19.500000000001002 | E20: =D20 -> 19.500000000001002 | F20: 2 | G20: 69 | H20: 34.50 | I20: =IF(G20=0,"",G20/(F20*18)) -> 1.9166666666666667 | J20: 33 | K20: 36
A21: 17 | B21: Andrew Baldwin | C21: 19.2 | D21: 19.7 | E21: =D21 -> 19.7 | F21: 2 | G21: 69 | H21: 34.50 | I21: =IF(G21=0,"",G21/(F21*18)) -> 1.9166666666666667 | J21: 31 | K21: 38
A22: 18 | B22: Paul Carter | C22: 13.3 | D22: 13.9 | E22: =D22 -> 13.9 | F22: 4 | G22: 139 | H22: 34.75 | I22: =IF(G22=0,"",G22/(F22*18)) -> 1.9305555555555556 | J22: 32 | K22: 41
A23: 19 | B23: Roy Dickens | C23: 29.8 | D23: 29.6 | E23: =D23 -> 29.6 | F23: 4 | G23: 141 | H23: 35.25 | I23: =IF(G23=0,"",G23/(F23*18)) -> 1.9583333333333333 | J23: 32 | K23: 37
A24: 20 | B24: John Press | C24: 13.3 | D24: 14.0 | E24: =D24 -> 14 | F24: 2 | G24: 71 | H24: 35.50 | I24: =IF(G24=0,"",G24/(F24*18)) -> 1.9722222222222223 | J24: 35 | K24: 36
A25: 21 | B25: David Braithwaite | C25: 12.0 | D25: 11.7 | E25: =D25 -> 11.7 | F25: 3 | G25: 107 | H25: 35.666666666666664 | I25: =IF(G25=0,"",G25/(F25*18)) -> 1.9814814814814814 | J25: 34 | K25: 37
A26: 22 | B26: Jeff Colbrook | C26: 15.2 | D26: 14.7 | E26: =D26 -> 14.7 | F26: 2 | G26: 72 | H26: 36.00 | I26: =IF(G26=0,"",G26/(F26*18)) -> 2.00 | J26: 35 | K26: 37
A27: 23 | B27: Alan Baldwin | C27: 20.5 | D27: 21.0 | E27: =D27 -> 21 | F27: 1 | G27: 37 | H27: 37.00 | I27: =IF(G27=0,"",G27/(F27*18)) -> 2.0555555555555554 | J27: 37 | K27: 37
A28: 24 | B28: Andrew Knight | C28: 21.4 | D28: 21.4 | E28: =D28 -> 21.4 | F28: 0 | G28: 0 | H28: 0.00 | I28: =IF(G28=0,"",G28/(F28*18)) ->  | J28: 0 | K28: 0
A29: 25 | B29: Chris Manning | C29: 22.7 | D29: 22.7 | E29: =D29 -> 22.7 | F29: 0 | G29: 0 | H29: 0.00 | I29: =IF(G29=0,"",G29/(F29*18)) ->  | J29: 0 | K29: 0
A30: 26 | B30: Clive Ferris | C30: 26.0 | D30: 26.0 | E30: =D30 -> 26 | F30: 0 | G30: 0 | H30: 0.00 | I30: =IF(G30=0,"",G30/(F30*18)) ->  | J30: 0 | K30: 0
A31: 27 | B31: Dave White | C31: 21.5 | D31: 21.5 | E31: =D31 -> 21.5 | F31: 0 | G31: 0 | H31: 0.00 | I31: =IF(G31=0,"",G31/(F31*18)) ->  | J31: 0 | K31: 0
A32: 28 | B32: Jeff Gibbons | C32: 21.0 | D32: 21.0 | E32: =D32 -> 21 | F32: 0 | G32: 0 | H32: 0.00 | I32: =IF(G32=0,"",G32/(F32*18)) ->  | J32: 0 | K32: 0
A33: 29 | B33: Keith Johns | C33: 21.5 | D33: 21.5 | E33: =D33 -> 21.5 | F33: 0 | G33: 0 | H33: 0.00 | I33: =IF(G33=0,"",G33/(F33*18)) ->  | J33: 0 | K33: 0
A34: 30 | B34: Malcolm Rouse | C34: 43.9 | D34: 43.9 | E34: =D34 -> 43.9 | F34: 0 | G34: 0 | H34: 0.00 | I34: =IF(G34=0,"",G34/(F34*18)) ->  | J34: 0 | K34: 0
A35: 31 | B35: Simon Owens | C35: 13.7 | D35: 13.7 | E35: =D35 -> 13.7 | F35: 0 | G35: 0 | H35: 0.00 | I35: =IF(G35=0,"",G35/(F35*18)) ->  | J35: 0 | K35: 0
A36: 32 | B36: Steve Tilling | C36: 16.5 | D36: 16.5 | E36: =D36 -> 16.5 | F36: 0 | G36: 0 | H36: 0.00 | I36: =IF(G36=0,"",G36/(F36*18)) ->  | J36: 0 | K36: 0