A1: Simon Owens
A2: Club | B2: The Grove
A3: Par/SS | B3: 72/72 | D3: Num. Of Fairways | I3: =IF(B2="","",18-(COUNTIF(B9:B26,3))) -> 14
A4: Date | B4: 39289 | D4: Playing Handicap | I4: 13.2
A5: Event Place | B5: 2 | D5: Prize Money | G5: 3750
A6: Game Stats | B6: DB+ | C6: DB | D6: Bi | E6: P | F6: B | G6: E | H6: A | I6: H1
B7: 1 | C7: 4 | D7: 9 | E7: 4 | F7: 0 | G7: 0 | H7: 0 | I7: 0
A8: Hole No | B8: Par | C8: Stroke Index | D8: Gross Score | E8: Points | F8: Putts | G8: Fairways | H8: Ferrets | I8: Green Regulation
A9: 1 | B9: 4 | C9: 17 | D9: 4 | E9: 2 | F9: 1
A10: 2 | B10: 4 | C10: 11 | D10: 5 | E10: 2 | F10: 2 | I10: Yes
A11: 3 | B11: 4 | C11: 1 | D11: 7 | E11: 0 | F11: 2 | G11: 1 | H11: 1
A12: 4 | B12: 3 | C12: 9 | D12: 4 | E12: 2 | F12: 2 | I12: Yes
A13: 5 | B13: 4 | C13: 3 | D13: 4 | E13: 3 | F13: 2 | G13: 1 | I13: Yes
A14: 6 | B14: 5 | C14: 7 | D14: 7 | E14: 1 | F14: 2
A15: 7 | B15: 3 | C15: 15 | D15: 4 | E15: 1 | F15: 2
A16: 8 | B16: 4 | C16: 13 | D16: 6 | E16: 1 | F16: 2 | G16: 1
A17: 9 | B17: 5 | C17: 5 | D17: 6 | E17: 2 | F17: 2 | I17: Yes
A18: 10 | B18: 4 | C18: 10 | D18: 5 | E18: 2 | F18: 2 | I18: Yes
A19: 11 | B19: 5 | C19: 12 | D19: 5 | E19: 3 | F19: 2 | G19: 1 | I19: Yes
A20: 12 | B20: 4 | C20: 2 | D20: 5 | E20: 2 | F20: 1 | G20: 1
A21: 13 | B21: 3 | C21: 6 | D21: 5 | E21: 1 | F21: 2
A22: 14 | B22: 4 | C22: 16 | D22: 5 | E22: 1 | F22: 2
A23: 15 | B23: 4 | C23: 8 | D23: 6 | E23: 1 | F23: 2
A24: 16 | B24: 3 | C24: 18 | D24: 3 | E24: 2 | F24: 1
A25: 17 | B25: 5 | C25: 14 | D25: 6 | E25: 1 | F25: 2 | G25: 1
A26: 18 | B26: 4 | C26: 4 | D26: 5 | E26: 2 | F26: 1 | G26: 1
A27: Totals | B27: =IF(B2="","",SUM(B9:B26)) -> 72 | D27: =IF(B2="","",SUM(D9:D26)) -> 92 | E27: =IF(B2="","",SUM(E9:E26)) -> 29 | F27: =IF(B2="","",SUM(F9:F26)) -> 32 | G27: =IF(B2="","",SUM(G9:G26)) -> 7 | H27: =IF(B2="","",SUM(H9:H26)) -> 1 | I27: =IF(COUNTIF(I9:I26,"=Yes")=0,"",COUNTIF(I9:I26,"=Yes")) -> 6