A1: Club | B1: Wycombe Heights
A2: Par/SS | B2: 69/68 | D2: Num. Of Fairways | I2: =IF(B1="","",18-(COUNTIF(B8:B25,3))) -> 13
A3: Date | B3: 41202 | D3: Playing Handicap | I3: 15.1
A4: Event Place | B4: 7 | C4: M | D4: Prize Money | G4: 25000
A5: Game Stats | B5: DB+ | C5: DB | D5: Bi | E5: P | F5: B | G5: E | H5: A | I5: H1
B6: 2 | C6: 2 | D6: 10 | E6: 4 | F6: 0 | G6: 0 | H6: 0 | I6: 0
A7: Hole No | B7: Par | C7: Stroke Index | D7: Gross Score | E7: Points | F7: Putts | G7: Fairways | H7: Ferrets | I7: Green Regulation
A8: 1 | B8: 4 | C8: 9 | D8: 7 | E8: 0 | F8: 2 | G8: 1
A9: 2 | B9: 3 | C9: 13 | D9: 4 | E9: 2 | F9: 2 | I9: Yes
A10: 3 | B10: 4 | C10: 11 | D10: 5 | E10: 2 | F10: 3 | I10: Yes
A11: 4 | B11: 4 | C11: 3 | D11: 5 | E11: 2 | F11: 2 | G11: 1 | I11: Yes
A12: 5 | B12: 5 | C12: 15 | D12: 8 | E12: 0 | F12: 3
A13: 6 | B13: 3 | C13: 7 | D13: 4 | E13: 2 | F13: 1
A14: 7 | B14: 4 | C14: 1 | D14: 6 | E14: 1 | F14: 1
A15: 8 | B15: 3 | C15: 17 | D15: 3 | E15: 2 | F15: 1
A16: 9 | B16: 4 | C16: 5 | D16: 5 | E16: 2 | F16: 2 | I16: Yes
A17: 10 | B17: 3 | C17: 16 | D17: 4 | E17: 1 | F17: 2
A18: 11 | B18: 4 | C18: 18 | D18: 4 | E18: 2 | F18: 2 | I18: Yes
A19: 12 | B19: 4 | C19: 8 | D19: 5 | E19: 2 | F19: 2 | I19: Yes
A20: 13 | B20: 4 | C20: 2 | D20: 6 | E20: 1 | F20: 3 | I20: Yes
A21: 14 | B21: 4 | C21: 14 | D21: 5 | E21: 2 | F21: 2 | I21: Yes
A22: 15 | B22: 4 | C22: 4 | D22: 5 | E22: 2 | F22: 2 | I22: Yes
A23: 16 | B23: 3 | C23: 12 | D23: 4 | E23: 2 | F23: 1
A24: 17 | B24: 5 | C24: 6 | D24: 5 | E24: 3 | F24: 2 | G24: 1 | I24: Yes
A25: 18 | B25: 4 | C25: 10 | D25: 4 | E25: 3 | F25: 2 | I25: Yes
A26: Totals | B26: =IF(B1="","",SUM(B8:B25)) -> 69 | D26: =IF(B1="","",SUM(D8:D25)) -> 89 | E26: =IF(B1="","",SUM(E8:E25)) -> 31 | F26: =IF(B1="","",SUM(F8:F25)) -> 35 | G26: =IF(B1="","",SUM(G8:G25)) -> 3 | H26: =IF(B1="","",SUM(H8:H25)) -> 0 | I26: =IF(COUNTIF(I8:I25,"=Yes")=0,"",COUNTIF(I8:I25,"=Yes")) -> 11