A1: Keith Mendelson
A2: Club | B2: Broke Hill
A3: Par/SS | B3: 72/72 | D3: Num. Of Fairways | I3: =IF(B2="","",18-(COUNTIF(B9:B26,3))) -> 14
A4: Date | B4: 38197 | D4: Playing Handicap | I4: 13.1
A5: Event Place | B5: 1 | D5: Prize Money | G5: 5000
A6: Game Stats | B6: DB+ | C6: DB | D6: BI | E6: P | F6: B | G6: E | H6: A | I6: H1
B7: 1 | C7: 4 | D7: 8 | E7: 4 | F7: 1 | G7: 0 | H7: 0 | I7: 0
A8: Hole No | B8: Par | C8: Stroke Index | D8: Gross Score | E8: Points | F8: Putts | G8: Fairways | H8: Ferrets | I8: Green Regulation
A9: 1 | B9: 4 | C9: 13 | D9: 6 | E9: 1 | F9: 2
A10: 2 | B10: 4 | C10: 9 | D10: 4 | E10: 3 | F10: 2 | G10: 1 | I10: Yes
A11: 3 | B11: 5 | C11: 3 | D11: 5 | E11: 3 | F11: 1 | G11: 1 | I11: Yes
A12: 4 | B12: 3 | C12: 15 | D12: 4 | E12: 1 | F12: 2
A13: 5 | B13: 4 | C13: 11 | D13: 8 | E13: 0 | F13: 2 | H13: 1
A14: 6 | B14: 4 | C14: 1 | D14: 5 | E14: 2 | F14: 1
A15: 7 | B15: 4 | C15: 7 | D15: 3 | E15: 4 | F15: 1 | G15: 1 | I15: Yes
A16: 8 | B16: 3 | C16: 17 | D16: 5 | E16: 0 | F16: 2
A17: 9 | B17: 5 | C17: 5 | D17: 7 | E17: 1 | F17: 2
A18: 10 | B18: 4 | C18: 12 | D18: 5 | E18: 2 | F18: 1 | G18: 1
A19: 11 | B19: 3 | C19: 18 | D19: 4 | E19: 1 | F19: 1
A20: 12 | B20: 5 | C20: 4 | D20: 5 | E20: 3 | F20: 1 | G20: 1 | I20: Yes
A21: 13 | B21: 4 | C21: 8 | D21: 5 | E21: 2 | F21: 2 | I21: Yes
A22: 14 | B22: 4 | C22: 14 | D22: 6 | E22: 0 | F22: 2
A23: 15 | B23: 5 | C23: 2 | D23: 6 | E23: 2 | F23: 2 | I23: Yes
A24: 16 | B24: 4 | C24: 16 | D24: 4 | E24: 2 | F24: 1 | G24: 1
A25: 17 | B25: 3 | C25: 6 | D25: 4 | E25: 2 | F25: 2 | I25: Yes
A26: 18 | B26: 4 | C26: 10 | D26: 5 | E26: 2 | F26: 2 | G26: 1 | I26: Yes
A27: Totals | B27: =IF(B2="","",SUM(B9:B26)) -> 72 | D27: =IF(B2="","",SUM(D9:D26)) -> 91 | E27: =IF(B2="","",SUM(E9:E26)) -> 31 | F27: =IF(B2="","",SUM(F9:F26)) -> 29 | G27: =IF(B2="","",SUM(G9:G26)) -> 7 | H27: =IF(B2="","",SUM(H9:H26)) -> 1 | I27: =IF(COUNTIF(I9:I26,"=Yes")=0,"",COUNTIF(I9:I26,"=Yes")) -> 8