A1: Roy Dickens
A2: Club | B2: Broke Hill
A3: Par/SS | B3: 72/72 | D3: Num. Of Fairways | I3: =IF(B2="","",18-(COUNTIF(B9:B26,3))) -> 14
A4: Date | B4: 38179 | D4: Playing Handicap | I4: 27.800000000000999
A5: Event Place | B5: 3 | D5: Prize Money | G5: 2500
A6: Game Stats | B6: DB+ | C6: DB | D6: Bi | E6: P | F6: B | G6: E | H6: A | I6: H1
B7: 10 | C7: 5 | D7: 3 | E7: 0 | F7: 0 | G7: 0 | H7: 0 | I7: 0
A8: Hole No | B8: Par | C8: Stroke Index | D8: Gross Score | E8: Points | F8: Putts | G8: Fairways | H8: Ferrets | I8: Green Regulation
A9: 1 | B9: 4 | C9: 13 | D9: 7 | E9: 0 | F9: 4 | G9: 1 | I9: Yes
A10: 2 | B10: 4 | C10: 9 | D10: 6 | E10: 2 | F10: 1
A11: 3 | B11: 5 | C11: 3 | D11: 10 | E11: 0 | F11: 3 | H11: 1
A12: 4 | B12: 3 | C12: 15 | D12: 7 | E12: 0 | F12: 3
A13: 5 | B13: 4 | C13: 11 | D13: 7 | E13: 0 | F13: 2
A14: 6 | B14: 4 | C14: 1 | D14: 5 | E14: 3 | F14: 1 | I14: Yes
A15: 7 | B15: 4 | C15: 7 | D15: 6 | E15: 2 | F15: 2 | I15: Yes
A16: 8 | B16: 3 | C16: 17 | D16: 5 | E16: 1 | F16: 3 | I16: Yes
A17: 9 | B17: 5 | C17: 5 | D17: 8 | E17: 1 | F17: 2
A18: 10 | B18: 4 | C18: 12 | D18: 7 | E18: 0 | F18: 2
A19: 11 | B19: 3 | C19: 18 | D19: 5 | E19: 1 | F19: 2
A20: 12 | B20: 5 | C20: 4 | D20: 6 | E20: 3 | F20: 2 | I20: Yes
A21: 13 | B21: 4 | C21: 8 | D21: 5 | E21: 3 | F21: 2 | I21: Yes
A22: 14 | B22: 4 | C22: 14 | D22: 7 | E22: 0 | F22: 2 | H22: 1
A23: 15 | B23: 5 | C23: 2 | D23: 10 | E23: 0 | F23: 3 | H23: 1
A24: 16 | B24: 4 | C24: 16 | D24: 6 | E24: 1 | F24: 1
A25: 17 | B25: 3 | C25: 6 | D25: 7 | E25: 0 | F25: 2
A26: 18 | B26: 4 | C26: 10 | D26: 10 | E26: 0 | F26: 3 | H26: 1
A27: Totals | B27: =IF(B2="","",SUM(B9:B26)) -> 72 | D27: =IF(B2="","",SUM(D9:D26)) -> 124 | E27: =IF(B2="","",SUM(E9:E26)) -> 17 | F27: =IF(B2="","",SUM(F9:F26)) -> 40 | G27: =IF(B2="","",SUM(G9:G26)) -> 1 | H27: =IF(B2="","",SUM(H9:H26)) -> 4 | I27: =IF(COUNTIF(I9:I26,"=Yes")=0,"",COUNTIF(I9:I26,"=Yes")) -> 6