A1: Danny Marsh
A2: Club | B2: Harpenden
A3: Par/SS | B3: 70/70 | D3: Num. Of Fairways | I3: =IF(B2="","",18-(COUNTIF(B9:B26,3))) -> 14
A4: Date | B4: 37834 | D4: Playing Handicap | I4: 10.5
A5: Event Place | B5: 2 | D5: Prize Money | G5: 2500
A6: Game Stats | B6: DB+ | C6: DB | D6: BI | E6: P | F6: B | G6: E | H6: A | I6: H1
B7: 1 | C7: 5 | D7: 10 | E7: 2 | F7: 0 | G7: 0 | H7: 0 | I7: 0
A8: Hole No | B8: Par | C8: Stroke Index | D8: Gross Score | E8: Points | F8: Putts | G8: Fairways | H8: Ferrets | I8: Green Regulation
A9: 1 | B9: 4 | C9: 7 | D9: 5 | E9: 2 | F9: 1
A10: 2 | B10: 4 | C10: 9 | D10: 5 | E10: 2 | F10: 2 | I10: Yes
A11: 3 | B11: 4 | C11: 1 | D11: 4 | E11: 3 | F11: 1 | I11: Yes
A12: 4 | B12: 4 | C12: 13 | D12: 10 | E12: 0 | F12: 2 | H12: 2
A13: 5 | B13: 3 | C13: 17 | D13: 4 | E13: 1 | F13: 2
A14: 6 | B14: 5 | C14: 11 | D14: 5 | E14: 3 | F14: 1 | I14: Yes
A15: 7 | B15: 4 | C15: 5 | D15: 5 | E15: 2 | F15: 2 | H15: 1 | I15: Yes
A16: 8 | B16: 3 | C16: 15 | D16: 5 | E16: 0 | F16: 2
A17: 9 | B17: 4 | C17: 3 | D17: 6 | E17: 1 | F17: 1
A18: 10 | B18: 4 | C18: 8 | D18: 5 | E18: 2 | F18: 2 | I18: Yes
A19: 11 | B19: 3 | C19: 18 | D19: 4 | E19: 1 | F19: 2
A20: 12 | B20: 4 | C20: 6 | D20: 6 | E20: 1 | F20: 1
A21: 13 | B21: 4 | C21: 14 | D21: 5 | E21: 1 | F21: 2
A22: 14 | B22: 4 | C22: 2 | D22: 5 | E22: 2 | F22: 2 | I22: Yes
A23: 15 | B23: 4 | C23: 12 | D23: 5 | E23: 1 | F23: 1
A24: 16 | B24: 3 | C24: 16 | D24: 4 | E24: 1 | F24: 3 | I24: Yes
A25: 17 | B25: 5 | C25: 4 | D25: 7 | E25: 1 | F25: 2 | H25: 1
A26: 18 | B26: 4 | C26: 10 | D26: 6 | E26: 1 | F26: 2
A27: Totals | B27: =IF(B2="","",SUM(B9:B26)) -> 70 | D27: =IF(B2="","",SUM(D9:D26)) -> 96 | E27: =IF(B2="","",SUM(E9:E26)) -> 25 | F27: =IF(B2="","",SUM(F9:F26)) -> 31 | G27: =IF(B2="","",SUM(G9:G26)) -> 0 | H27: =IF(B2="","",SUM(H9:H26)) -> 4 | I27: =IF(COUNTIF(I9:I26,"=Yes")=0,"",COUNTIF(I9:I26,"=Yes")) -> 7