A1: Ian Edwards
A2: Club | B2: Harpenden
A3: Par/SS | B3: 70/70 | D3: Num. Of Fairways | I3: =IF(B2="","",18-(COUNTIF(B9:B26,3))) -> 14
A4: Date | B4: 37834 | D4: Playing Handicap | I4: 13.7
A5: Event Place | B5: 1 | D5: Prize Money | G5: 5000
A6: Game Stats | B6: DB+ | C6: DB | D6: Bi | E6: P | F6: B | G6: E | H6: A | I6: H1
B7: 1 | C7: 2 | D7: 6 | E7: 8 | F7: 1 | G7: 0 | H7: 0 | I7: 0
A8: Hole No | B8: Par | C8: Stroke Index | D8: Gross Score | E8: Points | F8: Putts | G8: Fairways | H8: Ferrets | I8: Green Regulation
A9: 1 | B9: 4 | C9: 7 | D9: 5 | E9: 2 | F9: 1
A10: 2 | B10: 4 | C10: 9 | D10: 5 | E10: 2 | F10: 2 | G10: 1 | I10: Yes
A11: 3 | B11: 4 | C11: 1 | D11: 5 | E11: 2 | F11: 1
A12: 4 | B12: 4 | C12: 13 | D12: 5 | E12: 2 | F12: 2 | I12: Yes
A13: 5 | B13: 3 | C13: 17 | D13: 3 | E13: 2 | F13: 2 | I13: Yes
A14: 6 | B14: 5 | C14: 11 | D14: 9 | E14: 0 | F14: 2 | H14: 2
A15: 7 | B15: 4 | C15: 5 | D15: 4 | E15: 3 | F15: 2 | I15: Yes
A16: 8 | B16: 3 | C16: 15 | D16: 3 | E16: 2 | F16: 1
A17: 9 | B17: 4 | C17: 3 | D17: 4 | E17: 3 | F17: 2 | I17: Yes
A18: 10 | B18: 4 | C18: 8 | D18: 4 | E18: 3 | F18: 1 | I18: Yes
A19: 11 | B19: 3 | C19: 18 | D19: 3 | E19: 2 | F19: 2 | I19: Yes
A20: 12 | B20: 4 | C20: 6 | D20: 6 | E20: 1 | F20: 2 | G20: 1
A21: 13 | B21: 4 | C21: 14 | D21: 4 | E21: 3 | F21: 2 | I21: Yes
A22: 14 | B22: 4 | C22: 2 | D22: 5 | E22: 2 | F22: 2 | H22: 1 | I22: Yes
A23: 15 | B23: 4 | C23: 12 | D23: 6 | E23: 1 | F23: 2 | G23: 1 | H23: 1
A24: 16 | B24: 3 | C24: 16 | D24: 2 | E24: 3 | F24: 1 | I24: Yes
A25: 17 | B25: 5 | C25: 4 | D25: 6 | E25: 2 | F25: 1
A26: 18 | B26: 4 | C26: 10 | D26: 4 | E26: 3 | F26: 2 | I26: Yes
A27: Totals | B27: =IF(B2="","",SUM(B9:B26)) -> 70 | D27: =IF(B2="","",SUM(D9:D26)) -> 83 | E27: =IF(B2="","",SUM(E9:E26)) -> 38 | F27: =IF(B2="","",SUM(F9:F26)) -> 30 | G27: =IF(B2="","",SUM(G9:G26)) -> 3 | H27: =IF(B2="","",SUM(H9:H26)) -> 4 | I27: =IF(COUNTIF(I9:I26,"=Yes")=0,"",COUNTIF(I9:I26,"=Yes")) -> 11