A1: Martin Cox
A2: Club | B2: Addington Court Championship
A3: Par/SS | B3: 0 | D3: Num. Of Fairways | I3: =IF(B2="","",18-(COUNTIF(B9:B26,3))) -> 13
A4: Date | B4: 5/8/03pm | D4: Playing Handicap | I4: 10.1
A5: Event Place | B5: 1 | D5: Prize Money | G5: 5000
A6: Game Stats | B6: DB+ | C6: DB | D6: Bi | E6: P | F6: B | G6: E | H6: A | I6: H1
B7: 1 | C7: 4 | D7: 6 | E7: 7 | F7: 0 | G7: 0 | H7: 0 | I7: 0
A8: Hole No | B8: Par | C8: Stroke Index | D8: Gross Score | E8: Points | F8: Putts | G8: Fairways | H8: Ferrets | I8: Green Regulation
A9: 1 | B9: 5 | C9: 9 | D9: 7 | E9: 1 | F9: 3 | I9: Yes
A10: 2 | B10: 4 | C10: 2 | D10: 6 | E10: 1 | F10: 2
A11: 3 | B11: 3 | C11: 16 | D11: 3 | E11: 2 | F11: 2 | I11: Yes
A12: 4 | B12: 4 | C12: 12 | D12: 4 | E12: 2 | F12: 2 | G12: 1 | I12: Yes
A13: 5 | B13: 4 | C13: 11 | D13: 5 | E13: 1 | F13: 2
A14: 6 | B14: 4 | C14: 13 | D14: 4 | E14: 2 | F14: 2 | I14: Yes
A15: 7 | B15: 4 | C15: 3 | D15: 5 | E15: 2 | F15: 2 | G15: 1 | I15: Yes
A16: 8 | B16: 3 | C16: 14 | D16: 5 | E16: 0 | F16: 2
A17: 9 | B17: 4 | C17: 7 | D17: 4 | E17: 3 | F17: 1 | I17: Yes
A18: 10 | B18: 3 | C18: 17 | D18: 4 | E18: 1 | F18: 3 | I18: Yes
A19: 11 | B19: 4 | C19: 1 | D19: 5 | E19: 2 | F19: 2 | G19: 1 | I19: Yes
A20: 12 | B20: 3 | C20: 15 | D20: 5 | E20: 0 | F20: 1
A21: 13 | B21: 4 | C21: 5 | D21: 4 | E21: 3 | F21: 1 | I21: Yes
A22: 14 | B22: 3 | C22: 18 | D22: 3 | E22: 2 | F22: 2 | I22: Yes
A23: 15 | B23: 4 | C23: 4 | D23: 4 | E23: 3 | F23: 2 | I23: Yes
A24: 16 | B24: 4 | C24: 8 | D24: 5 | E24: 2 | F24: 1
A25: 17 | B25: 4 | C25: 6 | D25: 7 | E25: 0 | F25: 2
A26: 18 | B26: 4 | C26: 10 | D26: 5 | E26: 2 | F26: 1
A27: Totals | B27: =IF(B2="","",SUM(B9:B26)) -> 68 | D27: =IF(B2="","",SUM(D9:D26)) -> 85 | E27: =IF(B2="","",SUM(E9:E26)) -> 29 | F27: =IF(B2="","",SUM(F9:F26)) -> 33 | G27: =IF(B2="","",SUM(G9:G26)) -> 3 | H27: =IF(B2="","",SUM(H9:H26)) -> 0 | I27: =IF(COUNTIF(I9:I26,"=Yes")=0,"",COUNTIF(I9:I26,"=Yes")) -> 11