A1: Martin Cox
A2: Club | B2: Falconwood
A3: Par/SS | B3: 0 | D3: Num. Of Fairways | I3: =IF(B2="","",18-(COUNTIF(B9:B26,3))) -> 13
A4: Date | B4: 37838 | D4: Playing Handicap | I4: 10
A5: Event Place | B5: 1 | D5: Prize Money | G5: 5000
A6: Game Stats | B6: DB+ | C6: DB | D6: Bi | E6: P | F6: B | G6: E | H6: A | I6: H1
B7: 1 | C7: 2 | D7: 10 | E7: 5 | F7: 0 | G7: 0 | H7: 0 | I7: 0
A8: Hole No | B8: Par | C8: Stroke Index | D8: Gross Score | E8: Points | F8: Putts | G8: Fairways | H8: Ferrets | I8: Green Regulation
A9: 1 | B9: 4 | C9: 8 | D9: 5 | E9: 2 | F9: 2 | G9: 1 | I9: Yes
A10: 2 | B10: 4 | C10: 10 | D10: 5 | E10: 2 | F10: 2 | G10: 1 | I10: Yes
A11: 3 | B11: 4 | C11: 12 | D11: 7 | E11: 0 | F11: 2
A12: 4 | B12: 3 | C12: 16 | D12: 3 | E12: 2 | F12: 1
A13: 5 | B13: 4 | C13: 18 | D13: 4 | E13: 2 | F13: 2 | G13: 1 | I13: Yes
A14: 6 | B14: 3 | C14: 15 | D14: 4 | E14: 1 | F14: 2
A15: 7 | B15: 4 | C15: 1 | D15: 5 | E15: 2 | F15: 2 | G15: 1 | I15: Yes
A16: 8 | B16: 4 | C16: 4 | D16: 6 | E16: 1 | F16: 1
A17: 9 | B17: 3 | C17: 6 | D17: 3 | E17: 3 | F17: 1 | I17: Yes
A18: 10 | B18: 5 | C18: 9 | D18: 5 | E18: 3 | F18: 1 | G18: 1 | I18: Yes
A19: 11 | B19: 3 | C19: 11 | D19: 4 | E19: 1 | F19: 2
A20: 12 | B20: 4 | C20: 3 | D20: 5 | E20: 2 | F20: 2 | G20: 1 | I20: Yes
A21: 13 | B21: 4 | C21: 13 | D21: 5 | E21: 1 | F21: 2
A22: 14 | B22: 4 | C22: 14 | D22: 4 | E22: 2 | F22: 2 | G22: 1 | I22: Yes
A23: 15 | B23: 4 | C23: 2 | D23: 5 | E23: 2 | F23: 2 | G23: 1 | I23: Yes
A24: 16 | B24: 3 | C24: 17 | D24: 4 | E24: 1 | F24: 2
A25: 17 | B25: 4 | C25: 7 | D25: 5 | E25: 2 | F25: 2 | I25: Yes
A26: 18 | B26: 4 | C26: 5 | D26: 6 | E26: 1 | F26: 2
A27: Totals | B27: =IF(B2="","",SUM(B9:B26)) -> 68 | D27: =IF(B2="","",SUM(D9:D26)) -> 85 | E27: =IF(B2="","",SUM(E9:E26)) -> 30 | F27: =IF(B2="","",SUM(F9:F26)) -> 32 | G27: =IF(B2="","",SUM(G9:G26)) -> 8 | H27: =IF(B2="","",SUM(H9:H26)) -> 0 | I27: =IF(COUNTIF(I9:I26,"=Yes")=0,"",COUNTIF(I9:I26,"=Yes")) -> 10