A1: Dave Kewley (Wolfie)
A2: Club | B2: Long Ashton
A3: Par/SS | B3: 71/69 | D3: Num. Of Fairways | I3: =IF(B2="","",18-(COUNTIF(B9:B26,3))) -> 14
A4: Date | B4: 41439 | D4: Playing Handicap | I4: 22
A5: Event Place | B5: 1 | D5: Prize Money | G5: 7500
A6: Game Stats | B6: DB+ | C6: DB | D6: Bi | E6: P | F6: B | G6: E | H6: A | I6: H1
B7: 3 | C7: 7 | D7: 5 | E7: 3 | F7: 0 | G7: 0 | H7: 0 | I7: 0
A8: Hole No | B8: Par | C8: Stroke Index | D8: Gross Score | E8: Points | F8: Putts | G8: Fairways | H8: Ferrets | I8: Green Regulation
A9: 1 | B9: 4 | C9: 10 | D9: 8 | E9: 0 | F9: 2
A10: 2 | B10: 3 | C10: 18 | D10: 3 | E10: 3 | F10: 1 | I10: Yes
A11: 3 | B11: 4 | C11: 6 | D11: 5 | E11: 2 | F11: 2 | I11: Yes
A12: 4 | B12: 5 | C12: 12 | D12: 7 | E12: 1 | F12: 2 | G12: 1
A13: 5 | B13: 5 | C13: 4 | D13: 7 | E13: 2 | F13: 3 | G13: 1 | I13: Yes
A14: 6 | B14: 4 | C14: 14 | D14: 6 | E14: 1 | F14: 3 | I14: Yes
A15: 7 | B15: 4 | C15: 2 | D15: 8 | E15: 0 | F15: 3 | H15: 1
A16: 8 | B16: 4 | C16: 8 | D16: 6 | E16: 1 | F16: 2
A17: 9 | B17: 3 | C17: 16 | D17: 3 | E17: 3 | F17: 2 | I17: Yes
A18: 10 | B18: 4 | C18: 5 | D18: 6 | E18: 1 | F18: 2
A19: 11 | B19: 4 | C19: 15 | D19: 5 | E19: 2 | F19: 2 | I19: Yes
A20: 12 | B20: 4 | C20: 3 | D20: 5 | E20: 3 | F20: 2 | I20: Yes
A21: 13 | B21: 3 | C21: 11 | D21: 4 | E21: 2 | F21: 2 | I21: Yes
A22: 14 | B22: 4 | C22: 7 | D22: 6 | E22: 1 | F22: 2 | G22: 1
A23: 15 | B23: 4 | C23: 1 | D23: 4 | E23: 4 | F23: 1 | I23: Yes
A24: 16 | B24: 4 | C24: 13 | D24: 8 | E24: 0 | F24: 3
A25: 17 | B25: 3 | C25: 17 | D25: 5 | E25: 1 | F25: 3 | I25: Yes
A26: 18 | B26: 5 | C26: 9 | D26: 6 | E26: 2 | F26: 2 | I26: Yes
A27: Totals | B27: =IF(B2="","",SUM(B9:B26)) -> 71 | D27: =IF(B2="","",SUM(D9:D26)) -> 102 | E27: =IF(B2="","",SUM(E9:E26)) -> 29 | F27: =IF(B2="","",SUM(F9:F26)) -> 39 | G27: =IF(B2="","",SUM(G9:G26)) -> 3 | H27: =IF(B2="","",SUM(H9:H26)) -> 1 | I27: =IF(COUNTIF(I9:I26,"=Yes")=0,"",COUNTIF(I9:I26,"=Yes")) -> 11