A1: Kevin Gallagher
A2: Club | B2: Hoebridge
A3: Par/SS | B3: 72/70 | D3: Num. Of Fairways
A4: Date | B4: 41433 | D4: Playing Handicap | I4: 16.1
A5: Event Place | B5: 8 | C5: M | D5: Prize Money | G5: 21250
A6: Game Stats | B6: DB+ | C6: DB | D6: Bi | E6: P | F6: B | G6: E | H6: A | I6: H1
B7: 4 | C7: 3 | D7: 8 | E7: 2 | F7: 1 | G7: 0 | H7: 0 | I7: 0
A8: Hole No | B8: Par | C8: Stroke Index | D8: Gross Score | E8: Points | F8: Putts | G8: Fairways | H8: Ferrets | I8: Green Regulation
A9: 1 | B9: 5 | C9: 11 | D9: 9 | E9: 0 | F9: 3
A10: 2 | B10: 3 | C10: 17 | D10: 4 | E10: 1 | F10: 2
A11: 3 | B11: 5 | C11: 7 | D11: 5 | E11: 3 | F11: 2 | I11: Yes
A12: 4 | B12: 4 | C12: 1 | D12: 6 | E12: 1 | F12: 2 | G12: 1
A13: 5 | B13: 4 | C13: 5 | D13: 6 | E13: 1 | F13: 2
A14: 6 | B14: 3 | C14: 15 | D14: 4 | E14: 2 | F14: 1
A15: 7 | B15: 4 | C15: 3 | D15: 3 | E15: 4 | F15: 1 | I15: Yes
A16: 8 | B16: 4 | C16: 9 | D16: 7 | E16: 0 | F16: 2 | G16: 1
A17: 9 | B17: 5 | C17: 13 | D17: 6 | E17: 2 | F17: 1 | G17: 1
A18: 10 | B18: 4 | C18: 12 | D18: 5 | E18: 2 | F18: 1
A19: 11 | B19: 4 | C19: 4 | D19: 5 | E19: 2 | F19: 1
A20: 12 | B20: 3 | C20: 18 | D20: 4 | E20: 1 | F20: 2
A21: 13 | B21: 5 | C21: 8 | D21: 7 | E21: 1 | F21: 2
A22: 14 | B22: 4 | C22: 14 | D22: 5 | E22: 2 | F22: 2 | I22: Yes
A23: 15 | B23: 4 | C23: 2 | D23: 7 | E23: 0 | F23: 1
A24: 16 | B24: 3 | C24: 10 | D24: 4 | E24: 2 | F24: 2 | I24: Yes
A25: 17 | B25: 5 | C25: 6 | D25: 5 | E25: 3 | F25: 2 | I25: Yes
A26: 18 | B26: 3 | C26: 16 | D26: 10 | E26: 0 | F26: 3
A27: Totals | B27: =IF(B2="","",SUM(B9:B26)) -> 72 | D27: =IF(B2="","",SUM(D9:D26)) -> 102 | E27: =IF(B2="","",SUM(E9:E26)) -> 27 | F27: =IF(B2="","",SUM(F9:F26)) -> 32 | G27: =IF(B2="","",SUM(G9:G26)) -> 3 | H27: =IF(B2="","",SUM(H9:H26)) -> 0 | I27: =IF(COUNTIF(I9:I26,"=Yes")=0,"",COUNTIF(I9:I26,"=Yes")) -> 5

A1: Robert Thompson
A2: Club | B2: Hoebridge
A3: Par/SS | B3: 72/70 | D3: Num. Of Fairways | I3: =IF(B2="","",18-(COUNTIF(B9:B26,3))) -> 13
A4: Date | B4: 41433 | D4: Playing Handicap | I4: 10.3
A5: Event Place | B5: 13 | C5: M | D5: Prize Money | G5: 10000
A6: Game Stats | B6: DB+ | C6: DB | D6: Bi | E6: P | F6: B | G6: E | H6: A | I6: H1
B7: 4 | C7: 5 | D7: 4 | E7: 5 | F7: 0 | G7: 0 | H7: 0 | I7: 0
A8: Hole No | B8: Par | C8: Stroke Index | D8: Gross Score | E8: Points | F8: Putts | G8: Fairways | H8: Ferrets | I8: Green Regulation
A9: 1 | B9: 5 | C9: 11 | D9: 10 | E9: 0 | F9: 3 | H9: 1
A10: 2 | B10: 3 | C10: 17 | D10: 3 | E10: 2 | F10: 2 | I10: Yes
A11: 3 | B11: 5 | C11: 7 | D11: 5 | E11: 3 | F11: 1 | I11: Yes
A12: 4 | B12: 4 | C12: 1 | D12: 6 | E12: 1 | F12: 2
A13: 5 | B13: 4 | C13: 5 | D13: 4 | E13: 3 | F13: 1 | G13: 1 | I13: Yes
A14: 6 | B14: 3 | C14: 15 | D14: 5 | E14: 0 | F14: 3
A15: 7 | B15: 4 | C15: 3 | D15: 5 | E15: 2 | F15: 2 | G15: 1 | I15: Yes
A16: 8 | B16: 4 | C16: 9 | D16: 6 | E16: 1 | F16: 2 | H16: 1
A17: 9 | B17: 5 | C17: 13 | D17: 6 | E17: 1 | F17: 1 | G17: 1
A18: 10 | B18: 4 | C18: 12 | D18: 6 | E18: 0 | F18: 3
A19: 11 | B19: 4 | C19: 4 | D19: 5 | E19: 2 | F19: 2 | G19: 1 | I19: Yes
A20: 12 | B20: 3 | C20: 18 | D20: 3 | E20: 2 | F20: 2 | I20: Yes
A21: 13 | B21: 5 | C21: 8 | D21: 7 | E21: 1 | F21: 2
A22: 14 | B22: 4 | C22: 14 | D22: 5 | E22: 1 | F22: 2 | G22: 1
A23: 15 | B23: 4 | C23: 2 | D23: 7 | E23: 0 | F23: 2 | H23: 1
A24: 16 | B24: 3 | C24: 10 | D24: 6 | E24: 0 | F24: 3
A25: 17 | B25: 5 | C25: 6 | D25: 5 | E25: 3 | F25: 0
A26: 18 | B26: 3 | C26: 16 | D26: 7 | E26: 0 | F26: 2
A27: Totals | B27: =IF(B2="","",SUM(B9:B26)) -> 72 | D27: =IF(B2="","",SUM(D9:D26)) -> 101 | E27: =IF(B2="","",SUM(E9:E26)) -> 22 | F27: =SUM(F9:F26) -> 35 | G27: =SUM(G9:G26) -> 5 | H27: =SUM(H9:H26) -> 3 | I27: =IF(COUNTIF(I9:I26,"=Yes")=0,"",COUNTIF(I9:I26,"=Yes")) -> 6