A1: Keith Mendelson
A2: Club | B2: Hoebridge
A3: Par/SS | B3: 72/70 | D3: Num. Of Fairways
A4: Date | B4: 41433 | D4: Playing Handicap | I4: 15.4
A5: Event Place | B5: 12 | C5: M | D5: Prize Money | G5: 12500
A6: Game Stats | B6: DB+ | C6: DB | D6: BI | E6: P | F6: B | G6: E | H6: A | I6: H1
B7: 5 | C7: 3 | D7: 8 | E7: 2 | F7: 0 | G7: 0 | H7: 0 | I7: 0
A8: Hole No | B8: Par | C8: Stroke Index | D8: Gross Score | E8: Points | F8: Putts | G8: Fairways | H8: Ferrets | I8: Green Regulation
A9: 1 | B9: 5 | C9: 11 | D9: 8 | E9: 0 | F9: 3
A10: 2 | B10: 3 | C10: 17 | D10: 4 | E10: 1 | F10: 2
A11: 3 | B11: 5 | C11: 7 | D11: 6 | E11: 2 | F11: 2 | I11: Yes
A12: 4 | B12: 4 | C12: 1 | D12: 6 | E12: 1 | F12: 2
A13: 5 | B13: 4 | C13: 5 | D13: 7 | E13: 0 | F13: 2
A14: 6 | B14: 3 | C14: 15 | D14: 4 | E14: 2 | F14: 2 | I14: Yes
A15: 7 | B15: 4 | C15: 3 | D15: 5 | E15: 2 | F15: 2 | I15: Yes
A16: 8 | B16: 4 | C16: 9 | D16: 6 | E16: 1 | F16: 1
A17: 9 | B17: 5 | C17: 13 | D17: 10 | E17: 0 | F17: 3 | H17: 1
A18: 10 | B18: 4 | C18: 12 | D18: 9 | E18: 0 | F18: 2
A19: 11 | B19: 4 | C19: 4 | D19: 5 | E19: 2 | F19: 1 | G19: 1
A20: 12 | B20: 3 | C20: 18 | D20: 3 | E20: 2 | F20: 1
A21: 13 | B21: 5 | C21: 8 | D21: 5 | E21: 3 | F21: 2 | I21: Yes
A22: 14 | B22: 4 | C22: 14 | D22: 5 | E22: 2 | F22: 1 | G22: 1
A23: 15 | B23: 4 | C23: 2 | D23: 6 | E23: 1 | F23: 2
A24: 16 | B24: 3 | C24: 10 | D24: 4 | E24: 2 | F24: 2 | I24: Yes
A25: 17 | B25: 5 | C25: 6 | D25: 6 | E25: 2 | F25: 2 | I25: Yes
A26: 18 | B26: 3 | C26: 16 | D26: 6 | E26: 0 | F26: 3
A27: Totals | B27: =IF(B2="","",SUM(B9:B26)) -> 72 | D27: =IF(B2="","",SUM(D9:D26)) -> 105 | E27: =IF(B2="","",SUM(E9:E26)) -> 23 | F27: =IF(B2="","",SUM(F9:F26)) -> 35 | G27: =IF(B2="","",SUM(G9:G26)) -> 2 | H27: =IF(B2="","",SUM(H9:H26)) -> 1 | I27: =IF(COUNTIF(I9:I26,"=Yes")=0,"",COUNTIF(I9:I26,"=Yes")) -> 6