A1: Jeff Colbrook
A2: Club | B2: Badgmore Park
A3: Par/SS | B3: 69/69 | D3: Num. Of Fairways | I3: =IF(B2="","",18-(COUNTIF(B9:B26,3))) -> 14
A4: Date | B4: 39254 | D4: Playing Handicap | I4: 14.4
A5: Event Place | B5: 1 | D5: Prize Money | G5: 3750
A6: Game Stats | B6: DB+ | C6: DB | D6: BI | E6: P | F6: B | G6: E | H6: A | I6: H1
B7: 1 | C7: 5 | D7: 8 | E7: 3 | F7: 1 | G7: 0 | H7: 0 | I7: 0
A8: Hole No | B8: Par | C8: Stroke Index | D8: Gross Score | E8: Points | F8: Putts | G8: Fairways | H8: Ferrets | I8: Green Regulation
A9: 1 | B9: 4 | C9: 11 | D9: 5 | E9: 2 | F9: 2 | I9: Yes
A10: 2 | B10: 5 | C10: 7 | D10: 6 | E10: 2 | F10: 2 | G10: 1 | I10: Yes
A11: 3 | B11: 4 | C11: 1 | D11: 5 | E11: 2 | F11: 2 | I11: Yes
A12: 4 | B12: 3 | C12: 13 | D12: 4 | E12: 2 | F12: 2 | I12: Yes
A13: 5 | B13: 4 | C13: 5 | D13: 5 | E13: 2 | F13: 2 | I13: Yes
A14: 6 | B14: 3 | C14: 15 | D14: 6 | E14: 0 | F14: 3
A15: 7 | B15: 4 | C15: 17 | D15: 4 | E15: 2 | F15: 2 | G15: 1 | I15: Yes
A16: 8 | B16: 4 | C16: 3 | D16: 6 | E16: 1 | F16: 2
A17: 9 | B17: 4 | C17: 9 | D17: 6 | E17: 1 | F17: 2 | H17: 1
A18: 10 | B18: 4 | C18: 12 | D18: 6 | E18: 1 | F18: 2
A19: 11 | B19: 4 | C19: 2 | D19: 6 | E19: 1 | F19: 2
A20: 12 | B20: 4 | C20: 18 | D20: 4 | E20: 2 | F20: 2 | I20: Yes
A21: 13 | B21: 3 | C21: 8 | D21: 4 | E21: 2 | F21: 2 | I21: Yes
A22: 14 | B22: 4 | C22: 6 | D22: 4 | E22: 3 | F22: 1 | I22: Yes
A23: 15 | B23: 4 | C23: 14 | D23: 6 | E23: 1 | F23: 2
A24: 16 | B24: 4 | C24: 4 | D24: 5 | E24: 2 | F24: 1 | G24: 1
A25: 17 | B25: 3 | C25: 16 | D25: 2 | E25: 3 | F25: 0
A26: 18 | B26: 4 | C26: 10 | D26: 5 | E26: 2 | F26: 2 | I26: Yes
A27: Totals | B27: =IF(B2="","",SUM(B9:B26)) -> 69 | D27: =IF(B2="","",SUM(D9:D26)) -> 89 | E27: =IF(B2="","",SUM(E9:E26)) -> 31 | F27: =IF(B2="","",SUM(F9:F26)) -> 33 | G27: =IF(B2="","",SUM(G9:G26)) -> 3 | H27: =IF(B2="","",SUM(H9:H26)) -> 1 | I27: =IF(COUNTIF(I9:I26,"=Yes")=0,"",COUNTIF(I9:I26,"=Yes")) -> 10