A1: Matthew Carter
A2: Club | B2: Hoebridge
A3: Par/SS | B3: 71/70 | D3: Num. Of Fairways | I3: =IF(B2="","",18-(COUNTIF(B9:B26,3))) -> 13
A4: Date | B4: 39252 | D4: Playing Handicap | I4: 20.7
A5: Event Place | B5: 2 | D5: Prize Money | G5: 2500
A6: Game Stats | B6: DB+ | C6: DB | D6: BI | E6: P | F6: B | G6: E | H6: A | I6: H1
B7: 4 | C7: 6 | D7: 4 | E7: 4 | F7: 0 | G7: 0 | H7: 0 | I7: 0
A8: Hole No | B8: Par | C8: Stroke Index | D8: Gross Score | E8: Points | F8: Putts | G8: Fairways | H8: Ferrets | I8: Green Regulation
A9: 1 | B9: 5 | C9: 11 | D9: 6 | E9: 2 | F9: 3 | G9: 1 | I9: Yes
A10: 2 | B10: 3 | C10: 17 | D10: 4 | E10: 2 | F10: 2 | I10: Yes
A11: 3 | B11: 4 | C11: 7 | D11: 6 | E11: 1 | F11: 2
A12: 4 | B12: 4 | C12: 1 | D12: 5 | E12: 3 | F12: 1 | I12: Yes
A13: 5 | B13: 4 | C13: 5 | D13: 7 | E13: 0 | F13: 4 | I13: Yes
A14: 6 | B14: 3 | C14: 15 | D14: 6 | E14: 0 | F14: 4 | I14: Yes
A15: 7 | B15: 4 | C15: 3 | D15: 6 | E15: 2 | F15: 2 | I15: Yes
A16: 8 | B16: 4 | C16: 9 | D16: 4 | E16: 3 | F16: 2 | G16: 1 | I16: Yes
A17: 9 | B17: 5 | C17: 13 | D17: 7 | E17: 1 | F17: 2
A18: 10 | B18: 4 | C18: 12 | D18: 4 | E18: 3 | F18: 2 | G18: 1 | I18: Yes
A19: 11 | B19: 4 | C19: 4 | D19: 7 | E19: 0 | F19: 2 | G19: 1
A20: 12 | B20: 3 | C20: 18 | D20: 3 | E20: 3 | F20: 1 | I20: Yes
A21: 13 | B21: 5 | C21: 8 | D21: 7 | E21: 1 | F21: 1
A22: 14 | B22: 4 | C22: 14 | D22: 6 | E22: 1 | F22: 4 | I22: Yes
A23: 15 | B23: 4 | C23: 2 | D23: 7 | E23: 1 | F23: 2
A24: 16 | B24: 3 | C24: 10 | D24: 4 | E24: 2 | F24: 2 | I24: Yes
A25: 17 | B25: 5 | C25: 6 | D25: 7 | E25: 1 | F25: 2 | G25: 1
A26: 18 | B26: 3 | C26: 16 | D26: 3 | E26: 3 | F26: 2 | I26: Yes
A27: Totals | B27: =IF(B2="","",SUM(B9:B26)) -> 71 | D27: =IF(B2="","",SUM(D9:D26)) -> 99 | E27: =IF(B2="","",SUM(E9:E26)) -> 29 | F27: =IF(B2="","",SUM(F9:F26)) -> 40 | G27: =IF(B2="","",SUM(G9:G26)) -> 5 | H27: =IF(B2="","",SUM(H9:H26)) -> 0 | I27: =IF(COUNTIF(I9:I26,"=Yes")=0,"",COUNTIF(I9:I26,"=Yes")) -> 12