A1: David Archer
A2: Club | B2: Dona Julia
A3: Par/SS | D3: Num. Of Fairways | I3: =IF(B2="","",18-(COUNTIF(B9:B26,3))) -> 13
A4: Date | B4: 42500 | D4: Playing Handicap | I4: 22.5
A5: Event Place | B5: 19 | C5: M | D5: Prize Money | G5: 12500
A6: Game Stats | B6: DB+ | C6: DB | D6: Bi | E6: P | F6: B | G6: E | H6: A | I6: H1
B7: 10 | C7: 3 | D7: 4 | E7: 1 | F7: 0 | G7: 0 | H7: 0 | I7: 0
A8: Hole No | B8: Par | C8: Stroke Index | D8: Gross Score | E8: Points | F8: Putts | G8: Fairways | H8: Ferrets | I8: Green Regulation
A9: 1 | B9: 4 | C9: 8 | D9: 5 | E9: 2 | F9: 2 | G9: 1 | I9: Yes
A10: 2 | B10: 4 | C10: 10 | D10: 5 | E10: 2 | F10: 2 | G10: 1 | I10: Yes
A11: 3 | B11: 3 | C11: 18 | D11: 6 | E11: 0 | F11: 2 | H11: 1
A12: 4 | B12: 4 | C12: 14 | D12: 7 | E12: 0 | F12: 2
A13: 5 | B13: 5 | C13: 6 | D13: 10 | E13: 0 | F13: 3
A14: 6 | B14: 4 | C14: 12 | D14: 6 | E14: 1 | F14: 2 | G14: 1
A15: 7 | B15: 4 | C15: 16 | D15: 5 | E15: 2 | F15: 2 | G15: 1 | I15: Yes
A16: 8 | B16: 5 | C16: 2 | D16: 8 | E16: 1 | F16: 2
A17: 9 | B17: 4 | C17: 4 | D17: 7 | E17: 1 | F17: 2 | G17: 1
A18: 10 | B18: 4 | C18: 1 | D18: 7 | E18: 1 | F18: 2 | G18: 1
A19: 11 | B19: 3 | C19: 17 | D19: 3 | E19: 3 | F19: 2 | I19: Yes
A20: 12 | B20: 3 | C20: 9 | D20: 4 | E20: 2 | F20: 3 | I20: Yes
A21: 13 | B21: 3 | C21: 3 | D21: 6 | E21: 1 | F21: 2
A22: 14 | B22: 5 | C22: 13 | D22: 7 | E22: 1 | F22: 1
A23: 15 | B23: 4 | C23: 15 | D23: 7 | E23: 0 | F23: 2
A24: 16 | B24: 4 | C24: 7 | D24: 7 | E24: 0 | F24: 1
A25: 17 | B25: 5 | C25: 11 | D25: 7 | E25: 1 | F25: 1 | G25: 1
A26: 18 | B26: 3 | C26: 5 | D26: 10 | E26: 0 | F26: 3 | H26: 2
A27: Totals | B27: =IF(B2="","",SUM(B9:B26)) -> 71 | D27: =IF(B2="","",SUM(D9:D26)) -> 117 | E27: =IF(B2="","",SUM(E9:E26)) -> 18 | F27: =IF(B2="","",SUM(F9:F26)) -> 36 | G27: =IF(B2="","",SUM(G9:G26)) -> 7 | H27: =IF(B2="","",SUM(H9:H26)) -> 3 | I27: =IF(COUNTIF(I9:I26,"=Yes")=0,"",COUNTIF(I9:I26,"=Yes")) -> 5