A1: Ian Edwards
A2: Club | B2: Dona Julia
A3: Par/SS | D3: Num. Of Fairways | I3: =IF(B2="","",18-(COUNTIF(B9:B26,3))) -> 13
A4: Date | B4: 42500 | D4: Playing Handicap | I4: 15.7
A5: Event Place | B5: 13 | C5: M | D5: Prize Money | G5: 27500
A6: Game Stats | B6: DB+ | C6: DB | D6: Bi | E6: P | F6: B | G6: E | H6: A | I6: H1
B7: 5 | C7: 4 | D7: 6 | E7: 3 | F7: 0 | G7: 0 | H7: 0 | I7: 0
A8: Hole No | B8: Par | C8: Stroke Index | D8: Gross Score | E8: Points | F8: Putts | G8: Fairways | H8: Ferrets | I8: Green Regulation
A9: 1 | B9: 4 | C9: 8 | D9: 5 | E9: 2 | F9: 2 | G9: 1 | I9: Yes
A10: 2 | B10: 4 | C10: 10 | D10: 7 | E10: 0 | F10: 2 | G10: 1
A11: 3 | B11: 3 | C11: 18 | D11: 5 | E11: 0 | F11: 3
A12: 4 | B12: 4 | C12: 14 | D12: 6 | E12: 1 | F12: 2 | G12: 1
A13: 5 | B13: 5 | C13: 6 | D13: 6 | E13: 2 | F13: 2 | G13: 1 | I13: Yes
A14: 6 | B14: 4 | C14: 12 | D14: 5 | E14: 2 | F14: 2 | G14: 1 | I14: Yes
A15: 7 | B15: 4 | C15: 16 | D15: 5 | E15: 2 | F15: 3 | G15: 1 | I15: Yes
A16: 8 | B16: 5 | C16: 2 | D16: 5 | E16: 3 | F16: 1 | G16: 1 | I16: Yes
A17: 9 | B17: 4 | C17: 4 | D17: 4 | E17: 3 | F17: 2 | G17: 1 | I17: Yes
A18: 10 | B18: 4 | C18: 1 | D18: 5 | E18: 2 | F18: 2 | I18: Yes
A19: 11 | B19: 3 | C19: 17 | D19: 5 | E19: 0 | F19: 4 | I19: Yes
A20: 12 | B20: 3 | C20: 9 | D20: 5 | E20: 1 | F20: 1
A21: 13 | B21: 3 | C21: 3 | D21: 6 | E21: 0 | F21: 1
A22: 14 | B22: 5 | C22: 13 | D22: 5 | E22: 3 | F22: 2 | H22: 1 | I22: Yes
A23: 15 | B23: 4 | C23: 15 | D23: 7 | E23: 0 | F23: 3
A24: 16 | B24: 4 | C24: 7 | D24: 10 | E24: 0 | F24: 3
A25: 17 | B25: 5 | C25: 11 | D25: 6 | E25: 2 | F25: 2 | G25: 1 | H25: 2 | I25: Yes
A26: 18 | B26: 3 | C26: 5 | D26: 10 | E26: 0 | F26: 3
A27: Totals | B27: =IF(B2="","",SUM(B9:B26)) -> 71 | D27: =IF(B2="","",SUM(D9:D26)) -> 107 | E27: =IF(B2="","",SUM(E9:E26)) -> 23 | F27: =IF(B2="","",SUM(F9:F26)) -> 40 | G27: =IF(B2="","",SUM(G9:G26)) -> 9 | H27: =IF(B2="","",SUM(H9:H26)) -> 3 | I27: =IF(COUNTIF(I9:I26,"=Yes")=0,"",COUNTIF(I9:I26,"=Yes")) -> 10