A1: Pos | B1: Player (Click to see statistics) | C1: Original Handicap | D1: Current Handicap | E1: Played | F1: Points | G1: Average | H1: Best Score | I1: Qualified
A2: 1 | B2: Paul Baldwin | C2: 26 | D2: 20 | E2: 8 | F2: 295 | G2: =IF(ISERROR(H2/G2),0,H2/G2) -> 36.88 | H2: 49 | I2: =IF(G2>=3,4,"") -> Yes
A3: 2 | B3: Jeff Gibbons | C3: 27 | D3: 25 | E3: 17 | F3: 587 | G3: =IF(ISERROR(H5/G5),0,H5/G5) -> 34.727272727272727 | H3: 43 | I3: =IF(G5>=3,4,"") -> Yes
A4: 3 | B4: John Press | C4: 22 | D4: 18 | E4: 6 | F4: 203 | G4: =IF(ISERROR(H4/G4),0,H4/G4) -> 33.83 | H4: 46 | I4: =IF(G4>=3,4,"") -> Yes
A5: 4 | B5: Robert Thompson | C5: 11 | D5: 11 | E5: 24 | F5: 803 | G5: =IF(ISERROR(H8/G8),0,H8/G8) -> 33.46 | H5: 42 | I5: =IF(G8>=3,4,"") -> Yes
A6: 5 | B6: Kevin Gallagher | C6: 14 | D6: 12 | E6: 13 | F6: 431 | G6: =IF(ISERROR(H3/G3),0,H3/G3) -> 33.15 | H6: 44 | I6: =IF(G3>=3,4,"") -> Yes
A7: =IF(K10="","",A9+1) -> 6 | B7: Martin Cox | C7: 14 | D7: 15 | E7: 20 | F7: 643 | G7: =IF(ISERROR(H10/G10),0,H10/G10) -> 31.888888888888889 | H7: 40 | I7: =IF(G10>=3,4,"") -> Yes
A8: =IF(K16="","",A15+1) -> 7 | B8: Steve Tilling | C8: 20 | D8: 20 | E8: 4 | F8: 127 | G8: =IF(ISERROR(H16/G16),0,H16/G16) -> 31.75 | H8: 35 | I8: =IF(G16>=3,4,"") -> Yes
A9: =IF(K11="","",A10+1) -> 8 | B9: Keith Mendelson | C9: 13 | D9: 14 | E9: 21 | F9: 647 | G9: =IF(ISERROR(H11/G11),0,H11/G11) -> 31.833333333333332 | H9: 38 | I9: =IF(G11>=3,4,"") -> Yes
A10: =IF(K13="","",A12+1) -> 9 | B10: Paul Carter | C10: 16 | D10: 17 | E10: 12 | F10: 367 | G10: =IF(ISERROR(H13/G13),0,H13/G13) -> 30.58 | H10: 40 | I10: =IF(G13>=3,4,"") -> Yes
A11: 10 | B11: Dave Rouse | C11: 23 | D11: 22 | E11: 23 | F11: 700 | G11: =IF(ISERROR(H9/G9),0,H9/G9) -> 32.555555555555557 | H11: 40 | I11: =IF(G13>=3,4,"") -> Yes
A12: =IF(K18="","",A17+1) -> 11 | B12: Dave Andrews | C12: 33 | D12: 33 | E12: 5 | F12: 152 | G12: =IF(ISERROR(H18/G18),0,H18/G18) -> 30.40 | H12: 41 | I12: =IF(G18>=3,4,"") -> Yes
A13: =IF(K12="","",A11+1) -> 12= | B13: Andrew Baldwin | C13: 17 | D13: 17 | E13: 15 | F13: 455 | G13: =IF(ISERROR(H12/G12),0,H12/G12) -> 31.714285714285715 | H13: 39 | I13: =IF(G12>=3,4,"") -> Yes
A14: =IF(K17="","",A16+1) -> 12= | B14: Alan Baldwin | C14: 25 | D14: 25 | E14: 3 | F14: 91 | G14: =IF(ISERROR(H17/G17),0,H17/G17) -> 30.33 | H14: 35 | I14: =IF(G17>=3,4,"") -> Yes
A15: 14 | B15: Chris Manning | C15: 22 | D15: 22 | E15: 8 | F15: 238 | G15: =IF(ISERROR(H6/G6),0,H6/G6) -> 29.75 | H15: 40 | I15: =IF(G6>=3,4,"") -> Yes
A16: 15 | B16: Simon Thompson | C16: 17 | D16: 17 | E16: 12 | F16: 356 | G16: =IF(ISERROR(H7/G7),0,H7/G7) -> 29.67 | H16: 40 | I16: =IF(G7>=3,4,"") -> Yes
A17: =IF(K15="","",A14+1) -> 16 | B17: Roy Dickens | C17: 30 | D17: 30 | E17: 4 | F17: 113 | G17: =IF(ISERROR(H15/G15),0,H15/G15) -> 28.25 | H17: 34 | I17: =IF(G15>=3,4,"") -> Yes
A18: =IF(K21="","",A20+1) -> 17 | B18: Alan Hopkins | C18: 4 | D18: 7 | E18: 3 | F18: 83 | G18: =IF(ISERROR(H21/G21),0,H21/G21) -> 27.67 | H18: 32 | I18: =IF(G21>=3,4,"") -> Yes
A19: =IF(K14="","",A13+1) -> NON QUALIFIERS
A20: =IF(K14="","",A13+1) ->  | B20: Andy Benson | C20: 9 | D20: 9 | E20: 1 | F20: 37 | G20: =IF(ISERROR(H14/G14),0,H14/G14) -> 37.00 | H20: 37 | I20: =IF(G14>=3,4,"") -> 
A21: =IF(K19="","",A18+1) ->  | B21: Ian Edwards | C21: 14 | D21: 15 | E21: 2 | F21: 63 | G21: =IF(ISERROR(H19/G19),0,H19/G19) -> 31.50 | H21: 35 | I21: =IF(G19>=3,4,"") -> 
A22: =IF(K20="","",A19+1) ->  | B22: Neil Leah | C22: 16 | D22: 17 | E22: 1 | F22: 25 | G22: =IF(ISERROR(H20/G20),0,H20/G20) -> 25.00 | H22: 25 | I22: =IF(G20>=3,4,"") -> 
A23: =IF(K27="","",A26+1) ->  | B23: Dave White | C23: 20 | D23: 20 | E23: 2 | F23: 49 | G23: =IF(ISERROR(H27/G27),0,H27/G27) -> 24.50 | H23: 23 | I23: =IF(G27>=3,4,"") -> 
A24: =IF(K22="","",A21+1) ->  | B24: Malcolm Rouse | C24: 36 | D24: 40 | E24: 2 | F24: 38 | G24: =IF(ISERROR(H22/G22),0,H22/G22) -> 19.00 | H24: 20 | I24: =IF(G22>=3,4,"") -> 
A25: =IF(K26="","",A25+1) ->  | B25: Jon Dey | C25: 36 | D25: 36 | E25: 1 | F25: 15 | G25: =IF(ISERROR(H26/G26),0,H26/G26) -> 15.00 | H25: 15 | I25: =IF(G26>=3,4,"") -> 
A26: =IF(K23="","",A22+1) ->  | B26: Mike Edmond | C26: 36 | D26: 36 | E26: 0 | F26: 0 | G26: =IF(ISERROR(H23/G23),0,H23/G23) -> 0.00 | H26: 0 | I26: =IF(G23>=3,4,"") -> 
A27: =IF(K24="","",A23+1) ->  | B27: Dave Archer | C27: 22 | D27: 22 | E27: 0 | F27: 0 | G27: =IF(ISERROR(H24/G24),0,H24/G24) -> 0.00 | H27: 0 | I27: =IF(G24>=3,4,"") -> 
A28: =IF(K25="","",A24+1) ->  | B28: Clive Ferris | C28: 26 | D28: 26 | E28: 0 | F28: 0 | G28: =IF(ISERROR(H25/G25),0,H25/G25) -> 0.00 | H28: 0 | I28: =IF(G25>=3,4,"") -> 