A1: Dave Andrews
A2: Club | B2: Wimbledon Common
A3: Par/SS | B3: 68/66 | D3: Num. Of Fairways | I3: =IF(B2="","",18-(COUNTIF(B9:B26,3))) -> 13
A4: Date | B4: 38591 | D4: Playing Handicap | I4: 17.2
A5: Event Place | B5: 3 | D5: Prize Money | G5: 2500
A6: Game Stats | B6: DB+ | C6: DB | D6: BI | E6: P | F6: B | G6: E | H6: A | I6: H1
B7: 4 | C7: 6 | D7: 7 | E7: 1 | F7: 0 | G7: 0 | H7: 0 | I7: 0
A8: Hole No | B8: Par | C8: Stroke Index | D8: Gross Score | E8: Points | F8: Putts | G8: Fairways | H8: Ferrets | I8: Green Regulation
A9: 1 | B9: 3 | C9: 7 | D9: 10 | E9: 0 | F9: 3 | H9: 1
A10: 2 | B10: 4 | C10: 1 | D10: 6 | E10: 1 | F10: 2 | G10: 1
A11: 3 | B11: 4 | C11: 14 | D11: 6 | E11: 1 | F11: 2
A12: 4 | B12: 3 | C12: 11 | D12: 5 | E12: 1 | F12: 3 | I12: Yes
A13: 5 | B13: 4 | C13: 18 | D13: 5 | E13: 1 | F13: 2
A14: 6 | B14: 4 | C14: 5 | D14: 6 | E14: 1 | F14: 1
A15: 7 | B15: 4 | C15: 10 | D15: 9 | E15: 0 | F15: 2 | H15: 1
A16: 8 | B16: 3 | C16: 8 | D16: 4 | E16: 2 | F16: 2 | I16: Yes
A17: 9 | B17: 4 | C17: 16 | D17: 5 | E17: 2 | F17: 3 | G17: 1 | I17: Yes
A18: 10 | B18: 4 | C18: 15 | D18: 5 | E18: 2 | F18: 2 | I18: Yes
A19: 11 | B19: 4 | C19: 4 | D19: 6 | E19: 1 | F19: 2
A20: 12 | B20: 3 | C20: 6 | D20: 5 | E20: 1 | F20: 2
A21: 13 | B21: 4 | C21: 13 | D21: 5 | E21: 2 | F21: 2 | I21: Yes
A22: 14 | B22: 4 | C22: 2 | D22: 8 | E22: 0 | F22: 1
A23: 15 | B23: 4 | C23: 12 | D23: 4 | E23: 3 | F23: 1 | I23: Yes
A24: 16 | B24: 3 | C24: 17 | D24: 4 | E24: 2 | F24: 2 | I24: Yes
A25: 17 | B25: 4 | C25: 9 | D25: 5 | E25: 2 | F25: 2 | G25: 1 | I25: Yes
A26: 18 | B26: 5 | C26: 3 | D26: 8 | E26: 0 | F26: 2
A27: Totals | B27: =IF(B2="","",SUM(B9:B26)) -> 68 | D27: =IF(B2="","",SUM(D9:D26)) -> 106 | E27: =IF(B2="","",SUM(E9:E26)) -> 22 | F27: =IF(B2="","",SUM(F9:F26)) -> 36 | G27: =IF(B2="","",SUM(G9:G26)) -> 3 | H27: =IF(B2="","",SUM(H9:H26)) -> 2 | I27: =IF(COUNTIF(I9:I26,"=Yes")=0,"",COUNTIF(I9:I26,"=Yes")) -> 8