A1: Dave Rouse
A2: Club | B2: Mauritius - Belle Mare Plage (Links)
A3: Par/SS | B3: 71/72 | D3: Num. Of Fairways | I3: =IF(B2="","",18-(COUNTIF(B9:B26,3))) -> 14
A4: Date | B4: 38569 | D4: Playing Handicap | I4: 22.6
A5: Event Place | B5: 1 | D5: Prize Money | G5: 5000
A6: Game Stats | B6: DB+ | C6: DB | D6: Bi | E6: P | F6: B | G6: E | H6: A | I6: H1
B7: 8 | C7: 4 | D7: 5 | E7: 1 | F7: 0 | G7: 0 | H7: 0 | I7: 0
A8: Hole No | B8: Par | C8: Stroke Index | D8: Gross Score | E8: Points | F8: Putts | G8: Fairways | H8: Ferrets | I8: Green Regulation
A9: 1 | B9: 4 | C9: 11 | D9: 10 | E9: 0 | F9: 3 | H9: 1
A10: 2 | B10: 5 | C10: 1 | D10: 8 | E10: 1 | F10: 3 | G10: 1 | I10: Yes
A11: 3 | B11: 4 | C11: 3 | D11: 5 | E11: 3 | F11: 1 | G11: 1 | I11: Yes
A12: 4 | B12: 4 | C12: 7 | D12: 6 | E12: 1 | F12: 2 | G12: 1
A13: 5 | B13: 4 | C13: 13 | D13: 5 | E13: 2 | F13: 2 | G13: 1 | I13: Yes
A14: 6 | B14: 5 | C14: 9 | D14: 10 | E14: 0 | F14: 3 | G14: 1 | H14: 2
A15: 7 | B15: 3 | C15: 17 | D15: 5 | E15: 1 | F15: 2
A16: 8 | B16: 4 | C16: 5 | D16: 5 | E16: 3 | F16: 1 | G16: 1 | I16: Yes
A17: 9 | B17: 3 | C17: 15 | D17: 3 | E17: 3 | F17: 2 | I17: Yes
A18: 10 | B18: 5 | C18: 10 | D18: 6 | E18: 2 | F18: 2 | I18: Yes
A19: 11 | B19: 3 | C19: 18 | D19: 5 | E19: 1 | F19: 2
A20: 12 | B20: 4 | C20: 4 | D20: 10 | E20: 0 | F20: 3 | H20: 2
A21: 13 | B21: 4 | C21: 8 | D21: 8 | E21: 0 | F21: 2 | H21: 1
A22: 14 | B22: 3 | C22: 16 | D22: 4 | E22: 2 | F22: 3 | I22: Yes
A23: 15 | B23: 4 | C23: 12 | D23: 7 | E23: 0 | F23: 2
A24: 16 | B24: 4 | C24: 2 | D24: 6 | E24: 2 | F24: 3 | I24: Yes
A25: 17 | B25: 4 | C25: 14 | D25: 10 | E25: 0 | F25: 3 | H25: 2
A26: 18 | B26: 4 | C26: 6 | D26: 9 | E26: 0 | F26: 3 | H26: 1
A27: Totals | B27: =IF(B2="","",SUM(B9:B26)) -> 71 | D27: =IF(B2="","",SUM(D9:D26)) -> 122 | E27: =IF(B2="","",SUM(E9:E26)) -> 21 | F27: =IF(B2="","",SUM(F9:F26)) -> 42 | G27: =IF(B2="","",SUM(G9:G26)) -> 6 | H27: =IF(B2="","",SUM(H9:H26)) -> 9 | I27: =IF(COUNTIF(I9:I26,"=Yes")=0,"",COUNTIF(I9:I26,"=Yes")) -> 8