A1: Kevin Gallagher
A2: Club | B2: Royal Wimbledon
A3: Par/SS | B3: 70/70 | D3: Num. Of Fairways | I3: =IF(B2="","",18-(COUNTIF(B9:B26,3))) -> 14
A4: Date | B4: 38575 | D4: Playing Handicap | I4: 10.900000000000995
A5: Event Place | B5: 2 | D5: Prize Money | G5: 2500
A6: Game Stats | B6: DB+ | C6: DB | D6: Bi | E6: P | F6: B | G6: E | H6: A | I6: H1
B7: 0 | C7: 4 | D7: 8 | E7: 6 | F7: 0 | G7: 0 | H7: 0 | I7: 0
A8: Hole No | B8: Par | C8: Stroke Index | D8: Gross Score | E8: Points | F8: Putts | G8: Fairways | H8: Ferrets | I8: Green Regulation
A9: 1 | B9: 4 | C9: 9 | D9: 6 | E9: 1 | F9: 2
A10: 2 | B10: 4 | C10: 5 | D10: 5 | E10: 2 | F10: 1
A11: 3 | B11: 4 | C11: 11 | D11: 4 | E11: 3 | F11: 1 | G11: 1 | I11: Yes
A12: 4 | B12: 4 | C12: 1 | D12: 5 | E12: 2 | F12: 2 | G12: 1 | I12: Yes
A13: 5 | B13: 3 | C13: 15 | D13: 4 | E13: 1 | F13: 3 | I13: Yes
A14: 6 | B14: 4 | C14: 17 | D14: 4 | E14: 2 | F14: 2 | G14: 1 | I14: Yes
A15: 7 | B15: 5 | C15: 3 | D15: 6 | E15: 2 | F15: 2 | I15: Yes
A16: 8 | B16: 3 | C16: 7 | D16: 4 | E16: 2 | F16: 2 | I16: Yes
A17: 9 | B17: 4 | C17: 13 | D17: 5 | E17: 1 | F17: 1 | G17: 1
A18: 10 | B18: 5 | C18: 8 | D18: 5 | E18: 3 | F18: 2 | G18: 1 | I18: Yes
A19: 11 | B19: 4 | C19: 12 | D19: 6 | E19: 0 | F19: 1
A20: 12 | B20: 4 | C20: 2 | D20: 4 | E20: 3 | F20: 1 | G20: 1 | I20: Yes
A21: 13 | B21: 3 | C21: 16 | D21: 3 | E21: 2 | F21: 2 | I21: Yes
A22: 14 | B22: 4 | C22: 6 | D22: 6 | E22: 1 | F22: 3 | G22: 1 | I22: Yes
A23: 15 | B23: 4 | C23: 10 | D23: 6 | E23: 1 | F23: 2 | G23: 1
A24: 16 | B24: 4 | C24: 4 | D24: 5 | E24: 2 | F24: 2 | G24: 1 | I24: Yes
A25: 17 | B25: 3 | C25: 18 | D25: 3 | E25: 2 | F25: 2 | I25: Yes
A26: 18 | B26: 4 | C26: 14 | D26: 5 | E26: 1 | F26: 2 | G26: 1
A27: Totals | B27: =IF(B2="","",SUM(B9:B26)) -> 70 | D27: =IF(B2="","",SUM(D9:D26)) -> 86 | E27: =IF(B2="","",SUM(E9:E26)) -> 31 | F27: =IF(B2="","",SUM(F9:F26)) -> 33 | G27: =IF(B2="","",SUM(G9:G26)) -> 10 | H27: =IF(B2="","",SUM(H9:H26)) -> 0 | I27: =IF(COUNTIF(I9:I26,"=Yes")=0,"",COUNTIF(I9:I26,"=Yes")) -> 12