A1: Martin Cox
A2: Club | B2: Westgate & Birch
A3: Par/SS | B3: 64/64 | D3: Num. Of Fairways | I3: =IF(B2="","",18-(COUNTIF(B9:B26,3))) -> 10
A4: Date | B4: 38595 | D4: Playing Handicap | I4: 12.500000000001997
A5: Event Place | B5: 2 | D5: Prize Money | G5: 2500
A6: Game Stats | B6: DB+ | C6: DB | D6: Bi | E6: P | F6: B | G6: E | H6: A | I6: H1
B7: 1 | C7: 1 | D7: 7 | E7: 9 | F7: 0 | G7: 0 | H7: 0 | I7: 0
A8: Hole No | B8: Par | C8: Stroke Index | D8: Gross Score | E8: Points | F8: Putts | G8: Fairways | H8: Ferrets | I8: Green Regulation
A9: 1 | B9: 4 | C9: 11 | D9: 7 | E9: 0 | F9: 1
A10: 2 | B10: 4 | C10: 7 | D10: 5 | E10: 2 | F10: 2 | G10: 1 | I10: Yes
A11: 3 | B11: 3 | C11: 15 | D11: 4 | E11: 1 | F11: 2
A12: 4 | B12: 4 | C12: 4 | D12: 5 | E12: 2 | F12: 1
A13: 5 | B13: 3 | C13: 17 | D13: 4 | E13: 1 | F13: 2
A14: 6 | B14: 4 | C14: 12 | D14: 4 | E14: 3 | F14: 2 | I14: Yes
A15: 7 | B15: 4 | C15: 1 | D15: 4 | E15: 3 | F15: 1 | I15: Yes
A16: 8 | B16: 3 | C16: 8 | D16: 4 | E16: 2 | F16: 2 | I16: Yes
A17: 9 | B17: 4 | C17: 5 | D17: 4 | E17: 3 | F17: 1 | I17: Yes
A18: 10 | B18: 4 | C18: 2 | D18: 4 | E18: 3 | F18: 1 | I18: Yes
A19: 11 | B19: 3 | C19: 18 | D19: 3 | E19: 2 | F19: 1
A20: 12 | B20: 4 | C20: 3 | D20: 6 | E20: 1 | F20: 1 | G20: 1
A21: 13 | B21: 3 | C21: 10 | D21: 3 | E21: 3 | F21: 1 | I21: Yes
A22: 14 | B22: 3 | C22: 16 | D22: 3 | E22: 2 | F22: 1
A23: 15 | B23: 3 | C23: 14 | D23: 3 | E23: 2 | F23: 2 | I23: Yes
A24: 16 | B24: 4 | C24: 6 | D24: 5 | E24: 2 | F24: 2 | G24: 1 | I24: Yes
A25: 17 | B25: 3 | C25: 13 | D25: 3 | E25: 3 | F25: 1 | I25: Yes
A26: 18 | B26: 4 | C26: 9 | D26: 5 | E26: 2 | F26: 1 | G26: 1
A27: Totals | B27: =IF(B2="","",SUM(B9:B26)) -> 64 | D27: =IF(B2="","",SUM(D9:D26)) -> 76 | E27: =IF(B2="","",SUM(E9:E26)) -> 37 | F27: =IF(B2="","",SUM(F9:F26)) -> 25 | G27: =IF(B2="","",SUM(G9:G26)) -> 4 | H27: =IF(B2="","",SUM(H9:H26)) -> 0 | I27: =IF(COUNTIF(I9:I26,"=Yes")=0,"",COUNTIF(I9:I26,"=Yes")) -> 10