A1: Robert Thompson
A2: Club | B2: Wimbledon Common
A3: Par/SS | B3: 68/66 | D3: Num. Of Fairways | I3: =IF(B2="","",18-(COUNTIF(B9:B26,3))) -> 13
A4: Date | B4: 38595 | D4: Playing Handicap | I4: 7.9999999999999947
A5: Event Place | B5: 4 | D5: Prize Money | G5: 2500
A6: Game Stats | B6: DB+ | C6: DB | D6: Bi | E6: P | F6: B | G6: E | H6: A | I6: H1
B7: 3 | C7: 4 | D7: 4 | E7: 6 | F7: 1 | G7: 0 | H7: 0 | I7: 0
A8: Hole No | B8: Par | C8: Stroke Index | D8: Gross Score | E8: Points | F8: Putts | G8: Fairways | H8: Ferrets | I8: Green Regulation
A9: 1 | B9: 3 | C9: 7 | D9: 4 | E9: 2 | F9: 1
A10: 2 | B10: 4 | C10: 1 | D10: 5 | E10: 2 | F10: 2 | G10: 1 | I10: Yes
A11: 3 | B11: 4 | C11: 14 | D11: 4 | E11: 2 | F11: 1 | G11: 1
A12: 4 | B12: 3 | C12: 11 | D12: 4 | E12: 1 | F12: 2
A13: 5 | B13: 4 | C13: 18 | D13: 6 | E13: 0 | F13: 2
A14: 6 | B14: 4 | C14: 5 | D14: 3 | E14: 4 | F14: 1 | G14: 1 | I14: Yes
A15: 7 | B15: 4 | C15: 10 | D15: 10 | E15: 0 | F15: 3 | H15: 1
A16: 8 | B16: 3 | C16: 8 | D16: 6 | E16: 0 | F16: 2
A17: 9 | B17: 4 | C17: 16 | D17: 6 | E17: 0 | F17: 2
A18: 19 | B18: 4 | C18: 15 | D18: 4 | E18: 2 | F18: 2 | I18: Yes
A19: 20 | B19: 4 | C19: 4 | D19: 6 | E19: 1 | F19: 2
A20: 21 | B20: 3 | C20: 6 | D20: 6 | E20: 0 | F20: 1
A21: 22 | B21: 4 | C21: 13 | D21: 4 | E21: 2 | F21: 2 | I21: Yes
A22: 23 | B22: 4 | C22: 2 | D22: 6 | E22: 1 | F22: 3 | I22: Yes
A23: 24 | B23: 4 | C23: 12 | D23: 4 | E23: 2 | F23: 2 | G23: 1 | I23: Yes
A24: 25 | B24: 3 | C24: 17 | D24: 4 | E24: 1 | F24: 3 | I24: Yes
A25: 26 | B25: 4 | C25: 9 | D25: 4 | E25: 2 | F25: 2 | I25: Yes
A26: 27 | B26: 5 | C26: 3 | D26: 5 | E26: 3 | F26: 1 | G26: 1 | I26: Yes
A27: Totals | B27: =IF(B2="","",SUM(B9:B26)) -> 68 | D27: =IF(B2="","",SUM(D9:D26)) -> 91 | E27: =IF(B2="","",SUM(E9:E26)) -> 25 | F27: =IF(B2="","",SUM(F9:F26)) -> 34 | G27: =IF(B2="","",SUM(G9:G26)) -> 5 | H27: =IF(B2="","",SUM(H9:H26)) -> 1 | I27: =IF(COUNTIF(I9:I26,"=Yes")=0,"",COUNTIF(I9:I26,"=Yes")) -> 9