A1: Season 2 - April 1st 2000 to 31st March 2001
A2: MGA World Tour Net Greens in Regulation
B3: Statistics updated | C3: =TODAY() -> 36962
A4: Pos | B4: Player | C4: Original Handicap | D4: Current Handicap | E4: Playing Handicap | F4: Played | G4: Total Greens Hit | H4: Green in Regulation | I4: Greens in Regulation Ratio
A5: 1 | B5: Steve Tilling | C5: 20.2 | D5: 20.3 | E5: =D5 -> 20.3 | F5: 10 | G5: 128 | H5: 71.11 % | I5: =IF(G5="","",IF(G5=0,"0 : "&F5*18,"1 : "&ROUND((F5*18)/G5,1))) -> 1 : 1.4
A6: =A5+1 -> 2 | B6: Alan Baldwin | C6: 25.3 | D6: 22.8 | E6: =D6 -> 22.8 | F6: 6 | G6: 74 | H6: 68.52 % | I6: =IF(G6="","",IF(G6=0,"0 : "&F6*18,"1 : "&ROUND((F6*18)/G6,1))) -> 1 : 1.5
A7: =A6+1 -> 3 | B7: John Press | C7: 18.6 | D7: 12.9 | E7: =D7 -> 12.9 | F7: 16 | G7: 190 | H7: 65.97 % | I7: =IF(G7="","",IF(G7=0,"0 : "&F7*18,"1 : "&ROUND((F7*18)/G7,1))) -> 1 : 1.5
A8: =A7+1 -> 4 | B8: Kevin Gallagher | C8: 11.6 | D8: 9.4 | E8: =D8 -> 9.4 | F8: 40 | G8: 471 | H8: 65.42 % | I8: =IF(G8="","",IF(G8=0,"0 : "&F8*18,"1 : "&ROUND((F8*18)/G8,1))) -> 1 : 1.5
A9: =A8+1 -> 5 | B9: Jeff Gibbons | C9: 25.1 | D9: 15.7 | E9: =D9 -> 15.7 | F9: 39 | G9: 459 | H9: 65.38 % | I9: =IF(G9="","",IF(G9=0,"0 : "&F9*18,"1 : "&ROUND((F9*18)/G9,1))) -> 1 : 1.5
A10: =A9+1 -> 6 | B10: Simon Thompson | C10: 16.9 | D10: 16.3 | E10: =D10 -> 16.3 | F10: 24 | G10: 269 | H10: 62.27 % | I10: =IF(G10="","",IF(G10=0,"0 : "&F10*18,"1 : "&ROUND((F10*18)/G10,1))) -> 1 : 1.6
A11: =A10+1 -> 7 | B11: Ian Edwards | C11: 15.0 | D11: 14.6 | E11: =D11 -> 14.6 | F11: 6 | G11: 67 | H11: 62.04 % | I11: =IF(G11="","",IF(G11=0,"0 : "&F11*18,"1 : "&ROUND((F11*18)/G11,1))) -> 1 : 1.6
A12: =A11+1 -> 8 | B12: Paul Baldwin | C12: 20.0 | D12: 20.0 | E12: =D12 -> 20 | F12: 9 | G12: 99 | H12: 61.11 % | I12: =IF(G12="","",IF(G12=0,"0 : "&F12*18,"1 : "&ROUND((F12*18)/G12,1))) -> 1 : 1.6
A13: =A12+1 -> 9 | B13: Paul Carter | C13: 16.9 | D13: 14.5 | E13: =D13 -> 14.5 | F13: 20 | G13: 219 | H13: 60.83 % | I13: =IF(G13="","",IF(G13=0,"0 : "&F13*18,"1 : "&ROUND((F13*18)/G13,1))) -> 1 : 1.6
A14: =A13+1 -> 10 | B14: Martin Cox | C14: 14.1 | D14: 10.2 | E14: =D14 -> 10.2 | F14: 35 | G14: 383 | H14: 60.79 % | I14: =IF(G14="","",IF(G14=0,"0 : "&F14*18,"1 : "&ROUND((F14*18)/G14,1))) -> 1 : 1.6
A15: =A14+1 -> 11 | B15: Andrew Baldwin | C15: 17.4 | D15: 16.4 | E15: =D15 -> 16.4 | F15: 42 | G15: 456 | H15: 60.32 % | I15: =IF(G15="","",IF(G15=0,"0 : "&F15*18,"1 : "&ROUND((F15*18)/G15,1))) -> 1 : 1.7
A16: =A15+1 -> 12 | B16: Roy Dickens | C16: 30.3 | D16: 29.9 | E16: =D16 -> 29.9 | F16: 14 | G16: 152 | H16: 60.32 % | I16: =IF(G16="","",IF(G16=0,"0 : "&F16*18,"1 : "&ROUND((F16*18)/G16,1))) -> 1 : 1.7
A17: =A16+1 -> 13 | B17: Jon Dey | C17: 36.0 | D17: 35.4 | E17: =D17 -> 35.4 | F17: 5 | G17: 53 | H17: 58.89 % | I17: =IF(G17="","",IF(G17=0,"0 : "&F17*18,"1 : "&ROUND((F17*18)/G17,1))) -> 1 : 1.7
A18: =A17+1 -> 14 | B18: Robert Thompson | C18: 10.6 | D18: 7.6 | E18: =D18 -> 7.6 | F18: 54 | G18: 568 | H18: 58.44 % | I18: =IF(G18="","",IF(G18=0,"0 : "&F18*18,"1 : "&ROUND((F18*18)/G18,1))) -> 1 : 1.7
A19: =A18+1 -> 15 | B19: Keith Mendelson | C19: 14.5 | D19: 11.1 | E19: =D19 -> 11.1 | F19: 43 | G19: 452 | H19: 58.4 % | I19: =IF(G19="","",IF(G19=0,"0 : "&F19*18,"1 : "&ROUND((F19*18)/G19,1))) -> 1 : 1.7
A20: =A19+1 -> 16 | B20: Dave Rouse | C20: 22.0 | D20: 23.5 | E20: =D20 -> 23.5 | F20: 39 | G20: 402 | H20: 57.26 % | I20: =IF(G20="","",IF(G20=0,"0 : "&F20*18,"1 : "&ROUND((F20*18)/G20,1))) -> 1 : 1.7
A21: =A20+1 -> 17 | B21: Alan Hopkins | C21: 7.0 | D21: 7.4 | E21: =D21 -> 7.4 | F21: 5 | G21: 51 | H21: 56.67 % | I21: =IF(G21="","",IF(G21=0,"0 : "&F21*18,"1 : "&ROUND((F21*18)/G21,1))) -> 1 : 1.8
A22: =A21+1 -> 18 | B22: Dave Andrews | C22: 32.9 | D22: 31.9 | E22: =D22 -> 31.9 | F22: 13 | G22: 127 | H22: 54.27 % | I22: =IF(G22="","",IF(G22=0,"0 : "&F22*18,"1 : "&ROUND((F22*18)/G22,1))) -> 1 : 1.8
A23: =A22+1 -> 19 | B23: Chris Manning | C23: 22.1 | D23: 22.4 | E23: =D23 -> 22.4 | F23: 11 | G23: 103 | H23: 52.02 % | I23: =IF(G23="","",IF(G23=0,"0 : "&F23*18,"1 : "&ROUND((F23*18)/G23,1))) -> 1 : 1.9
A24: =A23+1 -> 20 | B24: Malcolm Rouse | C24: 36.0 | D24: 38.1 | E24: =D24 -> 38.1 | F24: 5 | G24: 38 | H24: 42.22 % | I24: =IF(G24="","",IF(G24=0,"0 : "&F24*18,"1 : "&ROUND((F24*18)/G24,1))) -> 1 : 2.4
A25: =A24+1 -> 21 | B25: Dave White | C25: 20.1 | D25: 20.2 | E25: =D25 -> 20.2 | F25: 1 | G25: 12 | H25: 66.67 % | I25: =IF(G25="","",IF(G25=0,"0 : "&F25*18,"1 : "&ROUND((F25*18)/G25,1))) -> 1 : 1.5
A26: =A25+1 -> 22 | B26: Neil Leah | C26: 17.0 | D26: 17.3 | E26: =D26 -> 17.3 | F26: 3 | G26: 27 | H26: 50 % | I26: =IF(G26="","",IF(G26=0,"0 : "&F26*18,"1 : "&ROUND((F26*18)/G26,1))) -> 1 : 2
A27: =A26+1 -> 23 | B27: Andy Benson | C27: 8.9 | D27: 9.2 | E27: =D27 -> 9.2 | F27: 4 | G27: 34 | H27: 47.22 % | I27: =IF(G27="","",IF(G27=0,"0 : "&F27*18,"1 : "&ROUND((F27*18)/G27,1))) -> 1 : 2.1
A28: =A27+1 -> 24 | B28: Mike Edmond | C28: 36.0 | D28: 36.5 | E28: =D28 -> 36.5 | F28: 1 | G28: 7 | H28: 38.89 % | I28: =IF(G28="","",IF(G28=0,"0 : "&F28*18,"1 : "&ROUND((F28*18)/G28,1))) -> 1 : 2.6
A29: =A28+1 -> 25 | B29: Dave Archer | C29: 25.0 | E29: =D29 ->  | F29: 0 | G29: 0 | I29: =IF(G29="","",IF(G29=0,"0 : "&F29*18,"1 : "&ROUND((F29*18)/G29,1))) -> 0 : 0
A30: =A29+1 -> 26 | B30: Clive Ferris | C30: 25.0 | E30: =D30 ->  | F30: 0 | G30: 0 | I30: =IF(G30="","",IF(G30=0,"0 : "&F30*18,"1 : "&ROUND((F30*18)/G30,1))) -> 0 : 0