A1: Season 2 - April 1st 2000 to 31st March 2001
A2: MGA Tour Money List Sept 1999 - Mar 2000
B3: Statistics updated | C3: =TODAY() -> 36962
A4: Pos | B4: Name | C4: Original Handicap | D4: Current Handicap | E4: Playing Handicap | F4: Events Played | G4: Tour Victories | H4: Winnings
A5: 1 | B5: Robert Thompson | C5: 10.6 | D5: 7.6 | E5: =D5 -> 7.6 | F5: 54 | G5: 17 | H5: 370500
A6: 2 | B6: Andrew Baldwin | C6: 17.4 | D6: 16.4 | E6: =D6 -> 16.4 | F6: 42 | G6: 10 | H6: 366000
A7: 3 | B7: Martin Cox | C7: 14.1 | D7: 10.2 | E7: =D7 -> 10.2 | F7: 35 | G7: 11 | H7: 306750
A8: 4 | B8: Keith Mendelson | C8: 14.5 | D8: 11.1 | E8: =D8 -> 11.1 | F8: 43 | G8: 12 | H8: 303750
A9: 5 | B9: Kevin Gallagher | C9: 11.6 | D9: 9.4 | E9: =D9 -> 9.4 | F9: 40 | G9: 11 | H9: 293750
A10: 6 | B10: Dave Rouse | C10: 22.0 | D10: 23.5 | E10: =D10 -> 23.5 | F10: 39 | G10: 16 | H10: 248750
A11: 7 | B11: Jeff Gibbons | C11: 25.1 | D11: 15.7 | E11: =D11 -> 15.7 | F11: 39 | G11: 12 | H11: 238750
A12: 8 | B12: Paul Carter | C12: 16.9 | D12: 14.5 | E12: =D12 -> 14.5 | F12: 20 | G12: 5 | H12: 207500
A13: 9 | B13: Simon Thompson | C13: 16.9 | D13: 16.3 | E13: =D13 -> 16.3 | F13: 24 | G13: 13 | H13: 166250
A14: 10 | B14: Alan Baldwin | C14: 25.3 | D14: 22.8 | E14: =D14 -> 22.8 | F14: 6 | G14: 2 | H14: 156250
A15: 11 | B15: Roy Dickens | C15: 30.3 | D15: 29.9 | E15: =D15 -> 29.9 | F15: 14 | G15: 2 | H15: 147500
A16: 12 | B16: John Press | C16: 18.6 | D16: 12.9 | E16: =D16 -> 12.9 | F16: 16 | G16: 6 | H16: 139250
A17: 13 | B17: David Andrews | C17: 32.9 | D17: 31.9 | E17: =D17 -> 31.9 | F17: 13 | G17: 1 | H17: 128750
A18: 14 | B18: Steve Tilling | C18: 20.2 | D18: 20.3 | E18: =D18 -> 20.3 | F18: 10 | G18: 4 | H18: 107500
A19: 15 | B19: Ian Edwards | C19: 15.0 | D19: 14.6 | E19: =D19 -> 14.6 | F19: 6 | G19: 3 | H19: 105000
A20: 16 | B20: Alan Hopkins | C20: 7.0 | D20: 7.4 | E20: =D20 -> 7.4 | F20: 5 | G20: 0 | H20: 96250
A21: 17 | B21: Chris Manning | C21: 22.1 | D21: 22.4 | E21: =D21 -> 22.4 | F21: 11 | G21: 4 | H21: 95000
A22: 18 | B22: Paul Baldwin | C22: 20.0 | D22: 20.0 | E22: =D22 -> 20 | F22: 9 | G22: 2 | H22: 83750
A23: 19 | B23: Jon Dey | C23: 36.0 | D23: 35.4 | E23: =D23 -> 35.4 | F23: 5 | G23: 2 | H23: 83750
A24: 20 | B24: Neil Leah | C24: 17.0 | D24: 17.3 | E24: =D24 -> 17.3 | F24: 3 | G24: 0 | H24: 71250
A25: 21 | B25: Andy Benson | C25: 8.9 | D25: 9.2 | E25: =D25 -> 9.2 | F25: 4 | G25: 2 | H25: 65000
A26: 22 | B26: Dave White | C26: 20.1 | D26: 20.2 | E26: =D26 -> 20.2 | F26: 1 | G26: 0 | H26: 46250
A27: 23 | B27: Malcolm Rouse | C27: 36.0 | D27: 38.1 | E27: =D27 -> 38.1 | F27: 5 | G27: 0 | H27: 13750
A28: 24 | B28: Mike Edmond | C28: 36.0 | D28: 36.5 | E28: =D28 -> 36.5 | F28: 1 | G28: 0 | H28: 7500
A29: 25 | B29: Dave Archer | C29: 25.0 | E29: =D29 ->  | F29: 0 | G29: 0 | H29: 0
A30: 26 | B30: Clive Ferris | C30: 25.0 | E30: =D30 ->  | F30: 0 | G30: 0 | H30: 0