A1: Season 2 - April 1st 2000 to 31st March 2001
A2: MGA World Tour Order of Merit
B3: Statistics updated | C3: =TODAY() -> 36962
A4: Pos | B4: Player | C4: Original Handicap | D4: Current Handicap | E4: Playing Handicap | F4: Played | G4: Points | H4: Average | I4: HI / LOW Score | J4: Qualified
A5: 1 | B5: Alan Baldwin | C5: 25.3 | D5: 22.8 | E5: =D5 -> 22.8 | F5: 6 | G5: 213 | H5: =IF(ISERROR(G5/F5),0,G5/F5) -> 35.50 | I5: 45 / 30 | J5: =IF(F5>=5,"Yes","") -> Yes
A6: =IF(J6="","",A5+1) -> 2 | B6: John Press | C6: 18.6 | D6: 12.9 | E6: =D6 -> 12.9 | F6: 16 | G6: 552 | H6: =IF(ISERROR(G6/F6),0,G6/F6) -> 34.50 | I6: 44 / 22 | J6: =IF(F6>=5,"Yes","") -> Yes
A7: =IF(J7="","",A6+1) -> 3 | B7: Jeff Gibbons | C7: 25.1 | D7: 15.7 | E7: =D7 -> 15.7 | F7: 39 | G7: 1344 | H7: =IF(ISERROR(G7/F7),0,G7/F7) -> 34.46153846153846 | I7: 49 / 14 | J7: =IF(F7>=5,"Yes","") -> Yes
A8: =IF(J8="","",A7+1) -> 4 | B8: Kevin Gallagher | C8: 11.6 | D8: 9.4 | E8: =D8 -> 9.4 | F8: 40 | G8: 1332 | H8: =IF(ISERROR(G8/F8),0,G8/F8) -> 33.30 | I8: 43 / 20 | J8: =IF(F8>=5,"Yes","") -> Yes
A9: =IF(J9="","",A8+1) -> 5 | B9: Simon Thompson | C9: 16.9 | D9: 16.3 | E9: =D9 -> 16.3 | F9: 24 | G9: 794 | H9: =IF(ISERROR(G9/F9),0,G9/F9) -> 33.083333333333336 | I9: 43 / 18 | J9: =IF(F9>=5,"Yes","") -> Yes
A10: =IF(J10="","",A9+1) -> 6 | B10: Steve Tilling | C10: 20.2 | D10: 20.3 | E10: =D10 -> 20.3 | F10: 10 | G10: 330 | H10: =IF(ISERROR(G10/F10),0,G10/F10) -> 33.00 | I10: 38 / 27 | J10: =IF(F10>=5,"Yes","") -> Yes
A11: =IF(J11="","",A10+1) -> 7 | B11: Martin Cox | C11: 14.1 | D11: 10.2 | E11: =D11 -> 10.2 | F11: 35 | G11: 1145 | H11: =IF(ISERROR(G11/F11),0,G11/F11) -> 32.714285714285715 | I11: 44 / 20 | J11: =IF(F11>=5,"Yes","") -> Yes
A12: =IF(J12="","",A11+1) -> 8 | B12: Keith Mendelson | C12: 14.5 | D12: 11.1 | E12: =D12 -> 11.1 | F12: 43 | G12: 1406 | H12: =IF(ISERROR(G12/F12),0,G12/F12) -> 32.697674418604649 | I12: 44 / 11 | J12: =IF(F12>=5,"Yes","") -> Yes
A13: =IF(J13="","",A12+1) -> 9 | B13: Robert Thompson | C13: 10.6 | D13: 7.6 | E13: =D13 -> 7.6 | F13: 54 | G13: 1759 | H13: =IF(ISERROR(G13/F13),0,G13/F13) -> 32.574074074074076 | I13: 46 / 15 | J13: =IF(F13>=5,"Yes","") -> Yes
A14: =IF(J14="","",A13+1) -> 10 | B14: Andrew Baldwin | C14: 17.4 | D14: 16.4 | E14: =D14 -> 16.4 | F14: 42 | G14: 1368 | H14: =IF(ISERROR(G14/F14),0,G14/F14) -> 32.571428571428569 | I14: 43 / 21 | J14: =IF(F14>=5,"Yes","") -> Yes
A15: =IF(J15="","",A14+1) -> 11 | B15: Jon Dey | C15: 36.0 | D15: 35.4 | E15: =D15 -> 35.4 | F15: 5 | G15: 161 | H15: =IF(ISERROR(G15/F15),0,G15/F15) -> 32.20 | I15: 40 / 23 | J15: =IF(F15>=5,"Yes","") -> Yes
A16: =IF(J16="","",A15+1) -> 12 | B16: Roy Dickens | C16: 30.3 | D16: 29.9 | E16: =D16 -> 29.9 | F16: 14 | G16: 449 | H16: =IF(ISERROR(G16/F16),0,G16/F16) -> 32.071428571428569 | I16: 43 / 17 | J16: =IF(F16>=5,"Yes","") -> Yes
A17: =IF(J17="","",A16+1) -> 13 | B17: Paul Carter | C17: 16.9 | D17: 14.5 | E17: =D17 -> 14.5 | F17: 20 | G17: 638 | H17: =IF(ISERROR(G17/F17),0,G17/F17) -> 31.90 | I17: 49 / 24 | J17: =IF(F17>=5,"Yes","") -> Yes
A18: =IF(J18="","",A17+1) -> 14 | B18: Paul Baldwin | C18: 20.0 | D18: 20.0 | E18: =D18 -> 20 | F18: 9 | G18: 283 | H18: =IF(ISERROR(G18/F18),0,G18/F18) -> 31.444444444444443 | I18: 41 / 17 | J18: =IF(F18>=5,"Yes","") -> Yes
A19: =IF(J19="","",A18+1) -> 15 | B19: Ian Edwards | C19: 15.0 | D19: 14.6 | E19: =D19 -> 14.6 | F19: 6 | G19: 188 | H19: =IF(ISERROR(G19/F19),0,G19/F19) -> 31.333333333333332 | I19: 43 / 22 | J19: =IF(F19>=5,"Yes","") -> Yes
A20: =IF(J20="","",A19+1) -> 16 | B20: David Andrews | C20: 32.9 | D20: 31.9 | E20: =D20 -> 31.9 | F20: 13 | G20: 406 | H20: =IF(ISERROR(G20/F20),0,G20/F20) -> 31.23076923076923 | I20: 45 / 22 | J20: =IF(F20>=5,"Yes","") -> Yes
A21: =IF(J21="","",A20+1) -> 17 | B21: Dave Rouse | C21: 22.0 | D21: 23.5 | E21: =D21 -> 23.5 | F21: 39 | G21: 1190 | H21: =IF(ISERROR(G21/F21),0,G21/F21) -> 30.512820512820515 | I21: 41 / 20 | J21: =IF(F21>=5,"Yes","") -> Yes
A22: =IF(J22="","",A21+1) -> 18 | B22: Alan Hopkins | C22: 7.0 | D22: 7.4 | E22: =D22 -> 7.4 | F22: 5 | G22: 146 | H22: =IF(ISERROR(G22/F22),0,G22/F22) -> 29.20 | I22: 36 / 22 | J22: =IF(F22>=5,"Yes","") -> Yes
A23: =IF(J23="","",A22+1) -> 19 | B23: Chris Manning | C23: 22.1 | D23: 22.4 | E23: =D23 -> 22.4 | F23: 11 | G23: 317 | H23: =IF(ISERROR(G23/F23),0,G23/F23) -> 28.818181818181817 | I23: 42 / 17 | J23: =IF(F23>=5,"Yes","") -> Yes
A24: =IF(J24="","",A23+1) -> 20 | B24: Malcolm Rouse | C24: 36.0 | D24: 38.1 | E24: =D24 -> 38.1 | F24: 5 | G24: 90 | H24: =IF(ISERROR(G24/F24),0,G24/F24) -> 18.00 | I24: 31 / 12 | J24: =IF(F24>=5,"Yes","") -> Yes
A25: =IF(J25="","",A24+1) ->  | B25: Dave White | C25: 20.1 | D25: 20.2 | E25: =D25 -> 20.2 | F25: 1 | G25: 29 | H25: =IF(ISERROR(G25/F25),0,G25/F25) -> 29.00 | I25: 29 / 29 | J25: =IF(F25>=5,"Yes","") -> 
A26: =IF(J26="","",A25+1) ->  | B26: Andy Benson | C26: 8.9 | D26: 9.2 | E26: =D26 -> 9.2 | F26: 4 | G26: 114 | H26: =IF(ISERROR(G26/F26),0,G26/F26) -> 28.50 | I26: 34 / 25 | J26: =IF(F26>=5,"Yes","") -> 
A27: =IF(J27="","",A26+1) ->  | B27: Neil Leah | C27: 17.0 | D27: 17.3 | E27: =D27 -> 17.3 | F27: 3 | G27: 84 | H27: =IF(ISERROR(G27/F27),0,G27/F27) -> 28.00 | I27: 33 / 23 | J27: =IF(F27>=5,"Yes","") -> 
A28: =IF(J28="","",A27+1) ->  | B28: Mike Edmond | C28: 36.0 | D28: 36.5 | E28: =D28 -> 36.5 | F28: 1 | G28: 16 | H28: =IF(ISERROR(G28/F28),0,G28/F28) -> 16.00 | I28: 16 / 16 | J28: =IF(F28>=5,"Yes","") -> 
A29: =IF(J29="","",A28+1) ->  | B29: Dave Archer | C29: 25.0 | E29: =D29 ->  | F29: 0 | H29: =IF(ISERROR(G29/F29),0,G29/F29) -> 0.00 | I29: / | J29: =IF(F29>=5,"Yes","") -> 
A30: =IF(J30="","",A29+1) ->  | B30: Clive Ferris | C30: 25.0 | E30: =D30 ->  | F30: 0 | H30: =IF(ISERROR(G30/F30),0,G30/F30) -> 0.00 | I30: / | J30: =IF(F30>=5,"Yes","") -> 