A1: Season 2 - April 1st 2000 to 31st March 2001
A2: MGA World Tour Putting Statistics
B3: Statistics updated | C3: =TODAY() -> 36962
A4: Pos | B4: Player | C4: Original Handicap | D4: Current Handicap | E4: Playing Handicap | F4: Played | G4: Total Putts | H4: Average per Round | I4: Average Per Hole | J4: Best Round | K4: Worst Round
A5: 1 | B5: Jeff Gibbons | C5: 25.1 | D5: 15.7 | E5: =D5 -> 15.7 | F5: 39 | G5: 1255 | H5: 32.179487179487182 | I5: =IF(G5="","",G5/(F5*18)) -> 1.7877492877492878 | J5: 26 | K5: 40
A6: 2 | B6: Keith Mendelson | C6: 14.5 | D6: 11.1 | E6: =D6 -> 11.1 | F6: 43 | G6: 1400 | H6: 32.558139534883722 | I6: =IF(G6="","",G6/(F6*18)) -> 1.8087855297157622 | J6: 26 | K6: 40
A7: 3 | B7: Robert Thompson | C7: 10.6 | D7: 7.6 | E7: =D7 -> 7.6 | F7: 54 | G7: 1764 | H7: 32.666666666666664 | I7: =IF(G7="","",G7/(F7*18)) -> 1.8148148148148149 | J7: 26 | K7: 40
A8: 4 | B8: Kevin Gallagher | C8: 11.6 | D8: 9.4 | E8: =D8 -> 9.4 | F8: 40 | G8: 1307 | H8: 32.674999999999997 | I8: =IF(G8="","",G8/(F8*18)) -> 1.8152777777777778 | J8: 28 | K8: 41
A9: 5 | B9: Paul Carter | C9: 16.9 | D9: 14.5 | E9: =D9 -> 14.5 | F9: 20 | G9: 665 | H9: 33.25 | I9: =IF(G9="","",G9/(F9*18)) -> 1.8472222222222223 | J9: 27 | K9: 37
A10: 6 | B10: Martin Cox | C10: 14.1 | D10: 10.2 | E10: =D10 -> 10.2 | F10: 35 | G10: 1170 | H10: 33.428571428571431 | I10: =IF(G10="","",G10/(F10*18)) -> 1.8571428571428572 | J10: 26 | K10: 38
A11: 7 | B11: Andrew Baldwin | C11: 17.4 | D11: 16.4 | E11: =D11 -> 16.4 | F11: 42 | G11: 1412 | H11: 33.61904761904762 | I11: =IF(G11="","",G11/(F11*18)) -> 1.8677248677248677 | J11: 26 | K11: 42
A12: 8 | B12: Simon Thompson | C12: 16.9 | D12: 16.3 | E12: =D12 -> 16.3 | F12: 24 | G12: 807 | H12: 33.625 | I12: =IF(G12="","",G12/(F12*18)) -> 1.8680555555555556 | J12: 29 | K12: 38
A13: 9 | B13: John Press | C13: 18.6 | D13: 12.9 | E13: =D13 -> 12.9 | F13: 16 | G13: 542 | H13: 33.875 | I13: =IF(G13="","",G13/(F13*18)) -> 1.8819444444444444 | J13: 28 | K13: 43
A14: 10 | B14: Dave Andrews | C14: 32.9 | D14: 31.9 | E14: =D14 -> 31.9 | F14: 13 | G14: 443 | H14: 34.07692307692308 | I14: =IF(G14="","",G14/(F14*18)) -> 1.8931623931623931 | J14: 30 | K14: 40
A15: 11 | B15: Alan Baldwin | C15: 25.3 | D15: 22.8 | E15: =D15 -> 22.8 | F15: 6 | G15: 206 | H15: 34.333333333333336 | I15: =IF(G15="","",G15/(F15*18)) -> 1.9074074074074074 | J15: 29 | K15: 38
A16: 12 | B16: Alan Hopkins | C16: 7.0 | D16: 7.4 | E16: =D16 -> 7.4 | F16: 5 | G16: 175 | H16: 35.00 | I16: =IF(G16="","",G16/(F16*18)) -> 1.9444444444444444 | J16: 30 | K16: 39
A17: 13 | B17: Jon Dey | C17: 36.0 | D17: 35.4 | E17: =D17 -> 35.4 | F17: 5 | G17: 175 | H17: 35.00 | I17: =IF(G17="","",G17/(F17*18)) -> 1.9444444444444444 | J17: 34 | K17: 36
A18: 14 | B18: Chris Manning | C18: 22.1 | D18: 22.4 | E18: =D18 -> 22.4 | F18: 11 | G18: 386 | H18: 35.090909090909093 | I18: =IF(G18="","",G18/(F18*18)) -> 1.9494949494949494 | J18: 32 | K18: 40
A19: 15 | B19: Dave Rouse | C19: 22.0 | D19: 23.5 | E19: =D19 -> 23.5 | F19: 39 | G19: 1374 | H19: 35.230769230769234 | I19: =IF(G19="","",G19/(F19*18)) -> 1.9572649572649572 | J19: 30 | K19: 42
A20: 16 | B20: Ian Edwards | C20: 15.0 | D20: 14.6 | E20: =D20 -> 14.6 | F20: 6 | G20: 218 | H20: 36.333333333333336 | I20: =IF(G20="","",G20/(F20*18)) -> 2.0185185185185186 | J20: 30 | K20: 40
A21: 17 | B21: Steve Tilling | C21: 20.2 | D21: 20.3 | E21: =D21 -> 20.3 | F21: 10 | G21: 366 | H21: 36.60 | I21: =IF(G21="","",G21/(F21*18)) -> 2.0333333333333332 | J21: 32 | K21: 44
A22: 18 | B22: Roy Dickens | C22: 30.3 | D22: 29.9 | E22: =D22 -> 29.9 | F22: 14 | G22: 519 | H22: 37.071428571428569 | I22: =IF(G22="","",G22/(F22*18)) -> 2.0595238095238093 | J22: 33 | K22: 40
A23: 19 | B23: Paul Baldwin | C23: 20.0 | D23: 20.0 | E23: =D23 -> 20 | F23: 9 | G23: 334 | H23: 37.111111111111114 | I23: =IF(G23="","",G23/(F23*18)) -> 2.0617283950617282 | J23: 33 | K23: 40
A24: 20 | B24: Malcolm Rouse | C24: 36.0 | D24: 38.1 | E24: =D24 -> 38.1 | F24: 5 | G24: 214 | H24: 42.80 | I24: =IF(G24="","",G24/(F24*18)) -> 2.3777777777777778 | J24: 38 | K24: 47
A25: 21 | B25: Andy Benson | C25: 8.9 | D25: 9.2 | E25: =D25 -> 9.2 | F25: 4 | G25: 139 | H25: 34.75 | I25: =IF(G25="","",G25/(F25*18)) -> 1.9305555555555556 | J25: 28 | K25: 41
A26: 22 | B26: Neil Leah | C26: 17.0 | D26: 17.3 | E26: =D26 -> 17.3 | F26: 3 | G26: 109 | H26: 36.333333333333336 | I26: =IF(G26="","",G26/(F26*18)) -> 2.0185185185185186 | J26: 35 | K26: 41
A27: 23 | B27: Dave White | C27: 20.1 | D27: 20.2 | E27: =D27 -> 20.2 | F27: 1 | G27: 37 | H27: 37.00 | I27: =IF(G27="","",G27/(F27*18)) -> 2.0555555555555554 | J27: 37 | K27: 37
A28: 24 | B28: Mike Edmond | C28: 36.0 | D28: 36.5 | E28: =D28 -> 36.5 | F28: 1 | G28: 40 | H28: 40.00 | I28: =IF(G28="","",G28/(F28*18)) -> 2.2222222222222223 | J28: 40 | K28: 43
A29: 25 | B29: Dave Archer | C29: 25.0 | E29: =D29 ->  | F29: 0 | I29: =IF(G29="","",G29/(F29*18)) ->  | J29: 0 | K29: 0
A30: 26 | B30: Clive Ferris | C30: 25.0 | E30: =D30 ->  | F30: 0 | I30: =IF(G30="","",G30/(F30*18)) ->  | J30: 0 | K30: 0