A1: Keith Johns
A2: Club | B2: Traditions
A3: Par/SS | B3: 71/68 | D3: Num. Of Fairways | I3: =IF(B2="","",18-(COUNTIF(B9:B26,3))) -> 14
A4: Date | B4: 37786 | D4: Playing Handicap | I4: 25.1
A5: Event Place | B5: 13 | C5: M | D5: Prize Money | G5: 20000
A6: Game Stats | B6: DB+ | C6: DB | D6: Bi | E6: P | F6: B | G6: E | H6: A | I6: H1
B7: 5 | C7: 5 | D7: 6 | E7: 2 | F7: 0 | G7: 0 | H7: 0 | I7: 0
A8: Hole No | B8: Par | C8: Stroke Index | D8: Gross Score | E8: Points | F8: Putts | G8: Fairways | H8: Ferrets | I8: Green Regulation
A9: 1 | B9: 4 | C9: 9 | D9: 5 | E9: 2 | F9: 2 | G9: 1 | I9: Yes
A10: 2 | B10: 4 | C10: 5 | D10: 6 | E10: 2 | F10: 1
A11: 3 | B11: 3 | C11: 17 | D11: 3 | E11: 3 | F11: 1 | I11: Yes
A12: 4 | B12: 4 | C12: 1 | D12: 8 | E12: 0 | F12: 3 | H12: 1
A13: 5 | B13: 5 | C13: 13 | D13: 8 | E13: 0 | F13: 2
A14: 6 | B14: 3 | C14: 7 | D14: 5 | E14: 2 | F14: 1
A15: 7 | B15: 4 | C15: 15 | D15: 5 | E15: 2 | F15: 2 | G15: 1 | I15: Yes
A16: 8 | B16: 4 | C16: 3 | D16: 6 | E16: 2 | F16: 2 | I16: Yes
A17: 9 | B17: 4 | C17: 11 | D17: 5 | E17: 2 | F17: 2 | I17: Yes
A18: 10 | B18: 3 | C18: 10 | D18: 4 | E18: 2 | F18: 1
A19: 11 | B19: 4 | C19: 16 | D19: 6 | E19: 1 | F19: 2
A20: 12 | B20: 5 | C20: 12 | D20: 5 | E20: 3 | F20: 2 | I20: Yes
A21: 13 | B21: 4 | C21: 8 | D21: 5 | E21: 2 | F21: 2 | I21: Yes
A22: 14 | B22: 4 | C22: 4 | D22: 6 | E22: 2 | F22: 2 | G22: 1 | I22: Yes
A23: 15 | B23: 3 | C23: 18 | D23: 4 | E23: 2 | F23: 2 | I23: Yes
A24: 16 | B24: 5 | C24: 14 | D24: 8 | E24: 0 | F24: 2
A25: 17 | B25: 4 | C25: 2 | D25: 8 | E25: 0 | F25: 2 | H25: 1
A26: 18 | B26: 4 | C26: 6 | D26: 10 | E26: 0 | F26: 3 | H26: 1
A27: Totals | B27: =IF(B2="","",SUM(B9:B26)) -> 71 | D27: =IF(B2="","",SUM(D9:D26)) -> 107 | E27: =IF(B2="","",SUM(E9:E26)) -> 27 | F27: =IF(B2="","",SUM(F9:F26)) -> 34 | G27: =IF(B2="","",SUM(G9:G26)) -> 3 | H27: =IF(B2="","",SUM(H9:H26)) -> 3 | I27: =IF(COUNTIF(I9:I26,"=Yes")=0,"",COUNTIF(I9:I26,"=Yes")) -> 9