A1: Roy Dickens
A2: Club | B2: Merrist Wood
A3: Par/SS | B3: 72/70 | D3: Num. Of Fairways | I3: =IF(B2="","",18-(COUNTIF(B9:B26,3))) -> 14
A4: Date | B4: 39536 | D4: Playing Handicap | I4: 31.3
A5: Event Place | B5: 2 | C5: M | D5: Prize Money | G5: 30000
A6: Game Stats | B6: DB+ | C6: DB | D6: Bi | E6: P | F6: B | G6: E | H6: A | I6: H1
B7: 5 | C7: 5 | D7: 6 | E7: 2 | F7: 0 | G7: 0 | H7: 0 | I7: 0
A8: Hole No | B8: Par | C8: Stroke Index | D8: Gross Score | E8: Points | F8: Putts | G8: Fairways | H8: Ferrets | I8: Green Regulation
A9: 1 | B9: 4 | C9: 10 | D9: 10 | E9: 0 | F9: 3 | H9: 1
A10: 2 | B10: 3 | C10: 18 | D10: 6 | E10: 0 | F10: 3
A11: 3 | B11: 4 | C11: 6 | D11: 6 | E11: 2 | F11: 4 | I11: Yes
A12: 4 | B12: 5 | C12: 14 | D12: 5 | E12: 3 | F12: 2 | I12: Yes
A13: 5 | B13: 4 | C13: 4 | D13: 4 | E13: 4 | F13: 2 | I13: Yes
A14: 6 | B14: 5 | C14: 12 | D14: 8 | E14: 1 | F14: 2
A15: 7 | B15: 4 | C15: 8 | D15: 5 | E15: 3 | F15: 2 | G15: 1 | I15: Yes
A16: 8 | B16: 3 | C16: 16 | D16: 4 | E16: 2 | F16: 2 | I16: Yes
A17: 9 | B17: 4 | C17: 2 | D17: 7 | E17: 1 | F17: 2 | G17: 1
A18: 10 | B18: 5 | C18: 9 | D18: 7 | E18: 2 | F18: 2 | G18: 1 | I18: Yes
A19: 11 | B19: 3 | C19: 15 | D19: 5 | E19: 1 | F19: 2
A20: 12 | B20: 4 | C20: 7 | D20: 6 | E20: 2 | F20: 2 | G20: 1 | H20: 1 | I20: Yes
A21: 13 | B21: 4 | C21: 1 | D21: 5 | E21: 3 | F21: 1 | G21: 1 | I21: Yes
A22: 14 | B22: 4 | C22: 13 | D22: 5 | E22: 3 | F22: 1 | G22: 1 | I22: Yes
A23: 15 | B23: 4 | C23: 3 | D23: 7 | E23: 1 | F23: 2
A24: 16 | B24: 3 | C24: 17 | D24: 5 | E24: 1 | F24: 2
A25: 17 | B25: 4 | C25: 5 | D25: 5 | E25: 3 | F25: 2 | G25: 1 | I25: Yes
A26: 18 | B26: 5 | C26: 11 | D26: 6 | E26: 3 | F26: 2 | I26: Yes
A27: Totals | B27: =IF(B2="","",SUM(B9:B26)) -> 72 | D27: =IF(B2="","",SUM(D9:D26)) -> 106 | E27: =IF(B2="","",SUM(E9:E26)) -> 35 | F27: =IF(B2="","",SUM(F9:F26)) -> 38 | G27: =IF(B2="","",SUM(G9:G26)) -> 7 | H27: =IF(B2="","",SUM(H9:H26)) -> 2 | I27: =IF(COUNTIF(I9:I26,"=Yes")=0,"",COUNTIF(I9:I26,"=Yes")) -> 11