A1: Simon Thompson
A2: Club | B2: Wimbledon Common
A3: Par/SS | B3: 68/66 | D3: Num. Of Fairways | I3: =IF(B2="","",18-(COUNTIF(B9:B26,3))) -> 13
A4: Date | B4: 39529 | D4: Playing Handicap | I4: 12
A5: Event Place | B5: 1 | D5: Prize Money | G5: 5000
A6: Game Stats | B6: DB+ | C6: DB | D6: Bi | E6: P | F6: B | G6: E | H6: A | I6: H1
B7: 3 | C7: 1 | D7: 4 | E7: 8 | F7: 1 | G7: 1 | H7: 0 | I7: 0
A8: Hole No | B8: Par | C8: Stroke Index | D8: Gross Score | E8: Points | F8: Putts | G8: Fairways | H8: Ferrets | I8: Green Regulation
A9: 1 | B9: 3 | C9: 7 | D9: 3 | E9: 3 | F9: 0
A10: 2 | B10: 4 | C10: 1 | D10: 7 | E10: 0 | F10: 2
A11: 3 | B11: 4 | C11: 14 | D11: 4 | E11: 2 | F11: 2 | G11: 1 | I11: Yes
A12: 4 | B12: 3 | C12: 11 | D12: 4 | E12: 2 | F12: 2 | I12: Yes
A13: 5 | B13: 4 | C13: 18 | D13: 6 | E13: 0 | F13: 2
A14: 6 | B14: 4 | C14: 5 | D14: 9 | E14: 0 | F14: 3
A15: 7 | B15: 4 | C15: 10 | D15: 5 | E15: 2 | F15: 1 | G15: 1
A16: 8 | B16: 3 | C16: 8 | D16: 3 | E16: 3 | F16: 1 | I16: Yes
A17: 9 | B17: 4 | C17: 16 | D17: 2 | E17: 4 | F17: 1 | G17: 1 | I17: Yes
A18: 10 | B18: 4 | C18: 15 | D18: 3 | E18: 3 | F18: 1 | G18: 1 | I18: Yes
A19: 11 | B19: 4 | C19: 4 | D19: 8 | E19: 0 | F19: 2
A20: 12 | B20: 3 | C20: 6 | D20: 4 | E20: 2 | F20: 2 | I20: Yes
A21: 13 | B21: 4 | C21: 13 | D21: 4 | E21: 2 | F21: 2 | G21: 1 | I21: Yes
A22: 14 | B22: 4 | C22: 2 | D22: 4 | E22: 3 | F22: 2 | I22: Yes
A23: 15 | B23: 4 | C23: 12 | D23: 5 | E23: 2 | F23: 2 | G23: 1 | I23: Yes
A24: 16 | B24: 3 | C24: 17 | D24: 3 | E24: 2 | F24: 1
A25: 17 | B25: 4 | C25: 9 | D25: 4 | E25: 3 | F25: 2 | I25: Yes
A26: 18 | B26: 5 | C26: 3 | D26: 5 | E26: 3 | F26: 2 | I26: Yes
A27: Totals | B27: =IF(B2="","",SUM(B9:B26)) -> 68 | D27: =IF(B2="","",SUM(D9:D26)) -> 83 | E27: =IF(B2="","",SUM(E9:E26)) -> 36 | F27: =IF(B2="","",SUM(F9:F26)) -> 30 | G27: =IF(B2="","",SUM(G9:G26)) -> 6 | H27: =IF(B2="","",SUM(H9:H26)) -> 0 | I27: =IF(COUNTIF(I9:I26,"=Yes")=0,"",COUNTIF(I9:I26,"=Yes")) -> 11