A1: Dave Bingham
A2: Club | B2: Chartham Park
A3: Par/SS | B3: 72/69 | D3: Num. Of Fairways | I3: =IF(B2="","",18-(COUNTIF(B9:B26,3))) -> 14
A4: Date | B4: 40151 | D4: Playing Handicap | I4: 13.2
A5: Event Place | B5: 1 | D5: Prize Money | G5: 10000
A6: Game Stats | B6: DB+ | C6: DB | D6: Bi | E6: P | F6: B | G6: E | H6: A | I6: H1
B7: 0 | C7: 2 | D7: 9 | E7: 7 | F7: 0 | G7: 0 | H7: 0 | I7: 0
A8: Hole No | B8: Par | C8: Stroke Index | D8: Gross Score | E8: Points | F8: Putts | G8: Fairways | H8: Ferrets | I8: Green Regulation
A9: 1 | B9: 4 | C9: 6 | D9: 4 | E9: 3 | F9: 2 | G9: 1 | I9: Yes
A10: 2 | B10: 4 | C10: 16 | D10: 4 | E10: 2 | F10: 2 | G10: 1 | I10: Yes
A11: 3 | B11: 3 | C11: 18 | D11: 4 | E11: 1 | F11: 2
A12: 4 | B12: 5 | C12: 8 | D12: 7 | E12: 1 | F12: 3 | G12: 1 | I12: Yes
A13: 5 | B13: 4 | C13: 14 | D13: 5 | E13: 1 | F13: 1 | G13: 1
A14: 6 | B14: 4 | C14: 2 | D14: 6 | E14: 1 | F14: 2 | H14: 1
A15: 7 | B15: 5 | C15: 10 | D15: 5 | E15: 3 | F15: 2 | I15: Yes
A16: 8 | B16: 4 | C16: 4 | D16: 5 | E16: 2 | F16: 2 | G16: 1 | I16: Yes
A17: 9 | B17: 3 | C17: 12 | D17: 3 | E17: 3 | F17: 2 | I17: Yes
A18: 10 | B18: 4 | C18: 7 | D18: 4 | E18: 3 | F18: 2 | G18: 1 | I18: Yes
A19: 11 | B19: 5 | C19: 15 | D19: 5 | E19: 2 | F19: 2 | G19: 1 | I19: Yes
A20: 12 | B20: 4 | C20: 1 | D20: 5 | E20: 2 | F20: 3 | G20: 1 | I20: Yes
A21: 13 | B21: 3 | C21: 5 | D21: 4 | E21: 2 | F21: 1
A22: 14 | B22: 4 | C22: 11 | D22: 5 | E22: 2 | F22: 2 | G22: 1 | I22: Yes
A23: 15 | B23: 4 | C23: 13 | D23: 4 | E23: 3 | F23: 2 | G23: 1 | I23: Yes
A24: 16 | B24: 4 | C24: 3 | D24: 5 | E24: 2 | F24: 1 | G24: 1
A25: 17 | B25: 3 | C25: 17 | D25: 4 | E25: 1 | F25: 1
A26: 18 | B26: 5 | C26: 9 | D26: 6 | E26: 2 | F26: 2 | G26: 1 | I26: Yes
A27: Totals | B27: =IF(B2="","",SUM(B9:B26)) -> 72 | D27: =IF(B2="","",SUM(D9:D26)) -> 85 | E27: =IF(B2="","",SUM(E9:E26)) -> 36 | F27: =IF(B2="","",SUM(F9:F26)) -> 34 | G27: =IF(B2="","",SUM(G9:G26)) -> 12 | H27: =IF(B2="","",SUM(H9:H26)) -> 1 | I27: =IF(COUNTIF(I9:I26,"=Yes")=0,"",COUNTIF(I9:I26,"=Yes")) -> 12