A1: Keith Mendelson
A2: Club | B2: Batchwood
A3: Par/SS | B3: 71/69 | D3: Num. Of Fairways | I3: =IF(B2="","",18-(COUNTIF(B9:B26,3))) -> 14
A4: Date | B4: 41753 | D4: Playing Handicap | I4: 11.8
A5: Event Place | B5: 3 | D5: Prize Money | G5: 2500
A6: Game Stats | B6: DB+ | C6: DB | D6: Bi | E6: P | F6: B | G6: E | H6: A | I6: H1
B7: 2 | C7: 4 | D7: 6 | E7: 6 | F7: 0 | G7: 0 | H7: 0 | I7: 0
A8: Hole No | B8: Par | C8: Stroke Index | D8: Gross Score | E8: Points | F8: Putts | G8: Fairways | H8: Ferrets | I8: Green Regulation
A9: 1 | B9: 5 | C9: 16 | D9: 6 | E9: 1 | F9: 1
A10: 2 | B10: 4 | C10: 8 | D10: 4 | E10: 3 | F10: 2 | I10: Yes
A11: 3 | B11: 3 | C11: 18 | D11: 6 | E11: 0 | F11: 2
A12: 4 | B12: 4 | C12: 6 | D12: 6 | E12: 1 | F12: 2 | G12: 1
A13: 5 | B13: 4 | C13: 4 | D13: 6 | E13: 1 | F13: 3 | I13: Yes
A14: 6 | B14: 3 | C14: 12 | D14: 3 | E14: 3 | F14: 2 | I14: Yes
A15: 7 | B15: 4 | C15: 2 | D15: 10 | E15: 0 | F15: 3 | H15: 1
A16: 8 | B16: 4 | C16: 10 | D16: 6 | E16: 1 | F16: 1 | H16: 1
A17: 9 | B17: 3 | C17: 14 | D17: 4 | E17: 1 | F17: 2
A18: 10 | B18: 4 | C18: 1 | D18: 6 | E18: 1 | F18: 3 | G18: 1 | I18: Yes
A19: 11 | B19: 4 | C19: 5 | D19: 4 | E19: 3 | F19: 2 | G19: 1 | I19: Yes
A20: 12 | B20: 4 | C20: 3 | D20: 4 | E20: 3 | F20: 1 | G20: 1 | I20: Yes
A21: 13 | B21: 4 | C21: 11 | D21: 4 | E21: 3 | F21: 2 | G21: 1 | I21: Yes
A22: 14 | B22: 4 | C22: 13 | D22: 5 | E22: 1 | F22: 3 | G22: 1 | I22: Yes
A23: 15 | B23: 4 | C23: 7 | D23: 5 | E23: 2 | F23: 2 | I23: Yes
A24: 16 | B24: 3 | C24: 17 | D24: 3 | E24: 2 | F24: 2 | I24: Yes
A25: 17 | B25: 5 | C25: 15 | D25: 6 | E25: 1 | F25: 1
A26: 18 | B26: 5 | C26: 9 | D26: 6 | E26: 2 | F26: 2 | G26: 1 | I26: Yes
A27: Totals | B27: =IF(B2="","",SUM(B9:B26)) -> 71 | D27: =IF(B2="","",SUM(D9:D26)) -> 94 | E27: =IF(B2="","",SUM(E9:E26)) -> 29 | F27: =IF(B2="","",SUM(F9:F26)) -> 36 | G27: =IF(B2="","",SUM(G9:G26)) -> 7 | H27: =IF(B2="","",SUM(H9:H26)) -> 2 | I27: =IF(COUNTIF(I9:I26,"=Yes")=0,"",COUNTIF(I9:I26,"=Yes")) -> 11