B1: Season 17 - April 1st 2015 to 2nd April 2016
A2: MGA World Tour Net Greens in Regulation
B3: Statistics updated | C3: =TODAY() -> 42469
A4: Pos | B4: Player | C4: Original Handicap | D4: Current Handicap | E4: Playing Handicap | F4: Played | G4: Total Greens Hit | H4: Green in Regulation | I4: Greens in Regulation Ratio
A5: 1 | B5: Jon Press | C5: 13.5 | D5: 12.1 | E5: =D5 -> 12.1 | F5: 3 | G5: 34 | H5: 62.96 % | I5: =IF(G5="","",IF(G5=0,"0 : "&F5*18,"1 : "&ROUND((F5*18)/G5,1))) -> 1 : 1.6 | J5: Qualified
A6: 2 | B6: David Archer | C6: 21.7 | D6: 22.500000000001002 | E6: =D6 -> 22.500000000001002 | F6: 4 | G6: 44 | H6: 61.11 % | I6: =IF(G6="","",IF(G6=0,"0 : "&F6*18,"1 : "&ROUND((F6*18)/G6,1))) -> 1 : 1.6 | J6: Qualified
A7: 3 | B7: Simon Thompson | C7: 10.3 | D7: 8.4 | E7: =D7 -> 8.4 | F7: 6 | G7: 66 | H7: 61.11 % | I7: =IF(G7="","",IF(G7=0,"0 : "&F7*18,"1 : "&ROUND((F7*18)/G7,1))) -> 1 : 1.6 | J7: Qualified
A8: 4 | B8: Jon Dey | C8: 22.8 | D8: 18.900000000001004 | E8: =D8 -> 18.900000000001004 | F8: 7 | G8: 74 | H8: 58.73 % | I8: =IF(G8="","",IF(G8=0,"0 : "&F8*18,"1 : "&ROUND((F8*18)/G8,1))) -> 1 : 1.7 | J8: Qualified
A9: 5 | B9: Jeff Colbrook | C9: 18.4 | D9: 19.0 | E9: =D9 -> 19 | F9: 4 | G9: 42 | H9: 58.33 % | I9: =IF(G9="","",IF(G9=0,"0 : "&F9*18,"1 : "&ROUND((F9*18)/G9,1))) -> 1 : 1.7 | J9: Qualified
A10: 6 | B10: Ian Edwards | C10: 17.0 | D10: 15.7 | E10: =D10 -> 15.7 | F10: 7 | G10: 73 | H10: 57.94 % | I10: =IF(G10="","",IF(G10=0,"0 : "&F10*18,"1 : "&ROUND((F10*18)/G10,1))) -> 1 : 1.7 | J10: Qualified
A11: 7 | B11: Matthew Carter | C11: 15.4 | D11: 16.0 | E11: =D11 -> 16 | F11: 4 | G11: 41 | H11: 56.94 % | I11: =IF(G11="","",IF(G11=0,"0 : "&F11*18,"1 : "&ROUND((F11*18)/G11,1))) -> 1 : 1.8 | J11: Qualified
A12: 8 | B12: Keith Mendelson | C12: 12.8 | D12: 12.5 | E12: =D12 -> 12.5 | F12: 4 | G12: 39 | H12: 54.17 % | I12: =IF(G12="","",IF(G12=0,"0 : "&F12*18,"1 : "&ROUND((F12*18)/G12,1))) -> 1 : 1.8 | J12: Qualified
A13: 9 | B13: Paul Carter | C13: 12.0 | D13: 11.1 | E13: =D13 -> 11.1 | F13: 6 | G13: 57 | H13: 52.78 % | I13: =IF(G13="","",IF(G13=0,"0 : "&F13*18,"1 : "&ROUND((F13*18)/G13,1))) -> 1 : 1.9 | J13: Qualified
A14: 10 | B14: David Braithwaite | C14: 11.1 | D14: 11.900000000000997 | E14: =D14 -> 11.900000000000997 | F14: 6 | G14: 57 | H14: 52.78 % | I14: =IF(G14="","",IF(G14=0,"0 : "&F14*18,"1 : "&ROUND((F14*18)/G14,1))) -> 1 : 1.9 | J14: Qualified
A15: 11 | B15: Paul Baldwin | C15: 19.0 | D15: 19.100000000001 | E15: =D15 -> 19.100000000001 | F15: 3 | G15: 28 | H15: 51.85 % | I15: =IF(G15="","",IF(G15=0,"0 : "&F15*18,"1 : "&ROUND((F15*18)/G15,1))) -> 1 : 1.9 | J15: Qualified
A16: 12 | B16: David Bingham | C16: 11.0 | D16: 11.2 | E16: =D16 -> 11.2 | F16: 6 | G16: 55 | H16: 50.93 % | I16: =IF(G16="","",IF(G16=0,"0 : "&F16*18,"1 : "&ROUND((F16*18)/G16,1))) -> 1 : 2 | J16: Qualified
A17: 13 | B17: David Kewley | C17: 14.9 | D17: 14.400000000000999 | E17: =D17 -> 14.400000000000999 | F17: 7 | G17: 63 | H17: 50 % | I17: =IF(G17="","",IF(G17=0,"0 : "&F17*18,"1 : "&ROUND((F17*18)/G17,1))) -> 1 : 2 | J17: Qualified
A18: 14 | B18: Kevin Gallagher | C18: 13.4 | D18: 13.6 | E18: =D18 -> 13.6 | F18: 5 | G18: 45 | H18: 50 % | I18: =IF(G18="","",IF(G18=0,"0 : "&F18*18,"1 : "&ROUND((F18*18)/G18,1))) -> 1 : 2 | J18: Qualified
A19: 15 | B19: Martin Cox | C19: 13.8 | D19: 14.5 | E19: =D19 -> 14.5 | F19: 7 | G19: 62 | H19: 49.21 % | I19: =IF(G19="","",IF(G19=0,"0 : "&F19*18,"1 : "&ROUND((F19*18)/G19,1))) -> 1 : 2 | J19: Qualified
A20: 16 | B20: Robert Thompson | C20: 11.9 | D20: 10.7 | E20: =D20 -> 10.7 | F20: 10 | G20: 87 | H20: 48.33 % | I20: =IF(G20="","",IF(G20=0,"0 : "&F20*18,"1 : "&ROUND((F20*18)/G20,1))) -> 1 : 2.1 | J20: Qualified
A21: 17 | B21: David Rouse | C21: 27.0 | D21: 28.5 | E21: =D21 -> 28.5 | F21: 7 | G21: 59 | H21: 46.83 % | I21: =IF(G21="","",IF(G21=0,"0 : "&F21*18,"1 : "&ROUND((F21*18)/G21,1))) -> 1 : 2.1 | J21: Qualified
A22: 18 | B22: Simon Owens | C22: 15.1 | D22: 16.1 | E22: =D22 -> 16.1 | F22: 4 | G22: 32 | H22: 44.44 % | I22: =IF(G22="","",IF(G22=0,"0 : "&F22*18,"1 : "&ROUND((F22*18)/G22,1))) -> 1 : 2.3 | J22: Qualified
A23: 19 | B23: David Andrews | C23: 14.3 | D23: 15.300000000000999 | E23: =D23 -> 15.300000000000999 | F23: 4 | G23: 28 | H23: 38.89 % | I23: =IF(G23="","",IF(G23=0,"0 : "&F23*18,"1 : "&ROUND((F23*18)/G23,1))) -> 1 : 2.6 | J23: Qualified
A24: 20 | B24: Roy Dickens | C24: 28.8 | D24: 29.9 | E24: =D24 -> 29.9 | F24: 4 | G24: 27 | H24: 37.5 % | I24: =IF(G24="","",IF(G24=0,"0 : "&F24*18,"1 : "&ROUND((F24*18)/G24,1))) -> 1 : 2.7 | J24: Qualified
A25: 21 | B25: Chris Manning | C25: 23.3 | D25: 22.6 | E25: =D25 -> 22.6 | F25: 1 | G25: 12 | H25: 66.67 % | I25: =IF(G25="","",IF(G25=0,"0 : "&F25*18,"1 : "&ROUND((F25*18)/G25,1))) -> 1 : 1.5
A26: 22 | B26: Alan Baldwin | C26: 22.2 | D26: 22.2 | E26: =D26 -> 22.2 | F26: 1 | G26: 11 | H26: 61.11 % | I26: =IF(G26="","",IF(G26=0,"0 : "&F26*18,"1 : "&ROUND((F26*18)/G26,1))) -> 1 : 1.6
A27: 23 | B27: Michael Trimmings | C27: 19.8 | D27: 19.3 | E27: =D27 -> 19.3 | F27: 2 | G27: 18 | H27: 50 % | I27: =IF(G27="","",IF(G27=0,"0 : "&F27*18,"1 : "&ROUND((F27*18)/G27,1))) -> 1 : 2
A28: 24 | B28: Alan Hopkins | C28: 7.9 | D28: 8.0 | E28: =D28 -> 8 | F28: 1 | G28: 7 | H28: 38.89 % | I28: =IF(G28="","",IF(G28=0,"0 : "&F28*18,"1 : "&ROUND((F28*18)/G28,1))) -> 1 : 2.6
A29: 25 | B29: Andrew Baldwin | C29: 20.4 | D29: 20.9 | E29: =D29 -> 20.9 | F29: 1 | G29: 6 | H29: 33.33 % | I29: =IF(G29="","",IF(G29=0,"0 : "&F29*18,"1 : "&ROUND((F29*18)/G29,1))) -> 1 : 3
B30: Steve Tilling | C30: 16.3 | D30: 16.3 | E30: =D30 -> 16.3 | F30: 0 | G30: 0 | H30: 0.00 | I30: =IF(G30="","",IF(G30=0,"0 : "&F30*18,"1 : "&ROUND((F30*18)/G30,1))) -> 0 : 0
B31: Martin Bould | C31: 16.2 | D31: 16.2 | E31: =D31 -> 16.2 | F31: 0 | G31: 0 | H31: 0.00 | I31: =IF(G31="","",IF(G31=0,"0 : "&F31*18,"1 : "&ROUND((F31*18)/G31,1))) -> 0 : 0
B32: Malcolm Rouse | C32: 44.9 | D32: 44.9 | E32: =D32 -> 44.9 | F32: 0 | G32: 0 | H32: 0.00 | I32: =IF(G32="","",IF(G32=0,"0 : "&F32*18,"1 : "&ROUND((F32*18)/G32,1))) -> 0 : 0
B33: Clive Ferris | C33: 26.0 | D33: 26.0 | E33: =D33 -> 26 | F33: 0 | G33: 0 | H33: 0.00 | I33: =IF(G33="","",IF(G33=0,"0 : "&F33*18,"1 : "&ROUND((F33*18)/G33,1))) -> 0 : 0
B34: Andy Benson | C34: 6.1 | D34: 6.1 | E34: =D34 -> 6.1 | F34: 0 | G34: 0 | H34: 0.00 | I34: =IF(G34="","",IF(G34=0,"0 : "&F34*18,"1 : "&ROUND((F34*18)/G34,1))) -> 0 : 0