B1: Season 17 - April 1st 2015 to 31st March 2016
A2: MGA World Tour Order of Merit
B3: Statistics updated | C3: =TODAY() -> 42282
A4: Pos | B4: Player | C4: Original Handicap | D4: Current Handicap | E4: Playing Handicap | F4: Played | G4: Points | H4: Average | I4: HI / LOW Score | J4: Qualified (3 games)
A5: 1 | B5: Simon Thompson | C5: 10.3 | D5: 8.2 | E5: =D5 -> 8.2 | F5: 5 | G5: 163 | H5: =IF(ISERROR(G5/F5),0,G5/F5) -> 32.60 | I5: 35 / 31 | J5: Qualified
A6: 2 | B6: Jon Dey | C6: 22.8 | D6: 18.600000000001003 | E6: =D6 -> 18.600000000001003 | F6: 5 | G6: 162 | H6: =IF(ISERROR(G6/F6),0,G6/F6) -> 32.40 | I6: 51 / 21 | J6: Qualified
A7: 3 | B7: David Archer | C7: 21.7 | D7: 21.500000000001002 | E7: =D7 -> 21.500000000001002 | F7: 3 | G7: 96 | H7: =IF(ISERROR(G7/F7),0,G7/F7) -> 32.00 | I7: 38 / 28 | J7: Qualified
A8: 4 | B8: Jon Press | C8: 13.5 | D8: 12.1 | E8: =D8 -> 12.1 | F8: 3 | G8: 94 | H8: =IF(ISERROR(G8/F8),0,G8/F8) -> 31.333333333333332 | I8: 39 / 24 | J8: Qualified
A9: 5 | B9: Keith Mendelson | C9: 12.8 | D9: 11.5 | E9: =D9 -> 11.5 | F9: 3 | G9: 94 | H9: =IF(ISERROR(G9/F9),0,G9/F9) -> 31.333333333333332 | I9: 40 / 27 | J9: Qualified
A10: 6 | B10: Kevin Gallagher | C10: 13.4 | D10: 13.4 | E10: =D10 -> 13.4 | F10: 4 | G10: 125 | H10: =IF(ISERROR(G10/F10),0,G10/F10) -> 31.25 | I10: 33 / 30 | J10: Qualified
A11: 7 | B11: David Kewley | C11: 14.9 | D11: 14.3 | E11: =D11 -> 14.3 | F11: 6 | G11: 182 | H11: =IF(ISERROR(G11/F11),0,G11/F11) -> 30.333333333333332 | I11: 37 / 23 | J11: Qualified
A12: 8 | B12: Robert Thompson | C12: 11.9 | D12: 10.3 | E12: =D12 -> 10.3 | F12: 8 | G12: 238 | H12: =IF(ISERROR(G12/F12),0,G12/F12) -> 29.75 | I12: 40 / 21 | J12: Qualified
A13: 9 | B13: David Braithwaite | C13: 11.1 | D13: 11.700000000000998 | E13: =D13 -> 11.700000000000998 | F13: 5 | G13: 146 | H13: =IF(ISERROR(G13/F13),0,G13/F13) -> 29.20 | I13: 34 / 26 | J13: Qualified
A14: 10 | B14: Paul Carter | C14: 12.0 | D14: 10.6 | E14: =D14 -> 10.6 | F14: 5 | G14: 144 | H14: =IF(ISERROR(G14/F14),0,G14/F14) -> 28.80 | I14: 36 / 22 | J14: Qualified
A15: 11 | B15: Ian Edwards | C15: 17.0 | D15: 16.9 | E15: =D15 -> 16.9 | F15: 5 | G15: 143 | H15: =IF(ISERROR(G15/F15),0,G15/F15) -> 28.60 | I15: 35 / 24 | J15: Qualified
A16: 12 | B16: Matthew Carter | C16: 15.4 | D16: 16.0 | E16: =D16 -> 16 | F16: 4 | G16: 114 | H16: =IF(ISERROR(G16/F16),0,G16/F16) -> 28.50 | I16: 37 / 20 | J16: Qualified
A17: 13 | B17: David Rouse | C17: 27.0 | D17: 27.5 | E17: =D17 -> 27.5 | F17: 6 | G17: 170 | H17: =IF(ISERROR(G17/F17),0,G17/F17) -> 28.333333333333332 | I17: 39 / 13 | J17: Qualified
A18: 14 | B18: Jeff Colbrook | C18: 18.4 | D18: 18.8 | E18: =D18 -> 18.8 | F18: 3 | G18: 83 | H18: =IF(ISERROR(G18/F18),0,G18/F18) -> 27.666666666666668 | I18: 30 / 24 | J18: Qualified
A19: 15 | B19: Martin Cox | C19: 13.8 | D19: 14.3 | E19: =D19 -> 14.3 | F19: 6 | G19: 163 | H19: =IF(ISERROR(G19/F19),0,G19/F19) -> 27.166666666666668 | I19: 35 / 22 | J19: Qualified
A20: 16 | B20: David Bingham | C20: 11.0 | D20: 11.8 | E20: =D20 -> 11.8 | F20: 5 | G20: 135 | H20: =IF(ISERROR(G20/F20),0,G20/F20) -> 27.00 | I20: 33 / 23 | J20: Qualified
A21: 17 | B21: Simon Owens | C21: 15.1 | D21: 16.1 | E21: =D21 -> 16.1 | F21: 4 | G21: 98 | H21: =IF(ISERROR(G21/F21),0,G21/F21) -> 24.50 | I21: 29 / 19 | J21: Qualified
A22: 18 | B22: Roy Dickens | C22: 28.8 | D22: 29.7 | E22: =D22 -> 29.7 | F22: 3 | G22: 67 | H22: =IF(ISERROR(G22/F22),0,G22/F22) -> 22.333333333333332 | I22: 26 / 19 | J22: Qualified
A23: 19 | B23: Chris Manning | C23: 23.3 | D23: 22.6 | E23: =D23 -> 22.6 | F23: 1 | G23: 35 | H23: =IF(ISERROR(G23/F23),0,G23/F23) -> 35.00 | I23: 35 / 35
A24: 20 | B24: Alan Baldwin | C24: 22.2 | D24: 22.2 | E24: =D24 -> 22.2 | F24: 1 | G24: 34 | H24: =IF(ISERROR(G24/F24),0,G24/F24) -> 34.00 | I24: 34 / 34
A25: 21 | B25: Alan Hopkins | C25: 7.9 | D25: 8.0 | E25: =D25 -> 8 | F25: 1 | G25: 31 | H25: =IF(ISERROR(G25/F25),0,G25/F25) -> 31.00 | I25: 31 / 31
A26: 22 | B26: Michael Trimmings | C26: 19.8 | D26: 19.3 | E26: =D26 -> 19.3 | F26: 2 | G26: 55 | H26: =IF(ISERROR(G26/F26),0,G26/F26) -> 27.50 | I26: 33 / 22
A27: 23 | B27: Paul Baldwin | C27: 19.0 | D27: 19.300000000000999 | E27: =D27 -> 19.300000000000999 | F27: 2 | G27: 51 | H27: =IF(ISERROR(G27/F27),0,G27/F27) -> 25.50 | I27: 28 / 23
A28: 24 | B28: David Andrews | C28: 14.3 | D28: 14.600000000001 | E28: =D28 -> 14.600000000001 | F28: 2 | G28: 51 | H28: =IF(ISERROR(G28/F28),0,G28/F28) -> 25.50 | I28: 28 / 23
A29: 25 | B29: Andrew Baldwin | C29: 20.4 | D29: 20.9 | E29: =D29 -> 20.9 | F29: 1 | G29: 19 | H29: =IF(ISERROR(G29/F29),0,G29/F29) -> 19.00 | I29: 19 / 19
B30: Steve Tilling | C30: 16.3 | D30: 16.3 | E30: =D30 -> 16.3 | F30: 0 | G30: 0 | H30: =IF(ISERROR(G30/F30),0,G30/F30) -> 0.00 | I30: /
B31: Martin Bould | C31: 16.2 | D31: 16.2 | E31: =D31 -> 16.2 | F31: 0 | G31: 0 | H31: =IF(ISERROR(G31/F31),0,G31/F31) -> 0.00 | I31: /
B32: Malcolm Rouse | C32: 44.9 | D32: 44.9 | E32: =D32 -> 44.9 | F32: 0 | G32: 0 | H32: =IF(ISERROR(G32/F32),0,G32/F32) -> 0.00 | I32: /
B33: Clive Ferris | C33: 26.0 | D33: 26.0 | E33: =D33 -> 26 | F33: 0 | G33: 0 | H33: =IF(ISERROR(G33/F33),0,G33/F33) -> 0.00 | I33: /
B34: Andy Benson | C34: 6.1 | D34: 6.1 | E34: =D34 -> 6.1 | F34: 0 | G34: 0 | H34: =IF(ISERROR(G34/F34),0,G34/F34) -> 0.00 | I34: /