A1: Keith Mendelson
A2: Club | B2: Hoebridge
A3: Par/SS | B3: 72/70 | D3: Num. Of Fairways | I3: =IF(B2="","",18-(COUNTIF(B9:B26,3))) -> 13
A4: Date | B4: 39718 | D4: Playing Handicap | I4: 15.3
A5: Event Place | B5: 3 | C5: M | D5: Prize Money | G5: 15000
A6: Game Stats | B6: DB+ | C6: DB | D6: Bi | E6: P | F6: B | G6: E | H6: A | I6: H1
B7: 1 | C7: 3 | D7: 8 | E7: 6 | F7: 0 | G7: 0 | H7: 0 | I7: 0
A8: Hole No | B8: Par | C8: Stroke Index | D8: Gross Score | E8: Points | F8: Putts | G8: Fairways | H8: Ferrets | I8: Green Regulation
A9: 1 | B9: 5 | C9: 11 | D9: 5 | E9: 3 | F9: 2 | G9: 1 | I9: Yes
A10: 2 | B10: 3 | C10: 17 | D10: 4 | E10: 1 | F10: 3 | I10: Yes
A11: 3 | B11: 5 | C11: 7 | D11: 5 | E11: 3 | F11: 2 | I11: Yes
A12: 4 | B12: 4 | C12: 1 | D12: 4 | E12: 3 | F12: 1 | I12: Yes
A13: 5 | B13: 4 | C13: 5 | D13: 5 | E13: 2 | F13: 2 | I13: Yes
A14: 6 | B14: 3 | C14: 15 | D14: 5 | E14: 1 | F14: 2
A15: 7 | B15: 4 | C15: 3 | D15: 5 | E15: 2 | F15: 3 | G15: 1 | I15: Yes
A16: 8 | B16: 4 | C16: 9 | D16: 5 | E16: 2 | F16: 2 | I16: Yes
A17: 9 | B17: 5 | C17: 13 | D17: 7 | E17: 1 | F17: 2
A18: 10 | B18: 4 | C18: 12 | D18: 4 | E18: 3 | F18: 2 | G18: 1 | I18: Yes
A19: 11 | B19: 4 | C19: 4 | D19: 7 | E19: 0 | F19: 2 | G19: 1
A20: 12 | B20: 3 | C20: 18 | D20: 3 | E20: 2 | F20: 2 | I20: Yes
A21: 13 | B21: 5 | C21: 8 | D21: 6 | E21: 2 | F21: 3 | G21: 1 | I21: Yes
A22: 14 | B22: 4 | C22: 14 | D22: 5 | E22: 2 | F22: 2 | I22: Yes
A23: 15 | B23: 4 | C23: 2 | D23: 4 | E23: 3 | F23: 2 | G23: 1 | I23: Yes
A24: 16 | B24: 3 | C24: 10 | D24: 4 | E24: 2 | F24: 1
A25: 17 | B25: 5 | C25: 6 | D25: 7 | E25: 1 | F25: 1 | H25: 1
A26: 18 | B26: 3 | C26: 16 | D26: 4 | E26: 1 | F26: 2
A27: Totals | B27: =IF(B2="","",SUM(B9:B26)) -> 72 | D27: =IF(B2="","",SUM(D9:D26)) -> 89 | E27: =IF(B2="","",SUM(E9:E26)) -> 34 | F27: =IF(B2="","",SUM(F9:F26)) -> 36 | G27: =IF(B2="","",SUM(G9:G26)) -> 6 | H27: =IF(B2="","",SUM(H9:H26)) -> 1 | I27: =IF(COUNTIF(I9:I26,"=Yes")=0,"",COUNTIF(I9:I26,"=Yes")) -> 12