A1: Season 5 - April 2nd 2003 to 31st March 2004
A2: MGA World Tour Net Greens in Regulation
B3: Statistics updated | C3: =TODAY() -> 38078
A4: Pos | B4: Player | C4: Original Handicap | D4: Current Handicap | E4: Playing Handicap | F4: Played | G4: Total Greens Hit | H4: Green in Regulation | I4: Greens in Regulation Ratio
A5: 1 | B5: Simon Thompson | C5: 14.7 | D5: 16.0 | E5: =D5 -> 16 | F5: 26 | G5: 269 | H5: 57.48 % | I5: =IF(G5="","",IF(G5=0,"0 : "&F5*18,"1 : "&ROUND((F5*18)/G5,1))) -> 1 : 1.7
A6: 2 | B6: Paul Baldwin | C6: 18.1 | D6: 17.000000000002007 | E6: =D6 -> 17.000000000002007 | F6: 16 | G6: 165 | H6: 57.29 % | I6: =IF(G6="","",IF(G6=0,"0 : "&F6*18,"1 : "&ROUND((F6*18)/G6,1))) -> 1 : 1.7
A7: 3 | B7: Andrew Baldwin | C7: 15.2 | D7: 13.000000000001998 | E7: =D7 -> 13.000000000001998 | F7: 16 | G7: 163 | H7: 56.6 % | I7: =IF(G7="","",IF(G7=0,"0 : "&F7*18,"1 : "&ROUND((F7*18)/G7,1))) -> 1 : 1.8
A8: =A7+1 -> 4 | B8: Kevin Gallagher | C8: 9.7 | D8: 7.4000000000039927 | E8: =D8 -> 7.4000000000039927 | F8: 33 | G8: 336 | H8: 56.57 % | I8: =IF(G8="","",IF(G8=0,"0 : "&F8*18,"1 : "&ROUND((F8*18)/G8,1))) -> 1 : 1.8
A9: =A8+1 -> 5 | B9: Dave Andrews | C9: 19.0 | D9: 18.500000000003002 | E9: =D9 -> 18.500000000003002 | F9: 21 | G9: 209 | H9: 55.29 % | I9: =IF(G9="","",IF(G9=0,"0 : "&F9*18,"1 : "&ROUND((F9*18)/G9,1))) -> 1 : 1.8
A10: =A9+1 -> 6 | B10: Dave Rouse | C10: 21.5 | D10: 22.1 | E10: =D10 -> 22.1 | F10: 19 | G10: 186 | H10: 54.39 % | I10: =IF(G10="","",IF(G10=0,"0 : "&F10*18,"1 : "&ROUND((F10*18)/G10,1))) -> 1 : 1.8
A11: =A10+1 -> 7 | B11: Robert Thompson | C11: 6.2 | D11: 6.9 | E11: =D11 -> 6.9 | F11: 37 | G11: 355 | H11: 53.3 % | I11: =IF(G11="","",IF(G11=0,"0 : "&F11*18,"1 : "&ROUND((F11*18)/G11,1))) -> 1 : 1.9
A12: =A11+1 -> 8 | B12: Keith Mendelson | C12: 11.3 | D12: 11.4 | E12: =D12 -> 11.4 | F12: 35 | G12: 334 | H12: 53.02 % | I12: =IF(G12="","",IF(G12=0,"0 : "&F12*18,"1 : "&ROUND((F12*18)/G12,1))) -> 1 : 1.9
A13: =A12+1 -> 9 | B13: Jeff Gibbons | C13: 13.2 | D13: 13.30000000000299 | E13: =D13 -> 13.30000000000299 | F13: 43 | G13: 410 | H13: 52.97 % | I13: =IF(G13="","",IF(G13=0,"0 : "&F13*18,"1 : "&ROUND((F13*18)/G13,1))) -> 1 : 1.9
A14: =A13+1 -> 10 | B14: Paul Carter | C14: 11.4 | D14: 11.800000000000997 | E14: =D14 -> 11.800000000000997 | F14: 10 | G14: 95 | H14: 52.78 % | I14: =IF(G14="","",IF(G14=0,"0 : "&F14*18,"1 : "&ROUND((F14*18)/G14,1))) -> 1 : 1.9
A15: =A14+1 -> 11 | B15: Danny Marsh | C15: 10.0 | D15: 7.1000000000009962 | E15: =D15 -> 7.1000000000009962 | F15: 22 | G15: 205 | H15: 51.77 % | I15: =IF(G15="","",IF(G15=0,"0 : "&F15*18,"1 : "&ROUND((F15*18)/G15,1))) -> 1 : 1.9
A16: =A15+1 -> 12 | B16: Martin Bould | C16: 20.5 | D16: 17.7 | E16: =D16 -> 17.7 | F16: 15 | G16: 139 | H16: 51.48 % | I16: =IF(G16="","",IF(G16=0,"0 : "&F16*18,"1 : "&ROUND((F16*18)/G16,1))) -> 1 : 1.9
A17: =A16+1 -> 13 | B17: Ian Edwards | C17: 13.0 | D17: 14.6 | E17: =D17 -> 14.6 | F17: 23 | G17: 213 | H17: 51.45 % | I17: =IF(G17="","",IF(G17=0,"0 : "&F17*18,"1 : "&ROUND((F17*18)/G17,1))) -> 1 : 1.9
A18: =A17+1 -> 14 | B18: Martin Cox | C18: 13.6 | D18: 11.0 | E18: =D18 -> 11 | F18: 20 | G18: 185 | H18: 51.39 % | I18: =IF(G18="","",IF(G18=0,"0 : "&F18*18,"1 : "&ROUND((F18*18)/G18,1))) -> 1 : 1.9
A19: =A18+1 -> 15 | B19: Jeff Colbrook | C19: 16.7 | D19: 17.2 | E19: =D19 -> 17.2 | F19: 13 | G19: 118 | H19: 50.43 % | I19: =IF(G19="","",IF(G19=0,"0 : "&F19*18,"1 : "&ROUND((F19*18)/G19,1))) -> 1 : 2
A20: =A19+1 -> 16 | B20: Alan Baldwin | C20: 22.0 | D20: 19.4 | E20: =D20 -> 19.4 | F20: 12 | G20: 106 | H20: 49.07 % | I20: =IF(G20="","",IF(G20=0,"0 : "&F20*18,"1 : "&ROUND((F20*18)/G20,1))) -> 1 : 2
A21: =A20+1 -> 17 | B21: John Press | C21: 15.4 | D21: 14.2 | E21: =D21 -> 14.2 | F21: 4 | G21: 45 | H21: 62.5 % | I21: =IF(G21="","",IF(G21=0,"0 : "&F21*18,"1 : "&ROUND((F21*18)/G21,1))) -> 1 : 1.6
A22: =A21+1 -> 18 | B22: Roy Dickens | C22: 28.3 | D22: 28.5 | E22: =D22 -> 28.5 | F22: 3 | G22: 33 | H22: 61.11 % | I22: =IF(G22="","",IF(G22=0,"0 : "&F22*18,"1 : "&ROUND((F22*18)/G22,1))) -> 1 : 1.6
A23: =A22+1 -> 19 | B23: Simon Owens | C23: 16.0 | D23: 16.100000000001 | E23: =D23 -> 16.100000000001 | F23: 1 | G23: 11 | H23: 61.11 % | I23: =IF(G23="","",IF(G23=0,"0 : "&F23*18,"1 : "&ROUND((F23*18)/G23,1))) -> 1 : 1.6
A24: =A23+1 -> 20 | B24: Jon Dey | C24: 35.4 | D24: 35.5 | E24: =D24 -> 35.5 | F24: 4 | G24: 43 | H24: 59.72 % | I24: =IF(G24="","",IF(G24=0,"0 : "&F24*18,"1 : "&ROUND((F24*18)/G24,1))) -> 1 : 1.7
A25: =A24+1 -> 21 | B25: Michael Trimmings | C25: 22.6 | D25: 22.6 | E25: =D25 -> 22.6 | F25: 4 | G25: 41 | H25: 56.94 % | I25: =IF(G25="","",IF(G25=0,"0 : "&F25*18,"1 : "&ROUND((F25*18)/G25,1))) -> 1 : 1.8
A26: =A25+1 -> 22 | B26: Alan Hopkins | C26: 7.2 | D26: 7.2 | E26: =D26 -> 7.2 | F26: 3 | G26: 30 | H26: 55.56 % | I26: =IF(G26="","",IF(G26=0,"0 : "&F26*18,"1 : "&ROUND((F26*18)/G26,1))) -> 1 : 1.8
A27: =A26+1 -> 23 | B27: Keith Johns | C27: 25.1 | D27: 24.3 | E27: =D27 -> 24.3 | F27: 2 | G27: 20 | H27: 55.56 % | I27: =IF(G27="","",IF(G27=0,"0 : "&F27*18,"1 : "&ROUND((F27*18)/G27,1))) -> 1 : 1.8
A28: =A27+1 -> 24 | B28: Chris Manning | C28: 22.0 | D28: 22.5 | E28: =D28 -> 22.5 | F28: 3 | G28: 27 | H28: 50 % | I28: =IF(G28="","",IF(G28=0,"0 : "&F28*18,"1 : "&ROUND((F28*18)/G28,1))) -> 1 : 2
A29: =A28+1 -> 25 | B29: Andy Benson | C29: 7.5 | D29: 7.6000000000009997 | E29: =D29 -> 7.6000000000009997 | F29: 2 | G29: 18 | H29: 50 % | I29: =IF(G29="","",IF(G29=0,"0 : "&F29*18,"1 : "&ROUND((F29*18)/G29,1))) -> 1 : 2
A30: =A29+1 -> 26 | B30: Clive Ferris | C30: 25.7 | D30: 26.6 | E30: =D30 -> 26.6 | F30: 3 | G30: 25 | H30: 46.3 % | I30: =IF(G30="","",IF(G30=0,"0 : "&F30*18,"1 : "&ROUND((F30*18)/G30,1))) -> 1 : 2.2
A31: =A30+1 -> 27 | B31: Steve Tilling | C31: 16.5 | D31: 15.9 | E31: =D31 -> 15.9 | F31: 1 | G31: 269 | H31: 33.33 % | I31: =IF(G31="","",IF(G31=0,"0 : "&F31*18,"1 : "&ROUND((F31*18)/G31,1))) -> 1 : 0.1
A32: =A31+1 -> 28 | B32: Malcolm Rouse | C32: 41.9 | D32: 42.9 | E32: =D32 -> 42.9 | F32: 1 | G32: 4 | H32: 22.22 % | I32: =IF(G32="","",IF(G32=0,"0 : "&F32*18,"1 : "&ROUND((F32*18)/G32,1))) -> 1 : 4.5
A33: =A32+1 -> 29 | B33: Neil Leah | C33: 15.0 | D33: 15.0 | E33: =D33 -> 15 | F33: 0 | G33: 0 | H33: 0.00 | I33: =IF(G33="","",IF(G33=0,"0 : "&F33*18,"1 : "&ROUND((F33*18)/G33,1))) -> 0 : 0
A34: =A33+1 -> 30 | B34: Mike Edmond | C34: 36.5 | D34: 36.5 | E34: =D34 -> 36.5 | F34: 0 | G34: 0 | H34: 0.00 | I34: =IF(G34="","",IF(G34=0,"0 : "&F34*18,"1 : "&ROUND((F34*18)/G34,1))) -> 0 : 0
A35: =A34+1 -> 31 | B35: Dave Archer | C35: 22.0 | D35: 22.0 | E35: =D35 -> 22 | F35: 0 | G35: 0 | H35: 0.00 | I35: =IF(G35="","",IF(G35=0,"0 : "&F35*18,"1 : "&ROUND((F35*18)/G35,1))) -> 0 : 0
A36: =A35+1 -> 32 | B36: Andrew Knight | C36: 21.4 | D36: 21.4 | E36: =D36 -> 21.4 | F36: 0 | G36: 0 | H36: 0.00 | I36: =IF(G36="","",IF(G36=0,"0 : "&F36*18,"1 : "&ROUND((F36*18)/G36,1))) -> 0 : 0