A1: Season 5 - April 2nd 2003 to 31st March 2004
A2: MGA World Tour Money List
B3: Statistics updated | C3: =TODAY() -> 38079
A4: Pos | B4: Player | C4: Original Handicap | D4: Current Handicap | E4: Playing Handicap | F4: Events Played | G4: Tour Victories | H4: Winnings
A5: 1 | B5: Robert Thompson | C5: 6.2 | D5: 6.9 | E5: =D5 -> 6.9 | F5: 37 | G5: 14 | H5: 290250
A6: =A5+1 -> 2 | B6: Kevin Gallagher | C6: 9.7 | D6: 7.4000000000039927 | E6: =D6 -> 7.4000000000039927 | F6: 33 | G6: 11 | H6: 279500
A7: =A6+1 -> 3 | B7: Martin Cox | C7: 13.6 | D7: 11.0 | E7: =D7 -> 11 | F7: 20 | G7: 6 | H7: 237500
A8: =A7+1 -> 4 | B8: Dave Rouse | C8: 21.5 | D8: 22.1 | E8: =D8 -> 22.1 | F8: 19 | G8: 4 | H8: 213750
A9: =A8+1 -> 5 | B9: Simon Thompson | C9: 14.7 | D9: 16.0 | E9: =D9 -> 16 | F9: 26 | G9: 7 | H9: 211250 | I9: (£30k from DAB)
A10: =A9+1 -> 6 | B10: Paul Baldwin | C10: 18.1 | D10: 17.000000000002007 | E10: =D10 -> 17.000000000002007 | F10: 16 | G10: 3 | H10: 207500
A11: =A10+1 -> 7 | B11: Jeff Gibbons | C11: 13.2 | D11: 13.30000000000299 | E11: =D11 -> 13.30000000000299 | F11: 43 | G11: 13 | H11: 205000
A12: =A11+1 -> 8 | B12: Keith Mendelson | C12: 11.3 | D12: 11.4 | E12: =D12 -> 11.4 | F12: 35 | G12: 13 | H12: 205000
A13: =A12+1 -> 9 | B13: Martin Bould | C13: 20.5 | D13: 17.7 | E13: =D13 -> 17.7 | F13: 15 | G13: 4 | H13: 192500
A14: =A13+1 -> 10 | B14: Danny Marsh | C14: 10.0 | D14: 7.1000000000009962 | E14: =D14 -> 7.1000000000009962 | F14: 22 | G14: 13 | H14: 152500
A15: =A14+1 -> 11 | B15: Dave Andrews | C15: 19.0 | D15: 18.500000000003002 | E15: =D15 -> 18.500000000003002 | F15: 21 | G15: 5 | H15: 149500
A16: =A15+1 -> 12 | B16: Jeff Colbrook | C16: 16.7 | D16: 17.2 | E16: =D16 -> 17.2 | F16: 13 | G16: 2 | H16: 145000
A17: =A16+1 -> 13 | B17: Ian Edwards | C17: 13.0 | D17: 14.6 | E17: =D17 -> 14.6 | F17: 23 | G17: 7 | H17: 122500
A18: =A17+1 -> 14 | B18: Paul Carter | C18: 11.4 | D18: 11.800000000000997 | E18: =D18 -> 11.800000000000997 | F18: 10 | G18: 0 | H18: 108750
A19: =A18+1 -> 15 | B19: John Press | C19: 15.4 | D19: 14.2 | E19: =D19 -> 14.2 | F19: 4 | G19: 0 | H19: 91250
A20: =A19+1 -> 16 | B20: Alan Baldwin | C20: 22.0 | D20: 19.4 | E20: =D20 -> 19.4 | F20: 12 | G20: 4 | H20: 86250
A21: =A20+1 -> 17 | B21: Andrew Baldwin | C21: 15.2 | D21: 13.000000000001998 | E21: =D21 -> 13.000000000001998 | F21: 16 | G21: 3 | H21: 83750
A22: =A21+1 -> 18 | B22: Keith Johns | C22: 25.1 | D22: 24.3 | E22: =D22 -> 24.3 | F22: 2 | G22: 1 | H22: 70000
A23: =A22+1 -> 19 | B23: Jon Dey | C23: 35.4 | D23: 35.5 | E23: =D23 -> 35.5 | F23: 4 | G23: 2 | H23: 52500
A24: =A23+1 -> 20 | B24: Alan Hopkins | C24: 7.2 | D24: 7.2 | E24: =D24 -> 7.2 | F24: 3 | G24: 0 | H24: 51250
A25: =A24+1 -> 21 | B25: Chris Manning | C25: 22.0 | D25: 22.5 | E25: =D25 -> 22.5 | F25: 3 | G25: 0 | H25: 33750
A26: =A25+1 -> 22 | B26: Clive Ferris | C26: 25.7 | D26: 26.6 | E26: =D26 -> 26.6 | F26: 3 | G26: 1 | H26: 32500
A27: =A26+1 -> 23 | B27: Michael Trimmings | C27: 22.6 | D27: 22.6 | E27: =D27 -> 22.6 | F27: 4 | G27: 1 | H27: 27500
A28: =A27+1 -> 24 | B28: Andy Benson | C28: 7.5 | D28: 7.6000000000009997 | E28: =D28 -> 7.6000000000009997 | F28: 2 | G28: 1 | H28: 27500
A29: =A28+1 -> 25 | B29: Steve Tilling | C29: 16.5 | D29: 15.9 | E29: =D29 -> 15.9 | F29: 1 | G29: 0 | H29: 20000
A30: =A29+1 -> 26 | B30: Roy Dickens | C30: 28.3 | D30: 28.5 | E30: =D30 -> 28.5 | F30: 3 | G30: 1 | H30: 17500
A31: =A30+1 -> 27 | B31: Simon Owens | C31: 16.0 | D31: 16.100000000001 | E31: =D31 -> 16.100000000001 | F31: 1 | G31: 0 | H31: 5000
A32: =A31+1 -> 28 | B32: Malcolm Rouse | C32: 41.9 | D32: 42.9 | E32: =D32 -> 42.9 | F32: 1 | G32: 0 | H32: 3750
A33: =A32+1 -> 29 | B33: Neil Leah | C33: 15.0 | D33: 15.0 | E33: =D33 -> 15 | F33: 0 | G33: 0 | H33: 0
A34: =A33+1 -> 30 | B34: Mike Edmond | C34: 36.5 | D34: 36.5 | E34: =D34 -> 36.5 | F34: 0 | G34: 0 | H34: 0
A35: =A34+1 -> 31 | B35: Dave Archer | C35: 22.0 | D35: 22.0 | E35: =D35 -> 22 | F35: 0 | G35: 0 | H35: 0
A36: =A35+1 -> 32 | B36: Andrew Knight | C36: 21.4 | D36: 21.4 | E36: =D36 -> 21.4 | F36: 0 | G36: 0 | H36: 0