A1: Season 5 - April 2nd 2003 to 31st March 2004
A2: MGA World Tour Putting Statistics
B3: Statistics updated | C3: =TODAY() -> 38078
A4: Pos | B4: Player | C4: Original Handicap | D4: Current Handicap | E4: Playing Handicap | F4: Played | G4: Total Putts | H4: Ave per Round | I4: Ave Per Hole | J4: Best Round | K4: Worst Round
A5: 1 | B5: Jeff Gibbons | C5: 13.2 | D5: 13.30000000000299 | E5: =D5 -> 13.30000000000299 | F5: 43 | G5: 1355 | H5: 31.511627906976745 | I5: =IF(G5=0,"",G5/(F5*18)) -> 1.7506459948320414 | J5: 24 | K5: 39
A6: =A5+1 -> 2 | B6: Keith Mendelson | C6: 11.3 | D6: 11.4 | E6: =D6 -> 11.4 | F6: 35 | G6: 1113 | H6: 31.80 | I6: =IF(G6=0,"",G6/(F6*18)) -> 1.7666666666666666 | J6: 26 | K6: 39
A7: =A6+1 -> 3 | B7: Kevin Gallagher | C7: 9.7 | D7: 7.4000000000039927 | E7: =D7 -> 7.4000000000039927 | F7: 33 | G7: 1050 | H7: 31.818181818181817 | I7: =IF(G7=0,"",G7/(F7*18)) -> 1.7676767676767677 | J7: 26 | K7: 38
A8: =A7+1 -> 4 | B8: Dave Andrews | C8: 19.0 | D8: 18.500000000003002 | E8: =D8 -> 18.500000000003002 | F8: 21 | G8: 677 | H8: 32.238095238095241 | I8: =IF(G8=0,"",G8/(F8*18)) -> 1.7910052910052909 | J8: 28 | K8: 39
A9: =A8+1 -> 5 | B9: Danny Marsh | C9: 10.0 | D9: 7.1000000000009962 | E9: =D9 -> 7.1000000000009962 | F9: 22 | G9: 717 | H9: 32.590909090909093 | I9: =IF(G9=0,"",G9/(F9*18)) -> 1.8106060606060606 | J9: 29 | K9: 41
A10: =A9+1 -> 6 | B10: Martin Cox | C10: 13.6 | D10: 11.0 | E10: =D10 -> 11 | F10: 20 | G10: 653 | H10: 32.65 | I10: =IF(G10=0,"",G10/(F10*18)) -> 1.8138888888888889 | J10: 29 | K10: 37
A11: =A10+1 -> 7 | B11: Robert Thompson | C11: 6.2 | D11: 6.9 | E11: =D11 -> 6.9 | F11: 37 | G11: 1210 | H11: 32.702702702702702 | I11: =IF(G11=0,"",G11/(F11*18)) -> 1.8168168168168168 | J11: 28 | K11: 37
A12: =A11+1 -> 8 | B12: Simon Thompson | C12: 14.7 | D12: 16.0 | E12: =D12 -> 16 | F12: 26 | G12: 879 | H12: 33.807692307692307 | I12: =IF(G12=0,"",G12/(F12*18)) -> 1.8782051282051282 | J12: 29 | K12: 38
A13: =A12+1 -> 9 | B13: Paul Baldwin | C13: 18.1 | D13: 17.000000000002007 | E13: =D13 -> 17.000000000002007 | F13: 16 | G13: 541 | H13: 33.8125 | I13: =IF(G13=0,"",G13/(F13*18)) -> 1.8784722222222223 | J13: 28 | K13: 38
A14: =A13+1 -> 10 | B14: Martin Bould | C14: 20.5 | D14: 17.7 | E14: =D14 -> 17.7 | F14: 15 | G14: 513 | H14: 34.20 | I14: =IF(G14=0,"",G14/(F14*18)) -> 1.90 | J14: 31 | K14: 38
A15: =A14+1 -> 11 | B15: Ian Edwards | C15: 13.0 | D15: 14.6 | E15: =D15 -> 14.6 | F15: 23 | G15: 790 | H15: 34.347826086956523 | I15: =IF(G15=0,"",G15/(F15*18)) -> 1.9082125603864735 | J15: 29 | K15: 40
A16: =A15+1 -> 12 | B16: Paul Carter | C16: 11.4 | D16: 11.800000000000997 | E16: =D16 -> 11.800000000000997 | F16: 10 | G16: 346 | H16: 34.60 | I16: =IF(G16=0,"",G16/(F16*18)) -> 1.9222222222222223 | J16: 32 | K16: 38
A17: =A16+1 -> 13 | B17: Andrew Baldwin | C17: 15.2 | D17: 13.000000000001998 | E17: =D17 -> 13.000000000001998 | F17: 16 | G17: 557 | H17: 34.8125 | I17: =IF(G17=0,"",G17/(F17*18)) -> 1.9340277777777777 | J17: 29 | K17: 42
A18: =A17+1 -> 14 | B18: Alan Baldwin | C18: 22.0 | D18: 19.4 | E18: =D18 -> 19.4 | F18: 12 | G18: 419 | H18: 34.916666666666664 | I18: =IF(G18=0,"",G18/(F18*18)) -> 1.9398148148148149 | J18: 28 | K18: 41
A19: =A18+1 -> 15 | B19: Jeff Colbrook | C19: 16.7 | D19: 17.2 | E19: =D19 -> 17.2 | F19: 13 | G19: 456 | H19: 35.07692307692308 | I19: =IF(G19=0,"",G19/(F19*18)) -> 1.9487179487179487 | J19: 31 | K19: 40
A20: =A19+1 -> 16 | B20: Dave Rouse | C20: 21.5 | D20: 22.1 | E20: =D20 -> 22.1 | F20: 19 | G20: 674 | H20: 35.473684210526315 | I20: =IF(G20=0,"",G20/(F20*18)) -> 1.9707602339181287 | J20: 30 | K20: 41
A21: =A20+1 -> 17 | B21: Steve Tilling | C21: 16.5 | D21: 15.9 | E21: =D21 -> 15.9 | F21: 1 | G21: 30 | H21: 30.00 | I21: =IF(G21=0,"",G21/(F21*18)) -> 1.6666666666666667 | J21: 30 | K21: 30
A22: =A21+1 -> 18 | B22: John Press | C22: 15.4 | D22: 14.2 | E22: =D22 -> 14.2 | F22: 4 | G22: 134 | H22: 33.50 | I22: =IF(G22=0,"",G22/(F22*18)) -> 1.8611111111111112 | J22: 31 | K22: 39
A23: =A22+1 -> 19 | B23: Andy Benson | C23: 7.5 | D23: 7.6000000000009997 | E23: =D23 -> 7.6000000000009997 | F23: 2 | G23: 67 | H23: 33.50 | I23: =IF(G23=0,"",G23/(F23*18)) -> 1.8611111111111112 | J23: 32 | K23: 35
A24: =A23+1 -> 20 | B24: Chris Manning | C24: 22.0 | D24: 22.5 | E24: =D24 -> 22.5 | F24: 3 | G24: 106 | H24: 35.333333333333336 | I24: =IF(G24=0,"",G24/(F24*18)) -> 1.962962962962963 | J24: 26 | K24: 43
A25: =A24+1 -> 21 | B25: Alan Hopkins | C25: 7.2 | D25: 7.2 | E25: =D25 -> 7.2 | F25: 3 | G25: 107 | H25: 35.666666666666664 | I25: =IF(G25=0,"",G25/(F25*18)) -> 1.9814814814814814 | J25: 31 | K25: 41
A26: =A25+1 -> 22 | B26: Roy Dickens | C26: 28.3 | D26: 28.5 | E26: =D26 -> 28.5 | F26: 3 | G26: 108 | H26: 36.00 | I26: =IF(G26=0,"",G26/(F26*18)) -> 2.00 | J26: 32 | K26: 38
A27: =A26+1 -> 23 | B27: Keith Johns | C27: 16.0 | D27: 16.100000000001 | E27: =D27 -> 16.100000000001 | F27: 1 | G27: 36 | H27: 36.00 | I27: =IF(G27=0,"",G27/(F27*18)) -> 2.00 | J27: 36 | K27: 36
A28: =A27+1 -> 24 | B28: Simon Owens | C28: 16.0 | D28: 16.100000000001 | E28: =D28 -> 16.100000000001 | F28: 1 | G28: 36 | H28: 36.00 | I28: =IF(G28=0,"",G28/(F28*18)) -> 2.00 | J28: 36 | K28: 36
A29: =A28+1 -> 25 | B29: Michael Trimmings | C29: 22.6 | D29: 22.6 | E29: =D29 -> 22.6 | F29: 4 | G29: 146 | H29: 36.50 | I29: =IF(G29=0,"",G29/(F29*18)) -> 2.0277777777777777 | J29: 35 | K29: 37
A30: =A29+1 -> 26 | B30: Clive Ferris | C30: 25.7 | D30: 26.6 | E30: =D30 -> 26.6 | F30: 3 | G30: 111 | H30: 37.00 | I30: =IF(G30=0,"",G30/(F30*18)) -> 2.0555555555555554 | J30: 34 | K30: 42
A31: =A30+1 -> 27 | B31: Jon Dey | C31: 35.4 | D31: 35.5 | E31: =D31 -> 35.5 | F31: 4 | G31: 153 | H31: 38.25 | I31: =IF(G31=0,"",G31/(F31*18)) -> 2.125 | J31: 36 | K31: 41
A32: =A31+1 -> 28 | B32: Malcolm Rouse | C32: 41.9 | D32: 42.9 | E32: =D32 -> 42.9 | F32: 1 | G32: 45 | H32: 45.00 | I32: =IF(G32=0,"",G32/(F32*18)) -> 2.50 | J32: 45 | K32: 45
A33: =A32+1 -> 29 | B33: Neil Leah | C33: 15.0 | D33: 15.0 | E33: =D33 -> 15 | F33: 0 | G33: 0 | H33: 0.00 | I33: =IF(G33=0,"",G33/(F33*18)) ->  | J33: 0 | K33: 0
A34: =A33+1 -> 30 | B34: Mike Edmond | C34: 36.5 | D34: 36.5 | E34: =D34 -> 36.5 | F34: 0 | G34: 0 | H34: 0.00 | I34: =IF(G34=0,"",G34/(F34*18)) ->  | J34: 0 | K34: 0
A35: =A34+1 -> 31 | B35: Dave Archer | C35: 22.0 | D35: 22.0 | E35: =D35 -> 22 | F35: 0 | G35: 0 | H35: 0.00 | I35: =IF(G35=0,"",G35/(F35*18)) ->  | J35: 0 | K35: 0
A36: =A35+1 -> 32 | B36: Andrew Knight | C36: 36.5 | D36: 36.5 | E36: =D36 -> 36.5 | F36: 0 | G36: 0 | H36: 0.00 | I36: =IF(G36=0,"",G36/(F36*18)) ->  | J36: 0 | K36: 0