A1: Alan Hopkins
A2: Club | B2: Chelsfield Lakes
A3: Par/SS | B3: 71/68 | D3: Num. Of Fairways | I3: =IF(B2="","",18-(COUNTIF(B9:B26,3))) -> 14
A4: Date | B4: 38675 | D4: Playing Handicap | I4: 7.7000000000019986
A5: Event Place | B5: 9 | C5: M | D5: Prize Money | G5: 17500
A6: Game Stats | B6: DB+ | C6: DB | D6: Bi | E6: P | F6: B | G6: E | H6: A | I6: H1
B7: 1 | C7: 2 | D7: 8 | E7: 5 | F7: 2 | G7: 0 | H7: 0 | I7: 0
A8: Hole No | B8: Par | C8: Stroke Index | D8: Gross Score | E8: Points | F8: Putts | G8: Fairways | H8: Ferrets | I8: Green Regulation
A9: 1 | B9: 4 | C9: 11 | D9: 5 | E9: 1 | F9: 2
A10: 2 | B10: 3 | C10: 3 | D10: 5 | E10: 1 | F10: 2
A11: 3 | B11: 4 | C11: 13 | D11: 5 | E11: 1 | F11: 1 | H11: 1
A12: 4 | B12: 4 | C12: 1 | D12: 5 | E12: 2 | F12: 3 | I12: Yes
A13: 5 | B13: 3 | C13: 7 | D13: 6 | E13: 0 | F13: 3
A14: 6 | B14: 5 | C14: 15 | D14: 5 | E14: 2 | F14: 2 | I14: Yes
A15: 7 | B15: 5 | C15: 5 | D15: 5 | E15: 3 | F15: 2 | I15: Yes
A16: 8 | B16: 4 | C16: 17 | D16: 5 | E16: 1 | F16: 2 | G16: 1
A17: 9 | B17: 4 | C17: 9 | D17: 3 | E17: 3 | F17: 1 | G17: 1 | I17: Yes
A18: 10 | B18: 4 | C18: 6 | D18: 5 | E18: 2 | F18: 1
A19: 11 | B19: 4 | C19: 18 | D19: 5 | E19: 1 | F19: 1 | H19: 1
A20: 12 | B20: 4 | C20: 8 | D20: 5 | E20: 2 | F20: 2 | I20: Yes
A21: 13 | B21: 5 | C21: 2 | D21: 4 | E21: 4 | F21: 1 | I21: Yes
A22: 14 | B22: 4 | C22: 16 | D22: 4 | E22: 2 | F22: 2 | G22: 1 | I22: Yes
A23: 15 | B23: 3 | C23: 12 | D23: 3 | E23: 2 | F23: 1
A24: 16 | B24: 4 | C24: 4 | D24: 4 | E24: 3 | F24: 2 | G24: 1 | I24: Yes
A25: 17 | B25: 3 | C25: 14 | D25: 4 | E25: 1 | F25: 2
A26: 18 | B26: 4 | C26: 10 | D26: 6 | E26: 0 | F26: 2 | H26: 1
A27: Totals | B27: =IF(B2="","",SUM(B9:B26)) -> 71 | D27: =IF(B2="","",SUM(D9:D26)) -> 84 | E27: =IF(B2="","",SUM(E9:E26)) -> 31 | F27: =IF(B2="","",SUM(F9:F26)) -> 32 | G27: =IF(B2="","",SUM(G9:G26)) -> 4 | H27: =IF(B2="","",SUM(H9:H26)) -> 3 | I27: =IF(COUNTIF(I9:I26,"=Yes")=0,"",COUNTIF(I9:I26,"=Yes")) -> 8