A1: Paul Carter
A2: Club | B2: Chelsfield Lakes
A3: Par/SS | B3: 71/68 | D3: Num. Of Fairways | I3: =IF(B2="","",18-(COUNTIF(B9:B26,3))) -> 14
A4: Date | B4: 38675 | D4: Playing Handicap | I4: 13
A5: Event Place | B5: 15 | C5: M | D5: Prize Money | G5: 2500
A6: Game Stats | B6: DB+ | C6: DB | D6: Bi | E6: P | F6: B | G6: E | H6: A | I6: H1
B7: 3 | C7: 6 | D7: 6 | E7: 3 | F7: 0 | G7: 0 | H7: 0 | I7: 0
A8: Hole No | B8: Par | C8: Stroke Index | D8: Gross Score | E8: Points | F8: Putts | G8: Fairways | H8: Ferrets | I8: Green Regulation
A9: 1 | B9: 4 | C9: 11 | D9: 4 | E9: 3 | F9: 0 | G9: 1
A10: 2 | B10: 3 | C10: 3 | D10: 5 | E10: 1 | F10: 2
A11: 3 | B11: 4 | C11: 13 | D11: 4 | E11: 3 | F11: 1 | G11: 1 | I11: Yes
A12: 4 | B12: 4 | C12: 1 | D12: 8 | E12: 0 | F12: 2
A13: 5 | B13: 3 | C13: 7 | D13: 5 | E13: 1 | F13: 2
A14: 6 | B14: 5 | C14: 15 | D14: 7 | E14: 0 | F14: 2
A15: 7 | B15: 5 | C15: 5 | D15: 8 | E15: 0 | F15: 3
A16: 8 | B16: 4 | C16: 17 | D16: 4 | E16: 2 | F16: 1 | G16: 1
A17: 9 | B17: 4 | C17: 9 | D17: 6 | E17: 1 | F17: 2 | G17: 1
A18: 10 | B18: 4 | C18: 6 | D18: 5 | E18: 2 | F18: 3 | G18: 1 | I18: Yes
A19: 11 | B19: 4 | C19: 18 | D19: 5 | E19: 1 | F19: 3 | I19: Yes
A20: 12 | B20: 4 | C20: 8 | D20: 5 | E20: 2 | F20: 3 | I20: Yes
A21: 13 | B21: 5 | C21: 2 | D21: 10 | E21: 0 | F21: 3 | H21: 2
A22: 14 | B22: 4 | C22: 16 | D22: 5 | E22: 1 | F22: 1
A23: 15 | B23: 3 | C23: 12 | D23: 5 | E23: 1 | F23: 3 | I23: Yes
A24: 16 | B24: 4 | C24: 4 | D24: 5 | E24: 2 | F24: 2 | I24: Yes
A25: 17 | B25: 3 | C25: 14 | D25: 4 | E25: 1 | F25: 3 | I25: Yes
A26: 18 | B26: 4 | C26: 10 | D26: 6 | E26: 1 | F26: 2
A27: Totals | B27: =IF(B2="","",SUM(B9:B26)) -> 71 | D27: =IF(B2="","",SUM(D9:D26)) -> 101 | E27: =IF(B2="","",SUM(E9:E26)) -> 22 | F27: =IF(B2="","",SUM(F9:F26)) -> 38 | G27: =IF(B2="","",SUM(G9:G26)) -> 5 | H27: =IF(B2="","",SUM(H9:H26)) -> 2 | I27: =IF(COUNTIF(I9:I26,"=Yes")=0,"",COUNTIF(I9:I26,"=Yes")) -> 7