A1: Roy Dickens
A2: Club | B2: Chelsfield Lakes
A3: Par/SS | B3: 71/68 | D3: Num. Of Fairways | I3: =IF(B2="","",18-(COUNTIF(B9:B26,3))) -> 14
A4: Date | B4: 38675 | D4: Playing Handicap | I4: 30
A5: Event Place | B5: 2 | C5: M | D5: Prize Money | G5: 35000
A6: Game Stats | B6: DB+ | C6: DB | D6: BI | E6: P | F6: B | G6: E | H6: A | I6: H1
B7: 1 | C7: 5 | D7: 9 | E7: 3 | F7: 0 | G7: 0 | H7: 0 | I7: 0
A8: Hole No | B8: Par | C8: Stroke Index | D8: Gross Score | E8: Points | F8: Putts | G8: Fairways | H8: Ferrets | I8: Green Regulation
A9: 1 | B9: 4 | C9: 11 | D9: 4 | E9: 4 | F9: 1 | I9: Yes
A10: 2 | B10: 3 | C10: 3 | D10: 6 | E10: 1 | F10: 3 | I10: Yes
A11: 3 | B11: 4 | C11: 13 | D11: 6 | E11: 1 | F11: 2
A12: 4 | B12: 4 | C12: 1 | D12: 5 | E12: 3 | F12: 3 | G12: 1 | I12: Yes
A13: 5 | B13: 3 | C13: 7 | D13: 4 | E13: 3 | F13: 3 | I13: Yes
A14: 6 | B14: 5 | C14: 15 | D14: 6 | E14: 2 | F14: 2 | G14: 1 | I14: Yes
A15: 7 | B15: 5 | C15: 5 | D15: 6 | E15: 3 | F15: 2 | I15: Yes
A16: 8 | B16: 4 | C16: 17 | D16: 5 | E16: 2 | F16: 1
A17: 9 | B17: 4 | C17: 9 | D17: 4 | E17: 4 | F17: 1 | G17: 1 | I17: Yes
A18: 10 | B18: 4 | C18: 6 | D18: 6 | E18: 2 | F18: 3 | G18: 1 | I18: Yes
A19: 11 | B19: 4 | C19: 18 | D19: 5 | E19: 2 | F19: 2 | G19: 1 | I19: Yes
A20: 12 | B20: 4 | C20: 8 | D20: 4 | E20: 4 | F20: 1 | I20: Yes
A21: 13 | B21: 5 | C21: 2 | D21: 7 | E21: 2 | F21: 2 | G21: 1 | I21: Yes
A22: 14 | B22: 4 | C22: 16 | D22: 5 | E22: 2 | F22: 1
A23: 15 | B23: 3 | C23: 12 | D23: 4 | E23: 3 | F23: 2 | I23: Yes
A24: 16 | B24: 4 | C24: 4 | D24: 6 | E24: 2 | F24: 2 | G24: 1 | I24: Yes
A25: 17 | B25: 3 | C25: 14 | D25: 4 | E25: 2 | F25: 2 | I25: Yes
A26: 18 | B26: 4 | C26: 10 | D26: 6 | E26: 2 | F26: 2 | I26: Yes
A27: Totals | B27: =IF(B2="","",SUM(B9:B26)) -> 71 | D27: =IF(B2="","",SUM(D9:D26)) -> 93 | E27: =IF(B2="","",SUM(E9:E26)) -> 44 | F27: =IF(B2="","",SUM(F9:F26)) -> 35 | G27: =IF(B2="","",SUM(G9:G26)) -> 7 | H27: =IF(B2="","",SUM(H9:H26)) -> 0 | I27: =IF(COUNTIF(I9:I26,"=Yes")=0,"",COUNTIF(I9:I26,"=Yes")) -> 15