A1: Jeff Colbrook
A2: Club | B2: Hoebridge
A3: Par/SS | B3: 71/70 | D3: Num. Of Fairways | I3: =IF(B2="","",18-(COUNTIF(B9:B26,3))) -> 13
A4: Date | B4: 38570 | D4: Playing Handicap | I4: 16.7
A5: Event Place | B5: 2 | D5: Prize Money | G5: 7500
A6: Game Stats | B6: DB+ | C6: DB | D6: Bi | E6: P | F6: B | G6: E | H6: A | I6: H1
B7: 4 | C7: 3 | D7: 4 | E7: 6 | F7: 1 | G7: 0 | H7: 0 | I7: 0
A8: Hole No | B8: Par | C8: Stroke Index | D8: Gross Score | E8: Points | F8: Putts | G8: Fairways | H8: Ferrets | I8: Green Regulation
A9: 1 | B9: 5 | C9: 11 | D9: 4 | E9: 4 | F9: 1 | I9: Yes
A10: 2 | B10: 3 | C10: 17 | D10: 8 | E10: 0 | F10: 3
A11: 3 | B11: 5 | C11: 7 | D11: 6 | E11: 2 | F11: 2 | G11: 1 | I11: Yes
A12: 4 | B12: 4 | C12: 1 | D12: 4 | E12: 3 | F12: 2 | I12: Yes
A13: 5 | B13: 4 | C13: 5 | D13: 5 | E13: 2 | F13: 2 | I13: Yes
A14: 6 | B14: 3 | C14: 15 | D14: 4 | E14: 2 | F14: 2 | I14: Yes
A15: 7 | B15: 4 | C15: 3 | D15: 4 | E15: 3 | F15: 2 | I15: Yes
A16: 8 | B16: 4 | C16: 9 | D16: 6 | E16: 1 | F16: 2 | H16: 1
A17: 9 | B17: 5 | C17: 13 | D17: 5 | E17: 3 | F17: 1 | I17: Yes
A18: 10 | B18: 4 | C18: 12 | D18: 4 | E18: 3 | F18: 2 | I18: Yes
A19: 11 | B19: 4 | C19: 4 | D19: 5 | E19: 2 | F19: 3 | I19: Yes
A20: 12 | B20: 3 | C20: 18 | D20: 3 | E20: 2 | F20: 2 | I20: Yes
A21: 13 | B21: 5 | C21: 8 | D21: 8 | E21: 0 | F21: 2 | H21: 1
A22: 14 | B22: 4 | C22: 14 | D22: 6 | E22: 1 | F22: 2 | H22: 1
A23: 15 | B23: 4 | C23: 2 | D23: 7 | E23: 0 | F23: 2 | H23: 1
A24: 16 | B24: 3 | C24: 10 | D24: 6 | E24: 0 | F24: 3
A25: 17 | B25: 5 | C25: 6 | D25: 7 | E25: 1 | F25: 2
A26: 18 | B26: 3 | C26: 16 | D26: 3 | E26: 3 | F26: 2 | I26: Yes
A27: Totals | B27: =IF(B2="","",SUM(B9:B26)) -> 72 | D27: =IF(B2="","",SUM(D9:D26)) -> 95 | E27: =IF(B2="","",SUM(E9:E26)) -> 32 | F27: =IF(B2="","",SUM(F9:F26)) -> 37 | G27: =IF(B2="","",SUM(G9:G26)) -> 1 | H27: =IF(B2="","",SUM(H9:H26)) -> 4 | I27: =IF(COUNTIF(I9:I26,"=Yes")=0,"",COUNTIF(I9:I26,"=Yes")) -> 11