A1: Jon Press
A2: Club | B2: Mendip
A3: Par/SS | B3: 71/71 | D3: Num. Of Fairways | I3: =IF(B2="","",18-(COUNTIF(B9:B26,3))) -> 15
A4: Date | B4: 41939 | D4: Playing Handicap | I4: 14
A5: Event Place | B5: 1 | D5: Prize Money | G5: 7500
A6: Game Stats | B6: DB+ | C6: DB | D6: Bi | E6: P | F6: B | G6: E | H6: A | I6: H1
B7: 0 | C7: 6 | D7: 8 | E7: 2 | F7: 2 | G7: 0 | H7: 0 | I7: 0
A8: Hole No | B8: Par | C8: Stroke Index | D8: Gross Score | E8: Points | F8: Putts | G8: Fairways | H8: Ferrets | I8: Green Regulation
A9: 1 | B9: 4 | C9: 13 | D9: 5 | E9: 2 | F9: 2 | G9: 1 | I9: Yes
A10: 2 | B10: 4 | C10: 5 | D10: 6 | E10: 1 | F10: 2
A11: 3 | B11: 4 | C11: 3 | D11: 5 | E11: 2 | F11: 2 | I11: Yes
A12: 4 | B12: 5 | C12: 11 | D12: 7 | E12: 1 | F12: 2 | H12: 1
A13: 5 | B13: 4 | C13: 9 | D13: 5 | E13: 2 | F13: 2 | G13: 1 | I13: Yes
A14: 6 | B14: 4 | C14: 7 | D14: 5 | E14: 2 | F14: 2 | G14: 1 | I14: Yes
A15: 7 | B15: 4 | C15: 1 | D15: 6 | E15: 1 | F15: 2 | G15: 1
A16: 8 | B16: 3 | C16: 15 | D16: 5 | E16: 0 | F16: 2
A17: 9 | B17: 5 | C17: 17 | D17: 4 | E17: 3 | F17: 2 | G17: 1 | I17: Yes
A18: 10 | B18: 4 | C18: 2 | D18: 6 | E18: 1 | F18: 2 | G18: 1
A19: 11 | B19: 4 | C19: 8 | D19: 5 | E19: 2 | F19: 3 | I19: Yes
A20: 12 | B20: 3 | C20: 12 | D20: 3 | E20: 3 | F20: 1 | I20: Yes
A21: 13 | B21: 4 | C21: 14 | D21: 4 | E21: 3 | F21: 2 | G21: 1 | I21: Yes
A22: 14 | B22: 4 | C22: 10 | D22: 5 | E22: 2 | F22: 2 | I22: Yes
A23: 15 | B23: 4 | C23: 4 | D23: 6 | E23: 1 | F23: 1
A24: 16 | B24: 4 | C24: 6 | D24: 5 | E24: 2 | F24: 2 | G24: 1 | I24: Yes
A25: 17 | B25: 3 | C25: 16 | D25: 4 | E25: 1 | F25: 2
A26: 18 | B26: 4 | C26: 18 | D26: 3 | E26: 3 | F26: 1 | G26: 1 | I26: Yes
A27: Totals | B27: =IF(B2="","",SUM(B9:B26)) -> 71 | D27: =IF(B2="","",SUM(D9:D26)) -> 89 | E27: =IF(B2="","",SUM(E9:E26)) -> 32 | F27: =IF(B2="","",SUM(F9:F26)) -> 34 | G27: =IF(B2="","",SUM(G9:G26)) -> 9 | H27: =IF(B2="","",SUM(H9:H26)) -> 1 | I27: =IF(COUNTIF(I9:I26,"=Yes")=0,"",COUNTIF(I9:I26,"=Yes")) -> 11