A1: Danny Marsh
A2: Club | B2: Vale Do Lobo, Ocean
A3: Par/SS | B3: 71/71 | D3: Num. Of Fairways | I3: =IF(B2="","",18-(COUNTIF(B9:B26,3))) -> 13
A4: Date | B4: 38318 | D4: Playing Handicap | I4: 9.4000000000009969
A5: Event Place | B5: 2 | D5: Prize Money | G5: 10000
A6: Game Stats | B6: DB+ | C6: DB | D6: Bi | E6: P | F6: B | G6: E | H6: A | I6: H1
B7: 2 | C7: 3 | D7: 5 | E7: 8 | F7: 0 | G7: 0 | H7: 0 | I7: 0
A8: Hole No | B8: Par | C8: Stroke Index | D8: Gross Score | E8: Points | F8: Putts | G8: Fairways | H8: Ferrets | I8: Green Regulation
A9: 1 | B9: 4 | C9: 1 | D9: 5 | E9: 2 | F9: 2 | G9: 1 | I9: Yes
A10: 2 | B10: 4 | C10: 9 | D10: 7 | E10: 0 | F10: 2
A11: 3 | B11: 4 | C11: 11 | D11: 5 | E11: 1 | F11: 2 | G11: 1
A12: 4 | B12: 4 | C12: 7 | D12: 6 | E12: 1 | F12: 2 | G12: 1
A13: 5 | B13: 3 | C13: 15 | D13: 3 | E13: 2 | F13: 2 | I13: Yes
A14: 6 | B14: 5 | C14: 13 | D14: 5 | E14: 2 | F14: 2 | I14: Yes
A15: 7 | B15: 3 | C15: 17 | D15: 3 | E15: 2 | F15: 2 | I15: Yes
A16: 8 | B16: 5 | C16: 5 | D16: 10 | E16: 0 | F16: 3 | H16: 1
A17: 9 | B17: 4 | C17: 3 | D17: 4 | E17: 3 | F17: 1 | G17: 1 | I17: Yes
A18: 10 | B18: 5 | C18: 10 | D18: 5 | E18: 2 | F18: 1 | G18: 1
A19: 11 | B19: 4 | C19: 2 | D19: 6 | E19: 1 | F19: 2 | G19: 1
A20: 12 | B20: 4 | C20: 8 | D20: 4 | E20: 3 | F20: 1 | G20: 1 | I20: Yes
A21: 13 | B21: 3 | C21: 18 | D21: 4 | E21: 1 | F21: 1
A22: 14 | B22: 4 | C22: 4 | D22: 5 | E22: 2 | F22: 2 | H22: 1 | I22: Yes
A23: 15 | B23: 3 | C23: 14 | D23: 5 | E23: 0 | F23: 3
A24: 16 | B24: 5 | C24: 6 | D24: 5 | E24: 3 | F24: 1 | G24: 1 | I24: Yes
A25: 17 | B25: 3 | C25: 16 | D25: 4 | E25: 1 | F25: 2
A26: 18 | B26: 5 | C26: 12 | D26: 5 | E26: 2 | F26: 1 | G26: 1
A27: Totals | B27: =IF(B2="","",SUM(B9:B26)) -> 72 | D27: =IF(B2="","",SUM(D9:D26)) -> 91 | E27: =IF(B2="","",SUM(E9:E26)) -> 28 | F27: =IF(B2="","",SUM(F9:F26)) -> 32 | G27: =IF(B2="","",SUM(G9:G26)) -> 9 | H27: =IF(B2="","",SUM(H9:H26)) -> 2 | I27: =IF(COUNTIF(I9:I26,"=Yes")=0,"",COUNTIF(I9:I26,"=Yes")) -> 8