A1: Danny Marsh
A2: Club | B2: Millennium, Vilamoura
A3: Par/SS | B3: 72/70 | D3: Num. Of Fairways | I3: =IF(B2="","",18-(COUNTIF(B9:B26,3))) -> 14
A4: Date | B4: 38319 | D4: Playing Handicap | I4: 9.7000000000019959
A5: Event Place | B5: 2 | D5: Prize Money | G5: 10000
A6: Game Stats | B6: DB+ | C6: DB | D6: Bi | E6: P | F6: B | G6: E | H6: A | I6: H1
B7: 0 | C7: 3 | D7: 9 | E7: 4 | F7: 2 | G7: 0 | H7: 0 | I7: 0
A8: Hole No | B8: Par | C8: Stroke Index | D8: Gross Score | E8: Points | F8: Putts | G8: Fairways | H8: Ferrets | I8: Green Regulation
A9: 1 | B9: 4 | C9: 9 | D9: 5 | E9: 2 | F9: 2 | G9: 1 | I9: Yes
A10: 2 | B10: 4 | C10: 7 | D10: 5 | E10: 2 | F10: 2 | G10: 1 | I10: Yes
A11: 3 | B11: 3 | C11: 11 | D11: 5 | E11: 0 | F11: 1
A12: 4 | B12: 5 | C12: 3 | D12: 6 | E12: 2 | F12: 2 | I12: Yes
A13: 5 | B13: 4 | C13: 1 | D13: 6 | E13: 1 | F13: 3 | G13: 1 | I13: Yes
A14: 6 | B14: 3 | C14: 13 | D14: 3 | E14: 2 | F14: 2 | I14: Yes
A15: 7 | B15: 4 | C15: 5 | D15: 5 | E15: 2 | F15: 3 | G15: 1 | I15: Yes
A16: 8 | B16: 5 | C16: 17 | D16: 4 | E16: 3 | F16: 1 | G16: 1 | I16: Yes
A17: 9 | B17: 4 | C17: 15 | D17: 5 | E17: 1 | F17: 2
A18: 10 | B18: 4 | C18: 8 | D18: 5 | E18: 2 | F18: 2 | G18: 1 | I18: Yes
A19: 11 | B19: 5 | C19: 12 | D19: 7 | E19: 0 | F19: 2
A20: 12 | B20: 4 | C20: 16 | D20: 5 | E20: 1 | F20: 1 | G20: 1
A21: 13 | B21: 3 | C21: 14 | D21: 3 | E21: 2 | F21: 1
A22: 14 | B22: 4 | C22: 6 | D22: 5 | E22: 2 | F22: 1
A23: 15 | B23: 3 | C23: 18 | D23: 3 | E23: 2 | F23: 1
A24: 16 | B24: 4 | C24: 2 | D24: 4 | E24: 3 | F24: 2 | G24: 1 | I24: Yes
A25: 17 | B25: 4 | C25: 10 | D25: 5 | E25: 2 | F25: 2 | G25: 1 | I25: Yes
A26: 18 | B26: 5 | C26: 4 | D26: 4 | E26: 4 | F26: 1 | I26: Yes
A27: Totals | B27: =IF(B2="","",SUM(B9:B26)) -> 72 | D27: =IF(B2="","",SUM(D9:D26)) -> 85 | E27: =IF(B2="","",SUM(E9:E26)) -> 33 | F27: =IF(B2="","",SUM(F9:F26)) -> 31 | G27: =IF(B2="","",SUM(G9:G26)) -> 9 | H27: =IF(B2="","",SUM(H9:H26)) -> 0 | I27: =IF(COUNTIF(I9:I26,"=Yes")=0,"",COUNTIF(I9:I26,"=Yes")) -> 11