A1: Dave Rouse
A2: Club | B2: Quinto Do Lago, South
A3: Par/SS | B3: 72/72 | D3: Num. Of Fairways | I3: =IF(B2="","",18-(COUNTIF(B9:B26,3))) -> 14
A4: Date | B4: 38318 | D4: Playing Handicap | I4: 23.9
A5: Event Place | B5: 2 | D5: Prize Money | G5: 10000
A6: Game Stats | B6: DB+ | C6: DB | D6: Bi | E6: P | F6: B | G6: E | H6: A | I6: H1
B7: 4 | C7: 3 | D7: 8 | E7: 3 | F7: 0 | G7: 0 | H7: 0 | I7: 0
A8: Hole No | B8: Par | C8: Stroke Index | D8: Gross Score | E8: Points | F8: Putts | G8: Fairways | H8: Ferrets | I8: Green Regulation
A9: 1 | B9: 4 | C9: 13 | D9: 5 | E9: 2 | F9: 1 | G9: 1
A10: 2 | B10: 5 | C10: 7 | D10: 6 | E10: 2 | F10: 2 | G10: 1 | I10: Yes
A11: 3 | B11: 4 | C11: 5 | D11: 4 | E11: 4 | F11: 2 | G11: 1 | I11: Yes
A12: 4 | B12: 3 | C12: 17 | D12: 4 | E12: 2 | F12: 1
A13: 5 | B13: 5 | C13: 1 | D13: 10 | E13: 0 | F13: 3 | H13: 2
A14: 6 | B14: 4 | C14: 9 | D14: 5 | E14: 2 | F14: 1
A15: 7 | B15: 3 | C15: 15 | D15: 5 | E15: 1 | F15: 2
A16: 8 | B16: 4 | C16: 3 | D16: 7 | E16: 1 | F16: 2
A17: 9 | B17: 4 | C17: 11 | D17: 6 | E17: 1 | F17: 2
A18: 10 | B18: 4 | C18: 6 | D18: 5 | E18: 3 | F18: 2 | I18: Yes
A19: 11 | B19: 3 | C19: 16 | D19: 5 | E19: 1 | F19: 1
A20: 12 | B20: 5 | C20: 12 | D20: 5 | E20: 3 | F20: 1 | I20: Yes
A21: 13 | B21: 4 | C21: 18 | D21: 4 | E21: 3 | F21: 3 | G21: 1 | I21: Yes
A22: 14 | B22: 4 | C22: 2 | D22: 8 | E22: 0 | F22: 3
A23: 15 | B23: 3 | C23: 8 | D23: 4 | E23: 2 | F23: 2 | I23: Yes
A24: 16 | B24: 4 | C24: 14 | D24: 8 | E24: 0 | F24: 2
A25: 17 | B25: 5 | C25: 4 | D25: 6 | E25: 3 | F25: 2 | G25: 1 | I25: Yes
A26: 18 | B26: 4 | C26: 10 | D26: 5 | E26: 2 | F26: 2 | I26: Yes
A27: Totals | B27: =IF(B2="","",SUM(B9:B26)) -> 72 | D27: =IF(B2="","",SUM(D9:D26)) -> 102 | E27: =IF(B2="","",SUM(E9:E26)) -> 32 | F27: =IF(B2="","",SUM(F9:F26)) -> 34 | G27: =IF(B2="","",SUM(G9:G26)) -> 5 | H27: =IF(B2="","",SUM(H9:H26)) -> 2 | I27: =IF(COUNTIF(I9:I26,"=Yes")=0,"",COUNTIF(I9:I26,"=Yes")) -> 8