A1: Kevin Gallagher
A2: Club | B2: Vale Do Lobo, Ocean
A3: Par/SS | B3: 71/71 | D3: Num. Of Fairways | I3: =IF(B2="","",18-(COUNTIF(B9:B26,3))) -> 13
A4: Date | B4: 38318 | D4: Playing Handicap | I4: 9.7000000000009923
A5: Event Place | B5: 3 | D5: Prize Money | G5: 6250
A6: Game Stats | B6: DB+ | C6: DB | D6: Bi | E6: P | F6: B | G6: E | H6: A | I6: H1
B7: 3 | C7: 2 | D7: 7 | E7: 6 | F7: 0 | G7: 0 | H7: 0 | I7: 0
A8: Hole No | B8: Par | C8: Stroke Index | D8: Gross Score | E8: Points | F8: Putts | G8: Fairways | H8: Ferrets | I8: Green Regulation
A9: 1 | B9: 4 | C9: 1 | D9: 7 | E9: 0 | F9: 1
A10: 2 | B10: 4 | C10: 9 | D10: 6 | E10: 1 | F10: 2 | G10: 1
A11: 3 | B11: 4 | C11: 11 | D11: 5 | E11: 1 | F11: 2 | G11: 1
A12: 4 | B12: 4 | C12: 7 | D12: 5 | E12: 2 | F12: 2 | G12: 1 | I12: Yes
A13: 5 | B13: 3 | C13: 15 | D13: 4 | E13: 1 | F13: 2
A14: 6 | B14: 5 | C14: 13 | D14: 10 | E14: 0 | F14: 3 | H14: 2
A15: 7 | B15: 3 | C15: 17 | D15: 3 | E15: 2 | F15: 2 | I15: Yes
A16: 8 | B16: 5 | C16: 5 | D16: 5 | E16: 3 | F16: 1 | I16: Yes
A17: 9 | B17: 4 | C17: 3 | D17: 6 | E17: 1 | F17: 2
A18: 10 | B18: 5 | C18: 10 | D18: 6 | E18: 2 | F18: 2 | I18: Yes
A19: 11 | B19: 4 | C19: 2 | D19: 4 | E19: 3 | F19: 1 | G19: 1 | I19: Yes
A20: 12 | B20: 4 | C20: 8 | D20: 5 | E20: 2 | F20: 1 | G20: 1
A21: 13 | B21: 3 | C21: 18 | D21: 3 | E21: 2 | F21: 2 | I21: Yes
A22: 14 | B22: 4 | C22: 4 | D22: 5 | E22: 2 | F22: 1 | G22: 1
A23: 15 | B23: 3 | C23: 14 | D23: 4 | E23: 1 | F23: 2
A24: 16 | B24: 5 | C24: 6 | D24: 9 | E24: 0 | F24: 2
A25: 17 | B25: 3 | C25: 16 | D25: 3 | E25: 2 | F25: 1
A26: 18 | B26: 5 | C26: 12 | D26: 5 | E26: 2 | F26: 2 | G26: 1 | I26: Yes
A27: Totals | B27: =IF(B2="","",SUM(B9:B26)) -> 72 | D27: =IF(B2="","",SUM(D9:D26)) -> 95 | E27: =IF(B2="","",SUM(E9:E26)) -> 27 | F27: =IF(B2="","",SUM(F9:F26)) -> 31 | G27: =IF(B2="","",SUM(G9:G26)) -> 7 | H27: =IF(B2="","",SUM(H9:H26)) -> 2 | I27: =IF(COUNTIF(I9:I26,"=Yes")=0,"",COUNTIF(I9:I26,"=Yes")) -> 7