A1: Martin Bould
A2: Club | B2: Woburn, Dukes Course
A3: Par/SS | B3: 72 | D3: Num. Of Fairways | I3: =IF(B2="","",18-(COUNTIF(B9:B26,3))) -> 14
A4: Date | B4: 38540 | D4: Playing Handicap | I4: 18.7
A5: Event Place | B5: 2 | D5: Prize Money | G5: 2500
A6: Game Stats | B6: DB+ | C6: DB | D6: Bi | E6: P | F6: B | G6: E | H6: A | I6: H1
B7: 4 | C7: 6 | D7: 7 | E7: 1 | F7: 0 | G7: 0 | H7: 0 | I7: 0
A8: Hole No | B8: Par | C8: Stroke Index | D8: Gross Score | E8: Points | F8: Putts | G8: Fairways | H8: Ferrets | I8: Green Regulation
A9: 1 | B9: 5 | C9: 8 | D9: 7 | E9: 1 | F9: 2 | G9: 1
A10: 2 | B10: 4 | C10: 10 | D10: 4 | E10: 3 | F10: 2 | G10: 1 | I10: Yes
A11: 3 | B11: 3 | C11: 18 | D11: 4 | E11: 2 | F11: 3 | I11: Yes
A12: 4 | B12: 4 | C12: 3 | D12: 7 | E12: 0 | F12: 2 | G12: 1
A13: 5 | B13: 5 | C13: 7 | D13: 7 | E13: 1 | F13: 2
A14: 6 | B14: 3 | C14: 15 | D14: 4 | E14: 2 | F14: 1
A15: 7 | B15: 4 | C15: 1 | D15: 8 | E15: 0 | F15: 3 | H15: 1
A16: 8 | B16: 4 | C16: 6 | D16: 5 | E16: 2 | F16: 2 | I16: Yes
A17: 9 | B17: 3 | C17: 16 | D17: 6 | E17: 0 | F17: 2
A18: 10 | B18: 4 | C18: 12 | D18: 5 | E18: 2 | F18: 1
A19: 11 | B19: 5 | C19: 5 | D19: 6 | E19: 2 | F19: 2 | I19: Yes
A20: 12 | B20: 3 | C20: 17 | D20: 5 | E20: 1 | F20: 2
A21: 13 | B21: 4 | C21: 4 | D21: 6 | E21: 1 | F21: 3 | G21: 1 | I21: Yes
A22: 14 | B22: 5 | C22: 13 | D22: 6 | E22: 2 | F22: 2 | I22: Yes
A23: 15 | B23: 4 | C23: 8 | D23: 7 | E23: 0 | F23: 2
A24: 16 | B24: 4 | C24: 2 | D24: 5 | E24: 2 | F24: 2 | G24: 1 | I24: Yes
A25: 17 | B25: 4 | C25: 11 | D25: 6 | E25: 1 | F25: 2
A26: 18 | B26: 4 | C26: 14 | D26: 6 | E26: 1 | F26: 3 | G26: 1 | I26: Yes
A27: Totals | B27: =IF(B2="","",SUM(B9:B26)) -> 72 | D27: =IF(B2="","",SUM(D9:D26)) -> 104 | E27: =IF(B2="","",SUM(E9:E26)) -> 23 | F27: =IF(B2="","",SUM(F9:F26)) -> 38 | G27: =IF(B2="","",SUM(G9:G26)) -> 6 | H27: =IF(B2="","",SUM(H9:H26)) -> 1 | I27: =IF(COUNTIF(I9:I26,"=Yes")=0,"",COUNTIF(I9:I26,"=Yes")) -> 8