A1: Dave Rouse
A2: Club | B2: Selsdon Park
A3: Par/SS | B3: 73/70 | D3: Num. Of Fairways | I3: =IF(B2="","",18-(COUNTIF(B9:B26,3))) -> 14
A4: Date | B4: 42252 | D4: Playing Handicap | I4: 27.2
A5: Event Place | B5: 4 | C5: M | D5: Prize Money | G5: 41250
A6: Game Stats | B6: DB+ | C6: DB | D6: Bi | E6: P | F6: B | G6: E | H6: A | I6: H1
B7: 4 | C7: 8 | D7: 3 | E7: 3 | F7: 0 | G7: 0 | H7: 0 | I7: 0
A8: Hole No | B8: Par | C8: Stroke Index | D8: Gross Score | E8: Points | F8: Putts | G8: Fairways | H8: Ferrets | I8: Green Regulation
A9: 1 | B9: 5 | C9: 9 | D9: 7 | E9: 2 | F9: 2 | G9: 1 | I9: Yes
A10: 2 | B10: 4 | C10: 3 | D10: 4 | E10: 4 | F10: 1 | G10: 1 | I10: Yes
A11: 3 | B11: 3 | C11: 17 | D11: 3 | E11: 3 | F11: 1 | I11: Yes
A12: 4 | B12: 4 | C12: 7 | D12: 6 | E12: 2 | F12: 3 | G12: 1 | I12: Yes
A13: 5 | B13: 5 | C13: 15 | D13: 6 | E13: 2 | F13: 2 | I13: Yes
A14: 6 | B14: 3 | C14: 5 | D14: 5 | E14: 2 | F14: 2 | I14: Yes
A15: 7 | B15: 4 | C15: 13 | D15: 6 | E15: 1 | F15: 2
A16: 8 | B16: 4 | C16: 1 | D16: 7 | E16: 1 | F16: 1
A17: 9 | B17: 4 | C17: 11 | D17: 8 | E17: 0 | F17: 2
A18: 10 | B18: 5 | C18: 10 | D18: 7 | E18: 1 | F18: 1
A19: 11 | B19: 3 | C19: 16 | D19: 4 | E19: 2 | F19: 2 | I19: Yes
A20: 12 | B20: 5 | C20: 2 | D20: 7 | E20: 2 | F20: 1
A21: 13 | B21: 4 | C21: 8 | D21: 5 | E21: 3 | F21: 2 | I21: Yes
A22: 14 | B22: 4 | C22: 6 | D22: 6 | E22: 2 | F22: 2 | G22: 1 | I22: Yes
A23: 15 | B23: 5 | C23: 18 | D23: 5 | E23: 3 | F23: 1 | G23: 1 | I23: Yes
A24: 16 | B24: 4 | C24: 4 | D24: 9 | E24: 0 | F24: 2
A25: 17 | B25: 3 | C25: 14 | D25: 5 | E25: 1 | F25: 2
A26: 18 | B26: 4 | C26: 12 | D26: 7 | E26: 0 | F26: 3
A27: Totals | B27: =IF(B2="","",SUM(B9:B26)) -> 73 | D27: =IF(B2="","",SUM(D9:D26)) -> 107 | E27: =IF(B2="","",SUM(E9:E26)) -> 31 | F27: =IF(B2="","",SUM(F9:F26)) -> 32 | G27: =IF(B2="","",SUM(G9:G26)) -> 5 | H27: =IF(B2="","",SUM(H9:H26)) -> 0 | I27: =IF(COUNTIF(I9:I26,"=Yes")=0,"",COUNTIF(I9:I26,"=Yes")) -> 10