A1: Andrew Baldwin
A2: Club | B2: Woldingham
A3: Par/SS | B3: 71/71 | D3: Num. Of Fairways
A4: Date | B4: 40005 | D4: Playing Handicap | I4: 19.1
A5: Event Place | B5: 6 | C5: M | D5: Prize Money | G5: 7500
A6: Game Stats | B6: DB+ | C6: DB | D6: BI | E6: P | F6: B | G6: E | H6: A | I6: H1
B7: 1 | C7: 4 | D7: 7 | E7: 6 | F7: 0 | G7: 0 | H7: 0 | I7: 0
A8: Hole No | B8: Par | C8: Stroke Index | D8: Gross Score | E8: Points | F8: Putts | G8: Fairways | H8: Ferrets | I8: Green Regulation
A9: 1 | B9: 4 | C9: 8 | D9: 5 | E9: 2 | F9: 2 | I9: Yes
A10: 2 | B10: 3 | C10: 16 | D10: 3 | E10: 3 | F10: 2 | I10: Yes
A11: 3 | B11: 4 | C11: 4 | D11: 4 | E11: 3 | F11: 1 | I11: Yes
A12: 4 | B12: 4 | C12: 18 | D12: 6 | E12: 1 | F12: 2
A13: 5 | B13: 5 | C13: 14 | D13: 6 | E13: 2 | F13: 2 | G13: 1 | I13: Yes
A14: 6 | B14: 4 | C14: 12 | D14: 6 | E14: 1 | F14: 2
A15: 7 | B15: 3 | C15: 2 | D15: 4 | E15: 2 | F15: 2 | I15: Yes
A16: 8 | B16: 4 | C16: 6 | D16: 5 | E16: 2 | F16: 1
A17: 9 | B17: 5 | C17: 10 | D17: 6 | E17: 2 | F17: 2 | I17: Yes
A18: 10 | B18: 4 | C18: 5 | D18: 4 | E18: 3 | F18: 1 | I18: Yes
A19: 11 | B19: 3 | C19: 13 | D19: 5 | E19: 1 | F19: 3 | I19: Yes
A20: 12 | B20: 4 | C20: 1 | D20: 8 | E20: 0 | F20: 1
A21: 13 | B21: 4 | C21: 11 | D21: 5 | E21: 2 | F21: 2 | I21: Yes
A22: 14 | B22: 4 | C22: 3 | D22: 4 | E22: 3 | F22: 1 | G22: 1 | I22: Yes
A23: 15 | B23: 3 | C23: 17 | D23: 5 | E23: 1 | F23: 2
A24: 16 | B24: 5 | C24: 7 | D24: 5 | E24: 3 | F24: 2 | G24: 1 | I24: Yes
A25: 17 | B25: 3 | C25: 15 | D25: 4 | E25: 2 | F25: 2 | I25: Yes
A26: 18 | B26: 5 | C26: 9 | D26: 5 | E26: 3 | F26: 1 | I26: Yes
A27: Totals | B27: =IF(B2="","",SUM(B9:B26)) -> 71 | D27: =IF(B2="","",SUM(D9:D26)) -> 90 | E27: =IF(B2="","",SUM(E9:E26)) -> 36 | F27: =IF(B2="","",SUM(F9:F26)) -> 31 | G27: =IF(B2="","",SUM(G9:G26)) -> 3 | H27: =IF(B2="","",SUM(H9:H26)) -> 0 | I27: =IF(COUNTIF(I9:I26,"=Yes")=0,"",COUNTIF(I9:I26,"=Yes")) -> 13