A1: Ian Edwards
A2: Club | B2: Porters Park
A3: Par/SS | B3: 70/70 | D3: Num. Of Fairways | I3: =IF(B2="","",18-(COUNTIF(B9:B26,3))) -> 14
A4: Date | B4: 38024 | D4: Playing Handicap | I4: 14
A5: Event Place | B5: 1 | D5: Prize Money | G5: 5000
A6: Game Stats | B6: DB+ | C6: DB | D6: Bi | E6: P | F6: B | G6: E | H6: A | I6: H1
B7: 4 | C7: 3 | D7: 4 | E7: 5 | F7: 2 | G7: 0 | H7: 0 | I7: 0
A8: Hole No | B8: Par | C8: Stroke Index | D8: Gross Score | E8: Points | F8: Putts | G8: Fairways | H8: Ferrets | I8: Green Regulation
A9: 1 | B9: 4 | C9: 17 | D9: 5 | E9: 1 | F9: 1
A10: 2 | B10: 4 | C10: 11 | D10: 5 | E10: 2 | F10: 1
A11: 3 | B11: 4 | C11: 3 | D11: 9 | E11: 0 | F11: 3
A12: 4 | B12: 4 | C12: 1 | D12: 4 | E12: 3 | F12: 2 | I12: Yes
A13: 5 | B13: 4 | C13: 9 | D13: 4 | E13: 3 | F13: 1 | I13: Yes
A14: 6 | B14: 3 | C14: 13 | D14: 2 | E14: 4 | F14: 1 | I14: Yes
A15: 7 | B15: 4 | C15: 7 | D15: 5 | E15: 2 | F15: 1
A16: 8 | B16: 4 | C16: 5 | D16: 5 | E16: 2 | F16: 1
A17: 9 | B17: 3 | C17: 15 | D17: 5 | E17: 0 | F17: 2
A18: 10 | B18: 5 | C18: 12 | D18: 5 | E18: 3 | F18: 2 | I18: Yes
A19: 11 | B19: 4 | C19: 2 | D19: 7 | E19: 0 | F19: 2
A20: 12 | B20: 3 | C20: 8 | D20: 5 | E20: 1 | F20: 2
A21: 13 | B21: 5 | C21: 4 | D21: 4 | E21: 4 | F21: 1 | G21: 1 | I21: Yes
A22: 14 | B22: 3 | C22: 16 | D22: 3 | E22: 2 | F22: 2 | I22: Yes
A23: 15 | B23: 4 | C23: 18 | D23: 6 | E23: 0 | F23: 2
A24: 16 | B24: 4 | C24: 6 | D24: 8 | E24: 0 | F24: 3 | H24: 1
A25: 17 | B25: 4 | C25: 14 | D25: 4 | E25: 3 | F25: 2 | I25: Yes
A26: 18 | B26: 4 | C26: 10 | D26: 8 | E26: 0 | F26: 3 | H26: 1
A27: Totals | B27: =IF(B2="","",SUM(B9:B26)) -> 70 | D27: =IF(B2="","",SUM(D9:D26)) -> 94 | E27: =IF(B2="","",SUM(E9:E26)) -> 30 | F27: =IF(B2="","",SUM(F9:F26)) -> 32 | G27: =IF(B2="","",SUM(G9:G26)) -> 1 | H27: =IF(B2="","",SUM(H9:H26)) -> 2 | I27: =IF(COUNTIF(I9:I26,"=Yes")=0,"",COUNTIF(I9:I26,"=Yes")) -> 7