A1: Jeff Colbrook
A2: Club | B2: The Belfry - Brabazon
A3: Par/SS | B3: 72/71 | D3: Num. Of Fairways | I3: =IF(B2="","",18-(COUNTIF(B9:B26,3))) -> 15
A4: Date | B4: 38083 | D4: Playing Handicap | I4: 17
A5: Event Place | B5: 4 | D5: Prize Money | G5: 13750
A6: Game Stats | B6: DB+ | C6: DB | D6: Bi | E6: P | F6: B | G6: E | H6: A | I6: H1
B7: 3 | C7: 6 | D7: 6 | E7: 3 | F7: 0 | G7: 0 | H7: 0 | I7: 0
A8: Hole No | B8: Par | C8: Stroke Index | D8: Gross Score | E8: Points | F8: Putts | G8: Fairways | H8: Ferrets | I8: Green Regulation
A9: 1 | B9: 4 | C9: 9 | D9: 5 | E9: 2 | F9: 2 | I9: Yes
A10: 2 | B10: 4 | C10: 17 | D10: 5 | E10: 2 | F10: 2 | I10: Yes
A11: 3 | B11: 5 | C11: 13 | D11: 7 | E11: 1 | F11: 2
A12: 4 | B12: 4 | C12: 3 | D12: 7 | E12: 0 | F12: 2
A13: 5 | B13: 4 | C13: 11 | D13: 5 | E13: 2 | F13: 1 | G13: 1
A14: 6 | B14: 4 | C14: 5 | D14: 6 | E14: 1 | F14: 2
A15: 7 | B15: 3 | C15: 15 | D15: 3 | E15: 3 | F15: 2 | I15: Yes
A16: 8 | B16: 4 | C16: 1 | D16: 5 | E16: 2 | F16: 1
A17: 9 | B17: 4 | C17: 7 | D17: 5 | E17: 2 | F17: 2 | G17: 1 | I17: Yes
A18: 10 | B18: 4 | C18: 8 | D18: 4 | E18: 3 | F18: 1 | G18: 1 | I18: Yes
A19: 11 | B19: 4 | C19: 16 | D19: 5 | E19: 2 | F19: 2 | I19: Yes
A20: 12 | B20: 3 | C20: 6 | D20: 10 | E20: 0 | F20: 3 | H20: 2
A21: 13 | B21: 4 | C21: 18 | D21: 6 | E21: 0 | F21: 1
A22: 14 | B22: 3 | C22: 14 | D22: 5 | E22: 1 | F22: 2
A23: 15 | B23: 5 | C23: 2 | D23: 8 | E23: 0 | F23: 3 | H23: 1
A24: 16 | B24: 4 | C24: 12 | D24: 4 | E24: 3 | F24: 2 | I24: Yes
A25: 17 | B25: 5 | C25: 10 | D25: 7 | E25: 1 | F25: 3 | I25: Yes
A26: 18 | B26: 4 | C26: 4 | D26: 6 | E26: 1 | F26: 2 | G26: 1
A27: Totals | B27: =IF(B2="","",SUM(B9:B26)) -> 72 | D27: =IF(B2="","",SUM(D9:D26)) -> 103 | E27: =IF(B2="","",SUM(E9:E26)) -> 26 | F27: =IF(B2="","",SUM(F9:F26)) -> 35 | G27: =IF(B2="","",SUM(G9:G26)) -> 4 | H27: =IF(B2="","",SUM(H9:H26)) -> 3 | I27: =IF(COUNTIF(I9:I26,"=Yes")=0,"",COUNTIF(I9:I26,"=Yes")) -> 8