A1: Martin Cox
A2: Club | B2: The Belfry - Brabazon
A3: Par/SS | B3: 72/71 | D3: Num. Of Fairways | I3: =IF(B2="","",18-(COUNTIF(B9:B26,3))) -> 15
A4: Date | B4: 38023 | D4: Playing Handicap | I4: 10.6
A5: Event Place | B5: 8 | C5: M | D5: Prize Money | G5: 5000
A6: Game Stats | B6: DB+ | C6: DB | D6: Bi | E6: P | F6: B | G6: E | H6: A | I6: H1
B7: 3 | C7: 5 | D7: 8 | E7: 2 | F7: 0 | G7: 0 | H7: 0 | I7: 0
A8: Hole No | B8: Par | C8: Stroke Index | D8: Gross Score | E8: Points | F8: Putts | G8: Fairways | H8: Ferrets | I8: Green Regulation
A9: 1 | B9: 4 | C9: 9 | D9: 6 | E9: 1 | F9: 2
A10: 2 | B10: 4 | C10: 17 | D10: 6 | E10: 0 | F10: 2 | G10: 1
A11: 3 | B11: 5 | C11: 13 | D11: 8 | E11: 0 | F11: 2 | G11: 1 | H11: 2
A12: 4 | B12: 4 | C12: 3 | D12: 6 | E12: 1 | F12: 2 | G12: 1 | H12: 1
A13: 5 | B13: 4 | C13: 11 | D13: 5 | E13: 2 | F13: 2 | G13: 1 | I13: Yes
A14: 6 | B14: 4 | C14: 5 | D14: 6 | E14: 1 | F14: 3 | G14: 1 | I14: Yes
A15: 7 | B15: 3 | C15: 15 | D15: 4 | E15: 1 | F15: 1
A16: 8 | B16: 4 | C16: 1 | D16: 5 | E16: 2 | F16: 2 | G16: 1 | I16: Yes
A17: 9 | B17: 4 | C17: 7 | D17: 5 | E17: 2 | F17: 2 | G17: 1 | I17: Yes
A18: 10 | B18: 4 | C18: 8 | D18: 4 | E18: 3 | F18: 2 | I18: Yes
A19: 11 | B19: 4 | C19: 16 | D19: 4 | E19: 2 | F19: 1
A20: 12 | B20: 3 | C20: 6 | D20: 4 | E20: 2 | F20: 1
A21: 13 | B21: 4 | C21: 18 | D21: 6 | E21: 0 | F21: 3
A22: 14 | B22: 3 | C22: 14 | D22: 4 | E22: 1 | F22: 1
A23: 15 | B23: 5 | C23: 2 | D23: 6 | E23: 2 | F23: 2 | I23: Yes
A24: 16 | B24: 4 | C24: 12 | D24: 10 | E24: 0 | F24: 3 | H24: 1
A25: 17 | B25: 5 | C25: 10 | D25: 6 | E25: 2 | F25: 3 | G25: 1 | I25: Yes
A26: 18 | B26: 4 | C26: 4 | D26: 7 | E26: 0 | F26: 3 | G26: 1 | H26: 1
A27: Totals | B27: =IF(B2="","",SUM(B9:B26)) -> 72 | D27: =IF(B2="","",SUM(D9:D26)) -> 102 | E27: =IF(B2="","",SUM(E9:E26)) -> 22 | F27: =IF(B2="","",SUM(F9:F26)) -> 37 | G27: =IF(B2="","",SUM(G9:G26)) -> 9 | H27: =IF(B2="","",SUM(H9:H26)) -> 5 | I27: =IF(COUNTIF(I9:I26,"=Yes")=0,"",COUNTIF(I9:I26,"=Yes")) -> 7