A1: Matthew Carter
A2: Club | B2: Merrist Wood
A3: Par/SS | B3: 72/70 | D3: Num. Of Fairways | I3: =IF(B2="","",18-(COUNTIF(B9:B26,3))) -> 14
A4: Date | B4: 38885 | D4: Playing Handicap | I4: 21.2
A5: Event Place | B5: 8 | C5: M | D5: Prize Money | G5: 8750
A6: Game Stats | B6: DB+ | C6: DB | D6: Bi | E6: P | F6: B | G6: E | H6: A | I6: H1
B7: 6 | C7: 6 | D7: 2 | E7: 4 | F7: 0 | G7: 0 | H7: 0 | I7: 0
A8: Hole No | B8: Par | C8: Stroke Index | D8: Gross Score | E8: Points | F8: Putts | G8: Fairways | H8: Ferrets | I8: Green Regulation
A9: 1 | B9: 4 | C9: 10 | D9: 6 | E9: 1 | F9: 3 | G9: 1 | I9: Yes
A10: 2 | B10: 3 | C10: 18 | D10: 3 | E10: 3 | F10: 2 | I10: Yes
A11: 3 | B11: 4 | C11: 6 | D11: 6 | E11: 1 | F11: 2
A12: 4 | B12: 5 | C12: 14 | D12: 7 | E12: 1 | F12: 3 | I12: Yes
A13: 5 | B13: 4 | C13: 4 | D13: 7 | E13: 0 | F13: 3
A14: 6 | B14: 5 | C14: 12 | D14: 7 | E14: 1 | F14: 1
A15: 7 | B15: 4 | C15: 8 | D15: 6 | E15: 1 | F15: 2 | G15: 1
A16: 8 | B16: 3 | C16: 16 | D16: 6 | E16: 0 | F16: 2 | H16: 1
A17: 9 | B17: 4 | C17: 2 | D17: 7 | E17: 1 | F17: 2 | G17: 1 | H17: 1
A18: 10 | B18: 5 | C18: 9 | D18: 5 | E18: 3 | F18: 1 | G18: 1 | I18: Yes
A19: 11 | B19: 3 | C19: 15 | D19: 3 | E19: 3 | F19: 2 | I19: Yes
A20: 12 | B20: 4 | C20: 7 | D20: 10 | E20: 0 | F20: 3 | G20: 1 | H20: 2
A21: 13 | B21: 4 | C21: 1 | D21: 5 | E21: 3 | F21: 2 | G21: 1 | I21: Yes
A22: 14 | B22: 4 | C22: 13 | D22: 5 | E22: 2 | F22: 2 | I22: Yes
A23: 15 | B23: 4 | C23: 3 | D23: 7 | E23: 1 | F23: 2 | G23: 1
A24: 16 | B24: 3 | C24: 17 | D24: 5 | E24: 1 | F24: 3 | I24: Yes
A25: 17 | B25: 4 | C25: 5 | D25: 10 | E25: 0 | F25: 3 | G25: 1 | H25: 1
A26: 18 | B26: 5 | C26: 11 | D26: 5 | E26: 3 | F26: 1 | G26: 1 | I26: Yes
A27: Totals | B27: =IF(B2="","",SUM(B9:B26)) -> 72 | D27: =IF(B2="","",SUM(D9:D26)) -> 110 | E27: =IF(B2="","",SUM(E9:E26)) -> 25 | F27: =IF(B2="","",SUM(F9:F26)) -> 39 | G27: =IF(B2="","",SUM(G9:G26)) -> 9 | H27: =IF(B2="","",SUM(H9:H26)) -> 5 | I27: =IF(COUNTIF(I9:I26,"=Yes")=0,"",COUNTIF(I9:I26,"=Yes")) -> 9