A1: Robert Thompson
A2: Club | B2: Merrist Wood
A3: Par/SS | B3: 72/70 | D3: Num. Of Fairways | I3: =IF(B2="","",18-(COUNTIF(B9:B26,3))) -> 14
A4: Date | B4: 38885 | D4: Playing Handicap | I4: 8.1
A5: Event Place | B5: 5 | C5: M | D5: Prize Money | G5: 17500
A6: Game Stats | B6: DB+ | C6: DB | D6: Bi | E6: P | F6: B | G6: E | H6: A | I6: H1
B7: 2 | C7: 3 | D7: 3 | E7: 8 | F7: 2 | G7: 0 | H7: 0 | I7: 0
A8: Hole No | B8: Par | C8: Stroke Index | D8: Gross Score | E8: Points | F8: Putts | G8: Fairways | H8: Ferrets | I8: Green Regulation
A9: 1 | B9: 4 | C9: 10 | D9: 6 | E9: 0 | F9: 2 | H9: 1
A10: 2 | B10: 3 | C10: 18 | D10: 3 | E10: 2 | F10: 2 | I10: Yes
A11: 3 | B11: 4 | C11: 6 | D11: 4 | E11: 3 | F11: 1 | I11: Yes
A12: 4 | B12: 5 | C12: 14 | D12: 5 | E12: 2 | F12: 2 | I12: Yes
A13: 5 | B13: 4 | C13: 4 | D13: 4 | E13: 3 | F13: 2 | G13: 1 | I13: Yes
A14: 6 | B14: 5 | C14: 12 | D14: 4 | E14: 3 | F14: 1 | I14: Yes
A15: 7 | B15: 4 | C15: 8 | D15: 5 | E15: 2 | F15: 3 | G15: 1 | I15: Yes
A16: 8 | B16: 3 | C16: 16 | D16: 3 | E16: 2 | F16: 2 | I16: Yes
A17: 9 | B17: 4 | C17: 2 | D17: 4 | E17: 3 | F17: 2 | I17: Yes
A18: 10 | B18: 5 | C18: 9 | D18: 10 | E18: 0 | F18: 3 | H18: 1
A19: 11 | B19: 3 | C19: 15 | D19: 2 | E19: 3 | F19: 2 | I19: Yes
A20: 12 | B20: 4 | C20: 7 | D20: 4 | E20: 3 | F20: 2 | G20: 1 | I20: Yes
A21: 13 | B21: 4 | C21: 1 | D21: 7 | E21: 0 | F21: 3 | G21: 1
A22: 14 | B22: 4 | C22: 13 | D22: 6 | E22: 0 | F22: 1 | G22: 1
A23: 15 | B23: 4 | C23: 3 | D23: 5 | E23: 2 | F23: 1 | G23: 1
A24: 16 | B24: 3 | C24: 17 | D24: 4 | E24: 1 | F24: 2
A25: 17 | B25: 4 | C25: 5 | D25: 6 | E25: 1 | F25: 2
A26: 18 | B26: 5 | C26: 11 | D26: 5 | E26: 2 | F26: 1 | G26: 1
A27: Totals | B27: =IF(B2="","",SUM(B9:B26)) -> 72 | D27: =IF(B2="","",SUM(D9:D26)) -> 87 | E27: =IF(B2="","",SUM(E9:E26)) -> 32 | F27: =IF(B2="","",SUM(F9:F26)) -> 34 | G27: =IF(B2="","",SUM(G9:G26)) -> 7 | H27: =IF(B2="","",SUM(H9:H26)) -> 2 | I27: =IF(COUNTIF(I9:I26,"=Yes")=0,"",COUNTIF(I9:I26,"=Yes")) -> 10