A1: Dave Rouse
A2: Club | B2: San Lorenzo
A3: Par/SS | B3: 72/74 | D3: Num. Of Fairways | I3: =IF(B2="","",18-(COUNTIF(B9:B26,3))) -> 14
A4: Date | B4: 38689 | D4: Playing Handicap | I4: 23.4
A5: Event Place | B5: 5 | D5: Prize Money | G5: 5000
A6: Game Stats | B6: DB+ | C6: DB | D6: BI | E6: P | F6: B | G6: E | H6: A | I6: H1
B7: 8 | C7: 4 | D7: 1 | E7: 5 | F7: 0 | G7: 0 | H7: 0 | I7: 0
A8: Hole No | B8: Par | C8: Stroke Index | D8: Gross Score | E8: Points | F8: Putts | G8: Fairways | H8: Ferrets | I8: Green Regulation
A9: 1 | B9: 5 | C9: 7 | D9: 8 | E9: 0 | F9: 4 | G9: 1 | I9: Yes
A10: 2 | B10: 3 | C10: 15 | D10: 10 | E10: 0 | F10: 3 | H10: 1
A11: 3 | B11: 4 | C11: 13 | D11: 4 | E11: 3 | F11: 2 | I11: Yes
A12: 4 | B12: 4 | C12: 9 | D12: 7 | E12: 0 | F12: 3
A13: 5 | B13: 3 | C13: 17 | D13: 3 | E13: 3 | F13: 2 | I13: Yes
A14: 6 | B14: 4 | C14: 1 | D14: 6 | E14: 2 | F14: 2 | I14: Yes
A15: 7 | B15: 4 | C15: 11 | D15: 6 | E15: 1 | F15: 2
A16: 8 | B16: 5 | C16: 3 | D16: 10 | E16: 0 | F16: 3 | G16: 1 | H16: 1
A17: 9 | B17: 4 | C17: 5 | D17: 4 | E17: 4 | F17: 2 | G17: 1 | I17: Yes
A18: 10 | B18: 5 | C18: 12 | D18: 8 | E18: 0 | F18: 2
A19: 11 | B19: 4 | C19: 14 | D19: 4 | E19: 3 | F19: 2 | G19: 1 | I19: Yes
A20: 12 | B20: 4 | C20: 2 | D20: 10 | E20: 0 | F20: 3 | H20: 2
A21: 13 | B21: 4 | C21: 8 | D21: 10 | E21: 0 | F21: 3 | H21: 1
A22: 14 | B22: 3 | C22: 18 | D22: 5 | E22: 1 | F22: 2
A23: 15 | B23: 5 | C23: 6 | D23: 7 | E23: 1 | F23: 2
A24: 16 | B24: 3 | C24: 16 | D24: 7 | E24: 0 | F24: 2 | H24: 1
A25: 17 | B25: 4 | C25: 10 | D25: 4 | E25: 3 | F25: 2 | I25: Yes
A26: 18 | B26: 4 | C26: 4 | D26: 5 | E26: 3 | F26: 2 | G26: 1 | I26: Yes
A27: Totals | B27: =IF(B2="","",SUM(B9:B26)) -> 72 | D27: =IF(B2="","",SUM(D9:D26)) -> 118 | E27: =IF(B2="","",SUM(E9:E26)) -> 24 | F27: =IF(B2="","",SUM(F9:F26)) -> 43 | G27: =IF(B2="","",SUM(G9:G26)) -> 5 | H27: =IF(B2="","",SUM(H9:H26)) -> 6 | I27: =IF(COUNTIF(I9:I26,"=Yes")=0,"",COUNTIF(I9:I26,"=Yes")) -> 8