A1: Dave Rouse
A2: Club | B2: Victoria, Vilamoura
A3: Par/SS | B3: 72/72 | D3: Num. Of Fairways | I3: =IF(B2="","",18-(COUNTIF(B9:B26,3))) -> 14
A4: Date | B4: 38690 | D4: Playing Handicap | I4: 24.6
A5: Event Place | B5: 2 | D5: Prize Money | G5: 12500
A6: Game Stats | B6: DB+ | C6: DB | D6: Bi | E6: P | F6: B | G6: E | H6: A | I6: H1
B7: 5 | C7: 5 | D7: 3 | E7: 5 | F7: 0 | G7: 0 | H7: 0 | I7: 0
A8: Hole No | B8: Par | C8: Stroke Index | D8: Gross Score | E8: Points | F8: Putts | G8: Fairways | H8: Ferrets | I8: Green Regulation
A9: 1 | B9: 4 | C9: 9 | D9: 7 | E9: 0 | F9: 2
A10: 2 | B10: 4 | C10: 13 | D10: 4 | E10: 3 | F10: 2 | G10: 1 | I10: Yes
A11: 3 | B11: 5 | C11: 5 | D11: 8 | E11: 1 | F11: 1
A12: 4 | B12: 4 | C12: 3 | D12: 6 | E12: 2 | F12: 2 | G12: 1 | I12: Yes
A13: 5 | B13: 5 | C13: 11 | D13: 5 | E13: 3 | F13: 2 | I13: Yes
A14: 6 | B14: 3 | C14: 15 | D14: 4 | E14: 2 | F14: 2 | I14: Yes
A15: 7 | B15: 4 | C15: 1 | D15: 6 | E15: 2 | F15: 2 | G15: 1 | I15: Yes
A16: 8 | B16: 3 | C16: 17 | D16: 5 | E16: 1 | F16: 2
A17: 9 | B17: 4 | C17: 7 | D17: 7 | E17: 1 | F17: 1
A18: 10 | B18: 4 | C18: 10 | D18: 5 | E18: 2 | F18: 2 | G18: 1 | I18: Yes
A19: 11 | B19: 4 | C19: 14 | D19: 4 | E19: 3 | F19: 2 | G19: 1 | I19: Yes
A20: 12 | B20: 5 | C20: 2 | D20: 8 | E20: 1 | F20: 3 | I20: Yes
A21: 13 | B21: 3 | C21: 18 | D21: 3 | E21: 3 | F21: 2 | I21: Yes
A22: 14 | B22: 4 | C22: 6 | D22: 6 | E22: 2 | F22: 2 | I22: Yes
A23: 15 | B23: 4 | C23: 16 | D23: 5 | E23: 2 | F23: 2 | I23: Yes
A24: 16 | B24: 3 | C24: 12 | D24: 3 | E24: 3 | F24: 1 | I24: Yes
A25: 17 | B25: 5 | C25: 8 | D25: 9 | E25: 0 | F25: 2 | H25: 1
A26: 18 | B26: 4 | C26: 4 | D26: 6 | E26: 2 | F26: 2 | I26: Yes
A27: Totals | B27: =IF(B2="","",SUM(B9:B26)) -> 72 | D27: =IF(B2="","",SUM(D9:D26)) -> 101 | E27: =IF(B2="","",SUM(E9:E26)) -> 33 | F27: =IF(B2="","",SUM(F9:F26)) -> 34 | G27: =IF(B2="","",SUM(G9:G26)) -> 5 | H27: =IF(B2="","",SUM(H9:H26)) -> 1 | I27: =IF(COUNTIF(I9:I26,"=Yes")=0,"",COUNTIF(I9:I26,"=Yes")) -> 13