A1: Ian Edwards
A2: Club | B2: Porters Park
A3: Par/SS | B3: 70/70 | D3: Num. Of Fairways | I3: =IF(B2="","",18-(COUNTIF(B9:B26,3))) -> 14
A4: Date | B4: 38713 | D4: Playing Handicap | I4: 15.1
A5: Event Place | B5: 2 | D5: Prize Money | G5: 2500
A6: Game Stats | B6: DB+ | C6: DB | D6: BI | E6: P | F6: B | G6: E | H6: A | I6: H1
B7: 2 | C7: 5 | D7: 6 | E7: 5 | F7: 0 | G7: 0 | H7: 0 | I7: 0
A8: Hole No | B8: Par | C8: Stroke Index | D8: Gross Score | E8: Points | F8: Putts | G8: Fairways | H8: Ferrets | I8: Green Regulation
A9: 1 | B9: 4 | C9: 17 | D9: 7 | E9: 0 | F9: 1
A10: 2 | B10: 4 | C10: 11 | D10: 4 | E10: 3 | F10: 2 | G10: 1 | I10: Yes
A11: 3 | B11: 4 | C11: 3 | D11: 5 | E11: 2 | F11: 2 | I11: Yes
A12: 4 | B12: 4 | C12: 1 | D12: 5 | E12: 2 | F12: 2 | I12: Yes
A13: 5 | B13: 4 | C13: 9 | D13: 5 | E13: 2 | F13: 1 | H13: 1
A14: 6 | B14: 3 | C14: 13 | D14: 3 | E14: 3 | F14: 2 | I14: Yes
A15: 7 | B15: 4 | C15: 7 | D15: 6 | E15: 1 | F15: 3 | I15: Yes
A16: 8 | B16: 4 | C16: 5 | D16: 4 | E16: 3 | F16: 1 | I16: Yes
A17: 9 | B17: 3 | C17: 15 | D17: 3 | E17: 3 | F17: 2 | I17: Yes
A18: 10 | B18: 5 | C18: 12 | D18: 7 | E18: 1 | F18: 1
A19: 11 | B19: 4 | C19: 2 | D19: 6 | E19: 1 | F19: 3 | G19: 1 | I19: Yes
A20: 12 | B20: 3 | C20: 8 | D20: 5 | E20: 1 | F20: 3 | I20: Yes
A21: 13 | B21: 5 | C21: 4 | D21: 5 | E21: 3 | F21: 2 | G21: 1 | I21: Yes
A22: 14 | B22: 3 | C22: 16 | D22: 4 | E22: 1 | F22: 3 | I22: Yes
A23: 15 | B23: 4 | C23: 18 | D23: 5 | E23: 1 | F23: 2 | G23: 1
A24: 16 | B24: 4 | C24: 6 | D24: 6 | E24: 1 | F24: 3 | I24: Yes
A25: 17 | B25: 4 | C25: 14 | D25: 5 | E25: 2 | F25: 2 | I25: Yes
A26: 18 | B26: 4 | C26: 10 | D26: 10 | E26: 0 | F26: 3 | H26: 1
A27: Totals | B27: =IF(B2="","",SUM(B9:B26)) -> 70 | D27: =IF(B2="","",SUM(D9:D26)) -> 95 | E27: =IF(B2="","",SUM(E9:E26)) -> 30 | F27: =IF(B2="","",SUM(F9:F26)) -> 38 | G27: =IF(B2="","",SUM(G9:G26)) -> 4 | H27: =IF(B2="","",SUM(H9:H26)) -> 2 | I27: =IF(COUNTIF(I9:I26,"=Yes")=0,"",COUNTIF(I9:I26,"=Yes")) -> 13