A1: Kevin Gallagher
A2: Club | B2: Vale Do Lobo - Royal
A3: Par/SS | B3: 72/72 | D3: Num. Of Fairways | I3: =IF(B2="","",18-(COUNTIF(B9:B26,3))) -> 15
A4: Date | B4: 38688 | D4: Playing Handicap | I4: 11.600000000001993
A5: Event Place | B5: 1 | D5: Prize Money | G5: 15000
A6: Game Stats | B6: DB+ | C6: DB | D6: BI | E6: P | F6: B | G6: E | H6: A | I6: H1
B7: 2 | C7: 2 | D7: 10 | E7: 3 | F7: 1 | G7: 0 | H7: 0 | I7: 0
A8: Hole No | B8: Par | C8: Stroke Index | D8: Gross Score | E8: Points | F8: Putts | G8: Fairways | H8: Ferrets | I8: Green Regulation
A9: 1 | B9: 5 | C9: 9 | D9: 6 | E9: 2 | F9: 3 | I9: Yes
A10: 2 | B10: 4 | C10: 13 | D10: 5 | E10: 1 | F10: 3 | G10: 1 | I10: Yes
A11: 3 | B11: 4 | C11: 3 | D11: 5 | E11: 2 | F11: 2 | G11: 1 | I11: Yes
A12: 4 | B12: 4 | C12: 15 | D12: 4 | E12: 2 | F12: 2 | G12: 1 | I12: Yes
A13: 5 | B13: 5 | C13: 7 | D13: 7 | E13: 1 | F13: 2
A14: 6 | B14: 4 | C14: 1 | D14: 5 | E14: 2 | F14: 2 | G14: 1 | I14: Yes
A15: 7 | B15: 3 | C15: 17 | D15: 4 | E15: 1 | F15: 3 | I15: Yes
A16: 8 | B16: 4 | C16: 5 | D16: 5 | E16: 2 | F16: 2 | G16: 1 | I16: Yes
A17: 9 | B17: 3 | C17: 11 | D17: 3 | E17: 3 | F17: 2 | I17: Yes
A18: 10 | B18: 4 | C18: 18 | D18: 3 | E18: 3 | F18: 1 | G18: 1 | I18: Yes
A19: 11 | B19: 5 | C19: 8 | D19: 6 | E19: 2 | F19: 2 | I19: Yes
A20: 12 | B20: 4 | C20: 16 | D20: 4 | E20: 2 | F20: 1
A21: 13 | B21: 4 | C21: 2 | D21: 5 | E21: 2 | F21: 2 | I21: Yes
A22: 14 | B22: 4 | C22: 4 | D22: 7 | E22: 0 | F22: 3
A23: 15 | B23: 4 | C23: 10 | D23: 5 | E23: 2 | F23: 3 | G23: 1 | I23: Yes
A24: 16 | B24: 3 | C24: 14 | D24: 10 | E24: 0 | F24: 3 | H24: 1
A25: 17 | B25: 4 | C25: 6 | D25: 5 | E25: 2 | F25: 2 | G25: 1 | I25: Yes
A26: 18 | B26: 4 | C26: 12 | D26: 6 | E26: 1 | F26: 2
A27: Totals | B27: =IF(B2="","",SUM(B9:B26)) -> 72 | D27: =IF(B2="","",SUM(D9:D26)) -> 95 | E27: =IF(B2="","",SUM(E9:E26)) -> 30 | F27: =IF(B2="","",SUM(F9:F26)) -> 40 | G27: =IF(B2="","",SUM(G9:G26)) -> 8 | H27: =IF(B2="","",SUM(H9:H26)) -> 1 | I27: =IF(COUNTIF(I9:I26,"=Yes")=0,"",COUNTIF(I9:I26,"=Yes")) -> 13