A1: Roy Dickens
A2: Club | B2: Pinheiros Altos
A3: Par/SS | B3: 72/70 | D3: Num. Of Fairways | I3: =IF(B2="","",18-(COUNTIF(B9:B26,3))) -> 14
A4: Date | B4: 38689 | D4: Playing Handicap | I4: 27.7
A5: Event Place | B5: 4 | D5: Prize Money | G5: 6250
A6: Game Stats | B6: DB+ | C6: DB | D6: BI | E6: P | F6: B | G6: E | H6: A | I6: H1
B7: 12 | C7: 2 | D7: 3 | E7: 0 | F7: 1 | G7: 0 | H7: 0 | I7: 0
A8: Hole No | B8: Par | C8: Stroke Index | D8: Gross Score | E8: Points | F8: Putts | G8: Fairways | H8: Ferrets | I8: Green Regulation
A9: 1 | B9: 4 | C9: 9 | D9: 6 | E9: 2 | F9: 2 | G9: 1 | I9: Yes
A10: 2 | B10: 3 | C10: 17 | D10: 2 | E10: 4 | F10: 1 | I10: Yes
A11: 3 | B11: 4 | C11: 11 | D11: 7 | E11: 0 | F11: 2
A12: 4 | B12: 4 | C12: 15 | D12: 7 | E12: 0 | F12: 2 | H12: 1
A13: 5 | B13: 3 | C13: 13 | D13: 4 | E13: 2 | F13: 2 | I13: Yes
A14: 6 | B14: 4 | C14: 5 | D14: 7 | E14: 1 | F14: 3 | I14: Yes
A15: 7 | B15: 4 | C15: 7 | D15: 6 | E15: 2 | F15: 2 | G15: 1 | I15: Yes
A16: 8 | B16: 5 | C16: 1 | D16: 10 | E16: 0 | F16: 2
A17: 9 | B17: 4 | C17: 3 | D17: 10 | E17: 0 | F17: 3
A18: 10 | B18: 4 | C18: 12 | D18: 10 | E18: 0 | F18: 2
A19: 11 | B19: 4 | C19: 2 | D19: 8 | E19: 0 | F19: 2
A20: 12 | B20: 5 | C20: 6 | D20: 8 | E20: 1 | F20: 2
A21: 13 | B21: 5 | C21: 4 | D21: 10 | E21: 0 | F21: 2
A22: 14 | B22: 3 | C22: 10 | D22: 6 | E22: 1 | F22: 2
A23: 15 | B23: 4 | C23: 16 | D23: 5 | E23: 2 | F23: 2 | G23: 1 | I23: Yes
A24: 16 | B24: 4 | C24: 8 | D24: 5 | E24: 3 | F24: 2 | H24: 1 | I24: Yes
A25: 17 | B25: 3 | C25: 18 | D25: 10 | E25: 0 | F25: 3 | H25: 1
A26: 18 | B26: 4 | C26: 14 | D26: 8 | E26: 0 | F26: 2
A27: Totals | B27: =IF(B2="","",SUM(B9:B26)) -> 71 | D27: =IF(B2="","",SUM(D9:D26)) -> 129 | E27: =IF(B2="","",SUM(E9:E26)) -> 18 | F27: =IF(B2="","",SUM(F9:F26)) -> 38 | G27: =IF(B2="","",SUM(G9:G26)) -> 3 | H27: =IF(B2="","",SUM(H9:H26)) -> 3 | I27: =IF(COUNTIF(I9:I26,"=Yes")=0,"",COUNTIF(I9:I26,"=Yes")) -> 7