A1: Roy Dickens
A2: Club | B2: San Lorenzo
A3: Par/SS | B3: 72/74 | D3: Num. Of Fairways | I3: =IF(B2="","",18-(COUNTIF(B9:B26,3))) -> 14
A4: Date | B4: 38689 | D4: Playing Handicap | I4: 27.5
A5: Event Place | B5: 4 | D5: Prize Money | G5: 7500
A6: Game Stats | B6: DB+ | C6: DB | D6: Bi | E6: P | F6: B | G6: E | H6: A | I6: H1
B7: 8 | C7: 3 | D7: 5 | E7: 2 | F7: 0 | G7: 0 | H7: 0 | I7: 0
A8: Hole No | B8: Par | C8: Stroke Index | D8: Gross Score | E8: Points | F8: Putts | G8: Fairways | H8: Ferrets | I8: Green Regulation
A9: 1 | B9: 5 | C9: 7 | D9: 8 | E9: 1 | F9: 2 | G9: 1
A10: 2 | B10: 3 | C10: 15 | D10: 4 | E10: 2 | F10: 2 | I10: Yes
A11: 3 | B11: 4 | C11: 13 | D11: 7 | E11: 0 | F11: 2 | H11: 1
A12: 4 | B12: 4 | C12: 9 | D12: 8 | E12: 0 | F12: 3 | H12: 1
A13: 5 | B13: 3 | C13: 17 | D13: 5 | E13: 1 | F13: 2
A14: 6 | B14: 4 | C14: 1 | D14: 5 | E14: 3 | F14: 2 | G14: 1 | I14: Yes
A15: 7 | B15: 4 | C15: 11 | D15: 10 | E15: 0 | F15: 3
A16: 8 | B16: 5 | C16: 3 | D16: 10 | E16: 0 | F16: 2 | H16: 1
A17: 9 | B17: 4 | C17: 5 | D17: 6 | E17: 2 | F17: 1 | H17: 1
A18: 10 | B18: 5 | C18: 12 | D18: 6 | E18: 2 | F18: 2 | I18: Yes
A19: 11 | B19: 4 | C19: 14 | D19: 5 | E19: 2 | F19: 3 | G19: 1 | I19: Yes
A20: 12 | B20: 4 | C20: 2 | D20: 6 | E20: 2 | F20: 2 | G20: 1 | I20: Yes
A21: 13 | B21: 4 | C21: 8 | D21: 10 | E21: 0 | F21: 2 | H21: 1
A22: 14 | B22: 3 | C22: 18 | D22: 3 | E22: 3 | F22: 2 | I22: Yes
A23: 15 | B23: 5 | C23: 6 | D23: 8 | E23: 1 | F23: 2
A24: 16 | B24: 3 | C24: 16 | D24: 4 | E24: 2 | F24: 1
A25: 17 | B25: 4 | C25: 10 | D25: 4 | E25: 4 | F25: 2 | I25: Yes
A26: 18 | B26: 4 | C26: 4 | D26: 8 | E26: 0 | F26: 2 | H26: 1
A27: Totals | B27: =IF(B2="","",SUM(B9:B26)) -> 72 | D27: =IF(B2="","",SUM(D9:D26)) -> 117 | E27: =IF(B2="","",SUM(E9:E26)) -> 25 | F27: =IF(B2="","",SUM(F9:F26)) -> 37 | G27: =IF(B2="","",SUM(G9:G26)) -> 4 | H27: =IF(B2="","",SUM(H9:H26)) -> 6 | I27: =IF(COUNTIF(I9:I26,"=Yes")=0,"",COUNTIF(I9:I26,"=Yes")) -> 7