A1: Robert Thompson
A2: Club | B2: Victoria, Vilamoura
A3: Par/SS | B3: 72/72 | D3: Num. Of Fairways | I3: =IF(B2="","",18-(COUNTIF(B9:B26,3))) -> 14
A4: Date | B4: 38690 | D4: Playing Handicap | I4: 9.7999999999999865
A5: Event Place | B5: 3 | D5: Prize Money | G5: 10000
A6: Game Stats | B6: DB+ | C6: DB | D6: BI | E6: P | F6: B | G6: E | H6: A | I6: H1
B7: 3 | C7: 4 | D7: 5 | E7: 6 | F7: 0 | G7: 0 | H7: 0 | I7: 0
A8: Hole No | B8: Par | C8: Stroke Index | D8: Gross Score | E8: Points | F8: Putts | G8: Fairways | H8: Ferrets | I8: Green Regulation
A9: 1 | B9: 4 | C9: 9 | D9: 6 | E9: 1 | F9: 3 | I9: Yes
A10: 2 | B10: 4 | C10: 13 | D10: 6 | E10: 0 | F10: 1
A11: 3 | B11: 5 | C11: 5 | D11: 6 | E11: 2 | F11: 3 | G11: 1 | I11: Yes
A12: 4 | B12: 4 | C12: 3 | D12: 5 | E12: 2 | F12: 2 | I12: Yes
A13: 5 | B13: 5 | C13: 11 | D13: 5 | E13: 2 | F13: 0 | G13: 1
A14: 6 | B14: 3 | C14: 15 | D14: 3 | E14: 2 | F14: 1
A15: 7 | B15: 4 | C15: 1 | D15: 8 | E15: 0 | F15: 2 | H15: 2
A16: 8 | B16: 3 | C16: 17 | D16: 3 | E16: 2 | F16: 2 | I16: Yes
A17: 9 | B17: 4 | C17: 7 | D17: 6 | E17: 1 | F17: 3 | I17: Yes
A18: 10 | B18: 4 | C18: 10 | D18: 6 | E18: 1 | F18: 3 | I18: Yes
A19: 11 | B19: 4 | C19: 14 | D19: 8 | E19: 0 | F19: 2 | H19: 1
A20: 12 | B20: 5 | C20: 2 | D20: 10 | E20: 0 | F20: 3 | H20: 2
A21: 13 | B21: 3 | C21: 18 | D21: 4 | E21: 1 | F21: 3 | I21: Yes
A22: 14 | B22: 4 | C22: 6 | D22: 5 | E22: 2 | F22: 2 | I22: Yes
A23: 15 | B23: 4 | C23: 16 | D23: 4 | E23: 2 | F23: 1 | G23: 1
A24: 16 | B24: 3 | C24: 12 | D24: 3 | E24: 2 | F24: 2 | I24: Yes
A25: 17 | B25: 5 | C25: 8 | D25: 5 | E25: 3 | F25: 2 | I25: Yes
A26: 18 | B26: 4 | C26: 4 | D26: 5 | E26: 2 | F26: 2 | I26: Yes
A27: Totals | B27: =IF(B2="","",SUM(B9:B26)) -> 72 | D27: =IF(B2="","",SUM(D9:D26)) -> 98 | E27: =IF(B2="","",SUM(E9:E26)) -> 25 | F27: =IF(B2="","",SUM(F9:F26)) -> 37 | G27: =IF(B2="","",SUM(G9:G26)) -> 3 | H27: =IF(B2="","",SUM(H9:H26)) -> 5 | I27: =IF(COUNTIF(I9:I26,"=Yes")=0,"",COUNTIF(I9:I26,"=Yes")) -> 11