A1: David Braithwaite
A2: Club | B2: Crowborough Beacon
A3: Par/SS | B3: 71/69 | D3: Num. Of Fairways | I3: =IF(B2="","",18-(COUNTIF(B9:B26,3))) -> 14
A4: Date | B4: 40302 | D4: Playing Handicap | I4: 12
A5: Event Place | B5: 2 | C5: M | D5: Prize Money | G5: 31250
A6: Game Stats | B6: DB+ | C6: DB | D6: Bi | E6: P | F6: B | G6: E | H6: A | I6: H1
B7: 1 | C7: 3 | D7: 8 | E7: 6 | F7: 0 | G7: 0 | H7: 0 | I7: 0
A8: Hole No | B8: Par | C8: Stroke Index | D8: Gross Score | E8: Points | F8: Putts | G8: Fairways | H8: Ferrets | I8: Green Regulation
A9: 1 | B9: 4 | C9: 9 | D9: 5 | E9: 2 | F9: 2 | I9: Yes
A10: 2 | B10: 4 | C10: 1 | D10: 5 | E10: 2 | F10: 2 | I10: Yes
A11: 3 | B11: 3 | C11: 15 | D11: 3 | E11: 2 | F11: 2 | I11: Yes
A12: 4 | B12: 4 | C12: 17 | D12: 4 | E12: 2 | F12: 2 | G12: 1 | I12: Yes
A13: 5 | B13: 4 | C13: 3 | D13: 7 | E13: 0 | F13: 2
A14: 6 | B14: 3 | C14: 11 | D14: 5 | E14: 1 | F14: 3 | I14: Yes
A15: 7 | B15: 5 | C15: 7 | D15: 6 | E15: 2 | F15: 2 | I15: Yes
A16: 8 | B16: 4 | C16: 13 | D16: 5 | E16: 1 | F16: 1 | G16: 1
A17: 9 | B17: 4 | C17: 5 | D17: 5 | E17: 2 | F17: 2 | G17: 1 | I17: Yes
A18: 10 | B18: 5 | C18: 8 | D18: 5 | E18: 3 | F18: 1 | I18: Yes
A19: 11 | B19: 4 | C19: 14 | D19: 4 | E19: 2 | F19: 2 | I19: Yes
A20: 12 | B20: 4 | C20: 2 | D20: 5 | E20: 2 | F20: 2 | I20: Yes
A21: 13 | B21: 3 | C21: 18 | D21: 5 | E21: 0 | F21: 2
A22: 14 | B22: 5 | C22: 10 | D22: 5 | E22: 3 | F22: 2 | G22: 1 | I22: Yes
A23: 15 | B23: 4 | C23: 6 | D23: 4 | E23: 3 | F23: 2 | I23: Yes
A24: 16 | B24: 4 | C24: 12 | D24: 5 | E24: 2 | F24: 2 | I24: Yes
A25: 17 | B25: 3 | C25: 16 | D25: 4 | E25: 1 | F25: 3 | I25: Yes
A26: 18 | B26: 4 | C26: 4 | D26: 6 | E26: 1 | F26: 2 | G26: 1
A27: Totals | B27: =IF(B2="","",SUM(B9:B26)) -> 71 | D27: =IF(B2="","",SUM(D9:D26)) -> 88 | E27: =IF(B2="","",SUM(E9:E26)) -> 31 | F27: =IF(B2="","",SUM(F9:F26)) -> 36 | G27: =IF(B2="","",SUM(G9:G26)) -> 5 | H27: =IF(B2="","",SUM(H9:H26)) -> 0 | I27: =IF(COUNTIF(I9:I26,"=Yes")=0,"",COUNTIF(I9:I26,"=Yes")) -> 14