A1: Martin Cox
A2: Club | B2: Crowborough Beacon
A3: Par/SS | B3: 71/69 | D3: Num. Of Fairways | I3: =IF(B2="","",18-(COUNTIF(B9:B26,3))) -> 14
A4: Date | B4: 40302 | D4: Playing Handicap | I4: 13.7
A5: Event Place | B5: 9 | C5: M | D5: Prize Money | G5: 15000
A6: Game Stats | B6: DB+ | C6: DB | D6: Bi | E6: P | F6: B | G6: E | H6: A | I6: H1
B7: 4 | C7: 6 | D7: 5 | E7: 2 | F7: 1 | G7: 0 | H7: 0 | I7: 0
A8: Hole No | B8: Par | C8: Stroke Index | D8: Gross Score | E8: Points | F8: Putts | G8: Fairways | H8: Ferrets | I8: Green Regulation
A9: 1 | B9: 4 | C9: 9 | D9: 6 | E9: 1 | F9: 2 | G9: 1
A10: 2 | B10: 4 | C10: 1 | D10: 5 | E10: 2 | F10: 2 | G10: 1 | I10: Yes
A11: 3 | B11: 3 | C11: 15 | D11: 5 | E11: 0 | F11: 3
A12: 4 | B12: 4 | C12: 17 | D12: 4 | E12: 2 | F12: 1
A13: 5 | B13: 4 | C13: 3 | D13: 6 | E13: 1 | F13: 3 | I13: Yes
A14: 6 | B14: 3 | C14: 11 | D14: 10 | E14: 0 | F14: 3 | H14: 1
A15: 7 | B15: 5 | C15: 7 | D15: 6 | E15: 2 | F15: 2 | G15: 1 | I15: Yes
A16: 8 | B16: 4 | C16: 13 | D16: 5 | E16: 2 | F16: 2 | G16: 1 | I16: Yes
A17: 9 | B17: 4 | C17: 5 | D17: 6 | E17: 1 | F17: 2 | G17: 1
A18: 10 | B18: 5 | C18: 8 | D18: 6 | E18: 2 | F18: 2 | I18: Yes
A19: 11 | B19: 4 | C19: 14 | D19: 6 | E19: 1 | F19: 2
A20: 12 | B20: 4 | C20: 2 | D20: 8 | E20: 0 | F20: 2 | G20: 1
A21: 13 | B21: 3 | C21: 18 | D21: 5 | E21: 0 | F21: 2
A22: 14 | B22: 5 | C22: 10 | D22: 6 | E22: 2 | F22: 2 | G22: 1 | I22: Yes
A23: 15 | B23: 4 | C23: 6 | D23: 10 | E23: 0 | F23: 3 | H23: 2
A24: 16 | B24: 4 | C24: 12 | D24: 4 | E24: 3 | F24: 2 | G24: 1 | I24: Yes
A25: 17 | B25: 3 | C25: 16 | D25: 2 | E25: 3 | F25: 1 | I25: Yes
A26: 18 | B26: 4 | C26: 4 | D26: 7 | E26: 0 | F26: 2 | G26: 1
A27: Totals | B27: =IF(B2="","",SUM(B9:B26)) -> 71 | D27: =IF(B2="","",SUM(D9:D26)) -> 107 | E27: =IF(B2="","",SUM(E9:E26)) -> 22 | F27: =IF(B2="","",SUM(F9:F26)) -> 38 | G27: =IF(B2="","",SUM(G9:G26)) -> 9 | H27: =IF(B2="","",SUM(H9:H26)) -> 3 | I27: =IF(COUNTIF(I9:I26,"=Yes")=0,"",COUNTIF(I9:I26,"=Yes")) -> 8