A1: Season 9 - April 1st 2007 to 31st March 2008
A2: MGA World Tour Driving Accuracy (Fairways Hit)
B3: Statistics updated | C3: =TODAY() -> 39532
A4: Pos | B4: Player | C4: Original Handicap | D4: Current Handicap | E4: Playing Handicap | F4: Played | G4: Total Number of Fairways | H4: Total Fairways Hit | I4: Fairway %
A5: 1 | B5: Kevin Gallagher | C5: 11.3 | D5: 11.500000000000991 | E5: =D5 -> 11.500000000000991 | F5: 27 | G5: 363 | H5: 205 | I5: =IF(F5=0,"0 %",ROUND((H5/G5)*100,2) &" %") -> 56.47 %
A6: =A5+1 -> 2 | B6: Jeff Gibbons | C6: 20.9 | D6: 19.400000000002009 | E6: =D6 -> 19.400000000002009 | F6: 16 | G6: 224 | H6: 121 | I6: =IF(F6=0,"0 %",ROUND((H6/G6)*100,2) &" %") -> 54.02 %
A7: =A6+1 -> 3 | B7: Robert Thompson | C7: 8.7 | D7: 8.5 | E7: =D7 -> 8.5 | F7: 29 | G7: 385 | H7: 204 | I7: =IF(F7=0,"0 %",ROUND((H7/G7)*100,2) &" %") -> 52.99 %
A8: =A7+1 -> 4 | B8: Keith Mendelson | C8: 14.2 | D8: 14.4 | E8: =D8 -> 14.4 | F8: 20 | G8: 279 | H8: 110 | I8: =IF(F8=0,"0 %",ROUND((H8/G8)*100,2) &" %") -> 39.43 %
A9: =A8+1 -> 5 | B9: Dave Andrews | C9: 17.9 | D9: 18.900000000001 | E9: =D9 -> 18.900000000001 | F9: 7 | G9: 92 | H9: 54 | I9: =IF(F9=0,"0 %",ROUND((H9/G9)*100,2) &" %") -> 58.7 %
A10: =A9+1 -> 6 | B10: Jon Dey | C10: 37.0 | D10: 37.1 | E10: =D10 -> 37.1 | F10: 1 | G10: 14 | H10: 8 | I10: =IF(F10=0,"0 %",ROUND((H10/G10)*100,2) &" %") -> 57.14 %
A11: =A10+1 -> 7 | B11: Simon Owens | C11: 13.2 | D11: 13.3 | E11: =D11 -> 13.3 | F11: 1 | G11: 14 | H11: 7 | I11: =IF(F11=0,"0 %",ROUND((H11/G11)*100,2) &" %") -> 50 %
A12: =A11+1 -> 8 | B12: Simon Thompson | C12: 13.7 | D12: 12.0 | E12: =D12 -> 12 | F12: 8 | G12: 107 | H12: 53 | I12: =IF(F12=0,"0 %",ROUND((H12/G12)*100,2) &" %") -> 49.53 %
A13: =A12+1 -> 9 | B13: John Press | C13: 13.5 | D13: 14.6 | E13: =D13 -> 14.6 | F13: 2 | G13: 27 | H13: 13 | I13: =IF(F13=0,"0 %",ROUND((H13/G13)*100,2) &" %") -> 48.15 %
A14: =A13+1 -> 10 | B14: Alan Baldwin | C14: 20.3 | D14: 20.3 | E14: =D14 -> 20.3 | F14: 2 | G14: 24 | H14: 11 | I14: =IF(F14=0,"0 %",ROUND((H14/G14)*100,2) &" %") -> 45.83 %
A15: =A14+1 -> 11 | B15: Matthew Carter | C15: 21.2 | D15: 20.2 | E15: =D15 -> 20.2 | F15: 7 | G15: 95 | H15: 41 | I15: =IF(F15=0,"0 %",ROUND((H15/G15)*100,2) &" %") -> 43.16 %
A16: =A15+1 -> 12 | B16: Martin Cox | C16: 12.8 | D16: 13.5 | E16: =D16 -> 13.5 | F16: 5 | G16: 65 | H16: 28 | I16: =IF(F16=0,"0 %",ROUND((H16/G16)*100,2) &" %") -> 43.08 %
A17: =A16+1 -> 13 | B17: Alan Hopkins | C17: 7.1 | D17: 8.2 | E17: =D17 -> 8.2 | F17: 3 | G17: 41 | H17: 14 | I17: =IF(F17=0,"0 %",ROUND((H17/G17)*100,2) &" %") -> 34.15 %
A18: =A17+1 -> 14 | B18: Jeff Colbrook | C18: 14.2 | D18: 15.4 | E18: =D18 -> 15.4 | F18: 7 | G18: 98 | H18: 33 | I18: =IF(F18=0,"0 %",ROUND((H18/G18)*100,2) &" %") -> 33.67 %
A19: =A18+1 -> 15 | B19: Michael Trimmings | C19: 22.2 | D19: 22.2 | E19: =D19 -> 22.2 | F19: 7 | G19: 98 | H19: 33 | I19: =IF(F19=0,"0 %",ROUND((H19/G19)*100,2) &" %") -> 33.67 %
A20: =A19+1 -> 16 | B20: Andy Benson | C20: 6.9 | D20: 7.5000000000010001 | E20: =D20 -> 7.5000000000010001 | F20: 3 | G20: 43 | H20: 14 | I20: =IF(F20=0,"0 %",ROUND((H20/G20)*100,2) &" %") -> 32.56 %
A21: =A20+1 -> 17 | B21: Ian Edwards | C21: 15.7 | D21: 15.3 | E21: =D21 -> 15.3 | F21: 2 | G21: 28 | H21: 9 | I21: =IF(F21=0,"0 %",ROUND((H21/G21)*100,2) &" %") -> 32.14 %
A22: =A21+1 -> 18 | B22: Andrew Baldwin | C22: 17.5 | D22: 17.6 | E22: =D22 -> 17.6 | F22: 4 | G22: 55 | H22: 17 | I22: =IF(F22=0,"0 %",ROUND((H22/G22)*100,2) &" %") -> 30.91 %
A23: =A22+1 -> 19 | B23: Dave Rouse | C23: 25.1 | D23: 26.7 | E23: =D23 -> 26.7 | F23: 5 | G23: 69 | H23: 19 | I23: =IF(F23=0,"0 %",ROUND((H23/G23)*100,2) &" %") -> 27.54 %
A24: =A23+1 -> 20 | B24: Roy Dickens | C24: 29.6 | D24: 31.3 | E24: =D24 -> 31.3 | F24: 6 | G24: 85 | H24: 23 | I24: =IF(F24=0,"0 %",ROUND((H24/G24)*100,2) &" %") -> 27.06 %
A25: =A24+1 -> 21 | B25: Paul Carter | C25: 12.3 | D25: 14.7 | E25: =D25 -> 14.7 | F25: 7 | G25: 95 | H25: 25 | I25: =IF(F25=0,"0 %",ROUND((H25/G25)*100,2) &" %") -> 26.32 %
A26: =A25+1 -> 22 | B26: Martin Bould | C26: 19.4 | D26: 20.3 | E26: =D26 -> 20.3 | F26: 4 | G26: 53 | H26: 12 | I26: =IF(F26=0,"0 %",ROUND((H26/G26)*100,2) &" %") -> 22.64 %
A27: =A26+1 -> 23 | B27: Paul Baldwin | C27: 17.4 | D27: 18.4 | E27: =D27 -> 18.4 | F27: 1 | G27: 14 | H27: 2 | I27: =IF(F27=0,"0 %",ROUND((H27/G27)*100,2) &" %") -> 14.29 %
A28: =A27+1 -> 24 | B28: Malcolm Rouse | C28: 42.9 | D28: 43.9 | E28: =D28 -> 43.9 | F28: 1 | G28: 14 | H28: 1 | I28: =IF(F28=0,"0 %",ROUND((H28/G28)*100,2) &" %") -> 7.14 %
A29: =A28+1 -> 25 | B29: Steve Tilling | C29: 16.5 | D29: 16.5 | E29: =D29 -> 16.5 | F29: 0 | G29: 0 | H29: 0 | I29: =IF(F29=0,"0 %",ROUND((H29/G29)*100,2) &" %") -> 0 %
A30: =A29+1 -> 26 | B30: Neil Leah | C30: 15.0 | D30: 15.0 | E30: =D30 -> 15 | F30: 0 | G30: 0 | H30: 0 | I30: =IF(F30=0,"0 %",ROUND((H30/G30)*100,2) &" %") -> 0 %
A31: =A30+1 -> 27 | B31: Keith Johns | C31: 24.3 | D31: 24.3 | E31: =D31 -> 24.3 | F31: 0 | G31: 0 | H31: 0 | I31: =IF(F31=0,"0 %",ROUND((H31/G31)*100,2) &" %") -> 0 %
A32: =A31+1 -> 28 | B32: Dave White | C32: 22.1 | D32: 22.1 | E32: =D32 -> 22.1 | F32: 0 | G32: 0 | H32: 0 | I32: =IF(F32=0,"0 %",ROUND((H32/G32)*100,2) &" %") -> 0 %
A33: =A32+1 -> 29 | B33: Danny Marsh | C33: 8.1 | D33: 8.1 | E33: =D33 -> 8.1 | F33: 0 | G33: 0 | H33: 0 | I33: =IF(F33=0,"0 %",ROUND((H33/G33)*100,2) &" %") -> 0 %
A34: =A33+1 -> 30 | B34: Clive Ferris | C34: 26.0 | D34: 26.0 | E34: =D34 -> 26 | F34: 0 | G34: 0 | H34: 0 | I34: =IF(F34=0,"0 %",ROUND((H34/G34)*100,2) &" %") -> 0 %
A35: =A34+1 -> 31 | B35: Chris Manning | C35: 22.7 | D35: 22.7 | E35: =D35 -> 22.7 | F35: 0 | G35: 0 | H35: 0 | I35: =IF(F35=0,"0 %",ROUND((H35/G35)*100,2) &" %") -> 0 %
A36: =A35+1 -> 32 | B36: Andrew Knight | C36: 21.4 | D36: 21.4 | E36: =D36 -> 21.4 | F36: 0 | G36: 0 | H36: 0 | I36: =IF(F36=0,"0 %",ROUND((H36/G36)*100,2) &" %") -> 0 %