A1: Season 9 - April 1st 2007 to 31st March 2008
A2: MGA World Tour Putting Statistics
B3: Statistics updated | C3: =TODAY() -> 39538
A4: Pos | B4: Player | C4: Original Handicap | D4: Current Handicap | E4: Playing Handicap | F4: Played | G4: Total Putts | H4: Ave per Round | I4: Ave Per Hole | J4: Best Round | K4: Worst Round
A5: 1 | B5: Jeff Gibbons | C5: 20.9 | D5: 19.600000000002009 | E5: =D5 -> 19.600000000002009 | F5: 17 | G5: 556 | H5: 32.705882352941174 | I5: =IF(G5=0,"",G5/(F5*18)) -> 1.8169934640522876 | J5: 29 | K5: 35
A6: =A5+1 -> 2 | B6: Kevin Gallagher | C6: 11.3 | D6: 12.000000000000991 | E6: =D6 -> 12.000000000000991 | F6: 28 | G6: 921 | H6: 32.892857142857146 | I6: =IF(G6=0,"",G6/(F6*18)) -> 1.8273809523809523 | J6: 25 | K6: 44
A7: =A6+1 -> 3 | B7: Robert Thompson | C7: 8.7 | D7: 8.7 | E7: =D7 -> 8.7 | F7: 30 | G7: 988 | H7: 32.93333333333333 | I7: =IF(G7=0,"",G7/(F7*18)) -> 1.8296296296296297 | J7: 27 | K7: 40
A8: =A7+1 -> 4 | B8: Keith Mendelson | C8: 14.2 | D8: 14.6 | E8: =D8 -> 14.6 | F8: 21 | G8: 722 | H8: 34.38095238095238 | I8: =IF(G8=0,"",G8/(F8*18)) -> 1.91005291005291 | J8: 30 | K8: 40
A9: =A8+1 -> 5 | B9: Jeff Colbrook | C9: 14.2 | D9: 15.6 | E9: =D9 -> 15.6 | F9: 8 | G9: 250 | H9: 31.25 | I9: =IF(G9=0,"",G9/(F9*18)) -> 1.7361111111111112 | J9: 25 | K9: 34
A10: =A9+1 -> 6 | B10: Dave Andrews | C10: 17.9 | D10: 18.900000000001 | E10: =D10 -> 18.900000000001 | F10: 7 | G10: 221 | H10: 31.571428571428573 | I10: =IF(G10=0,"",G10/(F10*18)) -> 1.753968253968254 | J10: 26 | K10: 35
A11: =A10+1 -> 7 | B11: Simon Owens | C11: 13.2 | D11: 13.3 | E11: =D11 -> 13.3 | F11: 1 | G11: 32 | H11: 32.00 | I11: =IF(G11=0,"",G11/(F11*18)) -> 1.7777777777777777 | J11: 32 | K11: 32
A12: =A11+1 -> 8 | B12: Andy Benson | C12: 6.9 | D12: 7.5000000000010001 | E12: =D12 -> 7.5000000000010001 | F12: 3 | G12: 100 | H12: 33.333333333333336 | I12: =IF(G12=0,"",G12/(F12*18)) -> 1.8518518518518519 | J12: 31 | K12: 36
A13: =A12+1 -> 9 | B13: Jon Dey | C13: 37.0 | D13: 37.1 | E13: =D13 -> 37.1 | F13: 1 | G13: 34 | H13: 34.00 | I13: =IF(G13=0,"",G13/(F13*18)) -> 1.8888888888888888 | J13: 34 | K13: 34
A14: =A13+1 -> 10 | B14: Martin Cox | C14: 12.8 | D14: 13.5 | E14: =D14 -> 13.5 | F14: 5 | G14: 171 | H14: 34.20 | I14: =IF(G14=0,"",G14/(F14*18)) -> 1.90 | J14: 27 | K14: 40
A15: =A14+1 -> 11 | B15: Alan Hopkins | C15: 7.1 | D15: 8.2 | E15: =D15 -> 8.2 | F15: 3 | G15: 105 | H15: 35.00 | I15: =IF(G15=0,"",G15/(F15*18)) -> 1.9444444444444444 | J15: 31 | K15: 42
A16: =A15+1 -> 12 | B16: Alan Baldwin | C16: 20.3 | D16: 20.3 | E16: =D16 -> 20.3 | F16: 2 | G16: 71 | H16: 35.50 | I16: =IF(G16=0,"",G16/(F16*18)) -> 1.9722222222222223 | J16: 30 | K16: 41
A17: =A16+1 -> 13 | B17: Paul Baldwin | C17: 17.4 | D17: 18.6 | E17: =D17 -> 18.6 | F17: 2 | G17: 72 | H17: 36.00 | I17: =IF(G17=0,"",G17/(F17*18)) -> 2.00 | J17: 36 | K17: 36
A18: =A17+1 -> 14 | B18: Andrew Baldwin | C18: 17.5 | D18: 18.1 | E18: =D18 -> 18.1 | F18: 5 | G18: 181 | H18: 36.20 | I18: =IF(G18=0,"",G18/(F18*18)) -> 2.0111111111111111 | J18: 34 | K18: 40
A19: =A18+1 -> 15 | B19: John Press | C19: 13.5 | D19: 14.8 | E19: =D19 -> 14.8 | F19: 3 | G19: 109 | H19: 36.333333333333336 | I19: =IF(G19=0,"",G19/(F19*18)) -> 2.0185185185185186 | J19: 35 | K19: 37
A20: =A19+1 -> 16 | B20: Dave Rouse | C20: 25.1 | D20: 26.4 | E20: =D20 -> 26.4 | F20: 6 | G20: 219 | H20: 36.50 | I20: =IF(G20=0,"",G20/(F20*18)) -> 2.0277777777777777 | J20: 35 | K20: 39
A21: =A20+1 -> 17 | B21: Martin Bould | C21: 19.4 | D21: 20.3 | E21: =D21 -> 20.3 | F21: 4 | G21: 146 | H21: 36.50 | I21: =IF(G21=0,"",G21/(F21*18)) -> 2.0277777777777777 | J21: 35 | K21: 40
A22: =A21+1 -> 18 | B22: Simon Thompson | C22: 13.7 | D22: 12.1 | E22: =D22 -> 12.1 | F22: 9 | G22: 330 | H22: 36.666666666666664 | I22: =IF(G22=0,"",G22/(F22*18)) -> 2.0370370370370372 | J22: 30 | K22: 43
A23: =A22+1 -> 19 | B23: Paul Carter | C23: 12.3 | D23: 14.7 | E23: =D23 -> 14.7 | F23: 7 | G23: 258 | H23: 36.857142857142854 | I23: =IF(G23=0,"",G23/(F23*18)) -> 2.0476190476190474 | J23: 32 | K23: 40
A24: =A23+1 -> 20 | B24: Ian Edwards | C24: 15.7 | D24: 11.8 | E24: =D24 -> 11.8 | F24: 3 | G24: 114 | H24: 38.00 | I24: =IF(G24=0,"",G24/(F24*18)) -> 2.1111111111111112 | J24: 34 | K24: 41
A25: =A24+1 -> 21 | B25: Matthew Carter | C25: 21.2 | D25: 20.2 | E25: =D25 -> 20.2 | F25: 7 | G25: 269 | H25: 38.428571428571431 | I25: =IF(G25=0,"",G25/(F25*18)) -> 2.1349206349206349 | J25: 36 | K25: 41
A26: =A25+1 -> 22 | B26: Andrew Knight | C26: 21.2 | D26: 20.2 | E26: =D26 -> 20.2 | F26: 7 | G26: 269 | H26: 38.428571428571431 | I26: =IF(G26=0,"",G26/(F26*18)) -> 2.1349206349206349 | J26: 36 | K26: 41
A27: =A26+1 -> 23 | B27: Michael Trimmings | C27: 22.2 | D27: 22.4 | E27: =D27 -> 22.4 | F27: 8 | G27: 308 | H27: 38.50 | I27: =IF(G27=0,"",G27/(F27*18)) -> 2.1388888888888888 | J27: 35 | K27: 45
A28: =A27+1 -> 24 | B28: Roy Dickens | C28: 29.6 | D28: 30.6 | E28: =D28 -> 30.6 | F28: 7 | G28: 278 | H28: 39.714285714285715 | I28: =IF(G28=0,"",G28/(F28*18)) -> 2.2063492063492065 | J28: 35 | K28: 43
A29: =A28+1 -> 25 | B29: Malcolm Rouse | C29: 42.9 | D29: 43.9 | E29: =D29 -> 43.9 | F29: 1 | G29: 43 | H29: 43.00 | I29: =IF(G29=0,"",G29/(F29*18)) -> 2.3888888888888888 | J29: 43 | K29: 43
A30: =A29+1 -> 26 | B30: Steve Tilling | C30: 16.5 | D30: 16.5 | E30: =D30 -> 16.5 | F30: 0 | G30: 0 | H30: 0.00 | I30: =IF(G30=0,"",G30/(F30*18)) ->  | J30: 0 | K30: 0
A31: =A30+1 -> 27 | B31: Neil Leah | C31: 15.0 | D31: 15.0 | E31: =D31 -> 15 | F31: 0 | G31: 0 | H31: 0.00 | I31: =IF(G31=0,"",G31/(F31*18)) ->  | J31: 0 | K31: 0
A32: =A31+1 -> 28 | B32: Keith Johns | C32: 22.1 | D32: 22.1 | E32: =D32 -> 22.1 | F32: 0 | G32: 0 | H32: 0.00 | I32: =IF(G32=0,"",G32/(F32*18)) ->  | J32: 0 | K32: 0
A33: =A32+1 -> 29 | B33: Dave White | C33: 22.1 | D33: 22.1 | E33: =D33 -> 22.1 | F33: 0 | G33: 0 | H33: 0.00 | I33: =IF(G33=0,"",G33/(F33*18)) ->  | J33: 0 | K33: 0
A34: =A33+1 -> 30 | B34: Danny Marsh | C34: 8.1 | D34: 8.1 | E34: =D34 -> 8.1 | F34: 0 | G34: 0 | H34: 0.00 | I34: =IF(G34=0,"",G34/(F34*18)) ->  | J34: 0 | K34: 0
A35: =A34+1 -> 31 | B35: Clive Ferris | C35: 26.0 | D35: 26.0 | E35: =D35 -> 26 | F35: 0 | G35: 0 | H35: 0.00 | I35: =IF(G35=0,"",G35/(F35*18)) ->  | J35: 0 | K35: 0
A36: =A35+1 -> 32 | B36: Chris Manning | C36: 22.7 | D36: 22.7 | E36: =D36 -> 22.7 | F36: 0 | G36: 0 | H36: 0.00 | I36: =IF(G36=0,"",G36/(F36*18)) ->  | J36: 0 | K36: 0