A1: Simon Owens
A2: Club | B2: Chelsfield Lakes
A3: Par/SS | B3: 71/68 | D3: Num. Of Fairways | I3: =IF(B2="","",18-(COUNTIF(B9:B26,3))) -> 14
A4: Date | B4: 41524 | D4: Playing Handicap | I4: 14.6
A5: Event Place | B5: 16 | C5: M | D5: Prize Money | G5: 2500
A6: Game Stats | B6: DB+ | C6: DB | D6: BI | E6: P | F6: B | G6: E | H6: A | I6: H1
B7: 5 | C7: 3 | D7: 5 | E7: 2 | F7: 3 | G7: 0 | H7: 0 | I7: 0
A8: Hole No | B8: Par | C8: Stroke Index | D8: Gross Score | E8: Points | F8: Putts | G8: Fairways | H8: Ferrets | I8: Green Regulation
A9: 1 | B9: 4 | C9: 11 | D9: 5 | E9: 2 | F9: 1
A10: 2 | B10: 3 | C10: 3 | D10: 3 | E10: 3 | F10: 1 | I10: Yes
A11: 3 | B11: 4 | C11: 13 | D11: 5 | E11: 2 | F11: 2 | G11: 1 | I11: Yes
A12: 4 | B12: 4 | C12: 1 | D12: 10 | E12: 0 | F12: 2 | H12: 2
A13: 5 | B13: 3 | C13: 7 | D13: 5 | E13: 1 | F13: 2
A14: 6 | B14: 5 | C14: 15 | D14: 6 | E14: 2 | F14: 2 | I14: Yes
A15: 7 | B15: 5 | C15: 5 | D15: 4 | E15: 4 | F15: 1 | I15: Yes
A16: 8 | B16: 4 | C16: 17 | D16: 5 | E16: 1 | F16: 2
A17: 9 | B17: 4 | C17: 9 | D17: 7 | E17: 0 | F17: 3 | H17: 1
A18: 10 | B18: 4 | C18: 6 | D18: 3 | E18: 4 | F18: 1 | I18: Yes
A19: 11 | B19: 4 | C19: 18 | D19: 5 | E19: 1 | F19: 2
A20: 12 | B20: 4 | C20: 8 | D20: 7 | E20: 0 | F20: 2
A21: 13 | B21: 5 | C21: 2 | D21: 8 | E21: 0 | F21: 3
A22: 14 | B22: 4 | C22: 16 | D22: 6 | E22: 0 | F22: 3
A23: 15 | B23: 3 | C23: 12 | D23: 2 | E23: 4 | F23: 1 | I23: Yes
A24: 16 | B24: 4 | C24: 4 | D24: 4 | E24: 3 | F24: 1 | I24: Yes
A25: 17 | B25: 3 | C25: 14 | D25: 10 | E25: 0 | F25: 1
A26: 18 | B26: 4 | C26: 10 | D26: 6 | E26: 1 | F26: 2
A27: Totals | B27: =IF(B2="","",SUM(B9:B26)) -> 71 | D27: =IF(B2="","",SUM(D9:D26)) -> 101 | E27: =IF(B2="","",SUM(E9:E26)) -> 28 | F27: =IF(B2="","",SUM(F9:F26)) -> 32 | G27: =IF(B2="","",SUM(G9:G26)) -> 1 | H27: =IF(B2="","",SUM(H9:H26)) -> 3 | I27: =IF(COUNTIF(I9:I26,"=Yes")=0,"",COUNTIF(I9:I26,"=Yes")) -> 7