A1: CHINNEY CHOO - 2007/2008
B3: Rousey Invitation 24/4/07 | C3: Mendy's Masters 30/6/07 | D3: Tubby Trophy 10/11/07 | E3: Bubble Open 22/9/07 | F3: Thommo Classic 29/3/08 | G3: Total
A4: EUROPE
A5: R Thompson | B5: 19 | C5: 29 | D5: 24 | E5: 37 | F5: 27 | G5: =SUM(B5:F5) -> 136
A6: R Dickens | B6: 17 | C6: 29 | D6: 0 | E6: 34 | F6: 35 | G6: =SUM(B6:F6) -> 115
A7: A Baldwin (Jnr) | B7: 19 | C7: 23 | D7: 0 | E7: 35 | F7: 21 | G7: =SUM(B7:F7) -> 98
A8: I Edwards | B8: 0 | C8: 34 | D8: 27 | E8: 0 | F8: 35 | G8: =SUM(B8:F8) -> 96
A9: J Gibbons | B9: 0 | C9: 28 | D9: 0 | E9: 38 | F9: 25 | G9: =SUM(B9:F9) -> 91
A10: J Colbrook | B10: 0 | C10: 0 | D10: 25 | E10: 37 | F10: 24 | G10: =SUM(B10:F10) -> 86
A11: K Mendelson | B11: 0 | C11: 30 | D11: 28 | E11: 0 | F11: 26 | G11: =SUM(B11:F11) -> 84
A12: M Cox | B12: 10 | C12: 35 | D12: 21 | E12: 0 | F12: 0 | G12: =SUM(B12:F12) -> 66
A13: J Dey | B13: 0 | C13: 29 | D13: 0 | E13: 0 | F13: 0 | G13: =SUM(B13:F13) -> 29
A14: A Baldwin (Snr) | B14: 17 | C14: 0 | D14: 0 | E14: 0 | F14: 0 | G14: =SUM(B14:F14) -> 17
A15: M Bould | B15: 0 | C15: 0 | D15: 0 | E15: 0 | F15: 0 | G15: =SUM(B15:F15) -> 0
A16: D Andrews | B16: 0 | C16: 0 | D16: 0 | E16: 0 | F16: 0 | G16: =SUM(B16:F16) -> 0
A17: C Manning | B17: 0 | C17: 0 | D17: 0 | E17: 0 | F17: 0 | G17: =SUM(B17:F17) -> 0
A18: K Johns | B18: 0 | C18: 0 | D18: 0 | E18: 0 | F18: 0 | G18: =SUM(B18:F18) -> 0
A19: D White | B19: 0 | C19: 0 | D19: 0 | E19: 0 | F19: 0 | G19: =SUM(B19:F19) -> 0
A20: D Archer | B20: 0 | C20: 0 | D20: 0 | E20: 0 | F20: 0 | G20: =SUM(B20:F20) -> 0
B21: =SUM(B5:B20) -> 82 | C21: =SUM(C5:C20) -> 237 | D21: =SUM(D5:D20) -> 125 | E21: =SUM(E5:E20) -> 181 | F21: =SUM(F5:F20) -> 193 | G21: =SUM(G5:G20) -> 818
A22: USA
A23: D Rouse | B23: 14 | C23: 27 | D23: 26 | E23: 35 | F23: 33 | G23: =SUM(B23:F23) -> 135
A24: S Thompson | B24: 17 | C24: 35 | D24: 0 | E24: 41 | F24: 28 | G24: =SUM(B24:F24) -> 121
A25: K Gallagher | B25: 14 | C25: 34 | D25: 23 | E25: 28 | F25: 20 | G25: =SUM(B25:F25) -> 119
A26: M Carter | B26: 20 | C26: 0 | D26: 30 | E26: 34 | F26: 0 | G26: =SUM(B26:F26) -> 84
A27: P Carter | B27: 14 | C27: 0 | D27: 17 | E27: 33 | F27: 0 | G27: =SUM(B27:F27) -> 64
A28: P Baldwin | B28: 18 | C28: 0 | D28: 0 | E28: 0 | F28: 25 | G28: =SUM(B28:F28) -> 43
A29: M Trimmings | B29: 0 | C29: 18 | D29: 0 | E29: 0 | F29: 25 | G29: =SUM(B29:F29) -> 43
A30: J Press | B30: 16 | C30: 0 | D30: 0 | E30: 0 | F30: 23 | G30: =SUM(B30:F30) -> 39
A31: A Hopkins | B31: 0 | C31: 0 | D31: 17 | E31: 0 | F31: 0 | G31: =SUM(B31:F31) -> 17
A32: M Rouse | B32: 13 | C32: 0 | D32: 0 | E32: 0 | F32: 0 | G32: =SUM(B32:F32) -> 13
A33: A Benson | B33: 0 | C33: 0 | D33: 0 | E33: 0 | F33: 0 | G33: =SUM(B33:F33) -> 0
A34: D Marsh | B34: 0 | C34: 0 | D34: 0 | E34: 0 | F34: 0 | G34: =SUM(B34:F34) -> 0
A35: S Tilling | B35: 0 | C35: 0 | D35: 0 | E35: 0 | F35: 0 | G35: =SUM(B35:F35) -> 0
A36: S Owens | B36: 0 | C36: 0 | D36: 0 | E36: 0 | F36: 0 | G36: =SUM(B36:F36) -> 0
A37: C Ferris | B37: 0 | C37: 0 | D37: 0 | E37: 0 | F37: 0 | G37: =SUM(B37:F37) -> 0
A38: N Leah | B38: 0 | C38: 0 | D38: 0 | E38: 0 | F38: 0 | G38: =SUM(B38:F38) -> 0
A39: M Edmond | B39: 0 | C39: 0 | D39: 0 | E39: 0 | F39: 0 | G39: =SUM(B39:F39) -> 0
B40: =SUM(B23:B39) -> 126 | C40: =SUM(C23:C39) -> 114 | D40: =SUM(D23:D39) -> 113 | E40: =SUM(E23:E39) -> 171 | F40: =SUM(F23:F39) -> 154 | G40: =SUM(B40:F40) -> 678