A1: Season 9 - April 1st 2007 to 31st March 2008
A2: MGA World Tour Order of Ferret by Quantity
B3: Statistics updated | C3: =TODAY() -> 39532 | G3: See Ferrets by Average
A4: Pos | B4: Player | C4: Original Handicap | D4: Current Handicap | E4: Playing Handicap | F4: Played | G4: Total Ferrets | H4: Average per Round | I4: Ferret ratio
A5: 1 | B5: Kevin Gallagher | C5: 11.3 | D5: 11.500000000000991 | E5: =D5 -> 11.500000000000991 | F5: 27 | G5: 31 | H5: 1.1481481481481481 | I5: =IF(G5="","",IF(G5=0,"0 : "&F5*18,"1 : "&ROUND(((F5*18)/G5),0))) -> 1 : 16
A6: =A5+1 -> 2 | B6: Roy Dickens | C6: 29.6 | D6: 31.3 | E6: =D6 -> 31.3 | F6: 6 | G6: 26 | H6: 4.333333333333333 | I6: =IF(G6="","",IF(G6=0,"0 : "&F6*18,"1 : "&ROUND(((F6*18)/G6),0))) -> 1 : 4
A7: =A6+1 -> 3 | B7: Dave Rouse | C7: 25.1 | D7: 26.7 | E7: =D7 -> 26.7 | F7: 5 | G7: 24 | H7: 4.80 | I7: =IF(G7="","",IF(G7=0,"0 : "&F7*18,"1 : "&ROUND(((F7*18)/G7),0))) -> 1 : 4
A8: =A7+1 -> 4 | B8: Robert Thompson | C8: 8.7 | D8: 8.5 | E8: =D8 -> 8.5 | F8: 29 | G8: 23 | H8: 0.7931034482758621 | I8: =IF(G8="","",IF(G8=0,"0 : "&F8*18,"1 : "&ROUND(((F8*18)/G8),0))) -> 1 : 23
A9: =A8+1 -> 5 | B9: Paul Carter | C9: 12.3 | D9: 14.7 | E9: =D9 -> 14.7 | F9: 7 | G9: 19 | H9: 2.7142857142857144 | I9: =IF(G9="","",IF(G9=0,"0 : "&F9*18,"1 : "&ROUND(((F9*18)/G9),0))) -> 1 : 7
A10: =A9+1 -> 6 | B10: Michael Trimmings | C10: 22.2 | D10: 22.2 | E10: =D10 -> 22.2 | F10: 7 | G10: 15 | H10: 2.1428571428571428 | I10: =IF(G10="","",IF(G10=0,"0 : "&F10*18,"1 : "&ROUND(((F10*18)/G10),0))) -> 1 : 8
A11: =A10+1 -> 7 | B11: Jeff Gibbons | C11: 20.9 | D11: 19.400000000002009 | E11: =D11 -> 19.400000000002009 | F11: 16 | G11: 15 | H11: 0.9375 | I11: =IF(G11="","",IF(G11=0,"0 : "&F11*18,"1 : "&ROUND(((F11*18)/G11),0))) -> 1 : 19
A12: =A11+1 -> 8 | B12: Keith Mendelson | C12: 14.2 | D12: 14.4 | E12: =D12 -> 14.4 | F12: 20 | G12: 15 | H12: 0.75 | I12: =IF(G12="","",IF(G12=0,"0 : "&F12*18,"1 : "&ROUND(((F12*18)/G12),0))) -> 1 : 24
A13: =A12+1 -> 9 | B13: Andrew Baldwin | C13: 17.5 | D13: 17.6 | E13: =D13 -> 17.6 | F13: 4 | G13: 12 | H13: 3.00 | I13: =IF(G13="","",IF(G13=0,"0 : "&F13*18,"1 : "&ROUND(((F13*18)/G13),0))) -> 1 : 6
A14: =A13+1 -> 10 | B14: Martin Cox | C14: 12.8 | D14: 13.5 | E14: =D14 -> 13.5 | F14: 5 | G14: 12 | H14: 2.40 | I14: =IF(G14="","",IF(G14=0,"0 : "&F14*18,"1 : "&ROUND(((F14*18)/G14),0))) -> 1 : 8
A15: =A14+1 -> 11 | B15: Jeff Colbrook | C15: 14.2 | D15: 15.4 | E15: =D15 -> 15.4 | F15: 7 | G15: 12 | H15: 1.7142857142857142 | I15: =IF(G15="","",IF(G15=0,"0 : "&F15*18,"1 : "&ROUND(((F15*18)/G15),0))) -> 1 : 11
A16: =A15+1 -> 12 | B16: Martin Bould | C16: 19.4 | D16: 20.3 | E16: =D16 -> 20.3 | F16: 4 | G16: 11 | H16: 2.75 | I16: =IF(G16="","",IF(G16=0,"0 : "&F16*18,"1 : "&ROUND(((F16*18)/G16),0))) -> 1 : 7
A17: =A16+1 -> 13 | B17: Matthew Carter | C17: 21.2 | D17: 20.2 | E17: =D17 -> 20.2 | F17: 7 | G17: 11 | H17: 1.5714285714285714 | I17: =IF(G17="","",IF(G17=0,"0 : "&F17*18,"1 : "&ROUND(((F17*18)/G17),0))) -> 1 : 11
A18: =A17+1 -> 14 | B18: Dave Andrews | C18: 17.9 | D18: 18.900000000001 | E18: =D18 -> 18.900000000001 | F18: 7 | G18: 10 | H18: 1.4285714285714286 | I18: =IF(G18="","",IF(G18=0,"0 : "&F18*18,"1 : "&ROUND(((F18*18)/G18),0))) -> 1 : 13
A19: =A18+1 -> 15 | B19: Malcolm Rouse | C19: 42.9 | D19: 43.9 | E19: =D19 -> 43.9 | F19: 1 | G19: 9 | H19: 9.00 | I19: =IF(G19="","",IF(G19=0,"0 : "&F19*18,"1 : "&ROUND(((F19*18)/G19),0))) -> 1 : 2
A20: =A19+1 -> 16 | B20: Alan Hopkins | C20: 7.1 | D20: 8.2 | E20: =D20 -> 8.2 | F20: 3 | G20: 9 | H20: 3.00 | I20: =IF(G20="","",IF(G20=0,"0 : "&F20*18,"1 : "&ROUND(((F20*18)/G20),0))) -> 1 : 6
A21: =A20+1 -> 17 | B21: Simon Thompson | C21: 13.7 | D21: 12.0 | E21: =D21 -> 12 | F21: 8 | G21: 9 | H21: 1.125 | I21: =IF(G21="","",IF(G21=0,"0 : "&F21*18,"1 : "&ROUND(((F21*18)/G21),0))) -> 1 : 16
A22: =A21+1 -> 18 | B22: Ian Edwards | C22: 15.7 | D22: 15.3 | E22: =D22 -> 15.3 | F22: 2 | G22: 7 | H22: 3.50 | I22: =IF(G22="","",IF(G22=0,"0 : "&F22*18,"1 : "&ROUND(((F22*18)/G22),0))) -> 1 : 5
A23: =A22+1 -> 19 | B23: Paul Baldwin | C23: 17.4 | D23: 18.4 | E23: =D23 -> 18.4 | F23: 1 | G23: 6 | H23: 6.00 | I23: =IF(G23="","",IF(G23=0,"0 : "&F23*18,"1 : "&ROUND(((F23*18)/G23),0))) -> 1 : 3
A24: =A23+1 -> 20 | B24: John Press | C24: 13.5 | D24: 14.6 | E24: =D24 -> 14.6 | F24: 2 | G24: 6 | H24: 3.00 | I24: =IF(G24="","",IF(G24=0,"0 : "&F24*18,"1 : "&ROUND(((F24*18)/G24),0))) -> 1 : 6
A25: =A24+1 -> 21 | B25: Alan Baldwin | C25: 20.3 | D25: 20.3 | E25: =D25 -> 20.3 | F25: 2 | G25: 5 | H25: 2.50 | I25: =IF(G25="","",IF(G25=0,"0 : "&F25*18,"1 : "&ROUND(((F25*18)/G25),0))) -> 1 : 7
A26: =A25+1 -> 22 | B26: Jon Dey | C26: 37.0 | D26: 37.1 | E26: =D26 -> 37.1 | F26: 1 | G26: 3 | H26: 3.00 | I26: =IF(G26="","",IF(G26=0,"0 : "&F26*18,"1 : "&ROUND(((F26*18)/G26),0))) -> 1 : 6
A27: =A26+1 -> 23 | B27: Simon Owens | C27: 13.2 | D27: 13.3 | E27: =D27 -> 13.3 | F27: 1 | G27: 1 | H27: 1.00 | I27: =IF(G27="","",IF(G27=0,"0 : "&F27*18,"1 : "&ROUND(((F27*18)/G27),0))) -> 1 : 18
A28: =A27+1 -> 24 | B28: Andy Benson | C28: 6.9 | D28: 7.5000000000010001 | E28: =D28 -> 7.5000000000010001 | F28: 3 | G28: 1 | H28: 0.33333333333333331 | I28: =IF(G28="","",IF(G28=0,"0 : "&F28*18,"1 : "&ROUND(((F28*18)/G28),0))) -> 1 : 54
A29: =A28+1 -> 25 | B29: Steve Tilling | C29: 16.5 | D29: 16.5 | E29: =D29 -> 16.5 | F29: 0 | G29: 0 | H29: 0.00 | I29: =IF(G29="","",IF(G29=0,"0 : "&F29*18,"1 : "&ROUND(((F29*18)/G29),0))) -> 0 : 0
A30: =A29+1 -> 26 | B30: Neil Leah | C30: 15.0 | D30: 15.0 | E30: =D30 -> 15 | F30: 0 | G30: 0 | H30: 0.00 | I30: =IF(G30="","",IF(G30=0,"0 : "&F30*18,"1 : "&ROUND(((F30*18)/G30),0))) -> 0 : 0
A31: =A30+1 -> 27 | B31: Keith Johns | C31: 24.3 | D31: 24.3 | E31: =D31 -> 24.3 | F31: 0 | G31: 0 | H31: 0.00 | I31: =IF(G31="","",IF(G31=0,"0 : "&F31*18,"1 : "&ROUND(((F31*18)/G31),0))) -> 0 : 0
A32: =A31+1 -> 28 | B32: Dave White | C32: 22.1 | D32: 22.1 | E32: =D32 -> 22.1 | F32: 0 | G32: 0 | H32: 0.00 | I32: =IF(G32="","",IF(G32=0,"0 : "&F32*18,"1 : "&ROUND(((F32*18)/G32),0))) -> 0 : 0
A33: =A32+1 -> 29 | B33: Danny Marsh | C33: 8.1 | D33: 8.1 | E33: =D33 -> 8.1 | F33: 0 | G33: 0 | H33: 0.00 | I33: =IF(G33="","",IF(G33=0,"0 : "&F33*18,"1 : "&ROUND(((F33*18)/G33),0))) -> 0 : 0
A34: =A33+1 -> 30 | B34: Clive Ferris | C34: 26.0 | D34: 26.0 | E34: =D34 -> 26 | F34: 0 | G34: 0 | H34: 0.00 | I34: =IF(G34="","",IF(G34=0,"0 : "&F34*18,"1 : "&ROUND(((F34*18)/G34),0))) -> 0 : 0
A35: =A34+1 -> 31 | B35: Chris Manning | C35: 22.7 | D35: 22.7 | E35: =D35 -> 22.7 | F35: 0 | G35: 0 | H35: 0.00 | I35: =IF(G35="","",IF(G35=0,"0 : "&F35*18,"1 : "&ROUND(((F35*18)/G35),0))) -> 0 : 0
A36: =A35+1 -> 32 | B36: Andrew Knight | C36: 21.4 | D36: 21.4 | E36: =D36 -> 21.4 | F36: 0 | G36: 0 | H36: 0.00 | I36: =IF(G36="","",IF(G36=0,"0 : "&F36*18,"1 : "&ROUND(((F36*18)/G36),0))) -> 0 : 0
F37: TOTAL | G37: =SUM(G5:G36) -> 292