A1: Season 9 - April 1st 2007 to 31st March 2008
A2: MGA World Tour Net Greens in Regulation
B3: Statistics updated | C3: =TODAY() -> 39532
A4: Pos | B4: Player | C4: Original Handicap | D4: Current Handicap | E4: Playing Handicap | F4: Played | G4: Total Greens Hit | H4: Green in Regulation | I4: Greens in Regulation Ratio
A5: 1 | B5: Keith Mendelson | C5: 14.2 | D5: 14.4 | E5: =D5 -> 14.4 | F5: 20 | G5: 210 | H5: 58.33 % | I5: =IF(G5="","",IF(G5=0,"0 : "&F5*18,"1 : "&ROUND((F5*18)/G5,1))) -> 1 : 1.7
A6: 2 | B6: Robert Thompson | C6: 8.7 | D6: 8.5 | E6: =D6 -> 8.5 | F6: 29 | G6: 295 | H6: 56.51 % | I6: =IF(G6="","",IF(G6=0,"0 : "&F6*18,"1 : "&ROUND((F6*18)/G6,1))) -> 1 : 1.8
A7: 3 | B7: Jeff Gibbons | C7: 20.9 | D7: 19.400000000002009 | E7: =D7 -> 19.400000000002009 | F7: 16 | G7: 160 | H7: 55.56 % | I7: =IF(G7="","",IF(G7=0,"0 : "&F7*18,"1 : "&ROUND((F7*18)/G7,1))) -> 1 : 1.8
A8: =A7+1 -> 4 | B8: Kevin Gallagher | C8: 11.3 | D8: 11.500000000000991 | E8: =D8 -> 11.500000000000991 | F8: 27 | G8: 252 | H8: 51.85 % | I8: =IF(G8="","",IF(G8=0,"0 : "&F8*18,"1 : "&ROUND((F8*18)/G8,1))) -> 1 : 1.9
A9: =A8+1 -> 5 | B9: Ian Edwards | C9: 15.7 | D9: 15.3 | E9: =D9 -> 15.3 | F9: 2 | G9: 25 | H9: 69.44 % | I9: =IF(G9="","",IF(G9=0,"0 : "&F9*18,"1 : "&ROUND((F9*18)/G9,1))) -> 1 : 1.4
A10: =A9+1 -> 6 | B10: Matthew Carter | C10: 21.2 | D10: 20.2 | E10: =D10 -> 20.2 | F10: 7 | G10: 80 | H10: 63.49 % | I10: =IF(G10="","",IF(G10=0,"0 : "&F10*18,"1 : "&ROUND((F10*18)/G10,1))) -> 1 : 1.6
A11: =A10+1 -> 7 | B11: Michael Trimmings | C11: 22.2 | D11: 22.2 | E11: =D11 -> 22.2 | F11: 7 | G11: 78 | H11: 61.9 % | I11: =IF(G11="","",IF(G11=0,"0 : "&F11*18,"1 : "&ROUND((F11*18)/G11,1))) -> 1 : 1.6
A12: =A11+1 -> 8 | B12: Simon Thompson | C12: 13.7 | D12: 12.0 | E12: =D12 -> 12 | F12: 8 | G12: 84 | H12: 58.33 % | I12: =IF(G12="","",IF(G12=0,"0 : "&F12*18,"1 : "&ROUND((F12*18)/G12,1))) -> 1 : 1.7
A13: =A12+1 -> 9 | B13: Jon Dey | C13: 37.0 | D13: 37.1 | E13: =D13 -> 37.1 | F13: 1 | G13: 10 | H13: 55.56 % | I13: =IF(G13="","",IF(G13=0,"0 : "&F13*18,"1 : "&ROUND((F13*18)/G13,1))) -> 1 : 1.8
A14: =A13+1 -> 10 | B14: Roy Dickens | C14: 29.6 | D14: 31.3 | E14: =D14 -> 31.3 | F14: 6 | G14: 57 | H14: 52.78 % | I14: =IF(G14="","",IF(G14=0,"0 : "&F14*18,"1 : "&ROUND((F14*18)/G14,1))) -> 1 : 1.9
A15: =A14+1 -> 11 | B15: Alan Baldwin | C15: 20.3 | D15: 20.3 | E15: =D15 -> 20.3 | F15: 2 | G15: 19 | H15: 52.78 % | I15: =IF(G15="","",IF(G15=0,"0 : "&F15*18,"1 : "&ROUND((F15*18)/G15,1))) -> 1 : 1.9
A16: =A15+1 -> 12 | B16: Paul Carter | C16: 12.3 | D16: 14.7 | E16: =D16 -> 14.7 | F16: 7 | G16: 65 | H16: 51.59 % | I16: =IF(G16="","",IF(G16=0,"0 : "&F16*18,"1 : "&ROUND((F16*18)/G16,1))) -> 1 : 1.9
A17: =A16+1 -> 13 | B17: Andy Benson | C17: 6.9 | D17: 7.5000000000010001 | E17: =D17 -> 7.5000000000010001 | F17: 3 | G17: 27 | H17: 50 % | I17: =IF(G17="","",IF(G17=0,"0 : "&F17*18,"1 : "&ROUND((F17*18)/G17,1))) -> 1 : 2
A18: =A17+1 -> 14 | B18: Dave Andrews | C18: 17.9 | D18: 18.900000000001 | E18: =D18 -> 18.900000000001 | F18: 7 | G18: 62 | H18: 49.21 % | I18: =IF(G18="","",IF(G18=0,"0 : "&F18*18,"1 : "&ROUND((F18*18)/G18,1))) -> 1 : 2
A19: =A18+1 -> 15 | B19: Martin Bould | C19: 19.4 | D19: 20.3 | E19: =D19 -> 20.3 | F19: 4 | G19: 34 | H19: 47.22 % | I19: =IF(G19="","",IF(G19=0,"0 : "&F19*18,"1 : "&ROUND((F19*18)/G19,1))) -> 1 : 2.1
A20: =A19+1 -> 16 | B20: Alan Hopkins | C20: 7.1 | D20: 8.2 | E20: =D20 -> 8.2 | F20: 3 | G20: 25 | H20: 46.3 % | I20: =IF(G20="","",IF(G20=0,"0 : "&F20*18,"1 : "&ROUND((F20*18)/G20,1))) -> 1 : 2.2
A21: =A20+1 -> 17 | B21: Andrew Baldwin | C21: 17.5 | D21: 17.6 | E21: =D21 -> 17.6 | F21: 4 | G21: 33 | H21: 45.83 % | I21: =IF(G21="","",IF(G21=0,"0 : "&F21*18,"1 : "&ROUND((F21*18)/G21,1))) -> 1 : 2.2
A22: =A21+1 -> 18 | B22: Dave Rouse | C22: 25.1 | D22: 26.7 | E22: =D22 -> 26.7 | F22: 5 | G22: 39 | H22: 43.33 % | I22: =IF(G22="","",IF(G22=0,"0 : "&F22*18,"1 : "&ROUND((F22*18)/G22,1))) -> 1 : 2.3
A23: =A22+1 -> 19 | B23: Jeff Colbrook | C23: 14.2 | D23: 15.4 | E23: =D23 -> 15.4 | F23: 7 | G23: 54 | H23: 42.86 % | I23: =IF(G23="","",IF(G23=0,"0 : "&F23*18,"1 : "&ROUND((F23*18)/G23,1))) -> 1 : 2.3
A24: =A23+1 -> 20 | B24: Martin Cox | C24: 12.8 | D24: 13.5 | E24: =D24 -> 13.5 | F24: 5 | G24: 36 | H24: 40 % | I24: =IF(G24="","",IF(G24=0,"0 : "&F24*18,"1 : "&ROUND((F24*18)/G24,1))) -> 1 : 2.5
A25: =A24+1 -> 21 | B25: John Press | C25: 13.5 | D25: 14.6 | E25: =D25 -> 14.6 | F25: 2 | G25: 14 | H25: 38.89 % | I25: =IF(G25="","",IF(G25=0,"0 : "&F25*18,"1 : "&ROUND((F25*18)/G25,1))) -> 1 : 2.6
A26: =A25+1 -> 22 | B26: Simon Owens | C26: 13.2 | D26: 13.3 | E26: =D26 -> 13.3 | F26: 1 | G26: 6 | H26: 33.33 % | I26: =IF(G26="","",IF(G26=0,"0 : "&F26*18,"1 : "&ROUND((F26*18)/G26,1))) -> 1 : 3
A27: =A26+1 -> 23 | B27: Malcolm Rouse | C27: 42.9 | D27: 43.9 | E27: =D27 -> 43.9 | F27: 1 | G27: 4 | H27: 22.22 % | I27: =IF(G27="","",IF(G27=0,"0 : "&F27*18,"1 : "&ROUND((F27*18)/G27,1))) -> 1 : 4.5
A28: =A27+1 -> 24 | B28: Paul Baldwin | C28: 17.4 | D28: 18.4 | E28: =D28 -> 18.4 | F28: 1 | G28: 3 | H28: 16.67 % | I28: =IF(G28="","",IF(G28=0,"0 : "&F28*18,"1 : "&ROUND((F28*18)/G28,1))) -> 1 : 6
A29: =A28+1 -> 25 | B29: Steve Tilling | C29: 16.5 | D29: 16.5 | E29: =D29 -> 16.5 | F29: 0 | G29: 0 | H29: 0.00 | I29: =IF(G29="","",IF(G29=0,"0 : "&F29*18,"1 : "&ROUND((F29*18)/G29,1))) -> 0 : 0
A30: =A29+1 -> 26 | B30: Neil Leah | C30: 15.0 | D30: 15.0 | E30: =D30 -> 15 | F30: 0 | G30: 0 | H30: 0.00 | I30: =IF(G30="","",IF(G30=0,"0 : "&F30*18,"1 : "&ROUND((F30*18)/G30,1))) -> 0 : 0
A31: =A30+1 -> 27 | B31: Keith Johns | C31: 24.3 | D31: 24.3 | E31: =D31 -> 24.3 | F31: 0 | G31: 0 | H31: 0.00 | I31: =IF(G31="","",IF(G31=0,"0 : "&F31*18,"1 : "&ROUND((F31*18)/G31,1))) -> 0 : 0
A32: =A31+1 -> 28 | B32: Dave White | C32: 22.1 | D32: 22.1 | E32: =D32 -> 22.1 | F32: 0 | G32: 0 | H32: 0.00 | I32: =IF(G32="","",IF(G32=0,"0 : "&F32*18,"1 : "&ROUND((F32*18)/G32,1))) -> 0 : 0
A33: =A32+1 -> 29 | B33: Danny Marsh | C33: 8.1 | D33: 8.1 | E33: =D33 -> 8.1 | F33: 0 | G33: 0 | H33: 0.00 | I33: =IF(G33="","",IF(G33=0,"0 : "&F33*18,"1 : "&ROUND((F33*18)/G33,1))) -> 0 : 0
A34: =A33+1 -> 30 | B34: Clive Ferris | C34: 26.0 | D34: 26.0 | E34: =D34 -> 26 | F34: 0 | G34: 0 | H34: 0.00 | I34: =IF(G34="","",IF(G34=0,"0 : "&F34*18,"1 : "&ROUND((F34*18)/G34,1))) -> 0 : 0
A35: =A34+1 -> 31 | B35: Chris Manning | C35: 22.7 | D35: 22.7 | E35: =D35 -> 22.7 | F35: 0 | G35: 0 | H35: 0.00 | I35: =IF(G35="","",IF(G35=0,"0 : "&F35*18,"1 : "&ROUND((F35*18)/G35,1))) -> 0 : 0
A36: =A35+1 -> 32 | B36: Andrew Knight | C36: 21.4 | D36: 21.4 | E36: =D36 -> 21.4 | F36: 0 | G36: 0 | H36: 0.00 | I36: =IF(G36="","",IF(G36=0,"0 : "&F36*18,"1 : "&ROUND((F36*18)/G36,1))) -> 0 : 0