A1: Season 9 - April 1st 2007 to 31st March 2008
A2: MGA World Tour Order of Merit
B3: Statistics updated | C3: =TODAY() -> 39538
A4: Pos | B4: Player | C4: Original Handicap | D4: Current Handicap | E4: Playing Handicap | F4: Played | G4: Points | H4: Average | I4: HI / LOW Score | J4: Qualified (10 games)
A5: 1 | B5: Keith Mendelson | C5: 14.2 | D5: 14.6 | E5: =D5 -> 14.6 | F5: 21 | G5: 663 | H5: =IF(ISERROR(G5/F5),0,G5/F5) -> 31.571428571428573 | I5: 37 / 24 | J5: =IF(F5>=10,"Yes","") -> Yes
A6: 2 | B6: Robert Thompson | C6: 8.7 | D6: 8.7 | E6: =D6 -> 8.7 | F6: 30 | G6: 937 | H6: =IF(ISERROR(G6/F6),0,G6/F6) -> 31.233333333333334 | I6: 39 / 19 | J6: =IF(F6>=10,"Yes","") -> Yes
A7: 3 | B7: Jeff Gibbons | C7: 20.9 | D7: 19.600000000002009 | E7: =D7 -> 19.600000000002009 | F7: 17 | G7: 517 | H7: =IF(ISERROR(G7/F7),0,G7/F7) -> 30.411764705882351 | I7: 42 / 25 | J7: =IF(F7>=10,"Yes","") -> Yes
A8: 4 | B8: Kevin Gallagher | C8: 11.3 | D8: 12.000000000000991 | E8: =D8 -> 12.000000000000991 | F8: 28 | G8: 838 | H8: =IF(ISERROR(G8/F8),0,G8/F8) -> 29.928571428571427 | I8: 41 / 14 | J8: =IF(F8>=10,"Yes","") -> Yes
A9: 5 | B9: Ian Edwards | C9: 15.7 | D9: 11.8 | E9: =D9 -> 11.8 | F9: 3 | G9: 104 | H9: =IF(ISERROR(G9/F9),0,G9/F9) -> 34.666666666666664 | I9: 43 / 27 | J9: =IF(F9>=10,"Yes","") -> 
A10: 6 | B10: Dave Andrews | C10: 17.9 | D10: 18.900000000001 | E10: =D10 -> 18.900000000001 | F10: 7 | G10: 208 | H10: =IF(ISERROR(G10/F10),0,G10/F10) -> 29.714285714285715 | I10: 36 / 21 | J10: =IF(F10>=10,"Yes","") -> 
A11: 7 | B11: Simon Thompson | C11: 13.7 | D11: 12.1 | E11: =D11 -> 12.1 | F11: 9 | G11: 267 | H11: =IF(ISERROR(G11/F11),0,G11/F11) -> 29.666666666666668 | I11: 41 / 17 | J11: =IF(F11>=10,"Yes","") -> 
A12: 8 | B12: Matthew Carter | C12: 21.2 | D12: 20.2 | E12: =D12 -> 20.2 | F12: 7 | G12: 206 | H12: =IF(ISERROR(G12/F12),0,G12/F12) -> 29.428571428571427 | I12: 34 / 20 | J12: =IF(F12>=10,"Yes","") -> 
A13: 9 | B13: Michael Trimmings | C13: 22.2 | D13: 22.4 | E13: =D13 -> 22.4 | F13: 8 | G13: 234 | H13: =IF(ISERROR(G13/F13),0,G13/F13) -> 29.25 | I13: 41 / 18 | J13: =IF(F13>=10,"Yes","") -> 
A14: 10 | B14: Jon Dey | C14: 37.0 | D14: 37.1 | E14: =D14 -> 37.1 | F14: 1 | G14: 29 | H14: =IF(ISERROR(G14/F14),0,G14/F14) -> 29.00 | I14: 29 / 29 | J14: =IF(F14>=10,"Yes","") -> 
A15: 11 | B15: Simon Owens | C15: 13.2 | D15: 13.3 | E15: =D15 -> 13.3 | F15: 1 | G15: 29 | H15: =IF(ISERROR(G15/F15),0,G15/F15) -> 29.00 | I15: 29 / 29 | J15: =IF(F15>=10,"Yes","") -> 
A16: 12 | B16: Alan Baldwin | C16: 20.3 | D16: 20.3 | E16: =D16 -> 20.3 | F16: 2 | G16: 57 | H16: =IF(ISERROR(G16/F16),0,G16/F16) -> 28.50 | I16: 40 / 17 | J16: =IF(F16>=10,"Yes","") -> 
A17: 13 | B17: Roy Dickens | C17: 29.6 | D17: 30.6 | E17: =D17 -> 30.6 | F17: 7 | G17: 196 | H17: =IF(ISERROR(G17/F17),0,G17/F17) -> 28.00 | I17: 35 / 17 | J17: =IF(F17>=10,"Yes","") -> 
A18: 14 | B18: Andy Benson | C18: 6.9 | D18: 7.5000000000010001 | E18: =D18 -> 7.5000000000010001 | F18: 3 | G18: 84 | H18: =IF(ISERROR(G18/F18),0,G18/F18) -> 28.00 | I18: 35 / 21 | J18: =IF(F18>=10,"Yes","") -> 
A19: 15 | B19: Jeff Colbrook | C19: 14.2 | D19: 15.6 | E19: =D19 -> 15.6 | F19: 8 | G19: 222 | H19: =IF(ISERROR(G19/F19),0,G19/F19) -> 27.75 | I19: 37 / 18 | J19: =IF(F19>=10,"Yes","") -> 
A20: 16 | B20: Alan Hopkins | C20: 7.1 | D20: 8.2 | E20: =D20 -> 8.2 | F20: 3 | G20: 83 | H20: =IF(ISERROR(G20/F20),0,G20/F20) -> 27.666666666666668 | I20: 34 / 17 | J20: =IF(F20>=10,"Yes","") -> 
A21: 17 | B21: Paul Carter | C21: 12.3 | D21: 14.7 | E21: =D21 -> 14.7 | F21: 7 | G21: 189 | H21: =IF(ISERROR(G21/F21),0,G21/F21) -> 27.00 | I21: 36 / 14 | J21: =IF(F21>=10,"Yes","") -> 
A22: 18 | B22: Dave Rouse | C22: 25.1 | D22: 26.4 | E22: =D22 -> 26.4 | F22: 6 | G22: 161 | H22: =IF(ISERROR(G22/F22),0,G22/F22) -> 26.833333333333332 | I22: 35 / 14 | J22: =IF(F22>=10,"Yes","") -> 
A23: 19 | B23: Andrew Baldwin | C23: 17.5 | D23: 18.1 | E23: =D23 -> 18.1 | F23: 5 | G23: 129 | H23: =IF(ISERROR(G23/F23),0,G23/F23) -> 25.80 | I23: 35 / 19 | J23: =IF(F23>=10,"Yes","") -> 
A24: 20 | B24: Martin Bould | C24: 19.4 | D24: 20.3 | E24: =D24 -> 20.3 | F24: 4 | G24: 102 | H24: =IF(ISERROR(G24/F24),0,G24/F24) -> 25.50 | I24: 33 / 21 | J24: =IF(F24>=10,"Yes","") -> 
A25: 21 | B25: Martin Cox | C25: 12.8 | D25: 13.5 | E25: =D25 -> 13.5 | F25: 5 | G25: 124 | H25: =IF(ISERROR(G25/F25),0,G25/F25) -> 24.80 | I25: 35 / 10 | J25: =IF(F25>=10,"Yes","") -> 
A26: 22 | B26: John Press | C26: 13.5 | D26: 14.8 | E26: =D26 -> 14.8 | F26: 3 | G26: 69 | H26: =IF(ISERROR(G26/F26),0,G26/F26) -> 23.00 | I26: 30 / 16 | J26: =IF(F26>=10,"Yes","") -> 
A27: 23 | B27: Paul Baldwin | C27: 17.4 | D27: 18.6 | E27: =D27 -> 18.6 | F27: 2 | G27: 43 | H27: =IF(ISERROR(G27/F27),0,G27/F27) -> 21.50 | I27: 25 / 18 | J27: =IF(F27>=10,"Yes","") -> 
A28: 24 | B28: Malcolm Rouse | C28: 42.9 | D28: 43.9 | E28: =D28 -> 43.9 | F28: 1 | G28: 13 | H28: =IF(ISERROR(G28/F28),0,G28/F28) -> 13.00 | I28: 13 / 13 | J28: =IF(F28>=10,"Yes","") -> 
A29: =IF(J29="","",A28+1) ->  | B29: Neil Leah | C29: 15.0 | D29: 15.0 | E29: =D29 -> 15 | F29: 0 | G29: 0 | H29: =IF(ISERROR(G29/F29),0,G29/F29) -> 0.00 | I29: / | J29: =IF(F29>=10,"Yes","") -> 
A30: =IF(J30="","",A29+1) ->  | B30: Keith Johns | C30: 24.3 | D30: 24.3 | E30: =D30 -> 24.3 | F30: 0 | G30: 0 | H30: =IF(ISERROR(G30/F30),0,G30/F30) -> 0.00 | I30: / | J30: =IF(F30>=10,"Yes","") -> 
A31: =IF(J31="","",A30+1) ->  | B31: Dave White | C31: 22.1 | D31: 22.1 | E31: =D31 -> 22.1 | F31: 0 | G31: 0 | H31: =IF(ISERROR(G31/F31),0,G31/F31) -> 0.00 | I31: / | J31: =IF(F31>=10,"Yes","") -> 
A32: =IF(J32="","",A31+1) ->  | B32: Steve Tilling | C32: 16.5 | D32: 16.5 | E32: =D32 -> 16.5 | F32: 0 | G32: 0 | H32: =IF(ISERROR(G32/F32),0,G32/F32) -> 0.00 | I32: / | J32: =IF(F32>=10,"Yes","") -> 
A33: =IF(J33="","",A32+1) ->  | B33: Danny Marsh | C33: 8.1 | D33: 8.1 | E33: =D33 -> 8.1 | F33: 0 | G33: 0 | H33: =IF(ISERROR(G33/F33),0,G33/F33) -> 0.00 | I33: / | J33: =IF(F33>=10,"Yes","") -> 
A34: =IF(J34="","",A33+1) ->  | B34: Clive Ferris | C34: 26.0 | D34: 26.0 | E34: =D34 -> 26 | F34: 0 | G34: 0 | H34: =IF(ISERROR(G34/F34),0,G34/F34) -> 0.00 | I34: / | J34: =IF(F34>=10,"Yes","") -> 
A35: =IF(J35="","",A34+1) ->  | B35: Chris Manning | C35: 22.7 | D35: 22.7 | E35: =D35 -> 22.7 | F35: 0 | G35: 0 | H35: =IF(ISERROR(G35/F35),0,G35/F35) -> 0.00 | I35: / | J35: =IF(F35>=10,"Yes","") -> 
A36: =IF(J36="","",A35+1) ->  | B36: Andrew Knight | C36: 21.4 | D36: 21.4 | E36: =D36 -> 21.4 | F36: 0 | G36: 0 | H36: =IF(ISERROR(G36/F36),0,G36/F36) -> 0.00 | I36: / | J36: =IF(F36>=10,"Yes","") -> 