A1: Martin Bould
A2: Club | B2: Sunningdale New Course
A3: Par/SS | B3: 71/71 | D3: Num. Of Fairways | I3: =IF(B2="","",18-(COUNTIF(B9:B26,3))) -> 13
A4: Date | B4: 39360 | D4: Playing Handicap | I4: 19.6
A5: Event Place | B5: 2 | D5: Prize Money | G5: 2500
A6: Game Stats | B6: DB+ | C6: DB | D6: BI | E6: P | F6: B | G6: E | H6: A | I6: H1
B7: 7 | C7: 6 | D7: 2 | E7: 3 | F7: 0 | G7: 0 | H7: 0 | I7: 0
A8: Hole No | B8: Par | C8: Stroke Index | D8: Gross Score | E8: Points | F8: Putts | G8: Fairways | H8: Ferrets | I8: Green Regulation
A9: 1 | B9: 5 | C9: 8 | D9: 7 | E9: 1 | F9: 3 | G9: 1 | I9: Yes
A10: 2 | B10: 3 | C10: 16 | D10: 5 | E10: 1 | F10: 3 | I10: Yes
A11: 3 | B11: 4 | C11: 4 | D11: 6 | E11: 1 | F11: 1
A12: 4 | B12: 4 | C12: 10 | D12: 7 | E12: 0 | F12: 2 | H12: 1
A13: 5 | B13: 3 | C13: 12 | D13: 3 | E13: 3 | F13: 2 | I13: Yes
A14: 6 | B14: 5 | C14: 2 | D14: 7 | E14: 2 | F14: 2 | G14: 1 | I14: Yes
A15: 7 | B15: 4 | C15: 18 | D15: 7 | E15: 0 | F15: 2 | H15: 1
A16: 8 | B16: 4 | C16: 14 | D16: 8 | E16: 0 | F16: 3
A17: 9 | B17: 4 | C17: 6 | D17: 8 | E17: 0 | F17: 3
A18: 10 | B18: 3 | C18: 9 | D18: 5 | E18: 1 | F18: 2
A19: 11 | B19: 4 | C19: 1 | D19: 7 | E19: 1 | F19: 2
A20: 12 | B20: 4 | C20: 15 | D20: 4 | E20: 3 | F20: 1 | I20: Yes
A21: 13 | B21: 5 | C21: 5 | D21: 8 | E21: 0 | F21: 3
A22: 14 | B22: 3 | C22: 11 | D22: 3 | E22: 3 | F22: 2 | I22: Yes
A23: 15 | B23: 4 | C23: 3 | D23: 6 | E23: 1 | F23: 2 | H23: 1
A24: 16 | B24: 4 | C24: 13 | D24: 5 | E24: 2 | F24: 2 | G24: 1 | I24: Yes
A25: 17 | B25: 3 | C25: 17 | D25: 10 | E25: 0 | F25: 3 | H25: 1
A26: 18 | B26: 5 | C26: 7 | D26: 6 | E26: 2 | F26: 2 | I26: Yes
A27: Totals | B27: =IF(B2="","",SUM(B9:B26)) -> 71 | D27: =IF(B2="","",SUM(D9:D26)) -> 112 | E27: =IF(B2="","",SUM(E9:E26)) -> 21 | F27: =IF(B2="","",SUM(F9:F26)) -> 40 | G27: =IF(B2="","",SUM(G9:G26)) -> 3 | H27: =IF(B2="","",SUM(H9:H26)) -> 4 | I27: =IF(COUNTIF(I9:I26,"=Yes")=0,"",COUNTIF(I9:I26,"=Yes")) -> 8