A1: Dave Rouse
A2: Club | B2: Wycombe Heights
A3: Par/SS | B3: 70/72 | D3: Num. Of Fairways | I3: =IF(B2="","",18-(COUNTIF(B9:B26,3))) -> 14
A4: Date | B4: 38025 | D4: Playing Handicap | I4: 23.3
A5: Event Place | B5: 1 | D5: Prize Money | G5: 15000
A6: Game Stats | B6: DB+ | C6: DB | D6: Bi | E6: P | F6: B | G6: E | H6: A | I6: H1
B7: 3 | C7: 5 | D7: 5 | E7: 5 | F7: 0 | G7: 0 | H7: 0 | I7: 0
A8: Hole No | B8: Par | C8: Stroke Index | D8: Gross Score | E8: Points | F8: Putts | G8: Fairways | H8: Ferrets | I8: Green Regulation
A9: 1 | B9: 4 | C9: 9 | D9: 5 | E9: 2 | F9: 2 | I9: Yes
A10: 2 | B10: 3 | C10: 13 | D10: 5 | E10: 1 | F10: 2
A11: 3 | B11: 4 | C11: 11 | D11: 5 | E11: 2 | F11: 3 | G11: 1 | I11: Yes
A12: 4 | B12: 4 | C12: 3 | D12: 7 | E12: 1 | F12: 3 | I12: Yes
A13: 5 | B13: 5 | C13: 15 | D13: 5 | E13: 3 | F13: 2 | I13: Yes
A14: 6 | B14: 4 | C14: 7 | D14: 6 | E14: 1 | F14: 3 | I14: Yes
A15: 7 | B15: 4 | C15: 1 | D15: 5 | E15: 3 | F15: 2 | I15: Yes
A16: 8 | B16: 3 | C16: 17 | D16: 3 | E16: 3 | F16: 1 | I16: Yes
A17: 9 | B17: 4 | C17: 5 | D17: 8 | E17: 0 | F17: 4 | G17: 1 | I17: Yes
A18: 10 | B18: 3 | C18: 16 | D18: 3 | E18: 3 | F18: 1 | I18: Yes
A19: 11 | B19: 4 | C19: 18 | D19: 4 | E19: 3 | F19: 2 | G19: 1 | I19: Yes
A20: 12 | B20: 4 | C20: 8 | D20: 4 | E20: 3 | F20: 2 | I20: Yes
A21: 13 | B21: 4 | C21: 2 | D21: 6 | E21: 2 | F21: 2 | I21: Yes
A22: 14 | B22: 4 | C22: 14 | D22: 6 | E22: 1 | F22: 2 | G22: 1
A23: 15 | B23: 4 | C23: 4 | D23: 5 | E23: 3 | F23: 1 | G23: 1 | I23: Yes
A24: 16 | B24: 3 | C24: 12 | D24: 4 | E24: 2 | F24: 3 | I24: Yes
A25: 17 | B25: 5 | C25: 6 | D25: 7 | E25: 1 | F25: 2
A26: 18 | B26: 4 | C26: 10 | D26: 10 | E26: 0 | F26: 3 | H26: 3
A27: Totals | B27: =IF(B2="","",SUM(B9:B26)) -> 70 | D27: =IF(B2="","",SUM(D9:D26)) -> 98 | E27: =IF(B2="","",SUM(E9:E26)) -> 34 | F27: =IF(B2="","",SUM(F9:F26)) -> 40 | G27: =IF(B2="","",SUM(G9:G26)) -> 5 | H27: =IF(B2="","",SUM(H9:H26)) -> 3 | I27: =IF(COUNTIF(I9:I26,"=Yes")=0,"",COUNTIF(I9:I26,"=Yes")) -> 14