A1: Ian Edwards
A2: Club | B2: The Belfry - Brabazon
A3: Par/SS | B3: 72/71 | D3: Num. Of Fairways | I3: =IF(B2="","",18-(COUNTIF(B9:B26,3))) -> 15
A4: Date | B4: 38023 | D4: Playing Handicap | I4: 14.9
A5: Event Place | B5: 1 | C5: M | D5: Prize Money | G5: 22500
A6: Game Stats | B6: DB+ | C6: DB | D6: Bi | E6: P | F6: B | G6: E | H6: A | I6: H1
B7: 3 | C7: 2 | D7: 8 | E7: 5 | F7: 0 | G7: 0 | H7: 0 | I7: 0
A8: Hole No | B8: Par | C8: Stroke Index | D8: Gross Score | E8: Points | F8: Putts | G8: Fairways | H8: Ferrets | I8: Green Regulation
A9: 1 | B9: 4 | C9: 9 | D9: 10 | E9: 0 | F9: 3 | H9: 1
A10: 2 | B10: 4 | C10: 17 | D10: 6 | E10: 0 | F10: 3
A11: 3 | B11: 5 | C11: 13 | D11: 5 | E11: 3 | F11: 1 | I11: Yes
A12: 4 | B12: 4 | C12: 3 | D12: 5 | E12: 2 | F12: 1
A13: 5 | B13: 4 | C13: 11 | D13: 4 | E13: 3 | F13: 1 | G13: 1 | I13: Yes
A14: 6 | B14: 4 | C14: 5 | D14: 7 | E14: 0 | F14: 1 | H14: 2
A15: 7 | B15: 3 | C15: 15 | D15: 4 | E15: 2 | F15: 1
A16: 8 | B16: 4 | C16: 1 | D16: 4 | E16: 3 | F16: 1 | G16: 1 | I16: Yes
A17: 9 | B17: 4 | C17: 7 | D17: 5 | E17: 2 | F17: 1 | G17: 1
A18: 10 | B18: 4 | C18: 8 | D18: 4 | E18: 3 | F18: 2 | I18: Yes
A19: 11 | B19: 4 | C19: 16 | D19: 4 | E19: 2 | F19: 2 | I19: Yes
A20: 12 | B20: 3 | C20: 6 | D20: 7 | E20: 0 | F20: 2 | H20: 1
A21: 13 | B21: 4 | C21: 18 | D21: 5 | E21: 1 | F21: 1
A22: 14 | B22: 3 | C22: 14 | D22: 4 | E22: 2 | F22: 3 | I22: Yes
A23: 15 | B23: 5 | C23: 2 | D23: 6 | E23: 2 | F23: 2 | G23: 1 | I23: Yes
A24: 16 | B24: 4 | C24: 12 | D24: 5 | E24: 2 | F24: 2 | I24: Yes
A25: 17 | B25: 5 | C25: 10 | D25: 6 | E25: 2 | F25: 1
A26: 18 | B26: 4 | C26: 4 | D26: 6 | E26: 1 | F26: 3 | I26: Yes
A27: Totals | B27: =IF(B2="","",SUM(B9:B26)) -> 72 | D27: =IF(B2="","",SUM(D9:D26)) -> 97 | E27: =IF(B2="","",SUM(E9:E26)) -> 30 | F27: =IF(B2="","",SUM(F9:F26)) -> 31 | G27: =IF(B2="","",SUM(G9:G26)) -> 4 | H27: =IF(B2="","",SUM(H9:H26)) -> 4 | I27: =IF(COUNTIF(I9:I26,"=Yes")=0,"",COUNTIF(I9:I26,"=Yes")) -> 9