A1: Paul Carter
A2: Club | B2: Wycombe Heights
A3: Par/SS | B3: 70/72 | D3: Num. Of Fairways | I3: =IF(B2="","",18-(COUNTIF(B9:B26,3))) -> 14
A4: Date | B4: 38025 | D4: Playing Handicap | I4: 12.400000000000997
A5: Event Place | B5: 4 | D5: Prize Money | G5: 7500
A6: Game Stats | B6: DB+ | C6: DB | D6: Bi | E6: P | F6: B | G6: E | H6: A | I6: H1
B7: 0 | C7: 6 | D7: 7 | E7: 5 | F7: 0 | G7: 0 | H7: 0 | I7: 0
A8: Hole No | B8: Par | C8: Stroke Index | D8: Gross Score | E8: Points | F8: Putts | G8: Fairways | H8: Ferrets | I8: Green Regulation
A9: 1 | B9: 4 | C9: 9 | D9: 6 | E9: 1 | F9: 2
A10: 2 | B10: 3 | C10: 13 | D10: 5 | E10: 0 | F10: 3
A11: 3 | B11: 4 | C11: 11 | D11: 4 | E11: 3 | F11: 2 | G11: 1 | I11: Yes
A12: 4 | B12: 4 | C12: 3 | D12: 5 | E12: 2 | F12: 2 | G12: 1 | I12: Yes
A13: 5 | B13: 5 | C13: 15 | D13: 6 | E13: 1 | F13: 1
A14: 6 | B14: 4 | C14: 7 | D14: 5 | E14: 2 | F14: 2 | I14: Yes
A15: 7 | B15: 4 | C15: 1 | D15: 5 | E15: 2 | F15: 2 | I15: Yes
A16: 8 | B16: 3 | C16: 17 | D16: 3 | E16: 2 | F16: 2 | I16: Yes
A17: 9 | B17: 4 | C17: 5 | D17: 6 | E17: 1 | F17: 2
A18: 10 | B18: 3 | C18: 16 | D18: 4 | E18: 1 | F18: 2
A19: 11 | B19: 4 | C19: 18 | D19: 4 | E19: 2 | F19: 2 | G19: 1 | I19: Yes
A20: 12 | B20: 4 | C20: 8 | D20: 5 | E20: 2 | F20: 2 | I20: Yes
A21: 13 | B21: 4 | C21: 2 | D21: 6 | E21: 1 | F21: 2
A22: 14 | B22: 4 | C22: 14 | D22: 6 | E22: 0 | F22: 2
A23: 15 | B23: 4 | C23: 4 | D23: 5 | E23: 2 | F23: 2 | G23: 1 | I23: Yes
A24: 16 | B24: 3 | C24: 12 | D24: 3 | E24: 3 | F24: 2 | I24: Yes
A25: 17 | B25: 5 | C25: 6 | D25: 5 | E25: 3 | F25: 2 | G25: 1 | I25: Yes
A26: 18 | B26: 4 | C26: 10 | D26: 6 | E26: 1 | F26: 2
A27: Totals | B27: =IF(B2="","",SUM(B9:B26)) -> 70 | D27: =IF(B2="","",SUM(D9:D26)) -> 89 | E27: =IF(B2="","",SUM(E9:E26)) -> 29 | F27: =IF(B2="","",SUM(F9:F26)) -> 36 | G27: =IF(B2="","",SUM(G9:G26)) -> 5 | H27: =IF(B2="","",SUM(H9:H26)) -> 0 | I27: =IF(COUNTIF(I9:I26,"=Yes")=0,"",COUNTIF(I9:I26,"=Yes")) -> 10