A1: Season 7 - April 2nd 2005 to 31st March 2006
A2: MGA World Tour Driving Accuracy (Fairways Hit)
B3: Statistics updated | C3: =TODAY() -> 38817
A4: Pos | B4: Player | C4: Original Handicap | D4: Current Handicap | E4: Playing Handicap | F4: Played | G4: Total Number of Fairways | H4: Total Fairways Hit | I4: Fairway %
A5: 1 | B5: Martin Cox | C5: 11.3 | D5: 12.300000000001996 | E5: =D5 -> 12.300000000001996 | F5: 14 | G5: 191 | H5: 109 | I5: =IF(F5=0,"0 %",ROUND((H5/G5)*100,2) &" %") -> 57.07 %
A6: =A5+1 -> 2 | B6: Kevin Gallagher | C6: 10.4 | D6: 11.80000000000199 | E6: =D6 -> 11.80000000000199 | F6: 47 | G6: 628 | H6: 344 | I6: =IF(F6=0,"0 %",ROUND((H6/G6)*100,2) &" %") -> 54.78 %
A7: =A6+1 -> 3 | B7: Jeff Gibbons | C7: 21.7 | D7: 20.000000000003013 | E7: =D7 -> 20.000000000003013 | F7: 48 | G7: 671 | H7: 332 | I7: =IF(F7=0,"0 %",ROUND((H7/G7)*100,2) &" %") -> 49.48 %
A8: =A7+1 -> 4 | B8: Keith Mendelson | C8: 14.4 | D8: 15.7 | E8: =D8 -> 15.7 | F8: 44 | G8: 611 | H8: 289 | I8: =IF(F8=0,"0 %",ROUND((H8/G8)*100,2) &" %") -> 47.3 %
A9: =A8+1 -> 5 | B9: Alan Hopkins | C9: 7.7 | D9: 8.400000000001997 | E9: =D9 -> 8.400000000001997 | F9: 18 | G9: 248 | H9: 109 | I9: =IF(F9=0,"0 %",ROUND((H9/G9)*100,2) &" %") -> 43.95 %
A10: =A9+1 -> 6 | B10: Dave Andrews | C10: 17.2 | D10: 17.500000000001002 | E10: =D10 -> 17.500000000001002 | F10: 22 | G10: 288 | H10: 124 | I10: =IF(F10=0,"0 %",ROUND((H10/G10)*100,2) &" %") -> 43.06 %
A11: =A10+1 -> 7 | B11: Simon Thompson | C11: 12.7 | D11: 11.6 | E11: =D11 -> 11.6 | F11: 29 | G11: 383 | H11: 159 | I11: =IF(F11=0,"0 %",ROUND((H11/G11)*100,2) &" %") -> 41.51 %
A12: =A11+1 -> 8 | B12: Robert Thompson | C12: 8.2 | D12: 8.0999999999999837 | E12: =D12 -> 8.0999999999999837 | F12: 51 | G12: 675 | H12: 275 | I12: =IF(F12=0,"0 %",ROUND((H12/G12)*100,2) &" %") -> 40.74 %
A13: =A12+1 -> 9 | B13: Martin Bould | C13: 18.3 | D13: 20.400000000001 | E13: =D13 -> 20.400000000001 | F13: 14 | G13: 190 | H13: 73 | I13: =IF(F13=0,"0 %",ROUND((H13/G13)*100,2) &" %") -> 38.42 %
A14: =A13+1 -> 10 | B14: Dave Rouse | C14: 22.9 | D14: 24.6 | E14: =D14 -> 24.6 | F14: 18 | G14: 249 | H14: 78 | I14: =IF(F14=0,"0 %",ROUND((H14/G14)*100,2) &" %") -> 31.33 %
A15: =A14+1 -> 11 | B15: Roy Dickens | C15: 29.6 | D15: 29.6 | E15: =D15 -> 29.6 | F15: 21 | G15: 288 | H15: 87 | I15: =IF(F15=0,"0 %",ROUND((H15/G15)*100,2) &" %") -> 30.21 %
A16: =A15+1 -> 12 | B16: Paul Carter | C16: 12.4 | D16: 12.8 | E16: =D16 -> 12.8 | F16: 12 | G16: 165 | H16: 45 | I16: =IF(F16=0,"0 %",ROUND((H16/G16)*100,2) &" %") -> 27.27 %
A17: =A16+1 -> 13 | B17: Jeff Colbrook | C17: 17.2 | D17: 13.1 | E17: =D17 -> 13.1 | F17: 10 | G17: 134 | H17: 36 | I17: =IF(F17=0,"0 %",ROUND((H17/G17)*100,2) &" %") -> 26.87 %
A18: =A17+1 -> 14 | B18: Chris Manning | C18: 22.6 | D18: 22.7 | E18: =D18 -> 22.7 | F18: 1 | G18: 14 | H18: 7 | I18: =IF(F18=0,"0 %",ROUND((H18/G18)*100,2) &" %") -> 50 %
A19: =A18+1 -> 15 | B19: John Press | C19: 15.0 | D19: 14.9 | E19: =D19 -> 14.9 | F19: 3 | G19: 42 | H19: 20 | I19: =IF(F19=0,"0 %",ROUND((H19/G19)*100,2) &" %") -> 47.62 %
A20: =A19+1 -> 16 | B20: Danny Marsh | C20: 10.0 | D20: 8.2000000000009994 | E20: =D20 -> 8.2000000000009994 | F20: 7 | G20: 96 | H20: 42 | I20: =IF(F20=0,"0 %",ROUND((H20/G20)*100,2) &" %") -> 43.75 %
A21: =A20+1 -> 17 | B21: Paul Baldwin | C21: 17.7 | D21: 16.900000000001 | E21: =D21 -> 16.900000000001 | F21: 4 | G21: 56 | H21: 23 | I21: =IF(F21=0,"0 %",ROUND((H21/G21)*100,2) &" %") -> 41.07 %
A22: =A21+1 -> 18 | B22: Matt Carter | C22: 20.0 | D22: 20.9 | E22: =D22 -> 20.9 | F22: 8 | G22: 111 | H22: 45 | I22: =IF(F22=0,"0 %",ROUND((H22/G22)*100,2) &" %") -> 40.54 %
A23: =A22+1 -> 19 | B23: Ian Edwards | C23: 14.9 | D23: 15.2 | E23: =D23 -> 15.2 | F23: 6 | G23: 82 | H23: 33 | I23: =IF(F23=0,"0 %",ROUND((H23/G23)*100,2) &" %") -> 40.24 %
A24: =A23+1 -> 20 | B24: Andy Benson | C24: 6.0 | D24: 6.7 | E24: =D24 -> 6.7 | F24: 5 | G24: 69 | H24: 27 | I24: =IF(F24=0,"0 %",ROUND((H24/G24)*100,2) &" %") -> 39.13 %
A25: =A24+1 -> 21 | B25: Alan Baldwin | C25: 18.9 | D25: 22.6 | E25: =D25 -> 22.6 | F25: 8 | G25: 109 | H25: 39 | I25: =IF(F25=0,"0 %",ROUND((H25/G25)*100,2) &" %") -> 35.78 %
A26: =A25+1 -> 22 | B26: Steve Tilling | C26: 16.3 | D26: 16.5 | E26: =D26 -> 16.5 | F26: 1 | G26: 14 | H26: 5 | I26: =IF(F26=0,"0 %",ROUND((H26/G26)*100,2) &" %") -> 35.71 %
A27: =A26+1 -> 23 | B27: Dave White | C27: 22.0 | D27: 22.1 | E27: =D27 -> 22.1 | F27: 1 | G27: 14 | H27: 5 | I27: =IF(F27=0,"0 %",ROUND((H27/G27)*100,2) &" %") -> 35.71 %
A28: =A27+1 -> 24 | B28: Andrew Baldwin | C28: 15.4 | D28: 17.4 | E28: =D28 -> 17.4 | F28: 6 | G28: 84 | H28: 28 | I28: =IF(F28=0,"0 %",ROUND((H28/G28)*100,2) &" %") -> 33.33 %
A29: =A28+1 -> 25 | B29: Michael Trimmings | C29: 22.8 | D29: 22.800000000001003 | E29: =D29 -> 22.800000000001003 | F29: 9 | G29: 123 | H29: 37 | I29: =IF(F29=0,"0 %",ROUND((H29/G29)*100,2) &" %") -> 30.08 %
A30: =A29+1 -> 26 | B30: Jon Dey | C30: 35.8 | D30: 36.8 | E30: =D30 -> 36.8 | F30: 1 | G30: 14 | H30: 3 | I30: =IF(F30=0,"0 %",ROUND((H30/G30)*100,2) &" %") -> 21.43 %
A31: =A30+1 -> 27 | B31: Neil Leah | C31: 15.0 | D31: 15.0 | E31: =D31 -> 15 | F31: 0 | G31: 0 | H31: 0 | I31: =IF(F31=0,"0 %",ROUND((H31/G31)*100,2) &" %") -> 0 %
A32: =A31+1 -> 28 | B32: Malcolm Rouse | C32: 42.9 | D32: 42.9 | E32: =D32 -> 42.9 | F32: 0 | G32: 0 | H32: 0 | I32: =IF(F32=0,"0 %",ROUND((H32/G32)*100,2) &" %") -> 0 %
A33: =A32+1 -> 29 | B33: Keith Johns | C33: 24.3 | D33: 24.3 | E33: =D33 -> 24.3 | F33: 0 | G33: 0 | H33: 0 | I33: =IF(F33=0,"0 %",ROUND((H33/G33)*100,2) &" %") -> 0 %
A34: =A33+1 -> 30 | B34: Dave Archer | C34: 22.0 | D34: 22.0 | E34: =D34 -> 22 | F34: 0 | G34: 0 | H34: 0 | I34: =IF(F34=0,"0 %",ROUND((H34/G34)*100,2) &" %") -> 0 %
A35: =A34+1 -> 31 | B35: Clive Ferris | C35: 26.0 | D35: 26.0 | E35: =D35 -> 26 | F35: 0 | G35: 0 | H35: 0 | I35: =IF(F35=0,"0 %",ROUND((H35/G35)*100,2) &" %") -> 0 %
A36: =A35+1 -> 32 | B36: Andrew Knight | C36: 21.4 | D36: 21.4 | E36: =D36 -> 21.4 | F36: 0 | G36: 0 | H36: 0 | I36: =IF(F36=0,"0 %",ROUND((H36/G36)*100,2) &" %") -> 0 %