A1: Season 7 - April 2nd 2005 to 31st March 2006
A2: MGA World Tour Order of Ferret by Average
B3: Statistics updated | C3: =TODAY() -> 38817 | G3: See Ferrets by Quantity
A4: Pos | B4: Player | C4: Original Handicap | D4: Current Handicap | E4: Playing Handicap | F4: Played | G4: Total Ferrets | H4: Average per Round | I4: Ferret ratio
A5: 1 | B5: Jon Dey | C5: 35.8 | D5: 36.8 | E5: =D5 -> 36.8 | F5: 1 | G5: 9 | H5: 9.00 | I5: =IF(G5="","",IF(G5=0,"0 : "&F5*18,"1 : "&ROUND(((F5*18)/G5),0))) -> 1 : 2
A6: =A5+1 -> 2 | B6: Steve Tilling | C6: 16.3 | D6: 16.5 | E6: =D6 -> 16.5 | F6: 1 | G6: 5 | H6: 5.00 | I6: =IF(G6="","",IF(G6=0,"0 : "&F6*18,"1 : "&ROUND(((F6*18)/G6),0))) -> 1 : 4
A7: =A6+1 -> 3 | B7: Michael Trimmings | C7: 22.8 | D7: 22.800000000001003 | E7: =D7 -> 22.800000000001003 | F7: 9 | G7: 39 | H7: 4.333333333333333 | I7: =IF(G7="","",IF(G7=0,"0 : "&F7*18,"1 : "&ROUND(((F7*18)/G7),0))) -> 1 : 4
A8: =A7+1 -> 4 | B8: Roy Dickens | C8: 29.6 | D8: 29.6 | E8: =D8 -> 29.6 | F8: 21 | G8: 74 | H8: 3.5238095238095237 | I8: =IF(G8="","",IF(G8=0,"0 : "&F8*18,"1 : "&ROUND(((F8*18)/G8),0))) -> 1 : 5
A9: =A8+1 -> 5 | B9: Alan Baldwin | C9: 18.9 | D9: 22.6 | E9: =D9 -> 22.6 | F9: 8 | G9: 25 | H9: 3.125 | I9: =IF(G9="","",IF(G9=0,"0 : "&F9*18,"1 : "&ROUND(((F9*18)/G9),0))) -> 1 : 6
A10: =A9+1 -> 6 | B10: Andrew Baldwin | C10: 15.4 | D10: 17.4 | E10: =D10 -> 17.4 | F10: 6 | G10: 18 | H10: 3.00 | I10: =IF(G10="","",IF(G10=0,"0 : "&F10*18,"1 : "&ROUND(((F10*18)/G10),0))) -> 1 : 6
A11: =A10+1 -> 7 | B11: Chris Manning | C11: 22.6 | D11: 22.7 | E11: =D11 -> 22.7 | F11: 1 | G11: 3 | H11: 3.00 | I11: =IF(G11="","",IF(G11=0,"0 : "&F11*18,"1 : "&ROUND(((F11*18)/G11),0))) -> 1 : 6
A12: =A11+1 -> 8 | B12: Dave White | C12: 22.0 | D12: 22.1 | E12: =D12 -> 22.1 | F12: 1 | G12: 3 | H12: 3.00 | I12: =IF(G12="","",IF(G12=0,"0 : "&F12*18,"1 : "&ROUND(((F12*18)/G12),0))) -> 1 : 6
A13: =A12+1 -> 9 | B13: Ian Edwards | C13: 14.9 | D13: 15.2 | E13: =D13 -> 15.2 | F13: 6 | G13: 16 | H13: 2.6666666666666665 | I13: =IF(G13="","",IF(G13=0,"0 : "&F13*18,"1 : "&ROUND(((F13*18)/G13),0))) -> 1 : 7
A14: =A13+1 -> 10 | B14: John Press | C14: 15.0 | D14: 14.9 | E14: =D14 -> 14.9 | F14: 3 | G14: 8 | H14: 2.6666666666666665 | I14: =IF(G14="","",IF(G14=0,"0 : "&F14*18,"1 : "&ROUND(((F14*18)/G14),0))) -> 1 : 7
A15: =A14+1 -> 11 | B15: Dave Rouse | C15: 22.9 | D15: 24.6 | E15: =D15 -> 24.6 | F15: 18 | G15: 47 | H15: 2.6111111111111112 | I15: =IF(G15="","",IF(G15=0,"0 : "&F15*18,"1 : "&ROUND(((F15*18)/G15),0))) -> 1 : 7
A16: =A15+1 -> 12 | B16: Matt Carter | C16: 20.0 | D16: 20.9 | E16: =D16 -> 20.9 | F16: 8 | G16: 18 | H16: 2.25 | I16: =IF(G16="","",IF(G16=0,"0 : "&F16*18,"1 : "&ROUND(((F16*18)/G16),0))) -> 1 : 8
A17: =A16+1 -> 13 | B17: Jeff Colbrook | C17: 17.2 | D17: 13.1 | E17: =D17 -> 13.1 | F17: 10 | G17: 20 | H17: 2.00 | I17: =IF(G17="","",IF(G17=0,"0 : "&F17*18,"1 : "&ROUND(((F17*18)/G17),0))) -> 1 : 9
A18: =A17+1 -> 14 | B18: Andy Benson | C18: 6.0 | D18: 6.7 | E18: =D18 -> 6.7 | F18: 5 | G18: 10 | H18: 2.00 | I18: =IF(G18="","",IF(G18=0,"0 : "&F18*18,"1 : "&ROUND(((F18*18)/G18),0))) -> 1 : 9
A19: =A18+1 -> 15 | B19: Martin Cox | C19: 11.3 | D19: 12.300000000001996 | E19: =D19 -> 12.300000000001996 | F19: 14 | G19: 21 | H19: 1.50 | I19: =IF(G19="","",IF(G19=0,"0 : "&F19*18,"1 : "&ROUND(((F19*18)/G19),0))) -> 1 : 12
A20: =A19+1 -> 16 | B20: Paul Carter | C20: 12.4 | D20: 12.8 | E20: =D20 -> 12.8 | F20: 12 | G20: 18 | H20: 1.50 | I20: =IF(G20="","",IF(G20=0,"0 : "&F20*18,"1 : "&ROUND(((F20*18)/G20),0))) -> 1 : 12
A21: =A20+1 -> 17 | B21: Paul Baldwin | C21: 17.7 | D21: 16.900000000001 | E21: =D21 -> 16.900000000001 | F21: 4 | G21: 6 | H21: 1.50 | I21: =IF(G21="","",IF(G21=0,"0 : "&F21*18,"1 : "&ROUND(((F21*18)/G21),0))) -> 1 : 12
A22: =A21+1 -> 18 | B22: Alan Hopkins | C22: 7.7 | D22: 8.400000000001997 | E22: =D22 -> 8.400000000001997 | F22: 18 | G22: 24 | H22: 1.3333333333333333 | I22: =IF(G22="","",IF(G22=0,"0 : "&F22*18,"1 : "&ROUND(((F22*18)/G22),0))) -> 1 : 14
A23: =A22+1 -> 19 | B23: Dave Andrews | C23: 17.2 | D23: 17.500000000001002 | E23: =D23 -> 17.500000000001002 | F23: 22 | G23: 29 | H23: 1.3181818181818181 | I23: =IF(G23="","",IF(G23=0,"0 : "&F23*18,"1 : "&ROUND(((F23*18)/G23),0))) -> 1 : 14
A24: =A23+1 -> 20 | B24: Martin Bould | C24: 18.3 | D24: 20.400000000001 | E24: =D24 -> 20.400000000001 | F24: 14 | G24: 16 | H24: 1.1428571428571428 | I24: =IF(G24="","",IF(G24=0,"0 : "&F24*18,"1 : "&ROUND(((F24*18)/G24),0))) -> 1 : 16
A25: =A24+1 -> 21 | B25: Robert Thompson | C25: 8.2 | D25: 8.0999999999999837 | E25: =D25 -> 8.0999999999999837 | F25: 51 | G25: 54 | H25: 1.0588235294117647 | I25: =IF(G25="","",IF(G25=0,"0 : "&F25*18,"1 : "&ROUND(((F25*18)/G25),0))) -> 1 : 17
A26: =A25+1 -> 22 | B26: Simon Thompson | C26: 12.7 | D26: 11.6 | E26: =D26 -> 11.6 | F26: 29 | G26: 29 | H26: 1.00 | I26: =IF(G26="","",IF(G26=0,"0 : "&F26*18,"1 : "&ROUND(((F26*18)/G26),0))) -> 1 : 18
A27: =A26+1 -> 23 | B27: Danny Marsh | C27: 10.0 | D27: 8.2000000000009994 | E27: =D27 -> 8.2000000000009994 | F27: 7 | G27: 6 | H27: 0.8571428571428571 | I27: =IF(G27="","",IF(G27=0,"0 : "&F27*18,"1 : "&ROUND(((F27*18)/G27),0))) -> 1 : 21
A28: =A27+1 -> 24 | B28: Keith Mendelson | C28: 14.4 | D28: 15.7 | E28: =D28 -> 15.7 | F28: 44 | G28: 37 | H28: 0.84090909090909094 | I28: =IF(G28="","",IF(G28=0,"0 : "&F28*18,"1 : "&ROUND(((F28*18)/G28),0))) -> 1 : 21
A29: =A28+1 -> 25 | B29: Jeff Gibbons | C29: 21.7 | D29: 20.000000000003013 | E29: =D29 -> 20.000000000003013 | F29: 48 | G29: 33 | H29: 0.6875 | I29: =IF(G29="","",IF(G29=0,"0 : "&F29*18,"1 : "&ROUND(((F29*18)/G29),0))) -> 1 : 26
A30: =A29+1 -> 26 | B30: Kevin Gallagher | C30: 10.4 | D30: 11.80000000000199 | E30: =D30 -> 11.80000000000199 | F30: 47 | G30: 32 | H30: 0.68085106382978722 | I30: =IF(G30="","",IF(G30=0,"0 : "&F30*18,"1 : "&ROUND(((F30*18)/G30),0))) -> 1 : 26
A31: =A30+1 -> 27 | B31: Neil Leah | C31: 15.0 | D31: 15.0 | E31: =D31 -> 15 | F31: 0 | G31: 0 | H31: 0.00 | I31: =IF(G31="","",IF(G31=0,"0 : "&F31*18,"1 : "&ROUND(((F31*18)/G31),0))) -> 0 : 0
A32: =A31+1 -> 28 | B32: Malcolm Rouse | C32: 42.9 | D32: 42.9 | E32: =D32 -> 42.9 | F32: 0 | G32: 0 | H32: 0.00 | I32: =IF(G32="","",IF(G32=0,"0 : "&F32*18,"1 : "&ROUND(((F32*18)/G32),0))) -> 0 : 0
A33: =A32+1 -> 29 | B33: Keith Johns | C33: 24.3 | D33: 24.3 | E33: =D33 -> 24.3 | F33: 0 | G33: 0 | H33: 0.00 | I33: =IF(G33="","",IF(G33=0,"0 : "&F33*18,"1 : "&ROUND(((F33*18)/G33),0))) -> 0 : 0
A34: =A33+1 -> 30 | B34: Dave Archer | C34: 22.0 | D34: 22.0 | E34: =D34 -> 22 | F34: 0 | G34: 0 | H34: 0.00 | I34: =IF(G34="","",IF(G34=0,"0 : "&F34*18,"1 : "&ROUND(((F34*18)/G34),0))) -> 0 : 0
A35: =A34+1 -> 31 | B35: Clive Ferris | C35: 26.0 | D35: 26.0 | E35: =D35 -> 26 | F35: 0 | G35: 0 | H35: 0.00 | I35: =IF(G35="","",IF(G35=0,"0 : "&F35*18,"1 : "&ROUND(((F35*18)/G35),0))) -> 0 : 0
A36: =A35+1 -> 32 | B36: Andrew Knight | C36: 21.4 | D36: 21.4 | E36: =D36 -> 21.4 | F36: 0 | G36: 0 | H36: 0.00 | I36: =IF(G36="","",IF(G36=0,"0 : "&F36*18,"1 : "&ROUND(((F36*18)/G36),0))) -> 0 : 0
F37: TOTAL | G37: =SUM(G5:G36) -> 600