A1: Season 7 - April 2nd 2005 to 31st March 2006
A2: MGA World Tour Order of Merit
B3: Statistics updated | C3: =TODAY() -> 38817
A4: Pos | B4: Player | C4: Original Handicap | D4: Current Handicap | E4: Playing Handicap | F4: Played | G4: Points | H4: Average | I4: HI / LOW Score | J4: Qualified (10 games)
A5: 1 | B5: Jeff Colbrook | C5: 17.2 | D5: 13.1 | E5: =D5 -> 13.1 | F5: 10 | G5: 335 | H5: =IF(ISERROR(G5/F5),0,G5/F5) -> 33.50 | I5: 44 / 27 | J5: =IF(F5>=10,"Yes","") -> Yes
A6: =IF(J6="","",A5+1) -> 2 | B6: Dave Andrews | C6: 17.2 | D6: 17.500000000001002 | E6: =D6 -> 17.500000000001002 | F6: 22 | G6: 700 | H6: =IF(ISERROR(G6/F6),0,G6/F6) -> 31.818181818181817 | I6: 39 / 21 | J6: =IF(F6>=10,"Yes","") -> Yes
A7: =IF(J7="","",A6+1) -> 3 | B7: Kevin Gallagher | C7: 10.4 | D7: 11.80000000000199 | E7: =D7 -> 11.80000000000199 | F7: 47 | G7: 1491 | H7: =IF(ISERROR(G7/F7),0,G7/F7) -> 31.723404255319149 | I7: 40 / 20 | J7: =IF(F7>=10,"Yes","") -> Yes
A8: =IF(J8="","",A7+1) -> 4 | B8: Jeff Gibbons | C8: 21.7 | D8: 20.000000000003013 | E8: =D8 -> 20.000000000003013 | F8: 48 | G8: 1515 | H8: =IF(ISERROR(G8/F8),0,G8/F8) -> 31.5625 | I8: 42 / 16 | J8: =IF(F8>=10,"Yes","") -> Yes
A9: =IF(J9="","",A8+1) -> 5 | B9: Robert Thompson | C9: 8.2 | D9: 8.0999999999999837 | E9: =D9 -> 8.0999999999999837 | F9: 51 | G9: 1556 | H9: =IF(ISERROR(G9/F9),0,G9/F9) -> 30.509803921568629 | I9: 41 / 23 | J9: =IF(F9>=10,"Yes","") -> Yes
A10: =IF(J10="","",A9+1) -> 6 | B10: Simon Thompson | C10: 12.7 | D10: 11.6 | E10: =D10 -> 11.6 | F10: 29 | G10: 882 | H10: =IF(ISERROR(G10/F10),0,G10/F10) -> 30.413793103448278 | I10: 42 / 22 | J10: =IF(F10>=10,"Yes","") -> Yes
A11: =IF(J11="","",A10+1) -> 7 | B11: Keith Mendelson | C11: 14.4 | D11: 15.7 | E11: =D11 -> 15.7 | F11: 44 | G11: 1331 | H11: =IF(ISERROR(G11/F11),0,G11/F11) -> 30.25 | I11: 41 / 18 | J11: =IF(F11>=10,"Yes","") -> Yes
A12: =IF(J12="","",A11+1) -> 8 | B12: Alan Hopkins | C12: 7.7 | D12: 8.400000000001997 | E12: =D12 -> 8.400000000001997 | F12: 18 | G12: 534 | H12: =IF(ISERROR(G12/F12),0,G12/F12) -> 29.666666666666668 | I12: 35 / 20 | J12: =IF(F12>=10,"Yes","") -> Yes
A13: =IF(J13="","",A12+1) -> 9 | B13: Paul Carter | C13: 12.4 | D13: 12.8 | E13: =D13 -> 12.8 | F13: 12 | G13: 355 | H13: =IF(ISERROR(G13/F13),0,G13/F13) -> 29.583333333333332 | I13: 35 / 21 | J13: =IF(F13>=10,"Yes","") -> Yes
A14: =IF(J14="","",A13+1) -> 10 | B14: Martin Cox | C14: 11.3 | D14: 12.300000000001996 | E14: =D14 -> 12.300000000001996 | F14: 14 | G14: 408 | H14: =IF(ISERROR(G14/F14),0,G14/F14) -> 29.142857142857142 | I14: 38 / 22 | J14: =IF(F14>=10,"Yes","") -> Yes
A15: =IF(J15="","",A14+1) -> 11 | B15: Dave Rouse | C15: 22.9 | D15: 24.6 | E15: =D15 -> 24.6 | F15: 18 | G15: 514 | H15: =IF(ISERROR(G15/F15),0,G15/F15) -> 28.555555555555557 | I15: 41 / 17 | J15: =IF(F15>=10,"Yes","") -> Yes
A16: =IF(J16="","",A15+1) -> 12 | B16: Roy Dickens | C16: 29.6 | D16: 29.6 | E16: =D16 -> 29.6 | F16: 21 | G16: 584 | H16: =IF(ISERROR(G16/F16),0,G16/F16) -> 27.80952380952381 | I16: 44 / 13 | J16: =IF(F16>=10,"Yes","") -> Yes
A17: =IF(J17="","",A16+1) -> 13 | B17: Martin Bould | C17: 18.3 | D17: 20.400000000001 | E17: =D17 -> 20.400000000001 | F17: 14 | G17: 384 | H17: =IF(ISERROR(G17/F17),0,G17/F17) -> 27.428571428571427 | I17: 38 / 20 | J17: =IF(F17>=10,"Yes","") -> Yes
A18: =IF(J18="","",A17+1) ->  | B18: Paul Baldwin | C18: 17.7 | D18: 16.900000000001 | E18: =D18 -> 16.900000000001 | F18: 4 | G18: 132 | H18: =IF(ISERROR(G18/F18),0,G18/F18) -> 33.00 | I18: 39 / 28 | J18: =IF(F18>=10,"Yes","") -> 
A19: =IF(J19="","",A18+1) ->  | B19: Danny Marsh | C19: 10.0 | D19: 8.2000000000009994 | E19: =D19 -> 8.2000000000009994 | F19: 7 | G19: 225 | H19: =IF(ISERROR(G19/F19),0,G19/F19) -> 32.142857142857146 | I19: 37 / 28 | J19: =IF(F19>=10,"Yes","") -> 
A20: =IF(J20="","",A19+1) ->  | B20: Dave White | C20: 22.0 | D20: 22.1 | E20: =D20 -> 22.1 | F20: 1 | G20: 32 | H20: =IF(ISERROR(G20/F20),0,G20/F20) -> 32.00 | I20: 32 / 32 | J20: =IF(F20>=10,"Yes","") -> 
A21: =IF(J21="","",A20+1) ->  | B21: Ian Edwards | C21: 14.9 | D21: 15.2 | E21: =D21 -> 15.2 | F21: 6 | G21: 189 | H21: =IF(ISERROR(G21/F21),0,G21/F21) -> 31.50 | I21: 34 / 29 | J21: =IF(F21>=10,"Yes","") -> 
A22: =IF(J22="","",A21+1) ->  | B22: Chris Manning | C22: 22.6 | D22: 22.7 | E22: =D22 -> 22.7 | F22: 1 | G22: 31 | H22: =IF(ISERROR(G22/F22),0,G22/F22) -> 31.00 | I22: 31 / 31 | J22: =IF(F22>=10,"Yes","") -> 
A23: =IF(J23="","",A22+1) ->  | B23: John Press | C23: 15.0 | D23: 14.9 | E23: =D23 -> 14.9 | F23: 3 | G23: 92 | H23: =IF(ISERROR(G23/F23),0,G23/F23) -> 30.666666666666668 | I23: 38 / 24 | J23: =IF(F23>=10,"Yes","") -> 
A24: =IF(J24="","",A23+1) ->  | B24: Matt Carter | C24: 20.0 | D24: 20.9 | E24: =D24 -> 20.9 | F24: 8 | G24: 236 | H24: =IF(ISERROR(G24/F24),0,G24/F24) -> 29.50 | I24: 36 / 22 | J24: =IF(F24>=10,"Yes","") -> 
A25: =IF(J25="","",A24+1) ->  | B25: Andy Benson | C25: 6.0 | D25: 6.7 | E25: =D25 -> 6.7 | F25: 5 | G25: 140 | H25: =IF(ISERROR(G25/F25),0,G25/F25) -> 28.00 | I25: 34 / 24 | J25: =IF(F25>=10,"Yes","") -> 
A26: =IF(J26="","",A25+1) ->  | B26: Michael Trimmings | C26: 22.8 | D26: 22.800000000001003 | E26: =D26 -> 22.800000000001003 | F26: 9 | G26: 249 | H26: =IF(ISERROR(G26/F26),0,G26/F26) -> 27.666666666666668 | I26: 42 / 13 | J26: =IF(F26>=10,"Yes","") -> 
A27: =IF(J27="","",A26+1) ->  | B27: Steve Tilling | C27: 16.3 | D27: 16.5 | E27: =D27 -> 16.5 | F27: 1 | G27: 26 | H27: =IF(ISERROR(G27/F27),0,G27/F27) -> 26.00 | I27: 26 / 26 | J27: =IF(F27>=10,"Yes","") -> 
A28: =IF(J28="","",A27+1) ->  | B28: Andrew Baldwin | C28: 15.4 | D28: 17.4 | E28: =D28 -> 17.4 | F28: 6 | G28: 140 | H28: =IF(ISERROR(G28/F28),0,G28/F28) -> 23.333333333333332 | I28: 29 / 19 | J28: =IF(F28>=10,"Yes","") -> 
A29: =IF(J29="","",A28+1) ->  | B29: Alan Baldwin | C29: 18.9 | D29: 22.6 | E29: =D29 -> 22.6 | F29: 8 | G29: 165 | H29: =IF(ISERROR(G29/F29),0,G29/F29) -> 20.625 | I29: 41 / 13 | J29: =IF(F29>=10,"Yes","") -> 
A30: =IF(J30="","",A29+1) ->  | B30: Jon Dey | C30: 35.8 | D30: 36.8 | E30: =D30 -> 36.8 | F30: 1 | G30: 18 | H30: =IF(ISERROR(G30/F30),0,G30/F30) -> 18.00 | I30: 18 / 18 | J30: =IF(F30>=10,"Yes","") -> 
A31: =IF(J31="","",A30+1) ->  | B31: Neil Leah | C31: 15.0 | D31: 15.0 | E31: =D31 -> 15 | F31: 0 | G31: 0 | H31: =IF(ISERROR(G31/F31),0,G31/F31) -> 0.00 | I31: / | J31: =IF(F31>=10,"Yes","") -> 
A32: =IF(J32="","",A31+1) ->  | B32: Malcolm Rouse | C32: 42.9 | D32: 42.9 | E32: =D32 -> 42.9 | F32: 0 | G32: 0 | H32: =IF(ISERROR(G32/F32),0,G32/F32) -> 0.00 | I32: / | J32: =IF(F32>=10,"Yes","") -> 
A33: =IF(J33="","",A32+1) ->  | B33: Keith Johns | C33: 24.3 | D33: 24.3 | E33: =D33 -> 24.3 | F33: 0 | G33: 0 | H33: =IF(ISERROR(G33/F33),0,G33/F33) -> 0.00 | I33: / | J33: =IF(F33>=10,"Yes","") -> 
A34: =IF(J34="","",A33+1) ->  | B34: Dave Archer | C34: 22.0 | D34: 22.0 | E34: =D34 -> 22 | F34: 0 | G34: 0 | H34: =IF(ISERROR(G34/F34),0,G34/F34) -> 0.00 | I34: / | J34: =IF(F34>=10,"Yes","") -> 
A35: =IF(J35="","",A34+1) ->  | B35: Clive Ferris | C35: 26.0 | D35: 26.0 | E35: =D35 -> 26 | F35: 0 | G35: 0 | H35: =IF(ISERROR(G35/F35),0,G35/F35) -> 0.00 | I35: / | J35: =IF(F35>=10,"Yes","") -> 
A36: =IF(J36="","",A35+1) ->  | B36: Andrew Knight | C36: 21.4 | D36: 21.4 | E36: =D36 -> 21.4 | F36: 0 | G36: 0 | H36: =IF(ISERROR(G36/F36),0,G36/F36) -> 0.00 | I36: / | J36: =IF(F36>=10,"Yes","") -> 