A1: Season 7 - April 2nd 2005 to 31st March 2006
A2: MGA World Tour Putting Statistics
B3: Statistics updated | C3: =TODAY() -> 38817
A4: Pos | B4: Player | C4: Original Handicap | D4: Current Handicap | E4: Playing Handicap | F4: Played | G4: Total Putts | H4: Ave per Round | I4: Ave Per Hole | J4: Best Round | K4: Worst Round
A5: 1 | B5: Martin Cox | C5: 11.3 | D5: 12.300000000001996 | E5: =D5 -> 12.300000000001996 | F5: 14 | G5: 431 | H5: 30.785714285714285 | I5: =IF(G5=0,"",G5/(F5*18)) -> 1.7103174603174602 | J5: 25 | K5: 37
A6: =A5+1 -> 2 | B6: Robert Thompson | C6: 8.2 | D6: 8.0999999999999837 | E6: =D6 -> 8.0999999999999837 | F6: 51 | G6: 1632 | H6: 32.00 | I6: =IF(G6=0,"",G6/(F6*18)) -> 1.7777777777777777 | J6: 25 | K6: 38
A7: =A6+1 -> 3 | B7: Jeff Gibbons | C7: 21.7 | D7: 20.000000000003013 | E7: =D7 -> 20.000000000003013 | F7: 48 | G7: 1536 | H7: 32.00 | I7: =IF(G7=0,"",G7/(F7*18)) -> 1.7777777777777777 | J7: 27 | K7: 42
A8: =A7+1 -> 4 | B8: Dave Andrews | C8: 17.2 | D8: 17.500000000001002 | E8: =D8 -> 17.500000000001002 | F8: 22 | G8: 714 | H8: 32.454545454545453 | I8: =IF(G8=0,"",G8/(F8*18)) -> 1.803030303030303 | J8: 27 | K8: 37
A9: =A8+1 -> 5 | B9: Keith Mendelson | C9: 14.4 | D9: 15.7 | E9: =D9 -> 15.7 | F9: 44 | G9: 1440 | H9: 32.727272727272727 | I9: =IF(G9=0,"",G9/(F9*18)) -> 1.8181818181818181 | J9: 27 | K9: 39
A10: =A9+1 -> 6 | B10: Kevin Gallagher | C10: 10.4 | D10: 11.80000000000199 | E10: =D10 -> 11.80000000000199 | F10: 47 | G10: 1541 | H10: 32.787234042553195 | I10: =IF(G10=0,"",G10/(F10*18)) -> 1.8215130023640662 | J10: 28 | K10: 40
A11: =A10+1 -> 7 | B11: Simon Thompson | C11: 12.7 | D11: 11.6 | E11: =D11 -> 11.6 | F11: 29 | G11: 982 | H11: 33.862068965517238 | I11: =IF(G11=0,"",G11/(F11*18)) -> 1.8812260536398469 | J11: 27 | K11: 39
A12: =A11+1 -> 8 | B12: Paul Carter | C12: 12.4 | D12: 12.8 | E12: =D12 -> 12.8 | F12: 12 | G12: 407 | H12: 33.916666666666664 | I12: =IF(G12=0,"",G12/(F12*18)) -> 1.8842592592592593 | J12: 30 | K12: 39
A13: =A12+1 -> 9 | B13: Jeff Colbrook | C13: 17.2 | D13: 13.1 | E13: =D13 -> 13.1 | F13: 10 | G13: 340 | H13: 34.00 | I13: =IF(G13=0,"",G13/(F13*18)) -> 1.8888888888888888 | J13: 27 | K13: 40
A14: =A13+1 -> 10 | B14: Alan Hopkins | C14: 7.7 | D14: 8.400000000001997 | E14: =D14 -> 8.400000000001997 | F14: 18 | G14: 620 | H14: 34.444444444444443 | I14: =IF(G14=0,"",G14/(F14*18)) -> 1.9135802469135803 | J14: 30 | K14: 40
A15: =A14+1 -> 11 | B15: Dave Rouse | C15: 22.9 | D15: 24.6 | E15: =D15 -> 24.6 | F15: 18 | G15: 655 | H15: 36.388888888888886 | I15: =IF(G15=0,"",G15/(F15*18)) -> 2.0216049382716048 | J15: 30 | K15: 44
A16: =A15+1 -> 12 | B16: Martin Bould | C16: 18.3 | D16: 20.400000000001 | E16: =D16 -> 20.400000000001 | F16: 14 | G16: 513 | H16: 36.642857142857146 | I16: =IF(G16=0,"",G16/(F16*18)) -> 2.0357142857142856 | J16: 32 | K16: 43
A17: =A16+1 -> 13 | B17: Roy Dickens | C17: 29.6 | D17: 29.6 | E17: =D17 -> 29.6 | F17: 21 | G17: 802 | H17: 38.19047619047619 | I17: =IF(G17=0,"",G17/(F17*18)) -> 2.1216931216931219 | J17: 32 | K17: 44
A18: =A17+1 -> 14 | B18: Danny Marsh | C18: 10.0 | D18: 8.2000000000009994 | E18: =D18 -> 8.2000000000009994 | F18: 7 | G18: 222 | H18: 31.714285714285715 | I18: =IF(G18=0,"",G18/(F18*18)) -> 1.7619047619047619 | J18: 29 | K18: 34
A19: =A18+1 -> 15 | B19: Dave White | C19: 22.0 | D19: 22.1 | E19: =D19 -> 22.1 | F19: 1 | G19: 32 | H19: 32.00 | I19: =IF(G19=0,"",G19/(F19*18)) -> 1.7777777777777777 | J19: 32 | K19: 32
A20: =A19+1 -> 16 | B20: Andy Benson | C20: 6.0 | D20: 6.7 | E20: =D20 -> 6.7 | F20: 5 | G20: 167 | H20: 33.40 | I20: =IF(G20=0,"",G20/(F20*18)) -> 1.8555555555555556 | J20: 31 | K20: 38
A21: =A20+1 -> 17 | B21: Paul Baldwin | C21: 17.7 | D21: 16.900000000001 | E21: =D21 -> 16.900000000001 | F21: 4 | G21: 138 | H21: 34.50 | I21: =IF(G21=0,"",G21/(F21*18)) -> 1.9166666666666667 | J21: 29 | K21: 38
A22: =A21+1 -> 18 | B22: Ian Edwards | C22: 14.9 | D22: 15.2 | E22: =D22 -> 15.2 | F22: 6 | G22: 210 | H22: 35.00 | I22: =IF(G22=0,"",G22/(F22*18)) -> 1.9444444444444444 | J22: 28 | K22: 40
A23: =A22+1 -> 19 | B23: Chris Manning | C23: 22.6 | D23: 22.7 | E23: =D23 -> 22.7 | F23: 1 | G23: 35 | H23: 35.00 | I23: =IF(G23=0,"",G23/(F23*18)) -> 1.9444444444444444 | J23: 35 | K23: 35
A24: =A23+1 -> 20 | B24: Matt Carter | C24: 20.0 | D24: 20.9 | E24: =D24 -> 20.9 | F24: 8 | G24: 290 | H24: 36.25 | I24: =IF(G24=0,"",G24/(F24*18)) -> 2.0138888888888888 | J24: 34 | K24: 39
A25: =A24+1 -> 21 | B25: Michael Trimmings | C25: 22.8 | D25: 22.800000000001003 | E25: =D25 -> 22.800000000001003 | F25: 9 | G25: 332 | H25: 36.888888888888886 | I25: =IF(G25=0,"",G25/(F25*18)) -> 2.0493827160493829 | J25: 32 | K25: 41
A26: =A25+1 -> 22 | B26: Andrew Baldwin | C26: 15.4 | D26: 17.4 | E26: =D26 -> 17.4 | F26: 6 | G26: 222 | H26: 37.00 | I26: =IF(G26=0,"",G26/(F26*18)) -> 2.0555555555555554 | J26: 35 | K26: 41
A27: =A26+1 -> 23 | B27: John Press | C27: 15.0 | D27: 14.9 | E27: =D27 -> 14.9 | F27: 3 | G27: 111 | H27: 37.00 | I27: =IF(G27=0,"",G27/(F27*18)) -> 2.0555555555555554 | J27: 36 | K27: 39
A28: =A27+1 -> 24 | B28: Steve Tilling | C28: 16.3 | D28: 16.5 | E28: =D28 -> 16.5 | F28: 1 | G28: 37 | H28: 37.00 | I28: =IF(G28=0,"",G28/(F28*18)) -> 2.0555555555555554 | J28: 37 | K28: 37
A29: =A28+1 -> 25 | B29: Jon Dey | C29: 35.8 | D29: 36.8 | E29: =D29 -> 36.8 | F29: 1 | G29: 37 | H29: 37.00 | I29: =IF(G29=0,"",G29/(F29*18)) -> 2.0555555555555554 | J29: 37 | K29: 37
A30: =A29+1 -> 26 | B30: Alan Baldwin | C30: 18.9 | D30: 22.6 | E30: =D30 -> 22.6 | F30: 8 | G30: 311 | H30: 38.875 | I30: =IF(G30=0,"",G30/(F30*18)) -> 2.1597222222222223 | J30: 32 | K30: 45
A31: =A30+1 -> 27 | B31: Keith Johns | C31: 24.3 | D31: 24.3 | E31: =D31 -> 24.3 | F31: 0 | G31: 0 | H31: 0.00 | I31: =IF(G31=0,"",G31/(F31*18)) ->  | J31: 0 | K31: 0
A32: =A31+1 -> 28 | B32: Andrew Knight | C32: 21.4 | D32: 21.4 | E32: =D32 -> 21.4 | F32: 0 | G32: 0 | H32: 0.00 | I32: =IF(G32=0,"",G32/(F32*18)) ->  | J32: 0 | K32: 0
A33: =A32+1 -> 29 | B33: Neil Leah | C33: 15.0 | D33: 15.0 | E33: =D33 -> 15 | F33: 0 | G33: 0 | H33: 0.00 | I33: =IF(G33=0,"",G33/(F33*18)) ->  | J33: 0 | K33: 0
A34: =A33+1 -> 30 | B34: Malcolm Rouse | C34: 42.9 | D34: 42.9 | E34: =D34 -> 42.9 | F34: 0 | G34: 0 | H34: 0.00 | I34: =IF(G34=0,"",G34/(F34*18)) ->  | J34: 0 | K34: 0
A35: =A34+1 -> 31 | B35: Dave Archer | C35: 22.0 | D35: 22.0 | E35: =D35 -> 22 | F35: 0 | G35: 0 | H35: 0.00 | I35: =IF(G35=0,"",G35/(F35*18)) ->  | J35: 0 | K35: 0
A36: =A35+1 -> 32 | B36: Clive Ferris | C36: 26.0 | D36: 26.0 | E36: =D36 -> 26 | F36: 0 | G36: 0 | H36: 0.00 | I36: =IF(G36=0,"",G36/(F36*18)) ->  | J36: 0 | K36: 0