A1: Jeff Gibbons
A2: Club | B2: Chelsfield Lakes
A3: Par/SS | B3: 71/68 | D3: Num. Of Fairways | I3: =IF(B2="","",18-(COUNTIF(B9:B26,3))) -> 14
A4: Date | B4: 37737 | D4: Playing Handicap | I4: 13
A5: Event Place | B5: 2 | D5: Prize Money | G5: 8750
A6: Game Stats | B6: DB+ | C6: DB | D6: Bi | E6: P | F6: B | G6: E | H6: A | I6: H1
B7: 0 | C7: 3 | D7: 8 | E7: 6 | F7: 1 | G7: 0 | H7: 0 | I7: 0
A8: Hole No | B8: Par | C8: Stroke Index | D8: Gross Score | E8: Points | F8: Putts | G8: Fairways | H8: Ferrets | I8: Green Regulation
A9: 1 | B9: 4 | C9: 12 | D9: 4 | E9: 3 | F9: 1 | G9: 1 | I9: Yes
A10: 2 | B10: 3 | C10: 7 | D10: 4 | E10: 2 | F10: 1
A11: 3 | B11: 4 | C11: 11 | D11: 3 | E11: 4 | F11: 0 | I11: Yes
A12: 4 | B12: 4 | C12: 2 | D12: 6 | E12: 1 | F12: 2 | G12: 1
A13: 5 | B13: 3 | C13: 9 | D13: 3 | E13: 3 | F13: 2 | I13: Yes
A14: 6 | B14: 5 | C14: 14 | D14: 6 | E14: 1 | F14: 2
A15: 7 | B15: 5 | C15: 6 | D15: 5 | E15: 3 | F15: 1 | I15: Yes
A16: 8 | B16: 4 | C16: 18 | D16: 5 | E16: 1 | F16: 2 | G16: 1
A17: 9 | B17: 4 | C17: 5 | D17: 5 | E17: 2 | F17: 2 | G17: 1 | I17: Yes
A18: 10 | B18: 4 | C18: 10 | D18: 6 | E18: 1 | F18: 2
A19: 11 | B19: 4 | C19: 13 | D19: 4 | E19: 3 | F19: 1 | G19: 1 | I19: Yes
A20: 12 | B20: 4 | C20: 8 | D20: 6 | E20: 1 | F20: 2
A21: 13 | B21: 5 | C21: 1 | D21: 6 | E21: 2 | F21: 2 | G21: 1 | I21: Yes
A22: 14 | B22: 4 | C22: 16 | D22: 4 | E22: 2 | F22: 2 | I22: Yes
A23: 15 | B23: 3 | C23: 17 | D23: 4 | E23: 1 | F23: 2
A24: 16 | B24: 4 | C24: 3 | D24: 5 | E24: 2 | F24: 2 | G24: 1 | I24: Yes
A25: 17 | B25: 3 | C25: 15 | D25: 4 | E25: 1 | F25: 2
A26: 18 | B26: 4 | C26: 4 | D26: 4 | E26: 3 | F26: 2 | I26: Yes
A27: Totals | B27: =IF(B2="","",SUM(B9:B26)) -> 71 | D27: =IF(B2="","",SUM(D9:D26)) -> 84 | E27: =IF(B2="","",SUM(E9:E26)) -> 36 | F27: =IF(B2="","",SUM(F9:F26)) -> 30 | G27: =IF(B2="","",SUM(G9:G26)) -> 7 | H27: =IF(B2="","",SUM(H9:H26)) -> 0 | I27: =IF(COUNTIF(I9:I26,"=Yes")=0,"",COUNTIF(I9:I26,"=Yes")) -> 10