A1: Season 10 - April 1st 2008 to 31st March 2009
A2: MGA World Tour Driving Accuracy (Fairways Hit)
B3: Statistics updated | C3: =TODAY() -> 39902
A4: Pos | B4: Player | C4: Original Handicap | D4: Current Handicap | E4: Playing Handicap | F4: Played | G4: Total Number of Fairways | H4: Total Fairways Hit | I4: Fairway %
A5: 1 | B5: Kevin Gallagher | C5: 12.0 | D5: 13.500000000001993 | E5: =D5 -> 13.500000000001993 | F5: 19 | G5: 248 | H5: 155 | I5: =IF(F5=0,"0 %",ROUND((H5/G5)*100,2) &" %") -> 62.5 % | J5: Qualified
A6: 2 | B6: Jeff Gibbons | C6: 19.6 | D6: 20.5 | E6: =D6 -> 20.5 | F6: 10 | G6: 140 | H6: 75 | I6: =IF(F6=0,"0 %",ROUND((H6/G6)*100,2) &" %") -> 53.57 % | J6: Qualified
A7: 3 | B7: Robert Thompson | C7: 8.7 | D7: 7.9 | E7: =D7 -> 7.9 | F7: 23 | G7: 303 | H7: 152 | I7: =IF(F7=0,"0 %",ROUND((H7/G7)*100,2) &" %") -> 50.17 % | J7: Qualified
A8: 4 | B8: Keith Mendelson | C8: 14.6 | D8: 15.1 | E8: =D8 -> 15.1 | F8: 13 | G8: 181 | H8: 66 | I8: =IF(F8=0,"0 %",ROUND((H8/G8)*100,2) &" %") -> 36.46 % | J8: Qualified
A9: 5 | B9: Paul Carter | C9: 14.7 | D9: 14.7 | E9: =D9 -> 14.7 | F9: 6 | G9: 84 | H9: 30 | I9: =IF(F9=0,"0 %",ROUND((H9/G9)*100,2) &" %") -> 35.71 % | J9: Qualified
A10: 6 | B10: Dave Rouse | C10: 26.4 | D10: 25.6 | E10: =D10 -> 25.6 | F10: 7 | G10: 96 | H10: 34 | I10: =IF(F10=0,"0 %",ROUND((H10/G10)*100,2) &" %") -> 35.42 % | J10: Qualified
A11: 7 | B11: Matthew Carter | C11: 20.2 | D11: 19.600000000002002 | E11: =D11 -> 19.600000000002002 | F11: 7 | G11: 97 | H11: 32 | I11: =IF(F11=0,"0 %",ROUND((H11/G11)*100,2) &" %") -> 32.99 % | J11: Qualified
A12: 8 | B12: John Press | C12: 14.8 | D12: 15.0 | E12: =D12 -> 15 | F12: 1 | G12: 14 | H12: 11 | I12: =IF(F12=0,"0 %",ROUND((H12/G12)*100,2) &" %") -> 78.57 %
A13: 9 | B13: Martin Cox | C13: 13.5 | D13: 13.6 | E13: =D13 -> 13.6 | F13: 3 | G13: 42 | H13: 23 | I13: =IF(F13=0,"0 %",ROUND((H13/G13)*100,2) &" %") -> 54.76 %
A14: 10 | B14: Ian Edwards | C14: 11.8 | D14: 11.8 | E14: =D14 -> 11.8 | F14: 1 | G14: 14 | H14: 7 | I14: =IF(F14=0,"0 %",ROUND((H14/G14)*100,2) &" %") -> 50 %
A15: 11 | B15: Simon Thompson | C15: 12.1 | D15: 12.0 | E15: =D15 -> 12 | F15: 2 | G15: 27 | H15: 13 | I15: =IF(F15=0,"0 %",ROUND((H15/G15)*100,2) &" %") -> 48.15 %
A16: 12 | B16: Jeff Colbrook | C16: 15.6 | D16: 14.9 | E16: =D16 -> 14.9 | F16: 4 | G16: 54 | H16: 24 | I16: =IF(F16=0,"0 %",ROUND((H16/G16)*100,2) &" %") -> 44.44 %
A17: 13 | B17: Dave Bingham | C17: 16.0 | D17: 13.1 | E17: =D17 -> 13.1 | F17: 4 | G17: 55 | H17: 24 | I17: =IF(F17=0,"0 %",ROUND((H17/G17)*100,2) &" %") -> 43.64 %
A18: 14 | B18: Alan Baldwin | C18: 20.3 | D18: 20.3 | E18: =D18 -> 20.3 | F18: 2 | G18: 24 | H18: 10 | I18: =IF(F18=0,"0 %",ROUND((H18/G18)*100,2) &" %") -> 41.67 %
A19: 15 | B19: Paul Baldwin | C19: 18.6 | D19: 19.2 | E19: =D19 -> 19.2 | F19: 3 | G19: 42 | H19: 15 | I19: =IF(F19=0,"0 %",ROUND((H19/G19)*100,2) &" %") -> 35.71 %
A20: 16 | B20: Dave Andrews | C20: 18.9 | D20: 16.6 | E20: =D20 -> 16.6 | F20: 2 | G20: 27 | H20: 9 | I20: =IF(F20=0,"0 %",ROUND((H20/G20)*100,2) &" %") -> 33.33 %
A21: 17 | B21: Simon Owens | C21: 13.3 | D21: 14.4 | E21: =D21 -> 14.4 | F21: 4 | G21: 55 | H21: 17 | I21: =IF(F21=0,"0 %",ROUND((H21/G21)*100,2) &" %") -> 30.91 %
A22: 18 | B22: Andrew Baldwin | C22: 18.1 | D22: 18.6 | E22: =D22 -> 18.6 | F22: 4 | G22: 52 | H22: 15 | I22: =IF(F22=0,"0 %",ROUND((H22/G22)*100,2) &" %") -> 28.85 %
A23: 19 | B23: Roy Dickens | C23: 30.6 | D23: 29.4 | E23: =D23 -> 29.4 | F23: 2 | G23: 28 | H23: 8 | I23: =IF(F23=0,"0 %",ROUND((H23/G23)*100,2) &" %") -> 28.57 %
A24: 20 | B24: Jon Dey | C24: 37.1 | D24: 37.2 | E24: =D24 -> 37.2 | F24: 1 | G24: 14 | H24: 4 | I24: =IF(F24=0,"0 %",ROUND((H24/G24)*100,2) &" %") -> 28.57 %
A25: 21 | B25: Alan Hopkins | C25: 8.2 | D25: 8.2 | E25: =D25 -> 8.2 | F25: 1 | G25: 14 | H25: 4 | I25: =IF(F25=0,"0 %",ROUND((H25/G25)*100,2) &" %") -> 28.57 %
A26: 22 | B26: Michael Trimmings | C26: 22.4 | D26: 22.6 | E26: =D26 -> 22.6 | F26: 1 | G26: 14 | H26: 4 | I26: =IF(F26=0,"0 %",ROUND((H26/G26)*100,2) &" %") -> 28.57 %
A27: 23 | B27: Martin Bould | C27: 20.3 | D27: 19.4 | E27: =D27 -> 19.4 | F27: 4 | G27: 54 | H27: 14 | I27: =IF(F27=0,"0 %",ROUND((H27/G27)*100,2) &" %") -> 25.93 %
A28: 24 | B28: Andy Benson | C28: 7.5 | D28: 7.6 | E28: =D28 -> 7.6 | F28: 1 | G28: 14 | H28: 3 | I28: =IF(F28=0,"0 %",ROUND((H28/G28)*100,2) &" %") -> 21.43 %
A29: 25 | B29: Steve Tilling | C29: 16.5 | D29: 16.5 | E29: =D29 -> 16.5 | F29: 0 | G29: 0 | H29: 0 | I29: =IF(F29=0,"0 %",ROUND((H29/G29)*100,2) &" %") -> 0 %
A30: 26 | B30: Malcolm Rouse | C30: 43.9 | D30: 43.9 | E30: =D30 -> 43.9 | F30: 0 | G30: 0 | H30: 0 | I30: =IF(F30=0,"0 %",ROUND((H30/G30)*100,2) &" %") -> 0 %
A31: 27 | B31: Keith Johns | C31: 24.3 | D31: 24.3 | E31: =D31 -> 24.3 | F31: 0 | G31: 0 | H31: 0 | I31: =IF(F31=0,"0 %",ROUND((H31/G31)*100,2) &" %") -> 0 %
A32: 28 | B32: Dave White | C32: 21.5 | D32: 21.5 | E32: =D32 -> 21.5 | F32: 0 | G32: 0 | H32: 0 | I32: =IF(F32=0,"0 %",ROUND((H32/G32)*100,2) &" %") -> 0 %
A33: 29 | B33: Danny Marsh | C33: 8.1 | D33: 8.1 | E33: =D33 -> 8.1 | F33: 0 | G33: 0 | H33: 0 | I33: =IF(F33=0,"0 %",ROUND((H33/G33)*100,2) &" %") -> 0 %
A34: 30 | B34: Clive Ferris | C34: 26.0 | D34: 26.0 | E34: =D34 -> 26 | F34: 0 | G34: 0 | H34: 0 | I34: =IF(F34=0,"0 %",ROUND((H34/G34)*100,2) &" %") -> 0 %
A35: 31 | B35: Chris Manning | C35: 22.7 | D35: 22.7 | E35: =D35 -> 22.7 | F35: 0 | G35: 0 | H35: 0 | I35: =IF(F35=0,"0 %",ROUND((H35/G35)*100,2) &" %") -> 0 %
A36: 32 | B36: Andrew Knight | C36: 21.4 | D36: 21.4 | E36: =D36 -> 21.4 | F36: 0 | G36: 0 | H36: 0 | I36: =IF(F36=0,"0 %",ROUND((H36/G36)*100,2) &" %") -> 0 %