A1: Season 10 - April 1st 2008 to 31st March 2009
A2: MGA World Tour Order of Ferret by Average
B3: Statistics updated | C3: =TODAY() -> 39914 | G3: See Ferrets by Quantity
A4: Pos | B4: Player | C4: Original Handicap | D4: Current Handicap | E4: Playing Handicap | F4: Played | G4: Total Ferrets | H4: Average per Round | I4: Ferret ratio
A5: 1 | B5: Roy Dickens | C5: 30.6 | D5: 29.4 | E5: =D5 -> 29.4 | F5: 2 | G5: 8 | H5: 4.00 | I5: =IF(G5="","",IF(G5=0,"0 : "&F5*18,"1 : "&ROUND(((F5*18)/G5),0))) -> 1 : 5
A6: =A5+1 -> 2 | B6: Paul Baldwin | C6: 18.6 | D6: 19.2 | E6: =D6 -> 19.2 | F6: 3 | G6: 10 | H6: 3.3333333333333335 | I6: =IF(G6="","",IF(G6=0,"0 : "&F6*18,"1 : "&ROUND(((F6*18)/G6),0))) -> 1 : 5
A7: =A6+1 -> 3 | B7: Paul Carter | C7: 14.7 | D7: 14.7 | E7: =D7 -> 14.7 | F7: 6 | G7: 19 | H7: 3.1666666666666665 | I7: =IF(G7="","",IF(G7=0,"0 : "&F7*18,"1 : "&ROUND(((F7*18)/G7),0))) -> 1 : 6
A8: =A7+1 -> 4 | B8: Jon Press | C8: 14.8 | D8: 15.0 | E8: =D8 -> 15 | F8: 1 | G8: 3 | H8: 3.00 | I8: =IF(G8="","",IF(G8=0,"0 : "&F8*18,"1 : "&ROUND(((F8*18)/G8),0))) -> 1 : 6
A9: =A8+1 -> 5 | B9: Matt Carter | C9: 20.2 | D9: 19.600000000002002 | E9: =D9 -> 19.600000000002002 | F9: 7 | G9: 20 | H9: 2.8571428571428572 | I9: =IF(G9="","",IF(G9=0,"0 : "&F9*18,"1 : "&ROUND(((F9*18)/G9),0))) -> 1 : 6
A10: =A9+1 -> 6 | B10: Andrew Baldwin | C10: 18.1 | D10: 18.6 | E10: =D10 -> 18.6 | F10: 4 | G10: 11 | H10: 2.75 | I10: =IF(G10="","",IF(G10=0,"0 : "&F10*18,"1 : "&ROUND(((F10*18)/G10),0))) -> 1 : 7
A11: =A10+1 -> 7 | B11: Simon Owens | C11: 13.3 | D11: 14.4 | E11: =D11 -> 14.4 | F11: 4 | G11: 11 | H11: 2.75 | I11: =IF(G11="","",IF(G11=0,"0 : "&F11*18,"1 : "&ROUND(((F11*18)/G11),0))) -> 1 : 7
A12: =A11+1 -> 8 | B12: Dave Rouse | C12: 26.4 | D12: 25.6 | E12: =D12 -> 25.6 | F12: 7 | G12: 19 | H12: 2.7142857142857144 | I12: =IF(G12="","",IF(G12=0,"0 : "&F12*18,"1 : "&ROUND(((F12*18)/G12),0))) -> 1 : 7
A13: =A12+1 -> 9 | B13: Martin Cox | C13: 13.5 | D13: 13.6 | E13: =D13 -> 13.6 | F13: 3 | G13: 7 | H13: 2.3333333333333335 | I13: =IF(G13="","",IF(G13=0,"0 : "&F13*18,"1 : "&ROUND(((F13*18)/G13),0))) -> 1 : 8
A14: =A13+1 -> 10 | B14: Jon Dey | C14: 37.1 | D14: 37.2 | E14: =D14 -> 37.2 | F14: 1 | G14: 2 | H14: 2.00 | I14: =IF(G14="","",IF(G14=0,"0 : "&F14*18,"1 : "&ROUND(((F14*18)/G14),0))) -> 1 : 9
A15: =A14+1 -> 11 | B15: Alan Hopkins | C15: 8.2 | D15: 8.2 | E15: =D15 -> 8.2 | F15: 1 | G15: 2 | H15: 2.00 | I15: =IF(G15="","",IF(G15=0,"0 : "&F15*18,"1 : "&ROUND(((F15*18)/G15),0))) -> 1 : 9
A16: =A15+1 -> 12 | B16: Andy Benson | C16: 7.5 | D16: 7.6 | E16: =D16 -> 7.6 | F16: 1 | G16: 2 | H16: 2.00 | I16: =IF(G16="","",IF(G16=0,"0 : "&F16*18,"1 : "&ROUND(((F16*18)/G16),0))) -> 1 : 9
A17: =A16+1 -> 13 | B17: Martin Bould | C17: 20.3 | D17: 19.4 | E17: =D17 -> 19.4 | F17: 4 | G17: 7 | H17: 1.75 | I17: =IF(G17="","",IF(G17=0,"0 : "&F17*18,"1 : "&ROUND(((F17*18)/G17),0))) -> 1 : 10
A18: =A17+1 -> 14 | B18: Dave Bingham | C18: 16.0 | D18: 13.1 | E18: =D18 -> 13.1 | F18: 4 | G18: 7 | H18: 1.75 | I18: =IF(G18="","",IF(G18=0,"0 : "&F18*18,"1 : "&ROUND(((F18*18)/G18),0))) -> 1 : 10
A19: =A18+1 -> 15 | B19: Keith Mendelson | C19: 14.6 | D19: 15.1 | E19: =D19 -> 15.1 | F19: 13 | G19: 16 | H19: 1.2307692307692308 | I19: =IF(G19="","",IF(G19=0,"0 : "&F19*18,"1 : "&ROUND(((F19*18)/G19),0))) -> 1 : 15
A20: =A19+1 -> 16 | B20: Kevin Gallagher | C20: 12.0 | D20: 13.500000000001993 | E20: =D20 -> 13.500000000001993 | F20: 19 | G20: 23 | H20: 1.2105263157894737 | I20: =IF(G20="","",IF(G20=0,"0 : "&F20*18,"1 : "&ROUND(((F20*18)/G20),0))) -> 1 : 15
A21: =A20+1 -> 17 | B21: Jeff Gibbons | C21: 19.6 | D21: 20.5 | E21: =D21 -> 20.5 | F21: 10 | G21: 10 | H21: 1.00 | I21: =IF(G21="","",IF(G21=0,"0 : "&F21*18,"1 : "&ROUND(((F21*18)/G21),0))) -> 1 : 18
A22: =A21+1 -> 18 | B22: Alan Baldwin | C22: 20.3 | D22: 20.3 | E22: =D22 -> 20.3 | F22: 2 | G22: 2 | H22: 1.00 | I22: =IF(G22="","",IF(G22=0,"0 : "&F22*18,"1 : "&ROUND(((F22*18)/G22),0))) -> 1 : 18
A23: =A22+1 -> 19 | B23: Ian Edwards | C23: 11.8 | D23: 11.8 | E23: =D23 -> 11.8 | F23: 1 | G23: 1 | H23: 1.00 | I23: =IF(G23="","",IF(G23=0,"0 : "&F23*18,"1 : "&ROUND(((F23*18)/G23),0))) -> 1 : 18
A24: =A23+1 -> 20 | B24: Robert Thompson | C24: 8.7 | D24: 7.9 | E24: =D24 -> 7.9 | F24: 23 | G24: 22 | H24: 0.95652173913043481 | I24: =IF(G24="","",IF(G24=0,"0 : "&F24*18,"1 : "&ROUND(((F24*18)/G24),0))) -> 1 : 19
A25: =A24+1 -> 21 | B25: Jeff Colbrook | C25: 15.6 | D25: 14.9 | E25: =D25 -> 14.9 | F25: 4 | G25: 3 | H25: 0.75 | I25: =IF(G25="","",IF(G25=0,"0 : "&F25*18,"1 : "&ROUND(((F25*18)/G25),0))) -> 1 : 24
A26: =A25+1 -> 22 | B26: Dave Andrews | C26: 18.9 | D26: 16.6 | E26: =D26 -> 16.6 | F26: 2 | G26: 1 | H26: 0.50 | I26: =IF(G26="","",IF(G26=0,"0 : "&F26*18,"1 : "&ROUND(((F26*18)/G26),0))) -> 1 : 36
A27: =A26+1 -> 23 | B27: Simon Thompson | C27: 12.1 | D27: 12.0 | E27: =D27 -> 12 | F27: 2 | G27: 1 | H27: 0.50 | I27: =IF(G27="","",IF(G27=0,"0 : "&F27*18,"1 : "&ROUND(((F27*18)/G27),0))) -> 1 : 36
A28: =A27+1 -> 24 | B28: Steve Tilling | C28: 16.5 | D28: 16.5 | E28: =D28 -> 16.5 | F28: 0 | G28: 0 | H28: 0.00 | I28: =IF(G28="","",IF(G28=0,"0 : "&F28*18,"1 : "&ROUND(((F28*18)/G28),0))) -> 0 : 0
A29: =A28+1 -> 25 | B29: Michael Trimmings | C29: 22.4 | D29: 22.6 | E29: =D29 -> 22.6 | F29: 1 | G29: 0 | H29: 0.00 | I29: =IF(G29="","",IF(G29=0,"0 : "&F29*18,"1 : "&ROUND(((F29*18)/G29),0))) -> 0 : 18
A30: =A29+1 -> 26 | B30: Malcolm Rouse | C30: 43.9 | D30: 43.9 | E30: =D30 -> 43.9 | F30: 0 | G30: 0 | H30: 0.00 | I30: =IF(G30="","",IF(G30=0,"0 : "&F30*18,"1 : "&ROUND(((F30*18)/G30),0))) -> 0 : 0
A31: =A30+1 -> 27 | B31: Keith Johns | C31: 24.3 | D31: 24.3 | E31: =D31 -> 24.3 | F31: 0 | G31: 0 | H31: 0.00 | I31: =IF(G31="","",IF(G31=0,"0 : "&F31*18,"1 : "&ROUND(((F31*18)/G31),0))) -> 0 : 0
A32: =A31+1 -> 28 | B32: Dave White | C32: 21.5 | D32: 21.5 | E32: =D32 -> 21.5 | F32: 0 | G32: 0 | H32: 0.00 | I32: =IF(G32="","",IF(G32=0,"0 : "&F32*18,"1 : "&ROUND(((F32*18)/G32),0))) -> 0 : 0
A33: =A32+1 -> 29 | B33: Danny Marsh | C33: 8.1 | D33: 8.1 | E33: =D33 -> 8.1 | F33: 0 | G33: 0 | H33: 0.00 | I33: =IF(G33="","",IF(G33=0,"0 : "&F33*18,"1 : "&ROUND(((F33*18)/G33),0))) -> 0 : 0
A34: =A33+1 -> 30 | B34: Clive Ferris | C34: 26.0 | D34: 26.0 | E34: =D34 -> 26 | F34: 0 | G34: 0 | H34: 0.00 | I34: =IF(G34="","",IF(G34=0,"0 : "&F34*18,"1 : "&ROUND(((F34*18)/G34),0))) -> 0 : 0
A35: =A34+1 -> 31 | B35: Chris Manning | C35: 22.7 | D35: 22.7 | E35: =D35 -> 22.7 | F35: 0 | G35: 0 | H35: 0.00 | I35: =IF(G35="","",IF(G35=0,"0 : "&F35*18,"1 : "&ROUND(((F35*18)/G35),0))) -> 0 : 0
A36: =A35+1 -> 32 | B36: Andrew Knight | C36: 21.4 | D36: 21.4 | E36: =D36 -> 21.4 | F36: 0 | G36: 0 | H36: 0.00 | I36: =IF(G36="","",IF(G36=0,"0 : "&F36*18,"1 : "&ROUND(((F36*18)/G36),0))) -> 0 : 0
F37: TOTAL | G37: =SUM(G5:G36) -> 207