A1: Season 10 - April 1st 2008 to 31st March 2009
A2: MGA World Tour Net Greens in Regulation
B3: Statistics updated | C3: =TODAY() -> 39902
A4: Pos | B4: Player | C4: Original Handicap | D4: Current Handicap | E4: Playing Handicap | F4: Played | G4: Total Greens Hit | H4: Green in Regulation | I4: Greens in Regulation Ratio
A5: 1 | B5: Matthew Carter | C5: 20.2 | D5: 19.600000000002002 | E5: =D5 -> 19.600000000002002 | F5: 7 | G5: 78 | H5: 61.9 % | I5: =IF(G5="","",IF(G5=0,"0 : "&F5*18,"1 : "&ROUND((F5*18)/G5,1))) -> 1 : 1.6 | J5: Qualified
A6: 2 | B6: Dave Rouse | C6: 26.4 | D6: 25.6 | E6: =D6 -> 25.6 | F6: 7 | G6: 75 | H6: 59.52 % | I6: =IF(G6="","",IF(G6=0,"0 : "&F6*18,"1 : "&ROUND((F6*18)/G6,1))) -> 1 : 1.7 | J6: Qualified
A7: 3 | B7: Paul Carter | C7: 14.7 | D7: 14.7 | E7: =D7 -> 14.7 | F7: 6 | G7: 63 | H7: 58.33 % | I7: =IF(G7="","",IF(G7=0,"0 : "&F7*18,"1 : "&ROUND((F7*18)/G7,1))) -> 1 : 1.7 | J7: Qualified
A8: 4 | B8: Keith Mendelson | C8: 14.6 | D8: 15.1 | E8: =D8 -> 15.1 | F8: 13 | G8: 132 | H8: 56.41 % | I8: =IF(G8="","",IF(G8=0,"0 : "&F8*18,"1 : "&ROUND((F8*18)/G8,1))) -> 1 : 1.8 | J8: Qualified
A9: 5 | B9: Jeff Gibbons | C9: 19.6 | D9: 20.5 | E9: =D9 -> 20.5 | F9: 10 | G9: 98 | H9: 54.44 % | I9: =IF(G9="","",IF(G9=0,"0 : "&F9*18,"1 : "&ROUND((F9*18)/G9,1))) -> 1 : 1.8 | J9: Qualified
A10: 6 | B10: Kevin Gallagher | C10: 12.0 | D10: 13.500000000001993 | E10: =D10 -> 13.500000000001993 | F10: 19 | G10: 186 | H10: 54.39 % | I10: =IF(G10="","",IF(G10=0,"0 : "&F10*18,"1 : "&ROUND((F10*18)/G10,1))) -> 1 : 1.8 | J10: Qualified
A11: 7 | B11: Robert Thompson | C11: 8.7 | D11: 7.9 | E11: =D11 -> 7.9 | F11: 23 | G11: 222 | H11: 53.62 % | I11: =IF(G11="","",IF(G11=0,"0 : "&F11*18,"1 : "&ROUND((F11*18)/G11,1))) -> 1 : 1.9 | J11: Qualified
A12: 8 | B12: Ian Edwards | C12: 11.8 | D12: 11.8 | E12: =D12 -> 11.8 | F12: 1 | G12: 14 | H12: 77.78 % | I12: =IF(G12="","",IF(G12=0,"0 : "&F12*18,"1 : "&ROUND((F12*18)/G12,1))) -> 1 : 1.3
A13: 9 | B13: Dave Bingham | C13: 16.0 | D13: 13.1 | E13: =D13 -> 13.1 | F13: 4 | G13: 50 | H13: 69.44 % | I13: =IF(G13="","",IF(G13=0,"0 : "&F13*18,"1 : "&ROUND((F13*18)/G13,1))) -> 1 : 1.4
A14: 10 | B14: Jeff Colbrook | C14: 15.6 | D14: 14.9 | E14: =D14 -> 14.9 | F14: 4 | G14: 46 | H14: 63.89 % | I14: =IF(G14="","",IF(G14=0,"0 : "&F14*18,"1 : "&ROUND((F14*18)/G14,1))) -> 1 : 1.6
A15: 11 | B15: Martin Bould | C15: 20.3 | D15: 19.4 | E15: =D15 -> 19.4 | F15: 4 | G15: 46 | H15: 63.89 % | I15: =IF(G15="","",IF(G15=0,"0 : "&F15*18,"1 : "&ROUND((F15*18)/G15,1))) -> 1 : 1.6
A16: 12 | B16: Martin Cox | C16: 13.5 | D16: 13.6 | E16: =D16 -> 13.6 | F16: 3 | G16: 34 | H16: 62.96 % | I16: =IF(G16="","",IF(G16=0,"0 : "&F16*18,"1 : "&ROUND((F16*18)/G16,1))) -> 1 : 1.6
A17: 13 | B17: Roy Dickens | C17: 30.6 | D17: 29.4 | E17: =D17 -> 29.4 | F17: 2 | G17: 22 | H17: 61.11 % | I17: =IF(G17="","",IF(G17=0,"0 : "&F17*18,"1 : "&ROUND((F17*18)/G17,1))) -> 1 : 1.6
A18: 14 | B18: Simon Thompson | C18: 12.1 | D18: 12.0 | E18: =D18 -> 12 | F18: 2 | G18: 20 | H18: 55.56 % | I18: =IF(G18="","",IF(G18=0,"0 : "&F18*18,"1 : "&ROUND((F18*18)/G18,1))) -> 1 : 1.8
A19: 15 | B19: Dave Andrews | C19: 18.9 | D19: 16.6 | E19: =D19 -> 16.6 | F19: 2 | G19: 20 | H19: 55.56 % | I19: =IF(G19="","",IF(G19=0,"0 : "&F19*18,"1 : "&ROUND((F19*18)/G19,1))) -> 1 : 1.8
A20: 16 | B20: Alan Baldwin | C20: 20.3 | D20: 20.3 | E20: =D20 -> 20.3 | F20: 2 | G20: 20 | H20: 55.56 % | I20: =IF(G20="","",IF(G20=0,"0 : "&F20*18,"1 : "&ROUND((F20*18)/G20,1))) -> 1 : 1.8
A21: 17 | B21: Jon Dey | C21: 37.1 | D21: 37.2 | E21: =D21 -> 37.2 | F21: 1 | G21: 10 | H21: 55.56 % | I21: =IF(G21="","",IF(G21=0,"0 : "&F21*18,"1 : "&ROUND((F21*18)/G21,1))) -> 1 : 1.8
A22: 18 | B22: Alan Hopkins | C22: 8.2 | D22: 8.2 | E22: =D22 -> 8.2 | F22: 1 | G22: 10 | H22: 55.56 % | I22: =IF(G22="","",IF(G22=0,"0 : "&F22*18,"1 : "&ROUND((F22*18)/G22,1))) -> 1 : 1.8
A23: 19 | B23: Andy Benson | C23: 7.5 | D23: 7.6 | E23: =D23 -> 7.6 | F23: 1 | G23: 10 | H23: 55.56 % | I23: =IF(G23="","",IF(G23=0,"0 : "&F23*18,"1 : "&ROUND((F23*18)/G23,1))) -> 1 : 1.8
A24: 20 | B24: Michael Trimmings | C24: 22.4 | D24: 22.6 | E24: =D24 -> 22.6 | F24: 1 | G24: 10 | H24: 55.56 % | I24: =IF(G24="","",IF(G24=0,"0 : "&F24*18,"1 : "&ROUND((F24*18)/G24,1))) -> 1 : 1.8
A25: 21 | B25: John Press | C25: 14.8 | D25: 15.0 | E25: =D25 -> 15 | F25: 1 | G25: 9 | H25: 50 % | I25: =IF(G25="","",IF(G25=0,"0 : "&F25*18,"1 : "&ROUND((F25*18)/G25,1))) -> 1 : 2
A26: 22 | B26: Andrew Baldwin | C26: 18.1 | D26: 18.6 | E26: =D26 -> 18.6 | F26: 4 | G26: 35 | H26: 48.61 % | I26: =IF(G26="","",IF(G26=0,"0 : "&F26*18,"1 : "&ROUND((F26*18)/G26,1))) -> 1 : 2.1
A27: 23 | B27: Paul Baldwin | C27: 18.6 | D27: 19.2 | E27: =D27 -> 19.2 | F27: 3 | G27: 26 | H27: 48.15 % | I27: =IF(G27="","",IF(G27=0,"0 : "&F27*18,"1 : "&ROUND((F27*18)/G27,1))) -> 1 : 2.1
A28: 24 | B28: Simon Owens | C28: 13.3 | D28: 14.4 | E28: =D28 -> 14.4 | F28: 4 | G28: 33 | H28: 45.83 % | I28: =IF(G28="","",IF(G28=0,"0 : "&F28*18,"1 : "&ROUND((F28*18)/G28,1))) -> 1 : 2.2
A29: 25 | B29: Andrew Knight | C29: 21.4 | D29: 21.4 | E29: =D29 -> 21.4 | F29: 0 | G29: 0 | H29: 0.00 | I29: =IF(G29="","",IF(G29=0,"0 : "&F29*18,"1 : "&ROUND((F29*18)/G29,1))) -> 0 : 0
A30: 26 | B30: Chris Manning | C30: 22.7 | D30: 22.7 | E30: =D30 -> 22.7 | F30: 0 | G30: 0 | H30: 0.00 | I30: =IF(G30="","",IF(G30=0,"0 : "&F30*18,"1 : "&ROUND((F30*18)/G30,1))) -> 0 : 0
A31: 27 | B31: Clive Ferris | C31: 26.0 | D31: 26.0 | E31: =D31 -> 26 | F31: 0 | G31: 0 | H31: 0.00 | I31: =IF(G31="","",IF(G31=0,"0 : "&F31*18,"1 : "&ROUND((F31*18)/G31,1))) -> 0 : 0
A32: 28 | B32: Danny Marsh | C32: 8.1 | D32: 8.1 | E32: =D32 -> 8.1 | F32: 0 | G32: 0 | H32: 0.00 | I32: =IF(G32="","",IF(G32=0,"0 : "&F32*18,"1 : "&ROUND((F32*18)/G32,1))) -> 0 : 0
A33: 29 | B33: Dave White | C33: 21.5 | D33: 21.5 | E33: =D33 -> 21.5 | F33: 0 | G33: 0 | H33: 0.00 | I33: =IF(G33="","",IF(G33=0,"0 : "&F33*18,"1 : "&ROUND((F33*18)/G33,1))) -> 0 : 0
A34: 30 | B34: Keith Johns | C34: 24.3 | D34: 24.3 | E34: =D34 -> 24.3 | F34: 0 | G34: 0 | H34: 0.00 | I34: =IF(G34="","",IF(G34=0,"0 : "&F34*18,"1 : "&ROUND((F34*18)/G34,1))) -> 0 : 0
A35: 31 | B35: Malcolm Rouse | C35: 43.9 | D35: 43.9 | E35: =D35 -> 43.9 | F35: 0 | G35: 0 | H35: 0.00 | I35: =IF(G35="","",IF(G35=0,"0 : "&F35*18,"1 : "&ROUND((F35*18)/G35,1))) -> 0 : 0
A36: 32 | B36: Steve Tilling | C36: 16.5 | D36: 16.5 | E36: =D36 -> 16.5 | F36: 0 | G36: 0 | H36: 0.00 | I36: =IF(G36="","",IF(G36=0,"0 : "&F36*18,"1 : "&ROUND((F36*18)/G36,1))) -> 0 : 0