A1: Season 10 - April 1st 2008 to 31st March 2009
A2: MGA World Tour Order of Merit
B3: Statistics updated | C3: =TODAY() -> 39902
A4: Pos | B4: Player | C4: Original Handicap | D4: Current Handicap | E4: Playing Handicap | F4: Played | G4: Points | H4: Average | I4: HI / LOW Score | J4: Qualified (5 games)
A5: 1 | B5: Robert Thompson | C5: 8.7 | D5: 7.9 | E5: =D5 -> 7.9 | F5: 23 | G5: 727 | H5: =IF(ISERROR(G5/F5),0,G5/F5) -> 31.608695652173914 | I5: 38 / 23 | J5: =IF(F5>=5,"Qualified","") -> Qualified
A6: 2 | B6: Keith Mendelson | C6: 14.6 | D6: 15.1 | E6: =D6 -> 15.1 | F6: 13 | G6: 410 | H6: =IF(ISERROR(G6/F6),0,G6/F6) -> 31.53846153846154 | I6: 36 / 23 | J6: =IF(F6>=5,"Qualified","") -> Qualified
A7: 3 | B7: Dave Rouse | C7: 26.4 | D7: 25.6 | E7: =D7 -> 25.6 | F7: 7 | G7: 217 | H7: =IF(ISERROR(G7/F7),0,G7/F7) -> 31.00 | I7: 35 / 25 | J7: =IF(F7>=5,"Qualified","") -> Qualified
A8: 4 | B8: Jeff Gibbons | C8: 19.6 | D8: 20.5 | E8: =D8 -> 20.5 | F8: 10 | G8: 304 | H8: =IF(ISERROR(G8/F8),0,G8/F8) -> 30.40 | I8: 36 / 24 | J8: =IF(F8>=5,"Qualified","") -> Qualified
A9: 5 | B9: Matthew Carter | C9: 20.2 | D9: 19.600000000002002 | E9: =D9 -> 19.600000000002002 | F9: 7 | G9: 211 | H9: =IF(ISERROR(G9/F9),0,G9/F9) -> 30.142857142857142 | I9: 37 / 23 | J9: =IF(F9>=5,"Qualified","") -> Qualified
A10: 6 | B10: Kevin Gallagher | C10: 12.0 | D10: 13.500000000001993 | E10: =D10 -> 13.500000000001993 | F10: 19 | G10: 561 | H10: =IF(ISERROR(G10/F10),0,G10/F10) -> 29.526315789473685 | I10: 37 / 22 | J10: =IF(F10>=5,"Qualified","") -> Qualified
A11: 7 | B11: Paul Carter | C11: 14.7 | D11: 14.7 | E11: =D11 -> 14.7 | F11: 6 | G11: 172 | H11: =IF(ISERROR(G11/F11),0,G11/F11) -> 28.666666666666668 | I11: 37 / 26 | J11: =IF(F11>=5,"Qualified","") -> Qualified
A12: 8 | B12: Ian Edwards | C12: 11.8 | D12: 11.8 | E12: =D12 -> 11.8 | F12: 1 | G12: 35 | H12: =IF(ISERROR(G12/F12),0,G12/F12) -> 35.00 | I12: 35 / 35 | J12: =IF(F12>=5,"Qualified","") -> 
A13: 9 | B13: Alan Hopkins | C13: 8.2 | D13: 8.2 | E13: =D13 -> 8.2 | F13: 1 | G13: 35 | H13: =IF(ISERROR(G13/F13),0,G13/F13) -> 35.00 | I13: 35 / 35 | J13: =IF(F13>=5,"Qualified","") -> 
A14: 10 | B14: Dave Bingham | C14: 16.0 | D14: 13.1 | E14: =D14 -> 13.1 | F14: 4 | G14: 138 | H14: =IF(ISERROR(G14/F14),0,G14/F14) -> 34.50 | I14: 39 / 27 | J14: =IF(F14>=5,"Qualified","") -> 
A15: 11 | B15: Martin Bould | C15: 20.3 | D15: 19.4 | E15: =D15 -> 19.4 | F15: 4 | G15: 130 | H15: =IF(ISERROR(G15/F15),0,G15/F15) -> 32.50 | I15: 37 / 31 | J15: =IF(F15>=5,"Qualified","") -> 
A16: 12 | B16: Roy Dickens | C16: 30.6 | D16: 29.4 | E16: =D16 -> 29.4 | F16: 2 | G16: 64 | H16: =IF(ISERROR(G16/F16),0,G16/F16) -> 32.00 | I16: 38 / 26 | J16: =IF(F16>=5,"Qualified","") -> 
A17: 13 | B17: Andy Benson | C17: 7.5 | D17: 7.6 | E17: =D17 -> 7.6 | F17: 1 | G17: 32 | H17: =IF(ISERROR(G17/F17),0,G17/F17) -> 32.00 | I17: 32 / 32 | J17: =IF(F17>=5,"Qualified","") -> 
A18: 14 | B18: Dave Andrews | C18: 18.9 | D18: 16.6 | E18: =D18 -> 16.6 | F18: 2 | G18: 63 | H18: =IF(ISERROR(G18/F18),0,G18/F18) -> 31.50 | I18: 41 / 22 | J18: =IF(F18>=5,"Qualified","") -> 
A19: 15 | B19: Jeff Colbrook | C19: 15.6 | D19: 14.9 | E19: =D19 -> 14.9 | F19: 4 | G19: 125 | H19: =IF(ISERROR(G19/F19),0,G19/F19) -> 31.25 | I19: 39 / 17 | J19: =IF(F19>=5,"Qualified","") -> 
A20: 16 | B20: Alan Baldwin | C20: 20.3 | D20: 20.3 | E20: =D20 -> 20.3 | F20: 2 | G20: 61 | H20: =IF(ISERROR(G20/F20),0,G20/F20) -> 30.50 | I20: 37 / 24 | J20: =IF(F20>=5,"Qualified","") -> 
A21: 17 | B21: Jon Dey | C21: 37.1 | D21: 37.2 | E21: =D21 -> 37.2 | F21: 1 | G21: 30 | H21: =IF(ISERROR(G21/F21),0,G21/F21) -> 30.00 | I21: 30 / 30 | J21: =IF(F21>=5,"Qualified","") -> 
A22: 18 | B22: Simon Thompson | C22: 12.1 | D22: 12.0 | E22: =D22 -> 12 | F22: 2 | G22: 59 | H22: =IF(ISERROR(G22/F22),0,G22/F22) -> 29.50 | I22: 31 / 28 | J22: =IF(F22>=5,"Qualified","") -> 
A23: 19 | B23: Martin Cox | C23: 13.5 | D23: 13.6 | E23: =D23 -> 13.6 | F23: 3 | G23: 88 | H23: =IF(ISERROR(G23/F23),0,G23/F23) -> 29.333333333333332 | I23: 36 / 25 | J23: =IF(F23>=5,"Qualified","") -> 
A24: 20 | B24: Andrew Baldwin | C24: 18.1 | D24: 18.6 | E24: =D24 -> 18.6 | F24: 4 | G24: 108 | H24: =IF(ISERROR(G24/F24),0,G24/F24) -> 27.00 | I24: 33 / 23 | J24: =IF(F24>=5,"Qualified","") -> 
A25: 21 | B25: Michael Trimmings | C25: 22.4 | D25: 22.6 | E25: =D25 -> 22.6 | F25: 1 | G25: 27 | H25: =IF(ISERROR(G25/F25),0,G25/F25) -> 27.00 | I25: 27 / 27 | J25: =IF(F25>=5,"Qualified","") -> 
A26: 22 | B26: John Press | C26: 14.8 | D26: 15.0 | E26: =D26 -> 15 | F26: 1 | G26: 25 | H26: =IF(ISERROR(G26/F26),0,G26/F26) -> 25.00 | I26: 25 / 25 | J26: =IF(F26>=5,"Qualified","") -> 
A27: 23 | B27: Paul Baldwin | C27: 18.6 | D27: 19.2 | E27: =D27 -> 19.2 | F27: 3 | G27: 74 | H27: =IF(ISERROR(G27/F27),0,G27/F27) -> 24.666666666666668 | I27: 26 / 23 | J27: =IF(F27>=5,"Qualified","") -> 
A28: 24 | B28: Simon Owens | C28: 13.3 | D28: 14.4 | E28: =D28 -> 14.4 | F28: 4 | G28: 94 | H28: =IF(ISERROR(G28/F28),0,G28/F28) -> 23.50 | I28: 25 / 20 | J28: =IF(F28>=5,"Qualified","") -> 
A29: 25 | B29: Malcolm Rouse | C29: 43.9 | D29: 43.9 | E29: =D29 -> 43.9 | F29: 0 | G29: 0 | H29: =IF(ISERROR(G29/F29),0,G29/F29) -> 0.00 | I29: / | J29: =IF(F29>=5,"Qualified","") -> 
A30: 26 | B30: Keith Johns | C30: 24.3 | D30: 24.3 | E30: =D30 -> 24.3 | F30: 0 | G30: 0 | H30: =IF(ISERROR(G30/F30),0,G30/F30) -> 0.00 | I30: / | J30: =IF(F30>=5,"Qualified","") -> 
A31: 27 | B31: Steve Tilling | C31: 16.5 | D31: 16.5 | E31: =D31 -> 16.5 | F31: 0 | G31: 0 | H31: =IF(ISERROR(G31/F31),0,G31/F31) -> 0.00 | I31: / | J31: =IF(F31>=5,"Qualified","") -> 
A32: 28 | B32: Dave White | C32: 21.5 | D32: 21.5 | E32: =D32 -> 21.5 | F32: 0 | G32: 0 | H32: =IF(ISERROR(G32/F32),0,G32/F32) -> 0.00 | I32: / | J32: =IF(F32>=5,"Qualified","") -> 
A33: 29 | B33: Danny Marsh | C33: 8.1 | D33: 8.1 | E33: =D33 -> 8.1 | F33: 0 | G33: 0 | H33: =IF(ISERROR(G33/F33),0,G33/F33) -> 0.00 | I33: / | J33: =IF(F33>=5,"Qualified","") -> 
A34: 30 | B34: Clive Ferris | C34: 26.0 | D34: 26.0 | E34: =D34 -> 26 | F34: 0 | G34: 0 | H34: =IF(ISERROR(G34/F34),0,G34/F34) -> 0.00 | I34: / | J34: =IF(F34>=5,"Qualified","") -> 
A35: 31 | B35: Chris Manning | C35: 22.7 | D35: 22.7 | E35: =D35 -> 22.7 | F35: 0 | G35: 0 | H35: =IF(ISERROR(G35/F35),0,G35/F35) -> 0.00 | I35: / | J35: =IF(F35>=5,"Qualified","") -> 
A36: 32 | B36: Andrew Knight | C36: 21.4 | D36: 21.4 | E36: =D36 -> 21.4 | F36: 0 | G36: 0 | H36: =IF(ISERROR(G36/F36),0,G36/F36) -> 0.00 | I36: / | J36: =IF(F36>=5,"Qualified","") -> 