A1: Ian Edwards
A2: Club | B2: Sunningdale Ladies
A3: Par/SS | D3: Num. Of Fairways | I3: =IF(B2="","",18-(COUNTIF(B9:B26,3))) -> 4
A4: Date | B4: 42588 | D4: Playing Handicap | I4: 16.1
A5: Event Place | B5: 12 | C5: M | D5: Prize Money | G5: 7500
A6: Game Stats | B6: DB+ | C6: DB | D6: Bi | E6: P | F6: B | G6: E | H6: A | I6: H1
B7: 4 | C7: 4 | D7: 9 | E7: 1 | F7: 0 | G7: 0 | H7: 0 | I7: 0
A8: Hole No | B8: Par | C8: Stroke Index | D8: Gross Score | E8: Points | F8: Putts | G8: Fairways | H8: Ferrets | I8: Green Regulation
A9: 1 | B9: 3 | C9: 9 | D9: 10 | E9: 0 | F9: 3 | H9: 2
A10: 2 | B10: 3 | C10: 5 | D10: 5 | E10: 1 | F10: 2
A11: 3 | B11: 3 | C11: 17 | D11: 4 | E11: 1 | F11: 2
A12: 4 | B12: 4 | C12: 7 | D12: 6 | E12: 1 | F12: 2 | H12: 1
A13: 5 | B13: 3 | C13: 15 | D13: 9 | E13: 0 | F13: 2 | H13: 1
A14: 6 | B14: 3 | C14: 13 | D14: 10 | E14: 0 | F14: 3 | H14: 2
A15: 7 | B15: 3 | C15: 3 | D15: 4 | E15: 2 | F15: 2 | I15: Yes
A16: 8 | B16: 4 | C16: 1 | D16: 5 | E16: 2 | F16: 2 | I16: Yes
A17: 9 | B17: 3 | C17: 11 | D17: 8 | E17: 0 | F17: 3 | H17: 1
A18: 10 | B18: 3 | C18: 12 | D18: 5 | E18: 1 | F18: 2 | H18: 1
A19: 11 | B19: 3 | C19: 6 | D19: 4 | E19: 2 | F19: 2 | I19: Yes
A20: 12 | B20: 3 | C20: 8 | D20: 4 | E20: 2 | F20: 2 | H20: 1 | I20: Yes
A21: 13 | B21: 4 | C21: 2 | D21: 5 | E21: 2 | F21: 2 | H21: 1 | I21: Yes
A22: 14 | B22: 3 | C22: 18 | D22: 4 | E22: 1 | F22: 2
A23: 15 | B23: 3 | C23: 14 | D23: 4 | E23: 2 | F23: 2 | I23: Yes
A24: 16 | B24: 4 | C24: 4 | D24: 6 | E24: 1 | F24: 3 | I24: Yes
A25: 17 | B25: 3 | C25: 16 | D25: 4 | E25: 2 | F25: 2 | I25: Yes
A26: 18 | B26: 3 | C26: 10 | D26: 3 | E26: 3 | F26: 2 | I26: Yes
A27: Totals | B27: =IF(B2="","",SUM(B9:B26)) -> 58 | D27: =IF(B2="","",SUM(D9:D26)) -> 100 | E27: =IF(B2="","",SUM(E9:E26)) -> 23 | F27: =IF(B2="","",SUM(F9:F26)) -> 40 | G27: =IF(B2="","",SUM(G9:G26)) -> 0 | H27: =IF(B2="","",SUM(H9:H26)) -> 10 | I27: =IF(COUNTIF(I9:I26,"=Yes")=0,"",COUNTIF(I9:I26,"=Yes")) -> 9