A1: Martin Cox
A2: Club | B2: Sunningdale Ladies
A3: Par/SS | D3: Num. Of Fairways | I3: =IF(B2="","",18-(COUNTIF(B9:B26,3))) -> 4
A4: Date | B4: 42588 | D4: Playing Handicap | I4: 15.7
A5: Event Place | B5: 9 | C5: M | D5: Prize Money | G5: 15000
A6: Game Stats | B6: DB+ | C6: DB | D6: Bi | E6: P | F6: B | G6: E | H6: A | I6: H1
B7: 3 | C7: 3 | D7: 10 | E7: 2 | F7: 0 | G7: 0 | H7: 0 | I7: 0
A8: Hole No | B8: Par | C8: Stroke Index | D8: Gross Score | E8: Points | F8: Putts | G8: Fairways | H8: Ferrets | I8: Green Regulation
A9: 1 | B9: 3 | C9: 9 | D9: 7 | E9: 0 | F9: 2
A10: 2 | B10: 3 | C10: 5 | D10: 5 | E10: 1 | F10: 2
A11: 3 | B11: 3 | C11: 17 | D11: 4 | E11: 1 | F11: 2
A12: 4 | B12: 4 | C12: 7 | D12: 5 | E12: 2 | F12: 2 | G12: 1 | I12: Yes
A13: 5 | B13: 3 | C13: 15 | D13: 4 | E13: 2 | F13: 1
A14: 6 | B14: 3 | C14: 13 | D14: 4 | E14: 2 | F14: 1
A15: 7 | B15: 3 | C15: 3 | D15: 4 | E15: 2 | F15: 2 | I15: Yes
A16: 8 | B16: 4 | C16: 1 | D16: 6 | E16: 1 | F16: 2 | G16: 1
A17: 9 | B17: 3 | C17: 11 | D17: 6 | E17: 0 | F17: 1 | H17: 1
A18: 10 | B18: 3 | C18: 12 | D18: 4 | E18: 2 | F18: 2 | I18: Yes
A19: 11 | B19: 3 | C19: 6 | D19: 4 | E19: 2 | F19: 2 | I19: Yes
A20: 12 | B20: 3 | C20: 8 | D20: 5 | E20: 1 | F20: 2
A21: 13 | B21: 4 | C21: 2 | D21: 5 | E21: 2 | F21: 2 | I21: Yes
A22: 14 | B22: 3 | C22: 18 | D22: 3 | E22: 2 | F22: 1
A23: 15 | B23: 3 | C23: 14 | D23: 4 | E23: 2 | F23: 1
A24: 16 | B24: 4 | C24: 4 | D24: 7 | E24: 0 | F24: 2
A25: 17 | B25: 3 | C25: 16 | D25: 3 | E25: 3 | F25: 2 | H25: 1 | I25: Yes
A26: 18 | B26: 3 | C26: 10 | D26: 4 | E26: 2 | F26: 2 | I26: Yes
A27: Totals | B27: =IF(B2="","",SUM(B9:B26)) -> 58 | D27: =IF(B2="","",SUM(D9:D26)) -> 84 | E27: =IF(B2="","",SUM(E9:E26)) -> 27 | F27: =IF(B2="","",SUM(F9:F26)) -> 31 | G27: =IF(B2="","",SUM(G9:G26)) -> 2 | H27: =IF(B2="","",SUM(H9:H26)) -> 2 | I27: =IF(COUNTIF(I9:I26,"=Yes")=0,"",COUNTIF(I9:I26,"=Yes")) -> 7