A1: Robert Thompson
A2: Club | B2: Sunningdale Ladies
A3: Par/SS | D3: Num. Of Fairways | I3: =IF(B2="","",18-(COUNTIF(B9:B26,3))) -> 4
A4: Date | B4: 42588 | D4: Playing Handicap | I4: 11.1
A5: Event Place | B5: 14 | C5: M | D5: Prize Money | G5: 2500
A6: Game Stats | B6: DB+ | C6: DB | D6: Bi | E6: P | F6: B | G6: E | H6: A | I6: H1
B7: 4 | C7: 4 | D7: 7 | E7: 3 | F7: 0 | G7: 0 | H7: 0 | I7: 0
A8: Hole No | B8: Par | C8: Stroke Index | D8: Gross Score | E8: Points | F8: Putts | G8: Fairways | H8: Ferrets | I8: Green Regulation
A9: 1 | B9: 3 | C9: 9 | D9: 10 | E9: 0 | F9: 3 | H9: 2
A10: 2 | B10: 3 | C10: 5 | D10: 6 | E10: 0 | F10: 3
A11: 3 | B11: 3 | C11: 17 | D11: 3 | E11: 2 | F11: 2 | I11: Yes
A12: 4 | B12: 4 | C12: 7 | D12: 6 | E12: 1 | F12: 2
A13: 5 | B13: 3 | C13: 15 | D13: 6 | E13: 0 | F13: 3 | H13: 1
A14: 6 | B14: 3 | C14: 13 | D14: 4 | E14: 1 | F14: 1
A15: 7 | B15: 3 | C15: 3 | D15: 4 | E15: 2 | F15: 2 | I15: Yes
A16: 8 | B16: 4 | C16: 1 | D16: 4 | E16: 3 | F16: 2 | G16: 1 | I16: Yes
A17: 9 | B17: 3 | C17: 11 | D17: 4 | E17: 2 | F17: 1
A18: 10 | B18: 3 | C18: 12 | D18: 4 | E18: 1 | F18: 1
A19: 11 | B19: 3 | C19: 6 | D19: 5 | E19: 1 | F19: 2 | H19: 2
A20: 12 | B20: 3 | C20: 8 | D20: 5 | E20: 1 | F20: 3 | I20: Yes
A21: 13 | B21: 4 | C21: 2 | D21: 5 | E21: 2 | F21: 2 | I21: Yes
A22: 14 | B22: 3 | C22: 18 | D22: 3 | E22: 2 | F22: 2 | I22: Yes
A23: 15 | B23: 3 | C23: 14 | D23: 4 | E23: 1 | F23: 2
A24: 16 | B24: 4 | C24: 4 | D24: 6 | E24: 1 | F24: 1
A25: 17 | B25: 3 | C25: 16 | D25: 4 | E25: 1 | F25: 2
A26: 18 | B26: 3 | C26: 10 | D26: 6 | E26: 0 | F26: 2
A27: Totals | B27: =IF(B2="","",SUM(B9:B26)) -> 58 | D27: =IF(B2="","",SUM(D9:D26)) -> 89 | E27: =IF(B2="","",SUM(E9:E26)) -> 21 | F27: =IF(B2="","",SUM(F9:F26)) -> 36 | G27: =IF(B2="","",SUM(G9:G26)) -> 1 | H27: =IF(B2="","",SUM(H9:H26)) -> 5 | I27: =IF(COUNTIF(I9:I26,"=Yes")=0,"",COUNTIF(I9:I26,"=Yes")) -> 6