A1: Alan Baldwin
A2: Club | B2: Westgate & Birch
A3: Par/SS | B3: 64/64 | D3: Num. Of Fairways | I3: =IF(B2="","",18-(COUNTIF(B9:B26,3))) -> 10
A4: Date | B4: 38211 | D4: Playing Handicap | I4: 19.1
A5: Event Place | B5: 1 | D5: Prize Money | G5: 5000
A6: Game Stats | B6: DB+ | C6: DB | D6: Bi | E6: P | F6: B | G6: E | H6: A | I6: H1
B7: 1 | C7: 2 | D7: 10 | E7: 4 | F7: 1 | G7: 0 | H7: 0 | I7: 0
A8: Hole No | B8: Par | C8: Stroke Index | D8: Gross Score | E8: Points | F8: Putts | G8: Fairways | H8: Ferrets | I8: Green Regulation
A9: 1 | B9: 4 | C9: 11 | D9: 5 | E9: 2 | F9: 1 | G9: 1
A10: 2 | B10: 4 | C10: 7 | D10: 6 | E10: 1 | F10: 2 | H10: 1
A11: 3 | B11: 3 | C11: 15 | D11: 3 | E11: 3 | F11: 2 | I11: Yes
A12: 4 | B12: 4 | C12: 4 | D12: 5 | E12: 2 | F12: 2 | I12: Yes
A13: 5 | B13: 3 | C13: 17 | D13: 2 | E13: 4 | F13: 2 | I13: Yes
A14: 6 | B14: 4 | C14: 12 | D14: 4 | E14: 3 | F14: 2 | I14: Yes
A15: 7 | B15: 4 | C15: 1 | D15: 6 | E15: 2 | F15: 2 | I15: Yes
A16: 8 | B16: 3 | C16: 8 | D16: 4 | E16: 2 | F16: 2 | I16: Yes
A17: 9 | B17: 4 | C17: 5 | D17: 5 | E17: 2 | F17: 2 | G17: 1 | I17: Yes
A18: 10 | B18: 4 | C18: 2 | D18: 5 | E18: 2 | F18: 2 | G18: 1 | I18: Yes
A19: 11 | B19: 3 | C19: 18 | D19: 4 | E19: 2 | F19: 2 | I19: Yes
A20: 12 | B20: 4 | C20: 3 | D20: 5 | E20: 2 | F20: 2 | G20: 1 | I20: Yes
A21: 13 | B21: 3 | C21: 10 | D21: 6 | E21: 0 | F21: 2
A22: 14 | B22: 3 | C22: 16 | D22: 3 | E22: 3 | F22: 2 | I22: Yes
A23: 15 | B23: 3 | C23: 14 | D23: 4 | E23: 2 | F23: 2 | I23: Yes
A24: 16 | B24: 4 | C24: 6 | D24: 5 | E24: 2 | F24: 2 | I24: Yes
A25: 17 | B25: 3 | C25: 13 | D25: 4 | E25: 2 | F25: 2 | I25: Yes
A26: 18 | B26: 4 | C26: 9 | D26: 4 | E26: 3 | F26: 1 | I26: Yes
A27: Totals | B27: =IF(B2="","",SUM(B9:B26)) -> 64 | D27: =IF(B2="","",SUM(D9:D26)) -> 80 | E27: =IF(B2="","",SUM(E9:E26)) -> 39 | F27: =IF(B2="","",SUM(F9:F26)) -> 34 | G27: =IF(B2="","",SUM(G9:G26)) -> 4 | H27: =IF(B2="","",SUM(H9:H26)) -> 1 | I27: =IF(COUNTIF(I9:I26,"=Yes")=0,"",COUNTIF(I9:I26,"=Yes")) -> 15