A1: Ian Edwards
A2: Club | B2: Wycombe Heights
A3: Par/SS | B3: 69/68 | D3: Num. Of Fairways | I3: =IF(B2="","",18-(COUNTIF(B9:B26,3))) -> 13
A4: Date | B4: 42281 | D4: Playing Handicap | I4: 17.6
A5: Event Place | B5: 2 | C5: M | D5: Prize Money | G5: 33750
A6: Game Stats | B6: DB+ | C6: DB | D6: Bi | E6: P | F6: B | G6: E | H6: A | I6: H1
B7: 1 | C7: 6 | D7: 4 | E7: 7 | F7: 0 | G7: 0 | H7: 0 | I7: 0
A8: Hole No | B8: Par | C8: Stroke Index | D8: Gross Score | E8: Points | F8: Putts | G8: Fairways | H8: Ferrets | I8: Green Regulation
A9: 1 | B9: 4 | C9: 9 | D9: 4 | E9: 3 | F9: 1 | G9: 1 | I9: Yes
A10: 2 | B10: 3 | C10: 13 | D10: 3 | E10: 3 | F10: 1 | I10: Yes
A11: 3 | B11: 4 | C11: 11 | D11: 6 | E11: 1 | F11: 3 | I11: Yes
A12: 4 | B12: 4 | C12: 3 | D12: 5 | E12: 2 | F12: 2 | I12: Yes
A13: 5 | B13: 5 | C13: 15 | D13: 5 | E13: 3 | F13: 2 | I13: Yes
A14: 6 | B14: 3 | C14: 7 | D14: 6 | E14: 0 | F14: 2
A15: 7 | B15: 4 | C15: 1 | D15: 6 | E15: 1 | F15: 2
A16: 8 | B16: 3 | C16: 17 | D16: 4 | E16: 2 | F16: 1
A17: 9 | B17: 4 | C17: 5 | D17: 5 | E17: 2 | F17: 2 | I17: Yes
A18: 10 | B18: 3 | C18: 16 | D18: 3 | E18: 3 | F18: 1 | I18: Yes
A19: 11 | B19: 4 | C19: 18 | D19: 6 | E19: 1 | F19: 2
A20: 12 | B20: 4 | C20: 8 | D20: 6 | E20: 1 | F20: 2
A21: 13 | B21: 4 | C21: 2 | D21: 6 | E21: 1 | F21: 2
A22: 14 | B22: 4 | C22: 14 | D22: 4 | E22: 3 | F22: 1 | I22: Yes
A23: 15 | B23: 4 | C23: 4 | D23: 4 | E23: 3 | F23: 2 | G23: 1 | I23: Yes
A24: 16 | B24: 3 | C24: 12 | D24: 5 | E24: 1 | F24: 3 | I24: Yes
A25: 17 | B25: 5 | C25: 6 | D25: 5 | E25: 3 | F25: 1 | G25: 1 | I25: Yes
A26: 18 | B26: 4 | C26: 10 | D26: 5 | E26: 2 | F26: 3 | I26: Yes
A27: Totals | B27: =IF(B2="","",SUM(B9:B26)) -> 69 | D27: =IF(B2="","",SUM(D9:D26)) -> 88 | E27: =IF(B2="","",SUM(E9:E26)) -> 35 | F27: =IF(B2="","",SUM(F9:F26)) -> 33 | G27: =IF(B2="","",SUM(G9:G26)) -> 3 | H27: =IF(B2="","",SUM(H9:H26)) -> 0 | I27: =IF(COUNTIF(I9:I26,"=Yes")=0,"",COUNTIF(I9:I26,"=Yes")) -> 12

A1: Dave Rouse
A2: Club | B2: Wycombe Heights
A3: Par/SS | B3: 69/68 | D3: Num. Of Fairways | I3: =IF(B2="","",18-(COUNTIF(B9:B26,3))) -> 13
A4: Date | B4: 42281 | D4: Playing Handicap | I4: 27.3
A5: Event Place | B5: 13 | C5: M | D5: Prize Money | G5: 7500
A6: Game Stats | B6: DB+ | C6: DB | D6: BI | E6: P | F6: B | G6: E | H6: A | I6: H1
B7: 4 | C7: 10 | D7: 4 | E7: 0 | F7: 0 | G7: 0 | H7: 0 | I7: 0
A8: Hole No | B8: Par | C8: Stroke Index | D8: Gross Score | E8: Points | F8: Putts | G8: Fairways | H8: Ferrets | I8: Green Regulation
A9: 1 | B9: 4 | C9: 9 | D9: 8 | E9: 0 | F9: 2
A10: 2 | B10: 3 | C10: 13 | D10: 5 | E10: 1 | F10: 3 | I10: Yes
A11: 3 | B11: 4 | C11: 11 | D11: 6 | E11: 1 | F11: 1
A12: 4 | B12: 4 | C12: 3 | D12: 6 | E12: 2 | F12: 2 | I12: Yes
A13: 5 | B13: 5 | C13: 15 | D13: 9 | E13: 0 | F13: 2
A14: 6 | B14: 3 | C14: 7 | D14: 4 | E14: 3 | F14: 1 | I14: Yes
A15: 7 | B15: 4 | C15: 1 | D15: 7 | E15: 1 | F15: 2
A16: 8 | B16: 3 | C16: 17 | D16: 5 | E16: 1 | F16: 1
A17: 9 | B17: 4 | C17: 5 | D17: 6 | E17: 2 | F17: 1 | G17: 1
A18: 10 | B18: 3 | C18: 16 | D18: 4 | E18: 2 | F18: 2 | I18: Yes
A19: 11 | B19: 4 | C19: 18 | D19: 6 | E19: 1 | F19: 2
A20: 12 | B20: 4 | C20: 8 | D20: 6 | E20: 2 | F20: 3 | I20: Yes
A21: 13 | B21: 4 | C21: 2 | D21: 7 | E21: 1 | F21: 3 | I21: Yes
A22: 14 | B22: 4 | C22: 14 | D22: 6 | E22: 1 | F22: 2
A23: 15 | B23: 4 | C23: 4 | D23: 6 | E23: 2 | F23: 2 | I23: Yes
A24: 16 | B24: 3 | C24: 12 | D24: 4 | E24: 2 | F24: 2 | I24: Yes
A25: 17 | B25: 5 | C25: 6 | D25: 7 | E25: 2 | F25: 2 | G25: 1 | I25: Yes
A26: 18 | B26: 4 | C26: 10 | D26: 5 | E26: 2 | F26: 1 | G26: 1
A27: Totals | B27: =IF(B2="","",SUM(B9:B26)) -> 69 | D27: =IF(B2="","",SUM(D9:D26)) -> 107 | E27: =IF(B2="","",SUM(E9:E26)) -> 26 | F27: =IF(B2="","",SUM(F9:F26)) -> 34 | G27: =IF(B2="","",SUM(G9:G26)) -> 3 | H27: =IF(B2="","",SUM(H9:H26)) -> 0 | I27: =IF(COUNTIF(I9:I26,"=Yes")=0,"",COUNTIF(I9:I26,"=Yes")) -> 9