A1: Season 14 - April 1st 2012 to 13th April 2013
A2: MGA World Tour Order of Merit
B3: Statistics updated | C3: =TODAY() -> 41379
A4: Pos | B4: Player | C4: Original Handicap | D4: Current Handicap | E4: Playing Handicap | F4: Played | G4: Points | H4: Average | I4: HI / LOW Score | J4: Qualified (5 games)
A5: 1 | B5: Jon Dey | C5: 31.1 | D5: 26.6 | E5: =D5 -> 26.6 | F5: 6 | G5: 207 | H5: =IF(ISERROR(G5/F5),0,G5/F5) -> 34.50 | I5: 45 / 27 | J5: Qualified
A6: 2 | B6: Dave Andrews | C6: 16.3 | D6: 15.8 | E6: =D6 -> 15.8 | F6: 4 | G6: 133 | H6: =IF(ISERROR(G6/F6),0,G6/F6) -> 33.25 | I6: 38 / 27 | J6: Qualified
A7: 3 | B7: Dave Rouse | C7: 27.0 | D7: 25.8 | E7: =D7 -> 25.8 | F7: 6 | G7: 189 | H7: =IF(ISERROR(G7/F7),0,G7/F7) -> 31.50 | I7: 36 / 29 | J7: Qualified
A8: 4 | B8: Keith Mendelson | C8: 16.4 | D8: 15.2 | E8: =D8 -> 15.2 | F8: 5 | G8: 155 | H8: =IF(ISERROR(G8/F8),0,G8/F8) -> 31.00 | I8: 40 / 25 | J8: Qualified
A9: 5 | B9: Dave Bingham | C9: 10.6 | D9: 10.9 | E9: =D9 -> 10.9 | F9: 3 | G9: 91 | H9: =IF(ISERROR(G9/F9),0,G9/F9) -> 30.333333333333332 | I9: 34 / 27 | J9: Qualified
A10: 6 | B10: Kevin Gallagher | C10: 15.7 | D10: 15.8 | E10: =D10 -> 15.8 | F10: 11 | G10: 333 | H10: =IF(ISERROR(G10/F10),0,G10/F10) -> 30.272727272727273 | I10: 37 / 18 | J10: Qualified
A11: 7 | B11: Michael Trimmings | C11: 25.0 | D11: 24.5 | E11: =D11 -> 24.5 | F11: 4 | G11: 121 | H11: =IF(ISERROR(G11/F11),0,G11/F11) -> 30.25 | I11: 37 / 25 | J11: Qualified
A12: 8 | B12: Robert Thompson | C12: 11.6 | D12: 10.1 | E12: =D12 -> 10.1 | F12: 13 | G12: 393 | H12: =IF(ISERROR(G12/F12),0,G12/F12) -> 30.23076923076923 | I12: 39 / 25 | J12: Qualified
A13: 9 | B13: Matthew Carter | C13: 17.5 | D13: 16.7 | E13: =D13 -> 16.7 | F13: 6 | G13: 178 | H13: =IF(ISERROR(G13/F13),0,G13/F13) -> 29.666666666666668 | I13: 38 / 20 | J13: Qualified
A14: 10 | B14: Jeff Colbrook | C14: 15.2 | D14: 15.500000000000998 | E14: =D14 -> 15.500000000000998 | F14: 3 | G14: 89 | H14: =IF(ISERROR(G14/F14),0,G14/F14) -> 29.666666666666668 | I14: 31 / 28 | J14: Qualified
A15: 11 | B15: Paul Carter | C15: 14.3 | D15: 14.0 | E15: =D15 -> 14 | F15: 5 | G15: 146 | H15: =IF(ISERROR(G15/F15),0,G15/F15) -> 29.20 | I15: 39 / 22 | J15: Qualified
A16: 19 | B16: David Braithwaite | C16: 11.7 | D16: 12.1 | E16: =D16 -> 12.1 | F16: 3 | G16: 87 | H16: =IF(ISERROR(G16/F16),0,G16/F16) -> 29.00 | I16: 32 / 25 | J16: Qualified
A17: 12 | B17: Paul Baldwin | C17: 20.8 | D17: 21.100000000001003 | E17: =D17 -> 21.100000000001003 | F17: 3 | G17: 87 | H17: =IF(ISERROR(G17/F17),0,G17/F17) -> 29.00 | I17: 30 / 28 | J17: Qualified
A18: 13 | B18: Simon Thompson | C18: 9.3 | D18: 9.2 | E18: =D18 -> 9.2 | F18: 4 | G18: 113 | H18: =IF(ISERROR(G18/F18),0,G18/F18) -> 28.25 | I18: 31 / 26 | J18: Qualified
A19: 14 | B19: Ian Edwards | C19: 12.6 | D19: 14.5 | E19: =D19 -> 14.5 | F19: 4 | G19: 85 | H19: =IF(ISERROR(G19/F19),0,G19/F19) -> 21.25 | I19: 26 / 18 | J19: Qualified
A20: 15 | B20: Martin Bould | C20: 18.8 | D20: 14.8 | E20: =D20 -> 14.8 | F20: 1 | G20: 44 | H20: =IF(ISERROR(G20/F20),0,G20/F20) -> 44.00 | I20: 44 / 44 | J20: =IF(F20>=5,"Qualified","") -> 
A21: 16 | B21: Alan Baldwin | C21: 21.2 | D21: 20.900000000001 | E21: =D21 -> 20.900000000001 | F21: 2 | G21: 66 | H21: =IF(ISERROR(G21/F21),0,G21/F21) -> 33.00 | I21: 38 / 28 | J21: =IF(F21>=5,"Qualified","") -> 
A22: 17 | B22: David Archer | C22: 24.0 | D22: 24.1 | E22: =D22 -> 24.1 | F22: 2 | G22: 64 | H22: =IF(ISERROR(G22/F22),0,G22/F22) -> 32.00 | I22: 34 / 30 | J22: =IF(F22>=5,"Qualified","") -> 
A23: 18 | B23: Chris Manning | C23: 22.7 | D23: 22.8 | E23: =D23 -> 22.8 | F23: 1 | G23: 31 | H23: =IF(ISERROR(G23/F23),0,G23/F23) -> 31.00 | I23: 31 / 31 | J23: =IF(F23>=5,"Qualified","") -> 
A24: 20 | B24: Jon Press | C24: 14.2 | D24: 14.5 | E24: =D24 -> 14.5 | F24: 2 | G24: 59 | H24: =IF(ISERROR(G24/F24),0,G24/F24) -> 29.50 | I24: 32 / 27 | J24: =IF(F24>=5,"Qualified","") -> 
A25: 21 | B25: Andrew Baldwin | C25: 19.8 | D25: 20.1 | E25: =D25 -> 20.1 | F25: 2 | G25: 58 | H25: =IF(ISERROR(G25/F25),0,G25/F25) -> 29.00 | I25: 31 / 27 | J25: =IF(F25>=5,"Qualified","") -> 
A26: 22 | B26: Simon Owens | C26: 14.1 | D26: 14.5 | E26: =D26 -> 14.5 | F26: 2 | G26: 50 | H26: =IF(ISERROR(G26/F26),0,G26/F26) -> 25.00 | I26: 26 / 24 | J26: =IF(F26>=5,"Qualified","") -> 
A27: 23 | B27: Roy Dickens | C27: 30.4 | D27: 30.8 | E27: =D27 -> 30.8 | F27: 2 | G27: 50 | H27: =IF(ISERROR(G27/F27),0,G27/F27) -> 25.00 | I27: 26 / 24 | J27: =IF(F27>=5,"Qualified","") -> 
A28: 24 | B28: Martin Cox | C28: 13.5 | D28: 13.7 | E28: =D28 -> 13.7 | F28: 1 | G28: 22 | H28: =IF(ISERROR(G28/F28),0,G28/F28) -> 22.00 | I28: 22 / 22 | J28: =IF(F28>=5,"Qualified","") -> 
A29: 24 | B29: Steve Tilling | C29: 16.5 | D29: 16.5 | E29: =D29 -> 16.5 | F29: 0 | G29: 0 | H29: =IF(ISERROR(G29/F29),0,G29/F29) -> 0.00 | I29: / | J29: =IF(F29>=5,"Qualified","") -> 
A30: 25 | B30: Malcolm Rouse | C30: 44.9 | D30: 44.9 | E30: =D30 -> 44.9 | F30: 0 | G30: 0 | H30: =IF(ISERROR(G30/F30),0,G30/F30) -> 0.00 | I30: / | J30: =IF(F30>=5,"Qualified","") -> 
A31: 26 | B31: Keith Johns | C31: 24.3 | D31: 24.3 | E31: =D31 -> 24.3 | F31: 0 | G31: 0 | H31: =IF(ISERROR(G31/F31),0,G31/F31) -> 0.00 | I31: / | J31: =IF(F31>=5,"Qualified","") -> 
A32: 27 | B32: Jeff Gibbons | C32: 21.0 | D32: 21.0 | E32: =D32 -> 21 | F32: 0 | G32: 0 | H32: =IF(ISERROR(G32/F32),0,G32/F32) -> 0.00 | I32: / | J32: =IF(F32>=5,"Qualified","") -> 
A33: 28 | B33: Dave White | C33: 21.5 | D33: 21.5 | E33: =D33 -> 21.5 | F33: 0 | G33: 0 | H33: =IF(ISERROR(G33/F33),0,G33/F33) -> 0.00 | I33: / | J33: =IF(F33>=5,"Qualified","") -> 
A34: 29 | B34: Clive Ferris | C34: 26.0 | D34: 26.0 | E34: =D34 -> 26 | F34: 0 | G34: 0 | H34: =IF(ISERROR(G34/F34),0,G34/F34) -> 0.00 | I34: / | J34: =IF(F34>=5,"Qualified","") -> 
A35: 31 | B35: Andy Benson | C35: 6.3 | D35: 6.3 | E35: =D35 -> 6.3 | F35: 0 | G35: 0 | H35: =IF(ISERROR(G35/F35),0,G35/F35) -> 0.00 | I35: / | J35: =IF(F35>=5,"Qualified","") -> 
A36: 32 | B36: Alan Hopkins | C36: 7.7 | D36: 7.7 | E36: =D36 -> 7.7 | F36: 0 | G36: 0 | H36: =IF(ISERROR(G36/F36),0,G36/F36) -> 0.00 | I36: / | J36: =IF(F36>=5,"Qualified","") -> 