A1: Dave Rouse
A2: Club | B2: Horton Park
A3: Par/SS | B3: 70/69 | D3: Num. Of Fairways | I3: =IF(B2="","",18-(COUNTIF(B9:B26,3))) -> 12
A4: Date | B4: 42462 | D4: Playing Handicap | I4: 27.5
A5: Event Place | B5: 15 | C5: M | D5: Prize Money | G5: 7500
A6: Game Stats | B6: DB+ | C6: DB | D6: Bi | E6: P | F6: B | G6: E | H6: A | I6: H1
B7: 11 | C7: 4 | D7: 2 | E7: 1 | F7: 0 | G7: 0 | H7: 0 | I7: 0
A8: Hole No | B8: Par | C8: Stroke Index | D8: Gross Score | E8: Points | F8: Putts | G8: Fairways | H8: Ferrets | I8: Green Regulation
A9: 1 | B9: 3 | C9: 12 | D9: 3 | E9: 3 | F9: 1 | I9: Yes
A10: 2 | B10: 4 | C10: 6 | D10: 7 | E10: 1 | F10: 3 | I10: Yes
A11: 3 | B11: 5 | C11: 2 | D11: 11 | E11: 0 | F11: 2
A12: 4 | B12: 3 | C12: 10 | D12: 6 | E12: 1 | F12: 2
A13: 5 | B13: 5 | C13: 14 | D13: 7 | E13: 1 | F13: 2 | G13: 1
A14: 6 | B14: 4 | C14: 16 | D14: 6 | E14: 1 | F14: 2
A15: 7 | B15: 4 | C15: 18 | D15: 7 | E15: 0 | F15: 2
A16: 8 | B16: 5 | C16: 4 | D16: 8 | E16: 1 | F16: 1
A17: 9 | B17: 3 | C17: 8 | D17: 10 | E17: 0 | F17: 3 | H17: 2
A18: 10 | B18: 3 | C18: 7 | D18: 4 | E18: 3 | F18: 2 | I18: Yes
A19: 11 | B19: 5 | C19: 13 | D19: 8 | E19: 0 | F19: 1
A20: 12 | B20: 4 | C20: 3 | D20: 10 | E20: 0 | F20: 3 | G20: 1
A21: 13 | B21: 4 | C21: 15 | D21: 5 | E21: 2 | F21: 2 | G21: 1 | I21: Yes
A22: 14 | B22: 4 | C22: 9 | D22: 8 | E22: 0 | F22: 3 | G22: 1
A23: 15 | B23: 4 | C23: 5 | D23: 10 | E23: 0 | F23: 1 | G23: 1
A24: 16 | B24: 3 | C24: 17 | D24: 5 | E24: 1 | F24: 3 | I24: Yes
A25: 17 | B25: 4 | C25: 1 | D25: 8 | E25: 0 | F25: 2
A26: 18 | B26: 3 | C26: 11 | D26: 5 | E26: 1 | F26: 2
A27: Totals | B27: =IF(B2="","",SUM(B9:B26)) -> 70 | D27: =IF(B2="","",SUM(D9:D26)) -> 128 | E27: =IF(B2="","",SUM(E9:E26)) -> 15 | F27: =IF(B2="","",SUM(F9:F26)) -> 37 | G27: =IF(B2="","",SUM(G9:G26)) -> 5 | H27: =IF(B2="","",SUM(H9:H26)) -> 2 | I27: =IF(COUNTIF(I9:I26,"=Yes")=0,"",COUNTIF(I9:I26,"=Yes")) -> 5