B2: 2015 Ferret Count
C5: Day 1 | D5: Day 2 | E5: Day 3 | F5: Day 4 | G5: Total
B6: R Dickens | C6: 8 | D6: 1 | E6: 1 | F6: 3 | G6: =SUM(C6:F6) -> 13
B7: D Andrews | C7: 7 | D7: 2 | E7: 2 | F7: 1 | G7: =SUM(C7:F7) -> 12
B8: I Edwards | C8: 5 | D8: 5 | E8: 1 | F8: 0 | G8: =SUM(C8:F8) -> 11
B9: K Mendelson | C9: 5 | D9: 4 | E9: 0 | F9: 2 | G9: =SUM(C9:F9) -> 11
B10: R Thompson | C10: 7 | D10: 1 | E10: 1 | F10: 2 | G10: =SUM(C10:F10) -> 11
B11: A Baldwin (Jnr) | C11: 6 | D11: 1 | E11: 1 | F11: 3 | G11: =SUM(C11:F11) -> 11
B12: S Thompson | C12: 5 | D12: 3 | E12: 1 | F12: 1 | G12: =SUM(C12:F12) -> 10
B13: J Colbrook | C13: 4 | D13: 3 | E13: 1 | F13: 2 | G13: =SUM(C13:F13) -> 10
B14: J Press | C14: 6 | D14: 0 | E14: 1 | F14: 1 | G14: =SUM(C14:F14) -> 8
B15: M Cox | C15: 4 | D15: 2 | E15: 1 | F15: 1 | G15: =SUM(C15:F15) -> 8
B16: M Carter | C16: 3 | D16: 1 | E16: 3 | F16: 1 | G16: =SUM(C16:F16) -> 8
B17: P Baldwin | C17: 6 | D17: 0 | E17: 0 | F17: 1 | G17: =SUM(C17:F17) -> 7
B18: S Owens | C18: 4 | D18: 2 | E18: 0 | F18: 1 | G18: =SUM(C18:F18) -> 7
B19: K Gallagher | C19: 4 | D19: 2 | E19: 0 | F19: 1 | G19: =SUM(C19:F19) -> 7
B20: D Kewley | C20: 4 | D20: 1 | E20: 1 | F20: 1 | G20: =SUM(C20:F20) -> 7
B21: D Bingham | C21: 2 | D21: 1 | E21: 1 | F21: 2 | G21: =SUM(C21:F21) -> 6
B22: D Archer | C22: 1 | D22: 2 | E22: 1 | F22: 2 | G22: =SUM(C22:F22) -> 6
B23: D Rouse | C23: 5 | D23: 0 | E23: 0 | F23: 0 | G23: =SUM(C23:F23) -> 5
B24: J Dey | C24: 1 | D24: 4 | E24: 0 | F24: 0 | G24: =SUM(C24:F24) -> 5
B25: A Baldwin (Snr) | C25: 2 | D25: 1 | E25: 1 | F25: 0 | G25: =SUM(C25:F25) -> 4
B26: M Trimmings | C26: 3 | D26: 0 | E26: 0 | F26: 1 | G26: =SUM(C26:F26) -> 4
B27: P Carter | C27: 1 | D27: 2 | E27: 0 | F27: 1 | G27: =SUM(C27:F27) -> 4
B28: D Braithwaite | C28: 0 | D28: 2 | E28: 1 | F28: 1 | G28: =SUM(C28:F28) -> 4
B29: A Benson | C29: 0 | D29: 0 | E29: 0 | F29: 0 | G29: =SUM(C29:F29) -> 0
C30: =SUM(C6:C29) -> 93 | D30: =SUM(D6:D29) -> 40 | E30: =SUM(E6:E29) -> 18 | F30: =SUM(F6:F28) -> 28 | G30: =SUM(G6:G29) -> 179