A1: 14th September 2001
A2: The Holes That Did The Damage!
A3: (9 Holes am and 18 Holes pm included)
A5: Hole | B5: 1 | C5: 2 | D5: 3 | E5: 4 | F5: 5 | G5: 6 | H5: 7 | I5: 8 | J5: 9 | K5: 10 | L5: 11 | M5: 12 | N5: 13 | O5: 14 | P5: 15 | Q5: 16 | R5: 17 | S5: 18 | T5: Total
A6: J Press | Q6: 2 | T6: =SUM(B6:S6) -> 2
A7: J Colbrook | M7: 1 | Q7: 2 | T7: =SUM(B7:S7) -> 3
A8: D Andrews | G8: 1 | H8: 1 | I8: 1 | Q8: 1 | T8: =SUM(B8:S8) -> 4
A9: A Hopkins | E9: 1 | T9: =SUM(B9:S9) -> 1
A10: R Thompson | Q10: 1 | T10: =SUM(B10:S10) -> 1
A11: P Carter | O11: 1 | Q11: 3 | T11: =SUM(B11:S11) -> 4
A12: R Dickens | K12: 1 | L12: 1 | O12: 1 | T12: =SUM(B12:S12) -> 3
A13: A Baldwin (Jnr) | K13: 1 | L13: 1 | O13: 1 | Q13: 2 | T13: =SUM(B13:S13) -> 5
A14: M Cox | K14: 1 | Q14: 4 | T14: =SUM(B14:S14) -> 5
A15: M Rouse | C15: 2 | Q15: 1 | T15: =SUM(B15:S15) -> 3
A16: C Manning | H16: 1 | M16: 1 | T16: =SUM(B16:S16) -> 2
A17: K Gallagher | B17: 1 | Q17: 3 | T17: =SUM(B17:S17) -> 4
A18: P Baldwin | B18: 1 | G18: 1 | Q18: 1 | S18: 1 | T18: =SUM(B18:S18) -> 4
A19: A Baldwin (Snr) | J19: 1 | L19: 1 | O19: 3 | Q19: 1 | T19: =SUM(B19:S19) -> 6
A20: K Mendelson | H20: 1 | M20: 1 | O20: 1 | Q20: 1 | T20: =SUM(B20:S20) -> 4
A21: D Rouse | E21: 1 | M21: 1 | O21: 2 | R21: 1 | S21: 1 | T21: =SUM(B21:S21) -> 6
A22: S Thompson | E22: 3 | G22: 1 | K22: 1 | M22: 2 | Q22: 1 | T22: =SUM(B22:S22) -> 8
A23: J Gibbons | K23: 1 | Q23: 1 | T23: =SUM(B23:S23) -> 2
A24: J Dey | D24: 1 | E24: 1 | F24: 1 | G24: 1 | H24: 1 | K24: 1 | O24: 1 | P24: 1 | Q24: 1 | R24: 1 | S24: 1 | T24: =SUM(B24:S24) -> 11
B25: =SUM(B6:B24) -> 2 | C25: =SUM(C6:C24) -> 2 | D25: =SUM(D6:D24) -> 1 | E25: =SUM(E6:E24) -> 6 | F25: =SUM(F6:F24) -> 1 | G25: =SUM(G6:G24) -> 4 | H25: =SUM(H6:H24) -> 4 | I25: =SUM(I6:I24) -> 1 | J25: =SUM(J6:J24) -> 1 | K25: =SUM(K6:K24) -> 6 | L25: =SUM(L6:L24) -> 3 | M25: =SUM(M6:M24) -> 6 | N25: =SUM(N6:N24) -> 0 | O25: =SUM(O6:O24) -> 10 | P25: =SUM(P6:P24) -> 1 | Q25: =SUM(Q6:Q24) -> 25 | R25: =SUM(R6:R24) -> 2 | S25: =SUM(S6:S24) -> 3 | T25: =SUM(T6:T24) -> 78