A1: MELBAGE CUP 2000 ORDER OF MERIT
A3: Pos | B3: Name | C3: Team | D3: Played | E3: W | F3: D | G3: L | H3: Points | I3: Average | J3: 99 pos
A4: 1 | B4: C Manning | C4: 5 for USA | D4: 6 | E4: 5 | F4: 1 | G4: =D4-(E4+F4) -> 0 | H4: =E4+(F4*0.5) -> 5.5 | I4: =H4/D4 -> 0.91666666666666663 | J4: new entry
A5: 2 | B5: A Benson | C5: USA | D5: 31 | E5: 19 | F5: 6 | G5: =D5-(E5+F5) -> 6 | H5: =E5+(F5*0.5) -> 22 | I5: =H5/D5 -> 0.70967741935483875 | J5: 1
A6: 3 | B6: K Mendelson | C6: Europe | D6: 34 | E6: 20 | F6: 5 | G6: =D6-(E6+F6) -> 9 | H6: =E6+(F6*0.5) -> 22.5 | I6: =H6/D6 -> 0.66176470588235292 | J6: 2
A7: 4 | B7: P Carter | C7: USA | D7: 34 | E7: 20 | F7: 4 | G7: =D7-(E7+F7) -> 10 | H7: =E7+(F7*0.5) -> 22 | I7: =H7/D7 -> 0.6470588235294118 | J7: 7
A8: 5 | B8: S Thompson | C8: USA | D8: 28 | E8: 16 | F8: 4 | G8: =D8-(E8+F8) -> 8 | H8: =E8+(F8*0.5) -> 18 | I8: =H8/D8 -> 0.6428571428571429 | J8: 3
A9: 6 | B9: M Cox | C9: Europe | D9: 34 | E9: 18 | F9: 7 | G9: =D9-(E9+F9) -> 9 | H9: =E9+(F9*0.5) -> 21.5 | I9: =H9/D9 -> 0.63235294117647056 | J9: 5
A10: 7 | B10: R Thompson | C10: Europe | D10: 34 | E10: 20 | F10: 2 | G10: =D10-(E10+F10) -> 12 | H10: =E10+(F10*0.5) -> 21 | I10: =H10/D10 -> 0.61764705882352944 | J10: 6
A11: 8 | B11: A Hopkins | C11: USA | D11: 33 | E11: 19 | F11: 2 | G11: =D11-(E11+F11) -> 12 | H11: =E11+(F11*0.5) -> 20 | I11: =H11/D11 -> 0.60606060606060608 | J11: 4
A12: 9 | B12: A Baldwin (Jnr) | C12: USA | D12: 34 | E12: 17 | F12: 4 | G12: =D12-(E12+F12) -> 13 | H12: =E12+(F12*0.5) -> 19 | I12: =H12/D12 -> 0.55882352941176472 | J12: 12
A13: 10 | B13: D Archer | C13: Europe | D13: 30 | E13: 14 | F13: 5 | G13: =D13-(E13+F13) -> 11 | H13: =E13+(F13*0.5) -> 16.5 | I13: =H13/D13 -> 00.55 | J13: 8
A14: 11 | B14: I Edwards | C14: Europe | D14: 33 | E14: 16 | F14: 3 | G14: =D14-(E14+F14) -> 14 | H14: =E14+(F14*0.5) -> 17.5 | I14: =H14/D14 -> 0.53030303030303028 | J14: 9
A15: 12 | B15: J Gibbons | C15: Europe | D15: 32 | E15: 14 | F15: 5 | G15: =D15-(E15+F15) -> 13 | H15: =E15+(F15*0.5) -> 16.5 | I15: =H15/D15 -> 0.515625 | J15: 14
A16: 13 | B16: D Rouse | C16: USA | D16: 34 | E16: 16 | F16: 3 | G16: =D16-(E16+F16) -> 15 | H16: =E16+(F16*0.5) -> 17.5 | I16: =H16/D16 -> 0.51470588235294112 | J16: 10
A17: 14 | B17: J Dey | C17: Europe | D17: 31 | E17: 15 | F17: 1 | G17: =D17-(E17+F17) -> 15 | H17: =E17+(F17*0.5) -> 15.5 | I17: =H17/D17 -> 0.500 | J17: 18
A18: 15 | B18: S Tilling | C18: USA | D18: 21 | E18: 10 | F18: 1 | G18: =D18-(E18+F18) -> 10 | H18: =E18+(F18*0.5) -> 10.5 | I18: =H18/D18 -> 0.500 | J18: 16
A19: 16 | B19: J Press | C19: 5 for Europe | D19: 9 | E19: 4 | F19: 1 | G19: =D19-(E19+F19) -> 4 | H19: =E19+(F19*0.5) -> 4.5 | I19: =H19/D19 -> 0.500 | J19: new entry
A20: 17 | B20: D White | C20: Europe | D20: 34 | E20: 15 | F20: 3 | G20: =D20-(E20+F20) -> 16 | H20: =E20+(F20*0.5) -> 16.5 | I20: =H20/D20 -> 0.48529411764705882 | J20: 11
A21: 18 | B21: A Baldwin (Snr) | C21: Europe | D21: 30 | E21: 13 | F21: 2 | G21: =D21-(E21+F21) -> 15 | H21: =E21+(F21*0.5) -> 14 | I21: =H21/D21 -> 0.46666666666666667 | J21: 13
A22: 19 | B22: N Leah | C22: USA | D22: 30 | E22: 10 | F22: 6 | G22: =D22-(E22+F22) -> 14 | H22: =E22+(F22*0.5) -> 13 | I22: =H22/D22 -> 0.43333333333333335 | J22: 19
A23: 20 | B23: R Dickens | C23: Europe | D23: 29 | E23: 10 | F23: 5 | G23: =D23-(E23+F23) -> 14 | H23: =E23+(F23*0.5) -> 12.5 | I23: =H23/D23 -> 0.43103448275862066 | J23: 17
A24: 21 | B24: D Andrews | C24: Europe | D24: 32 | E24: 13 | F24: 1 | G24: =D24-(E24+F24) -> 18 | H24: =E24+(F24*0.5) -> 13.5 | I24: =H24/D24 -> 0.421875 | J24: 15
A25: 22 | B25: P Baldwin | C25: USA | D25: 24 | E25: 8 | F25: 3 | G25: =D25-(E25+F25) -> 13 | H25: =E25+(F25*0.5) -> 9.5 | I25: =H25/D25 -> 0.39583333333333331 | J25: 20
A26: 23 | B26: K Gallagher | C26: USA | D26: 33 | E26: 11 | F26: 1 | G26: =D26-(E26+F26) -> 21 | H26: =E26+(F26*0.5) -> 11.5 | I26: =H26/D26 -> 0.34848484848484851 | J26: 21
A27: 24 | B27: M Edmond | C27: USA | D27: 27 | E27: 7 | F27: 0 | G27: =D27-(E27+F27) -> 20 | H27: =E27+(F27*0.5) -> 7 | I27: =H27/D27 -> 0.25925925925925924 | J27: 22
A28: 25 | B28: M Rouse | C28: USA | D28: 18 | E28: 4 | F28: 1 | G28: =D28-(E28+F28) -> 13 | H28: =E28+(F28*0.5) -> 4.5 | I28: =H28/D28 -> 0.250 | J28: 23
A29: 26 | B29: C Ferris | C29: USA | D29: 20 | E29: 2 | F29: 3 | G29: =D29-(E29+F29) -> 15 | H29: =E29+(F29*0.5) -> 3.5 | I29: =H29/D29 -> 0.17499999999999999 | J29: 24