A1: David Kewley
A2: Club | B2: Celtic Manor - Twenty Ten
A3: Par/SS | B3: 71/71 | D3: Num. Of Fairways | I3: =IF(B2="","",18-(COUNTIF(B9:B26,3))) -> 13
A4: Date | B4: 41871 | D4: Playing Handicap | I4: 13.4
A5: Event Place | B5: 4 | D5: Prize Money | G5: 2500
A6: Game Stats | B6: DB+ | C6: DB | D6: Bi | E6: P | F6: B | G6: E | H6: A | I6: H1
B7: 7 | C7: 6 | D7: 4 | E7: 1 | F7: 0 | G7: 0 | H7: 0 | I7: 0
A8: Hole No | B8: Par | C8: Stroke Index | D8: Gross Score | E8: Points | F8: Putts | G8: Fairways | H8: Ferrets | I8: Green Regulation
A9: 1 | B9: 4 | C9: 11 | D9: 5 | E9: 2 | F9: 2 | I9: Yes
A10: 2 | B10: 5 | C10: 3 | D10: 10 | E10: 0 | F10: 2
A11: 3 | B11: 3 | C11: 13 | D11: 4 | E11: 2 | F11: 3 | I11: Yes
A12: 4 | B12: 4 | C12: 15 | D12: 6 | E12: 0 | F12: 2
A13: 5 | B13: 4 | C13: 1 | D13: 6 | E13: 1 | F13: 2 | G13: 1
A14: 6 | B14: 4 | C14: 7 | D14: 8 | E14: 0 | F14: 3
A15: 7 | B15: 3 | C15: 17 | D15: 6 | E15: 0 | F15: 3
A16: 8 | B16: 4 | C16: 9 | D16: 4 | E16: 3 | F16: 1 | I16: Yes
A17: 9 | B17: 5 | C17: 5 | D17: 7 | E17: 1 | F17: 2
A18: 10 | B18: 3 | C18: 18 | D18: 5 | E18: 0 | F18: 3
A19: 11 | B19: 5 | C19: 8 | D19: 6 | E19: 2 | F19: 1
A20: 12 | B20: 4 | C20: 4 | D20: 5 | E20: 2 | F20: 2 | I20: Yes
A21: 13 | B21: 3 | C21: 14 | D21: 6 | E21: 0 | F21: 2
A22: 14 | B22: 4 | C22: 2 | D22: 6 | E22: 1 | F22: 2
A23: 15 | B23: 4 | C23: 12 | D23: 7 | E23: 0 | F23: 3
A24: 16 | B24: 4 | C24: 6 | D24: 7 | E24: 0 | F24: 2
A25: 17 | B25: 3 | C25: 16 | D25: 5 | E25: 0 | F25: 4 | I25: Yes
A26: 18 | B26: 5 | C26: 10 | D26: 10 | E26: 0 | F26: 3 | H26: 2
A27: Totals | B27: =IF(B2="","",SUM(B9:B26)) -> 71 | D27: =IF(B2="","",SUM(D9:D26)) -> 113 | E27: =IF(B2="","",SUM(E9:E26)) -> 14 | F27: =IF(B2="","",SUM(F9:F26)) -> 42 | G27: =IF(B2="","",SUM(G9:G26)) -> 1 | H27: =IF(B2="","",SUM(H9:H26)) -> 2 | I27: =IF(COUNTIF(I9:I26,"=Yes")=0,"",COUNTIF(I9:I26,"=Yes")) -> 5