A1: Jon Press
A2: Club | B2: Cumberwell Park B/O
A3: Par/SS | B3: 71/68 | D3: Num. Of Fairways
A4: Date | B4: 40111 | D4: Playing Handicap | I4: 14
A5: Event Place | B5: 2 | D5: Prize Money | G5: 2500
A6: Game Stats | B6: DB+ | C6: DB | D6: BI | E6: P | F6: B | G6: E | H6: A | I6: H1
B7: 0 | C7: 2 | D7: 9 | E7: 7 | F7: 0 | G7: 0 | H7: 0 | I7: 0
A8: Hole No | B8: Par | C8: Stroke Index | D8: Gross Score | E8: Points | F8: Putts | G8: Fairways | H8: Ferrets | I8: Green Regulation
A9: 1 | B9: 5 | C9: 5 | D9: 6 | E9: 2 | F9: 2 | G9: 1 | I9: Yes
A10: 2 | B10: 4 | C10: 1 | D10: 4 | E10: 3 | F10: 2 | I10: Yes
A11: 3 | B11: 4 | C11: 15 | D11: 4 | E11: 2 | F11: 1 | G11: 1
A12: 4 | B12: 4 | C12: 13 | D12: 4 | E12: 3 | F12: 2 | G12: 1 | I12: Yes
A13: 5 | B13: 4 | C13: 3 | D13: 4 | E13: 3 | F13: 2 | I13: Yes
A14: 6 | B14: 3 | C14: 17 | D14: 4 | E14: 1 | F14: 2
A15: 7 | B15: 4 | C15: 7 | D15: 5 | E15: 2 | F15: 2 | G15: 1 | I15: Yes
A16: 8 | B16: 3 | C16: 9 | D16: 5 | E16: 1 | F16: 2
A17: 9 | B17: 5 | C17: 11 | D17: 5 | E17: 3 | F17: 2 | G17: 1 | I17: Yes
A18: 10 | B18: 4 | C18: 16 | D18: 4 | E18: 2 | F18: 2 | I18: Yes
A19: 11 | B19: 3 | C19: 12 | D19: 3 | E19: 3 | F19: 2 | I19: Yes
A20: 12 | B20: 4 | C20: 8 | D20: 5 | E20: 2 | F20: 2 | G20: 1 | I20: Yes
A21: 13 | B21: 3 | C21: 18 | D21: 5 | E21: 0 | F21: 2
A22: 14 | B22: 4 | C22: 10 | D22: 5 | E22: 2 | F22: 3 | G22: 1 | I22: Yes
A23: 15 | B23: 4 | C23: 4 | D23: 5 | E23: 2 | F23: 2 | G23: 1 | I23: Yes
A24: 16 | B24: 5 | C24: 6 | D24: 6 | E24: 2 | F24: 2 | I24: Yes
A25: 17 | B25: 5 | C25: 2 | D25: 6 | E25: 2 | F25: 2 | I25: Yes
A26: 18 | B26: 3 | C26: 14 | D26: 4 | E26: 2 | F26: 2 | I26: Yes
A27: Totals | B27: =IF(B2="","",SUM(B9:B26)) -> 71 | D27: =IF(B2="","",SUM(D9:D26)) -> 84 | E27: =IF(B2="","",SUM(E9:E26)) -> 37 | F27: =IF(B2="","",SUM(F9:F26)) -> 36 | G27: =IF(B2="","",SUM(G9:G26)) -> 8 | H27: =IF(B2="","",SUM(H9:H26)) -> 0 | I27: =IF(COUNTIF(I9:I26,"=Yes")=0,"",COUNTIF(I9:I26,"=Yes")) -> 14