A1: Dave Rouse
A2: Club | B2: Blue Mountain
A3: Par/SS | B3: 70/68 | D3: Num. Of Fairways | I3: =IF(B2="","",18-(COUNTIF(B9:B26,3))) -> 14
A4: Date | B4: 39893 | D4: Playing Handicap | I4: 25.3
A5: Event Place | B5: 6 | C5: M | D5: Prize Money | G5: 2500
A6: Game Stats | B6: DB+ | C6: DB | D6: BI | E6: P | F6: B | G6: E | H6: A | I6: H1
B7: 3 | C7: 8 | D7: 5 | E7: 2 | F7: 0 | G7: 0 | H7: 0 | I7: 0
A8: Hole No | B8: Par | C8: Stroke Index | D8: Gross Score | E8: Points | F8: Putts | G8: Fairways | H8: Ferrets | I8: Green Regulation
A9: 1 | B9: 4 | C9: 13 | D9: 5 | E9: 2 | F9: 2 | I9: Yes
A10: 2 | B10: 5 | C10: 5 | D10: 7 | E10: 2 | F10: 2 | H10: 1 | I10: Yes
A11: 3 | B11: 4 | C11: 11 | D11: 4 | E11: 3 | F11: 2 | I11: Yes
A12: 4 | B12: 3 | C12: 3 | D12: 5 | E12: 2 | F12: 3 | I12: Yes
A13: 5 | B13: 4 | C13: 9 | D13: 4 | E13: 3 | F13: 2 | G13: 1 | I13: Yes
A14: 6 | B14: 5 | C14: 7 | D14: 7 | E14: 2 | F14: 1 | G14: 1
A15: 7 | B15: 4 | C15: 1 | D15: 5 | E15: 3 | F15: 1 | G15: 1 | I15: Yes
A16: 8 | B16: 4 | C16: 17 | D16: 7 | E16: 0 | F16: 2 | G16: 1
A17: 9 | B17: 4 | C17: 15 | D17: 5 | E17: 2 | F17: 1
A18: 10 | B18: 4 | C18: 8 | D18: 7 | E18: 0 | F18: 3
A19: 11 | B19: 3 | C19: 14 | D19: 5 | E19: 1 | F19: 2 | H19: 1
A20: 12 | B20: 4 | C20: 18 | D20: 6 | E20: 1 | F20: 3 | G20: 1 | I20: Yes
A21: 13 | B21: 4 | C21: 12 | D21: 8 | E21: 0 | F21: 3
A22: 14 | B22: 3 | C22: 4 | D22: 5 | E22: 2 | F22: 2 | I22: Yes
A23: 15 | B23: 4 | C23: 2 | D23: 5 | E23: 3 | F23: 2 | I23: Yes
A24: 16 | B24: 3 | C24: 10 | D24: 5 | E24: 1 | F24: 4 | I24: Yes
A25: 17 | B25: 4 | C25: 6 | D25: 6 | E25: 2 | F25: 2 | I25: Yes
A26: 18 | B26: 4 | C26: 16 | D26: 5 | E26: 2 | F26: 2 | I26: Yes
A27: Totals | B27: =IF(B2="","",SUM(B9:B26)) -> 70 | D27: =IF(B2="","",SUM(D9:D26)) -> 101 | E27: =IF(B2="","",SUM(E9:E26)) -> 31 | F27: =IF(B2="","",SUM(F9:F26)) -> 39 | G27: =IF(B2="","",SUM(G9:G26)) -> 5 | H27: =IF(B2="","",SUM(H9:H26)) -> 2 | I27: =IF(COUNTIF(I9:I26,"=Yes")=0,"",COUNTIF(I9:I26,"=Yes")) -> 12