A1: Paul Baldwin
A2: Club | B2: Merrist Wood
A3: Par/SS | B3: 72/70 | D3: Num. Of Fairways | I3: =IF(B2="","",18-(COUNTIF(B9:B26,3))) -> 14
A4: Date | B4: 39900 | D4: Playing Handicap | I4: 19
A5: Event Place | B5: 7 | C5: M | D5: Prize Money | G5: 10000
A6: Game Stats | B6: DB+ | C6: DB | D6: Bi | E6: P | F6: B | G6: E | H6: A | I6: H1
B7: 7 | C7: 3 | D7: 3 | E7: 5 | F7: 0 | G7: 0 | H7: 0 | I7: 0
A8: Hole No | B8: Par | C8: Stroke Index | D8: Gross Score | E8: Points | F8: Putts | G8: Fairways | H8: Ferrets | I8: Green Regulation
A9: 1 | B9: 4 | C9: 10 | D9: 6 | E9: 1 | F9: 3 | G9: 1 | I9: Yes
A10: 2 | B10: 3 | C10: 18 | D10: 6 | E10: 0 | F10: 4 | I10: Yes
A11: 3 | B11: 4 | C11: 6 | D11: 11 | E11: 0 | F11: 4
A12: 4 | B12: 5 | C12: 14 | D12: 6 | E12: 2 | F12: 3 | G12: 1 | I12: Yes
A13: 5 | B13: 4 | C13: 4 | D13: 5 | E13: 2 | F13: 1 | G13: 1
A14: 6 | B14: 5 | C14: 12 | D14: 7 | E14: 1 | F14: 2
A15: 7 | B15: 4 | C15: 8 | D15: 4 | E15: 3 | F15: 2 | G15: 1 | I15: Yes
A16: 8 | B16: 3 | C16: 16 | D16: 4 | E16: 2 | F16: 2 | I16: Yes
A17: 9 | B17: 4 | C17: 2 | D17: 10 | E17: 0 | F17: 2 | G17: 1
A18: 10 | B18: 5 | C18: 9 | D18: 7 | E18: 1 | F18: 2
A19: 11 | B19: 3 | C19: 15 | D19: 3 | E19: 3 | F19: 1 | I19: Yes
A20: 12 | B20: 4 | C20: 7 | D20: 10 | E20: 0 | F20: 3 | H20: 2
A21: 13 | B21: 4 | C21: 1 | D21: 4 | E21: 4 | F21: 3 | I21: Yes
A22: 14 | B22: 4 | C22: 13 | D22: 7 | E22: 0 | F22: 2 | G22: 1
A23: 15 | B23: 4 | C23: 3 | D23: 4 | E23: 3 | F23: 2 | I23: Yes
A24: 16 | B24: 3 | C24: 17 | D24: 3 | E24: 3 | F24: 2 | I24: Yes
A25: 17 | B25: 4 | C25: 5 | D25: 7 | E25: 0 | F25: 2
A26: 18 | B26: 5 | C26: 11 | D26: 8 | E26: 0 | F26: 2
A27: Totals | B27: =IF(B2="","",SUM(B9:B26)) -> 72 | D27: =IF(B2="","",SUM(D9:D26)) -> 112 | E27: =IF(B2="","",SUM(E9:E26)) -> 25 | F27: =IF(B2="","",SUM(F9:F26)) -> 42 | G27: =IF(B2="","",SUM(G9:G26)) -> 6 | H27: =IF(B2="","",SUM(H9:H26)) -> 2 | I27: =IF(COUNTIF(I9:I26,"=Yes")=0,"",COUNTIF(I9:I26,"=Yes")) -> 9