A1: David Braithwaite
A2: Club | B2: Celtic Manor - Twenty Ten
A3: Par/SS | B3: 71/71 | D3: Num. Of Fairways | I3: =IF(B2="","",18-(COUNTIF(B9:B26,3))) -> 13
A4: Date | B4: 41871 | D4: Playing Handicap | I4: 10.600000000001
A5: Event Place | B5: 3 | D5: Prize Money | G5: 5000
A6: Game Stats | B6: DB+ | C6: DB | D6: Bi | E6: P | F6: B | G6: E | H6: A | I6: H1
B7: 0 | C7: 9 | D7: 4 | E7: 4 | F7: 1 | G7: 0 | H7: 0 | I7: 0
A8: Hole No | B8: Par | C8: Stroke Index | D8: Gross Score | E8: Points | F8: Putts | G8: Fairways | H8: Ferrets | I8: Green Regulation
A9: 1 | B9: 4 | C9: 11 | D9: 6 | E9: 1 | F9: 2 | G9: 1
A10: 2 | B10: 5 | C10: 3 | D10: 6 | E10: 2 | F10: 2 | G10: 1 | I10: Yes
A11: 3 | B11: 3 | C11: 13 | D11: 4 | E11: 1 | F11: 2
A12: 4 | B12: 4 | C12: 15 | D12: 6 | E12: 0 | F12: 2
A13: 5 | B13: 4 | C13: 1 | D13: 5 | E13: 2 | F13: 1 | G13: 1
A14: 6 | B14: 4 | C14: 7 | D14: 6 | E14: 1 | F14: 3 | I14: Yes
A15: 7 | B15: 3 | C15: 17 | D15: 2 | E15: 3 | F15: 1 | I15: Yes
A16: 8 | B16: 4 | C16: 9 | D16: 6 | E16: 1 | F16: 2 | G16: 1 | H16: 1
A17: 9 | B17: 5 | C17: 5 | D17: 7 | E17: 1 | F17: 3 | I17: Yes
A18: 10 | B18: 3 | C18: 18 | D18: 3 | E18: 2 | F18: 2 | I18: Yes
A19: 11 | B19: 5 | C19: 8 | D19: 7 | E19: 1 | F19: 2
A20: 12 | B20: 4 | C20: 4 | D20: 6 | E20: 1 | F20: 1 | G20: 1
A21: 13 | B21: 3 | C21: 14 | D21: 3 | E21: 2 | F21: 2 | I21: Yes
A22: 14 | B22: 4 | C22: 2 | D22: 4 | E22: 3 | F22: 1 | G22: 1 | I22: Yes
A23: 15 | B23: 4 | C23: 12 | D23: 5 | E23: 1 | F23: 3 | G23: 1 | I23: Yes
A24: 16 | B24: 4 | C24: 6 | D24: 6 | E24: 1 | F24: 2
A25: 17 | B25: 3 | C25: 16 | D25: 5 | E25: 0 | F25: 2
A26: 18 | B26: 5 | C26: 10 | D26: 5 | E26: 3 | F26: 2 | I26: Yes
A27: Totals | B27: =IF(B2="","",SUM(B9:B26)) -> 71 | D27: =IF(B2="","",SUM(D9:D26)) -> 92 | E27: =IF(B2="","",SUM(E9:E26)) -> 26 | F27: =IF(B2="","",SUM(F9:F26)) -> 35 | G27: =IF(B2="","",SUM(G9:G26)) -> 7 | H27: =IF(B2="","",SUM(H9:H26)) -> 1 | I27: =IF(COUNTIF(I9:I26,"=Yes")=0,"",COUNTIF(I9:I26,"=Yes")) -> 9