A1: Paul Baldwin
A2: Club | B2: Rowlands Castle
A3: Par/SS | B3: 72/70 | D3: Num. Of Fairways | I3: =IF(B2="","",18-(COUNTIF(B9:B26,3))) -> 15
A4: Date | B4: 39924 | D4: Playing Handicap | I4: 19.2
A5: Event Place | B5: 5 | C5: M | D5: Prize Money | G5: 18750
A6: Game Stats | B6: DB+ | C6: DB | D6: Bi | E6: P | F6: B | G6: E | H6: A | I6: H1
B7: 3 | C7: 5 | D7: 7 | E7: 3 | F7: 0 | G7: 0 | H7: 0 | I7: 0
A8: Hole No | B8: Par | C8: Stroke Index | D8: Gross Score | E8: Points | F8: Putts | G8: Fairways | H8: Ferrets | I8: Green Regulation
A9: 1 | B9: 4 | C9: 9 | D9: 6 | E9: 1 | F9: 2
A10: 2 | B10: 3 | C10: 17 | D10: 6 | E10: 0 | F10: 2
A11: 3 | B11: 4 | C11: 5 | D11: 4 | E11: 3 | F11: 1 | I11: Yes
A12: 4 | B12: 4 | C12: 15 | D12: 6 | E12: 1 | F12: 2
A13: 5 | B13: 4 | C13: 7 | D13: 5 | E13: 2 | F13: 2 | G13: 1 | I13: Yes
A14: 6 | B14: 4 | C14: 1 | D14: 5 | E14: 3 | F14: 2 | I14: Yes
A15: 7 | B15: 5 | C15: 11 | D15: 6 | E15: 2 | F15: 2 | I15: Yes
A16: 8 | B16: 4 | C16: 3 | D16: 6 | E16: 1 | F16: 2
A17: 9 | B17: 4 | C17: 13 | D17: 6 | E17: 1 | F17: 2
A18: 10 | B18: 4 | C18: 4 | D18: 5 | E18: 2 | F18: 2 | I18: Yes
A19: 11 | B19: 3 | C19: 18 | D19: 4 | E19: 2 | F19: 2 | I19: Yes
A20: 12 | B20: 5 | C20: 14 | D20: 10 | E20: 0 | F20: 3 | H20: 1
A21: 13 | B21: 4 | C21: 8 | D21: 4 | E21: 3 | F21: 1 | G21: 1 | I21: Yes
A22: 14 | B22: 3 | C22: 16 | D22: 4 | E22: 2 | F22: 2 | I22: Yes
A23: 15 | B23: 4 | C23: 2 | D23: 4 | E23: 3 | F23: 1 | I23: Yes
A24: 16 | B24: 4 | C24: 12 | D24: 5 | E24: 2 | F24: 2 | I24: Yes
A25: 17 | B25: 5 | C25: 10 | D25: 10 | E25: 0 | F25: 3 | H25: 1
A26: 18 | B26: 4 | C26: 6 | D26: 6 | E26: 1 | F26: 1
A27: Totals | B27: =IF(B2="","",SUM(B9:B26)) -> 72 | D27: =IF(B2="","",SUM(D9:D26)) -> 102 | E27: =IF(B2="","",SUM(E9:E26)) -> 29 | F27: =IF(B2="","",SUM(F9:F26)) -> 34 | G27: =IF(B2="","",SUM(G9:G26)) -> 2 | H27: =IF(B2="","",SUM(H9:H26)) -> 2 | I27: =IF(COUNTIF(I9:I26,"=Yes")=0,"",COUNTIF(I9:I26,"=Yes")) -> 10