A1: Dave Rouse
A2: Club | B2: Wimbledon Common
A3: Par/SS | B3: 68/66 | D3: Num. Of Fairways | I3: =IF(B2="","",18-(COUNTIF(B9:B26,3))) -> 13
A4: Date | B4: 38559 | D4: Playing Handicap | I4: 22.8
A5: Event Place | B5: 1 | D5: Prize Money | G5: 5000
A6: Game Stats | B6: DB+ | C6: DB | D6: Bi | E6: P | F6: B | G6: E | H6: A | I6: H1
B7: 1 | C7: 4 | D7: 10 | E7: 3 | F7: 0 | G7: 0 | H7: 0 | I7: 0
A8: Hole No | B8: Par | C8: Stroke Index | D8: Gross Score | E8: Points | F8: Putts | G8: Fairways | H8: Ferrets | I8: Green Regulation
A9: 1 | B9: 3 | C9: 7 | D9: 4 | E9: 2 | F9: 2 | I9: Yes
A10: 2 | B10: 4 | C10: 1 | D10: 4 | E10: 4 | F10: 2 | G10: 1 | I10: Yes
A11: 3 | B11: 4 | C11: 14 | D11: 6 | E11: 1 | F11: 2
A12: 4 | B12: 3 | C12: 11 | D12: 4 | E12: 2 | F12: 3 | I12: Yes
A13: 5 | B13: 4 | C13: 18 | D13: 4 | E13: 3 | F13: 1 | I13: Yes
A14: 6 | B14: 4 | C14: 5 | D14: 5 | E14: 3 | F14: 1 | I14: Yes
A15: 7 | B15: 4 | C15: 10 | D15: 6 | E15: 1 | F15: 1
A16: 8 | B16: 3 | C16: 8 | D16: 5 | E16: 1 | F16: 2
A17: 9 | B17: 4 | C17: 16 | D17: 5 | E17: 2 | F17: 2 | G17: 1 | I17: Yes
A18: 10 | B18: 4 | C18: 15 | D18: 5 | E18: 2 | F18: 2 | G18: 1 | I18: Yes
A19: 11 | B19: 4 | C19: 4 | D19: 5 | E19: 3 | F19: 2 | I19: Yes
A20: 12 | B20: 3 | C20: 6 | D20: 4 | E20: 2 | F20: 0
A21: 13 | B21: 4 | C21: 13 | D21: 6 | E21: 1 | F21: 2
A22: 14 | B22: 4 | C22: 2 | D22: 10 | E22: 0 | F22: 3 | H22: 2
A23: 15 | B23: 4 | C23: 12 | D23: 5 | E23: 2 | F23: 2 | G23: 1 | I23: Yes
A24: 16 | B24: 3 | C24: 17 | D24: 3 | E24: 3 | F24: 1 | I24: Yes
A25: 17 | B25: 4 | C25: 9 | D25: 5 | E25: 2 | F25: 2 | G25: 1 | I25: Yes
A26: 18 | B26: 5 | C26: 3 | D26: 6 | E26: 3 | F26: 2 | I26: Yes
A27: Totals | B27: =IF(B2="","",SUM(B9:B26)) -> 68 | D27: =IF(B2="","",SUM(D9:D26)) -> 92 | E27: =IF(B2="","",SUM(E9:E26)) -> 37 | F27: =IF(B2="","",SUM(F9:F26)) -> 32 | G27: =IF(B2="","",SUM(G9:G26)) -> 5 | H27: =IF(B2="","",SUM(H9:H26)) -> 2 | I27: =IF(COUNTIF(I9:I26,"=Yes")=0,"",COUNTIF(I9:I26,"=Yes")) -> 12