A1: Kevin Gallagher
A2: Club | B2: Horton Park
A3: Par/SS | B3: 70/69 | D3: Num. Of Fairways | I3: =IF(B2="","",18-(COUNTIF(B9:B26,3))) -> 12
A4: Date | B4: 42084 | D4: Playing Handicap | I4: 12.9
A5: Event Place | B5: 5 | C5: M | D5: Prize Money | G5: 10000
A6: Game Stats | B6: DB+ | C6: DB | D6: BI | E6: P | F6: B | G6: E | H6: A | I6: H1
B7: 1 | C7: 9 | D7: 8 | E7: 0 | F7: 0 | G7: 0 | H7: 0 | I7: 0
A8: Hole No | B8: Par | C8: Stroke Index | D8: Gross Score | E8: Points | F8: Putts | G8: Fairways | H8: Ferrets | I8: Green Regulation
A9: 1 | B9: 3 | C9: 12 | D9: 4 | E9: 2 | F9: 2 | I9: Yes
A10: 2 | B10: 4 | C10: 6 | D10: 5 | E10: 2 | F10: 2 | G10: 1 | I10: Yes
A11: 3 | B11: 5 | C11: 2 | D11: 7 | E11: 1 | F11: 3 | I11: Yes
A12: 4 | B12: 3 | C12: 10 | D12: 6 | E12: 0 | F12: 3
A13: 5 | B13: 5 | C13: 14 | D13: 6 | E13: 1 | F13: 2
A14: 6 | B14: 4 | C14: 16 | D14: 5 | E14: 1 | F14: 2
A15: 7 | B15: 4 | C15: 18 | D15: 5 | E15: 1 | F15: 2
A16: 8 | B16: 5 | C16: 4 | D16: 7 | E16: 1 | F16: 1
A17: 9 | B17: 3 | C17: 8 | D17: 4 | E17: 2 | F17: 2 | I17: Yes
A18: 10 | B18: 3 | C18: 7 | D18: 5 | E18: 1 | F18: 2
A19: 11 | B19: 5 | C19: 13 | D19: 6 | E19: 2 | F19: 1 | G19: 1
A20: 12 | B20: 4 | C20: 3 | D20: 6 | E20: 1 | F20: 2 | G20: 1
A21: 13 | B21: 4 | C21: 15 | D21: 6 | E21: 0 | F21: 3
A22: 14 | B22: 4 | C22: 9 | D22: 6 | E22: 1 | F22: 3 | I22: Yes
A23: 15 | B23: 4 | C23: 5 | D23: 6 | E23: 1 | F23: 1
A24: 16 | B24: 3 | C24: 17 | D24: 5 | E24: 0 | F24: 3
A25: 17 | B25: 4 | C25: 1 | D25: 6 | E25: 1 | F25: 3 | I25: Yes
A26: 18 | B26: 3 | C26: 11 | D26: 4 | E26: 2 | F26: 2 | I26: Yes
A27: Totals | B27: =IF(B2="","",SUM(B9:B26)) -> 70 | D27: =IF(B2="","",SUM(D9:D26)) -> 99 | E27: =IF(B2="","",SUM(E9:E26)) -> 20 | F27: =IF(B2="","",SUM(F9:F26)) -> 39 | G27: =IF(B2="","",SUM(G9:G26)) -> 3 | H27: =IF(B2="","",SUM(H9:H26)) -> 0 | I27: =IF(COUNTIF(I9:I26,"=Yes")=0,"",COUNTIF(I9:I26,"=Yes")) -> 7