A1: Kevin Gallagher
A2: Club | B2: Dudsbury
A3: Par/SS | B3: 71/70 | D3: Num. Of Fairways | I3: =IF(B2="","",18-(COUNTIF(B9:B26,3))) -> 14
A4: Date | B4: 38475 | D4: Playing Handicap | I4: 9.5
A5: Event Place | B5: 9 | D5: Prize Money | G5: 18750
A6: Game Stats | B6: DB+ | C6: DB | D6: Bi | E6: P | F6: B | G6: E | H6: A | I6: H1
B7: 1 | C7: 3 | D7: 10 | E7: 3 | F7: 1 | G7: 0 | H7: 0 | I7: 0
A8: Hole No | B8: Par | C8: Stroke Index | D8: Gross Score | E8: Points | F8: Putts | G8: Fairways | H8: Ferrets | I8: Green Regulation
A9: 1 | B9: 4 | C9: 12 | D9: 5 | E9: 1 | F9: 2 | G9: 1
A10: 2 | B10: 3 | C10: 18 | D10: 4 | E10: 1 | F10: 2
A11: 3 | B11: 4 | C11: 6 | D11: 5 | E11: 2 | F11: 2 | G11: 1 | I11: Yes
A12: 4 | B12: 4 | C12: 16 | D12: 3 | E12: 3 | F12: 1 | G12: 1 | I12: Yes
A13: 5 | B13: 4 | C13: 2 | D13: 6 | E13: 1 | F13: 2 | G13: 1
A14: 6 | B14: 5 | C14: 10 | D14: 5 | E14: 3 | F14: 2 | I14: Yes
A15: 7 | B15: 4 | C15: 8 | D15: 6 | E15: 1 | F15: 3 | I15: Yes
A16: 8 | B16: 3 | C16: 14 | D16: 4 | E16: 1 | F16: 2
A17: 9 | B17: 4 | C17: 4 | D17: 6 | E17: 1 | F17: 2 | G17: 1
A18: 10 | B18: 5 | C18: 15 | D18: 5 | E18: 2 | F18: 1 | G18: 1
A19: 11 | B19: 3 | C19: 11 | D19: 4 | E19: 1 | F19: 2
A20: 12 | B20: 4 | C20: 3 | D20: 5 | E20: 2 | F20: 2 | G20: 1 | I20: Yes
A21: 13 | B21: 4 | C21: 5 | D21: 7 | E21: 0 | F21: 2
A22: 14 | B22: 4 | C22: 1 | D22: 5 | E22: 2 | F22: 1 | G22: 1
A23: 15 | B23: 3 | C23: 17 | D23: 3 | E23: 2 | F23: 1
A24: 16 | B24: 4 | C24: 9 | D24: 5 | E24: 2 | F24: 2 | G24: 1 | I24: Yes
A25: 17 | B25: 5 | C25: 13 | D25: 6 | E25: 1 | F25: 2
A26: 18 | B26: 4 | C26: 7 | D26: 5 | E26: 2 | F26: 1 | G26: 1
A27: Totals | B27: =IF(B2="","",SUM(B9:B26)) -> 71 | D27: =IF(B2="","",SUM(D9:D26)) -> 89 | E27: =IF(B2="","",SUM(E9:E26)) -> 28 | F27: =IF(B2="","",SUM(F9:F26)) -> 32 | G27: =IF(B2="","",SUM(G9:G26)) -> 10 | H27: =IF(B2="","",SUM(H9:H26)) -> 0 | I27: =IF(COUNTIF(I9:I26,"=Yes")=0,"",COUNTIF(I9:I26,"=Yes")) -> 6

A1: Kevin Gallagher
A2: Club | B2: Dudsbury
A3: Par/SS | B3: 71/70 | D3: Num. Of Fairways | I3: =IF(B2="","",18-(COUNTIF(B9:B26,3))) -> 14
A4: Date | B4: 38475 | D4: Playing Handicap | I4: 9.3
A5: Event Place | B5: 9 | D5: Prize Money | G5: 18750
A6: Game Stats | B6: DB+ | C6: DB | D6: Bi | E6: P | F6: B | G6: E | H6: A | I6: H1
B7: 1 | C7: 3 | D7: 10 | E7: 3 | F7: 1 | G7: 0 | H7: 0 | I7: 0
A8: Hole No | B8: Par | C8: Stroke Index | D8: Gross Score | E8: Points | F8: Putts | G8: Fairways | H8: Ferrets | I8: Green Regulation
A9: 1 | B9: 4 | C9: 12 | D9: 5 | E9: 1 | F9: 2 | G9: 1
A10: 2 | B10: 3 | C10: 18 | D10: 4 | E10: 1 | F10: 2
A11: 3 | B11: 4 | C11: 6 | D11: 5 | E11: 2 | F11: 2 | G11: 1 | I11: Yes
A12: 4 | B12: 4 | C12: 16 | D12: 3 | E12: 3 | F12: 1 | G12: 1 | I12: Yes
A13: 5 | B13: 4 | C13: 2 | D13: 6 | E13: 1 | F13: 2 | G13: 1
A14: 6 | B14: 5 | C14: 10 | D14: 5 | E14: 2 | F14: 2 | I14: Yes
A15: 7 | B15: 4 | C15: 8 | D15: 6 | E15: 1 | F15: 3 | I15: Yes
A16: 8 | B16: 3 | C16: 14 | D16: 4 | E16: 1 | F16: 2
A17: 9 | B17: 4 | C17: 4 | D17: 6 | E17: 1 | F17: 2 | G17: 1
A18: 10 | B18: 5 | C18: 15 | D18: 5 | E18: 2 | F18: 1 | G18: 1
A19: 11 | B19: 3 | C19: 11 | D19: 4 | E19: 1 | F19: 2
A20: 12 | B20: 4 | C20: 3 | D20: 5 | E20: 2 | F20: 2 | G20: 1 | I20: Yes
A21: 13 | B21: 4 | C21: 5 | D21: 7 | E21: 0 | F21: 2
A22: 14 | B22: 4 | C22: 1 | D22: 5 | E22: 2 | F22: 1 | G22: 1
A23: 15 | B23: 3 | C23: 17 | D23: 3 | E23: 2 | F23: 1
A24: 16 | B24: 4 | C24: 9 | D24: 5 | E24: 2 | F24: 2 | G24: 1 | I24: Yes
A25: 17 | B25: 5 | C25: 13 | D25: 6 | E25: 1 | F25: 2
A26: 18 | B26: 4 | C26: 7 | D26: 5 | E26: 2 | F26: 1 | G26: 1
A27: Totals | B27: =IF(B2="","",SUM(B9:B26)) -> 71 | D27: =IF(B2="","",SUM(D9:D26)) -> 89 | E27: =IF(B2="","",SUM(E9:E26)) -> 27 | F27: =IF(B2="","",SUM(F9:F26)) -> 32 | G27: =IF(B2="","",SUM(G9:G26)) -> 10 | H27: =IF(B2="","",SUM(H9:H26)) -> 0 | I27: =IF(COUNTIF(I9:I26,"=Yes")=0,"",COUNTIF(I9:I26,"=Yes")) -> 6