A1: Jon Dey
A2: Club | B2: Chelsfield Lakes
A3: Par/SS | B3: 71/68 | D3: Num. Of Fairways | I3: =IF(B2="","",18-(COUNTIF(B9:B26,3))) -> 14
A4: Date | B4: 41524 | D4: Playing Handicap | I4: 24
A5: Event Place | B5: 5 | C5: M | D5: Prize Money | G5: 30000
A6: Game Stats | B6: DB+ | C6: DB | D6: BI | E6: P | F6: B | G6: E | H6: A | I6: H1
B7: 2 | C7: 4 | D7: 9 | E7: 3 | F7: 0 | G7: 0 | H7: 0 | I7: 0
A8: Hole No | B8: Par | C8: Stroke Index | D8: Gross Score | E8: Points | F8: Putts | G8: Fairways | H8: Ferrets | I8: Green Regulation
A9: 1 | B9: 4 | C9: 11 | D9: 6 | E9: 1 | F9: 1
A10: 2 | B10: 3 | C10: 3 | D10: 3 | E10: 4 | F10: 1 | I10: Yes
A11: 3 | B11: 4 | C11: 13 | D11: 5 | E11: 2 | F11: 2 | G11: 1 | I11: Yes
A12: 4 | B12: 4 | C12: 1 | D12: 5 | E12: 3 | F12: 2 | G12: 1 | I12: Yes
A13: 5 | B13: 3 | C13: 7 | D13: 5 | E13: 1 | F13: 2
A14: 6 | B14: 5 | C14: 15 | D14: 8 | E14: 0 | F14: 3
A15: 7 | B15: 5 | C15: 5 | D15: 6 | E15: 3 | F15: 2 | G15: 1 | I15: Yes
A16: 8 | B16: 4 | C16: 17 | D16: 6 | E16: 1 | F16: 2
A17: 9 | B17: 4 | C17: 9 | D17: 4 | E17: 3 | F17: 2 | G17: 1 | I17: Yes
A18: 10 | B18: 4 | C18: 6 | D18: 5 | E18: 3 | F18: 2 | I18: Yes
A19: 11 | B19: 4 | C19: 18 | D19: 4 | E19: 3 | F19: 2 | G19: 1 | I19: Yes
A20: 12 | B20: 4 | C20: 8 | D20: 8 | E20: 0 | F20: 2
A21: 13 | B21: 5 | C21: 2 | D21: 6 | E21: 3 | F21: 2 | I21: Yes
A22: 14 | B22: 4 | C22: 16 | D22: 5 | E22: 2 | F22: 2 | I22: Yes
A23: 15 | B23: 3 | C23: 12 | D23: 5 | E23: 1 | F23: 2
A24: 16 | B24: 4 | C24: 4 | D24: 5 | E24: 3 | F24: 2 | I24: Yes
A25: 17 | B25: 3 | C25: 14 | D25: 4 | E25: 2 | F25: 2 | I25: Yes
A26: 18 | B26: 4 | C26: 10 | D26: 5 | E26: 2 | F26: 2 | G26: 1 | I26: Yes
A27: Totals | B27: =IF(B2="","",SUM(B9:B26)) -> 71 | D27: =IF(B2="","",SUM(D9:D26)) -> 95 | E27: =IF(B2="","",SUM(E9:E26)) -> 37 | F27: =IF(B2="","",SUM(F9:F26)) -> 35 | G27: =IF(B2="","",SUM(G9:G26)) -> 6 | H27: =IF(B2="","",SUM(H9:H26)) -> 0 | I27: =IF(COUNTIF(I9:I26,"=Yes")=0,"",COUNTIF(I9:I26,"=Yes")) -> 12