A1: Dave Rouse
A2: Club | B2: Hamptworth
A3: Par/SS | B3: 72/69 | D3: Num. Of Fairways | I3: =IF(B2="","",18-(COUNTIF(B9:B26,3))) -> 14
A4: Date | B4: 41401 | D4: Playing Handicap | I4: 25.8
A5: Event Place | B5: 9 | C5: M | D5: Prize Money | G5: 18750
A6: Game Stats | B6: DB+ | C6: DB | D6: Bi | E6: P | F6: B | G6: E | H6: A | I6: H1
B7: 6 | C7: 5 | D7: 6 | E7: 1 | F7: 0 | G7: 0 | H7: 0 | I7: 0
A8: Hole No | B8: Par | C8: Stroke Index | D8: Gross Score | E8: Points | F8: Putts | G8: Fairways | H8: Ferrets | I8: Green Regulation
A9: 1 | B9: 4 | C9: 9 | D9: 4 | E9: 3 | F9: 2 | G9: 1 | I9: Yes
A10: 2 | B10: 4 | C10: 5 | D10: 5 | E10: 3 | F10: 2 | G10: 1 | I10: Yes
A11: 3 | B11: 4 | C11: 17 | D11: 6 | E11: 1 | F11: 3 | I11: Yes
A12: 4 | B12: 3 | C12: 3 | D12: 6 | E12: 1 | F12: 3 | I12: Yes
A13: 5 | B13: 4 | C13: 13 | D13: 6 | E13: 1 | F13: 2 | G13: 1
A14: 6 | B14: 4 | C14: 15 | D14: 5 | E14: 2 | F14: 2 | I14: Yes
A15: 7 | B15: 5 | C15: 1 | D15: 6 | E15: 3 | F15: 2 | I15: Yes
A16: 8 | B16: 3 | C16: 7 | D16: 7 | E16: 0 | F16: 2
A17: 9 | B17: 5 | C17: 11 | D17: 7 | E17: 1 | F17: 2 | G17: 1
A18: 10 | B18: 3 | C18: 10 | D18: 4 | E18: 2 | F18: 2 | I18: Yes
A19: 11 | B19: 4 | C19: 4 | D19: 6 | E19: 2 | F19: 1 | G19: 1
A20: 12 | B20: 4 | C20: 18 | D20: 5 | E20: 2 | F20: 2 | I20: Yes
A21: 13 | B21: 3 | C21: 8 | D21: 7 | E21: 0 | F21: 4 | I21: Yes
A22: 14 | B22: 4 | C22: 2 | D22: 10 | E22: 0 | F22: 3 | H22: 2
A23: 15 | B23: 4 | C23: 14 | D23: 8 | E23: 0 | F23: 2
A24: 16 | B24: 5 | C24: 6 | D24: 6 | E24: 3 | F24: 2 | G24: 1 | I24: Yes
A25: 17 | B25: 4 | C25: 16 | D25: 7 | E25: 0 | F25: 2
A26: 18 | B26: 5 | C26: 12 | D26: 7 | E26: 1 | F26: 2
A27: Totals | B27: =IF(B2="","",SUM(B9:B26)) -> 72 | D27: =IF(B2="","",SUM(D9:D26)) -> 112 | E27: =IF(B2="","",SUM(E9:E26)) -> 25 | F27: =IF(B2="","",SUM(F9:F26)) -> 40 | G27: =IF(B2="","",SUM(G9:G26)) -> 6 | H27: =IF(B2="","",SUM(H9:H26)) -> 2 | I27: =IF(COUNTIF(I9:I26,"=Yes")=0,"",COUNTIF(I9:I26,"=Yes")) -> 10