A1: Jon Dey
A2: Club | B2: Hamptworth
A3: Par/SS | B3: 72/69 | D3: Num. Of Fairways | I3: =IF(B2="","",18-(COUNTIF(B9:B26,3))) -> 14
A4: Date | B4: 41401 | D4: Playing Handicap | I4: 26.6
A5: Event Place | B5: 2 | C5: M | D5: Prize Money | G5: 36250
A6: Game Stats | B6: DB+ | C6: DB | D6: Bi | E6: P | F6: B | G6: E | H6: A | I6: H1
B7: 4 | C7: 5 | D7: 7 | E7: 2 | F7: 0 | G7: 0 | H7: 0 | I7: 0
A8: Hole No | B8: Par | C8: Stroke Index | D8: Gross Score | E8: Points | F8: Putts | G8: Fairways | H8: Ferrets | I8: Green Regulation
A9: 1 | B9: 4 | C9: 9 | D9: 5 | E9: 3 | F9: 1 | G9: 1 | I9: Yes
A10: 2 | B10: 4 | C10: 5 | D10: 6 | E10: 2 | F10: 2 | G10: 1 | I10: Yes
A11: 3 | B11: 4 | C11: 17 | D11: 6 | E11: 1 | F11: 2 | G11: 1
A12: 4 | B12: 3 | C12: 3 | D12: 4 | E12: 3 | F12: 2 | I12: Yes
A13: 5 | B13: 4 | C13: 13 | D13: 10 | E13: 0 | F13: 4 | H13: 1
A14: 6 | B14: 4 | C14: 15 | D14: 5 | E14: 2 | F14: 1
A15: 7 | B15: 5 | C15: 1 | D15: 8 | E15: 1 | F15: 1
A16: 8 | B16: 3 | C16: 7 | D16: 3 | E16: 4 | F16: 1 | I16: Yes
A17: 9 | B17: 5 | C17: 11 | D17: 8 | E17: 0 | F17: 2
A18: 10 | B18: 3 | C18: 10 | D18: 4 | E18: 2 | F18: 2 | I18: Yes
A19: 11 | B19: 4 | C19: 4 | D19: 6 | E19: 2 | F19: 1 | G19: 1
A20: 12 | B20: 4 | C20: 18 | D20: 5 | E20: 2 | F20: 3 | G20: 1 | I20: Yes
A21: 13 | B21: 3 | C21: 8 | D21: 5 | E21: 2 | F21: 2 | I21: Yes
A22: 14 | B22: 4 | C22: 2 | D22: 10 | E22: 0 | F22: 3 | H22: 1
A23: 15 | B23: 4 | C23: 14 | D23: 5 | E23: 2 | F23: 2 | G23: 1 | I23: Yes
A24: 16 | B24: 5 | C24: 6 | D24: 7 | E24: 2 | F24: 2 | I24: Yes
A25: 17 | B25: 4 | C25: 16 | D25: 5 | E25: 2 | F25: 2 | I25: Yes
A26: 18 | B26: 5 | C26: 12 | D26: 5 | E26: 3 | F26: 1 | G26: 1 | I26: Yes
A27: Totals | B27: =IF(B2="","",SUM(B9:B26)) -> 72 | D27: =IF(B2="","",SUM(D9:D26)) -> 107 | E27: =IF(B2="","",SUM(E9:E26)) -> 33 | F27: =IF(B2="","",SUM(F9:F26)) -> 34 | G27: =IF(B2="","",SUM(G9:G26)) -> 7 | H27: =IF(B2="","",SUM(H9:H26)) -> 2 | I27: =IF(COUNTIF(I9:I26,"=Yes")=0,"",COUNTIF(I9:I26,"=Yes")) -> 11