A1: Ian Edwards
A2: Club | B2: Wycombe Heights
A3: Par/SS | B3: 69/68 | D3: Num. Of Fairways | I3: =IF(B2="","",18-(COUNTIF(B9:B26,3))) -> 13
A4: Date | B4: 41552 | D4: Playing Handicap | I4: 15.5
A5: Event Place | B5: 8 | C5: M | D5: Prize Money | G5: 32500
A6: Game Stats | B6: DB+ | C6: DB | D6: BI | E6: P | F6: B | G6: E | H6: A | I6: H1
B7: 2 | C7: 4 | D7: 6 | E7: 5 | F7: 1 | G7: 0 | H7: 0 | I7: 0
A8: Hole No | B8: Par | C8: Stroke Index | D8: Gross Score | E8: Points | F8: Putts | G8: Fairways | H8: Ferrets | I8: Green Regulation
A9: 1 | B9: 4 | C9: 9 | D9: 4 | E9: 3 | F9: 2 | I9: Yes
A10: 2 | B10: 3 | C10: 13 | D10: 3 | E10: 3 | F10: 0
A11: 3 | B11: 4 | C11: 11 | D11: 5 | E11: 2 | F11: 1
A12: 4 | B12: 4 | C12: 3 | D12: 6 | E12: 1 | F12: 2
A13: 5 | B13: 5 | C13: 15 | D13: 5 | E13: 3 | F13: 2 | I13: Yes
A14: 6 | B14: 3 | C14: 7 | D14: 5 | E14: 1 | F14: 2
A15: 7 | B15: 4 | C15: 1 | D15: 5 | E15: 2 | F15: 2 | I15: Yes
A16: 8 | B16: 3 | C16: 17 | D16: 4 | E16: 1 | F16: 2
A17: 9 | B17: 4 | C17: 5 | D17: 6 | E17: 1 | F17: 2
A18: 10 | B18: 3 | C18: 16 | D18: 4 | E18: 2 | F18: 2 | I18: Yes
A19: 11 | B19: 4 | C19: 18 | D19: 3 | E19: 3 | F19: 1 | G19: 1 | I19: Yes
A20: 12 | B20: 4 | C20: 8 | D20: 4 | E20: 3 | F20: 1 | I20: Yes
A21: 13 | B21: 4 | C21: 2 | D21: 6 | E21: 1 | F21: 2
A22: 14 | B22: 4 | C22: 14 | D22: 4 | E22: 3 | F22: 2 | G22: 1 | I22: Yes
A23: 15 | B23: 4 | C23: 4 | D23: 5 | E23: 2 | F23: 2 | I23: Yes
A24: 16 | B24: 3 | C24: 12 | D24: 4 | E24: 2 | F24: 2 | H24: 1 | I24: Yes
A25: 17 | B25: 5 | C25: 6 | D25: 8 | E25: 0 | F25: 3 | G25: 1 | H25: 1
A26: 18 | B26: 4 | C26: 10 | D26: 7 | E26: 0 | F26: 2 | H26: 1
A27: Totals | B27: =IF(B2="","",SUM(B9:B26)) -> 69 | D27: =IF(B2="","",SUM(D9:D26)) -> 88 | E27: =IF(B2="","",SUM(E9:E26)) -> 33 | F27: =IF(B2="","",SUM(F9:F26)) -> 32 | G27: =IF(B2="","",SUM(G9:G26)) -> 3 | H27: =IF(B2="","",SUM(H9:H26)) -> 3 | I27: =IF(COUNTIF(I9:I26,"=Yes")=0,"",COUNTIF(I9:I26,"=Yes")) -> 9