A1: Kevin Gallagher
A2: Club | B2: Wycombe Heights
A3: Par/SS | B3: 69/68 | D3: Num. Of Fairways | I3: =IF(B2="","",18-(COUNTIF(B9:B26,3))) -> 13
A4: Date | B4: 41552 | D4: Playing Handicap | I4: 13.000000000001005
A5: Event Place | B5: 7 | C5: M | D5: Prize Money | G5: 37500
A6: Game Stats | B6: DB+ | C6: DB | D6: Bi | E6: P | F6: B | G6: E | H6: A | I6: H1
B7: 0 | C7: 4 | D7: 7 | E7: 7 | F7: 0 | G7: 0 | H7: 0 | I7: 0
A8: Hole No | B8: Par | C8: Stroke Index | D8: Gross Score | E8: Points | F8: Putts | G8: Fairways | H8: Ferrets | I8: Green Regulation
A9: 1 | B9: 4 | C9: 9 | D9: 5 | E9: 2 | F9: 2 | I9: Yes
A10: 2 | B10: 3 | C10: 13 | D10: 3 | E10: 3 | F10: 2 | I10: Yes
A11: 3 | B11: 4 | C11: 11 | D11: 5 | E11: 2 | F11: 2 | I11: Yes
A12: 4 | B12: 4 | C12: 3 | D12: 4 | E12: 3 | F12: 2 | I12: Yes
A13: 5 | B13: 5 | C13: 15 | D13: 5 | E13: 2 | F13: 2 | I13: Yes
A14: 6 | B14: 3 | C14: 7 | D14: 4 | E14: 2 | F14: 3 | I14: Yes
A15: 7 | B15: 4 | C15: 1 | D15: 5 | E15: 2 | F15: 1 | G15: 1
A16: 8 | B16: 3 | C16: 17 | D16: 3 | E16: 2 | F16: 2 | I16: Yes
A17: 9 | B17: 4 | C17: 5 | D17: 6 | E17: 1 | F17: 3 | I17: Yes
A18: 10 | B18: 3 | C18: 16 | D18: 5 | E18: 0 | F18: 2
A19: 11 | B19: 4 | C19: 18 | D19: 5 | E19: 1 | F19: 3 | G19: 1 | I19: Yes
A20: 12 | B20: 4 | C20: 8 | D20: 6 | E20: 1 | F20: 2
A21: 13 | B21: 4 | C21: 2 | D21: 5 | E21: 2 | F21: 2 | I21: Yes
A22: 14 | B22: 4 | C22: 14 | D22: 4 | E22: 2 | F22: 1
A23: 15 | B23: 4 | C23: 4 | D23: 4 | E23: 3 | F23: 2 | I23: Yes
A24: 16 | B24: 3 | C24: 12 | D24: 5 | E24: 1 | F24: 3 | I24: Yes
A25: 17 | B25: 5 | C25: 6 | D25: 5 | E25: 3 | F25: 2 | G25: 1 | I25: Yes
A26: 18 | B26: 4 | C26: 10 | D26: 5 | E26: 2 | F26: 2 | G26: 1 | I26: Yes
A27: Totals | B27: =IF(B2="","",SUM(B9:B26)) -> 69 | D27: =IF(B2="","",SUM(D9:D26)) -> 84 | E27: =IF(B2="","",SUM(E9:E26)) -> 34 | F27: =IF(B2="","",SUM(F9:F26)) -> 38 | G27: =IF(B2="","",SUM(G9:G26)) -> 4 | H27: =IF(B2="","",SUM(H9:H26)) -> 0 | I27: =IF(COUNTIF(I9:I26,"=Yes")=0,"",COUNTIF(I9:I26,"=Yes")) -> 14