A1: Michael Trimmings
A2: Club | B2: Wycombe Heights
A3: Par/SS | B3: 69/68 | D3: Num. Of Fairways | I3: =IF(B2="","",18-(COUNTIF(B9:B26,3))) -> 13
A4: Date | B4: 41552 | D4: Playing Handicap | I4: 20.3
A5: Event Place | B5: 4 | C5: M | D5: Prize Money | G5: 45000
A6: Game Stats | B6: DB+ | C6: DB | D6: BI | E6: P | F6: B | G6: E | H6: A | I6: H1
B7: 1 | C7: 6 | D7: 6 | E7: 4 | F7: 1 | G7: 0 | H7: 0 | I7: 0
A8: Hole No | B8: Par | C8: Stroke Index | D8: Gross Score | E8: Points | F8: Putts | G8: Fairways | H8: Ferrets | I8: Green Regulation
A9: 1 | B9: 4 | C9: 9 | D9: 6 | E9: 1 | F9: 2
A10: 2 | B10: 3 | C10: 13 | D10: 6 | E10: 0 | F10: 2
A11: 3 | B11: 4 | C11: 11 | D11: 5 | E11: 2 | F11: 2 | I11: Yes
A12: 4 | B12: 4 | C12: 3 | D12: 6 | E12: 1 | F12: 2
A13: 5 | B13: 5 | C13: 15 | D13: 6 | E13: 2 | F13: 2 | G13: 1 | I13: Yes
A14: 6 | B14: 3 | C14: 7 | D14: 4 | E14: 2 | F14: 2 | I14: Yes
A15: 7 | B15: 4 | C15: 1 | D15: 5 | E15: 3 | F15: 1 | I15: Yes
A16: 8 | B16: 3 | C16: 17 | D16: 3 | E16: 3 | F16: 2 | I16: Yes
A17: 9 | B17: 4 | C17: 5 | D17: 6 | E17: 1 | F17: 3 | G17: 1 | I17: Yes
A18: 10 | B18: 3 | C18: 16 | D18: 3 | E18: 3 | F18: 1 | I18: Yes
A19: 11 | B19: 4 | C19: 18 | D19: 6 | E19: 1 | F19: 2 | H19: 1
A20: 12 | B20: 4 | C20: 8 | D20: 6 | E20: 1 | F20: 2
A21: 13 | B21: 4 | C21: 2 | D21: 5 | E21: 3 | F21: 2 | G21: 1 | I21: Yes
A22: 14 | B22: 4 | C22: 14 | D22: 5 | E22: 2 | F22: 2 | I22: Yes
A23: 15 | B23: 4 | C23: 4 | D23: 6 | E23: 1 | F23: 2
A24: 16 | B24: 3 | C24: 12 | D24: 3 | E24: 3 | F24: 1 | I24: Yes
A25: 17 | B25: 5 | C25: 6 | D25: 5 | E25: 3 | F25: 1 | I25: Yes
A26: 18 | B26: 4 | C26: 10 | D26: 3 | E26: 4 | F26: 1 | G26: 1 | I26: Yes
A27: Totals | B27: =IF(B2="","",SUM(B9:B26)) -> 69 | D27: =IF(B2="","",SUM(D9:D26)) -> 89 | E27: =IF(B2="","",SUM(E9:E26)) -> 36 | F27: =IF(B2="","",SUM(F9:F26)) -> 32 | G27: =IF(B2="","",SUM(G9:G26)) -> 4 | H27: =IF(B2="","",SUM(H9:H26)) -> 1 | I27: =IF(COUNTIF(I9:I26,"=Yes")=0,"",COUNTIF(I9:I26,"=Yes")) -> 12