A1: David Braithwaite
A2: Club | B2: Cumberwell Park B/R
A3: Par/SS | B3: 70/71 | D3: Num. Of Fairways | I3: =IF(B2="","",18-(COUNTIF(B9:B26,3))) -> 13
A4: Date | B4: 40179 | D4: Playing Handicap | I4: 12.7
A5: Event Place | B5: 2 | D5: Prize Money | G5: 2500
A6: Game Stats | B6: DB+ | C6: DB | D6: Bi | E6: P | F6: B | G6: E | H6: A | I6: H1
B7: 1 | C7: 2 | D7: 8 | E7: 6 | F7: 1 | G7: 0 | H7: 0 | I7: 0
A8: Hole No | B8: Par | C8: Stroke Index | D8: Gross Score | E8: Points | F8: Putts | G8: Fairways | H8: Ferrets | I8: Green Regulation
A9: 1 | B9: 4 | C9: 9 | D9: 4 | E9: 3 | F9: 1 | G9: 1 | I9: Yes
A10: 2 | B10: 4 | C10: 5 | D10: 5 | E10: 2 | F10: 2 | I10: Yes
A11: 3 | B11: 3 | C11: 17 | D11: 5 | E11: 0 | F11: 2
A12: 4 | B12: 4 | C12: 11 | D12: 4 | E12: 3 | F12: 1 | G12: 1 | I12: Yes
A13: 5 | B13: 4 | C13: 13 | D13: 4 | E13: 3 | F13: 1 | G13: 1 | I13: Yes
A14: 6 | B14: 4 | C14: 3 | D14: 5 | E14: 2 | F14: 2 | I14: Yes
A15: 7 | B15: 3 | C15: 15 | D15: 3 | E15: 2 | F15: 1
A16: 8 | B16: 4 | C16: 1 | D16: 5 | E16: 2 | F16: 1
A17: 9 | B17: 5 | C17: 7 | D17: 6 | E17: 2 | F17: 2 | G17: 1 | I17: Yes
A18: 10 | B18: 5 | C18: 6 | D18: 7 | E18: 1 | F18: 2
A19: 11 | B19: 4 | C19: 2 | D19: 5 | E19: 2 | F19: 2 | G19: 1 | I19: Yes
A20: 12 | B20: 4 | C20: 16 | D20: 5 | E20: 1 | F20: 2
A21: 13 | B21: 4 | C21: 14 | D21: 5 | E21: 1 | F21: 1 | G21: 1
A22: 14 | B22: 4 | C22: 4 | D22: 4 | E22: 3 | F22: 2 | G22: 1 | I22: Yes
A23: 15 | B23: 3 | C23: 18 | D23: 3 | E23: 2 | F23: 1
A24: 16 | B24: 4 | C24: 8 | D24: 5 | E24: 2 | F24: 2 | I24: Yes
A25: 17 | B25: 3 | C25: 10 | D25: 2 | E25: 4 | F25: 1 | I25: Yes
A26: 18 | B26: 3 | C26: 12 | D26: 7 | E26: 0 | F26: 2 | G26: 1
A27: Totals | B27: =IF(B2="","",SUM(B9:B26)) -> 69 | D27: =IF(B2="","",SUM(D9:D26)) -> 84 | E27: =IF(B2="","",SUM(E9:E26)) -> 35 | F27: =IF(B2="","",SUM(F9:F26)) -> 28 | G27: =IF(B2="","",SUM(G9:G26)) -> 8 | H27: =IF(B2="","",SUM(H9:H26)) -> 0 | I27: =IF(COUNTIF(I9:I26,"=Yes")=0,"",COUNTIF(I9:I26,"=Yes")) -> 10