A1: Jeff Colbrook
A2: Club | B2: Atalaya Old Course
A3: Par/SS | B3: 72/72 | D3: Num. Of Fairways | I3: =IF(B2="","",18-(COUNTIF(B9:B26,3))) -> 14
A4: Date | B4: 40666 | D4: Playing Handicap | I4: 14.7
A5: Event Place | B5: 15 | C5: M | D5: Prize Money | G5: 22500
A6: Game Stats | B6: DB+ | C6: DB | D6: Bi | E6: P | F6: B | G6: E | H6: A | I6: H1
B7: 6 | C7: 5 | D7: 4 | E7: 3 | F7: 0 | G7: 0 | H7: 0 | I7: 0
A8: Hole No | B8: Par | C8: Stroke Index | D8: Gross Score | E8: Points | F8: Putts | G8: Fairways | H8: Ferrets | I8: Green Regulation
A9: 1 | B9: 4 | C9: 17 | D9: 7 | E9: 0 | F9: 2 | G9: 1 | H9: 1
A10: 2 | B10: 3 | C10: 7 | D10: 4 | E10: 2 | F10: 2 | I10: Yes
A11: 3 | B11: 4 | C11: 3 | D11: 7 | E11: 0 | F11: 2
A12: 4 | B12: 4 | C12: 13 | D12: 4 | E12: 3 | F12: 1 | G12: 1 | I12: Yes
A13: 5 | B13: 5 | C13: 1 | D13: 7 | E13: 1 | F13: 2 | G13: 1
A14: 6 | B14: 4 | C14: 11 | D14: 7 | E14: 0 | F14: 2 | G14: 1
A15: 7 | B15: 3 | C15: 5 | D15: 4 | E15: 2 | F15: 2 | I15: Yes
A16: 8 | B16: 5 | C16: 15 | D16: 7 | E16: 1 | F16: 2
A17: 9 | B17: 4 | C17: 9 | D17: 5 | E17: 2 | F17: 2 | I17: Yes
A18: 10 | B18: 4 | C18: 12 | D18: 4 | E18: 3 | F18: 1 | I18: Yes
A19: 11 | B19: 5 | C19: 14 | D19: 8 | E19: 0 | F19: 2
A20: 12 | B20: 3 | C20: 6 | D20: 4 | E20: 2 | F20: 2 | I20: Yes
A21: 13 | B21: 4 | C21: 2 | D21: 6 | E21: 1 | F21: 2
A22: 14 | B22: 4 | C22: 16 | D22: 4 | E22: 2 | F22: 2 | G22: 1 | I22: Yes
A23: 15 | B23: 4 | C23: 8 | D23: 7 | E23: 0 | F23: 2
A24: 16 | B24: 3 | C24: 18 | D24: 5 | E24: 0 | F24: 3
A25: 17 | B25: 5 | C25: 4 | D25: 10 | E25: 0 | F25: 3 | H25: 1
A26: 18 | B26: 4 | C26: 10 | D26: 6 | E26: 1 | F26: 2
A27: Totals | B27: =IF(B2="","",SUM(B9:B26)) -> 72 | D27: =IF(B2="","",SUM(D9:D26)) -> 106 | E27: =IF(B2="","",SUM(E9:E26)) -> 20 | F27: =IF(B2="","",SUM(F9:F26)) -> 36 | G27: =IF(B2="","",SUM(G9:G26)) -> 5 | H27: =IF(B2="","",SUM(H9:H26)) -> 2 | I27: =IF(COUNTIF(I9:I26,"=Yes")=0,"",COUNTIF(I9:I26,"=Yes")) -> 7