A1: Robert Thompson
A2: Club | B2: Atalaya Old Course
A3: Par/SS | B3: 72/72 | D3: Num. Of Fairways
A4: Date | B4: 40666 | D4: Playing Handicap | I4: 10.8
A5: Event Place | B5: 6 | C5: M | D5: Prize Money | G5: 45000
A6: Game Stats | B6: DB+ | C6: DB | D6: BI | E6: P | F6: B | G6: E | H6: A | I6: H1
B7: 5 | C7: 0 | D7: 8 | E7: 5 | F7: 0 | G7: 0 | H7: 0 | I7: 0
A8: Hole No | B8: Par | C8: Stroke Index | D8: Gross Score | E8: Points | F8: Putts | G8: Fairways | H8: Ferrets | I8: Green Regulation
A9: 1 | B9: 4 | C9: 17 | D9: 5 | E9: 1 | F9: 2 | G9: 1
A10: 2 | B10: 3 | C10: 7 | D10: 7 | E10: 0 | F10: 2
A11: 3 | B11: 4 | C11: 3 | D11: 8 | E11: 0 | F11: 2
A12: 4 | B12: 4 | C12: 13 | D12: 8 | E12: 0 | F12: 2
A13: 5 | B13: 5 | C13: 1 | D13: 6 | E13: 2 | F13: 1 | G13: 1
A14: 6 | B14: 4 | C14: 11 | D14: 5 | E14: 2 | F14: 2 | G14: 1 | I14: Yes
A15: 7 | B15: 3 | C15: 5 | D15: 4 | E15: 2 | F15: 2 | I15: Yes
A16: 8 | B16: 5 | C16: 15 | D16: 6 | E16: 1 | F16: 2 | G16: 1
A17: 9 | B17: 4 | C17: 9 | D17: 7 | E17: 0 | F17: 3 | G17: 1
A18: 10 | B18: 4 | C18: 12 | D18: 4 | E18: 2 | F18: 0
A19: 11 | B19: 5 | C19: 14 | D19: 6 | E19: 1 | F19: 1
A20: 12 | B20: 3 | C20: 6 | D20: 4 | E20: 2 | F20: 2 | I20: Yes
A21: 13 | B21: 4 | C21: 2 | D21: 4 | E21: 3 | F21: 1 | G21: 1 | I21: Yes
A22: 14 | B22: 4 | C22: 16 | D22: 7 | E22: 0 | F22: 2
A23: 15 | B23: 4 | C23: 8 | D23: 4 | E23: 3 | F23: 1 | G23: 1 | I23: Yes
A24: 16 | B24: 3 | C24: 18 | D24: 4 | E24: 1 | F24: 2
A25: 17 | B25: 5 | C25: 4 | D25: 5 | E25: 3 | F25: 1 | G25: 1 | I25: Yes
A26: 18 | B26: 4 | C26: 10 | D26: 4 | E26: 3 | F26: 1 | I26: Yes
A27: Totals | B27: =IF(B2="","",SUM(B9:B26)) -> 72 | D27: =IF(B2="","",SUM(D9:D26)) -> 98 | E27: =IF(B2="","",SUM(E9:E26)) -> 26 | F27: =IF(B2="","",SUM(F9:F26)) -> 29 | G27: =IF(B2="","",SUM(G9:G26)) -> 8 | H27: =IF(B2="","",SUM(H9:H26)) -> 0 | I27: =IF(COUNTIF(I9:I26,"=Yes")=0,"",COUNTIF(I9:I26,"=Yes")) -> 7