A1: Matt Carter
A2: Club | B2: Merrist Wood
A3: Par/SS | B3: 72/70 | D3: Num. Of Fairways | I3: =IF(B2="","",18-(COUNTIF(B9:B26,3))) -> 14
A4: Date | B4: 38490 | D4: Playing Handicap | I4: 20.2
A5: Event Place | B5: 10 | D5: Prize Money | G5: 11250
A6: Game Stats | B6: DB+ | C6: DB | D6: BI | E6: P | F6: B | G6: E | H6: A | I6: H1
B7: 3 | C7: 6 | D7: 7 | E7: 2 | F7: 0 | G7: 0 | H7: 0 | I7: 0
A8: Hole No | B8: Par | C8: Stroke Index | D8: Gross Score | E8: Points | F8: Putts | G8: Fairways | H8: Ferrets | I8: Green Regulation
A9: 1 | B9: 4 | C9: 10 | D9: 5 | E9: 2 | F9: 3 | G9: 1 | I9: Yes
A10: 2 | B10: 3 | C10: 18 | D10: 3 | E10: 3 | F10: 1 | I10: Yes
A11: 3 | B11: 4 | C11: 6 | D11: 5 | E11: 2 | F11: 2 | G11: 1 | I11: Yes
A12: 4 | B12: 5 | C12: 14 | D12: 8 | E12: 0 | F12: 3
A13: 5 | B13: 4 | C13: 4 | D13: 5 | E13: 2 | F13: 1 | G13: 1
A14: 6 | B14: 5 | C14: 12 | D14: 6 | E14: 2 | F14: 2 | I14: Yes
A15: 7 | B15: 4 | C15: 8 | D15: 6 | E15: 1 | F15: 2
A16: 8 | B16: 3 | C16: 16 | D16: 5 | E16: 1 | F16: 1 | H16: 1
A17: 9 | B17: 4 | C17: 2 | D17: 8 | E17: 0 | F17: 2 | H17: 2
A18: 10 | B18: 5 | C18: 9 | D18: 6 | E18: 2 | F18: 3 | G18: 1 | I18: Yes
A19: 11 | B19: 3 | C19: 15 | D19: 4 | E19: 2 | F19: 2 | I19: Yes
A20: 12 | B20: 4 | C20: 7 | D20: 6 | E20: 1 | F20: 3 | I20: Yes
A21: 13 | B21: 4 | C21: 1 | D21: 5 | E21: 3 | F21: 2 | G21: 1 | I21: Yes
A22: 14 | B22: 4 | C22: 13 | D22: 6 | E22: 1 | F22: 3 | I22: Yes
A23: 15 | B23: 4 | C23: 3 | D23: 6 | E23: 1 | F23: 2
A24: 16 | B24: 3 | C24: 17 | D24: 3 | E24: 3 | F24: 2 | I24: Yes
A25: 17 | B25: 4 | C25: 5 | D25: 7 | E25: 0 | F25: 1 | H25: 1
A26: 18 | B26: 5 | C26: 11 | D26: 7 | E26: 1 | F26: 1 | H26: 1
A27: Totals | B27: =IF(B2="","",SUM(B9:B26)) -> 72 | D27: =IF(B2="","",SUM(D9:D26)) -> 101 | E27: =IF(B2="","",SUM(E9:E26)) -> 27 | F27: =IF(B2="","",SUM(F9:F26)) -> 36 | G27: =IF(B2="","",SUM(G9:G26)) -> 5 | H27: =IF(B2="","",SUM(H9:H26)) -> 5 | I27: =IF(COUNTIF(I9:I26,"=Yes")=0,"",COUNTIF(I9:I26,"=Yes")) -> 10