A1: Dave Rouse
A2: Club | B2: Wildwood B&C
A3: Par/SS | B3: 72 | D3: Num. Of Fairways | I3: =IF(B2="","",18-(COUNTIF(B9:B26,3))) -> 14
A4: Date | B4: 38247 | D4: Playing Handicap | I4: 22.6
A5: Event Place | B5: 9 | C5: M | D5: Prize Money | G5: 2500
A6: Game Stats | B6: DB+ | C6: DB | D6: Bi | E6: P | F6: B | G6: E | H6: A | I6: H1
B7: 14 | C7: 1 | D7: 2 | E7: 1 | F7: 0 | G7: 0 | H7: 0 | I7: 0
A8: Hole No | B8: Par | C8: Stroke Index | D8: Gross Score | E8: Points | F8: Putts | G8: Fairways | H8: Ferrets | I8: Green Regulation
A9: 1 | B9: 5 | C9: 12 | D9: 6 | E9: 2 | F9: 2 | I9: Yes
A10: 2 | B10: 4 | C10: 8 | D10: 9 | E10: 0 | F10: 3 | H10: 1
A11: 3 | B11: 3 | C11: 6 | D11: 10 | E11: 0 | F11: 3 | H11: 2
A12: 4 | B12: 4 | C12: 2 | D12: 9 | E12: 0 | F12: 2
A13: 5 | B13: 4 | C13: 10 | D13: 10 | E13: 0 | F13: 3 | H13: 2
A14: 6 | B14: 4 | C14: 4 | D14: 8 | E14: 0 | F14: 3 | G14: 1
A15: 7 | B15: 3 | C15: 18 | D15: 4 | E15: 2 | F15: 2 | I15: Yes
A16: 8 | B16: 4 | C16: 14 | D16: 8 | E16: 0 | F16: 2 | G16: 1 | H16: 1
A17: 9 | B17: 5 | C17: 16 | D17: 8 | E17: 0 | F17: 2 | G17: 1
A18: 10 | B18: 4 | C18: 11 | D18: 8 | E18: 0 | F18: 2
A19: 11 | B19: 3 | C19: 17 | D19: 7 | E19: 0 | F19: 2
A20: 12 | B20: 4 | C20: 7 | D20: 10 | E20: 0 | F20: 3 | H20: 1
A21: 13 | B21: 4 | C21: 15 | D21: 4 | E21: 3 | F21: 2 | G21: 1 | I21: Yes
A22: 14 | B22: 4 | C22: 5 | D22: 9 | E22: 0 | F22: 2 | H22: 1
A23: 15 | B23: 3 | C23: 13 | D23: 7 | E23: 0 | F23: 2
A24: 16 | B24: 5 | C24: 3 | D24: 7 | E24: 2 | F24: 1
A25: 17 | B25: 5 | C25: 1 | D25: 10 | E25: 0 | F25: 3 | H25: 2
A26: 18 | B26: 4 | C26: 9 | D26: 10 | E26: 0 | F26: 3 | H26: 2
A27: Totals | B27: =IF(B2="","",SUM(B9:B26)) -> 72 | D27: =IF(B2="","",SUM(D9:D26)) -> 144 | E27: =IF(B2="","",SUM(E9:E26)) -> 9 | F27: =IF(B2="","",SUM(F9:F26)) -> 42 | G27: =IF(B2="","",SUM(G9:G26)) -> 4 | H27: =IF(B2="","",SUM(H9:H26)) -> 12 | I27: =IF(COUNTIF(I9:I26,"=Yes")=0,"",COUNTIF(I9:I26,"=Yes")) -> 3