A1: Jeff Gibbons
A2: Club | B2: Broke Hill
A3: Par/SS | B3: 72/72 | D3: Num. Of Fairways | I3: =IF(B2="","",18-(COUNTIF(B9:B26,3))) -> 14
A4: Date | B4: 38242 | D4: Playing Handicap | I4: 20.900000000002002
A5: Event Place | B5: 1 | D5: Prize Money | G5: 10000
A6: Game Stats | B6: DB+ | C6: DB | D6: Bi | E6: P | F6: B | G6: E | H6: A | I6: H1
B7: 6 | C7: 0 | D7: 10 | E7: 2 | F7: 0 | G7: 0 | H7: 0 | I7: 0
A8: Hole No | B8: Par | C8: Stroke Index | D8: Gross Score | E8: Points | F8: Putts | G8: Fairways | H8: Ferrets | I8: Green Regulation
A9: 1 | B9: 4 | C9: 13 | D9: 8 | E9: 0 | F9: 1 | G9: 1
A10: 2 | B10: 4 | C10: 9 | D10: 5 | E10: 2 | F10: 2 | I10: Yes
A11: 3 | B11: 5 | C11: 3 | D11: 6 | E11: 3 | F11: 1 | I11: Yes
A12: 4 | B12: 3 | C12: 15 | D12: 6 | E12: 0 | F12: 1
A13: 5 | B13: 4 | C13: 11 | D13: 5 | E13: 2 | F13: 2 | I13: Yes
A14: 6 | B14: 4 | C14: 1 | D14: 7 | E14: 1 | F14: 2 | H14: 1
A15: 7 | B15: 4 | C15: 7 | D15: 5 | E15: 2 | F15: 1
A16: 8 | B16: 3 | C16: 17 | D16: 4 | E16: 2 | F16: 2 | I16: Yes
A17: 9 | B17: 5 | C17: 5 | D17: 5 | E17: 3 | F17: 0
A18: 10 | B18: 4 | C18: 12 | D18: 5 | E18: 2 | F18: 1 | G18: 1
A19: 11 | B19: 3 | C19: 18 | D19: 4 | E19: 2 | F19: 2 | I19: Yes
A20: 12 | B20: 5 | C20: 4 | D20: 8 | E20: 0 | F20: 2
A21: 13 | B21: 4 | C21: 8 | D21: 4 | E21: 3 | F21: 1 | I21: Yes
A22: 14 | B22: 4 | C22: 14 | D22: 5 | E22: 2 | F22: 2 | I22: Yes
A23: 15 | B23: 5 | C23: 2 | D23: 6 | E23: 3 | F23: 1 | I23: Yes
A24: 16 | B24: 4 | C24: 16 | D24: 5 | E24: 2 | F24: 1
A25: 17 | B25: 3 | C25: 6 | D25: 6 | E25: 0 | F25: 3
A26: 18 | B26: 4 | C26: 10 | D26: 9 | E26: 0 | F26: 2
A27: Totals | B27: =IF(B2="","",SUM(B9:B26)) -> 72 | D27: =IF(B2="","",SUM(D9:D26)) -> 103 | E27: =IF(B2="","",SUM(E9:E26)) -> 29 | F27: =IF(B2="","",SUM(F9:F26)) -> 27 | G27: =IF(B2="","",SUM(G9:G26)) -> 2 | H27: =IF(B2="","",SUM(H9:H26)) -> 1 | I27: =IF(COUNTIF(I9:I26,"=Yes")=0,"",COUNTIF(I9:I26,"=Yes")) -> 8