A1: Jeff Gibbons
A2: Club | B2: Wildwood B&C
A3: Par/SS | B3: 72 | D3: Num. Of Fairways | I3: =IF(B2="","",18-(COUNTIF(B9:B26,3))) -> 14
A4: Date | B4: 38247 | D4: Playing Handicap | I4: 21.000000000002004
A5: Event Place | B5: 4 | C5: M | D5: Prize Money | G5: 13750
A6: Game Stats | B6: DB+ | C6: DB | D6: Bi | E6: P | F6: B | G6: E | H6: A | I6: H1
B7: 5 | C7: 5 | D7: 8 | E7: 0 | F7: 0 | G7: 0 | H7: 0 | I7: 0
A8: Hole No | B8: Par | C8: Stroke Index | D8: Gross Score | E8: Points | F8: Putts | G8: Fairways | H8: Ferrets | I8: Green Regulation
A9: 1 | B9: 5 | C9: 12 | D9: 8 | E9: 0 | F9: 2
A10: 2 | B10: 4 | C10: 8 | D10: 5 | E10: 2 | F10: 1 | G10: 1
A11: 3 | B11: 3 | C11: 6 | D11: 6 | E11: 0 | F11: 2 | H11: 1
A12: 4 | B12: 4 | C12: 2 | D12: 6 | E12: 2 | F12: 1 | H12: 1
A13: 5 | B13: 4 | C13: 10 | D13: 6 | E13: 1 | F13: 3 | I13: Yes
A14: 6 | B14: 4 | C14: 4 | D14: 5 | E14: 2 | F14: 2 | I14: Yes
A15: 7 | B15: 3 | C15: 18 | D15: 4 | E15: 2 | F15: 2 | I15: Yes
A16: 8 | B16: 4 | C16: 14 | D16: 6 | E16: 1 | F16: 2
A17: 9 | B17: 5 | C17: 16 | D17: 6 | E17: 2 | F17: 2 | I17: Yes
A18: 10 | B18: 4 | C18: 11 | D18: 10 | E18: 0 | F18: 3 | G18: 1 | H18: 1
A19: 11 | B19: 3 | C19: 17 | D19: 4 | E19: 2 | F19: 2 | I19: Yes
A20: 12 | B20: 4 | C20: 7 | D20: 7 | E20: 0 | F20: 3 | G20: 1
A21: 13 | B21: 4 | C21: 15 | D21: 5 | E21: 2 | F21: 2 | I21: Yes
A22: 14 | B22: 4 | C22: 5 | D22: 7 | E22: 0 | F22: 2 | G22: 1
A23: 15 | B23: 3 | C23: 13 | D23: 4 | E23: 2 | F23: 1
A24: 16 | B24: 5 | C24: 3 | D24: 6 | E24: 3 | F24: 2 | I24: Yes
A25: 17 | B25: 5 | C25: 1 | D25: 7 | E25: 2 | F25: 2 | I25: Yes
A26: 18 | B26: 4 | C26: 9 | D26: 6 | E26: 1 | F26: 2
A27: Totals | B27: =IF(B2="","",SUM(B9:B26)) -> 72 | D27: =IF(B2="","",SUM(D9:D26)) -> 108 | E27: =IF(B2="","",SUM(E9:E26)) -> 24 | F27: =IF(B2="","",SUM(F9:F26)) -> 36 | G27: =IF(B2="","",SUM(G9:G26)) -> 4 | H27: =IF(B2="","",SUM(H9:H26)) -> 3 | I27: =IF(COUNTIF(I9:I26,"=Yes")=0,"",COUNTIF(I9:I26,"=Yes")) -> 8