A1: Simon Thompson
A2: Club | B2: Wildwood B&C
A3: Par/SS | B3: 72 | D3: Num. Of Fairways | I3: =IF(B2="","",18-(COUNTIF(B9:B26,3))) -> 14
A4: Date | B4: 38247 | D4: Playing Handicap | I4: 14.9
A5: Event Place | B5: 1 | C5: M | D5: Prize Money | G5: 25000
A6: Game Stats | B6: DB+ | C6: DB | D6: Bi | E6: P | F6: B | G6: E | H6: A | I6: H1
B7: 3 | C7: 2 | D7: 5 | E7: 8 | F7: 0 | G7: 0 | H7: 0 | I7: 0
A8: Hole No | B8: Par | C8: Stroke Index | D8: Gross Score | E8: Points | F8: Putts | G8: Fairways | H8: Ferrets | I8: Green Regulation
A9: 1 | B9: 5 | C9: 12 | D9: 5 | E9: 3 | F9: 2 | G9: 1 | I9: Yes
A10: 2 | B10: 4 | C10: 8 | D10: 5 | E10: 2 | F10: 2 | I10: Yes
A11: 3 | B11: 3 | C11: 6 | D11: 3 | E11: 3 | F11: 2 | I11: Yes
A12: 4 | B12: 4 | C12: 2 | D12: 9 | E12: 0 | F12: 2
A13: 5 | B13: 4 | C13: 10 | D13: 4 | E13: 3 | F13: 1 | G13: 1 | I13: Yes
A14: 6 | B14: 4 | C14: 4 | D14: 4 | E14: 3 | F14: 2 | G14: 1 | I14: Yes
A15: 7 | B15: 3 | C15: 18 | D15: 4 | E15: 1 | F15: 2
A16: 8 | B16: 4 | C16: 14 | D16: 6 | E16: 1 | F16: 2
A17: 9 | B17: 5 | C17: 16 | D17: 5 | E17: 2 | F17: 1 | G17: 1
A18: 10 | B18: 4 | C18: 11 | D18: 5 | E18: 2 | F18: 1 | G18: 1
A19: 11 | B19: 3 | C19: 17 | D19: 3 | E19: 2 | F19: 2 | I19: Yes
A20: 12 | B20: 4 | C20: 7 | D20: 5 | E20: 2 | F20: 2 | G20: 1 | I20: Yes
A21: 13 | B21: 4 | C21: 15 | D21: 4 | E21: 3 | F21: 2 | I21: Yes
A22: 14 | B22: 4 | C22: 5 | D22: 6 | E22: 1 | F22: 2
A23: 15 | B23: 3 | C23: 13 | D23: 3 | E23: 3 | F23: 1 | I23: Yes
A24: 16 | B24: 5 | C24: 3 | D24: 6 | E24: 2 | F24: 2 | H24: 1 | I24: Yes
A25: 17 | B25: 5 | C25: 1 | D25: 10 | E25: 0 | F25: 3 | H25: 1
A26: 18 | B26: 4 | C26: 9 | D26: 10 | E26: 0 | F26: 3 | H26: 2
A27: Totals | B27: =IF(B2="","",SUM(B9:B26)) -> 72 | D27: =IF(B2="","",SUM(D9:D26)) -> 97 | E27: =IF(B2="","",SUM(E9:E26)) -> 33 | F27: =IF(B2="","",SUM(F9:F26)) -> 34 | G27: =IF(B2="","",SUM(G9:G26)) -> 6 | H27: =IF(B2="","",SUM(H9:H26)) -> 4 | I27: =IF(COUNTIF(I9:I26,"=Yes")=0,"",COUNTIF(I9:I26,"=Yes")) -> 10