A1: Andrew Baldwin
A2: Club | B2: Horton Park
A3: Par/SS | B3: 70/69 | D3: Num. Of Fairways | I3: =IF(B2="","",18-(COUNTIF(B9:B26,3))) -> 12
A4: Date | B4: 41727 | D4: Playing Handicap | I4: 20
A5: Event Place | B5: 8 | C5: M | D5: Prize Money | G5: 28750
A6: Game Stats | B6: DB+ | C6: DB | D6: Bi | E6: P | F6: B | G6: E | H6: A | I6: H1
B7: 4 | C7: 4 | D7: 7 | E7: 3 | F7: 0 | G7: 0 | H7: 0 | I7: 0
A8: Hole No | B8: Par | C8: Stroke Index | D8: Gross Score | E8: Points | F8: Putts | G8: Fairways | H8: Ferrets | I8: Green Regulation
A9: 1 | B9: 3 | C9: 12 | D9: 4 | E9: 2 | F9: 1
A10: 2 | B10: 4 | C10: 6 | D10: 7 | E10: 0 | F10: 2
A11: 3 | B11: 5 | C11: 2 | D11: 6 | E11: 3 | F11: 2 | I11: Yes
A12: 4 | B12: 3 | C12: 10 | D12: 4 | E12: 2 | F12: 2 | I12: Yes
A13: 5 | B13: 5 | C13: 14 | D13: 7 | E13: 1 | F13: 2 | G13: 1
A14: 6 | B14: 4 | C14: 16 | D14: 7 | E14: 0 | F14: 2
A15: 7 | B15: 4 | C15: 18 | D15: 4 | E15: 3 | F15: 1 | G15: 1 | I15: Yes
A16: 8 | B16: 5 | C16: 4 | D16: 6 | E16: 2 | F16: 2 | G16: 1 | I16: Yes
A17: 9 | B17: 3 | C17: 8 | D17: 4 | E17: 2 | F17: 2 | I17: Yes
A18: 10 | B18: 3 | C18: 7 | D18: 5 | E18: 1 | F18: 4 | I18: Yes
A19: 11 | B19: 5 | C19: 13 | D19: 6 | E19: 2 | F19: 1
A20: 12 | B20: 4 | C20: 3 | D20: 6 | E20: 1 | F20: 3 | I20: Yes
A21: 13 | B21: 4 | C21: 15 | D21: 4 | E21: 3 | F21: 2 | G21: 1 | I21: Yes
A22: 14 | B22: 4 | C22: 9 | D22: 6 | E22: 1 | F22: 3 | I22: Yes
A23: 15 | B23: 4 | C23: 5 | D23: 7 | E23: 0 | F23: 2 | G23: 1
A24: 16 | B24: 3 | C24: 17 | D24: 3 | E24: 3 | F24: 2 | I24: Yes
A25: 17 | B25: 4 | C25: 1 | D25: 8 | E25: 0 | F25: 1
A26: 18 | B26: 3 | C26: 11 | D26: 4 | E26: 2 | F26: 1
A27: Totals | B27: =IF(B2="","",SUM(B9:B26)) -> 70 | D27: =IF(B2="","",SUM(D9:D26)) -> 98 | E27: =IF(B2="","",SUM(E9:E26)) -> 28 | F27: =IF(B2="","",SUM(F9:F26)) -> 35 | G27: =IF(B2="","",SUM(G9:G26)) -> 5 | H27: =IF(B2="","",SUM(H9:H26)) -> 0 | I27: =IF(COUNTIF(I9:I26,"=Yes")=0,"",COUNTIF(I9:I26,"=Yes")) -> 10