A1: David Braithwaite
A2: Club | B2: Horton Park
A3: Par/SS | B3: 70/69 | D3: Num. Of Fairways | I3: =IF(B2="","",18-(COUNTIF(B9:B26,3))) -> 12
A4: Date | B4: 41727 | D4: Playing Handicap | I4: 12.6
A5: Event Place | B5: 5 | C5: M | D5: Prize Money | G5: 41250
A6: Game Stats | B6: DB+ | C6: DB | D6: BI | E6: P | F6: B | G6: E | H6: A | I6: H1
B7: 2 | C7: 7 | D7: 2 | E7: 6 | F7: 1 | G7: 0 | H7: 0 | I7: 0
A8: Hole No | B8: Par | C8: Stroke Index | D8: Gross Score | E8: Points | F8: Putts | G8: Fairways | H8: Ferrets | I8: Green Regulation
A9: 1 | B9: 3 | C9: 12 | D9: 3 | E9: 3 | F9: 2 | I9: Yes
A10: 2 | B10: 4 | C10: 6 | D10: 5 | E10: 2 | F10: 2 | I10: Yes
A11: 3 | B11: 5 | C11: 2 | D11: 7 | E11: 1 | F11: 2 | G11: 1
A12: 4 | B12: 3 | C12: 10 | D12: 5 | E12: 1 | F12: 2
A13: 5 | B13: 5 | C13: 14 | D13: 5 | E13: 2 | F13: 1
A14: 6 | B14: 4 | C14: 16 | D14: 4 | E14: 2 | F14: 2 | I14: Yes
A15: 7 | B15: 4 | C15: 18 | D15: 6 | E15: 0 | F15: 2 | G15: 1
A16: 8 | B16: 5 | C16: 4 | D16: 7 | E16: 1 | F16: 2
A17: 9 | B17: 3 | C17: 8 | D17: 10 | E17: 0 | F17: 3
A18: 10 | B18: 3 | C18: 7 | D18: 3 | E18: 3 | F18: 1 | I18: Yes
A19: 11 | B19: 5 | C19: 13 | D19: 5 | E19: 3 | F19: 2 | G19: 1 | I19: Yes
A20: 12 | B20: 4 | C20: 3 | D20: 6 | E20: 1 | F20: 2
A21: 13 | B21: 4 | C21: 15 | D21: 3 | E21: 3 | F21: 1 | I21: Yes
A22: 14 | B22: 4 | C22: 9 | D22: 4 | E22: 3 | F22: 1 | I22: Yes
A23: 15 | B23: 4 | C23: 5 | D23: 6 | E23: 1 | F23: 1
A24: 16 | B24: 3 | C24: 17 | D24: 6 | E24: 0 | F24: 2 | H24: 1
A25: 17 | B25: 4 | C25: 1 | D25: 5 | E25: 2 | F25: 2 | I25: Yes
A26: 18 | B26: 3 | C26: 11 | D26: 5 | E26: 1 | F26: 1
A27: Totals | B27: =IF(B2="","",SUM(B9:B26)) -> 70 | D27: =IF(B2="","",SUM(D9:D26)) -> 95 | E27: =IF(B2="","",SUM(E9:E26)) -> 29 | F27: =IF(B2="","",SUM(F9:F26)) -> 31 | G27: =IF(B2="","",SUM(G9:G26)) -> 3 | H27: =IF(B2="","",SUM(H9:H26)) -> 1 | I27: =IF(COUNTIF(I9:I26,"=Yes")=0,"",COUNTIF(I9:I26,"=Yes")) -> 8

A1: Dave Rouse
A2: Club | B2: Horton Park
A3: Par/SS | B3: 70/69 | D3: Num. Of Fairways | I3: =IF(B2="","",18-(COUNTIF(B9:B26,3))) -> 12
A4: Date | B4: 41727 | D4: Playing Handicap | I4: 25.8
A5: Event Place | B5: 19 | C5: M | D5: Prize Money | G5: 6250
A6: Game Stats | B6: DB+ | C6: DB | D6: Bi | E6: P | F6: B | G6: E | H6: A | I6: H1
B7: 8 | C7: 5 | D7: 4 | E7: 1 | F7: 0 | G7: 0 | H7: 0 | I7: 0
A8: Hole No | B8: Par | C8: Stroke Index | D8: Gross Score | E8: Points | F8: Putts | G8: Fairways | H8: Ferrets | I8: Green Regulation
A9: 1 | B9: 3 | C9: 12 | D9: 4 | E9: 2 | F9: 2 | I9: Yes
A10: 2 | B10: 4 | C10: 6 | D10: 5 | E10: 3 | F10: 2 | I10: Yes
A11: 3 | B11: 5 | C11: 2 | D11: 9 | E11: 0 | F11: 2
A12: 4 | B12: 3 | C12: 10 | D12: 5 | E12: 1 | F12: 2
A13: 5 | B13: 5 | C13: 14 | D13: 10 | E13: 0 | F13: 3 | H13: 1
A14: 6 | B14: 4 | C14: 16 | D14: 4 | E14: 3 | F14: 1 | G14: 1 | I14: Yes
A15: 7 | B15: 4 | C15: 18 | D15: 6 | E15: 1 | F15: 3 | I15: Yes
A16: 8 | B16: 5 | C16: 4 | D16: 8 | E16: 1 | F16: 2
A17: 9 | B17: 3 | C17: 8 | D17: 4 | E17: 3 | F17: 1 | I17: Yes
A18: 10 | B18: 3 | C18: 7 | D18: 4 | E18: 3 | F18: 3 | I18: Yes
A19: 11 | B19: 5 | C19: 13 | D19: 10 | E19: 0 | F19: 3 | G19: 1 | H19: 1
A20: 12 | B20: 4 | C20: 3 | D20: 8 | E20: 0 | F20: 3 | G20: 1
A21: 13 | B21: 4 | C21: 15 | D21: 6 | E21: 1 | F21: 2
A22: 14 | B22: 4 | C22: 9 | D22: 6 | E22: 1 | F22: 2
A23: 15 | B23: 4 | C23: 5 | D23: 10 | E23: 0 | F23: 3 | H23: 2
A24: 16 | B24: 3 | C24: 17 | D24: 10 | E24: 0 | F24: 3 | H24: 1
A25: 17 | B25: 4 | C25: 1 | D25: 10 | E25: 0 | F25: 2 | G25: 1
A26: 18 | B26: 3 | C26: 11 | D26: 5 | E26: 1 | F26: 2
A27: Totals | B27: =IF(B2="","",SUM(B9:B26)) -> 70 | D27: =IF(B2="","",SUM(D9:D26)) -> 124 | E27: =IF(B2="","",SUM(E9:E26)) -> 20 | F27: =IF(B2="","",SUM(F9:F26)) -> 41 | G27: =IF(B2="","",SUM(G9:G26)) -> 4 | H27: =IF(B2="","",SUM(H9:H26)) -> 5 | I27: =IF(COUNTIF(I9:I26,"=Yes")=0,"",COUNTIF(I9:I26,"=Yes")) -> 6