B1: Season 15 - April 14th 2013 to 31st March 2014
A2: MGA World Tour Driving Accuracy (Fairways Hit)
B3: Statistics updated | C3: =TODAY() -> 41729
A4: Pos | B4: Player | C4: Original Handicap | D4: Current Handicap | E4: Playing Handicap | F4: Played | G4: Total Number of Fairways | H4: Total Fairways Hit | I4: Fairway %
A5: 1 | B5: Dave Bingham | C5: 10.9 | D5: 11.400000000000999 | E5: =D5 -> 11.400000000000999 | F5: 4 | G5: 52 | H5: 29 | I5: =IF(F5=0,"0 %",ROUND((H5/G5)*100,2) &" %") -> 55.77 % | J5: Qualified
A6: 2 | B6: Martin Cox | C6: 13.7 | D6: 13.0 | E6: =D6 -> 13 | F6: 4 | G6: 53 | H6: 27 | I6: =IF(F6=0,"0 %",ROUND((H6/G6)*100,2) &" %") -> 50.94 % | J6: Qualified
A7: 3 | B7: Jon Press | C7: 14.5 | D7: 12.800000000000999 | E7: =D7 -> 12.800000000000999 | F7: 5 | G7: 68 | H7: 30 | I7: =IF(F7=0,"0 %",ROUND((H7/G7)*100,2) &" %") -> 44.12 % | J7: Qualified
A8: 4 | B8: Kevin Gallagher | C8: 15.8 | D8: 13.300000000001004 | E8: =D8 -> 13.300000000001004 | F8: 14 | G8: 186 | H8: 77 | I8: =IF(F8=0,"0 %",ROUND((H8/G8)*100,2) &" %") -> 41.4 % | J8: Qualified
A9: 5 | B9: Robert Thompson | C9: 10.1 | D9: 10.2 | E9: =D9 -> 10.2 | F9: 14 | G9: 186 | H9: 74 | I9: =IF(F9=0,"0 %",ROUND((H9/G9)*100,2) &" %") -> 39.78 % | J9: Qualified
A10: 6 | B10: Simon Thompson | C10: 9.2 | D10: 11.4 | E10: =D10 -> 11.4 | F10: 8 | G10: 109 | H10: 42 | I10: =IF(F10=0,"0 %",ROUND((H10/G10)*100,2) &" %") -> 38.53 % | J10: Qualified
A11: 7 | B11: David Archer | C11: 24.1 | D11: 21.7 | E11: =D11 -> 21.7 | F11: 5 | G11: 66 | H11: 25 | I11: =IF(F11=0,"0 %",ROUND((H11/G11)*100,2) &" %") -> 37.88 % | J11: Qualified
A12: 8 | B12: Dave Andrews | C12: 15.8 | D12: 15.7 | E12: =D12 -> 15.7 | F12: 6 | G12: 82 | H12: 31 | I12: =IF(F12=0,"0 %",ROUND((H12/G12)*100,2) &" %") -> 37.8 % | J12: Qualified
A13: 9 | B13: Dave Kewley (Wolfie) | C13: 22.0 | D13: 17.200000000001001 | E13: =D13 -> 17.200000000001001 | F13: 4 | G13: 53 | H13: 20 | I13: =IF(F13=0,"0 %",ROUND((H13/G13)*100,2) &" %") -> 37.74 % | J13: Qualified
A14: 10 | B14: Michael Trimmings | C14: 24.5 | D14: 20.4 | E14: =D14 -> 20.4 | F14: 7 | G14: 93 | H14: 35 | I14: =IF(F14=0,"0 %",ROUND((H14/G14)*100,2) &" %") -> 37.63 % | J14: Qualified
A15: 11 | B15: Steve Tilling | C15: 16.5 | D15: 16.3 | E15: =D15 -> 16.3 | F15: 3 | G15: 41 | H15: 15 | I15: =IF(F15=0,"0 %",ROUND((H15/G15)*100,2) &" %") -> 36.59 % | J15: Qualified
A16: 12 | B16: Jeff Colbrook | C16: 15.5 | D16: 17.4 | E16: =D16 -> 17.4 | F16: 5 | G16: 66 | H16: 24 | I16: =IF(F16=0,"0 %",ROUND((H16/G16)*100,2) &" %") -> 36.36 % | J16: Qualified
A17: 13 | B17: Matthew Carter | C17: 16.7 | D17: 16.4 | E17: =D17 -> 16.4 | F17: 7 | G17: 89 | H17: 31 | I17: =IF(F17=0,"0 %",ROUND((H17/G17)*100,2) &" %") -> 34.83 % | J17: Qualified
A18: 14 | B18: Andrew Baldwin | C18: 20.1 | D18: 20.100000000001003 | E18: =D18 -> 20.100000000001003 | F18: 4 | G18: 53 | H18: 17 | I18: =IF(F18=0,"0 %",ROUND((H18/G18)*100,2) &" %") -> 32.08 % | J18: Qualified
A19: 15 | B19: Keith Mendelson | C19: 15.2 | D19: 12.0 | E19: =D19 -> 12 | F19: 6 | G19: 91 | H19: 29 | I19: =IF(F19=0,"0 %",ROUND((H19/G19)*100,2) &" %") -> 31.87 % | J19: Qualified
A20: 16 | B20: Paul Baldwin | C20: 21.1 | D20: 20.500000000001002 | E20: =D20 -> 20.500000000001002 | F20: 5 | G20: 67 | H20: 21 | I20: =IF(F20=0,"0 %",ROUND((H20/G20)*100,2) &" %") -> 31.34 % | J20: Qualified
A21: 17 | B21: David Braithwaite | C21: 12.1 | D21: 12.7 | E21: =D21 -> 12.7 | F21: 6 | G21: 81 | H21: 24 | I21: =IF(F21=0,"0 %",ROUND((H21/G21)*100,2) &" %") -> 29.63 % | J21: Qualified
A22: 18 | B22: Jon Dey | C22: 26.6 | D22: 23.9 | E22: =D22 -> 23.9 | F22: 8 | G22: 110 | H22: 32 | I22: =IF(F22=0,"0 %",ROUND((H22/G22)*100,2) &" %") -> 29.09 % | J22: Qualified
A23: 19 | B23: Dave Rouse | C23: 25.8 | D23: 26.3 | E23: =D23 -> 26.3 | F23: 7 | G23: 94 | H23: 27 | I23: =IF(F23=0,"0 %",ROUND((H23/G23)*100,2) &" %") -> 28.72 % | J23: Qualified
A24: 20 | B24: Alan Hopkins | C24: 7.7 | D24: 8.1 | E24: =D24 -> 8.1 | F24: 3 | G24: 39 | H24: 10 | I24: =IF(F24=0,"0 %",ROUND((H24/G24)*100,2) &" %") -> 25.64 % | J24: Qualified
A25: 21 | B25: Roy Dickens | C25: 30.8 | D25: 29.8 | E25: =D25 -> 29.8 | F25: 6 | G25: 80 | H25: 19 | I25: =IF(F25=0,"0 %",ROUND((H25/G25)*100,2) &" %") -> 23.75 % | J25: Qualified
A26: 22 | B26: Paul Carter | C26: 14.0 | D26: 14.5 | E26: =D26 -> 14.5 | F26: 8 | G26: 105 | H26: 24 | I26: =IF(F26=0,"0 %",ROUND((H26/G26)*100,2) &" %") -> 22.86 % | J26: Qualified
A27: 23 | B27: Simon Owens | C27: 14.5 | D27: 14.800000000000999 | E27: =D27 -> 14.800000000000999 | F27: 3 | G27: 41 | H27: 9 | I27: =IF(F27=0,"0 %",ROUND((H27/G27)*100,2) &" %") -> 21.95 % | J27: Qualified
A28: 24 | B28: Ian Edwards | C28: 14.5 | D28: 15.4 | E28: =D28 -> 15.4 | F28: 7 | G28: 96 | H28: 18 | I28: =IF(F28=0,"0 %",ROUND((H28/G28)*100,2) &" %") -> 18.75 % | J28: Qualified
A29: 25 | B29: Alan Baldwin | C29: 20.9 | D29: 21.1 | E29: =D29 -> 21.1 | F29: 2 | G29: 28 | H29: 17 | I29: =IF(F29=0,"0 %",ROUND((H29/G29)*100,2) &" %") -> 60.71 %
A30: 26 | B30: Martin Bould | C30: 14.8 | D30: 16.0 | E30: =D30 -> 16 | F30: 2 | G30: 27 | H30: 11 | I30: =IF(F30=0,"0 %",ROUND((H30/G30)*100,2) &" %") -> 40.74 %
A31: 27 | B31: Chris Manning | C31: 22.8 | D31: 22.9 | E31: =D31 -> 22.9 | F31: 1 | G31: 13 | H31: 3 | I31: =IF(F31=0,"0 %",ROUND((H31/G31)*100,2) &" %") -> 23.08 %
B32: Malcolm Rouse | C32: 44.9 | D32: 44.9 | E32: =D32 -> 44.9 | F32: 0 | H32: 0 | I32: =IF(F32=0,"0 %",ROUND((H32/G32)*100,2) &" %") -> 0 %
B33: Dave White | C33: 21.5 | D33: 21.5 | E33: =D33 -> 21.5 | F33: 0 | H33: 0 | I33: =IF(F33=0,"0 %",ROUND((H33/G33)*100,2) &" %") -> 0 %
B34: Clive Ferris | C34: 26.0 | D34: 26.0 | E34: =D34 -> 26 | F34: 0 | H34: 0 | I34: =IF(F34=0,"0 %",ROUND((H34/G34)*100,2) &" %") -> 0 %
B35: Andy Benson | C35: 6.3 | D35: 6.3 | E35: =D35 -> 6.3 | F35: 0 | H35: 0 | I35: =IF(F35=0,"0 %",ROUND((H35/G35)*100,2) &" %") -> 0 %