B1: Season 15 - April 14th 2013 to 31st March 2014
A2: MGA World Tour Putting Statistics
B3: Statistics updated | C3: =TODAY() -> 41554
A4: Pos | B4: Player | C4: Original Handicap | D4: Current Handicap | E4: Playing Handicap | F4: Played | G4: Total Putts | H4: Ave per Round | I4: Ave Per Hole | J4: Best Round | K4: Worst Round
A5: 1 | B5: David Braithwaite | C5: 12.1 | D5: 12.6 | E5: =D5 -> 12.6 | F5: 5 | G5: 151 | H5: 30.20 | I5: =IF(G5=0,"",G5/(F5*18)) -> 1.6777777777777778 | J5: 28 | K5: 32 | L5: Qualified
A6: 2 | B6: Martin Cox | C6: 13.7 | D6: 12.8 | E6: =D6 -> 12.8 | F6: 3 | G6: 94 | H6: 31.333333333333332 | I6: =IF(G6=0,"",G6/(F6*18)) -> 1.7407407407407407 | J6: 28 | K6: 37 | L6: Qualified
A7: 3 | B7: Dave Kewley (Wolfie) | C7: 22.0 | D7: 17.1 | E7: =D7 -> 17.1 | F7: 3 | G7: 96 | H7: 32.00 | I7: =IF(G7=0,"",G7/(F7*18)) -> 1.7777777777777777 | J7: 23 | K7: 39 | L7: Qualified
A8: 4 | B8: Ian Edwards | C8: 14.5 | D8: 15.6 | E8: =D8 -> 15.6 | F8: 6 | G8: 195 | H8: 32.50 | I8: =IF(G8=0,"",G8/(F8*18)) -> 1.8055555555555556 | J8: 28 | K8: 36 | L8: Qualified
A9: 5 | B9: Dave Bingham | C9: 10.9 | D9: 11.3 | E9: =D9 -> 11.3 | F9: 3 | G9: 98 | H9: 32.666666666666664 | I9: =IF(G9=0,"",G9/(F9*18)) -> 1.8148148148148149 | J9: 31 | K9: 35 | L9: Qualified
A10: 6 | B10: Simon Owens | C10: 14.5 | D10: 14.800000000000999 | E10: =D10 -> 14.800000000000999 | F10: 3 | G10: 99 | H10: 33.00 | I10: =IF(G10=0,"",G10/(F10*18)) -> 1.8333333333333333 | J10: 32 | K10: 34 | L10: Qualified
A11: 7 | B11: Dave Andrews | C11: 15.8 | D11: 15.6 | E11: =D11 -> 15.6 | F11: 5 | G11: 166 | H11: 33.20 | I11: =IF(G11=0,"",G11/(F11*18)) -> 1.8444444444444446 | J11: 30 | K11: 39 | L11: Qualified
A12: 8 | B12: Keith Mendelson | C12: 15.2 | D12: 11.8 | E12: =D12 -> 11.8 | F12: 5 | G12: 168 | H12: 33.60 | I12: =IF(G12=0,"",G12/(F12*18)) -> 1.8666666666666667 | J12: 29 | K12: 39 | L12: Qualified
A13: 9 | B13: Robert Thompson | C13: 10.1 | D13: 9.2 | E13: =D13 -> 9.2 | F13: 13 | G13: 437 | H13: 33.615384615384613 | I13: =IF(G13=0,"",G13/(F13*18)) -> 1.8675213675213675 | J13: 30 | K13: 37 | L13: Qualified
A14: 10 | B14: Kevin Gallagher | C14: 15.8 | D14: 13.000000000001005 | E14: =D14 -> 13.000000000001005 | F14: 12 | G14: 408 | H14: 34.00 | I14: =IF(G14=0,"",G14/(F14*18)) -> 1.8888888888888888 | J14: 28 | K14: 40 | L14: Qualified
A15: 11 | B15: Jon Dey | C15: 26.6 | D15: 23.8 | E15: =D15 -> 23.8 | F15: 7 | G15: 238 | H15: 34.00 | I15: =IF(G15=0,"",G15/(F15*18)) -> 1.8888888888888888 | J15: 30 | K15: 36 | L15: Qualified
A16: 12 | B16: Matthew Carter | C16: 16.7 | D16: 16.2 | E16: =D16 -> 16.2 | F16: 6 | G16: 205 | H16: 34.166666666666664 | I16: =IF(G16=0,"",G16/(F16*18)) -> 1.8981481481481481 | J16: 30 | K16: 38 | L16: Qualified
A17: 13 | B17: Paul Baldwin | C17: 21.1 | D17: 20.4 | E17: =D17 -> 20.4 | F17: 4 | G17: 137 | H17: 34.25 | I17: =IF(G17=0,"",G17/(F17*18)) -> 1.9027777777777777 | J17: 27 | K17: 38 | L17: Qualified
A18: 14 | B18: Jon Press | C18: 14.5 | D18: 13.800000000000999 | E18: =D18 -> 13.800000000000999 | F18: 4 | G18: 139 | H18: 34.75 | I18: =IF(G18=0,"",G18/(F18*18)) -> 1.9305555555555556 | J18: 33 | K18: 36 | L18: Qualified
A19: 15 | B19: Steve Tilling | C19: 16.5 | D19: 16.3 | E19: =D19 -> 16.3 | F19: 3 | G19: 105 | H19: 35.00 | I19: =IF(G19=0,"",G19/(F19*18)) -> 1.9444444444444444 | J19: 34 | K19: 36 | L19: Qualified
A20: 16 | B20: Paul Carter | C20: 14.0 | D20: 13.8 | E20: =D20 -> 13.8 | F20: 6 | G20: 211 | H20: 35.166666666666664 | I20: =IF(G20=0,"",G20/(F20*18)) -> 1.9537037037037037 | J20: 33 | K20: 38 | L20: Qualified
A21: 17 | B21: Simon Thompson | C21: 9.2 | D21: 11.2 | E21: =D21 -> 11.2 | F21: 7 | G21: 248 | H21: 35.428571428571431 | I21: =IF(G21=0,"",G21/(F21*18)) -> 1.9682539682539681 | J21: 32 | K21: 41 | L21: Qualified
A22: 18 | B22: Jeff Colbrook | C22: 15.5 | D22: 17.2 | E22: =D22 -> 17.2 | F22: 4 | G22: 142 | H22: 35.50 | I22: =IF(G22=0,"",G22/(F22*18)) -> 1.9722222222222223 | J22: 34 | K22: 38 | L22: Qualified
A23: 19 | B23: Dave Rouse | C23: 25.8 | D23: 25.8 | E23: =D23 -> 25.8 | F23: 6 | G23: 213 | H23: 35.50 | I23: =IF(G23=0,"",G23/(F23*18)) -> 1.9722222222222223 | J23: 30 | K23: 40 | L23: Qualified
A24: 20 | B24: Michael Trimmings | C24: 24.5 | D24: 20.3 | E24: =D24 -> 20.3 | F24: 6 | G24: 213 | H24: 35.50 | I24: =IF(G24=0,"",G24/(F24*18)) -> 1.9722222222222223 | J24: 29 | K24: 41 | L24: Qualified
A25: 21 | B25: Roy Dickens | C25: 30.8 | D25: 30.4 | E25: =D25 -> 30.4 | F25: 5 | G25: 179 | H25: 35.80 | I25: =IF(G25=0,"",G25/(F25*18)) -> 1.9888888888888889 | J25: 28 | K25: 40 | L25: Qualified
A26: 22 | B26: Andrew Baldwin | C26: 20.1 | D26: 20.0 | E26: =D26 -> 20 | F26: 3 | G26: 112 | H26: 37.333333333333336 | I26: =IF(G26=0,"",G26/(F26*18)) -> 2.074074074074074 | J26: 35 | K26: 39 | L26: Qualified
A27: 23 | B27: David Archer | C27: 24.1 | D27: 21.2 | E27: =D27 -> 21.2 | F27: 4 | G27: 152 | H27: 38.00 | I27: =IF(G27=0,"",G27/(F27*18)) -> 2.1111111111111112 | J27: 36 | K27: 40 | L27: Qualified
A28: 24 | B28: Martin Bould | C28: 14.8 | D28: 16.0 | E28: =D28 -> 16 | F28: 2 | G28: 79 | H28: 39.50 | I28: =IF(G28=0,"",G28/(F28*18)) -> 2.1944444444444446 | J28: 35 | K28: 44
A29: 25 | B29: Alan Baldwin | C29: 20.9 | D29: 21.1 | E29: =D29 -> 21.1 | F29: 2 | G29: 68 | H29: 34.00 | I29: =IF(G29=0,"",G29/(F29*18)) -> 1.8888888888888888 | J29: 31 | K29: 37
A30: 26 | B30: Chris Manning | C30: 22.8 | D30: 22.9 | E30: =D30 -> 22.9 | F30: 1 | G30: 34 | H30: 34.00 | I30: =IF(G30=0,"",G30/(F30*18)) -> 1.8888888888888888 | J30: 34 | K30: 34
A31: 27 | B31: Alan Hopkins | C31: 7.7 | D31: 7.9 | E31: =D31 -> 7.9 | F31: 2 | G31: 71 | H31: 35.50 | I31: =IF(G31=0,"",G31/(F31*18)) -> 1.9722222222222223 | J31: 35 | K31: 36
B32: Andy Benson | C32: 6.3 | D32: 6.3 | E32: =D32 -> 6.3 | F32: 0 | G32: 0 | H32: 0.00 | I32: =IF(G32=0,"",G32/(F32*18)) ->  | J32: 0 | K32: 0
B33: Clive Ferris | C33: 26.0 | D33: 26.0 | E33: =D33 -> 26 | F33: 0 | G33: 0 | H33: 0.00 | I33: =IF(G33=0,"",G33/(F33*18)) ->  | J33: 0 | K33: 0
B34: Dave White | C34: 21.5 | D34: 21.5 | E34: =D34 -> 21.5 | F34: 0 | G34: 0 | H34: 0.00 | I34: =IF(G34=0,"",G34/(F34*18)) ->  | J34: 0 | K34: 0
B35: Malcolm Rouse | C35: 44.9 | D35: 44.9 | E35: =D35 -> 44.9 | F35: 0 | G35: 0 | H35: 0.00 | I35: =IF(G35=0,"",G35/(F35*18)) ->  | J35: 0 | K35: 0

B1: Season 15 - April 14th 2013 to 31st March 2014
A2: MGA World Tour Putting Statistics
B3: Statistics updated | C3: =TODAY() -> 41729
A4: Pos | B4: Player | C4: Original Handicap | D4: Current Handicap | E4: Playing Handicap | F4: Played | G4: Total Putts | H4: Ave per Round | I4: Ave Per Hole | J4: Best Round | K4: Worst Round
A5: 1 | B5: Dave Bingham | C5: 10.9 | D5: 11.400000000000999 | E5: =D5 -> 11.400000000000999 | F5: 4 | G5: 130 | H5: 32.50 | I5: =IF(G5=0,"",G5/(F5*18)) -> 1.8055555555555556 | J5: 31 | K5: 35 | L5: Qualified
A6: 2 | B6: Martin Cox | C6: 13.7 | D6: 13.0 | E6: =D6 -> 13 | F6: 4 | G6: 132 | H6: 33.00 | I6: =IF(G6=0,"",G6/(F6*18)) -> 1.8333333333333333 | J6: 28 | K6: 38 | L6: Qualified
A7: 3 | B7: Simon Owens | C7: 14.5 | D7: 14.800000000000999 | E7: =D7 -> 14.800000000000999 | F7: 3 | G7: 99 | H7: 33.00 | I7: =IF(G7=0,"",G7/(F7*18)) -> 1.8333333333333333 | J7: 32 | K7: 34 | L7: Qualified
A8: 4 | B8: Paul Carter | C8: 14.0 | D8: 14.5 | E8: =D8 -> 14.5 | F8: 8 | G8: 277 | H8: 34.625 | I8: =IF(G8=0,"",G8/(F8*18)) -> 1.9236111111111112 | J8: 31 | K8: 38 | L8: Qualified
A9: 5 | B9: Steve Tilling | C9: 16.5 | D9: 16.3 | E9: =D9 -> 16.3 | F9: 3 | G9: 105 | H9: 35.00 | I9: =IF(G9=0,"",G9/(F9*18)) -> 1.9444444444444444 | J9: 34 | K9: 36 | L9: Qualified
A10: 6 | B10: Simon Thompson | C10: 9.2 | D10: 11.4 | E10: =D10 -> 11.4 | F10: 8 | G10: 283 | H10: 35.375 | I10: =IF(G10=0,"",G10/(F10*18)) -> 1.9652777777777777 | J10: 32 | K10: 41 | L10: Qualified
A11: 7 | B11: Roy Dickens | C11: 30.8 | D11: 29.8 | E11: =D11 -> 29.8 | F11: 6 | G11: 222 | H11: 37.00 | I11: =IF(G11=0,"",G11/(F11*18)) -> 2.0555555555555554 | J11: 28 | K11: 43 | L11: Qualified
A12: 8 | B12: Alan Hopkins | C12: 7.7 | D12: 8.1 | E12: =D12 -> 8.1 | F12: 3 | G12: 114 | H12: 38.00 | I12: =IF(G12=0,"",G12/(F12*18)) -> 2.1111111111111112 | J12: 35 | K12: 43 | L12: Qualified
A13: 9 | B13: David Archer | C13: 24.1 | D13: 21.7 | E13: =D13 -> 21.7 | F13: 5 | G13: 191 | H13: 38.20 | I13: =IF(G13=0,"",G13/(F13*18)) -> 2.1222222222222222 | J13: 36 | K13: 40 | L13: Qualified
A14: 10 | B14: David Braithwaite | C14: 12.1 | D14: 12.7 | E14: =D14 -> 12.7 | F14: 6 | G14: 182 | H14: 30.333333333333332 | I14: =IF(G14=0,"",G14/(F14*18)) -> 1.6851851851851851 | J14: 28 | K14: 32 | L14: Qualified
A15: 11 | B15: Dave Kewley (Wolfie) | C15: 22.0 | D15: 17.200000000001001 | E15: =D15 -> 17.200000000001001 | F15: 4 | G15: 125 | H15: 31.25 | I15: =IF(G15=0,"",G15/(F15*18)) -> 1.7361111111111112 | J15: 23 | K15: 39 | L15: Qualified
A16: 12 | B16: Ian Edwards | C16: 14.5 | D16: 15.4 | E16: =D16 -> 15.4 | F16: 7 | G16: 230 | H16: 32.857142857142854 | I16: =IF(G16=0,"",G16/(F16*18)) -> 1.8253968253968254 | J16: 28 | K16: 36 | L16: Qualified
A17: 13 | B17: Jon Press | C17: 14.5 | D17: 12.800000000000999 | E17: =D17 -> 12.800000000000999 | F17: 5 | G17: 168 | H17: 33.60 | I17: =IF(G17=0,"",G17/(F17*18)) -> 1.8666666666666667 | J17: 29 | K17: 36 | L17: Qualified
A18: 14 | B18: Robert Thompson | C18: 10.1 | D18: 10.2 | E18: =D18 -> 10.2 | F18: 14 | G18: 475 | H18: 33.928571428571431 | I18: =IF(G18=0,"",G18/(F18*18)) -> 1.8849206349206349 | J18: 30 | K18: 38 | L18: Qualified
A19: 15 | B19: Dave Andrews | C19: 15.8 | D19: 15.7 | E19: =D19 -> 15.7 | F19: 6 | G19: 198 | H19: 33.00 | I19: =IF(G19=0,"",G19/(F19*18)) -> 1.8333333333333333 | J19: 30 | K19: 39 | L19: Qualified
A20: 16 | B20: Keith Mendelson | C20: 15.2 | D20: 12.0 | E20: =D20 -> 12 | F20: 6 | G20: 200 | H20: 33.333333333333336 | I20: =IF(G20=0,"",G20/(F20*18)) -> 1.8518518518518519 | J20: 29 | K20: 39 | L20: Qualified
A21: 17 | B21: Kevin Gallagher | C21: 15.8 | D21: 13.300000000001004 | E21: =D21 -> 13.300000000001004 | F21: 14 | G21: 471 | H21: 33.642857142857146 | I21: =IF(G21=0,"",G21/(F21*18)) -> 1.8690476190476191 | J21: 28 | K21: 40 | L21: Qualified
A22: 18 | B22: Jon Dey | C22: 26.6 | D22: 23.9 | E22: =D22 -> 23.9 | F22: 8 | G22: 273 | H22: 34.125 | I22: =IF(G22=0,"",G22/(F22*18)) -> 1.8958333333333333 | J22: 30 | K22: 36 | L22: Qualified
A23: 19 | B23: Matthew Carter | C23: 16.7 | D23: 16.4 | E23: =D23 -> 16.4 | F23: 7 | G23: 239 | H23: 34.142857142857146 | I23: =IF(G23=0,"",G23/(F23*18)) -> 1.8968253968253967 | J23: 30 | K23: 38 | L23: Qualified
A24: 20 | B24: Paul Baldwin | C24: 21.1 | D24: 20.500000000001002 | E24: =D24 -> 20.500000000001002 | F24: 5 | G24: 176 | H24: 35.20 | I24: =IF(G24=0,"",G24/(F24*18)) -> 1.9555555555555555 | J24: 27 | K24: 39 | L24: Qualified
A25: 21 | B25: Michael Trimmings | C25: 24.5 | D25: 20.4 | E25: =D25 -> 20.4 | F25: 7 | G25: 250 | H25: 35.714285714285715 | I25: =IF(G25=0,"",G25/(F25*18)) -> 1.9841269841269842 | J25: 29 | K25: 41 | L25: Qualified
A26: 22 | B26: Jeff Colbrook | C26: 15.5 | D26: 17.4 | E26: =D26 -> 17.4 | F26: 5 | G26: 180 | H26: 36.00 | I26: =IF(G26=0,"",G26/(F26*18)) -> 2.00 | J26: 34 | K26: 38 | L26: Qualified
A27: 23 | B27: Dave Rouse | C27: 25.8 | D27: 26.3 | E27: =D27 -> 26.3 | F27: 7 | G27: 254 | H27: 36.285714285714285 | I27: =IF(G27=0,"",G27/(F27*18)) -> 2.0158730158730158 | J27: 30 | K27: 41 | L27: Qualified
A28: 24 | B28: Andrew Baldwin | C28: 20.1 | D28: 20.100000000001003 | E28: =D28 -> 20.100000000001003 | F28: 4 | G28: 147 | H28: 36.75 | I28: =IF(G28=0,"",G28/(F28*18)) -> 2.0416666666666665 | J28: 35 | K28: 39 | L28: Qualified
A29: 25 | B29: Martin Bould | C29: 14.8 | D29: 16.0 | E29: =D29 -> 16 | F29: 2 | G29: 79 | H29: 39.50 | I29: =IF(G29=0,"",G29/(F29*18)) -> 2.1944444444444446 | J29: 35 | K29: 44
A30: 26 | B30: Alan Baldwin | C30: 20.9 | D30: 21.1 | E30: =D30 -> 21.1 | F30: 2 | G30: 68 | H30: 34.00 | I30: =IF(G30=0,"",G30/(F30*18)) -> 1.8888888888888888 | J30: 31 | K30: 37
A31: 27 | B31: Chris Manning | C31: 22.8 | D31: 22.9 | E31: =D31 -> 22.9 | F31: 1 | G31: 34 | H31: 34.00 | I31: =IF(G31=0,"",G31/(F31*18)) -> 1.8888888888888888 | J31: 34 | K31: 34
B32: Andy Benson | C32: 6.3 | D32: 6.3 | E32: =D32 -> 6.3 | F32: 0 | G32: 0 | H32: 0.00 | I32: =IF(G32=0,"",G32/(F32*18)) ->  | J32: 0 | K32: 0
B33: Clive Ferris | C33: 26.0 | D33: 26.0 | E33: =D33 -> 26 | F33: 0 | G33: 0 | H33: 0.00 | I33: =IF(G33=0,"",G33/(F33*18)) ->  | J33: 0 | K33: 0
B34: Dave White | C34: 21.5 | D34: 21.5 | E34: =D34 -> 21.5 | F34: 0 | G34: 0 | H34: 0.00 | I34: =IF(G34=0,"",G34/(F34*18)) ->  | J34: 0 | K34: 0
B35: Malcolm Rouse | C35: 44.9 | D35: 44.9 | E35: =D35 -> 44.9 | F35: 0 | G35: 0 | H35: 0.00 | I35: =IF(G35=0,"",G35/(F35*18)) ->  | J35: 0 | K35: 0