A1: Roy Dickens
A2: Club | B2: Portmarnock
A3: Par/SS | B3: 72/72 | D3: Num. Of Fairways | I3: =IF(B2="","",18-(COUNTIF(B9:B26,3))) -> 15
A4: Date | B4: 39262 | D4: Playing Handicap | I4: 31.2
A5: Event Place | B5: 1 | D5: Prize Money | G5: 5000
A6: Game Stats | B6: DB+ | C6: DB | D6: Bi | E6: P | F6: B | G6: E | H6: A | I6: H1
B7: 8 | C7: 4 | D7: 5 | E7: 1 | F7: 0 | G7: 0 | H7: 0 | I7: 0
A8: Hole No | B8: Par | C8: Stroke Index | D8: Gross Score | E8: Points | F8: Putts | G8: Fairways | H8: Ferrets | I8: Green Regulation
A9: 1 | B9: 4 | C9: 11 | D9: 7 | E9: 1 | F9: 2 | G9: 1
A10: 2 | B10: 4 | C10: 15 | D10: 7 | E10: 0 | F10: 1
A11: 3 | B11: 4 | C11: 13 | D11: 5 | E11: 3 | F11: 2 | I11: Yes
A12: 4 | B12: 4 | C12: 1 | D12: 8 | E12: 0 | F12: 2
A13: 5 | B13: 4 | C13: 5 | D13: 7 | E13: 1 | F13: 2
A14: 6 | B14: 5 | C14: 9 | D14: 8 | E14: 1 | F14: 2 | H14: 2
A15: 7 | B15: 3 | C15: 17 | D15: 4 | E15: 2 | F15: 2 | I15: Yes
A16: 8 | B16: 4 | C16: 7 | D16: 7 | E16: 1 | F16: 2
A17: 9 | B17: 4 | C17: 3 | D17: 6 | E17: 2 | F17: 2 | G17: 1 | H17: 1 | I17: Yes
A18: 10 | B18: 4 | C18: 8 | D18: 5 | E18: 3 | F18: 2 | G18: 1 | I18: Yes
A19: 11 | B19: 4 | C19: 6 | D19: 5 | E19: 3 | F19: 2 | I19: Yes
A20: 12 | B20: 3 | C20: 16 | D20: 3 | E20: 3 | F20: 1 | I20: Yes
A21: 13 | B21: 5 | C21: 14 | D21: 6 | E21: 2 | F21: 2 | I21: Yes
A22: 14 | B22: 4 | C22: 2 | D22: 6 | E22: 2 | F22: 2 | I22: Yes
A23: 15 | B23: 3 | C23: 12 | D23: 6 | E23: 1 | F23: 2
A24: 16 | B24: 5 | C24: 18 | D24: 8 | E24: 0 | F24: 2 | G24: 1
A25: 17 | B25: 4 | C25: 4 | D25: 6 | E25: 2 | F25: 2 | G25: 1 | I25: Yes
A26: 18 | B26: 4 | C26: 10 | D26: 6 | E26: 2 | F26: 3 | H26: 1 | I26: Yes
A27: Totals | B27: =IF(B2="","",SUM(B9:B26)) -> 72 | D27: =IF(B2="","",SUM(D9:D26)) -> 110 | E27: =IF(B2="","",SUM(E9:E26)) -> 29 | F27: =IF(B2="","",SUM(F9:F26)) -> 35 | G27: =IF(B2="","",SUM(G9:G26)) -> 5 | H27: =IF(B2="","",SUM(H9:H26)) -> 4 | I27: =IF(COUNTIF(I9:I26,"=Yes")=0,"",COUNTIF(I9:I26,"=Yes")) -> 10