B1: CHINNEY CHOO - 2003/2004
C3: Rousey Invitation 14/6/03 | D3: Mendy's Masters 26/7/03 | E3: Tubby Trophy 19/9/03 | F3: Bubble Open 24/10/03 | G3: Players Championship 6/2/04 | H3: Thommo Classic 29/3/04 | I3: Total
B4: EUROPE
B5: M Cox | C5: 33 | D5: 43 | E5: 31 | F5: 31 | G5: 22 | H5: 24 | I5: =SUM(C5:H5) -> 184
B6: R Thompson | C6: 32 | D6: 28 | E6: 23 | F6: 26 | G6: 19 | H6: 31 | I6: =SUM(C6:H6) -> 159
B7: M Bould | C7: 38 | D7: 44 | E7: 25 | F7: 0 | G7: 25 | H7: 0 | I7: =SUM(C7:H7) -> 132
B8: J Colbrook | C8: 41 | D8: 23 | E8: 0 | F8: 24 | G8: 26 | H8: 0 | I8: =SUM(C8:H8) -> 114
B9: D Marsh | C9: 32 | D9: 0 | E9: 15 | F9: 33 | G9: 27 | H9: 0 | I9: =SUM(C9:H9) -> 107
B10: J Gibbons | C10: 24 | D10: 29 | E10: 24 | F10: 0 | G10: 0 | H10: 25 | I10: =SUM(C10:H10) -> 102
B11: D Andrews | C11: 32 | D11: 0 | E11: 0 | F11: 27 | G11: 26 | H11: 0 | I11: =SUM(C11:H11) -> 85
B12: A Baldwin (Snr) | C12: 26 | D12: 35 | E12: 0 | F12: 0 | G12: 0 | H12: 23 | I12: =SUM(C12:H12) -> 84
B13: K Mendelson | C13: 26 | D13: 32 | E13: 25 | F13: 0 | G13: 0 | H13: 0 | I13: =SUM(C13:H13) -> 83
B14: A Baldwin (Jnr) | C14: 21 | D14: 32 | E14: 0 | F14: 0 | G14: 0 | H14: 21 | I14: =SUM(C14:H14) -> 74
B15: I Edwards | C15: 0 | D15: 0 | E15: 30 | F15: 0 | G15: 30 | H15: 0 | I15: =SUM(C15:H15) -> 60
B16: J Dey | C16: 0 | D16: 0 | E16: 31 | F16: 0 | G16: 0 | H16: 0 | I16: =SUM(C16:H16) -> 31
B17: R Dickens | C17: 0 | D17: 0 | E17: 0 | F17: 0 | G17: 0 | H17: 0 | I17: =SUM(C17:H17) -> 0
B18: S Owens | C18: 0 | D18: 0 | E18: 0 | F18: 0 | G18: 0 | H18: 0 | I18: =SUM(C18:H18) -> 0
B19: D White | C19: 0 | D19: 0 | E19: 0 | F19: 0 | G19: 0 | H19: 0 | I19: =SUM(C19:H19) -> 0
B20: D Archer | C20: 0 | D20: 0 | E20: 0 | F20: 0 | G20: 0 | H20: 0 | I20: =SUM(C20:H20) -> 0
C21: =SUM(C5:C20) -> 305 | D21: =SUM(D5:D20) -> 266 | E21: =SUM(E5:E20) -> 204 | F21: =SUM(F5:F20) -> 141 | G21: =SUM(G5:G20) -> 175 | H21: =SUM(H5:H20) -> 124 | I21: =SUM(I5:I20) -> 1215
B22: USA
B23: D Rouse | C23: 25 | D23: 34 | E23: 29 | F23: 30 | G23: 23 | H23: 38 | I23: =SUM(C23:H23) -> 179
B24: K Gallagher | C24: 36 | D24: 32 | E24: 31 | F24: 29 | G24: 0 | H24: 31 | I24: =SUM(C24:H24) -> 159
B25: P Carter | C25: 31 | D25: 32 | E25: 24 | F25: 0 | G25: 0 | H25: 37 | I25: =SUM(C25:H25) -> 124
B26: S Thompson | C26: 32 | D26: 32 | E26: 14 | F26: 0 | G26: 0 | H26: 30 | I26: =SUM(C26:H26) -> 108
B27: P Baldwin | C27: 33 | D27: 0 | E27: 32 | F27: 0 | G27: 0 | H27: 29 | I27: =SUM(C27:H27) -> 94
B28: J Press | C28: 34 | D28: 0 | E28: 30 | F28: 0 | G28: 0 | H28: 27 | I28: =SUM(C28:H28) -> 91
B29: K Johns | C29: 27 | D29: 0 | E29: 36 | F29: 0 | G29: 0 | H29: 0 | I29: =SUM(C29:H29) -> 63
B30: A Hopkins | C30: 24 | D30: 35 | E30: 0 | F30: 0 | G30: 0 | H30: 29 | I30: =SUM(C30:H30) -> 88
B31: C Manning | C31: 0 | D31: 32 | E31: 24 | F31: 0 | G31: 0 | H31: 0 | I31: =SUM(C31:H31) -> 56
B32: S Tilling | C32: 0 | D32: 0 | E32: 0 | F32: 0 | G32: 29 | H32: 0 | I32: =SUM(C32:H32) -> 29
B33: A Benson | C33: 28 | D33: 0 | E33: 0 | F33: 0 | G33: 0 | H33: 0 | I33: =SUM(C33:H33) -> 28
B34: C Ferris | C34: 0 | D34: 0 | E34: 26 | F34: 0 | G34: 0 | H34: 0 | I34: =SUM(C34:H34) -> 26
B35: M Trimmings | C35: 26 | D35: 0 | E35: 0 | F35: 0 | G35: 0 | H35: 0 | I35: =SUM(C35:H35) -> 26
B36: M Rouse | C36: 0 | D36: 0 | E36: 15 | F36: 0 | G36: 0 | H36: 0 | I36: =SUM(C36:H36) -> 15
B37: N Leah | C37: 0 | D37: 0 | E37: 0 | F37: 0 | G37: 0 | H37: 0 | I37: =SUM(C37:H37) -> 0
B38: M Edmond | C38: 0 | D38: 0 | E38: 0 | F38: 0 | G38: 0 | H38: 0 | I38: =SUM(C38:H38) -> 0
B39: <!-- var pCid="uk_lycos-uk_0"; var w0=1; var refR=escape(document.referrer); if (refR.length>=252) refR=refR.substring(0,252)+"..."; //--> <!-- var w0=0; //--> <!-- if(w0){ var imgN='<img src="http://lycos-eu.imrworldwide.com/cgi-bin/count?ref='+ refR+'&cid='+pCid+'" width=1 height=1>'; if(navigator.userAgent.indexOf('Mac')!=-1){document.write(imgN); }else{ document.write('<applet code="Measure.class" '+ 'codebase="http://lycos-eu.imrworldwide.com/"'+'width=1 height=2>'+ '<param name="ref" value="'+refR+'">'+'<param name="cid" value="'+pCid+ '"><textflow>'+imgN+'</textflow></applet>'); } } document.write("<COMMENT>"); //--> if (!AD_clientWindowSize()) { document.write("<NOSC"+"RIPT>"); } function setCookie(name, value, expires, path, domain, secure) { var curCookie = name + "=" + escape(value) + ((expires) ? "; expires=" + expires.toGMTString() : "") + ((path) ? "; path=" + path : "") + ((domain) ? "; domain=" + domain : "") + ((secure) ? "; secure" : ""); document.cookie = curCookie; } var ad_url = "http://ads.tripod.lycos.co.uk/ad/google/frame.php?_url="+escape(self.location); var ref=window.document.referrer; if(parent.LycosAdFrame) { if(parent.memberPage && parent.memberPage.document.title ) { parent.document.title=parent.memberPage.document.title; } if(parent.LycosAdFrame && parent.LycosAdFrame.location && (ref != "" && (ref+"?" != window.location) && (ref.substr(ref.length-1,1) != "/")) ) { //parent.LycosAdFrame.location.href=ad_url; parent.LycosAdFrame.location.replace(ad_url); } setCookie("adFrameForcePHP",0,0," "); parent.document.body.cols = "*,140"; } else if(top.LycosAdFrame && top.LycosAdFrame.location) { if ((ref != "" && (ref+"?" != top.window.location) && (ref.substr(ref.length-1,1) != "?"))) { //top.LycosAdFrame.location.href=ad_url; top.LycosAdFrame.location.replace(ad_url); } setCookie("adFrameForcePHP",0,0," "); top.document.body.cols = "*,140"; } else { if (!window.opener) { setCookie("adFrameForcePHP",1,0," "); } else { setCookie("adFrameForcePHP",0,0," "); } } | C39: =SUM(C23:C38) -> 296 | D39: =SUM(D23:D38) -> 197 | E39: =SUM(E23:E38) -> 261 | F39: =SUM(F23:F38) -> 59 | G39: =SUM(G23:G38) -> 52 | H39: =SUM(H23:H38) -> 221 | I39: =SUM(I23:I38) -> 1086