A1: Season 5 - April 2nd 2003 to 31st March 2004
A2: MGA World Tour Driving Accuracy (Fairways Hit)
B3: Statistics updated | C3: =TODAY() -> 38078
A4: Pos | B4: Player | C4: Original Handicap | D4: Current Handicap | E4: Playing Handicap | F4: Played | G4: Total Number of Fairways | H4: Total Fairways Hit | I4: Fairway %
A5: 1 | B5: Kevin Gallagher | C5: 9.7 | D5: 7.4000000000039927 | E5: =D5 -> 7.4000000000039927 | F5: 33 | G5: 424 | H5: 243 | I5: =IF(F5=0,"0 %",ROUND((H5/G5)*100,2) &" %") -> 57.31 %
A6: =A5+1 -> 2 | B6: Keith Mendelson | C6: 11.3 | D6: 11.4 | E6: =D6 -> 11.4 | F6: 35 | G6: 490 | H6: 255 | I6: =IF(F6=0,"0 %",ROUND((H6/G6)*100,2) &" %") -> 52.04 %
A7: =A6+1 -> 3 | B7: Martin Cox | C7: 13.6 | D7: 11.0 | E7: =D7 -> 11 | F7: 20 | G7: 268 | H7: 137 | I7: =IF(F7=0,"0 %",ROUND((H7/G7)*100,2) &" %") -> 51.12 %
A8: =A7+1 -> 4 | B8: Robert Thompson | C8: 6.2 | D8: 6.9 | E8: =D8 -> 6.9 | F8: 37 | G8: 475 | H8: 221 | I8: =IF(F8=0,"0 %",ROUND((H8/G8)*100,2) &" %") -> 46.53 %
A9: =A8+1 -> 5 | B9: Jeff Gibbons | C9: 13.2 | D9: 13.30000000000299 | E9: =D9 -> 13.30000000000299 | F9: 43 | G9: 598 | H9: 254 | I9: =IF(F9=0,"0 %",ROUND((H9/G9)*100,2) &" %") -> 42.47 %
A10: =A9+1 -> 6 | B10: Andrew Baldwin | C10: 15.2 | D10: 13.000000000001998 | E10: =D10 -> 13.000000000001998 | F10: 16 | G10: 220 | H10: 93 | I10: =IF(F10=0,"0 %",ROUND((H10/G10)*100,2) &" %") -> 42.27 %
A11: =A10+1 -> 7 | B11: Martin Bould | C11: 20.5 | D11: 17.7 | E11: =D11 -> 17.7 | F11: 15 | G11: 210 | H11: 86 | I11: =IF(F11=0,"0 %",ROUND((H11/G11)*100,2) &" %") -> 40.95 %
A12: =A11+1 -> 8 | B12: Simon Thompson | C12: 14.7 | D12: 16.0 | E12: =D12 -> 16 | F12: 26 | G12: 336 | H12: 126 | I12: =IF(F12=0,"0 %",ROUND((H12/G12)*100,2) &" %") -> 37.5 %
A13: =A12+1 -> 9 | B13: Paul Carter | C13: 11.4 | D13: 11.800000000000997 | E13: =D13 -> 11.800000000000997 | F13: 10 | G13: 139 | H13: 52 | I13: =IF(F13=0,"0 %",ROUND((H13/G13)*100,2) &" %") -> 37.41 %
A14: =A13+1 -> 10 | B14: Paul Baldwin | C14: 18.1 | D14: 17.000000000002007 | E14: =D14 -> 17.000000000002007 | F14: 16 | G14: 224 | H14: 83 | I14: =IF(F14=0,"0 %",ROUND((H14/G14)*100,2) &" %") -> 37.05 %
A15: =A14+1 -> 11 | B15: Dave Andrews | C15: 19.0 | D15: 18.500000000003002 | E15: =D15 -> 18.500000000003002 | F15: 21 | G15: 279 | H15: 103 | I15: =IF(F15=0,"0 %",ROUND((H15/G15)*100,2) &" %") -> 36.92 %
A16: =A15+1 -> 12 | B16: Jeff Colbrook | C16: 16.7 | D16: 17.2 | E16: =D16 -> 17.2 | F16: 13 | G16: 182 | H16: 66 | I16: =IF(F16=0,"0 %",ROUND((H16/G16)*100,2) &" %") -> 36.26 %
A17: =A16+1 -> 13 | B17: Danny Marsh | C17: 10.0 | D17: 7.1000000000009962 | E17: =D17 -> 7.1000000000009962 | F17: 22 | G17: 305 | H17: 108 | I17: =IF(F17=0,"0 %",ROUND((H17/G17)*100,2) &" %") -> 35.41 %
A18: =A17+1 -> 14 | B18: Alan Baldwin | C18: 22.0 | D18: 19.4 | E18: =D18 -> 19.4 | F18: 12 | G18: 156 | H18: 54 | I18: =IF(F18=0,"0 %",ROUND((H18/G18)*100,2) &" %") -> 34.62 %
A19: =A18+1 -> 15 | B19: Ian Edwards | C19: 13.0 | D19: 14.6 | E19: =D19 -> 14.6 | F19: 23 | G19: 319 | H19: 100 | I19: =IF(F19=0,"0 %",ROUND((H19/G19)*100,2) &" %") -> 31.35 %
A20: =A19+1 -> 16 | B20: Dave Rouse | C20: 21.5 | D20: 22.1 | E20: =D20 -> 22.1 | F20: 19 | G20: 265 | H20: 78 | I20: =IF(F20=0,"0 %",ROUND((H20/G20)*100,2) &" %") -> 29.43 %
A21: =A20+1 -> 17 | B21: Steve Tilling | C21: 16.5 | D21: 15.9 | E21: =D21 -> 15.9 | F21: 1 | G21: 15 | H21: 8 | I21: =IF(F21=0,"0 %",ROUND((H21/G21)*100,2) &" %") -> 53.33 %
A22: =A21+1 -> 18 | B22: John Press | C22: 15.4 | D22: 14.2 | E22: =D22 -> 14.2 | F22: 4 | G22: 52 | H22: 26 | I22: =IF(F22=0,"0 %",ROUND((H22/G22)*100,2) &" %") -> 50 %
A23: =A22+1 -> 19 | B23: Michael Trimmings | C23: 22.6 | D23: 22.6 | E23: =D23 -> 22.6 | F23: 4 | G23: 54 | H23: 25 | I23: =IF(F23=0,"0 %",ROUND((H23/G23)*100,2) &" %") -> 46.3 %
A24: =A23+1 -> 20 | B24: Alan Hopkins | C24: 7.2 | D24: 7.2 | E24: =D24 -> 7.2 | F24: 3 | G24: 42 | H24: 18 | I24: =IF(F24=0,"0 %",ROUND((H24/G24)*100,2) &" %") -> 42.86 %
A25: =A24+1 -> 21 | B25: Roy Dickens | C25: 28.3 | D25: 28.5 | E25: =D25 -> 28.5 | F25: 3 | G25: 42 | H25: 14 | I25: =IF(F25=0,"0 %",ROUND((H25/G25)*100,2) &" %") -> 33.33 %
A26: =A25+1 -> 22 | B26: Simon Owens | C26: 16.0 | D26: 16.100000000001 | E26: =D26 -> 16.100000000001 | F26: 1 | G26: 13 | H26: 4 | I26: =IF(F26=0,"0 %",ROUND((H26/G26)*100,2) &" %") -> 30.77 %
A27: =A26+1 -> 23 | B27: Andy Benson | C27: 7.5 | D27: 7.6000000000009997 | E27: =D27 -> 7.6000000000009997 | F27: 2 | G27: 27 | H27: 8 | I27: =IF(F27=0,"0 %",ROUND((H27/G27)*100,2) &" %") -> 29.63 %
A28: =A27+1 -> 24 | B28: Malcolm Rouse | C28: 41.9 | D28: 42.9 | E28: =D28 -> 42.9 | F28: 1 | G28: 14 | H28: 4 | I28: =IF(F28=0,"0 %",ROUND((H28/G28)*100,2) &" %") -> 28.57 %
A29: =A28+1 -> 25 | B29: Jon Dey | C29: 35.4 | D29: 35.5 | E29: =D29 -> 35.5 | F29: 4 | G29: 55 | H29: 15 | I29: =IF(F29=0,"0 %",ROUND((H29/G29)*100,2) &" %") -> 27.27 %
A30: =A29+1 -> 26 | B30: Keith Johns | C30: 25.1 | D30: 24.3 | E30: =D30 -> 24.3 | F30: 2 | G30: 28 | H30: 7 | I30: =IF(F30=0,"0 %",ROUND((H30/G30)*100,2) &" %") -> 25 %
A31: =A30+1 -> 27 | B31: Clive Ferris | C31: 25.7 | D31: 26.6 | E31: =D31 -> 26.6 | F31: 3 | G31: 42 | H31: 10 | I31: =IF(F31=0,"0 %",ROUND((H31/G31)*100,2) &" %") -> 23.81 %
A32: =A31+1 -> 28 | B32: Chris Manning | C32: 22.0 | D32: 22.5 | E32: =D32 -> 22.5 | F32: 3 | G32: 42 | H32: 9 | I32: =IF(F32=0,"0 %",ROUND((H32/G32)*100,2) &" %") -> 21.43 %
A33: =A32+1 -> 29 | B33: Neil Leah | C33: 15.0 | D33: 15.0 | E33: =D33 -> 15 | F33: 0 | G33: 0 | H33: 0 | I33: =IF(F33=0,"0 %",ROUND((H33/G33)*100,2) &" %") -> 0 %
A34: =A33+1 -> 30 | B34: Mike Edmond | C34: 36.5 | D34: 36.5 | E34: =D34 -> 36.5 | F34: 0 | G34: 0 | H34: 0 | I34: =IF(F34=0,"0 %",ROUND((H34/G34)*100,2) &" %") -> 0 %
A35: =A34+1 -> 31 | B35: Dave Archer | C35: 22.0 | D35: 22.0 | E35: =D35 -> 22 | F35: 0 | G35: 0 | H35: 0 | I35: =IF(F35=0,"0 %",ROUND((H35/G35)*100,2) &" %") -> 0 %
A36: =A35+1 -> 32 | B36: Andrew Knight | C36: 21.4 | D36: 21.4 | E36: =D36 -> 21.4 | F36: 0 | G36: 0 | H36: 0 | I36: =IF(F36=0,"0 %",ROUND((H36/G36)*100,2) &" %") -> 0 %