B1: MGA World Tour Match Results
B2: November 2003
B4: To see individual scorecard, click on player's name
D6: CR | E6: Denotes MGA Course Record
B8: 1st November 2003 | D8: Wimbledon Common | I8: Start H/Cap | J8: New H/Cap
B9: Position | C9: Name | D9: Prize Money | E9: Points | F9: Putts | G9: Fairways | H9: Ferrets
B10: 1st | C10: K Gallagher | D10: 5000 | E10: 27 | F10: 34 | G10: 5 | H10: 0 | I10: 8.4 | J10: 8.6
B11: 2nd | C11: R Thompson | D11: 2500 | E11: 25 | F11: 35 | G11: 5 | H11: 2 | I11: 7.1 | J11: 7.3
B13: 1st November 2003 | D13: Huntswood | I13: Start H/Cap | J13: New H/Cap
B14: Position | C14: Name | D14: Prize Money | E14: Points | F14: Putts | G14: Fairways | H14: Ferrets
B15: 1st | C15: J Colbrook | D15: 5000 | E15: 29 | F15: 35 | G15: 4 | H15: 0 | I15: 14.7 | J15: 14.8
B16: 2nd | C16: D Andrews | D16: 2500 | E16: 28 | F16: 30 | G16: 0 | H16: 0 | I16: 19.0 | J16: 19.1
B18: 7th November 2003 | D18: Pyrford | I18: Start H/Cap | J18: New H/Cap
B19: Position | C19: Name | D19: Prize Money | E19: Points | F19: Putts | G19: Fairways | H19: Ferrets
B20: 1st | C20: K Gallagher | D20: 5000 | E20: 28 | F20: 32 | G20: 10 | H20: 2 | I20: 8.6 | J20: 8.7
B21: 2nd | C21: P Carter | D21: 2500 | E21: 27 | F21: 33 | G21: 5 | H21: 3 | I21: 12.2 | J21: 12.4
B23: 8th November 2003 | D23: Porters Park | I23: Start H/Cap | J23: New H/Cap
B24: Position | C24: Name | D24: Prize Money | E24: Points | F24: Putts | G24: Fairways | H24: Ferrets
B25: 1st | C25: D Marsh | D25: 5000 | E25: 26 | F25: 33 | G25: 6 | H25: 0 | I25: 6.6 | J25: 6.8
B26: 2nd | C26: I Edwards | D26: 2500 | E26: 24 | F26: 39 | G26: 3 | H26: 1 | I26: 14.5 | J26: 14.7
B28: 8th November 2003 | D28: Wimbledon Common | I28: Start H/Cap | J28: New H/Cap
B29: Position | C29: Name | D29: Prize Money | E29: Points | F29: Putts | G29: Fairways | H29: Ferrets
B30: 1st | C30: K Gallagher | D30: 10000 | E30: 41 | F30: 26 | G30: 7 | H30: 0 | I30: 8.7 | J30: 7.2
B31: 2nd | C31: S Thompson | D31: 7500 | E31: 36 | F31: 31 | G31: 6 | H31: 0 | I31: 16.2 | J31: 16.2
B32: 3rd | C32: D Andrews | D32: 5000 | E32: 33 | F32: 32 | G32: 6 | H32: 1 | I32: 19.1 | J32: 19.1
B33: 4th | C33: R Thompson | D33: 2500 | E33: 32 | F33: 30 | G33: 7 | H33: 0 | I33: 7.3 | J33: 7.4
B35: 15th November 2003 | D35: Wimbledon Common | I35: Start H/Cap | J35: New H/Cap
B36: Position | C36: Name | D36: Prize Money | E36: Points | F36: Putts | G36: Fairways | H36: Ferrets
B37: 1st | C37: S Thompson | D37: 7500 | E37: 37 | F37: 32 | G37: 4 | H37: 0 | I37: 16.2 | J37: 16.0
B38: 2nd | C38: K Gallagher | D38: 5000 | E38: 31 | F38: 34 | G38: 7 | H38: 0 | I38: 7.2 | J38: 7.3
B39: 3rd | C39: R Thompson | D39: 2500 | E39: 27 | F39: 32 | G39: 7 | H39: 0 | I39: 7.4 | J39: 7.6
B41: 28th November 2003 | D41: The Old Course, Vilamoura | I41: Start H/Cap | J41: New H/Cap
B42: Position | C42: Name | D42: Prize Money | E42: Points | F42: Putts | G42: Fairways | H42: Ferrets
B43: 1st | C43: R Thompson | D43: 17500 | E43: 33 | F43: 35 | G43: 8 | H43: 0 | I43: 7.6 | J43: 7.6
B44: 2nd= | C44: J Colbrook | D44: 13750 | E44: 31 | F44: 35 | G44: 4 | H44: 1 | I44: 14.9 | J44: 14.9
B45: 2nd= | C45: P Baldwin | D45: 13750 | E45: 31 | F45: 35 | G45: 12 | H45: 0 | I45: 16.9 | J45: 17.0
B46: 4th | C46: D Rouse | D46: 10000 | E46: 25 | F46: 33 | G46: 1 | H46: 0 | I46: 22.3 | J46: 22.5
B47: 5th | C47: M Bould | D47: 7500 | E47: 24 | F47: 36 | G47: 8 | H47: 0 | I47: 15.4 | J47: 15.6
B48: 6th | C48: M Cox | D48: 5000 | E48: 23 | F48: 36 | G48: 7 | H48: 0 | I48: 9.7 | J48: 9.9
B49: 7th | C49: A Baldwin (Snr) | D49: 2500 | E49: 17 | F49: 35 | G49: 6 | H49: 0 | I49: 14.7 | J49: 15.7
B51: 29th November 2003 (am) | D51: Laguna, Vilamoura | I51: Start H/Cap | J51: New H/Cap
B52: Position | C52: Name | D52: Prize Money | E52: Points | F52: Putts | G52: Fairways | H52: Ferrets
B53: 1st | C53: R Thompson | D53: 16250 | E53: 31 | F53: 33 | G53: 7 | H53: 1 | I53: 7.6 | J53: 7.7
B54: 2nd | C54: M Cox | D54: 16250 | E54: 31 | F54: 29 | G54: 11 | H54: 1 | I54: 9.9 | J54: 10.0
B55: 3rd | C55: D Rouse | D55: 12500 | E55: 25 | F55: 35 | G55: 5 | H55: 6 | I55: 22.5 | J55: 22.7
B56: 4th | C56: P Baldwin | D56: 10000 | E56: 22 | F56: 36 | G56: 3 | H56: 3 | I56: 17.0 | J56: 17.2
B57: 5th | C57: M Bould | D57: 7500 | E57: 21 | F57: 37 | G57: 6 | H57: 5 | I57: 15.6 | J57: 16.1
B58: 6th | C58: J Colbrook | D58: 5000 | E58: 17 | F58: 35 | G58: 9 | H58: 7 | I58: 14.8 | J58: 15.9
B59: 7th | C59: A Baldwin (Snr) | D59: 2500 | E59: 14 | F59: 39 | G59: 9 | H59: 7 | I59: 15.7 | J59: 16.7
B61: 29th November 2003 (pm) | D61: Pinhal, Vilamoura | I61: Start H/Cap | J61: New H/Cap
B62: Position | C62: Name | D62: Prize Money | E62: Points | F62: Putts | G62: Fairways | H62: Ferrets
B63: 1st | C63: R Thompson | D63: 17500 | E63: 31 | F63: 37 | G63: 3 | H63: 0 | I63: 7.7 | J63: 7.8
B64: 2nd | C64: D Rouse | D64: 15000 | E64: 30 | F64: 36 | G64: 5 | H64: 0 | I64: 22.7 | J64: 22.8
B65: 3rd | C65: P Baldwin | D65: 12500 | E65: 28 | F65: 33 | G65: 4 | H65: 0 | I65: 17.2 | J65: 17.3
B66: 4th | C66: M Cox | D66: 10000 | E66: 25 | F66: 30 | G66: 7 | H66: 0 | I66: 10.0 | J66: 10.2
B67: 5th | C67: J Colbrook | D67: 7500 | E67: 21 | F67: 32 | G67: 6 | H67: 2 | I67: 15.9 | J67: 16.4
B68: 6th | C68: M Bould | D68: 5000 | E68: 18 | F68: 32 | G68: 5 | H68: 0 | I68: 16.1 | J68: 17.1
B69: 7th | C69: A Baldwin (Snr) | D69: 2500 | E69: 13 | F69: 40 | G69: 4 | H69: 1 | I69: 16.7 | J69: 17.7
B71: 30th November 2003 (am) | D71: Vila Sol, Vilamoura 1-18 | I71: Start H/Cap | J71: New H/Cap
B72: Position | C72: Name | D72: Prize Money | E72: Points | F72: Putts | G72: Fairways | H72: Ferrets
B73: 1st | C73: M Cox | D73: 17500 | E73: 27 | F73: 35 | G73: 8 | H73: 0 | I73: 10.2 | J73: 10.4
B74: 2nd | C74: D Rouse | D74: 15000 | E74: 26 | F74: 31 | G74: 6 | H74: 2 | I74: 22.8 | J74: 23.0
B75: 3rd= | C75: R Thompson | D75: 10000 | E75: 23 | F75: 37 | G75: 7 | H75: 3 | I75: 7.8 | J75: 8.0
B76: 3rd= | C76: M Bould | D76: 10000 | E76: 23 | F76: 36 | G76: 6 | H76: 1 | I76: 17.1 | J76: 17.3
B77: 3rd= | C77: P Baldwin | D77: 10000 | E77: 23 | F77: 36 | G77: 3 | H77: 3 | I77: 17.3 | J77: 17.5
B78: 6th | C78: A Baldwin (Snr) | D78: 5000 | E78: 21 | F78: 36 | G78: 5 | H78: 2 | I78: 17.7 | J78: 18.2
B79: 7th | C79: J Colbrook | D79: 2500 | E79: 20 | F79: 40 | G79: 5 | H79: 3 | I79: 16.4 | J79: 16.9
B81: 30th November 2003 (pm) | D81: Vila Sol, Vilamoura 10-27 | I81: Start H/Cap | J81: New H/Cap
B82: Position | C82: Name | D82: Prize Money | E82: Points | F82: Putts | G82: Fairways | H82: Ferrets
A83: CR | B83: 1st | C83: D Rouse | D83: 17500 | E83: 30 | F83: 35 | G83: 5 | H83: 0 | I83: 23.0 | J83: 23.1
B84: 2nd | C84: J Colbrook | D84: 15000 | E84: 29 | F84: 38 | G84: 8 | H84: 2 | I84: 16.9 | J84: 17.0
B85: 3rd | C85: P Baldwin | D85: 12500 | E85: 28 | F85: 37 | G85: 7 | H85: 3 | I85: 17.5 | J85: 17.6
B86: 4th= | C86: R Thompson | D86: 8750 | E86: 26 | F86: 34 | G86: 7 | H86: 0 | I86: 8.0 | J86: 8.2
B87: 4th= | C87: M Bould | D87: 8750 | E87: 26 | F87: 38 | G87: 7 | H87: 1 | I87: 17.3 | J87: 17.5
B88: 6th | C88: M Cox | D88: 5000 | E88: 24 | F88: 35 | G88: 6 | H88: 1 | I88: 10.4 | J88: 10.6
B89: 7th | C89: A Baldwin (Snr) | D89: 2500 | E89: 14 | F89: 41 | G89: 2 | H89: 3 | I89: 18.2 | J89: 19.2
D91: Summary of The Coxy Recky Cup, Portugal 2003 | I91: Start H/Cap | J91: New H/Cap
B92: Position | C92: Name | D92: Prize Money | E92: Points | F92: Putts | G92: Fairways | H92: Ferrets
B93: 1st | C93: R Thompson | D93: =D86+D75+D63+D53+D43 -> 70000 | E93: 144 | F93: 176 | G93: 32 | H93: 4 | I93: 7.6 | J93: 8.2 | K93: + 0.6
B94: 2nd | C94: D Rouse | D94: =D83+D74+D64+D55+D46 -> 70000 | E94: =E83+E74+E64+E55+E46 -> 136 | F94: =F83+F74+F64+F55+F46 -> 170 | G94: =G83+G74+G64+G55+G46 -> 22 | H94: =H83+H74+H64+H55+H46 -> 8 | I94: 22.3 | J94: 23.1 | K94: + 0.8
B95: 3rd | C95: P Baldwin | D95: =D85+D77+D65+D56+D45 -> 58750 | E95: =E85+E77+E65+E56+E45 -> 132 | F95: =F85+F77+F65+F56+F45 -> 177 | G95: =G85+G77+G65+G56+G45 -> 29 | H95: =H85+H77+H65+H56+H45 -> 9 | I95: 16.9 | J95: 17.6 | K95: + 0.7
B96: 4th | C96: M Cox | D96: =D88+D73+D66+D54+D48 -> 53750 | E96: =E88+E73+E66+E54+E48 -> 130 | F96: =F88+F73+F66+F54+F48 -> 165 | G96: =G88+G73+G66+G54+G48 -> 39 | H96: =H88+H73+H66+H54+H48 -> 2 | I96: 9.7 | J96: 10.6 | K96: + 0.9
B97: 5th | C97: J Colbrook | D97: =D83+D78+D66+D57+D43 -> 57500 | E97: =E83+E78+E66+E57+E43 -> 130 | F97: =F83+F78+F66+F57+F43 -> 173 | G97: =G83+G78+G66+G57+G43 -> 31 | H97: =H83+H78+H66+H57+H43 -> 7 | I97: 14.9 | J97: 17.0 | K97: + 2.1
B98: 6th | C98: M Bould | D98: =D88+D77+D69+D58+D48 -> 27500 | E98: =E88+E77+E69+E58+E48 -> 100 | F98: =F88+F77+F69+F58+F48 -> 182 | G98: =G88+G77+G69+G58+G48 -> 29 | H98: =H88+H77+H69+H58+H48 -> 12 | I98: 15.4 | J98: 17.5 | K98: + 2.1
B99: 7th | C99: A Baldwin (Snr) | D99: =D89+D78+D69+D59+D49 -> 15000 | E99: =E89+E78+E69+E59+E49 -> 79 | F99: =F89+F78+F69+F59+F49 -> 191 | G99: =G89+G78+G69+G59+G49 -> 26 | H99: =H89+H78+H69+H59+H49 -> 13 | I99: 14.7 | J99: 19.2 | K99: + 4.5
B101: 30th November 2003 | D101: Chelsfield Lakes | I101: Start H/Cap | J101: New H/Cap
B102: Position | C102: Name | D102: Prize Money | E102: Points | F102: Putts | G102: Fairways | H102: Ferrets
B103: 1st | C103: J Gibbons | D103: 5000 | E103: 25 | F103: 35 | G103: 6 | H103: 1 | I103: 12.0 | J103: 12.2
B104: 2nd | C104: K Mendelson | D104: 2500 | E104: 23 | F104: 32 | G104: 5 | H104: 2 | I104: 10.5 | J104: 10.7