A1: Season 5 - April 2nd 2003 to 31st March 2004
A2: MGA World Tour Order of Merit
B3: Statistics updated | C3: =TODAY() -> 38078
A4: Pos | B4: Player | C4: Original Handicap | D4: Current Handicap | E4: Playing Handicap | F4: Played | G4: Points | H4: Average | I4: HI / LOW Score | J4: Qualified (10 games)
A5: 1 | B5: Kevin Gallagher | C5: 9.7 | D5: 7.4000000000039927 | E5: =D5 -> 7.4000000000039927 | F5: 33 | G5: 1062 | H5: =IF(ISERROR(G5/F5),0,G5/F5) -> 32.18181818181818 | I5: 41 / 17 | J5: =IF(F5>=10,"Yes","") -> Yes
A6: =IF(J6="","",A5+1) -> 2 | B6: Dave Andrews | C6: 19.0 | D6: 18.500000000003002 | E6: =D6 -> 18.500000000003002 | F6: 21 | G6: 669 | H6: =IF(ISERROR(G6/F6),0,G6/F6) -> 31.857142857142858 | I6: 40 / 23 | J6: =IF(F6>=10,"Yes","") -> Yes
A7: =IF(J7="","",A6+1) -> 3 | B7: Keith Mendelson | C7: 11.3 | D7: 11.4 | E7: =D7 -> 11.4 | F7: 35 | G7: 1108 | H7: =IF(ISERROR(G7/F7),0,G7/F7) -> 31.657142857142858 | I7: 40 / 22 | J7: =IF(F7>=10,"Yes","") -> Yes
A8: =IF(J8="","",A7+1) -> 4 | B8: Jeff Gibbons | C8: 13.2 | D8: 13.30000000000299 | E8: =D8 -> 13.30000000000299 | F8: 43 | G8: 1353 | H8: =IF(ISERROR(G8/F8),0,G8/F8) -> 31.465116279069768 | I8: 42 / 20 | J8: =IF(F8>=10,"Yes","") -> Yes
A9: =IF(J9="","",A8+1) -> 5 | B9: Simon Thompson | C9: 14.7 | D9: 16.0 | E9: =D9 -> 16 | F9: 26 | G9: 811 | H9: =IF(ISERROR(G9/F9),0,G9/F9) -> 31.192307692307693 | I9: 40 / 14 | J9: =IF(F9>=10,"Yes","") -> Yes
A10: =IF(J10="","",A9+1) -> 6 | B10: Paul Baldwin | C10: 18.1 | D10: 17.000000000002007 | E10: =D10 -> 17.000000000002007 | F10: 16 | G10: 497 | H10: =IF(ISERROR(G10/F10),0,G10/F10) -> 31.0625 | I10: 39 / 22 | J10: =IF(F10>=10,"Yes","") -> Yes
A11: =IF(J11="","",A10+1) -> 7 | B11: Robert Thompson | C11: 6.2 | D11: 6.9 | E11: =D11 -> 6.9 | F11: 37 | G11: 1126 | H11: =IF(ISERROR(G11/F11),0,G11/F11) -> 30.432432432432432 | I11: 40 / 19 | J11: =IF(F11>=10,"Yes","") -> Yes
A12: =IF(J12="","",A11+1) -> 8 | B12: Danny Marsh | C12: 10.0 | D12: 7.1000000000009962 | E12: =D12 -> 7.1000000000009962 | F12: 22 | G12: 665 | H12: =IF(ISERROR(G12/F12),0,G12/F12) -> 30.227272727272727 | I12: 47 / 15 | J12: =IF(F12>=10,"Yes","") -> Yes
A13: =IF(J13="","",A12+1) -> 9 | B13: Andrew Baldwin | C13: 15.2 | D13: 13.000000000001998 | E13: =D13 -> 13.000000000001998 | F13: 16 | G13: 483 | H13: =IF(ISERROR(G13/F13),0,G13/F13) -> 30.1875 | I13: 43 / 21 | J13: =IF(F13>=10,"Yes","") -> Yes
A14: =IF(J14="","",A13+1) -> 10 | B14: Martin Cox | C14: 13.6 | D14: 11.0 | E14: =D14 -> 11 | F14: 20 | G14: 594 | H14: =IF(ISERROR(G14/F14),0,G14/F14) -> 29.70 | I14: 43 / 22 | J14: =IF(F14>=10,"Yes","") -> Yes
A15: =IF(J15="","",A14+1) -> 11 | B15: Martin Bould | C15: 20.5 | D15: 17.7 | E15: =D15 -> 17.7 | F15: 15 | G15: 439 | H15: =IF(ISERROR(G15/F15),0,G15/F15) -> 29.266666666666666 | I15: 44 / 18 | J15: =IF(F15>=10,"Yes","") -> Yes
A16: =IF(J16="","",A15+1) -> 12 | B16: Ian Edwards | C16: 13.0 | D16: 14.6 | E16: =D16 -> 14.6 | F16: 23 | G16: 660 | H16: =IF(ISERROR(G16/F16),0,G16/F16) -> 28.695652173913043 | I16: 38 / 23 | J16: =IF(F16>=10,"Yes","") -> Yes
A17: =IF(J17="","",A16+1) -> 13 | B17: Dave Rouse | C17: 21.5 | D17: 22.1 | E17: =D17 -> 22.1 | F17: 19 | G17: 545 | H17: =IF(ISERROR(G17/F17),0,G17/F17) -> 28.684210526315791 | I17: 38 / 23 | J17: =IF(F17>=10,"Yes","") -> Yes
A18: =IF(J18="","",A17+1) -> 14 | B18: Paul Carter | C18: 11.4 | D18: 11.800000000000997 | E18: =D18 -> 11.800000000000997 | F18: 10 | G18: 285 | H18: =IF(ISERROR(G18/F18),0,G18/F18) -> 28.50 | I18: 37 / 23 | J18: =IF(F18>=10,"Yes","") -> Yes
A19: =IF(J19="","",A18+1) -> 15 | B19: Jeff Colbrook | C19: 16.7 | D19: 17.2 | E19: =D19 -> 17.2 | F19: 13 | G19: 357 | H19: =IF(ISERROR(G19/F19),0,G19/F19) -> 27.46153846153846 | I19: 41 / 17 | J19: =IF(F19>=10,"Yes","") -> Yes
A20: =IF(J20="","",A19+1) -> 16 | B20: Alan Baldwin | C20: 22.0 | D20: 19.4 | E20: =D20 -> 19.4 | F20: 12 | G20: 329 | H20: =IF(ISERROR(G20/F20),0,G20/F20) -> 27.416666666666668 | I20: 43 / 13 | J20: =IF(F20>=10,"Yes","") -> Yes
A21: =IF(J21="","",A20+1) ->  | B21: John Press | C21: 15.4 | D21: 14.2 | E21: =D21 -> 14.2 | F21: 4 | G21: 132 | H21: =IF(ISERROR(G21/F21),0,G21/F21) -> 33.00 | I21: 41 / 27 | J21: =IF(F21>=10,"Yes","") -> 
A22: =IF(J22="","",A21+1) ->  | B22: Roy Dickens | C22: 28.3 | D22: 28.5 | E22: =D22 -> 28.5 | F22: 3 | G22: 96 | H22: =IF(ISERROR(G22/F22),0,G22/F22) -> 32.00 | I22: 36 / 29 | J22: =IF(F22>=10,"Yes","") -> 
A23: =IF(J23="","",A22+1) ->  | B23: Keith Johns | C23: 25.1 | D23: 24.3 | E23: =D23 -> 24.3 | F23: 2 | G23: 63 | H23: =IF(ISERROR(G23/F23),0,G23/F23) -> 31.50 | I23: 27 / 27 | J23: =IF(F23>=10,"Yes","") -> 
A24: =IF(J24="","",A23+1) ->  | B24: Andy Benson | C24: 7.5 | D24: 7.6000000000009997 | E24: =D24 -> 7.6000000000009997 | F24: 2 | G24: 63 | H24: =IF(ISERROR(G24/F24),0,G24/F24) -> 31.50 | I24: 35 / 28 | J24: =IF(F24>=10,"Yes","") -> 
A25: =IF(J25="","",A24+1) ->  | B25: Jon Dey | C25: 35.4 | D25: 35.5 | E25: =D25 -> 35.5 | F25: 4 | G25: 122 | H25: =IF(ISERROR(G25/F25),0,G25/F25) -> 30.50 | I25: 35 / 25 | J25: =IF(F25>=10,"Yes","") -> 
A26: =IF(J26="","",A25+1) ->  | B26: Alan Hopkins | C26: 7.2 | D26: 7.2 | E26: =D26 -> 7.2 | F26: 3 | G26: 88 | H26: =IF(ISERROR(G26/F26),0,G26/F26) -> 29.333333333333332 | I26: 35 / 24 | J26: =IF(F26>=10,"Yes","") -> 
A27: =IF(J27="","",A26+1) ->  | B27: Michael Trimmings | C27: 22.6 | D27: 22.6 | E27: =D27 -> 22.6 | F27: 4 | G27: 116 | H27: =IF(ISERROR(G27/F27),0,G27/F27) -> 29.00 | I27: 32 / 26 | J27: =IF(F27>=10,"Yes","") -> 
A28: =IF(J28="","",A27+1) ->  | B28: Steve Tilling | C28: 16.5 | D28: 15.9 | E28: =D28 -> 15.9 | F28: 1 | G28: 29 | H28: =IF(ISERROR(G28/F28),0,G28/F28) -> 29.00 | I28: 29 / 29 | J28: =IF(F28>=10,"Yes","") -> 
A29: =IF(J29="","",A28+1) ->  | B29: Simon Owens | C29: 16.0 | D29: 16.100000000001 | E29: =D29 -> 16.100000000001 | F29: 1 | G29: 28 | H29: =IF(ISERROR(G29/F29),0,G29/F29) -> 28.00 | I29: 28 / 28 | J29: =IF(F29>=10,"Yes","") -> 
A30: =IF(J30="","",A29+1) ->  | B30: Chris Manning | C30: 22.0 | D30: 22.5 | E30: =D30 -> 22.5 | F30: 3 | G30: 78 | H30: =IF(ISERROR(G30/F30),0,G30/F30) -> 26.00 | I30: 32 / 22 | J30: =IF(F30>=10,"Yes","") -> 
A31: =IF(J31="","",A30+1) ->  | B31: Clive Ferris | C31: 25.7 | D31: 26.6 | E31: =D31 -> 26.6 | F31: 3 | G31: 74 | H31: =IF(ISERROR(G31/F31),0,G31/F31) -> 24.666666666666668 | I31: 27 / 21 | J31: =IF(F31>=10,"Yes","") -> 
A32: =IF(J32="","",A31+1) ->  | B32: Malcolm Rouse | C32: 41.9 | D32: 42.9 | E32: =D32 -> 42.9 | F32: 1 | G32: 15 | H32: =IF(ISERROR(G32/F32),0,G32/F32) -> 15.00 | I32: 15 / 15 | J32: =IF(F32>=10,"Yes","") -> 
A33: =IF(J33="","",A32+1) ->  | B33: Neil Leah | C33: 15.0 | D33: 15.0 | E33: =D33 -> 15 | F33: 0 | G33: 0 | H33: =IF(ISERROR(G33/F33),0,G33/F33) -> 0.00 | I33: / | J33: =IF(F33>=10,"Yes","") -> 
A34: =IF(J34="","",A33+1) ->  | B34: Mike Edmond | C34: 36.5 | D34: 36.5 | E34: =D34 -> 36.5 | F34: 0 | G34: 0 | H34: =IF(ISERROR(G34/F34),0,G34/F34) -> 0.00 | I34: / | J34: =IF(F34>=10,"Yes","") -> 
A35: =IF(J35="","",A34+1) ->  | B35: Dave Archer | C35: 22.0 | D35: 22.0 | E35: =D35 -> 22 | F35: 0 | G35: 0 | H35: =IF(ISERROR(G35/F35),0,G35/F35) -> 0.00 | I35: / | J35: =IF(F35>=10,"Yes","") -> 
A36: =IF(J36="","",A35+1) ->  | B36: Andrew Knight | C36: 21.4 | D36: 21.4 | E36: =D36 -> 21.4 | F36: 0 | G36: 0 | H36: =IF(ISERROR(G36/F36),0,G36/F36) -> 0.00 | I36: / | J36: =IF(F36>=10,"Yes","") -> 