A1: Season 7 - April 2nd 2005 to 31st March 2006
A2: MGA World Tour Net Greens in Regulation
B3: Statistics updated | C3: =TODAY() -> 38817
A4: Pos | B4: Player | C4: Original Handicap | D4: Current Handicap | E4: Playing Handicap | F4: Played | G4: Total Greens Hit | H4: Green in Regulation | I4: Greens in Regulation Ratio
A5: 1 | B5: Jeff Colbrook | C5: 17.2 | D5: 13.1 | E5: =D5 -> 13.1 | F5: 10 | G5: 113 | H5: 62.78 % | I5: =IF(G5="","",IF(G5=0,"0 : "&F5*18,"1 : "&ROUND((F5*18)/G5,1))) -> 1 : 1.6
A6: 2 | B6: Kevin Gallagher | C6: 10.4 | D6: 11.80000000000199 | E6: =D6 -> 11.80000000000199 | F6: 47 | G6: 502 | H6: 59.34 % | I6: =IF(G6="","",IF(G6=0,"0 : "&F6*18,"1 : "&ROUND((F6*18)/G6,1))) -> 1 : 1.7
A7: 3 | B7: Dave Andrews | C7: 17.2 | D7: 17.500000000001002 | E7: =D7 -> 17.500000000001002 | F7: 22 | G7: 225 | H7: 56.82 % | I7: =IF(G7="","",IF(G7=0,"0 : "&F7*18,"1 : "&ROUND((F7*18)/G7,1))) -> 1 : 1.8
A8: =A7+1 -> 4 | B8: Simon Thompson | C8: 12.7 | D8: 11.6 | E8: =D8 -> 11.6 | F8: 29 | G8: 292 | H8: 55.94 % | I8: =IF(G8="","",IF(G8=0,"0 : "&F8*18,"1 : "&ROUND((F8*18)/G8,1))) -> 1 : 1.8
A9: =A8+1 -> 5 | B9: Roy Dickens | C9: 29.6 | D9: 29.6 | E9: =D9 -> 29.6 | F9: 21 | G9: 211 | H9: 55.82 % | I9: =IF(G9="","",IF(G9=0,"0 : "&F9*18,"1 : "&ROUND((F9*18)/G9,1))) -> 1 : 1.8
A10: =A9+1 -> 6 | B10: Jeff Gibbons | C10: 21.7 | D10: 20.000000000003013 | E10: =D10 -> 20.000000000003013 | F10: 48 | G10: 473 | H10: 54.75 % | I10: =IF(G10="","",IF(G10=0,"0 : "&F10*18,"1 : "&ROUND((F10*18)/G10,1))) -> 1 : 1.8
A11: =A10+1 -> 7 | B11: Dave Rouse | C11: 22.9 | D11: 24.6 | E11: =D11 -> 24.6 | F11: 18 | G11: 177 | H11: 54.63 % | I11: =IF(G11="","",IF(G11=0,"0 : "&F11*18,"1 : "&ROUND((F11*18)/G11,1))) -> 1 : 1.8
A12: =A11+1 -> 8 | B12: Martin Bould | C12: 18.3 | D12: 20.400000000001 | E12: =D12 -> 20.400000000001 | F12: 14 | G12: 137 | H12: 54.37 % | I12: =IF(G12="","",IF(G12=0,"0 : "&F12*18,"1 : "&ROUND((F12*18)/G12,1))) -> 1 : 1.8
A13: =A12+1 -> 9 | B13: Alan Hopkins | C13: 7.7 | D13: 8.400000000001997 | E13: =D13 -> 8.400000000001997 | F13: 18 | G13: 175 | H13: 54.01 % | I13: =IF(G13="","",IF(G13=0,"0 : "&F13*18,"1 : "&ROUND((F13*18)/G13,1))) -> 1 : 1.9
A14: =A13+1 -> 10 | B14: Robert Thompson | C14: 8.2 | D14: 8.0999999999999837 | E14: =D14 -> 8.0999999999999837 | F14: 51 | G14: 492 | H14: 53.59 % | I14: =IF(G14="","",IF(G14=0,"0 : "&F14*18,"1 : "&ROUND((F14*18)/G14,1))) -> 1 : 1.9
A15: =A14+1 -> 11 | B15: Keith Mendelson | C15: 14.4 | D15: 15.7 | E15: =D15 -> 15.7 | F15: 44 | G15: 420 | H15: 53.03 % | I15: =IF(G15="","",IF(G15=0,"0 : "&F15*18,"1 : "&ROUND((F15*18)/G15,1))) -> 1 : 1.9
A16: =A15+1 -> 12 | B16: Paul Carter | C16: 12.4 | D16: 12.8 | E16: =D16 -> 12.8 | F16: 12 | G16: 111 | H16: 51.39 % | I16: =IF(G16="","",IF(G16=0,"0 : "&F16*18,"1 : "&ROUND((F16*18)/G16,1))) -> 1 : 1.9
A17: =A16+1 -> 13 | B17: Martin Cox | C17: 11.3 | D17: 12.300000000001996 | E17: =D17 -> 12.300000000001996 | F17: 14 | G17: 122 | H17: 48.41 % | I17: =IF(G17="","",IF(G17=0,"0 : "&F17*18,"1 : "&ROUND((F17*18)/G17,1))) -> 1 : 2.1
A18: =A17+1 -> 14 | B18: John Press | C18: 15.0 | D18: 14.9 | E18: =D18 -> 14.9 | F18: 3 | G18: 36 | H18: 66.67 % | I18: =IF(G18="","",IF(G18=0,"0 : "&F18*18,"1 : "&ROUND((F18*18)/G18,1))) -> 1 : 1.5
A19: =A18+1 -> 15 | B19: Paul Baldwin | C19: 17.7 | D19: 16.900000000001 | E19: =D19 -> 16.900000000001 | F19: 4 | G19: 45 | H19: 62.5 % | I19: =IF(G19="","",IF(G19=0,"0 : "&F19*18,"1 : "&ROUND((F19*18)/G19,1))) -> 1 : 1.6
A20: =A19+1 -> 16 | B20: Ian Edwards | C20: 14.9 | D20: 15.2 | E20: =D20 -> 15.2 | F20: 6 | G20: 67 | H20: 62.04 % | I20: =IF(G20="","",IF(G20=0,"0 : "&F20*18,"1 : "&ROUND((F20*18)/G20,1))) -> 1 : 1.6
A21: =A20+1 -> 17 | B21: Matt Carter | C21: 20.0 | D21: 20.9 | E21: =D21 -> 20.9 | F21: 8 | G21: 87 | H21: 60.42 % | I21: =IF(G21="","",IF(G21=0,"0 : "&F21*18,"1 : "&ROUND((F21*18)/G21,1))) -> 1 : 1.7
A22: =A21+1 -> 18 | B22: Michael Trimmings | C22: 22.8 | D22: 22.800000000001003 | E22: =D22 -> 22.800000000001003 | F22: 9 | G22: 86 | H22: 53.09 % | I22: =IF(G22="","",IF(G22=0,"0 : "&F22*18,"1 : "&ROUND((F22*18)/G22,1))) -> 1 : 1.9
A23: =A22+1 -> 19 | B23: Andy Benson | C23: 6.0 | D23: 6.7 | E23: =D23 -> 6.7 | F23: 5 | G23: 46 | H23: 51.11 % | I23: =IF(G23="","",IF(G23=0,"0 : "&F23*18,"1 : "&ROUND((F23*18)/G23,1))) -> 1 : 2
A24: =A23+1 -> 20 | B24: Chris Manning | C24: 22.6 | D24: 22.7 | E24: =D24 -> 22.7 | F24: 1 | G24: 9 | H24: 50 % | I24: =IF(G24="","",IF(G24=0,"0 : "&F24*18,"1 : "&ROUND((F24*18)/G24,1))) -> 1 : 2
A25: =A24+1 -> 21 | B25: Dave White | C25: 22.0 | D25: 22.1 | E25: =D25 -> 22.1 | F25: 1 | G25: 9 | H25: 50 % | I25: =IF(G25="","",IF(G25=0,"0 : "&F25*18,"1 : "&ROUND((F25*18)/G25,1))) -> 1 : 2
A26: =A25+1 -> 22 | B26: Danny Marsh | C26: 10.0 | D26: 8.2000000000009994 | E26: =D26 -> 8.2000000000009994 | F26: 7 | G26: 62 | H26: 49.21 % | I26: =IF(G26="","",IF(G26=0,"0 : "&F26*18,"1 : "&ROUND((F26*18)/G26,1))) -> 1 : 2
A27: =A26+1 -> 23 | B27: Andrew Baldwin | C27: 15.4 | D27: 17.4 | E27: =D27 -> 17.4 | F27: 6 | G27: 49 | H27: 45.37 % | I27: =IF(G27="","",IF(G27=0,"0 : "&F27*18,"1 : "&ROUND((F27*18)/G27,1))) -> 1 : 2.2
A28: =A27+1 -> 24 | B28: Steve Tilling | C28: 16.3 | D28: 16.5 | E28: =D28 -> 16.5 | F28: 1 | G28: 292 | H28: 44.44 % | I28: =IF(G28="","",IF(G28=0,"0 : "&F28*18,"1 : "&ROUND((F28*18)/G28,1))) -> 1 : 0.1
A29: =A28+1 -> 25 | B29: Alan Baldwin | C29: 18.9 | D29: 22.6 | E29: =D29 -> 22.6 | F29: 8 | G29: 56 | H29: 38.89 % | I29: =IF(G29="","",IF(G29=0,"0 : "&F29*18,"1 : "&ROUND((F29*18)/G29,1))) -> 1 : 2.6
A30: =A29+1 -> 26 | B30: Jon Dey | C30: 35.8 | D30: 36.8 | E30: =D30 -> 36.8 | F30: 1 | G30: 5 | H30: 27.78 % | I30: =IF(G30="","",IF(G30=0,"0 : "&F30*18,"1 : "&ROUND((F30*18)/G30,1))) -> 1 : 3.6
A31: =A30+1 -> 27 | B31: Neil Leah | C31: 15.0 | D31: 15.0 | E31: =D31 -> 15 | F31: 0 | G31: 0 | H31: 0.00 | I31: =IF(G31="","",IF(G31=0,"0 : "&F31*18,"1 : "&ROUND((F31*18)/G31,1))) -> 0 : 0
A32: =A31+1 -> 28 | B32: Malcolm Rouse | C32: 42.9 | D32: 42.9 | E32: =D32 -> 42.9 | F32: 0 | G32: 0 | H32: 0.00 | I32: =IF(G32="","",IF(G32=0,"0 : "&F32*18,"1 : "&ROUND((F32*18)/G32,1))) -> 0 : 0
A33: =A32+1 -> 29 | B33: Keith Johns | C33: 24.3 | D33: 24.3 | E33: =D33 -> 24.3 | F33: 0 | G33: 0 | H33: 0.00 | I33: =IF(G33="","",IF(G33=0,"0 : "&F33*18,"1 : "&ROUND((F33*18)/G33,1))) -> 0 : 0
A34: =A33+1 -> 30 | B34: Dave Archer | C34: 22.0 | D34: 22.0 | E34: =D34 -> 22 | F34: 0 | G34: 0 | H34: 0.00 | I34: =IF(G34="","",IF(G34=0,"0 : "&F34*18,"1 : "&ROUND((F34*18)/G34,1))) -> 0 : 0
A35: =A34+1 -> 31 | B35: Clive Ferris | C35: 26.0 | D35: 26.0 | E35: =D35 -> 26 | F35: 0 | G35: 0 | H35: 0.00 | I35: =IF(G35="","",IF(G35=0,"0 : "&F35*18,"1 : "&ROUND((F35*18)/G35,1))) -> 0 : 0
A36: =A35+1 -> 32 | B36: Andrew Knight | C36: 21.4 | D36: 21.4 | E36: =D36 -> 21.4 | F36: 0 | G36: 0 | H36: 0.00 | I36: =IF(G36="","",IF(G36=0,"0 : "&F36*18,"1 : "&ROUND((F36*18)/G36,1))) -> 0 : 0