A1: Season 7 - April 2nd 2005 to 31st March 2006
A2: MGA World Tour Money List
B3: Statistics updated | C3: =TODAY() -> 38817
A4: Pos | B4: Player | C4: Original Handicap | D4: Current Handicap | E4: Playing Handicap | F4: Events Played | G4: Tour Victories | H4: Winnings
A5: 1 | B5: Robert Thompson | C5: 8.2 | D5: 8.0999999999999837 | E5: =D5 -> 8.0999999999999837 | F5: 51 | G5: 13 | H5: 366250
A6: =A5+1 -> 2 | B6: Kevin Gallagher | C6: 10.4 | D6: 11.80000000000199 | E6: =D6 -> 11.80000000000199 | F6: 47 | G6: 23 | H6: 342500
A7: =A6+1 -> 3 | B7: Jeff Gibbons | C7: 21.7 | D7: 20.000000000003013 | E7: =D7 -> 20.000000000003013 | F7: 48 | G7: 28 | H7: 307500
A8: =A7+1 -> 4 | B8: Keith Mendelson | C8: 14.4 | D8: 15.7 | E8: =D8 -> 15.7 | F8: 44 | G8: 17 | H8: 237500
A9: =A8+1 -> 5 | B9: Alan Hopkins | C9: 7.7 | D9: 8.400000000001997 | E9: =D9 -> 8.400000000001997 | F9: 18 | G9: 5 | H9: 237500
A10: =A9+1 -> 6 | B10: Simon Thompson | C10: 12.7 | D10: 11.6 | E10: =D10 -> 11.6 | F10: 29 | G10: 8 | H10: 190000
A11: =A10+1 -> 7 | B11: Dave Rouse | C11: 22.9 | D11: 24.6 | E11: =D11 -> 24.6 | F11: 18 | G11: 5 | H11: 178750
A12: =A11+1 -> 8 | B12: Roy Dickens | C12: 29.6 | D12: 29.6 | E12: =D12 -> 29.6 | F12: 21 | G12: 4 | H12: 163750
A13: =A12+1 -> 9 | B13: Dave Andrews | C13: 17.2 | D13: 17.500000000001002 | E13: =D13 -> 17.500000000001002 | F13: 22 | G13: 7 | H13: 137500
A14: =A13+1 -> 10 | B14: Paul Carter | C14: 12.4 | D14: 12.8 | E14: =D14 -> 12.8 | F14: 12 | G14: 2 | H14: 115000
A15: =A14+1 -> 11 | B15: Danny Marsh | C15: 10.0 | D15: 8.2000000000009994 | E15: =D15 -> 8.2000000000009994 | F15: 7 | G15: 4 | H15: 112500
A16: =A15+1 -> 12 | B16: Jeff Colbrook | C16: 17.2 | D16: 13.1 | E16: =D16 -> 13.1 | F16: 10 | G16: 4 | H16: 106250
A17: =A16+1 -> 13 | B17: Paul Baldwin | C17: 17.7 | D17: 16.900000000001 | E17: =D17 -> 16.900000000001 | F17: 4 | G17: 1 | H17: 106250
A18: =A17+1 -> 14 | B18: Martin Cox | C18: 11.3 | D18: 12.300000000001996 | E18: =D18 -> 12.300000000001996 | F18: 14 | G18: 0 | H18: 106250
A19: =A18+1 -> 15 | B19: Martin Bould | C19: 18.3 | D19: 20.400000000001 | E19: =D19 -> 20.400000000001 | F19: 14 | G19: 4 | H19: 87500
A20: =A19+1 -> 16 | B20: Matt Carter | C20: 20.0 | D20: 20.9 | E20: =D20 -> 20.9 | F20: 8 | G20: 2 | H20: 78750
A21: =A20+1 -> 17 | B21: Andy Benson | C21: 6.0 | D21: 6.7 | E21: =D21 -> 6.7 | F21: 5 | G21: 1 | H21: 56250
A22: =A21+1 -> 18 | B22: Michael Trimmings | C22: 22.8 | D22: 22.800000000001003 | E22: =D22 -> 22.800000000001003 | F22: 9 | G22: 2 | H22: 55000
A23: =A22+1 -> 19 | B23: Andrew Baldwin | C23: 15.4 | D23: 17.4 | E23: =D23 -> 17.4 | F23: 6 | G23: 0 | H23: 52500
A24: =A23+1 -> 20 | B24: John Press | C24: 15.0 | D24: 14.9 | E24: =D24 -> 14.9 | F24: 3 | G24: 1 | H24: 48750
A25: =A24+1 -> 21 | B25: Alan Baldwin | C25: 18.9 | D25: 22.6 | E25: =D25 -> 22.6 | F25: 8 | G25: 1 | H25: 33750
A26: =A25+1 -> 22 | B26: Ian Edwards | C26: 14.9 | D26: 15.2 | E26: =D26 -> 15.2 | F26: 6 | G26: 4 | H26: 25000
A27: =A26+1 -> 23 | B27: Steve Tilling | C27: 16.3 | D27: 16.5 | E27: =D27 -> 16.5 | F27: 1 | G27: 0 | H27: 13750
A28: =A27+1 -> 24 | B28: Chris Manning | C28: 22.6 | D28: 22.7 | E28: =D28 -> 22.7 | F28: 1 | G28: 0 | H28: 2500
A29: =A28+1 -> 25 | B29: Dave White | C29: 22.0 | D29: 22.1 | E29: =D29 -> 22.1 | F29: 1 | G29: 0 | H29: 2500
A30: =A29+1 -> 26 | B30: Jon Dey | C30: 35.8 | D30: 36.8 | E30: =D30 -> 36.8 | F30: 1 | G30: 0 | H30: 2500
A31: =A30+1 -> 27 | B31: Neil Leah | C31: 15.0 | D31: 15.0 | E31: =D31 -> 15 | F31: 0 | G31: 0 | H31: 0
A32: =A31+1 -> 28 | B32: Malcolm Rouse | C32: 42.9 | D32: 42.9 | E32: =D32 -> 42.9 | F32: 0 | G32: 0 | H32: 0
A33: =A32+1 -> 29 | B33: Keith Johns | C33: 24.3 | D33: 24.3 | E33: =D33 -> 24.3 | F33: 0 | G33: 0 | H33: 0
A34: =A33+1 -> 30 | B34: Dave Archer | C34: 22.0 | D34: 22.0 | E34: =D34 -> 22 | F34: 0 | G34: 0 | H34: 0
A35: =A34+1 -> 31 | B35: Clive Ferris | C35: 26.0 | D35: 26.0 | E35: =D35 -> 26 | F35: 0 | G35: 0 | H35: 0
A36: =A35+1 -> 32 | B36: Andrew Knight | C36: 21.4 | D36: 21.4 | E36: =D36 -> 21.4 | F36: 0 | G36: 0 | H36: 0