A1: Andrew Baldwin
A2: Club | B2: Westgate & Birch
A3: Par/SS | B3: 64/64 | D3: Num. Of Fairways | I3: =IF(B2="","",18-(COUNTIF(B9:B26,3))) -> 10
A4: Date | B4: 38431 | D4: Playing Handicap | I4: 13.9
A5: Event Place | B5: 2 | D5: Prize Money | G5: 2500
A6: Game Stats | B6: DB+ | C6: DB | D6: BI | E6: P | F6: B | G6: E | H6: A | I6: H1
B7: 5 | C7: 5 | D7: 5 | E7: 3 | F7: 0 | G7: 0 | H7: 0 | I7: 0
A8: Hole No | B8: Par | C8: Stroke Index | D8: Gross Score | E8: Points | F8: Putts | G8: Fairways | H8: Ferrets | I8: Green Regulation
A9: 1 | B9: 4 | C9: 11 | D9: 6 | E9: 1 | F9: 2 | G9: 1
A10: 2 | B10: 4 | C10: 7 | D10: 7 | E10: 0 | F10: 3 | G10: 1
A11: 3 | B11: 3 | C11: 15 | D11: 5 | E11: 0 | F11: 2
A12: 4 | B12: 4 | C12: 4 | D12: 5 | E12: 2 | F12: 2 | I12: Yes
A13: 5 | B13: 3 | C13: 17 | D13: 3 | E13: 2 | F13: 2 | I13: Yes
A14: 6 | B14: 4 | C14: 12 | D14: 6 | E14: 1 | F14: 2
A15: 7 | B15: 4 | C15: 1 | D15: 7 | E15: 0 | F15: 3
A16: 8 | B16: 3 | C16: 8 | D16: 3 | E16: 3 | F16: 1 | I16: Yes
A17: 9 | B17: 4 | C17: 5 | D17: 5 | E17: 2 | F17: 1
A18: 10 | B18: 4 | C18: 2 | D18: 6 | E18: 1 | F18: 1 | G18: 1
A19: 11 | B19: 3 | C19: 18 | D19: 10 | E19: 0 | F19: 3
A20: 12 | B20: 4 | C20: 3 | D20: 7 | E20: 0 | F20: 2 | H20: 1
A21: 13 | B21: 3 | C21: 10 | D21: 4 | E21: 2 | F21: 2 | I21: Yes
A22: 14 | B22: 3 | C22: 16 | D22: 3 | E22: 2 | F22: 0
A23: 15 | B23: 3 | C23: 14 | D23: 4 | E23: 2 | F23: 2 | I23: Yes
A24: 16 | B24: 4 | C24: 6 | D24: 6 | E24: 1 | F24: 2
A25: 17 | B25: 3 | C25: 13 | D25: 10 | E25: 0 | F25: 3 | H25: 1
A26: 18 | B26: 4 | C26: 9 | D26: 5 | E26: 2 | F26: 2 | I26: Yes
A27: Totals | B27: =IF(B2="","",SUM(B9:B26)) -> 64 | D27: =IF(B2="","",SUM(D9:D26)) -> 102 | E27: =IF(B2="","",SUM(E9:E26)) -> 21 | F27: =IF(B2="","",SUM(F9:F26)) -> 35 | G27: =IF(B2="","",SUM(G9:G26)) -> 3 | H27: =IF(B2="","",SUM(H9:H26)) -> 2 | I27: =IF(COUNTIF(I9:I26,"=Yes")=0,"",COUNTIF(I9:I26,"=Yes")) -> 6