A1: Jeff Gibbons
A2: Club | B2: Merrist Wood
A3: Par/SS | B3: 72/70 | D3: Num. Of Fairways | I3: =IF(B2="","",18-(COUNTIF(B9:B26,3))) -> 14
A4: Date | B4: 38444 | D4: Playing Handicap | I4: 21.500000000002007
A5: Event Place | B5: 11 | C5: m | D5: Prize Money | G5: 22500
A6: Game Stats | B6: DB+ | C6: DB | D6: BI | E6: P | F6: B | G6: E | H6: A | I6: H1
B7: 4 | C7: 8 | D7: 4 | E7: 2 | F7: 0 | G7: 0 | H7: 0 | I7: 0
A8: Hole No | B8: Par | C8: Stroke Index | D8: Gross Score | E8: Points | F8: Putts | G8: Fairways | H8: Ferrets | I8: Green Regulation
A9: 1 | B9: 4 | C9: 10 | D9: 6 | E9: 1 | F9: 2
A10: 2 | B10: 3 | C10: 18 | D10: 5 | E10: 1 | F10: 2
A11: 3 | B11: 4 | C11: 6 | D11: 6 | E11: 1 | F11: 2
A12: 4 | B12: 5 | C12: 14 | D12: 8 | E12: 0 | F12: 3 | G12: 1
A13: 5 | B13: 4 | C13: 4 | D13: 5 | E13: 3 | F13: 1 | I13: Yes
A14: 6 | B14: 5 | C14: 12 | D14: 7 | E14: 1 | F14: 1
A15: 7 | B15: 4 | C15: 8 | D15: 5 | E15: 2 | F15: 2 | I15: Yes
A16: 8 | B16: 3 | C16: 16 | D16: 3 | E16: 3 | F16: 2 | I16: Yes
A17: 9 | B17: 4 | C17: 2 | D17: 7 | E17: 1 | F17: 2
A18: 10 | B18: 5 | C18: 9 | D18: 5 | E18: 3 | F18: 2 | G18: 1 | I18: Yes
A19: 11 | B19: 3 | C19: 15 | D19: 4 | E19: 2 | F19: 2 | I19: Yes
A20: 12 | B20: 4 | C20: 7 | D20: 5 | E20: 2 | F20: 2 | I20: Yes
A21: 13 | B21: 4 | C21: 1 | D21: 7 | E21: 1 | F21: 2 | G21: 1
A22: 14 | B22: 4 | C22: 13 | D22: 6 | E22: 1 | F22: 1
A23: 15 | B23: 4 | C23: 3 | D23: 6 | E23: 2 | F23: 2 | G23: 1 | I23: Yes
A24: 16 | B24: 3 | C24: 17 | D24: 5 | E24: 1 | F24: 2
A25: 17 | B25: 4 | C25: 5 | D25: 6 | E25: 1 | F25: 2
A26: 18 | B26: 5 | C26: 11 | D26: 8 | E26: 0 | F26: 2
A27: Totals | B27: =IF(B2="","",SUM(B9:B26)) -> 72 | D27: =IF(B2="","",SUM(D9:D26)) -> 104 | E27: =IF(B2="","",SUM(E9:E26)) -> 26 | F27: =IF(B2="","",SUM(F9:F26)) -> 34 | G27: =IF(B2="","",SUM(G9:G26)) -> 4 | H27: =IF(B2="","",SUM(H9:H26)) -> 0 | I27: =IF(COUNTIF(I9:I26,"=Yes")=0,"",COUNTIF(I9:I26,"=Yes")) -> 7