A1: Roy Dickens
A2: Club | B2: Merrist Wood
A3: Par/SS | B3: 72/70 | D3: Num. Of Fairways | I3: =IF(B2="","",18-(COUNTIF(B9:B26,3))) -> 14
A4: Date | B4: 38444 | D4: Playing Handicap | I4: 29.400000000001
A5: Event Place | B5: 8 | C5: m | D5: Prize Money | G5: 27500
A6: Game Stats | B6: DB+ | C6: DB | D6: BI | E6: P | F6: B | G6: E | H6: A | I6: H1
B7: 6 | C7: 7 | D7: 4 | E7: 1 | F7: 0 | G7: 0 | H7: 0 | I7: 0
A8: Hole No | B8: Par | C8: Stroke Index | D8: Gross Score | E8: Points | F8: Putts | G8: Fairways | H8: Ferrets | I8: Green Regulation
A9: 1 | B9: 4 | C9: 10 | D9: 4 | E9: 4 | F9: 1 | G9: 1 | I9: Yes
A10: 2 | B10: 3 | C10: 18 | D10: 4 | E10: 2 | F10: 3 | I10: Yes
A11: 3 | B11: 4 | C11: 6 | D11: 7 | E11: 1 | F11: 2 | H11: 1
A12: 4 | B12: 5 | C12: 14 | D12: 8 | E12: 0 | F12: 3 | G12: 1
A13: 5 | B13: 4 | C13: 4 | D13: 6 | E13: 2 | F13: 2 | I13: Yes
A14: 6 | B14: 5 | C14: 12 | D14: 7 | E14: 1 | F14: 2
A15: 7 | B15: 4 | C15: 8 | D15: 8 | E15: 0 | F15: 2
A16: 8 | B16: 3 | C16: 16 | D16: 5 | E16: 1 | F16: 2
A17: 9 | B17: 4 | C17: 2 | D17: 6 | E17: 2 | F17: 3 | G17: 1 | I17: Yes
A18: 10 | B18: 5 | C18: 9 | D18: 7 | E18: 2 | F18: 2 | I18: Yes
A19: 11 | B19: 3 | C19: 15 | D19: 4 | E19: 2 | F19: 2 | I19: Yes
A20: 12 | B20: 4 | C20: 7 | D20: 7 | E20: 1 | F20: 2
A21: 13 | B21: 4 | C21: 1 | D21: 7 | E21: 1 | F21: 1
A22: 14 | B22: 4 | C22: 13 | D22: 6 | E22: 1 | F22: 2
A23: 15 | B23: 4 | C23: 3 | D23: 6 | E23: 2 | F23: 1
A24: 16 | B24: 3 | C24: 17 | D24: 4 | E24: 2 | F24: 2 | I24: Yes
A25: 17 | B25: 4 | C25: 5 | D25: 8 | E25: 0 | F25: 2 | H25: 1
A26: 18 | B26: 5 | C26: 11 | D26: 6 | E26: 3 | F26: 2 | H26: 1 | I26: Yes
A27: Totals | B27: =IF(B2="","",SUM(B9:B26)) -> 72 | D27: =IF(B2="","",SUM(D9:D26)) -> 110 | E27: =IF(B2="","",SUM(E9:E26)) -> 27 | F27: =IF(B2="","",SUM(F9:F26)) -> 36 | G27: =IF(B2="","",SUM(G9:G26)) -> 3 | H27: =IF(B2="","",SUM(H9:H26)) -> 3 | I27: =IF(COUNTIF(I9:I26,"=Yes")=0,"",COUNTIF(I9:I26,"=Yes")) -> 8