A1: Dave Rouse
A2: Club | B2: Laguna Vilamoura
A3: Par/SS | B3: 72/73 | D3: Num. Of Fairways | I3: =IF(B2="","",18-(COUNTIF(B9:B26,3))) -> 14
A4: Date | B4: 37954 | D4: Playing Handicap | I4: 22.5
A5: Event Place | B5: 3 | D5: Prize Money | G5: 12500
A6: Game Stats | B6: DB+ | C6: DB | D6: Bi | E6: P | F6: B | G6: E | H6: A | I6: H1
B7: 5 | C7: 8 | D7: 2 | E7: 3 | F7: 0 | G7: 0 | H7: 0 | I7: 0
A8: Hole No | B8: Par | C8: Stroke Index | D8: Gross Score | E8: Points | F8: Putts | G8: Fairways | H8: Ferrets | I8: Green Regulation
A9: 1 | B9: 5 | C9: 16 | D9: 5 | E9: 3 | F9: 1 | G9: 1 | I9: Yes
A10: 2 | B10: 3 | C10: 12 | D10: 5 | E10: 1 | F10: 1
A11: 3 | B11: 4 | C11: 4 | D11: 7 | E11: 1 | F11: 2 | G11: 1 | H11: 1
A12: 4 | B12: 3 | C12: 6 | D12: 5 | E12: 1 | F12: 3 | I12: Yes
A13: 5 | B13: 4 | C13: 8 | D13: 7 | E13: 0 | F13: 2 | H13: 1
A14: 6 | B14: 4 | C14: 18 | D14: 4 | E14: 3 | F14: 1 | I14: Yes
A15: 7 | B15: 4 | C15: 10 | D15: 6 | E15: 1 | F15: 2
A16: 8 | B16: 5 | C16: 14 | D16: 8 | E16: 0 | F16: 2 | G16: 1 | H16: 1
A17: 9 | B17: 4 | C17: 2 | D17: 6 | E17: 2 | F17: 2 | I17: Yes
A18: 10 | B18: 5 | C18: 17 | D18: 7 | E18: 1 | F18: 2
A19: 11 | B19: 4 | C19: 7 | D19: 5 | E19: 2 | F19: 2 | I19: Yes
A20: 12 | B20: 3 | C20: 5 | D20: 5 | E20: 2 | F20: 2 | I20: Yes
A21: 13 | B21: 4 | C21: 1 | D21: 7 | E21: 1 | F21: 1 | H21: 1
A22: 14 | B22: 4 | C22: 3 | D22: 10 | E22: 0 | F22: 3 | H22: 2
A23: 15 | B23: 5 | C23: 13 | D23: 7 | E23: 1 | F23: 3 | I23: Yes
A24: 16 | B24: 4 | C24: 15 | D24: 6 | E24: 1 | F24: 2 | G24: 1
A25: 17 | B25: 3 | C25: 11 | D25: 4 | E25: 2 | F25: 2 | I25: Yes
A26: 18 | B26: 4 | C26: 9 | D26: 4 | E26: 3 | F26: 2 | G26: 1 | I26: Yes
A27: Totals | B27: =IF(B2="","",SUM(B9:B26)) -> 72 | D27: =IF(B2="","",SUM(D9:D26)) -> 108 | E27: =IF(B2="","",SUM(E9:E26)) -> 25 | F27: =IF(B2="","",SUM(F9:F26)) -> 35 | G27: =IF(B2="","",SUM(G9:G26)) -> 5 | H27: =IF(B2="","",SUM(H9:H26)) -> 6 | I27: =IF(COUNTIF(I9:I26,"=Yes")=0,"",COUNTIF(I9:I26,"=Yes")) -> 9