A1: Kevin Gallagher
A2: Club | B2: Pyrford
A3: Par/SS | B3: 72/70 | D3: Num. Of Fairways | I3: =IF(B2="","",18-(COUNTIF(B9:B26,3))) -> 14
A4: Date | B4: 37932 | D4: Playing Handicap | I4: 8.5000000000019948
A5: Event Place | B5: 1 | D5: Prize Money | G5: 5000
A6: Game Stats | B6: DB+ | C6: DB | D6: Bi | E6: P | F6: B | G6: E | H6: A | I6: H1
B7: 2 | C7: 1 | D7: 10 | E7: 5 | F7: 0 | G7: 0 | H7: 0 | I7: 0
A8: Hole No | B8: Par | C8: Stroke Index | D8: Gross Score | E8: Points | F8: Putts | G8: Fairways | H8: Ferrets | I8: Green Regulation
A9: 1 | B9: 4 | C9: 6 | D9: 5 | E9: 2 | F9: 1 | G9: 1
A10: 2 | B10: 3 | C10: 14 | D10: 3 | E10: 2 | F10: 2 | I10: Yes
A11: 3 | B11: 4 | C11: 12 | D11: 4 | E11: 2 | F11: 2 | G11: 1 | I11: Yes
A12: 4 | B12: 5 | C12: 8 | D12: 6 | E12: 2 | F12: 2 | G12: 1 | I12: Yes
A13: 5 | B13: 4 | C13: 10 | D13: 5 | E13: 1 | F13: 2
A14: 6 | B14: 3 | C14: 18 | D14: 4 | E14: 1 | F14: 2
A15: 7 | B15: 4 | C15: 4 | D15: 5 | E15: 2 | F15: 2 | I15: Yes
A16: 8 | B16: 4 | C16: 16 | D16: 4 | E16: 2 | F16: 1 | G16: 1
A17: 9 | B17: 5 | C17: 2 | D17: 8 | E17: 0 | F17: 3 | G17: 1
A18: 10 | B18: 3 | C18: 11 | D18: 4 | E18: 1 | F18: 2
A19: 11 | B19: 4 | C19: 1 | D19: 5 | E19: 2 | F19: 2 | G19: 1 | I19: Yes
A20: 12 | B20: 5 | C20: 9 | D20: 6 | E20: 2 | F20: 2 | G20: 1 | I20: Yes
A21: 13 | B21: 4 | C21: 3 | D21: 4 | E21: 3 | F21: 1 | G21: 1 | I21: Yes
A22: 14 | B22: 4 | C22: 15 | D22: 7 | E22: 0 | F22: 1 | H22: 1
A23: 15 | B23: 4 | C23: 13 | D23: 6 | E23: 0 | F23: 2 | H23: 1
A24: 16 | B24: 4 | C24: 5 | D24: 5 | E24: 2 | F24: 2 | G24: 1 | I24: Yes
A25: 17 | B25: 3 | C25: 17 | D25: 3 | E25: 2 | F25: 2 | I25: Yes
A26: 18 | B26: 5 | C26: 7 | D26: 6 | E26: 2 | F26: 1 | G26: 1
A27: Totals | B27: =IF(B2="","",SUM(B9:B26)) -> 72 | D27: =IF(B2="","",SUM(D9:D26)) -> 90 | E27: =IF(B2="","",SUM(E9:E26)) -> 28 | F27: =IF(B2="","",SUM(F9:F26)) -> 32 | G27: =IF(B2="","",SUM(G9:G26)) -> 10 | H27: =IF(B2="","",SUM(H9:H26)) -> 2 | I27: =IF(COUNTIF(I9:I26,"=Yes")=0,"",COUNTIF(I9:I26,"=Yes")) -> 9