A1: Martin Cox
A2: Club | B2: The Old Course
A3: Par/SS | B3: 73/72 | D3: Num. Of Fairways | I3: =IF(B2="","",18-(COUNTIF(B9:B26,3))) -> 14
A4: Date | B4: 37953 | D4: Playing Handicap | I4: 9.7
A5: Event Place | B5: 6 | D5: Prize Money | G5: 5000
A6: Game Stats | B6: DB+ | C6: DB | D6: BI | E6: P | F6: B | G6: E | H6: A | I6: H1
B7: 2 | C7: 4 | D7: 10 | E7: 2 | F7: 0 | G7: 0 | H7: 0 | I7: 0
A8: Hole No | B8: Par | C8: Stroke Index | D8: Gross Score | E8: Points | F8: Putts | G8: Fairways | H8: Ferrets | I8: Green Regulation
A9: 1 | B9: 4 | C9: 17 | D9: 6 | E9: 0 | F9: 3 | G9: 1
A10: 2 | B10: 5 | C10: 5 | D10: 6 | E10: 2 | F10: 2 | G10: 1 | I10: Yes
A11: 3 | B11: 4 | C11: 9 | D11: 5 | E11: 2 | F11: 1
A12: 4 | B12: 3 | C12: 15 | D12: 4 | E12: 1 | F12: 2
A13: 5 | B13: 5 | C13: 10 | D13: 6 | E13: 2 | F13: 3 | G13: 1 | I13: Yes
A14: 6 | B14: 3 | C14: 11 | D14: 4 | E14: 1 | F14: 1
A15: 7 | B15: 4 | C15: 7 | D15: 5 | E15: 2 | F15: 1
A16: 8 | B16: 4 | C16: 1 | D16: 6 | E16: 1 | F16: 2 | G16: 1
A17: 9 | B17: 4 | C17: 13 | D17: 5 | E17: 1 | F17: 2
A18: 10 | B18: 3 | C18: 18 | D18: 3 | E18: 2 | F18: 2 | I18: Yes
A19: 11 | B19: 4 | C19: 4 | D19: 6 | E19: 1 | F19: 2 | G19: 1
A20: 12 | B20: 5 | C20: 6 | D20: 6 | E20: 2 | F20: 2 | G20: 1 | I20: Yes
A21: 13 | B21: 4 | C21: 16 | D21: 5 | E21: 1 | F21: 2
A22: 14 | B22: 5 | C22: 8 | D22: 5 | E22: 3 | F22: 2 | G22: 1 | I22: Yes
A23: 15 | B23: 3 | C23: 14 | D23: 4 | E23: 1 | F23: 2
A24: 16 | B24: 5 | C24: 2 | D24: 8 | E24: 0 | F24: 2
A25: 17 | B25: 4 | C25: 12 | D25: 7 | E25: 0 | F25: 3
A26: 18 | B26: 4 | C26: 3 | D26: 6 | E26: 1 | F26: 2
A27: Totals | B27: =IF(B2="","",SUM(B9:B26)) -> 73 | D27: =IF(B2="","",SUM(D9:D26)) -> 97 | E27: =IF(B2="","",SUM(E9:E26)) -> 23 | F27: =IF(B2="","",SUM(F9:F26)) -> 36 | G27: =IF(B2="","",SUM(G9:G26)) -> 7 | H27: =IF(B2="","",SUM(H9:H26)) -> 0 | I27: =IF(COUNTIF(I9:I26,"=Yes")=0,"",COUNTIF(I9:I26,"=Yes")) -> 5