A1: Martin Cox
A2: Club | B2: Pinhal Vilamoura
A3: Par/SS | B3: 72/71 | D3: Num. Of Fairways | I3: =IF(B2="","",18-(COUNTIF(B9:B26,3))) -> 14
A4: Date | B4: 37954 | D4: Playing Handicap | I4: 10
A5: Event Place | B5: 4 | D5: Prize Money | G5: 10000
A6: Game Stats | B6: DB+ | C6: DB | D6: Bi | E6: P | F6: B | G6: E | H6: A | I6: H1
B7: 1 | C7: 3 | D7: 12 | E7: 2 | F7: 0 | G7: 0 | H7: 0 | I7: 0
A8: Hole No | B8: Par | C8: Stroke Index | D8: Gross Score | E8: Points | F8: Putts | G8: Fairways | H8: Ferrets | I8: Green Regulation
A9: 1 | B9: 5 | C9: 14 | D9: 5 | E9: 2 | F9: 1 | G9: 1
A10: 2 | B10: 4 | C10: 4 | D10: 6 | E10: 1 | F10: 1
A11: 3 | B11: 5 | C11: 10 | D11: 8 | E11: 0 | F11: 2
A12: 4 | B12: 4 | C12: 8 | D12: 4 | E12: 3 | F12: 1 | I12: Yes
A13: 5 | B13: 3 | C13: 18 | D13: 4 | E13: 1 | F13: 2
A14: 6 | B14: 4 | C14: 2 | D14: 5 | E14: 2 | F14: 2 | G14: 1 | I14: Yes
A15: 7 | B15: 4 | C15: 6 | D15: 5 | E15: 2 | F15: 2 | G15: 1 | I15: Yes
A16: 8 | B16: 3 | C16: 12 | D16: 4 | E16: 1 | F16: 1
A17: 9 | B17: 4 | C17: 16 | D17: 5 | E17: 1 | F17: 1 | G17: 1
A18: 10 | B18: 4 | C18: 5 | D18: 5 | E18: 2 | F18: 1 | G18: 1
A19: 11 | B19: 4 | C19: 11 | D19: 5 | E19: 1 | F19: 2 | G19: 1
A20: 12 | B20: 3 | C20: 13 | D20: 4 | E20: 1 | F20: 2
A21: 13 | B21: 5 | C21: 1 | D21: 6 | E21: 2 | F21: 2 | I21: Yes
A22: 14 | B22: 3 | C22: 17 | D22: 4 | E22: 1 | F22: 3 | I22: Yes
A23: 15 | B23: 4 | C23: 15 | D23: 5 | E23: 1 | F23: 2
A24: 16 | B24: 4 | C24: 9 | D24: 6 | E24: 1 | F24: 2
A25: 17 | B25: 5 | C25: 3 | D25: 6 | E25: 2 | F25: 1 | G25: 1
A26: 18 | B26: 4 | C26: 7 | D26: 6 | E26: 1 | F26: 2
A27: Totals | B27: =IF(B2="","",SUM(B9:B26)) -> 72 | D27: =IF(B2="","",SUM(D9:D26)) -> 93 | E27: =IF(B2="","",SUM(E9:E26)) -> 25 | F27: =IF(B2="","",SUM(F9:F26)) -> 30 | G27: =IF(B2="","",SUM(G9:G26)) -> 7 | H27: =IF(B2="","",SUM(H9:H26)) -> 0 | I27: =IF(COUNTIF(I9:I26,"=Yes")=0,"",COUNTIF(I9:I26,"=Yes")) -> 5