A1: Paul Baldwin
A2: Club | B2: The Old Course
A3: Par/SS | B3: 73/72 | D3: Num. Of Fairways | I3: =IF(B2="","",18-(COUNTIF(B9:B26,3))) -> 14
A4: Date | B4: 37953 | D4: Playing Handicap | I4: 16.9
A5: Event Place | B5: 2 | D5: Prize Money | G5: 13750
A6: Game Stats | B6: DB+ | C6: DB | D6: BI | E6: P | F6: B | G6: E | H6: A | I6: H1
B7: 2 | C7: 5 | D7: 6 | E7: 5 | F7: 0 | G7: 0 | H7: 0 | I7: 0
A8: Hole No | B8: Par | C8: Stroke Index | D8: Gross Score | E8: Points | F8: Putts | G8: Fairways | H8: Ferrets | I8: Green Regulation
A9: 1 | B9: 4 | C9: 17 | D9: 4 | E9: 3 | F9: 2 | G9: 1 | I9: Yes
A10: 2 | B10: 5 | C10: 5 | D10: 6 | E10: 2 | F10: 2 | G10: 1 | I10: Yes
A11: 3 | B11: 4 | C11: 9 | D11: 5 | E11: 2 | F11: 2 | G11: 1 | I11: Yes
A12: 4 | B12: 3 | C12: 15 | D12: 5 | E12: 1 | F12: 2
A13: 5 | B13: 5 | C13: 10 | D13: 5 | E13: 3 | F13: 2 | G13: 1 | I13: Yes
A14: 6 | B14: 3 | C14: 11 | D14: 5 | E14: 1 | F14: 1
A15: 7 | B15: 4 | C15: 7 | D15: 4 | E15: 3 | F15: 1 | G15: 1 | I15: Yes
A16: 8 | B16: 4 | C16: 1 | D16: 6 | E16: 1 | F16: 2 | G16: 1
A17: 9 | B17: 4 | C17: 13 | D17: 5 | E17: 2 | F17: 2 | G17: 1 | I17: Yes
A18: 19 | B18: 3 | C18: 18 | D18: 4 | E18: 1 | F18: 2
A19: 20 | B19: 4 | C19: 4 | D19: 7 | E19: 0 | F19: 2 | G19: 1
A20: 21 | B20: 5 | C20: 6 | D20: 11 | E20: 0 | F20: 4
A21: 22 | B21: 4 | C21: 16 | D21: 5 | E21: 2 | F21: 2 | G21: 1 | I21: Yes
A22: 23 | B22: 5 | C22: 8 | D22: 7 | E22: 1 | F22: 2
A23: 24 | B23: 3 | C23: 14 | D23: 3 | E23: 3 | F23: 2 | I23: Yes
A24: 25 | B24: 5 | C24: 2 | D24: 7 | E24: 1 | F24: 1 | G24: 1
A25: 26 | B25: 4 | C25: 12 | D25: 4 | E25: 3 | F25: 1 | G25: 1 | I25: Yes
A26: 27 | B26: 4 | C26: 3 | D26: 5 | E26: 2 | F26: 3 | G26: 1 | I26: Yes
A27: Totals | B27: =IF(B2="","",SUM(B9:B26)) -> 73 | D27: =IF(B2="","",SUM(D9:D26)) -> 98 | E27: =IF(B2="","",SUM(E9:E26)) -> 31 | F27: =IF(B2="","",SUM(F9:F26)) -> 35 | G27: =IF(B2="","",SUM(G9:G26)) -> 12 | H27: =IF(B2="","",SUM(H9:H26)) -> 0 | I27: =IF(COUNTIF(I9:I26,"=Yes")=0,"",COUNTIF(I9:I26,"=Yes")) -> 10