A1: Paul Baldwin
A2: Club | B2: Vila Sol 1-18
A3: Par/SS | B3: 72/72 | D3: Num. Of Fairways | I3: =IF(B2="","",18-(COUNTIF(B9:B26,3))) -> 14
A4: Date | B4: 37955 | D4: Playing Handicap | I4: 17.300000000001006
A5: Event Place | B5: 3 | D5: Prize Money | G5: 10000
A6: Game Stats | B6: DB+ | C6: DB | D6: Bi | E6: P | F6: B | G6: E | H6: A | I6: H1
B7: 4 | C7: 4 | D7: 10 | E7: 0 | F7: 0 | G7: 0 | H7: 0 | I7: 0
A8: Hole No | B8: Par | C8: Stroke Index | D8: Gross Score | E8: Points | F8: Putts | G8: Fairways | H8: Ferrets | I8: Green Regulation
A9: 1 | B9: 4 | C9: 3 | D9: 5 | E9: 2 | F9: 2 | G9: 1 | I9: Yes
A10: 2 | B10: 4 | C10: 7 | D10: 5 | E10: 2 | F10: 2 | I10: Yes
A11: 3 | B11: 4 | C11: 1 | D11: 5 | E11: 2 | F11: 2 | G11: 1 | I11: Yes
A12: 4 | B12: 3 | C12: 15 | D12: 4 | E12: 2 | F12: 2 | I12: Yes
A13: 5 | B13: 4 | C13: 11 | D13: 5 | E13: 2 | F13: 1
A14: 6 | B14: 5 | C14: 9 | D14: 10 | E14: 0 | F14: 3 | H14: 1
A15: 7 | B15: 3 | C15: 13 | D15: 6 | E15: 0 | F15: 3 | H15: 1
A16: 8 | B16: 5 | C16: 5 | D16: 7 | E16: 1 | F16: 2
A17: 9 | B17: 4 | C17: 17 | D17: 5 | E17: 2 | F17: 2 | I17: Yes
A18: 10 | B18: 4 | C18: 10 | D18: 7 | E18: 0 | F18: 3
A19: 11 | B19: 5 | C19: 16 | D19: 8 | E19: 0 | F19: 2 | H19: 1
A20: 12 | B20: 4 | C20: 6 | D20: 6 | E20: 1 | F20: 2
A21: 13 | B21: 3 | C21: 18 | D21: 4 | E21: 1 | F21: 2
A22: 14 | B22: 5 | C22: 2 | D22: 6 | E22: 2 | F22: 2 | I22: Yes
A23: 15 | B23: 3 | C23: 14 | D23: 4 | E23: 2 | F23: 1
A24: 16 | B24: 4 | C24: 8 | D24: 5 | E24: 2 | F24: 1
A25: 17 | B25: 4 | C25: 12 | D25: 6 | E25: 1 | F25: 2
A26: 18 | B26: 4 | C26: 4 | D26: 6 | E26: 1 | F26: 2 | G26: 1
A27: Totals | B27: =IF(B2="","",SUM(B9:B26)) -> 72 | D27: =IF(B2="","",SUM(D9:D26)) -> 104 | E27: =IF(B2="","",SUM(E9:E26)) -> 23 | F27: =IF(B2="","",SUM(F9:F26)) -> 36 | G27: =IF(B2="","",SUM(G9:G26)) -> 3 | H27: =IF(B2="","",SUM(H9:H26)) -> 3 | I27: =IF(COUNTIF(I9:I26,"=Yes")=0,"",COUNTIF(I9:I26,"=Yes")) -> 6