A1: Robert Thompson
A2: Club | B2: Wimbledon Common
A3: Par/SS | B3: 68/66 | D3: Num. Of Fairways | I3: =IF(B2="","",18-(COUNTIF(B9:B26,3))) -> 13
A4: Date | B4: 37926 | D4: Playing Handicap | I4: 7.1
A5: Event Place | B5: 2 | D5: Prize Money | G5: 2500
A6: Game Stats | B6: DB+ | C6: DB | D6: Bi | E6: P | F6: B | G6: E | H6: A | I6: H1
B7: 2 | C7: 3 | D7: 8 | E7: 4 | F7: 1 | G7: 0 | H7: 0 | I7: 0
A8: Hole No | B8: Par | C8: Stroke Index | D8: Gross Score | E8: Points | F8: Putts | G8: Fairways | H8: Ferrets | I8: Green Regulation
A9: 1 | B9: 3 | C9: 7 | D9: 4 | E9: 2 | F9: 2 | I9: Yes
A10: 2 | B10: 4 | C10: 1 | D10: 7 | E10: 0 | F10: 3
A11: 3 | B11: 4 | C11: 14 | D11: 5 | E11: 1 | F11: 2
A12: 4 | B12: 3 | C12: 11 | D12: 5 | E12: 0 | F12: 2
A13: 5 | B13: 4 | C13: 18 | D13: 3 | E13: 3 | F13: 1 | I13: Yes
A14: 6 | B14: 4 | C14: 5 | D14: 6 | E14: 1 | F14: 2
A15: 7 | B15: 4 | C15: 10 | D15: 5 | E15: 1 | F15: 1 | H15: 1
A16: 8 | B16: 3 | C16: 8 | D16: 4 | E16: 1 | F16: 2
A17: 9 | B17: 4 | C17: 16 | D17: 6 | E17: 0 | F17: 2 | G17: 1
A18: 10 | B18: 4 | C18: 15 | D18: 4 | E18: 2 | F18: 2 | G18: 1 | I18: Yes
A19: 11 | B19: 4 | C19: 4 | D19: 4 | E19: 3 | F19: 1 | I19: Yes
A20: 12 | B20: 3 | C20: 6 | D20: 4 | E20: 2 | F20: 2 | I20: Yes
A21: 13 | B21: 4 | C21: 13 | D21: 4 | E21: 2 | F21: 2 | G21: 1 | I21: Yes
A22: 14 | B22: 4 | C22: 2 | D22: 5 | E22: 2 | F22: 3 | G22: 1 | I22: Yes
A23: 15 | B23: 4 | C23: 12 | D23: 5 | E23: 1 | F23: 2
A24: 16 | B24: 3 | C24: 17 | D24: 3 | E24: 2 | F24: 2 | I24: Yes
A25: 17 | B25: 4 | C25: 9 | D25: 10 | E25: 0 | F25: 3 | H25: 1
A26: 18 | B26: 5 | C26: 3 | D26: 6 | E26: 2 | F26: 1 | G26: 1
A27: Totals | B27: =IF(B2="","",SUM(B9:B26)) -> 68 | D27: =IF(B2="","",SUM(D9:D26)) -> 90 | E27: =IF(B2="","",SUM(E9:E26)) -> 25 | F27: =IF(B2="","",SUM(F9:F26)) -> 35 | G27: =IF(B2="","",SUM(G9:G26)) -> 5 | H27: =IF(B2="","",SUM(H9:H26)) -> 2 | I27: =IF(COUNTIF(I9:I26,"=Yes")=0,"",COUNTIF(I9:I26,"=Yes")) -> 8