A1: Jeff Colbrook
A2: Club | B2: Merrist Wood
A3: Par/SS | B3: 72/70 | D3: Num. Of Fairways | I3: =IF(B2="","",18-(COUNTIF(B9:B26,3))) -> 14
A4: Date | B4: 39172 | D4: Playing Handicap | I4: 14.000000000000997
A5: Event Place | B5: 12 | C5: M | D5: Prize Money | G5: 12500
A6: Game Stats | B6: DB+ | C6: DB | D6: BI | E6: P | F6: B | G6: E | H6: A | I6: H1
B7: 5 | C7: 5 | D7: 2 | E7: 6 | F7: 0 | G7: 0 | H7: 0 | I7: 0
A8: Hole No | B8: Par | C8: Stroke Index | D8: Gross Score | E8: Points | F8: Putts | G8: Fairways | H8: Ferrets | I8: Green Regulation
A9: 1 | B9: 4 | C9: 10 | D9: 10 | E9: 0 | F9: 2
A10: 2 | B10: 3 | C10: 18 | D10: 3 | E10: 2 | F10: 1
A11: 3 | B11: 4 | C11: 6 | D11: 6 | E11: 1 | F11: 0 | G11: 1
A12: 4 | B12: 5 | C12: 14 | D12: 6 | E12: 2 | F12: 2 | I12: Yes
A13: 5 | B13: 4 | C13: 4 | D13: 6 | E13: 1 | F13: 2
A14: 6 | B14: 5 | C14: 12 | D14: 8 | E14: 0 | F14: 3
A15: 7 | B15: 4 | C15: 8 | D15: 4 | E15: 3 | F15: 1 | G15: 1 | I15: Yes
A16: 8 | B16: 3 | C16: 16 | D16: 4 | E16: 1 | F16: 1
A17: 9 | B17: 4 | C17: 2 | D17: 8 | E17: 0 | F17: 2
A18: 10 | B18: 5 | C18: 9 | D18: 5 | E18: 3 | F18: 1 | I18: Yes
A19: 11 | B19: 3 | C19: 15 | D19: 3 | E19: 2 | F19: 3 | I19: Yes
A20: 12 | B20: 4 | C20: 7 | D20: 6 | E20: 1 | F20: 2 | G20: 1
A21: 13 | B21: 4 | C21: 1 | D21: 6 | E21: 1 | F21: 1 | G21: 1
A22: 14 | B22: 4 | C22: 13 | D22: 4 | E22: 3 | F22: 2 | I22: Yes
A23: 15 | B23: 4 | C23: 3 | D23: 7 | E23: 0 | F23: 1
A24: 16 | B24: 3 | C24: 17 | D24: 3 | E24: 2 | F24: 1
A25: 17 | B25: 4 | C25: 5 | D25: 6 | E25: 1 | F25: 1
A26: 18 | B26: 5 | C26: 11 | D26: 10 | E26: 0 | F26: 1
A27: Totals | B27: =IF(B2="","",SUM(B9:B26)) -> 72 | D27: =IF(B2="","",SUM(D9:D26)) -> 105 | E27: =IF(B2="","",SUM(E9:E26)) -> 23 | F27: =IF(B2="","",SUM(F9:F26)) -> 27 | G27: =IF(B2="","",SUM(G9:G26)) -> 4 | H27: =IF(B2="","",SUM(H9:H26)) -> 0 | I27: =IF(COUNTIF(I9:I26,"=Yes")=0,"",COUNTIF(I9:I26,"=Yes")) -> 5