A1: Kevin Gallagher
A2: Club | B2: Wimbledon Common
A3: Par/SS | B3: 68/66 | D3: Num. Of Fairways | I3: =IF(B2="","",18-(COUNTIF(B9:B26,3))) -> 13
A4: Date | B4: 39165 | D4: Playing Handicap | I4: 11.000000000000998
A5: Event Place | B5: 3 | D5: Prize Money | G5: 2500
A6: Game Stats | B6: DB+ | C6: DB | D6: Bi | E6: P | F6: B | G6: E | H6: A | I6: H1
B7: 2 | C7: 3 | D7: 9 | E7: 4 | F7: 0 | G7: 0 | H7: 0 | I7: 0
A8: Hole No | B8: Par | C8: Stroke Index | D8: Gross Score | E8: Points | F8: Putts | G8: Fairways | H8: Ferrets | I8: Green Regulation
A9: 1 | B9: 3 | C9: 7 | D9: 4 | E9: 2 | F9: 2 | I9: Yes
A10: 2 | B10: 4 | C10: 1 | D10: 6 | E10: 1 | F10: 3 | G10: 1 | I10: Yes
A11: 3 | B11: 4 | C11: 14 | D11: 5 | E11: 1 | F11: 2 | G11: 1
A12: 4 | B12: 3 | C12: 11 | D12: 10 | E12: 0 | F12: 3 | H12: 1
A13: 5 | B13: 4 | C13: 18 | D13: 5 | E13: 1 | F13: 2 | G13: 1
A14: 6 | B14: 4 | C14: 5 | D14: 5 | E14: 2 | F14: 2 | G14: 1 | I14: Yes
A15: 7 | B15: 4 | C15: 10 | D15: 4 | E15: 3 | F15: 1 | G15: 1 | I15: Yes
A16: 8 | B16: 3 | C16: 8 | D16: 4 | E16: 2 | F16: 2 | I16: Yes
A17: 9 | B17: 4 | C17: 16 | D17: 4 | E17: 2 | F17: 2 | G17: 1 | I17: Yes
A18: 19 | B18: 4 | C18: 15 | D18: 4 | E18: 2 | F18: 2 | G18: 1 | I18: Yes
A19: 20 | B19: 4 | C19: 4 | D19: 5 | E19: 2 | F19: 2 | I19: Yes
A20: 21 | B20: 3 | C20: 6 | D20: 6 | E20: 0 | F20: 4 | I20: Yes
A21: 22 | B21: 4 | C21: 13 | D21: 5 | E21: 1 | F21: 2 | G21: 1
A22: 23 | B22: 4 | C22: 2 | D22: 6 | E22: 1 | F22: 2 | G22: 1
A23: 24 | B23: 4 | C23: 12 | D23: 4 | E23: 2 | F23: 2 | G23: 1 | I23: Yes
A24: 25 | B24: 3 | C24: 17 | D24: 4 | E24: 1 | F24: 3 | I24: Yes
A25: 26 | B25: 4 | C25: 9 | D25: 5 | E25: 2 | F25: 2 | G25: 1 | I25: Yes
A26: 27 | B26: 5 | C26: 3 | D26: 7 | E26: 1 | F26: 2
A27: Totals | B27: =IF(B2="","",SUM(B9:B26)) -> 68 | D27: =IF(B2="","",SUM(D9:D26)) -> 93 | E27: =IF(B2="","",SUM(E9:E26)) -> 26 | F27: =IF(B2="","",SUM(F9:F26)) -> 40 | G27: =IF(B2="","",SUM(G9:G26)) -> 11 | H27: =IF(B2="","",SUM(H9:H26)) -> 1 | I27: =IF(COUNTIF(I9:I26,"=Yes")=0,"",COUNTIF(I9:I26,"=Yes")) -> 12