A1: Matthew Carter
A2: Club | B2: Hoebridge
A3: Par/SS | B3: 71/70 | D3: Num. Of Fairways | I3: =IF(B2="","",18-(COUNTIF(B9:B26,3))) -> 13
A4: Date | B4: 39151 | D4: Playing Handicap | I4: 21.3
A5: Event Place | B5: 1 | D5: Prize Money | G5: 13750
A6: Game Stats | B6: DB+ | C6: DB | D6: Bi | E6: P | F6: B | G6: E | H6: A | I6: H1
B7: 2 | C7: 2 | D7: 10 | E7: 4 | F7: 0 | G7: 0 | H7: 0 | I7: 0
A8: Hole No | B8: Par | C8: Stroke Index | D8: Gross Score | E8: Points | F8: Putts | G8: Fairways | H8: Ferrets | I8: Green Regulation
A9: 1 | B9: 5 | C9: 11 | D9: 6 | E9: 2 | F9: 2 | G9: 1 | I9: Yes
A10: 2 | B10: 3 | C10: 17 | D10: 4 | E10: 2 | F10: 2 | I10: Yes
A11: 3 | B11: 5 | C11: 7 | D11: 6 | E11: 2 | F11: 2 | I11: Yes
A12: 4 | B12: 4 | C12: 1 | D12: 5 | E12: 3 | F12: 1 | I12: Yes
A13: 5 | B13: 4 | C13: 5 | D13: 4 | E13: 3 | F13: 1 | G13: 1 | I13: Yes
A14: 6 | B14: 3 | C14: 15 | D14: 4 | E14: 2 | F14: 2 | I14: Yes
A15: 7 | B15: 4 | C15: 3 | D15: 7 | E15: 1 | F15: 3 | G15: 1 | I15: Yes
A16: 8 | B16: 4 | C16: 9 | D16: 5 | E16: 2 | F16: 2 | G16: 1 | I16: Yes
A17: 9 | B17: 5 | C17: 13 | D17: 7 | E17: 1 | F17: 2 | G17: 1
A18: 10 | B18: 4 | C18: 12 | D18: 5 | E18: 2 | F18: 1
A19: 11 | B19: 4 | C19: 4 | D19: 5 | E19: 2 | F19: 2 | G19: 1 | I19: Yes
A20: 12 | B20: 3 | C20: 18 | D20: 4 | E20: 2 | F20: 2 | I20: Yes
A21: 13 | B21: 5 | C21: 8 | D21: 7 | E21: 1 | F21: 2 | G21: 1
A22: 14 | B22: 4 | C22: 14 | D22: 5 | E22: 2 | F22: 2 | I22: Yes
A23: 15 | B23: 4 | C23: 2 | D23: 4 | E23: 4 | F23: 1 | G23: 1 | I23: Yes
A24: 16 | B24: 3 | C24: 10 | D24: 7 | E24: 0 | F24: 2
A25: 17 | B25: 5 | C25: 6 | D25: 5 | E25: 3 | F25: 1 | I25: Yes
A26: 18 | B26: 3 | C26: 16 | D26: 3 | E26: 3 | F26: 2 | I26: Yes
A27: Totals | B27: =IF(B2="","",SUM(B9:B26)) -> 72 | D27: =IF(B2="","",SUM(D9:D26)) -> 93 | E27: =IF(B2="","",SUM(E9:E26)) -> 37 | F27: =IF(B2="","",SUM(F9:F26)) -> 32 | G27: =IF(B2="","",SUM(G9:G26)) -> 8 | H27: =IF(B2="","",SUM(H9:H26)) -> 0 | I27: =IF(COUNTIF(I9:I26,"=Yes")=0,"",COUNTIF(I9:I26,"=Yes")) -> 14