A1: Roy Dickens
A2: Club | B2: Merrist Wood
A3: Par/SS | B3: 72/70 | D3: Num. Of Fairways | I3: =IF(B2="","",18-(COUNTIF(B9:B26,3))) -> 14
A4: Date | B4: 39172 | D4: Playing Handicap | I4: 29.500000000001002
A5: Event Place | B5: 14 | C5: M | D5: Prize Money | G5: 7500
A6: Game Stats | B6: DB+ | C6: DB | D6: BI | E6: P | F6: B | G6: E | H6: A | I6: H1
B7: 10 | C7: 5 | D7: 1 | E7: 2 | F7: 0 | G7: 0 | H7: 0 | I7: 0
A8: Hole No | B8: Par | C8: Stroke Index | D8: Gross Score | E8: Points | F8: Putts | G8: Fairways | H8: Ferrets | I8: Green Regulation
A9: 1 | B9: 4 | C9: 10 | D9: 6 | E9: 2 | F9: 3 | I9: Yes
A10: 2 | B10: 3 | C10: 18 | D10: 5 | E10: 1 | F10: 2
A11: 3 | B11: 4 | C11: 6 | D11: 9 | E11: 0 | F11: 2 | G11: 1 | H11: 2
A12: 4 | B12: 5 | C12: 14 | D12: 8 | E12: 0 | F12: 2 | H12: 1
A13: 5 | B13: 4 | C13: 4 | D13: 7 | E13: 1 | F13: 2
A14: 6 | B14: 5 | C14: 12 | D14: 7 | E14: 2 | F14: 1
A15: 7 | B15: 4 | C15: 8 | D15: 4 | E15: 4 | F15: 1 | G15: 1 | I15: Yes
A16: 8 | B16: 3 | C16: 16 | D16: 6 | E16: 0 | F16: 2
A17: 9 | B17: 4 | C17: 2 | D17: 9 | E17: 0 | F17: 3 | G17: 1
A18: 10 | B18: 5 | C18: 9 | D18: 6 | E18: 3 | F18: 2 | G18: 1 | I18: Yes
A19: 11 | B19: 3 | C19: 15 | D19: 3 | E19: 3 | F19: 1 | I19: Yes
A20: 12 | B20: 4 | C20: 7 | D20: 6 | E20: 2 | F20: 2 | G20: 1 | I20: Yes
A21: 13 | B21: 4 | C21: 1 | D21: 7 | E21: 1 | F21: 2 | G21: 1
A22: 14 | B22: 4 | C22: 13 | D22: 6 | E22: 1 | F22: 3 | G22: 1 | I22: Yes
A23: 15 | B23: 4 | C23: 3 | D23: 8 | E23: 0 | F23: 2 | H23: 1
A24: 16 | B24: 3 | C24: 17 | D24: 6 | E24: 0 | F24: 2
A25: 17 | B25: 4 | C25: 5 | D25: 8 | E25: 0 | F25: 3 | H25: 1
A26: 18 | B26: 5 | C26: 11 | D26: 8 | E26: 1 | F26: 2
A27: Totals | B27: =IF(B2="","",SUM(B9:B26)) -> 72 | D27: =IF(B2="","",SUM(D9:D26)) -> 119 | E27: =IF(B2="","",SUM(E9:E26)) -> 21 | F27: =IF(B2="","",SUM(F9:F26)) -> 37 | G27: =IF(B2="","",SUM(G9:G26)) -> 7 | H27: =IF(B2="","",SUM(H9:H26)) -> 5 | I27: =IF(COUNTIF(I9:I26,"=Yes")=0,"",COUNTIF(I9:I26,"=Yes")) -> 6