A1: CHINNEY CHOO - 2004/2005
B3: Rousey Invitation 22/5/04 | C3: Bubble Open 17/7/04 | D3: Tubby Trophy 17/9/04 | E3: Mendy's Masters | F3: Players Championship | G3: Thommo Classic | H3: Total
A4: EUROPE
A5: D Andrews | B5: 32 | C5: 29 | D5: 27 | G5: 24 | H5: =SUM(B5:G5) -> 112
A6: R Thompson | B6: 36 | C6: 26 | D6: 21 | G6: 25 | H6: =SUM(B6:G6) -> 108
A7: J Gibbons | B7: 18 | C7: 31 | D7: 24 | G7: 26 | H7: =SUM(B7:G7) -> 99
A8: J Colbrook | B8: 32 | C8: 34 | D8: 0 | G8: 28 | H8: =SUM(B8:G8) -> 94
A9: R Dickens | B9: 28 | C9: 31 | D9: 0 | G9: 27 | H9: =SUM(B9:G9) -> 86
A10: K Mendelson | B10: 30 | C10: 35 | D10: 0 | G10: 19 | H10: =SUM(B10:G10) -> 84
A11: M Cox | B11: 31 | C11: 0 | D11: 24 | G11: 29 | H11: =SUM(B11:G11) -> 84
A12: A Baldwin (Jnr) | B12: 24 | C12: 32 | D12: 0 | G12: 18 | H12: =SUM(B12:G12) -> 74
A13: I Edwards | B13: 29 | C13: 0 | D13: 0 | G13: 31 | H13: =SUM(B13:G13) -> 60
A14: J Dey | B14: 26 | C14: 0 | D14: 0 | G14: 28 | H14: =SUM(B14:G14) -> 54
A15: A Baldwin (Snr) | B15: 29 | C15: 0 | D15: 0 | G15: 21 | H15: =SUM(B15:G15) -> 50
A16: M Bould | B16: 26 | C16: 0 | D16: 0 | G16: 13 | H16: =SUM(B16:G16) -> 39
A17: K Johns | B17: 0 | C17: 0 | D17: 0 | G17: 0 | H17: =SUM(B17:G17) -> 0
A18: S Owens | B18: 0 | C18: 0 | D18: 0 | G18: 0 | H18: =SUM(B18:G18) -> 0
A19: D White | B19: 0 | C19: 0 | D19: 0 | G19: 0 | H19: =SUM(B19:G19) -> 0
A20: D Archer | B20: 0 | C20: 0 | D20: 0 | G20: 0 | H20: =SUM(B20:G20) -> 0
B21: =SUM(B5:B20) -> 341 | C21: =SUM(C5:C20) -> 218 | D21: =SUM(D5:D20) -> 96 | E21: =SUM(E5:E20) -> 0 | F21: =SUM(F5:F20) -> 0 | G21: =SUM(G5:G20) -> 289 | H21: =SUM(H5:H20) -> 944
A22: USA
A23: S Thompson | B23: 38 | C23: 33 | D23: 33 | G23: 31 | H23: =SUM(B23:G23) -> 135
A24: P Carter | B24: 33 | C24: 30 | D24: 21 | G24: 25 | H24: =SUM(B24:G24) -> 109
A25: K Gallagher | B25: 31 | C25: 35 | D25: 26 | G25: 0 | H25: =SUM(B25:G25) -> 92
A26: D Rouse | B26: 32 | C26: 24 | D26: 9 | G26: 24 | H26: =SUM(B26:G26) -> 89
A27: J Press | B27: 29 | C27: 0 | D27: 19 | G27: 27 | H27: =SUM(B27:G27) -> 75
A28: S Tilling | B28: 29 | C28: 0 | D28: 0 | G28: 27 | H28: =SUM(B28:G28) -> 56
A29: A Hopkins | B29: 24 | C29: 0 | D29: 0 | G29: 28 | H29: =SUM(B29:G29) -> 52
A30: D Marsh | B30: 0 | C30: 20 | D30: 0 | G30: 29 | H30: =SUM(B30:G30) -> 49
A31: C Manning | B31: 31 | C31: 0 | D31: 0 | G31: 0 | H31: =SUM(B31:G31) -> 31
A32: P Baldwin | B32: 22 | C32: 0 | D32: 0 | G32: 0 | H32: =SUM(B32:G32) -> 22
A33: A Benson | B33: 0 | C33: 0 | D33: 0 | G33: 0 | H33: =SUM(B33:G33) -> 0
A34: C Ferris | B34: 0 | C34: 0 | D34: 0 | G34: 0 | H34: =SUM(B34:G34) -> 0
A35: M Trimmings | B35: 0 | C35: 0 | D35: 0 | G35: 0 | H35: =SUM(B35:G35) -> 0
A36: M Rouse | B36: 0 | C36: 0 | D36: 0 | G36: 0 | H36: =SUM(B36:G36) -> 0
A37: N Leah | B37: 0 | C37: 0 | D37: 0 | G37: 0 | H37: =SUM(B37:G37) -> 0
A38: M Edmond | B38: 0 | C38: 0 | D38: 0 | G38: 0 | H38: =SUM(B38:G38) -> 0
B39: =SUM(B23:B38) -> 269 | C39: =SUM(C23:C38) -> 142 | D39: =SUM(D23:D38) -> 108 | E39: =SUM(E23:E38) -> 0 | F39: =SUM(F23:F38) -> 0 | G39: =SUM(G23:G38) -> 191 | H39: =SUM(H23:H38) -> 710