A1: Season 6 - April 1st 2004 to 31st March 2005
A2: MGA World Tour Order of Merit
B3: Statistics updated | C3: =TODAY() -> 38446
A4: Pos | B4: Player | C4: Original Handicap | D4: Current Handicap | E4: Playing Handicap | F4: Played | G4: Points | H4: Average | I4: HI / LOW Score | J4: Qualified (10 games)
A5: 1 | B5: Simon Thompson | C5: 16.0 | D5: 12.7 | E5: =D5 -> 12.7 | F5: 25 | G5: 816 | H5: =IF(ISERROR(G5/F5),0,G5/F5) -> 32.64 | I5: 39 / 23 | J5: =IF(F5>=10,"Yes","") -> Yes
A6: =IF(J6="","",A5+1) -> 2 | B6: Dave Andrews | C6: 18.5 | D6: 17.2 | E6: =D6 -> 17.2 | F6: 22 | G6: 713 | H6: =IF(ISERROR(G6/F6),0,G6/F6) -> 32.409090909090907 | I6: 40 / 24 | J6: =IF(F6>=10,"Yes","") -> Yes
A7: =IF(J7="","",A6+1) -> 3 | B7: Martin Cox | C7: 11.0 | D7: 11.3 | E7: =D7 -> 11.3 | F7: 10 | G7: 316 | H7: =IF(ISERROR(G7/F7),0,G7/F7) -> 31.60 | I7: 36 / 24 | J7: =IF(F7>=10,"Yes","") -> Yes
A8: =IF(J8="","",A7+1) -> 4 | B8: Robert Thompson | C8: 6.9 | D8: 8.2 | E8: =D8 -> 8.2 | F8: 43 | G8: 1347 | H8: =IF(ISERROR(G8/F8),0,G8/F8) -> 31.325581395348838 | I8: 41 / 21 | J8: =IF(F8>=10,"Yes","") -> Yes
A9: =IF(J9="","",A8+1) -> 5 | B9: Ian Edwards | C9: 14.6 | D9: 14.9 | E9: =D9 -> 14.9 | F9: 12 | G9: 366 | H9: =IF(ISERROR(G9/F9),0,G9/F9) -> 30.50 | I9: 37 / 25 | J9: =IF(F9>=10,"Yes","") -> Yes
A10: =IF(J10="","",A9+1) -> 6 | B10: Kevin Gallagher | C10: 7.4 | D10: 10.40000000000199 | E10: =D10 -> 10.40000000000199 | F10: 39 | G10: 1161 | H10: =IF(ISERROR(G10/F10),0,G10/F10) -> 29.76923076923077 | I10: 37 / 20 | J10: =IF(F10>=10,"Yes","") -> Yes
A11: =IF(J11="","",A10+1) -> 7 | B11: Keith Mendelson | C11: 11.4 | D11: 14.4 | E11: =D11 -> 14.4 | F11: 47 | G11: 1392 | H11: =IF(ISERROR(G11/F11),0,G11/F11) -> 29.617021276595743 | I11: 40 / 18 | J11: =IF(F11>=10,"Yes","") -> Yes
A12: =IF(J12="","",A11+1) -> 8 | B12: Jeff Gibbons | C12: 13.3 | D12: 21.700000000002007 | E12: =D12 -> 21.700000000002007 | F12: 50 | G12: 1410 | H12: =IF(ISERROR(G12/F12),0,G12/F12) -> 28.20 | I12: 39 / 17 | J12: =IF(F12>=10,"Yes","") -> Yes
A13: =IF(J13="","",A12+1) -> 9 | B13: Roy Dickens | C13: 28.5 | D13: 29.600000000001 | E13: =D13 -> 29.600000000001 | F13: 10 | G13: 282 | H13: =IF(ISERROR(G13/F13),0,G13/F13) -> 28.20 | I13: 40 / 17 | J13: =IF(F13>=10,"Yes","") -> Yes
A14: =IF(J14="","",A13+1) -> 10 | B14: Danny Marsh | C14: 7.8 | D14: 10.000000000001995 | E14: =D14 -> 10.000000000001995 | F14: 16 | G14: 449 | H14: =IF(ISERROR(G14/F14),0,G14/F14) -> 28.0625 | I14: 35 / 19 | J14: =IF(F14>=10,"Yes","") -> Yes
A15: =IF(J15="","",A14+1) -> 11 | B15: Dave Rouse | C15: 22.1 | D15: 22.9 | E15: =D15 -> 22.9 | F15: 11 | G15: 304 | H15: =IF(ISERROR(G15/F15),0,G15/F15) -> 27.636363636363637 | I15: 41 / 9 | J15: =IF(F15>=10,"Yes","") -> Yes
A16: =IF(J16="","",A15+1) ->  | B16: Clive Ferris | C16: 26.6 | D16: 26.0 | E16: =D16 -> 26 | F16: 2 | G16: 70 | H16: =IF(ISERROR(G16/F16),0,G16/F16) -> 35.00 | I16: 39 / 31 | J16: =IF(F16>=10,"Yes","") -> 
A17: =IF(J17="","",A16+1) ->  | B17: Alan Baldwin | C17: 19.4 | D17: 18.9 | E17: =D17 -> 18.9 | F17: 5 | G17: 161 | H17: =IF(ISERROR(G17/F17),0,G17/F17) -> 32.20 | I17: 39 / 21 | J17: =IF(F17>=10,"Yes","") -> 
A18: =IF(J18="","",A17+1) ->  | B18: Andy Benson | C18: 7.6 | D18: 6.0 | E18: =D18 -> 6 | F18: 5 | G18: 159 | H18: =IF(ISERROR(G18/F18),0,G18/F18) -> 31.80 | I18: 42 / 23 | J18: =IF(F18>=10,"Yes","") -> 
A19: =IF(J19="","",A18+1) ->  | B19: Chris Manning | C19: 22.5 | D19: 22.6 | E19: =D19 -> 22.6 | F19: 1 | G19: 31 | H19: =IF(ISERROR(G19/F19),0,G19/F19) -> 31.00 | I19: 31 / 31 | J19: =IF(F19>=10,"Yes","") -> 
A20: =IF(J20="","",A19+1) ->  | B20: Jeff Colbrook | C20: 17.2 | D20: 17.200000000001001 | E20: =D20 -> 17.200000000001001 | F20: 4 | G20: 123 | H20: =IF(ISERROR(G20/F20),0,G20/F20) -> 30.75 | I20: 34 / 28 | J20: =IF(F20>=10,"Yes","") -> 
A21: =IF(J21="","",A20+1) ->  | B21: Jon Dey | C21: 35.5 | D21: 35.800000000001006 | E21: =D21 -> 35.800000000001006 | F21: 3 | G21: 89 | H21: =IF(ISERROR(G21/F21),0,G21/F21) -> 29.666666666666668 | I21: 35 / 26 | J21: =IF(F21>=10,"Yes","") -> 
A22: =IF(J22="","",A21+1) ->  | B22: Steve Tilling | C22: 15.9 | D22: 16.300000000000999 | E22: =D22 -> 16.300000000000999 | F22: 4 | G22: 117 | H22: =IF(ISERROR(G22/F22),0,G22/F22) -> 29.25 | I22: 33 / 27 | J22: =IF(F22>=10,"Yes","") -> 
A23: =IF(J23="","",A22+1) ->  | B23: Paul Baldwin | C23: 17.0 | D23: 17.7 | E23: =D23 -> 17.7 | F23: 9 | G23: 255 | H23: =IF(ISERROR(G23/F23),0,G23/F23) -> 28.333333333333332 | I23: 40 / 17 | J23: =IF(F23>=10,"Yes","") -> 
A24: =IF(J24="","",A23+1) ->  | B24: Paul Carter | C24: 11.8 | D24: 12.4 | E24: =D24 -> 12.4 | F24: 5 | G24: 139 | H24: =IF(ISERROR(G24/F24),0,G24/F24) -> 27.80 | I24: 33 / 21 | J24: =IF(F24>=10,"Yes","") -> 
A25: =IF(J25="","",A24+1) ->  | B25: Alan Hopkins | C25: 7.2 | D25: 7.7000000000010003 | E25: =D25 -> 7.7000000000010003 | F25: 3 | G25: 79 | H25: =IF(ISERROR(G25/F25),0,G25/F25) -> 26.333333333333332 | I25: 28 / 24 | J25: =IF(F25>=10,"Yes","") -> 
A26: =IF(J26="","",A25+1) ->  | B26: Michael Trimmings | C26: 22.6 | D26: 22.8 | E26: =D26 -> 22.8 | F26: 1 | G26: 26 | H26: =IF(ISERROR(G26/F26),0,G26/F26) -> 26.00 | I26: 26 / 26 | J26: =IF(F26>=10,"Yes","") -> 
A27: =IF(J27="","",A26+1) ->  | B27: Martin Bould | C27: 17.7 | D27: 18.3 | E27: =D27 -> 18.3 | F27: 5 | G27: 126 | H27: =IF(ISERROR(G27/F27),0,G27/F27) -> 25.20 | I27: 40 / 13 | J27: =IF(F27>=10,"Yes","") -> 
A28: =IF(J28="","",A27+1) ->  | B28: John Press | C28: 14.2 | D28: 15.0 | E28: =D28 -> 15 | F28: 3 | G28: 75 | H28: =IF(ISERROR(G28/F28),0,G28/F28) -> 25.00 | I28: 29 / 19 | J28: =IF(F28>=10,"Yes","") -> 
A29: =IF(J29="","",A28+1) ->  | B29: Andrew Baldwin | C29: 13.0 | D29: 15.4 | E29: =D29 -> 15.4 | F29: 7 | G29: 173 | H29: =IF(ISERROR(G29/F29),0,G29/F29) -> 24.714285714285715 | I29: 32 / 18 | J29: =IF(F29>=10,"Yes","") -> 
A30: =IF(J30="","",A29+1) ->  | B30: Simon Owens | C30: 16.0 | D30: 16.0 | E30: =D30 -> 16 | F30: 0 | G30: 0 | H30: =IF(ISERROR(G30/F30),0,G30/F30) -> 0.00 | I30: / | J30: =IF(F30>=10,"Yes","") -> 
A31: =IF(J31="","",A30+1) ->  | B31: Keith Johns | C31: 24.3 | D31: 24.3 | E31: =D31 -> 24.3 | F31: 0 | G31: 0 | H31: =IF(ISERROR(G31/F31),0,G31/F31) -> 0.00 | I31: / | J31: =IF(F31>=10,"Yes","") -> 
A32: =IF(J32="","",A31+1) ->  | B32: Neil Leah | C32: 15.0 | D32: 15.0 | E32: =D32 -> 15 | F32: 0 | G32: 0 | H32: =IF(ISERROR(G32/F32),0,G32/F32) -> 0.00 | I32: / | J32: =IF(F32>=10,"Yes","") -> 
A33: =IF(J33="","",A32+1) ->  | B33: Mike Edmond | C33: 36.5 | D33: 36.5 | E33: =D33 -> 36.5 | F33: 0 | G33: 0 | H33: =IF(ISERROR(G33/F33),0,G33/F33) -> 0.00 | I33: / | J33: =IF(F33>=10,"Yes","") -> 
A34: =IF(J34="","",A33+1) ->  | B34: Malcolm Rouse | C34: 42.9 | D34: 42.9 | E34: =D34 -> 42.9 | F34: 0 | G34: 0 | H34: =IF(ISERROR(G34/F34),0,G34/F34) -> 0.00 | I34: / | J34: =IF(F34>=10,"Yes","") -> 
A35: =IF(J35="","",A34+1) ->  | B35: Dave Archer | C35: 22.0 | D35: 22.0 | E35: =D35 -> 22 | F35: 0 | G35: 0 | H35: =IF(ISERROR(G35/F35),0,G35/F35) -> 0.00 | I35: / | J35: =IF(F35>=10,"Yes","") -> 
A36: =IF(J36="","",A35+1) ->  | B36: Andrew Knight | C36: 21.4 | D36: 21.4 | E36: =D36 -> 21.4 | F36: 0 | G36: 0 | H36: =IF(ISERROR(G36/F36),0,G36/F36) -> 0.00 | I36: / | J36: =IF(F36>=10,"Yes","") -> 