A1: Matthew Carter
A2: Club | B2: Coombe Wood
A3: Par/SS | B3: 66/65 | D3: Num. Of Fairways
A4: Date | B4: 41431 | D4: Playing Handicap | I4: 17.7
A5: Event Place | B5: 1 | D5: Prize Money | G5: 5000
A6: Game Stats | B6: DB+ | C6: DB | D6: BI | E6: P | F6: B | G6: E | H6: A | I6: H1
B7: 1 | C7: 8 | D7: 5 | E7: 4 | F7: 0 | G7: 0 | H7: 0 | I7: 0
A8: Hole No | B8: Par | C8: Stroke Index | D8: Gross Score | E8: Points | F8: Putts | G8: Fairways | H8: Ferrets | I8: Green Regulation
A9: 1 | B9: 5 | C9: 11 | D9: 6 | E9: 2 | F9: 3 | I9: Yes
A10: 2 | B10: 4 | C10: 15 | D10: 6 | E10: 1 | F10: 2
A11: 3 | B11: 3 | C11: 3 | D11: 4 | E11: 2 | F11: 2 | I11: Yes
A12: 4 | B12: 4 | C12: 7 | D12: 4 | E12: 3 | F12: 2 | G12: 1 | I12: Yes
A13: 5 | B13: 3 | C13: 13 | D13: 5 | E13: 1 | F13: 2
A14: 6 | B14: 4 | C14: 1 | D14: 4 | E14: 3 | F14: 2 | G14: 1 | I14: Yes
A15: 7 | B15: 4 | C15: 17 | D15: 5 | E15: 2 | F15: 2 | I15: Yes
A16: 8 | B16: 3 | C16: 5 | D16: 5 | E16: 1 | F16: 3 | I16: Yes
A17: 9 | B17: 4 | C17: 9 | D17: 6 | E17: 1 | F17: 2
A18: 10 | B18: 3 | C18: 12 | D18: 5 | E18: 1 | F18: 3 | I18: Yes
A19: 11 | B19: 4 | C19: 4 | D19: 4 | E19: 3 | F19: 1 | I19: Yes
A20: 12 | B20: 3 | C20: 14 | D20: 5 | E20: 1 | F20: 3 | I20: Yes
A21: 13 | B21: 4 | C21: 2 | D21: 8 | E21: 0 | F21: 1
A22: 14 | B22: 3 | C22: 16 | D22: 5 | E22: 1 | F22: 3 | I22: Yes
A23: 15 | B23: 4 | C23: 6 | D23: 5 | E23: 2 | F23: 2 | I23: Yes
A24: 16 | B24: 4 | C24: 18 | D24: 5 | E24: 2 | F24: 1
A25: 17 | B25: 3 | C25: 8 | D25: 5 | E25: 1 | F25: 3 | I25: Yes
A26: 18 | B26: 4 | C26: 10 | D26: 4 | E26: 3 | F26: 1 | G26: 1 | I26: Yes
A27: Totals | B27: =IF(B2="","",SUM(B9:B26)) -> 66 | D27: =IF(B2="","",SUM(D9:D26)) -> 91 | E27: =IF(B2="","",SUM(E9:E26)) -> 30 | F27: =IF(B2="","",SUM(F9:F26)) -> 38 | G27: =IF(B2="","",SUM(G9:G26)) -> 3 | H27: =IF(B2="","",SUM(H9:H26)) -> 0 | I27: =IF(COUNTIF(I9:I26,"=Yes")=0,"",COUNTIF(I9:I26,"=Yes")) -> 13

A1: Paul Carter
A2: Club | B2: Coombe Wood
A3: Par/SS | B3: 66/65 | D3: Num. Of Fairways
A4: Date | B4: 41431 | D4: Playing Handicap | I4: 14.2
A5: Event Place | B5: 2 | D5: Prize Money | G5: 2500
A6: Game Stats | B6: DB+ | C6: DB | D6: BI | E6: P | F6: B | G6: E | H6: A | I6: H1
B7: 3 | C7: 5 | D7: 5 | E7: 5 | F7: 0 | G7: 0 | H7: 0 | I7: 0
A8: Hole No | B8: Par | C8: Stroke Index | D8: Gross Score | E8: Points | F8: Putts | G8: Fairways | H8: Ferrets | I8: Green Regulation
A9: 1 | B9: 5 | C9: 11 | D9: 7 | E9: 1 | F9: 1
A10: 2 | B10: 4 | C10: 15 | D10: 4 | E10: 2 | F10: 1
A11: 3 | B11: 3 | C11: 3 | D11: 3 | E11: 3 | F11: 2 | I11: Yes
A12: 4 | B12: 4 | C12: 7 | D12: 5 | E12: 2 | F12: 3 | G12: 1 | I12: Yes
A13: 5 | B13: 3 | C13: 13 | D13: 4 | E13: 2 | F13: 2 | I13: Yes
A14: 6 | B14: 4 | C14: 1 | D14: 8 | E14: 0 | F14: 3
A15: 7 | B15: 4 | C15: 17 | D15: 4 | E15: 2 | F15: 2 | I15: Yes
A16: 8 | B16: 3 | C16: 5 | D16: 6 | E16: 0 | F16: 2
A17: 9 | B17: 4 | C17: 9 | D17: 6 | E17: 1 | F17: 2
A18: 10 | B18: 3 | C18: 12 | D18: 10 | E18: 0 | F18: 3
A19: 11 | B19: 4 | C19: 4 | D19: 6 | E19: 1 | F19: 2
A20: 12 | B20: 3 | C20: 14 | D20: 4 | E20: 2 | F20: 2 | I20: Yes
A21: 13 | B21: 4 | C21: 2 | D21: 5 | E21: 2 | F21: 2 | I21: Yes
A22: 14 | B22: 3 | C22: 16 | D22: 5 | E22: 0 | F22: 3
A23: 15 | B23: 4 | C23: 6 | D23: 4 | E23: 3 | F23: 2 | I23: Yes
A24: 16 | B24: 4 | C24: 18 | D24: 5 | E24: 1 | F24: 2
A25: 17 | B25: 3 | C25: 8 | D25: 5 | E25: 1 | F25: 2
A26: 18 | B26: 4 | C26: 10 | D26: 4 | E26: 3 | F26: 2 | I26: Yes
A27: Totals | B27: =IF(B2="","",SUM(B9:B26)) -> 66 | D27: =IF(B2="","",SUM(D9:D26)) -> 95 | E27: =IF(B2="","",SUM(E9:E26)) -> 26 | F27: =IF(B2="","",SUM(F9:F26)) -> 38 | G27: =IF(B2="","",SUM(G9:G26)) -> 1 | H27: =IF(B2="","",SUM(H9:H26)) -> 0 | I27: =IF(COUNTIF(I9:I26,"=Yes")=0,"",COUNTIF(I9:I26,"=Yes")) -> 8