A1: Season 11 - April 1st 2009 to 31st March 2010
A2: MGA World Tour Money List
B3: Statistics updated | C3: =TODAY() -> 40268
A4: Pos | B4: Player | C4: Original Handicap | D4: Current Handicap | E4: Playing Handicap | F4: Events Played | G4: Tour Victories | H4: Winnings
A5: 1 | B5: Kevin Gallagher | C5: 13.5 | D5: 13.500000000000995 | E5: =D5 -> 13.500000000000995 | F5: 17 | G5: 6 | H5: 147500
A6: 2 | B6: Robert Thompson | C6: 7.9 | D6: 10.0 | E6: =D6 -> 10 | F6: 13 | G6: 6 | H6: 98750
A7: 3 | B7: Simon Thompson | C7: 12.0 | D7: 9.6 | E7: =D7 -> 9.6 | F7: 8 | G7: 0 | H7: 92500
A8: 4 | B8: Paul Carter | C8: 14.7 | D8: 13.3 | E8: =D8 -> 13.3 | F8: 4 | G8: 1 | H8: 76250
A9: 5 | B9: Dave Bingham | C9: 13.1 | D9: 13.5 | E9: =D9 -> 13.5 | F9: 7 | G9: 2 | H9: 65000
A10: 6 | B10: John Press | C10: 15.0 | D10: 13.3 | E10: =D10 -> 13.3 | F10: 5 | G10: 4 | H10: 51250
A11: 7 | B11: Keith Mendelson | C11: 15.1 | D11: 14.6 | E11: =D11 -> 14.6 | F11: 7 | G11: 1 | H11: 46250
A12: 8 | B12: Matthew Carter | C12: 19.6 | D12: 19.500000000001002 | E12: =D12 -> 19.500000000001002 | F12: 4 | G12: 1 | H12: 43750
A13: 9 | B13: Dave Rouse | C13: 25.6 | D13: 25.6 | E13: =D13 -> 25.6 | F13: 3 | G13: 0 | H13: 41250
A14: 10 | B14: David Braithwaite | C14: 13.0 | D14: 12.0 | E14: =D14 -> 12 | F14: 4 | G14: 1 | H14: 40000
A15: 11 | B15: Dave Andrews | C15: 16.6 | D15: 16.700000000001001 | E15: =D15 -> 16.700000000001001 | F15: 4 | G15: 3 | H15: 33750
A16: 12 | B16: Jon Dey | C16: 37.2 | D16: 30.2 | E16: =D16 -> 30.2 | F16: 3 | G16: 3 | H16: 32500
A17: 13 | B17: Michael Trimmings | C17: 22.6 | D17: 24.5 | E17: =D17 -> 24.5 | F17: 6 | G17: 0 | H17: 30000
A18: 14 | B18: Martin Bould | C18: 19.4 | D18: 19.7 | E18: =D18 -> 19.7 | F18: 2 | G18: 0 | H18: 25000
A19: 15 | B19: Andy Benson | C19: 7.6 | D19: 7.4 | E19: =D19 -> 7.4 | F19: 2 | G19: 0 | H19: 23750
A20: 16 | B20: Jeff Gibbons | C20: 20.5 | D20: 21.0 | E20: =D20 -> 21 | F20: 5 | G20: 4 | H20: 22500
A21: 17 | B21: Alan Hopkins | C21: 8.2 | D21: 7.9 | E21: =D21 -> 7.9 | F21: 1 | G21: 0 | H21: 21250
A22: 18 | B22: Martin Cox | C22: 13.6 | D22: 13.7 | E22: =D22 -> 13.7 | F22: 1 | G22: 0 | H22: 18750
A23: 19 | B23: Paul Baldwin | C23: 19.2 | D23: 19.3 | E23: =D23 -> 19.3 | F23: 1 | G23: 0 | H23: 18750
A24: 20 | B24: Roy Dickens | C24: 29.4 | D24: 29.8 | E24: =D24 -> 29.8 | F24: 2 | G24: 0 | H24: 17500
A25: 21 | B25: Andrew Baldwin | C25: 18.6 | D25: 19.2 | E25: =D25 -> 19.2 | F25: 3 | G25: 0 | H25: 13750
A26: 22 | B26: Simon Owens | C26: 14.4 | D26: 13.7 | E26: =D26 -> 13.7 | F26: 1 | G26: 0 | H26: 13750
A27: 23 | B27: Ian Edwards | C27: 11.8 | D27: 13.6 | E27: =D27 -> 13.6 | F27: 4 | G27: 0 | H27: 10000
A28: 24 | B28: Jeff Colbrook | C28: 14.9 | D28: 15.2 | E28: =D28 -> 15.2 | F28: 3 | G28: 0 | H28: 8750
A29: 25 | B29: Alan Baldwin | C29: 20.3 | D29: 20.5 | E29: =D29 -> 20.5 | F29: 1 | G29: 0 | H29: 7500
B30: Andrew Knight | C30: 21.4 | D30: 21.4 | E30: =D30 -> 21.4 | F30: 0 | G30: 0 | H30: 0
B31: Chris Manning | C31: 22.7 | D31: 22.7 | E31: =D31 -> 22.7 | F31: 0 | G31: 0 | H31: 0
B32: Clive Ferris | C32: 26.0 | D32: 26.0 | E32: =D32 -> 26 | F32: 0 | G32: 0 | H32: 0
B33: Danny Marsh | C33: 8.1 | D33: 8.1 | E33: =D33 -> 8.1 | F33: 0 | G33: 0 | H33: 0
B34: Keith Johns | C34: 24.3 | D34: 24.3 | E34: =D34 -> 24.3 | F34: 0 | G34: 0 | H34: 0
B35: Malcolm Rouse | C35: 43.9 | D35: 43.9 | E35: =D35 -> 43.9 | F35: 0 | G35: 0 | H35: 0
B36: Steve Tilling | C36: 16.5 | D36: 16.5 | E36: =D36 -> 16.5 | F36: 0 | G36: 0 | H36: 0