A1: Dave Andrews
A2: Club | B2: Traditions
A3: Par/SS | B3: 71/68 | D3: Num. Of Fairways | I3: =IF(B2="","",18-(COUNTIF(B9:B26,3))) -> 14
A4: Date | B4: 37786 | D4: Playing Handicap | I4: 19.6
A5: Event Place | B5: 7 | C5: M | D5: Prize Money | G5: 31250
A6: Game Stats | B6: DB+ | C6: DB | D6: Bi | E6: P | F6: B | G6: E | H6: A | I6: H1
B7: 4 | C7: 4 | D7: 4 | E7: 5 | F7: 1 | G7: 0 | H7: 0 | I7: 0
A8: Hole No | B8: Par | C8: Stroke Index | D8: Gross Score | E8: Points | F8: Putts | G8: Fairways | H8: Ferrets | I8: Green Regulation
A9: 1 | B9: 4 | C9: 9 | D9: 4 | E9: 3 | F9: 1 | I9: Yes
A10: 2 | B10: 4 | C10: 5 | D10: 6 | E10: 1 | F10: 1 | H10: 1
A11: 3 | B11: 3 | C11: 17 | D11: 4 | E11: 2 | F11: 2 | I11: Yes
A12: 4 | B12: 4 | C12: 1 | D12: 5 | E12: 3 | F12: 2 | G12: 1 | I12: Yes
A13: 5 | B13: 5 | C13: 13 | D13: 6 | E13: 2 | F13: 3 | I13: Yes
A14: 6 | B14: 3 | C14: 7 | D14: 3 | E14: 3 | F14: 2 | I14: Yes
A15: 7 | B15: 4 | C15: 15 | D15: 6 | E15: 1 | F15: 2
A16: 8 | B16: 4 | C16: 3 | D16: 5 | E16: 2 | F16: 2 | I16: Yes
A17: 9 | B17: 4 | C17: 11 | D17: 7 | E17: 0 | F17: 2
A18: 10 | B18: 3 | C18: 10 | D18: 3 | E18: 3 | F18: 2 | I18: Yes
A19: 11 | B19: 4 | C19: 16 | D19: 6 | E19: 1 | F19: 1 | G19: 1
A20: 12 | B20: 5 | C20: 12 | D20: 4 | E20: 4 | F20: 1 | I20: Yes
A21: 13 | B21: 4 | C21: 8 | D21: 6 | E21: 1 | F21: 2
A22: 14 | B22: 4 | C22: 4 | D22: 4 | E22: 3 | F22: 2 | I22: Yes
A23: 15 | B23: 3 | C23: 18 | D23: 3 | E23: 3 | F23: 1 | I23: Yes
A24: 16 | B24: 5 | C24: 14 | D24: 8 | E24: 0 | F24: 2 | H24: 1
A25: 17 | B25: 4 | C25: 2 | D25: 8 | E25: 0 | F25: 2 | H25: 1
A26: 18 | B26: 4 | C26: 6 | D26: 7 | E26: 0 | F26: 2 | H26: 1
A27: Totals | B27: =IF(B2="","",SUM(B9:B26)) -> 71 | D27: =IF(B2="","",SUM(D9:D26)) -> 95 | E27: =IF(B2="","",SUM(E9:E26)) -> 32 | F27: =IF(B2="","",SUM(F9:F26)) -> 32 | G27: =IF(B2="","",SUM(G9:G26)) -> 2 | H27: =IF(B2="","",SUM(H9:H26)) -> 4 | I27: =IF(COUNTIF(I9:I26,"=Yes")=0,"",COUNTIF(I9:I26,"=Yes")) -> 10