A1: Dave Rouse
A2: Club | B2: Hoebridge
A3: Par/SS | B3: 72/70 | D3: Num. Of Fairways | I3: =IF(B2="","",18-(COUNTIF(B9:B26,3))) -> 13
A4: Date | B4: 40502 | D4: Playing Handicap | I4: 24.7
A5: Event Place | B5: 10 | C5: M | D5: Prize Money | G5: 2500
A6: Game Stats | B6: DB+ | C6: DB | D6: Bi | E6: P | F6: B | G6: E | H6: A | I6: H1
B7: 6 | C7: 9 | D7: 3 | E7: 0 | F7: 0 | G7: 0 | H7: 0 | I7: 0
A8: Hole No | B8: Par | C8: Stroke Index | D8: Gross Score | E8: Points | F8: Putts | G8: Fairways | H8: Ferrets | I8: Green Regulation
A9: 1 | B9: 5 | C9: 11 | D9: 11 | E9: 0 | F9: 4 | H9: 1
A10: 2 | B10: 3 | C10: 17 | D10: 4 | E10: 2 | F10: 2 | I10: Yes
A11: 3 | B11: 5 | C11: 7 | D11: 8 | E11: 1 | F11: 3 | I11: Yes
A12: 4 | B12: 4 | C12: 1 | D12: 6 | E12: 2 | F12: 2 | I12: Yes
A13: 5 | B13: 4 | C13: 5 | D13: 6 | E13: 2 | F13: 1 | G13: 1
A14: 6 | B14: 3 | C14: 15 | D14: 4 | E14: 2 | F14: 2 | I14: Yes
A15: 7 | B15: 4 | C15: 3 | D15: 7 | E15: 1 | F15: 3 | I15: Yes
A16: 8 | B16: 4 | C16: 9 | D16: 6 | E16: 1 | F16: 2
A17: 9 | B17: 5 | C17: 13 | D17: 7 | E17: 1 | F17: 3 | I17: Yes
A18: 10 | B18: 4 | C18: 12 | D18: 7 | E18: 0 | F18: 2
A19: 11 | B19: 4 | C19: 4 | D19: 6 | E19: 2 | F19: 1
A20: 12 | B20: 3 | C20: 18 | D20: 4 | E20: 2 | F20: 2 | I20: Yes
A21: 13 | B21: 5 | C21: 8 | D21: 8 | E21: 0 | F21: 3
A22: 14 | B22: 4 | C22: 14 | D22: 6 | E22: 1 | F22: 2
A23: 15 | B23: 4 | C23: 2 | D23: 6 | E23: 2 | F23: 3 | G23: 1 | I23: Yes
A24: 16 | B24: 3 | C24: 10 | D24: 5 | E24: 1 | F24: 2
A25: 17 | B25: 5 | C25: 6 | D25: 7 | E25: 2 | F25: 1 | G25: 1
A26: 18 | B26: 3 | C26: 16 | D26: 6 | E26: 0 | F26: 2
A27: Totals | B27: =IF(B2="","",SUM(B9:B26)) -> 72 | D27: =IF(B2="","",SUM(D9:D26)) -> 114 | E27: =IF(B2="","",SUM(E9:E26)) -> 22 | F27: =IF(B2="","",SUM(F9:F26)) -> 40 | G27: =IF(B2="","",SUM(G9:G26)) -> 3 | H27: =IF(B2="","",SUM(H9:H26)) -> 1 | I27: =IF(COUNTIF(I9:I26,"=Yes")=0,"",COUNTIF(I9:I26,"=Yes")) -> 8