A1: Dave Rouse
A2: Club | B2: Hoebridge
A3: Par/SS | B3: 72/70 | D3: Num. Of Fairways
A4: Date | B4: 41804 | D4: Playing Handicap | I4: 26
A5: Event Place | B5: 16 | C5: M | D5: Prize Money | G5: 6250
A6: Game Stats | B6: DB+ | C6: DB | D6: Bi | E6: P | F6: B | G6: E | H6: A | I6: H1
B7: 7 | C7: 7 | D7: 3 | E7: 1 | F7: 0 | G7: 0 | H7: 0 | I7: 0
A8: Hole No | B8: Par | C8: Stroke Index | D8: Gross Score | E8: Points | F8: Putts | G8: Fairways | H8: Ferrets | I8: Green Regulation
A9: 1 | B9: 5 | C9: 11 | D9: 10 | E9: 0 | F9: 3 | H9: 2
A10: 2 | B10: 3 | C10: 17 | D10: 4 | E10: 2 | F10: 1
A11: 3 | B11: 5 | C11: 7 | D11: 6 | E11: 3 | F11: 1 | G11: 1 | I11: Yes
A12: 4 | B12: 4 | C12: 1 | D12: 6 | E12: 2 | F12: 2 | I12: Yes
A13: 5 | B13: 4 | C13: 5 | D13: 7 | E13: 1 | F13: 2
A14: 6 | B14: 3 | C14: 15 | D14: 5 | E14: 1 | F14: 2 | H14: 1
A15: 7 | B15: 4 | C15: 3 | D15: 7 | E15: 1 | F15: 2
A16: 8 | B16: 4 | C16: 9 | D16: 6 | E16: 1 | F16: 2
A17: 9 | B17: 5 | C17: 13 | D17: 7 | E17: 1 | F17: 2 | G17: 1
A18: 10 | B18: 4 | C18: 12 | D18: 5 | E18: 2 | F18: 2 | H18: 1 | I18: Yes
A19: 11 | B19: 4 | C19: 4 | D19: 10 | E19: 0 | F19: 2 | H19: 1
A20: 12 | B20: 3 | C20: 18 | D20: 6 | E20: 0 | F20: 3 | H20: 2
A21: 13 | B21: 5 | C21: 8 | D21: 10 | E21: 0 | F21: 2 | G21: 1
A22: 14 | B22: 4 | C22: 14 | D22: 6 | E22: 1 | F22: 2 | H22: 1
A23: 15 | B23: 4 | C23: 2 | D23: 7 | E23: 1 | F23: 2
A24: 16 | B24: 3 | C24: 10 | D24: 5 | E24: 1 | F24: 2
A25: 17 | B25: 5 | C25: 6 | D25: 7 | E25: 2 | F25: 2 | I25: Yes
A26: 18 | B26: 3 | C26: 16 | D26: 3 | E26: 3 | F26: 1 | I26: Yes
A27: Totals | B27: =IF(B2="","",SUM(B9:B26)) -> 72 | D27: =IF(B2="","",SUM(D9:D26)) -> 117 | E27: =IF(B2="","",SUM(E9:E26)) -> 22 | F27: =IF(B2="","",SUM(F9:F26)) -> 35 | G27: =IF(B2="","",SUM(G9:G26)) -> 3 | H27: =IF(B2="","",SUM(H9:H26)) -> 8 | I27: =IF(COUNTIF(I9:I26,"=Yes")=0,"",COUNTIF(I9:I26,"=Yes")) -> 5