A1: Simon Owens
A2: Club | B2: Hoebridge
A3: Par/SS | B3: 72/70 | D3: Num. Of Fairways | I3: =IF(B2="","",18-(COUNTIF(B9:B26,3))) -> 13
A4: Date | B4: 41804 | D4: Playing Handicap | I4: 14.8
A5: Event Place | B5: 16 | C5: m | D5: Prize Money | G5: 6250
A6: Game Stats | B6: DB+ | C6: DB | D6: Bi | E6: P | F6: B | G6: E | H6: A | I6: H1
B7: 7 | C7: 3 | D7: 4 | E7: 4 | F7: 0 | G7: 0 | H7: 0 | I7: 0
A8: Hole No | B8: Par | C8: Stroke Index | D8: Gross Score | E8: Points | F8: Putts | G8: Fairways | H8: Ferrets | I8: Green Regulation
A9: 1 | B9: 5 | C9: 11 | D9: 7 | E9: 1 | F9: 3 | I9: Yes
A10: 2 | B10: 3 | C10: 17 | D10: 3 | E10: 2 | F10: 2 | I10: Yes
A11: 3 | B11: 5 | C11: 7 | D11: 5 | E11: 3 | F11: 1 | G11: 1 | I11: Yes
A12: 4 | B12: 4 | C12: 1 | D12: 8 | E12: 0 | F12: 3 | G12: 1
A13: 5 | B13: 4 | C13: 5 | D13: 7 | E13: 0 | F13: 2 | H13: 1
A14: 6 | B14: 3 | C14: 15 | D14: 5 | E14: 1 | F14: 2
A15: 7 | B15: 4 | C15: 3 | D15: 4 | E15: 3 | F15: 1 | I15: Yes
A16: 8 | B16: 4 | C16: 9 | D16: 5 | E16: 2 | F16: 2 | G16: 1 | I16: Yes
A17: 9 | B17: 5 | C17: 13 | D17: 6 | E17: 2 | F17: 3 | G17: 1 | I17: Yes
A18: 10 | B18: 4 | C18: 12 | D18: 7 | E18: 0 | F18: 1 | H18: 1
A19: 11 | B19: 4 | C19: 4 | D19: 5 | E19: 2 | F19: 2 | G19: 1 | I19: Yes
A20: 12 | B20: 3 | C20: 18 | D20: 7 | E20: 0 | F20: 2 | H20: 1
A21: 13 | B21: 5 | C21: 8 | D21: 10 | E21: 0 | F21: 3 | H21: 2
A22: 14 | B22: 4 | C22: 14 | D22: 5 | E22: 2 | F22: 2 | G22: 1 | I22: Yes
A23: 15 | B23: 4 | C23: 2 | D23: 7 | E23: 0 | F23: 2 | G23: 1
A24: 16 | B24: 3 | C24: 10 | D24: 3 | E24: 3 | F24: 1 | I24: Yes
A25: 17 | B25: 5 | C25: 6 | D25: 7 | E25: 1 | F25: 2 | G25: 1
A26: 18 | B26: 3 | C26: 16 | D26: 6 | E26: 0 | F26: 1 | H26: 1
A27: Totals | B27: =IF(B2="","",SUM(B9:B26)) -> 72 | D27: =IF(B2="","",SUM(D9:D26)) -> 107 | E27: =IF(B2="","",SUM(E9:E26)) -> 22 | F27: =IF(B2="","",SUM(F9:F26)) -> 35 | G27: =IF(B2="","",SUM(G9:G26)) -> 8 | H27: =IF(B2="","",SUM(H9:H26)) -> 6 | I27: =IF(COUNTIF(I9:I26,"=Yes")=0,"",COUNTIF(I9:I26,"=Yes")) -> 9