A1: 2010 Fantasy Team Final Positions
B2: Owner | C2: Fantasy Team Name | D2: Total Points | E2: A Benson | F2: P Carter | G2: A Hopkins | H2: K Mendelson | I2: R Thompson | J2: M Cox | K2: S Thompson | L2: A Baldwin (Jnr) | M2: D Andrews | N2: J Colbrook | O2: M Bould | P2: K Gallagher | Q2: A Baldwin (Sr) | R2: D Rouse | S2: I Edwards | T2: J Press | U2: M Carter | V2: P Baldwin | W2: J Dey | X2: R Dickens | Y2: M Trimmings | Z2: M Rouse | AA2: D Braithwaite | AB2: S Owens
A3: 1st | B3: M Trimmings | C3: Bottom Bandits | D3: =SUM(E3:AB3) -> 16.5 | H3: 3.0 | I3: 1.0 | K3: 2.5 | P3: 2.0 | Y3: 4.0 | AB3: 4.0
A4: 2nd= | B4: M Carter | C4: Old Sluts | D4: =SUM(E4:AB4) -> 14.5 | F4: 2.5 | I4: 1.0 | J4: 1.5 | K4: 2.5 | U4: 3.0 | Y4: 4.0
A5: 2nd= | B5: R Dickens | C5: Dicko's Duffing Dozers | D5: =SUM(E5:AB5) -> 14.5 | H5: 3.0 | I5: 1.0 | K5: 2.5 | T5: 4.0 | U5: 3.0 | X5: 1.0
A6: 4th= | B6: J Dey | C6: The average weight of the European team at Melbage 19 was 19st 19lbs 19oz | D6: =SUM(E6:AB6) -> 13.5 | F6: 2.5 | H6: 3.0 | I6: 1.0 | R6: 1.5 | T6: 4.0 | W6: 1.5
A7: 4th= | B7: A Baldwin (Jnr) | C7: Pure Fantasy | D7: =SUM(E7:AB7) -> 13.5 | H7: 3.0 | I7: 1.0 | J7: 1.5 | K7: 2.5 | T7: 4.0 | W7: 1.5
A8: 6th | B8: P Baldwin | C8: TMMBWN | D8: =SUM(E8:AB8) -> 12.5 | H8: 3.0 | I8: 1.0 | K8: 2.5 | P8: 2.0 | U8: 3.0 | V8: 1.0
A9: 7th | B9: D Braithwaite | C9: Watnobingo | D9: =SUM(E9:AB9) -> 12.0 | I9: 1.0 | J9: 1.5 | T9: 4.0 | U9: 3.0 | W9: 1.5 | AA9: 1.0
A10: 8th= | B10: P Carter | C10: It's In The Genes | D10: =SUM(E10:AB10) -> 11.5 | F10: 2.5 | I10: 1.0 | K10: 2.5 | L10: 1.5 | U10: 3.0 | V10: 1.0
A11: 8th= | B11: S Owens | C11: The Good, The Bad and The Ugly | D11: =SUM(E11:AB11) -> 11.5 | J11: 1.5 | K11: 2.5 | Q11: 1.0 | R11: 1.5 | AA11: 1.0 | AB11: 4.0
A12: 8th= | B12: J Press | C12: Buttons Big Bashers | D12: =SUM(E12:AB12) -> 11.5 | I12: 1.0 | J12: 1.5 | K12: 2.5 | T12: 4.0 | W12: 1.5 | AA12: 1.0
A13: 8th= | B13: S Thompson | C13: No DA so he'll score not shout 4 | D13: =SUM(E13:AB13) -> 11.5 | I13: 1.0 | K13: 2.5 | R13: 1.5 | W13: 1.5 | X13: 1.0 | AB13: 4.0
A14: 12th= | B14: K Mendelson | C14: Mendy's Beach Babes | D14: =SUM(E14:AB14) -> 11.0 | F14: 2.5 | H14: 3.0 | I14: 1.0 | N14: 1.5 | P14: 2.0 | AA14: 1.0
A15: 12th= | B15: D Andrews | C15: Flying High | D15: =SUM(E15:AB15) -> 11.0 | G15: 0.0 | H15: 3.0 | I15: 1.0 | M15: 0.0 | T15: 4.0 | U15: 3.0
A16: 12th= | B16: K Gallagher | C16: Bubbs Tubbs | D16: =SUM(E16:AB16) -> 11.0 | I16: 1.0 | J16: 1.5 | P16: 2.0 | T16: 4.0 | W16: 1.5 | AA16: 1.0
A17: 15th= | B17: D Bingham | C17: Romans | D17: =SUM(E17:AB17) -> 10.5 | I17: 1.0 | K17: 2.5 | M17: 0.0 | P17: 2.0 | T17: 4.0 | AA17: 1.0
A18: 15th= | B18: A Hopkins | C18: Baggashite Boys | D18: =SUM(E18:AB18) -> 10.5 | I18: 1.0 | K18: 2.5 | R18: 1.5 | U18: 3.0 | W18: 1.5 | AA18: 1.0
A19: 15th= | B19: M Cox | C19: The Diabetic Six | D19: =SUM(E19:AB19) -> 10.5 | F19: 2.5 | H19: 3.0 | I19: 1.0 | J19: 1.5 | K19: 2.5 | M19: 0.0
A20: 15th= | B20: I Edwards | C20: Tiger's Bimbo | D20: =SUM(E20:AB20) -> 10.5 | H20: 3.0 | I20: 1.0 | J20: 1.5 | K20: 2.5 | V20: 1.0 | W20: 1.5
A21: 15th= | B21: D Rouse | C21: The Manky Murkins | D21: =SUM(E21:AB21) -> 10.5 | J21: 1.5 | R21: 1.5 | T21: 4.0 | W21: 1.5 | X21: 1.0 | AA21: 1.0
A22: 20th | B22: M Bould | C22: The BackSwingers | D22: =SUM(E22:AB22) -> 9.5 | I22: 1.0 | J22: 1.5 | K22: 2.5 | O22: 2.5 | X22: 1.0 | AA22: 1.0
A23: 21st | B23: J Colbrook | C23: Jeffer's All Stars | D23: =SUM(E23:AB23) -> 9.0 | I23: 1.0 | J23: 1.5 | M23: 0.0 | N23: 1.5 | V23: 1.0 | AB23: 4.0
A24: 22nd | B24: R Thompson | C24: The Chief Wiggums | D24: =SUM(E24:AB24) -> 7.5 | G24: 0.0 | I24: 1.0 | M24: 0.0 | T24: 4.0 | W24: 1.5 | AA24: 1.0
A25: 23rd | B25: A Baldwin (Snr) | C25: Turncoat's Natural Hazards | D25: =SUM(E25:AB25) -> 7.0 | G25: 0.0 | J25: 1.5 | L25: 1.5 | P25: 2.0 | Q25: 1.0 | X25: 1.0
A26: 24th | B26: M Rouse | C26: R. Swipes | D26: =SUM(E26:AB26) -> 6.5 | I26: 1.0 | M26: 0.0 | P26: 2.0 | R26: 1.5 | X26: 1.0 | Z26: 1.0