A1: Matthew Carter
A2: Club | B2: Mitcham
A3: Par/SS | B3: 69 | D3: Num. Of Fairways | I3: =IF(B2="","",18-(COUNTIF(B9:B26,3))) -> 14
A4: Date | B4: 39128 | D4: Playing Handicap | I4: 21.3
A5: Event Place | B5: 1 | D5: Prize Money | G5: 5000
A6: Game Stats | B6: DB+ | C6: DB | D6: BI | E6: P | F6: B | G6: E | H6: A | I6: H1
B7: 0 | C7: 5 | D7: 13 | E7: 0 | F7: 0 | G7: 0 | H7: 0 | I7: 0
A8: Hole No | B8: Par | C8: Stroke Index | D8: Gross Score | E8: Points | F8: Putts | G8: Fairways | H8: Ferrets | I8: Green Regulation
A9: 1 | B9: 4 | C9: 10 | D9: 5 | E9: 2 | F9: 2 | G9: 1 | I9: Yes
A10: 2 | B10: 4 | C10: 4 | D10: 6 | E10: 1 | F10: 2
A11: 3 | B11: 3 | C11: 14 | D11: 4 | E11: 2 | F11: 2 | I11: Yes
A12: 4 | B12: 4 | C12: 16 | D12: 5 | E12: 2 | F12: 2 | G12: 1 | I12: Yes
A13: 5 | B13: 4 | C13: 2 | D13: 5 | E13: 3 | F13: 1 | G13: 1 | I13: Yes
A14: 6 | B14: 4 | C14: 18 | D14: 5 | E14: 2 | F14: 2 | G14: 1 | I14: Yes
A15: 7 | B15: 4 | C15: 6 | D15: 5 | E15: 2 | F15: 3 | G15: 1 | I15: Yes
A16: 8 | B16: 3 | C16: 8 | D16: 5 | E16: 1 | F16: 3 | I16: Yes
A17: 9 | B17: 4 | C17: 12 | D17: 6 | E17: 1 | F17: 1 | H17: 1
A18: 10 | B18: 5 | C18: 9 | D18: 6 | E18: 2 | F18: 1
A19: 11 | B19: 4 | C19: 15 | D19: 6 | E19: 1 | F19: 2
A20: 12 | B20: 4 | C20: 7 | D20: 5 | E20: 2 | F20: 1 | G20: 1
A21: 13 | B21: 4 | C21: 5 | D21: 5 | E21: 2 | F21: 1 | G21: 1
A22: 14 | B22: 4 | C22: 1 | D22: 5 | E22: 3 | F22: 1 | G22: 1 | I22: Yes
A23: 15 | B23: 4 | C23: 11 | D23: 5 | E23: 2 | F23: 2 | G23: 1 | I23: Yes
A24: 16 | B24: 3 | C24: 17 | D24: 5 | E24: 1 | F24: 1
A25: 17 | B25: 4 | C25: 3 | D25: 5 | E25: 3 | F25: 2 | G25: 1 | I25: Yes
A26: 18 | B26: 3 | C26: 13 | D26: 4 | E26: 2 | F26: 1
A27: Totals | B27: =IF(B2="","",SUM(B9:B26)) -> 69 | D27: =IF(B2="","",SUM(D9:D26)) -> 92 | E27: =IF(B2="","",SUM(E9:E26)) -> 34 | F27: =IF(B2="","",SUM(F9:F26)) -> 30 | G27: =IF(B2="","",SUM(G9:G26)) -> 10 | H27: =IF(B2="","",SUM(H9:H26)) -> 1 | I27: =IF(COUNTIF(I9:I26,"=Yes")=0,"",COUNTIF(I9:I26,"=Yes")) -> 10