A1: Season 16 - April 1st 2014 to 31st March 2015
A2: MGA World Tour Money List
B3: Statistics updated | C3: =TODAY() -> 42089
A4: Pos | B4: Player | C4: Original Handicap | D4: Current Handicap | E4: Playing Handicap | F4: Events Played | G4: Tour Victories | H4: Winnings
A5: 1 | B5: David Braithwaite | C5: 12.6 | D5: 11.100000000000998 | E5: =D5 -> 11.100000000000998 | F5: 8 | G5: 2 | H5: 178750
A6: 2 | B6: Paul Carter | C6: 13.8 | D6: 12.0 | E6: =D6 -> 12 | F6: 7 | G6: 0 | H6: 155000
A7: 3 | B7: David Bingham | C7: 11.3 | D7: 11.000000000001998 | E7: =D7 -> 11.000000000001998 | F7: 6 | G7: 0 | H7: 152500
A8: 4 | B8: Roy Dickens | C8: 30.4 | D8: 28.800000000001003 | E8: =D8 -> 28.800000000001003 | F8: 5 | G8: 1 | H8: 150000
A9: 5 | B9: Jon Dey | C9: 23.8 | D9: 22.8 | E9: =D9 -> 22.8 | F9: 7 | G9: 3 | H9: 148750
A10: 6 | B10: David Kewley | C10: 17.1 | D10: 14.900000000001 | E10: =D10 -> 14.900000000001 | F10: 7 | G10: 1 | H10: 140000
A11: 7 | B11: Matthew Carter | C11: 16.2 | D11: 15.400000000000999 | E11: =D11 -> 15.400000000000999 | F11: 5 | G11: 0 | H11: 137500
A12: 8 | B12: Paul Baldwin | C12: 20.4 | D12: 19.000000000000998 | E12: =D12 -> 19.000000000000998 | F12: 4 | G12: 1 | H12: 122500
A13: 9 | B13: Martin Cox | C13: 12.8 | D13: 13.8 | E13: =D13 -> 13.8 | F13: 5 | G13: 0 | H13: 113750
A14: 10 | B14: Kevin Gallagher | C14: 13.0 | D14: 13.4 | E14: =D14 -> 13.4 | F14: 6 | G14: 0 | H14: 112500
A15: 11 | B15: Simon Thompson | C15: 11.2 | D15: 10.3 | E15: =D15 -> 10.3 | F15: 5 | G15: 1 | H15: 102500
A16: 12 | B16: Jon Press | C16: 13.8 | D16: 13.5 | E16: =D16 -> 13.5 | F16: 6 | G16: 2 | H16: 100000
A17: 13 | B17: Michael Trimmings | C17: 20.3 | D17: 19.8 | E17: =D17 -> 19.8 | F17: 5 | G17: 1 | H17: 100000
A18: 14 | B18: David Andrews | C18: 15.6 | D18: 14.3 | E18: =D18 -> 14.3 | F18: 5 | G18: 2 | H18: 98750
A19: 15 | B19: Robert Thompson | C19: 9.2 | D19: 11.9 | E19: =D19 -> 11.9 | F19: 9 | G19: 0 | H19: 88750
A20: 16 | B20: David Rouse | C20: 25.8 | D20: 27.0 | E20: =D20 -> 27 | F20: 8 | G20: 2 | H20: 70000
A21: 17 | B21: David Archer | C21: 21.2 | D21: 21.700000000000998 | E21: =D21 -> 21.700000000000998 | F21: 4 | G21: 0 | H21: 67500
A22: 18 | B22: Andrew Baldwin | C22: 20.0 | D22: 20.4 | E22: =D22 -> 20.4 | F22: 3 | G22: 0 | H22: 67500
A23: 19 | B23: Jeff Colbrook | C23: 17.2 | D23: 18.4 | E23: =D23 -> 18.4 | F23: 5 | G23: 0 | H23: 66250
A24: 20 | B24: Keith Mendelson | C24: 11.8 | D24: 12.8 | E24: =D24 -> 12.8 | F24: 5 | G24: 0 | H24: 66250
A25: 21 | B25: Simon Owens | C25: 14.8 | D25: 15.1 | E25: =D25 -> 15.1 | F25: 4 | G25: 1 | H25: 57500
A26: 22 | B26: Alan Hopkins | C26: 7.9 | D26: 7.9 | E26: =D26 -> 7.9 | F26: 2 | G26: 0 | H26: 43750
A27: 23 | B27: Ian Edwards | C27: 15.6 | D27: 17.000000000002 | E27: =D27 -> 17.000000000002 | F27: 4 | G27: 0 | H27: 36250
A28: 24 | B28: Andy Benson | C28: 6.3 | D28: 6.1 | E28: =D28 -> 6.1 | F28: 1 | G28: 0 | H28: 28750
A29: 25 | B29: Alan Baldwin | C29: 21.1 | D29: 22.2 | E29: =D29 -> 22.2 | F29: 2 | G29: 0 | H29: 22500
A30: 26 | B30: Chris Manning | C30: 22.9 | D30: 23.3 | E30: =D30 -> 23.3 | F30: 2 | G30: 0 | H30: 22500
A31: 27 | B31: Martin Bould | C31: 16.0 | D31: 16.2 | E31: =D31 -> 16.2 | F31: 1 | G31: 0 | H31: 5000
B32: Clive Ferris | C32: 26.0 | D32: 26.0 | E32: =D32 -> 26 | F32: 0 | G32: 0 | H32: 0
B33: Malcolm Rouse | C33: 44.9 | D33: 44.9 | E33: =D33 -> 44.9 | F33: 0 | G33: 0 | H33: 0
B34: Steve Tilling | C34: 16.3 | D34: 16.3 | E34: =D34 -> 16.3 | F34: 0 | G34: 0 | H34: 0