B1: Season 16 - April 1st 2014 to 31st March 2015
A2: MGA World Tour Order of Merit
B3: Statistics updated | C3: =TODAY() -> 42089
A4: Pos | B4: Player | C4: Original Handicap | D4: Current Handicap | E4: Playing Handicap | F4: Played | G4: Points | H4: Average | I4: HI / LOW Score | J4: Qualified (3 games)
A5: 1 | B5: David Andrews | C5: 15.6 | D5: 14.3 | E5: =D5 -> 14.3 | F5: 5 | G5: 165 | H5: =IF(ISERROR(G5/F5),0,G5/F5) -> 33.00 | I5: 39 / 26 | J5: YES
A6: 2 | B6: Roy Dickens | C6: 30.4 | D6: 28.800000000001003 | E6: =D6 -> 28.800000000001003 | F6: 5 | G6: 165 | H6: =IF(ISERROR(G6/F6),0,G6/F6) -> 33.00 | I6: 38 / 28 | J6: YES
A7: 3 | B7: Jon Dey | C7: 23.8 | D7: 22.8 | E7: =D7 -> 22.8 | F7: 7 | G7: 228 | H7: =IF(ISERROR(G7/F7),0,G7/F7) -> 32.571428571428569 | I7: 36 / 29 | J7: YES
A8: 4 | B8: Paul Baldwin | C8: 20.4 | D8: 19.000000000000998 | E8: =D8 -> 19.000000000000998 | F8: 4 | G8: 128 | H8: =IF(ISERROR(G8/F8),0,G8/F8) -> 32.00 | I8: 39 / 25 | J8: YES
A9: 5 | B9: Matthew Carter | C9: 16.2 | D9: 15.400000000000999 | E9: =D9 -> 15.400000000000999 | F9: 5 | G9: 151 | H9: =IF(ISERROR(G9/F9),0,G9/F9) -> 30.20 | I9: 39 / 25 | J9: YES
A10: 6 | B10: Jon Press | C10: 13.8 | D10: 13.5 | E10: =D10 -> 13.5 | F10: 6 | G10: 178 | H10: =IF(ISERROR(G10/F10),0,G10/F10) -> 29.666666666666668 | I10: 32 / 27 | J10: YES
A11: 7 | B11: Michael Trimmings | C11: 20.3 | D11: 19.8 | E11: =D11 -> 19.8 | F11: 5 | G11: 148 | H11: =IF(ISERROR(G11/F11),0,G11/F11) -> 29.60 | I11: 34 / 24 | J11: YES
A12: 8 | B12: David Braithwaite | C12: 12.6 | D12: 11.100000000000998 | E12: =D12 -> 11.100000000000998 | F12: 8 | G12: 233 | H12: =IF(ISERROR(G12/F12),0,G12/F12) -> 29.125 | I12: 41 / 16 | J12: YES
A13: 9 | B13: Paul Carter | C13: 13.8 | D13: 12.0 | E13: =D13 -> 12 | F13: 7 | G13: 203 | H13: =IF(ISERROR(G13/F13),0,G13/F13) -> 29.00 | I13: 41 / 26 | J13: YES
A14: 10 | B14: David Bingham | C14: 11.3 | D14: 11.000000000001998 | E14: =D14 -> 11.000000000001998 | F14: 6 | G14: 173 | H14: =IF(ISERROR(G14/F14),0,G14/F14) -> 28.833333333333332 | I14: 39 / 22 | J14: YES
A15: 11 | B15: Andrew Baldwin | C15: 20.0 | D15: 20.4 | E15: =D15 -> 20.4 | F15: 3 | G15: 86 | H15: =IF(ISERROR(G15/F15),0,G15/F15) -> 28.666666666666668 | I15: 31 / 26 | J15: YES
A16: 12 | B16: Simon Thompson | C16: 11.2 | D16: 10.3 | E16: =D16 -> 10.3 | F16: 5 | G16: 143 | H16: =IF(ISERROR(G16/F16),0,G16/F16) -> 28.60 | I16: 32 / 26 | J16: YES
A17: 13 | B17: David Archer | C17: 21.2 | D17: 21.700000000000998 | E17: =D17 -> 21.700000000000998 | F17: 4 | G17: 111 | H17: =IF(ISERROR(G17/F17),0,G17/F17) -> 27.75 | I17: 33 / 24 | J17: YES
A18: 14 | B18: Kevin Gallagher | C18: 13.0 | D18: 13.4 | E18: =D18 -> 13.4 | F18: 6 | G18: 166 | H18: =IF(ISERROR(G18/F18),0,G18/F18) -> 27.666666666666668 | I18: 36 / 20 | J18: YES
A19: 15 | B19: Martin Cox | C19: 12.8 | D19: 13.8 | E19: =D19 -> 13.8 | F19: 5 | G19: 138 | H19: =IF(ISERROR(G19/F19),0,G19/F19) -> 27.60 | I19: 35 / 19 | J19: YES
A20: 16 | B20: David Kewley | C20: 17.1 | D20: 14.900000000001 | E20: =D20 -> 14.900000000001 | F20: 7 | G20: 193 | H20: =IF(ISERROR(G20/F20),0,G20/F20) -> 27.571428571428573 | I20: 43 / 14 | J20: YES
A21: 17 | B21: David Rouse | C21: 25.8 | D21: 27.0 | E21: =D21 -> 27 | F21: 8 | G21: 215 | H21: =IF(ISERROR(G21/F21),0,G21/F21) -> 26.875 | I21: 36 / 22 | J21: YES
A22: 18 | B22: Keith Mendelson | C22: 11.8 | D22: 12.8 | E22: =D22 -> 12.8 | F22: 5 | G22: 127 | H22: =IF(ISERROR(G22/F22),0,G22/F22) -> 25.40 | I22: 29 / 20 | J22: YES
A23: 19 | B23: Simon Owens | C23: 14.8 | D23: 15.1 | E23: =D23 -> 15.1 | F23: 4 | G23: 100 | H23: =IF(ISERROR(G23/F23),0,G23/F23) -> 25.00 | I23: 32 / 20 | J23: YES
A24: 20 | B24: Robert Thompson | C24: 9.2 | D24: 11.9 | E24: =D24 -> 11.9 | F24: 9 | G24: 224 | H24: =IF(ISERROR(G24/F24),0,G24/F24) -> 24.888888888888889 | I24: 30 / 16 | J24: YES
A25: 21 | B25: Jeff Colbrook | C25: 17.2 | D25: 18.4 | E25: =D25 -> 18.4 | F25: 5 | G25: 122 | H25: =IF(ISERROR(G25/F25),0,G25/F25) -> 24.40 | I25: 36 / 15 | J25: YES
A26: 22 | B26: Ian Edwards | C26: 15.6 | D26: 17.000000000002 | E26: =D26 -> 17.000000000002 | F26: 4 | G26: 90 | H26: =IF(ISERROR(G26/F26),0,G26/F26) -> 22.50 | I26: 28 / 12 | J26: YES
A27: 23 | B27: Andy Benson | C27: 6.3 | D27: 6.1 | E27: =D27 -> 6.1 | F27: 1 | G27: 30 | H27: =IF(ISERROR(G27/F27),0,G27/F27) -> 30.00 | I27: 30 / 30
A28: 24 | B28: Alan Hopkins | C28: 7.9 | D28: 7.9 | E28: =D28 -> 7.9 | F28: 2 | G28: 59 | H28: =IF(ISERROR(G28/F28),0,G28/F28) -> 29.50 | I28: 37 / 22
A29: 25 | B29: Martin Bould | C29: 16.0 | D29: 16.2 | E29: =D29 -> 16.2 | F29: 1 | G29: 26 | H29: =IF(ISERROR(G29/F29),0,G29/F29) -> 26.00 | I29: 26 / 26
A30: 26 | B30: Chris Manning | C30: 22.9 | D30: 23.3 | E30: =D30 -> 23.3 | F30: 2 | G30: 50 | H30: =IF(ISERROR(G30/F30),0,G30/F30) -> 25.00 | I30: 27 / 23
B31: Alan Baldwin | C31: 21.1 | D31: 22.2 | E31: =D31 -> 22.2 | F31: 2 | G31: 47 | H31: =IF(ISERROR(G31/F31),0,G31/F31) -> 23.50 | I31: 32 / 15
B32: Clive Ferris | C32: 26.0 | D32: 26.0 | E32: =D32 -> 26 | F32: 0 | G32: 0 | H32: =IF(ISERROR(G32/F32),0,G32/F32) -> 0.00 | I32: /
B33: Malcolm Rouse | C33: 44.9 | D33: 44.9 | E33: =D33 -> 44.9 | F33: 0 | G33: 0 | H33: =IF(ISERROR(G33/F33),0,G33/F33) -> 0.00 | I33: /
B34: Steve Tilling | C34: 16.3 | D34: 16.3 | E34: =D34 -> 16.3 | F34: 0 | G34: 0 | H34: =IF(ISERROR(G34/F34),0,G34/F34) -> 0.00 | I34: /