A1: Jon Dey
A2: Club | B2: Porters Park
A3: Par/SS | B3: 70/70 | D3: Num. Of Fairways | I3: =IF(B2="","",18-(COUNTIF(B9:B26,3))) -> 14
A4: Date | B4: 40426 | D4: Playing Handicap | I4: 29.7
A5: Event Place | B5: 1 | D5: Prize Money | G5: 5000
A6: Game Stats | B6: DB+ | C6: DB | D6: Bi | E6: P | F6: B | G6: E | H6: A | I6: H1
B7: 3 | C7: 7 | D7: 5 | E7: 3 | F7: 0 | G7: 0 | H7: 0 | I7: 0
A8: Hole No | B8: Par | C8: Stroke Index | D8: Gross Score | E8: Points | F8: Putts | G8: Fairways | H8: Ferrets | I8: Green Regulation
A9: 1 | B9: 4 | C9: 17 | D9: 4 | E9: 3 | F9: 2 | G9: 1 | I9: Yes
A10: 2 | B10: 4 | C10: 11 | D10: 6 | E10: 2 | F10: 1
A11: 3 | B11: 4 | C11: 3 | D11: 6 | E11: 2 | F11: 2 | G11: 1 | I11: Yes
A12: 4 | B12: 4 | C12: 1 | D12: 6 | E12: 2 | F12: 2 | I12: Yes
A13: 5 | B13: 4 | C13: 9 | D13: 7 | E13: 1 | F13: 3 | G13: 1 | I13: Yes
A14: 6 | B14: 3 | C14: 13 | D14: 5 | E14: 1 | F14: 2
A15: 7 | B15: 4 | C15: 7 | D15: 6 | E15: 2 | F15: 2 | I15: Yes
A16: 8 | B16: 4 | C16: 5 | D16: 8 | E16: 0 | F16: 3
A17: 9 | B17: 3 | C17: 15 | D17: 4 | E17: 2 | F17: 2 | I17: Yes
A18: 10 | B18: 5 | C18: 12 | D18: 6 | E18: 3 | F18: 1 | I18: Yes
A19: 11 | B19: 4 | C19: 2 | D19: 4 | E19: 4 | F19: 1 | G19: 1 | I19: Yes
A20: 12 | B20: 3 | C20: 8 | D20: 4 | E20: 3 | F20: 2 | I20: Yes
A21: 13 | B21: 5 | C21: 4 | D21: 6 | E21: 3 | F21: 1 | G21: 1 | I21: Yes
A22: 14 | B22: 3 | C22: 16 | D22: 4 | E22: 2 | F22: 2 | I22: Yes
A23: 15 | B23: 4 | C23: 18 | D23: 6 | E23: 1 | F23: 2
A24: 16 | B24: 4 | C24: 6 | D24: 8 | E24: 0 | F24: 2
A25: 17 | B25: 4 | C25: 14 | D25: 6 | E25: 1 | F25: 1
A26: 18 | B26: 4 | C26: 10 | D26: 4 | E26: 4 | F26: 1 | G26: 1 | I26: Yes
A27: Totals | B27: =IF(B2="","",SUM(B9:B26)) -> 70 | D27: =IF(B2="","",SUM(D9:D26)) -> 100 | E27: =IF(B2="","",SUM(E9:E26)) -> 36 | F27: =IF(B2="","",SUM(F9:F26)) -> 32 | G27: =IF(B2="","",SUM(G9:G26)) -> 6 | H27: =IF(B2="","",SUM(H9:H26)) -> 0 | I27: =IF(COUNTIF(I9:I26,"=Yes")=0,"",COUNTIF(I9:I26,"=Yes")) -> 12