A1: Jeff Gibbons
A2: Club | B2: The London Club (International)
A3: Par/SS | B3: 72/72 | D3: Num. Of Fairways | I3: =IF(B2="","",18-(COUNTIF(B9:B26,3))) -> 13
A4: Date | B4: 38802 | D4: Playing Handicap | I4: 19.600000000003014
A5: Event Place | B5: 2 | D5: Prize Money | G5: 2500
A6: Game Stats | B6: DB+ | C6: DB | D6: Bi | E6: P | F6: B | G6: E | H6: A | I6: H1
B7: 4 | C7: 6 | D7: 7 | E7: 1 | F7: 0 | G7: 0 | H7: 0 | I7: 0
A8: Hole No | B8: Par | C8: Stroke Index | D8: Gross Score | E8: Points | F8: Putts | G8: Fairways | H8: Ferrets | I8: Green Regulation
A9: 1 | B9: 4 | C9: 14 | D9: 5 | E9: 2 | F9: 1 | G9: 1
A10: 2 | B10: 5 | C10: 8 | D10: 8 | E10: 0 | F10: 2 | G10: 1
A11: 3 | B11: 3 | C11: 6 | D11: 4 | E11: 2 | F11: 3 | I11: Yes
A12: 4 | B12: 5 | C12: 4 | D12: 9 | E12: 0 | F12: 3 | H12: 1
A13: 5 | B13: 3 | C13: 18 | D13: 4 | E13: 2 | F13: 2 | I13: Yes
A14: 6 | B14: 4 | C14: 16 | D14: 6 | E14: 1 | F14: 2
A15: 7 | B15: 4 | C15: 12 | D15: 5 | E15: 2 | F15: 1 | G15: 1
A16: 8 | B16: 3 | C16: 2 | D16: 5 | E16: 2 | F16: 2 | I16: Yes
A17: 9 | B17: 5 | C17: 10 | D17: 7 | E17: 1 | F17: 2
A18: 10 | B18: 5 | C18: 11 | D18: 8 | E18: 0 | F18: 1 | H18: 1
A19: 11 | B19: 4 | C19: 9 | D19: 6 | E19: 1 | F19: 1
A20: 12 | B20: 4 | C20: 1 | D20: 5 | E20: 3 | F20: 1 | G20: 1 | I20: Yes
A21: 13 | B21: 3 | C21: 17 | D21: 4 | E21: 2 | F21: 1
A22: 14 | B22: 4 | C22: 5 | D22: 6 | E22: 1 | F22: 1 | G22: 1
A23: 15 | B23: 5 | C23: 13 | D23: 5 | E23: 3 | F23: 2 | G23: 1 | I23: Yes
A24: 16 | B24: 4 | C24: 15 | D24: 5 | E24: 2 | F24: 2 | G24: 1 | I24: Yes
A25: 17 | B25: 3 | C25: 7 | D25: 5 | E25: 1 | F25: 2
A26: 18 | B26: 4 | C26: 3 | D26: 8 | E26: 0 | F26: 2
A27: Totals | B27: =IF(B2="","",SUM(B9:B26)) -> 72 | D27: =IF(B2="","",SUM(D9:D26)) -> 105 | E27: =IF(B2="","",SUM(E9:E26)) -> 25 | F27: =IF(B2="","",SUM(F9:F26)) -> 31 | G27: =IF(B2="","",SUM(G9:G26)) -> 7 | H27: =IF(B2="","",SUM(H9:H26)) -> 2 | I27: =IF(COUNTIF(I9:I26,"=Yes")=0,"",COUNTIF(I9:I26,"=Yes")) -> 6