A1: Martin Cox
A2: Club | B2: Merrist Wood
A3: Par/SS | B3: 72/70 | D3: Num. Of Fairways | I3: =IF(B2="","",18-(COUNTIF(B9:B26,3))) -> 14
A4: Date | B4: 38808 | D4: Playing Handicap | I4: 12.100000000001996
A5: Event Place | B5: 16 | C5: m | D5: Prize Money | G5: 12500
A6: Game Stats | B6: DB+ | C6: DB | D6: BI | E6: P | F6: B | G6: E | H6: A | I6: H1
B7: 3 | C7: 4 | D7: 9 | E7: 2 | F7: 0 | G7: 0 | H7: 0 | I7: 0
A8: Hole No | B8: Par | C8: Stroke Index | D8: Gross Score | E8: Points | F8: Putts | G8: Fairways | H8: Ferrets | I8: Green Regulation
A9: 1 | B9: 4 | C9: 10 | D9: 5 | E9: 2 | F9: 2 | I9: Yes
A10: 2 | B10: 3 | C10: 18 | D10: 5 | E10: 0 | F10: 3
A11: 3 | B11: 4 | C11: 6 | D11: 5 | E11: 2 | F11: 1
A12: 4 | B12: 5 | C12: 14 | D12: 6 | E12: 1 | F12: 1
A13: 5 | B13: 4 | C13: 4 | D13: 5 | E13: 2 | F13: 2 | G13: 1 | I13: Yes
A14: 6 | B14: 5 | C14: 12 | D14: 6 | E14: 2 | F14: 1 | G14: 1
A15: 7 | B15: 4 | C15: 8 | D15: 5 | E15: 2 | F15: 2 | G15: 1 | I15: Yes
A16: 8 | B16: 3 | C16: 16 | D16: 7 | E16: 0 | F16: 2
A17: 9 | B17: 4 | C17: 2 | D17: 5 | E17: 2 | F17: 2 | G17: 1 | I17: Yes
A18: 10 | B18: 5 | C18: 9 | D18: 7 | E18: 1 | F18: 2
A19: 11 | B19: 3 | C19: 15 | D19: 3 | E19: 2 | F19: 1 | H19: 1
A20: 12 | B20: 4 | C20: 7 | D20: 7 | E20: 0 | F20: 2
A21: 13 | B21: 4 | C21: 1 | D21: 5 | E21: 2 | F21: 2 | I21: Yes
A22: 14 | B22: 4 | C22: 13 | D22: 5 | E22: 1 | F22: 1
A23: 15 | B23: 4 | C23: 3 | D23: 10 | E23: 0 | F23: 3
A24: 16 | B24: 3 | C24: 17 | D24: 3 | E24: 2 | F24: 1
A25: 17 | B25: 4 | C25: 5 | D25: 6 | E25: 1 | F25: 3 | G25: 1 | I25: Yes
A26: 18 | B26: 5 | C26: 11 | D26: 7 | E26: 1 | F26: 1 | G26: 1
A27: Totals | B27: =IF(B2="","",SUM(B9:B26)) -> 72 | D27: =IF(B2="","",SUM(D9:D26)) -> 102 | E27: =IF(B2="","",SUM(E9:E26)) -> 23 | F27: =IF(B2="","",SUM(F9:F26)) -> 32 | G27: =IF(B2="","",SUM(G9:G26)) -> 6 | H27: =IF(B2="","",SUM(H9:H26)) -> 1 | I27: =IF(COUNTIF(I9:I26,"=Yes")=0,"",COUNTIF(I9:I26,"=Yes")) -> 6