A1: Matt Carter
A2: Club | B2: Merrist Wood
A3: Par/SS | B3: 72/70 | D3: Num. Of Fairways | I3: =IF(B2="","",18-(COUNTIF(B9:B26,3))) -> 14
A4: Date | B4: 38808 | D4: Playing Handicap | I4: 20.5
A5: Event Place | B5: 5 | C5: m | D5: Prize Money | G5: 36250
A6: Game Stats | B6: DB+ | C6: DB | D6: Bi | E6: P | F6: B | G6: E | H6: A | I6: H1
B7: 2 | C7: 4 | D7: 12 | E7: 0 | F7: 0 | G7: 0 | H7: 0 | I7: 0
A8: Hole No | B8: Par | C8: Stroke Index | D8: Gross Score | E8: Points | F8: Putts | G8: Fairways | H8: Ferrets | I8: Green Regulation
A9: 1 | B9: 4 | C9: 10 | D9: 5 | E9: 2 | F9: 2 | I9: Yes
A10: 2 | B10: 3 | C10: 18 | D10: 4 | E10: 2 | F10: 2 | I10: Yes
A11: 3 | B11: 4 | C11: 6 | D11: 5 | E11: 2 | F11: 2 | I11: Yes
A12: 4 | B12: 5 | C12: 14 | D12: 6 | E12: 2 | F12: 2 | G12: 1 | I12: Yes
A13: 5 | B13: 4 | C13: 4 | D13: 5 | E13: 2 | F13: 3 | I13: Yes
A14: 6 | B14: 5 | C14: 12 | D14: 7 | E14: 1 | F14: 3 | G14: 1 | I14: Yes
A15: 7 | B15: 4 | C15: 8 | D15: 8 | E15: 0 | F15: 2
A16: 8 | B16: 3 | C16: 16 | D16: 4 | E16: 2 | F16: 3 | I16: Yes
A17: 9 | B17: 4 | C17: 2 | D17: 5 | E17: 3 | F17: 2 | G17: 1 | I17: Yes
A18: 10 | B18: 5 | C18: 9 | D18: 7 | E18: 1 | F18: 2
A19: 11 | B19: 3 | C19: 15 | D19: 4 | E19: 2 | F19: 1
A20: 12 | B20: 4 | C20: 7 | D20: 6 | E20: 1 | F20: 2 | G20: 1 | H20: 1
A21: 13 | B21: 4 | C21: 1 | D21: 5 | E21: 3 | F21: 1 | G21: 1 | I21: Yes
A22: 14 | B22: 4 | C22: 13 | D22: 5 | E22: 2 | F22: 1 | G22: 1
A23: 15 | B23: 4 | C23: 3 | D23: 6 | E23: 2 | F23: 2 | I23: Yes
A24: 16 | B24: 3 | C24: 17 | D24: 4 | E24: 2 | F24: 1
A25: 17 | B25: 4 | C25: 5 | D25: 7 | E25: 0 | F25: 2
A26: 18 | B26: 5 | C26: 11 | D26: 6 | E26: 2 | F26: 1 | G26: 1
A27: Totals | B27: =IF(B2="","",SUM(B9:B26)) -> 72 | D27: =IF(B2="","",SUM(D9:D26)) -> 99 | E27: =IF(B2="","",SUM(E9:E26)) -> 31 | F27: =IF(B2="","",SUM(F9:F26)) -> 34 | G27: =IF(B2="","",SUM(G9:G26)) -> 7 | H27: =IF(B2="","",SUM(H9:H26)) -> 1 | I27: =IF(COUNTIF(I9:I26,"=Yes")=0,"",COUNTIF(I9:I26,"=Yes")) -> 10