A1: Dave Andrews
A2: Club | B2: Chelsfield Lakes
A3: Par/SS | B3: 71/68 | D3: Num. Of Fairways | I3: =IF(B2="","",18-(COUNTIF(B9:B26,3))) -> 14
A4: Date | B4: 41090 | D4: Playing Handicap | I4: 16.3
A5: Event Place | B5: 4 | C5: M | D5: Prize Money | G5: 30000
A6: Game Stats | B6: DB+ | C6: DB | D6: Bi | E6: P | F6: B | G6: E | H6: A | I6: H1
B7: 0 | C7: 3 | D7: 10 | E7: 3 | F7: 2 | G7: 0 | H7: 0 | I7: 0
A8: Hole No | B8: Par | C8: Stroke Index | D8: Gross Score | E8: Points | F8: Putts | G8: Fairways | H8: Ferrets | I8: Green Regulation
A9: 1 | B9: 4 | C9: 11 | D9: 5 | E9: 2 | F9: 3 | G9: 1 | I9: Yes
A10: 2 | B10: 3 | C10: 3 | D10: 5 | E10: 1 | F10: 1
A11: 3 | B11: 4 | C11: 13 | D11: 3 | E11: 4 | F11: 1 | G11: 1 | I11: Yes
A12: 4 | B12: 4 | C12: 1 | D12: 5 | E12: 2 | F12: 2 | G12: 1 | I12: Yes
A13: 5 | B13: 3 | C13: 7 | D13: 4 | E13: 2 | F13: 3 | I13: Yes
A14: 6 | B14: 5 | C14: 15 | D14: 6 | E14: 2 | F14: 2 | I14: Yes
A15: 7 | B15: 5 | C15: 5 | D15: 6 | E15: 2 | F15: 1
A16: 8 | B16: 4 | C16: 17 | D16: 6 | E16: 0 | F16: 2
A17: 9 | B17: 4 | C17: 9 | D17: 5 | E17: 2 | F17: 1 | G17: 1
A18: 10 | B18: 4 | C18: 6 | D18: 4 | E18: 3 | F18: 1 | I18: Yes
A19: 11 | B19: 4 | C19: 18 | D19: 5 | E19: 1 | F19: 2 | G19: 1
A20: 12 | B20: 4 | C20: 8 | D20: 4 | E20: 3 | F20: 1 | I20: Yes
A21: 13 | B21: 5 | C21: 2 | D21: 7 | E21: 1 | F21: 3 | I21: Yes
A22: 14 | B22: 4 | C22: 16 | D22: 5 | E22: 2 | F22: 2 | I22: Yes
A23: 15 | B23: 3 | C23: 12 | D23: 2 | E23: 4 | F23: 0 | I23: Yes
A24: 16 | B24: 4 | C24: 4 | D24: 4 | E24: 3 | F24: 0
A25: 17 | B25: 3 | C25: 14 | D25: 4 | E25: 2 | F25: 2 | I25: Yes
A26: 18 | B26: 4 | C26: 10 | D26: 5 | E26: 2 | F26: 1 | G26: 1
A27: Totals | B27: =IF(B2="","",SUM(B9:B26)) -> 71 | D27: =IF(B2="","",SUM(D9:D26)) -> 85 | E27: =IF(B2="","",SUM(E9:E26)) -> 38 | F27: =IF(B2="","",SUM(F9:F26)) -> 28 | G27: =IF(B2="","",SUM(G9:G26)) -> 6 | H27: =IF(B2="","",SUM(H9:H26)) -> 0 | I27: =IF(COUNTIF(I9:I26,"=Yes")=0,"",COUNTIF(I9:I26,"=Yes")) -> 11