A1: Dave Bingham
A2: Club | B2: Chesfield Downs
A3: Par/SS | B3: 71/70 | D3: Num. Of Fairways | I3: =IF(B2="","",18-(COUNTIF(B9:B26,3))) -> 14
A4: Date | B4: 41090 | D4: Playing Handicap | I4: 10.6
A5: Event Place | B5: 7 | D5: Prize Money | G5: 22500
A6: Game Stats | B6: DB+ | C6: DB | D6: Bi | E6: P | F6: B | G6: E | H6: A | I6: H1
B7: 2 | C7: 2 | D7: 7 | E7: 4 | F7: 3 | G7: 0 | H7: 0 | I7: 0
A8: Hole No | B8: Par | C8: Stroke Index | D8: Gross Score | E8: Points | F8: Putts | G8: Fairways | H8: Ferrets | I8: Green Regulation
A9: 1 | B9: 4 | C9: 9 | D9: 4 | E9: 3 | F9: 2 | G9: 1 | I9: Yes
A10: 2 | B10: 4 | C10: 1 | D10: 3 | E10: 4 | F10: 1 | I10: Yes
A11: 3 | B11: 3 | C11: 13 | D11: 6 | E11: 0 | F11: 3
A12: 4 | B12: 4 | C12: 7 | D12: 5 | E12: 2 | F12: 2 | G12: 1 | I12: Yes
A13: 5 | B13: 5 | C13: 3 | D13: 4 | E13: 4 | F13: 2 | I13: Yes
A14: 6 | B14: 4 | C14: 11 | D14: 5 | E14: 2 | F14: 2 | G14: 1 | I14: Yes
A15: 7 | B15: 4 | C15: 17 | D15: 6 | E15: 0 | F15: 2 | G15: 1
A16: 8 | B16: 4 | C16: 5 | D16: 5 | E16: 2 | F16: 2 | I16: Yes
A17: 9 | B17: 3 | C17: 15 | D17: 4 | E17: 1 | F17: 2
A18: 10 | B18: 4 | C18: 12 | D18: 5 | E18: 1 | F18: 2
A19: 11 | B19: 4 | C19: 2 | D19: 4 | E19: 3 | F19: 2 | G19: 1 | I19: Yes
A20: 12 | B20: 3 | C20: 8 | D20: 4 | E20: 2 | F20: 1
A21: 13 | B21: 4 | C21: 14 | D21: 6 | E21: 0 | F21: 2 | H21: 1
A22: 14 | B22: 5 | C22: 16 | D22: 6 | E22: 1 | F22: 2 | H22: 1
A23: 15 | B23: 4 | C23: 4 | D23: 3 | E23: 4 | F23: 1 | I23: Yes
A24: 16 | B24: 5 | C24: 6 | D24: 10 | E24: 0 | F24: 3 | H24: 1
A25: 17 | B25: 3 | C25: 10 | D25: 3 | E25: 3 | F25: 2 | I25: Yes
A26: 18 | B26: 4 | C26: 18 | D26: 4 | E26: 2 | F26: 2 | G26: 1 | I26: Yes
A27: Totals | B27: =IF(B2="","",SUM(B9:B26)) -> 71 | D27: =IF(B2="","",SUM(D9:D26)) -> 87 | E27: =IF(B2="","",SUM(E9:E26)) -> 34 | F27: =IF(B2="","",SUM(F9:F26)) -> 35 | G27: =IF(B2="","",SUM(G9:G26)) -> 6 | H27: =IF(B2="","",SUM(H9:H26)) -> 3 | I27: =IF(COUNTIF(I9:I26,"=Yes")=0,"",COUNTIF(I9:I26,"=Yes")) -> 10