A1: Kevin Gallagher
A2: Club | B2: Chelsfield Lakes
A3: Par/SS | B3: 71/68 | D3: Num. Of Fairways | I3: =IF(B2="","",18-(COUNTIF(B9:B26,3))) -> 14
A4: Date | B4: 41475 | D4: Playing Handicap | I4: 16.700000000001001
A5: Event Place | B5: 6 | C5: M | D5: Prize Money | G5: 47500
A6: Game Stats | B6: DB+ | C6: DB | D6: Bi | E6: P | F6: B | G6: E | H6: A | I6: H1
B7: 0 | C7: 3 | D7: 8 | E7: 7 | F7: 0 | G7: 0 | H7: 0 | I7: 0
A8: Hole No | B8: Par | C8: Stroke Index | D8: Gross Score | E8: Points | F8: Putts | G8: Fairways | H8: Ferrets | I8: Green Regulation
A9: 1 | B9: 4 | C9: 11 | D9: 5 | E9: 2 | F9: 3 | I9: Yes
A10: 2 | B10: 3 | C10: 3 | D10: 4 | E10: 2 | F10: 2 | I10: Yes
A11: 3 | B11: 4 | C11: 13 | D11: 5 | E11: 2 | F11: 2 | I11: Yes
A12: 4 | B12: 4 | C12: 1 | D12: 5 | E12: 2 | F12: 2 | I12: Yes
A13: 5 | B13: 3 | C13: 7 | D13: 3 | E13: 3 | F13: 2 | I13: Yes
A14: 6 | B14: 5 | C14: 15 | D14: 6 | E14: 2 | F14: 2 | I14: Yes
A15: 7 | B15: 5 | C15: 5 | D15: 6 | E15: 2 | F15: 1
A16: 8 | B16: 4 | C16: 17 | D16: 4 | E16: 3 | F16: 1 | G16: 1 | I16: Yes
A17: 9 | B17: 4 | C17: 9 | D17: 6 | E17: 1 | F17: 2
A18: 10 | B18: 4 | C18: 6 | D18: 5 | E18: 2 | F18: 2 | I18: Yes
A19: 11 | B19: 4 | C19: 18 | D19: 6 | E19: 0 | F19: 1 | H19: 1
A20: 12 | B20: 4 | C20: 8 | D20: 5 | E20: 2 | F20: 2 | G20: 1 | I20: Yes
A21: 13 | B21: 5 | C21: 2 | D21: 7 | E21: 1 | F21: 2 | G21: 1
A22: 14 | B22: 4 | C22: 16 | D22: 4 | E22: 3 | F22: 1 | G22: 1 | I22: Yes
A23: 15 | B23: 3 | C23: 12 | D23: 3 | E23: 3 | F23: 2 | I23: Yes
A24: 16 | B24: 4 | C24: 4 | D24: 4 | E24: 3 | F24: 1 | G24: 1 | I24: Yes
A25: 17 | B25: 3 | C25: 14 | D25: 3 | E25: 3 | F25: 1 | I25: Yes
A26: 18 | B26: 4 | C26: 10 | D26: 4 | E26: 3 | F26: 2 | G26: 1 | I26: Yes
A27: Totals | B27: =IF(B2="","",SUM(B9:B26)) -> 71 | D27: =IF(B2="","",SUM(D9:D26)) -> 85 | E27: =IF(B2="","",SUM(E9:E26)) -> 39 | F27: =IF(B2="","",SUM(F9:F26)) -> 31 | G27: =IF(B2="","",SUM(G9:G26)) -> 6 | H27: =IF(B2="","",SUM(H9:H26)) -> 1 | I27: =IF(COUNTIF(I9:I26,"=Yes")=0,"",COUNTIF(I9:I26,"=Yes")) -> 14