B1: CHINNEY CHOO - 2011/2012
B3: Awarded to the team with most accumulated points in Majors
C4: Rousey Invitation 3/5/11 | D4: Mendy's Masters 1/10/11 | E4: Bubble Open 16/7/10 | F4: Thommo Classic 24/3/12 | G4: Players Campionship | H4: Tubby Trophy | I4: Total
B5: EUROPE
B6: D Bingham | C6: 27 | D6: 32 | E6: 34 | F6: 24 | I6: =SUM(C6:H6) -> 117
B7: I Edwards | C7: 20 | D7: 33 | E7: 27 | F7: 23 | I7: =SUM(C7:H7) -> 103
B8: J Dey | C8: 18 | D8: 26 | E8: 27 | F8: 28 | I8: =SUM(C8:H8) -> 99
B9: R Thompson | C9: 26 | D9: 0 | E9: 37 | F9: 18 | I9: =SUM(C9:H9) -> 81
B10: A Baldwin (Jnr) | C10: 28 | D10: 0 | E10: 32 | F10: 24 | I10: =SUM(C10:H10) -> 84
B11: D Andrews | C11: 26 | D11: 0 | E11: 26 | F11: 0 | I11: =SUM(C11:H11) -> 52
B12: R Dickens | C12: 19 | D12: 29 | E12: 0 | F12: 28 | I12: =SUM(C12:H12) -> 76
B13: K Mendelson | C13: 18 | D13: 16 | E13: 0 | F13: 32 | I13: =SUM(C13:H13) -> 66
B14: A Baldwin (Snr) | C14: 22 | D14: 0 | E14: 0 | F14: 0 | I14: =SUM(C14:H14) -> 22
B15: J Colbrook | C15: 20 | D15: 0 | E15: 0 | F15: 0 | I15: =SUM(C15:H15) -> 20
B16: M Bould | C16: 17 | D16: 0 | E16: 0 | F16: 0 | I16: =SUM(C16:H16) -> 17
B17: M Rouse | C17: 12 | D17: 0 | E17: 0 | F17: 0 | I17: =SUM(C17:H17) -> 12
B18: M Cox | C18: 0 | D18: 0 | E18: 0 | F18: 0 | I18: =SUM(C18:H18) -> 0
B19: J Gibbons | C19: 0 | D19: 0 | E19: 0 | F19: 0 | I19: =SUM(C19:H19) -> 0
B20: C Manning | C20: 0 | D20: 0 | E20: 0 | F20: 0 | I20: =SUM(C20:H20) -> 0
B21: K Johns | C21: 0 | D21: 0 | E21: 0 | F21: 0 | I21: =SUM(C21:H21) -> 0
B22: D White | C22: 0 | D22: 0 | E22: 0 | F22: 0 | I22: =SUM(C22:H22) -> 0
C23: =SUM(C6:C22) -> 253 | D23: =SUM(D6:D22) -> 136 | E23: =SUM(E6:E22) -> 183 | F23: =SUM(F6:F22) -> 177 | G23: =SUM(G6:G22) -> 0 | H23: =SUM(H6:H22) -> 0 | I23: =SUM(I6:I22) -> 749
B24: USA
B25: S Thompson | C25: 22 | D25: 22 | E25: 34 | F25: 30 | I25: =SUM(C25:H25) -> 108
B26: K Gallagher | C26: 24 | D26: 30 | E26: 22 | F26: 35 | I26: =SUM(C26:H26) -> 111
B27: D Rouse | C27: 19 | D27: 23 | E27: 25 | F27: 17 | I27: =SUM(C27:H27) -> 84
B28: J Press | C28: 23 | D28: 0 | E28: 33 | F28: 0 | I28: =SUM(C28:H28) -> 56
B29: P Carter | C29: 26 | D29: 29 | E29: 0 | F29: 30 | I29: =SUM(C29:H29) -> 85
B30: M Carter | C30: 25 | D30: 25 | E30: 0 | F30: 29 | I30: =SUM(C30:H30) -> 79
B31: M Trimmings | C31: 21 | D31: 28 | E31: 0 | F31: 30 | I31: =SUM(C31:H31) -> 79
B32: P Baldwin | C32: 18 | D32: 26 | E32: 0 | F32: 30 | I32: =SUM(C32:H32) -> 74
B33: A Benson | C33: 33 | D33: 0 | E33: 0 | F33: 0 | I33: =SUM(C33:H33) -> 33
B34: S Owens | C34: 29 | D34: 0 | E34: 0 | F34: 14 | I34: =SUM(C34:H34) -> 43
B35: D Braithwaite | C35: 27 | D35: 0 | E35: 0 | F35: 31 | I35: =SUM(C35:H35) -> 58
B36: A Hopkins | C36: 20 | D36: 0 | E36: 0 | F36: 0 | I36: =SUM(C36:H36) -> 20
B37: D Marsh | C37: 0 | D37: 0 | E37: 0 | F37: 0 | I37: =SUM(C37:H37) -> 0
B38: S Tilling | C38: 0 | D38: 0 | E38: 0 | F38: 0 | I38: =SUM(C38:H38) -> 0
B39: C Ferris | C39: 0 | D39: 0 | E39: 0 | F39: 0 | I39: =SUM(C39:H39) -> 0
C40: =SUM(C25:C39) -> 287 | D40: =SUM(D25:D39) -> 183 | E40: =SUM(E25:E39) -> 114 | F40: =SUM(F25:F39) -> 246 | G40: =SUM(G25:G39) -> 0 | H40: =SUM(H25:H39) -> 0 | I40: =SUM(I25:I39) -> 830