A1: Season 13 - April 1st 2011 to 31st March 2012
A2: MGA World Tour Order of Ferret by Quantity
B3: Statistics updated | C3: =TODAY() -> 40996 | G3: See Ferrets by Average
A4: Pos | B4: Player | C4: Original Handicap | D4: Current Handicap | E4: Playing Handicap | F4: Played | G4: Total Ferrets | H4: Average per Round | I4: Ferret ratio
A5: 1 | B5: Kevin Gallagher | C5: 15.3 | D5: 15.700000000001001 | E5: =D5 -> 15.700000000001001 | F5: 11 | G5: 31 | H5: 2.8181818181818183 | I5: =IF(G5="","",IF(G5=0,"0 : "&F5*18,"1 : "&ROUND(((F5*18)/G5),0))) -> 1 : 6
A6: 2 | B6: Ian Edwards | C6: 12.6 | D6: 12.6 | E6: =D6 -> 12.6 | F6: 5 | G6: 18 | H6: 3.60 | I6: =IF(G6="","",IF(G6=0,"0 : "&F6*18,"1 : "&ROUND(((F6*18)/G6),0))) -> 1 : 5
A7: =A6+1 -> 3 | B7: Roy Dickens | C7: 29.6 | D7: 30.400000000001004 | E7: =D7 -> 30.400000000001004 | F7: 4 | G7: 16 | H7: 4.00 | I7: =IF(G7="","",IF(G7=0,"0 : "&F7*18,"1 : "&ROUND(((F7*18)/G7),0))) -> 1 : 5
A8: =A7+1 -> 4 | B8: Michael Trimmings | C8: 25.0 | D8: 25.0 | E8: =D8 -> 25 | F8: 4 | G8: 14 | H8: 3.50 | I8: =IF(G8="","",IF(G8=0,"0 : "&F8*18,"1 : "&ROUND(((F8*18)/G8),0))) -> 1 : 5
A9: =A8+1 -> 5 | B9: Dave Rouse | C9: 25.1 | D9: 27.0 | E9: =D9 -> 27 | F9: 4 | G9: 12 | H9: 3.00 | I9: =IF(G9="","",IF(G9=0,"0 : "&F9*18,"1 : "&ROUND(((F9*18)/G9),0))) -> 1 : 6
A10: =A9+1 -> 6 | B10: Robert Thompson | C10: 10.6 | D10: 11.6 | E10: =D10 -> 11.6 | F10: 12 | G10: 11 | H10: 0.91666666666666663 | I10: =IF(G10="","",IF(G10=0,"0 : "&F10*18,"1 : "&ROUND(((F10*18)/G10),0))) -> 1 : 20
A11: =A10+1 -> 7 | B11: Jon Dey | C11: 30.0 | D11: 31.100000000001 | E11: =D11 -> 31.100000000001 | F11: 5 | G11: 9 | H11: 1.80 | I11: =IF(G11="","",IF(G11=0,"0 : "&F11*18,"1 : "&ROUND(((F11*18)/G11),0))) -> 1 : 10
A12: =A11+1 -> 8 | B12: Simon Thompson | C12: 9.3 | D12: 9.3 | E12: =D12 -> 9.3 | F12: 5 | G12: 7 | H12: 1.40 | I12: =IF(G12="","",IF(G12=0,"0 : "&F12*18,"1 : "&ROUND(((F12*18)/G12),0))) -> 1 : 13
A13: =A12+1 -> 9 | B13: Simon Owens | C13: 13.7 | D13: 14.1 | E13: =D13 -> 14.1 | F13: 2 | G13: 6 | H13: 3.00 | I13: =IF(G13="","",IF(G13=0,"0 : "&F13*18,"1 : "&ROUND(((F13*18)/G13),0))) -> 1 : 6
A14: =A13+1 -> 10 | B14: Malcolm Rouse | C14: 43.9 | D14: 44.9 | E14: =D14 -> 44.9 | F14: 1 | G14: 5 | H14: 5.00 | I14: =IF(G14="","",IF(G14=0,"0 : "&F14*18,"1 : "&ROUND(((F14*18)/G14),0))) -> 1 : 4
A15: =A14+1 -> 11 | B15: Matthew Carter | C15: 17.0 | D15: 17.5 | E15: =D15 -> 17.5 | F15: 3 | G15: 5 | H15: 1.6666666666666667 | I15: =IF(G15="","",IF(G15=0,"0 : "&F15*18,"1 : "&ROUND(((F15*18)/G15),0))) -> 1 : 11
A16: =A15+1 -> 12 | B16: Dave Andrews | C16: 15.8 | D16: 16.3 | E16: =D16 -> 16.3 | F16: 3 | G16: 4 | H16: 1.3333333333333333 | I16: =IF(G16="","",IF(G16=0,"0 : "&F16*18,"1 : "&ROUND(((F16*18)/G16),0))) -> 1 : 14
A17: =A16+1 -> 13 | B17: Paul Carter | C17: 13.9 | D17: 14.3 | E17: =D17 -> 14.3 | F17: 3 | G17: 4 | H17: 1.3333333333333333 | I17: =IF(G17="","",IF(G17=0,"0 : "&F17*18,"1 : "&ROUND(((F17*18)/G17),0))) -> 1 : 14
A18: =A17+1 -> 14 | B18: Paul Baldwin | C18: 19.5 | D18: 20.8 | E18: =D18 -> 20.8 | F18: 3 | G18: 4 | H18: 1.3333333333333333 | I18: =IF(G18="","",IF(G18=0,"0 : "&F18*18,"1 : "&ROUND(((F18*18)/G18),0))) -> 1 : 14
A19: =A18+1 -> 15 | B19: Dave Bingham | C19: 11.5 | D19: 10.6 | E19: =D19 -> 10.6 | F19: 4 | G19: 3 | H19: 0.75 | I19: =IF(G19="","",IF(G19=0,"0 : "&F19*18,"1 : "&ROUND(((F19*18)/G19),0))) -> 1 : 24
A20: =A19+1 -> 16 | B20: Alan Hopkins | C20: 7.2 | D20: 7.7 | E20: =D20 -> 7.7 | F20: 1 | G20: 2 | H20: 2.00 | I20: =IF(G20="","",IF(G20=0,"0 : "&F20*18,"1 : "&ROUND(((F20*18)/G20),0))) -> 1 : 9
A21: =A20+1 -> 17 | B21: Jeff Colbrook | C21: 14.7 | D21: 15.2 | E21: =D21 -> 15.2 | F21: 1 | G21: 2 | H21: 2.00 | I21: =IF(G21="","",IF(G21=0,"0 : "&F21*18,"1 : "&ROUND(((F21*18)/G21),0))) -> 1 : 9
A22: =A21+1 -> 18 | B22: Jon Press | C22: 14.0 | D22: 14.2 | E22: =D22 -> 14.2 | F22: 2 | G22: 2 | H22: 1.00 | I22: =IF(G22="","",IF(G22=0,"0 : "&F22*18,"1 : "&ROUND(((F22*18)/G22),0))) -> 1 : 18
A23: =A22+1 -> 19 | B23: Keith Mendelson | C23: 15.0 | D23: 16.4 | E23: =D23 -> 16.4 | F23: 3 | G23: 2 | H23: 0.66666666666666663 | I23: =IF(G23="","",IF(G23=0,"0 : "&F23*18,"1 : "&ROUND(((F23*18)/G23),0))) -> 1 : 27
A24: =A23+1 -> 20 | B24: Alan Baldwin | C24: 21.0 | D24: 21.2 | E24: =D24 -> 21.2 | F24: 1 | G24: 1 | H24: 1.00 | I24: =IF(G24="","",IF(G24=0,"0 : "&F24*18,"1 : "&ROUND(((F24*18)/G24),0))) -> 1 : 18
A25: =A24+1 -> 21 | B25: Martin Bould | C25: 17.8 | D25: 18.8 | E25: =D25 -> 18.8 | F25: 1 | G25: 1 | H25: 1.00 | I25: =IF(G25="","",IF(G25=0,"0 : "&F25*18,"1 : "&ROUND(((F25*18)/G25),0))) -> 1 : 18
A26: =A25+1 -> 22 | B26: Andy Benson | C26: 7.5 | D26: 6.3 | E26: =D26 -> 6.3 | F26: 2 | G26: 1 | H26: 0.50 | I26: =IF(G26="","",IF(G26=0,"0 : "&F26*18,"1 : "&ROUND(((F26*18)/G26),0))) -> 1 : 36
A27: =A26+1 -> 23 | B27: David Braithwaite | C27: 11.7 | D27: 11.7 | E27: =D27 -> 11.7 | F27: 2 | G27: 1 | H27: 0.50 | I27: =IF(G27="","",IF(G27=0,"0 : "&F27*18,"1 : "&ROUND(((F27*18)/G27),0))) -> 1 : 36
A28: =A27+1 -> 24 | B28: Andrew Baldwin | C28: 19.7 | D28: 19.800000000000999 | E28: =D28 -> 19.800000000000999 | F28: 3 | G28: 0 | H28: 0.00 | I28: =IF(G28="","",IF(G28=0,"0 : "&F28*18,"1 : "&ROUND(((F28*18)/G28),0))) -> 0 : 54
A29: =A28+1 -> 25 | B29: Andrew Knight | C29: 21.4 | D29: 21.4 | E29: =D29 -> 21.4 | F29: 0 | G29: 0 | H29: 0.00 | I29: =IF(G29="","",IF(G29=0,"0 : "&F29*18,"1 : "&ROUND(((F29*18)/G29),0))) -> 0 : 0
A30: =A29+1 -> 26 | B30: Chris Manning | C30: 22.7 | D30: 22.7 | E30: =D30 -> 22.7 | F30: 0 | G30: 0 | H30: 0.00 | I30: =IF(G30="","",IF(G30=0,"0 : "&F30*18,"1 : "&ROUND(((F30*18)/G30),0))) -> 0 : 0
A31: =A30+1 -> 27 | B31: Clive Ferris | C31: 26.0 | D31: 26.0 | E31: =D31 -> 26 | F31: 0 | G31: 0 | H31: 0.00 | I31: =IF(G31="","",IF(G31=0,"0 : "&F31*18,"1 : "&ROUND(((F31*18)/G31),0))) -> 0 : 0
A32: =A31+1 -> 28 | B32: Dave White | C32: 21.5 | D32: 21.5 | E32: =D32 -> 21.5 | F32: 0 | G32: 0 | H32: 0.00 | I32: =IF(G32="","",IF(G32=0,"0 : "&F32*18,"1 : "&ROUND(((F32*18)/G32),0))) -> 0 : 0
A33: =A32+1 -> 29 | B33: Jeff Gibbons | C33: 21.0 | D33: 21.0 | E33: =D33 -> 21 | F33: 0 | G33: 0 | H33: 0.00 | I33: =IF(G33="","",IF(G33=0,"0 : "&F33*18,"1 : "&ROUND(((F33*18)/G33),0))) -> 0 : 0
A34: =A33+1 -> 30 | B34: Keith Johns | C34: 24.3 | D34: 24.3 | E34: =D34 -> 24.3 | F34: 0 | G34: 0 | H34: 0.00 | I34: =IF(G34="","",IF(G34=0,"0 : "&F34*18,"1 : "&ROUND(((F34*18)/G34),0))) -> 0 : 0
A35: =A34+1 -> 31 | B35: Martin Cox | C35: 13.5 | D35: 13.5 | E35: =D35 -> 13.5 | F35: 0 | G35: 0 | H35: 0.00 | I35: =IF(G35="","",IF(G35=0,"0 : "&F35*18,"1 : "&ROUND(((F35*18)/G35),0))) -> 0 : 0
A36: =A35+1 -> 32 | B36: Steve Tilling | C36: 16.5 | D36: 16.5 | E36: =D36 -> 16.5 | F36: 0 | G36: 0 | H36: 0.00 | I36: =IF(G36="","",IF(G36=0,"0 : "&F36*18,"1 : "&ROUND(((F36*18)/G36),0))) -> 0 : 0
F37: TOTAL | G37: =SUM(G5:G36) -> 161