A1: Season 13 - April 1st 2011 to 31st March 2012
A2: MGA World Tour Net Greens in Regulation
B3: Statistics updated | C3: =TODAY() -> 40996
A4: Pos | B4: Player | C4: Original Handicap | D4: Current Handicap | E4: Playing Handicap | F4: Played | G4: Total Greens Hit | H4: Green in Regulation | I4: Greens in Regulation Ratio
A5: 1 | B5: Jon Dey | C5: 30.0 | D5: 31.100000000001 | E5: =D5 -> 31.100000000001 | F5: 5 | G5: 50 | H5: 55.56 % | I5: =IF(G5="","",IF(G5=0,"0 : "&F5*18,"1 : "&ROUND((F5*18)/G5,1))) -> 1 : 1.8 | J5: Qualified
A6: 2 | B6: Robert Thompson | C6: 10.6 | D6: 11.6 | E6: =D6 -> 11.6 | F6: 12 | G6: 116 | H6: 53.7 % | I6: =IF(G6="","",IF(G6=0,"0 : "&F6*18,"1 : "&ROUND((F6*18)/G6,1))) -> 1 : 1.9 | J6: Qualified
A7: 3 | B7: Kevin Gallagher | C7: 15.3 | D7: 15.700000000001001 | E7: =D7 -> 15.700000000001001 | F7: 11 | G7: 102 | H7: 51.52 % | I7: =IF(G7="","",IF(G7=0,"0 : "&F7*18,"1 : "&ROUND((F7*18)/G7,1))) -> 1 : 1.9 | J7: Qualified
A8: 4 | B8: Ian Edwards | C8: 12.6 | D8: 12.6 | E8: =D8 -> 12.6 | F8: 5 | G8: 45 | H8: 50 % | I8: =IF(G8="","",IF(G8=0,"0 : "&F8*18,"1 : "&ROUND((F8*18)/G8,1))) -> 1 : 2 | J8: Qualified
A9: 5 | B9: Simon Thompson | C9: 9.3 | D9: 9.3 | E9: =D9 -> 9.3 | F9: 5 | G9: 40 | H9: 44.44 % | I9: =IF(G9="","",IF(G9=0,"0 : "&F9*18,"1 : "&ROUND((F9*18)/G9,1))) -> 1 : 2.3 | J9: Qualified
A10: 6 | B10: Michael Trimmings | C10: 25.0 | D10: 25.0 | E10: =D10 -> 25 | F10: 4 | G10: 45 | H10: 62.5 % | I10: =IF(G10="","",IF(G10=0,"0 : "&F10*18,"1 : "&ROUND((F10*18)/G10,1))) -> 1 : 1.6
A11: 7 | B11: Andy Benson | C11: 7.5 | D11: 6.3 | E11: =D11 -> 6.3 | F11: 2 | G11: 22 | H11: 61.11 % | I11: =IF(G11="","",IF(G11=0,"0 : "&F11*18,"1 : "&ROUND((F11*18)/G11,1))) -> 1 : 1.6
A12: 8 | B12: Andrew Baldwin | C12: 19.7 | D12: 19.800000000000999 | E12: =D12 -> 19.800000000000999 | F12: 3 | G12: 30 | H12: 55.56 % | I12: =IF(G12="","",IF(G12=0,"0 : "&F12*18,"1 : "&ROUND((F12*18)/G12,1))) -> 1 : 1.8
A13: 9 | B13: Jon Press | C13: 14.0 | D13: 14.2 | E13: =D13 -> 14.2 | F13: 2 | G13: 20 | H13: 55.56 % | I13: =IF(G13="","",IF(G13=0,"0 : "&F13*18,"1 : "&ROUND((F13*18)/G13,1))) -> 1 : 1.8
A14: 10 | B14: Roy Dickens | C14: 29.6 | D14: 30.400000000001004 | E14: =D14 -> 30.400000000001004 | F14: 4 | G14: 38 | H14: 52.78 % | I14: =IF(G14="","",IF(G14=0,"0 : "&F14*18,"1 : "&ROUND((F14*18)/G14,1))) -> 1 : 1.9
A15: 11 | B15: Matthew Carter | C15: 17.0 | D15: 17.5 | E15: =D15 -> 17.5 | F15: 3 | G15: 28 | H15: 51.85 % | I15: =IF(G15="","",IF(G15=0,"0 : "&F15*18,"1 : "&ROUND((F15*18)/G15,1))) -> 1 : 1.9
A16: 12 | B16: Dave Bingham | C16: 11.5 | D16: 10.6 | E16: =D16 -> 10.6 | F16: 4 | G16: 34 | H16: 47.22 % | I16: =IF(G16="","",IF(G16=0,"0 : "&F16*18,"1 : "&ROUND((F16*18)/G16,1))) -> 1 : 2.1
A17: 13 | B17: Paul Carter | C17: 13.9 | D17: 14.3 | E17: =D17 -> 14.3 | F17: 3 | G17: 25 | H17: 46.3 % | I17: =IF(G17="","",IF(G17=0,"0 : "&F17*18,"1 : "&ROUND((F17*18)/G17,1))) -> 1 : 2.2
A18: 14 | B18: Martin Bould | C18: 17.8 | D18: 18.8 | E18: =D18 -> 18.8 | F18: 1 | G18: 8 | H18: 44.44 % | I18: =IF(G18="","",IF(G18=0,"0 : "&F18*18,"1 : "&ROUND((F18*18)/G18,1))) -> 1 : 2.3
A19: 15 | B19: Dave Andrews | C19: 15.8 | D19: 16.3 | E19: =D19 -> 16.3 | F19: 3 | G19: 23 | H19: 42.59 % | I19: =IF(G19="","",IF(G19=0,"0 : "&F19*18,"1 : "&ROUND((F19*18)/G19,1))) -> 1 : 2.3
A20: 16 | B20: David Braithwaite | C20: 11.7 | D20: 11.7 | E20: =D20 -> 11.7 | F20: 2 | G20: 15 | H20: 41.67 % | I20: =IF(G20="","",IF(G20=0,"0 : "&F20*18,"1 : "&ROUND((F20*18)/G20,1))) -> 1 : 2.4
A21: 17 | B21: Jeff Colbrook | C21: 14.7 | D21: 15.2 | E21: =D21 -> 15.2 | F21: 1 | G21: 7 | H21: 38.89 % | I21: =IF(G21="","",IF(G21=0,"0 : "&F21*18,"1 : "&ROUND((F21*18)/G21,1))) -> 1 : 2.6
A22: 18 | B22: Dave Rouse | C22: 25.1 | D22: 27.0 | E22: =D22 -> 27 | F22: 4 | G22: 27 | H22: 37.5 % | I22: =IF(G22="","",IF(G22=0,"0 : "&F22*18,"1 : "&ROUND((F22*18)/G22,1))) -> 1 : 2.7
A23: 19 | B23: Paul Baldwin | C23: 19.5 | D23: 20.8 | E23: =D23 -> 20.8 | F23: 3 | G23: 19 | H23: 35.19 % | I23: =IF(G23="","",IF(G23=0,"0 : "&F23*18,"1 : "&ROUND((F23*18)/G23,1))) -> 1 : 2.8
A24: 20 | B24: Keith Mendelson | C24: 15.0 | D24: 16.4 | E24: =D24 -> 16.4 | F24: 3 | G24: 19 | H24: 35.19 % | I24: =IF(G24="","",IF(G24=0,"0 : "&F24*18,"1 : "&ROUND((F24*18)/G24,1))) -> 1 : 2.8
A25: 21 | B25: Alan Hopkins | C25: 7.2 | D25: 7.7 | E25: =D25 -> 7.7 | F25: 1 | G25: 6 | H25: 33.33 % | I25: =IF(G25="","",IF(G25=0,"0 : "&F25*18,"1 : "&ROUND((F25*18)/G25,1))) -> 1 : 3
A26: 22 | B26: Simon Owens | C26: 13.7 | D26: 14.1 | E26: =D26 -> 14.1 | F26: 2 | G26: 11 | H26: 30.56 % | I26: =IF(G26="","",IF(G26=0,"0 : "&F26*18,"1 : "&ROUND((F26*18)/G26,1))) -> 1 : 3.3
A27: 23 | B27: Alan Baldwin | C27: 21.0 | D27: 21.2 | E27: =D27 -> 21.2 | F27: 1 | G27: 5 | H27: 27.78 % | I27: =IF(G27="","",IF(G27=0,"0 : "&F27*18,"1 : "&ROUND((F27*18)/G27,1))) -> 1 : 3.6
A28: 24 | B28: Malcolm Rouse | C28: 43.9 | D28: 44.9 | E28: =D28 -> 44.9 | F28: 1 | G28: 4 | H28: 22.22 % | I28: =IF(G28="","",IF(G28=0,"0 : "&F28*18,"1 : "&ROUND((F28*18)/G28,1))) -> 1 : 4.5
A29: 25 | B29: Andrew Knight | C29: 21.4 | D29: 21.4 | E29: =D29 -> 21.4 | F29: 0 | G29: 0 | H29: 0.00 | I29: =IF(G29="","",IF(G29=0,"0 : "&F29*18,"1 : "&ROUND((F29*18)/G29,1))) -> 0 : 0
A30: 26 | B30: Chris Manning | C30: 22.7 | D30: 22.7 | E30: =D30 -> 22.7 | F30: 0 | G30: 0 | H30: 0.00 | I30: =IF(G30="","",IF(G30=0,"0 : "&F30*18,"1 : "&ROUND((F30*18)/G30,1))) -> 0 : 0
A31: 27 | B31: Clive Ferris | C31: 26.0 | D31: 26.0 | E31: =D31 -> 26 | F31: 0 | G31: 0 | H31: 0.00 | I31: =IF(G31="","",IF(G31=0,"0 : "&F31*18,"1 : "&ROUND((F31*18)/G31,1))) -> 0 : 0
A32: 28 | B32: Dave White | C32: 21.5 | D32: 21.5 | E32: =D32 -> 21.5 | F32: 0 | G32: 0 | H32: 0.00 | I32: =IF(G32="","",IF(G32=0,"0 : "&F32*18,"1 : "&ROUND((F32*18)/G32,1))) -> 0 : 0
A33: 29 | B33: Jeff Gibbons | C33: 21.0 | D33: 21.0 | E33: =D33 -> 21 | F33: 0 | G33: 0 | H33: 0.00 | I33: =IF(G33="","",IF(G33=0,"0 : "&F33*18,"1 : "&ROUND((F33*18)/G33,1))) -> 0 : 0
A34: 30 | B34: Keith Johns | C34: 24.3 | D34: 24.3 | E34: =D34 -> 24.3 | F34: 0 | G34: 0 | H34: 0.00 | I34: =IF(G34="","",IF(G34=0,"0 : "&F34*18,"1 : "&ROUND((F34*18)/G34,1))) -> 0 : 0
A35: 31 | B35: Martin Cox | C35: 13.5 | D35: 13.5 | E35: =D35 -> 13.5 | F35: 0 | G35: 0 | H35: 0.00 | I35: =IF(G35="","",IF(G35=0,"0 : "&F35*18,"1 : "&ROUND((F35*18)/G35,1))) -> 0 : 0
A36: 32 | B36: Steve Tilling | C36: 16.5 | D36: 16.5 | E36: =D36 -> 16.5 | F36: 0 | G36: 0 | H36: 0.00 | I36: =IF(G36="","",IF(G36=0,"0 : "&F36*18,"1 : "&ROUND((F36*18)/G36,1))) -> 0 : 0