A1: Season 13 - April 1st 2011 to 31st March 2012
A2: MGA World Tour Money List
B3: Statistics updated | C3: =TODAY() -> 40996
A4: Pos | B4: Player | C4: Original Handicap | D4: Current Handicap | E4: Playing Handicap | F4: Events Played | G4: Tour Victories | H4: Winnings
A5: 1 | B5: Kevin Gallagher | C5: 15.3 | D5: 15.700000000001001 | E5: =D5 -> 15.700000000001001 | F5: 11 | G5: 4 | H5: 140000
A6: =A5+1 -> 2 | B6: Robert Thompson | C6: 10.6 | D6: 11.6 | E6: =D6 -> 11.6 | F6: 12 | G6: 4 | H6: 113750
A7: =A6+1 -> 3 | B7: Dave Bingham | C7: 11.5 | D7: 10.6 | E7: =D7 -> 10.6 | F7: 4 | G7: 0 | H7: 113750
A8: =A7+1 -> 4 | B8: Paul Carter | C8: 13.9 | D8: 14.3 | E8: =D8 -> 14.3 | F8: 3 | G8: 0 | H8: 95000
A9: =A8+1 -> 5 | B9: Simon Thompson | C9: 9.3 | D9: 9.3 | E9: =D9 -> 9.3 | F9: 5 | G9: 0 | H9: 90000
A10: =A9+1 -> 6 | B10: David Braithwaite | C10: 11.7 | D10: 11.7 | E10: =D10 -> 11.7 | F10: 2 | G10: 0 | H10: 86250
A11: =A10+1 -> 7 | B11: Michael Trimmings | C11: 25.0 | D11: 25.0 | E11: =D11 -> 25 | F11: 4 | G11: 1 | H11: 83750
A12: =A11+1 -> 8 | B12: Andrew Baldwin | C12: 19.7 | D12: 19.800000000000999 | E12: =D12 -> 19.800000000000999 | F12: 3 | G12: 0 | H12: 83750
A13: =A12+1 -> 9 | B13: Ian Edwards | C13: 12.6 | D13: 12.6 | E13: =D13 -> 12.6 | F13: 5 | G13: 1 | H13: 81250
A14: =A13+1 -> 10 | B14: Andy Benson | C14: 7.5 | D14: 6.3 | E14: =D14 -> 6.3 | F14: 2 | G14: 2 | H14: 72500
A15: =A14+1 -> 11 | B15: Matthew Carter | C15: 17.0 | D15: 17.5 | E15: =D15 -> 17.5 | F15: 3 | G15: 0 | H15: 72500
A16: =A15+1 -> 12 | B16: Simon Owens | C16: 13.7 | D16: 14.1 | E16: =D16 -> 14.1 | F16: 2 | G16: 0 | H16: 60000
A17: =A16+1 -> 13 | B17: Jon Dey | C17: 30.0 | D17: 31.100000000001 | E17: =D17 -> 31.100000000001 | F17: 5 | G17: 1 | H17: 58750
A18: =A17+1 -> 14 | B18: Roy Dickens | C18: 29.6 | D18: 30.400000000001004 | E18: =D18 -> 30.400000000001004 | F18: 4 | G18: 0 | H18: 58750
A19: =A18+1 -> 15 | B19: Dave Andrews | C19: 15.8 | D19: 16.3 | E19: =D19 -> 16.3 | F19: 3 | G19: 1 | H19: 57500
A20: =A19+1 -> 16 | B20: Paul Baldwin | C20: 19.5 | D20: 20.8 | E20: =D20 -> 20.8 | F20: 3 | G20: 0 | H20: 52500
A21: =A20+1 -> 17 | B21: Jon Press | C21: 14.0 | D21: 14.2 | E21: =D21 -> 14.2 | F21: 2 | G21: 0 | H21: 52500
A22: =A21+1 -> 18 | B22: Keith Mendelson | C22: 15.0 | D22: 16.4 | E22: =D22 -> 16.4 | F22: 3 | G22: 0 | H22: 50000
A23: =A22+1 -> 19 | B23: Dave Rouse | C23: 25.1 | D23: 27.0 | E23: =D23 -> 27 | F23: 4 | G23: 0 | H23: 33750
A24: =A23+1 -> 20 | B24: Alan Baldwin | C24: 21.0 | D24: 21.2 | E24: =D24 -> 21.2 | F24: 1 | G24: 0 | H24: 31250
A25: =A24+1 -> 21 | B25: Alan Hopkins | C25: 7.2 | D25: 7.7 | E25: =D25 -> 7.7 | F25: 1 | G25: 0 | H25: 22500
A26: =A25+1 -> 22 | B26: Jeff Colbrook | C26: 14.7 | D26: 15.2 | E26: =D26 -> 15.2 | F26: 1 | G26: 0 | H26: 22500
A27: =A26+1 -> 23 | B27: Martin Bould | C27: 17.8 | D27: 18.8 | E27: =D27 -> 18.8 | F27: 1 | G27: 0 | H27: 5000
A28: =A27+1 -> 24 | B28: Malcolm Rouse | C28: 43.9 | D28: 44.9 | E28: =D28 -> 44.9 | F28: 1 | G28: 0 | H28: 2500
A29: =A28+1 -> 25 | B29: Andrew Knight | C29: 21.4 | D29: 21.4 | E29: =D29 -> 21.4 | F29: 0 | G29: 0 | H29: 0
A30: =A29+1 -> 26 | B30: Chris Manning | C30: 22.7 | D30: 22.7 | E30: =D30 -> 22.7 | F30: 0 | G30: 0 | H30: 0
A31: =A30+1 -> 27 | B31: Clive Ferris | C31: 26.0 | D31: 26.0 | E31: =D31 -> 26 | F31: 0 | G31: 0 | H31: 0
A32: =A31+1 -> 28 | B32: Dave White | C32: 21.5 | D32: 21.5 | E32: =D32 -> 21.5 | F32: 0 | G32: 0 | H32: 0
A33: =A32+1 -> 29 | B33: Jeff Gibbons | C33: 21.0 | D33: 21.0 | E33: =D33 -> 21 | F33: 0 | G33: 0 | H33: 0
A34: =A33+1 -> 30 | B34: Keith Johns | C34: 24.3 | D34: 24.3 | E34: =D34 -> 24.3 | F34: 0 | G34: 0 | H34: 0
A35: =A34+1 -> 31 | B35: Martin Cox | C35: 13.5 | D35: 13.5 | E35: =D35 -> 13.5 | F35: 0 | G35: 0 | H35: 0
A36: =A35+1 -> 32 | B36: Steve Tilling | C36: 16.5 | D36: 16.5 | E36: =D36 -> 16.5 | F36: 0 | G36: 0 | H36: 0