A1: Season 13 - April 1st 2011 to 31st March 2012
A2: MGA World Tour Order of Merit
B3: Statistics updated | C3: =TODAY() -> 40996
A4: Pos | B4: Player | C4: Original Handicap | D4: Current Handicap | E4: Playing Handicap | F4: Played | G4: Points | H4: Average | I4: HI / LOW Score | J4: Qualified (5 games)
A5: 1 | B5: Robert Thompson | C5: 10.6 | D5: 11.6 | E5: =D5 -> 11.6 | F5: 12 | G5: 350 | H5: =IF(ISERROR(G5/F5),0,G5/F5) -> 29.166666666666668 | I5: 37 / 18 | J5: =IF(F5>=5,"Qualified","") -> Qualified
A6: 2 | B6: Kevin Gallagher | C6: 15.3 | D6: 15.700000000001001 | E6: =D6 -> 15.700000000001001 | F6: 11 | G6: 304 | H6: =IF(ISERROR(G6/F6),0,G6/F6) -> 27.636363636363637 | I6: 35 / 20 | J6: =IF(F6>=5,"Qualified","") -> Qualified
A7: 3 | B7: Jon Dey | C7: 30.0 | D7: 31.100000000001 | E7: =D7 -> 31.100000000001 | F7: 5 | G7: 137 | H7: =IF(ISERROR(G7/F7),0,G7/F7) -> 27.40 | I7: 38 / 18 | J7: =IF(F7>=5,"Qualified","") -> Qualified
A8: 4 | B8: Simon Thompson | C8: 9.3 | D8: 9.3 | E8: =D8 -> 9.3 | F8: 5 | G8: 135 | H8: =IF(ISERROR(G8/F8),0,G8/F8) -> 27.00 | I8: 34 / 22 | J8: =IF(F8>=5,"Qualified","") -> Qualified
A9: 5 | B9: Ian Edwards | C9: 12.6 | D9: 12.6 | E9: =D9 -> 12.6 | F9: 5 | G9: 132 | H9: =IF(ISERROR(G9/F9),0,G9/F9) -> 26.40 | I9: 33 / 20 | J9: =IF(F9>=5,"Qualified","") -> Qualified
A10: 6 | B10: Andy Benson | C10: 7.5 | D10: 6.3 | E10: =D10 -> 6.3 | F10: 2 | G10: 70 | H10: =IF(ISERROR(G10/F10),0,G10/F10) -> 35.00 | I10: 37 / 33 | J10: =IF(F10>=5,"Qualified","") -> 
A11: 7 | B11: Dave Bingham | C11: 11.5 | D11: 10.6 | E11: =D11 -> 10.6 | F11: 4 | G11: 117 | H11: =IF(ISERROR(G11/F11),0,G11/F11) -> 29.25 | I11: 34 / 24 | J11: =IF(F11>=5,"Qualified","") -> 
A12: 8 | B12: Michael Trimmings | C12: 25.0 | D12: 25.0 | E12: =D12 -> 25 | F12: 4 | G12: 116 | H12: =IF(ISERROR(G12/F12),0,G12/F12) -> 29.00 | I12: 37 / 21 | J12: =IF(F12>=5,"Qualified","") -> 
A13: 9 | B13: David Braithwaite | C13: 11.7 | D13: 11.7 | E13: =D13 -> 11.7 | F13: 2 | G13: 58 | H13: =IF(ISERROR(G13/F13),0,G13/F13) -> 29.00 | I13: 31 / 27 | J13: =IF(F13>=5,"Qualified","") -> 
A14: 10 | B14: Paul Carter | C14: 13.9 | D14: 14.3 | E14: =D14 -> 14.3 | F14: 3 | G14: 85 | H14: =IF(ISERROR(G14/F14),0,G14/F14) -> 28.333333333333332 | I14: 30 / 26 | J14: =IF(F14>=5,"Qualified","") -> 
A15: 11 | B15: Andrew Baldwin | C15: 19.7 | D15: 19.800000000000999 | E15: =D15 -> 19.800000000000999 | F15: 3 | G15: 84 | H15: =IF(ISERROR(G15/F15),0,G15/F15) -> 28.00 | I15: 32 / 24 | J15: =IF(F15>=5,"Qualified","") -> 
A16: 12 | B16: Jon Press | C16: 14.0 | D16: 14.2 | E16: =D16 -> 14.2 | F16: 2 | G16: 56 | H16: =IF(ISERROR(G16/F16),0,G16/F16) -> 28.00 | I16: 33 / 23 | J16: =IF(F16>=5,"Qualified","") -> 
A17: 13 | B17: Dave Andrews | C17: 15.8 | D17: 16.3 | E17: =D17 -> 16.3 | F17: 3 | G17: 82 | H17: =IF(ISERROR(G17/F17),0,G17/F17) -> 27.333333333333332 | I17: 30 / 26 | J17: =IF(F17>=5,"Qualified","") -> 
A18: 14 | B18: Roy Dickens | C18: 29.6 | D18: 30.400000000001004 | E18: =D18 -> 30.400000000001004 | F18: 4 | G18: 107 | H18: =IF(ISERROR(G18/F18),0,G18/F18) -> 26.75 | I18: 31 / 19 | J18: =IF(F18>=5,"Qualified","") -> 
A19: 15 | B19: Matthew Carter | C19: 17.0 | D19: 17.5 | E19: =D19 -> 17.5 | F19: 3 | G19: 80 | H19: =IF(ISERROR(G19/F19),0,G19/F19) -> 26.666666666666668 | I19: 29 / 25 | J19: =IF(F19>=5,"Qualified","") -> 
A20: 16 | B20: Paul Baldwin | C20: 19.5 | D20: 20.8 | E20: =D20 -> 20.8 | F20: 3 | G20: 74 | H20: =IF(ISERROR(G20/F20),0,G20/F20) -> 24.666666666666668 | I20: 30 / 18 | J20: =IF(F20>=5,"Qualified","") -> 
A21: 17 | B21: Keith Mendelson | C21: 15.0 | D21: 16.4 | E21: =D21 -> 16.4 | F21: 3 | G21: 66 | H21: =IF(ISERROR(G21/F21),0,G21/F21) -> 22.00 | I21: 32 / 16 | J21: =IF(F21>=5,"Qualified","") -> 
A22: 18 | B22: Alan Baldwin | C22: 21.0 | D22: 21.2 | E22: =D22 -> 21.2 | F22: 1 | G22: 22 | H22: =IF(ISERROR(G22/F22),0,G22/F22) -> 22.00 | I22: 22 / 22 | J22: =IF(F22>=5,"Qualified","") -> 
A23: 19 | B23: Dave Rouse | C23: 25.1 | D23: 27.0 | E23: =D23 -> 27 | F23: 4 | G23: 86 | H23: =IF(ISERROR(G23/F23),0,G23/F23) -> 21.50 | I23: 25 / 17 | J23: =IF(F23>=5,"Qualified","") -> 
A24: 20 | B24: Simon Owens | C24: 13.7 | D24: 14.1 | E24: =D24 -> 14.1 | F24: 2 | G24: 43 | H24: =IF(ISERROR(G24/F24),0,G24/F24) -> 21.50 | I24: 29 / 14 | J24: =IF(F24>=5,"Qualified","") -> 
A25: 21 | B25: Alan Hopkins | C25: 7.2 | D25: 7.7 | E25: =D25 -> 7.7 | F25: 1 | G25: 20 | H25: =IF(ISERROR(G25/F25),0,G25/F25) -> 20.00 | I25: 20 / 20 | J25: =IF(F25>=5,"Qualified","") -> 
A26: 22 | B26: Jeff Colbrook | C26: 14.7 | D26: 15.2 | E26: =D26 -> 15.2 | F26: 1 | G26: 20 | H26: =IF(ISERROR(G26/F26),0,G26/F26) -> 20.00 | I26: 20 / 20 | J26: =IF(F26>=5,"Qualified","") -> 
A27: 23 | B27: Martin Bould | C27: 17.8 | D27: 18.8 | E27: =D27 -> 18.8 | F27: 1 | G27: 17 | H27: =IF(ISERROR(G27/F27),0,G27/F27) -> 17.00 | I27: 17 / 17 | J27: =IF(F27>=5,"Qualified","") -> 
A28: 24 | B28: Malcolm Rouse | C28: 43.9 | D28: 44.9 | E28: =D28 -> 44.9 | F28: 1 | G28: 12 | H28: =IF(ISERROR(G28/F28),0,G28/F28) -> 12.00 | I28: 12 / 12 | J28: =IF(F28>=5,"Qualified","") -> 
A29: 25 | B29: Andrew Knight | C29: 21.4 | D29: 21.4 | E29: =D29 -> 21.4 | F29: 0 | G29: 0 | H29: =IF(ISERROR(G29/F29),0,G29/F29) -> 0.00 | I29: / | J29: =IF(F29>=5,"Qualified","") -> 
A30: 26 | B30: Chris Manning | C30: 22.7 | D30: 22.7 | E30: =D30 -> 22.7 | F30: 0 | G30: 0 | H30: =IF(ISERROR(G30/F30),0,G30/F30) -> 0.00 | I30: / | J30: =IF(F30>=5,"Qualified","") -> 
A31: 27 | B31: Clive Ferris | C31: 26.0 | D31: 26.0 | E31: =D31 -> 26 | F31: 0 | G31: 0 | H31: =IF(ISERROR(G31/F31),0,G31/F31) -> 0.00 | I31: / | J31: =IF(F31>=5,"Qualified","") -> 
A32: 28 | B32: Dave White | C32: 21.5 | D32: 21.5 | E32: =D32 -> 21.5 | F32: 0 | G32: 0 | H32: =IF(ISERROR(G32/F32),0,G32/F32) -> 0.00 | I32: / | J32: =IF(F32>=5,"Qualified","") -> 
A33: 29 | B33: Jeff Gibbons | C33: 21.0 | D33: 21.0 | E33: =D33 -> 21 | F33: 0 | G33: 0 | H33: =IF(ISERROR(G33/F33),0,G33/F33) -> 0.00 | I33: / | J33: =IF(F33>=5,"Qualified","") -> 
A34: 30 | B34: Keith Johns | C34: 24.3 | D34: 24.3 | E34: =D34 -> 24.3 | F34: 0 | G34: 0 | H34: =IF(ISERROR(G34/F34),0,G34/F34) -> 0.00 | I34: / | J34: =IF(F34>=5,"Qualified","") -> 
A35: 31 | B35: Martin Cox | C35: 13.5 | D35: 13.5 | E35: =D35 -> 13.5 | F35: 0 | G35: 0 | H35: =IF(ISERROR(G35/F35),0,G35/F35) -> 0.00 | I35: / | J35: =IF(F35>=5,"Qualified","") -> 
A36: 32 | B36: Steve Tilling | C36: 16.5 | D36: 16.5 | E36: =D36 -> 16.5 | F36: 0 | G36: 0 | H36: =IF(ISERROR(G36/F36),0,G36/F36) -> 0.00 | I36: / | J36: =IF(F36>=5,"Qualified","") -> 