A1: Season 13 - April 1st 2011 to 31st March 2012
A2: MGA World Tour Putting Statistics
B3: Statistics updated | C3: =TODAY() -> 40996
A4: Pos | B4: Player | C4: Original Handicap | D4: Current Handicap | E4: Playing Handicap | F4: Played | G4: Total Putts | H4: Ave per Round | I4: Ave Per Hole | J4: Best Round | K4: Worst Round
A5: 1 | B5: Simon Thompson | C5: 9.3 | D5: 9.3 | E5: =D5 -> 9.3 | F5: 5 | G5: 165 | H5: 33.00 | I5: =IF(G5=0,"",G5/(F5*18)) -> 1.8333333333333333 | J5: 29 | K5: 37 | L5: Qualified
A6: 2 | B6: Robert Thompson | C6: 10.6 | D6: 11.6 | E6: =D6 -> 11.6 | F6: 12 | G6: 407 | H6: 33.916666666666664 | I6: =IF(G6=0,"",G6/(F6*18)) -> 1.8842592592592593 | J6: 29 | K6: 37 | L6: Qualified
A7: 3 | B7: Kevin Gallagher | C7: 15.3 | D7: 15.700000000001001 | E7: =D7 -> 15.700000000001001 | F7: 11 | G7: 387 | H7: 35.18181818181818 | I7: =IF(G7=0,"",G7/(F7*18)) -> 1.9545454545454546 | J7: 25 | K7: 41 | L7: Qualified
A8: 4 | B8: Ian Edwards | C8: 12.6 | D8: 12.6 | E8: =D8 -> 12.6 | F8: 5 | G8: 184 | H8: 36.80 | I8: =IF(G8=0,"",G8/(F8*18)) -> 2.0444444444444443 | J8: 35 | K8: 41 | L8: Qualified
A9: 5 | B9: Jon Press | C9: 30.0 | D9: 31.100000000001 | E9: =D9 -> 31.100000000001 | F9: 5 | G9: 193 | H9: 38.60 | I9: =IF(G9=0,"",G9/(F9*18)) -> 2.1444444444444444 | J9: 34 | K9: 44 | L9: Qualified
A10: 6 | B10: Dave Bingham | C10: 11.5 | D10: 10.6 | E10: =D10 -> 10.6 | F10: 4 | G10: 129 | H10: 32.25 | I10: =IF(G10=0,"",G10/(F10*18)) -> 1.7916666666666667 | J10: 27 | K10: 37
A11: 7 | B11: Andy Benson | C11: 7.5 | D11: 6.3 | E11: =D11 -> 6.3 | F11: 2 | G11: 65 | H11: 32.50 | I11: =IF(G11=0,"",G11/(F11*18)) -> 1.8055555555555556 | J11: 31 | K11: 34
A12: 8 | B12: David Braithwaite | C12: 11.7 | D12: 11.7 | E12: =D12 -> 11.7 | F12: 2 | G12: 65 | H12: 32.50 | I12: =IF(G12=0,"",G12/(F12*18)) -> 1.8055555555555556 | J12: 31 | K12: 34
A13: 9 | B13: Dave Andrews | C13: 15.8 | D13: 16.3 | E13: =D13 -> 16.3 | F13: 3 | G13: 98 | H13: 32.666666666666664 | I13: =IF(G13=0,"",G13/(F13*18)) -> 1.8148148148148149 | J13: 31 | K13: 34
A14: 10 | B14: Alan Baldwin | C14: 21.0 | D14: 21.2 | E14: =D14 -> 21.2 | F14: 1 | G14: 33 | H14: 33.00 | I14: =IF(G14=0,"",G14/(F14*18)) -> 1.8333333333333333 | J14: 33 | K14: 33
A15: 11 | B15: Simon Owens | C15: 13.7 | D15: 14.1 | E15: =D15 -> 14.1 | F15: 2 | G15: 67 | H15: 33.50 | I15: =IF(G15=0,"",G15/(F15*18)) -> 1.8611111111111112 | J15: 28 | K15: 39
A16: 12 | B16: Paul Baldwin | C16: 19.5 | D16: 20.8 | E16: =D16 -> 20.8 | F16: 3 | G16: 103 | H16: 34.333333333333336 | I16: =IF(G16=0,"",G16/(F16*18)) -> 1.9074074074074074 | J16: 33 | K16: 36
A17: 13 | B17: Paul Carter | C17: 13.9 | D17: 14.3 | E17: =D17 -> 14.3 | F17: 3 | G17: 104 | H17: 34.666666666666664 | I17: =IF(G17=0,"",G17/(F17*18)) -> 1.9259259259259258 | J17: 32 | K17: 40
A18: 14 | B18: Matthew Carter | C18: 17.0 | D18: 17.5 | E18: =D18 -> 17.5 | F18: 3 | G18: 105 | H18: 35.00 | I18: =IF(G18=0,"",G18/(F18*18)) -> 1.9444444444444444 | J18: 33 | K18: 38
A19: 15 | B19: Andrew Baldwin | C19: 19.7 | D19: 19.800000000000999 | E19: =D19 -> 19.800000000000999 | F19: 3 | G19: 106 | H19: 35.333333333333336 | I19: =IF(G19=0,"",G19/(F19*18)) -> 1.962962962962963 | J19: 34 | K19: 37
A20: 16 | B20: Dave Rouse | C20: 25.1 | D20: 27.0 | E20: =D20 -> 27 | F20: 4 | G20: 144 | H20: 36.00 | I20: =IF(G20=0,"",G20/(F20*18)) -> 2.00 | J20: 32 | K20: 44
A21: 17 | B21: Jeff Colbrook | C21: 14.7 | D21: 15.2 | E21: =D21 -> 15.2 | F21: 1 | G21: 36 | H21: 36.00 | I21: =IF(G21=0,"",G21/(F21*18)) -> 2.00 | J21: 36 | K21: 36
A22: 18 | B22: Keith Mendelson | C22: 15.0 | D22: 16.4 | E22: =D22 -> 16.4 | F22: 3 | G22: 109 | H22: 36.333333333333336 | I22: =IF(G22=0,"",G22/(F22*18)) -> 2.0185185185185186 | J22: 35 | K22: 38
A23: 19 | B23: Jon Dey | C23: 14.0 | D23: 14.2 | E23: =D23 -> 14.2 | F23: 2 | G23: 73 | H23: 36.50 | I23: =IF(G23=0,"",G23/(F23*18)) -> 2.0277777777777777 | J23: 32 | K23: 41
A24: 20 | B24: Michael Trimmings | C24: 25.0 | D24: 25.0 | E24: =D24 -> 25 | F24: 4 | G24: 152 | H24: 38.00 | I24: =IF(G24=0,"",G24/(F24*18)) -> 2.1111111111111112 | J24: 34 | K24: 41
A25: 21 | B25: Roy Dickens | C25: 29.6 | D25: 30.400000000001004 | E25: =D25 -> 30.400000000001004 | F25: 4 | G25: 153 | H25: 38.25 | I25: =IF(G25=0,"",G25/(F25*18)) -> 2.125 | J25: 35 | K25: 41
A26: 22 | B26: Martin Bould | C26: 17.8 | D26: 18.8 | E26: =D26 -> 18.8 | F26: 1 | G26: 39 | H26: 39.00 | I26: =IF(G26=0,"",G26/(F26*18)) -> 2.1666666666666665 | J26: 39 | K26: 39
A27: 23 | B27: Alan Hopkins | C27: 7.2 | D27: 7.7 | E27: =D27 -> 7.7 | F27: 1 | G27: 41 | H27: 41.00 | I27: =IF(G27=0,"",G27/(F27*18)) -> 2.2777777777777777 | J27: 41 | K27: 41
A28: 24 | B28: Malcolm Rouse | C28: 43.9 | D28: 44.9 | E28: =D28 -> 44.9 | F28: 1 | G28: 44 | H28: 44.00 | I28: =IF(G28=0,"",G28/(F28*18)) -> 2.4444444444444446 | J28: 44 | K28: 44
A29: 25 | B29: Andrew Knight | C29: 21.4 | D29: 21.4 | E29: =D29 -> 21.4 | F29: 0 | G29: 0 | H29: 0.00 | I29: =IF(G29=0,"",G29/(F29*18)) ->  | J29: 0 | K29: 0
A30: 26 | B30: Chris Manning | C30: 22.7 | D30: 22.7 | E30: =D30 -> 22.7 | F30: 0 | G30: 0 | H30: 0.00 | I30: =IF(G30=0,"",G30/(F30*18)) ->  | J30: 0 | K30: 0
A31: 27 | B31: Clive Ferris | C31: 26.0 | D31: 26.0 | E31: =D31 -> 26 | F31: 0 | G31: 0 | H31: 0.00 | I31: =IF(G31=0,"",G31/(F31*18)) ->  | J31: 0 | K31: 0
A32: 28 | B32: Dave White | C32: 21.5 | D32: 21.5 | E32: =D32 -> 21.5 | F32: 0 | G32: 0 | H32: 0.00 | I32: =IF(G32=0,"",G32/(F32*18)) ->  | J32: 0 | K32: 0
A33: 29 | B33: Jeff Gibbons | C33: 21.0 | D33: 21.0 | E33: =D33 -> 21 | F33: 0 | G33: 0 | H33: 0.00 | I33: =IF(G33=0,"",G33/(F33*18)) ->  | J33: 0 | K33: 0
A34: 30 | B34: Keith Johns | C34: 21.5 | D34: 21.5 | E34: =D34 -> 21.5 | F34: 0 | G34: 0 | H34: 0.00 | I34: =IF(G34=0,"",G34/(F34*18)) ->  | J34: 0 | K34: 0
A35: 31 | B35: Martin Cox | C35: 13.5 | D35: 13.5 | E35: =D35 -> 13.5 | F35: 0 | G35: 0 | H35: 0.00 | I35: =IF(G35=0,"",G35/(F35*18)) ->  | J35: 0 | K35: 0
A36: 32 | B36: Steve Tilling | C36: 16.5 | D36: 16.5 | E36: =D36 -> 16.5 | F36: 0 | G36: 0 | H36: 0.00 | I36: =IF(G36=0,"",G36/(F36*18)) ->  | J36: 0 | K36: 0