B2: MELBAGE CUP 2007 ORDER OF MERIT
B4: Up to and including Melbage 16
B5: Pos | C5: Move | D5: Name *elite* | E5: Team | F5: Played | G5: W | H5: D | I5: L | J5: Points | K5: Average | L5: 06 Pos
B6: 1 | C6: = | D6: A Benson | E6: USA | F6: 57 | G6: 34 | H6: 8 | I6: 15 | J6: =G6+(H6*0.5) -> 38 | K6: =J6/F6 -> 0.66666666666666663 | L6: 1
B7: 2 | C7: ▲ | D7: J Dey | E7: Europe | F7: 59 | G7: 34 | H7: 3 | I7: 22 | J7: =G7+(H7*0.5) -> 35.5 | K7: =J7/F7 -> 0.60169491525423724 | L7: 6
B8: 3 | C8: ▼ | D8: M Bould | E8: Europe | F8: 22 | G8: 11 | H8: 4 | I8: 7 | J8: =G8+(H8*0.5) -> 13 | K8: =J8/F8 -> 0.59090909090909094 | L8: 2
B9: 4 | C9: ▼ | D9: A Hopkins | E9: USA | F9: 61 | G9: 33 | H9: 6 | I9: 22 | J9: =G9+(H9*0.5) -> 36 | K9: =J9/F9 -> 0.5901639344262295 | L9: 3
B10: 5 | C10: new | D10: M Carter | E10: 4 for USA | F10: 12 | G10: 6 | H10: 2 | I10: 4 | J10: =G10+(H10*0.5) -> 7 | K10: =J10/F10 -> 0.58333333333333337
B11: 6 | C11: ▲ | D11: S Thompson | E11: USA | F11: 56 | G11: 29 | H11: 7 | I11: 20 | J11: =G11+(H11*0.5) -> 32.5 | K11: =J11/F11 -> 0.5803571428571429 | L11: 8
B12: 7= | C12: ▼ | D12: R Thompson * | E12: Europe | F12: 62 | G12: 32 | H12: 7 | I12: 23 | J12: =G12+(H12*0.5) -> 35.5 | K12: =J12/F12 -> 0.57258064516129037 | L12: 4=
B13: 7= | C13: ▼ | D13: P Carter * | E13: USA | F13: 62 | G13: 32 | H13: 7 | I13: 23 | J13: =G13+(H13*0.5) -> 35.5 | K13: =J13/F13 -> 0.57258064516129037 | L13: 4=
B14: 9 | C14: ▼ | D14: K Mendelson * | E14: Europe | F14: 58 | G14: 30 | H14: 6 | I14: 22 | J14: =G14+(H14*0.5) -> 33 | K14: =J14/F14 -> 0.56896551724137934 | L14: 7
B15: 10 | C15: new | D15: M Trimmings | E15: USA | F15: 8 | G15: 4 | H15: 1 | I15: 3 | J15: =G15+(H15*0.5) -> 4.5 | K15: =J15/F15 -> 0.5625
B16: 11 | C16: ▼ | D16: J Gibbons | E16: Europe | F16: 56 | G16: 27 | H16: 8 | I16: 21 | J16: =G16+(H16*0.5) -> 31 | K16: =J16/F16 -> 0.5535714285714286 | L16: 10
B17: 12 | C17: ▲ | D17: A Baldwin (Jnr) | E17: Europe | F17: 62 | G17: 31 | H17: 5 | I17: 26 | J17: =G17+(H17*0.5) -> 33.5 | K17: =J17/F17 -> 0.54032258064516125 | L17: 14
B18: 13 | C18: ▼ | D18: I Edwards | E18: Europe | F18: 47 | G18: 23 | H18: 4 | I18: 20 | J18: =G18+(H18*0.5) -> 25 | K18: =J18/F18 -> 0.53191489361702127 | L18: 9
B19: 14 | C19: ▼ | D19: D Marsh | E19: 12 for USA | F19: 16 | G19: 8 | H19: 1 | I19: 7 | J19: =G19+(H19*0.5) -> 8.5 | K19: =J19/F19 -> 0.53125 | L19: 12=
B20: 15 | C20: ▲ | D20: R Dickens | E20: Europe | F20: 52 | G20: 24 | H20: 7 | I20: 21 | J20: =G20+(H20*0.5) -> 27.5 | K20: =J20/F20 -> 0.52884615384615385 | L20: 16
B21: 16 | C21: ▼ | D21: J Press | E21: 31 for USA | F21: 36 | G21: 16 | H21: 6 | I21: 14 | J21: =G21+(H21*0.5) -> 19 | K21: =J21/F21 -> 0.52777777777777779 | L21: 12=
B22: 17 | C22: ▼ | D22: M Cox * | E22: Europe | F22: 62 | G22: 26 | H22: 12 | I22: 24 | J22: =G22+(H22*0.5) -> 32 | K22: =J22/F22 -> 0.5161290322580645 | L22: 11
B23: 18 | C23: ▼ | D23: S Tilling | E23: USA | F23: 31 | G23: 15 | H23: 2 | I23: 14 | J23: =G23+(H23*0.5) -> 16 | K23: =J23/F23 -> 0.5161290322580645 | L23: 15
B24: 19 | C24: ▼ | D24: C Manning | E24: 13 for USA | F24: 14 | G24: 6 | H24: 2 | I24: 6 | J24: =G24+(H24*0.5) -> 7 | K24: =J24/F24 -> 0.5000 | L24: 17
B25: 20 | C25: ▼ | D25: D Rouse * | E25: USA | F25: 62 | G25: 28 | H25: 5 | I25: 29 | J25: =G25+(H25*0.5) -> 30.5 | K25: =J25/F25 -> 0.49193548387096775 | L25: 18
B26: 21 | C26: ▲ | D26: P Baldwin | E26: USA | F26: 52 | G26: 24 | H26: 3 | I26: 25 | J26: =G26+(H26*0.5) -> 25.5 | K26: =J26/F26 -> 0.49038461538461536 | L26: 22
B27: 22 | C27: ▼ | D27: D Archer | E27: Europe | F27: 34 | G27: 14 | H27: 5 | I27: 15 | J27: =G27+(H27*0.5) -> 16.5 | K27: =J27/F27 -> 0.48529411764705882 | L27: 19
B28: 23 | C28: ▼ | D28: A Baldwin (Snr) | E28: Europe | F28: 58 | G28: 26 | H28: 3 | I28: 29 | J28: =G28+(H28*0.5) -> 27.5 | K28: =J28/F28 -> 0.47413793103448276 | L28: 20
B29: 24 | C29: ▼ | D29: D White | E29: Europe | F29: 35 | G29: 15 | H29: 3 | I29: 17 | J29: =G29+(H29*0.5) -> 16.5 | K29: =J29/F29 -> 0.47142857142857142 | L29: 21
B30: 25 | C30: ▼ | D30: N Leah | E30: USA | F30: 33 | G30: 12 | H30: 6 | I30: 15 | J30: =G30+(H30*0.5) -> 15 | K30: =J30/F30 -> 0.45454545454545453 | L30: 23
B31: 26 | C31: ▼ | D31: K Gallagher | E31: USA | F31: 61 | G31: 24 | H31: 4 | I31: 33 | J31: =G31+(H31*0.5) -> 26 | K31: =J31/F31 -> 0.42622950819672129 | L31: 24
B32: 27 | C32: ▼ | D32: D Andrews | E32: Europe | F32: 60 | G32: 24 | H32: 2 | I32: 34 | J32: =G32+(H32*0.5) -> 25 | K32: =J32/F32 -> 0.41666666666666669 | L32: 26
B33: 28 | C33: ▼ | D33: A Knight | E33: 5 for USA | F33: 11 | G33: 4 | H33: 1 | I33: 6 | J33: =G33+(H33*0.5) -> 4.5 | K33: =J33/F33 -> 0.40909090909090912 | L33: 27
B34: 29 | C34: ▼ | D34: K Johns | E34: 6 for USA | F34: 10 | G34: 3 | H34: 1 | I34: 6 | J34: =G34+(H34*0.5) -> 3.5 | K34: =J34/F34 -> 00.35 | L34: 25
B35: 30 | C35: ▼ | D35: J Colbrook | E35: Europe | F35: 36 | G35: 11 | H35: 1 | I35: 24 | J35: =G35+(H35*0.5) -> 11.5 | K35: =J35/F35 -> 0.31944444444444442 | L35: 28
B36: 31 | C36: ▼ | D36: M Rouse | E36: USA | F36: 38 | G36: 10 | H36: 1 | I36: 27 | J36: =G36+(H36*0.5) -> 10.5 | K36: =J36/F36 -> 0.27631578947368424 | L36: 29
B37: 32 | C37: ▼ | D37: M Edmond | E37: USA | F37: 34 | G37: 8 | H37: 0 | I37: 26 | J37: =G37+(H37*0.5) -> 8 | K37: =J37/F37 -> 0.23529411764705882 | L37: 30
B38: 33 | C38: ▼ | D38: C Ferris | E38: USA | F38: 26 | G38: 4 | H38: 3 | I38: 19 | J38: =G38+(H38*0.5) -> 5.5 | K38: =J38/F38 -> 0.21153846153846154 | L38: 31