B2: MELBAGE CUP 2008 ORDER OF MERIT
B4: Up to and including Melbage 17
B5: Pos | C5: Move | D5: Name *elite* Click to see matches | E5: Team | F5: Played | G5: W | H5: D | I5: L | J5: Points | K5: Average | L5: 07 Pos
B6: 1 | C6: = | D6: A Benson | E6: USA | F6: 61 | G6: 38 | H6: 8 | I6: 15 | J6: =G6+(H6*0.5) -> 42 | K6: =J6/F6 -> 0.68852459016393441 | L6: 1
B7: 2 | C7: ▲ 4 | D7: S Thompson | E7: USA | F7: 60 | G7: 32 | H7: 7 | I7: 21 | J7: =G7+(H7*0.5) -> 35.5 | K7: =J7/F7 -> 0.59166666666666667 | L7: 6
B8: 3 | C8: ▲ 1 | D8: A Hopkins | E8: USA | F8: 65 | G8: 35 | H8: 6 | I8: 24 | J8: =G8+(H8*0.5) -> 38 | K8: =J8/F8 -> 0.58461538461538465 | L8: 4
B9: 4 | C9: ▼ 1 | D9: M Bould | E9: Europe | F9: 24 | G9: 12 | H9: 4 | I9: 8 | J9: =G9+(H9*0.5) -> 14 | K9: =J9/F9 -> 0.58333333333333337 | L9: 3
B10: 5 | C10: ▼ 3 | D10: J Dey | E10: Europe | F10: 63 | G10: 35 | H10: 3 | I10: 25 | J10: =G10+(H10*0.5) -> 36.5 | K10: =J10/F10 -> 0.57936507936507942 | L10: 2
B11: 6 | C11: ▲ 1 | D11: R Thompson * | E11: Europe | F11: 66 | G11: 34 | H11: 7 | I11: 25 | J11: =G11+(H11*0.5) -> 37.5 | K11: =J11/F11 -> 0.56818181818181823 | L11: 7=
B12: 7 | C12: ▼ 2 | D12: M Carter | E12: 8 for USA | F12: 16 | G12: 8 | H12: 2 | I12: 6 | J12: =G12+(H12*0.5) -> 9 | K12: =J12/F12 -> 0.5625 | L12: 5
B13: 8 | C13: ▲ 2 | D13: J Gibbons | E13: Europe | F13: 56 | G13: 27 | H13: 8 | I13: 21 | J13: =G13+(H13*0.5) -> 31 | K13: =J13/F13 -> 0.5535714285714286 | L13: 10
B14: 9 | C14: ▼ 2 | D14: P Carter * | E14: USA | F14: 66 | G14: 33 | H14: 7 | I14: 26 | J14: =G14+(H14*0.5) -> 36.5 | K14: =J14/F14 -> 0.55303030303030298 | L14: 7=
B15: 10 | C15: ▲ 3 | D15: I Edwards | E15: Europe | F15: 51 | G15: 26 | H15: 4 | I15: 21 | J15: =G15+(H15*0.5) -> 28 | K15: =J15/F15 -> 0.5490196078431373 | L15: 13
B16: 11 | C16: ▲ 6 | D16: M Cox * | E16: Europe | F16: 66 | G16: 30 | H16: 12 | I16: 24 | J16: =G16+(H16*0.5) -> 36 | K16: =J16/F16 -> 0.54545454545454541 | L16: 17
B17: 12 | C17: ▲ 1 | D17: D Marsh | E17: 12 for USA | F17: 16 | G17: 8 | H17: 1 | I17: 7 | J17: =G17+(H17*0.5) -> 8.5 | K17: =J17/F17 -> 0.53125 | L17: 13
B18: 13 | C18: ▲ 8 | D18: P Baldwin | E18: USA | F18: 56 | G18: 28 | H18: 3 | I18: 25 | J18: =G18+(H18*0.5) -> 29.5 | K18: =J18/F18 -> 0.5267857142857143 | L18: 22
B19: 14 | C19: ▲ 2 | D19: J Press | E19: 31 for USA | F19: 40 | G19: 18 | H19: 6 | I19: 16 | J19: =G19+(H19*0.5) -> 21 | K19: =J19/F19 -> 0.52500000000000002 | L19: 16
B20: 15 | C20: ▼ 4 | D20: A Baldwin (Jnr) | E20: Europe | F20: 66 | G20: 32 | H20: 5 | I20: 29 | J20: =G20+(H20*0.5) -> 34.5 | K20: =J20/F20 -> 0.52272727272727271 | L20: 11
B21: 16 | C21: ▲ 2 | D21: S Tilling | E21: USA | F21: 31 | G21: 15 | H21: 2 | I21: 14 | J21: =G21+(H21*0.5) -> 16 | K21: =J21/F21 -> 0.5161290322580645 | L21: 18
B22: 17 | C22: ▼ 2 | D22: R Dickens | E22: Europe | F22: 56 | G22: 25 | H22: 7 | I22: 24 | J22: =G22+(H22*0.5) -> 28.5 | K22: =J22/F22 -> 0.5089285714285714 | L22: 15
B23: 18 | C23: ▼ 6 | D23: K Mendelson * | E23: Europe | F23: 66 | G23: 30 | H23: 6 | I23: 26 | J23: =G23+(H23*0.5) -> 33 | K23: =J23/F23 -> 0.5000 | L23: 12
B24: 18= | C24: ▲ 1 | D24: C Manning | E24: 13 for USA | F24: 14 | G24: 6 | H24: 2 | I24: 6 | J24: =G24+(H24*0.5) -> 7 | K24: =J24/F24 -> 0.5000 | L24: 19
B25: 20 | C25: = | D25: D Rouse * | E25: USA | F25: 66 | G25: 30 | H25: 5 | I25: 31 | J25: =G25+(H25*0.5) -> 32.5 | K25: =J25/F25 -> 0.49242424242424243 | L25: 20
B26: 21 | C26: ▲ 1 | D26: D Archer | E26: Europe | F26: 34 | G26: 14 | H26: 5 | I26: 15 | J26: =G26+(H26*0.5) -> 16.5 | K26: =J26/F26 -> 0.48529411764705882 | L26: 22
B27: 22 | C27: ▲ 1 | D27: A Baldwin (Snr) | E27: Europe | F27: 62 | G27: 28 | H27: 3 | I27: 31 | J27: =G27+(H27*0.5) -> 29.5 | K27: =J27/F27 -> 0.47580645161290325 | L27: 23
B28: 23 | C28: ▲ 1 | D28: D White | E28: Europe | F28: 35 | G28: 15 | H28: 3 | I28: 17 | J28: =G28+(H28*0.5) -> 16.5 | K28: =J28/F28 -> 0.47142857142857142 | L28: 24
B29: 24 | C29: ▲ 1 | D29: N Leah | E29: USA | F29: 33 | G29: 12 | H29: 6 | I29: 15 | J29: =G29+(H29*0.5) -> 15 | K29: =J29/F29 -> 0.45454545454545453 | L29: 25
B30: 25 | C30: ▲ 2 | D30: D Andrews | E30: Europe | F30: 64 | G30: 27 | H30: 2 | I30: 35 | J30: =G30+(H30*0.5) -> 28 | K30: =J30/F30 -> 0.4375 | L30: 27
B31: 26 | C31: = | D31: K Gallagher | E31: USA | F31: 65 | G31: 26 | H31: 4 | I31: 35 | J31: =G31+(H31*0.5) -> 28 | K31: =J31/F31 -> 0.43076923076923079 | L31: 26
B32: 27 | C32: ▲ 1 | D32: A Knight | E32: 5 for USA | F32: 11 | G32: 4 | H32: 1 | I32: 6 | J32: =G32+(H32*0.5) -> 4.5 | K32: =J32/F32 -> 0.40909090909090912 | L32: 28
B33: 28 | C33: ▼ 18 | D33: M Trimmings | E33: USA | F33: 12 | G33: 4 | H33: 1 | I33: 7 | J33: =G33+(H33*0.5) -> 4.5 | K33: =J33/F33 -> 0.375 | L33: 10
B34: 29 | C34: = | D34: K Johns | E34: 6 for USA | F34: 10 | G34: 3 | H34: 1 | I34: 6 | J34: =G34+(H34*0.5) -> 3.5 | K34: =J34/F34 -> 00.35 | L34: 29
B35: 30 | C35: = | D35: J Colbrook | E35: Europe | F35: 40 | G35: 12 | H35: 1 | I35: 27 | J35: =G35+(H35*0.5) -> 12.5 | K35: =J35/F35 -> 0.3125 | L35: 30
B36: 31 | C36: = | D36: M Rouse | E36: USA | F36: 42 | G36: 11 | H36: 1 | I36: 30 | J36: =G36+(H36*0.5) -> 11.5 | K36: =J36/F36 -> 0.27380952380952384 | L36: 31
B37: 32 | C37: ▲ 1 | D37: C Ferris | E37: USA | F37: 27 | G37: 5 | H37: 3 | I37: 19 | J37: =G37+(H37*0.5) -> 6.5 | K37: =J37/F37 -> 0.24074074074074073 | L37: 33
B38: 33 | C38: ▼ 1 | D38: M Edmond | E38: USA | F38: 34 | G38: 8 | H38: 0 | I38: 26 | J38: =G38+(H38*0.5) -> 8 | K38: =J38/F38 -> 0.23529411764705882 | L38: 32