A1: 2009 Fantasy Team Final Positions
A2: Owner | B2: Fantasy Team Name | D2: P Carter | E2: A Hopkins | F2: K Mendelson | G2: R Thompson | H2: M Cox | I2: S Thompson | J2: A Baldwin (Jnr) | K2: D Andrews | L2: J Colbrook | M2: D Bingham | N2: K Gallagher | O2: A Baldwin (Sr) | P2: D Rouse | Q2: D Braithwaite | R2: J Press | S2: M Carter | T2: P Baldwin | U2: J Dey | V2: R Dickens | W2: M Trimmings | X2: M Bould | Y2: S Owens
A3: R Thompson | B3: Bugger Me I'm Bolloxy | C3: =SUM(D3:Y3) -> 16.5 | E3: 1.0 | F3: 3.5 | G3: 2.5 | H3: 3.5 | M3: 3.0 | Q3: 3.0
A4: D Andrews | B4: Flying High | C4: =SUM(D4:Y4) -> 16.0 | E4: 1.0 | G4: 2.5 | H4: 3.5 | K4: 3.0 | M4: 3.0 | R4: 3.0
A5: K Gallagher | B5: Bubbs's Buxom Boys | C5: =SUM(D5:Y5) -> 14.5 | G5: 2.5 | I5: 1.0 | M5: 3.0 | N5: 2.0 | Q5: 3.0 | V5: 3.0
A6: M Bould | B6: What Backswing? | C6: =SUM(D6:Y6) -> 14.5 | G6: 2.5 | M6: 3.0 | S6: 3.0 | V6: 3.0 | X6: 2.0 | Y6: 1.0
A7: A Hopkins | B7: Wax Back Crack and Sack | C7: =SUM(D7:Y7) -> 14.0 | E7: 1.0 | G7: 2.5 | H7: 3.5 | M7: 3.0 | Q7: 3.0 | T7: 1.0
A8: S Thompson | B8: Wicksy's Wanglers | C8: =SUM(D8:Y8) -> 13.5 | G8: 2.5 | I8: 1.0 | M8: 3.0 | Q8: 3.0 | S8: 3.0 | T8: 1.0
A9: M Carter | B9: I Don't Know | C9: =SUM(D9:Y9) -> 13.5 | D9: 1.0 | G9: 2.5 | I9: 1.0 | M9: 3.0 | S9: 3.0 | U9: 3.0
A10: K Mendelson | B10: Mendy's Bognor Bankers | C10: =SUM(D10:Y10) -> 13.5 | E10: 1.0 | F10: 3.5 | G10: 2.5 | L10: 1.5 | M10: 3.0 | N10: 2.0
A11: M Rouse | B11: The Shmegma Boys | C11: =SUM(D11:Y11) -> 13.0 | G11: 2.5 | I11: 1.0 | P11: 0.5 | Q11: 3.0 | S11: 3.0 | U11: 3.0
A12: P Carter | B12: Last Minute Hopefuls | C12: =SUM(D12:Y12) -> 13.0 | D12: 1.0 | F12: 3.5 | G12: 2.5 | I12: 1.0 | M12: 3.0 | X12: 2.0
A13: J Press | B13: Button's Baboon Boys | C13: =SUM(D13:Y13) -> 13.0 | J13: 0.0 | M13: 3.0 | N13: 2.0 | Q13: 3.0 | R13: 3.0 | X13: 2.0
A14: J Dey | B14: Clapham No More, Euston No More, Freemans No More | C14: =SUM(D14:Y14) -> 12.5 | E14: 1.0 | G14: 2.5 | J14: 0.0 | M14: 3.0 | R14: 3.0 | U14: 3.0
A15: D Rouse | B15: The Rusty Scalebreakers | C15: =SUM(D15:Y15) -> 12.5 | E15: 1.0 | H15: 3.5 | L15: 1.5 | M15: 3.0 | P15: 0.5 | R15: 3.0
A16: P Baldwin | B16: The Steady Eddies | C16: =SUM(D16:Y16) -> 12.0 | G16: 2.5 | M16: 3.0 | N16: 2.0 | P16: 0.5 | S16: 3.0 | T16: 1.0
A17: M Trimmings | B17: Rosscopecotrain | C17: =SUM(D17:Y17) -> 12.0 | E17: 1.0 | G17: 2.5 | H17: 3.5 | I17: 1.0 | M17: 3.0 | W17: 1.0
A18: R Dickens | B18: Scrambling Scumbags | C18: =SUM(D18:Y18) -> 11.5 | E18: 1.0 | G18: 2.5 | I18: 1.0 | U18: 3.0 | V18: 3.0 | Y18: 1.0
A19: J Colbrook | B19: Hackers From Hell | C19: =SUM(D19:Y19) -> 11.5 | E19: 1.0 | I19: 1.0 | L19: 1.5 | M19: 3.0 | R19: 3.0 | X19: 2.0
A20: A Baldwin (Snr) | B20: Turncoat's Natural Hazards | C20: =SUM(D20:Y20) -> 11.0 | D20: 1.0 | H20: 3.5 | J20: 0.0 | N20: 2.0 | O20: 1.5 | V20: 3.0
A21: D Braithwaite | B21: The Hob Knobs | C21: =SUM(D21:Y21) -> 10.5 | J21: 0.0 | M21: 3.0 | P21: 0.5 | Q21: 3.0 | S21: 3.0 | T21: 1.0
A22: S Owens | B22: The Bognor BigWigs | C22: =SUM(D22:Y22) -> 10.0 | D22: 1.0 | E22: 1.0 | F22: 3.5 | G22: 2.5 | I22: 1.0 | Y22: 1.0
A23: A Baldwin (Jnr) | B23: No Idea | C23: =SUM(D23:Y23) -> 10.0 | E23: 1.0 | G23: 2.5 | H23: 3.5 | I23: 1.0 | J23: 0.0 | N23: 2.0
A24: D Bingham | B24: Roman's Team | C24: =SUM(D24:Y24) -> 9.5 | J24: 0.0 | K24: 3.0 | M24: 3.0 | N24: 2.0 | P24: 0.5 | T24: 1.0
A25: M Cox | B25: Coxy's Crunchers | C25: =SUM(D25:Y25) -> 9.0 | G25: 2.5 | H25: 3.5 | I25: 1.0 | J25: 0.0 | L25: 1.5 | P25: 0.5