B2: MELBAGE CUP 2009 ORDER OF MERIT
B4: Up to and including Melbage 18
B5: Pos | C5: Name *elite* Click to see matches | D5: Team | E5: Played | F5: W | G5: D | H5: L | I5: Points | J5: Average | K5: 08 Pos
B6: 1 | C6: A Benson | D6: USA | E6: 62 | F6: 39 | G6: 8 | H6: 15 | I6: =F6+(G6*0.5) -> 43 | J6: =I6/E6 -> 0.69354838709677424 | K6: 1
B7: 2 | C7: M Carter | D7: 12 for USA | E7: 20 | F7: 10 | G7: 4 | H7: 6 | I7: =F7+(G7*0.5) -> 12 | J7: =I7/E7 -> 00.6 | K7: 7
B8: 3 | C8: J Dey | D8: Europe | E8: 67 | F8: 38 | G8: 3 | H8: 26 | I8: =F8+(G8*0.5) -> 39.5 | J8: =I8/E8 -> 0.58955223880597019 | K8: 5
B9: 4 | C9: M Bould | D9: Europe | E9: 28 | F9: 14 | G9: 4 | H9: 10 | I9: =F9+(G9*0.5) -> 16 | J9: =I9/E9 -> 0.5714285714285714 | K9: 4
B10: 5 | C10: R Thompson * | D10: Europe | E10: 70 | F10: 36 | G10: 8 | H10: 26 | I10: =F10+(G10*0.5) -> 40 | J10: =I10/E10 -> 0.5714285714285714 | K10: 6
B11: 6 | C11: S Thompson | D11: USA | E11: 64 | F11: 32 | G11: 9 | H11: 23 | I11: =F11+(G11*0.5) -> 36.5 | J11: =I11/E11 -> 0.5703125 | K11: 2
B12: 7 | C12: A Hopkins | D12: USA | E12: 69 | F12: 36 | G12: 6 | H12: 27 | I12: =F12+(G12*0.5) -> 39 | J12: =I12/E12 -> 0.56521739130434778 | K12: 3
B13: 8 | C13: M Cox * | D13: Europe | E13: 70 | F13: 33 | G13: 13 | H13: 24 | I13: =F13+(G13*0.5) -> 39.5 | J13: =I13/E13 -> 0.56428571428571428 | K13: 11
B14: 9 | C14: I Edwards | D14: Europe | E14: 51 | F14: 26 | G14: 4 | H14: 21 | I14: =F14+(G14*0.5) -> 28 | J14: =I14/E14 -> 0.5490196078431373 | K14: 10
B15: 10 | C15: J Press | D15: 31 for USA | E15: 44 | F15: 21 | G15: 6 | H15: 17 | I15: =F15+(G15*0.5) -> 24 | J15: =I15/E15 -> 0.54545454545454541 | K15: 14
B16: 11 | C16: J Gibbons | D16: Europe | E16: 57 | F16: 27 | G16: 8 | H16: 22 | I16: =F16+(G16*0.5) -> 31 | J16: =I16/E16 -> 0.54385964912280704 | K16: 8
B17: 12 | C17: S Owens | D17: USA | E17: 27 | F17: 14 | G17: 1 | H17: 12 | I17: =F17+(G17*0.5) -> 14.5 | J17: =I17/E17 -> 0.53703703703703709
B18: 13 | C18: P Carter * | D18: USA | E18: 70 | F18: 34 | G18: 7 | H18: 29 | I18: =F18+(G18*0.5) -> 37.5 | J18: =I18/E18 -> 0.5357142857142857 | K18: 9
B19: 14 | C19: D Marsh | D19: 12 for USA | E19: 16 | F19: 8 | G19: 1 | H19: 7 | I19: =F19+(G19*0.5) -> 8.5 | J19: =I19/E19 -> 0.53125 | K19: 12
B20: 15 | C20: R Dickens | D20: Europe | E20: 60 | F20: 28 | G20: 7 | H20: 25 | I20: =F20+(G20*0.5) -> 31.5 | J20: =I20/E20 -> 0.52500000000000002 | K20: 17
B21: 16 | C21: K Mendelson * | D21: Europe | E21: 70 | F21: 33 | G21: 7 | H21: 26 | I21: =F21+(G21*0.5) -> 36.5 | J21: =I21/E21 -> 0.52142857142857146 | K21: 18
B22: 17 | C22: S Tilling | D22: USA | E22: 31 | F22: 15 | G22: 2 | H22: 14 | I22: =F22+(G22*0.5) -> 16 | J22: =I22/E22 -> 0.5161290322580645 | K22: 16
B23: 18 | C23: P Baldwin | D23: USA | E23: 60 | F23: 29 | G23: 3 | H23: 28 | I23: =F23+(G23*0.5) -> 30.5 | J23: =I23/E23 -> 0.5083333333333333 | K23: 13
B24: 19 | C24: C Manning | D24: 13 for USA | E24: 14 | F24: 6 | G24: 2 | H24: 6 | I24: =F24+(G24*0.5) -> 7 | J24: =I24/E24 -> 0.5000 | K24: 18=
B25: 20 | C25: A Baldwin (Jnr) | D25: Europe | E25: 70 | F25: 32 | G25: 5 | H25: 33 | I25: =F25+(G25*0.5) -> 34.5 | J25: =I25/E25 -> 0.49285714285714288 | K25: 15
B26: 21 | C26: D Rouse * | D26: USA | E26: 70 | F26: 30 | G26: 6 | H26: 34 | I26: =F26+(G26*0.5) -> 33 | J26: =I26/E26 -> 0.47142857142857142 | K26: 20
B27: 22 | C27: A Baldwin (Snr) | D27: Europe | E27: 66 | F27: 29 | G27: 4 | H27: 33 | I27: =F27+(G27*0.5) -> 31 | J27: =I27/E27 -> 0.46969696969696972 | K27: 22
B28: 23 | C28: D Andrews | D28: Europe | E28: 68 | F28: 30 | G28: 2 | H28: 36 | I28: =F28+(G28*0.5) -> 31 | J28: =I28/E28 -> 0.45588235294117646 | K28: 25
B29: 24 | C29: K Gallagher | D29: USA | E29: 69 | F29: 28 | G29: 4 | H29: 37 | I29: =F29+(G29*0.5) -> 30 | J29: =I29/E29 -> 0.43478260869565216 | K29: 26
B30: 25 | C30: A Knight | D30: 5 for USA | E30: 11 | F30: 4 | G30: 1 | H30: 6 | I30: =F30+(G30*0.5) -> 4.5 | J30: =I30/E30 -> 0.40909090909090912 | K30: 27
B31: 26 | C31: K Johns | D31: 6 for USA | E31: 10 | F31: 3 | G31: 1 | H31: 6 | I31: =F31+(G31*0.5) -> 3.5 | J31: =I31/E31 -> 00.35 | K31: 29
B32: 27 | C32: M Trimmings | D32: USA | E32: 16 | F32: 5 | G32: 1 | H32: 10 | I32: =F32+(G32*0.5) -> 5.5 | J32: =I32/E32 -> 0.34375 | K32: 28
B33: 28 | C33: J Colbrook | D33: Europe | E33: 44 | F33: 13 | G33: 2 | H33: 29 | I33: =F33+(G33*0.5) -> 14 | J33: =I33/E33 -> 0.31818181818181818 | K33: 30
B34: 29 | C34: M Rouse | D34: USA | E34: 42 | F34: 11 | G34: 1 | H34: 30 | I34: =F34+(G34*0.5) -> 11.5 | J34: =I34/E34 -> 0.27380952380952384 | K34: 31
B35: 30 | C35: C Ferris | D35: USA | E35: 28 | F35: 5 | G35: 3 | H35: 20 | I35: =F35+(G35*0.5) -> 6.5 | J35: =I35/E35 -> 0.23214285714285715 | K35: 32