A1: MELBAGE CUP 2012 ORDER OF MERIT
B3: Up to and including Melbage 21
B4: Pos | C4: Name *elite* | D4: Team | E4: Played | F4: W | G4: D | H4: L | I4: Points | J4: Average | K4: 11 Pos
B5: 1 | C5: D Bingham | D5: Europe | E5: 17 | F5: 12 | G5: 0 | H5: 5 | I5: =F5+(G5*0.5) -> 12 | J5: =I5/E5 -> 0.70588235294117652 | K5: 1
B6: 2 | C6: A Benson | D6: USA | E6: 68 | F6: 41 | G6: 12 | H6: 15 | I6: =F6+(G6*0.5) -> 47 | J6: =I6/E6 -> 0.69117647058823528 | K6: 2
B7: 3 | C7: M Carter | D7: 24 for USA | E7: 32 | F7: 18 | G7: 4 | H7: 10 | I7: =F7+(G7*0.5) -> 20 | J7: =I7/E7 -> 0.625 | K7: 3
B8: 4 | C8: S Owens | D8: USA | E8: 35 | F8: 21 | G8: 1 | H8: 13 | I8: =F8+(G8*0.5) -> 21.5 | J8: =I8/E8 -> 0.61428571428571432 | K8: 4
B9: 5 | C9: M Bould | D9: Europe | E9: 40 | F9: 21 | G9: 6 | H9: 13 | I9: =F9+(G9*0.5) -> 24 | J9: =I9/E9 -> 0.6000 | K9: 7=
B10: 6 | C10: J Dey | D10: Europe | E10: 79 | F10: 43 | G10: 4 | H10: 32 | I10: =F10+(G10*0.5) -> 45 | J10: =I10/E10 -> 0.569620253164557 | K10: 6
B11: 7 | C11: R Thompson * | D11: Europe | E11: 82 | F11: 42 | G11: 8 | H11: 32 | I11: =F11+(G11*0.5) -> 46 | J11: =I11/E11 -> 0.56097560975609762 | K11: 11
B12: 8 | C12: A Hopkins | D12: USA | E12: 78 | F12: 40 | G12: 7 | H12: 31 | I12: =F12+(G12*0.5) -> 43.5 | J12: =I12/E12 -> 0.55769230769230771 | K12: 9=
B13: 9 | C13: M Cox | D13: Europe | E13: 74 | F13: 34 | G13: 14 | H13: 26 | I13: =F13+(G13*0.5) -> 41 | J13: =I13/E13 -> 0.55405405405405406 | K13: 9=
B14: 10 | C14: J Press | D14: 39 for USA | E14: 56 | F14: 28 | G14: 6 | H14: 22 | I14: =F14+(G14*0.5) -> 31 | J14: =I14/E14 -> 0.5535714285714286 | K14: 13
B15: 11 | C15: S Thompson | D15: USA | E15: 76 | F15: 37 | G15: 10 | H15: 29 | I15: =F15+(G15*0.5) -> 42 | J15: =I15/E15 -> 0.55263157894736847 | K15: 7=
B16: 12 | C16: J Gibbons | D16: Europe | E16: 57 | F16: 27 | G16: 8 | H16: 22 | I16: =F16+(G16*0.5) -> 31 | J16: =I16/E16 -> 0.54385964912280704 | K16: 12
B17: 13 | C17: M Trimmings | D17: USA | E17: 28 | F17: 14 | G17: 2 | H17: 12 | I17: =F17+(G17*0.5) -> 15 | J17: =I17/E17 -> 0.5357142857142857 | K17: 19=
B18: 14 | C18: D Marsh | D18: 12 for USA | E18: 16 | F18: 8 | G18: 1 | H18: 7 | I18: =F18+(G18*0.5) -> 8.5 | J18: =I18/E18 -> 0.53125 | K18: 15
B19: 15 | C19: K Mendelson * | D19: 2 for USA | E19: 82 | F19: 38 | G19: 11 | H19: 29 | I19: =F19+(G19*0.5) -> 43.5 | J19: =I19/E19 -> 0.53048780487804881 | K19: 16
B20: 16 | C20: P Carter | D20: USA | E20: 81 | F20: 38 | G20: 8 | H20: 35 | I20: =F20+(G20*0.5) -> 42 | J20: =I20/E20 -> 0.51851851851851849 | K20: 17
B21: 17 | C21: S Tilling | D21: USA | E21: 31 | F21: 15 | G21: 2 | H21: 14 | I21: =F21+(G21*0.5) -> 16 | J21: =I21/E21 -> 0.5161290322580645 | K21: 18
B22: 18 | C22: I Edwards | D22: Europe | E22: 63 | F22: 30 | G22: 5 | H22: 28 | I22: =F22+(G22*0.5) -> 32.5 | J22: =I22/E22 -> 0.51587301587301593 | K22: 14
B23: 19 | C23: R Dickens | D23: Europe | E23: 71 | F23: 32 | G23: 8 | H23: 31 | I23: =F23+(G23*0.5) -> 36 | J23: =I23/E23 -> 0.50704225352112675 | K23: 19=
B24: 20 | C24: D Braithwaite | D24: USA | E24: 16 | F24: 8 | G24: 0 | H24: 8 | I24: =F24+(G24*0.5) -> 8 | J24: =I24/E24 -> 0.5000 | K24: 5
B25: 21 | C25: C Manning | D25: 13 for USA | E25: 14 | F25: 6 | G25: 2 | H25: 6 | I25: =F25+(G25*0.5) -> 7 | J25: =I25/E25 -> 0.5000 | K25: 19=
B26: 22 | C26: A Baldwin (Jnr) | D26: Europe | E26: 82 | F26: 37 | G26: 6 | H26: 39 | I26: =F26+(G26*0.5) -> 40 | J26: =I26/E26 -> 0.48780487804878048 | K26: 22
B27: 23 | C27: A Baldwin (Snr) | D27: Europe | E27: 74 | F27: 32 | G27: 6 | H27: 36 | I27: =F27+(G27*0.5) -> 35 | J27: =I27/E27 -> 0.47297297297297297 | K27: 23
B28: 24 | C28: D Andrews | D28: Europe | E28: 80 | F28: 36 | G28: 2 | H28: 42 | I28: =F28+(G28*0.5) -> 37 | J28: =I28/E28 -> 0.46250000000000002 | K28: 27
B29: 25 | C29: D Rouse * | D29: USA | E29: 82 | F29: 33 | G29: 8 | H29: 40 | I29: =F29+(G29*0.5) -> 37 | J29: =I29/E29 -> 0.45121951219512196 | K29: 25
B30: 26 | C30: P Baldwin | D30: USA | E30: 72 | F30: 29 | G30: 5 | H30: 38 | I30: =F30+(G30*0.5) -> 31.5 | J30: =I30/E30 -> 0.4375 | K30: 24
B31: 27 | C31: K Gallagher | D31: USA | E31: 81 | F31: 31 | G31: 7 | H31: 43 | I31: =F31+(G31*0.5) -> 34.5 | J31: =I31/E31 -> 0.42592592592592593 | K31: 26
B32: 28 | C32: A Knight | D32: 5 for USA | E32: 11 | F32: 4 | G32: 1 | H32: 6 | I32: =F32+(G32*0.5) -> 4.5 | J32: =I32/E32 -> 0.40909090909090912 | K32: 28
B33: 29 | C33: K Johns | D33: 6 for USA | E33: 10 | F33: 3 | G33: 1 | H33: 6 | I33: =F33+(G33*0.5) -> 3.5 | J33: =I33/E33 -> 0.3500 | K33: 29
B34: 30 | C34: J Colbrook | D34: Europe | E34: 56 | F34: 17 | G34: 5 | H34: 34 | I34: =F34+(G34*0.5) -> 19.5 | J34: =I34/E34 -> 0.3482142857142857 | K34: 30
B35: 31 | C35: M Rouse | D35: 45 for USA | E35: 49 | F35: 14 | G35: 1 | H35: 34 | I35: =F35+(G35*0.5) -> 14.5 | J35: =I35/E35 -> 0.29591836734693877 | K35: 31
B36: 32 | C36: C Ferris | D36: USA | E36: 28 | F36: 5 | G36: 3 | H36: 20 | I36: =F36+(G36*0.5) -> 6.5 | J36: =I36/E36 -> 0.23214285714285715 | K36: 32