A1: 2011 Fantasy Team Final Positions
B2: Owner | C2: Fantasy Team Name | E2: A Benson | F2: P Carter | G2: A Hopkins | H2: K Mendelson | I2: R Thompson | J2: M Rouse | K2: S Thompson | L2: A Baldwin (Jnr) | M2: D Andrews | N2: J Colbrook | O2: M Bould | P2: K Gallagher | Q2: A Baldwin (Sr) | R2: D Rouse | S2: I Edwards | T2: J Press | U2: M Carter | V2: P Baldwin | W2: J Dey | X2: R Dickens | Y2: M Trimmings | Z2: D Bingham | AA2: D Braithwaite | AB2: S Owens
A3: 1 | B3: D Rouse | C3: The Team without Thommo | D3: =SUM(E3:AB3) -> 14.5 | E3: 3.0 | K3: 1.0 | M3: 2.0 | R3: 2.5 | U3: 3.0 | W3: 3.0
A4: 2= | B4: K Gallagher | C4: Factor 100 - Slap It On! | D4: =SUM(E4:AB4) -> 13.5 | E4: 3.0 | I4: 2.0 | L4: 2.0 | O4: 1.5 | Z4: 2.0 | AA4: 3.0
A5: 2= | B5: R Thompson | C5: This Weather Is Superb | D5: =SUM(E5:AB5) -> 13.5 | G5: 2.0 | H5: 1.5 | I5: 2.0 | U5: 3.0 | Z5: 2.0 | AA5: 3.0
A6: 4= | B6: P Baldwin | C6: The F'ing Cs | D6: =SUM(E6:AB6) -> 13.0 | E6: 3.0 | I6: 2.0 | K6: 1.0 | N6: 2.5 | P6: 2.0 | R6: 2.5
A7: 4= | B7: J Press | C7: Scuffing Schleck Boys | D7: =SUM(E7:AB7) -> 13.0 | E7: 3.0 | I7: 2.0 | M7: 2.0 | V7: 0.0 | W7: 3.0 | AA7: 3.0
A8: 6 | B8: M Bould | C8: Los Muchachos Grandes | D8: =SUM(E8:AB8) -> 12.5 | H8: 1.5 | I8: 2.0 | O8: 1.5 | U8: 3.0 | X8: 1.5 | AB8: 3.0
A9: 7= | B9: K Mendelson | C9: Initial Ilfracombe Idiots (3is) | D9: =SUM(E9:AB9) -> 12.0 | G9: 2.0 | H9: 1.5 | I9: 2.0 | L9: 2.0 | P9: 2.0 | R9: 2.5
A10: 7= | B10: M Trimmings | C10: The Fat Elephant not Bubbs | D10: =SUM(E10:AB10) -> 12.0 | H10: 1.5 | I10: 2.0 | K10: 1.0 | Y10: 2.5 | Z10: 2.0 | AA10: 3.0
A11: 7= | B11: A Hopkins | C11: Morefuckingquestions | D11: =SUM(E11:AB11) -> 12.0 | E11: 3.0 | H11: 1.5 | I11: 2.0 | K11: 1.0 | U11: 3.0 | X11: 1.5
A12: 7= | B12: A Benson | C12: Obviously Missed This One Rousey | D12: =SUM(E12:AB12) -> 12.0 | E12: 3.0 | H12: 1.5 | S12: 2.0 | T12: 0.0 | Y12: 2.5 | AB12: 3.0
A13: 7= | B13: J Dey | C13: In Spain On The Social | D13: =SUM(E13:AB13) -> 12.0 | E13: 3.0 | F13: 0.0 | M13: 2.0 | S13: 2.0 | W13: 3.0 | Z13: 2.0
A14: 12= | B14: A Baldwin (Snr) | C14: Paella & Chips | D14: =SUM(E14:AB14) -> 11.5 | F14: 0.0 | H14: 1.5 | I14: 2.0 | P14: 2.0 | Q14: 3.0 | AB14: 3.0
A15: 12= | B15: P Carter | C15: The Committee Takes The Biscuit | D15: =SUM(E15:AB15) -> 11.5 | F15: 0.0 | I15: 2.0 | L15: 2.0 | M15: 2.0 | R15: 2.5 | AA15: 3.0
A16: 12= | B16: S Owens | C16: Onion's Fat Boys | D16: =SUM(E16:AB16) -> 11.5 | E16: 3.0 | F16: 0.0 | I16: 2.0 | M16: 2.0 | R16: 2.5 | Z16: 2.0
A17: 12= | B17: R Dickens | C17: The Stiff Shaft Crew | D17: =SUM(E17:AB17) -> 11.5 | F17: 0.0 | I17: 2.0 | M17: 2.0 | U17: 3.0 | X17: 1.5 | AB17: 3.0
A18: 16= | B18: M Carter | C18: Who Ate All the Paella? | D18: =SUM(E18:AB18) -> 11.0 | F18: 0.0 | I18: 2.0 | L18: 2.0 | U18: 3.0 | X18: 1.5 | Y18: 2.5
A19: 16= | B19: S Thompson | C19: Wicksy's Eurotrash | D19: =SUM(E19:AB19) -> 11.0 | I19: 2.0 | K19: 1.0 | M19: 2.0 | T19: 0.0 | U19: 3.0 | AA19: 3.0
A20: 16= | B20: J Colbrook | C20: Slappy Slappers | D20: =SUM(E20:AB20) -> 11.0 | G20: 2.0 | H20: 1.5 | K20: 1.0 | M20: 2.0 | N20: 2.5 | Z20: 2.0
A21: 19 | B21: D Braithwaite | C21: Milk, White and Plain | D21: =SUM(E21:AB21) -> 10.5 | F21: 0.0 | I21: 2.0 | P21: 2.0 | X21: 1.5 | Z21: 2.0 | AA21: 3.0
A22: 20 | B22: A Baldwin (Jnr) | C22: Extreme Golf | D22: =SUM(E22:AB22) -> 10.0 | H22: 1.5 | I22: 2.0 | S22: 2.0 | T22: 0.0 | X22: 1.5 | AA22: 3.0
A23: 21 | B23: D Bingham | C23: Romans | D23: =SUM(E23:AB23) -> 9.5 | F23: 0.0 | H23: 1.5 | I23: 2.0 | K23: 1.0 | S23: 2.0 | AB23: 3.0
A24: 22= | B24: M Rouse | C24: Who'll Take Eric? | D24: =SUM(E24:AB24) -> 9.0 | H24: 1.5 | K24: 1.0 | P24: 2.0 | T24: 0.0 | X24: 1.5 | AA24: 3.0
A25: 22= | B25: D Andrews | C25: Flying High | D25: =SUM(E25:AB25) -> 9.0 | E25: 3.0 | F25: 0.0 | I25: 2.0 | M25: 2.0 | T25: 0.0 | Z25: 2.0
A26: 22= | B26: I Edwards | C26: The Marbellan 'Mad For It' Masterbators | D26: =SUM(E26:AB26) -> 9.0 | G26: 2.0 | K26: 1.0 | M26: 2.0 | S26: 2.0 | T26: 0.0 | Z26: 2.0