B1: MELBAGE CUP 2012 ORDER OF MERIT
B3: Up to and including Melbage 21
B4: Pos | D4: Name *elite* | E4: Team | F4: Played | G4: W | H4: D | I4: L | J4: Points | K4: Average | L4: 11 Pos
B5: 1 | C5: = | D5: D Bingham | E5: Europe | F5: 17 | G5: 12 | H5: 0 | I5: 5 | J5: =G5+(H5*0.5) -> 12 | K5: =J5/F5 -> 0.70588235294117652 | L5: 1
B6: 2 | C6: = | D6: A Benson | E6: USA | F6: 68 | G6: 41 | H6: 12 | I6: 15 | J6: =G6+(H6*0.5) -> 47 | K6: =J6/F6 -> 0.69117647058823528 | L6: 2
B7: 3 | C7: = | D7: M Carter | E7: 24 for USA | F7: 32 | G7: 18 | H7: 4 | I7: 10 | J7: =G7+(H7*0.5) -> 20 | K7: =J7/F7 -> 0.625 | L7: 3
B8: 4 | C8: = | D8: S Owens | E8: USA | F8: 35 | G8: 21 | H8: 1 | I8: 13 | J8: =G8+(H8*0.5) -> 21.5 | K8: =J8/F8 -> 0.61428571428571432 | L8: 4
B9: 5 | C9: ▼ | D9: M Bould | E9: Europe | F9: 40 | G9: 21 | H9: 6 | I9: 13 | J9: =G9+(H9*0.5) -> 24 | K9: =J9/F9 -> 0.6000 | L9: 7=
B10: 6 | C10: = | D10: J Dey | E10: Europe | F10: 79 | G10: 43 | H10: 4 | I10: 32 | J10: =G10+(H10*0.5) -> 45 | K10: =J10/F10 -> 0.569620253164557 | L10: 6
B11: 7 | C11: ▲ | D11: R Thompson * | E11: Europe | F11: 82 | G11: 42 | H11: 8 | I11: 32 | J11: =G11+(H11*0.5) -> 46 | K11: =J11/F11 -> 0.56097560975609762 | L11: 11
B12: 8 | C12: ▲ | D12: A Hopkins | E12: USA | F12: 78 | G12: 40 | H12: 7 | I12: 31 | J12: =G12+(H12*0.5) -> 43.5 | K12: =J12/F12 -> 0.55769230769230771 | L12: 9=
B13: 9 | C13: = | D13: M Cox | E13: Europe | F13: 74 | G13: 34 | H13: 14 | I13: 26 | J13: =G13+(H13*0.5) -> 41 | K13: =J13/F13 -> 0.55405405405405406 | L13: 9=
B14: 10 | C14: ▲ | D14: J Press | E14: 39 for USA | F14: 56 | G14: 28 | H14: 6 | I14: 22 | J14: =G14+(H14*0.5) -> 31 | K14: =J14/F14 -> 0.5535714285714286 | L14: 13
B15: 11 | C15: ▼ | D15: S Thompson | E15: USA | F15: 76 | G15: 37 | H15: 10 | I15: 29 | J15: =G15+(H15*0.5) -> 42 | K15: =J15/F15 -> 0.55263157894736847 | L15: 7=
B16: 12 | C16: = | D16: J Gibbons | E16: Europe | F16: 57 | G16: 27 | H16: 8 | I16: 22 | J16: =G16+(H16*0.5) -> 31 | K16: =J16/F16 -> 0.54385964912280704 | L16: 12
B17: 13 | C17: ▲ | D17: M Trimmings | E17: USA | F17: 28 | G17: 14 | H17: 2 | I17: 12 | J17: =G17+(H17*0.5) -> 15 | K17: =J17/F17 -> 0.5357142857142857 | L17: 19=
B18: 14 | C18: ▲ | D18: D Marsh | E18: 12 for USA | F18: 16 | G18: 8 | H18: 1 | I18: 7 | J18: =G18+(H18*0.5) -> 8.5 | K18: =J18/F18 -> 0.53125 | L18: 15
B19: 15 | C19: ▲ | D19: K Mendelson * | E19: 2 for USA | F19: 82 | G19: 38 | H19: 11 | I19: 29 | J19: =G19+(H19*0.5) -> 43.5 | K19: =J19/F19 -> 0.53048780487804881 | L19: 16
B20: 16 | C20: ▲ | D20: P Carter | E20: USA | F20: 81 | G20: 38 | H20: 8 | I20: 35 | J20: =G20+(H20*0.5) -> 42 | K20: =J20/F20 -> 0.51851851851851849 | L20: 17
B21: 17 | C21: ▲ | D21: S Tilling | E21: USA | F21: 31 | G21: 15 | H21: 2 | I21: 14 | J21: =G21+(H21*0.5) -> 16 | K21: =J21/F21 -> 0.5161290322580645 | L21: 18
B22: 18 | C22: ▼ | D22: I Edwards | E22: Europe | F22: 63 | G22: 30 | H22: 5 | I22: 28 | J22: =G22+(H22*0.5) -> 32.5 | K22: =J22/F22 -> 0.51587301587301593 | L22: 14
B23: 19 | C23: = | D23: R Dickens | E23: Europe | F23: 71 | G23: 32 | H23: 8 | I23: 31 | J23: =G23+(H23*0.5) -> 36 | K23: =J23/F23 -> 0.50704225352112675 | L23: 19=
B24: 20 | C24: ▼ | D24: D Braithwaite | E24: USA | F24: 16 | G24: 8 | H24: 0 | I24: 8 | J24: =G24+(H24*0.5) -> 8 | K24: =J24/F24 -> 0.5000 | L24: 5
B25: 21 | C25: ▼ | D25: C Manning | E25: 13 for USA | F25: 14 | G25: 6 | H25: 2 | I25: 6 | J25: =G25+(H25*0.5) -> 7 | K25: =J25/F25 -> 0.5000 | L25: 19=
B26: 22 | C26: = | D26: A Baldwin (Jnr) | E26: Europe | F26: 82 | G26: 37 | H26: 6 | I26: 39 | J26: =G26+(H26*0.5) -> 40 | K26: =J26/F26 -> 0.48780487804878048 | L26: 22
B27: 23 | C27: = | D27: A Baldwin (Snr) | E27: Europe | F27: 74 | G27: 32 | H27: 6 | I27: 36 | J27: =G27+(H27*0.5) -> 35 | K27: =J27/F27 -> 0.47297297297297297 | L27: 23
B28: 24 | C28: ▲ | D28: D Andrews | E28: Europe | F28: 80 | G28: 36 | H28: 2 | I28: 42 | J28: =G28+(H28*0.5) -> 37 | K28: =J28/F28 -> 0.46250000000000002 | L28: 27
B29: 25 | C29: = | D29: D Rouse * | E29: USA | F29: 82 | G29: 33 | H29: 8 | I29: 40 | J29: =G29+(H29*0.5) -> 37 | K29: =J29/F29 -> 0.45121951219512196 | L29: 25
B30: 26 | C30: ▼ | D30: P Baldwin | E30: USA | F30: 72 | G30: 29 | H30: 5 | I30: 38 | J30: =G30+(H30*0.5) -> 31.5 | K30: =J30/F30 -> 0.4375 | L30: 24
B31: 27 | C31: ▼ | D31: K Gallagher | E31: USA | F31: 81 | G31: 31 | H31: 7 | I31: 43 | J31: =G31+(H31*0.5) -> 34.5 | K31: =J31/F31 -> 0.42592592592592593 | L31: 26
B32: 28 | C32: = | D32: A Knight | E32: 5 for USA | F32: 11 | G32: 4 | H32: 1 | I32: 6 | J32: =G32+(H32*0.5) -> 4.5 | K32: =J32/F32 -> 0.40909090909090912 | L32: 28
B33: 29 | C33: = | D33: K Johns | E33: 6 for USA | F33: 10 | G33: 3 | H33: 1 | I33: 6 | J33: =G33+(H33*0.5) -> 3.5 | K33: =J33/F33 -> 0.3500 | L33: 29
B34: 30 | C34: = | D34: J Colbrook | E34: Europe | F34: 56 | G34: 17 | H34: 5 | I34: 34 | J34: =G34+(H34*0.5) -> 19.5 | K34: =J34/F34 -> 0.3482142857142857 | L34: 30
B35: 31 | C35: = | D35: M Rouse | E35: 45 for USA | F35: 49 | G35: 14 | H35: 1 | I35: 34 | J35: =G35+(H35*0.5) -> 14.5 | K35: =J35/F35 -> 0.29591836734693877 | L35: 31
B36: 32 | C36: = | D36: C Ferris | E36: USA | F36: 28 | G36: 5 | H36: 3 | I36: 20 | J36: =G36+(H36*0.5) -> 6.5 | K36: =J36/F36 -> 0.23214285714285715 | L36: 32