A1: 2013 Ferret Count
B5: Day 1 | C5: Day 2 | D5: Day 3 | E5: Day 4 | F5: Total
A6: A Hopkins | B6: 3 | C6: 7 | D6: 8 | E6: 3 | F6: =SUM(B6:E6) -> 21
A7: R Dickens | B7: 5 | C7: 3 | D7: 3 | E7: 5 | F7: =SUM(B7:E7) -> 16
A8: M Trimmings | B8: 5 | C8: 2 | D8: 4 | E8: 4 | F8: =SUM(B8:E8) -> 15
A9: S Thompson | B9: 4 | C9: 2 | D9: 3 | E9: 3 | F9: =SUM(B9:E9) -> 12
A10: P Carter | B10: 4 | C10: 3 | D10: 1 | E10: 2 | F10: =SUM(B10:E10) -> 10
A11: R Thompson | B11: 2 | C11: 4 | D11: 2 | E11: 2 | F11: =SUM(B11:E11) -> 10
A12: D Braithwaite | B12: 2 | C12: 4 | D12: 1 | E12: 1 | F12: =SUM(B12:E12) -> 8
A13: A Baldwin (Snr) | B13: 4 | C13: 0 | D13: 3 | E13: 2 | F13: =SUM(B13:E13) -> 9
A14: M Carter | B14: 2 | C14: 1 | D14: 4 | E14: 2 | F14: =SUM(B14:E14) -> 9
A15: S Owens | B15: 1 | C15: 0 | D15: 6 | E15: 6 | F15: =SUM(B15:E15) -> 13
A16: P Baldwin | B16: 3 | C16: 3 | D16: 0 | E16: 2 | F16: =SUM(B16:E16) -> 8
A17: A Baldwin (Jnr) | B17: 3 | C17: 1 | D17: 2 | E17: 2 | F17: =SUM(B17:E17) -> 8
A18: D Archer | B18: 2 | C18: 1 | D18: 3 | E18: 3 | F18: =SUM(B18:E18) -> 9
A19: J Press | B19: 1 | C19: 1 | D19: 4 | E19: 3 | F19: =SUM(B19:E19) -> 9
A20: M Cox | B20: 1 | C20: 3 | D20: 1 | E20: 2 | F20: =SUM(B20:E20) -> 7
A21: D Rouse | B21: 1 | C21: 1 | D21: 3 | E21: 1 | F21: =SUM(B21:E21) -> 6
A22: M Bould | B22: 1 | C22: 1 | D22: 3 | E22: 2 | F22: =SUM(B22:E22) -> 7
A23: D Andrews | B23: 2 | C23: 1 | D23: 0 | E23: 1 | F23: =SUM(B23:E23) -> 4
A24: D Bingham | B24: 2 | C24: 1 | D24: 0 | E24: 1 | F24: =SUM(B24:E24) -> 4
A25: K Mendelson | B25: 0 | C25: 2 | D25: 1 | E25: 3 | F25: =SUM(B25:E25) -> 6
A26: J Colbrook | B26: 0 | C26: 1 | D26: 2 | E26: 3 | F26: =SUM(B26:E26) -> 6
A27: K Gallagher | B27: 0 | C27: 0 | D27: 3 | E27: 0 | F27: =SUM(B27:E27) -> 3
A28: S Sutton | B28: 2 | C28: 0 | D28: 0 | E28: 0 | F28: =SUM(B28:E28) -> 2
A29: J Dey | B29: 0 | C29: 0 | D29: 2 | E29: 2 | F29: =SUM(B29:E29) -> 4
A30: D Kewley | B30: 0 | C30: 0 | D30: 2 | E30: 1 | F30: =SUM(B30:E30) -> 3
B31: =SUM(B6:B30) -> 50 | C31: =SUM(C6:C30) -> 42 | D31: =SUM(D6:D30) -> 61 | E31: =SUM(E6:E30) -> 56 | F31: =SUM(F6:F30) -> 209