B1: 2014 Ferret Count
C5: Day 1 | D5: Day 2 | E5: Day 3 | F5: Day 4 | G5: Total
B6: J Press | C6: 5 | D6: 2 | E6: 4 | F6: 2 | G6: =SUM(C6:F6) -> 13
B7: D Archer | C7: 8 | D7: 0 | E7: 1 | F7: 3 | G7: =SUM(C7:F7) -> 12
B8: A Hopkins | C8: 7 | D8: 1 | E8: 1 | F8: 3 | G8: =SUM(C8:F8) -> 12
B9: R Dickens | C9: 5 | D9: 1 | E9: 2 | F9: 3 | G9: =SUM(C9:F9) -> 11
B10: P Baldwin | C10: 4 | D10: 1 | E10: 2 | F10: 4 | G10: =SUM(C10:F10) -> 11
B11: A Baldwin (Snr) | C11: 5 | D11: 3 | E11: 0 | F11: 2 | G11: =SUM(C11:F11) -> 10
B12: M Trimmings | C12: 3 | D12: 2 | E12: 1 | F12: 4 | G12: =SUM(C12:F12) -> 10
B13: D Rouse | C13: 2 | D13: 1 | E13: 3 | F13: 4 | G13: =SUM(C13:F13) -> 10
B14: M Cox | C14: 2 | D14: 2 | E14: 1 | F14: 4 | G14: =SUM(C14:F14) -> 9
B15: M Bould | C15: 3 | D15: 2 | E15: 2 | F15: 1 | G15: =SUM(C15:F15) -> 8
B16: R Thompson | C16: 2 | D16: 1 | E16: 1 | F16: 2 | G16: =SUM(C16:F16) -> 6
B17: D Andrews | C17: 1 | D17: 2 | E17: 1 | F17: 2 | G17: =SUM(C17:F17) -> 6
B18: J Colbrook | C18: 1 | D18: 2 | E18: 1 | F18: 2 | G18: =SUM(C18:F18) -> 6
B19: A Baldwin (Jnr) | C19: 4 | D19: 1 | E19: 0 | F19: 0 | G19: =SUM(C19:F19) -> 5
B20: S Thompson | C20: 3 | D20: 1 | E20: 1 | F20: 0 | G20: =SUM(C20:F20) -> 5
B21: D Braithwaite | C21: 3 | D21: 0 | E21: 1 | F21: 0 | G21: =SUM(C21:F21) -> 4
B22: S Owens | C22: 3 | D22: 0 | E22: 1 | F22: 0 | G22: =SUM(C22:F22) -> 4
B23: J Dey | C23: 3 | D23: 0 | E23: 0 | F23: 1 | G23: =SUM(C23:F23) -> 4
B24: D Bingham | C24: 0 | D24: 1 | E24: 2 | F24: 1 | G24: =SUM(C24:F24) -> 4
B25: D Kewley | C25: 0 | D25: 1 | E25: 1 | F25: 2 | G25: =SUM(C25:F25) -> 4
B26: K Mendelson | C26: 1 | D26: 0 | E26: 1 | F26: 1 | G26: =SUM(C26:F26) -> 3
B27: M Carter | C27: 1 | D27: 0 | E27: 0 | F27: 2 | G27: =SUM(C27:F27) -> 3
B28: K Gallagher | C28: 1 | D28: 0 | E28: 0 | F28: 2 | G28: =SUM(C28:F28) -> 3
B29: P Carter | C29: 1 | D29: 0 | E29: 1 | F29: 0 | G29: =SUM(C29:F29) -> 2
C30: =SUM(C6:C29) -> 68 | D30: =SUM(D6:D29) -> 24 | E30: =SUM(E6:E29) -> 28 | F30: =SUM(F6:F29) -> 45 | G30: =SUM(G6:G29) -> 165