A1: Owner | B1: Fantasy Team Name | C1: S Owens | D1: P Carter | E1: A Hopkins | F1: S Thompson | G1: K Gallagher | H1: D Rouse | I1: J Press | J1: M Carter | K1: P Baldwin | L1: M Trimmings | M1: D Braithwaite | N1: D Kewley | O1: K Mendelson | P1: R Thompson | Q1: A Baldwin (Jnr) | R1: D Andrews | S1: J Colbrook | T1: A Baldwin (Snr) | U1: M Bould | V1: M Cox | W1: J Dey | X1: R Dickens | Y1: D Archer | Z1: D Bingham
A2: P Carter | B2: Seven Deadly Sins | D2: 3.0 | I2: 2.0 | J2: 2.0 | K2: 4.0 | U2: 2.0 | W2: 2.0 | Z2: 4.0 | AA2: =SUM(C2:Z2) -> 19.0
A3: S Owens | B3: Slice & Dice | C3: 4.0 | H3: 1.0 | J3: 2.0 | M3: 2.0 | R3: 2.0 | U3: 2.0 | Z3: 4.0 | AA3: =SUM(C3:Z3) -> 17.0
A4: J Colbrook | B4: Bald Old Badgers | E4: 2.5 | F4: 3.0 | G4: 3.0 | K4: 4.0 | Q4: 1.0 | S4: 1.5 | U4: 2.0 | AA4: =SUM(C4:Z4) -> 17.0
A5: J Dey | B5: Sheep in Wolfs Clothing | D5: 3.0 | G5: 3.0 | J5: 2.0 | M5: 2.0 | O5: 0.0 | W5: 2.0 | Z5: 4.0 | AA5: =SUM(C5:Z5) -> 16.0
A6: J Press | B6: Buttons' Blithering Bores | F6: 3.0 | I6: 2.0 | J6: 2.0 | M6: 2.0 | P6: 1.0 | W6: 2.0 | Z6: 4.0 | AA6: =SUM(C6:Z6) -> 16.0
A7: A Baldwin (Jnr) | B7: Butt Plug United | F7: 3.0 | I7: 2.0 | M7: 2.0 | N7: 3.0 | W7: 2.0 | Z7: 4.0 | AA7: =SUM(C7:Z7) -> 16.0
A8: D Kewley | B8: Wolfie's Howlers | G8: 3.0 | H8: 1.0 | J8: 2.0 | M8: 2.0 | P8: 1.0 | U8: 2.0 | Z8: 4.0 | AA8: =SUM(C8:Z8) -> 15.0
A9: A Hopkins | B9: Hoppo's Tossers | F9: 3.0 | G9: 3.0 | J9: 2.0 | N9: 3.0 | O9: 0.0 | Z9: 4.0 | AA9: =SUM(C9:Z9) -> 15.0
A10: K Gallagher | B10: In The Hole | F10: 3.0 | I10: 2.0 | J10: 2.0 | N10: 3.0 | P10: 1.0 | Z10: 4.0 | AA10: =SUM(C10:Z10) -> 15.0
A11: M Trimmings | B11: My Fantasy Team | L11: 4.0 | M11: 2.0 | N11: 3.0 | V11: 0.0 | W11: 2.0 | Z11: 4.0 | AA11: =SUM(C11:Z11) -> 15.0
A12: D Andrews | B12: Flying High | I12: 2.0 | L12: 4.0 | O12: 0.0 | R12: 2.0 | U12: 2.0 | X12: 1.0 | Z12: 4.0 | AA12: =SUM(C12:Z12) -> 15.0
A13: R Thompson | B13: When Butter and Cheese on Toast is Not Enough | E13: 2.5 | I13: 2.0 | M13: 2.0 | O13: 0.0 | R13: 2.0 | W13: 2.0 | Z13: 4.0 | AA13: =SUM(C13:Z13) -> 14.5
A14: S Thompson | B14: Fun In The Sun | D14: 3.0 | F14: 3.0 | J14: 2.0 | K14: 4.0 | P14: 1.0 | Q14: 1.0 | T14: 0.0 | AA14: =SUM(C14:Z14) -> 14.0
A15: M Bould | B15: Fore, Right! | G15: 3.0 | M15: 2.0 | O15: 0.0 | P15: 1.0 | U15: 2.0 | W15: 2.0 | Z15: 4.0 | AA15: =SUM(C15:Z15) -> 14.0
A16: R Dickens | B16: Always In The Shite | I16: 2.0 | J16: 2.0 | K16: 4.0 | Q16: 1.0 | R16: 2.0 | W16: 2.0 | X16: 1.0 | AA16: =SUM(C16:Z16) -> 14.0
A17: D Bingham | B17: Romans | F17: 3.0 | I17: 2.0 | N17: 3.0 | U17: 2.0 | V17: 0.0 | Z17: 4.0 | AA17: =SUM(C17:Z17) -> 14.0
A18: D Braithwaite | B18: Half Man, Half Biscuit | F18: 3.0 | G18: 3.0 | I18: 2.0 | M18: 2.0 | P18: 1.0 | Q18: 1.0 | W18: 2.0 | AA18: =SUM(C18:Z18) -> 14.0
A19: M Carter | B19: The Fat Pack | D19: 3.0 | E19: 2.5 | F19: 3.0 | H19: 1.0 | J19: 2.0 | P19: 1.0 | V19: 0.0 | AA19: =SUM(C19:Z19) -> 12.5
A20: A Baldwin (Snr) | B20: Turncoat's Aging Artisans | G20: 3.0 | K20: 4.0 | N20: 3.0 | Q20: 1.0 | T20: 0.0 | X20: 1.0 | AA20: =SUM(C20:Z20) -> 12.0
A21: D Rouse | B21: Rousey's Non Howlers | H21: 1.0 | I21: 2.0 | M21: 2.0 | W21: 2.0 | X21: 1.0 | Z21: 4.0 | AA21: =SUM(C21:Z21) -> 12.0
A22: D Archer | B22: Almost 600Kg of Poo | F22: 3.0 | I22: 2.0 | N22: 3.0 | P22: 1.0 | W22: 2.0 | Y22: 0.0 | AA22: =SUM(C22:Z22) -> 11.0
A23: K Mendelson | B23: Mendy's Magnificent Seven | E23: 2.5 | G23: 3.0 | M23: 2.0 | O23: 0.0 | P23: 1.0 | S23: 1.5 | V23: 0.0 | AA23: =SUM(C23:Z23) -> 10.0
A24: P Baldwin | B24: #professionalgolfers | I24: 2.0 | J24: 2.0 | K24: 4.0 | O24: 0.0 | V24: 0.0 | W24: 2.0 | AA24: =SUM(C24:Z24) -> 10.0
A25: M Cox | B25: The Diabetic Six | H25: 1.0 | I25: 2.0 | N25: 3.0 | P25: 1.0 | S25: 1.5 | V25: 0.0 | AA25: =SUM(C25:Z25) -> 8.5
B26: Number of times selected | C26: 1 | D26: 4 | E26: 4 | F26: 10 | G26: 8 | H26: 5 | I26: 13 | J26: 11 | K26: 6 | L26: 2 | M26: 12 | N26: 8 | O26: 7 | P26: 10 | Q26: 5 | R26: 4 | S26: 3 | T26: 2 | U26: 7 | V26: 6 | W26: 12 | X26: 4 | Y26: 1 | Z26: 14