A1: Owner | B1: Fantasy Team Name | C1: S Owens | D1: P Carter | E1: A Hopkins | F1: S Thompson | G1: K Gallagher | H1: D Rouse | I1: J Press | J1: M Carter | K1: P Baldwin | L1: M Trimmings | M1: D Braithwaite | N1: D Kewley | O1: K Mendelson | P1: R Thompson | Q1: A Baldwin (Jnr) | R1: D Andrews | S1: J Colbrook | T1: A Baldwin (Snr) | U1: I Edwards | V1: M Cox | W1: J Dey | X1: R Dickens | Y1: D Archer | Z1: D Bingham
A2: I Edwards | B2: Team McSchlappp | F2: 2.0 | M2: 2.0 | N2: 4.0 | V2: 3.0 | W2: 3.0 | Z2: 1.5 | AA2: =SUM(C2:Z2) -> 15.5
A3: A Baldwin (Jnr) | B3: Balder's Champions League Half Dozen | F3: 2.0 | I3: 2.0 | N3: 4.0 | V3: 3.0 | W3: 3.0 | Z3: 1.5 | AA3: =SUM(C3:Z3) -> 15.5
A4: J Dey | B4: The Eastbourne Pensioners | D4: 3.5 | H4: 2.0 | N4: 4.0 | T4: 1.0 | W4: 3.0 | Z4: 1.5 | AA4: =SUM(C4:Z4) -> 15.0
A5: J Press | B5: Buttons Buttplugging Buttmasters | C5: 1.5 | I5: 2.0 | K5: 3.0 | N5: 4.0 | W5: 3.0 | Z5: 1.5 | AA5: =SUM(C5:Z5) -> 15.0
A6: D Braithwaite | B6: Biscuit Lickers | G6: 2.5 | M6: 2.0 | N6: 4.0 | R6: 2.0 | W6: 3.0 | Z6: 1.5 | AA6: =SUM(C6:Z6) -> 15.0
A7: S Owens | B7: Shite & Onions | C7: 1.5 | I7: 2.0 | M7: 2.0 | N7: 4.0 | V7: 3.0 | Z7: 1.5 | AA7: =SUM(C7:Z7) -> 14.0
A8: D Archer | B8: Team Chod | C8: 1.5 | F8: 2.0 | I8: 2.0 | N8: 4.0 | W8: 3.0 | Z8: 1.5 | AA8: =SUM(C8:Z8) -> 14.0
A9: D Kewley | B9: The Wolf Pack | D9: 3.5 | F9: 2.0 | I9: 2.0 | J9: 1.5 | W9: 3.0 | Z9: 1.5 | AA9: =SUM(C9:Z9) -> 13.5
A10: A Baldwin (Snr) | B10: Turncoat's Designated Carers | D10: 3.5 | K10: 3.0 | Q10: 2.0 | S10: 0.5 | T10: 1.0 | W10: 3.0 | AA10: =SUM(C10:Z10) -> 13.0
A11: P Baldwin | B11: #Hashtags | H11: 2.0 | J11: 1.5 | K11: 3.0 | N11: 4.0 | P11: 1.0 | Z11: 1.5 | AA11: =SUM(C11:Z11) -> 13.0
A12: S Thompson | B12: Beware The Wounded Beast | F12: 2.0 | I12: 2.0 | M12: 2.0 | P12: 1.0 | V12: 3.0 | W12: 3.0 | AA12: =SUM(C12:Z12) -> 13.0
A13: A Hopkins | B13: Hoppinators | F13: 2.0 | I13: 2.0 | J13: 1.5 | K13: 3.0 | W13: 3.0 | Z13: 1.5 | AA13: =SUM(C13:Z13) -> 13.0
A14: D Bingham | B14: Romans | F14: 2.0 | I14: 2.0 | M14: 2.0 | R14: 2.0 | W14: 3.0 | Z14: 1.5 | AA14: =SUM(C14:Z14) -> 12.5
A15: D Rouse | B15: Jeff, You've Missed A Bit | F15: 2.0 | H15: 2.0 | I15: 2.0 | K15: 3.0 | R15: 2.0 | Z15: 1.5 | AA15: =SUM(C15:Z15) -> 12.5
A16: R Dickens | B16: Clubbed To Death | D16: 3.5 | F16: 2.0 | I16: 2.0 | P16: 1.0 | W16: 3.0 | X16: 1.0 | AA16: =SUM(C16:Z16) -> 12.5
A17: K Gallagher | B17: Farty Fat Fellas | M17: 2.0 | N17: 4.0 | O17: 0.5 | P17: 1.0 | R17: 2.0 | W17: 3.0 | AA17: =SUM(C17:Z17) -> 12.5
A18: M Trimmings | B18: Wish We Were At Bournemouth | F18: 2.0 | G18: 2.5 | L18: 3.0 | M18: 2.0 | P18: 1.0 | R18: 2.0 | AA18: =SUM(C18:Z18) -> 12.5
A19: M Carter | B19: Matt's Maulers | D19: 3.5 | I19: 2.0 | J19: 1.5 | M19: 2.0 | P19: 1.0 | Q19: 2.0 | AA19: =SUM(C19:Z19) -> 12.0
A20: P Carter | B20: Tubby Team | D20: 3.5 | F20: 2.0 | I20: 2.0 | S20: 0.5 | W20: 3.0 | X20: 1.0 | AA20: =SUM(C20:Z20) -> 12.0
A21: D Andrews | B21: Flying High | L21: 3.0 | N21: 4.0 | O21: 0.5 | P21: 1.0 | R21: 2.0 | Z21: 1.5 | AA21: =SUM(C21:Z21) -> 12.0
A22: K Mendelson | B22: Mendy's Eastbourne Arses | C22: 1.5 | F22: 2.0 | N22: 4.0 | O22: 0.5 | R22: 2.0 | Z22: 1.5 | AA22: =SUM(C22:Z22) -> 11.5
A23: M Cox | B23: Eastbourne Beware | H23: 2.0 | I23: 2.0 | P23: 1.0 | Q23: 2.0 | S23: 0.5 | V23: 3.0 | AA23: =SUM(C23:Z23) -> 10.5
A24: R Thompson | B24: The Law of Bloody Averages | I24: 2.0 | M24: 2.0 | O24: 0.5 | P24: 1.0 | R24: 2.0 | W24: 3.0 | AA24: =SUM(C24:Z24) -> 10.5
A25: J Colbrook | B25: Painter's Mates | F25: 2.0 | K25: 3.0 | O25: 0.5 | S25: 0.5 | V25: 3.0 | Z25: 1.5 | AA25: =SUM(C25:Z25) -> 10.5
C26: 4 | D26: 6 | E26: 0 | F26: 13 | G26: 2 | H26: 4 | I26: 14 | J26: 4 | K26: 6 | L26: 2 | M26: 9 | N26: 11 | O26: 5 | P26: 9 | Q26: 3 | R26: 8 | S26: 4 | T26: 2 | U26: 0 | V26: 6 | W26: 15 | X26: 2 | Y26: 0 | Z26: 15