B1: MGA Tour Statistics for: | L1: Martin Cox | X1: MGA Membership Number :
B2: Date: | D2: =TODAY() -> 36655 | G2: Handicap: | L2: Started: | N2: 14.1 | P2: Current: | V2: 14.7 | AF2: Cumulative | AI2: Average
B3: Merit Position: | G3: 6 of 7 | Q3: Cumulative | V3: Average | X3: Double Bogey Plus (DB+) | AF3: 10 | AI3: =IF(G10=0,"",AF3/$G$10) -> 2.00
B4: Prize Money Position: | G4: 5 | M4: Gross Score | Q4: 473 | V4: =IF(G10=0,"",Q4/G$10) -> 94.60 | X4: Double Bogey (DB) | AF4: 21 | AI4: =IF(G10=0,"",AF4/$G$10) -> 4.20
B5: Total Prize Money: | G5: 83750 | M5: Points | Q5: 142 | V5: =IF(G10=0,"",Q5/G$10) -> 28.40 | X5: Bogey | AF5: 37 | AI5: =IF(G10=0,"",AF5/$G$10) -> 7.40
B6: Career Earning | G6: =G5+52675 -> 136425 | M6: Putts | Q6: 176 | V6: =IF(G10=0,"",Q6/G$10) -> 35.20 | X6: Par (P) | AF6: 21 | AI6: =IF(G10=0,"",AF6/$G$10) -> 4.20
B7: Games Avg, Earning | G7: 16750 | M7: Fairways | Q7: 40 / 70 | V7: 57.14 % | X7: Birdie (B) | AF7: 1 | AI7: =IF(G10=0,"",AF7/$G$10) -> 00.2
B8: Best Score | G8: 31 | M8: Ferrets | Q8: 6 | V8: =IF(G10=0,"",Q8/G$10) -> 1.20 | X8: Eagle (E) | AF8: 0 | AI8: =IF(G10=0,"",AF8/$G$10) -> 0.00
B9: Worse Score | G9: 24 | M9: Green Regulation | Q9: 46 | V9: =IF(G10=0,"",ROUND((Q9/(G$10*18)*100),2)&" %") -> 51.11 % | X9: Albatross (A) | AF9: 0 | AI9: =IF(G10=0,"",AF9/$G$10) -> 0.00
B10: Games Played : | G10: 5 | M10: Average Putts per Hole | V10: =IF(G10=0,"",V6/18) -> 1.9555555555555557 | X10: Hole in One (H1) | AF10: 0 | AI10: =IF(G10=0,"",AF10/$G$10) -> 0.00
A12: Club | B12: Wycombe Heights | L12: Laguna Vilamoura | V12: Pinhal Vilamoura | AF12: Vila Sol
A13: Par/SS | B13: 70/72 | D13: Num. Of Fairways | I13: =IF(B12="","",18-(COUNTIF(B19:B36,3))) -> 14 | L13: 72/73 | N13: Num. Of Fairways | S13: =IF(L12="","",18-(COUNTIF(L19:L36,3))) -> 14 | V13: 72/71 | X13: Num. Of Fairways | AC13: =IF(V12="","",18-(COUNTIF(V19:V36,3))) -> 14 | AF13: 72/72 | AH13: Num. Of Fairways | AM13: =IF(AF12="","",18-(COUNTIF(AF19:AF36,3))) -> 14
A14: Date | B14: 36622 | D14: Playing Handicap | I14: =IF(B12="","",N2) -> 14.1 | L14: 36626 | N14: Playing Handicap | S14: 14.2 | V14: 36627 | X14: Playing Handicap | AC14: 14.3 | AF14: 36632 | AH14: Playing Handicap | AM14: 14.4
A15: Event Place | B15: 2 | D15: Prize Money | G15: 2500 | L15: 10 | N15: Prize Money | Q15: 33750 | V15: 3 | X15: Prize Money | AA15: 35000 | AF15: 5 | AH15: Prize Money | AK15: 5000
A16: Game Stats | B16: DB+ | C16: DB | D16: Bi | E16: P | F16: B | G16: E | H16: A | I16: H1 | L16: DB+ | M16: DB | N16: BI | O16: P | P16: B | Q16: E | R16: A | S16: H1 | V16: DB+ | W16: DB | X16: Bi | Y16: P | Z16: B | AA16: E | AB16: A | AC16: H1 | AF16: DB+ | AG16: DB | AH16: Bi | AI16: P | AJ16: B | AK16: E | AL16: A | AM16: H1
B17: =IF(B12="","",IF(COUNTIF($K19:$K36,"=DB+")="","",COUNTIF($K19:$K37,"=DB+"))) -> 2 | C17: =IF(B12="","",IF(COUNTIF($K19:$K36,"=DB")="","",COUNTIF($K19:$K37,"=DB"))) -> 3 | D17: =IF(B12="","",IF(COUNTIF($K19:$K36,"=Bi")="","",COUNTIF($K19:$K37,"=Bi"))) -> 7 | E17: =IF(B12="","",IF(COUNTIF($K19:$K36,"=P")="","",COUNTIF($K19:$K37,"=P"))) -> 6 | F17: =IF(B12="","",IF(COUNTIF($K19:$K36,"=B")="","",COUNTIF($K19:$K37,"=B"))) -> 0 | G17: =IF(B12="","",IF(COUNTIF($K19:$K36,"=E")="","",COUNTIF($K19:$K37,"=E"))) -> 0 | H17: =IF(B12="","",IF(COUNTIF($K19:$K36,"=A")="","",COUNTIF($K19:$K37,"=A"))) -> 0 | I17: =IF(B12="","",IF(COUNTIF($K19:$K36,"=H1")="","",COUNTIF($K19:$K37,"=H1"))) -> 0 | L17: =IF(L12="","",IF(COUNTIF($U19:$U36,"=DB+")="","",COUNTIF($U19:$U37,"=DB+"))) -> 3 | M17: =IF(L12="","",IF(COUNTIF($U19:$U36,"=DB")="","",COUNTIF($U19:$U37,"=DB"))) -> 3 | N17: =IF(L12="","",IF(COUNTIF($U19:$U36,"=Bi")="","",COUNTIF($U19:$U37,"=Bi"))) -> 8 | O17: =IF(L12="","",IF(COUNTIF($U19:$U36,"=P")="","",COUNTIF($U19:$U37,"=P"))) -> 4 | P17: =IF(L12="","",IF(COUNTIF($U19:$U36,"=B")="","",COUNTIF($U19:$U37,"=B"))) -> 0 | Q17: =IF(L12="","",IF(COUNTIF($U19:$U36,"=E")="","",COUNTIF($U19:$U37,"=E"))) -> 0 | R17: =IF(L12="","",IF(COUNTIF($U19:$U36,"=A")="","",COUNTIF($U19:$U37,"=A"))) -> 0 | S17: =IF(L12="","",IF(COUNTIF($U19:$U36,"=H1")="","",COUNTIF($U19:$U37,"=H1"))) -> 0 | V17: =IF(V12="","",IF(COUNTIF($AE19:$AE36,"=DB+")="","",COUNTIF($AE19:$AE37,"=DB+"))) -> 2 | W17: =IF(V12="","",IF(COUNTIF($AE19:$AE36,"=DB")="","",COUNTIF($AE19:$AE37,"=DB"))) -> 4 | X17: =IF(V12="","",IF(COUNTIF($AE19:$AE36,"=Bi")="","",COUNTIF($AE19:$AE37,"=Bi"))) -> 7 | Y17: =IF(V12="","",IF(COUNTIF($AE19:$AE36,"=P")="","",COUNTIF($AE19:$AE37,"=P"))) -> 4 | Z17: =IF(V12="","",IF(COUNTIF($AE19:$AE36,"=B")="","",COUNTIF($AE19:$AE37,"=B"))) -> 1 | AA17: =IF(V12="","",IF(COUNTIF($AE19:$AE36,"=E")="","",COUNTIF($AE19:$AE37,"=E"))) -> 0 | AB17: =IF(V12="","",IF(COUNTIF($AE19:$AE36,"=A")="","",COUNTIF($AE19:$AE37,"=A"))) -> 0 | AC17: =IF(V12="","",IF(COUNTIF($AE19:$AE36,"=H1")="","",COUNTIF($AE19:$AE37,"=H1"))) -> 0 | AF17: 2 | AG17: 6 | AH17: 8 | AI17: 2 | AJ17: 0 | AK17: 0 | AL17: 0 | AM17: 0
A18: Hole No | B18: Par | C18: Stroke Index | D18: Gross Score | E18: Points | F18: Putts | G18: Fairways | H18: Ferrets | I18: Green Regulation | L18: Par | M18: Stroke Index | N18: Gross Score | O18: Points | P18: Putts | Q18: Fairways | R18: Ferrets | S18: Green Regulation | V18: Par | W18: Stroke Index | X18: Gross Score | Y18: Points | Z18: Putts | AA18: Fairways | AB18: Ferrets | AC18: Green Regulation | AF18: Par | AG18: Stroke Index | AH18: Gross Score | AI18: Points | AJ18: Putts | AK18: Fairways | AL18: Ferrets | AM18: Green Regulation
A19: 1 | B19: 4 | C19: 3 | D19: 4 | E19: 3 | F19: 1 | G19: 1 | I19: =IF(B$12="","",IF((B19+J19)-2>=D19-F19,"Yes","")) -> Yes | J19: =IF(ROUND(I$14,0)>=C19,IF((ROUND(I$14,0)-18)>=C19,2,1),0) -> 1 | K19: =IF(D19=1,"H1",IF(B19-3=D19,"A",IF(B19-2=D19,"E",IF(B19-1=D19,"B",IF(B19=D19,"P",IF(B19+1=D19,"Bi",IF(B19+2=D19,"DB",IF(B19+2=D19,"DB+","DB+")))))))) -> P | L19: 5 | M19: 16 | N19: 6 | O19: 1 | P19: 2 | S19: =IF(L$12="","",IF((L19+T19)-2>=N19-P19,"Yes","")) ->  | T19: =IF(ROUND(S$14,0)>=M19,IF((ROUND(S$14,0)-18)>=M19,2,1),0) -> 0 | U19: =IF(N19=1,"H1",IF(L19-3=N19,"A",IF(L19-2=N19,"E",IF(L19-1=N19,"B",IF(L19=N19,"P",IF(L19+1=N19,"Bi",IF(L19+2=N19,"DB",IF(L19+2=N19,"DB+","DB+")))))))) -> Bi | V19: 5 | W19: 14 | X19: 6 | Y19: 2 | Z19: 1 | AC19: =IF(V$12="","",IF((V19+AD19)-2>=X19-Z19,"Yes","")) ->  | AD19: =IF(ROUND(AC$14,0)>=W19,IF((ROUND(AC$14,0)-18)>=W19,2,1),0) -> 1 | AE19: =IF(X19=1,"H1",IF(V19-3=X19,"A",IF(V19-2=X19,"E",IF(V19-1=X19,"B",IF(V19=X19,"P",IF(V19+1=X19,"Bi",IF(V19+2=X19,"DB",IF(V19+2=X19,"DB+","DB+")))))))) -> Bi | AF19: 4 | AG19: 3 | AH19: 8 | AI19: 0 | AJ19: 3 | AK19: 1 | AL19: 1
A20: 2 | B20: 3 | C20: 15 | D20: 5 | E20: 0 | F20: 2 | I20: =IF(B$12="","",IF((B20+J20)-2>=D20-F20,"Yes","")) ->  | J20: =IF(ROUND(I$14,0)>=C20,IF((ROUND(I$14,0)-18)>=C20,2,1),0) -> 0 | K20: =IF(D20=1,"H1",IF(B20-3=D20,"A",IF(B20-2=D20,"E",IF(B20-1=D20,"B",IF(B20=D20,"P",IF(B20+1=D20,"Bi",IF(B20+2=D20,"DB",IF(B20+2=D20,"DB+","DB+")))))))) -> DB | L20: 3 | M20: 12 | N20: 4 | O20: 2 | P20: 2 | S20: =IF(L$12="","",IF((L20+T20)-2>=N20-P20,"Yes","")) -> Yes | T20: =IF(ROUND(S$14,0)>=M20,IF((ROUND(S$14,0)-18)>=M20,2,1),0) -> 1 | U20: =IF(N20=1,"H1",IF(L20-3=N20,"A",IF(L20-2=N20,"E",IF(L20-1=N20,"B",IF(L20=N20,"P",IF(L20+1=N20,"Bi",IF(L20+2=N20,"DB",IF(L20+2=N20,"DB+","DB+")))))))) -> Bi | V20: 4 | W20: 4 | X20: 4 | Y20: 3 | Z20: 1 | AA20: 1 | AC20: =IF(V$12="","",IF((V20+AD20)-2>=X20-Z20,"Yes","")) -> Yes | AD20: =IF(ROUND(AC$14,0)>=W20,IF((ROUND(AC$14,0)-18)>=W20,2,1),0) -> 1 | AE20: =IF(X20=1,"H1",IF(V20-3=X20,"A",IF(V20-2=X20,"E",IF(V20-1=X20,"B",IF(V20=X20,"P",IF(V20+1=X20,"Bi",IF(V20+2=X20,"DB",IF(V20+2=X20,"DB+","DB+")))))))) -> P | AF20: 4 | AG20: 9 | AH20: 5 | AI20: 2 | AJ20: 3 | AK20: 1 | AM20: Yes
A21: 3 | B21: 4 | C21: 11 | D21: 10 | E21: 0 | F21: 3 | H21: 1 | I21: =IF(B$12="","",IF((B21+J21)-2>=D21-F21,"Yes","")) ->  | J21: =IF(ROUND(I$14,0)>=C21,IF((ROUND(I$14,0)-18)>=C21,2,1),0) -> 1 | K21: =IF(D21=1,"H1",IF(B21-3=D21,"A",IF(B21-2=D21,"E",IF(B21-1=D21,"B",IF(B21=D21,"P",IF(B21+1=D21,"Bi",IF(B21+2=D21,"DB",IF(B21+2=D21,"DB+","DB+")))))))) -> DB+ | L21: 4 | M21: 4 | N21: 4 | O21: 3 | P21: 1 | Q21: 1 | S21: =IF(L$12="","",IF((L21+T21)-2>=N21-P21,"Yes","")) -> Yes | T21: =IF(ROUND(S$14,0)>=M21,IF((ROUND(S$14,0)-18)>=M21,2,1),0) -> 1 | U21: =IF(N21=1,"H1",IF(L21-3=N21,"A",IF(L21-2=N21,"E",IF(L21-1=N21,"B",IF(L21=N21,"P",IF(L21+1=N21,"Bi",IF(L21+2=N21,"DB",IF(L21+2=N21,"DB+","DB+")))))))) -> P | V21: 5 | W21: 10 | X21: 4 | Y21: 4 | Z21: 1 | AA21: 1 | AC21: =IF(V$12="","",IF((V21+AD21)-2>=X21-Z21,"Yes","")) -> Yes | AD21: =IF(ROUND(AC$14,0)>=W21,IF((ROUND(AC$14,0)-18)>=W21,2,1),0) -> 1 | AE21: =IF(X21=1,"H1",IF(V21-3=X21,"A",IF(V21-2=X21,"E",IF(V21-1=X21,"B",IF(V21=X21,"P",IF(V21+1=X21,"Bi",IF(V21+2=X21,"DB",IF(V21+2=X21,"DB+","DB+")))))))) -> B | AF21: 4 | AG21: 1 | AH21: 5 | AI21: 2 | AJ21: 2 | AK21: 1 | AM21: Yes
A22: 4 | B22: 4 | C22: 9 | D22: 5 | E22: 2 | F22: 3 | I22: =IF(B$12="","",IF((B22+J22)-2>=D22-F22,"Yes","")) -> Yes | J22: =IF(ROUND(I$14,0)>=C22,IF((ROUND(I$14,0)-18)>=C22,2,1),0) -> 1 | K22: =IF(D22=1,"H1",IF(B22-3=D22,"A",IF(B22-2=D22,"E",IF(B22-1=D22,"B",IF(B22=D22,"P",IF(B22+1=D22,"Bi",IF(B22+2=D22,"DB",IF(B22+2=D22,"DB+","DB+")))))))) -> Bi | L22: 3 | M22: 6 | N22: 4 | O22: 2 | P22: 2 | S22: =IF(L$12="","",IF((L22+T22)-2>=N22-P22,"Yes","")) -> Yes | T22: =IF(ROUND(S$14,0)>=M22,IF((ROUND(S$14,0)-18)>=M22,2,1),0) -> 1 | U22: =IF(N22=1,"H1",IF(L22-3=N22,"A",IF(L22-2=N22,"E",IF(L22-1=N22,"B",IF(L22=N22,"P",IF(L22+1=N22,"Bi",IF(L22+2=N22,"DB",IF(L22+2=N22,"DB+","DB+")))))))) -> Bi | V22: 4 | W22: 8 | X22: 6 | Y22: 1 | Z22: 2 | AC22: =IF(V$12="","",IF((V22+AD22)-2>=X22-Z22,"Yes","")) ->  | AD22: =IF(ROUND(AC$14,0)>=W22,IF((ROUND(AC$14,0)-18)>=W22,2,1),0) -> 1 | AE22: =IF(X22=1,"H1",IF(V22-3=X22,"A",IF(V22-2=X22,"E",IF(V22-1=X22,"B",IF(V22=X22,"P",IF(V22+1=X22,"Bi",IF(V22+2=X22,"DB",IF(V22+2=X22,"DB+","DB+")))))))) -> DB | AF22: 3 | AG22: 11 | AH22: 3 | AI22: 3 | AJ22: 0
A23: 5 | B23: 5 | C23: 13 | D23: 5 | E23: 3 | F23: 2 | G23: 1 | I23: =IF(B$12="","",IF((B23+J23)-2>=D23-F23,"Yes","")) -> Yes | J23: =IF(ROUND(I$14,0)>=C23,IF((ROUND(I$14,0)-18)>=C23,2,1),0) -> 1 | K23: =IF(D23=1,"H1",IF(B23-3=D23,"A",IF(B23-2=D23,"E",IF(B23-1=D23,"B",IF(B23=D23,"P",IF(B23+1=D23,"Bi",IF(B23+2=D23,"DB",IF(B23+2=D23,"DB+","DB+")))))))) -> P | L23: 4 | M23: 8 | N23: 6 | O23: 1 | P23: 4 | Q23: 1 | S23: =IF(L$12="","",IF((L23+T23)-2>=N23-P23,"Yes","")) -> Yes | T23: =IF(ROUND(S$14,0)>=M23,IF((ROUND(S$14,0)-18)>=M23,2,1),0) -> 1 | U23: =IF(N23=1,"H1",IF(L23-3=N23,"A",IF(L23-2=N23,"E",IF(L23-1=N23,"B",IF(L23=N23,"P",IF(L23+1=N23,"Bi",IF(L23+2=N23,"DB",IF(L23+2=N23,"DB+","DB+")))))))) -> DB | V23: 3 | W23: 18 | X23: 3 | Y23: 2 | Z23: 2 | AC23: =IF(V$12="","",IF((V23+AD23)-2>=X23-Z23,"Yes","")) -> Yes | AD23: =IF(ROUND(AC$14,0)>=W23,IF((ROUND(AC$14,0)-18)>=W23,2,1),0) -> 0 | AE23: =IF(X23=1,"H1",IF(V23-3=X23,"A",IF(V23-2=X23,"E",IF(V23-1=X23,"B",IF(V23=X23,"P",IF(V23+1=X23,"Bi",IF(V23+2=X23,"DB",IF(V23+2=X23,"DB+","DB+")))))))) -> P | AF23: 4 | AG23: 13 | AH23: 5 | AI23: 2 | AJ23: 2 | AK23: 1 | AM23: Yes
A24: 6 | B24: 4 | C24: 5 | D24: 5 | E24: 2 | F24: 3 | I24: =IF(B$12="","",IF((B24+J24)-2>=D24-F24,"Yes","")) -> Yes | J24: =IF(ROUND(I$14,0)>=C24,IF((ROUND(I$14,0)-18)>=C24,2,1),0) -> 1 | K24: =IF(D24=1,"H1",IF(B24-3=D24,"A",IF(B24-2=D24,"E",IF(B24-1=D24,"B",IF(B24=D24,"P",IF(B24+1=D24,"Bi",IF(B24+2=D24,"DB",IF(B24+2=D24,"DB+","DB+")))))))) -> Bi | L24: 4 | M24: 18 | N24: 4 | O24: 2 | P24: 2 | Q24: 1 | S24: =IF(L$12="","",IF((L24+T24)-2>=N24-P24,"Yes","")) -> Yes | T24: =IF(ROUND(S$14,0)>=M24,IF((ROUND(S$14,0)-18)>=M24,2,1),0) -> 0 | U24: =IF(N24=1,"H1",IF(L24-3=N24,"A",IF(L24-2=N24,"E",IF(L24-1=N24,"B",IF(L24=N24,"P",IF(L24+1=N24,"Bi",IF(L24+2=N24,"DB",IF(L24+2=N24,"DB+","DB+")))))))) -> P | V24: 4 | W24: 2 | X24: 7 | Y24: 0 | Z24: 3 | AA24: 1 | AC24: =IF(V$12="","",IF((V24+AD24)-2>=X24-Z24,"Yes","")) ->  | AD24: =IF(ROUND(AC$14,0)>=W24,IF((ROUND(AC$14,0)-18)>=W24,2,1),0) -> 1 | AE24: =IF(X24=1,"H1",IF(V24-3=X24,"A",IF(V24-2=X24,"E",IF(V24-1=X24,"B",IF(V24=X24,"P",IF(V24+1=X24,"Bi",IF(V24+2=X24,"DB",IF(V24+2=X24,"DB+","DB+")))))))) -> DB+ | AF24: 5 | AG24: 7 | AH24: 6 | AI24: 2 | AJ24: 2 | AK24: 1 | AM24: Yes
A25: 7 | B25: 4 | C25: 2 | D25: 4 | E25: 3 | F25: 2 | I25: =IF(B$12="","",IF((B25+J25)-2>=D25-F25,"Yes","")) -> Yes | J25: =IF(ROUND(I$14,0)>=C25,IF((ROUND(I$14,0)-18)>=C25,2,1),0) -> 1 | K25: =IF(D25=1,"H1",IF(B25-3=D25,"A",IF(B25-2=D25,"E",IF(B25-1=D25,"B",IF(B25=D25,"P",IF(B25+1=D25,"Bi",IF(B25+2=D25,"DB",IF(B25+2=D25,"DB+","DB+")))))))) -> P | L25: 4 | M25: 10 | N25: 5 | O25: 2 | P25: 2 | S25: =IF(L$12="","",IF((L25+T25)-2>=N25-P25,"Yes","")) -> Yes | T25: =IF(ROUND(S$14,0)>=M25,IF((ROUND(S$14,0)-18)>=M25,2,1),0) -> 1 | U25: =IF(N25=1,"H1",IF(L25-3=N25,"A",IF(L25-2=N25,"E",IF(L25-1=N25,"B",IF(L25=N25,"P",IF(L25+1=N25,"Bi",IF(L25+2=N25,"DB",IF(L25+2=N25,"DB+","DB+")))))))) -> Bi | V25: 4 | W25: 6 | X25: 6 | Y25: 1 | Z25: 0 | AC25: =IF(V$12="","",IF((V25+AD25)-2>=X25-Z25,"Yes","")) ->  | AD25: =IF(ROUND(AC$14,0)>=W25,IF((ROUND(AC$14,0)-18)>=W25,2,1),0) -> 1 | AE25: =IF(X25=1,"H1",IF(V25-3=X25,"A",IF(V25-2=X25,"E",IF(V25-1=X25,"B",IF(V25=X25,"P",IF(V25+1=X25,"Bi",IF(V25+2=X25,"DB",IF(V25+2=X25,"DB+","DB+")))))))) -> DB | AF25: 3 | AG25: 15 | AH25: 5 | AI25: 0 | AJ25: 2
A26: 8 | B26: 3 | C26: 18 | D26: 4 | E26: 1 | F26: 2 | I26: =IF(B$12="","",IF((B26+J26)-2>=D26-F26,"Yes","")) ->  | J26: =IF(ROUND(I$14,0)>=C26,IF((ROUND(I$14,0)-18)>=C26,2,1),0) -> 0 | K26: =IF(D26=1,"H1",IF(B26-3=D26,"A",IF(B26-2=D26,"E",IF(B26-1=D26,"B",IF(B26=D26,"P",IF(B26+1=D26,"Bi",IF(B26+2=D26,"DB",IF(B26+2=D26,"DB+","DB+")))))))) -> Bi | L26: 5 | M26: 14 | N26: 5 | O26: 3 | P26: 1 | Q26: 1 | S26: =IF(L$12="","",IF((L26+T26)-2>=N26-P26,"Yes","")) -> Yes | T26: =IF(ROUND(S$14,0)>=M26,IF((ROUND(S$14,0)-18)>=M26,2,1),0) -> 1 | U26: =IF(N26=1,"H1",IF(L26-3=N26,"A",IF(L26-2=N26,"E",IF(L26-1=N26,"B",IF(L26=N26,"P",IF(L26+1=N26,"Bi",IF(L26+2=N26,"DB",IF(L26+2=N26,"DB+","DB+")))))))) -> P | V26: 3 | W26: 12 | X26: 4 | Y26: 2 | Z26: 2 | AC26: =IF(V$12="","",IF((V26+AD26)-2>=X26-Z26,"Yes","")) -> Yes | AD26: =IF(ROUND(AC$14,0)>=W26,IF((ROUND(AC$14,0)-18)>=W26,2,1),0) -> 1 | AE26: =IF(X26=1,"H1",IF(V26-3=X26,"A",IF(V26-2=X26,"E",IF(V26-1=X26,"B",IF(V26=X26,"P",IF(V26+1=X26,"Bi",IF(V26+2=X26,"DB",IF(V26+2=X26,"DB+","DB+")))))))) -> Bi | AF26: 5 | AG26: 5 | AH26: 7 | AI26: 1 | AJ26: 2 | AK26: 1
A27: 9 | B27: 4 | C27: 8 | D27: 10 | E27: 0 | F27: 3 | G27: 1 | H27: 1 | I27: =IF(B$12="","",IF((B27+J27)-2>=D27-F27,"Yes","")) ->  | J27: =IF(ROUND(I$14,0)>=C27,IF((ROUND(I$14,0)-18)>=C27,2,1),0) -> 1 | K27: =IF(D27=1,"H1",IF(B27-3=D27,"A",IF(B27-2=D27,"E",IF(B27-1=D27,"B",IF(B27=D27,"P",IF(B27+1=D27,"Bi",IF(B27+2=D27,"DB",IF(B27+2=D27,"DB+","DB+")))))))) -> DB+ | L27: 4 | M27: 2 | N27: 6 | O27: 1 | P27: 2 | Q27: 1 | S27: =IF(L$12="","",IF((L27+T27)-2>=N27-P27,"Yes","")) ->  | T27: =IF(ROUND(S$14,0)>=M27,IF((ROUND(S$14,0)-18)>=M27,2,1),0) -> 1 | U27: =IF(N27=1,"H1",IF(L27-3=N27,"A",IF(L27-2=N27,"E",IF(L27-1=N27,"B",IF(L27=N27,"P",IF(L27+1=N27,"Bi",IF(L27+2=N27,"DB",IF(L27+2=N27,"DB+","DB+")))))))) -> DB | V27: 4 | W27: 16 | X27: 5 | Y27: 1 | Z27: 2 | AA27: 1 | AC27: =IF(V$12="","",IF((V27+AD27)-2>=X27-Z27,"Yes","")) ->  | AD27: =IF(ROUND(AC$14,0)>=W27,IF((ROUND(AC$14,0)-18)>=W27,2,1),0) -> 0 | AE27: =IF(X27=1,"H1",IF(V27-3=X27,"A",IF(V27-2=X27,"E",IF(V27-1=X27,"B",IF(V27=X27,"P",IF(V27+1=X27,"Bi",IF(V27+2=X27,"DB",IF(V27+2=X27,"DB+","DB+")))))))) -> Bi | AF27: 4 | AG27: 17 | AH27: 5 | AI27: 1 | AJ27: 3 | AK27: 1 | AM27: Yes
A28: 10 | B28: 3 | C28: 16 | D28: 3 | E28: 2 | F28: 1 | I28: =IF(B$12="","",IF((B28+J28)-2>=D28-F28,"Yes","")) ->  | J28: =IF(ROUND(I$14,0)>=C28,IF((ROUND(I$14,0)-18)>=C28,2,1),0) -> 0 | K28: =IF(D28=1,"H1",IF(B28-3=D28,"A",IF(B28-2=D28,"E",IF(B28-1=D28,"B",IF(B28=D28,"P",IF(B28+1=D28,"Bi",IF(B28+2=D28,"DB",IF(B28+2=D28,"DB+","DB+")))))))) -> P | L28: 5 | M28: 17 | N28: 6 | O28: 1 | P28: 2 | S28: =IF(L$12="","",IF((L28+T28)-2>=N28-P28,"Yes","")) ->  | T28: =IF(ROUND(S$14,0)>=M28,IF((ROUND(S$14,0)-18)>=M28,2,1),0) -> 0 | U28: =IF(N28=1,"H1",IF(L28-3=N28,"A",IF(L28-2=N28,"E",IF(L28-1=N28,"B",IF(L28=N28,"P",IF(L28+1=N28,"Bi",IF(L28+2=N28,"DB",IF(L28+2=N28,"DB+","DB+")))))))) -> Bi | V28: 4 | W28: 5 | X28: 5 | Y28: 2 | Z28: 1 | AC28: =IF(V$12="","",IF((V28+AD28)-2>=X28-Z28,"Yes","")) ->  | AD28: =IF(ROUND(AC$14,0)>=W28,IF((ROUND(AC$14,0)-18)>=W28,2,1),0) -> 1 | AE28: =IF(X28=1,"H1",IF(V28-3=X28,"A",IF(V28-2=X28,"E",IF(V28-1=X28,"B",IF(V28=X28,"P",IF(V28+1=X28,"Bi",IF(V28+2=X28,"DB",IF(V28+2=X28,"DB+","DB+")))))))) -> Bi | AF28: 4 | AG28: 6 | AH28: 6 | AI28: 1 | AJ28: 2 | AK28: 1
A29: 11 | B29: 4 | C29: 14 | D29: 5 | E29: 2 | F29: 3 | I29: =IF(B$12="","",IF((B29+J29)-2>=D29-F29,"Yes","")) -> Yes | J29: =IF(ROUND(I$14,0)>=C29,IF((ROUND(I$14,0)-18)>=C29,2,1),0) -> 1 | K29: =IF(D29=1,"H1",IF(B29-3=D29,"A",IF(B29-2=D29,"E",IF(B29-1=D29,"B",IF(B29=D29,"P",IF(B29+1=D29,"Bi",IF(B29+2=D29,"DB",IF(B29+2=D29,"DB+","DB+")))))))) -> Bi | L29: 4 | M29: 7 | N29: 5 | O29: 2 | P29: 2 | Q29: 1 | S29: =IF(L$12="","",IF((L29+T29)-2>=N29-P29,"Yes","")) -> Yes | T29: =IF(ROUND(S$14,0)>=M29,IF((ROUND(S$14,0)-18)>=M29,2,1),0) -> 1 | U29: =IF(N29=1,"H1",IF(L29-3=N29,"A",IF(L29-2=N29,"E",IF(L29-1=N29,"B",IF(L29=N29,"P",IF(L29+1=N29,"Bi",IF(L29+2=N29,"DB",IF(L29+2=N29,"DB+","DB+")))))))) -> Bi | V29: 4 | W29: 11 | X29: 6 | Y29: 1 | Z29: 1 | AA29: 1 | AC29: =IF(V$12="","",IF((V29+AD29)-2>=X29-Z29,"Yes","")) ->  | AD29: =IF(ROUND(AC$14,0)>=W29,IF((ROUND(AC$14,0)-18)>=W29,2,1),0) -> 1 | AE29: =IF(X29=1,"H1",IF(V29-3=X29,"A",IF(V29-2=X29,"E",IF(V29-1=X29,"B",IF(V29=X29,"P",IF(V29+1=X29,"Bi",IF(V29+2=X29,"DB",IF(V29+2=X29,"DB+","DB+")))))))) -> DB | AF29: 5 | AG29: 10 | AH29: 7 | AI29: 1 | AJ29: 2 | AK29: 1
A30: 12 | B30: 4 | C30: 6 | D30: 5 | E30: 2 | F30: 2 | I30: =IF(B$12="","",IF((B30+J30)-2>=D30-F30,"Yes","")) -> Yes | J30: =IF(ROUND(I$14,0)>=C30,IF((ROUND(I$14,0)-18)>=C30,2,1),0) -> 1 | K30: =IF(D30=1,"H1",IF(B30-3=D30,"A",IF(B30-2=D30,"E",IF(B30-1=D30,"B",IF(B30=D30,"P",IF(B30+1=D30,"Bi",IF(B30+2=D30,"DB",IF(B30+2=D30,"DB+","DB+")))))))) -> Bi | L30: 3 | M30: 5 | N30: 7 | O30: 0 | P30: 2 | R30: 1 | S30: =IF(L$12="","",IF((L30+T30)-2>=N30-P30,"Yes","")) ->  | T30: =IF(ROUND(S$14,0)>=M30,IF((ROUND(S$14,0)-18)>=M30,2,1),0) -> 1 | U30: =IF(N30=1,"H1",IF(L30-3=N30,"A",IF(L30-2=N30,"E",IF(L30-1=N30,"B",IF(L30=N30,"P",IF(L30+1=N30,"Bi",IF(L30+2=N30,"DB",IF(L30+2=N30,"DB+","DB+")))))))) -> DB+ | V30: 3 | W30: 13 | X30: 4 | Y30: 2 | Z30: 1 | AC30: =IF(V$12="","",IF((V30+AD30)-2>=X30-Z30,"Yes","")) ->  | AD30: =IF(ROUND(AC$14,0)>=W30,IF((ROUND(AC$14,0)-18)>=W30,2,1),0) -> 1 | AE30: =IF(X30=1,"H1",IF(V30-3=X30,"A",IF(V30-2=X30,"E",IF(V30-1=X30,"B",IF(V30=X30,"P",IF(V30+1=X30,"Bi",IF(V30+2=X30,"DB",IF(V30+2=X30,"DB+","DB+")))))))) -> Bi | AF30: 4 | AG30: 14 | AH30: 4 | AI30: 3 | AJ30: 2 | AK30: 1 | AM30: Yes
A31: 13 | B31: 4 | C31: 1 | D31: 6 | E31: 1 | F31: 1 | G31: 1 | I31: =IF(B$12="","",IF((B31+J31)-2>=D31-F31,"Yes","")) ->  | J31: =IF(ROUND(I$14,0)>=C31,IF((ROUND(I$14,0)-18)>=C31,2,1),0) -> 1 | K31: =IF(D31=1,"H1",IF(B31-3=D31,"A",IF(B31-2=D31,"E",IF(B31-1=D31,"B",IF(B31=D31,"P",IF(B31+1=D31,"Bi",IF(B31+2=D31,"DB",IF(B31+2=D31,"DB+","DB+")))))))) -> DB | L31: 4 | M31: 1 | N31: 5 | O31: 2 | P31: 2 | S31: =IF(L$12="","",IF((L31+T31)-2>=N31-P31,"Yes","")) -> Yes | T31: =IF(ROUND(S$14,0)>=M31,IF((ROUND(S$14,0)-18)>=M31,2,1),0) -> 1 | U31: =IF(N31=1,"H1",IF(L31-3=N31,"A",IF(L31-2=N31,"E",IF(L31-1=N31,"B",IF(L31=N31,"P",IF(L31+1=N31,"Bi",IF(L31+2=N31,"DB",IF(L31+2=N31,"DB+","DB+")))))))) -> Bi | V31: 5 | W31: 1 | X31: 8 | Y31: 0 | Z31: 2 | AC31: =IF(V$12="","",IF((V31+AD31)-2>=X31-Z31,"Yes","")) ->  | AD31: =IF(ROUND(AC$14,0)>=W31,IF((ROUND(AC$14,0)-18)>=W31,2,1),0) -> 1 | AE31: =IF(X31=1,"H1",IF(V31-3=X31,"A",IF(V31-2=X31,"E",IF(V31-1=X31,"B",IF(V31=X31,"P",IF(V31+1=X31,"Bi",IF(V31+2=X31,"DB",IF(V31+2=X31,"DB+","DB+")))))))) -> DB+ | AF31: 3 | AG31: 18 | AH31: 5 | AI31: 0 | AJ31: 2
A32: 14 | B32: 4 | C32: 10 | D32: 4 | E32: 3 | F32: 2 | I32: =IF(B$12="","",IF((B32+J32)-2>=D32-F32,"Yes","")) -> Yes | J32: =IF(ROUND(I$14,0)>=C32,IF((ROUND(I$14,0)-18)>=C32,2,1),0) -> 1 | K32: =IF(D32=1,"H1",IF(B32-3=D32,"A",IF(B32-2=D32,"E",IF(B32-1=D32,"B",IF(B32=D32,"P",IF(B32+1=D32,"Bi",IF(B32+2=D32,"DB",IF(B32+2=D32,"DB+","DB+")))))))) -> P | L32: 4 | M32: 3 | N32: 7 | O32: 0 | P32: 2 | Q32: 1 | R32: 1 | S32: =IF(L$12="","",IF((L32+T32)-2>=N32-P32,"Yes","")) ->  | T32: =IF(ROUND(S$14,0)>=M32,IF((ROUND(S$14,0)-18)>=M32,2,1),0) -> 1 | U32: =IF(N32=1,"H1",IF(L32-3=N32,"A",IF(L32-2=N32,"E",IF(L32-1=N32,"B",IF(L32=N32,"P",IF(L32+1=N32,"Bi",IF(L32+2=N32,"DB",IF(L32+2=N32,"DB+","DB+")))))))) -> DB+ | V32: 3 | W32: 17 | X32: 4 | Y32: 1 | Z32: 1 | AC32: =IF(V$12="","",IF((V32+AD32)-2>=X32-Z32,"Yes","")) ->  | AD32: =IF(ROUND(AC$14,0)>=W32,IF((ROUND(AC$14,0)-18)>=W32,2,1),0) -> 0 | AE32: =IF(X32=1,"H1",IF(V32-3=X32,"A",IF(V32-2=X32,"E",IF(V32-1=X32,"B",IF(V32=X32,"P",IF(V32+1=X32,"Bi",IF(V32+2=X32,"DB",IF(V32+2=X32,"DB+","DB+")))))))) -> Bi | AF32: 5 | AG32: 2 | AH32: 7 | AI32: 1 | AJ32: 1 | AK32: 1
A33: 15 | B33: 4 | C33: 4 | D33: 5 | E33: 2 | F33: 2 | I33: =IF(B$12="","",IF((B33+J33)-2>=D33-F33,"Yes","")) -> Yes | J33: =IF(ROUND(I$14,0)>=C33,IF((ROUND(I$14,0)-18)>=C33,2,1),0) -> 1 | K33: =IF(D33=1,"H1",IF(B33-3=D33,"A",IF(B33-2=D33,"E",IF(B33-1=D33,"B",IF(B33=D33,"P",IF(B33+1=D33,"Bi",IF(B33+2=D33,"DB",IF(B33+2=D33,"DB+","DB+")))))))) -> Bi | L33: 5 | M33: 13 | N33: 5 | O33: 3 | P33: 2 | Q33: 1 | S33: =IF(L$12="","",IF((L33+T33)-2>=N33-P33,"Yes","")) -> Yes | T33: =IF(ROUND(S$14,0)>=M33,IF((ROUND(S$14,0)-18)>=M33,2,1),0) -> 1 | U33: =IF(N33=1,"H1",IF(L33-3=N33,"A",IF(L33-2=N33,"E",IF(L33-1=N33,"B",IF(L33=N33,"P",IF(L33+1=N33,"Bi",IF(L33+2=N33,"DB",IF(L33+2=N33,"DB+","DB+")))))))) -> P | V33: 4 | W33: 15 | X33: 4 | Y33: 2 | Z33: 2 | AA33: 1 | AC33: =IF(V$12="","",IF((V33+AD33)-2>=X33-Z33,"Yes","")) -> Yes | AD33: =IF(ROUND(AC$14,0)>=W33,IF((ROUND(AC$14,0)-18)>=W33,2,1),0) -> 0 | AE33: =IF(X33=1,"H1",IF(V33-3=X33,"A",IF(V33-2=X33,"E",IF(V33-1=X33,"B",IF(V33=X33,"P",IF(V33+1=X33,"Bi",IF(V33+2=X33,"DB",IF(V33+2=X33,"DB+","DB+")))))))) -> P | AF33: 3 | AG33: 12 | AH33: 4 | AI33: 2 | AJ33: 3 | AM33: Yes
A34: 16 | B34: 3 | C34: 12 | D34: 4 | E34: 2 | F34: 2 | I34: =IF(B$12="","",IF((B34+J34)-2>=D34-F34,"Yes","")) -> Yes | J34: =IF(ROUND(I$14,0)>=C34,IF((ROUND(I$14,0)-18)>=C34,2,1),0) -> 1 | K34: =IF(D34=1,"H1",IF(B34-3=D34,"A",IF(B34-2=D34,"E",IF(B34-1=D34,"B",IF(B34=D34,"P",IF(B34+1=D34,"Bi",IF(B34+2=D34,"DB",IF(B34+2=D34,"DB+","DB+")))))))) -> Bi | L34: 4 | M34: 15 | N34: 5 | O34: 1 | P34: 2 | Q34: 1 | S34: =IF(L$12="","",IF((L34+T34)-2>=N34-P34,"Yes","")) ->  | T34: =IF(ROUND(S$14,0)>=M34,IF((ROUND(S$14,0)-18)>=M34,2,1),0) -> 0 | U34: =IF(N34=1,"H1",IF(L34-3=N34,"A",IF(L34-2=N34,"E",IF(L34-1=N34,"B",IF(L34=N34,"P",IF(L34+1=N34,"Bi",IF(L34+2=N34,"DB",IF(L34+2=N34,"DB+","DB+")))))))) -> Bi | V34: 4 | W34: 9 | X34: 5 | Y34: 2 | Z34: 2 | AA34: 1 | AC34: =IF(V$12="","",IF((V34+AD34)-2>=X34-Z34,"Yes","")) -> Yes | AD34: =IF(ROUND(AC$14,0)>=W34,IF((ROUND(AC$14,0)-18)>=W34,2,1),0) -> 1 | AE34: =IF(X34=1,"H1",IF(V34-3=X34,"A",IF(V34-2=X34,"E",IF(V34-1=X34,"B",IF(V34=X34,"P",IF(V34+1=X34,"Bi",IF(V34+2=X34,"DB",IF(V34+2=X34,"DB+","DB+")))))))) -> Bi | AF34: 4 | AG34: 8 | AH34: 5 | AI34: 2 | AJ34: 2 | AM34: Yes
A35: 17 | B35: 5 | C35: 7 | D35: 7 | E35: 1 | F35: 2 | G35: 1 | I35: =IF(B$12="","",IF((B35+J35)-2>=D35-F35,"Yes","")) ->  | J35: =IF(ROUND(I$14,0)>=C35,IF((ROUND(I$14,0)-18)>=C35,2,1),0) -> 1 | K35: =IF(D35=1,"H1",IF(B35-3=D35,"A",IF(B35-2=D35,"E",IF(B35-1=D35,"B",IF(B35=D35,"P",IF(B35+1=D35,"Bi",IF(B35+2=D35,"DB",IF(B35+2=D35,"DB+","DB+")))))))) -> DB | L35: 3 | M35: 11 | N35: 5 | O35: 1 | P35: 2 | S35: =IF(L$12="","",IF((L35+T35)-2>=N35-P35,"Yes","")) ->  | T35: =IF(ROUND(S$14,0)>=M35,IF((ROUND(S$14,0)-18)>=M35,2,1),0) -> 1 | U35: =IF(N35=1,"H1",IF(L35-3=N35,"A",IF(L35-2=N35,"E",IF(L35-1=N35,"B",IF(L35=N35,"P",IF(L35+1=N35,"Bi",IF(L35+2=N35,"DB",IF(L35+2=N35,"DB+","DB+")))))))) -> DB | V35: 5 | W35: 3 | X35: 7 | Y35: 1 | Z35: 2 | AA35: 1 | AC35: =IF(V$12="","",IF((V35+AD35)-2>=X35-Z35,"Yes","")) ->  | AD35: =IF(ROUND(AC$14,0)>=W35,IF((ROUND(AC$14,0)-18)>=W35,2,1),0) -> 1 | AE35: =IF(X35=1,"H1",IF(V35-3=X35,"A",IF(V35-2=X35,"E",IF(V35-1=X35,"B",IF(V35=X35,"P",IF(V35+1=X35,"Bi",IF(V35+2=X35,"DB",IF(V35+2=X35,"DB+","DB+")))))))) -> DB | AF35: 4 | AG35: 16 | AH35: 5 | AI35: 1 | AJ35: 2 | AK35: 1
A36: 18 | B36: 4 | C36: 17 | D36: 4 | E36: 2 | F36: 2 | I36: =IF(B$12="","",IF((B36+J36)-2>=D36-F36,"Yes","")) -> Yes | J36: =IF(ROUND(I$14,0)>=C36,IF((ROUND(I$14,0)-18)>=C36,2,1),0) -> 0 | K36: =IF(D36=1,"H1",IF(B36-3=D36,"A",IF(B36-2=D36,"E",IF(B36-1=D36,"B",IF(B36=D36,"P",IF(B36+1=D36,"Bi",IF(B36+2=D36,"DB",IF(B36+2=D36,"DB+","DB+")))))))) -> P | L36: 4 | M36: 9 | N36: 7 | O36: 0 | P36: 4 | S36: =IF(L$12="","",IF((L36+T36)-2>=N36-P36,"Yes","")) -> Yes | T36: =IF(ROUND(S$14,0)>=M36,IF((ROUND(S$14,0)-18)>=M36,2,1),0) -> 1 | U36: =IF(N36=1,"H1",IF(L36-3=N36,"A",IF(L36-2=N36,"E",IF(L36-1=N36,"B",IF(L36=N36,"P",IF(L36+1=N36,"Bi",IF(L36+2=N36,"DB",IF(L36+2=N36,"DB+","DB+")))))))) -> DB+ | V36: 4 | W36: 7 | X36: 4 | Y36: 3 | Z36: 0 | AA36: 1 | AC36: =IF(V$12="","",IF((V36+AD36)-2>=X36-Z36,"Yes","")) ->  | AD36: =IF(ROUND(AC$14,0)>=W36,IF((ROUND(AC$14,0)-18)>=W36,2,1),0) -> 1 | AE36: =IF(X36=1,"H1",IF(V36-3=X36,"A",IF(V36-2=X36,"E",IF(V36-1=X36,"B",IF(V36=X36,"P",IF(V36+1=X36,"Bi",IF(V36+2=X36,"DB",IF(V36+2=X36,"DB+","DB+")))))))) -> P | AF36: 4 | AG36: 4 | AH36: 7 | AI36: 0 | AJ36: 2
A37: Totals | B37: =IF(B12="","",SUM(B19:B36)) -> 70 | D37: =IF(B12="","",SUM(D19:D36)) -> 95 | E37: =IF(B12="","",SUM(E19:E36)) -> 31 | F37: =IF(B12="","",SUM(F19:F36)) -> 38 | G37: =IF(B12="","",SUM(G19:G36)) -> 5 | H37: =IF(B12="","",SUM(H19:H36)) -> 2 | I37: =IF(COUNTIF(I19:I36,"=Yes")=0,"",COUNTIF(I19:I36,"=Yes")) -> 11 | L37: =IF(L12="","",SUM(L19:L36)) -> 72 | N37: =IF(L12="","",SUM(N19:N36)) -> 96 | O37: =IF(L12="","",SUM(O19:O36)) -> 27 | P37: =IF(L12="","",SUM(P19:P36)) -> 38 | Q37: =IF(L12="","",SUM(Q19:Q36)) -> 9 | R37: =IF(L12="","",SUM(R19:R36)) -> 2 | S37: =IF(COUNTIF(S19:S36,"=Yes")=0,"",COUNTIF(S19:S36,"=Yes")) -> 11 | V37: =IF(V12="","",SUM(V19:V36)) -> 72 | X37: =IF(V12="","",SUM(X19:X36)) -> 92 | Y37: =IF(V12="","",SUM(Y19:Y36)) -> 30 | Z37: =IF(V12="","",SUM(Z19:Z36)) -> 26 | AA37: =IF(V12="","",SUM(AA19:AA36)) -> 9 | AB37: =IF(V12="","",SUM(AB19:AB36)) -> 0 | AC37: =IF(COUNTIF(AC19:AC36,"=Yes")=0,"",COUNTIF(AC19:AC36,"=Yes")) -> 6 | AF37: =IF(AF12="","",SUM(AF19:AF36)) -> 72 | AH37: =IF(AF12="","",SUM(AH19:AH36)) -> 99 | AI37: =IF(AF12="","",SUM(AI19:AI36)) -> 24 | AJ37: =IF(AF12="","",SUM(AJ19:AJ36)) -> 37 | AK37: =IF(AF12="","",SUM(AK19:AK36)) -> 12 | AL37: =IF(AF12="","",SUM(AL19:AL36)) -> 1 | AM37: =IF(COUNTIF(AM19:AM36,"=Yes")=0,"",COUNTIF(AM19:AM36,"=Yes")) -> 8
A39: Club | B39: Wycombe Heights
A40: Par/SS | B40: 70/72 | D40: Num. Of Fairways | I40: =IF(B39="","",18-(COUNTIF(B46:B63,3))) -> 14 | N40: Num. Of Fairways | S40: =IF(L39="","",18-(COUNTIF(L46:L63,3))) ->  | X40: Num. Of Fairways | AC40: =IF(V39="","",18-(COUNTIF(V46:V63,3))) ->  | AH40: Num. Of Fairways | AM40: =IF(AF39="","",18-(COUNTIF(AF46:AF63,3))) -> 
A41: Date | B41: 36651 | D41: Playing Handicap | I41: 14.6 | N41: Playing Handicap | S41: 14.7 | X41: Playing Handicap | AH41: Playing Handicap
A42: Event Place | B42: 1 | D42: Prize Money | G42: 7500 | N42: Prize Money | X42: Prize Money | AH42: Prize Money
A43: Game Stats | B43: DB+ | C43: DB | D43: Bi | E43: P | F43: B | G43: E | H43: A | I43: H1 | L43: DB+ | M43: DB | N43: BI | O43: P | P43: B | Q43: E | R43: A | S43: H1 | V43: DB+ | W43: DB | X43: Bi | Y43: P | Z43: B | AA43: E | AB43: A | AC43: H1 | AF43: DB+ | AG43: DB | AH43: Bi | AI43: P | AJ43: B | AK43: E | AL43: A | AM43: H1
B44: =IF(B39="","",IF(COUNTIF($K46:$K63,"=DB+")="","",COUNTIF($K46:$K64,"=DB+"))) -> 1 | C44: =IF(B39="","",IF(COUNTIF($K46:$K63,"=DB")="","",COUNTIF($K46:$K64,"=DB"))) -> 5 | D44: =IF(B39="","",IF(COUNTIF($K46:$K63,"=Bi")="","",COUNTIF($K46:$K64,"=Bi"))) -> 7 | E44: =IF(B39="","",IF(COUNTIF($K46:$K63,"=P")="","",COUNTIF($K46:$K64,"=P"))) -> 5 | F44: =IF(B39="","",IF(COUNTIF($K46:$K63,"=B")="","",COUNTIF($K46:$K64,"=B"))) -> 0 | G44: =IF(B39="","",IF(COUNTIF($K46:$K63,"=E")="","",COUNTIF($K46:$K64,"=E"))) -> 0 | H44: =IF(B39="","",IF(COUNTIF($K46:$K63,"=A")="","",COUNTIF($K46:$K64,"=A"))) -> 0 | I44: =IF(B39="","",IF(COUNTIF($K46:$K63,"=H1")="","",COUNTIF($K46:$K64,"=H1"))) -> 0 | L44: =IF(L39="","",IF(COUNTIF($U46:$U63,"=DB+")="","",COUNTIF($U46:$U64,"=DB+"))) ->  | M44: =IF(L39="","",IF(COUNTIF($U46:$U63,"=DB")="","",COUNTIF($U46:$U64,"=DB"))) ->  | N44: =IF(L39="","",IF(COUNTIF($U46:$U63,"=Bi")="","",COUNTIF($U46:$U64,"=Bi"))) ->  | O44: =IF(L39="","",IF(COUNTIF($U46:$U63,"=P")="","",COUNTIF($U46:$U64,"=P"))) ->  | P44: =IF(L39="","",IF(COUNTIF($U46:$U63,"=B")="","",COUNTIF($U46:$U64,"=B"))) ->  | Q44: =IF(L39="","",IF(COUNTIF($U46:$U63,"=E")="","",COUNTIF($U46:$U64,"=E"))) ->  | R44: =IF(L39="","",IF(COUNTIF($U46:$U63,"=A")="","",COUNTIF($U46:$U64,"=A"))) ->  | S44: =IF(L39="","",IF(COUNTIF($U46:$U63,"=H1")="","",COUNTIF($U46:$U64,"=H1"))) ->  | V44: =IF(V39="","",IF(COUNTIF($AE46:$AE63,"=DB+")="","",COUNTIF($AE46:$AE64,"=DB+"))) ->  | W44: =IF(V39="","",IF(COUNTIF($AE46:$AE63,"=DB")="","",COUNTIF($AE46:$AE64,"=DB"))) ->  | X44: =IF(V39="","",IF(COUNTIF($AE46:$AE63,"=Bi")="","",COUNTIF($AE46:$AE64,"=Bi"))) ->  | Y44: =IF(V39="","",IF(COUNTIF($AE46:$AE63,"=P")="","",COUNTIF($AE46:$AE64,"=P"))) ->  | Z44: =IF(V39="","",IF(COUNTIF($AE46:$AE63,"=B")="","",COUNTIF($AE46:$AE64,"=B"))) ->  | AA44: =IF(V39="","",IF(COUNTIF($AE46:$AE63,"=E")="","",COUNTIF($AE46:$AE64,"=E"))) ->  | AB44: =IF(V39="","",IF(COUNTIF($AE46:$AE63,"=A")="","",COUNTIF($AE46:$AE64,"=A"))) ->  | AC44: =IF(V39="","",IF(COUNTIF($AE46:$AE63,"=H1")="","",COUNTIF($AE46:$AE64,"=H1"))) -> 
A45: Hole No | B45: Par | C45: Stroke Index | D45: Gross Score | E45: Points | F45: Putts | G45: Fairways | H45: Ferrets | I45: Green Regulation | L45: Par | M45: Stroke Index | N45: Gross Score | O45: Points | P45: Putts | Q45: Fairways | R45: Ferrets | S45: Green Regulation | V45: Par | W45: Stroke Index | X45: Gross Score | Y45: Points | Z45: Putts | AA45: Fairways | AB45: Ferrets | AC45: Green Regulation | AF45: Par | AG45: Stroke Index | AH45: Gross Score | AI45: Points | AJ45: Putts | AK45: Fairways | AL45: Ferrets | AM45: Green Regulation
A46: 1 | B46: 4 | C46: 3 | D46: 4 | E46: 3 | F46: 1 | I46: =IF(B$39="","",IF((B46+J46)-2>=D46-F46,"Yes","")) -> Yes | J46: =IF(ROUND(I$14,0)>=C46,IF((ROUND(I$14,0)-18)>=C46,2,1),0) -> 1 | K46: =IF(D46=1,"H1",IF(B46-3=D46,"A",IF(B46-2=D46,"E",IF(B46-1=D46,"B",IF(B46=D46,"P",IF(B46+1=D46,"Bi",IF(B46+2=D46,"DB",IF(B46+2=D46,"DB+","DB+")))))))) -> P | S46: =IF(L$39="","",IF((L46+T46)-2>=N46-P46,"Yes","")) ->  | T46: =IF(ROUND(S$14,0)>=M46,IF((ROUND(S$14,0)-18)>=M46,2,1),0) -> 0 | U46: =IF(N46=1,"H1",IF(L46-3=N46,"A",IF(L46-2=N46,"E",IF(L46-1=N46,"B",IF(L46=N46,"P",IF(L46+1=N46,"Bi",IF(L46+2=N46,"DB",IF(L46+2=N46,"DB+","DB+")))))))) -> ####### | AC46: =IF(V$39="","",IF((V46+AD46)-2>=X46-Z46,"Yes","")) ->  | AD46: =IF(ROUND(AC$14,0)>=W46,IF((ROUND(AC$14,0)-18)>=W46,2,1),0) -> 0 | AE46: =IF(X46=1,"H1",IF(V46-3=X46,"A",IF(V46-2=X46,"E",IF(V46-1=X46,"B",IF(V46=X46,"P",IF(V46+1=X46,"Bi",IF(V46+2=X46,"DB",IF(V46+2=X46,"DB+","DB+")))))))) -> #######
A47: 2 | B47: 3 | C47: 15 | D47: 3 | E47: 2 | F47: 2 | I47: =IF(B$39="","",IF((B47+J47)-2>=D47-F47,"Yes","")) -> Yes | J47: =IF(ROUND(I$14,0)>=C47,IF((ROUND(I$14,0)-18)>=C47,2,1),0) -> 0 | K47: =IF(D47=1,"H1",IF(B47-3=D47,"A",IF(B47-2=D47,"E",IF(B47-1=D47,"B",IF(B47=D47,"P",IF(B47+1=D47,"Bi",IF(B47+2=D47,"DB",IF(B47+2=D47,"DB+","DB+")))))))) -> P | S47: =IF(L$39="","",IF((L47+T47)-2>=N47-P47,"Yes","")) ->  | T47: =IF(ROUND(S$14,0)>=M47,IF((ROUND(S$14,0)-18)>=M47,2,1),0) -> 0 | U47: =IF(N47=1,"H1",IF(L47-3=N47,"A",IF(L47-2=N47,"E",IF(L47-1=N47,"B",IF(L47=N47,"P",IF(L47+1=N47,"Bi",IF(L47+2=N47,"DB",IF(L47+2=N47,"DB+","DB+")))))))) -> ####### | AC47: =IF(V$39="","",IF((V47+AD47)-2>=X47-Z47,"Yes","")) ->  | AD47: =IF(ROUND(AC$14,0)>=W47,IF((ROUND(AC$14,0)-18)>=W47,2,1),0) -> 0 | AE47: =IF(X47=1,"H1",IF(V47-3=X47,"A",IF(V47-2=X47,"E",IF(V47-1=X47,"B",IF(V47=X47,"P",IF(V47+1=X47,"Bi",IF(V47+2=X47,"DB",IF(V47+2=X47,"DB+","DB+")))))))) -> #######
A48: 3 | B48: 4 | C48: 11 | D48: 6 | E48: 1 | F48: 2 | I48: =IF(B$39="","",IF((B48+J48)-2>=D48-F48,"Yes","")) ->  | J48: =IF(ROUND(I$14,0)>=C48,IF((ROUND(I$14,0)-18)>=C48,2,1),0) -> 1 | K48: =IF(D48=1,"H1",IF(B48-3=D48,"A",IF(B48-2=D48,"E",IF(B48-1=D48,"B",IF(B48=D48,"P",IF(B48+1=D48,"Bi",IF(B48+2=D48,"DB",IF(B48+2=D48,"DB+","DB+")))))))) -> DB | S48: =IF(L$39="","",IF((L48+T48)-2>=N48-P48,"Yes","")) ->  | T48: =IF(ROUND(S$14,0)>=M48,IF((ROUND(S$14,0)-18)>=M48,2,1),0) -> 0 | U48: =IF(N48=1,"H1",IF(L48-3=N48,"A",IF(L48-2=N48,"E",IF(L48-1=N48,"B",IF(L48=N48,"P",IF(L48+1=N48,"Bi",IF(L48+2=N48,"DB",IF(L48+2=N48,"DB+","DB+")))))))) -> ####### | AC48: =IF(V$39="","",IF((V48+AD48)-2>=X48-Z48,"Yes","")) ->  | AD48: =IF(ROUND(AC$14,0)>=W48,IF((ROUND(AC$14,0)-18)>=W48,2,1),0) -> 0 | AE48: =IF(X48=1,"H1",IF(V48-3=X48,"A",IF(V48-2=X48,"E",IF(V48-1=X48,"B",IF(V48=X48,"P",IF(V48+1=X48,"Bi",IF(V48+2=X48,"DB",IF(V48+2=X48,"DB+","DB+")))))))) -> #######
A49: 4 | B49: 4 | C49: 9 | D49: 6 | E49: 1 | F49: 2 | I49: =IF(B$39="","",IF((B49+J49)-2>=D49-F49,"Yes","")) ->  | J49: =IF(ROUND(I$14,0)>=C49,IF((ROUND(I$14,0)-18)>=C49,2,1),0) -> 1 | K49: =IF(D49=1,"H1",IF(B49-3=D49,"A",IF(B49-2=D49,"E",IF(B49-1=D49,"B",IF(B49=D49,"P",IF(B49+1=D49,"Bi",IF(B49+2=D49,"DB",IF(B49+2=D49,"DB+","DB+")))))))) -> DB | S49: =IF(L$39="","",IF((L49+T49)-2>=N49-P49,"Yes","")) ->  | T49: =IF(ROUND(S$14,0)>=M49,IF((ROUND(S$14,0)-18)>=M49,2,1),0) -> 0 | U49: =IF(N49=1,"H1",IF(L49-3=N49,"A",IF(L49-2=N49,"E",IF(L49-1=N49,"B",IF(L49=N49,"P",IF(L49+1=N49,"Bi",IF(L49+2=N49,"DB",IF(L49+2=N49,"DB+","DB+")))))))) -> ####### | AC49: =IF(V$39="","",IF((V49+AD49)-2>=X49-Z49,"Yes","")) ->  | AD49: =IF(ROUND(AC$14,0)>=W49,IF((ROUND(AC$14,0)-18)>=W49,2,1),0) -> 0 | AE49: =IF(X49=1,"H1",IF(V49-3=X49,"A",IF(V49-2=X49,"E",IF(V49-1=X49,"B",IF(V49=X49,"P",IF(V49+1=X49,"Bi",IF(V49+2=X49,"DB",IF(V49+2=X49,"DB+","DB+")))))))) -> #######
A50: 5 | B50: 5 | C50: 13 | D50: 5 | E50: 3 | F50: 2 | G50: 1 | I50: =IF(B$39="","",IF((B50+J50)-2>=D50-F50,"Yes","")) -> Yes | J50: =IF(ROUND(I$14,0)>=C50,IF((ROUND(I$14,0)-18)>=C50,2,1),0) -> 1 | K50: =IF(D50=1,"H1",IF(B50-3=D50,"A",IF(B50-2=D50,"E",IF(B50-1=D50,"B",IF(B50=D50,"P",IF(B50+1=D50,"Bi",IF(B50+2=D50,"DB",IF(B50+2=D50,"DB+","DB+")))))))) -> P | S50: =IF(L$39="","",IF((L50+T50)-2>=N50-P50,"Yes","")) ->  | T50: =IF(ROUND(S$14,0)>=M50,IF((ROUND(S$14,0)-18)>=M50,2,1),0) -> 0 | U50: =IF(N50=1,"H1",IF(L50-3=N50,"A",IF(L50-2=N50,"E",IF(L50-1=N50,"B",IF(L50=N50,"P",IF(L50+1=N50,"Bi",IF(L50+2=N50,"DB",IF(L50+2=N50,"DB+","DB+")))))))) -> ####### | AC50: =IF(V$39="","",IF((V50+AD50)-2>=X50-Z50,"Yes","")) ->  | AD50: =IF(ROUND(AC$14,0)>=W50,IF((ROUND(AC$14,0)-18)>=W50,2,1),0) -> 0 | AE50: =IF(X50=1,"H1",IF(V50-3=X50,"A",IF(V50-2=X50,"E",IF(V50-1=X50,"B",IF(V50=X50,"P",IF(V50+1=X50,"Bi",IF(V50+2=X50,"DB",IF(V50+2=X50,"DB+","DB+")))))))) -> #######
A51: 6 | B51: 4 | C51: 5 | D51: 5 | E51: 2 | F51: 2 | I51: =IF(B$39="","",IF((B51+J51)-2>=D51-F51,"Yes","")) -> Yes | J51: =IF(ROUND(I$14,0)>=C51,IF((ROUND(I$14,0)-18)>=C51,2,1),0) -> 1 | K51: =IF(D51=1,"H1",IF(B51-3=D51,"A",IF(B51-2=D51,"E",IF(B51-1=D51,"B",IF(B51=D51,"P",IF(B51+1=D51,"Bi",IF(B51+2=D51,"DB",IF(B51+2=D51,"DB+","DB+")))))))) -> Bi | S51: =IF(L$39="","",IF((L51+T51)-2>=N51-P51,"Yes","")) ->  | T51: =IF(ROUND(S$14,0)>=M51,IF((ROUND(S$14,0)-18)>=M51,2,1),0) -> 0 | U51: =IF(N51=1,"H1",IF(L51-3=N51,"A",IF(L51-2=N51,"E",IF(L51-1=N51,"B",IF(L51=N51,"P",IF(L51+1=N51,"Bi",IF(L51+2=N51,"DB",IF(L51+2=N51,"DB+","DB+")))))))) -> ####### | AC51: =IF(V$39="","",IF((V51+AD51)-2>=X51-Z51,"Yes","")) ->  | AD51: =IF(ROUND(AC$14,0)>=W51,IF((ROUND(AC$14,0)-18)>=W51,2,1),0) -> 0 | AE51: =IF(X51=1,"H1",IF(V51-3=X51,"A",IF(V51-2=X51,"E",IF(V51-1=X51,"B",IF(V51=X51,"P",IF(V51+1=X51,"Bi",IF(V51+2=X51,"DB",IF(V51+2=X51,"DB+","DB+")))))))) -> #######
A52: 7 | B52: 4 | C52: 2 | D52: 6 | E52: 1 | F52: 2 | I52: =IF(B$39="","",IF((B52+J52)-2>=D52-F52,"Yes","")) ->  | J52: =IF(ROUND(I$14,0)>=C52,IF((ROUND(I$14,0)-18)>=C52,2,1),0) -> 1 | K52: =IF(D52=1,"H1",IF(B52-3=D52,"A",IF(B52-2=D52,"E",IF(B52-1=D52,"B",IF(B52=D52,"P",IF(B52+1=D52,"Bi",IF(B52+2=D52,"DB",IF(B52+2=D52,"DB+","DB+")))))))) -> DB | S52: =IF(L$39="","",IF((L52+T52)-2>=N52-P52,"Yes","")) ->  | T52: =IF(ROUND(S$14,0)>=M52,IF((ROUND(S$14,0)-18)>=M52,2,1),0) -> 0 | U52: =IF(N52=1,"H1",IF(L52-3=N52,"A",IF(L52-2=N52,"E",IF(L52-1=N52,"B",IF(L52=N52,"P",IF(L52+1=N52,"Bi",IF(L52+2=N52,"DB",IF(L52+2=N52,"DB+","DB+")))))))) -> ####### | AC52: =IF(V$39="","",IF((V52+AD52)-2>=X52-Z52,"Yes","")) ->  | AD52: =IF(ROUND(AC$14,0)>=W52,IF((ROUND(AC$14,0)-18)>=W52,2,1),0) -> 0 | AE52: =IF(X52=1,"H1",IF(V52-3=X52,"A",IF(V52-2=X52,"E",IF(V52-1=X52,"B",IF(V52=X52,"P",IF(V52+1=X52,"Bi",IF(V52+2=X52,"DB",IF(V52+2=X52,"DB+","DB+")))))))) -> #######
A53: 8 | B53: 3 | C53: 18 | D53: 4 | E53: 1 | F53: 2 | I53: =IF(B$39="","",IF((B53+J53)-2>=D53-F53,"Yes","")) ->  | J53: =IF(ROUND(I$14,0)>=C53,IF((ROUND(I$14,0)-18)>=C53,2,1),0) -> 0 | K53: =IF(D53=1,"H1",IF(B53-3=D53,"A",IF(B53-2=D53,"E",IF(B53-1=D53,"B",IF(B53=D53,"P",IF(B53+1=D53,"Bi",IF(B53+2=D53,"DB",IF(B53+2=D53,"DB+","DB+")))))))) -> Bi | S53: =IF(L$39="","",IF((L53+T53)-2>=N53-P53,"Yes","")) ->  | T53: =IF(ROUND(S$14,0)>=M53,IF((ROUND(S$14,0)-18)>=M53,2,1),0) -> 0 | U53: =IF(N53=1,"H1",IF(L53-3=N53,"A",IF(L53-2=N53,"E",IF(L53-1=N53,"B",IF(L53=N53,"P",IF(L53+1=N53,"Bi",IF(L53+2=N53,"DB",IF(L53+2=N53,"DB+","DB+")))))))) -> ####### | AC53: =IF(V$39="","",IF((V53+AD53)-2>=X53-Z53,"Yes","")) ->  | AD53: =IF(ROUND(AC$14,0)>=W53,IF((ROUND(AC$14,0)-18)>=W53,2,1),0) -> 0 | AE53: =IF(X53=1,"H1",IF(V53-3=X53,"A",IF(V53-2=X53,"E",IF(V53-1=X53,"B",IF(V53=X53,"P",IF(V53+1=X53,"Bi",IF(V53+2=X53,"DB",IF(V53+2=X53,"DB+","DB+")))))))) -> #######
A54: 9 | B54: 4 | C54: 8 | D54: 5 | E54: 2 | F54: 2 | G54: 1 | I54: =IF(B$39="","",IF((B54+J54)-2>=D54-F54,"Yes","")) -> Yes | J54: =IF(ROUND(I$14,0)>=C54,IF((ROUND(I$14,0)-18)>=C54,2,1),0) -> 1 | K54: =IF(D54=1,"H1",IF(B54-3=D54,"A",IF(B54-2=D54,"E",IF(B54-1=D54,"B",IF(B54=D54,"P",IF(B54+1=D54,"Bi",IF(B54+2=D54,"DB",IF(B54+2=D54,"DB+","DB+")))))))) -> Bi | S54: =IF(L$39="","",IF((L54+T54)-2>=N54-P54,"Yes","")) ->  | T54: =IF(ROUND(S$14,0)>=M54,IF((ROUND(S$14,0)-18)>=M54,2,1),0) -> 0 | U54: =IF(N54=1,"H1",IF(L54-3=N54,"A",IF(L54-2=N54,"E",IF(L54-1=N54,"B",IF(L54=N54,"P",IF(L54+1=N54,"Bi",IF(L54+2=N54,"DB",IF(L54+2=N54,"DB+","DB+")))))))) -> ####### | AC54: =IF(V$39="","",IF((V54+AD54)-2>=X54-Z54,"Yes","")) ->  | AD54: =IF(ROUND(AC$14,0)>=W54,IF((ROUND(AC$14,0)-18)>=W54,2,1),0) -> 0 | AE54: =IF(X54=1,"H1",IF(V54-3=X54,"A",IF(V54-2=X54,"E",IF(V54-1=X54,"B",IF(V54=X54,"P",IF(V54+1=X54,"Bi",IF(V54+2=X54,"DB",IF(V54+2=X54,"DB+","DB+")))))))) -> #######
A55: 10 | B55: 3 | C55: 16 | D55: 4 | E55: 1 | F55: 2 | I55: =IF(B$39="","",IF((B55+J55)-2>=D55-F55,"Yes","")) ->  | J55: =IF(ROUND(I$14,0)>=C55,IF((ROUND(I$14,0)-18)>=C55,2,1),0) -> 0 | K55: =IF(D55=1,"H1",IF(B55-3=D55,"A",IF(B55-2=D55,"E",IF(B55-1=D55,"B",IF(B55=D55,"P",IF(B55+1=D55,"Bi",IF(B55+2=D55,"DB",IF(B55+2=D55,"DB+","DB+")))))))) -> Bi | S55: =IF(L$39="","",IF((L55+T55)-2>=N55-P55,"Yes","")) ->  | T55: =IF(ROUND(S$14,0)>=M55,IF((ROUND(S$14,0)-18)>=M55,2,1),0) -> 0 | U55: =IF(N55=1,"H1",IF(L55-3=N55,"A",IF(L55-2=N55,"E",IF(L55-1=N55,"B",IF(L55=N55,"P",IF(L55+1=N55,"Bi",IF(L55+2=N55,"DB",IF(L55+2=N55,"DB+","DB+")))))))) -> ####### | AC55: =IF(V$39="","",IF((V55+AD55)-2>=X55-Z55,"Yes","")) ->  | AD55: =IF(ROUND(AC$14,0)>=W55,IF((ROUND(AC$14,0)-18)>=W55,2,1),0) -> 0 | AE55: =IF(X55=1,"H1",IF(V55-3=X55,"A",IF(V55-2=X55,"E",IF(V55-1=X55,"B",IF(V55=X55,"P",IF(V55+1=X55,"Bi",IF(V55+2=X55,"DB",IF(V55+2=X55,"DB+","DB+")))))))) -> #######
A56: 11 | B56: 4 | C56: 14 | D56: 6 | E56: 1 | F56: 2 | I56: =IF(B$39="","",IF((B56+J56)-2>=D56-F56,"Yes","")) ->  | J56: =IF(ROUND(I$14,0)>=C56,IF((ROUND(I$14,0)-18)>=C56,2,1),0) -> 1 | K56: =IF(D56=1,"H1",IF(B56-3=D56,"A",IF(B56-2=D56,"E",IF(B56-1=D56,"B",IF(B56=D56,"P",IF(B56+1=D56,"Bi",IF(B56+2=D56,"DB",IF(B56+2=D56,"DB+","DB+")))))))) -> DB | S56: =IF(L$39="","",IF((L56+T56)-2>=N56-P56,"Yes","")) ->  | T56: =IF(ROUND(S$14,0)>=M56,IF((ROUND(S$14,0)-18)>=M56,2,1),0) -> 0 | U56: =IF(N56=1,"H1",IF(L56-3=N56,"A",IF(L56-2=N56,"E",IF(L56-1=N56,"B",IF(L56=N56,"P",IF(L56+1=N56,"Bi",IF(L56+2=N56,"DB",IF(L56+2=N56,"DB+","DB+")))))))) -> ####### | AC56: =IF(V$39="","",IF((V56+AD56)-2>=X56-Z56,"Yes","")) ->  | AD56: =IF(ROUND(AC$14,0)>=W56,IF((ROUND(AC$14,0)-18)>=W56,2,1),0) -> 0 | AE56: =IF(X56=1,"H1",IF(V56-3=X56,"A",IF(V56-2=X56,"E",IF(V56-1=X56,"B",IF(V56=X56,"P",IF(V56+1=X56,"Bi",IF(V56+2=X56,"DB",IF(V56+2=X56,"DB+","DB+")))))))) -> #######
A57: 12 | B57: 4 | C57: 6 | D57: 5 | E57: 2 | F57: 3 | I57: =IF(B$39="","",IF((B57+J57)-2>=D57-F57,"Yes","")) -> Yes | J57: =IF(ROUND(I$14,0)>=C57,IF((ROUND(I$14,0)-18)>=C57,2,1),0) -> 1 | K57: =IF(D57=1,"H1",IF(B57-3=D57,"A",IF(B57-2=D57,"E",IF(B57-1=D57,"B",IF(B57=D57,"P",IF(B57+1=D57,"Bi",IF(B57+2=D57,"DB",IF(B57+2=D57,"DB+","DB+")))))))) -> Bi | S57: =IF(L$39="","",IF((L57+T57)-2>=N57-P57,"Yes","")) ->  | T57: =IF(ROUND(S$14,0)>=M57,IF((ROUND(S$14,0)-18)>=M57,2,1),0) -> 0 | U57: =IF(N57=1,"H1",IF(L57-3=N57,"A",IF(L57-2=N57,"E",IF(L57-1=N57,"B",IF(L57=N57,"P",IF(L57+1=N57,"Bi",IF(L57+2=N57,"DB",IF(L57+2=N57,"DB+","DB+")))))))) -> ####### | AC57: =IF(V$39="","",IF((V57+AD57)-2>=X57-Z57,"Yes","")) ->  | AD57: =IF(ROUND(AC$14,0)>=W57,IF((ROUND(AC$14,0)-18)>=W57,2,1),0) -> 0 | AE57: =IF(X57=1,"H1",IF(V57-3=X57,"A",IF(V57-2=X57,"E",IF(V57-1=X57,"B",IF(V57=X57,"P",IF(V57+1=X57,"Bi",IF(V57+2=X57,"DB",IF(V57+2=X57,"DB+","DB+")))))))) -> #######
A58: 13 | B58: 4 | C58: 1 | D58: 6 | E58: 1 | F58: 2 | I58: =IF(B$39="","",IF((B58+J58)-2>=D58-F58,"Yes","")) ->  | J58: =IF(ROUND(I$14,0)>=C58,IF((ROUND(I$14,0)-18)>=C58,2,1),0) -> 1 | K58: =IF(D58=1,"H1",IF(B58-3=D58,"A",IF(B58-2=D58,"E",IF(B58-1=D58,"B",IF(B58=D58,"P",IF(B58+1=D58,"Bi",IF(B58+2=D58,"DB",IF(B58+2=D58,"DB+","DB+")))))))) -> DB | S58: =IF(L$39="","",IF((L58+T58)-2>=N58-P58,"Yes","")) ->  | T58: =IF(ROUND(S$14,0)>=M58,IF((ROUND(S$14,0)-18)>=M58,2,1),0) -> 0 | U58: =IF(N58=1,"H1",IF(L58-3=N58,"A",IF(L58-2=N58,"E",IF(L58-1=N58,"B",IF(L58=N58,"P",IF(L58+1=N58,"Bi",IF(L58+2=N58,"DB",IF(L58+2=N58,"DB+","DB+")))))))) -> ####### | AC58: =IF(V$39="","",IF((V58+AD58)-2>=X58-Z58,"Yes","")) ->  | AD58: =IF(ROUND(AC$14,0)>=W58,IF((ROUND(AC$14,0)-18)>=W58,2,1),0) -> 0 | AE58: =IF(X58=1,"H1",IF(V58-3=X58,"A",IF(V58-2=X58,"E",IF(V58-1=X58,"B",IF(V58=X58,"P",IF(V58+1=X58,"Bi",IF(V58+2=X58,"DB",IF(V58+2=X58,"DB+","DB+")))))))) -> #######
A59: 14 | B59: 4 | C59: 10 | D59: 4 | E59: 3 | F59: 2 | G59: 1 | I59: =IF(B$39="","",IF((B59+J59)-2>=D59-F59,"Yes","")) -> Yes | J59: =IF(ROUND(I$14,0)>=C59,IF((ROUND(I$14,0)-18)>=C59,2,1),0) -> 1 | K59: =IF(D59=1,"H1",IF(B59-3=D59,"A",IF(B59-2=D59,"E",IF(B59-1=D59,"B",IF(B59=D59,"P",IF(B59+1=D59,"Bi",IF(B59+2=D59,"DB",IF(B59+2=D59,"DB+","DB+")))))))) -> P | S59: =IF(L$39="","",IF((L59+T59)-2>=N59-P59,"Yes","")) ->  | T59: =IF(ROUND(S$14,0)>=M59,IF((ROUND(S$14,0)-18)>=M59,2,1),0) -> 0 | U59: =IF(N59=1,"H1",IF(L59-3=N59,"A",IF(L59-2=N59,"E",IF(L59-1=N59,"B",IF(L59=N59,"P",IF(L59+1=N59,"Bi",IF(L59+2=N59,"DB",IF(L59+2=N59,"DB+","DB+")))))))) -> ####### | AC59: =IF(V$39="","",IF((V59+AD59)-2>=X59-Z59,"Yes","")) ->  | AD59: =IF(ROUND(AC$14,0)>=W59,IF((ROUND(AC$14,0)-18)>=W59,2,1),0) -> 0 | AE59: =IF(X59=1,"H1",IF(V59-3=X59,"A",IF(V59-2=X59,"E",IF(V59-1=X59,"B",IF(V59=X59,"P",IF(V59+1=X59,"Bi",IF(V59+2=X59,"DB",IF(V59+2=X59,"DB+","DB+")))))))) -> #######
A60: 15 | B60: 4 | C60: 4 | D60: 8 | E60: 0 | F60: 2 | H60: 1 | I60: =IF(B$39="","",IF((B60+J60)-2>=D60-F60,"Yes","")) ->  | J60: =IF(ROUND(I$14,0)>=C60,IF((ROUND(I$14,0)-18)>=C60,2,1),0) -> 1 | K60: =IF(D60=1,"H1",IF(B60-3=D60,"A",IF(B60-2=D60,"E",IF(B60-1=D60,"B",IF(B60=D60,"P",IF(B60+1=D60,"Bi",IF(B60+2=D60,"DB",IF(B60+2=D60,"DB+","DB+")))))))) -> DB+ | S60: =IF(L$39="","",IF((L60+T60)-2>=N60-P60,"Yes","")) ->  | T60: =IF(ROUND(S$14,0)>=M60,IF((ROUND(S$14,0)-18)>=M60,2,1),0) -> 0 | U60: =IF(N60=1,"H1",IF(L60-3=N60,"A",IF(L60-2=N60,"E",IF(L60-1=N60,"B",IF(L60=N60,"P",IF(L60+1=N60,"Bi",IF(L60+2=N60,"DB",IF(L60+2=N60,"DB+","DB+")))))))) -> ####### | AC60: =IF(V$39="","",IF((V60+AD60)-2>=X60-Z60,"Yes","")) ->  | AD60: =IF(ROUND(AC$14,0)>=W60,IF((ROUND(AC$14,0)-18)>=W60,2,1),0) -> 0 | AE60: =IF(X60=1,"H1",IF(V60-3=X60,"A",IF(V60-2=X60,"E",IF(V60-1=X60,"B",IF(V60=X60,"P",IF(V60+1=X60,"Bi",IF(V60+2=X60,"DB",IF(V60+2=X60,"DB+","DB+")))))))) -> #######
A61: 16 | B61: 3 | C61: 12 | D61: 4 | E61: 2 | F61: 3 | I61: =IF(B$39="","",IF((B61+J61)-2>=D61-F61,"Yes","")) -> Yes | J61: =IF(ROUND(I$14,0)>=C61,IF((ROUND(I$14,0)-18)>=C61,2,1),0) -> 1 | K61: =IF(D61=1,"H1",IF(B61-3=D61,"A",IF(B61-2=D61,"E",IF(B61-1=D61,"B",IF(B61=D61,"P",IF(B61+1=D61,"Bi",IF(B61+2=D61,"DB",IF(B61+2=D61,"DB+","DB+")))))))) -> Bi | S61: =IF(L$39="","",IF((L61+T61)-2>=N61-P61,"Yes","")) ->  | T61: =IF(ROUND(S$14,0)>=M61,IF((ROUND(S$14,0)-18)>=M61,2,1),0) -> 0 | U61: =IF(N61=1,"H1",IF(L61-3=N61,"A",IF(L61-2=N61,"E",IF(L61-1=N61,"B",IF(L61=N61,"P",IF(L61+1=N61,"Bi",IF(L61+2=N61,"DB",IF(L61+2=N61,"DB+","DB+")))))))) -> ####### | AC61: =IF(V$39="","",IF((V61+AD61)-2>=X61-Z61,"Yes","")) ->  | AD61: =IF(ROUND(AC$14,0)>=W61,IF((ROUND(AC$14,0)-18)>=W61,2,1),0) -> 0 | AE61: =IF(X61=1,"H1",IF(V61-3=X61,"A",IF(V61-2=X61,"E",IF(V61-1=X61,"B",IF(V61=X61,"P",IF(V61+1=X61,"Bi",IF(V61+2=X61,"DB",IF(V61+2=X61,"DB+","DB+")))))))) -> #######
A62: 17 | B62: 5 | C62: 7 | D62: 6 | E62: 2 | F62: 2 | G62: 1 | I62: =IF(B$39="","",IF((B62+J62)-2>=D62-F62,"Yes","")) -> Yes | J62: =IF(ROUND(I$14,0)>=C62,IF((ROUND(I$14,0)-18)>=C62,2,1),0) -> 1 | K62: =IF(D62=1,"H1",IF(B62-3=D62,"A",IF(B62-2=D62,"E",IF(B62-1=D62,"B",IF(B62=D62,"P",IF(B62+1=D62,"Bi",IF(B62+2=D62,"DB",IF(B62+2=D62,"DB+","DB+")))))))) -> Bi | S62: =IF(L$39="","",IF((L62+T62)-2>=N62-P62,"Yes","")) ->  | T62: =IF(ROUND(S$14,0)>=M62,IF((ROUND(S$14,0)-18)>=M62,2,1),0) -> 0 | U62: =IF(N62=1,"H1",IF(L62-3=N62,"A",IF(L62-2=N62,"E",IF(L62-1=N62,"B",IF(L62=N62,"P",IF(L62+1=N62,"Bi",IF(L62+2=N62,"DB",IF(L62+2=N62,"DB+","DB+")))))))) -> ####### | AC62: =IF(V$39="","",IF((V62+AD62)-2>=X62-Z62,"Yes","")) ->  | AD62: =IF(ROUND(AC$14,0)>=W62,IF((ROUND(AC$14,0)-18)>=W62,2,1),0) -> 0 | AE62: =IF(X62=1,"H1",IF(V62-3=X62,"A",IF(V62-2=X62,"E",IF(V62-1=X62,"B",IF(V62=X62,"P",IF(V62+1=X62,"Bi",IF(V62+2=X62,"DB",IF(V62+2=X62,"DB+","DB+")))))))) -> #######
A63: 18 | B63: 4 | C63: 17 | D63: 4 | E63: 2 | F63: 2 | G63: 1 | I63: =IF(B$39="","",IF((B63+J63)-2>=D63-F63,"Yes","")) -> Yes | J63: =IF(ROUND(I$14,0)>=C63,IF((ROUND(I$14,0)-18)>=C63,2,1),0) -> 0 | K63: =IF(D63=1,"H1",IF(B63-3=D63,"A",IF(B63-2=D63,"E",IF(B63-1=D63,"B",IF(B63=D63,"P",IF(B63+1=D63,"Bi",IF(B63+2=D63,"DB",IF(B63+2=D63,"DB+","DB+")))))))) -> P | S63: =IF(L$39="","",IF((L63+T63)-2>=N63-P63,"Yes","")) ->  | T63: =IF(ROUND(S$14,0)>=M63,IF((ROUND(S$14,0)-18)>=M63,2,1),0) -> 0 | U63: =IF(N63=1,"H1",IF(L63-3=N63,"A",IF(L63-2=N63,"E",IF(L63-1=N63,"B",IF(L63=N63,"P",IF(L63+1=N63,"Bi",IF(L63+2=N63,"DB",IF(L63+2=N63,"DB+","DB+")))))))) -> ####### | AC63: =IF(V$39="","",IF((V63+AD63)-2>=X63-Z63,"Yes","")) ->  | AD63: =IF(ROUND(AC$14,0)>=W63,IF((ROUND(AC$14,0)-18)>=W63,2,1),0) -> 0 | AE63: =IF(X63=1,"H1",IF(V63-3=X63,"A",IF(V63-2=X63,"E",IF(V63-1=X63,"B",IF(V63=X63,"P",IF(V63+1=X63,"Bi",IF(V63+2=X63,"DB",IF(V63+2=X63,"DB+","DB+")))))))) -> #######
A64: Totals | B64: =IF(B39="","",SUM(B46:B63)) -> 70 | D64: =IF(B39="","",SUM(D46:D63)) -> 91 | E64: =IF(B39="","",SUM(E46:E63)) -> 30 | F64: =IF(B39="","",SUM(F46:F63)) -> 37 | G64: =IF(B39="","",SUM(G46:G63)) -> 5 | H64: =IF(B39="","",SUM(H46:H63)) -> 1 | I64: =IF(COUNTIF(I46:I63,"=Yes")=0,"",COUNTIF(I46:I63,"=Yes")) -> 10 | L64: =IF(L39="","",SUM(L46:L63)) ->  | N64: =IF(L39="","",SUM(N46:N63)) ->  | O64: =IF(L39="","",SUM(O46:O63)) ->  | P64: =IF(L39="","",SUM(P46:P63)) ->  | Q64: =IF(L39="","",SUM(Q46:Q63)) ->  | R64: =IF(L39="","",SUM(R46:R63)) ->  | S64: =IF(COUNTIF(S46:S63,"=Yes")=0,"",COUNTIF(S46:S63,"=Yes")) ->  | V64: =IF(V39="","",SUM(V46:V63)) ->  | X64: =IF(V39="","",SUM(X46:X63)) ->  | Y64: =IF(V39="","",SUM(Y46:Y63)) ->  | Z64: =IF(V39="","",SUM(Z46:Z63)) ->  | AA64: =IF(V39="","",SUM(AA46:AA63)) ->  | AB64: =IF(V39="","",SUM(AB46:AB63)) ->  | AC64: =IF(COUNTIF(AC46:AC63,"=Yes")=0,"",COUNTIF(AC46:AC63,"=Yes")) ->  | AF64: =IF(AF39="","",SUM(AF46:AF63)) ->  | AH64: =IF(AF39="","",SUM(AH46:AH63)) ->  | AI64: =IF(AF39="","",SUM(AI46:AI63)) ->  | AJ64: =IF(AF39="","",SUM(AJ46:AJ63)) ->  | AK64: =IF(AF39="","",SUM(AK46:AK63)) ->  | AL64: =IF(AF39="","",SUM(AL46:AL63)) ->  | AM64: =IF(COUNTIF(AM46:AM63,"=Yes")=0,"",COUNTIF(AM46:AM63,"=Yes")) -> 