A1: Alan Hopkins
A2: Club | B2: Quinto Do Lago, South
A3: Par/SS | B3: 72/72 | D3: Num. Of Fairways | I3: =IF(B2="","",18-(COUNTIF(B9:B26,3))) -> 14
A4: Date | B4: 38688 | D4: Playing Handicap | I4: 8.0000000000019984
A5: Event Place | B5: 2 | D5: Prize Money | G5: 12500
A6: Game Stats | B6: DB+ | C6: DB | D6: Bi | E6: P | F6: B | G6: E | H6: A | I6: H1
B7: 1 | C7: 2 | D7: 6 | E7: 8 | F7: 1 | G7: 0 | H7: 0 | I7: 0
A8: Hole No | B8: Par | C8: Stroke Index | D8: Gross Score | E8: Points | F8: Putts | G8: Fairways | H8: Ferrets | I8: Green Regulation
A9: 1 | B9: 4 | C9: 13 | D9: 8 | E9: 0 | F9: 3
A10: 2 | B10: 5 | C10: 7 | D10: 6 | E10: 2 | F10: 2 | G10: 1 | I10: Yes
A11: 3 | B11: 4 | C11: 5 | D11: 5 | E11: 2 | F11: 2 | I11: Yes
A12: 4 | B12: 3 | C12: 17 | D12: 3 | E12: 2 | F12: 2 | I12: Yes
A13: 5 | B13: 5 | C13: 1 | D13: 6 | E13: 2 | F13: 3 | G13: 1 | I13: Yes
A14: 6 | B14: 4 | C14: 9 | D14: 4 | E14: 2 | F14: 2 | G14: 1 | I14: Yes
A15: 7 | B15: 3 | C15: 15 | D15: 4 | E15: 1 | F15: 2
A16: 8 | B16: 4 | C16: 3 | D16: 3 | E16: 4 | F16: 1 | G16: 1 | I16: Yes
A17: 9 | B17: 4 | C17: 11 | D17: 4 | E17: 2 | F17: 2 | G17: 1 | I17: Yes
A18: 10 | B18: 4 | C18: 6 | D18: 6 | E18: 1 | F18: 2
A19: 11 | B19: 3 | C19: 16 | D19: 5 | E19: 0 | F19: 2
A20: 12 | B20: 5 | C20: 12 | D20: 5 | E20: 2 | F20: 2 | I20: Yes
A21: 13 | B21: 4 | C21: 18 | D21: 4 | E21: 2 | F21: 1
A22: 14 | B22: 4 | C22: 2 | D22: 4 | E22: 3 | F22: 2 | G22: 1 | I22: Yes
A23: 15 | B23: 3 | C23: 8 | D23: 4 | E23: 2 | F23: 1
A24: 16 | B24: 4 | C24: 14 | D24: 4 | E24: 2 | F24: 2 | I24: Yes
A25: 17 | B25: 5 | C25: 4 | D25: 6 | E25: 2 | F25: 2 | I25: Yes
A26: 18 | B26: 4 | C26: 10 | D26: 4 | E26: 2 | F26: 1 | G26: 1
A27: Totals | B27: =IF(B2="","",SUM(B9:B26)) -> 72 | D27: =IF(B2="","",SUM(D9:D26)) -> 85 | E27: =IF(B2="","",SUM(E9:E26)) -> 33 | F27: =IF(B2="","",SUM(F9:F26)) -> 34 | G27: =IF(B2="","",SUM(G9:G26)) -> 7 | H27: =IF(B2="","",SUM(H9:H26)) -> 0 | I27: =IF(COUNTIF(I9:I26,"=Yes")=0,"",COUNTIF(I9:I26,"=Yes")) -> 11