A1: Alan Hopkins
A2: Club | B2: Vale Do Lobo - Royal
A3: Par/SS | B3: 72/72 | D3: Num. Of Fairways | I3: =IF(B2="","",18-(COUNTIF(B9:B26,3))) -> 15
A4: Date | B4: 38688 | D4: Playing Handicap | I4: 7.8000000000019982
A5: Event Place | B5: 2 | D5: Prize Money | G5: 11250
A6: Game Stats | B6: DB+ | C6: DB | D6: Bi | E6: P | F6: B | G6: E | H6: A | I6: H1
B7: 2 | C7: 2 | D7: 8 | E7: 5 | F7: 1 | G7: 0 | H7: 0 | I7: 0
A8: Hole No | B8: Par | C8: Stroke Index | D8: Gross Score | E8: Points | F8: Putts | G8: Fairways | H8: Ferrets | I8: Green Regulation
A9: 1 | B9: 5 | C9: 9 | D9: 5 | E9: 2 | F9: 2 | I9: Yes
A10: 2 | B10: 4 | C10: 13 | D10: 3 | E10: 3 | F10: 1 | I10: Yes
A11: 3 | B11: 4 | C11: 3 | D11: 4 | E11: 3 | F11: 1 | G11: 1 | I11: Yes
A12: 4 | B12: 4 | C12: 15 | D12: 5 | E12: 1 | F12: 2 | G12: 1
A13: 5 | B13: 5 | C13: 7 | D13: 10 | E13: 0 | F13: 2 | G13: 1
A14: 6 | B14: 4 | C14: 1 | D14: 5 | E14: 2 | F14: 2 | I14: Yes
A15: 7 | B15: 3 | C15: 17 | D15: 3 | E15: 2 | F15: 2 | I15: Yes
A16: 8 | B16: 4 | C16: 5 | D16: 6 | E16: 1 | F16: 2 | G16: 1
A17: 9 | B17: 3 | C17: 11 | D17: 4 | E17: 1 | F17: 2
A18: 10 | B18: 4 | C18: 18 | D18: 5 | E18: 1 | F18: 2 | G18: 1
A19: 11 | B19: 5 | C19: 8 | D19: 6 | E19: 2 | F19: 2 | G19: 1 | I19: Yes
A20: 12 | B20: 4 | C20: 16 | D20: 4 | E20: 2 | F20: 2 | G20: 1 | I20: Yes
A21: 13 | B21: 4 | C21: 2 | D21: 4 | E21: 3 | F21: 2 | G21: 1 | I21: Yes
A22: 14 | B22: 4 | C22: 4 | D22: 10 | E22: 0 | F22: 3 | H22: 1
A23: 15 | B23: 4 | C23: 10 | D23: 5 | E23: 1 | F23: 2 | H23: 1
A24: 16 | B24: 3 | C24: 14 | D24: 4 | E24: 1 | F24: 2
A25: 17 | B25: 4 | C25: 6 | D25: 5 | E25: 2 | F25: 2 | G25: 1 | I25: Yes
A26: 18 | B26: 4 | C26: 12 | D26: 6 | E26: 0 | F26: 2
A27: Totals | B27: =IF(B2="","",SUM(B9:B26)) -> 72 | D27: =IF(B2="","",SUM(D9:D26)) -> 94 | E27: =IF(B2="","",SUM(E9:E26)) -> 27 | F27: =IF(B2="","",SUM(F9:F26)) -> 35 | G27: =IF(B2="","",SUM(G9:G26)) -> 9 | H27: =IF(B2="","",SUM(H9:H26)) -> 2 | I27: =IF(COUNTIF(I9:I26,"=Yes")=0,"",COUNTIF(I9:I26,"=Yes")) -> 9