A1: Alan Hopkins
A2: Club | B2: San Lorenzo
A3: Par/SS | B3: 72/74 | D3: Num. Of Fairways | I3: =IF(B2="","",18-(COUNTIF(B9:B26,3))) -> 14
A4: Date | B4: 38689 | D4: Playing Handicap | I4: 8.0000000000019984
A5: Event Place | B5: 2 | D5: Prize Money | G5: 12500
A6: Game Stats | B6: DB+ | C6: DB | D6: BI | E6: P | F6: B | G6: E | H6: A | I6: H1
B7: 1 | C7: 3 | D7: 6 | E7: 8 | F7: 0 | G7: 0 | H7: 0 | I7: 0
A8: Hole No | B8: Par | C8: Stroke Index | D8: Gross Score | E8: Points | F8: Putts | G8: Fairways | H8: Ferrets | I8: Green Regulation
A9: 1 | B9: 5 | C9: 7 | D9: 6 | E9: 2 | F9: 2 | I9: Yes
A10: 2 | B10: 3 | C10: 15 | D10: 4 | E10: 1 | F10: 1
A11: 3 | B11: 4 | C11: 13 | D11: 5 | E11: 1 | F11: 2 | G11: 1
A12: 4 | B12: 4 | C12: 9 | D12: 4 | E12: 2 | F12: 2 | I12: Yes
A13: 5 | B13: 3 | C13: 17 | D13: 3 | E13: 2 | F13: 2 | I13: Yes
A14: 6 | B14: 4 | C14: 1 | D14: 5 | E14: 2 | F14: 1
A15: 7 | B15: 4 | C15: 11 | D15: 10 | E15: 0 | F15: 2 | H15: 1
A16: 8 | B16: 5 | C16: 3 | D16: 7 | E16: 1 | F16: 2 | G16: 1 | H16: 1
A17: 9 | B17: 4 | C17: 5 | D17: 5 | E17: 2 | F17: 2 | G17: 1 | I17: Yes
A18: 10 | B18: 5 | C18: 12 | D18: 5 | E18: 2 | F18: 2 | G18: 1 | I18: Yes
A19: 11 | B19: 4 | C19: 14 | D19: 4 | E19: 2 | F19: 2 | G19: 1 | I19: Yes
A20: 12 | B20: 4 | C20: 2 | D20: 4 | E20: 3 | F20: 2 | G20: 1 | I20: Yes
A21: 13 | B21: 4 | C21: 8 | D21: 5 | E21: 2 | F21: 2 | I21: Yes
A22: 14 | B22: 3 | C22: 18 | D22: 3 | E22: 2 | F22: 1
A23: 15 | B23: 5 | C23: 6 | D23: 7 | E23: 1 | F23: 2
A24: 16 | B24: 3 | C24: 16 | D24: 3 | E24: 2 | F24: 1
A25: 17 | B25: 4 | C25: 10 | D25: 4 | E25: 2 | F25: 2 | I25: Yes
A26: 18 | B26: 4 | C26: 4 | D26: 6 | E26: 1 | F26: 2
A27: Totals | B27: =IF(B2="","",SUM(B9:B26)) -> 72 | D27: =IF(B2="","",SUM(D9:D26)) -> 90 | E27: =IF(B2="","",SUM(E9:E26)) -> 30 | F27: =IF(B2="","",SUM(F9:F26)) -> 32 | G27: =IF(B2="","",SUM(G9:G26)) -> 6 | H27: =IF(B2="","",SUM(H9:H26)) -> 2 | I27: =IF(COUNTIF(I9:I26,"=Yes")=0,"",COUNTIF(I9:I26,"=Yes")) -> 9