A1: Alan Hopkins
A2: Club | B2: Pinheiros Altos
A3: Par/SS | B3: 72/70 | D3: Num. Of Fairways | I3: =IF(B2="","",18-(COUNTIF(B9:B26,3))) -> 14
A4: Date | B4: 38689 | D4: Playing Handicap | I4: 8.100000000001998
A5: Event Place | B5: 2 | D5: Prize Money | G5: 12500
A6: Game Stats | B6: DB+ | C6: DB | D6: Bi | E6: P | F6: B | G6: E | H6: A | I6: H1
B7: 1 | C7: 2 | D7: 8 | E7: 6 | F7: 1 | G7: 0 | H7: 0 | I7: 0
A8: Hole No | B8: Par | C8: Stroke Index | D8: Gross Score | E8: Points | F8: Putts | G8: Fairways | H8: Ferrets | I8: Green Regulation
A9: 1 | B9: 4 | C9: 9 | D9: 10 | E9: 0 | F9: 3 | H9: 1
A10: 2 | B10: 3 | C10: 17 | D10: 3 | E10: 2 | F10: 2 | I10: Yes
A11: 3 | B11: 4 | C11: 11 | D11: 6 | E11: 0 | F11: 1
A12: 4 | B12: 4 | C12: 15 | D12: 4 | E12: 2 | F12: 2 | I12: Yes
A13: 5 | B13: 3 | C13: 13 | D13: 5 | E13: 0 | F13: 2
A14: 6 | B14: 4 | C14: 5 | D14: 5 | E14: 2 | F14: 3 | G14: 1 | I14: Yes
A15: 7 | B15: 4 | C15: 7 | D15: 5 | E15: 2 | F15: 2 | G15: 1 | I15: Yes
A16: 8 | B16: 5 | C16: 1 | D16: 6 | E16: 2 | F16: 2 | I16: Yes
A17: 9 | B17: 4 | C17: 3 | D17: 5 | E17: 2 | F17: 2 | I17: Yes
A18: 10 | B18: 4 | C18: 12 | D18: 4 | E18: 2 | F18: 2 | I18: Yes
A19: 11 | B19: 4 | C19: 2 | D19: 4 | E19: 3 | F19: 2 | G19: 1 | I19: Yes
A20: 12 | B20: 5 | C20: 6 | D20: 5 | E20: 3 | F20: 2 | G20: 1 | I20: Yes
A21: 13 | B21: 5 | C21: 4 | D21: 6 | E21: 2 | F21: 2 | G21: 1 | I21: Yes
A22: 14 | B22: 3 | C22: 10 | D22: 4 | E22: 1 | F22: 2
A23: 15 | B23: 4 | C23: 16 | D23: 3 | E23: 3 | F23: 2 | H23: 1 | I23: Yes
A24: 16 | B24: 4 | C24: 8 | D24: 4 | E24: 3 | F24: 2 | I24: Yes
A25: 17 | B25: 3 | C25: 18 | D25: 4 | E25: 1 | F25: 2
A26: 18 | B26: 4 | C26: 14 | D26: 5 | E26: 1 | F26: 1
A27: Totals | B27: =IF(B2="","",SUM(B9:B26)) -> 71 | D27: =IF(B2="","",SUM(D9:D26)) -> 88 | E27: =IF(B2="","",SUM(E9:E26)) -> 31 | F27: =IF(B2="","",SUM(F9:F26)) -> 36 | G27: =IF(B2="","",SUM(G9:G26)) -> 5 | H27: =IF(B2="","",SUM(H9:H26)) -> 2 | I27: =IF(COUNTIF(I9:I26,"=Yes")=0,"",COUNTIF(I9:I26,"=Yes")) -> 12