A1: Dave Rouse
A2: Club | B2: Quinto Do Lago, South
A3: Par/SS | B3: 72/72 | D3: Num. Of Fairways | I3: =IF(B2="","",18-(COUNTIF(B9:B26,3))) -> 14
A4: Date | B4: 38688 | D4: Playing Handicap | I4: 23.3
A5: Event Place | B5: 3 | D5: Prize Money | G5: 10000
A6: Game Stats | B6: DB+ | C6: DB | D6: Bi | E6: P | F6: B | G6: E | H6: A | I6: H1
B7: 4 | C7: 6 | D7: 6 | E7: 2 | F7: 0 | G7: 0 | H7: 0 | I7: 0
A8: Hole No | B8: Par | C8: Stroke Index | D8: Gross Score | E8: Points | F8: Putts | G8: Fairways | H8: Ferrets | I8: Green Regulation
A9: 1 | B9: 4 | C9: 13 | D9: 5 | E9: 2 | F9: 2 | G9: 1 | I9: Yes
A10: 2 | B10: 5 | C10: 7 | D10: 8 | E10: 0 | F10: 2
A11: 3 | B11: 4 | C11: 5 | D11: 7 | E11: 1 | F11: 3 | I11: Yes
A12: 4 | B12: 3 | C12: 17 | D12: 4 | E12: 2 | F12: 2 | I12: Yes
A13: 5 | B13: 5 | C13: 1 | D13: 7 | E13: 2 | F13: 2 | G13: 1 | I13: Yes
A14: 6 | B14: 4 | C14: 9 | D14: 4 | E14: 3 | F14: 2 | I14: Yes
A15: 7 | B15: 3 | C15: 15 | D15: 4 | E15: 2 | F15: 2 | I15: Yes
A16: 8 | B16: 4 | C16: 3 | D16: 6 | E16: 2 | F16: 3 | G16: 1 | I16: Yes
A17: 9 | B17: 4 | C17: 11 | D17: 5 | E17: 2 | F17: 2 | I17: Yes
A18: 10 | B18: 4 | C18: 6 | D18: 6 | E18: 1 | F18: 2
A19: 11 | B19: 3 | C19: 16 | D19: 4 | E19: 2 | F19: 3 | I19: Yes
A20: 12 | B20: 5 | C20: 12 | D20: 9 | E20: 0 | F20: 2
A21: 13 | B21: 4 | C21: 18 | D21: 7 | E21: 0 | F21: 3
A22: 14 | B22: 4 | C22: 2 | D22: 6 | E22: 2 | F22: 2 | I22: Yes
A23: 15 | B23: 3 | C23: 8 | D23: 5 | E23: 1 | F23: 2 | H23: 1
A24: 16 | B24: 4 | C24: 14 | D24: 4 | E24: 3 | F24: 1 | G24: 1 | I24: Yes
A25: 17 | B25: 5 | C25: 4 | D25: 6 | E25: 3 | F25: 2 | G25: 1 | I25: Yes
A26: 18 | B26: 4 | C26: 10 | D26: 6 | E26: 1 | F26: 3 | I26: Yes
A27: Totals | B27: =IF(B2="","",SUM(B9:B26)) -> 72 | D27: =IF(B2="","",SUM(D9:D26)) -> 103 | E27: =IF(B2="","",SUM(E9:E26)) -> 29 | F27: =IF(B2="","",SUM(F9:F26)) -> 40 | G27: =IF(B2="","",SUM(G9:G26)) -> 5 | H27: =IF(B2="","",SUM(H9:H26)) -> 1 | I27: =IF(COUNTIF(I9:I26,"=Yes")=0,"",COUNTIF(I9:I26,"=Yes")) -> 13