A1: Dave Rouse
A2: Club | B2: Pinheiros Altos
A3: Par/SS | B3: 72/70 | D3: Num. Of Fairways | I3: =IF(B2="","",18-(COUNTIF(B9:B26,3))) -> 14
A4: Date | B4: 38689 | D4: Playing Handicap | I4: 23.6
A5: Event Place | B5: 4 | D5: Prize Money | G5: 6250
A6: Game Stats | B6: DB+ | C6: DB | D6: Bi | E6: P | F6: B | G6: E | H6: A | I6: H1
B7: 9 | C7: 4 | D7: 3 | E7: 1 | F7: 1 | G7: 0 | H7: 0 | I7: 0
A8: Hole No | B8: Par | C8: Stroke Index | D8: Gross Score | E8: Points | F8: Putts | G8: Fairways | H8: Ferrets | I8: Green Regulation
A9: 1 | B9: 4 | C9: 9 | D9: 6 | E9: 1 | F9: 2
A10: 2 | B10: 3 | C10: 17 | D10: 2 | E10: 4 | F10: 1 | I10: Yes
A11: 3 | B11: 4 | C11: 11 | D11: 5 | E11: 2 | F11: 3 | G11: 1 | I11: Yes
A12: 4 | B12: 4 | C12: 15 | D12: 6 | E12: 1 | F12: 2 | G12: 1
A13: 5 | B13: 3 | C13: 13 | D13: 5 | E13: 1 | F13: 3 | I13: Yes
A14: 6 | B14: 4 | C14: 5 | D14: 8 | E14: 0 | F14: 2
A15: 7 | B15: 4 | C15: 7 | D15: 9 | E15: 0 | F15: 2 | H15: 1
A16: 8 | B16: 5 | C16: 1 | D16: 9 | E16: 0 | F16: 3 | H16: 1
A17: 9 | B17: 4 | C17: 3 | D17: 10 | E17: 0 | F17: 3
A18: 10 | B18: 4 | C18: 12 | D18: 7 | E18: 0 | F18: 3
A19: 11 | B19: 4 | C19: 2 | D19: 6 | E19: 2 | F19: 2 | I19: Yes
A20: 12 | B20: 5 | C20: 6 | D20: 9 | E20: 0 | F20: 2 | H20: 1
A21: 13 | B21: 5 | C21: 4 | D21: 9 | E21: 0 | F21: 2
A22: 14 | B22: 3 | C22: 10 | D22: 4 | E22: 2 | F22: 2 | I22: Yes
A23: 15 | B23: 4 | C23: 16 | D23: 10 | E23: 0 | F23: 2 | H23: 2
A24: 16 | B24: 4 | C24: 8 | D24: 4 | E24: 3 | F24: 3 | G24: 1 | I24: Yes
A25: 17 | B25: 3 | C25: 18 | D25: 6 | E25: 0 | F25: 2 | H25: 1
A26: 18 | B26: 4 | C26: 14 | D26: 5 | E26: 2 | F26: 2 | I26: Yes
A27: Totals | B27: =IF(B2="","",SUM(B9:B26)) -> 71 | D27: =IF(B2="","",SUM(D9:D26)) -> 120 | E27: =IF(B2="","",SUM(E9:E26)) -> 18 | F27: =IF(B2="","",SUM(F9:F26)) -> 41 | G27: =IF(B2="","",SUM(G9:G26)) -> 3 | H27: =IF(B2="","",SUM(H9:H26)) -> 6 | I27: =IF(COUNTIF(I9:I26,"=Yes")=0,"",COUNTIF(I9:I26,"=Yes")) -> 7