A1: Roy Dickens
A2: Club | B2: Quinto Do Lago, South
A3: Par/SS | B3: 72/72 | D3: Num. Of Fairways | I3: =IF(B2="","",18-(COUNTIF(B9:B26,3))) -> 14
A4: Date | B4: 38688 | D4: Playing Handicap | I4: 27.3
A5: Event Place | B5: 5 | D5: Prize Money | G5: 3750
A6: Game Stats | B6: DB+ | C6: DB | D6: Bi | E6: P | F6: B | G6: E | H6: A | I6: H1
B7: 8 | C7: 5 | D7: 4 | E7: 1 | F7: 0 | G7: 0 | H7: 0 | I7: 0
A8: Hole No | B8: Par | C8: Stroke Index | D8: Gross Score | E8: Points | F8: Putts | G8: Fairways | H8: Ferrets | I8: Green Regulation
A9: 1 | B9: 4 | C9: 13 | D9: 5 | E9: 2 | F9: 1
A10: 2 | B10: 5 | C10: 7 | D10: 6 | E10: 3 | F10: 2 | I10: Yes
A11: 3 | B11: 4 | C11: 5 | D11: 8 | E11: 0 | F11: 2
A12: 4 | B12: 3 | C12: 17 | D12: 8 | E12: 0 | F12: 2 | H12: 1
A13: 5 | B13: 5 | C13: 1 | D13: 10 | E13: 0 | F13: 3
A14: 6 | B14: 4 | C14: 9 | D14: 6 | E14: 2 | F14: 3 | G14: 1 | I14: Yes
A15: 7 | B15: 3 | C15: 15 | D15: 3 | E15: 3 | F15: 2 | I15: Yes
A16: 8 | B16: 4 | C16: 3 | D16: 6 | E16: 2 | F16: 3 | G16: 1 | I16: Yes
A17: 9 | B17: 4 | C17: 11 | D17: 10 | E17: 0 | F17: 3 | H17: 1
A18: 10 | B18: 4 | C18: 6 | D18: 7 | E18: 1 | F18: 2
A19: 11 | B19: 3 | C19: 16 | D19: 6 | E19: 0 | F19: 2
A20: 12 | B20: 5 | C20: 12 | D20: 6 | E20: 2 | F20: 2 | G20: 1 | I20: Yes
A21: 13 | B21: 4 | C21: 18 | D21: 7 | E21: 0 | F21: 1 | G21: 1
A22: 14 | B22: 4 | C22: 2 | D22: 5 | E22: 3 | F22: 2 | G22: 1 | I22: Yes
A23: 15 | B23: 3 | C23: 8 | D23: 5 | E23: 2 | F23: 3 | I23: Yes
A24: 16 | B24: 4 | C24: 14 | D24: 6 | E24: 1 | F24: 2
A25: 17 | B25: 5 | C25: 4 | D25: 8 | E25: 1 | F25: 3 | H25: 1 | I25: Yes
A26: 18 | B26: 4 | C26: 10 | D26: 6 | E26: 1 | F26: 2
A27: Totals | B27: =IF(B2="","",SUM(B9:B26)) -> 72 | D27: =IF(B2="","",SUM(D9:D26)) -> 118 | E27: =IF(B2="","",SUM(E9:E26)) -> 23 | F27: =IF(B2="","",SUM(F9:F26)) -> 40 | G27: =IF(B2="","",SUM(G9:G26)) -> 5 | H27: =IF(B2="","",SUM(H9:H26)) -> 3 | I27: =IF(COUNTIF(I9:I26,"=Yes")=0,"",COUNTIF(I9:I26,"=Yes")) -> 8