A1: Matthew Carter
A2: Club | B2: Merrist Wood
A3: Par/SS | B3: 72/70 | D3: Num. Of Fairways | I3: =IF(B2="","",18-(COUNTIF(B9:B26,3))) -> 13
A4: Date | B4: 41377 | D4: Playing Handicap | I4: 16.5
A5: Event Place | B5: 8 | C5: M | D5: Prize Money | G5: 5000
A6: Game Stats | B6: DB+ | C6: DB | D6: BI | E6: P | F6: B | G6: E | H6: A | I6: H1
B7: 6 | C7: 4 | D7: 6 | E7: 0 | F7: 2 | G7: 0 | H7: 0 | I7: 0
A8: Hole No | B8: Par | C8: Stroke Index | D8: Gross Score | E8: Points | F8: Putts | G8: Fairways | H8: Ferrets | I8: Green Regulation
A9: 1 | B9: 4 | C9: 10 | D9: 5 | E9: 2 | F9: 1
A10: 2 | B10: 3 | C10: 18 | D10: 4 | E10: 1 | F10: 2
A11: 3 | B11: 4 | C11: 6 | D11: 7 | E11: 0 | F11: 3
A12: 4 | B12: 5 | C12: 14 | D12: 4 | E12: 4 | F12: 1 | I12: Yes
A13: 5 | B13: 4 | C13: 4 | D13: 7 | E13: 0 | F13: 3 | G13: 1
A14: 6 | B14: 5 | C14: 12 | D14: 10 | E14: 0 | F14: 3
A15: 7 | B15: 3 | C15: 8 | D15: 5 | E15: 1 | F15: 2
A16: 8 | B16: 3 | C16: 16 | D16: 2 | E16: 4 | F16: 1 | I16: Yes
A17: 9 | B17: 4 | C17: 2 | D17: 10 | E17: 0 | F17: 3
A18: 10 | B18: 5 | C18: 9 | D18: 7 | E18: 1 | F18: 1 | G18: 1
A19: 11 | B19: 3 | C19: 15 | D19: 4 | E19: 2 | F19: 2 | I19: Yes
A20: 12 | B20: 4 | C20: 7 | D20: 5 | E20: 2 | F20: 2 | G20: 1 | I20: Yes
A21: 13 | B21: 4 | C21: 1 | D21: 6 | E21: 1 | F21: 2 | G21: 1
A22: 14 | B22: 4 | C22: 13 | D22: 5 | E22: 2 | F22: 1 | G22: 1
A23: 15 | B23: 4 | C23: 3 | D23: 6 | E23: 1 | F23: 2
A24: 16 | B24: 3 | C24: 17 | D24: 4 | E24: 2 | F24: 2 | I24: Yes
A25: 17 | B25: 4 | C25: 5 | D25: 7 | E25: 0 | F25: 3 | G25: 1
A26: 18 | B26: 5 | C26: 11 | D26: 8 | E26: 0 | F26: 1
A27: Totals | B27: =IF(B2="","",SUM(B9:B26)) -> 71 | D27: =IF(B2="","",SUM(D9:D26)) -> 106 | E27: =IF(B2="","",SUM(E9:E26)) -> 23 | F27: =IF(B2="","",SUM(F9:F26)) -> 35 | G27: =IF(B2="","",SUM(G9:G26)) -> 6 | H27: =IF(B2="","",SUM(H9:H26)) -> 0 | I27: =IF(COUNTIF(I9:I26,"=Yes")=0,"",COUNTIF(I9:I26,"=Yes")) -> 5