A1: Dave Rouse
A2: Club | B2: Broke Hill
A3: Par/SS | B3: 72/72 | D3: Num. Of Fairways
A4: Date | B4: 40348 | D4: Playing Handicap | I4: 25.7
A5: Event Place | B5: 1 | C5: M | D5: Prize Money | G5: 27500
A6: Game Stats | B6: DB+ | C6: DB | D6: BI | E6: P | F6: B | G6: E | H6: A | I6: H1
B7: 5 | C7: 3 | D7: 7 | E7: 3 | F7: 0 | G7: 0 | H7: 0 | I7: 0
A8: Hole No | B8: Par | C8: Stroke Index | D8: Gross Score | E8: Points | F8: Putts | G8: Fairways | H8: Ferrets | I8: Green Regulation
A9: 1 | B9: 4 | C9: 13 | D9: 5 | E9: 2 | F9: 2 | I9: Yes
A10: 2 | B10: 4 | C10: 9 | D10: 4 | E10: 3 | F10: 2 | I10: Yes
A11: 3 | B11: 5 | C11: 3 | D11: 8 | E11: 1 | F11: 2
A12: 4 | B12: 3 | C12: 15 | D12: 6 | E12: 0 | F12: 2 | H12: 1
A13: 5 | B13: 4 | C13: 11 | D13: 4 | E13: 3 | F13: 2 | I13: Yes
A14: 6 | B14: 4 | C14: 1 | D14: 6 | E14: 2 | F14: 1
A15: 7 | B15: 4 | C15: 7 | D15: 6 | E15: 2 | F15: 1
A16: 8 | B16: 3 | C16: 17 | D16: 4 | E16: 2 | F16: 1
A17: 9 | B17: 5 | C17: 5 | D17: 7 | E17: 2 | F17: 2 | I17: Yes
A18: 10 | B18: 4 | C18: 12 | D18: 5 | E18: 2 | F18: 2 | G18: 1 | I18: Yes
A19: 11 | B19: 3 | C19: 18 | D19: 4 | E19: 2 | F19: 2 | I19: Yes
A20: 12 | B20: 5 | C20: 4 | D20: 6 | E20: 3 | F20: 2 | I20: Yes
A21: 13 | B21: 4 | C21: 8 | D21: 5 | E21: 3 | F21: 2 | I21: Yes
A22: 14 | B22: 4 | C22: 14 | D22: 10 | E22: 0 | F22: 3 | H22: 1
A23: 15 | B23: 5 | C23: 2 | D23: 10 | E23: 0 | F23: 3 | H23: 1
A24: 16 | B24: 4 | C24: 16 | D24: 4 | E24: 3 | F24: 1 | G24: 1 | I24: Yes
A25: 17 | B25: 3 | C25: 6 | D25: 4 | E25: 3 | F25: 2 | I25: Yes
A26: 18 | B26: 4 | C26: 10 | D26: 10 | E26: 0 | F26: 3 | H26: 2
A27: Totals | B27: =IF(B2="","",SUM(B9:B26)) -> 72 | D27: =IF(B2="","",SUM(D9:D26)) -> 108 | E27: =IF(B2="","",SUM(E9:E26)) -> 33 | F27: =IF(B2="","",SUM(F9:F26)) -> 35 | G27: =IF(B2="","",SUM(G9:G26)) -> 2 | H27: =IF(B2="","",SUM(H9:H26)) -> 5 | I27: =IF(COUNTIF(I9:I26,"=Yes")=0,"",COUNTIF(I9:I26,"=Yes")) -> 10