A1: Danny Marsh
A2: Club | B2: Merrist Wood
A3: Par/SS | B3: 72/70 | D3: Num. Of Fairways | I3: =IF(B2="","",18-(COUNTIF(B9:B26,3))) -> 14
A4: Date | B4: 38808 | D4: Playing Handicap | I4: 9.4000000000009987
A5: Event Place | B5: 1 | C5: m | D5: Prize Money | G5: 55000
A6: Game Stats | B6: DB+ | C6: DB | D6: Bi | E6: P | F6: B | G6: E | H6: A | I6: H1
B7: 0 | C7: 0 | D7: 9 | E7: 8 | F7: 1 | G7: 0 | H7: 0 | I7: 0
A8: Hole No | B8: Par | C8: Stroke Index | D8: Gross Score | E8: Points | F8: Putts | G8: Fairways | H8: Ferrets | I8: Green Regulation
A9: 1 | B9: 4 | C9: 10 | D9: 4 | E9: 2 | F9: 1
A10: 2 | B10: 3 | C10: 18 | D10: 4 | E10: 1 | F10: 2
A11: 3 | B11: 4 | C11: 6 | D11: 4 | E11: 3 | F11: 1 | I11: Yes
A12: 4 | B12: 5 | C12: 14 | D12: 5 | E12: 2 | F12: 2 | G12: 1 | I12: Yes
A13: 5 | B13: 4 | C13: 4 | D13: 5 | E13: 2 | F13: 2 | I13: Yes
A14: 6 | B14: 5 | C14: 12 | D14: 4 | E14: 3 | F14: 2 | G14: 1 | I14: Yes
A15: 7 | B15: 4 | C15: 8 | D15: 5 | E15: 2 | F15: 3 | I15: Yes
A16: 8 | B16: 3 | C16: 16 | D16: 4 | E16: 1 | F16: 2
A17: 9 | B17: 4 | C17: 2 | D17: 5 | E17: 2 | F17: 2 | I17: Yes
A18: 10 | B18: 5 | C18: 9 | D18: 5 | E18: 3 | F18: 1 | G18: 1 | I18: Yes
A19: 11 | B19: 3 | C19: 15 | D19: 3 | E19: 2 | F19: 1
A20: 12 | B20: 4 | C20: 7 | D20: 5 | E20: 2 | F20: 2 | G20: 1 | I20: Yes
A21: 13 | B21: 4 | C21: 1 | D21: 5 | E21: 2 | F21: 2 | I21: Yes
A22: 14 | B22: 4 | C22: 13 | D22: 4 | E22: 2 | F22: 1
A23: 15 | B23: 4 | C23: 3 | D23: 5 | E23: 2 | F23: 1 | G23: 1
A24: 16 | B24: 3 | C24: 17 | D24: 3 | E24: 2 | F24: 1
A25: 17 | B25: 4 | C25: 5 | D25: 4 | E25: 3 | F25: 1 | I25: Yes
A26: 18 | B26: 5 | C26: 11 | D26: 6 | E26: 1 | F26: 2
A27: Totals | B27: =IF(B2="","",SUM(B9:B26)) -> 72 | D27: =IF(B2="","",SUM(D9:D26)) -> 80 | E27: =IF(B2="","",SUM(E9:E26)) -> 37 | F27: =IF(B2="","",SUM(F9:F26)) -> 29 | G27: =IF(B2="","",SUM(G9:G26)) -> 5 | H27: =IF(B2="","",SUM(H9:H26)) -> 0 | I27: =IF(COUNTIF(I9:I26,"=Yes")=0,"",COUNTIF(I9:I26,"=Yes")) -> 10