A1: Keith Mendelson
A2: Club | B2: The London Club (International)
A3: Par/SS | B3: 72/72 | D3: Num. Of Fairways | I3: =IF(B2="","",18-(COUNTIF(B9:B26,3))) -> 13
A4: Date | B4: 38802 | D4: Playing Handicap | I4: 15.4
A5: Event Place | B5: 1 | D5: Prize Money | G5: 5000
A6: Game Stats | B6: DB+ | C6: DB | D6: Bi | E6: P | F6: B | G6: E | H6: A | I6: H1
B7: 4 | C7: 3 | D7: 7 | E7: 4 | F7: 0 | G7: 0 | H7: 0 | I7: 0
A8: Hole No | B8: Par | C8: Stroke Index | D8: Gross Score | E8: Points | F8: Putts | G8: Fairways | H8: Ferrets | I8: Green Regulation
A9: 1 | B9: 4 | C9: 14 | D9: 8 | E9: 0 | F9: 2 | G9: 1
A10: 2 | B10: 5 | C10: 8 | D10: 5 | E10: 3 | F10: 2 | G10: 1 | I10: Yes
A11: 3 | B11: 3 | C11: 6 | D11: 6 | E11: 0 | F11: 1
A12: 4 | B12: 5 | C12: 4 | D12: 7 | E12: 1 | F12: 2
A13: 5 | B13: 3 | C13: 18 | D13: 4 | E13: 1 | F13: 2
A14: 6 | B14: 4 | C14: 16 | D14: 5 | E14: 1 | F14: 2 | G14: 1
A15: 7 | B15: 4 | C15: 12 | D15: 6 | E15: 1 | F15: 2
A16: 8 | B16: 3 | C16: 2 | D16: 4 | E16: 2 | F16: 1
A17: 9 | B17: 5 | C17: 10 | D17: 5 | E17: 3 | F17: 2 | G17: 1 | I17: Yes
A18: 10 | B18: 5 | C18: 11 | D18: 6 | E18: 2 | F18: 2 | I18: Yes
A19: 11 | B19: 4 | C19: 9 | D19: 8 | E19: 0 | F19: 1 | G19: 1
A20: 12 | B20: 4 | C20: 1 | D20: 7 | E20: 0 | F20: 2
A21: 13 | B21: 3 | C21: 17 | D21: 3 | E21: 2 | F21: 1
A22: 14 | B22: 4 | C22: 5 | D22: 5 | E22: 2 | F22: 2 | I22: Yes
A23: 15 | B23: 5 | C23: 13 | D23: 5 | E23: 3 | F23: 2 | G23: 1 | I23: Yes
A24: 16 | B24: 4 | C24: 15 | D24: 5 | E24: 2 | F24: 2 | I24: Yes
A25: 17 | B25: 3 | C25: 7 | D25: 4 | E25: 2 | F25: 2 | I25: Yes
A26: 18 | B26: 4 | C26: 3 | D26: 6 | E26: 1 | F26: 2 | G26: 1
A27: Totals | B27: =IF(B2="","",SUM(B9:B26)) -> 72 | D27: =IF(B2="","",SUM(D9:D26)) -> 99 | E27: =IF(B2="","",SUM(E9:E26)) -> 26 | F27: =IF(B2="","",SUM(F9:F26)) -> 32 | G27: =IF(B2="","",SUM(G9:G26)) -> 7 | H27: =IF(B2="","",SUM(H9:H26)) -> 0 | I27: =IF(COUNTIF(I9:I26,"=Yes")=0,"",COUNTIF(I9:I26,"=Yes")) -> 7