A1: Roy Dickens
A2: Club | B2: Hoebridge
A3: Par/SS | B3: 71/70 | D3: Num. Of Fairways | I3: =IF(B2="","",18-(COUNTIF(B9:B26,3))) -> 13
A4: Date | B4: 38780 | D4: Playing Handicap | I4: 28.9
A5: Event Place | B5: 5 | D5: Prize Money | G5: 3750
A6: Game Stats | B6: DB+ | C6: DB | D6: Bi | E6: P | F6: B | G6: E | H6: A | I6: H1
B7: 7 | C7: 3 | D7: 7 | E7: 1 | F7: 0 | G7: 0 | H7: 0 | I7: 0
A8: Hole No | B8: Par | C8: Stroke Index | D8: Gross Score | E8: Points | F8: Putts | G8: Fairways | H8: Ferrets | I8: Green Regulation
A9: 1 | B9: 5 | C9: 11 | D9: 10 | E9: 0 | F9: 3 | H9: 1
A10: 2 | B10: 3 | C10: 17 | D10: 6 | E10: 0 | F10: 2
A11: 3 | B11: 4 | C11: 7 | D11: 5 | E11: 3 | F11: 0
A12: 4 | B12: 4 | C12: 1 | D12: 8 | E12: 0 | F12: 2
A13: 5 | B13: 4 | C13: 5 | D13: 5 | E13: 3 | F13: 2 | G13: 1 | I13: Yes
A14: 6 | B14: 3 | C14: 15 | D14: 6 | E14: 0 | F14: 2
A15: 7 | B15: 4 | C15: 3 | D15: 6 | E15: 2 | F15: 2 | G15: 1 | I15: Yes
A16: 8 | B16: 4 | C16: 9 | D16: 5 | E16: 3 | F16: 2 | I16: Yes
A17: 9 | B17: 5 | C17: 13 | D17: 6 | E17: 2 | F17: 1 | G17: 1
A18: 10 | B18: 4 | C18: 12 | D18: 6 | E18: 1 | F18: 2
A19: 11 | B19: 4 | C19: 4 | D19: 10 | E19: 0 | F19: 3 | H19: 2
A20: 12 | B20: 3 | C20: 18 | D20: 4 | E20: 2 | F20: 2 | I20: Yes
A21: 13 | B21: 5 | C21: 8 | D21: 6 | E21: 3 | F21: 3 | I21: Yes
A22: 14 | B22: 4 | C22: 14 | D22: 4 | E22: 3 | F22: 3 | I22: Yes
A23: 15 | B23: 4 | C23: 2 | D23: 9 | E23: 0 | F23: 2 | H23: 1
A24: 16 | B24: 3 | C24: 10 | D24: 5 | E24: 2 | F24: 3 | I24: Yes
A25: 17 | B25: 5 | C25: 6 | D25: 9 | E25: 0 | F25: 2
A26: 18 | B26: 3 | C26: 16 | D26: 4 | E26: 2 | F26: 1
A27: Totals | B27: =IF(B2="","",SUM(B9:B26)) -> 71 | D27: =IF(B2="","",SUM(D9:D26)) -> 114 | E27: =IF(B2="","",SUM(E9:E26)) -> 26 | F27: =IF(B2="","",SUM(F9:F26)) -> 37 | G27: =IF(B2="","",SUM(G9:G26)) -> 3 | H27: =IF(B2="","",SUM(H9:H26)) -> 4 | I27: =IF(COUNTIF(I9:I26,"=Yes")=0,"",COUNTIF(I9:I26,"=Yes")) -> 7