B2: The Great Melbage Weight Loss Challenge
B5: Melbage Cup 2009 Belly Weights | G5: Target | K5: 39965 | L5: 39995 | M5: 40026 | N5: 40057 | O5: 40087 | P5: 40118 | Q5: 40148 | R5: 40179 | S5: 40210 | T5: 40238
C6: St | D6: lb | G6: St | H6: lb | I6: aimed loss
B7: Martin Cox | C7: 18 | D7: 7 | E7: =(14*C7)+D7 -> 259 | G7: 15 | H7: 0 | I7: =E7-((G7*14)+H7) -> 49
B8: Paul Carter | C8: 18 | D8: 6 | E8: =(14*C8)+D8 -> 258 | G8: 16 | H8: 0 | I8: =E8-((G8*14)+H8) -> 34 | K8: 17st 10
B9: Matt Carter | C9: 18 | D9: 3 | E9: =(14*C9)+D9 -> 255 | G9: 0 | H9: 0
B10: Kevin Gallagher | C10: 16 | D10: 11 | E10: =(14*C10)+D10 -> 235 | G10: 15 | H10: 5 | I10: =E10-((G10*14)+H10) -> 20
B11: Simon Owens | C11: 16 | D11: 3 | E11: =(14*C11)+D11 -> 227 | G11: 15 | H11: 7 | I11: =E11-((G11*14)+H11) -> 10
B12: Robert Thompson | C12: 16 | D12: 3 | E12: =(14*C12)+D12 -> 227 | G12: 15 | H12: 0 | I12: =E12-((G12*14)+H12) -> 17 | K12: 16st 4
B13: Alan Baldwin | C13: 16 | D13: 1 | E13: =(14*C13)+D13 -> 225 | G13: 0 | H13: 0
B14: Jeff Gibbons | C14: 15 | D14: 12 | E14: =(14*C14)+D14 -> 222 | G14: 0 | H14: 0
B15: Martin Bould | C15: 15 | D15: 10 | E15: =(14*C15)+D15 -> 220 | G15: 13 | H15: 10 | I15: =E15-((G15*14)+H15) -> 28 | K15: 15st 0
B16: Jon Dey | C16: 15 | D16: 7 | E16: =(14*C16)+D16 -> 217 | G16: 14 | H16: 0 | I16: =E16-((G16*14)+H16) -> 21 | K16: 15st 5
B17: Dave Andrews | C17: 15 | D17: 7 | E17: =(14*C17)+D17 -> 217 | G17: 14 | H17: 6 | I17: 15 lbs | K17: 15st 6
B18: Malcolm Rouse | C18: 15 | D18: 6 | E18: =(14*C18)+D18 -> 216 | G18: 14 | H18: 10 | I18: =E18-((G18*14)+H18) -> 10 | J18: above average
B19: Keith Mendelson | C19: 15 | D19: 0 | E19: =(14*C19)+D19 -> 210 | G19: not playing | J19: below average
B20: Dave Rouse | C20: 14 | D20: 10 | E20: =(14*C20)+D20 -> 206 | G20: 14 | H20: 0 | I20: =E20-((G20*14)+H20) -> 10 | K20: 14st 9
B21: Simon Thompson | C21: 14 | D21: 10 | E21: =(14*C21)+D21 -> 206 | G21: 13 | H21: 7 | I21: =E21-((G21*14)+H21) -> 17 | K21: 14st 5
B22: Dave Bingham | C22: 14 | D22: 8 | E22: =(14*C22)+D22 -> 204 | G22: 0 | H22: 0
B23: Alan Hopkins | C23: 14 | D23: 4 | E23: =(14*C23)+D23 -> 200 | G23: 13 | H23: 0 | I23: =E23-((G23*14)+H23) -> 18 | K23: 14st 2
B24: Michael Trimmings | C24: 14 | D24: 0 | E24: =(14*C24)+D24 -> 196 | G24: 0 | H24: 0
B25: Roy Dickens | C25: 14 | D25: 0 | E25: =(14*C25)+D25 -> 196 | G25: 13 | H25: 6 | I25: =E25-((G25*14)+H25) -> 8 | K25: 13st 8
B26: Dave Braithwaite | C26: 13 | D26: 11 | E26: =(14*C26)+D26 -> 193 | G26: 0 | H26: 0
B27: Jeff Colbrook | C27: 13 | D27: 4 | E27: =(14*C27)+D27 -> 186 | G27: 0 | H27: 0
B28: Andrew Baldwin | C28: 13 | D28: 3 | E28: =(14*C28)+D28 -> 185 | G28: 12 | H28: 11 | I28: =E28-((G28*14)+H28) -> 6
B29: Jon Press | C29: 12 | D29: 3 | E29: =(14*C29)+D29 -> 171 | G29: 0 | H29: 0
B30: Paul Baldwin | C30: 11 | D30: 8 | E30: =(14*C30)+D30 -> 162 | G30: 0 | H30: 0