B1: CHINNEY CHOO - 2009/2010
B3: Awarded to the team with most accumulated points in Majors
C4: Rousey Invitation 21/4/09 | D4: Mendy's Masters 11/7/09 | E4: Player's Championship | F4: Bubble Open 12/9/09 | G4: Tubby Trophy | H4: Thommo Classic 27/3/10 | I4: Total
B5: EUROPE
B6: R Thompson | C6: 28 | D6: 37 | F6: 0 | H6: 31 | I6: =SUM(C6:H6) -> 96
B7: D Bingham | C7: 0 | D7: 33 | F7: 31 | H7: 31 | I7: =SUM(C7:H7) -> 95
B8: K Mendelson | C8: 0 | D8: 38 | F8: 33 | H8: 0 | I8: =SUM(C8:H8) -> 71
B9: M Bould | C9: 0 | D9: 0 | F9: 32 | H9: 26 | I9: =SUM(C9:H9) -> 58
B10: A Baldwin (Jnr) | C10: 20 | D10: 36 | F10: 0 | H10: 0 | I10: =SUM(C10:H10) -> 56
B11: R Dickens | C11: 22 | D11: 0 | F11: 0 | H11: 27 | I11: =SUM(C11:H11) -> 49
B12: J Dey | C12: 0 | D12: 47 | F12: 0 | H12: 0 | I12: =SUM(C12:H12) -> 47
B13: I Edwards | C13: 0 | D13: 0 | F13: 23 | H13: 16 | I13: =SUM(C13:H13) -> 39
B14: J Colbrook | C14: 0 | D14: 33 | F14: 0 | H14: 0 | I14: =SUM(C14:H14) -> 33
B15: M Cox | C15: 29 | D15: 0 | F15: 0 | H15: 0 | I15: =SUM(C15:H15) -> 29
B16: D Andrews | C16: 0 | D16: 0 | F16: 0 | H16: 28 | I16: =SUM(C16:H16) -> 28
B17: A Baldwin (Snr) | C17: 26 | D17: 0 | F17: 0 | H17: 0 | I17: =SUM(C17:H17) -> 26
B18: J Gibbons | C18: 0 | D18: 0 | F18: 0 | H18: 0 | I18: =SUM(C18:H18) -> 0
B19: C Manning | C19: 0 | D19: 0 | F19: 0 | H19: 0 | I19: =SUM(C19:H19) -> 0
B20: K Johns | C20: 0 | D20: 0 | F20: 0 | H20: 0 | I20: =SUM(C20:H20) -> 0
B21: D White | C21: 0 | D21: 0 | F21: 0 | H21: 0 | I21: =SUM(C21:H21) -> 0
C22: =SUM(C6:C21) -> 125 | D22: =SUM(D6:D21) -> 224 | E22: =SUM(E6:E21) -> 0 | F22: =SUM(F6:F21) -> 119 | G22: =SUM(G6:G21) -> 0 | H22: =SUM(H6:H21) -> 159 | I22: =SUM(I6:I21) -> 627
B23: USA
B24: S Thompson | C24: 34 | D24: 42 | F24: 28 | H24: 32 | I24: =SUM(C24:H24) -> 136
B25: K Gallagher | C25: 32 | D25: 0 | F25: 39 | H25: 29 | I25: =SUM(C25:H25) -> 100
B26: P Carter | C26: 33 | D26: 0 | F26: 30 | H26: 37 | I26: =SUM(C26:H26) -> 100
B27: D Rouse | C27: 27 | D27: 0 | F27: 35 | H27: 21 | I27: =SUM(C27:H27) -> 83
B28: M Carter | C28: 27 | D28: 0 | F28: 0 | H28: 28 | I28: =SUM(C28:H28) -> 55
B29: M Trimmings | C29: 0 | D29: 0 | F29: 25 | H29: 25 | I29: =SUM(C29:H29) -> 50
B30: S Owens | C30: 0 | D30: 38 | F30: 0 | H30: 0 | I30: =SUM(C30:H30) -> 38
B31: J Press | C31: 35 | D31: 0 | F31: 0 | H31: 0 | I31: =SUM(C31:H31) -> 35
B32: A Hopkins | C32: 0 | D32: 0 | F32: 34 | H32: 0 | I32: =SUM(C32:H32) -> 34
B33: A Benson | C33: 0 | D33: 0 | F33: 34 | H33: 0 | I33: =SUM(C33:H33) -> 34
B34: P Baldwin | C34: 29 | D34: 0 | F34: 0 | H34: 0 | I34: =SUM(C34:H34) -> 29
B35: M Rouse | C35: 0 | D35: 0 | F35: 0 | H35: 0 | I35: =SUM(C35:H35) -> 0
B36: D Marsh | C36: 0 | D36: 0 | F36: 0 | H36: 0 | I36: =SUM(C36:H36) -> 0
B37: S Tilling | C37: 0 | D37: 0 | F37: 0 | H37: 0 | I37: =SUM(C37:H37) -> 0
B38: C Ferris | C38: 0 | D38: 0 | F38: 0 | H38: 0 | I38: =SUM(C38:H38) -> 0
C39: =SUM(C24:C38) -> 217 | D39: =SUM(D24:D38) -> 80 | E39: =SUM(E24:E38) -> 0 | F39: =SUM(F24:F38) -> 225 | G39: =SUM(G24:G38) -> 0 | H39: =SUM(H24:H38) -> 172 | I39: =SUM(I24:I38) -> 694