A1: Season 11 - April 1st 2009 to 31st March 2010
A2: MGA World Tour Net Greens in Regulation
B3: Statistics updated | C3: =TODAY() -> 40108
A4: Pos | B4: Player | C4: Original Handicap | D4: Current Handicap | E4: Playing Handicap | F4: Played | G4: Total Greens Hit | H4: Green in Regulation | I4: Greens in Regulation Ratio
A5: 1 | B5: Jeff Gibbons | C5: 20.5 | D5: 21.0 | E5: =D5 -> 21 | F5: 5 | G5: 59 | H5: 65.56 % | I5: =IF(G5="","",IF(G5=0,"0 : "&F5*18,"1 : "&ROUND((F5*18)/G5,1))) -> 1 : 1.5
A6: 2 | B6: Simon Thompson | C6: 12.0 | D6: 9.8 | E6: =D6 -> 9.8 | F6: 7 | G6: 75 | H6: 59.52 % | I6: =IF(G6="","",IF(G6=0,"0 : "&F6*18,"1 : "&ROUND((F6*18)/G6,1))) -> 1 : 1.7
A7: 3 | B7: Keith Mendelson | C7: 15.1 | D7: 14.6 | E7: =D7 -> 14.6 | F7: 7 | G7: 71 | H7: 56.35 % | I7: =IF(G7="","",IF(G7=0,"0 : "&F7*18,"1 : "&ROUND((F7*18)/G7,1))) -> 1 : 1.8
A8: 5 | B8: Kevin Gallagher | C8: 13.5 | D8: 12.900000000000997 | E8: =D8 -> 12.900000000000997 | F8: 11 | G8: 109 | H8: 55.05 % | I8: =IF(G8="","",IF(G8=0,"0 : "&F8*18,"1 : "&ROUND((F8*18)/G8,1))) -> 1 : 1.8
A9: 4 | B9: Robert Thompson | C9: 7.9 | D9: 9.8 | E9: =D9 -> 9.8 | F9: 10 | G9: 97 | H9: 53.89 % | I9: =IF(G9="","",IF(G9=0,"0 : "&F9*18,"1 : "&ROUND((F9*18)/G9,1))) -> 1 : 1.9
A10: 6 | B10: John Press | C10: 15.0 | D10: 14.0 | E10: =D10 -> 14 | F10: 1 | G10: 13 | H10: 72.22 % | I10: =IF(G10="","",IF(G10=0,"0 : "&F10*18,"1 : "&ROUND((F10*18)/G10,1))) -> 1 : 1.4
A11: 7 | B11: Jon Dey | C11: 37.2 | D11: 30.2 | E11: =D11 -> 30.2 | F11: 3 | G11: 38 | H11: 70.37 % | I11: =IF(G11="","",IF(G11=0,"0 : "&F11*18,"1 : "&ROUND((F11*18)/G11,1))) -> 1 : 1.4
A12: 8 | B12: Andy Benson | C12: 7.6 | D12: 7.4 | E12: =D12 -> 7.4 | F12: 2 | G12: 25 | H12: 69.44 % | I12: =IF(G12="","",IF(G12=0,"0 : "&F12*18,"1 : "&ROUND((F12*18)/G12,1))) -> 1 : 1.4
A13: 9 | B13: Dave Bingham | C13: 13.1 | D13: 13.2 | E13: =D13 -> 13.2 | F13: 4 | G13: 48 | H13: 66.67 % | I13: =IF(G13="","",IF(G13=0,"0 : "&F13*18,"1 : "&ROUND((F13*18)/G13,1))) -> 1 : 1.5
A14: 10 | B14: Dave Andrews | C14: 16.6 | D14: 16.6 | E14: =D14 -> 16.6 | F14: 2 | G14: 24 | H14: 66.67 % | I14: =IF(G14="","",IF(G14=0,"0 : "&F14*18,"1 : "&ROUND((F14*18)/G14,1))) -> 1 : 1.5
A15: 11 | B15: Martin Cox | C15: 13.6 | D15: 13.7 | E15: =D15 -> 13.7 | F15: 1 | G15: 12 | H15: 66.67 % | I15: =IF(G15="","",IF(G15=0,"0 : "&F15*18,"1 : "&ROUND((F15*18)/G15,1))) -> 1 : 1.5
A16: 12 | B16: Simon Owens | C16: 14.4 | D16: 13.7 | E16: =D16 -> 13.7 | F16: 1 | G16: 12 | H16: 66.67 % | I16: =IF(G16="","",IF(G16=0,"0 : "&F16*18,"1 : "&ROUND((F16*18)/G16,1))) -> 1 : 1.5
A17: 13 | B17: Matthew Carter | C17: 19.6 | D17: 19.4 | E17: =D17 -> 19.4 | F17: 2 | G17: 23 | H17: 63.89 % | I17: =IF(G17="","",IF(G17=0,"0 : "&F17*18,"1 : "&ROUND((F17*18)/G17,1))) -> 1 : 1.6
A18: 14 | B18: Alan Baldwin | C18: 20.3 | D18: 20.5 | E18: =D18 -> 20.5 | F18: 1 | G18: 11 | H18: 61.11 % | I18: =IF(G18="","",IF(G18=0,"0 : "&F18*18,"1 : "&ROUND((F18*18)/G18,1))) -> 1 : 1.6
A19: 15 | B19: Andrew Baldwin | C19: 18.6 | D19: 19.1 | E19: =D19 -> 19.1 | F19: 2 | G19: 21 | H19: 58.33 % | I19: =IF(G19="","",IF(G19=0,"0 : "&F19*18,"1 : "&ROUND((F19*18)/G19,1))) -> 1 : 1.7
A20: 16 | B20: Paul Carter | C20: 14.7 | D20: 14.5 | E20: =D20 -> 14.5 | F20: 2 | G20: 20 | H20: 55.56 % | I20: =IF(G20="","",IF(G20=0,"0 : "&F20*18,"1 : "&ROUND((F20*18)/G20,1))) -> 1 : 1.8
A21: 17 | B21: Paul Baldwin | C21: 19.2 | D21: 19.3 | E21: =D21 -> 19.3 | F21: 1 | G21: 10 | H21: 55.56 % | I21: =IF(G21="","",IF(G21=0,"0 : "&F21*18,"1 : "&ROUND((F21*18)/G21,1))) -> 1 : 1.8
A22: 18 | B22: Alan Hopkins | C22: 8.2 | D22: 7.9 | E22: =D22 -> 7.9 | F22: 1 | G22: 10 | H22: 55.56 % | I22: =IF(G22="","",IF(G22=0,"0 : "&F22*18,"1 : "&ROUND((F22*18)/G22,1))) -> 1 : 1.8
A23: 19 | B23: Michael Trimmings | C23: 24.0 | D23: 24.0 | E23: =D23 -> 24 | F23: 4 | G23: 36 | H23: 50 % | I23: =IF(G23="","",IF(G23=0,"0 : "&F23*18,"1 : "&ROUND((F23*18)/G23,1))) -> 1 : 2
A24: 20 | B24: Dave Rouse | C24: 25.6 | D24: 25.1 | E24: =D24 -> 25.1 | F24: 2 | G24: 18 | H24: 50 % | I24: =IF(G24="","",IF(G24=0,"0 : "&F24*18,"1 : "&ROUND((F24*18)/G24,1))) -> 1 : 2
A25: 21 | B25: Roy Dickens | C25: 29.4 | D25: 29.6 | E25: =D25 -> 29.6 | F25: 1 | G25: 9 | H25: 50 % | I25: =IF(G25="","",IF(G25=0,"0 : "&F25*18,"1 : "&ROUND((F25*18)/G25,1))) -> 1 : 2
A26: 22 | B26: Jeff Colbrook | C26: 14.9 | D26: 15.2 | E26: =D26 -> 15.2 | F26: 3 | G26: 25 | H26: 46.3 % | I26: =IF(G26="","",IF(G26=0,"0 : "&F26*18,"1 : "&ROUND((F26*18)/G26,1))) -> 1 : 2.2
A27: 23 | B27: Ian Edwards | C27: 11.8 | D27: 12.6 | E27: =D27 -> 12.6 | F27: 3 | G27: 24 | H27: 44.44 % | I27: =IF(G27="","",IF(G27=0,"0 : "&F27*18,"1 : "&ROUND((F27*18)/G27,1))) -> 1 : 2.3
A28: 24 | B28: Martin Bould | C28: 19.4 | D28: 19.5 | E28: =D28 -> 19.5 | F28: 1 | G28: 8 | H28: 44.44 % | I28: =IF(G28="","",IF(G28=0,"0 : "&F28*18,"1 : "&ROUND((F28*18)/G28,1))) -> 1 : 2.3
B29: Andrew Knight | C29: 21.4 | D29: 21.4 | E29: =D29 -> 21.4 | F29: 0 | G29: 0 | H29: 0.00 | I29: =IF(G29="","",IF(G29=0,"0 : "&F29*18,"1 : "&ROUND((F29*18)/G29,1))) -> 0 : 0
B30: Chris Manning | C30: 22.7 | D30: 22.7 | E30: =D30 -> 22.7 | F30: 0 | G30: 0 | H30: 0.00 | I30: =IF(G30="","",IF(G30=0,"0 : "&F30*18,"1 : "&ROUND((F30*18)/G30,1))) -> 0 : 0
B31: Clive Ferris | C31: 26.0 | D31: 26.0 | E31: =D31 -> 26 | F31: 0 | G31: 0 | H31: 0.00 | I31: =IF(G31="","",IF(G31=0,"0 : "&F31*18,"1 : "&ROUND((F31*18)/G31,1))) -> 0 : 0
B32: Danny Marsh | C32: 8.1 | D32: 8.1 | E32: =D32 -> 8.1 | F32: 0 | G32: 0 | H32: 0.00 | I32: =IF(G32="","",IF(G32=0,"0 : "&F32*18,"1 : "&ROUND((F32*18)/G32,1))) -> 0 : 0
B33: David Braithwaite | C33: 13.0 | D33: 13.0 | E33: =D33 -> 13 | F33: 0 | G33: 0 | H33: 0.00 | I33: =IF(G33="","",IF(G33=0,"0 : "&F33*18,"1 : "&ROUND((F33*18)/G33,1))) -> 0 : 0
B34: Keith Johns | C34: 24.3 | D34: 24.3 | E34: =D34 -> 24.3 | F34: 0 | G34: 0 | H34: 0.00 | I34: =IF(G34="","",IF(G34=0,"0 : "&F34*18,"1 : "&ROUND((F34*18)/G34,1))) -> 0 : 0
B35: Malcolm Rouse | C35: 43.9 | D35: 43.9 | E35: =D35 -> 43.9 | F35: 0 | G35: 0 | H35: 0.00 | I35: =IF(G35="","",IF(G35=0,"0 : "&F35*18,"1 : "&ROUND((F35*18)/G35,1))) -> 0 : 0
B36: Steve Tilling | C36: 16.5 | D36: 16.5 | E36: =D36 -> 16.5 | F36: 0 | G36: 0 | H36: 0.00 | I36: =IF(G36="","",IF(G36=0,"0 : "&F36*18,"1 : "&ROUND((F36*18)/G36,1))) -> 0 : 0

A1: Season 11 - April 1st 2009 to 31st March 2010
A2: MGA World Tour Net Greens in Regulation
B3: Statistics updated | C3: =TODAY() -> 40268
A4: Pos | B4: Player | C4: Original Handicap | D4: Current Handicap | E4: Playing Handicap | F4: Played | G4: Total Greens Hit | H4: Green in Regulation | I4: Greens in Regulation Ratio
A5: 1 | B5: John Press | C5: 15.0 | D5: 13.3 | E5: =D5 -> 13.3 | F5: 5 | G5: 62 | H5: 68.89 % | I5: =IF(G5="","",IF(G5=0,"0 : "&F5*18,"1 : "&ROUND((F5*18)/G5,1))) -> 1 : 1.5 | J5: Qualified
A6: 2 | B6: Jeff Gibbons | C6: 20.5 | D6: 21.0 | E6: =D6 -> 21 | F6: 5 | G6: 59 | H6: 65.56 % | I6: =IF(G6="","",IF(G6=0,"0 : "&F6*18,"1 : "&ROUND((F6*18)/G6,1))) -> 1 : 1.5 | J6: Qualified
A7: 3 | B7: Dave Bingham | C7: 13.1 | D7: 13.5 | E7: =D7 -> 13.5 | F7: 7 | G7: 79 | H7: 62.7 % | I7: =IF(G7="","",IF(G7=0,"0 : "&F7*18,"1 : "&ROUND((F7*18)/G7,1))) -> 1 : 1.6 | J7: Qualified
A8: 4 | B8: Simon Thompson | C8: 12.0 | D8: 9.6 | E8: =D8 -> 9.6 | F8: 8 | G8: 87 | H8: 60.42 % | I8: =IF(G8="","",IF(G8=0,"0 : "&F8*18,"1 : "&ROUND((F8*18)/G8,1))) -> 1 : 1.7 | J8: Qualified
A9: 5 | B9: Robert Thompson | C9: 7.9 | D9: 10.0 | E9: =D9 -> 10 | F9: 13 | G9: 135 | H9: 57.69 % | I9: =IF(G9="","",IF(G9=0,"0 : "&F9*18,"1 : "&ROUND((F9*18)/G9,1))) -> 1 : 1.7 | J9: Qualified
A10: 6 | B10: Keith Mendelson | C10: 15.1 | D10: 14.6 | E10: =D10 -> 14.6 | F10: 7 | G10: 71 | H10: 56.35 % | I10: =IF(G10="","",IF(G10=0,"0 : "&F10*18,"1 : "&ROUND((F10*18)/G10,1))) -> 1 : 1.8 | J10: Qualified
A11: 7 | B11: Kevin Gallagher | C11: 13.5 | D11: 13.500000000000995 | E11: =D11 -> 13.500000000000995 | F11: 17 | G11: 167 | H11: 54.58 % | I11: =IF(G11="","",IF(G11=0,"0 : "&F11*18,"1 : "&ROUND((F11*18)/G11,1))) -> 1 : 1.8 | J11: Qualified
A12: 8 | B12: Michael Trimmings | C12: 22.6 | D12: 24.5 | E12: =D12 -> 24.5 | F12: 6 | G12: 52 | H12: 48.15 % | I12: =IF(G12="","",IF(G12=0,"0 : "&F12*18,"1 : "&ROUND((F12*18)/G12,1))) -> 1 : 2.1 | J12: Qualified
A13: 9 | B13: Jon Dey | C13: 37.2 | D13: 30.2 | E13: =D13 -> 30.2 | F13: 3 | G13: 38 | H13: 70.37 % | I13: =IF(G13="","",IF(G13=0,"0 : "&F13*18,"1 : "&ROUND((F13*18)/G13,1))) -> 1 : 1.4
A14: 10 | B14: Andy Benson | C14: 7.6 | D14: 7.4 | E14: =D14 -> 7.4 | F14: 2 | G14: 25 | H14: 69.44 % | I14: =IF(G14="","",IF(G14=0,"0 : "&F14*18,"1 : "&ROUND((F14*18)/G14,1))) -> 1 : 1.4
A15: 11 | B15: Martin Cox | C15: 13.6 | D15: 13.7 | E15: =D15 -> 13.7 | F15: 1 | G15: 12 | H15: 66.67 % | I15: =IF(G15="","",IF(G15=0,"0 : "&F15*18,"1 : "&ROUND((F15*18)/G15,1))) -> 1 : 1.5
A16: 12 | B16: Simon Owens | C16: 14.4 | D16: 13.7 | E16: =D16 -> 13.7 | F16: 1 | G16: 12 | H16: 66.67 % | I16: =IF(G16="","",IF(G16=0,"0 : "&F16*18,"1 : "&ROUND((F16*18)/G16,1))) -> 1 : 1.5
A17: 13 | B17: David Braithwaite | C17: 13.0 | D17: 12.0 | E17: =D17 -> 12 | F17: 4 | G17: 46 | H17: 63.89 % | I17: =IF(G17="","",IF(G17=0,"0 : "&F17*18,"1 : "&ROUND((F17*18)/G17,1))) -> 1 : 1.6
A18: 14 | B18: Dave Andrews | C18: 16.6 | D18: 16.700000000001001 | E18: =D18 -> 16.700000000001001 | F18: 4 | G18: 46 | H18: 63.89 % | I18: =IF(G18="","",IF(G18=0,"0 : "&F18*18,"1 : "&ROUND((F18*18)/G18,1))) -> 1 : 1.6
A19: 15 | B19: Alan Baldwin | C19: 20.3 | D19: 20.5 | E19: =D19 -> 20.5 | F19: 1 | G19: 11 | H19: 61.11 % | I19: =IF(G19="","",IF(G19=0,"0 : "&F19*18,"1 : "&ROUND((F19*18)/G19,1))) -> 1 : 1.6
A20: 16 | B20: Paul Carter | C20: 14.7 | D20: 13.3 | E20: =D20 -> 13.3 | F20: 4 | G20: 42 | H20: 58.33 % | I20: =IF(G20="","",IF(G20=0,"0 : "&F20*18,"1 : "&ROUND((F20*18)/G20,1))) -> 1 : 1.7
A21: 17 | B21: Matthew Carter | C21: 19.6 | D21: 19.500000000001002 | E21: =D21 -> 19.500000000001002 | F21: 4 | G21: 41 | H21: 56.94 % | I21: =IF(G21="","",IF(G21=0,"0 : "&F21*18,"1 : "&ROUND((F21*18)/G21,1))) -> 1 : 1.8
A22: 18 | B22: Paul Baldwin | C22: 19.2 | D22: 19.3 | E22: =D22 -> 19.3 | F22: 1 | G22: 10 | H22: 55.56 % | I22: =IF(G22="","",IF(G22=0,"0 : "&F22*18,"1 : "&ROUND((F22*18)/G22,1))) -> 1 : 1.8
A23: 19 | B23: Alan Hopkins | C23: 8.2 | D23: 7.9 | E23: =D23 -> 7.9 | F23: 1 | G23: 10 | H23: 55.56 % | I23: =IF(G23="","",IF(G23=0,"0 : "&F23*18,"1 : "&ROUND((F23*18)/G23,1))) -> 1 : 1.8
A24: 20 | B24: Andrew Baldwin | C24: 18.6 | D24: 19.2 | E24: =D24 -> 19.2 | F24: 3 | G24: 28 | H24: 51.85 % | I24: =IF(G24="","",IF(G24=0,"0 : "&F24*18,"1 : "&ROUND((F24*18)/G24,1))) -> 1 : 1.9
A25: 21 | B25: Roy Dickens | C25: 29.4 | D25: 29.8 | E25: =D25 -> 29.8 | F25: 2 | G25: 17 | H25: 47.22 % | I25: =IF(G25="","",IF(G25=0,"0 : "&F25*18,"1 : "&ROUND((F25*18)/G25,1))) -> 1 : 2.1
A26: 22 | B26: Jeff Colbrook | C26: 14.9 | D26: 15.2 | E26: =D26 -> 15.2 | F26: 3 | G26: 25 | H26: 46.3 % | I26: =IF(G26="","",IF(G26=0,"0 : "&F26*18,"1 : "&ROUND((F26*18)/G26,1))) -> 1 : 2.2
A27: 23 | B27: Martin Bould | C27: 19.4 | D27: 19.7 | E27: =D27 -> 19.7 | F27: 2 | G27: 16 | H27: 44.44 % | I27: =IF(G27="","",IF(G27=0,"0 : "&F27*18,"1 : "&ROUND((F27*18)/G27,1))) -> 1 : 2.3
A28: 24 | B28: Dave Rouse | C28: 25.6 | D28: 25.6 | E28: =D28 -> 25.6 | F28: 3 | G28: 23 | H28: 42.59 % | I28: =IF(G28="","",IF(G28=0,"0 : "&F28*18,"1 : "&ROUND((F28*18)/G28,1))) -> 1 : 2.3
A29: 25 | B29: Ian Edwards | C29: 11.8 | D29: 13.6 | E29: =D29 -> 13.6 | F29: 4 | G29: 30 | H29: 41.67 % | I29: =IF(G29="","",IF(G29=0,"0 : "&F29*18,"1 : "&ROUND((F29*18)/G29,1))) -> 1 : 2.4
B30: Andrew Knight | C30: 21.4 | D30: 21.4 | E30: =D30 -> 21.4 | F30: 0 | G30: 0 | H30: 0.00 | I30: =IF(G30="","",IF(G30=0,"0 : "&F30*18,"1 : "&ROUND((F30*18)/G30,1))) -> 0 : 0
B31: Chris Manning | C31: 22.7 | D31: 22.7 | E31: =D31 -> 22.7 | F31: 0 | G31: 0 | H31: 0.00 | I31: =IF(G31="","",IF(G31=0,"0 : "&F31*18,"1 : "&ROUND((F31*18)/G31,1))) -> 0 : 0
B32: Clive Ferris | C32: 26.0 | D32: 26.0 | E32: =D32 -> 26 | F32: 0 | G32: 0 | H32: 0.00 | I32: =IF(G32="","",IF(G32=0,"0 : "&F32*18,"1 : "&ROUND((F32*18)/G32,1))) -> 0 : 0
B33: Danny Marsh | C33: 8.1 | D33: 8.1 | E33: =D33 -> 8.1 | F33: 0 | G33: 0 | H33: 0.00 | I33: =IF(G33="","",IF(G33=0,"0 : "&F33*18,"1 : "&ROUND((F33*18)/G33,1))) -> 0 : 0
B34: Keith Johns | C34: 24.3 | D34: 24.3 | E34: =D34 -> 24.3 | F34: 0 | G34: 0 | H34: 0.00 | I34: =IF(G34="","",IF(G34=0,"0 : "&F34*18,"1 : "&ROUND((F34*18)/G34,1))) -> 0 : 0
B35: Malcolm Rouse | C35: 43.9 | D35: 43.9 | E35: =D35 -> 43.9 | F35: 0 | G35: 0 | H35: 0.00 | I35: =IF(G35="","",IF(G35=0,"0 : "&F35*18,"1 : "&ROUND((F35*18)/G35,1))) -> 0 : 0
B36: Steve Tilling | C36: 16.5 | D36: 16.5 | E36: =D36 -> 16.5 | F36: 0 | G36: 0 | H36: 0.00 | I36: =IF(G36="","",IF(G36=0,"0 : "&F36*18,"1 : "&ROUND((F36*18)/G36,1))) -> 0 : 0