A1: Season 11 - April 1st 2009 to 31st March 2010
A2: MGA World Tour Order of Merit
B3: Statistics updated | C3: =TODAY() -> 40268
A4: Pos | B4: Player | C4: Original Handicap | D4: Current Handicap | E4: Playing Handicap | F4: Played | G4: Points | H4: Average | I4: HI / LOW Score | J4: Qualified (5 games)
A5: 1 | B5: John Press | C5: 15.0 | D5: 13.3 | E5: =D5 -> 13.3 | F5: 5 | G5: 172 | H5: =IF(ISERROR(G5/F5),0,G5/F5) -> 34.40 | I5: 39 / 29 | J5: =IF(F5>=5,"Qualified","") -> Qualified
A6: 2 | B6: Dave Bingham | C6: 13.1 | D6: 13.5 | E6: =D6 -> 13.5 | F6: 7 | G6: 228 | H6: =IF(ISERROR(G6/F6),0,G6/F6) -> 32.571428571428569 | I6: 36 / 27 | J6: =IF(F6>=5,"Qualified","") -> Qualified
A7: 3 | B7: Keith Mendelson | C7: 15.1 | D7: 14.6 | E7: =D7 -> 14.6 | F7: 7 | G7: 224 | H7: =IF(ISERROR(G7/F7),0,G7/F7) -> 32.00 | I7: 38 / 28 | J7: =IF(F7>=5,"Qualified","") -> Qualified
A8: 4 | B8: Jeff Gibbons | C8: 20.5 | D8: 21.0 | E8: =D8 -> 21 | F8: 5 | G8: 152 | H8: =IF(ISERROR(G8/F8),0,G8/F8) -> 30.40 | I8: 33 / 26 | J8: =IF(F8>=5,"Qualified","") -> Qualified
A9: 5 | B9: Kevin Gallagher | C9: 13.5 | D9: 13.500000000000995 | E9: =D9 -> 13.500000000000995 | F9: 17 | G9: 508 | H9: =IF(ISERROR(G9/F9),0,G9/F9) -> 29.882352941176471 | I9: 39 / 22 | J9: =IF(F9>=5,"Qualified","") -> Qualified
A10: 6 | B10: Robert Thompson | C10: 7.9 | D10: 10.0 | E10: =D10 -> 10 | F10: 13 | G10: 377 | H10: =IF(ISERROR(G10/F10),0,G10/F10) -> 29.00 | I10: 37 / 18 | J10: =IF(F10>=5,"Qualified","") -> Qualified
A11: 7 | B11: Simon Thompson | C11: 12.0 | D11: 9.6 | E11: =D11 -> 9.6 | F11: 8 | G11: 230 | H11: =IF(ISERROR(G11/F11),0,G11/F11) -> 28.75 | I11: 42 / 21 | J11: =IF(F11>=5,"Qualified","") -> Qualified
A12: 8 | B12: Michael Trimmings | C12: 22.6 | D12: 24.5 | E12: =D12 -> 24.5 | F12: 6 | G12: 147 | H12: =IF(ISERROR(G12/F12),0,G12/F12) -> 24.50 | I12: 35 / 18 | J12: =IF(F12>=5,"Qualified","") -> Qualified
A13: 9 | B13: Jon Dey | C13: 37.2 | D13: 30.2 | E13: =D13 -> 30.2 | F13: 3 | G13: 123 | H13: =IF(ISERROR(G13/F13),0,G13/F13) -> 41.00 | I13: 47 / 34 | J13: =IF(F13>=5,"Qualified","") -> 
A14: 10 | B14: Simon Owens | C14: 14.4 | D14: 13.7 | E14: =D14 -> 13.7 | F14: 1 | G14: 38 | H14: =IF(ISERROR(G14/F14),0,G14/F14) -> 38.00 | I14: 38 / 38 | J14: =IF(F14>=5,"Qualified","") -> 
A15: 11 | B15: David Braithwaite | C15: 13.0 | D15: 12.0 | E15: =D15 -> 12 | F15: 4 | G15: 138 | H15: =IF(ISERROR(G15/F15),0,G15/F15) -> 34.50 | I15: 38 / 31 | J15: =IF(F15>=5,"Qualified","") -> 
A16: 12 | B16: Alan Hopkins | C16: 8.2 | D16: 7.9 | E16: =D16 -> 7.9 | F16: 1 | G16: 34 | H16: =IF(ISERROR(G16/F16),0,G16/F16) -> 34.00 | I16: 34 / 34 | J16: =IF(F16>=5,"Qualified","") -> 
A17: 13 | B17: Paul Carter | C17: 14.7 | D17: 13.3 | E17: =D17 -> 13.3 | F17: 4 | G17: 133 | H17: =IF(ISERROR(G17/F17),0,G17/F17) -> 33.25 | I17: 37 / 29 | J17: =IF(F17>=5,"Qualified","") -> 
A18: 14 | B18: Dave Andrews | C18: 16.6 | D18: 16.700000000001001 | E18: =D18 -> 16.700000000001001 | F18: 4 | G18: 131 | H18: =IF(ISERROR(G18/F18),0,G18/F18) -> 32.75 | I18: 36 / 28 | J18: =IF(F18>=5,"Qualified","") -> 
A19: 15 | B19: Matthew Carter | C19: 19.6 | D19: 19.500000000001002 | E19: =D19 -> 19.500000000001002 | F19: 4 | G19: 127 | H19: =IF(ISERROR(G19/F19),0,G19/F19) -> 31.75 | I19: 38 / 27 | J19: =IF(F19>=5,"Qualified","") -> 
A20: 16 | B20: Andy Benson | C20: 7.6 | D20: 7.4 | E20: =D20 -> 7.4 | F20: 2 | G20: 63 | H20: =IF(ISERROR(G20/F20),0,G20/F20) -> 31.50 | I20: 34 / 29 | J20: =IF(F20>=5,"Qualified","") -> 
A21: 17 | B21: Jeff Colbrook | C21: 14.9 | D21: 15.2 | E21: =D21 -> 15.2 | F21: 3 | G21: 89 | H21: =IF(ISERROR(G21/F21),0,G21/F21) -> 29.666666666666668 | I21: 33 / 25 | J21: =IF(F21>=5,"Qualified","") -> 
A22: 18 | B22: Martin Bould | C22: 19.4 | D22: 19.7 | E22: =D22 -> 19.7 | F22: 2 | G22: 58 | H22: =IF(ISERROR(G22/F22),0,G22/F22) -> 29.00 | I22: 32 / 26 | J22: =IF(F22>=5,"Qualified","") -> 
A23: 19 | B23: Martin Cox | C23: 13.6 | D23: 13.7 | E23: =D23 -> 13.7 | F23: 1 | G23: 29 | H23: =IF(ISERROR(G23/F23),0,G23/F23) -> 29.00 | I23: 29 / 29 | J23: =IF(F23>=5,"Qualified","") -> 
A24: 20 | B24: Paul Baldwin | C24: 19.2 | D24: 19.3 | E24: =D24 -> 19.3 | F24: 1 | G24: 29 | H24: =IF(ISERROR(G24/F24),0,G24/F24) -> 29.00 | I24: 29 / 29 | J24: =IF(F24>=5,"Qualified","") -> 
A25: 21 | B25: Andrew Baldwin | C25: 18.6 | D25: 19.2 | E25: =D25 -> 19.2 | F25: 3 | G25: 85 | H25: =IF(ISERROR(G25/F25),0,G25/F25) -> 28.333333333333332 | I25: 36 / 20 | J25: =IF(F25>=5,"Qualified","") -> 
A26: 22 | B26: Dave Rouse | C26: 25.6 | D26: 25.6 | E26: =D26 -> 25.6 | F26: 3 | G26: 83 | H26: =IF(ISERROR(G26/F26),0,G26/F26) -> 27.666666666666668 | I26: 35 / 21 | J26: =IF(F26>=5,"Qualified","") -> 
A27: 23 | B27: Alan Baldwin | C27: 20.3 | D27: 20.5 | E27: =D27 -> 20.5 | F27: 1 | G27: 26 | H27: =IF(ISERROR(G27/F27),0,G27/F27) -> 26.00 | I27: 26 / 26 | J27: =IF(F27>=5,"Qualified","") -> 
A28: 24 | B28: Roy Dickens | C28: 29.4 | D28: 29.8 | E28: =D28 -> 29.8 | F28: 2 | G28: 49 | H28: =IF(ISERROR(G28/F28),0,G28/F28) -> 24.50 | I28: 27 / 22 | J28: =IF(F28>=5,"Qualified","") -> 
B29: Ian Edwards | C29: 11.8 | D29: 13.6 | E29: =D29 -> 13.6 | F29: 4 | G29: 91 | H29: =IF(ISERROR(G29/F29),0,G29/F29) -> 22.75 | I29: 31 / 16 | J29: =IF(F29>=5,"Qualified","") -> 
B30: Andrew Knight | C30: 21.4 | D30: 21.4 | E30: =D30 -> 21.4 | F30: 0 | G30: 0 | H30: =IF(ISERROR(G30/F30),0,G30/F30) -> 0.00 | I30: / | J30: =IF(F30>=5,"Qualified","") -> 
B31: Chris Manning | C31: 22.7 | D31: 22.7 | E31: =D31 -> 22.7 | F31: 0 | G31: 0 | H31: =IF(ISERROR(G31/F31),0,G31/F31) -> 0.00 | I31: / | J31: =IF(F31>=5,"Qualified","") -> 
B32: Clive Ferris | C32: 26.0 | D32: 26.0 | E32: =D32 -> 26 | F32: 0 | G32: 0 | H32: =IF(ISERROR(G32/F32),0,G32/F32) -> 0.00 | I32: / | J32: =IF(F32>=5,"Qualified","") -> 
B33: Danny Marsh | C33: 8.1 | D33: 8.1 | E33: =D33 -> 8.1 | F33: 0 | G33: 0 | H33: =IF(ISERROR(G33/F33),0,G33/F33) -> 0.00 | I33: / | J33: =IF(F33>=5,"Qualified","") -> 
B34: Keith Johns | C34: 24.3 | D34: 24.3 | E34: =D34 -> 24.3 | F34: 0 | G34: 0 | H34: =IF(ISERROR(G34/F34),0,G34/F34) -> 0.00 | I34: / | J34: =IF(F34>=5,"Qualified","") -> 
B35: Malcolm Rouse | C35: 43.9 | D35: 43.9 | E35: =D35 -> 43.9 | F35: 0 | G35: 0 | H35: =IF(ISERROR(G35/F35),0,G35/F35) -> 0.00 | I35: / | J35: =IF(F35>=5,"Qualified","") -> 
B36: Steve Tilling | C36: 16.5 | D36: 16.5 | E36: =D36 -> 16.5 | F36: 0 | G36: 0 | H36: =IF(ISERROR(G36/F36),0,G36/F36) -> 0.00 | I36: / | J36: =IF(F36>=5,"Qualified","") -> 