B1: Season 15 - April 14th 2013 to 31st March 2014
A2: MGA World Tour Net Greens in Regulation
B3: Statistics updated | C3: =TODAY() -> 41729
A4: Pos | B4: Player | C4: Original Handicap | D4: Current Handicap | E4: Playing Handicap | F4: Played | G4: Total Greens Hit | H4: Green in Regulation | I4: Greens in Regulation Ratio
A5: 1 | B5: Andrew Baldwin | C5: 20.1 | D5: 20.100000000001003 | E5: =D5 -> 20.100000000001003 | F5: 4 | G5: 46 | H5: 63.89 % | I5: =IF(G5="","",IF(G5=0,"0 : "&F5*18,"1 : "&ROUND((F5*18)/G5,1))) -> 1 : 1.6 | J5: Qualified
A6: 2 | B6: David Archer | C6: 24.1 | D6: 21.7 | E6: =D6 -> 21.7 | F6: 5 | G6: 56 | H6: 62.22 % | I6: =IF(G6="","",IF(G6=0,"0 : "&F6*18,"1 : "&ROUND((F6*18)/G6,1))) -> 1 : 1.6 | J6: Qualified
A7: 3 | B7: Paul Baldwin | C7: 21.1 | D7: 20.500000000001002 | E7: =D7 -> 20.500000000001002 | F7: 5 | G7: 54 | H7: 60 % | I7: =IF(G7="","",IF(G7=0,"0 : "&F7*18,"1 : "&ROUND((F7*18)/G7,1))) -> 1 : 1.7 | J7: Qualified
A8: 4 | B8: Jon Press | C8: 14.5 | D8: 12.800000000000999 | E8: =D8 -> 12.800000000000999 | F8: 5 | G8: 53 | H8: 58.89 % | I8: =IF(G8="","",IF(G8=0,"0 : "&F8*18,"1 : "&ROUND((F8*18)/G8,1))) -> 1 : 1.7 | J8: Qualified
A9: 5 | B9: Matthew Carter | C9: 16.7 | D9: 16.4 | E9: =D9 -> 16.4 | F9: 7 | G9: 74 | H9: 58.73 % | I9: =IF(G9="","",IF(G9=0,"0 : "&F9*18,"1 : "&ROUND((F9*18)/G9,1))) -> 1 : 1.7 | J9: Qualified
A10: 6 | B10: Roy Dickens | C10: 30.8 | D10: 29.8 | E10: =D10 -> 29.8 | F10: 6 | G10: 62 | H10: 57.41 % | I10: =IF(G10="","",IF(G10=0,"0 : "&F10*18,"1 : "&ROUND((F10*18)/G10,1))) -> 1 : 1.7 | J10: Qualified
A11: 7 | B11: Kevin Gallagher | C11: 15.8 | D11: 13.300000000001004 | E11: =D11 -> 13.300000000001004 | F11: 14 | G11: 140 | H11: 55.56 % | I11: =IF(G11="","",IF(G11=0,"0 : "&F11*18,"1 : "&ROUND((F11*18)/G11,1))) -> 1 : 1.8 | J11: Qualified
A12: 8 | B12: Jon Dey | C12: 26.6 | D12: 23.9 | E12: =D12 -> 23.9 | F12: 8 | G12: 80 | H12: 55.56 % | I12: =IF(G12="","",IF(G12=0,"0 : "&F12*18,"1 : "&ROUND((F12*18)/G12,1))) -> 1 : 1.8 | J12: Qualified
A13: 9 | B13: Dave Rouse | C13: 25.8 | D13: 26.3 | E13: =D13 -> 26.3 | F13: 7 | G13: 68 | H13: 53.97 % | I13: =IF(G13="","",IF(G13=0,"0 : "&F13*18,"1 : "&ROUND((F13*18)/G13,1))) -> 1 : 1.9 | J13: Qualified
A14: 10 | B14: Keith Mendelson | C14: 15.2 | D14: 12.0 | E14: =D14 -> 12 | F14: 6 | G14: 54 | H14: 50 % | I14: =IF(G14="","",IF(G14=0,"0 : "&F14*18,"1 : "&ROUND((F14*18)/G14,1))) -> 1 : 2 | J14: Qualified
A15: 11 | B15: Ian Edwards | C15: 14.5 | D15: 15.4 | E15: =D15 -> 15.4 | F15: 7 | G15: 61 | H15: 48.41 % | I15: =IF(G15="","",IF(G15=0,"0 : "&F15*18,"1 : "&ROUND((F15*18)/G15,1))) -> 1 : 2.1 | J15: Qualified
A16: 12 | B16: Dave Andrews | C16: 15.8 | D16: 15.7 | E16: =D16 -> 15.7 | F16: 6 | G16: 52 | H16: 48.15 % | I16: =IF(G16="","",IF(G16=0,"0 : "&F16*18,"1 : "&ROUND((F16*18)/G16,1))) -> 1 : 2.1 | J16: Qualified
A17: 13 | B17: Paul Carter | C17: 14.0 | D17: 14.5 | E17: =D17 -> 14.5 | F17: 8 | G17: 69 | H17: 47.92 % | I17: =IF(G17="","",IF(G17=0,"0 : "&F17*18,"1 : "&ROUND((F17*18)/G17,1))) -> 1 : 2.1 | J17: Qualified
A18: 14 | B18: Robert Thompson | C18: 10.1 | D18: 10.2 | E18: =D18 -> 10.2 | F18: 14 | G18: 120 | H18: 47.62 % | I18: =IF(G18="","",IF(G18=0,"0 : "&F18*18,"1 : "&ROUND((F18*18)/G18,1))) -> 1 : 2.1 | J18: Qualified
A19: 15 | B19: Simon Thompson | C19: 9.2 | D19: 11.4 | E19: =D19 -> 11.4 | F19: 8 | G19: 67 | H19: 46.53 % | I19: =IF(G19="","",IF(G19=0,"0 : "&F19*18,"1 : "&ROUND((F19*18)/G19,1))) -> 1 : 2.1 | J19: Qualified
A20: 16 | B20: David Braithwaite | C20: 12.1 | D20: 12.7 | E20: =D20 -> 12.7 | F20: 6 | G20: 48 | H20: 44.44 % | I20: =IF(G20="","",IF(G20=0,"0 : "&F20*18,"1 : "&ROUND((F20*18)/G20,1))) -> 1 : 2.3 | J20: Qualified
A21: 17 | B21: Jeff Colbrook | C21: 15.5 | D21: 17.4 | E21: =D21 -> 17.4 | F21: 5 | G21: 39 | H21: 43.33 % | I21: =IF(G21="","",IF(G21=0,"0 : "&F21*18,"1 : "&ROUND((F21*18)/G21,1))) -> 1 : 2.3 | J21: Qualified
A22: 18 | B22: Steve Tilling | C22: 16.5 | D22: 16.3 | E22: =D22 -> 16.3 | F22: 3 | G22: 67 | H22: 64.81 % | I22: =IF(G22="","",IF(G22=0,"0 : "&F22*18,"1 : "&ROUND((F22*18)/G22,1))) -> 1 : 0.8 | J22: Qualified
A23: 19 | B23: Dave Kewley (Wolfie) | C23: 22.0 | D23: 17.200000000001001 | E23: =D23 -> 17.200000000001001 | F23: 4 | G23: 46 | H23: 63.89 % | I23: =IF(G23="","",IF(G23=0,"0 : "&F23*18,"1 : "&ROUND((F23*18)/G23,1))) -> 1 : 1.6 | J23: Qualified
A24: 20 | B24: Michael Trimmings | C24: 24.5 | D24: 20.4 | E24: =D24 -> 20.4 | F24: 7 | G24: 70 | H24: 55.56 % | I24: =IF(G24="","",IF(G24=0,"0 : "&F24*18,"1 : "&ROUND((F24*18)/G24,1))) -> 1 : 1.8 | J24: Qualified
A25: 21 | B25: Simon Owens | C25: 14.5 | D25: 14.800000000000999 | E25: =D25 -> 14.800000000000999 | F25: 3 | G25: 30 | H25: 55.56 % | I25: =IF(G25="","",IF(G25=0,"0 : "&F25*18,"1 : "&ROUND((F25*18)/G25,1))) -> 1 : 1.8 | J25: Qualified
A26: 22 | B26: Martin Cox | C26: 13.7 | D26: 13.0 | E26: =D26 -> 13 | F26: 4 | G26: 37 | H26: 51.39 % | I26: =IF(G26="","",IF(G26=0,"0 : "&F26*18,"1 : "&ROUND((F26*18)/G26,1))) -> 1 : 1.9 | J26: Qualified
A27: 23 | B27: Dave Bingham | C27: 10.9 | D27: 11.400000000000999 | E27: =D27 -> 11.400000000000999 | F27: 4 | G27: 35 | H27: 48.61 % | I27: =IF(G27="","",IF(G27=0,"0 : "&F27*18,"1 : "&ROUND((F27*18)/G27,1))) -> 1 : 2.1 | J27: Qualified
A28: 24 | B28: Alan Hopkins | C28: 7.7 | D28: 8.1 | E28: =D28 -> 8.1 | F28: 3 | G28: 26 | H28: 48.15 % | I28: =IF(G28="","",IF(G28=0,"0 : "&F28*18,"1 : "&ROUND((F28*18)/G28,1))) -> 1 : 2.1 | J28: Qualified
A29: 25 | B29: Alan Baldwin | C29: 20.9 | D29: 21.1 | E29: =D29 -> 21.1 | F29: 2 | G29: 22 | H29: 61.11 % | I29: =IF(G29="","",IF(G29=0,"0 : "&F29*18,"1 : "&ROUND((F29*18)/G29,1))) -> 1 : 1.6
A30: 26 | B30: Chris Manning | C30: 22.8 | D30: 22.9 | E30: =D30 -> 22.9 | F30: 1 | G30: 10 | H30: 55.56 % | I30: =IF(G30="","",IF(G30=0,"0 : "&F30*18,"1 : "&ROUND((F30*18)/G30,1))) -> 1 : 1.8
A31: 27 | B31: Martin Bould | C31: 14.8 | D31: 16.0 | E31: =D31 -> 16 | F31: 2 | G31: 14 | H31: 38.89 % | I31: =IF(G31="","",IF(G31=0,"0 : "&F31*18,"1 : "&ROUND((F31*18)/G31,1))) -> 1 : 2.6
B32: Malcolm Rouse | C32: 44.9 | D32: 44.9 | E32: =D32 -> 44.9 | F32: 0 | G32: 0 | H32: 0.00 | I32: =IF(G32="","",IF(G32=0,"0 : "&F32*18,"1 : "&ROUND((F32*18)/G32,1))) -> 0 : 0
B33: Dave White | C33: 21.5 | D33: 21.5 | E33: =D33 -> 21.5 | F33: 0 | G33: 0 | H33: 0.00 | I33: =IF(G33="","",IF(G33=0,"0 : "&F33*18,"1 : "&ROUND((F33*18)/G33,1))) -> 0 : 0
B34: Clive Ferris | C34: 26.0 | D34: 26.0 | E34: =D34 -> 26 | F34: 0 | G34: 0 | H34: 0.00 | I34: =IF(G34="","",IF(G34=0,"0 : "&F34*18,"1 : "&ROUND((F34*18)/G34,1))) -> 0 : 0
B35: Andy Benson | C35: 6.3 | D35: 6.3 | E35: =D35 -> 6.3 | F35: 0 | G35: 0 | H35: 0.00 | I35: =IF(G35="","",IF(G35=0,"0 : "&F35*18,"1 : "&ROUND((F35*18)/G35,1))) -> 0 : 0