B1: MAJORS TROPHY - 2013/2014
B3: Awarded to the player with most accumulated points in Majors in a season
C4: Tubby Trophy 7/5/13 | D4: Mendy's Masters 7/9/13 | E4: Bubble Open 8/6/13 | F4: Rousey Invitation 5/10/13 | G4: Skips Memorial 20/7/13 | H4: Thommo Classic 29/3/14 | I4: Total
B5: J Dey | C5: 33 | D5: 37 | E5: 40 | F5: 35 | G5: 37 | H5: 29 | I5: =SUM(C5:H5) -> 211
B6: K Gallagher | C6: 25 | D6: 43 | E6: 27 | F6: 34 | G6: 39 | H6: 29 | I6: =SUM(C6:H6) -> 197
B7: P Carter | C7: 23 | D7: 33 | E7: 34 | F7: 32 | G7: 33 | H7: 26 | I7: =SUM(C7:H7) -> 181
B8: M Carter | C8: 17 | D8: 41 | E8: 31 | F8: 29 | G8: 36 | H8: 26 | I8: =SUM(C8:H8) -> 180
B9: M Trimmings | C9: 33 | D9: 0 | E9: 19 | F9: 36 | G9: 46 | H9: 29 | I9: =SUM(C9:H9) -> 163
B10: R Dickens | C10: 24 | D10: 0 | E10: 30 | F10: 37 | G10: 38 | H10: 32 | I10: =SUM(C10:H10) -> 161
B11: D Rouse | C11: 25 | D11: 30 | E11: 32 | F11: 25 | G11: 28 | H11: 20 | I11: =SUM(C11:H11) -> 160
B12: P Baldwin | C12: 27 | D12: 34 | E12: 30 | F12: 0 | G12: 40 | H12: 28 | I12: =SUM(C12:H12) -> 159
B13: D Archer | C13: 0 | D13: 35 | E13: 27 | F13: 26 | G13: 44 | H13: 20 | I13: =SUM(C13:H13) -> 152
B14: I Edwards | C14: 0 | D14: 32 | E14: 24 | F14: 33 | G14: 31 | H14: 31 | I14: =SUM(C14:H14) -> 151
B15: K Mendelson | C15: 24 | D15: 44 | E15: 23 | F15: 0 | G15: 34 | H15: 23 | I15: =SUM(C15:H15) -> 148
B16: S Thompson | C16: 21 | D16: 33 | E16: 31 | F16: 30 | G16: 31 | H16: 0 | I16: =SUM(C16:H16) -> 146
B17: R Thompson | C17: 28 | D17: 0 | E17: 22 | F17: 39 | G17: 35 | H17: 14 | I17: =SUM(C17:H17) -> 138
B18: A Baldwin (Jnr) | C18: 29 | D18: 0 | E18: 0 | F18: 33 | G18: 37 | H18: 28 | I18: =SUM(C18:H18) -> 127
B19: D Braithwaite | C19: 31 | D19: 0 | E19: 0 | F19: 33 | G19: 34 | H19: 29 | I19: =SUM(C19:H19) -> 127
B20: J Colbrook | C20: 0 | D20: 32 | E20: 17 | F20: 16 | G20: 38 | H20: 22 | I20: =SUM(C20:H20) -> 125
B21: D Andrews | C21: 33 | D21: 30 | E21: 0 | F21: 0 | G21: 29 | H21: 30 | I21: =SUM(C21:H21) -> 122
B22: M Cox | C22: 21 | D22: 0 | E22: 0 | F22: 39 | G22: 36 | H22: 23 | I22: =SUM(C22:H22) -> 119
B23: D Bingham | C23: 0 | D23: 32 | E23: 26 | F23: 32 | G23: 0 | H23: 28 | I23: =SUM(C23:H23) -> 118
B24: D Kewley | C24: 0 | D24: 0 | E24: 0 | F24: 35 | G24: 51 | H24: 28 | I24: =SUM(C24:H24) -> 114
B25: J Press | C25: 31 | D25: 0 | E25: 0 | F25: 0 | G25: 40 | H25: 34 | I25: =SUM(C25:H25) -> 105
B26: S Tilling | C26: 0 | D26: 38 | E26: 0 | F26: 24 | G26: 35 | H26: 0 | I26: =SUM(C26:H26) -> 97
B27: S Owens | C27: 0 | D27: 27 | E27: 0 | F27: 32 | G27: 30 | H27: 0 | I27: =SUM(C27:H27) -> 89
B28: A Hopkins | C28: 0 | D28: 0 | E28: 0 | F28: 30 | G28: 27 | H28: 23 | I28: =SUM(C28:H28) -> 80
B29: A Baldwin (Snr) | C29: 0 | D29: 30 | E29: 0 | F29: 0 | G29: 31 | H29: 0 | I29: =SUM(C29:H29) -> 61
B30: C Manning | C30: 0 | D30: 0 | E30: 0 | F30: 30 | G30: 0 | H30: 0 | I30: =SUM(C30:H30) -> 30
B31: M Bould | C31: 0 | D31: 0 | E31: 18 | F31: 0 | G31: 0 | H31: 0 | I31: =SUM(C31:H31) -> 18