A1: Season 15 - April 14th 2013 to 31st March 2014
A2: MGA World Tour Money List
B3: Statistics updated | C3: =TODAY() -> 41729
A4: Pos | B4: Player | C4: Original Handicap | D4: Current Handicap | E4: Playing Handicap | F4: Events Played | G4: Tour Victories | H4: Winnings
A5: 1 | B5: Kevin Gallagher | C5: 15.8 | D5: 13.300000000001004 | E5: =D5 -> 13.300000000001004 | F5: 14 | G5: 3 | H5: 245000
A6: 2 | B6: Jon Dey | C6: 26.6 | D6: 23.9 | E6: =D6 -> 23.9 | F6: 8 | G6: 2 | H6: 240000
A7: 3 | B7: Michael Trimmings | C7: 24.5 | D7: 20.4 | E7: =D7 -> 20.4 | F7: 7 | G7: 1 | H7: 200000
A8: 5 | B8: Roy Dickens | C8: 30.8 | D8: 29.8 | E8: =D8 -> 29.8 | F8: 6 | G8: 0 | H8: 183750
A9: 4 | B9: Robert Thompson | C9: 10.1 | D9: 10.2 | E9: =D9 -> 10.2 | F9: 14 | G9: 4 | H9: 163750
A10: 6 | B10: Paul Baldwin | C10: 21.1 | D10: 20.500000000001002 | E10: =D10 -> 20.500000000001002 | F10: 5 | G10: 0 | H10: 153750
A11: 7 | B11: Jon Press | C11: 14.5 | D11: 12.800000000000999 | E11: =D11 -> 12.800000000000999 | F11: 5 | G11: 2 | H11: 150000
A12: 8 | B12: Dave Kewley (Wolfie) | C12: 22.0 | D12: 17.200000000001001 | E12: =D12 -> 17.200000000001001 | F12: 4 | G12: 2 | H12: 142500
A13: 9 | B13: Matthew Carter | C13: 16.7 | D13: 16.4 | E13: =D13 -> 16.4 | F13: 7 | G13: 1 | H13: 141250
A14: 10 | B14: Paul Carter | C14: 14.0 | D14: 14.5 | E14: =D14 -> 14.5 | F14: 8 | G14: 0 | H14: 140000
A15: 11 | B15: David Braithwaite | C15: 12.1 | D15: 12.7 | E15: =D15 -> 12.7 | F15: 6 | G15: 0 | H15: 133750
A16: 12 | B16: Ian Edwards | C16: 14.5 | D16: 15.4 | E16: =D16 -> 15.4 | F16: 7 | G16: 1 | H16: 132500
A17: 13 | B17: Andrew Baldwin | C17: 20.1 | D17: 20.100000000001003 | E17: =D17 -> 20.100000000001003 | F17: 4 | G17: 0 | H17: 127500
A18: 14 | B18: David Archer | C18: 24.1 | D18: 21.7 | E18: =D18 -> 21.7 | F18: 5 | G18: 0 | H18: 120000
A19: 15 | B19: Dave Andrews | C19: 15.8 | D19: 15.7 | E19: =D19 -> 15.7 | F19: 6 | G19: 2 | H19: 117500
A20: 16 | B20: Keith Mendelson | C20: 15.2 | D20: 12.0 | E20: =D20 -> 12 | F20: 6 | G20: 1 | H20: 112500
A21: 17 | B21: Simon Thompson | C21: 9.2 | D21: 11.4 | E21: =D21 -> 11.4 | F21: 8 | G21: 2 | H21: 110000
A22: 18 | B22: Martin Cox | C22: 13.7 | D22: 13.0 | E22: =D22 -> 13 | F22: 4 | G22: 0 | H22: 105000
A23: 19 | B23: Dave Bingham | C23: 10.9 | D23: 11.400000000000999 | E23: =D23 -> 11.400000000000999 | F23: 4 | G23: 0 | H23: 86250
A24: 20 | B24: Dave Rouse | C24: 25.8 | D24: 26.3 | E24: =D24 -> 26.3 | F24: 7 | G24: 1 | H24: 85000
A25: 21 | B25: Jeff Colbrook | C25: 15.5 | D25: 17.4 | E25: =D25 -> 17.4 | F25: 5 | G25: 0 | H25: 73750
A26: 22 | B26: Steve Tilling | C26: 16.5 | D26: 16.3 | E26: =D26 -> 16.3 | F26: 3 | G26: 0 | H26: 66250
A27: 23 | B27: Simon Owens | C27: 14.5 | D27: 14.800000000000999 | E27: =D27 -> 14.800000000000999 | F27: 3 | G27: 0 | H27: 37500
A28: 24 | B28: Alan Hopkins | C28: 7.7 | D28: 8.1 | E28: =D28 -> 8.1 | F28: 3 | G28: 0 | H28: 35000
A29: 25 | B29: Alan Baldwin | C29: 20.9 | D29: 21.1 | E29: =D29 -> 21.1 | F29: 2 | G29: 0 | H29: 22500
A30: 26 | B30: Chris Manning | C30: 22.8 | D30: 22.9 | E30: =D30 -> 22.9 | F30: 1 | G30: 0 | H30: 17500
A31: 27 | B31: Martin Bould | C31: 14.8 | D31: 16.0 | E31: =D31 -> 16 | F31: 2 | G31: 0 | H31: 10000
B32: Malcolm Rouse | C32: 44.9 | D32: 44.9 | E32: =D32 -> 44.9 | F32: 0 | G32: 0 | H32: 0
B33: Dave White | C33: 21.5 | D33: 21.5 | E33: =D33 -> 21.5 | F33: 0 | G33: 0 | H33: 0
B34: Clive Ferris | C34: 26.0 | D34: 26.0 | E34: =D34 -> 26 | F34: 0 | G34: 0 | H34: 0
B35: Andy Benson | C35: 6.3 | D35: 6.3 | E35: =D35 -> 6.3 | F35: 0 | G35: 0 | H35: 0