B1: Season 15 - April 14th 2013 to 31st March 2014
A2: MGA World Tour Order of Merit
B3: Statistics updated | C3: =TODAY() -> 41729
A4: Pos | B4: Player | C4: Original Handicap | D4: Current Handicap | E4: Playing Handicap | F4: Played | G4: Points | H4: Average | I4: HI / LOW Score | J4: Qualified (3 games)
A5: 1 | B5: Dave Kewley (Wolfie) | C5: 22.0 | D5: 17.1 | E5: =D5 -> 17.1 | F5: 3 | G5: 115 | H5: =IF(ISERROR(G5/F5),0,G5/F5) -> 38.333333333333336 | I5: 51 / 29 | J5: Qualified
A6: 2 | B6: Jon Dey | C6: 26.6 | D6: 23.8 | E6: =D6 -> 23.8 | F6: 7 | G6: 234 | H6: =IF(ISERROR(G6/F6),0,G6/F6) -> 33.428571428571431 | I6: 40 / 23 | J6: Qualified
A7: 3 | B7: Andrew Baldwin | C7: 20.1 | D7: 20.0 | E7: =D7 -> 20 | F7: 3 | G7: 99 | H7: =IF(ISERROR(G7/F7),0,G7/F7) -> 33.00 | I7: 37 / 29 | J7: Qualified
A8: 4 | B8: David Archer | C8: 24.1 | D8: 21.2 | E8: =D8 -> 21.2 | F8: 4 | G8: 132 | H8: =IF(ISERROR(G8/F8),0,G8/F8) -> 33.00 | I8: 44 / 26 | J8: Qualified
A9: 5 | B9: Paul Baldwin | C9: 21.1 | D9: 20.4 | E9: =D9 -> 20.4 | F9: 4 | G9: 131 | H9: =IF(ISERROR(G9/F9),0,G9/F9) -> 32.75 | I9: 40 / 27 | J9: Qualified
A10: 6 | B10: Jon Press | C10: 14.5 | D10: 13.800000000000999 | E10: =D10 -> 13.800000000000999 | F10: 4 | G10: 130 | H10: =IF(ISERROR(G10/F10),0,G10/F10) -> 32.50 | I10: 40 / 28 | J10: Qualified
A11: 7 | B11: Steve Tilling | C11: 16.5 | D11: 16.3 | E11: =D11 -> 16.3 | F11: 3 | G11: 97 | H11: =IF(ISERROR(G11/F11),0,G11/F11) -> 32.333333333333336 | I11: 38 / 24 | J11: Qualified
A12: 8 | B12: Kevin Gallagher | C12: 15.8 | D12: 13.000000000001005 | E12: =D12 -> 13.000000000001005 | F12: 12 | G12: 384 | H12: =IF(ISERROR(G12/F12),0,G12/F12) -> 32.00 | I12: 43 / 23 | J12: Qualified
A13: 9 | B13: Martin Cox | C13: 13.7 | D13: 12.8 | E13: =D13 -> 12.8 | F13: 3 | G13: 96 | H13: =IF(ISERROR(G13/F13),0,G13/F13) -> 32.00 | I13: 39 / 21 | J13: Qualified
A14: 10 | B14: Matthew Carter | C14: 16.7 | D14: 16.2 | E14: =D14 -> 16.2 | F14: 6 | G14: 184 | H14: =IF(ISERROR(G14/F14),0,G14/F14) -> 30.666666666666668 | I14: 41 / 17 | J14: Qualified
A15: 11 | B15: Michael Trimmings | C15: 24.5 | D15: 20.3 | E15: =D15 -> 20.3 | F15: 6 | G15: 183 | H15: =IF(ISERROR(G15/F15),0,G15/F15) -> 30.50 | I15: 46 / 19 | J15: Qualified
A16: 12 | B16: Keith Mendelson | C16: 15.2 | D16: 11.8 | E16: =D16 -> 11.8 | F16: 5 | G16: 152 | H16: =IF(ISERROR(G16/F16),0,G16/F16) -> 30.40 | I16: 44 / 23 | J16: Qualified
A17: 13 | B17: Roy Dickens | C17: 30.8 | D17: 30.4 | E17: =D17 -> 30.4 | F17: 5 | G17: 152 | H17: =IF(ISERROR(G17/F17),0,G17/F17) -> 30.40 | I17: 38 / 23 | J17: Qualified
A18: 14 | B18: Paul Carter | C18: 14.0 | D18: 13.8 | E18: =D18 -> 13.8 | F18: 6 | G18: 181 | H18: =IF(ISERROR(G18/F18),0,G18/F18) -> 30.166666666666668 | I18: 34 / 23 | J18: Qualified
A19: 15 | B19: Simon Owens | C19: 14.5 | D19: 14.800000000000999 | E19: =D19 -> 14.800000000000999 | F19: 3 | G19: 90 | H19: =IF(ISERROR(G19/F19),0,G19/F19) -> 30.00 | I19: 32 / 28 | J19: Qualified
A20: 16 | B20: Dave Rouse | C20: 25.8 | D20: 25.8 | E20: =D20 -> 25.8 | F20: 6 | G20: 180 | H20: =IF(ISERROR(G20/F20),0,G20/F20) -> 30.00 | I20: 38 / 25 | J20: Qualified
A21: 17 | B21: Dave Bingham | C21: 10.9 | D21: 11.3 | E21: =D21 -> 11.3 | F21: 3 | G21: 90 | H21: =IF(ISERROR(G21/F21),0,G21/F21) -> 30.00 | I21: 32 / 26 | J21: Qualified
A22: 18 | B22: David Braithwaite | C22: 12.1 | D22: 12.6 | E22: =D22 -> 12.6 | F22: 5 | G22: 148 | H22: =IF(ISERROR(G22/F22),0,G22/F22) -> 29.60 | I22: 34 / 23 | J22: Qualified
A23: 19 | B23: Robert Thompson | C23: 10.1 | D23: 9.2 | E23: =D23 -> 9.2 | F23: 13 | G23: 381 | H23: =IF(ISERROR(G23/F23),0,G23/F23) -> 29.307692307692307 | I23: 40 / 20 | J23: Qualified
A24: 20 | B24: Dave Andrews | C24: 15.8 | D24: 15.6 | E24: =D24 -> 15.6 | F24: 5 | G24: 144 | H24: =IF(ISERROR(G24/F24),0,G24/F24) -> 28.80 | I24: 33 / 20 | J24: Qualified
A25: 21 | B25: Ian Edwards | C25: 14.5 | D25: 15.6 | E25: =D25 -> 15.6 | F25: 6 | G25: 168 | H25: =IF(ISERROR(G25/F25),0,G25/F25) -> 28.00 | I25: 33 / 21 | J25: Qualified
A26: 22 | B26: Simon Thompson | C26: 9.2 | D26: 11.2 | E26: =D26 -> 11.2 | F26: 7 | G26: 186 | H26: =IF(ISERROR(G26/F26),0,G26/F26) -> 26.571428571428573 | I26: 33 / 15 | J26: Qualified
A27: 23 | B27: Jeff Colbrook | C27: 15.5 | D27: 17.2 | E27: =D27 -> 17.2 | F27: 4 | G27: 103 | H27: =IF(ISERROR(G27/F27),0,G27/F27) -> 25.75 | I27: 38 / 16 | J27: Qualified
A28: 24 | B28: Alan Baldwin | C28: 20.9 | D28: 21.1 | E28: =D28 -> 21.1 | F28: 2 | G28: 62 | H28: =IF(ISERROR(G28/F28),0,G28/F28) -> 31.00 | I28: 31 / 31 | J28: =IF(F28>=5,"Qualified","") -> 
A29: 25 | B29: Chris Manning | C29: 22.8 | D29: 22.9 | E29: =D29 -> 22.9 | F29: 1 | G29: 30 | H29: =IF(ISERROR(G29/F29),0,G29/F29) -> 30.00 | I29: 30 / 30 | J29: =IF(F29>=5,"Qualified","") -> 
A30: 26 | B30: Alan Hopkins | C30: 7.7 | D30: 7.9 | E30: =D30 -> 7.9 | F30: 2 | G30: 59 | H30: =IF(ISERROR(G30/F30),0,G30/F30) -> 29.50 | I30: 30 / 29 | J30: =IF(F30>=5,"Qualified","") -> 
A31: 27 | B31: Martin Bould | C31: 14.8 | D31: 16.0 | E31: =D31 -> 16 | F31: 2 | G31: 43 | H31: =IF(ISERROR(G31/F31),0,G31/F31) -> 21.50 | I31: 25 / 18 | J31: =IF(F31>=5,"Qualified","") -> 
B32: Malcolm Rouse | C32: 44.9 | D32: 44.9 | E32: =D32 -> 44.9 | F32: 0 | G32: 0 | H32: =IF(ISERROR(G32/F32),0,G32/F32) -> 0.00 | I32: / | J32: =IF(F32>=5,"Qualified","") -> 
B33: Dave White | C33: 21.5 | D33: 21.5 | E33: =D33 -> 21.5 | F33: 0 | G33: 0 | H33: =IF(ISERROR(G33/F33),0,G33/F33) -> 0.00 | I33: / | J33: =IF(F33>=5,"Qualified","") -> 
B34: Clive Ferris | C34: 26.0 | D34: 26.0 | E34: =D34 -> 26 | F34: 0 | G34: 0 | H34: =IF(ISERROR(G34/F34),0,G34/F34) -> 0.00 | I34: / | J34: =IF(F34>=5,"Qualified","") -> 
B35: Andy Benson | C35: 6.3 | D35: 6.3 | E35: =D35 -> 6.3 | F35: 0 | G35: 0 | H35: =IF(ISERROR(G35/F35),0,G35/F35) -> 0.00 | I35: / | J35: =IF(F35>=5,"Qualified","") -> 