A1: Dave Kewley (Wolfie)
A2: Club | B2: Horton Park
A3: Par/SS | B3: 70/69 | D3: Num. Of Fairways | I3: =IF(B2="","",18-(COUNTIF(B9:B26,3))) -> 12
A4: Date | B4: 41727 | D4: Playing Handicap | I4: 17.1
A5: Event Place | B5: 8 | C5: M | D5: Prize Money | G5: 28750
A6: Game Stats | B6: DB+ | C6: DB | D6: Bi | E6: P | F6: B | G6: E | H6: A | I6: H1
B7: 2 | C7: 4 | D7: 11 | E7: 1 | F7: 0 | G7: 0 | H7: 0 | I7: 0
A8: Hole No | B8: Par | C8: Stroke Index | D8: Gross Score | E8: Points | F8: Putts | G8: Fairways | H8: Ferrets | I8: Green Regulation
A9: 1 | B9: 3 | C9: 12 | D9: 5 | E9: 1 | F9: 2
A10: 2 | B10: 4 | C10: 6 | D10: 4 | E10: 3 | F10: 1 | G10: 1 | I10: Yes
A11: 3 | B11: 5 | C11: 2 | D11: 7 | E11: 1 | F11: 2
A12: 4 | B12: 3 | C12: 10 | D12: 4 | E12: 2 | F12: 2 | I12: Yes
A13: 5 | B13: 5 | C13: 14 | D13: 6 | E13: 2 | F13: 2 | I13: Yes
A14: 6 | B14: 4 | C14: 16 | D14: 7 | E14: 0 | F14: 1
A15: 7 | B15: 4 | C15: 18 | D15: 5 | E15: 1 | F15: 1
A16: 8 | B16: 5 | C16: 4 | D16: 7 | E16: 1 | F16: 1
A17: 9 | B17: 3 | C17: 8 | D17: 4 | E17: 2 | F17: 1
A18: 10 | B18: 3 | C18: 7 | D18: 4 | E18: 2 | F18: 2 | I18: Yes
A19: 11 | B19: 5 | C19: 13 | D19: 8 | E19: 0 | F19: 3 | G19: 1
A20: 12 | B20: 4 | C20: 3 | D20: 6 | E20: 1 | F20: 2 | G20: 1
A21: 13 | B21: 4 | C21: 15 | D21: 5 | E21: 2 | F21: 2 | G21: 1 | I21: Yes
A22: 14 | B22: 4 | C22: 9 | D22: 5 | E22: 2 | F22: 1
A23: 15 | B23: 4 | C23: 5 | D23: 5 | E23: 2 | F23: 1 | G23: 1
A24: 16 | B24: 3 | C24: 17 | D24: 4 | E24: 2 | F24: 2 | I24: Yes
A25: 17 | B25: 4 | C25: 1 | D25: 5 | E25: 2 | F25: 1 | G25: 1
A26: 18 | B26: 3 | C26: 11 | D26: 4 | E26: 2 | F26: 2 | I26: Yes
A27: Totals | B27: =IF(B2="","",SUM(B9:B26)) -> 70 | D27: =IF(B2="","",SUM(D9:D26)) -> 95 | E27: =IF(B2="","",SUM(E9:E26)) -> 28 | F27: =IF(B2="","",SUM(F9:F26)) -> 29 | G27: =IF(B2="","",SUM(G9:G26)) -> 6 | H27: =IF(B2="","",SUM(H9:H26)) -> 0 | I27: =IF(COUNTIF(I9:I26,"=Yes")=0,"",COUNTIF(I9:I26,"=Yes")) -> 7