A1: Ian Edwards
A2: Club | B2: Horton Park
A3: Par/SS | B3: 70/69 | D3: Num. Of Fairways | I3: =IF(B2="","",18-(COUNTIF(B9:B26,3))) -> 12
A4: Date | B4: 41727 | D4: Playing Handicap | I4: 15.5
A5: Event Place | B5: 3 | C5: M | D5: Prize Money | G5: 47500
A6: Game Stats | B6: DB+ | C6: DB | D6: Bi | E6: P | F6: B | G6: E | H6: A | I6: H1
B7: 1 | C7: 6 | D7: 6 | E7: 5 | F7: 0 | G7: 0 | H7: 0 | I7: 0
A8: Hole No | B8: Par | C8: Stroke Index | D8: Gross Score | E8: Points | F8: Putts | G8: Fairways | H8: Ferrets | I8: Green Regulation
A9: 1 | B9: 3 | C9: 12 | D9: 5 | E9: 1 | F9: 3 | I9: Yes
A10: 2 | B10: 4 | C10: 6 | D10: 5 | E10: 2 | F10: 2 | I10: Yes
A11: 3 | B11: 5 | C11: 2 | D11: 7 | E11: 1 | F11: 3 | I11: Yes
A12: 4 | B12: 3 | C12: 10 | D12: 5 | E12: 1 | F12: 3 | I12: Yes
A13: 5 | B13: 5 | C13: 14 | D13: 5 | E13: 3 | F13: 1 | I13: Yes
A14: 6 | B14: 4 | C14: 16 | D14: 4 | E14: 3 | F14: 1 | I14: Yes
A15: 7 | B15: 4 | C15: 18 | D15: 5 | E15: 1 | F15: 2
A16: 8 | B16: 5 | C16: 4 | D16: 7 | E16: 1 | F16: 3 | G16: 1 | I16: Yes
A17: 9 | B17: 3 | C17: 8 | D17: 4 | E17: 2 | F17: 2 | I17: Yes
A18: 10 | B18: 3 | C18: 7 | D18: 4 | E18: 2 | F18: 2 | I18: Yes
A19: 11 | B19: 5 | C19: 13 | D19: 7 | E19: 1 | F19: 2
A20: 12 | B20: 4 | C20: 3 | D20: 5 | E20: 2 | F20: 1 | H20: 1
A21: 13 | B21: 4 | C21: 15 | D21: 4 | E21: 3 | F21: 1 | G21: 1 | I21: Yes
A22: 14 | B22: 4 | C22: 9 | D22: 4 | E22: 3 | F22: 2 | I22: Yes
A23: 15 | B23: 4 | C23: 5 | D23: 4 | E23: 3 | F23: 1 | I23: Yes
A24: 16 | B24: 3 | C24: 17 | D24: 4 | E24: 1 | F24: 2
A25: 17 | B25: 4 | C25: 1 | D25: 7 | E25: 0 | F25: 2
A26: 18 | B26: 3 | C26: 11 | D26: 5 | E26: 1 | F26: 2
A27: Totals | B27: =IF(B2="","",SUM(B9:B26)) -> 70 | D27: =IF(B2="","",SUM(D9:D26)) -> 91 | E27: =IF(B2="","",SUM(E9:E26)) -> 31 | F27: =IF(B2="","",SUM(F9:F26)) -> 35 | G27: =IF(B2="","",SUM(G9:G26)) -> 2 | H27: =IF(B2="","",SUM(H9:H26)) -> 1 | I27: =IF(COUNTIF(I9:I26,"=Yes")=0,"",COUNTIF(I9:I26,"=Yes")) -> 12