A1: Paul Carter
A2: Club | B2: Rusper
A3: Par/SS | B3: 72/71 | D3: Num. Of Fairways | I3: =IF(B2="","",18-(COUNTIF(B9:B26,3))) -> 14
A4: Date | B4: 41705 | D4: Playing Handicap | I4: 13.8
A5: Event Place | B5: 3 | D5: Prize Money | G5: 2500
A6: Game Stats | B6: DB+ | C6: DB | D6: Bi | E6: P | F6: B | G6: E | H6: A | I6: H1
B7: 5 | C7: 5 | D7: 6 | E7: 2 | F7: 0 | G7: 0 | H7: 0 | I7: 0
A8: Hole No | B8: Par | C8: Stroke Index | D8: Gross Score | E8: Points | F8: Putts | G8: Fairways | H8: Ferrets | I8: Green Regulation
A9: 1 | B9: 4 | C9: 16 | D9: 7 | E9: 0 | F9: 2 | H9: 1
A10: 2 | B10: 4 | C10: 12 | D10: 7 | E10: 0 | F10: 1 | H10: 1
A11: 3 | B11: 5 | C11: 6 | D11: 7 | E11: 1 | F11: 2
A12: 4 | B12: 3 | C12: 18 | D12: 4 | E12: 1 | F12: 2
A13: 5 | B13: 5 | C13: 4 | D13: 10 | E13: 0 | F13: 3
A14: 6 | B14: 4 | C14: 10 | D14: 5 | E14: 2 | F14: 2 | I14: Yes
A15: 7 | B15: 3 | C15: 14 | D15: 7 | E15: 0 | F15: 4
A16: 8 | B16: 4 | C16: 2 | D16: 6 | E16: 1 | F16: 2 | G16: 1
A17: 9 | B17: 5 | C17: 8 | D17: 6 | E17: 2 | F17: 2 | I17: Yes
A18: 10 | B18: 4 | C18: 5 | D18: 5 | E18: 2 | F18: 2 | G18: 1 | I18: Yes
A19: 11 | B19: 3 | C19: 15 | D19: 4 | E19: 1 | F19: 2
A20: 12 | B20: 4 | C20: 3 | D20: 6 | E20: 1 | F20: 0 | G20: 1
A21: 13 | B21: 5 | C21: 7 | D21: 6 | E21: 2 | F21: 2 | I21: Yes
A22: 14 | B22: 4 | C22: 1 | D22: 4 | E22: 3 | F22: 2 | I22: Yes
A23: 15 | B23: 4 | C23: 11 | D23: 6 | E23: 1 | F23: 2
A24: 16 | B24: 4 | C24: 17 | D24: 7 | E24: 0 | F24: 2 | H24: 1
A25: 17 | B25: 3 | C25: 13 | D25: 3 | E25: 3 | F25: 1 | I25: Yes
A26: 18 | B26: 4 | C26: 9 | D26: 6 | E26: 1 | F26: 2 | H26: 1
A27: Totals | B27: =IF(B2="","",SUM(B9:B26)) -> 72 | D27: =IF(B2="","",SUM(D9:D26)) -> 106 | E27: =IF(B2="","",SUM(E9:E26)) -> 21 | F27: =IF(B2="","",SUM(F9:F26)) -> 35 | G27: =IF(B2="","",SUM(G9:G26)) -> 3 | H27: =IF(B2="","",SUM(H9:H26)) -> 4 | I27: =IF(COUNTIF(I9:I26,"=Yes")=0,"",COUNTIF(I9:I26,"=Yes")) -> 6