A1: Andy Benson
A2: Club | B2: Harleyford
A3: Par/SS | B3: 72/72 | D3: Num. Of Fairways | I3: =IF(B2="","",18-(COUNTIF(B9:B26,3))) -> 14
A4: Date | B4: 39220 | D4: Playing Handicap | I4: 6.9
A5: Event Place | B5: 1 | D5: Prize Money | G5: 5000
A6: Game Stats | B6: DB+ | C6: DB | D6: Bi | E6: P | F6: B | G6: E | H6: A | I6: H1
B7: 0 | C7: 0 | D7: 9 | E7: 8 | F7: 1 | G7: 0 | H7: 0 | I7: 0
A8: Hole No | B8: Par | C8: Stroke Index | D8: Gross Score | E8: Points | F8: Putts | G8: Fairways | H8: Ferrets | I8: Green Regulation
A9: 1 | B9: 4 | C9: 15 | D9: 5 | E9: 1 | F9: 2 | G9: 1
A10: 2 | B10: 4 | C10: 9 | D10: 5 | E10: 1 | F10: 3 | I10: Yes
A11: 3 | B11: 3 | C11: 7 | D11: 3 | E11: 3 | F11: 1 | I11: Yes
A12: 4 | B12: 4 | C12: 13 | D12: 4 | E12: 2 | F12: 2 | G12: 1 | I12: Yes
A13: 5 | B13: 5 | C13: 5 | D13: 4 | E13: 4 | F13: 1 | G13: 1 | I13: Yes
A14: 6 | B14: 3 | C14: 11 | D14: 4 | E14: 1 | F14: 2
A15: 7 | B15: 4 | C15: 1 | D15: 5 | E15: 2 | F15: 2 | I15: Yes
A16: 8 | B16: 4 | C16: 3 | D16: 4 | E16: 3 | F16: 2 | I16: Yes
A17: 9 | B17: 5 | C17: 17 | D17: 5 | E17: 2 | F17: 2 | I17: Yes
A18: 10 | B18: 5 | C18: 8 | D18: 6 | E18: 1 | F18: 2
A19: 11 | B19: 4 | C19: 2 | D19: 4 | E19: 3 | F19: 1 | I19: Yes
A20: 12 | B20: 3 | C20: 12 | D20: 3 | E20: 2 | F20: 2 | I20: Yes
A21: 13 | B21: 4 | C21: 4 | D21: 4 | E21: 3 | F21: 2 | G21: 1 | I21: Yes
A22: 14 | B22: 4 | C22: 18 | D22: 5 | E22: 1 | F22: 1
A23: 15 | B23: 4 | C23: 10 | D23: 5 | E23: 1 | F23: 2
A24: 16 | B24: 3 | C24: 16 | D24: 4 | E24: 1 | F24: 3 | I24: Yes
A25: 17 | B25: 5 | C25: 14 | D25: 5 | E25: 2 | F25: 1 | G25: 1
A26: 18 | B26: 4 | C26: 6 | D26: 5 | E26: 2 | F26: 2 | I26: Yes
A27: Totals | B27: =IF(B2="","",SUM(B9:B26)) -> 72 | D27: =IF(B2="","",SUM(D9:D26)) -> 80 | E27: =IF(B2="","",SUM(E9:E26)) -> 35 | F27: =IF(B2="","",SUM(F9:F26)) -> 33 | G27: =IF(B2="","",SUM(G9:G26)) -> 5 | H27: =IF(B2="","",SUM(H9:H26)) -> 0 | I27: =IF(COUNTIF(I9:I26,"=Yes")=0,"",COUNTIF(I9:I26,"=Yes")) -> 12