A1: Ian Edwards
A2: Club | B2: Porters Park
A3: Par/SS | B3: 70/70 | D3: Num. Of Fairways | I3: =IF(B2="","",18-(COUNTIF(B9:B26,3))) -> 14
A4: Date | B4: 37988 | D4: Playing Handicap | I4: 14.7
A5: Event Place | B5: 2 | D5: Prize Money | G5: 2500
A6: Game Stats | B6: DB+ | C6: DB | D6: Bi | E6: P | F6: B | G6: E | H6: A | I6: H1
B7: 4 | C7: 4 | D7: 8 | E7: 2 | F7: 0 | G7: 0 | H7: 0 | I7: 0
A8: Hole No | B8: Par | C8: Stroke Index | D8: Gross Score | E8: Points | F8: Putts | G8: Fairways | H8: Ferrets | I8: Green Regulation
A9: 1 | B9: 4 | C9: 17 | D9: 5 | E9: 1 | F9: 2
A10: 2 | B10: 4 | C10: 11 | D10: 7 | E10: 0 | F10: 1 | H10: 1
A11: 3 | B11: 4 | C11: 3 | D11: 6 | E11: 1 | F11: 3 | I11: Yes
A12: 4 | B12: 4 | C12: 1 | D12: 7 | E12: 0 | F12: 3
A13: 5 | B13: 4 | C13: 9 | D13: 4 | E13: 3 | F13: 1 | G13: 1 | I13: Yes
A14: 6 | B14: 3 | C14: 13 | D14: 5 | E14: 1 | F14: 2
A15: 7 | B15: 4 | C15: 7 | D15: 5 | E15: 2 | F15: 3 | G15: 1 | I15: Yes
A16: 8 | B16: 4 | C16: 5 | D16: 5 | E16: 2 | F16: 3 | G16: 1 | I16: Yes
A17: 9 | B17: 3 | C17: 15 | D17: 5 | E17: 1 | F17: 1
A18: 10 | B18: 5 | C18: 12 | D18: 6 | E18: 2 | F18: 2 | G18: 1 | I18: Yes
A19: 11 | B19: 4 | C19: 2 | D19: 5 | E19: 2 | F19: 2 | I19: Yes
A20: 12 | B20: 3 | C20: 8 | D20: 5 | E20: 1 | F20: 2
A21: 13 | B21: 5 | C21: 4 | D21: 5 | E21: 3 | F21: 2 | G21: 1 | I21: Yes
A22: 14 | B22: 3 | C22: 16 | D22: 4 | E22: 1 | F22: 2
A23: 15 | B23: 4 | C23: 18 | D23: 5 | E23: 1 | F23: 2
A24: 16 | B24: 4 | C24: 6 | D24: 7 | E24: 0 | F24: 3
A25: 17 | B25: 4 | C25: 14 | D25: 5 | E25: 2 | F25: 2 | G25: 1 | I25: Yes
A26: 18 | B26: 4 | C26: 10 | D26: 7 | E26: 0 | F26: 3 | G26: 1
A27: Totals | B27: =IF(B2="","",SUM(B9:B26)) -> 70 | D27: =IF(B2="","",SUM(D9:D26)) -> 98 | E27: =IF(B2="","",SUM(E9:E26)) -> 23 | F27: =IF(B2="","",SUM(F9:F26)) -> 39 | G27: =IF(B2="","",SUM(G9:G26)) -> 7 | H27: =IF(B2="","",SUM(H9:H26)) -> 1 | I27: =IF(COUNTIF(I9:I26,"=Yes")=0,"",COUNTIF(I9:I26,"=Yes")) -> 8