A1: Clive Ferris
A2: Club | B2: Mill Ride
A3: Par/SS | B3: 72 | D3: Num. Of Fairways | I3: =IF(B2="","",18-(COUNTIF(B9:B26,3))) -> 14
A4: Date | B4: 37806 | D4: Playing Handicap | I4: 26.2
A5: Event Place | B5: 1 | D5: Prize Money | G5: 5000
A6: Game Stats | B6: DB+ | C6: DB | D6: BI | E6: P | F6: B | G6: E | H6: A | I6: H1
B7: 6 | C7: 5 | D7: 6 | E7: 1 | F7: 0 | G7: 0 | H7: 0 | I7: 0
A8: Hole No | B8: Par | C8: Stroke Index | D8: Gross Score | E8: Points | F8: Putts | G8: Fairways | H8: Ferrets | I8: Green Regulation
A9: 1 | B9: 5 | C9: 9 | D9: 8 | E9: 0 | F9: 3
A10: 2 | B10: 4 | C10: 1 | D10: 6 | E10: 2 | F10: 2 | I10: Yes
A11: 3 | B11: 3 | C11: 11 | D11: 4 | E11: 2 | F11: 2 | I11: Yes
A12: 4 | B12: 4 | C12: 5 | D12: 6 | E12: 2 | F12: 2 | I12: Yes
A13: 5 | B13: 5 | C13: 7 | D13: 6 | E13: 3 | F13: 1 | I13: Yes
A14: 6 | B14: 4 | C14: 15 | D14: 7 | E14: 0 | F14: 1 | H14: 1
A15: 7 | B15: 4 | C15: 13 | D15: 5 | E15: 2 | F15: 2 | I15: Yes
A16: 8 | B16: 3 | C16: 17 | D16: 3 | E16: 3 | F16: 2 | I16: Yes
A17: 9 | B17: 4 | C17: 3 | D17: 7 | E17: 1 | F17: 2
A18: 10 | B18: 5 | C18: 6 | D18: 10 | E18: 0 | F18: 3 | H18: 1
A19: 11 | B19: 3 | C19: 8 | D19: 5 | E19: 2 | F19: 2 | I19: Yes
A20: 12 | B20: 4 | C20: 12 | D20: 5 | E20: 2 | F20: 1
A21: 13 | B21: 4 | C21: 10 | D21: 10 | E21: 0 | F21: 3 | G21: 1
A22: 14 | B22: 4 | C22: 2 | D22: 7 | E22: 1 | F22: 2
A23: 15 | B23: 3 | C23: 18 | D23: 4 | E23: 2 | F23: 1
A24: 16 | B24: 4 | C24: 16 | D24: 6 | E24: 1 | F24: 1
A25: 17 | B25: 4 | C25: 4 | D25: 5 | E25: 3 | F25: 2 | G25: 1 | I25: Yes
A26: 18 | B26: 5 | C26: 14 | D26: 7 | E26: 1 | F26: 3 | G26: 1 | I26: Yes
A27: Totals | B27: =IF(B2="","",SUM(B9:B26)) -> 72 | D27: =IF(B2="","",SUM(D9:D26)) -> 111 | E27: =IF(B2="","",SUM(E9:E26)) -> 27 | F27: =IF(B2="","",SUM(F9:F26)) -> 35 | G27: =IF(B2="","",SUM(G9:G26)) -> 3 | H27: =IF(B2="","",SUM(H9:H26)) -> 2 | I27: =IF(COUNTIF(I9:I26,"=Yes")=0,"",COUNTIF(I9:I26,"=Yes")) -> 9