A1: Dave Rouse
A2: Club | B2: Chelsfield Lakes
A3: Par/SS | B3: 71/68 | D3: Num. Of Fairways | I3: =IF(B2="","",18-(COUNTIF(B9:B26,3))) -> 14
A4: Date | B4: 37828 | D4: Playing Handicap | I4: 21.9
A5: Event Place | B5: 5 | C5: M | D5: Prize Money | G5: 25000
A6: Game Stats | B6: DB+ | C6: DB | D6: Bi | E6: P | F6: B | G6: E | H6: A | I6: H1
B7: 4 | C7: 3 | D7: 5 | E7: 6 | F7: 0 | G7: 0 | H7: 0 | I7: 0
A8: Hole No | B8: Par | C8: Stroke Index | D8: Gross Score | E8: Points | F8: Putts | G8: Fairways | H8: Ferrets | I8: Green Regulation
A9: 1 | B9: 4 | C9: 12 | D9: 7 | E9: 0 | F9: 2 | G9: 1
A10: 2 | B10: 3 | C10: 7 | D10: 3 | E10: 3 | F10: 2 | I10: Yes
A11: 3 | B11: 4 | C11: 11 | D11: 5 | E11: 2 | F11: 1
A12: 4 | B12: 4 | C12: 2 | D12: 7 | E12: 1 | F12: 2 | G12: 1
A13: 5 | B13: 3 | C13: 9 | D13: 4 | E13: 2 | F13: 3 | I13: Yes
A14: 6 | B14: 5 | C14: 14 | D14: 5 | E14: 3 | F14: 1 | I14: Yes
A15: 7 | B15: 5 | C15: 6 | D15: 5 | E15: 3 | F15: 2 | I15: Yes
A16: 8 | B16: 4 | C16: 18 | D16: 5 | E16: 2 | F16: 2 | I16: Yes
A17: 9 | B17: 4 | C17: 5 | D17: 9 | E17: 0 | F17: 2 | H17: 1
A18: 10 | B18: 4 | C18: 10 | D18: 4 | E18: 3 | F18: 1 | G18: 1 | I18: Yes
A19: 11 | B19: 4 | C19: 13 | D19: 4 | E19: 3 | F19: 1 | I19: Yes
A20: 12 | B20: 4 | C20: 8 | D20: 5 | E20: 2 | F20: 1 | G20: 1
A21: 13 | B21: 5 | C21: 1 | D21: 7 | E21: 2 | F21: 1
A22: 14 | B22: 4 | C22: 16 | D22: 6 | E22: 1 | F22: 2
A23: 15 | B23: 3 | C23: 17 | D23: 4 | E23: 2 | F23: 2 | I23: Yes
A24: 16 | B24: 4 | C24: 3 | D24: 8 | E24: 0 | F24: 2
A25: 17 | B25: 3 | C25: 15 | D25: 3 | E25: 3 | F25: 1 | I25: Yes
A26: 18 | B26: 4 | C26: 4 | D26: 6 | E26: 2 | F26: 3 | I26: Yes
A27: Totals | B27: =IF(B2="","",SUM(B9:B26)) -> 71 | D27: =IF(B2="","",SUM(D9:D26)) -> 97 | E27: =IF(B2="","",SUM(E9:E26)) -> 34 | F27: =IF(B2="","",SUM(F9:F26)) -> 31 | G27: =IF(B2="","",SUM(G9:G26)) -> 4 | H27: =IF(B2="","",SUM(H9:H26)) -> 1 | I27: =IF(COUNTIF(I9:I26,"=Yes")=0,"",COUNTIF(I9:I26,"=Yes")) -> 10