A1: Danny Marsh
A2: Club | B2: Victoria, Vilamoura
A3: Par/SS | B3: 72/92 | D3: Num. Of Fairways | I3: =IF(B2="","",18-(COUNTIF(B9:B26,3))) -> 14
A4: Date | B4: 38317 | D4: Playing Handicap | I4: 9.3000000000009972
A5: Event Place | B5: 1 | D5: Prize Money | G5: 12500
A6: Game Stats | B6: DB+ | C6: DB | D6: BI | E6: P | F6: B | G6: E | H6: A | I6: H1
B7: 2 | C7: 3 | D7: 5 | E7: 5 | F7: 3 | G7: 0 | H7: 0 | I7: 0
A8: Hole No | B8: Par | C8: Stroke Index | D8: Gross Score | E8: Points | F8: Putts | G8: Fairways | H8: Ferrets | I8: Green Regulation
A9: 1 | B9: 4 | C9: 9 | D9: 5 | E9: 2 | F9: 2 | G9: 1 | I9: Yes
A10: 2 | B10: 4 | C10: 13 | D10: 3 | E10: 3 | F10: 1 | G10: 1 | I10: Yes
A11: 3 | B11: 5 | C11: 3 | D11: 5 | E11: 3 | F11: 2 | I11: Yes
A12: 4 | B12: 4 | C12: 11 | D12: 6 | E12: 0 | F12: 2 | G12: 1
A13: 5 | B13: 5 | C13: 1 | D13: 4 | E13: 4 | F13: 2 | G13: 1 | I13: Yes
A14: 6 | B14: 3 | C14: 15 | D14: 5 | E14: 0 | F14: 3
A15: 7 | B15: 4 | C15: 5 | D15: 3 | E15: 4 | F15: 3 | I15: Yes
A16: 8 | B16: 3 | C16: 17 | D16: 4 | E16: 1 | F16: 3 | I16: Yes
A17: 9 | B17: 4 | C17: 7 | D17: 7 | E17: 0 | F17: 3
A18: 10 | B18: 4 | C18: 10 | D18: 4 | E18: 2 | F18: 1 | G18: 1
A19: 11 | B19: 4 | C19: 14 | D19: 5 | E19: 1 | F19: 2 | G19: 1
A20: 12 | B20: 5 | C20: 4 | D20: 6 | E20: 2 | F20: 2 | G20: 1 | I20: Yes
A21: 13 | B21: 3 | C21: 18 | D21: 3 | E21: 2 | F21: 2 | I21: Yes
A22: 14 | B22: 4 | C22: 2 | D22: 6 | E22: 1 | F22: 3 | I22: Yes
A23: 15 | B23: 4 | C23: 16 | D23: 4 | E23: 2 | F23: 1
A24: 16 | B24: 3 | C24: 6 | D24: 4 | E24: 2 | F24: 2 | I24: Yes
A25: 17 | B25: 5 | C25: 8 | D25: 5 | E25: 3 | F25: 3 | G25: 1 | I25: Yes
A26: 18 | B26: 4 | C26: 12 | D26: 8 | E26: 0 | F26: 2
A27: Totals | B27: =IF(B2="","",SUM(B9:B26)) -> 72 | D27: =IF(B2="","",SUM(D9:D26)) -> 87 | E27: =IF(B2="","",SUM(E9:E26)) -> 32 | F27: =IF(B2="","",SUM(F9:F26)) -> 39 | G27: =IF(B2="","",SUM(G9:G26)) -> 8 | H27: =IF(B2="","",SUM(H9:H26)) -> 0 | I27: =IF(COUNTIF(I9:I26,"=Yes")=0,"",COUNTIF(I9:I26,"=Yes")) -> 11

A1: Robert Thompson
A2: Club | B2: Victoria, Vilamoura
A3: Par/SS | B3: 72/92 | D3: Num. Of Fairways | I3: =IF(B2="","",18-(COUNTIF(B9:B26,3))) -> 14
A4: Date | D4: Playing Handicap | I4: 8.6
A5: Event Place | B5: 2 | D5: Prize Money | G5: 10000
A6: Game Stats | B6: DB+ | C6: DB | D6: Bi | E6: P | F6: B | G6: E | H6: A | I6: H1
B7: 0 | C7: 5 | D7: 5 | E7: 7 | F7: 1 | G7: 0 | H7: 0 | I7: 0
A8: Hole No | B8: Par | C8: Stroke Index | D8: Gross Score | E8: Points | F8: Putts | G8: Fairways | H8: Ferrets | I8: Green Regulation
A9: 1 | B9: 4 | C9: 9 | D9: 3 | E9: 4 | F9: 1 | I9: Yes
A10: 2 | B10: 4 | C10: 13 | D10: 4 | E10: 2 | F10: 2 | G10: 1 | I10: Yes
A11: 3 | B11: 5 | C11: 3 | D11: 5 | E11: 3 | F11: 2 | G11: 1 | I11: Yes
A12: 4 | B12: 4 | C12: 11 | D12: 6 | E12: 0 | F12: 4 | G12: 1 | I12: Yes
A13: 5 | B13: 5 | C13: 1 | D13: 7 | E13: 1 | F13: 1
A14: 6 | B14: 3 | C14: 15 | D14: 4 | E14: 1 | F14: 2
A15: 7 | B15: 4 | C15: 5 | D15: 4 | E15: 3 | F15: 1 | I15: Yes
A16: 8 | B16: 3 | C16: 17 | D16: 5 | E16: 0 | F16: 2
A17: 9 | B17: 4 | C17: 7 | D17: 4 | E17: 3 | F17: 2 | G17: 1 | I17: Yes
A18: 10 | B18: 4 | C18: 10 | D18: 6 | E18: 0 | F18: 2
A19: 11 | B19: 4 | C19: 14 | D19: 5 | E19: 1 | F19: 3 | G19: 1 | I19: Yes
A20: 12 | B20: 5 | C20: 4 | D20: 6 | E20: 2 | F20: 2 | G20: 1 | I20: Yes
A21: 13 | B21: 3 | C21: 18 | D21: 3 | E21: 2 | F21: 2 | I21: Yes
A22: 14 | B22: 4 | C22: 2 | D22: 6 | E22: 1 | F22: 2 | G22: 1
A23: 15 | B23: 4 | C23: 16 | D23: 4 | E23: 2 | F23: 1
A24: 16 | B24: 3 | C24: 6 | D24: 3 | E24: 3 | F24: 1 | I24: Yes
A25: 17 | B25: 5 | C25: 8 | D25: 6 | E25: 2 | F25: 3 | G25: 1 | I25: Yes
A26: 18 | B26: 4 | C26: 12 | D26: 5 | E26: 1 | F26: 2 | G26: 1
A27: Totals | B27: =IF(B2="","",SUM(B9:B26)) -> 72 | D27: =IF(B2="","",SUM(D9:D26)) -> 86 | E27: =IF(B2="","",SUM(E9:E26)) -> 31 | F27: =IF(B2="","",SUM(F9:F26)) -> 35 | G27: =IF(B2="","",SUM(G9:G26)) -> 9 | H27: =IF(B2="","",SUM(H9:H26)) -> 0 | I27: =IF(COUNTIF(I9:I26,"=Yes")=0,"",COUNTIF(I9:I26,"=Yes")) -> 11