A1: Danny Marsh
A2: Club | B2: Quinto Do Lago, South
A3: Par/SS | B3: 72/72 | D3: Num. Of Fairways | I3: =IF(B2="","",18-(COUNTIF(B9:B26,3))) -> 14
A4: Date | B4: 38318 | D4: Playing Handicap | I4: 9.5000000000019966
A5: Event Place | B5: 5 | D5: Prize Money | G5: 2500
A6: Game Stats | B6: DB+ | C6: DB | D6: Bi | E6: P | F6: B | G6: E | H6: A | I6: H1
B7: 5 | C7: 1 | D7: 5 | E7: 6 | F7: 1 | G7: 0 | H7: 0 | I7: 0
A8: Hole No | B8: Par | C8: Stroke Index | D8: Gross Score | E8: Points | F8: Putts | G8: Fairways | H8: Ferrets | I8: Green Regulation
A9: 1 | B9: 4 | C9: 13 | D9: 4 | E9: 2 | F9: 2 | I9: Yes
A10: 2 | B10: 5 | C10: 7 | D10: 8 | E10: 0 | F10: 2 | G10: 1
A11: 3 | B11: 4 | C11: 5 | D11: 8 | E11: 0 | F11: 2
A12: 4 | B12: 3 | C12: 17 | D12: 3 | E12: 2 | F12: 2 | I12: Yes
A13: 5 | B13: 5 | C13: 1 | D13: 7 | E13: 1 | F13: 2
A14: 6 | B14: 4 | C14: 9 | D14: 5 | E14: 2 | F14: 2 | I14: Yes
A15: 7 | B15: 3 | C15: 15 | D15: 4 | E15: 1 | F15: 2
A16: 8 | B16: 4 | C16: 3 | D16: 8 | E16: 0 | F16: 3
A17: 9 | B17: 4 | C17: 11 | D17: 4 | E17: 2 | F17: 2 | I17: Yes
A18: 10 | B18: 4 | C18: 6 | D18: 5 | E18: 2 | F18: 2 | I18: Yes
A19: 11 | B19: 3 | C19: 16 | D19: 3 | E19: 2 | F19: 2 | I19: Yes
A20: 12 | B20: 5 | C20: 12 | D20: 6 | E20: 1 | F20: 2
A21: 13 | B21: 4 | C21: 18 | D21: 10 | E21: 0 | F21: 3 | H21: 1
A22: 14 | B22: 4 | C22: 2 | D22: 4 | E22: 3 | F22: 1 | I22: Yes
A23: 15 | B23: 3 | C23: 8 | D23: 3 | E23: 3 | F23: 2 | I23: Yes
A24: 16 | B24: 4 | C24: 14 | D24: 5 | E24: 1 | F24: 2
A25: 17 | B25: 5 | C25: 4 | D25: 4 | E25: 4 | F25: 0 | G25: 1 | I25: Yes
A26: 18 | B26: 4 | C26: 10 | D26: 7 | E26: 0 | F26: 3 | G26: 1
A27: Totals | B27: =IF(B2="","",SUM(B9:B26)) -> 72 | D27: =IF(B2="","",SUM(D9:D26)) -> 98 | E27: =IF(B2="","",SUM(E9:E26)) -> 26 | F27: =IF(B2="","",SUM(F9:F26)) -> 36 | G27: =IF(B2="","",SUM(G9:G26)) -> 3 | H27: =IF(B2="","",SUM(H9:H26)) -> 1 | I27: =IF(COUNTIF(I9:I26,"=Yes")=0,"",COUNTIF(I9:I26,"=Yes")) -> 9