A1: Danny Marsh
A2: Club | B2: Laguna Vilamoura
A3: Par/SS | B3: 72/73 | D3: Num. Of Fairways | I3: =IF(B2="","",18-(COUNTIF(B9:B26,3))) -> 14
A4: Date | B4: 38319 | D4: Playing Handicap | I4: 9.7000000000019959
A5: Event Place | B5: 5 | D5: Prize Money | G5: 2500
A6: Game Stats | B6: DB+ | C6: DB | D6: BI | E6: P | F6: B | G6: E | H6: A | I6: H1
B7: 3 | C7: 5 | D7: 7 | E7: 3 | F7: 0 | G7: 0 | H7: 0 | I7: 0
A8: Hole No | B8: Par | C8: Stroke Index | D8: Gross Score | E8: Points | F8: Putts | G8: Fairways | H8: Ferrets | I8: Green Regulation
A9: 1 | B9: 5 | C9: 16 | D9: 7 | E9: 0 | F9: 2
A10: 2 | B10: 3 | C10: 12 | D10: 4 | E10: 1 | F10: 1
A11: 3 | B11: 4 | C11: 4 | D11: 6 | E11: 1 | F11: 1 | H11: 1
A12: 4 | B12: 3 | C12: 6 | D12: 4 | E12: 2 | F12: 2 | I12: Yes
A13: 5 | B13: 4 | C13: 8 | D13: 4 | E13: 3 | F13: 2 | G13: 1 | I13: Yes
A14: 6 | B14: 4 | C14: 18 | D14: 4 | E14: 2 | F14: 1 | G14: 1
A15: 7 | B15: 4 | C15: 10 | D15: 5 | E15: 2 | F15: 2 | I15: Yes
A16: 8 | B16: 5 | C16: 14 | D16: 6 | E16: 1 | F16: 2
A17: 9 | B17: 4 | C17: 2 | D17: 10 | E17: 0 | F17: 3 | H17: 2
A18: 10 | B18: 5 | C18: 17 | D18: 6 | E18: 1 | F18: 2
A19: 11 | B19: 4 | C19: 7 | D19: 5 | E19: 2 | F19: 2 | G19: 1 | I19: Yes
A20: 12 | B20: 3 | C20: 5 | D20: 3 | E20: 3 | F20: 1 | H20: 1 | I20: Yes
A21: 13 | B21: 4 | C21: 1 | D21: 6 | E21: 1 | F21: 2
A22: 14 | B22: 4 | C22: 3 | D22: 7 | E22: 0 | F22: 2 | H22: 1
A23: 15 | B23: 5 | C23: 13 | D23: 10 | E23: 0 | F23: 3 | G23: 1 | H23: 2
A24: 16 | B24: 4 | C24: 15 | D24: 6 | E24: 0 | F24: 2 | G24: 1
A25: 17 | B25: 3 | C25: 11 | D25: 4 | E25: 1 | F25: 2
A26: 18 | B26: 4 | C26: 9 | D26: 6 | E26: 1 | F26: 1
A27: Totals | B27: =IF(B2="","",SUM(B9:B26)) -> 72 | D27: =IF(B2="","",SUM(D9:D26)) -> 103 | E27: =IF(B2="","",SUM(E9:E26)) -> 21 | F27: =IF(B2="","",SUM(F9:F26)) -> 33 | G27: =IF(B2="","",SUM(G9:G26)) -> 5 | H27: =IF(B2="","",SUM(H9:H26)) -> 7 | I27: =IF(COUNTIF(I9:I26,"=Yes")=0,"",COUNTIF(I9:I26,"=Yes")) -> 5