A1: Paul Baldwin
A2: Club | B2: Victoria, Vilamoura
A3: Par/SS | B3: 72/92 | D3: Num. Of Fairways | I3: =IF(B2="","",18-(COUNTIF(B9:B26,3))) -> 14
A4: Date | B4: 38317 | D4: Playing Handicap | I4: 16.4
A5: Event Place | B5: 5 | D5: Prize Money | G5: 2500
A6: Game Stats | B6: DB+ | C6: DB | D6: Bi | E6: P | F6: B | G6: E | H6: A | I6: H1
B7: 8 | C7: 3 | D7: 5 | E7: 2 | F7: 0 | G7: 0 | H7: 0 | I7: 0
A8: Hole No | B8: Par | C8: Stroke Index | D8: Gross Score | E8: Points | F8: Putts | G8: Fairways | H8: Ferrets | I8: Green Regulation
A9: 1 | B9: 4 | C9: 9 | D9: 4 | E9: 3 | F9: 2 | G9: 1 | I9: Yes
A10: 2 | B10: 4 | C10: 13 | D10: 6 | E10: 1 | F10: 2 | G10: 1
A11: 3 | B11: 5 | C11: 3 | D11: 8 | E11: 0 | F11: 3
A12: 4 | B12: 4 | C12: 11 | D12: 7 | E12: 0 | F12: 2
A13: 5 | B13: 5 | C13: 1 | D13: 6 | E13: 2 | F13: 2 | G13: 1 | I13: Yes
A14: 6 | B14: 3 | C14: 15 | D14: 5 | E14: 1 | F14: 2
A15: 7 | B15: 4 | C15: 5 | D15: 10 | E15: 0 | F15: 3 | H15: 2
A16: 8 | B16: 3 | C16: 17 | D16: 4 | E16: 1 | F16: 3 | I16: Yes
A17: 9 | B17: 4 | C17: 7 | D17: 5 | E17: 2 | F17: 2 | G17: 1 | I17: Yes
A18: 10 | B18: 4 | C18: 10 | D18: 4 | E18: 3 | F18: 1 | I18: Yes
A19: 11 | B19: 4 | C19: 14 | D19: 7 | E19: 0 | F19: 2
A20: 12 | B20: 5 | C20: 4 | D20: 10 | E20: 0 | F20: 3 | H20: 1
A21: 13 | B21: 3 | C21: 18 | D21: 5 | E21: 0 | F21: 3
A22: 14 | B22: 4 | C22: 2 | D22: 10 | E22: 0 | F22: 3 | H22: 1
A23: 15 | B23: 4 | C23: 16 | D23: 5 | E23: 2 | F23: 1
A24: 16 | B24: 3 | C24: 6 | D24: 4 | E24: 2 | F24: 2 | I24: Yes
A25: 17 | B25: 5 | C25: 8 | D25: 10 | E25: 0 | F25: 3 | H25: 2
A26: 18 | B26: 4 | C26: 12 | D26: 10 | E26: 0 | F26: 5 | G26: 1
A27: Totals | B27: =IF(B2="","",SUM(B9:B26)) -> 72 | D27: =IF(B2="","",SUM(D9:D26)) -> 120 | E27: =IF(B2="","",SUM(E9:E26)) -> 17 | F27: =IF(B2="","",SUM(F9:F26)) -> 44 | G27: =IF(B2="","",SUM(G9:G26)) -> 5 | H27: =IF(B2="","",SUM(H9:H26)) -> 6 | I27: =IF(COUNTIF(I9:I26,"=Yes")=0,"",COUNTIF(I9:I26,"=Yes")) -> 6