A1: Roy Dickens
A2: Club | B2: Broke Hill
A3: Par/SS | B3: 72/72 | D3: Num. Of Fairways | I3: =IF(B2="","",18-(COUNTIF(B9:B26,3))) -> 14
A4: Date | B4: 38298 | D4: Playing Handicap | I4: 29.200000000001001
A5: Event Place | B5: 2 | D5: Prize Money | G5: 7500
A6: Game Stats | B6: DB+ | C6: DB | D6: Bi | E6: P | F6: B | G6: E | H6: A | I6: H1
B7: 8 | C7: 4 | D7: 3 | E7: 2 | F7: 1 | G7: 0 | H7: 0 | I7: 0
A8: Hole No | B8: Par | C8: Stroke Index | D8: Gross Score | E8: Points | F8: Putts | G8: Fairways | H8: Ferrets | I8: Green Regulation
A9: 1 | B9: 4 | C9: 13 | D9: 5 | E9: 2 | F9: 2 | I9: Yes
A10: 2 | B10: 4 | C10: 9 | D10: 6 | E10: 2 | F10: 2 | I10: Yes
A11: 3 | B11: 5 | C11: 3 | D11: 6 | E11: 3 | F11: 0
A12: 4 | B12: 3 | C12: 15 | D12: 6 | E12: 0 | F12: 2 | H12: 1
A13: 5 | B13: 4 | C13: 11 | D13: 7 | E13: 1 | F13: 2
A14: 6 | B14: 4 | C14: 1 | D14: 8 | E14: 0 | F14: 2
A15: 7 | B15: 4 | C15: 7 | D15: 3 | E15: 5 | F15: 1 | G15: 1 | I15: Yes
A16: 8 | B16: 3 | C16: 17 | D16: 3 | E16: 3 | F16: 2 | I16: Yes
A17: 9 | B17: 5 | C17: 5 | D17: 6 | E17: 3 | F17: 2 | G17: 1 | I17: Yes
A18: 10 | B18: 4 | C18: 12 | D18: 7 | E18: 0 | F18: 1
A19: 11 | B19: 3 | C19: 18 | D19: 5 | E19: 1 | F19: 1
A20: 12 | B20: 5 | C20: 4 | D20: 10 | E20: 0 | F20: 2 | H20: 1
A21: 13 | B21: 4 | C21: 8 | D21: 6 | E21: 2 | F21: 1
A22: 14 | B22: 4 | C22: 14 | D22: 4 | E22: 3 | F22: 2 | G22: 1 | I22: Yes
A23: 15 | B23: 5 | C23: 2 | D23: 10 | E23: 0 | F23: 1 | H23: 1
A24: 16 | B24: 4 | C24: 16 | D24: 7 | E24: 0 | F24: 3 | G24: 1
A25: 17 | B25: 3 | C25: 6 | D25: 10 | E25: 0 | F25: 3
A26: 18 | B26: 4 | C26: 10 | D26: 6 | E26: 2 | F26: 2 | I26: Yes
A27: Totals | B27: =IF(B2="","",SUM(B9:B26)) -> 72 | D27: =IF(B2="","",SUM(D9:D26)) -> 115 | E27: =IF(B2="","",SUM(E9:E26)) -> 27 | F27: =IF(B2="","",SUM(F9:F26)) -> 31 | G27: =IF(B2="","",SUM(G9:G26)) -> 4 | H27: =IF(B2="","",SUM(H9:H26)) -> 3 | I27: =IF(COUNTIF(I9:I26,"=Yes")=0,"",COUNTIF(I9:I26,"=Yes")) -> 7