A1: Malcolm Rouse
A2: Club | B2: Atalaya Old Course
A3: Par/SS | B3: 72/72 | D3: Num. Of Fairways | I3: =IF(B2="","",18-(COUNTIF(B9:B26,3))) -> 14
A4: Date | B4: 40666 | D4: Playing Handicap | I4: 43.9
A5: Event Place | B5: 24 | C5: M | D5: Prize Money | G5: 2500
A6: Game Stats | B6: DB+ | C6: DB | D6: Bi | E6: P | F6: B | G6: E | H6: A | I6: H1
B7: 15 | C7: 2 | D7: 1 | E7: 0 | F7: 0 | G7: 0 | H7: 0 | I7: 0
A8: Hole No | B8: Par | C8: Stroke Index | D8: Gross Score | E8: Points | F8: Putts | G8: Fairways | H8: Ferrets | I8: Green Regulation
A9: 1 | B9: 4 | C9: 17 | D9: 8 | E9: 0 | F9: 3
A10: 2 | B10: 3 | C10: 7 | D10: 5 | E10: 2 | F10: 2 | I10: Yes
A11: 3 | B11: 4 | C11: 3 | D11: 10 | E11: 0 | F11: 3
A12: 4 | B12: 4 | C12: 13 | D12: 8 | E12: 0 | F12: 3
A13: 5 | B13: 5 | C13: 1 | D13: 10 | E13: 0 | F13: 3
A14: 6 | B14: 4 | C14: 11 | D14: 7 | E14: 1 | F14: 1 | G14: 1
A15: 7 | B15: 3 | C15: 5 | D15: 6 | E15: 1 | F15: 3 | H15: 1 | I15: Yes
A16: 8 | B16: 5 | C16: 15 | D16: 8 | E16: 1 | F16: 2
A17: 9 | B17: 4 | C17: 9 | D17: 8 | E17: 0 | F17: 2
A18: 10 | B18: 4 | C18: 12 | D18: 8 | E18: 0 | F18: 3
A19: 11 | B19: 5 | C19: 14 | D19: 10 | E19: 0 | F19: 3 | H19: 2
A20: 12 | B20: 3 | C20: 6 | D20: 10 | E20: 0 | F20: 3 | H20: 1
A21: 13 | B21: 4 | C21: 2 | D21: 7 | E21: 1 | F21: 2
A22: 14 | B22: 4 | C22: 16 | D22: 5 | E22: 3 | F22: 1 | G22: 1 | I22: Yes
A23: 15 | B23: 4 | C23: 8 | D23: 10 | E23: 0 | F23: 3 | H23: 1
A24: 16 | B24: 3 | C24: 18 | D24: 5 | E24: 2 | F24: 2 | I24: Yes
A25: 17 | B25: 5 | C25: 4 | D25: 10 | E25: 0 | F25: 3
A26: 18 | B26: 4 | C26: 10 | D26: 7 | E26: 1 | F26: 2
A27: Totals | B27: =IF(B2="","",SUM(B9:B26)) -> 72 | D27: =IF(B2="","",SUM(D9:D26)) -> 142 | E27: =IF(B2="","",SUM(E9:E26)) -> 12 | F27: =IF(B2="","",SUM(F9:F26)) -> 44 | G27: =IF(B2="","",SUM(G9:G26)) -> 2 | H27: =IF(B2="","",SUM(H9:H26)) -> 5 | I27: =IF(COUNTIF(I9:I26,"=Yes")=0,"",COUNTIF(I9:I26,"=Yes")) -> 4