A1: Andy Benson
A2: Club | B2: Hatfield London
A3: Par/SS | B3: 72/71 | D3: Num. Of Fairways | I3: =IF(B2="","",18-(COUNTIF(B9:B26,3))) -> 14
A4: Date | B4: 38429 | D4: Playing Handicap | I4: 5.9
A5: Event Place | B5: 2 | D5: Prize Money | G5: 2500
A6: Game Stats | B6: DB+ | C6: DB | D6: Bi | E6: P | F6: B | G6: E | H6: A | I6: H1
B7: 1 | C7: 2 | D7: 6 | E7: 7 | F7: 2 | G7: 0 | H7: 0 | I7: 0
A8: Hole No | B8: Par | C8: Stroke Index | D8: Gross Score | E8: Points | F8: Putts | G8: Fairways | H8: Ferrets | I8: Green Regulation
A9: 1 | B9: 4 | C9: 16 | D9: 4 | E9: 2 | F9: 2 | G9: 1 | I9: Yes
A10: 2 | B10: 4 | C10: 18 | D10: 5 | E10: 1 | F10: 2
A11: 3 | B11: 3 | C11: 14 | D11: 3 | E11: 2 | F11: 2 | I11: Yes
A12: 4 | B12: 5 | C12: 2 | D12: 7 | E12: 1 | F12: 2 | H12: 1
A13: 5 | B13: 4 | C13: 12 | D13: 5 | E13: 1 | F13: 2
A14: 6 | B14: 4 | C14: 4 | D14: 5 | E14: 2 | F14: 2 | I14: Yes
A15: 7 | B15: 4 | C15: 6 | D15: 4 | E15: 3 | F15: 1 | I15: Yes
A16: 8 | B16: 3 | C16: 10 | D16: 5 | E16: 0 | F16: 2
A17: 9 | B17: 5 | C17: 8 | D17: 4 | E17: 3 | F17: 1 | G17: 1 | I17: Yes
A18: 10 | B18: 4 | C18: 5 | D18: 5 | E18: 2 | F18: 2 | G18: 1 | I18: Yes
A19: 11 | B19: 3 | C19: 13 | D19: 3 | E19: 2 | F19: 2 | I19: Yes
A20: 12 | B20: 5 | C20: 3 | D20: 6 | E20: 2 | F20: 2 | I20: Yes
A21: 13 | B21: 3 | C21: 17 | D21: 2 | E21: 3 | F21: 1 | I21: Yes
A22: 14 | B22: 4 | C22: 11 | D22: 5 | E22: 1 | F22: 2
A23: 15 | B23: 4 | C23: 9 | D23: 4 | E23: 2 | F23: 2 | I23: Yes
A24: 16 | B24: 5 | C24: 15 | D24: 5 | E24: 2 | F24: 2 | G24: 1 | I24: Yes
A25: 17 | B25: 4 | C25: 7 | D25: 4 | E25: 2 | F25: 2 | G25: 1 | I25: Yes
A26: 18 | B26: 4 | C26: 1 | D26: 7 | E26: 0 | F26: 3 | H26: 1
A27: Totals | B27: =IF(B2="","",SUM(B9:B26)) -> 72 | D27: =IF(B2="","",SUM(D9:D26)) -> 83 | E27: =IF(B2="","",SUM(E9:E26)) -> 31 | F27: =IF(B2="","",SUM(F9:F26)) -> 34 | G27: =IF(B2="","",SUM(G9:G26)) -> 5 | H27: =IF(B2="","",SUM(H9:H26)) -> 2 | I27: =IF(COUNTIF(I9:I26,"=Yes")=0,"",COUNTIF(I9:I26,"=Yes")) -> 12