A1: Ian Edwards
A2: Club | B2: Merrist Wood
A3: Par/SS | B3: 72/70 | D3: Num. Of Fairways | I3: =IF(B2="","",18-(COUNTIF(B9:B26,3))) -> 14
A4: Date | B4: 38444 | D4: Playing Handicap | I4: 15.5
A5: Event Place | B5: 2 | C5: m | D5: Prize Money | G5: 45000
A6: Game Stats | B6: DB+ | C6: DB | D6: Bi | E6: P | F6: B | G6: E | H6: A | I6: H1
B7: 1 | C7: 7 | D7: 4 | E7: 6 | F7: 0 | G7: 0 | H7: 0 | I7: 0
A8: Hole No | B8: Par | C8: Stroke Index | D8: Gross Score | E8: Points | F8: Putts | G8: Fairways | H8: Ferrets | I8: Green Regulation
A9: 1 | B9: 4 | C9: 10 | D9: 6 | E9: 1 | F9: 3 | I9: Yes
A10: 2 | B10: 3 | C10: 18 | D10: 3 | E10: 2 | F10: 2 | I10: Yes
A11: 3 | B11: 4 | C11: 6 | D11: 5 | E11: 2 | F11: 3 | G11: 1 | I11: Yes
A12: 4 | B12: 5 | C12: 14 | D12: 5 | E12: 3 | F12: 2 | G12: 1 | I12: Yes
A13: 5 | B13: 4 | C13: 4 | D13: 5 | E13: 2 | F13: 3 | G13: 1 | I13: Yes
A14: 6 | B14: 5 | C14: 12 | D14: 7 | E14: 1 | F14: 1 | H14: 1
A15: 7 | B15: 4 | C15: 8 | D15: 4 | E15: 3 | F15: 2 | G15: 1 | I15: Yes
A16: 8 | B16: 3 | C16: 16 | D16: 5 | E16: 1 | F16: 3 | I16: Yes
A17: 9 | B17: 4 | C17: 2 | D17: 4 | E17: 3 | F17: 2 | G17: 1 | I17: Yes
A18: 10 | B18: 5 | C18: 9 | D18: 10 | E18: 0 | F18: 3 | H18: 2
A19: 11 | B19: 3 | C19: 15 | D19: 3 | E19: 3 | F19: 2 | I19: Yes
A20: 12 | B20: 4 | C20: 7 | D20: 5 | E20: 2 | F20: 3 | G20: 1 | I20: Yes
A21: 13 | B21: 4 | C21: 1 | D21: 5 | E21: 2 | F21: 3 | G21: 1 | I21: Yes
A22: 14 | B22: 4 | C22: 13 | D22: 6 | E22: 1 | F22: 3 | G22: 1 | I22: Yes
A23: 15 | B23: 4 | C23: 3 | D23: 6 | E23: 1 | F23: 2 | G23: 1
A24: 16 | B24: 3 | C24: 17 | D24: 3 | E24: 2 | F24: 1
A25: 17 | B25: 4 | C25: 5 | D25: 6 | E25: 1 | F25: 2 | H25: 1
A26: 18 | B26: 5 | C26: 11 | D26: 7 | E26: 1 | F26: 2
A27: Totals | B27: =IF(B2="","",SUM(B9:B26)) -> 72 | D27: =IF(B2="","",SUM(D9:D26)) -> 95 | E27: =IF(B2="","",SUM(E9:E26)) -> 31 | F27: =IF(B2="","",SUM(F9:F26)) -> 42 | G27: =IF(B2="","",SUM(G9:G26)) -> 9 | H27: =IF(B2="","",SUM(H9:H26)) -> 4 | I27: =IF(COUNTIF(I9:I26,"=Yes")=0,"",COUNTIF(I9:I26,"=Yes")) -> 12