A1: Robert Thompson
A2: Club | B2: Epsom
A3: Par/SS | B3: 67/65 | D3: Num. Of Fairways | I3: =IF(B2="","",18-(COUNTIF(B9:B26,3))) -> 13
A4: Date | B4: 38436 | D4: Playing Handicap | I4: 9
A5: Event Place | B5: 2 | D5: Prize Money | G5: 2500
A6: Game Stats | B6: DB+ | C6: DB | D6: Bi | E6: P | F6: B | G6: E | H6: A | I6: H1
B7: 2 | C7: 4 | D7: 6 | E7: 5 | F7: 1 | G7: 0 | H7: 0 | I7: 0
A8: Hole No | B8: Par | C8: Stroke Index | D8: Gross Score | E8: Points | F8: Putts | G8: Fairways | H8: Ferrets | I8: Green Regulation
A9: 1 | B9: 3 | C9: 6 | D9: 5 | E9: 1 | F9: 3 | I9: Yes
A10: 2 | B10: 4 | C10: 4 | D10: 5 | E10: 2 | F10: 1
A11: 3 | B11: 3 | C11: 10 | D11: 5 | E11: 0 | F11: 3
A12: 4 | B12: 4 | C12: 18 | D12: 7 | E12: 0 | F12: 3
A13: 5 | B13: 4 | C13: 2 | D13: 4 | E13: 3 | F13: 1 | I13: Yes
A14: 6 | B14: 4 | C14: 8 | D14: 6 | E14: 1 | F14: 1 | H14: 1
A15: 7 | B15: 3 | C15: 12 | D15: 3 | E15: 2 | F15: 2 | I15: Yes
A16: 8 | B16: 4 | C16: 16 | D16: 6 | E16: 0 | F16: 3 | G16: 1
A17: 9 | B17: 4 | C17: 14 | D17: 3 | E17: 3 | F17: 1 | I17: Yes
A18: 10 | B18: 4 | C18: 11 | D18: 5 | E18: 1 | F18: 2
A19: 11 | B19: 4 | C19: 3 | D19: 4 | E19: 3 | F19: 1 | G19: 1 | I19: Yes
A20: 12 | B20: 4 | C20: 7 | D20: 5 | E20: 2 | F20: 3 | G20: 1 | I20: Yes
A21: 13 | B21: 3 | C21: 13 | D21: 3 | E21: 2 | F21: 2 | I21: Yes
A22: 14 | B22: 4 | C22: 9 | D22: 4 | E22: 3 | F22: 2 | G22: 1 | I22: Yes
A23: 15 | B23: 4 | C23: 1 | D23: 5 | E23: 2 | F23: 2 | G23: 1 | I23: Yes
A24: 16 | B24: 4 | C24: 15 | D24: 5 | E24: 1 | F24: 3 | I24: Yes
A25: 17 | B25: 3 | C25: 17 | D25: 4 | E25: 1 | F25: 2
A26: 18 | B26: 4 | C26: 5 | D26: 10 | E26: 0 | F26: 3 | H26: 1
A27: Totals | B27: =IF(B2="","",SUM(B9:B26)) -> 67 | D27: =IF(B2="","",SUM(D9:D26)) -> 89 | E27: =IF(B2="","",SUM(E9:E26)) -> 27 | F27: =IF(B2="","",SUM(F9:F26)) -> 38 | G27: =IF(B2="","",SUM(G9:G26)) -> 5 | H27: =IF(B2="","",SUM(H9:H26)) -> 2 | I27: =IF(COUNTIF(I9:I26,"=Yes")=0,"",COUNTIF(I9:I26,"=Yes")) -> 10