A1: Paul Baldwin
A2: Club | B2: Westerham
A3: Par/SS | B3: 72/70 | D3: Num. Of Fairways
A4: Date | B4: 40817 | D4: Playing Handicap | I4: 20.5
A5: Event Place | B5: 7 | C5: M | D5: Prize Money | G5: 13750
A6: Game Stats | B6: DB+ | C6: DB | D6: BI | E6: P | F6: B | G6: E | H6: A | I6: H1
B7: 5 | C7: 4 | D7: 6 | E7: 3 | F7: 0 | G7: 0 | H7: 0 | I7: 0
A8: Hole No | B8: Par | C8: Stroke Index | D8: Gross Score | E8: Points | F8: Putts | G8: Fairways | H8: Ferrets | I8: Green Regulation
A9: 1 | B9: 4 | C9: 14 | D9: 5 | E9: 2 | F9: 1
A10: 2 | B10: 4 | C10: 8 | D10: 4 | E10: 3 | F10: 2 | G10: 1 | I10: Yes
A11: 3 | B11: 5 | C11: 4 | D11: 7 | E11: 1 | F11: 2
A12: 4 | B12: 3 | C12: 18 | D12: 3 | E12: 3 | F12: 2 | I12: Yes
A13: 5 | B13: 5 | C13: 6 | D13: 8 | E13: 0 | F13: 2
A14: 6 | B14: 4 | C14: 2 | D14: 5 | E14: 3 | F14: 2 | I14: Yes
A15: 7 | B15: 4 | C15: 12 | D15: 6 | E15: 1 | F15: 2 | G15: 1
A16: 8 | B16: 3 | C16: 10 | D16: 4 | E16: 2 | F16: 2 | I16: Yes
A17: 9 | B17: 4 | C17: 16 | D17: 10 | E17: 0 | F17: 3 | H17: 1
A18: 10 | B18: 5 | C18: 5 | D18: 7 | E18: 1 | F18: 2
A19: 11 | B19: 3 | C19: 13 | D19: 5 | E19: 1 | F19: 2
A20: 12 | B20: 4 | C20: 11 | D20: 5 | E20: 2 | F20: 1
A21: 13 | B21: 3 | C21: 15 | D21: 4 | E21: 2 | F21: 2 | I21: Yes
A22: 14 | B22: 4 | C22: 1 | D22: 8 | E22: 0 | F22: 2
A23: 15 | B23: 4 | C23: 7 | D23: 5 | E23: 2 | F23: 2 | I23: Yes
A24: 16 | B24: 5 | C24: 17 | D24: 5 | E24: 3 | F24: 1 | I24: Yes
A25: 17 | B25: 4 | C25: 3 | D25: 10 | E25: 0 | F25: 3 | H25: 1
A26: 18 | B26: 4 | C26: 9 | D26: 10 | E26: 0 | F26: 3 | G26: 1 | H26: 1
A27: Totals | B27: =IF(B2="","",SUM(B9:B26)) -> 72 | D27: =IF(B2="","",SUM(D9:D26)) -> 111 | E27: =IF(B2="","",SUM(E9:E26)) -> 26 | F27: =IF(B2="","",SUM(F9:F26)) -> 36 | G27: =IF(B2="","",SUM(G9:G26)) -> 3 | H27: =IF(B2="","",SUM(H9:H26)) -> 3 | I27: =IF(COUNTIF(I9:I26,"=Yes")=0,"",COUNTIF(I9:I26,"=Yes")) -> 7