B1: Season 16 - April 1st 2014 to 31st March 2015
A2: MGA World Tour Putting Statistics
B3: Statistics updated | C3: =TODAY() -> 42089
A4: Pos | B4: Player | C4: Original Handicap | D4: Current Handicap | E4: Playing Handicap | F4: Played | G4: Total Putts | H4: Ave per Round | I4: Ave Per Hole | J4: Best Round | K4: Worst Round
A5: 1 | B5: David Andrews | C5: 15.6 | D5: 14.3 | E5: =D5 -> 14.3 | F5: 5 | G5: 156 | H5: 31.20 | I5: =IF(G5=0,"",G5/(F5*18)) -> 1.7333333333333334 | J5: 25 | K5: 35 | L5: Qualified
A6: 2 | B6: David Braithwaite | C6: 12.6 | D6: 11.100000000000998 | E6: =D6 -> 11.100000000000998 | F6: 8 | G6: 253 | H6: 31.625 | I6: =IF(G6=0,"",G6/(F6*18)) -> 1.7569444444444444 | J6: 29 | K6: 35 | L6: Qualified
A7: 3 | B7: Keith Mendelson | C7: 11.8 | D7: 12.8 | E7: =D7 -> 12.8 | F7: 5 | G7: 169 | H7: 33.80 | I7: =IF(G7=0,"",G7/(F7*18)) -> 1.8777777777777778 | J7: 28 | K7: 37 | L7: Qualified
A8: 4 | B8: David Bingham | C8: 11.3 | D8: 11.000000000001998 | E8: =D8 -> 11.000000000001998 | F8: 6 | G8: 201 | H8: 33.50 | I8: =IF(G8=0,"",G8/(F8*18)) -> 1.8611111111111112 | J8: 32 | K8: 36 | L8: Qualified
A9: 5 | B9: Paul Carter | C9: 13.8 | D9: 12.0 | E9: =D9 -> 12 | F9: 7 | G9: 239 | H9: 34.142857142857146 | I9: =IF(G9=0,"",G9/(F9*18)) -> 1.8968253968253967 | J9: 28 | K9: 38 | L9: Qualified
A10: 6 | B10: Kevin Gallagher | C10: 13.0 | D10: 13.4 | E10: =D10 -> 13.4 | F10: 6 | G10: 210 | H10: 35.00 | I10: =IF(G10=0,"",G10/(F10*18)) -> 1.9444444444444444 | J10: 28 | K10: 39 | L10: Qualified
A11: 7 | B11: Jon Dey | C11: 23.8 | D11: 22.8 | E11: =D11 -> 22.8 | F11: 7 | G11: 241 | H11: 34.428571428571431 | I11: =IF(G11=0,"",G11/(F11*18)) -> 1.9126984126984128 | J11: 30 | K11: 39 | L11: Qualified
A12: 8 | B12: Simon Thompson | C12: 11.2 | D12: 10.3 | E12: =D12 -> 10.3 | F12: 5 | G12: 167 | H12: 33.40 | I12: =IF(G12=0,"",G12/(F12*18)) -> 1.8555555555555556 | J12: 29 | K12: 39 | L12: Qualified
A13: 9 | B13: Roy Dickens | C13: 30.4 | D13: 28.800000000001003 | E13: =D13 -> 28.800000000001003 | F13: 5 | G13: 173 | H13: 34.60 | I13: =IF(G13=0,"",G13/(F13*18)) -> 1.9222222222222223 | J13: 31 | K13: 38 | L13: Qualified
A14: 10 | B14: Robert Thompson | C14: 9.2 | D14: 11.9 | E14: =D14 -> 11.9 | F14: 9 | G14: 311 | H14: 34.555555555555557 | I14: =IF(G14=0,"",G14/(F14*18)) -> 1.9197530864197532 | J14: 33 | K14: 38 | L14: Qualified
A15: 11 | B15: David Rouse | C15: 25.8 | D15: 27.0 | E15: =D15 -> 27 | F15: 8 | G15: 277 | H15: 34.625 | I15: =IF(G15=0,"",G15/(F15*18)) -> 1.9236111111111112 | J15: 32 | K15: 37 | L15: Qualified
A16: 12 | B16: Jon Press | C16: 13.8 | D16: 13.5 | E16: =D16 -> 13.5 | F16: 6 | G16: 208 | H16: 34.666666666666664 | I16: =IF(G16=0,"",G16/(F16*18)) -> 1.9259259259259258 | J16: 31 | K16: 38 | L16: Qualified
A17: 13 | B17: Martin Cox | C17: 12.8 | D17: 13.8 | E17: =D17 -> 13.8 | F17: 5 | G17: 176 | H17: 35.20 | I17: =IF(G17=0,"",G17/(F17*18)) -> 1.9555555555555555 | J17: 34 | K17: 36 | L17: Qualified
A18: 14 | B18: Simon Owens | C18: 14.8 | D18: 15.1 | E18: =D18 -> 15.1 | F18: 4 | G18: 137 | H18: 34.25 | I18: =IF(G18=0,"",G18/(F18*18)) -> 1.9027777777777777 | J18: 31 | K18: 38 | L18: Qualified
A19: 15 | B19: David Kewley | C19: 17.1 | D19: 14.900000000001 | E19: =D19 -> 14.900000000001 | F19: 7 | G19: 251 | H19: 35.857142857142854 | I19: =IF(G19=0,"",G19/(F19*18)) -> 1.9920634920634921 | J19: 31 | K19: 42 | L19: Qualified
A20: 16 | B20: Matthew Carter | C20: 16.2 | D20: 15.400000000000999 | E20: =D20 -> 15.400000000000999 | F20: 5 | G20: 181 | H20: 36.20 | I20: =IF(G20=0,"",G20/(F20*18)) -> 2.0111111111111111 | J20: 34 | K20: 39 | L20: Qualified
A21: 17 | B21: Michael Trimmings | C21: 20.3 | D21: 19.8 | E21: =D21 -> 19.8 | F21: 5 | G21: 184 | H21: 36.80 | I21: =IF(G21=0,"",G21/(F21*18)) -> 2.0444444444444443 | J21: 32 | K21: 44 | L21: Qualified
A22: 18 | B22: Paul Baldwin | C22: 20.4 | D22: 19.000000000000998 | E22: =D22 -> 19.000000000000998 | F22: 4 | G22: 150 | H22: 37.50 | I22: =IF(G22=0,"",G22/(F22*18)) -> 2.0833333333333335 | J22: 35 | K22: 40 | L22: Qualified
A23: 19 | B23: Jeff Colbrook | C23: 17.2 | D23: 18.4 | E23: =D23 -> 18.4 | F23: 5 | G23: 188 | H23: 37.60 | I23: =IF(G23=0,"",G23/(F23*18)) -> 2.088888888888889 | J23: 34 | K23: 43 | L23: Qualified
A24: 20 | B24: Andrew Baldwin | C24: 20.0 | D24: 20.4 | E24: =D24 -> 20.4 | F24: 3 | G24: 114 | H24: 38.00 | I24: =IF(G24=0,"",G24/(F24*18)) -> 2.1111111111111112 | J24: 37 | K24: 40 | L24: Qualified
A25: 21 | B25: David Archer | C25: 21.2 | D25: 21.700000000000998 | E25: =D25 -> 21.700000000000998 | F25: 4 | G25: 158 | H25: 39.50 | I25: =IF(G25=0,"",G25/(F25*18)) -> 2.1944444444444446 | J25: 37 | K25: 43 | L25: Qualified
A26: 22 | B26: Ian Edwards | C26: 15.6 | D26: 17.000000000002 | E26: =D26 -> 17.000000000002 | F26: 4 | G26: 161 | H26: 40.25 | I26: =IF(G26=0,"",G26/(F26*18)) -> 2.2361111111111112 | J26: 36 | K26: 45 | L26: Qualified
A27: 23 | B27: Alan Hopkins | C27: 7.9 | D27: 7.9 | E27: =D27 -> 7.9 | F27: 2 | G27: 70 | H27: 35.00 | I27: =IF(G27=0,"",G27/(F27*18)) -> 1.9444444444444444 | J27: 29 | K27: 41
A28: 24 | B28: Andy Benson | C28: 6.3 | D28: 6.1 | E28: =D28 -> 6.1 | F28: 1 | G28: 36 | H28: 36.00 | I28: =IF(G28=0,"",G28/(F28*18)) -> 2.00 | J28: 36 | K28: 36
A29: 25 | B29: Chris Manning | C29: 22.9 | D29: 23.3 | E29: =D29 -> 23.3 | F29: 2 | G29: 73 | H29: 36.50 | I29: =IF(G29=0,"",G29/(F29*18)) -> 2.0277777777777777 | J29: 36 | K29: 37
A30: 26 | B30: Alan Baldwin | C30: 21.1 | D30: 22.2 | E30: =D30 -> 22.2 | F30: 2 | G30: 74 | H30: 37.00 | I30: =IF(G30=0,"",G30/(F30*18)) -> 2.0555555555555554 | J30: 35 | K30: 39
A31: 27 | B31: Martin Bould | C31: 16.0 | D31: 16.2 | E31: =D31 -> 16.2 | F31: 1 | G31: 37 | H31: 37.00 | I31: =IF(G31=0,"",G31/(F31*18)) -> 2.0555555555555554 | J31: 37 | K31: 37
B32: Clive Ferris | C32: 26.0 | D32: 26.0 | E32: =D32 -> 26 | F32: 0 | G32: 0 | H32: 0.00 | I32: =IF(G32=0,"",G32/(F32*18)) ->  | J32: 0 | K32: 0
B33: Malcolm Rouse | C33: 44.9 | D33: 44.9 | E33: =D33 -> 44.9 | F33: 0 | G33: 0 | H33: 0.00 | I33: =IF(G33=0,"",G33/(F33*18)) ->  | J33: 0 | K33: 0
B34: Steve Tilling | C34: 16.3 | D34: 16.3 | E34: =D34 -> 16.3 | F34: 0 | G34: 0 | H34: 0.00 | I34: =IF(G34=0,"",G34/(F34*18)) ->  | J34: 0 | K34: 0