A1: Season 10 - April 1st 2008 to 31st March 2009
A2: MGA World Tour Money List
B3: Statistics updated | C3: =TODAY() -> 39902
A4: Pos | B4: Player | C4: Original Handicap | D4: Current Handicap | E4: Playing Handicap | F4: Events Played | G4: Tour Victories | H4: Winnings
A5: 1 | B5: Robert Thompson | C5: 8.7 | D5: 7.9 | E5: =D5 -> 7.9 | F5: 23 | G5: 13 | H5: 180000
A6: =A5+1 -> 2 | B6: Keith Mendelson | C6: 14.6 | D6: 15.1 | E6: =D6 -> 15.1 | F6: 13 | G6: 5 | H6: 97500
A7: =A6+1 -> 3 | B7: Dave Rouse | C7: 26.4 | D7: 25.6 | E7: =D7 -> 25.6 | F7: 7 | G7: 1 | H7: 92500
A8: =A7+1 -> 4 | B8: Dave Bingham | C8: 16.0 | D8: 13.1 | E8: =D8 -> 13.1 | F8: 4 | G8: 1 | H8: 92500
A9: =A8+1 -> 5 | B9: Kevin Gallagher | C9: 12.0 | D9: 13.500000000001993 | E9: =D9 -> 13.500000000001993 | F9: 19 | G9: 4 | H9: 87500
A10: =A9+1 -> 6 | B10: Matthew Carter | C10: 20.2 | D10: 19.600000000002002 | E10: =D10 -> 19.600000000002002 | F10: 7 | G10: 1 | H10: 71250
A11: =A10+1 -> 7 | B11: Paul Carter | C11: 14.7 | D11: 14.7 | E11: =D11 -> 14.7 | F11: 6 | G11: 0 | H11: 58750
A12: =A11+1 -> 8 | B12: Jeff Colbrook | C12: 15.6 | D12: 14.9 | E12: =D12 -> 14.9 | F12: 4 | G12: 2 | H12: 52500
A13: =A12+1 -> 9 | B13: Jeff Gibbons | C13: 19.6 | D13: 20.5 | E13: =D13 -> 20.5 | F13: 10 | G13: 4 | H13: 51250
A14: =A13+1 -> 10 | B14: Andrew Baldwin | C14: 18.1 | D14: 18.6 | E14: =D14 -> 18.6 | F14: 4 | G14: 0 | H14: 46250
A15: =A14+1 -> 11 | B15: Dave Andrews | C15: 18.9 | D15: 16.6 | E15: =D15 -> 16.6 | F15: 2 | G15: 1 | H15: 42500
A16: =A15+1 -> 12 | B16: Martin Bould | C16: 20.3 | D16: 19.4 | E16: =D16 -> 19.4 | F16: 4 | G16: 1 | H16: 41250
A17: =A16+1 -> 13 | B17: Roy Dickens | C17: 30.6 | D17: 29.4 | E17: =D17 -> 29.4 | F17: 2 | G17: 1 | H17: 40000
A18: =A17+1 -> 14 | B18: Simon Thompson | C18: 12.1 | D18: 12.0 | E18: =D18 -> 12 | F18: 2 | G18: 1 | H18: 28750
A19: =A18+1 -> 15 | B19: Alan Hopkins | C19: 8.2 | D19: 8.2 | E19: =D19 -> 8.2 | F19: 1 | G19: 0 | H19: 27500
A20: =A19+1 -> 16 | B20: Martin Cox | C20: 13.5 | D20: 13.6 | E20: =D20 -> 13.6 | F20: 3 | G20: 0 | H20: 26250
A21: =A20+1 -> 17 | B21: Paul Baldwin | C21: 18.6 | D21: 19.2 | E21: =D21 -> 19.2 | F21: 3 | G21: 0 | H21: 23750
A22: =A21+1 -> 18 | B22: Simon Owens | C22: 13.3 | D22: 14.4 | E22: =D22 -> 14.4 | F22: 4 | G22: 0 | H22: 17500
A23: =A22+1 -> 19 | B23: Michael Trimmings | C23: 22.4 | D23: 22.6 | E23: =D23 -> 22.6 | F23: 1 | G23: 0 | H23: 16250
A24: =A23+1 -> 20 | B24: Alan Baldwin | C24: 20.3 | D24: 20.3 | E24: =D24 -> 20.3 | F24: 2 | G24: 1 | H24: 7500
A25: =A24+1 -> 21 | B25: Andy Benson | C25: 7.5 | D25: 7.6 | E25: =D25 -> 7.6 | F25: 1 | G25: 1 | H25: 7500
A26: =A25+1 -> 22 | B26: Ian Edwards | C26: 11.8 | D26: 11.8 | E26: =D26 -> 11.8 | F26: 1 | G26: 1 | H26: 5000
A27: =A26+1 -> 23 | B27: John Press | C27: 14.8 | D27: 15.0 | E27: =D27 -> 15 | F27: 1 | G27: 0 | H27: 5000
A28: =A27+1 -> 24 | B28: Jon Dey | C28: 37.1 | D28: 37.2 | E28: =D28 -> 37.2 | F28: 1 | G28: 0 | H28: 2500
A29: =A28+1 -> 25 | B29: Steve Tilling | C29: 16.5 | D29: 16.5 | E29: =D29 -> 16.5 | F29: 0 | G29: 0 | H29: 0
A30: =A29+1 -> 26 | B30: Malcolm Rouse | C30: 43.9 | D30: 43.9 | E30: =D30 -> 43.9 | F30: 0 | G30: 0 | H30: 0
A31: =A30+1 -> 27 | B31: Keith Johns | C31: 24.3 | D31: 24.3 | E31: =D31 -> 24.3 | F31: 0 | G31: 0 | H31: 0
A32: =A31+1 -> 28 | B32: Dave White | C32: 21.5 | D32: 21.5 | E32: =D32 -> 21.5 | F32: 0 | G32: 0 | H32: 0
A33: =A32+1 -> 29 | B33: Danny Marsh | C33: 8.1 | D33: 8.1 | E33: =D33 -> 8.1 | F33: 0 | G33: 0 | H33: 0
A34: =A33+1 -> 30 | B34: Clive Ferris | C34: 26.0 | D34: 26.0 | E34: =D34 -> 26 | F34: 0 | G34: 0 | H34: 0
A35: =A34+1 -> 31 | B35: Chris Manning | C35: 22.7 | D35: 22.7 | E35: =D35 -> 22.7 | F35: 0 | G35: 0 | H35: 0
A36: =A35+1 -> 32 | B36: Andrew Knight | C36: 21.4 | D36: 21.4 | E36: =D36 -> 21.4 | F36: 0 | G36: 0 | H36: 0