A1: Season 10 - April 1st 2008 to 31st March 2009
A2: MGA World Tour Putting Statistics
B3: Statistics updated | C3: =TODAY() -> 39902
A4: Pos | B4: Player | C4: Original Handicap | D4: Current Handicap | E4: Playing Handicap | F4: Played | G4: Total Putts | H4: Ave per Round | I4: Ave Per Hole | J4: Best Round | K4: Worst Round
A5: 1 | B5: Robert Thompson | C5: 8.7 | D5: 7.9 | E5: =D5 -> 7.9 | F5: 23 | G5: 739 | H5: 32.130434782608695 | I5: =IF(G5=0,"",G5/(F5*18)) -> 1.7850241545893719 | J5: 26 | K5: 39 | L5: Qualified
A6: 2 | B6: Jeff Gibbons | C6: 19.6 | D6: 20.5 | E6: =D6 -> 20.5 | F6: 10 | G6: 328 | H6: 32.80 | I6: =IF(G6=0,"",G6/(F6*18)) -> 1.8222222222222222 | J6: 28 | K6: 36 | L6: Qualified
A7: 3 | B7: Keith Mendelson | C7: 14.6 | D7: 15.1 | E7: =D7 -> 15.1 | F7: 13 | G7: 432 | H7: 33.230769230769234 | I7: =IF(G7=0,"",G7/(F7*18)) -> 1.8461538461538463 | J7: 26 | K7: 38 | L7: Qualified
A8: 4 | B8: Kevin Gallagher | C8: 12.0 | D8: 13.500000000001993 | E8: =D8 -> 13.500000000001993 | F8: 19 | G8: 641 | H8: 33.736842105263158 | I8: =IF(G8=0,"",G8/(F8*18)) -> 1.8742690058479532 | J8: 31 | K8: 37 | L8: Qualified
A9: 5 | B9: Paul Carter | C9: 14.7 | D9: 14.7 | E9: =D9 -> 14.7 | F9: 6 | G9: 215 | H9: 35.833333333333336 | I9: =IF(G9=0,"",G9/(F9*18)) -> 1.9907407407407407 | J9: 34 | K9: 39 | L9: Qualified
A10: 6 | B10: Matthew Carter | C10: 20.2 | D10: 19.600000000002002 | E10: =D10 -> 19.600000000002002 | F10: 7 | G10: 258 | H10: 36.857142857142854 | I10: =IF(G10=0,"",G10/(F10*18)) -> 2.0476190476190474 | J10: 33 | K10: 41 | L10: Qualified
A11: 7 | B11: Dave Rouse | C11: 26.4 | D11: 25.6 | E11: =D11 -> 25.6 | F11: 7 | G11: 262 | H11: 37.428571428571431 | I11: =IF(G11=0,"",G11/(F11*18)) -> 2.0793650793650795 | J11: 35 | K11: 41 | L11: Qualified
A12: 8 | B12: Andy Benson | C12: 7.5 | D12: 7.6 | E12: =D12 -> 7.6 | F12: 1 | G12: 30 | H12: 30.00 | I12: =IF(G12=0,"",G12/(F12*18)) -> 1.6666666666666667 | J12: 30 | K12: 30
A13: 9 | B13: Alan Baldwin | C13: 20.3 | D13: 20.3 | E13: =D13 -> 20.3 | F13: 2 | G13: 63 | H13: 31.50 | I13: =IF(G13=0,"",G13/(F13*18)) -> 1.75 | J13: 27 | K13: 36
A14: 10 | B14: Dave Andrews | C14: 18.9 | D14: 16.6 | E14: =D14 -> 16.6 | F14: 2 | G14: 64 | H14: 32.00 | I14: =IF(G14=0,"",G14/(F14*18)) -> 1.7777777777777777 | J14: 28 | K14: 36
A15: 11 | B15: Alan Hopkins | C15: 8.2 | D15: 8.2 | E15: =D15 -> 8.2 | F15: 1 | G15: 32 | H15: 32.00 | I15: =IF(G15=0,"",G15/(F15*18)) -> 1.7777777777777777 | J15: 32 | K15: 32
A16: 12 | B16: Simon Thompson | C16: 12.1 | D16: 12.0 | E16: =D16 -> 12 | F16: 2 | G16: 66 | H16: 33.00 | I16: =IF(G16=0,"",G16/(F16*18)) -> 1.8333333333333333 | J16: 31 | K16: 35
A17: 13 | B17: Martin Bould | C17: 20.3 | D17: 19.4 | E17: =D17 -> 19.4 | F17: 4 | G17: 137 | H17: 34.25 | I17: =IF(G17=0,"",G17/(F17*18)) -> 1.9027777777777777 | J17: 28 | K17: 39
A18: 14 | B18: Andrew Baldwin | C18: 18.1 | D18: 18.6 | E18: =D18 -> 18.6 | F18: 4 | G18: 140 | H18: 35.00 | I18: =IF(G18=0,"",G18/(F18*18)) -> 1.9444444444444444 | J18: 33 | K18: 36
A19: 15 | B19: Ian Edwards | C19: 11.8 | D19: 11.8 | E19: =D19 -> 11.8 | F19: 1 | G19: 35 | H19: 35.00 | I19: =IF(G19=0,"",G19/(F19*18)) -> 1.9444444444444444 | J19: 35 | K19: 35
A20: 16 | B20: Dave Bingham | C20: 16.0 | D20: 13.1 | E20: =D20 -> 13.1 | F20: 4 | G20: 143 | H20: 35.75 | I20: =IF(G20=0,"",G20/(F20*18)) -> 1.9861111111111112 | J20: 33 | K20: 40
A21: 17 | B21: Martin Cox | C21: 13.5 | D21: 13.6 | E21: =D21 -> 13.6 | F21: 3 | G21: 109 | H21: 36.333333333333336 | I21: =IF(G21=0,"",G21/(F21*18)) -> 2.0185185185185186 | J21: 32 | K21: 41
A22: 18 | B22: Michael Trimmings | C22: 22.4 | D22: 22.6 | E22: =D22 -> 22.6 | F22: 1 | G22: 37 | H22: 37.00 | I22: =IF(G22=0,"",G22/(F22*18)) -> 2.0555555555555554 | J22: 37 | K22: 37
A23: 19 | B23: Roy Dickens | C23: 30.6 | D23: 29.4 | E23: =D23 -> 29.4 | F23: 2 | G23: 75 | H23: 37.50 | I23: =IF(G23=0,"",G23/(F23*18)) -> 2.0833333333333335 | J23: 36 | K23: 39
A24: 20 | B24: Jeff Colbrook | C24: 15.6 | D24: 14.9 | E24: =D24 -> 14.9 | F24: 4 | G24: 151 | H24: 37.75 | I24: =IF(G24=0,"",G24/(F24*18)) -> 2.0972222222222223 | J24: 31 | K24: 46
A25: 21 | B25: Simon Owens | C25: 13.3 | D25: 14.4 | E25: =D25 -> 14.4 | F25: 4 | G25: 151 | H25: 37.75 | I25: =IF(G25=0,"",G25/(F25*18)) -> 2.0972222222222223 | J25: 36 | K25: 40
A26: 22 | B26: Jon Dey | C26: 37.1 | D26: 37.2 | E26: =D26 -> 37.2 | F26: 1 | G26: 38 | H26: 38.00 | I26: =IF(G26=0,"",G26/(F26*18)) -> 2.1111111111111112 | J26: 38 | K26: 38
A27: 23 | B27: Paul Baldwin | C27: 18.6 | D27: 19.2 | E27: =D27 -> 19.2 | F27: 3 | G27: 117 | H27: 39.00 | I27: =IF(G27=0,"",G27/(F27*18)) -> 2.1666666666666665 | J27: 36 | K27: 42
A28: 24 | B28: John Press | C28: 14.8 | D28: 15.0 | E28: =D28 -> 15 | F28: 1 | G28: 40 | H28: 40.00 | I28: =IF(G28=0,"",G28/(F28*18)) -> 2.2222222222222223 | J28: 40 | K28: 40
A29: 25 | B29: Andrew Knight | C29: 21.4 | D29: 21.4 | E29: =D29 -> 21.4 | F29: 0 | G29: 0 | H29: 0.00 | I29: =IF(G29=0,"",G29/(F29*18)) ->  | J29: 0 | K29: 0
A30: 26 | B30: Steve Tilling | C30: 16.5 | D30: 16.5 | E30: =D30 -> 16.5 | F30: 0 | G30: 0 | H30: 0.00 | I30: =IF(G30=0,"",G30/(F30*18)) ->  | J30: 0 | K30: 0
A31: 27 | B31: Malcolm Rouse | C31: 43.9 | D31: 43.9 | E31: =D31 -> 43.9 | F31: 0 | G31: 0 | H31: 0.00 | I31: =IF(G31=0,"",G31/(F31*18)) ->  | J31: 0 | K31: 0
A32: 28 | B32: Keith Johns | C32: 21.5 | D32: 21.5 | E32: =D32 -> 21.5 | F32: 0 | G32: 0 | H32: 0.00 | I32: =IF(G32=0,"",G32/(F32*18)) ->  | J32: 0 | K32: 0
A33: 29 | B33: Dave White | C33: 21.5 | D33: 21.5 | E33: =D33 -> 21.5 | F33: 0 | G33: 0 | H33: 0.00 | I33: =IF(G33=0,"",G33/(F33*18)) ->  | J33: 0 | K33: 0
A34: 30 | B34: Danny Marsh | C34: 8.1 | D34: 8.1 | E34: =D34 -> 8.1 | F34: 0 | G34: 0 | H34: 0.00 | I34: =IF(G34=0,"",G34/(F34*18)) ->  | J34: 0 | K34: 0
A35: 31 | B35: Clive Ferris | C35: 26.0 | D35: 26.0 | E35: =D35 -> 26 | F35: 0 | G35: 0 | H35: 0.00 | I35: =IF(G35=0,"",G35/(F35*18)) ->  | J35: 0 | K35: 0
A36: 32 | B36: Chris Manning | C36: 22.7 | D36: 22.7 | E36: =D36 -> 22.7 | F36: 0 | G36: 0 | H36: 0.00 | I36: =IF(G36=0,"",G36/(F36*18)) ->  | J36: 0 | K36: 0