A1: Michael Trimmings
A2: Club | B2: Perranporth
A3: Par/SS | B3: 72/72 | D3: Num. Of Fairways | I3: =IF(B2="","",18-(COUNTIF(B9:B26,3))) -> 15
A4: Date | B4: 40479 | D4: Playing Handicap | I4: 25.7
A5: Event Place | B5: 1 | D5: Prize Money | G5: 7500
A6: Game Stats | B6: DB+ | C6: DB | D6: Bi | E6: P | F6: B | G6: E | H6: A | I6: H1
B7: 1 | C7: 8 | D7: 5 | E7: 4 | F7: 0 | G7: 0 | H7: 0 | I7: 0
A8: Hole No | B8: Par | C8: Stroke Index | D8: Gross Score | E8: Points | F8: Putts | G8: Fairways | H8: Ferrets | I8: Green Regulation
A9: 1 | B9: 4 | C9: 12 | D9: 6 | E9: 1 | F9: 3 | I9: Yes
A10: 2 | B10: 5 | C10: 4 | D10: 6 | E10: 3 | F10: 2 | G10: 1 | I10: Yes
A11: 3 | B11: 4 | C11: 10 | D11: 5 | E11: 2 | F11: 1 | G11: 1
A12: 4 | B12: 3 | C12: 14 | D12: 5 | E12: 1 | F12: 3 | I12: Yes
A13: 5 | B13: 5 | C13: 6 | D13: 7 | E13: 2 | F13: 1
A14: 6 | B14: 3 | C14: 18 | D14: 3 | E14: 3 | F14: 2 | I14: Yes
A15: 7 | B15: 4 | C15: 8 | D15: 7 | E15: 1 | F15: 3 | G15: 1 | H15: 1 | I15: Yes
A16: 8 | B16: 4 | C16: 16 | D16: 4 | E16: 3 | F16: 1 | G16: 1 | I16: Yes
A17: 9 | B17: 4 | C17: 2 | D17: 6 | E17: 2 | F17: 1
A18: 10 | B18: 4 | C18: 11 | D18: 5 | E18: 2 | F18: 2 | I18: Yes
A19: 11 | B19: 5 | C19: 3 | D19: 6 | E19: 3 | F19: 2 | G19: 1 | I19: Yes
A20: 12 | B20: 4 | C20: 7 | D20: 6 | E20: 2 | F20: 2 | G20: 1 | I20: Yes
A21: 13 | B21: 4 | C21: 17 | D21: 4 | E21: 3 | F21: 2 | I21: Yes
A22: 14 | B22: 4 | C22: 1 | D22: 6 | E22: 2 | F22: 1
A23: 15 | B23: 4 | C23: 9 | D23: 4 | E23: 3 | F23: 1 | G23: 1 | I23: Yes
A24: 16 | B24: 3 | C24: 13 | D24: 4 | E24: 2 | F24: 1
A25: 17 | B25: 4 | C25: 5 | D25: 6 | E25: 2 | F25: 1
A26: 18 | B26: 4 | C26: 15 | D26: 6 | E26: 1 | F26: 1
A27: Totals | B27: =IF(B2="","",SUM(B9:B26)) -> 72 | D27: =IF(B2="","",SUM(D9:D26)) -> 96 | E27: =IF(B2="","",SUM(E9:E26)) -> 38 | F27: =IF(B2="","",SUM(F9:F26)) -> 30 | G27: =IF(B2="","",SUM(G9:G26)) -> 7 | H27: =IF(B2="","",SUM(H9:H26)) -> 1 | I27: =IF(COUNTIF(I9:I26,"=Yes")=0,"",COUNTIF(I9:I26,"=Yes")) -> 11