A1: Simon Thompson
A2: Club | B2: Rowlands Castle
A3: Par/SS | B3: 72/70 | D3: Num. Of Fairways | I3: =IF(B2="","",18-(COUNTIF(B9:B26,3))) -> 15
A4: Date | B4: 39924 | D4: Playing Handicap | I4: 12
A5: Event Place | B5: 2 | C5: M | D5: Prize Money | G5: 27500
A6: Game Stats | B6: DB+ | C6: DB | D6: Bi | E6: P | F6: B | G6: E | H6: A | I6: H1
B7: 0 | C7: 5 | D7: 5 | E7: 7 | F7: 1 | G7: 0 | H7: 0 | I7: 0
A8: Hole No | B8: Par | C8: Stroke Index | D8: Gross Score | E8: Points | F8: Putts | G8: Fairways | H8: Ferrets | I8: Green Regulation
A9: 1 | B9: 4 | C9: 9 | D9: 6 | E9: 1 | F9: 2
A10: 2 | B10: 3 | C10: 17 | D10: 4 | E10: 1 | F10: 2
A11: 3 | B11: 4 | C11: 5 | D11: 5 | E11: 2 | F11: 2 | I11: Yes
A12: 4 | B12: 4 | C12: 15 | D12: 4 | E12: 2 | F12: 2 | I12: Yes
A13: 5 | B13: 4 | C13: 7 | D13: 3 | E13: 4 | F13: 1 | G13: 1 | I13: Yes
A14: 6 | B14: 4 | C14: 1 | D14: 6 | E14: 1 | F14: 2 | G14: 1
A15: 7 | B15: 5 | C15: 11 | D15: 6 | E15: 2 | F15: 2 | G15: 1 | I15: Yes
A16: 8 | B16: 4 | C16: 3 | D16: 6 | E16: 1 | F16: 3 | I16: Yes
A17: 9 | B17: 4 | C17: 13 | D17: 4 | E17: 2 | F17: 2 | I17: Yes
A18: 10 | B18: 4 | C18: 4 | D18: 4 | E18: 3 | F18: 1 | I18: Yes
A19: 11 | B19: 3 | C19: 18 | D19: 3 | E19: 2 | F19: 2 | I19: Yes
A20: 12 | B20: 5 | C20: 14 | D20: 5 | E20: 2 | F20: 2 | G20: 1 | I20: Yes
A21: 13 | B21: 4 | C21: 8 | D21: 6 | E21: 1 | F21: 2
A22: 14 | B22: 3 | C22: 16 | D22: 4 | E22: 1 | F22: 2
A23: 15 | B23: 4 | C23: 2 | D23: 4 | E23: 3 | F23: 1 | G23: 1 | I23: Yes
A24: 16 | B24: 4 | C24: 12 | D24: 6 | E24: 1 | F24: 3 | I24: Yes
A25: 17 | B25: 5 | C25: 10 | D25: 6 | E25: 2 | F25: 2 | I25: Yes
A26: 18 | B26: 4 | C26: 6 | D26: 4 | E26: 3 | F26: 2 | G26: 1 | I26: Yes
A27: Totals | B27: =IF(B2="","",SUM(B9:B26)) -> 72 | D27: =IF(B2="","",SUM(D9:D26)) -> 86 | E27: =IF(B2="","",SUM(E9:E26)) -> 34 | F27: =IF(B2="","",SUM(F9:F26)) -> 35 | G27: =IF(B2="","",SUM(G9:G26)) -> 6 | H27: =IF(B2="","",SUM(H9:H26)) -> 0 | I27: =IF(COUNTIF(I9:I26,"=Yes")=0,"",COUNTIF(I9:I26,"=Yes")) -> 13