A1: Matthew Carter
A2: Club | B2: Wimbledon Common
A3: Par/SS | B3: 68/66 | D3: Num. Of Fairways | I3: =IF(B2="","",18-(COUNTIF(B9:B26,3))) -> 13
A4: Date | B4: 39296 | D4: Playing Handicap | I4: 20.9
A5: Event Place | B5: 2 | D5: Prize Money | G5: 2500
A6: Game Stats | B6: DB+ | C6: DB | D6: Bi | E6: P | F6: B | G6: E | H6: A | I6: H1
B7: 3 | C7: 6 | D7: 5 | E7: 4 | F7: 0 | G7: 0 | H7: 0 | I7: 0
A8: Hole No | B8: Par | C8: Stroke Index | D8: Gross Score | E8: Points | F8: Putts | G8: Fairways | H8: Ferrets | I8: Green Regulation
A9: 1 | B9: 3 | C9: 7 | D9: 6 | E9: 0 | F9: 1
A10: 2 | B10: 4 | C10: 1 | D10: 7 | E10: 1 | F10: 3 | G10: 1 | I10: Yes
A11: 3 | B11: 4 | C11: 14 | D11: 5 | E11: 2 | F11: 3 | I11: Yes
A12: 4 | B12: 3 | C12: 11 | D12: 3 | E12: 3 | F12: 2 | I12: Yes
A13: 5 | B13: 4 | C13: 18 | D13: 6 | E13: 1 | F13: 2
A14: 6 | B14: 4 | C14: 5 | D14: 6 | E14: 1 | F14: 3 | I14: Yes
A15: 7 | B15: 4 | C15: 10 | D15: 4 | E15: 3 | F15: 1 | I15: Yes
A16: 8 | B16: 3 | C16: 8 | D16: 6 | E16: 0 | F16: 3
A17: 9 | B17: 4 | C17: 16 | D17: 6 | E17: 1 | F17: 2
A18: 10 | B18: 4 | C18: 15 | D18: 5 | E18: 2 | F18: 2 | I18: Yes
A19: 11 | B19: 4 | C19: 4 | D19: 6 | E19: 1 | F19: 1 | G19: 1
A20: 12 | B20: 3 | C20: 6 | D20: 5 | E20: 1 | F20: 3 | I20: Yes
A21: 13 | B21: 4 | C21: 13 | D21: 6 | E21: 1 | F21: 2 | H21: 1
A22: 14 | B22: 4 | C22: 2 | D22: 5 | E22: 3 | F22: 2 | G22: 1 | I22: Yes
A23: 15 | B23: 4 | C23: 12 | D23: 5 | E23: 2 | F23: 1
A24: 16 | B24: 3 | C24: 17 | D24: 3 | E24: 3 | F24: 2 | I24: Yes
A25: 17 | B25: 4 | C25: 9 | D25: 5 | E25: 2 | F25: 2 | G25: 1 | H25: 1 | I25: Yes
A26: 18 | B26: 5 | C26: 3 | D26: 5 | E26: 4 | F26: 2 | H26: 2 | I26: Yes
A27: Totals | B27: =IF(B2="","",SUM(B9:B26)) -> 68 | D27: =IF(B2="","",SUM(D9:D26)) -> 94 | E27: =IF(B2="","",SUM(E9:E26)) -> 31 | F27: =IF(B2="","",SUM(F9:F26)) -> 37 | G27: =IF(B2="","",SUM(G9:G26)) -> 4 | H27: =IF(B2="","",SUM(H9:H26)) -> 4 | I27: =IF(COUNTIF(I9:I26,"=Yes")=0,"",COUNTIF(I9:I26,"=Yes")) -> 11