A1: Jeff Gibbons
A2: Club | B2: East Sussex National (West)
A3: Par/SS | B3: 72/74 | D3: Num. Of Fairways | I3: =IF(B2="","",18-(COUNTIF(B9:B26,3))) -> 14
A4: Date | B4: 38076 | D4: Playing Handicap | I4: 13.100000000002991
A5: Event Place | B5: 9 | D5: Prize Money | G5: 10000
A6: Game Stats | B6: DB+ | C6: DB | D6: Bi | E6: P | F6: B | G6: E | H6: A | I6: H1
B7: 3 | C7: 3 | D7: 9 | E7: 3 | F7: 0 | G7: 0 | H7: 0 | I7: 0
A8: Hole No | B8: Par | C8: Stroke Index | D8: Gross Score | E8: Points | F8: Putts | G8: Fairways | H8: Ferrets | I8: Green Regulation
A9: 1 | B9: 4 | C9: 10 | D9: 7 | E9: 0 | F9: 3
A10: 2 | B10: 5 | C10: 4 | D10: 6 | E10: 2 | F10: 2 | I10: Yes
A11: 3 | B11: 3 | C11: 14 | D11: 5 | E11: 0 | F11: 4 | I11: Yes
A12: 4 | B12: 4 | C12: 18 | D12: 5 | E12: 1 | F12: 3 | I12: Yes
A13: 5 | B13: 5 | C13: 16 | D13: 5 | E13: 2 | F13: 2 | G13: 1 | I13: Yes
A14: 6 | B14: 4 | C14: 8 | D14: 5 | E14: 2 | F14: 2 | G14: 1 | I14: Yes
A15: 7 | B15: 3 | C15: 6 | D15: 4 | E15: 2 | F15: 2 | I15: Yes
A16: 8 | B16: 4 | C16: 12 | D16: 8 | E16: 0 | F16: 2 | G16: 1 | H16: 1
A17: 9 | B17: 4 | C17: 2 | D17: 5 | E17: 2 | F17: 2 | I17: Yes
A18: 10 | B18: 4 | C18: 7 | D18: 5 | E18: 2 | F18: 1
A19: 11 | B19: 4 | C19: 5 | D19: 7 | E19: 0 | F19: 2
A20: 12 | B20: 5 | C20: 3 | D20: 6 | E20: 2 | F20: 2 | I20: Yes
A21: 13 | B21: 3 | C21: 15 | D21: 4 | E21: 1 | F21: 2
A22: 14 | B22: 4 | C22: 1 | D22: 6 | E22: 1 | F22: 3 | I22: Yes
A23: 15 | B23: 4 | C23: 17 | D23: 4 | E23: 2 | F23: 2 | G23: 1 | I23: Yes
A24: 16 | B24: 3 | C24: 13 | D24: 3 | E24: 3 | F24: 2 | I24: Yes
A25: 17 | B25: 5 | C25: 9 | D25: 7 | E25: 1 | F25: 1
A26: 18 | B26: 4 | C26: 11 | D26: 5 | E26: 2 | F26: 2 | I26: Yes
A27: Totals | B27: =IF(B2="","",SUM(B9:B26)) -> 72 | D27: =IF(B2="","",SUM(D9:D26)) -> 97 | E27: =IF(B2="","",SUM(E9:E26)) -> 25 | F27: =IF(B2="","",SUM(F9:F26)) -> 39 | G27: =IF(B2="","",SUM(G9:G26)) -> 4 | H27: =IF(B2="","",SUM(H9:H26)) -> 1 | I27: =IF(COUNTIF(I9:I26,"=Yes")=0,"",COUNTIF(I9:I26,"=Yes")) -> 12