A1: Martin Cox
A2: Club | B2: East Sussex National (West)
A3: Par/SS | B3: 72/74 | D3: Num. Of Fairways | I3: =IF(B2="","",18-(COUNTIF(B9:B26,3))) -> 14
A4: Date | B4: 38076 | D4: Playing Handicap | I4: 10.8
A5: Event Place | B5: 10 | C5: M | D5: Prize Money | G5: 7500
A6: Game Stats | B6: DB+ | C6: DB | D6: Bi | E6: P | F6: B | G6: E | H6: A | I6: H1
B7: 2 | C7: 3 | D7: 11 | E7: 2 | F7: 0 | G7: 0 | H7: 0 | I7: 0
A8: Hole No | B8: Par | C8: Stroke Index | D8: Gross Score | E8: Points | F8: Putts | G8: Fairways | H8: Ferrets | I8: Green Regulation
A9: 1 | B9: 4 | C9: 10 | D9: 6 | E9: 1 | F9: 2
A10: 2 | B10: 5 | C10: 4 | D10: 6 | E10: 2 | F10: 2 | G10: 1 | I10: Yes
A11: 3 | B11: 3 | C11: 14 | D11: 4 | E11: 1 | F11: 2
A12: 4 | B12: 4 | C12: 18 | D12: 6 | E12: 0 | F12: 2
A13: 5 | B13: 5 | C13: 16 | D13: 6 | E13: 1 | F13: 3 | G13: 1 | I13: Yes
A14: 6 | B14: 4 | C14: 8 | D14: 5 | E14: 2 | F14: 2 | I14: Yes
A15: 7 | B15: 3 | C15: 6 | D15: 4 | E15: 2 | F15: 2 | I15: Yes
A16: 8 | B16: 4 | C16: 12 | D16: 5 | E16: 1 | F16: 2 | G16: 1
A17: 9 | B17: 4 | C17: 2 | D17: 5 | E17: 2 | F17: 2 | G17: 1 | I17: Yes
A18: 10 | B18: 4 | C18: 7 | D18: 6 | E18: 1 | F18: 1 | G18: 1 | H18: 1
A19: 11 | B19: 4 | C19: 5 | D19: 5 | E19: 2 | F19: 2 | I19: Yes
A20: 12 | B20: 5 | C20: 3 | D20: 5 | E20: 3 | F20: 2 | I20: Yes
A21: 13 | B21: 3 | C21: 15 | D21: 4 | E21: 1 | F21: 3 | I21: Yes
A22: 14 | B22: 4 | C22: 1 | D22: 9 | E22: 0 | F22: 2
A23: 15 | B23: 4 | C23: 17 | D23: 4 | E23: 2 | F23: 2 | G23: 1 | I23: Yes
A24: 16 | B24: 3 | C24: 13 | D24: 4 | E24: 1 | F24: 2
A25: 17 | B25: 5 | C25: 9 | D25: 8 | E25: 0 | F25: 2
A26: 18 | B26: 4 | C26: 11 | D26: 5 | E26: 2 | F26: 2 | I26: Yes
A27: Totals | B27: =IF(B2="","",SUM(B9:B26)) -> 72 | D27: =IF(B2="","",SUM(D9:D26)) -> 97 | E27: =IF(B2="","",SUM(E9:E26)) -> 24 | F27: =IF(B2="","",SUM(F9:F26)) -> 37 | G27: =IF(B2="","",SUM(G9:G26)) -> 6 | H27: =IF(B2="","",SUM(H9:H26)) -> 1 | I27: =IF(COUNTIF(I9:I26,"=Yes")=0,"",COUNTIF(I9:I26,"=Yes")) -> 10