A1: Clive Ferris
A2: Club | B2: Mill Ride
A3: Par/SS | B3: 72 | D3: Num. Of Fairways | I3: =IF(B2="","",18-(COUNTIF(B9:B26,3))) -> 14
A4: Date | B4: 38112 | D4: Playing Handicap | I4: 26.6
A5: Event Place | B5: 1 | D5: Prize Money | G5: 5000
A6: Game Stats | B6: DB+ | C6: DB | D6: Bi | E6: P | F6: B | G6: E | H6: A | I6: H1
B7: 5 | C7: 6 | D7: 2 | E7: 5 | F7: 0 | G7: 0 | H7: 0 | I7: 0
A8: Hole No | B8: Par | C8: Stroke Index | D8: Gross Score | E8: Points | F8: Putts | G8: Fairways | H8: Ferrets | I8: Green Regulation
A9: 1 | B9: 5 | C9: 9 | D9: 7 | E9: 2 | F9: 2 | G9: 1 | I9: Yes
A10: 2 | B10: 4 | C10: 1 | D10: 10 | E10: 0 | F10: 3 | H10: 1
A11: 3 | B11: 3 | C11: 11 | D11: 3 | E11: 3 | F11: 1 | I11: Yes
A12: 4 | B12: 4 | C12: 5 | D12: 4 | E12: 4 | F12: 1 | G12: 1 | I12: Yes
A13: 5 | B13: 5 | C13: 7 | D13: 6 | E13: 3 | F13: 1 | I13: Yes
A14: 6 | B14: 4 | C14: 15 | D14: 5 | E14: 2 | F14: 3 | G14: 1 | I14: Yes
A15: 7 | B15: 4 | C15: 13 | D15: 10 | E15: 0 | F15: 3 | H15: 1
A16: 8 | B16: 3 | C16: 17 | D16: 3 | E16: 3 | F16: 2 | I16: Yes
A17: 9 | B17: 4 | C17: 3 | D17: 10 | E17: 0 | F17: 3
A18: 10 | B18: 5 | C18: 6 | D18: 8 | E18: 1 | F18: 2
A19: 11 | B19: 3 | C19: 8 | D19: 10 | E19: 0 | F19: 3 | H19: 2
A20: 12 | B20: 4 | C20: 12 | D20: 6 | E20: 1 | F20: 1
A21: 13 | B21: 4 | C21: 10 | D21: 6 | E21: 1 | F21: 1 | G21: 1
A22: 14 | B22: 4 | C22: 2 | D22: 6 | E22: 2 | F22: 1 | G22: 1
A23: 15 | B23: 3 | C23: 18 | D23: 3 | E23: 3 | F23: 1 | I23: Yes
A24: 16 | B24: 4 | C24: 16 | D24: 6 | E24: 1 | F24: 1 | G24: 1
A25: 17 | B25: 4 | C25: 4 | D25: 6 | E25: 2 | F25: 3 | G25: 1 | I25: Yes
A26: 18 | B26: 5 | C26: 14 | D26: 5 | E26: 3 | F26: 1 | G26: 1 | I26: Yes
A27: Totals | B27: =IF(B2="","",SUM(B9:B26)) -> 72 | D27: =IF(B2="","",SUM(D9:D26)) -> 114 | E27: =IF(B2="","",SUM(E9:E26)) -> 31 | F27: =IF(B2="","",SUM(F9:F26)) -> 33 | G27: =IF(B2="","",SUM(G9:G26)) -> 8 | H27: =IF(B2="","",SUM(H9:H26)) -> 4 | I27: =IF(COUNTIF(I9:I26,"=Yes")=0,"",COUNTIF(I9:I26,"=Yes")) -> 9