A1: Martin Bould
A2: Club | B2: Wycombe Heights
A3: Par/SS | B3: 70/72 | D3: Num. Of Fairways | I3: =IF(B2="","",18-(COUNTIF(B9:B26,3))) -> 14
A4: Date | B4: 38129 | D4: Playing Handicap | I4: 17.7
A5: Event Place | B5: 16 | C5: M | D5: Prize Money | G5: 13750
A6: Game Stats | B6: DB+ | C6: DB | D6: Bi | E6: P | F6: B | G6: E | H6: A | I6: H1
B7: 6 | C7: 1 | D7: 8 | E7: 3 | F7: 0 | G7: 0 | H7: 0 | I7: 0
A8: Hole No | B8: Par | C8: Stroke Index | D8: Gross Score | E8: Points | F8: Putts | G8: Fairways | H8: Ferrets | I8: Green Regulation
A9: 1 | B9: 4 | C9: 9 | D9: 7 | E9: 0 | F9: 2 | H9: 1
A10: 2 | B10: 3 | C10: 13 | D10: 7 | E10: 0 | F10: 4
A11: 3 | B11: 4 | C11: 11 | D11: 5 | E11: 2 | F11: 2 | I11: Yes
A12: 4 | B12: 4 | C12: 3 | D12: 7 | E12: 0 | F12: 3
A13: 5 | B13: 5 | C13: 15 | D13: 6 | E13: 2 | F13: 2 | I13: Yes
A14: 6 | B14: 4 | C14: 7 | D14: 7 | E14: 0 | F14: 2
A15: 7 | B15: 4 | C15: 1 | D15: 5 | E15: 2 | F15: 1
A16: 8 | B16: 3 | C16: 17 | D16: 3 | E16: 3 | F16: 2 | I16: Yes
A17: 9 | B17: 4 | C17: 5 | D17: 5 | E17: 2 | F17: 2 | I17: Yes
A18: 10 | B18: 3 | C18: 16 | D18: 3 | E18: 3 | F18: 2 | I18: Yes
A19: 11 | B19: 4 | C19: 18 | D19: 4 | E19: 3 | F19: 2 | G19: 1 | I19: Yes
A20: 12 | B20: 4 | C20: 8 | D20: 8 | E20: 0 | F20: 4 | G20: 1
A21: 13 | B21: 4 | C21: 2 | D21: 6 | E21: 1 | F21: 2 | G21: 1
A22: 14 | B22: 4 | C22: 14 | D22: 5 | E22: 2 | F22: 1 | G22: 1
A23: 15 | B23: 4 | C23: 4 | D23: 7 | E23: 0 | F23: 2 | G23: 1
A24: 16 | B24: 3 | C24: 12 | D24: 4 | E24: 2 | F24: 1
A25: 17 | B25: 5 | C25: 6 | D25: 6 | E25: 2 | F25: 2 | I25: Yes
A26: 18 | B26: 4 | C26: 10 | D26: 5 | E26: 2 | F26: 1
A27: Totals | B27: =IF(B2="","",SUM(B9:B26)) -> 70 | D27: =IF(B2="","",SUM(D9:D26)) -> 100 | E27: =IF(B2="","",SUM(E9:E26)) -> 26 | F27: =IF(B2="","",SUM(F9:F26)) -> 37 | G27: =IF(B2="","",SUM(G9:G26)) -> 5 | H27: =IF(B2="","",SUM(H9:H26)) -> 1 | I27: =IF(COUNTIF(I9:I26,"=Yes")=0,"",COUNTIF(I9:I26,"=Yes")) -> 7