A1: CHINNEY CHOO - 2006/2007
B3: Rousey Invitation | C3: Bubble Open 17/06/06 | D3: Tubby Trophy | E3: Mendy's Masters 15/7/06 | F3: Players Championship 9/5/06 | G3: Thommo Classic 31/3/07 | H3: Total
A4: EUROPE
A5: J Gibbons | C5: 27 | E5: 37 | F5: 32 | G5: 20 | H5: =SUM(B5:G5) -> 116
A6: R Dickens | C6: 34 | E6: 26 | F6: 28 | G6: 21 | H6: =SUM(B6:G6) -> 109
A7: R Thompson | C7: 32 | E7: 0 | F7: 34 | G7: 28 | H7: =SUM(B7:G7) -> 94
A8: M Cox | C8: 33 | E8: 29 | F8: 0 | G8: 0 | H8: =SUM(B8:G8) -> 62
A9: M Carter | C9: 25 | E9: 0 | F9: 31 | G9: 30 | H9: =SUM(B9:G9) -> 86
A10: K Mendelson | C10: 18 | E10: 33 | F10: 0 | G10: 22 | H10: =SUM(B10:G10) -> 73
A11: A Baldwin (Jnr) | C11: 34 | E11: 29 | F11: 26 | G11: 25 | H11: =SUM(B11:G11) -> 114
A12: J Colbrook | C12: 25 | E12: 0 | F12: 0 | G12: 23 | H12: =SUM(B12:G12) -> 48
A13: M Bould | C13: 0 | E13: 33 | F13: 0 | G13: 32 | H13: =SUM(B13:G13) -> 65
A14: A Baldwin (Snr) | C14: 0 | E14: 28 | F14: 30 | G14: 0 | H14: =SUM(B14:G14) -> 58
A15: D Andrews | C15: 0 | E15: 0 | F15: 0 | G15: 19 | H15: =SUM(B15:G15) -> 19
A16: I Edwards | C16: 0 | E16: 20 | F16: 0 | G16: 0 | H16: =SUM(B16:G16) -> 20
A17: J Dey | C17: 0 | E17: 25 | F17: 0 | G17: 0 | H17: =SUM(B17:G17) -> 25
A18: K Johns | C18: 0 | E18: 0 | F18: 0 | G18: 0 | H18: =SUM(B18:G18) -> 0
A19: D White | C19: 0 | E19: 0 | F19: 0 | G19: 0 | H19: =SUM(B19:G19) -> 0
A20: D Archer | C20: 0 | E20: 0 | F20: 0 | G20: 0 | H20: =SUM(B20:G20) -> 0
B21: =SUM(B5:B20) -> 0 | C21: =SUM(C5:C20) -> 228 | D21: =SUM(D5:D20) -> 0 | E21: =SUM(E5:E20) -> 260 | F21: =SUM(F5:F20) -> 181 | G21: =SUM(G5:G20) -> 220 | H21: =SUM(H5:H20) -> 889
A22: USA
A23: A Hopkins | C23: 37 | E23: 30 | F23: 33 | G23: 0 | H23: =SUM(B23:G23) -> 100
A24: K Gallagher | C24: 31 | E24: 0 | F24: 0 | G24: 30 | H24: =SUM(B24:G24) -> 61
A25: S Thompson | C25: 0 | E25: 0 | F25: 32 | G25: 28 | H25: =SUM(B25:G25) -> 60
A26: D Rouse | C26: 18 | E26: 30 | F26: 26 | G26: 33 | H26: =SUM(B26:G26) -> 107
A27: P Carter | C27: 0 | E27: 33 | F27: 23 | G27: 31 | H27: =SUM(B27:G27) -> 87
A28: P Baldwin | C28: 0 | E28: 0 | F28: 30 | G28: 25 | H28: =SUM(B28:G28) -> 55
A29: A Benson | C29: 0 | E29: 0 | F29: 0 | G29: 0 | H29: =SUM(B29:G29) -> 0
A30: D Marsh | C30: 0 | E30: 30 | F30: 0 | G30: 0 | H30: =SUM(B30:G30) -> 30
A31: M Trimmings | C31: 0 | E31: 0 | F31: 0 | G31: 30 | H31: =SUM(B31:G31) -> 30
A32: S Tilling | C32: 0 | E32: 0 | F32: 0 | G32: 0 | H32: =SUM(B32:G32) -> 0
A33: J Press | C33: 0 | E33: 0 | F33: 39 | G33: 25 | H33: =SUM(B33:G33) -> 64
A34: S Owens | C34: 0 | E34: 0 | F34: 0 | G34: 0 | H34: =SUM(B34:G34) -> 0
A35: C Manning | C35: 0 | E35: 0 | F35: 0 | G35: 0 | H35: =SUM(B35:G35) -> 0
A36: C Ferris | C36: 0 | E36: 0 | F36: 0 | G36: 0 | H36: =SUM(B36:G36) -> 0
A37: M Rouse | C37: 0 | E37: 0 | F37: 0 | G37: 0 | H37: =SUM(B37:G37) -> 0
A38: N Leah | C38: 0 | E38: 0 | F38: 0 | G38: 0 | H38: =SUM(B38:G38) -> 0
A39: M Edmond | C39: 0 | E39: 0 | F39: 0 | G39: 0 | H39: =SUM(B39:G39) -> 0
B40: =SUM(B23:B39) -> 0 | C40: =SUM(C23:C39) -> 86 | D40: =SUM(D23:D39) -> 0 | E40: =SUM(E23:E39) -> 123 | F40: =SUM(F23:F39) -> 183 | G40: =SUM(G23:G39) -> 202 | H40: =SUM(B40:G40) -> 594