A1: Season 8 - April 2nd 2006 to 31st March 2007
A2: MGA World Tour Order of Ferret by Average
B3: Statistics updated | C3: =TODAY() -> 39174 | G3: See Ferrets by Quantity
A4: Pos | B4: Player | C4: Original Handicap | D4: Current Handicap | E4: Playing Handicap | F4: Played | G4: Total Ferrets | H4: Average per Round | I4: Ferret ratio
A5: 1 | B5: Roy Dickens | C5: 29.6 | D5: 30.000000000001002 | E5: =D5 -> 30.000000000001002 | F5: 6 | G5: 30 | H5: 5.00 | I5: =IF(G5="","",IF(G5=0,"0 : "&F5*18,"1 : "&ROUND(((F5*18)/G5),0))) -> 1 : 4
A6: =A5+1 -> 2 | B6: Michael Trimmings | C6: 22.6 | D6: 22.2 | E6: =D6 -> 22.2 | F6: 4 | G6: 17 | H6: 4.25 | I6: =IF(G6="","",IF(G6=0,"0 : "&F6*18,"1 : "&ROUND(((F6*18)/G6),0))) -> 1 : 4
A7: =A6+1 -> 3 | B7: Dave Rouse | C7: 24.6 | D7: 25.1 | E7: =D7 -> 25.1 | F7: 5 | G7: 21 | H7: 4.20 | I7: =IF(G7="","",IF(G7=0,"0 : "&F7*18,"1 : "&ROUND(((F7*18)/G7),0))) -> 1 : 4
A8: =A7+1 -> 4 | B8: Paul Baldwin | C8: 16.9 | D8: 17.4 | E8: =D8 -> 17.4 | F8: 3 | G8: 12 | H8: 4.00 | I8: =IF(G8="","",IF(G8=0,"0 : "&F8*18,"1 : "&ROUND(((F8*18)/G8),0))) -> 1 : 5
A9: =A8+1 -> 5 | B9: Jon Dey | C9: 36.8 | D9: 37.0 | E9: =D9 -> 37 | F9: 1 | G9: 4 | H9: 4.00 | I9: =IF(G9="","",IF(G9=0,"0 : "&F9*18,"1 : "&ROUND(((F9*18)/G9),0))) -> 1 : 5
A10: =A9+1 -> 6 | B10: Ian Edwards | C10: 15.2 | D10: 15.7 | E10: =D10 -> 15.7 | F10: 2 | G10: 7 | H10: 3.50 | I10: =IF(G10="","",IF(G10=0,"0 : "&F10*18,"1 : "&ROUND(((F10*18)/G10),0))) -> 1 : 5
A11: =A10+1 -> 7 | B11: Danny Marsh | C11: 8.2 | D11: 8.1 | E11: =D11 -> 8.1 | F11: 3 | G11: 8 | H11: 2.6666666666666665 | I11: =IF(G11="","",IF(G11=0,"0 : "&F11*18,"1 : "&ROUND(((F11*18)/G11),0))) -> 1 : 7
A12: =A11+1 -> 8 | B12: Simon Owens | C12: 13.0 | D12: 13.2 | E12: =D12 -> 13.2 | F12: 1 | G12: 2 | H12: 2.00 | I12: =IF(G12="","",IF(G12=0,"0 : "&F12*18,"1 : "&ROUND(((F12*18)/G12),0))) -> 1 : 9
A13: =A12+1 -> 9 | B13: Jeff Colbrook | C13: 13.1 | D13: 14.200000000000996 | E13: =D13 -> 14.200000000000996 | F13: 14 | G13: 27 | H13: 1.9285714285714286 | I13: =IF(G13="","",IF(G13=0,"0 : "&F13*18,"1 : "&ROUND(((F13*18)/G13),0))) -> 1 : 9
A14: =A13+1 -> 10 | B14: Simon Thompson | C14: 11.6 | D14: 13.7 | E14: =D14 -> 13.7 | F14: 11 | G14: 19 | H14: 1.7272727272727273 | I14: =IF(G14="","",IF(G14=0,"0 : "&F14*18,"1 : "&ROUND(((F14*18)/G14),0))) -> 1 : 10
A15: =A14+1 -> 11 | B15: Martin Bould | C15: 20.4 | D15: 19.4 | E15: =D15 -> 19.4 | F15: 7 | G15: 12 | H15: 1.7142857142857142 | I15: =IF(G15="","",IF(G15=0,"0 : "&F15*18,"1 : "&ROUND(((F15*18)/G15),0))) -> 1 : 11
A16: =A15+1 -> 12 | B16: Matthew Carter | C16: 20.9 | D16: 21.2 | E16: =D16 -> 21.2 | F16: 8 | G16: 12 | H16: 1.50 | I16: =IF(G16="","",IF(G16=0,"0 : "&F16*18,"1 : "&ROUND(((F16*18)/G16),0))) -> 1 : 12
A17: =A16+1 -> 13 | B17: Andrew Baldwin | C17: 17.4 | D17: 17.5 | E17: =D17 -> 17.5 | F17: 6 | G17: 9 | H17: 1.50 | I17: =IF(G17="","",IF(G17=0,"0 : "&F17*18,"1 : "&ROUND(((F17*18)/G17),0))) -> 1 : 12
A18: =A17+1 -> 14 | B18: Dave Andrews | C18: 17.5 | D18: 17.9 | E18: =D18 -> 17.9 | F18: 17 | G18: 24 | H18: 1.411764705882353 | I18: =IF(G18="","",IF(G18=0,"0 : "&F18*18,"1 : "&ROUND(((F18*18)/G18),0))) -> 1 : 13
A19: =A18+1 -> 15 | B19: Alan Baldwin | C19: 22.6 | D19: 20.300000000001003 | E19: =D19 -> 20.300000000001003 | F19: 3 | G19: 4 | H19: 1.3333333333333333 | I19: =IF(G19="","",IF(G19=0,"0 : "&F19*18,"1 : "&ROUND(((F19*18)/G19),0))) -> 1 : 14
A20: =A19+1 -> 16 | B20: Alan Hopkins | C20: 8.4 | D20: 7.1 | E20: =D20 -> 7.1 | F20: 7 | G20: 8 | H20: 1.1428571428571428 | I20: =IF(G20="","",IF(G20=0,"0 : "&F20*18,"1 : "&ROUND(((F20*18)/G20),0))) -> 1 : 16
A21: =A20+1 -> 17 | B21: Keith Mendelson | C21: 15.7 | D21: 14.2 | E21: =D21 -> 14.2 | F21: 34 | G21: 38 | H21: 1.1176470588235294 | I21: =IF(G21="","",IF(G21=0,"0 : "&F21*18,"1 : "&ROUND(((F21*18)/G21),0))) -> 1 : 16
A22: =A21+1 -> 18 | B22: Robert Thompson | C22: 8.1 | D22: 8.7 | E22: =D22 -> 8.7 | F22: 33 | G22: 33 | H22: 1.00 | I22: =IF(G22="","",IF(G22=0,"0 : "&F22*18,"1 : "&ROUND(((F22*18)/G22),0))) -> 1 : 18
A23: =A22+1 -> 19 | B23: Martin Cox | C23: 12.3 | D23: 12.8 | E23: =D23 -> 12.8 | F23: 4 | G23: 4 | H23: 1.00 | I23: =IF(G23="","",IF(G23=0,"0 : "&F23*18,"1 : "&ROUND(((F23*18)/G23),0))) -> 1 : 18
A24: =A23+1 -> 20 | B24: Paul Carter | C24: 12.8 | D24: 12.3 | E24: =D24 -> 12.3 | F24: 6 | G24: 5 | H24: 0.83333333333333337 | I24: =IF(G24="","",IF(G24=0,"0 : "&F24*18,"1 : "&ROUND(((F24*18)/G24),0))) -> 1 : 22
A25: =A24+1 -> 21 | B25: Jeff Gibbons | C25: 20.0 | D25: 20.900000000003015 | E25: =D25 -> 20.900000000003015 | F25: 29 | G25: 22 | H25: 0.75862068965517238 | I25: =IF(G25="","",IF(G25=0,"0 : "&F25*18,"1 : "&ROUND(((F25*18)/G25),0))) -> 1 : 24
A26: =A25+1 -> 22 | B26: Andy Benson | C26: 6.7 | D26: 6.9000000000009996 | E26: =D26 -> 6.9000000000009996 | F26: 3 | G26: 2 | H26: 0.66666666666666663 | I26: =IF(G26="","",IF(G26=0,"0 : "&F26*18,"1 : "&ROUND(((F26*18)/G26),0))) -> 1 : 27
A27: =A26+1 -> 23 | B27: John Press | C27: 14.9 | D27: 13.5 | E27: =D27 -> 13.5 | F27: 3 | G27: 2 | H27: 0.66666666666666663 | I27: =IF(G27="","",IF(G27=0,"0 : "&F27*18,"1 : "&ROUND(((F27*18)/G27),0))) -> 1 : 27
A28: =A27+1 -> 24 | B28: Kevin Gallagher | C28: 11.8 | D28: 11.300000000000997 | E28: =D28 -> 11.300000000000997 | F28: 25 | G28: 14 | H28: 00.56 | I28: =IF(G28="","",IF(G28=0,"0 : "&F28*18,"1 : "&ROUND(((F28*18)/G28),0))) -> 1 : 32
A29: =A28+1 -> 25 | B29: Steve Tilling | C29: 16.5 | D29: 16.5 | E29: =D29 -> 16.5 | F29: 0 | G29: 0 | H29: 0.00 | I29: =IF(G29="","",IF(G29=0,"0 : "&F29*18,"1 : "&ROUND(((F29*18)/G29),0))) -> 0 : 0
A30: =A29+1 -> 26 | B30: Neil Leah | C30: 15.0 | D30: 15.0 | E30: =D30 -> 15 | F30: 0 | G30: 0 | H30: 0.00 | I30: =IF(G30="","",IF(G30=0,"0 : "&F30*18,"1 : "&ROUND(((F30*18)/G30),0))) -> 0 : 0
A31: =A30+1 -> 27 | B31: Malcolm Rouse | C31: 42.9 | D31: 42.9 | E31: =D31 -> 42.9 | F31: 0 | G31: 0 | H31: 0.00 | I31: =IF(G31="","",IF(G31=0,"0 : "&F31*18,"1 : "&ROUND(((F31*18)/G31),0))) -> 0 : 0
A32: =A31+1 -> 28 | B32: Keith Johns | C32: 24.3 | D32: 24.3 | E32: =D32 -> 24.3 | F32: 0 | G32: 0 | H32: 0.00 | I32: =IF(G32="","",IF(G32=0,"0 : "&F32*18,"1 : "&ROUND(((F32*18)/G32),0))) -> 0 : 0
A33: =A32+1 -> 29 | B33: Dave White | C33: 22.1 | D33: 22.1 | E33: =D33 -> 22.1 | F33: 0 | G33: 0 | H33: 0.00 | I33: =IF(G33="","",IF(G33=0,"0 : "&F33*18,"1 : "&ROUND(((F33*18)/G33),0))) -> 0 : 0
A34: =A33+1 -> 30 | B34: Clive Ferris | C34: 26.0 | D34: 26.0 | E34: =D34 -> 26 | F34: 0 | G34: 0 | H34: 0.00 | I34: =IF(G34="","",IF(G34=0,"0 : "&F34*18,"1 : "&ROUND(((F34*18)/G34),0))) -> 0 : 0
A35: =A34+1 -> 31 | B35: Chris Manning | C35: 22.7 | D35: 22.7 | E35: =D35 -> 22.7 | F35: 0 | G35: 0 | H35: 0.00 | I35: =IF(G35="","",IF(G35=0,"0 : "&F35*18,"1 : "&ROUND(((F35*18)/G35),0))) -> 0 : 0
A36: =A35+1 -> 32 | B36: Andrew Knight | C36: 21.4 | D36: 21.4 | E36: =D36 -> 21.4 | F36: 0 | G36: 0 | H36: 0.00 | I36: =IF(G36="","",IF(G36=0,"0 : "&F36*18,"1 : "&ROUND(((F36*18)/G36),0))) -> 0 : 0
F37: TOTAL | G37: =SUM(G5:G36) -> 336