B1: CHINNEY CHOO - 2012/2013
B3: Awarded to the team with most accumulated points in Majors
C4: Tubby Trophy 7/5/12 | D4: Mendy's Masters 30/6/12 | E4: Bubble Open 8/9/12 | F4: Rousey Invitation 20/10/12 | G4: Players Campionship | H4: Thommo Classic 13/4/13 | I4: Total
B5: EUROPE
B6: R Thompson | C6: 32 | D6: 39 | E6: 30 | F6: 26 | H6: 32 | I6: =SUM(C6:H6) -> 159
B7: J Dey | C7: 0 | D7: 35 | E7: 45 | F7: 33 | H7: 27 | I7: =SUM(C7:H7) -> 140
B8: K Mendelson | C8: 25 | D8: 40 | E8: 33 | F8: 31 | H8: 0 | I8: =SUM(C8:H8) -> 129
B9: D Andrews | C9: 0 | D9: 38 | E9: 27 | F9: 35 | H9: 0 | I9: =SUM(C9:H9) -> 100
B10: D Bingham | C10: 0 | D10: 34 | E10: 27 | F10: 30 | H10: 0 | I10: =SUM(C10:H10) -> 91
B11: I Edwards | C11: 0 | D11: 19 | E11: 18 | F11: 22 | H11: 25 | I11: =SUM(C11:H11) -> 84
B12: D Archer | C12: 0 | D12: 30 | E12: 0 | F12: 34 | H12: 0 | I12: =SUM(C12:H12) -> 64
B13: J Colbrook | C13: 0 | D13: 28 | E13: 0 | F13: 30 | H13: 0 | I13: =SUM(C13:H13) -> 58
B14: A Baldwin (Jnr) | C14: 27 | D14: 0 | E14: 0 | F14: 31 | H14: 0 | I14: =SUM(C14:H14) -> 58
B15: R Dickens | C15: 0 | D15: 0 | E15: 0 | F15: 24 | H15: 26 | I15: =SUM(C15:H15) -> 50
B16: M Bould | C16: 0 | D16: 44 | E16: 0 | F16: 0 | H16: 0 | I16: =SUM(C16:H16) -> 44
B17: C Manning | C17: 0 | D17: 0 | E17: 0 | F17: 31 | H17: 0 | I17: =SUM(C17:H17) -> 31
B18: M Cox | C18: 0 | D18: 0 | E18: 0 | F18: 0 | H18: 22 | I18: =SUM(C18:H18) -> 22
B19: A Baldwin (Snr) | C19: 0 | D19: 0 | E19: 0 | F19: 0 | H19: 0 | I19: =SUM(C19:H19) -> 0
B20: M Rouse | C20: 0 | D20: 0 | E20: 0 | F20: 0 | H20: 0 | I20: =SUM(C20:H20) -> 0
B21: D White | C21: 0 | D21: 0 | E21: 0 | F21: 0 | H21: 0 | I21: =SUM(C21:H21) -> 0
C22: =SUM(C6:C21) -> 84 | D22: =SUM(D6:D21) -> 307 | E22: =SUM(E6:E21) -> 180 | F22: =SUM(F6:F21) -> 327 | G22: =SUM(G6:G21) -> 0 | H22: =SUM(H6:H21) -> 132 | I22: =SUM(I6:I21) -> 1030
B23: USA
B24: D Rouse | C24: 31 | D24: 32 | E24: 36 | F24: 30 | H24: 31 | I24: =SUM(C24:H24) -> 160
B25: M Carter | C25: 20 | D25: 32 | E25: 27 | F25: 38 | H25: 23 | I25: =SUM(C25:H25) -> 140
B26: K Gallagher | C26: 31 | D26: 35 | E26: 37 | F26: 33 | H26: 0 | I26: =SUM(C26:H26) -> 136
B27: M Trimmings | C27: 25 | D27: 31 | E27: 28 | F27: 37 | H27: 0 | I27: =SUM(C27:H27) -> 121
B28: S Thompson | C28: 31 | D28: 29 | E28: 27 | F28: 0 | H28: 27 | I28: =SUM(C28:H28) -> 114
B29: P Carter | C29: 22 | D29: 0 | E29: 32 | F29: 26 | H29: 26 | I29: =SUM(C29:H29) -> 106
B30: P Baldwin | C30: 28 | D30: 30 | E30: 29 | F30: 0 | H30: 0 | I30: =SUM(C30:H30) -> 87
B31: D Braithwaite | C31: 25 | D31: 0 | E31: 32 | F31: 0 | H31: 0 | I31: =SUM(C31:H31) -> 57
B32: J Press | C32: 27 | D32: 0 | E32: 0 | F32: 0 | H32: 0 | I32: =SUM(C32:H32) -> 27
B33: S Owens | C33: 0 | D33: 0 | E33: 0 | F33: 24 | H33: 0 | I33: =SUM(C33:H33) -> 24
B34: A Benson | C34: 0 | D34: 0 | E34: 0 | F34: 0 | H34: 0 | I34: =SUM(C34:H34) -> 0
B35: A Hopkins | C35: 0 | D35: 0 | E35: 0 | F35: 0 | H35: 0 | I35: =SUM(C35:H35) -> 0
B36: D Marsh | C36: 0 | D36: 0 | E36: 0 | F36: 0 | H36: 0 | I36: =SUM(C36:H36) -> 0
B37: S Tilling | C37: 0 | D37: 0 | E37: 0 | F37: 0 | H37: 0 | I37: =SUM(C37:H37) -> 0
B38: C Ferris | C38: 0 | D38: 0 | E38: 0 | F38: 0 | H38: 0 | I38: =SUM(C38:H38) -> 0
C39: =SUM(C24:C38) -> 240 | D39: =SUM(D24:D38) -> 189 | E39: =SUM(E24:E38) -> 248 | F39: =SUM(F24:F38) -> 188 | G39: =SUM(G24:G38) -> 0 | H39: =SUM(H24:H38) -> 107 | I39: =SUM(I24:I38) -> 972