B1: MAJORS TROPHY - 2012/2013
B3: Awarded to the player with most accumulated points in Majors in a season
C4: Tubby Trophy 7/5/12 | D4: Mendy's Masters 30/6/12 | E4: Bubble Open 8/9/12 | F4: Rousey Invitation 20/10/12 | G4: Thommo Classic 13/4/13 | H4: Total
B5: D Rouse | C5: 31 | D5: 32 | E5: 36 | F5: 30 | G5: 31 | H5: =SUM(C5:G5) -> 160
B6: R Thompson | C6: 32 | D6: 39 | E6: 30 | F6: 26 | G6: 32 | H6: =SUM(C6:G6) -> 159
B7: J Dey | C7: 0 | D7: 35 | E7: 45 | F7: 33 | G7: 27 | H7: =SUM(C7:G7) -> 140
B8: M Carter | C8: 20 | D8: 32 | E8: 27 | F8: 38 | G8: 23 | H8: =SUM(C8:G8) -> 140
B9: K Gallagher | C9: 31 | D9: 35 | E9: 37 | F9: 33 | G9: 0 | H9: =SUM(C9:G9) -> 136
B10: K Mendelson | C10: 25 | D10: 40 | E10: 33 | F10: 31 | G10: 0 | H10: =SUM(C10:G10) -> 129
B11: M Trimmings | C11: 25 | D11: 31 | E11: 28 | F11: 37 | G11: 0 | H11: =SUM(C11:G11) -> 121
B12: S Thompson | C12: 31 | D12: 29 | E12: 27 | F12: 0 | G12: 27 | H12: =SUM(C12:G12) -> 114
B13: P Carter | C13: 22 | D13: 0 | E13: 32 | F13: 26 | G13: 26 | H13: =SUM(C13:G13) -> 106
B14: D Andrews | C14: 0 | D14: 38 | E14: 27 | F14: 35 | G14: 0 | H14: =SUM(C14:G14) -> 100
B15: D Bingham | C15: 0 | D15: 34 | E15: 27 | F15: 30 | G15: 0 | H15: =SUM(C15:G15) -> 91
B16: P Baldwin | C16: 28 | D16: 30 | E16: 29 | F16: 0 | G16: 0 | H16: =SUM(C16:G16) -> 87
B17: I Edwards | C17: 0 | D17: 19 | E17: 18 | F17: 22 | G17: 25 | H17: =SUM(C17:G17) -> 84
B18: D Archer | C18: 0 | D18: 30 | E18: 0 | F18: 34 | G18: 0 | H18: =SUM(C18:G18) -> 64
B19: J Colbrook | C19: 0 | D19: 28 | E19: 0 | F19: 30 | G19: 0 | H19: =SUM(C19:G19) -> 58
B20: A Baldwin (Jnr) | C20: 27 | D20: 0 | E20: 0 | F20: 31 | G20: 0 | H20: =SUM(C20:G20) -> 58
B21: D Braithwaite | C21: 25 | D21: 0 | E21: 32 | F21: 0 | G21: 0 | H21: =SUM(C21:G21) -> 57
B22: R Dickens | C22: 0 | D22: 0 | E22: 0 | F22: 24 | G22: 26 | H22: =SUM(C22:G22) -> 50
B23: M Bould | C23: 0 | D23: 44 | E23: 0 | F23: 0 | G23: 0 | H23: =SUM(C23:G23) -> 44
B24: C Manning | C24: 0 | D24: 0 | E24: 0 | F24: 31 | G24: 0 | H24: =SUM(C24:G24) -> 31
B25: J Press | C25: 27 | D25: 0 | E25: 0 | F25: 0 | G25: 0 | H25: =SUM(C25:G25) -> 27
B26: S Owens | C26: 0 | D26: 0 | E26: 0 | F26: 24 | G26: 0 | H26: =SUM(C26:G26) -> 24
B27: M Cox | C27: 0 | D27: 0 | E27: 0 | F27: 0 | G27: 22 | H27: =SUM(C27:G27) -> 22
B28: A Baldwin (Snr) | C28: 0 | D28: 0 | E28: 0 | F28: 0 | G28: 0 | H28: =SUM(C28:G28) -> 0
B29: M Rouse | C29: 0 | D29: 0 | E29: 0 | F29: 0 | G29: 0 | H29: =SUM(C29:G29) -> 0
B30: D White | C30: 0 | D30: 0 | E30: 0 | F30: 0 | G30: 0 | H30: =SUM(C30:G30) -> 0
B31: A Benson | C31: 0 | D31: 0 | E31: 0 | F31: 0 | G31: 0 | H31: =SUM(C31:G31) -> 0
B32: A Hopkins | C32: 0 | D32: 0 | E32: 0 | F32: 0 | G32: 0 | H32: =SUM(C32:G32) -> 0
B33: D Marsh | C33: 0 | D33: 0 | E33: 0 | F33: 0 | G33: 0 | H33: =SUM(C33:G33) -> 0
B34: S Tilling | C34: 0 | D34: 0 | E34: 0 | F34: 0 | G34: 0 | H34: =SUM(C34:G34) -> 0
B35: C Ferris | C35: 0 | D35: 0 | E35: 0 | F35: 0 | G35: 0 | H35: =SUM(C35:G35) -> 0