A1: Season 14 - April 1st 2012 to 13th April 2013
A2: MGA World Tour Putting Statistics
B3: Statistics updated | C3: =TODAY() -> 41380
A4: Pos | B4: Player | C4: Original Handicap | D4: Current Handicap | E4: Playing Handicap | F4: Played | G4: Total Putts | H4: Ave per Round | I4: Ave Per Hole | J4: Best Round | K4: Worst Round
A5: 1 | B5: Dave Andrews | C5: 16.3 | D5: 15.8 | E5: =D5 -> 15.8 | F5: 4 | G5: 120 | H5: 30.00 | I5: =IF(G5=0,"",G5/(F5*18)) -> 1.6666666666666667 | J5: 28 | K5: 33 | L5: Qualified
A6: 2 | B6: David Braithwaite | C6: 11.7 | D6: 12.1 | E6: =D6 -> 12.1 | F6: 3 | G6: 92 | H6: 30.666666666666668 | I6: =IF(G6=0,"",G6/(F6*18)) -> 1.7037037037037037 | J6: 28 | K6: 34 | L6: Qualified
A7: 3 | B7: Robert Thompson | C7: 11.6 | D7: 10.1 | E7: =D7 -> 10.1 | F7: 13 | G7: 417 | H7: 32.07692307692308 | I7: =IF(G7=0,"",G7/(F7*18)) -> 1.7820512820512822 | J7: 26 | K7: 37 | L7: Qualified
A8: 4 | B8: Dave Rouse | C8: 27.0 | D8: 25.8 | E8: =D8 -> 25.8 | F8: 6 | G8: 199 | H8: 33.166666666666664 | I8: =IF(G8=0,"",G8/(F8*18)) -> 1.8425925925925926 | J8: 31 | K8: 36 | L8: Qualified
A9: 5 | B9: Paul Carter | C9: 14.3 | D9: 14.0 | E9: =D9 -> 14 | F9: 5 | G9: 167 | H9: 33.40 | I9: =IF(G9=0,"",G9/(F9*18)) -> 1.8555555555555556 | J9: 27 | K9: 38 | L9: Qualified
A10: 6 | B10: Simon Thompson | C10: 9.3 | D10: 9.2 | E10: =D10 -> 9.2 | F10: 4 | G10: 136 | H10: 34.00 | I10: =IF(G10=0,"",G10/(F10*18)) -> 1.8888888888888888 | J10: 30 | K10: 37 | L10: Qualified
A11: 7 | B11: Matthew Carter | C11: 17.5 | D11: 16.7 | E11: =D11 -> 16.7 | F11: 6 | G11: 206 | H11: 34.333333333333336 | I11: =IF(G11=0,"",G11/(F11*18)) -> 1.9074074074074074 | J11: 29 | K11: 38 | L11: Qualified
A12: 8 | B12: Jon Dey | C12: 31.1 | D12: 26.6 | E12: =D12 -> 26.6 | F12: 6 | G12: 207 | H12: 34.50 | I12: =IF(G12=0,"",G12/(F12*18)) -> 1.9166666666666667 | J12: 32 | K12: 38 | L12: Qualified
A13: 9 | B13: Michael Trimmings | C13: 25.0 | D13: 24.5 | E13: =D13 -> 24.5 | F13: 4 | G13: 140 | H13: 35.00 | I13: =IF(G13=0,"",G13/(F13*18)) -> 1.9444444444444444 | J13: 31 | K13: 37 | L13: Qualified
A14: 10 | B14: Jeff Colbrook | C14: 15.2 | D14: 15.500000000000998 | E14: =D14 -> 15.500000000000998 | F14: 3 | G14: 105 | H14: 35.00 | I14: =IF(G14=0,"",G14/(F14*18)) -> 1.9444444444444444 | J14: 33 | K14: 38 | L14: Qualified
A15: 11 | B15: Keith Mendelson | C15: 16.4 | D15: 15.2 | E15: =D15 -> 15.2 | F15: 5 | G15: 176 | H15: 35.20 | I15: =IF(G15=0,"",G15/(F15*18)) -> 1.9555555555555555 | J15: 33 | K15: 40 | L15: Qualified
A16: 12 | B16: Kevin Gallagher | C16: 15.7 | D16: 15.8 | E16: =D16 -> 15.8 | F16: 11 | G16: 389 | H16: 35.363636363636367 | I16: =IF(G16=0,"",G16/(F16*18)) -> 1.9646464646464648 | J16: 31 | K16: 40 | L16: Qualified
A17: 13 | B17: Dave Bingham | C17: 10.6 | D17: 10.9 | E17: =D17 -> 10.9 | F17: 3 | G17: 109 | H17: 36.333333333333336 | I17: =IF(G17=0,"",G17/(F17*18)) -> 2.0185185185185186 | J17: 35 | K17: 39 | L17: Qualified
A18: 14 | B18: Paul Baldwin | C18: 20.8 | D18: 21.100000000001003 | E18: =D18 -> 21.100000000001003 | F18: 3 | G18: 111 | H18: 37.00 | I18: =IF(G18=0,"",G18/(F18*18)) -> 2.0555555555555554 | J18: 34 | K18: 40 | L18: Qualified
A19: 15 | B19: Ian Edwards | C19: 12.6 | D19: 14.5 | E19: =D19 -> 14.5 | F19: 4 | G19: 157 | H19: 39.25 | I19: =IF(G19=0,"",G19/(F19*18)) -> 2.1805555555555554 | J19: 34 | K19: 46 | L19: Qualified
A20: 16 | B20: Alan Baldwin | C20: 21.2 | D20: 20.900000000001 | E20: =D20 -> 20.900000000001 | F20: 2 | G20: 66 | H20: 33.00 | I20: =IF(G20=0,"",G20/(F20*18)) -> 1.8333333333333333 | J20: 32 | K20: 34
A21: 17 | B21: Chris Manning | C21: 22.7 | D21: 22.8 | E21: =D21 -> 22.8 | F21: 1 | G21: 34 | H21: 34.00 | I21: =IF(G21=0,"",G21/(F21*18)) -> 1.8888888888888888 | J21: 34 | K21: 34
A22: 18 | B22: Andrew Baldwin | C22: 19.8 | D22: 20.1 | E22: =D22 -> 20.1 | F22: 2 | G22: 69 | H22: 34.50 | I22: =IF(G22=0,"",G22/(F22*18)) -> 1.9166666666666667 | J22: 34 | K22: 35
A23: 19 | B23: Jon Press | C23: 14.2 | D23: 14.5 | E23: =D23 -> 14.5 | F23: 2 | G23: 69 | H23: 34.50 | I23: =IF(G23=0,"",G23/(F23*18)) -> 1.9166666666666667 | J23: 33 | K23: 36
A24: 20 | B24: Simon Owens | C24: 14.1 | D24: 14.5 | E24: =D24 -> 14.5 | F24: 2 | G24: 70 | H24: 35.00 | I24: =IF(G24=0,"",G24/(F24*18)) -> 1.9444444444444444 | J24: 32 | K24: 38
A25: 21 | B25: Martin Bould | C25: 18.8 | D25: 14.8 | E25: =D25 -> 14.8 | F25: 1 | G25: 36 | H25: 36.00 | I25: =IF(G25=0,"",G25/(F25*18)) -> 2.00 | J25: 36 | K25: 36
A26: 22 | B26: Martin Cox | C26: 13.5 | D26: 13.7 | E26: =D26 -> 13.7 | F26: 1 | G26: 36 | H26: 36.00 | I26: =IF(G26=0,"",G26/(F26*18)) -> 2.00 | J26: 36 | K26: 36
A27: 23 | B27: David Archer | C27: 24.0 | D27: 24.1 | E27: =D27 -> 24.1 | F27: 2 | G27: 73 | H27: 36.50 | I27: =IF(G27=0,"",G27/(F27*18)) -> 2.0277777777777777 | J27: 35 | K27: 38
A28: 24 | B28: Roy Dickens | C28: 30.4 | D28: 30.8 | E28: =D28 -> 30.8 | F28: 2 | G28: 75 | H28: 37.50 | I28: =IF(G28=0,"",G28/(F28*18)) -> 2.0833333333333335 | J28: 36 | K28: 39
B29: Steve Tilling | C29: 16.5 | D29: 16.5 | E29: =D29 -> 16.5 | F29: 0 | G29: 0 | H29: 0.00 | I29: =IF(G29=0,"",G29/(F29*18)) ->  | J29: 0 | K29: 0
B30: Malcolm Rouse | C30: 44.9 | D30: 44.9 | E30: =D30 -> 44.9 | F30: 0 | G30: 0 | H30: 0.00 | I30: =IF(G30=0,"",G30/(F30*18)) ->  | J30: 0 | K30: 0
B31: Keith Johns | C31: 21.5 | D31: 21.5 | E31: =D31 -> 21.5 | F31: 0 | G31: 0 | H31: 0.00 | I31: =IF(G31=0,"",G31/(F31*18)) ->  | J31: 0 | K31: 0
B32: Jeff Gibbons | C32: 21.0 | D32: 21.0 | E32: =D32 -> 21 | F32: 0 | G32: 0 | H32: 0.00 | I32: =IF(G32=0,"",G32/(F32*18)) ->  | J32: 0 | K32: 0
B33: Dave White | C33: 21.5 | D33: 21.5 | E33: =D33 -> 21.5 | F33: 0 | G33: 0 | H33: 0.00 | I33: =IF(G33=0,"",G33/(F33*18)) ->  | J33: 0 | K33: 0
B34: Clive Ferris | C34: 26.0 | D34: 26.0 | E34: =D34 -> 26 | F34: 0 | G34: 0 | H34: 0.00 | I34: =IF(G34=0,"",G34/(F34*18)) ->  | J34: 0 | K34: 0
B35: Andy Benson | C35: 6.3 | D35: 6.3 | E35: =D35 -> 6.3 | F35: 0 | G35: 0 | H35: 0.00 | I35: =IF(G35=0,"",G35/(F35*18)) ->  | J35: 0 | K35: 0
B36: Alan Hopkins | C36: 7.7 | D36: 7.7 | E36: =D36 -> 7.7 | F36: 0 | G36: 0 | H36: 0.00 | I36: =IF(G36=0,"",G36/(F36*18)) ->  | J36: 0 | K36: 0