A1: Dave Andrews
A2: Club | B2: Timber Greens, Florida
A3: Par/SS | B3: 71/71 | D3: Num. Of Fairways | I3: =IF(B2="","",18-(COUNTIF(B9:B26,3))) -> 14
A4: Date | B4: 38869 | D4: Playing Handicap | I4: 16.800000000001003
A5: Event Place | B5: 1 | D5: Prize Money | G5: 5000
A6: Game Stats | B6: DB+ | C6: DB | D6: Bi | E6: P | F6: B | G6: E | H6: A | I6: H1
B7: 3 | C7: 3 | D7: 5 | E7: 7 | F7: 0 | G7: 0 | H7: 0 | I7: 0
A8: Hole No | B8: Par | C8: Stroke Index | D8: Gross Score | E8: Points | F8: Putts | G8: Fairways | H8: Ferrets | I8: Green Regulation
A9: 1 | B9: 4 | C9: 5 | D9: 5 | E9: 2 | F9: 2 | G9: 1 | I9: Yes
A10: 2 | B10: 3 | C10: 15 | D10: 5 | E10: 1 | F10: 2
A11: 3 | B11: 4 | C11: 9 | D11: 4 | E11: 3 | F11: 2 | G11: 1 | I11: Yes
A12: 4 | B12: 4 | C12: 13 | D12: 5 | E12: 2 | F12: 2 | G12: 1 | I12: Yes
A13: 5 | B13: 4 | C13: 1 | D13: 6 | E13: 1 | F13: 2 | G13: 1
A14: 6 | B14: 5 | C14: 7 | D14: 8 | E14: 0 | F14: 2 | H14: 1
A15: 7 | B15: 4 | C15: 11 | D15: 4 | E15: 3 | F15: 1 | G15: 1 | I15: Yes
A16: 8 | B16: 3 | C16: 17 | D16: 3 | E16: 3 | F16: 1 | I16: Yes
A17: 9 | B17: 4 | C17: 3 | D17: 7 | E17: 0 | F17: 3
A18: 10 | B18: 3 | C18: 16 | D18: 4 | E18: 2 | F18: 1
A19: 11 | B19: 4 | C19: 14 | D19: 5 | E19: 2 | F19: 2 | I19: Yes
A20: 12 | B20: 5 | C20: 6 | D20: 5 | E20: 3 | F20: 1 | G20: 1 | I20: Yes
A21: 13 | B21: 3 | C21: 18 | D21: 3 | E21: 2 | F21: 2 | I21: Yes
A22: 14 | B22: 5 | C22: 8 | D22: 6 | E22: 2 | F22: 2 | I22: Yes
A23: 15 | B23: 4 | C23: 10 | D23: 7 | E23: 0 | F23: 2
A24: 16 | B24: 4 | C24: 2 | D24: 6 | E24: 1 | F24: 2
A25: 17 | B25: 4 | C25: 12 | D25: 4 | E25: 3 | F25: 2 | I25: Yes
A26: 18 | B26: 4 | C26: 4 | D26: 4 | E26: 3 | F26: 1 | I26: Yes
A27: Totals | B27: =IF(B2="","",SUM(B9:B26)) -> 71 | D27: =IF(B2="","",SUM(D9:D26)) -> 91 | E27: =IF(B2="","",SUM(E9:E26)) -> 33 | F27: =IF(B2="","",SUM(F9:F26)) -> 32 | G27: =IF(B2="","",SUM(G9:G26)) -> 6 | H27: =IF(B2="","",SUM(H9:H26)) -> 1 | I27: =IF(COUNTIF(I9:I26,"=Yes")=0,"",COUNTIF(I9:I26,"=Yes")) -> 11