A1: Dave Andrews
A2: Club | B2: Wimbledon Common
A3: Par/SS | B3: 68/66 | D3: Num. Of Fairways | I3: =IF(B2="","",18-(COUNTIF(B9:B26,3))) -> 13
A4: Date | B4: 38892 | D4: Playing Handicap | I4: 16.800000000001003
A5: Event Place | B5: 3 | D5: Prize Money | G5: 2500
A6: Game Stats | B6: DB+ | C6: DB | D6: Bi | E6: P | F6: B | G6: E | H6: A | I6: H1
B7: 7 | C7: 4 | D7: 4 | E7: 3 | F7: 0 | G7: 0 | H7: 0 | I7: 0
A8: Hole No | B8: Par | C8: Stroke Index | D8: Gross Score | E8: Points | F8: Putts | G8: Fairways | H8: Ferrets | I8: Green Regulation
A9: 1 | B9: 3 | C9: 7 | D9: 5 | E9: 1 | F9: 2
A10: 2 | B10: 4 | C10: 1 | D10: 11 | E10: 0 | F10: 2
A11: 3 | B11: 4 | C11: 14 | D11: 10 | E11: 0 | F11: 3
A12: 4 | B12: 3 | C12: 11 | D12: 6 | E12: 0 | F12: 2 | H12: 1
A13: 5 | B13: 4 | C13: 18 | D13: 8 | E13: 0 | F13: 2
A14: 6 | B14: 4 | C14: 5 | D14: 7 | E14: 0 | F14: 3 | G14: 1
A15: 7 | B15: 4 | C15: 10 | D15: 5 | E15: 2 | F15: 1 | G15: 1
A16: 8 | B16: 3 | C16: 8 | D16: 4 | E16: 2 | F16: 2 | I16: Yes
A17: 9 | B17: 4 | C17: 16 | D17: 8 | E17: 0 | F17: 2
A18: 10 | B18: 4 | C18: 15 | D18: 6 | E18: 1 | F18: 3 | G18: 1 | I18: Yes
A19: 11 | B19: 4 | C19: 4 | D19: 5 | E19: 2 | F19: 2 | G19: 1 | I19: Yes
A20: 12 | B20: 3 | C20: 6 | D20: 5 | E20: 1 | F20: 2
A21: 13 | B21: 4 | C21: 13 | D21: 4 | E21: 3 | F21: 1 | G21: 1 | I21: Yes
A22: 14 | B22: 4 | C22: 2 | D22: 4 | E22: 3 | F22: 1 | G22: 1 | I22: Yes
A23: 15 | B23: 4 | C23: 12 | D23: 5 | E23: 2 | F23: 2 | G23: 1 | I23: Yes
A24: 16 | B24: 3 | C24: 17 | D24: 3 | E24: 3 | F24: 2 | I24: Yes
A25: 17 | B25: 4 | C25: 9 | D25: 6 | E25: 1 | F25: 1
A26: 18 | B26: 5 | C26: 3 | D26: 10 | E26: 0 | F26: 3 | H26: 2
A27: Totals | B27: =IF(B2="","",SUM(B9:B26)) -> 68 | D27: =IF(B2="","",SUM(D9:D26)) -> 112 | E27: =IF(B2="","",SUM(E9:E26)) -> 21 | F27: =IF(B2="","",SUM(F9:F26)) -> 36 | G27: =IF(B2="","",SUM(G9:G26)) -> 7 | H27: =IF(B2="","",SUM(H9:H26)) -> 3 | I27: =IF(COUNTIF(I9:I26,"=Yes")=0,"",COUNTIF(I9:I26,"=Yes")) -> 7