A1: Keith Mendelson
A2: Club | B2: Broke Hill
A3: Par/SS | B3: 72/72 | D3: Num. Of Fairways | I3: =IF(B2="","",18-(COUNTIF(B9:B26,3))) -> 14
A4: Date | B4: 38879 | D4: Playing Handicap | I4: 13.3
A5: Event Place | B5: 2 | D5: Prize Money | G5: 2500
A6: Game Stats | B6: DB+ | C6: DB | D6: Bi | E6: P | F6: B | G6: E | H6: A | I6: H1
B7: 7 | C7: 1 | D7: 9 | E7: 1 | F7: 0 | G7: 0 | H7: 0 | I7: 0
A8: Hole No | B8: Par | C8: Stroke Index | D8: Gross Score | E8: Points | F8: Putts | G8: Fairways | H8: Ferrets | I8: Green Regulation
A9: 1 | B9: 4 | C9: 13 | D9: 5 | E9: 2 | F9: 2 | I9: Yes
A10: 2 | B10: 4 | C10: 9 | D10: 4 | E10: 3 | F10: 2 | I10: Yes
A11: 3 | B11: 5 | C11: 3 | D11: 10 | E11: 0 | F11: 3 | H11: 1
A12: 4 | B12: 3 | C12: 15 | D12: 4 | E12: 1 | F12: 1
A13: 5 | B13: 4 | C13: 11 | D13: 5 | E13: 2 | F13: 3 | I13: Yes
A14: 6 | B14: 4 | C14: 1 | D14: 7 | E14: 0 | F14: 2
A15: 7 | B15: 4 | C15: 7 | D15: 5 | E15: 2 | F15: 3 | G15: 1 | I15: Yes
A16: 8 | B16: 3 | C16: 17 | D16: 4 | E16: 1 | F16: 2
A17: 9 | B17: 5 | C17: 5 | D17: 10 | E17: 0 | F17: 2 | G17: 1 | H17: 1
A18: 10 | B18: 4 | C18: 12 | D18: 5 | E18: 2 | F18: 2 | I18: Yes
A19: 11 | B19: 3 | C19: 18 | D19: 4 | E19: 1 | F19: 2
A20: 12 | B20: 5 | C20: 4 | D20: 10 | E20: 0 | F20: 3
A21: 13 | B21: 4 | C21: 8 | D21: 10 | E21: 0 | F21: 3 | H21: 1
A22: 14 | B22: 4 | C22: 14 | D22: 5 | E22: 1 | F22: 2
A23: 15 | B23: 5 | C23: 2 | D23: 10 | E23: 0 | F23: 3 | H23: 1
A24: 16 | B24: 4 | C24: 16 | D24: 5 | E24: 1 | F24: 2
A25: 17 | B25: 3 | C25: 6 | D25: 5 | E25: 1 | F25: 2
A26: 18 | B26: 4 | C26: 10 | D26: 10 | E26: 0 | F26: 3 | H26: 1
A27: Totals | B27: =IF(B2="","",SUM(B9:B26)) -> 72 | D27: =IF(B2="","",SUM(D9:D26)) -> 118 | E27: =IF(B2="","",SUM(E9:E26)) -> 17 | F27: =IF(B2="","",SUM(F9:F26)) -> 42 | G27: =IF(B2="","",SUM(G9:G26)) -> 2 | H27: =IF(B2="","",SUM(H9:H26)) -> 5 | I27: =IF(COUNTIF(I9:I26,"=Yes")=0,"",COUNTIF(I9:I26,"=Yes")) -> 5