A1: Michael Trimmings
A2: Club | B2: Royal Wimbledon
A3: Par/SS | B3: 70/70 | D3: Num. Of Fairways | I3: =IF(B2="","",18-(COUNTIF(B9:B26,3))) -> 14
A4: Date | B4: 39314 | D4: Playing Handicap | I4: 23.3
A5: Event Place | B5: 2 | D5: Prize Money | G5: 2500
A6: Game Stats | B6: DB+ | C6: DB | D6: Bi | E6: P | F6: B | G6: E | H6: A | I6: H1
B7: 4 | C7: 9 | D7: 4 | E7: 1 | F7: 0 | G7: 0 | H7: 0 | I7: 0
A8: Hole No | B8: Par | C8: Stroke Index | D8: Gross Score | E8: Points | F8: Putts | G8: Fairways | H8: Ferrets | I8: Green Regulation
A9: 1 | B9: 4 | C9: 9 | D9: 5 | E9: 2 | F9: 2 | G9: 1 | I9: Yes
A10: 2 | B10: 4 | C10: 5 | D10: 6 | E10: 2 | F10: 2 | G10: 1 | I10: Yes
A11: 3 | B11: 4 | C11: 11 | D11: 7 | E11: 0 | F11: 3 | G11: 1
A12: 4 | B12: 4 | C12: 1 | D12: 5 | E12: 3 | F12: 2 | G12: 1 | I12: Yes
A13: 5 | B13: 3 | C13: 15 | D13: 3 | E13: 3 | F13: 2 | I13: Yes
A14: 6 | B14: 4 | C14: 17 | D14: 6 | E14: 1 | F14: 2 | H14: 1
A15: 7 | B15: 5 | C15: 3 | D15: 7 | E15: 2 | F15: 3 | I15: Yes
A16: 8 | B16: 3 | C16: 7 | D16: 6 | E16: 0 | F16: 2
A17: 9 | B17: 4 | C17: 13 | D17: 5 | E17: 2 | F17: 3 | G17: 1 | I17: Yes
A18: 10 | B18: 5 | C18: 8 | D18: 7 | E18: 1 | F18: 2
A19: 11 | B19: 4 | C19: 12 | D19: 10 | E19: 0 | F19: 3
A20: 12 | B20: 4 | C20: 2 | D20: 6 | E20: 2 | F20: 2 | G20: 1 | I20: Yes
A21: 13 | B21: 3 | C21: 16 | D21: 5 | E21: 1 | F21: 3 | I21: Yes
A22: 14 | B22: 4 | C22: 6 | D22: 5 | E22: 2 | F22: 2 | I22: Yes
A23: 15 | B23: 4 | C23: 10 | D23: 6 | E23: 1 | F23: 2
A24: 16 | B24: 4 | C24: 4 | D24: 6 | E24: 2 | F24: 2 | I24: Yes
A25: 17 | B25: 3 | C25: 18 | D25: 5 | E25: 1 | F25: 3 | I25: Yes
A26: 18 | B26: 4 | C26: 14 | D26: 10 | E26: 0 | F26: 3
A27: Totals | B27: =IF(B2="","",SUM(B9:B26)) -> 70 | D27: =IF(B2="","",SUM(D9:D26)) -> 110 | E27: =IF(B2="","",SUM(E9:E26)) -> 25 | F27: =IF(B2="","",SUM(F9:F26)) -> 43 | G27: =IF(B2="","",SUM(G9:G26)) -> 6 | H27: =IF(B2="","",SUM(H9:H26)) -> 1 | I27: =IF(COUNTIF(I9:I26,"=Yes")=0,"",COUNTIF(I9:I26,"=Yes")) -> 11