B1: Season 17 - April 1st 2015 to 2nd April 2016
A2: MGA World Tour Driving Accuracy (Fairways Hit)
B3: Statistics updated | C3: =TODAY() -> 42469
A4: Pos | B4: Player | C4: Original Handicap | D4: Current Handicap | E4: Playing Handicap | F4: Played | G4: Total Number of Fairways | H4: Total Fairways Hit | I4: Fairway %
A5: 1 | B5: Martin Cox | C5: 13.8 | D5: 14.5 | E5: =D5 -> 14.5 | F5: 7 | G5: 95 | H5: 51 | I5: =IF(F5=0,"0 %",ROUND((H5/G5)*100,2) &" %") -> 53.68 % | J5: Qualified
A6: 2 | B6: Jon Press | C6: 13.5 | D6: 12.1 | E6: =D6 -> 12.1 | F6: 3 | G6: 42 | H6: 22 | I6: =IF(F6=0,"0 %",ROUND((H6/G6)*100,2) &" %") -> 52.38 % | J6: Qualified
A7: 3 | B7: Keith Mendelson | C7: 12.8 | D7: 12.5 | E7: =D7 -> 12.5 | F7: 4 | G7: 54 | H7: 27 | I7: =IF(F7=0,"0 %",ROUND((H7/G7)*100,2) &" %") -> 50 % | J7: Qualified
A8: 4 | B8: David Andrews | C8: 14.3 | D8: 15.300000000000999 | E8: =D8 -> 15.300000000000999 | F8: 4 | G8: 54 | H8: 27 | I8: =IF(F8=0,"0 %",ROUND((H8/G8)*100,2) &" %") -> 50 % | J8: Qualified
A9: 5 | B9: Jon Dey | C9: 22.8 | D9: 18.900000000001004 | E9: =D9 -> 18.900000000001004 | F9: 7 | G9: 98 | H9: 48 | I9: =IF(F9=0,"0 %",ROUND((H9/G9)*100,2) &" %") -> 48.98 % | J9: Qualified
A10: 6 | B10: David Archer | C10: 21.7 | D10: 22.500000000001002 | E10: =D10 -> 22.500000000001002 | F10: 4 | G10: 55 | H10: 26 | I10: =IF(F10=0,"0 %",ROUND((H10/G10)*100,2) &" %") -> 47.27 % | J10: Qualified
A11: 7 | B11: Kevin Gallagher | C11: 13.4 | D11: 13.6 | E11: =D11 -> 13.6 | F11: 5 | G11: 66 | H11: 31 | I11: =IF(F11=0,"0 %",ROUND((H11/G11)*100,2) &" %") -> 46.97 % | J11: Qualified
A12: 8 | B12: Paul Carter | C12: 12.0 | D12: 11.1 | E12: =D12 -> 11.1 | F12: 6 | G12: 81 | H12: 35 | I12: =IF(F12=0,"0 %",ROUND((H12/G12)*100,2) &" %") -> 43.21 % | J12: Qualified
A13: 9 | B13: David Bingham | C13: 11.0 | D13: 11.2 | E13: =D13 -> 11.2 | F13: 6 | G13: 81 | H13: 35 | I13: =IF(F13=0,"0 %",ROUND((H13/G13)*100,2) &" %") -> 43.21 % | J13: Qualified
A14: 10 | B14: Simon Thompson | C14: 10.3 | D14: 8.4 | E14: =D14 -> 8.4 | F14: 6 | G14: 81 | H14: 34 | I14: =IF(F14=0,"0 %",ROUND((H14/G14)*100,2) &" %") -> 41.98 % | J14: Qualified
A15: 11 | B15: Matthew Carter | C15: 15.4 | D15: 16.0 | E15: =D15 -> 16 | F15: 4 | G15: 56 | H15: 23 | I15: =IF(F15=0,"0 %",ROUND((H15/G15)*100,2) &" %") -> 41.07 % | J15: Qualified
A16: 12 | B16: Robert Thompson | C16: 11.9 | D16: 10.7 | E16: =D16 -> 10.7 | F16: 10 | G16: 135 | H16: 49 | I16: =IF(F16=0,"0 %",ROUND((H16/G16)*100,2) &" %") -> 36.3 % | J16: Qualified
A17: 13 | B17: Simon Owens | C17: 15.1 | D17: 16.1 | E17: =D17 -> 16.1 | F17: 4 | G17: 53 | H17: 19 | I17: =IF(F17=0,"0 %",ROUND((H17/G17)*100,2) &" %") -> 35.85 % | J17: Qualified
A18: 14 | B18: David Rouse | C18: 27.0 | D18: 28.5 | E18: =D18 -> 28.5 | F18: 7 | G18: 95 | H18: 30 | I18: =IF(F18=0,"0 %",ROUND((H18/G18)*100,2) &" %") -> 31.58 % | J18: Qualified
A19: 15 | B19: David Kewley | C19: 14.9 | D19: 14.400000000000999 | E19: =D19 -> 14.400000000000999 | F19: 7 | G19: 95 | H19: 29 | I19: =IF(F19=0,"0 %",ROUND((H19/G19)*100,2) &" %") -> 30.53 % | J19: Qualified
A20: 16 | B20: David Braithwaite | C20: 11.1 | D20: 11.900000000000997 | E20: =D20 -> 11.900000000000997 | F20: 6 | G20: 81 | H20: 23 | I20: =IF(F20=0,"0 %",ROUND((H20/G20)*100,2) &" %") -> 28.4 % | J20: Qualified
A21: 17 | B21: Ian Edwards | C21: 17.0 | D21: 15.7 | E21: =D21 -> 15.7 | F21: 7 | G21: 98 | H21: 27 | I21: =IF(F21=0,"0 %",ROUND((H21/G21)*100,2) &" %") -> 27.55 % | J21: Qualified
A22: 18 | B22: Roy Dickens | C22: 28.8 | D22: 29.9 | E22: =D22 -> 29.9 | F22: 4 | G22: 53 | H22: 14 | I22: =IF(F22=0,"0 %",ROUND((H22/G22)*100,2) &" %") -> 26.42 % | J22: Qualified
A23: 19 | B23: Paul Baldwin | C23: 19.0 | D23: 19.100000000001 | E23: =D23 -> 19.100000000001 | F23: 3 | G23: 40 | H23: 9 | I23: =IF(F23=0,"0 %",ROUND((H23/G23)*100,2) &" %") -> 22.5 % | J23: Qualified
A24: 20 | B24: Jeff Colbrook | C24: 18.4 | D24: 19.0 | E24: =D24 -> 19 | F24: 4 | G24: 53 | H24: 10 | I24: =IF(F24=0,"0 %",ROUND((H24/G24)*100,2) &" %") -> 18.87 % | J24: Qualified
A25: 21 | B25: Alan Hopkins | C25: 7.9 | D25: 8.0 | E25: =D25 -> 8 | F25: 1 | G25: 14 | H25: 10 | I25: =IF(F25=0,"0 %",ROUND((H25/G25)*100,2) &" %") -> 71.43 %
A26: 22 | B26: Alan Baldwin | C26: 22.2 | D26: 22.2 | E26: =D26 -> 22.2 | F26: 1 | G26: 14 | H26: 6 | I26: =IF(F26=0,"0 %",ROUND((H26/G26)*100,2) &" %") -> 42.86 %
A27: 23 | B27: Michael Trimmings | C27: 19.8 | D27: 19.3 | E27: =D27 -> 19.3 | F27: 2 | G27: 28 | H27: 11 | I27: =IF(F27=0,"0 %",ROUND((H27/G27)*100,2) &" %") -> 39.29 %
A28: 24 | B28: Chris Manning | C28: 23.3 | D28: 22.6 | E28: =D28 -> 22.6 | F28: 1 | G28: 13 | H28: 3 | I28: =IF(F28=0,"0 %",ROUND((H28/G28)*100,2) &" %") -> 23.08 %
A29: 25 | B29: Andrew Baldwin | C29: 20.4 | D29: 20.9 | E29: =D29 -> 20.9 | F29: 1 | G29: 14 | H29: 2 | I29: =IF(F29=0,"0 %",ROUND((H29/G29)*100,2) &" %") -> 14.29 %
B30: Steve Tilling | C30: 16.3 | D30: 16.3 | E30: =D30 -> 16.3 | F30: 0 | G30: 0 | H30: 0 | I30: =IF(F30=0,"0 %",ROUND((H30/G30)*100,2) &" %") -> 0 %
B31: Martin Bould | C31: 16.2 | D31: 16.2 | E31: =D31 -> 16.2 | F31: 0 | G31: 0 | H31: 0 | I31: =IF(F31=0,"0 %",ROUND((H31/G31)*100,2) &" %") -> 0 %
B32: Malcolm Rouse | C32: 44.9 | D32: 44.9 | E32: =D32 -> 44.9 | F32: 0 | G32: 0 | H32: 0 | I32: =IF(F32=0,"0 %",ROUND((H32/G32)*100,2) &" %") -> 0 %
B33: Clive Ferris | C33: 26.0 | D33: 26.0 | E33: =D33 -> 26 | F33: 0 | G33: 0 | H33: 0 | I33: =IF(F33=0,"0 %",ROUND((H33/G33)*100,2) &" %") -> 0 %
B34: Andy Benson | C34: 6.1 | D34: 6.1 | E34: =D34 -> 6.1 | F34: 0 | G34: 0 | H34: 0 | I34: =IF(F34=0,"0 %",ROUND((H34/G34)*100,2) &" %") -> 0 %