B1: MAJORS TROPHY - 2015/2016
B3: Awarded to the player with most accumulated points in Majors in a season
C4: Tubby Trophy 5/5/15 | D4: Skips Memorial 13/6/15 | E4: Players Campionship 27/06/15 | F4: Bubble Open 11/7/15 | G4: Rousey Invitation 3/10/15 | H4: Mendys Masters 5/9/15 | I4: Thommo Classic 2/04/16 | J4: Total
B5: R Thompson | C5: 35 | D5: 40 | E5: 28 | F5: 24 | G5: 30 | H5: 28 | I5: 14 | J5: =SUM(C5:I5) -> 199
B6: M Cox | C6: 24 | D6: 35 | E6: 29 | F6: 31 | G6: 22 | H6: 22 | I6: 25 | J6: =SUM(C6:I6) -> 188
B7: S Thompson | C7: 31 | D7: 0 | E7: 33 | F7: 32 | G7: 32 | H7: 35 | I7: 24 | J7: =SUM(C7:I7) -> 187
B8: D Rouse | C8: 32 | D8: 39 | E8: 29 | F8: 13 | G8: 26 | H8: 31 | I8: 15 | J8: =SUM(C8:I8) -> 185
B9: D Kewley | C9: 23 | D9: 37 | E9: 32 | F9: 0 | G9: 30 | H9: 34 | I9: 28 | J9: =SUM(C9:I9) -> 184
B10: D Bingham | C10: 27 | D10: 0 | E10: 25 | F10: 27 | G10: 33 | H10: 23 | I10: 32 | J10: =SUM(C10:I10) -> 167
B11: P Carter | C11: 22 | D11: 0 | E11: 24 | F11: 35 | G11: 36 | H11: 27 | I11: 19 | J11: =SUM(C11:I11) -> 163
B12: K Gallagher | C12: 30 | D12: 0 | E12: 0 | F12: 30 | G12: 32 | H12: 33 | I12: 22 | J12: =SUM(C12:I12) -> 147
B13: D Braithwaite | C13: 0 | D13: 34 | E13: 26 | F13: 0 | G13: 31 | H13: 27 | I13: 22 | J13: =SUM(C13:I13) -> 140
B14: I Edwards | C14: 0 | D14: 26 | E14: 0 | F14: 0 | G14: 35 | H14: 29 | I14: 38 | J14: =SUM(C14:I14) -> 128
B15: J Dey | C15: 0 | D15: 51 | E15: 0 | F15: 0 | G15: 28 | H15: 21 | I15: 22 | J15: =SUM(C15:I15) -> 122
B16: M Carter | C16: 20 | D16: 37 | E16: 27 | F16: 0 | G16: 30 | H16: 0 | I16: 0 | J16: =SUM(C16:I16) -> 114
B17: D Archer | C17: 0 | D17: 38 | E17: 28 | F17: 0 | G17: 0 | H17: 30 | I17: 17 | J17: =SUM(C17:I17) -> 113
B18: J Colbrook | C18: 0 | D18: 24 | E18: 0 | F18: 30 | G18: 0 | H18: 29 | I18: 27 | J18: =SUM(C18:I18) -> 110
B19: K Mendelson | C19: 27 | D19: 40 | E19: 0 | F19: 0 | G19: 0 | H19: 27 | I19: 14 | J19: =SUM(C19:I19) -> 108
B20: R Dickens | C20: 22 | D20: 0 | E20: 0 | F20: 0 | G20: 19 | H20: 26 | I20: 22 | J20: =SUM(C20:I20) -> 89
B21: P Baldwin | C21: 23 | D21: 0 | E21: 0 | F21: 0 | G21: 0 | H21: 28 | I21: 30 | J21: =SUM(C21:I21) -> 81
B22: S Owens | C22: 0 | D22: 25 | E22: 0 | F22: 0 | G22: 29 | H22: 25 | I22: 0 | J22: =SUM(C22:I22) -> 79
B23: J Press | C23: 24 | D23: 0 | E23: 39 | F23: 0 | G23: 0 | H23: 0 | I23: 0 | J23: =SUM(C23:I23) -> 63
B24: M Trimmings | C24: 33 | D24: 0 | E24: 0 | F24: 0 | G24: 0 | H24: 22 | I24: 0 | J24: =SUM(C24:I24) -> 55
B25: D Andrews | C25: 0 | D25: 0 | E25: 0 | F25: 0 | G25: 0 | H25: 28 | I25: 20 | J25: =SUM(C25:I25) -> 48
B26: C Manning | C26: 0 | D26: 0 | E26: 0 | F26: 0 | G26: 35 | H26: 0 | I26: 0 | J26: =SUM(C26:I26) -> 35
B27: A Baldwin (Snr) | C27: 0 | D27: 34 | E27: 0 | F27: 0 | G27: 0 | H27: 0 | I27: 0 | J27: =SUM(C27:I27) -> 34
B28: A Hopkins | C28: 0 | D28: 0 | E28: 0 | F28: 0 | G28: 0 | H28: 31 | I28: 0 | J28: =SUM(C28:I28) -> 31
B29: A Baldwin (Jnr) | C29: 19 | D29: 0 | E29: 0 | F29: 0 | G29: 0 | H29: 0 | I29: 0 | J29: =SUM(C29:I29) -> 19
B30: M Bould | C30: 0 | D30: 0 | E30: 0 | F30: 0 | G30: 0 | H30: 0 | I30: 0 | J30: =SUM(C30:I30) -> 0
B31: S Tilling | C31: 0 | D31: 0 | E31: 0 | F31: 0 | G31: 0 | H31: 0 | I31: 0 | J31: =SUM(C31:I31) -> 0