A1: Season 17 - April 1st 2015 to 2nd April 2016
A2: MGA World Tour Money List
B3: Statistics updated | C3: =TODAY() -> 42469
A4: Pos | B4: Player | C4: Original Handicap | D4: Current Handicap | E4: Playing Handicap | F4: Events Played | G4: Tour Victories | H4: Winnings
A5: 1 | B5: Simon Thompson | C5: 10.3 | D5: 8.4 | E5: =D5 -> 8.4 | F5: 6 | G5: 1 | H5: 181250
A6: 2 | B6: David Kewley | C6: 14.9 | D6: 14.400000000000999 | E6: =D6 -> 14.400000000000999 | F6: 7 | G6: 0 | H6: 157500
A7: 3 | B7: Robert Thompson | C7: 11.9 | D7: 10.7 | E7: =D7 -> 10.7 | F7: 10 | G7: 3 | H7: 151250
A8: 4 | B8: David Rouse | C8: 27.0 | D8: 28.5 | E8: =D8 -> 28.5 | F8: 7 | G8: 0 | H8: 131250
A9: 5 | B9: Kevin Gallagher | C9: 13.4 | D9: 13.6 | E9: =D9 -> 13.6 | F9: 5 | G9: 0 | H9: 131250
A10: 6 | B10: Ian Edwards | C10: 17.0 | D10: 15.7 | E10: =D10 -> 15.7 | F10: 7 | G10: 1 | H10: 130000
A11: 7 | B11: David Bingham | C11: 11.0 | D11: 11.2 | E11: =D11 -> 11.2 | F11: 6 | G11: 0 | H11: 116250
A12: 8 | B12: Paul Carter | C12: 12.0 | D12: 11.1 | E12: =D12 -> 11.1 | F12: 6 | G12: 2 | H12: 108750
A13: 9 | B13: Martin Cox | C13: 13.8 | D13: 14.5 | E13: =D13 -> 14.5 | F13: 7 | G13: 0 | H13: 108750
A14: 10 | B14: David Braithwaite | C14: 11.1 | D14: 11.900000000000997 | E14: =D14 -> 11.900000000000997 | F14: 6 | G14: 0 | H14: 87500
A15: 11 | B15: Jon Dey | C15: 22.8 | D15: 18.900000000001004 | E15: =D15 -> 18.900000000001004 | F15: 7 | G15: 4 | H15: 86250
A16: 12 | B16: David Archer | C16: 21.7 | D16: 22.500000000001002 | E16: =D16 -> 22.500000000001002 | F16: 4 | G16: 0 | H16: 83750
A17: 13 | B17: Jeff Colbrook | C17: 18.4 | D17: 19.0 | E17: =D17 -> 19 | F17: 4 | G17: 0 | H17: 80000
A18: 14 | B18: Paul Baldwin | C18: 19.0 | D18: 19.100000000001 | E18: =D18 -> 19.100000000001 | F18: 3 | G18: 0 | H18: 78750
A19: 15 | B19: Keith Mendelson | C19: 12.8 | D19: 12.5 | E19: =D19 -> 12.5 | F19: 4 | G19: 0 | H19: 76250
A20: 16 | B20: Jon Press | C20: 13.5 | D20: 12.1 | E20: =D20 -> 12.1 | F20: 3 | G20: 2 | H20: 56250
A21: 17 | B21: Matthew Carter | C21: 15.4 | D21: 16.0 | E21: =D21 -> 16 | F21: 4 | G21: 0 | H21: 51250
A22: 18 | B22: David Andrews | C22: 14.3 | D22: 15.300000000000999 | E22: =D22 -> 15.300000000000999 | F22: 4 | G22: 1 | H22: 50000
A23: 19 | B23: Roy Dickens | C23: 28.8 | D23: 29.9 | E23: =D23 -> 29.9 | F23: 4 | G23: 0 | H23: 47500
A24: 20 | B24: Michael Trimmings | C24: 19.8 | D24: 19.3 | E24: =D24 -> 19.3 | F24: 2 | G24: 0 | H24: 41250
A25: 21 | B25: Alan Hopkins | C25: 7.9 | D25: 8.0 | E25: =D25 -> 8 | F25: 1 | G25: 0 | H25: 41250
A26: 22 | B26: Chris Manning | C26: 23.3 | D26: 22.6 | E26: =D26 -> 22.6 | F26: 1 | G26: 0 | H26: 33750
A27: 23 | B27: Simon Owens | C27: 15.1 | D27: 16.1 | E27: =D27 -> 16.1 | F27: 4 | G27: 0 | H27: 32500
A28: 24 | B28: Alan Baldwin | C28: 22.2 | D28: 22.2 | E28: =D28 -> 22.2 | F28: 1 | G28: 0 | H28: 11250
A29: 25 | B29: Andrew Baldwin | C29: 20.4 | D29: 20.9 | E29: =D29 -> 20.9 | F29: 1 | G29: 0 | H29: 2500
B30: Steve Tilling | C30: 16.3 | D30: 16.3 | E30: =D30 -> 16.3 | F30: 0 | G30: 0 | H30: 0
B31: Martin Bould | C31: 16.2 | D31: 16.2 | E31: =D31 -> 16.2 | F31: 0 | G31: 0 | H31: 0
B32: Malcolm Rouse | C32: 44.9 | D32: 44.9 | E32: =D32 -> 44.9 | F32: 0 | G32: 0 | H32: 0
B33: Clive Ferris | C33: 26.0 | D33: 26.0 | E33: =D33 -> 26 | F33: 0 | G33: 0 | H33: 0
B34: Andy Benson | C34: 6.1 | D34: 6.1 | E34: =D34 -> 6.1 | F34: 0 | G34: 0 | H34: 0