B1: Season 17 - April 1st 2015 to 2nd April 2016
A2: MGA World Tour Putting Statistics
B3: Statistics updated | C3: =TODAY() -> 42469
A4: Pos | B4: Player | C4: Original Handicap | D4: Current Handicap | E4: Playing Handicap | F4: Played | G4: Total Putts | H4: Ave per Round | I4: Ave Per Hole | J4: Best Round | K4: Worst Round
A5: 1 | B5: Kevin Gallagher | C5: 13.4 | D5: 13.6 | E5: =D5 -> 13.6 | F5: 5 | G5: 164 | H5: 32.80 | I5: =IF(G5=0,"",G5/(F5*18)) -> 1.8222222222222222 | J5: 29 | K5: 35 | L5: Qualified
A6: 2 | B6: David Andrews | C6: 14.3 | D6: 15.300000000000999 | E6: =D6 -> 15.300000000000999 | F6: 4 | G6: 132 | H6: 33.00 | I6: =IF(G6=0,"",G6/(F6*18)) -> 1.8333333333333333 | J6: 29 | K6: 35 | L6: Qualified
A7: 3 | B7: Jon Press | C7: 13.5 | D7: 12.1 | E7: =D7 -> 12.1 | F7: 3 | G7: 100 | H7: 33.333333333333336 | I7: =IF(G7=0,"",G7/(F7*18)) -> 1.8518518518518519 | J7: 32 | K7: 36 | L7: Qualified
A8: 4 | B8: Simon Thompson | C8: 10.3 | D8: 8.4 | E8: =D8 -> 8.4 | F8: 6 | G8: 204 | H8: 34.00 | I8: =IF(G8=0,"",G8/(F8*18)) -> 1.8888888888888888 | J8: 32 | K8: 36 | L8: Qualified
A9: 5 | B9: David Kewley | C9: 14.9 | D9: 14.400000000000999 | E9: =D9 -> 14.400000000000999 | F9: 7 | G9: 238 | H9: 34.00 | I9: =IF(G9=0,"",G9/(F9*18)) -> 1.8888888888888888 | J9: 29 | K9: 39 | L9: Qualified
A10: 6 | B10: Robert Thompson | C10: 11.9 | D10: 10.7 | E10: =D10 -> 10.7 | F10: 10 | G10: 341 | H10: 34.10 | I10: =IF(G10=0,"",G10/(F10*18)) -> 1.8944444444444444 | J10: 29 | K10: 37 | L10: Qualified
A11: 7 | B11: Jon Dey | C11: 22.8 | D11: 18.900000000001004 | E11: =D11 -> 18.900000000001004 | F11: 7 | G11: 239 | H11: 34.142857142857146 | I11: =IF(G11=0,"",G11/(F11*18)) -> 1.8968253968253967 | J11: 27 | K11: 40 | L11: Qualified
A12: 8 | B12: Matthew Carter | C12: 15.4 | D12: 16.0 | E12: =D12 -> 16 | F12: 4 | G12: 137 | H12: 34.25 | I12: =IF(G12=0,"",G12/(F12*18)) -> 1.9027777777777777 | J12: 33 | K12: 35 | L12: Qualified
A13: 9 | B13: David Braithwaite | C13: 11.1 | D13: 11.900000000000997 | E13: =D13 -> 11.900000000000997 | F13: 6 | G13: 206 | H13: 34.333333333333336 | I13: =IF(G13=0,"",G13/(F13*18)) -> 1.9074074074074074 | J13: 29 | K13: 39 | L13: Qualified
A14: 10 | B14: Martin Cox | C14: 13.8 | D14: 14.5 | E14: =D14 -> 14.5 | F14: 7 | G14: 242 | H14: 34.571428571428569 | I14: =IF(G14=0,"",G14/(F14*18)) -> 1.9206349206349207 | J14: 31 | K14: 37 | L14: Qualified
A15: 11 | B15: David Bingham | C15: 11.0 | D15: 11.2 | E15: =D15 -> 11.2 | F15: 6 | G15: 208 | H15: 34.666666666666664 | I15: =IF(G15=0,"",G15/(F15*18)) -> 1.9259259259259258 | J15: 31 | K15: 38 | L15: Qualified
A16: 12 | B16: Ian Edwards | C16: 17.0 | D16: 15.7 | E16: =D16 -> 15.7 | F16: 7 | G16: 247 | H16: 35.285714285714285 | I16: =IF(G16=0,"",G16/(F16*18)) -> 1.9603174603174602 | J16: 33 | K16: 38 | L16: Qualified
A17: 13 | B17: David Rouse | C17: 27.0 | D17: 28.5 | E17: =D17 -> 28.5 | F17: 7 | G17: 250 | H17: 35.714285714285715 | I17: =IF(G17=0,"",G17/(F17*18)) -> 1.9841269841269842 | J17: 32 | K17: 41 | L17: Qualified
A18: 14 | B18: Simon Owens | C18: 15.1 | D18: 16.1 | E18: =D18 -> 16.1 | F18: 4 | G18: 143 | H18: 35.75 | I18: =IF(G18=0,"",G18/(F18*18)) -> 1.9861111111111112 | J18: 31 | K18: 38 | L18: Qualified
A19: 15 | B19: Paul Baldwin | C19: 19.0 | D19: 19.100000000001 | E19: =D19 -> 19.100000000001 | F19: 3 | G19: 108 | H19: 36.00 | I19: =IF(G19=0,"",G19/(F19*18)) -> 2.00 | J19: 32 | K19: 42 | L19: Qualified
A20: 16 | B20: Roy Dickens | C20: 28.8 | D20: 29.9 | E20: =D20 -> 29.9 | F20: 4 | G20: 145 | H20: 36.25 | I20: =IF(G20=0,"",G20/(F20*18)) -> 2.0138888888888888 | J20: 31 | K20: 40 | L20: Qualified
A21: 17 | B21: Paul Carter | C21: 12.0 | D21: 11.1 | E21: =D21 -> 11.1 | F21: 6 | G21: 218 | H21: 36.333333333333336 | I21: =IF(G21=0,"",G21/(F21*18)) -> 2.0185185185185186 | J21: 30 | K21: 41 | L21: Qualified
A22: 18 | B22: David Archer | C22: 21.7 | D22: 22.500000000001002 | E22: =D22 -> 22.500000000001002 | F22: 4 | G22: 148 | H22: 37.00 | I22: =IF(G22=0,"",G22/(F22*18)) -> 2.0555555555555554 | J22: 36 | K22: 38 | L22: Qualified
A23: 19 | B23: Jeff Colbrook | C23: 18.4 | D23: 19.0 | E23: =D23 -> 19 | F23: 4 | G23: 148 | H23: 37.00 | I23: =IF(G23=0,"",G23/(F23*18)) -> 2.0555555555555554 | J23: 33 | K23: 42 | L23: Qualified
A24: 20 | B24: Keith Mendelson | C24: 12.8 | D24: 12.5 | E24: =D24 -> 12.5 | F24: 4 | G24: 150 | H24: 37.50 | I24: =IF(G24=0,"",G24/(F24*18)) -> 2.0833333333333335 | J24: 34 | K24: 41 | L24: Qualified
A25: 21 | B25: Chris Manning | C25: 23.3 | D25: 22.6 | E25: =D25 -> 22.6 | F25: 1 | G25: 30 | H25: 30.00 | I25: =IF(G25=0,"",G25/(F25*18)) -> 1.6666666666666667 | J25: 30 | K25: 30
A26: 22 | B26: Alan Hopkins | C26: 7.9 | D26: 8.0 | E26: =D26 -> 8 | F26: 1 | G26: 30 | H26: 30.00 | I26: =IF(G26=0,"",G26/(F26*18)) -> 1.6666666666666667 | J26: 30 | K26: 30
A27: 23 | B27: Alan Baldwin | C27: 22.2 | D27: 22.2 | E27: =D27 -> 22.2 | F27: 1 | G27: 33 | H27: 33.00 | I27: =IF(G27=0,"",G27/(F27*18)) -> 1.8333333333333333 | J27: 33 | K27: 33
A28: 24 | B28: Michael Trimmings | C28: 19.8 | D28: 19.3 | E28: =D28 -> 19.3 | F28: 2 | G28: 73 | H28: 36.50 | I28: =IF(G28=0,"",G28/(F28*18)) -> 2.0277777777777777 | J28: 31 | K28: 42
A29: 25 | B29: Andrew Baldwin | C29: 20.4 | D29: 20.9 | E29: =D29 -> 20.9 | F29: 1 | G29: 41 | H29: 41.00 | I29: =IF(G29=0,"",G29/(F29*18)) -> 2.2777777777777777 | J29: 41 | K29: 41
B30: Steve Tilling | C30: 16.3 | D30: 16.3 | E30: =D30 -> 16.3 | F30: 0 | G30: 0 | H30: 0.00 | I30: =IF(G30=0,"",G30/(F30*18)) ->  | J30: 0 | K30: 0
B31: Martin Bould | C31: 16.2 | D31: 16.2 | E31: =D31 -> 16.2 | F31: 0 | G31: 0 | H31: 0.00 | I31: =IF(G31=0,"",G31/(F31*18)) ->  | J31: 0 | K31: 0
B32: Malcolm Rouse | C32: 44.9 | D32: 44.9 | E32: =D32 -> 44.9 | F32: 0 | G32: 0 | H32: 0.00 | I32: =IF(G32=0,"",G32/(F32*18)) ->  | J32: 0 | K32: 0
B33: Clive Ferris | C33: 26.0 | D33: 26.0 | E33: =D33 -> 26 | F33: 0 | G33: 0 | H33: 0.00 | I33: =IF(G33=0,"",G33/(F33*18)) ->  | J33: 0 | K33: 0
B34: Andy Benson | C34: 6.1 | D34: 6.1 | E34: =D34 -> 6.1 | F34: 0 | G34: 0 | H34: 0.00 | I34: =IF(G34=0,"",G34/(F34*18)) ->  | J34: 0 | K34: 0