A1: Owner | B1: Fantasy Team Name | C1: S Owens | D1: P Carter | E1: A Hopkins | F1: S Thompson | G1: K Gallagher | H1: D Rouse | I1: J Press | J1: M Carter | K1: P Baldwin | L1: M Trimmings | M1: D Braithwaite | N1: K Mendelson | O1: R Thompson | P1: A Baldwin (Jnr) | Q1: D Andrews | R1: J Colbrook | S1: A Baldwin (Snr) | T1: M Bould | U1: M Cox | V1: J Dey | W1: R Dickens | X1: D Archer | Y1: D Bingham
A2: J Press | B2: The Bogey Scuffers | F2: 2.5 | G2: 4.0 | I2: 2.0 | M2: 3.0 | O2: 3.0 | Y2: 2.5 | Z2: =SUM(C2:Y2) -> 17.0
A3: M Trimmings | B3: Where's My Knob Gone? | F3: 2.5 | G3: 4.0 | L3: 1.0 | M3: 3.0 | O3: 3.0 | Y3: 2.5 | Z3: =SUM(C3:Y3) -> 16.0
A4: R Dickens | B4: The Bog's Dollocks | F4: 2.5 | J4: 2.5 | O4: 3.0 | Q4: 2.0 | W4: 3.5 | Y4: 2.5 | Z4: =SUM(C4:Y4) -> 16.0
A5: A Baldwin (Snr) | B5: Sons & Brothers | D5: 3.0 | F5: 2.5 | J5: 2.5 | K5: 1.5 | O5: 3.0 | P5: 3.0 | Z5: =SUM(C5:Y5) -> 15.5
A6: A Baldwin (Jnr) | B6: Boooomtastic Massive | F6: 2.5 | G6: 4.0 | N6: 1.0 | O6: 3.0 | V6: 2.5 | Y6: 2.5 | Z6: =SUM(C6:Y6) -> 15.5
A7: D Braithwaite | B7: Porridge Poofters | I7: 2.0 | J7: 2.5 | M7: 3.0 | O7: 3.0 | Q7: 2.0 | V7: 2.5 | Z7: =SUM(C7:Y7) -> 15.0
A8: D Rouse | B8: Where's Me Pants? | E8: 3.0 | H8: 1.0 | I8: 2.0 | M8: 3.0 | V8: 2.5 | Y8: 2.5 | Z8: =SUM(C8:Y8) -> 14.0
A9: M Bould | B9: A Canny Set of Threps | E9: 3.0 | J9: 2.5 | N9: 1.0 | O9: 3.0 | T9: 2.0 | V9: 2.5 | Z9: =SUM(C9:Y9) -> 14.0
A10: A Hopkins | B10: Bournemouth Bashers | F10: 2.5 | I10: 2.0 | J10: 2.5 | K10: 1.5 | O10: 3.0 | Y10: 2.5 | Z10: =SUM(C10:Y10) -> 14.0
A11: K Mendelson | B11: Mendy's Scuffing Scoundrels | D11: 3.0 | F11: 2.5 | M11: 3.0 | N11: 1.0 | T11: 2.0 | Y11: 2.5 | Z11: =SUM(C11:Y11) -> 14.0
A12: R Thompson | B12: More Scuffs Than A Beaten Up Cortina | I12: 2.0 | J12: 2.5 | N12: 1.0 | O12: 3.0 | V12: 2.5 | Y12: 2.5 | Z12: =SUM(C12:Y12) -> 13.5
A13: P Baldwin | B13: The Twats | G13: 4.0 | J13: 2.5 | K13: 1.5 | N13: 1.0 | T13: 2.0 | Y13: 2.5 | Z13: =SUM(C13:Y13) -> 13.5
A14: D Andrews | B14: Flying High | I14: 2.0 | L14: 1.0 | M14: 3.0 | O14: 3.0 | Q14: 2.0 | Y14: 2.5 | Z14: =SUM(C14:Y14) -> 13.5
A15: J Dey | B15: It’s taken them 22 years to be this good | E15: 3.0 | F15: 2.5 | H15: 1.0 | Q15: 2.0 | T15: 2.0 | V15: 2.5 | Z15: =SUM(C15:Y15) -> 13.0
A16: J Colbrook | B16: Jeff's Jaffers | F16: 2.5 | I16: 2.0 | J16: 2.5 | O16: 3.0 | Q16: 2.0 | R16: 1.0 | Z16: =SUM(C16:Y16) -> 13.0
A17: S Owens | B17: The Bournemouth Bum Bandits | C17: 0.5 | E17: 3.0 | H17: 1.0 | M17: 3.0 | V17: 2.5 | Y17: 2.5 | Z17: =SUM(C17:Y17) -> 12.5
A18: I Edwards | B18: Potsy's Pricks | F18: 2.5 | J18: 2.5 | O18: 3.0 | T18: 2.0 | U18: 0.0 | V18: 2.5 | Z18: =SUM(C18:Y18) -> 12.5
A19: S Thompson | B19: Simon's Keenly Inspired Putting Superstars | C19: 0.5 | F19: 2.5 | J19: 2.5 | T19: 2.0 | V19: 2.5 | Y19: 2.5 | Z19: =SUM(C19:Y19) -> 12.5
A20: M Carter | B20: The Hurricanes | C20: 0.5 | D20: 3.0 | J20: 2.5 | K20: 1.5 | R20: 1.0 | W20: 3.5 | Z20: =SUM(C20:Y20) -> 12.0
A21: K Gallagher | B21: Bring Back Matey! | C21: 0.5 | I21: 2.0 | Q21: 2.0 | T21: 2.0 | V21: 2.5 | Y21: 2.5 | Z21: =SUM(C21:Y21) -> 11.5
A22: D Bingham | B22: Romans | F22: 2.5 | J22: 2.5 | M22: 3.0 | N22: 1.0 | U22: 0.0 | V22: 2.5 | Z22: =SUM(C22:Y22) -> 11.5
A23: D Archer | B23: Team Arch | F23: 2.5 | H23: 1.0 | L23: 1.0 | N23: 1.0 | P23: 3.0 | T23: 2.0 | Z23: =SUM(C23:Y23) -> 10.5
A24: P Carter | B24: The Blues | C24: 0.5 | D24: 3.0 | J24: 2.5 | N24: 1.0 | T24: 2.0 | X24: 0.5 | Z24: =SUM(C24:Y24) -> 9.5
A25: M Cox | B25: He's Back | F25: 2.5 | H25: 1.0 | I25: 2.0 | R25: 1.0 | U25: 0.0 | Y25: 2.5 | Z25: =SUM(C25:Y25) -> 9.0
C26: 5 | D26: 4 | E26: 4 | F26: 14 | G26: 3 | H26: 5 | I26: 9 | J26: 13 | K26: 4 | L26: 3 | M26: 8 | N26: 8 | O26: 12 | P26: 2 | Q26: 6 | R26: 3 | S26: 0 | T26: 9 | U26: 3 | V26: 11 | W26: 2 | X26: 1 | Y26: 14