A1: Alan Hopkins
A2: Club | B2: Broke Hill
A3: Par/SS | B3: 72/72 | D3: Num. Of Fairways | I3: =IF(B2="","",18-(COUNTIF(B9:B26,3))) -> 14
A4: Date | B4: 38242 | D4: Playing Handicap | I4: 7.4
A5: Event Place | B5: 2 | D5: Prize Money | G5: 7500
A6: Game Stats | B6: DB+ | C6: DB | D6: BI | E6: P | F6: B | G6: E | H6: A | I6: H1
B7: 2 | C7: 2 | D7: 8 | E7: 6 | F7: 0 | G7: 0 | H7: 0 | I7: 0
A8: Hole No | B8: Par | C8: Stroke Index | D8: Gross Score | E8: Points | F8: Putts | G8: Fairways | H8: Ferrets | I8: Green Regulation
A9: 1 | B9: 4 | C9: 13 | D9: 6 | E9: 0 | F9: 2 | H9: 1
A10: 2 | B10: 4 | C10: 9 | D10: 5 | E10: 1 | F10: 3 | G10: 1 | I10: Yes
A11: 3 | B11: 5 | C11: 3 | D11: 5 | E11: 3 | F11: 2 | I11: Yes
A12: 4 | B12: 3 | C12: 15 | D12: 4 | E12: 1 | F12: 1
A13: 5 | B13: 4 | C13: 11 | D13: 7 | E13: 0 | F13: 2 | H13: 1
A14: 6 | B14: 4 | C14: 1 | D14: 5 | E14: 2 | F14: 2 | G14: 1 | I14: Yes
A15: 7 | B15: 4 | C15: 7 | D15: 5 | E15: 2 | F15: 2 | G15: 1 | I15: Yes
A16: 8 | B16: 3 | C16: 17 | D16: 4 | E16: 1 | F16: 2
A17: 9 | B17: 5 | C17: 5 | D17: 5 | E17: 3 | F17: 2 | I17: Yes
A18: 10 | B18: 4 | C18: 12 | D18: 4 | E18: 2 | F18: 1 | G18: 1
A19: 11 | B19: 3 | C19: 18 | D19: 4 | E19: 1 | F19: 2
A20: 12 | B20: 5 | C20: 4 | D20: 6 | E20: 2 | F20: 3 | I20: Yes
A21: 13 | B21: 4 | C21: 8 | D21: 4 | E21: 2 | F21: 2 | G21: 1 | I21: Yes
A22: 14 | B22: 4 | C22: 14 | D22: 4 | E22: 2 | F22: 1 | G22: 1
A23: 15 | B23: 5 | C23: 2 | D23: 6 | E23: 2 | F23: 2 | I23: Yes
A24: 16 | B24: 4 | C24: 16 | D24: 10 | E24: 0 | F24: 3 | H24: 2
A25: 17 | B25: 3 | C25: 6 | D25: 5 | E25: 1 | F25: 2 | H25: 1
A26: 18 | B26: 4 | C26: 10 | D26: 4 | E26: 2 | F26: 2 | I26: Yes
A27: Totals | B27: =IF(B2="","",SUM(B9:B26)) -> 72 | D27: =IF(B2="","",SUM(D9:D26)) -> 93 | E27: =IF(B2="","",SUM(E9:E26)) -> 27 | F27: =IF(B2="","",SUM(F9:F26)) -> 36 | G27: =IF(B2="","",SUM(G9:G26)) -> 6 | H27: =IF(B2="","",SUM(H9:H26)) -> 5 | I27: =IF(COUNTIF(I9:I26,"=Yes")=0,"",COUNTIF(I9:I26,"=Yes")) -> 9