A1: Keith Mendelson
A2: Club | B2: Broke Hill
A3: Par/SS | B3: 72/72 | D3: Num. Of Fairways | I3: =IF(B2="","",18-(COUNTIF(B9:B26,3))) -> 14
A4: Date | B4: 38249 | D4: Playing Handicap | I4: 13.3
A5: Event Place | B5: 2 | D5: Prize Money | G5: 2500
A6: Game Stats | B6: DB+ | C6: DB | D6: Bi | E6: P | F6: B | G6: E | H6: A | I6: H1
B7: 5 | C7: 5 | D7: 6 | E7: 1 | F7: 1 | G7: 0 | H7: 0 | I7: 0
A8: Hole No | B8: Par | C8: Stroke Index | D8: Gross Score | E8: Points | F8: Putts | G8: Fairways | H8: Ferrets | I8: Green Regulation
A9: 1 | B9: 4 | C9: 13 | D9: 6 | E9: 1 | F9: 3 | I9: Yes
A10: 2 | B10: 4 | C10: 9 | D10: 5 | E10: 2 | F10: 2 | I10: Yes
A11: 3 | B11: 5 | C11: 3 | D11: 7 | E11: 1 | F11: 2 | G11: 1
A12: 4 | B12: 3 | C12: 15 | D12: 4 | E12: 1 | F12: 2
A13: 5 | B13: 4 | C13: 11 | D13: 3 | E13: 4 | F13: 1 | G13: 1 | I13: Yes
A14: 6 | B14: 4 | C14: 1 | D14: 6 | E14: 1 | F14: 1
A15: 7 | B15: 4 | C15: 7 | D15: 7 | E15: 0 | F15: 1 | G15: 1
A16: 8 | B16: 3 | C16: 17 | D16: 6 | E16: 0 | F16: 2
A17: 9 | B17: 5 | C17: 5 | D17: 6 | E17: 2 | F17: 2 | G17: 1 | I17: Yes
A18: 10 | B18: 4 | C18: 12 | D18: 5 | E18: 2 | F18: 2 | I18: Yes
A19: 11 | B19: 3 | C19: 18 | D19: 7 | E19: 0 | F19: 2
A20: 12 | B20: 5 | C20: 4 | D20: 8 | E20: 0 | F20: 2 | H20: 1
A21: 13 | B21: 4 | C21: 8 | D21: 5 | E21: 2 | F21: 2 | G21: 1 | I21: Yes
A22: 14 | B22: 4 | C22: 14 | D22: 10 | E22: 0 | F22: 3
A23: 15 | B23: 5 | C23: 2 | D23: 7 | E23: 1 | F23: 3 | I23: Yes
A24: 16 | B24: 4 | C24: 16 | D24: 4 | E24: 2 | F24: 2 | G24: 1 | I24: Yes
A25: 17 | B25: 3 | C25: 6 | D25: 5 | E25: 1 | F25: 2
A26: 18 | B26: 4 | C26: 10 | D26: 5 | E26: 2 | F26: 3 | G26: 1 | I26: Yes
A27: Totals | B27: =IF(B2="","",SUM(B9:B26)) -> 72 | D27: =IF(B2="","",SUM(D9:D26)) -> 106 | E27: =IF(B2="","",SUM(E9:E26)) -> 22 | F27: =IF(B2="","",SUM(F9:F26)) -> 37 | G27: =IF(B2="","",SUM(G9:G26)) -> 7 | H27: =IF(B2="","",SUM(H9:H26)) -> 1 | I27: =IF(COUNTIF(I9:I26,"=Yes")=0,"",COUNTIF(I9:I26,"=Yes")) -> 9