A1: Andrew Baldwin
A2: Club | B2: Broke Hill
A3: Par/SS | B3: 72/72 | D3: Num. Of Fairways | I3: =IF(B2="","",18-(COUNTIF(B9:B26,3))) -> 14
A4: Date | B4: 38913 | D4: Playing Handicap | I4: 17.2
A5: Event Place | B5: 8 | C5: M | D5: Prize Money | G5: 13750
A6: Game Stats | B6: DB+ | C6: DB | D6: Bi | E6: P | F6: B | G6: E | H6: A | I6: H1
B7: 3 | C7: 5 | D7: 4 | E7: 6 | F7: 0 | G7: 0 | H7: 0 | I7: 0
A8: Hole No | B8: Par | C8: Stroke Index | D8: Gross Score | E8: Points | F8: Putts | G8: Fairways | H8: Ferrets | I8: Green Regulation
A9: 1 | B9: 4 | C9: 13 | D9: 6 | E9: 1 | F9: 2
A10: 2 | B10: 4 | C10: 9 | D10: 5 | E10: 2 | F10: 2 | I10: Yes
A11: 3 | B11: 5 | C11: 3 | D11: 7 | E11: 1 | F11: 2
A12: 4 | B12: 3 | C12: 15 | D12: 5 | E12: 1 | F12: 2 | H12: 1
A13: 5 | B13: 4 | C13: 11 | D13: 5 | E13: 2 | F13: 2 | G13: 1 | I13: Yes
A14: 6 | B14: 4 | C14: 1 | D14: 4 | E14: 3 | F14: 2 | G14: 1 | I14: Yes
A15: 7 | B15: 4 | C15: 7 | D15: 5 | E15: 2 | F15: 2 | I15: Yes
A16: 8 | B16: 3 | C16: 17 | D16: 3 | E16: 3 | F16: 2 | I16: Yes
A17: 9 | B17: 5 | C17: 5 | D17: 7 | E17: 1 | F17: 2 | G17: 1 | H17: 1
A18: 10 | B18: 4 | C18: 12 | D18: 4 | E18: 3 | F18: 2 | G18: 1 | I18: Yes
A19: 11 | B19: 3 | C19: 18 | D19: 3 | E19: 2 | F19: 2 | I19: Yes
A20: 12 | B20: 5 | C20: 4 | D20: 5 | E20: 3 | F20: 1 | I20: Yes
A21: 13 | B21: 4 | C21: 8 | D21: 6 | E21: 1 | F21: 2 | H21: 1
A22: 14 | B22: 4 | C22: 14 | D22: 5 | E22: 2 | F22: 2 | G22: 1 | I22: Yes
A23: 15 | B23: 5 | C23: 2 | D23: 10 | E23: 0 | F23: 3 | H23: 1
A24: 16 | B24: 4 | C24: 16 | D24: 10 | E24: 0 | F24: 2
A25: 17 | B25: 3 | C25: 6 | D25: 3 | E25: 3 | F25: 1 | I25: Yes
A26: 18 | B26: 4 | C26: 10 | D26: 10 | E26: 0 | F26: 3 | H26: 2
A27: Totals | B27: =IF(B2="","",SUM(B9:B26)) -> 72 | D27: =IF(B2="","",SUM(D9:D26)) -> 103 | E27: =IF(B2="","",SUM(E9:E26)) -> 30 | F27: =IF(B2="","",SUM(F9:F26)) -> 36 | G27: =IF(B2="","",SUM(G9:G26)) -> 5 | H27: =IF(B2="","",SUM(H9:H26)) -> 6 | I27: =IF(COUNTIF(I9:I26,"=Yes")=0,"",COUNTIF(I9:I26,"=Yes")) -> 10