B1: MAJORS TROPHY - 2009/2010
B3: Awarded to the player with most accumulated points in Majors in a season
C4: Mendy's Masters 11/7/09 | D4: Bubble Open 12/9/09 | E4: Rousey Invitation 21/4/09 | F4: Thommo Classic 27/3/10 | G4: Total
B5: S Thompson | C5: 42 | D5: 28 | E5: 34 | F5: 32 | G5: =SUM(C5:F5) -> 136
B6: K Gallagher | C6: 0 | D6: 39 | E6: 32 | F6: 29 | G6: =SUM(C6:F6) -> 100
B7: P Carter | C7: 0 | D7: 30 | E7: 33 | F7: 37 | G7: =SUM(C7:F7) -> 100
B8: R Thompson | C8: 37 | D8: 0 | E8: 28 | F8: 31 | G8: =SUM(C8:F8) -> 96
B9: D Bingham | C9: 33 | D9: 31 | E9: 0 | F9: 31 | G9: =SUM(C9:F9) -> 95
B10: D Rouse | C10: 0 | D10: 35 | E10: 27 | F10: 21 | G10: =SUM(C10:F10) -> 83
B11: K Mendelson | C11: 38 | D11: 33 | E11: 0 | F11: 0 | G11: =SUM(C11:F11) -> 71
B12: M Bould | C12: 0 | D12: 32 | E12: 0 | F12: 26 | G12: =SUM(C12:F12) -> 58
B13: A Baldwin (Jnr) | C13: 36 | D13: 0 | E13: 20 | F13: 0 | G13: =SUM(C13:F13) -> 56
B14: M Carter | C14: 0 | D14: 0 | E14: 27 | F14: 28 | G14: =SUM(C14:F14) -> 55
B15: M Trimmings | C15: 0 | D15: 25 | E15: 0 | F15: 25 | G15: =SUM(C15:F15) -> 50
B16: R Dickens | C16: 0 | D16: 0 | E16: 22 | F16: 27 | G16: =SUM(C16:F16) -> 49
B17: J Dey | C17: 47 | D17: 0 | E17: 0 | F17: 0 | G17: =SUM(C17:F17) -> 47
B18: I Edwards | C18: 0 | D18: 23 | E18: 0 | F18: 16 | G18: =SUM(C18:F18) -> 39
B19: S Owens | C19: 38 | D19: 0 | E19: 0 | F19: 0 | G19: =SUM(C19:F19) -> 38
B20: J Press | C20: 0 | D20: 0 | E20: 35 | F20: 0 | G20: =SUM(C20:F20) -> 35
B21: A Hopkins | C21: 0 | D21: 34 | E21: 0 | F21: 0 | G21: =SUM(C21:F21) -> 34
B22: A Benson | C22: 0 | D22: 34 | E22: 0 | F22: 0 | G22: =SUM(C22:F22) -> 34
B23: J Colbrook | C23: 33 | D23: 0 | E23: 0 | F23: 0 | G23: =SUM(C23:F23) -> 33
B24: M Cox | C24: 0 | D24: 0 | E24: 29 | F24: 0 | G24: =SUM(C24:F24) -> 29
B25: P Baldwin | C25: 0 | D25: 0 | E25: 29 | F25: 0 | G25: =SUM(C25:F25) -> 29
B26: D Andrews | C26: 0 | D26: 0 | E26: 0 | F26: 28 | G26: =SUM(C26:F26) -> 28
B27: A Baldwin (Snr) | C27: 0 | D27: 0 | E27: 26 | F27: 0 | G27: =SUM(C27:F27) -> 26