A1: David Braithwaite
A2: Club | B2: Donnington Valley
A3: Par/SS | B3: 71/69 | D3: Num. Of Fairways | I3: =IF(B2="","",18-(COUNTIF(B9:B26,3))) -> 15
A4: Date | B4: 41965 | D4: Playing Handicap | I4: 12.000000000000998
A5: Event Place | B5: 1 | C5: M | D5: Prize Money | G5: 25000
A6: Game Stats | B6: DB+ | C6: DB | D6: Bi | E6: P | F6: B | G6: E | H6: A | I6: H1
B7: 0 | C7: 4 | D7: 9 | E7: 4 | F7: 1 | G7: 0 | H7: 0 | I7: 0
A8: Hole No | B8: Par | C8: Stroke Index | D8: Gross Score | E8: Points | F8: Putts | G8: Fairways | H8: Ferrets | I8: Green Regulation
A9: 1 | B9: 5 | C9: 9 | D9: 6 | E9: 2 | F9: 2 | G9: 1 | I9: Yes
A10: 2 | B10: 4 | C10: 3 | D10: 5 | E10: 2 | F10: 2 | I10: Yes
A11: 3 | B11: 4 | C11: 11 | D11: 4 | E11: 3 | F11: 1 | I11: Yes
A12: 4 | B12: 4 | C12: 13 | D12: 5 | E12: 1 | F12: 1 | G12: 1
A13: 5 | B13: 4 | C13: 7 | D13: 6 | E13: 1 | F13: 3 | I13: Yes
A14: 6 | B14: 4 | C14: 1 | D14: 5 | E14: 2 | F14: 2 | I14: Yes
A15: 7 | B15: 4 | C15: 15 | D15: 6 | E15: 0 | F15: 2 | G15: 1
A16: 8 | B16: 4 | C16: 5 | D16: 5 | E16: 2 | F16: 2 | I16: Yes
A17: 9 | B17: 3 | C17: 17 | D17: 3 | E17: 2 | F17: 2 | I17: Yes
A18: 10 | B18: 4 | C18: 18 | D18: 3 | E18: 3 | F18: 2 | I18: Yes
A19: 11 | B19: 3 | C19: 8 | D19: 5 | E19: 1 | F19: 1
A20: 12 | B20: 4 | C20: 6 | D20: 5 | E20: 2 | F20: 2 | G20: 1 | I20: Yes
A21: 13 | B21: 4 | C21: 16 | D21: 5 | E21: 1 | F21: 2
A22: 14 | B22: 4 | C22: 10 | D22: 6 | E22: 1 | F22: 1 | H22: 1
A23: 15 | B23: 5 | C23: 2 | D23: 6 | E23: 2 | F23: 1 | H23: 1
A24: 16 | B24: 3 | C24: 12 | D24: 3 | E24: 3 | F24: 2 | I24: Yes
A25: 17 | B25: 4 | C25: 4 | D25: 5 | E25: 2 | F25: 3 | I25: Yes
A26: 18 | B26: 4 | C26: 14 | D26: 4 | E26: 2 | F26: 2 | G26: 1 | I26: Yes
A27: Totals | B27: =IF(B2="","",SUM(B9:B26)) -> 71 | D27: =IF(B2="","",SUM(D9:D26)) -> 87 | E27: =IF(B2="","",SUM(E9:E26)) -> 32 | F27: =IF(B2="","",SUM(F9:F26)) -> 33 | G27: =IF(B2="","",SUM(G9:G26)) -> 5 | H27: =IF(B2="","",SUM(H9:H26)) -> 2 | I27: =IF(COUNTIF(I9:I26,"=Yes")=0,"",COUNTIF(I9:I26,"=Yes")) -> 12