A1: Paul Carter
A2: Club | B2: Donnington Valley
A3: Par/SS | B3: 71/69 | D3: Num. Of Fairways | I3: =IF(B2="","",18-(COUNTIF(B9:B26,3))) -> 15
A4: Date | B4: 41965 | D4: Playing Handicap | I4: 12.4
A5: Event Place | B5: 5 | C5: M | D5: Prize Money | G5: 11250
A6: Game Stats | B6: DB+ | C6: DB | D6: BI | E6: P | F6: B | G6: E | H6: A | I6: H1
B7: 1 | C7: 6 | D7: 8 | E7: 1 | F7: 2 | G7: 0 | H7: 0 | I7: 0
A8: Hole No | B8: Par | C8: Stroke Index | D8: Gross Score | E8: Points | F8: Putts | G8: Fairways | H8: Ferrets | I8: Green Regulation
A9: 1 | B9: 5 | C9: 9 | D9: 4 | E9: 4 | F9: 1 | G9: 1 | I9: Yes
A10: 2 | B10: 4 | C10: 3 | D10: 6 | E10: 1 | F10: 2
A11: 3 | B11: 4 | C11: 11 | D11: 5 | E11: 2 | F11: 2 | G11: 1 | I11: Yes
A12: 4 | B12: 4 | C12: 13 | D12: 6 | E12: 0 | F12: 2
A13: 5 | B13: 4 | C13: 7 | D13: 5 | E13: 2 | F13: 2 | I13: Yes
A14: 6 | B14: 4 | C14: 1 | D14: 6 | E14: 1 | F14: 2
A15: 7 | B15: 4 | C15: 15 | D15: 5 | E15: 1 | F15: 3 | G15: 1 | I15: Yes
A16: 8 | B16: 4 | C16: 5 | D16: 5 | E16: 2 | F16: 2 | I16: Yes
A17: 9 | B17: 3 | C17: 17 | D17: 4 | E17: 1 | F17: 2
A18: 10 | B18: 4 | C18: 18 | D18: 3 | E18: 3 | F18: 1 | I18: Yes
A19: 11 | B19: 3 | C19: 8 | D19: 4 | E19: 2 | F19: 1
A20: 12 | B20: 4 | C20: 6 | D20: 5 | E20: 2 | F20: 2 | I20: Yes
A21: 13 | B21: 4 | C21: 16 | D21: 6 | E21: 0 | F21: 3 | H21: 2
A22: 14 | B22: 4 | C22: 10 | D22: 6 | E22: 1 | F22: 2
A23: 15 | B23: 5 | C23: 2 | D23: 10 | E23: 0 | F23: 3 | H23: 2
A24: 16 | B24: 3 | C24: 12 | D24: 4 | E24: 2 | F24: 1
A25: 17 | B25: 4 | C25: 4 | D25: 6 | E25: 1 | F25: 2
A26: 18 | B26: 4 | C26: 14 | D26: 4 | E26: 2 | F26: 2 | I26: Yes
A27: Totals | B27: =IF(B2="","",SUM(B9:B26)) -> 71 | D27: =IF(B2="","",SUM(D9:D26)) -> 94 | E27: =IF(B2="","",SUM(E9:E26)) -> 27 | F27: =IF(B2="","",SUM(F9:F26)) -> 35 | G27: =IF(B2="","",SUM(G9:G26)) -> 3 | H27: =IF(B2="","",SUM(H9:H26)) -> 4 | I27: =IF(COUNTIF(I9:I26,"=Yes")=0,"",COUNTIF(I9:I26,"=Yes")) -> 8