A1: Simon Thompson
A2: Club | B2: Merrist Wood
A3: Par/SS | B3: 72/70 | D3: Num. Of Fairways | I3: =IF(B2="","",18-(COUNTIF(B9:B26,3))) -> 14
A4: Date | B4: 39536 | D4: Playing Handicap | I4: 12
A5: Event Place | B5: 4 | C5: M | D5: Prize Money | G5: 25000
A6: Game Stats | B6: DB+ | C6: DB | D6: Bi | E6: P | F6: B | G6: E | H6: A | I6: H1
B7: 0 | C7: 7 | D7: 6 | E7: 5 | F7: 0 | G7: 0 | H7: 0 | I7: 0
A8: Hole No | B8: Par | C8: Stroke Index | D8: Gross Score | E8: Points | F8: Putts | G8: Fairways | H8: Ferrets | I8: Green Regulation
A9: 1 | B9: 4 | C9: 10 | D9: 5 | E9: 2 | F9: 2 | I9: Yes
A10: 2 | B10: 3 | C10: 18 | D10: 3 | E10: 2 | F10: 1
A11: 3 | B11: 4 | C11: 6 | D11: 5 | E11: 2 | F11: 1 | G11: 1
A12: 4 | B12: 5 | C12: 14 | D12: 6 | E12: 1 | F12: 2
A13: 5 | B13: 4 | C13: 4 | D13: 4 | E13: 3 | F13: 2 | G13: 1 | I13: Yes
A14: 6 | B14: 5 | C14: 12 | D14: 7 | E14: 1 | F14: 3 | I14: Yes
A15: 7 | B15: 4 | C15: 8 | D15: 6 | E15: 1 | F15: 3 | G15: 1 | I15: Yes
A16: 8 | B16: 3 | C16: 16 | D16: 5 | E16: 0 | F16: 3
A17: 9 | B17: 4 | C17: 2 | D17: 6 | E17: 1 | F17: 2 | G17: 1
A18: 10 | B18: 5 | C18: 9 | D18: 5 | E18: 3 | F18: 1 | I18: Yes
A19: 11 | B19: 3 | C19: 15 | D19: 3 | E19: 2 | F19: 2 | H19: 1 | I19: Yes
A20: 12 | B20: 4 | C20: 7 | D20: 6 | E20: 1 | F20: 2
A21: 13 | B21: 4 | C21: 1 | D21: 6 | E21: 1 | F21: 1
A22: 14 | B22: 4 | C22: 13 | D22: 4 | E22: 2 | F22: 3 | G22: 1 | I22: Yes
A23: 15 | B23: 4 | C23: 3 | D23: 6 | E23: 1 | F23: 2 | G23: 1
A24: 16 | B24: 3 | C24: 17 | D24: 4 | E24: 1 | F24: 2
A25: 17 | B25: 4 | C25: 5 | D25: 5 | E25: 2 | F25: 2 | G25: 1 | I25: Yes
A26: 18 | B26: 5 | C26: 11 | D26: 6 | E26: 2 | F26: 2 | G26: 1 | I26: Yes
A27: Totals | B27: =IF(B2="","",SUM(B9:B26)) -> 72 | D27: =IF(B2="","",SUM(D9:D26)) -> 92 | E27: =IF(B2="","",SUM(E9:E26)) -> 28 | F27: =IF(B2="","",SUM(F9:F26)) -> 36 | G27: =IF(B2="","",SUM(G9:G26)) -> 8 | H27: =IF(B2="","",SUM(H9:H26)) -> 1 | I27: =IF(COUNTIF(I9:I26,"=Yes")=0,"",COUNTIF(I9:I26,"=Yes")) -> 9