A1: Simon Thompson
A2: Club | B2: Dudsbury
A3: Par/SS | B3: 71/70 | D3: Num. Of Fairways | I3: =IF(B2="","",18-(COUNTIF(B9:B26,3))) -> 14
A4: Date | B4: 38475 | D4: Playing Handicap | I4: 12.8
A5: Event Place | B5: 6 | D5: Prize Money | G5: 25000
A6: Game Stats | B6: DB+ | C6: DB | D6: BI | E6: P | F6: B | G6: E | H6: A | I6: H1
B7: 1 | C7: 5 | D7: 8 | E7: 4 | F7: 0 | G7: 0 | H7: 0 | I7: 0
A8: Hole No | B8: Par | C8: Stroke Index | D8: Gross Score | E8: Points | F8: Putts | G8: Fairways | H8: Ferrets | I8: Green Regulation
A9: 1 | B9: 4 | C9: 12 | D9: 5 | E9: 2 | F9: 2 | I9: Yes
A10: 2 | B10: 3 | C10: 18 | D10: 5 | E10: 0 | F10: 2 | H10: 1
A11: 3 | B11: 4 | C11: 6 | D11: 6 | E11: 1 | F11: 1 | G11: 1 | H11: 1
A12: 4 | B12: 4 | C12: 16 | D12: 6 | E12: 0 | F12: 3
A13: 5 | B13: 4 | C13: 2 | D13: 5 | E13: 2 | F13: 2 | G13: 1 | I13: Yes
A14: 6 | B14: 5 | C14: 10 | D14: 5 | E14: 3 | F14: 1 | G14: 1 | I14: Yes
A15: 7 | B15: 4 | C15: 8 | D15: 4 | E15: 3 | F15: 1 | I15: Yes
A16: 8 | B16: 3 | C16: 14 | D16: 3 | E16: 2 | F16: 2 | I16: Yes
A17: 9 | B17: 4 | C17: 4 | D17: 5 | E17: 2 | F17: 2 | I17: Yes
A18: 10 | B18: 5 | C18: 15 | D18: 6 | E18: 1 | F18: 2 | G18: 1
A19: 11 | B19: 3 | C19: 11 | D19: 5 | E19: 1 | F19: 3 | I19: Yes
A20: 12 | B20: 4 | C20: 3 | D20: 5 | E20: 2 | F20: 1
A21: 13 | B21: 4 | C21: 5 | D21: 6 | E21: 1 | F21: 2 | G21: 1
A22: 14 | B22: 4 | C22: 1 | D22: 5 | E22: 2 | F22: 2 | I22: Yes
A23: 15 | B23: 3 | C23: 17 | D23: 3 | E23: 2 | F23: 1
A24: 16 | B24: 4 | C24: 9 | D24: 5 | E24: 2 | F24: 2 | G24: 1 | I24: Yes
A25: 17 | B25: 5 | C25: 13 | D25: 8 | E25: 0 | F25: 3 | H25: 1
A26: 18 | B26: 4 | C26: 7 | D26: 5 | E26: 2 | F26: 2 | G26: 1 | I26: Yes
A27: Totals | B27: =IF(B2="","",SUM(B9:B26)) -> 71 | D27: =IF(B2="","",SUM(D9:D26)) -> 92 | E27: =IF(B2="","",SUM(E9:E26)) -> 28 | F27: =IF(B2="","",SUM(F9:F26)) -> 34 | G27: =IF(B2="","",SUM(G9:G26)) -> 7 | H27: =IF(B2="","",SUM(H9:H26)) -> 3 | I27: =IF(COUNTIF(I9:I26,"=Yes")=0,"",COUNTIF(I9:I26,"=Yes")) -> 10

A1: Simon Thompson
A2: Club | B2: Dudsbury
A3: Par/SS | B3: 71/70 | D3: Num. Of Fairways | I3: =IF(B2="","",18-(COUNTIF(B9:B26,3))) -> 14
A4: Date | B4: 38475 | D4: Playing Handicap | I4: 12.8
A5: Event Place | B5: 6 | D5: Prize Money | G5: 25000
A6: Game Stats | B6: DB+ | C6: DB | D6: Bi | E6: P | F6: B | G6: E | H6: A | I6: H1
B7: 1 | C7: 5 | D7: 8 | E7: 4 | F7: 0 | G7: 0 | H7: 0 | I7: 0
A8: Hole No | B8: Par | C8: Stroke Index | D8: Gross Score | E8: Points | F8: Putts | G8: Fairways | H8: Ferrets | I8: Green Regulation
A9: 1 | B9: 4 | C9: 12 | D9: 5 | E9: 2 | F9: 2 | I9: Yes
A10: 2 | B10: 3 | C10: 18 | D10: 5 | E10: 0 | F10: 2 | H10: 1
A11: 3 | B11: 4 | C11: 6 | D11: 6 | E11: 1 | F11: 1 | G11: 1 | H11: 1
A12: 4 | B12: 4 | C12: 16 | D12: 6 | E12: 0 | F12: 3
A13: 5 | B13: 4 | C13: 2 | D13: 5 | E13: 2 | F13: 2 | G13: 1 | I13: Yes
A14: 6 | B14: 5 | C14: 10 | D14: 5 | E14: 3 | F14: 1 | G14: 1 | I14: Yes
A15: 7 | B15: 4 | C15: 8 | D15: 4 | E15: 3 | F15: 1 | I15: Yes
A16: 8 | B16: 3 | C16: 14 | D16: 3 | E16: 2 | F16: 2 | I16: Yes
A17: 9 | B17: 4 | C17: 4 | D17: 5 | E17: 2 | F17: 2 | I17: Yes
A18: 10 | B18: 5 | C18: 15 | D18: 6 | E18: 1 | F18: 2 | G18: 1
A19: 11 | B19: 3 | C19: 11 | D19: 5 | E19: 1 | F19: 3 | I19: Yes
A20: 12 | B20: 4 | C20: 3 | D20: 5 | E20: 2 | F20: 1
A21: 13 | B21: 4 | C21: 5 | D21: 6 | E21: 1 | F21: 2 | G21: 1
A22: 14 | B22: 4 | C22: 1 | D22: 5 | E22: 2 | F22: 2 | I22: Yes
A23: 15 | B23: 3 | C23: 17 | D23: 3 | E23: 2 | F23: 1
A24: 16 | B24: 4 | C24: 9 | D24: 5 | E24: 2 | F24: 2 | G24: 1 | I24: Yes
A25: 17 | B25: 5 | C25: 13 | D25: 8 | E25: 0 | F25: 3 | H25: 1
A26: 18 | B26: 4 | C26: 7 | D26: 5 | E26: 2 | F26: 2 | G26: 1 | I26: Yes
A27: Totals | B27: =IF(B2="","",SUM(B9:B26)) -> 71 | D27: =IF(B2="","",SUM(D9:D26)) -> 92 | E27: =IF(B2="","",SUM(E9:E26)) -> 28 | F27: =IF(B2="","",SUM(F9:F26)) -> 34 | G27: =IF(B2="","",SUM(G9:G26)) -> 7 | H27: =IF(B2="","",SUM(H9:H26)) -> 3 | I27: =IF(COUNTIF(I9:I26,"=Yes")=0,"",COUNTIF(I9:I26,"=Yes")) -> 10