A1: Jon Dey
A2: Club | B2: Porters Park
A3: Par/SS | B3: 70/70 | D3: Num. Of Fairways | I3: =IF(B2="","",18-(COUNTIF(B9:B26,3))) -> 14
A4: Date | B4: 40433 | D4: Playing Handicap | I4: 29.7
A5: Event Place | B5: 1 | D5: Prize Money | G5: 5000
A6: Game Stats | B6: DB+ | C6: DB | D6: Bi | E6: P | F6: B | G6: E | H6: A | I6: H1
B7: 7 | C7: 4 | D7: 4 | E7: 3 | F7: 0 | G7: 0 | H7: 0 | I7: 0
A8: Hole No | B8: Par | C8: Stroke Index | D8: Gross Score | E8: Points | F8: Putts | G8: Fairways | H8: Ferrets | I8: Green Regulation
A9: 1 | B9: 4 | C9: 17 | D9: 4 | E9: 3 | F9: 2 | G9: 1 | I9: Yes
A10: 2 | B10: 4 | C10: 11 | D10: 7 | E10: 1 | F10: 2
A11: 3 | B11: 4 | C11: 3 | D11: 5 | E11: 3 | F11: 1 | G11: 1 | I11: Yes
A12: 4 | B12: 4 | C12: 1 | D12: 8 | E12: 0 | F12: 2
A13: 5 | B13: 4 | C13: 9 | D13: 7 | E13: 1 | F13: 2 | H13: 1
A14: 6 | B14: 3 | C14: 13 | D14: 3 | E14: 3 | F14: 1 | I14: Yes
A15: 7 | B15: 4 | C15: 7 | D15: 6 | E15: 2 | F15: 3 | G15: 1 | I15: Yes
A16: 8 | B16: 4 | C16: 5 | D16: 7 | E16: 1 | F16: 2
A17: 9 | B17: 3 | C17: 15 | D17: 4 | E17: 2 | F17: 1
A18: 19 | B18: 5 | C18: 12 | D18: 9 | E18: 0 | F18: 2
A19: 20 | B19: 4 | C19: 2 | D19: 7 | E19: 1 | F19: 2
A20: 21 | B20: 3 | C20: 8 | D20: 4 | E20: 3 | F20: 2 | I20: Yes
A21: 22 | B21: 5 | C21: 4 | D21: 7 | E21: 2 | F21: 2 | I21: Yes
A22: 23 | B22: 3 | C22: 16 | D22: 6 | E22: 0 | F22: 3
A23: 24 | B23: 4 | C23: 18 | D23: 4 | E23: 3 | F23: 2 | G23: 1 | I23: Yes
A24: 25 | B24: 4 | C24: 6 | D24: 5 | E24: 3 | F24: 2 | I24: Yes
A25: 26 | B25: 4 | C25: 14 | D25: 6 | E25: 1 | F25: 2
A26: 27 | B26: 4 | C26: 10 | D26: 6 | E26: 2 | F26: 2 | G26: 1 | I26: Yes
A27: Totals | B27: =IF(B2="","",SUM(B9:B26)) -> 70 | D27: =IF(B2="","",SUM(D9:D26)) -> 105 | E27: =IF(B2="","",SUM(E9:E26)) -> 31 | F27: =IF(B2="","",SUM(F9:F26)) -> 35 | G27: =IF(B2="","",SUM(G9:G26)) -> 5 | H27: =IF(B2="","",SUM(H9:H26)) -> 1 | I27: =IF(COUNTIF(I9:I26,"=Yes")=0,"",COUNTIF(I9:I26,"=Yes")) -> 9