A1: Martin Bould
A2: Club | B2: Chichester Cathedral
A3: Par/SS | B3: 71/69 | D3: Num. Of Fairways | I3: =IF(B2="","",18-(COUNTIF(B9:B26,3))) -> 14
A4: Date | B4: 38849 | D4: Playing Handicap | I4: 20.4
A5: Event Place | B5: 5 | D5: Prize Money | G5: 6250
A6: Game Stats | B6: DB+ | C6: DB | D6: Bi | E6: P | F6: B | G6: E | H6: A | I6: H1
B7: 5 | C7: 4 | D7: 8 | E7: 0 | F7: 1 | G7: 0 | H7: 0 | I7: 0
A8: Hole No | B8: Par | C8: Stroke Index | D8: Gross Score | E8: Points | F8: Putts | G8: Fairways | H8: Ferrets | I8: Green Regulation
A9: 1 | B9: 4 | C9: 9 | D9: 10 | E9: 0 | F9: 3 | H9: 1
A10: 2 | B10: 4 | C10: 15 | D10: 10 | E10: 0 | F10: 3
A11: 3 | B11: 4 | C11: 5 | D11: 5 | E11: 2 | F11: 2 | I11: Yes
A12: 4 | B12: 3 | C12: 13 | D12: 4 | E12: 2 | F12: 2 | I12: Yes
A13: 5 | B13: 5 | C13: 1 | D13: 10 | E13: 0 | F13: 1 | G13: 1
A14: 6 | B14: 3 | C14: 17 | D14: 5 | E14: 1 | F14: 3 | I14: Yes
A15: 7 | B15: 4 | C15: 3 | D15: 6 | E15: 1 | F15: 2
A16: 8 | B16: 5 | C16: 7 | D16: 8 | E16: 0 | F16: 3 | H16: 1
A17: 9 | B17: 4 | C17: 11 | D17: 5 | E17: 2 | F17: 2 | I17: Yes
A18: 10 | B18: 4 | C18: 12 | D18: 5 | E18: 2 | F18: 2 | G18: 1 | I18: Yes
A19: 11 | B19: 4 | C19: 4 | D19: 6 | E19: 1 | F19: 2
A20: 12 | B20: 5 | C20: 14 | D20: 4 | E20: 4 | F20: 1 | I20: Yes
A21: 13 | B21: 3 | C21: 2 | D21: 5 | E21: 2 | F21: 2 | H21: 1 | I21: Yes
A22: 14 | B22: 4 | C22: 8 | D22: 5 | E22: 2 | F22: 2 | G22: 1 | I22: Yes
A23: 15 | B23: 3 | C23: 18 | D23: 4 | E23: 2 | F23: 1 | H23: 1
A24: 16 | B24: 4 | C24: 16 | D24: 5 | E24: 2 | F24: 1
A25: 17 | B25: 4 | C25: 6 | D25: 10 | E25: 0 | F25: 3 | H25: 2
A26: 18 | B26: 4 | C26: 10 | D26: 5 | E26: 2 | F26: 1 | G26: 1
A27: Totals | B27: =IF(B2="","",SUM(B9:B26)) -> 71 | D27: =IF(B2="","",SUM(D9:D26)) -> 112 | E27: =IF(B2="","",SUM(E9:E26)) -> 25 | F27: =IF(B2="","",SUM(F9:F26)) -> 36 | G27: =IF(B2="","",SUM(G9:G26)) -> 4 | H27: =IF(B2="","",SUM(H9:H26)) -> 6 | I27: =IF(COUNTIF(I9:I26,"=Yes")=0,"",COUNTIF(I9:I26,"=Yes")) -> 8