A1: Paul Carter
A2: Club | B2: Rowlands Castle
A3: Par/SS | B3: 72/70 | D3: Num. Of Fairways | I3: =IF(B2="","",18-(COUNTIF(B9:B26,3))) -> 15
A4: Date | B4: 38846 | D4: Playing Handicap | I4: 13
A5: Event Place | B5: 12 | C5: M | D5: Prize Money | G5: 2500
A6: Game Stats | B6: DB+ | C6: DB | D6: BI | E6: P | F6: B | G6: E | H6: A | I6: H1
B7: 0 | C7: 10 | D7: 6 | E7: 2 | F7: 0 | G7: 0 | H7: 0 | I7: 0
A8: Hole No | B8: Par | C8: Stroke Index | D8: Gross Score | E8: Points | F8: Putts | G8: Fairways | H8: Ferrets | I8: Green Regulation
A9: 1 | B9: 4 | C9: 9 | D9: 6 | E9: 1 | F9: 2 | G9: 1
A10: 2 | B10: 3 | C10: 17 | D10: 5 | E10: 0 | F10: 3
A11: 3 | B11: 4 | C11: 5 | D11: 5 | E11: 2 | F11: 2 | G11: 1 | I11: Yes
A12: 4 | B12: 4 | C12: 15 | D12: 6 | E12: 0 | F12: 2 | G12: 1
A13: 5 | B13: 4 | C13: 7 | D13: 6 | E13: 1 | F13: 2
A14: 6 | B14: 4 | C14: 1 | D14: 5 | E14: 2 | F14: 2 | I14: Yes
A15: 7 | B15: 5 | C15: 11 | D15: 7 | E15: 1 | F15: 2
A16: 8 | B16: 4 | C16: 3 | D16: 5 | E16: 2 | F16: 3 | G16: 1 | I16: Yes
A17: 9 | B17: 4 | C17: 13 | D17: 6 | E17: 1 | F17: 2 | G17: 1
A18: 10 | B18: 4 | C18: 4 | D18: 6 | E18: 1 | F18: 2 | G18: 1
A19: 11 | B19: 3 | C19: 18 | D19: 4 | E19: 1 | F19: 2
A20: 12 | B20: 5 | C20: 14 | D20: 5 | E20: 2 | F20: 1
A21: 13 | B21: 4 | C21: 8 | D21: 5 | E21: 2 | F21: 2 | I21: Yes
A22: 14 | B22: 3 | C22: 16 | D22: 4 | E22: 1 | F22: 2
A23: 15 | B23: 4 | C23: 2 | D23: 6 | E23: 1 | F23: 2
A24: 16 | B24: 4 | C24: 12 | D24: 6 | E24: 1 | F24: 2 | G24: 1
A25: 17 | B25: 5 | C25: 10 | D25: 7 | E25: 1 | F25: 2
A26: 18 | B26: 4 | C26: 6 | D26: 4 | E26: 3 | F26: 2 | G26: 1 | I26: Yes
A27: Totals | B27: =IF(B2="","",SUM(B9:B26)) -> 72 | D27: =IF(B2="","",SUM(D9:D26)) -> 98 | E27: =IF(B2="","",SUM(E9:E26)) -> 23 | F27: =IF(B2="","",SUM(F9:F26)) -> 37 | G27: =IF(B2="","",SUM(G9:G26)) -> 8 | H27: =IF(B2="","",SUM(H9:H26)) -> 0 | I27: =IF(COUNTIF(I9:I26,"=Yes")=0,"",COUNTIF(I9:I26,"=Yes")) -> 5