A1: Robert Thompson
A2: Club | B2: Brocket Hall
A3: Par/SS | B3: 73/71 | D3: Num. Of Fairways | I3: =IF(B2="","",18-(COUNTIF(B9:B26,3))) -> 14
A4: Date | B4: 38855 | D4: Playing Handicap | I4: 7.8
A5: Event Place | B5: 2 | D5: Prize Money | G5: 2500
A6: Game Stats | B6: DB+ | C6: DB | D6: Bi | E6: P | F6: B | G6: E | H6: A | I6: H1
B7: 2 | C7: 1 | D7: 8 | E7: 7 | F7: 0 | G7: 0 | H7: 0 | I7: 0
A8: Hole No | B8: Par | C8: Stroke Index | D8: Gross Score | E8: Points | F8: Putts | G8: Fairways | H8: Ferrets | I8: Green Regulation
A9: 1 | B9: 4 | C9: 10 | D9: 4 | E9: 2 | F9: 1 | G9: 1
A10: 2 | B10: 4 | C10: 6 | D10: 6 | E10: 1 | F10: 2 | G10: 1
A11: 3 | B11: 4 | C11: 16 | D11: 5 | E11: 1 | F11: 2 | G11: 1
A12: 4 | B12: 4 | C12: 2 | D12: 5 | E12: 2 | F12: 2 | I12: Yes
A13: 5 | B13: 3 | C13: 18 | D13: 4 | E13: 1 | F13: 3 | I13: Yes
A14: 6 | B14: 5 | C14: 4 | D14: 6 | E14: 2 | F14: 1 | G14: 1
A15: 7 | B15: 4 | C15: 14 | D15: 5 | E15: 1 | F15: 2
A16: 8 | B16: 3 | C16: 8 | D16: 3 | E16: 3 | F16: 1 | I16: Yes
A17: 9 | B17: 5 | C17: 12 | D17: 5 | E17: 2 | F17: 1 | G17: 1
A18: 10 | B18: 5 | C18: 9 | D18: 8 | E18: 0 | F18: 2 | H18: 1
A19: 11 | B19: 4 | C19: 1 | D19: 7 | E19: 0 | F19: 2 | G19: 1 | H19: 1
A20: 12 | B20: 4 | C20: 11 | D20: 4 | E20: 2 | F20: 2 | G20: 1 | I20: Yes
A21: 13 | B21: 5 | C21: 3 | D21: 6 | E21: 2 | F21: 2 | G21: 1 | I21: Yes
A22: 14 | B22: 3 | C22: 15 | D22: 3 | E22: 2 | F22: 1
A23: 15 | B23: 4 | C23: 13 | D23: 4 | E23: 2 | F23: 1
A24: 16 | B24: 4 | C24: 5 | D24: 4 | E24: 3 | F24: 1 | G24: 1 | I24: Yes
A25: 17 | B25: 3 | C25: 17 | D25: 4 | E25: 1 | F25: 3 | I25: Yes
A26: 18 | B26: 5 | C26: 7 | D26: 6 | E26: 2 | F26: 1
A27: Totals | B27: =IF(B2="","",SUM(B9:B26)) -> 73 | D27: =IF(B2="","",SUM(D9:D26)) -> 89 | E27: =IF(B2="","",SUM(E9:E26)) -> 29 | F27: =IF(B2="","",SUM(F9:F26)) -> 30 | G27: =IF(B2="","",SUM(G9:G26)) -> 9 | H27: =IF(B2="","",SUM(H9:H26)) -> 2 | I27: =IF(COUNTIF(I9:I26,"=Yes")=0,"",COUNTIF(I9:I26,"=Yes")) -> 7