A1: David Braithwaite
A2: Club | B2: Wycombe Heights
A3: Par/SS | B3: 69/68 | D3: Num. Of Fairways | I3: =IF(B2="","",18-(COUNTIF(B9:B26,3))) -> 13
A4: Date | B4: 41916 | D4: Playing Handicap | I4: 10.800000000000999
A5: Event Place | B5: 7 | C5: M | D5: Prize Money | G5: 20000
A6: Game Stats | B6: DB+ | C6: DB | D6: BI | E6: P | F6: B | G6: E | H6: A | I6: H1
B7: 2 | C7: 4 | D7: 7 | E7: 4 | F7: 1 | G7: 0 | H7: 0 | I7: 0
A8: Hole No | B8: Par | C8: Stroke Index | D8: Gross Score | E8: Points | F8: Putts | G8: Fairways | H8: Ferrets | I8: Green Regulation
A9: 1 | B9: 4 | C9: 9 | D9: 7 | E9: 0 | F9: 1
A10: 2 | B10: 3 | C10: 13 | D10: 4 | E10: 1 | F10: 2
A11: 3 | B11: 4 | C11: 11 | D11: 5 | E11: 2 | F11: 2 | I11: Yes
A12: 4 | B12: 4 | C12: 3 | D12: 4 | E12: 3 | F12: 1 | G12: 1 | I12: Yes
A13: 5 | B13: 5 | C13: 15 | D13: 5 | E13: 2 | F13: 2 | I13: Yes
A14: 6 | B14: 3 | C14: 7 | D14: 3 | E14: 3 | F14: 2 | I14: Yes
A15: 7 | B15: 4 | C15: 1 | D15: 6 | E15: 1 | F15: 2
A16: 8 | B16: 3 | C16: 17 | D16: 4 | E16: 1 | F16: 2
A17: 9 | B17: 4 | C17: 5 | D17: 5 | E17: 2 | F17: 2 | I17: Yes
A18: 10 | B18: 3 | C18: 16 | D18: 4 | E18: 1 | F18: 2
A19: 11 | B19: 4 | C19: 18 | D19: 5 | E19: 1 | F19: 2 | G19: 1
A20: 12 | B20: 4 | C20: 8 | D20: 6 | E20: 1 | F20: 2 | G20: 1
A21: 13 | B21: 4 | C21: 2 | D21: 6 | E21: 1 | F21: 2 | G21: 1
A22: 14 | B22: 4 | C22: 14 | D22: 4 | E22: 2 | F22: 2 | G22: 1 | I22: Yes
A23: 15 | B23: 4 | C23: 4 | D23: 5 | E23: 2 | F23: 2 | G23: 1 | I23: Yes
A24: 16 | B24: 3 | C24: 12 | D24: 2 | E24: 3 | F24: 1 | I24: Yes
A25: 17 | B25: 5 | C25: 6 | D25: 10 | E25: 0 | F25: 2 | H25: 2
A26: 18 | B26: 4 | C26: 10 | D26: 6 | E26: 1 | F26: 2 | H26: 1
A27: Totals | B27: =IF(B2="","",SUM(B9:B26)) -> 69 | D27: =IF(B2="","",SUM(D9:D26)) -> 91 | E27: =IF(B2="","",SUM(E9:E26)) -> 27 | F27: =IF(B2="","",SUM(F9:F26)) -> 33 | G27: =IF(B2="","",SUM(G9:G26)) -> 6 | H27: =IF(B2="","",SUM(H9:H26)) -> 3 | I27: =IF(COUNTIF(I9:I26,"=Yes")=0,"",COUNTIF(I9:I26,"=Yes")) -> 8