A1: David Braithwaite
A2: Club | B2: Mendip
A3: Par/SS | B3: 71/71 | D3: Num. Of Fairways | I3: =IF(B2="","",18-(COUNTIF(B9:B26,3))) -> 15
A4: Date | B4: 41939 | D4: Playing Handicap | I4: 11.000000000000998
A5: Event Place | B5: 3 | D5: Prize Money | G5: 2500
A6: Game Stats | B6: DB+ | C6: DB | D6: Bi | E6: P | F6: B | G6: E | H6: A | I6: H1
B7: 7 | C7: 3 | D7: 5 | E7: 3 | F7: 0 | G7: 0 | H7: 0 | I7: 0
A8: Hole No | B8: Par | C8: Stroke Index | D8: Gross Score | E8: Points | F8: Putts | G8: Fairways | H8: Ferrets | I8: Green Regulation
A9: 1 | B9: 4 | C9: 13 | D9: 4 | E9: 2 | F9: 1
A10: 2 | B10: 4 | C10: 5 | D10: 6 | E10: 1 | F10: 1
A11: 3 | B11: 4 | C11: 3 | D11: 7 | E11: 0 | F11: 2 | H11: 1
A12: 4 | B12: 5 | C12: 11 | D12: 8 | E12: 0 | F12: 1 | H12: 1
A13: 5 | B13: 4 | C13: 9 | D13: 7 | E13: 0 | F13: 2
A14: 6 | B14: 4 | C14: 7 | D14: 7 | E14: 0 | F14: 2
A15: 7 | B15: 4 | C15: 1 | D15: 5 | E15: 2 | F15: 2 | I15: Yes
A16: 8 | B16: 3 | C16: 15 | D16: 3 | E16: 2 | F16: 2 | I16: Yes
A17: 9 | B17: 5 | C17: 17 | D17: 6 | E17: 1 | F17: 1
A18: 10 | B18: 4 | C18: 2 | D18: 7 | E18: 0 | F18: 3
A19: 11 | B19: 4 | C19: 8 | D19: 6 | E19: 1 | F19: 1
A20: 12 | B20: 3 | C20: 12 | D20: 5 | E20: 0 | F20: 2
A21: 13 | B21: 4 | C21: 14 | D21: 5 | E21: 1 | F21: 1
A22: 14 | B22: 4 | C22: 10 | D22: 7 | E22: 0 | F22: 2
A23: 15 | B23: 4 | C23: 4 | D23: 4 | E23: 3 | F23: 2 | I23: Yes
A24: 16 | B24: 4 | C24: 6 | D24: 5 | E24: 2 | F24: 2 | G24: 1 | I24: Yes
A25: 17 | B25: 3 | C25: 16 | D25: 4 | E25: 1 | F25: 2
A26: 18 | B26: 4 | C26: 18 | D26: 10 | E26: 0 | F26: 2 | H26: 1
A27: Totals | B27: =IF(B2="","",SUM(B9:B26)) -> 71 | D27: =IF(B2="","",SUM(D9:D26)) -> 106 | E27: =IF(B2="","",SUM(E9:E26)) -> 16 | F27: =IF(B2="","",SUM(F9:F26)) -> 31 | G27: =IF(B2="","",SUM(G9:G26)) -> 1 | H27: =IF(B2="","",SUM(H9:H26)) -> 3 | I27: =IF(COUNTIF(I9:I26,"=Yes")=0,"",COUNTIF(I9:I26,"=Yes")) -> 4