A1: Jon Dey
A2: Club | B2: Wycombe Heights
A3: Par/SS | B3: 69/68 | D3: Num. Of Fairways | I3: =IF(B2="","",18-(COUNTIF(B9:B26,3))) -> 13
A4: Date | B4: 41916 | D4: Playing Handicap | I4: 23
A5: Event Place | B5: 3 | C5: M | D5: Prize Money | G5: 28750
A6: Game Stats | B6: DB+ | C6: DB | D6: Bi | E6: P | F6: B | G6: E | H6: A | I6: H1
B7: 4 | C7: 4 | D7: 9 | E7: 1 | F7: 0 | G7: 0 | H7: 0 | I7: 0
A8: Hole No | B8: Par | C8: Stroke Index | D8: Gross Score | E8: Points | F8: Putts | G8: Fairways | H8: Ferrets | I8: Green Regulation
A9: 1 | B9: 4 | C9: 9 | D9: 5 | E9: 2 | F9: 2 | G9: 1 | I9: Yes
A10: 2 | B10: 3 | C10: 13 | D10: 4 | E10: 2 | F10: 3 | I10: Yes
A11: 3 | B11: 4 | C11: 11 | D11: 7 | E11: 0 | F11: 3
A12: 4 | B12: 4 | C12: 3 | D12: 4 | E12: 4 | F12: 1 | I12: Yes
A13: 5 | B13: 5 | C13: 15 | D13: 6 | E13: 2 | F13: 1 | G13: 1
A14: 6 | B14: 3 | C14: 7 | D14: 4 | E14: 2 | F14: 1
A15: 7 | B15: 4 | C15: 1 | D15: 7 | E15: 1 | F15: 2
A16: 8 | B16: 3 | C16: 17 | D16: 5 | E16: 1 | F16: 2
A17: 9 | B17: 4 | C17: 5 | D17: 7 | E17: 1 | F17: 3 | I17: Yes
A18: 10 | B18: 3 | C18: 16 | D18: 4 | E18: 2 | F18: 1
A19: 11 | B19: 4 | C19: 18 | D19: 5 | E19: 2 | F19: 2 | I19: Yes
A20: 12 | B20: 4 | C20: 8 | D20: 6 | E20: 1 | F20: 3 | G20: 1 | I20: Yes
A21: 13 | B21: 4 | C21: 2 | D21: 7 | E21: 1 | F21: 1
A22: 14 | B22: 4 | C22: 14 | D22: 5 | E22: 2 | F22: 1
A23: 15 | B23: 4 | C23: 4 | D23: 5 | E23: 3 | F23: 1 | G23: 1 | I23: Yes
A24: 16 | B24: 3 | C24: 12 | D24: 5 | E24: 1 | F24: 2
A25: 17 | B25: 5 | C25: 6 | D25: 7 | E25: 1 | F25: 3 | G25: 1 | I25: Yes
A26: 18 | B26: 4 | C26: 10 | D26: 5 | E26: 2 | F26: 2 | I26: Yes
A27: Totals | B27: =IF(B2="","",SUM(B9:B26)) -> 69 | D27: =IF(B2="","",SUM(D9:D26)) -> 98 | E27: =IF(B2="","",SUM(E9:E26)) -> 30 | F27: =IF(B2="","",SUM(F9:F26)) -> 34 | G27: =IF(B2="","",SUM(G9:G26)) -> 5 | H27: =IF(B2="","",SUM(H9:H26)) -> 0 | I27: =IF(COUNTIF(I9:I26,"=Yes")=0,"",COUNTIF(I9:I26,"=Yes")) -> 9