A1: Michael Trimmings
A2: Club | B2: Perranporth
A3: Par/SS | B3: 72/72 | D3: Num. Of Fairways | I3: =IF(B2="","",18-(COUNTIF(B9:B26,3))) -> 15
A4: Date | B4: 41942 | D4: Playing Handicap | I4: 19.7
A5: Event Place | B5: 2 | D5: Prize Money | G5: 2500
A6: Game Stats | B6: DB+ | C6: DB | D6: Bi | E6: P | F6: B | G6: E | H6: A | I6: H1
B7: 3 | C7: 6 | D7: 6 | E7: 2 | F7: 1 | G7: 0 | H7: 0 | I7: 0
A8: Hole No | B8: Par | C8: Stroke Index | D8: Gross Score | E8: Points | F8: Putts | G8: Fairways | H8: Ferrets | I8: Green Regulation
A9: 1 | B9: 4 | C9: 12 | D9: 8 | E9: 0 | F9: 3 | G9: 1
A10: 2 | B10: 5 | C10: 4 | D10: 7 | E10: 1 | F10: 2
A11: 3 | B11: 4 | C11: 10 | D11: 6 | E11: 1 | F11: 2
A12: 4 | B12: 3 | C12: 14 | D12: 6 | E12: 0 | F12: 2
A13: 5 | B13: 5 | C13: 6 | D13: 10 | E13: 0 | F13: 3 | G13: 1 | H13: 1
A14: 6 | B14: 3 | C14: 18 | D14: 4 | E14: 2 | F14: 2 | I14: Yes
A15: 7 | B15: 4 | C15: 8 | D15: 4 | E15: 3 | F15: 1 | G15: 1 | I15: Yes
A16: 8 | B16: 4 | C16: 16 | D16: 5 | E16: 2 | F16: 2 | I16: Yes
A17: 9 | B17: 4 | C17: 2 | D17: 3 | E17: 5 | F17: 1 | G17: 1 | I17: Yes
A18: 10 | B18: 4 | C18: 11 | D18: 6 | E18: 1 | F18: 2
A19: 11 | B19: 5 | C19: 3 | D19: 6 | E19: 2 | F19: 2 | G19: 1 | I19: Yes
A20: 12 | B20: 4 | C20: 7 | D20: 5 | E20: 2 | F20: 2 | G20: 1 | I20: Yes
A21: 13 | B21: 4 | C21: 17 | D21: 6 | E21: 1 | F21: 2
A22: 14 | B22: 4 | C22: 1 | D22: 4 | E22: 4 | F22: 1 | G22: 1 | I22: Yes
A23: 15 | B23: 4 | C23: 9 | D23: 5 | E23: 2 | F23: 2 | G23: 1 | I23: Yes
A24: 16 | B24: 3 | C24: 13 | D24: 4 | E24: 2 | F24: 2 | I24: Yes
A25: 17 | B25: 4 | C25: 5 | D25: 6 | E25: 1 | F25: 3 | I25: Yes
A26: 18 | B26: 4 | C26: 15 | D26: 6 | E26: 1 | F26: 2
A27: Totals | B27: =IF(B2="","",SUM(B9:B26)) -> 72 | D27: =IF(B2="","",SUM(D9:D26)) -> 101 | E27: =IF(B2="","",SUM(E9:E26)) -> 30 | F27: =IF(B2="","",SUM(F9:F26)) -> 36 | G27: =IF(B2="","",SUM(G9:G26)) -> 8 | H27: =IF(B2="","",SUM(H9:H26)) -> 1 | I27: =IF(COUNTIF(I9:I26,"=Yes")=0,"",COUNTIF(I9:I26,"=Yes")) -> 10