A1: Roy Dickens
A2: Club | B2: Wycombe Heights
A3: Par/SS | B3: 69/68 | D3: Num. Of Fairways | I3: =IF(B2="","",18-(COUNTIF(B9:B26,3))) -> 13
A4: Date | B4: 41916 | D4: Playing Handicap | I4: 30.000000000001002
A5: Event Place | B5: 1 | C5: M | D5: Prize Money | G5: 42500
A6: Game Stats | B6: DB+ | C6: DB | D6: Bi | E6: P | F6: B | G6: E | H6: A | I6: H1
B7: 3 | C7: 7 | D7: 5 | E7: 3 | F7: 0 | G7: 0 | H7: 0 | I7: 0
A8: Hole No | B8: Par | C8: Stroke Index | D8: Gross Score | E8: Points | F8: Putts | G8: Fairways | H8: Ferrets | I8: Green Regulation
A9: 1 | B9: 4 | C9: 9 | D9: 6 | E9: 2 | F9: 1 | H9: 1
A10: 2 | B10: 3 | C10: 13 | D10: 4 | E10: 2 | F10: 2 | I10: Yes
A11: 3 | B11: 4 | C11: 11 | D11: 8 | E11: 0 | F11: 2 | H11: 1
A12: 4 | B12: 4 | C12: 3 | D12: 5 | E12: 3 | F12: 1 | I12: Yes
A13: 5 | B13: 5 | C13: 15 | D13: 7 | E13: 1 | F13: 2 | G13: 1
A14: 6 | B14: 3 | C14: 7 | D14: 3 | E14: 4 | F14: 2 | I14: Yes
A15: 7 | B15: 4 | C15: 1 | D15: 5 | E15: 4 | F15: 1 | I15: Yes
A16: 8 | B16: 3 | C16: 17 | D16: 3 | E16: 3 | F16: 2 | I16: Yes
A17: 9 | B17: 4 | C17: 5 | D17: 4 | E17: 4 | F17: 1 | I17: Yes
A18: 10 | B18: 3 | C18: 16 | D18: 5 | E18: 1 | F18: 1
A19: 11 | B19: 4 | C19: 18 | D19: 6 | E19: 1 | F19: 2 | H19: 1
A20: 12 | B20: 4 | C20: 8 | D20: 5 | E20: 3 | F20: 2 | G20: 1 | I20: Yes
A21: 13 | B21: 4 | C21: 2 | D21: 6 | E21: 2 | F21: 2 | G21: 1 | I21: Yes
A22: 14 | B22: 4 | C22: 14 | D22: 5 | E22: 2 | F22: 1
A23: 15 | B23: 4 | C23: 4 | D23: 7 | E23: 1 | F23: 2
A24: 16 | B24: 3 | C24: 12 | D24: 5 | E24: 2 | F24: 2 | I24: Yes
A25: 17 | B25: 5 | C25: 6 | D25: 7 | E25: 2 | F25: 2 | I25: Yes
A26: 18 | B26: 4 | C26: 10 | D26: 10 | E26: 0 | F26: 3 | H26: 2
A27: Totals | B27: =IF(B2="","",SUM(B9:B26)) -> 69 | D27: =IF(B2="","",SUM(D9:D26)) -> 101 | E27: =IF(B2="","",SUM(E9:E26)) -> 37 | F27: =IF(B2="","",SUM(F9:F26)) -> 31 | G27: =IF(B2="","",SUM(G9:G26)) -> 3 | H27: =IF(B2="","",SUM(H9:H26)) -> 5 | I27: =IF(COUNTIF(I9:I26,"=Yes")=0,"",COUNTIF(I9:I26,"=Yes")) -> 10