A1: Season 6 - April 1st 2004 to 31st March 2005
A2: MGA World Tour Net Greens in Regulation
B3: Statistics updated | C3: =TODAY() -> 38446
A4: Pos | B4: Player | C4: Original Handicap | D4: Current Handicap | E4: Playing Handicap | F4: Played | G4: Total Greens Hit | H4: Green in Regulation | I4: Greens in Regulation Ratio
A5: 1 | B5: Simon Thompson | C5: 16.0 | D5: 12.7 | E5: =D5 -> 12.7 | F5: 25 | G5: 271 | H5: 60.22 % | I5: =IF(G5="","",IF(G5=0,"0 : "&F5*18,"1 : "&ROUND((F5*18)/G5,1))) -> 1 : 1.7
A6: 2 | B6: Dave Andrews | C6: 18.5 | D6: 17.2 | E6: =D6 -> 17.2 | F6: 22 | G6: 215 | H6: 54.29 % | I6: =IF(G6="","",IF(G6=0,"0 : "&F6*18,"1 : "&ROUND((F6*18)/G6,1))) -> 1 : 1.8
A7: 3 | B7: Ian Edwards | C7: 14.6 | D7: 14.9 | E7: =D7 -> 14.9 | F7: 12 | G7: 116 | H7: 53.7 % | I7: =IF(G7="","",IF(G7=0,"0 : "&F7*18,"1 : "&ROUND((F7*18)/G7,1))) -> 1 : 1.9
A8: =A7+1 -> 4 | B8: Roy Dickens | C8: 28.5 | D8: 29.600000000001 | E8: =D8 -> 29.600000000001 | F8: 10 | G8: 96 | H8: 53.33 % | I8: =IF(G8="","",IF(G8=0,"0 : "&F8*18,"1 : "&ROUND((F8*18)/G8,1))) -> 1 : 1.9
A9: =A8+1 -> 5 | B9: Kevin Gallagher | C9: 7.4 | D9: 10.40000000000199 | E9: =D9 -> 10.40000000000199 | F9: 39 | G9: 358 | H9: 51 % | I9: =IF(G9="","",IF(G9=0,"0 : "&F9*18,"1 : "&ROUND((F9*18)/G9,1))) -> 1 : 2
A10: =A9+1 -> 6 | B10: Robert Thompson | C10: 6.9 | D10: 8.2 | E10: =D10 -> 8.2 | F10: 43 | G10: 394 | H10: 50.9 % | I10: =IF(G10="","",IF(G10=0,"0 : "&F10*18,"1 : "&ROUND((F10*18)/G10,1))) -> 1 : 2
A11: =A10+1 -> 7 | B11: Jeff Gibbons | C11: 13.3 | D11: 21.700000000002007 | E11: =D11 -> 21.700000000002007 | F11: 50 | G11: 456 | H11: 50.67 % | I11: =IF(G11="","",IF(G11=0,"0 : "&F11*18,"1 : "&ROUND((F11*18)/G11,1))) -> 1 : 2
A12: =A11+1 -> 8 | B12: Keith Mendelson | C12: 11.4 | D12: 14.4 | E12: =D12 -> 14.4 | F12: 47 | G12: 427 | H12: 50.47 % | I12: =IF(G12="","",IF(G12=0,"0 : "&F12*18,"1 : "&ROUND((F12*18)/G12,1))) -> 1 : 2
A13: =A12+1 -> 9 | B13: Dave Rouse | C13: 22.1 | D13: 22.9 | E13: =D13 -> 22.9 | F13: 11 | G13: 99 | H13: 50 % | I13: =IF(G13="","",IF(G13=0,"0 : "&F13*18,"1 : "&ROUND((F13*18)/G13,1))) -> 1 : 2
A14: =A13+1 -> 10 | B14: Martin Cox | C14: 11.0 | D14: 11.3 | E14: =D14 -> 11.3 | F14: 10 | G14: 86 | H14: 47.78 % | I14: =IF(G14="","",IF(G14=0,"0 : "&F14*18,"1 : "&ROUND((F14*18)/G14,1))) -> 1 : 2.1
A15: =A14+1 -> 11 | B15: Danny Marsh | C15: 7.8 | D15: 10.000000000001995 | E15: =D15 -> 10.000000000001995 | F15: 16 | G15: 132 | H15: 45.83 % | I15: =IF(G15="","",IF(G15=0,"0 : "&F15*18,"1 : "&ROUND((F15*18)/G15,1))) -> 1 : 2.2
A16: =A15+1 -> 12 | B16: Alan Baldwin | C16: 19.4 | D16: 18.9 | E16: =D16 -> 18.9 | F16: 5 | G16: 61 | H16: 67.78 % | I16: =IF(G16="","",IF(G16=0,"0 : "&F16*18,"1 : "&ROUND((F16*18)/G16,1))) -> 1 : 1.5
A17: =A16+1 -> 13 | B17: Clive Ferris | C17: 26.6 | D17: 26.0 | E17: =D17 -> 26 | F17: 2 | G17: 23 | H17: 63.89 % | I17: =IF(G17="","",IF(G17=0,"0 : "&F17*18,"1 : "&ROUND((F17*18)/G17,1))) -> 1 : 1.6
A18: =A17+1 -> 14 | B18: Andy Benson | C18: 7.6 | D18: 6.0 | E18: =D18 -> 6 | F18: 5 | G18: 55 | H18: 61.11 % | I18: =IF(G18="","",IF(G18=0,"0 : "&F18*18,"1 : "&ROUND((F18*18)/G18,1))) -> 1 : 1.6
A19: =A18+1 -> 15 | B19: Chris Manning | C19: 22.5 | D19: 22.6 | E19: =D19 -> 22.6 | F19: 1 | G19: 11 | H19: 61.11 % | I19: =IF(G19="","",IF(G19=0,"0 : "&F19*18,"1 : "&ROUND((F19*18)/G19,1))) -> 1 : 1.6
A20: =A19+1 -> 16 | B20: Jon Dey | C20: 35.5 | D20: 35.800000000001006 | E20: =D20 -> 35.800000000001006 | F20: 3 | G20: 32 | H20: 59.26 % | I20: =IF(G20="","",IF(G20=0,"0 : "&F20*18,"1 : "&ROUND((F20*18)/G20,1))) -> 1 : 1.7
A21: =A20+1 -> 17 | B21: Michael Trimmings | C21: 22.6 | D21: 22.8 | E21: =D21 -> 22.8 | F21: 1 | G21: 10 | H21: 55.56 % | I21: =IF(G21="","",IF(G21=0,"0 : "&F21*18,"1 : "&ROUND((F21*18)/G21,1))) -> 1 : 1.8
A22: =A21+1 -> 18 | B22: Paul Baldwin | C22: 17.0 | D22: 17.7 | E22: =D22 -> 17.7 | F22: 9 | G22: 88 | H22: 54.32 % | I22: =IF(G22="","",IF(G22=0,"0 : "&F22*18,"1 : "&ROUND((F22*18)/G22,1))) -> 1 : 1.8
A23: =A22+1 -> 19 | B23: Jeff Colbrook | C23: 17.2 | D23: 17.200000000001001 | E23: =D23 -> 17.200000000001001 | F23: 4 | G23: 39 | H23: 54.17 % | I23: =IF(G23="","",IF(G23=0,"0 : "&F23*18,"1 : "&ROUND((F23*18)/G23,1))) -> 1 : 1.8
A24: =A23+1 -> 20 | B24: Steve Tilling | C24: 15.9 | D24: 16.300000000000999 | E24: =D24 -> 16.300000000000999 | F24: 4 | G24: 271 | H24: 51.39 % | I24: =IF(G24="","",IF(G24=0,"0 : "&F24*18,"1 : "&ROUND((F24*18)/G24,1))) -> 1 : 0.3
A25: =A24+1 -> 21 | B25: Martin Bould | C25: 17.7 | D25: 18.3 | E25: =D25 -> 18.3 | F25: 5 | G25: 45 | H25: 50 % | I25: =IF(G25="","",IF(G25=0,"0 : "&F25*18,"1 : "&ROUND((F25*18)/G25,1))) -> 1 : 2
A26: =A25+1 -> 22 | B26: Alan Hopkins | C26: 7.2 | D26: 7.7000000000010003 | E26: =D26 -> 7.7000000000010003 | F26: 3 | G26: 27 | H26: 50 % | I26: =IF(G26="","",IF(G26=0,"0 : "&F26*18,"1 : "&ROUND((F26*18)/G26,1))) -> 1 : 2
A27: =A26+1 -> 23 | B27: Paul Carter | C27: 11.8 | D27: 12.4 | E27: =D27 -> 12.4 | F27: 5 | G27: 44 | H27: 48.89 % | I27: =IF(G27="","",IF(G27=0,"0 : "&F27*18,"1 : "&ROUND((F27*18)/G27,1))) -> 1 : 2
A28: =A27+1 -> 24 | B28: John Press | C28: 14.2 | D28: 15.0 | E28: =D28 -> 15 | F28: 3 | G28: 25 | H28: 46.3 % | I28: =IF(G28="","",IF(G28=0,"0 : "&F28*18,"1 : "&ROUND((F28*18)/G28,1))) -> 1 : 2.2
A29: =A28+1 -> 25 | B29: Andrew Baldwin | C29: 13.0 | D29: 15.4 | E29: =D29 -> 15.4 | F29: 7 | G29: 53 | H29: 42.06 % | I29: =IF(G29="","",IF(G29=0,"0 : "&F29*18,"1 : "&ROUND((F29*18)/G29,1))) -> 1 : 2.4
A30: =A29+1 -> 26 | B30: Simon Owens | C30: 16.0 | D30: 16.0 | E30: =D30 -> 16 | F30: 0 | G30: 0 | H30: 0.00 | I30: =IF(G30="","",IF(G30=0,"0 : "&F30*18,"1 : "&ROUND((F30*18)/G30,1))) -> 0 : 0
A31: =A30+1 -> 27 | B31: Keith Johns | C31: 24.3 | D31: 24.3 | E31: =D31 -> 24.3 | F31: 0 | G31: 0 | H31: 0.00 | I31: =IF(G31="","",IF(G31=0,"0 : "&F31*18,"1 : "&ROUND((F31*18)/G31,1))) -> 0 : 0
A32: =A31+1 -> 28 | B32: Neil Leah | C32: 15.0 | D32: 15.0 | E32: =D32 -> 15 | F32: 0 | G32: 0 | H32: 0.00 | I32: =IF(G32="","",IF(G32=0,"0 : "&F32*18,"1 : "&ROUND((F32*18)/G32,1))) -> 0 : 0
A33: =A32+1 -> 29 | B33: Mike Edmond | C33: 36.5 | D33: 36.5 | E33: =D33 -> 36.5 | F33: 0 | G33: 0 | H33: 0.00 | I33: =IF(G33="","",IF(G33=0,"0 : "&F33*18,"1 : "&ROUND((F33*18)/G33,1))) -> 0 : 0
A34: =A33+1 -> 30 | B34: Malcolm Rouse | C34: 42.9 | D34: 42.9 | E34: =D34 -> 42.9 | F34: 0 | G34: 0 | H34: 0.00 | I34: =IF(G34="","",IF(G34=0,"0 : "&F34*18,"1 : "&ROUND((F34*18)/G34,1))) -> 0 : 0
A35: =A34+1 -> 31 | B35: Dave Archer | C35: 22.0 | D35: 22.0 | E35: =D35 -> 22 | F35: 0 | G35: 0 | H35: 0.00 | I35: =IF(G35="","",IF(G35=0,"0 : "&F35*18,"1 : "&ROUND((F35*18)/G35,1))) -> 0 : 0
A36: =A35+1 -> 32 | B36: Andrew Knight | C36: 21.4 | D36: 21.4 | E36: =D36 -> 21.4 | F36: 0 | G36: 0 | H36: 0.00 | I36: =IF(G36="","",IF(G36=0,"0 : "&F36*18,"1 : "&ROUND((F36*18)/G36,1))) -> 0 : 0