A1: Season 6 - April 1st 2004 to 31st March 2005
A2: MGA World Tour Money List
B3: Statistics updated | C3: =TODAY() -> 38446
A4: Pos | B4: Player | C4: Original Handicap | D4: Current Handicap | E4: Playing Handicap | F4: Events Played | G4: Tour Victories | H4: Winnings
A5: 1 | B5: Robert Thompson | C5: 6.9 | D5: 8.2 | E5: =D5 -> 8.2 | F5: 43 | G5: 12 | H5: 273750
A6: =A5+1 -> 2 | B6: Simon Thompson | C6: 16.0 | D6: 12.7 | E6: =D6 -> 12.7 | F6: 25 | G6: 10 | H6: 261250
A7: =A6+1 -> 3 | B7: Keith Mendelson | C7: 11.4 | D7: 14.4 | E7: =D7 -> 14.4 | F7: 47 | G7: 24 | H7: 252500
A8: =A7+1 -> 4 | B8: Jeff Gibbons | C8: 13.3 | D8: 21.700000000002007 | E8: =D8 -> 21.700000000002007 | F8: 50 | G8: 16 | H8: 233750
A9: =A8+1 -> 5 | B9: Kevin Gallagher | C9: 7.4 | D9: 10.40000000000199 | E9: =D9 -> 10.40000000000199 | F9: 39 | G9: 8 | H9: 233750
A10: =A9+1 -> 6 | B10: Dave Andrews | C10: 18.5 | D10: 17.2 | E10: =D10 -> 17.2 | F10: 22 | G10: 11 | H10: 205000
A11: =A10+1 -> 7 | B11: Martin Cox | C11: 11.0 | D11: 11.3 | E11: =D11 -> 11.3 | F11: 10 | G11: 6 | H11: 130000
A12: =A11+1 -> 8 | B12: Dave Rouse | C12: 22.1 | D12: 22.9 | E12: =D12 -> 22.9 | F12: 11 | G12: 3 | H12: 121250
A13: =A12+1 -> 9 | B13: Danny Marsh | C13: 7.8 | D13: 10.000000000001995 | E13: =D13 -> 10.000000000001995 | F13: 16 | G13: 5 | H13: 118750
A14: =A13+1 -> 10 | B14: Ian Edwards | C14: 14.6 | D14: 14.9 | E14: =D14 -> 14.9 | F14: 12 | G14: 6 | H14: 116250
A15: =A14+1 -> 11 | B15: Jeff Colbrook | C15: 17.2 | D15: 17.200000000001001 | E15: =D15 -> 17.200000000001001 | F15: 4 | G15: 1 | H15: 108750
A16: =A15+1 -> 12 | B16: Roy Dickens | C16: 28.5 | D16: 29.600000000001 | E16: =D16 -> 29.600000000001 | F16: 10 | G16: 1 | H16: 95000
A17: =A16+1 -> 13 | B17: Paul Carter | C17: 11.8 | D17: 12.4 | E17: =D17 -> 12.4 | F17: 5 | G17: 1 | H17: 92500
A18: =A17+1 -> 14 | B18: Steve Tilling | C18: 15.9 | D18: 16.300000000000999 | E18: =D18 -> 16.300000000000999 | F18: 4 | G18: 0 | H18: 63750
A19: =A18+1 -> 15 | B19: Paul Baldwin | C19: 17.0 | D19: 17.7 | E19: =D19 -> 17.7 | F19: 9 | G19: 1 | H19: 60000
A20: =A19+1 -> 16 | B20: Jon Dey | C20: 35.5 | D20: 35.800000000001006 | E20: =D20 -> 35.800000000001006 | F20: 3 | G20: 1 | H20: 56250
A21: =A20+1 -> 17 | B21: John Press | C21: 14.2 | D21: 15.0 | E21: =D21 -> 15 | F21: 3 | G21: 0 | H21: 56250
A22: =A21+1 -> 18 | B22: Alan Hopkins | C22: 7.2 | D22: 7.7000000000010003 | E22: =D22 -> 7.7000000000010003 | F22: 3 | G22: 0 | H22: 51250
A23: =A22+1 -> 19 | B23: Alan Baldwin | C23: 19.4 | D23: 18.9 | E23: =D23 -> 18.9 | F23: 5 | G23: 3 | H23: 48750
A24: =A23+1 -> 20 | B24: Andrew Baldwin | C24: 13.0 | D24: 15.4 | E24: =D24 -> 15.4 | F24: 7 | G24: 0 | H24: 43750
A25: =A24+1 -> 21 | B25: Chris Manning | C25: 22.5 | D25: 22.6 | E25: =D25 -> 22.6 | F25: 1 | G25: 0 | H25: 35000
A26: =A25+1 -> 22 | B26: Martin Bould | C26: 17.7 | D26: 18.3 | E26: =D26 -> 18.3 | F26: 5 | G26: 0 | H26: 25000
A27: =A26+1 -> 23 | B27: Andy Benson | C27: 7.6 | D27: 6.0 | E27: =D27 -> 6 | F27: 5 | G27: 2 | H27: 17500
A28: =A27+1 -> 24 | B28: Clive Ferris | C28: 26.6 | D28: 26.0 | E28: =D28 -> 26 | F28: 2 | G28: 2 | H28: 10000
A29: =A28+1 -> 25 | B29: Michael Trimmings | C29: 22.6 | D29: 22.8 | E29: =D29 -> 22.8 | F29: 1 | G29: 0 | H29: 5000
A30: =A29+1 -> 26 | B30: Keith Johns | C30: 24.3 | D30: 24.3 | E30: =D30 -> 24.3 | F30: 0 | G30: 0 | H30: 0
A31: =A30+1 -> 27 | B31: Simon Owens | C31: 16.0 | D31: 16.0 | E31: =D31 -> 16 | F31: 0 | G31: 0 | H31: 0
A32: =A31+1 -> 28 | B32: Neil Leah | C32: 15.0 | D32: 15.0 | E32: =D32 -> 15 | F32: 0 | G32: 0 | H32: 0
A33: =A32+1 -> 29 | B33: Mike Edmond | C33: 36.5 | D33: 36.5 | E33: =D33 -> 36.5 | F33: 0 | G33: 0 | H33: 0
A34: =A33+1 -> 30 | B34: Malcolm Rouse | C34: 42.9 | D34: 42.9 | E34: =D34 -> 42.9 | F34: 0 | G34: 0 | H34: 0
A35: =A34+1 -> 31 | B35: Dave Archer | C35: 22.0 | D35: 22.0 | E35: =D35 -> 22 | F35: 0 | G35: 0 | H35: 0
A36: =A35+1 -> 32 | B36: Andrew Knight | C36: 21.4 | D36: 21.4 | E36: =D36 -> 21.4 | F36: 0 | G36: 0 | H36: 0