B1: MGA World Tour Match Results
B2: November 2004
B4: To see individual scorecard, click on player's name
D6: CR | E6: Denotes MGA Course Record
B8: 6th November 2004 | D8: Wimbledon Common | I8: Start H/Cap | J8: New H/Cap
B9: Position | C9: Name | D9: Prize Money | E9: Points | F9: Putts | G9: Fairways | H9: Ferrets
B10: 1st | C10: S Thompson | D10: 7500 | E10: 39 | F10: 28 | G10: 3 | H10: 1 | I10: 13.9 | J10: 13.2
B11: 2nd | C11: R Thompson | D11: 5000 | E11: 37 | F11: 27 | G11: 5 | H11: 0 | I11: 8.8 | J11: 8.6
B12: 3rd | C12: K Gallagher | D12: 2500 | E12: 34 | F12: 31 | G12: 7 | H12: 1 | I12: 9.4 | J12: 9.4
B14: 7th November 2004 | D14: Broke Hill | I14: Start H/Cap | J14: New H/Cap
B15: Position | C15: Name | D15: Prize Money | E15: Points | F15: Putts | G15: Fairways | H15: Ferrets
B16: 1st | C16: J Gibbons | D16: 10000 | E16: 33 | F16: 37 | G16: 6 | H16: 0 | I16: 21.2 | J16: 21.2
B17: 2nd | C17: R Dickens | D17: 7500 | E17: 27 | F17: 31 | G17: 4 | H17: 3 | I17: 29.2 | J17: 29.4
B18: 3rd= | C18: K Mendelson | D18: 3750 | E18: 24 | F18: 39 | G18: 5 | H18: 1 | I18: 13.6 | J18: 13.8
B19: 3rd= | C19: M Bould | D19: 3750 | E19: 24 | F19: 33 | G19: 7 | H19: 2 | I19: 17.1 | J19: 17.3
B21: 13th November 2004 | D21: Wimbledon Common | I21: Start H/Cap | J21: New H/Cap
B22: Position | C22: Name | D22: Prize Money | E22: Points | F22: Putts | G22: Fairways | H22: Ferrets
B23: 1st | C23: D Andrews | D23: 7500 | E23: 38 | F23: 31 | G23: 5 | H23: 0 | I23: 18.3 | J23: 17.9
B24: 2nd | C24: R Thompson | D24: 5000 | E24: 34 | F24: 29 | G24: 12 | H24: 0 | I24: 8.6 | J24: 8.6
B25: 3rd | C25: K Gallagher | D25: 2500 | E25: 26 | F25: 36 | G25: 10 | H25: 1 | I25: 9.4 | J25: 9.6
B27: 26th November 2004 | D27: Victoria, Vilamoura | F27: (Round 1 of Coxy Recky Cup) | I27: Start H/Cap | J27: New H/Cap
B28: Position | C28: Name | D28: Prize Money | E28: Points | F28: Putts | G28: Fairways | H28: Ferrets
A29: CR | B29: 1st | C29: D Marsh | D29: 12500 | E29: 32 | F29: 39 | G29: 8 | H29: 0 | I29: 9.3 | J29: 9.4
B30: 2nd | C30: R Thompson | D30: 10000 | E30: 31 | F30: 35 | G30: 9 | H30: 0 | I30: 8.6 | J30: 8.7
B31: 3rd | C31: K Gallagher | D31: 7500 | E31: 28 | F31: 33 | G31: 13 | H31: 1 | I31: 9.6 | J31: 9.7
B32: 4th | C32: D Rouse | D32: 5000 | E32: 27 | F32: 39 | G32: 8 | H32: 4 | I32: 23.6 | J32: 23.8
B33: 5th | C33: P Baldwin | D33: 2500 | E33: 17 | F33: 44 | G33: 5 | H33: 6 | I33: 16.4 | J33: 17.4
B35: 27th November 2004 | D35: Vale Do Lobo, Ocean | F35: (Round 2 of Coxy Recky Cup) | I35: Start H/Cap | J35: New H/Cap
B36: Position | C36: Name | D36: Prize Money | E36: Points | F36: Putts | G36: Fairways | H36: Ferrets
A37: CR | B37: 1st | C37: D Rouse | D37: 12500 | E37: 30 | F37: 35 | G37: 3 | H37: 3 | I37: 23.8 | J37: 23.9
B38: 2nd | C38: D Marsh | D38: 10000 | E38: 28 | F38: 32 | G38: 9 | H38: 2 | I38: 9.4 | J38: 9.5
B39: 3rd= | C39: R Thompson | D39: 6250 | E39: 27 | F39: 31 | G39: 6 | H39: 1 | I39: 8.7 | J39: 8.9
B40: 3rd= | C40: K Gallagher | D40: 6250 | E40: 27 | F40: 31 | G40: 7 | H40: 2 | I40: 9.7 | J40: 9.9
B41: 5th | C41: P Baldwin | D41: 2500 | E41: 22 | F41: 34 | G41: 5 | H41: 0 | I41: 17.4 | J41: 17.6
B43: 27th November 2004 | D43: Quinto Do Lago, South | F43: (Round 3 of Coxy Recky Cup) | I43: Start H/Cap | J43: New H/Cap
B44: Position | C44: Name | D44: Prize Money | E44: Points | F44: Putts | G44: Fairways | H44: Ferrets
A45: CR | B45: 1st | C45: P Baldwin | D45: 12500 | E45: 37 | F45: 33 | G45: 5 | H45: 1 | I45: 17.6 | J45: 17.4
B46: 2nd | C46: D Rouse | D46: 10000 | E46: 32 | F46: 34 | G46: 5 | H46: 2 | I46: 23.9 | J46: 24.0
B47: 3rd | C47: R Thompson | D47: 7500 | E47: 31 | F47: 35 | G47: 3 | H47: 1 | I47: 8.9 | J47: 9.0
B48: 4th | C48: K Gallagher | D48: 5000 | E48: 29 | F48: 36 | G48: 5 | H48: 0 | I48: 9.9 | J48: 10.0
B49: 5th | C49: D Marsh | D49: 2500 | E49: 26 | F49: 36 | G49: 3 | H49: 1 | I49: 9.5 | J49: 9.7
B51: 28th November 2004 | D51: Millennium, Vilamoura | F51: (Round 4 of Coxy Recky Cup) | I51: Start H/Cap | J51: New H/Cap
B52: Position | C52: Name | D52: Prize Money | E52: Points | F52: Putts | G52: Fairways | H52: Ferrets
A53: CR | B53: 1st | C53: D Rouse | D53: 12500 | E53: 41 | F53: 33 | G53: 2 | H53: 1 | I53: 24.0 | J53: 22.5
B54: 2nd | C54: D Marsh | D54: 10000 | E54: 33 | F54: 31 | G54: 9 | H54: 0 | I54: 9.7 | J54: 9.7
B55: 3rd | C55: P Baldwin | D55: 7500 | E55: 29 | F55: 40 | G55: 8 | H55: 1 | I55: 17.4 | J55: 17.5
B56: 4th | C56: R Thompson | D56: 5000 | E56: 28 | F56: 33 | G56: 6 | H56: 1 | I56: 9.0 | J56: 9.1
B57: 5th | C57: K Gallagher | D57: 2500 | E57: 24 | F57: 36 | G57: 7 | H57: 0 | I57: 10.0 | J57: 10.2
B59: 28th November 2004 | D59: Laguna, Vilamoura | F59: (Round 5 of Coxy Recky Cup) | I59: Start H/Cap | J59: New H/Cap
B60: Position | C60: Name | D60: Prize Money | E60: Points | F60: Putts | G60: Fairways | H60: Ferrets
B61: 1st | C61: D Rouse | D61: 12500 | E61: 31 | F61: 34 | G61: 3 | H61: 1 | I61: 22.5 | J61: 22.6
B62: 2nd | C62: P Baldwin | D62: 10000 | E62: 27 | F62: 35 | G62: 1 | H62: 3 | I62: 17.5 | J62: 17.7
B63: 3rd | C63: R Thompson | D63: 7500 | E63: 26 | F63: 30 | G63: 6 | H63: 2 | I63: 9.1 | J63: 9.3
B64: 4th | C64: K Gallagher | D64: 5000 | E64: 23 | F64: 33 | G64: 12 | H64: 3 | I64: 10.2 | J64: 10.4
B65: 5th | C65: D Marsh | D65: 2500 | E65: 21 | F65: 33 | G65: 5 | H65: 7 | I65: 9.7 | J65: 10.2
B67: Summary of The Coxy Recky Cup, Portugal 2004 | I67: Start H/Cap | J67: New H/Cap
B68: Position | C68: Name | D68: Prize Money | E68: Points | F68: Putts | G68: Fairways | H68: Ferrets
B69: 1st | C69: D Rouse | D69: =D61+D53+D46+D37+D32 -> 52500 | E69: =E61+E53+E46+E37+E32 -> 161 | F69: =F61+F53+F46+F37+F32 -> 175 | G69: =G61+G53+G46+G37+G32 -> 21 | H69: =H61+H53+H46+H37+H32 -> 11 | I69: 23.6 | J69: 22.6 | K69: - 1.0
B70: 2nd | C70: R Thompson | D70: =D63+D56+D47+D39+D30 -> 36250 | E70: =E63+E56+E47+E39+E30 -> 143 | F70: =F63+F56+F47+F39+F30 -> 164 | G70: =G63+G56+G47+G39+G30 -> 30 | H70: =H63+H56+H47+H39+H30 -> 5 | I70: 8.6 | J70: 9.3 | K70: + 0.7
B71: 3rd | C71: D Marsh | D71: =D65+D54+D49+D38+D29 -> 37500 | E71: =E65+E54+E49+E38+E29 -> 140 | F71: =F65+F54+F49+F38+F29 -> 171 | G71: =G65+G54+G49+G38+G29 -> 34 | H71: =H65+H54+H49+H38+H29 -> 10 | I71: 9.3 | J71: 10.2 | K71: + 0.9
B72: 4th | C72: P Baldwin | D72: =D62+D55+D45+D41+D33 -> 35000 | E72: =E62+E55+E45+E41+E33 -> 132 | F72: =F62+F55+F45+F41+F33 -> 186 | G72: =G62+G55+G45+G41+G33 -> 24 | H72: =H62+H55+H45+H41+H33 -> 11 | I72: 16.4 | J72: 17.7 | K72: + 1.3
B73: 5th | C73: K Gallagher | D73: =D64+D57+D48+D40+D31 -> 26250 | E73: =E64+E57+E48+E40+E31 -> 131 | F73: =F64+F57+F48+F40+F31 -> 169 | G73: =G64+G57+G48+G40+G31 -> 44 | H73: =H64+H57+H48+H40+H31 -> 6 | I73: 9.6 | J73: 10.4 | K73: + 0.8