A1: Season 6 - April 1st 2004 to 31st March 2005
A2: MGA World Tour Putting Statistics
B3: Statistics updated | C3: =TODAY() -> 38446
A4: Pos | B4: Player | C4: Original Handicap | D4: Current Handicap | E4: Playing Handicap | F4: Played | G4: Total Putts | H4: Ave per Round | I4: Ave Per Hole | J4: Best Round | K4: Worst Round
A5: 1 | B5: Martin Cox | C5: 11.0 | D5: 11.3 | E5: =D5 -> 11.3 | F5: 10 | G5: 299 | H5: 29.90 | I5: =IF(G5=0,"",G5/(F5*18)) -> 1.6611111111111112 | J5: 25 | K5: 34
A6: =A5+1 -> 2 | B6: Robert Thompson | C6: 6.9 | D6: 8.2 | E6: =D6 -> 8.2 | F6: 43 | G6: 1321 | H6: 30.720930232558139 | I6: =IF(G6=0,"",G6/(F6*18)) -> 1.70671834625323 | J6: 25 | K6: 39
A7: =A6+1 -> 3 | B7: Dave Andrews | C7: 18.5 | D7: 17.2 | E7: =D7 -> 17.2 | F7: 22 | G7: 684 | H7: 31.09090909090909 | I7: =IF(G7=0,"",G7/(F7*18)) -> 1.7272727272727273 | J7: 26 | K7: 36
A8: =A7+1 -> 4 | B8: Kevin Gallagher | C8: 7.4 | D8: 10.40000000000199 | E8: =D8 -> 10.40000000000199 | F8: 39 | G8: 1275 | H8: 32.692307692307693 | I8: =IF(G8=0,"",G8/(F8*18)) -> 1.8162393162393162 | J8: 28 | K8: 37
A9: =A8+1 -> 5 | B9: Keith Mendelson | C9: 11.4 | D9: 14.4 | E9: =D9 -> 14.4 | F9: 47 | G9: 1540 | H9: 32.765957446808514 | I9: =IF(G9=0,"",G9/(F9*18)) -> 1.8203309692671394 | J9: 25 | K9: 40
A10: =A9+1 -> 6 | B10: Jeff Gibbons | C10: 13.3 | D10: 21.700000000002007 | E10: =D10 -> 21.700000000002007 | F10: 50 | G10: 1651 | H10: 33.02 | I10: =IF(G10=0,"",G10/(F10*18)) -> 1.8344444444444445 | J10: 26 | K10: 41
A11: =A10+1 -> 7 | B11: Simon Thompson | C11: 16.0 | D11: 12.7 | E11: =D11 -> 12.7 | F11: 25 | G11: 840 | H11: 33.60 | I11: =IF(G11=0,"",G11/(F11*18)) -> 1.8666666666666667 | J11: 28 | K11: 42
A12: =A11+1 -> 8 | B12: Danny Marsh | C12: 7.8 | D12: 10.000000000001995 | E12: =D12 -> 10.000000000001995 | F12: 16 | G12: 541 | H12: 33.8125 | I12: =IF(G12=0,"",G12/(F12*18)) -> 1.8784722222222223 | J12: 30 | K12: 42
A13: =A12+1 -> 9 | B13: Ian Edwards | C13: 14.6 | D13: 14.9 | E13: =D13 -> 14.9 | F13: 12 | G13: 406 | H13: 33.833333333333336 | I13: =IF(G13=0,"",G13/(F13*18)) -> 1.8796296296296295 | J13: 29 | K13: 42
A14: =A13+1 -> 10 | B14: Roy Dickens | C14: 28.5 | D14: 29.600000000001 | E14: =D14 -> 29.600000000001 | F14: 10 | G14: 364 | H14: 36.40 | I14: =IF(G14=0,"",G14/(F14*18)) -> 2.0222222222222221 | J14: 31 | K14: 40
A15: =A14+1 -> 11 | B15: Dave Rouse | C15: 22.1 | D15: 22.9 | E15: =D15 -> 22.9 | F15: 11 | G15: 401 | H15: 36.454545454545453 | I15: =IF(G15=0,"",G15/(F15*18)) -> 2.0252525252525251 | J15: 31 | K15: 42
A16: =A15+1 -> 12 | B16: Andy Benson | C16: 7.6 | D16: 6.0 | E16: =D16 -> 6 | F16: 5 | G16: 167 | H16: 33.40 | I16: =IF(G16=0,"",G16/(F16*18)) -> 1.8555555555555556 | J16: 29 | K16: 37
A17: =A16+1 -> 13 | B17: Alan Baldwin | C17: 19.4 | D17: 18.9 | E17: =D17 -> 18.9 | F17: 5 | G17: 167 | H17: 33.40 | I17: =IF(G17=0,"",G17/(F17*18)) -> 1.8555555555555556 | J17: 32 | K17: 35
A18: =A17+1 -> 14 | B18: Jeff Colbrook | C18: 17.2 | D18: 17.200000000001001 | E18: =D18 -> 17.200000000001001 | F18: 4 | G18: 135 | H18: 33.75 | I18: =IF(G18=0,"",G18/(F18*18)) -> 1.875 | J18: 31 | K18: 35
A19: =A18+1 -> 15 | B19: Andrew Baldwin | C19: 13.0 | D19: 15.4 | E19: =D19 -> 15.4 | F19: 7 | G19: 237 | H19: 33.857142857142854 | I19: =IF(G19=0,"",G19/(F19*18)) -> 1.8809523809523809 | J19: 31 | K19: 36
A20: =A19+1 -> 16 | B20: Steve Tilling | C20: 15.9 | D20: 16.300000000000999 | E20: =D20 -> 16.300000000000999 | F20: 4 | G20: 137 | H20: 34.25 | I20: =IF(G20=0,"",G20/(F20*18)) -> 1.9027777777777777 | J20: 33 | K20: 36
A21: =A20+1 -> 17 | B21: Paul Carter | C21: 11.8 | D21: 12.4 | E21: =D21 -> 12.4 | F21: 5 | G21: 172 | H21: 34.40 | I21: =IF(G21=0,"",G21/(F21*18)) -> 1.9111111111111112 | J21: 33 | K21: 36
A22: =A21+1 -> 18 | B22: Clive Ferris | C22: 26.6 | D22: 26.0 | E22: =D22 -> 26 | F22: 2 | G22: 69 | H22: 34.50 | I22: =IF(G22=0,"",G22/(F22*18)) -> 1.9166666666666667 | J22: 33 | K22: 36
A23: =A22+1 -> 19 | B23: Martin Bould | C23: 17.7 | D23: 18.3 | E23: =D23 -> 18.3 | F23: 5 | G23: 176 | H23: 35.20 | I23: =IF(G23=0,"",G23/(F23*18)) -> 1.9555555555555555 | J23: 31 | K23: 39
A24: =A23+1 -> 20 | B24: Alan Hopkins | C24: 7.2 | D24: 7.7000000000010003 | E24: =D24 -> 7.7000000000010003 | F24: 3 | G24: 106 | H24: 35.333333333333336 | I24: =IF(G24=0,"",G24/(F24*18)) -> 1.962962962962963 | J24: 33 | K24: 37
A25: =A24+1 -> 21 | B25: Chris Manning | C25: 22.5 | D25: 22.6 | E25: =D25 -> 22.6 | F25: 1 | G25: 36 | H25: 36.00 | I25: =IF(G25=0,"",G25/(F25*18)) -> 2.00 | J25: 36 | K25: 36
A26: =A25+1 -> 22 | B26: John Press | C26: 14.2 | D26: 15.0 | E26: =D26 -> 15 | F26: 3 | G26: 109 | H26: 36.333333333333336 | I26: =IF(G26=0,"",G26/(F26*18)) -> 2.0185185185185186 | J26: 35 | K26: 38
A27: =A26+1 -> 23 | B27: Paul Baldwin | C27: 17.0 | D27: 17.7 | E27: =D27 -> 17.7 | F27: 9 | G27: 333 | H27: 37.00 | I27: =IF(G27=0,"",G27/(F27*18)) -> 2.0555555555555554 | J27: 33 | K27: 44
A28: =A27+1 -> 24 | B28: Jon Dey | C28: 35.5 | D28: 35.800000000001006 | E28: =D28 -> 35.800000000001006 | F28: 3 | G28: 112 | H28: 37.333333333333336 | I28: =IF(G28=0,"",G28/(F28*18)) -> 2.074074074074074 | J28: 32 | K28: 42
A29: =A28+1 -> 25 | B29: Michael Trimmings | C29: 22.6 | D29: 22.8 | E29: =D29 -> 22.8 | F29: 1 | G29: 39 | H29: 39.00 | I29: =IF(G29=0,"",G29/(F29*18)) -> 2.1666666666666665 | J29: 39 | K29: 39
A30: =A29+1 -> 26 | B30: Keith Johns | C30: 16.0 | D30: 16.0 | E30: =D30 -> 16 | F30: 0 | G30: 0 | H30: 0.00 | I30: =IF(G30=0,"",G30/(F30*18)) ->  | J30: 0 | K30: 0
A31: =A30+1 -> 27 | B31: Simon Owens | C31: 16.0 | D31: 16.0 | E31: =D31 -> 16 | F31: 0 | G31: 0 | H31: 0.00 | I31: =IF(G31=0,"",G31/(F31*18)) ->  | J31: 0 | K31: 0
A32: =A31+1 -> 28 | B32: Neil Leah | C32: 15.0 | D32: 15.0 | E32: =D32 -> 15 | F32: 0 | G32: 0 | H32: 0.00 | I32: =IF(G32=0,"",G32/(F32*18)) ->  | J32: 0 | K32: 0
A33: =A32+1 -> 29 | B33: Mike Edmond | C33: 36.5 | D33: 36.5 | E33: =D33 -> 36.5 | F33: 0 | G33: 0 | H33: 0.00 | I33: =IF(G33=0,"",G33/(F33*18)) ->  | J33: 0 | K33: 0
A34: =A33+1 -> 30 | B34: Malcolm Rouse | C34: 42.9 | D34: 42.9 | E34: =D34 -> 42.9 | F34: 0 | G34: 0 | H34: 0.00 | I34: =IF(G34=0,"",G34/(F34*18)) ->  | J34: 0 | K34: 0
A35: =A34+1 -> 31 | B35: Dave Archer | C35: 22.0 | D35: 22.0 | E35: =D35 -> 22 | F35: 0 | G35: 0 | H35: 0.00 | I35: =IF(G35=0,"",G35/(F35*18)) ->  | J35: 0 | K35: 0
A36: =A35+1 -> 32 | B36: Andrew Knight | C36: 36.5 | D36: 36.5 | E36: =D36 -> 36.5 | F36: 0 | G36: 0 | H36: 0.00 | I36: =IF(G36=0,"",G36/(F36*18)) ->  | J36: 0 | K36: 0