A1: Dave Andrews
A2: Club | B2: Wimbledon Common
A3: Par/SS | B3: 68/66 | D3: Num. Of Fairways | I3: =IF(B2="","",18-(COUNTIF(B9:B26,3))) -> 13
A4: Date | B4: 38920 | D4: Playing Handicap | I4: 17.300000000001003
A5: Event Place | B5: 2 | D5: Prize Money | G5: 2500
A6: Game Stats | B6: DB+ | C6: DB | D6: Bi | E6: P | F6: B | G6: E | H6: A | I6: H1
B7: 2 | C7: 6 | D7: 6 | E7: 2 | F7: 2 | G7: 0 | H7: 0 | I7: 0
A8: Hole No | B8: Par | C8: Stroke Index | D8: Gross Score | E8: Points | F8: Putts | G8: Fairways | H8: Ferrets | I8: Green Regulation
A9: 1 | B9: 3 | C9: 7 | D9: 4 | E9: 2 | F9: 1
A10: 2 | B10: 4 | C10: 1 | D10: 8 | E10: 0 | F10: 2 | H10: 1
A11: 3 | B11: 4 | C11: 14 | D11: 6 | E11: 1 | F11: 2
A12: 4 | B12: 3 | C12: 11 | D12: 5 | E12: 1 | F12: 2
A13: 5 | B13: 4 | C13: 18 | D13: 5 | E13: 1 | F13: 2
A14: 6 | B14: 4 | C14: 5 | D14: 6 | E14: 1 | F14: 2
A15: 7 | B15: 4 | C15: 10 | D15: 3 | E15: 4 | F15: 0 | I15: Yes
A16: 8 | B16: 3 | C16: 8 | D16: 4 | E16: 2 | F16: 1
A17: 9 | B17: 4 | C17: 16 | D17: 3 | E17: 4 | F17: 1 | G17: 1 | I17: Yes
A18: 10 | B18: 4 | C18: 15 | D18: 4 | E18: 3 | F18: 1 | I18: Yes
A19: 11 | B19: 4 | C19: 4 | D19: 6 | E19: 1 | F19: 2 | G19: 1
A20: 12 | B20: 3 | C20: 6 | D20: 3 | E20: 3 | F20: 1 | I20: Yes
A21: 13 | B21: 4 | C21: 13 | D21: 6 | E21: 1 | F21: 2 | G21: 1
A22: 14 | B22: 4 | C22: 2 | D22: 7 | E22: 0 | F22: 2
A23: 15 | B23: 4 | C23: 12 | D23: 5 | E23: 2 | F23: 2 | I23: Yes
A24: 16 | B24: 3 | C24: 17 | D24: 4 | E24: 2 | F24: 1
A25: 17 | B25: 4 | C25: 9 | D25: 5 | E25: 2 | F25: 2 | I25: Yes
A26: 18 | B26: 5 | C26: 3 | D26: 7 | E26: 1 | F26: 1
A27: Totals | B27: =IF(B2="","",SUM(B9:B26)) -> 68 | D27: =IF(B2="","",SUM(D9:D26)) -> 91 | E27: =IF(B2="","",SUM(E9:E26)) -> 31 | F27: =IF(B2="","",SUM(F9:F26)) -> 27 | G27: =IF(B2="","",SUM(G9:G26)) -> 3 | H27: =IF(B2="","",SUM(H9:H26)) -> 1 | I27: =IF(COUNTIF(I9:I26,"=Yes")=0,"",COUNTIF(I9:I26,"=Yes")) -> 6