A1: Robert Thompson
A2: Club | B2: Old Thorns
A3: Par/SS | B3: 72/72 | D3: Num. Of Fairways | I3: =IF(B2="","",18-(COUNTIF(B9:B26,3))) -> 14
A4: Date | B4: 38907 | D4: Playing Handicap | I4: 8.6
A5: Event Place | B5: 1 | D5: Prize Money | G5: 5000
A6: Game Stats | B6: DB+ | C6: DB | D6: BI | E6: P | F6: B | G6: E | H6: A | I6: H1
B7: 1 | C7: 5 | D7: 4 | E7: 7 | F7: 1 | G7: 0 | H7: 0 | I7: 0
A8: Hole No | B8: Par | C8: Stroke Index | D8: Gross Score | E8: Points | F8: Putts | G8: Fairways | H8: Ferrets | I8: Green Regulation
A9: 1 | B9: 4 | C9: 12 | D9: 5 | E9: 1 | F9: 3 | G9: 1 | I9: Yes
A10: 2 | B10: 5 | C10: 8 | D10: 7 | E10: 1 | F10: 2
A11: 3 | B11: 4 | C11: 2 | D11: 5 | E11: 2 | F11: 2 | G11: 1 | I11: Yes
A12: 4 | B12: 3 | C12: 16 | D12: 3 | E12: 2 | F12: 1
A13: 5 | B13: 4 | C13: 14 | D13: 6 | E13: 0 | F13: 0
A14: 6 | B14: 5 | C14: 4 | D14: 10 | E14: 0 | F14: 3 | G14: 1 | H14: 1
A15: 7 | B15: 3 | C15: 18 | D15: 3 | E15: 2 | F15: 2 | I15: Yes
A16: 8 | B16: 4 | C16: 10 | D16: 4 | E16: 2 | F16: 2 | G16: 1 | I16: Yes
A17: 9 | B17: 4 | C17: 6 | D17: 4 | E17: 3 | F17: 1 | G17: 1 | I17: Yes
A18: 10 | B18: 3 | C18: 9 | D18: 5 | E18: 1 | F18: 2 | H18: 1
A19: 11 | B19: 4 | C19: 13 | D19: 3 | E19: 3 | F19: 1 | G19: 1 | I19: Yes
A20: 12 | B20: 4 | C20: 3 | D20: 5 | E20: 2 | F20: 2 | G20: 1 | I20: Yes
A21: 13 | B21: 4 | C21: 15 | D21: 5 | E21: 1 | F21: 1
A22: 14 | B22: 5 | C22: 1 | D22: 5 | E22: 3 | F22: 2 | I22: Yes
A23: 15 | B23: 4 | C23: 11 | D23: 4 | E23: 2 | F23: 1 | G23: 1
A24: 16 | B24: 3 | C24: 17 | D24: 3 | E24: 2 | F24: 1
A25: 17 | B25: 5 | C25: 7 | D25: 7 | E25: 1 | F25: 3 | I25: Yes
A26: 18 | B26: 4 | C26: 5 | D26: 6 | E26: 1 | F26: 2
A27: Totals | B27: =IF(B2="","",SUM(B9:B26)) -> 72 | D27: =IF(B2="","",SUM(D9:D26)) -> 90 | E27: =IF(B2="","",SUM(E9:E26)) -> 29 | F27: =IF(B2="","",SUM(F9:F26)) -> 31 | G27: =IF(B2="","",SUM(G9:G26)) -> 8 | H27: =IF(B2="","",SUM(H9:H26)) -> 2 | I27: =IF(COUNTIF(I9:I26,"=Yes")=0,"",COUNTIF(I9:I26,"=Yes")) -> 9