A1: Jon Press
A2: Club | B2: Donnington Valley
A3: Par/SS | B3: 71/69 | D3: Num. Of Fairways | I3: =IF(B2="","",18-(COUNTIF(B9:B26,3))) -> 15
A4: Date | B4: 42182 | D4: Playing Handicap | I4: 13.7
A5: Event Place | B5: 1 | C5: M | D5: Prize Money | G5: 30000
A6: Game Stats | B6: DB+ | C6: DB | D6: BI | E6: P | F6: B | G6: E | H6: A | I6: H1
B7: 0 | C7: 2 | D7: 8 | E7: 7 | F7: 1 | G7: 0 | H7: 0 | I7: 0
A8: Hole No | B8: Par | C8: Stroke Index | D8: Gross Score | E8: Points | F8: Putts | G8: Fairways | H8: Ferrets | I8: Green Regulation
A9: 1 | B9: 5 | C9: 9 | D9: 5 | E9: 3 | F9: 1 | I9: Yes
A10: 2 | B10: 4 | C10: 3 | D10: 6 | E10: 1 | F10: 2 | G10: 1
A11: 3 | B11: 4 | C11: 11 | D11: 4 | E11: 3 | F11: 1 | I11: Yes
A12: 4 | B12: 4 | C12: 13 | D12: 4 | E12: 3 | F12: 2 | G12: 1 | I12: Yes
A13: 5 | B13: 4 | C13: 7 | D13: 4 | E13: 3 | F13: 2 | G13: 1 | I13: Yes
A14: 6 | B14: 4 | C14: 1 | D14: 5 | E14: 2 | F14: 2 | G14: 1 | I14: Yes
A15: 7 | B15: 4 | C15: 15 | D15: 4 | E15: 2 | F15: 2 | G15: 1 | I15: Yes
A16: 8 | B16: 4 | C16: 5 | D16: 5 | E16: 2 | F16: 1
A17: 9 | B17: 3 | C17: 17 | D17: 4 | E17: 1 | F17: 2
A18: 10 | B18: 4 | C18: 18 | D18: 4 | E18: 2 | F18: 2 | I18: Yes
A19: 11 | B19: 3 | C19: 8 | D19: 4 | E19: 2 | F19: 2 | I19: Yes
A20: 12 | B20: 4 | C20: 6 | D20: 5 | E20: 2 | F20: 3 | G20: 1 | I20: Yes
A21: 13 | B21: 4 | C21: 16 | D21: 6 | E21: 0 | F21: 1
A22: 14 | B22: 4 | C22: 10 | D22: 5 | E22: 2 | F22: 2 | I22: Yes
A23: 15 | B23: 5 | C23: 2 | D23: 6 | E23: 2 | F23: 2 | I23: Yes
A24: 16 | B24: 3 | C24: 12 | D24: 2 | E24: 4 | F24: 1 | I24: Yes
A25: 17 | B25: 4 | C25: 4 | D25: 4 | E25: 3 | F25: 2 | G25: 1 | I25: Yes
A26: 18 | B26: 4 | C26: 14 | D26: 5 | E26: 2 | F26: 2 | G26: 1 | I26: Yes
A27: Totals | B27: =IF(B2="","",SUM(B9:B26)) -> 71 | D27: =IF(B2="","",SUM(D9:D26)) -> 82 | E27: =IF(B2="","",SUM(E9:E26)) -> 39 | F27: =IF(B2="","",SUM(F9:F26)) -> 32 | G27: =IF(B2="","",SUM(G9:G26)) -> 8 | H27: =IF(B2="","",SUM(H9:H26)) -> 0 | I27: =IF(COUNTIF(I9:I26,"=Yes")=0,"",COUNTIF(I9:I26,"=Yes")) -> 14