A1: Matthew Carter
A2: Club | B2: Chelsfield Lakes
A3: Par/SS | B3: 71/68 | D3: Num. Of Fairways | I3: =IF(B2="","",18-(COUNTIF(B9:B26,3))) -> 14
A4: Date | B4: 42168 | D4: Playing Handicap | I4: 15.9
A5: Event Place | B5: 6 | C5: M | D5: Prize Money | G5: 18750
A6: Game Stats | B6: DB+ | C6: DB | D6: BI | E6: P | F6: B | G6: E | H6: A | I6: H1
B7: 2 | C7: 2 | D7: 6 | E7: 7 | F7: 1 | G7: 0 | H7: 0 | I7: 0
A8: Hole No | B8: Par | C8: Stroke Index | D8: Gross Score | E8: Points | F8: Putts | G8: Fairways | H8: Ferrets | I8: Green Regulation
A9: 1 | B9: 4 | C9: 16 | D9: 4 | E9: 3 | F9: 2 | G9: 1 | I9: Yes
A10: 2 | B10: 3 | C10: 6 | D10: 3 | E10: 3 | F10: 2 | I10: Yes
A11: 3 | B11: 4 | C11: 14 | D11: 5 | E11: 2 | F11: 2 | G11: 1 | I11: Yes
A12: 4 | B12: 4 | C12: 2 | D12: 4 | E12: 3 | F12: 1 | G12: 1 | I12: Yes
A13: 5 | B13: 3 | C13: 10 | D13: 2 | E13: 4 | F13: 1 | I13: Yes
A14: 6 | B14: 5 | C14: 12 | D14: 7 | E14: 1 | F14: 2 | H14: 1
A15: 7 | B15: 5 | C15: 8 | D15: 6 | E15: 2 | F15: 2 | I15: Yes
A16: 8 | B16: 4 | C16: 18 | D16: 4 | E16: 2 | F16: 2 | I16: Yes
A17: 9 | B17: 4 | C17: 4 | D17: 4 | E17: 3 | F17: 1 | G17: 1 | I17: Yes
A18: 10 | B18: 4 | C18: 7 | D18: 4 | E18: 3 | F18: 2 | I18: Yes
A19: 11 | B19: 4 | C19: 17 | D19: 5 | E19: 1 | F19: 2
A20: 12 | B20: 4 | C20: 9 | D20: 8 | E20: 0 | F20: 3
A21: 13 | B21: 5 | C21: 1 | D21: 6 | E21: 2 | F21: 2 | G21: 1 | H21: 1 | I21: Yes
A22: 14 | B22: 4 | C22: 13 | D22: 5 | E22: 2 | F22: 2 | I22: Yes
A23: 15 | B23: 3 | C23: 15 | D23: 4 | E23: 2 | F23: 2 | I23: Yes
A24: 16 | B24: 4 | C24: 3 | D24: 6 | E24: 1 | F24: 1 | G24: 1
A25: 17 | B25: 3 | C25: 11 | D25: 3 | E25: 3 | F25: 1 | I25: Yes
A26: 18 | B26: 4 | C26: 5 | D26: 10 | E26: 0 | F26: 3 | H26: 1
A27: Totals | B27: =IF(B2="","",SUM(B9:B26)) -> 71 | D27: =IF(B2="","",SUM(D9:D26)) -> 90 | E27: =IF(B2="","",SUM(E9:E26)) -> 37 | F27: =IF(B2="","",SUM(F9:F26)) -> 33 | G27: =IF(B2="","",SUM(G9:G26)) -> 6 | H27: =IF(B2="","",SUM(H9:H26)) -> 3 | I27: =IF(COUNTIF(I9:I26,"=Yes")=0,"",COUNTIF(I9:I26,"=Yes")) -> 13